,sbr,sbr_id,date,year,month,hour,day,id,domain,title,full_link,author,created,selftext,num_comments,score,over_18,thumbnail,media_provider,media_thumbnail,media_title,media_description,media_url
0,bangtan,t5_2zqih,2016-9-1,2016,9,1,10,50kr39,self.bangtan,i'd do it all,https://www.reddit.com/r/bangtan/comments/50kr39/id_do_it_all/,[deleted],1472693605,[removed],0,1,False,default,,,,,
1,bangtan,t5_2zqih,2016-9-1,2016,9,1,12,50l6ou,facebook.com,[BTS Official Facebook Album] 20th Golden Kookie Day 2016,https://www.reddit.com/r/bangtan/comments/50l6ou/bts_official_facebook_album_20th_golden_kookie/,jsf1101,1472699621,,2,25,False,default,,,,,
2,bangtan,t5_2zqih,2016-9-1,2016,9,1,13,50lg7o,self.bangtan,HELP! Important Business LOL,https://www.reddit.com/r/bangtan/comments/50lg7o/help_important_business_lol/,chieum,1472703558,[removed],0,1,False,default,,,,,
3,bangtan,t5_2zqih,2016-9-1,2016,9,1,14,50lrlz,kr.puma.com,[BTS x PUMA] bog sock exhibition photos live on the website,https://www.reddit.com/r/bangtan/comments/50lrlz/bts_x_puma_bog_sock_exhibition_photos_live_on_the/,chiisquare,1472709254,,20,28,False,default,,,,,
4,bangtan,t5_2zqih,2016-9-1,2016,9,1,17,50m60y,self.bangtan,New Fan,https://www.reddit.com/r/bangtan/comments/50m60y/new_fan/,Scherzo_Schizo,1472717759,"I just wanted to say what a great find BTS has been. I'm really late into the kpop music scene and honestly, BTS is the 2nd kpop group I've gotten into, extensively. I found out about them a couple of weeks ago.

I'm really impressed with this group. And the obvious care they have for their craft and opportunity. 

I just found out about the INU+Prologue+RUN+Forever Young concept MVs. How amazing! I was blown away and impressed. 

Also, I started reading the translations of their lyrics (I don't know if that's taboo as a kpop fan, but there's a language barrier so I initially don't judge it by lyrics, but the overall reaction I get from it) and I am really appreciating their contributions (I've read RapMon, Taehyung, and JK have written/produced tracks, right?) to the entire production of their tracks.

I'm obviously not a kpop expert, but are other groups like this? BTS members seem so collaborative, creative, and supportive of artistic expression. 

",29,26,False,self,,,,,
5,bangtan,t5_2zqih,2016-9-1,2016,9,1,20,50mmto,youtube.com,EXTREMELY accurate Baepsae Cover - even to the personalities!,https://www.reddit.com/r/bangtan/comments/50mmto/extremely_accurate_baepsae_cover_even_to_the/,YANN_LIFE,1472727912,,10,26,False,http://b.thumbs.redditmedia.com/2HNkL-Xa7UA4Yf9kZygF6Eo2SF4xK9OJd-Xf7xEbL7g.jpg,,,,,
6,bangtan,t5_2zqih,2016-9-1,2016,9,1,20,50msvb,soompi.com,"160901 Jungkook Talks about his Birthday, Special Dreams, and More",https://www.reddit.com/r/bangtan/comments/50msvb/160901_jungkook_talks_about_his_birthday_special/,mllelingling,1472731049,,2,32,False,http://a.thumbs.redditmedia.com/gaCOZ2TNyKWAjzlMgNBEqvCXov6Q4VgYeCZAo55Tpk4.jpg,,,,,
7,bangtan,t5_2zqih,2016-9-1,2016,9,1,20,50msyx,soompi.com,160901 Hwarang: The Beginning Wraps up Filming and Reveals Premiere Date,https://www.reddit.com/r/bangtan/comments/50msyx/160901_hwarang_the_beginning_wraps_up_filming_and/,mllelingling,1472731102,,11,41,False,http://b.thumbs.redditmedia.com/ExgzX5UyCVwL0Z-RRw59aewuDaLOJiCvwIp9tVJwdIk.jpg,,,,,
8,bangtan,t5_2zqih,2016-9-1,2016,9,1,21,50mwlo,self.bangtan,"I was browsing online, and found an album called ""More than you know"" under the name BTS. Do any of you know anything more about this?",https://www.reddit.com/r/bangtan/comments/50mwlo/i_was_browsing_online_and_found_an_album_called/,StaRapture10,1472732795,,2,4,False,self,,,,,
9,bangtan,t5_2zqih,2016-9-1,2016,9,1,22,50n3fd,youtube.com,BTS Puma BOG Sock Teaser (Yoongi's narration tho -),https://www.reddit.com/r/bangtan/comments/50n3fd/bts_puma_bog_sock_teaser_yoongis_narration_tho/,[deleted],1472735571,[deleted],1,1,False,default,,,,,
10,bangtan,t5_2zqih,2016-9-1,2016,9,1,22,50n46w,youtube.com,BTS Puma Bog Sock Teaser #blazeyourbrightest,https://www.reddit.com/r/bangtan/comments/50n46w/bts_puma_bog_sock_teaser_blazeyourbrightest/,mllelingling,1472735872,,19,39,False,http://b.thumbs.redditmedia.com/EhlbYOU-WCv97cBjcVOxIUxPO-w5NtTrCpTJiJcY1HQ.jpg,,,,,
11,bangtan,t5_2zqih,2016-9-2,2016,9,2,2,50ob6a,self.bangtan,Let's talk about Namjoon!,https://www.reddit.com/r/bangtan/comments/50ob6a/lets_talk_about_namjoon/,etherealemilyy,1472750010,"Basically, I love hearing what people have to say about our wonderful and amazing leader Namjoon / Rap Monster / Rapmon / RM / Brain Mon / Ryan Fanboy. Every now and then someone will post a more in-depth comment about him, but I tried searching the sub for a nice post/discussion about him and didn't find much. And his birthday is coming up, so why not? 

For me, I only got in to BTS this year, and RM isn't my bias so I still feel like I learn something new about him every week! And recently, I can't stop watching his [Live in Tokyo broadcast.](http://www.vlive.tv/video/13067/BTS-Live-in-Tokyo) 

There are lots of things I love about him, but I'll leave it to you guys. Post your thoughts, feelings, pictures, and videos here! Please :)",31,40,False,self,,,,,
12,bangtan,t5_2zqih,2016-9-2,2016,9,2,2,50oe44,twitter.com,Indonesian ARMYs organized food distribution to the less fortunate for JK's birthday,https://www.reddit.com/r/bangtan/comments/50oe44/indonesian_armys_organized_food_distribution_to/,motionless-min,1472750856,,6,111,False,http://b.thumbs.redditmedia.com/Q7bLTlotx0NeKZcr0I0wPdqfBeNxVi6DEoFFk5aOy_I.jpg,,,,,
13,bangtan,t5_2zqih,2016-9-2,2016,9,2,4,50p0hk,self.bangtan,So ready for the So Far Away MV to drop...,https://www.reddit.com/r/bangtan/comments/50p0hk/so_ready_for_the_so_far_away_mv_to_drop/,irine618,1472757744,Any hints or speculation on when and what the MV will be like?  Did I miss any clues from other MVs or social media?,16,22,False,self,,,,,
14,bangtan,t5_2zqih,2016-9-2,2016,9,2,4,50p0lg,twitter.com,Jungkook's Handwritten Letter to ARMY's on the Fancafe &lt;3,https://www.reddit.com/r/bangtan/comments/50p0lg/jungkooks_handwritten_letter_to_armys_on_the/,[deleted],1472757778,[deleted],0,1,False,default,,,,,
15,bangtan,t5_2zqih,2016-9-2,2016,9,2,9,50qk7i,66.media.tumblr.com,Where is this Jungkook gif from?,https://www.reddit.com/r/bangtan/comments/50qk7i/where_is_this_jungkook_gif_from/,littletonbo,1472776971,,6,23,False,http://b.thumbs.redditmedia.com/LYAjU6-Gw3mCUZgCkO1wRy_CREwuc0N-WVVxB0X8p4A.jpg,,,,,
16,bangtan,t5_2zqih,2016-9-2,2016,9,2,10,50qo6g,self.bangtan,BTS Reddit Groupchat,https://www.reddit.com/r/bangtan/comments/50qo6g/bts_reddit_groupchat/,lorenawr,1472778480,"EDIT: [Deleted the original text of this because... reasons] *Feel free to send me your LINE ID in a message or post it down below, whatever you prefer. I'll add you to the group! c:*",33,24,False,self,,,,,
17,bangtan,t5_2zqih,2016-9-2,2016,9,2,13,50rj4e,youtube.com,Found this fancam of BTS' FIRE- Full Performance @ A-NATION (includes save me and dope in the same channel),https://www.reddit.com/r/bangtan/comments/50rj4e/found_this_fancam_of_bts_fire_full_performance/,hellowred,1472791275,,0,12,False,http://b.thumbs.redditmedia.com/X2HhM-yGxFzvtsmNFMNob0OCdvAQVN-u5nbLXxodZ4U.jpg,,,,,
18,bangtan,t5_2zqih,2016-9-2,2016,9,2,16,50s2zx,self.bangtan,Muster 3 Fanmeeting - Anyone going?,https://www.reddit.com/r/bangtan/comments/50s2zx/muster_3_fanmeeting_anyone_going/,infadel-x,1472801317,"Fanclub pre-ticketing for the event ended so I was wondering anyone from our sub got a ticket? I got a ticket on the 12th, and will be attending! I was planning a vacation for November and since Muster fell on a good period for me I've decided to attend. Got a floor seat, not too close though so idk how good the view is but excited anyway.

FYI, general ticketing opens on September 5th 8PM KST and there should be ~2000 seats left for each show, so if anyone is incidentally in Seoul in November, do consider! Fanmeeting is a good place to meet the boys. ",13,13,False,self,,,,,
19,bangtan,t5_2zqih,2016-9-3,2016,9,3,0,50tty5,twitter.com,160902 - hobi dancing to nsync,https://www.reddit.com/r/bangtan/comments/50tty5/160902_hobi_dancing_to_nsync/,xcamilleon,1472830750,,25,81,False,http://a.thumbs.redditmedia.com/CvptqNfFgvN7BQVqHsJmsFbRs4l29TJW1F_Tas5OG64.jpg,,,,,
20,bangtan,t5_2zqih,2016-9-3,2016,9,3,2,50ubce,youtube.com,Baepsae 8bit / Chiptune Version (by me!),https://www.reddit.com/r/bangtan/comments/50ubce/baepsae_8bit_chiptune_version_by_me/,dentedwing,1472836410,,18,30,False,http://b.thumbs.redditmedia.com/GkgG23hJF_7pho2yExaSfMI8x2cpGfLbHcGnGKrPicA.jpg,,,,,
21,bangtan,t5_2zqih,2016-9-3,2016,9,3,8,50w8r0,self.bangtan,Rap Monster &amp; Bangtan Lego Set,https://www.reddit.com/r/bangtan/comments/50w8r0/rap_monster_bangtan_lego_set/,playlisthoarder,1472860182,"[Original](https://twitter.com/BTS_twt/status/771569384242327552) - [""(Finally) finished...the Bangtan Lego Set.. #RM""](https://twitter.com/BTS_ABS/status/771571486813401088) 

[Original](https://twitter.com/BTS_twt/status/771570109831745536) - [""But when this lego set came, one of Hopie's arms was missing..Sorry, Hope..I can't seem to find it..""](https://twitter.com/BTS_ABS/status/771571769555628033)",12,26,False,self,,,,,
22,bangtan,t5_2zqih,2016-9-3,2016,9,3,9,50whm1,imgur.com,BTS 2nd Japanese Album YOUTH posters,https://www.reddit.com/r/bangtan/comments/50whm1/bts_2nd_japanese_album_youth_posters/,playlisthoarder,1472863773,,6,46,False,http://b.thumbs.redditmedia.com/h2zGLId8U7ExsUz_bApNakgCz2vBWXOBD3H8WIZO_Co.jpg,,,,,
23,bangtan,t5_2zqih,2016-9-3,2016,9,3,11,50wurr,twitter.com,Pentatonix responds to Jimin's tweet!,https://www.reddit.com/r/bangtan/comments/50wurr/pentatonix_responds_to_jimins_tweet/,aexime,1472869370,,12,67,False,http://b.thumbs.redditmedia.com/LQcjIHpekv2VzwqgMCKUGdRyd_8dT8hlfXEFaG1jZEg.jpg,,,,,
24,bangtan,t5_2zqih,2016-9-3,2016,9,3,14,50xg8r,self.bangtan,160902 Top Idols vol. 5- What the Members Think of Eachother,https://www.reddit.com/r/bangtan/comments/50xg8r/160902_top_idols_vol_5_what_the_members_think_of/,[deleted],1472879784,[deleted],12,16,False,default,,,,,
25,bangtan,t5_2zqih,2016-9-3,2016,9,3,14,50xhhb,self.bangtan,BTS Ships,https://www.reddit.com/r/bangtan/comments/50xhhb/bts_ships/,HarrayS_34,1472880393,"Which member do you think is shipped a lot with other members? 

I personally think it's Jimin. Like Yoonmin, Jihope, Jikook, Vmin, etc.. are all very popular among the fandom, especially Jikook lately. The concept of Jimin harem exists for a reason  Idek what I'm saying....

Second would be Taehyung: Taejin, TaeGi, Vhope are shipped by many as well, his big pairs are Vmin and the most popular ship of all time Vkook. 

What do you think?",11,0,False,self,,,,,
26,bangtan,t5_2zqih,2016-9-3,2016,9,3,14,50xkdf,self.bangtan,"Thoughts about Yoonmin, Vhope, TaeGi, Taejin, Vkook, and Vmin",https://www.reddit.com/r/bangtan/comments/50xkdf/thoughts_about_yoonmin_vhope_taegi_taejin_vkook/,HarrayS_34,1472881961,"Does anyone know how Yoonmin started? Suga seems to be nice to everyone, I probably missed something but when I first got into this fandom Jimin is the last person I think of to be shipped with Yoongi lol. It's still a cute pair tho, I'm just confused. 

Many people ship Vhope as well, I don't know why, since Jhope interacts closely with everyone, especially Jimin, don't know how Vhope gotten more popular than Jihope lately. No hate tho, just asking. Is it because it's Taehyung? 

TaeGi and TaeJin don't make any sense to me either. I'm starting to think people ship them just coz there's Taehyung in the pair. Again, no hate. Just confused. Please enlighten me on that. Taejin doesn't have that much close up interaction (as far as I know of) as Namjin or dare I say, Jinmin has. Jin even chose Jimin as someone he would date if he is a girl. But I guess that time when Jimin called Jin his ""mom"" ruins the whole ship  

Whew boy here we go. Based on what I see, Vmin has far more interactions than Vkook does, but I assume most people prefer Vkook coz they are the two most popular BTS members? (And they look so good together no lie) And most casted away Vmin as simply friendship instead of a true pair. What are your thoughts on this? I personally think it's annoying when Vkook fans claimed something like ""Vmin: Friendship goal. Vkook: Relationship goal!"" in literally every Vmin videos I watched. 

Ofcoz I know ppl can ship watever they like, but I find it hard to believe they can ship it without hints. Obviously all BTS members are close to one another, but there are some ships that stand out more for a reason, and I don't see how Taejin stands out more than others. Again, no hate. TaeGi is adorable tho. But I still don't see it. Vkook is quite apparent, but Vmin is on that level of obviousness too. 

Btw, taking shipping seriously is one of my hobby, don't judge. I don't actually believe any of these ships are true, but I like to analyze them for fun whenever I'm bored so~ Please answer sincerely lol~",21,0,False,self,,,,,
27,bangtan,t5_2zqih,2016-9-3,2016,9,3,15,50xmfx,youtu.be,BTS - Save Me MV: Bright Ver. (Dark Filter Removed),https://www.reddit.com/r/bangtan/comments/50xmfx/bts_save_me_mv_bright_ver_dark_filter_removed/,alokpop,1472883142,,8,38,False,http://b.thumbs.redditmedia.com/xiDz4biqEAv_lZmDxxFc7rwLeit9Sk-cYG9r3vbA7Us.jpg,,,,,
28,bangtan,t5_2zqih,2016-9-3,2016,9,3,16,50xsob,twitter.com,Pentatonix followed BTS on Twitter!,https://www.reddit.com/r/bangtan/comments/50xsob/pentatonix_followed_bts_on_twitter/,fluffymushroom757,1472886809,,2,57,False,http://b.thumbs.redditmedia.com/bOeEXFaQjCsNQvn9-O6WmEB3yKZdDKfPLapcrQwjkwM.jpg,,,,,
29,bangtan,t5_2zqih,2016-9-3,2016,9,3,21,50yowy,youtube.com,160903 [BANGTAN BOMB] Moni &amp; Mini wearing twin-look,https://www.reddit.com/r/bangtan/comments/50yowy/160903_bangtan_bomb_moni_mini_wearing_twinlook/,mllelingling,1472907491,,4,41,False,http://b.thumbs.redditmedia.com/jQdmaeEaVd1Bcwlt7vVUq7xgEdxTAmBVwvUIOmzQZwc.jpg,,,,,
30,bangtan,t5_2zqih,2016-9-3,2016,9,3,23,50z0qh,self.bangtan,Rap monster shades,https://www.reddit.com/r/bangtan/comments/50z0qh/rap_monster_shades/,KingoftheTrollzzz,1472912775,Anyone know what shades these are and where to get them? https://imgur.com/a/44pzA,5,8,False,self,,,,,
31,bangtan,t5_2zqih,2016-9-4,2016,9,4,2,50zo4w,youtube.com,160903 [BANGTAN BOMB] Moni &amp; Mini wearing twin look,https://www.reddit.com/r/bangtan/comments/50zo4w/160903_bangtan_bomb_moni_mini_wearing_twin_look/,mllelingling,1472922007,,1,28,False,http://b.thumbs.redditmedia.com/JfWai8KaM7c5asGBuXmps8X4zxuZFEDkA0IuqTHSQvw.jpg,,,,,
32,bangtan,t5_2zqih,2016-9-4,2016,9,4,2,50zozz,lemmonnie.tumblr.com,[Audio] Wishing on a star,https://www.reddit.com/r/bangtan/comments/50zozz/audio_wishing_on_a_star/,keymanthan,1472922304,,11,39,False,http://b.thumbs.redditmedia.com/tszapsWhG1PrqMrOKtO-6-i3zoNu5oa_gZvz8q7QSHk.jpg,,,,,
33,bangtan,t5_2zqih,2016-9-4,2016,9,4,4,510d7j,youtu.be,Kids on Mnet's Hit The Stage dancing to BTS Danger,https://www.reddit.com/r/bangtan/comments/510d7j/kids_on_mnets_hit_the_stage_dancing_to_bts_danger/,PotassiumAlum,1472930989,,4,26,False,http://a.thumbs.redditmedia.com/9AS-BV1rIYLToVDIesLPHfGsHfgc3nhosJpTHp24lk8.jpg,,,,,
34,bangtan,t5_2zqih,2016-9-4,2016,9,4,5,510kye,peachisoda.blogspot.ca,160902 Pride Union's bus ad - #MinYoongiGenius,https://www.reddit.com/r/bangtan/comments/510kye/160902_pride_unions_bus_ad_minyoongigenius/,mllelingling,1472933786,,7,43,False,http://b.thumbs.redditmedia.com/ifJjrmU3xrZdy0dGPWWCG4GYy1_z8gGY9gmQaeDGb8A.jpg,,,,,
35,bangtan,t5_2zqih,2016-9-4,2016,9,4,11,5120tc,youtube.com,Bangtan Members Imitating Joonie,https://www.reddit.com/r/bangtan/comments/5120tc/bangtan_members_imitating_joonie/,mllelingling,1472954916,,3,34,False,http://b.thumbs.redditmedia.com/lVzrITNPlqZdMIGwnLF5IBqR_8BeLqn4y4gPzMlGpso.jpg,,,,,
36,bangtan,t5_2zqih,2016-9-4,2016,9,4,11,512108,youtu.be,Boss Ass Beach (BTS) - Drunk Edit,https://www.reddit.com/r/bangtan/comments/512108/boss_ass_beach_bts_drunk_edit/,LovesBigWords,1472955015,,0,2,False,http://b.thumbs.redditmedia.com/eqH5imtW57FnDVMIHiCe9YSH4G0aXc_JNG5ipYN-2qo.jpg,,,,,
37,bangtan,t5_2zqih,2016-9-4,2016,9,4,15,512xh1,twitter.com,BTS on Easy Magazine September Issue Cover Page,https://www.reddit.com/r/bangtan/comments/512xh1/bts_on_easy_magazine_september_issue_cover_page/,[deleted],1472971681,[deleted],0,1,False,default,,,,,
38,bangtan,t5_2zqih,2016-9-4,2016,9,4,15,512xll,twitter.com,BTS on Easy Magazine September Issue Cover Page,https://www.reddit.com/r/bangtan/comments/512xll/bts_on_easy_magazine_september_issue_cover_page/,fluffymushroom757,1472971750,,1,23,False,http://b.thumbs.redditmedia.com/nTB8XSF_DmNq98m-gP_Q1kCfwG8ADGGMZwp0kjH6p3Y.jpg,,,,,
39,bangtan,t5_2zqih,2016-9-4,2016,9,4,16,51329w,bts0726.tumblr.com,"When you search ""lying down"" on Naver......guess who's the top result?",https://www.reddit.com/r/bangtan/comments/51329w/when_you_search_lying_down_on_naverguess_whos_the/,hoseokked,1472974766,,7,52,False,http://b.thumbs.redditmedia.com/thTwWoBokTF0jb4ppdsygcbsvg279NwluyxjV2kG9Bc.jpg,,,,,
40,bangtan,t5_2zqih,2016-9-4,2016,9,4,16,5133ra,youtube.com,160904 [BANGTAN BOMB] Dart King Jung Kook,https://www.reddit.com/r/bangtan/comments/5133ra/160904_bangtan_bomb_dart_king_jung_kook/,Yundy,1472975803,,4,29,False,http://b.thumbs.redditmedia.com/UCnLYzPsLLFNU6lLY5Uw2MJTiDpN2f-UmWip19nVWnI.jpg,,,,,
41,bangtan,t5_2zqih,2016-9-4,2016,9,4,17,5134fc,i.reddituploads.com,saw this on my blog ..regarding kpop top idol interview ..so heartbreaking i read the trans of thier interview.. what they said about V is hurtful specially suga my bias,https://www.reddit.com/r/bangtan/comments/5134fc/saw_this_on_my_blog_regarding_kpop_top_idol/,ARMY_chatae,1472976273,,0,1,False,default,,,,,
42,bangtan,t5_2zqih,2016-9-4,2016,9,4,20,513ldj,youtube.com,160904 [BANGTAN BOMB] Dart King Jung Kook [ENG],https://www.reddit.com/r/bangtan/comments/513ldj/160904_bangtan_bomb_dart_king_jung_kook_eng/,Pikabouh,1472987952,,4,23,False,http://b.thumbs.redditmedia.com/9KpQcDToBr-JShWRU4lc2BSgoA6J-46fX5B0lajyLmU.jpg,,,,,
43,bangtan,t5_2zqih,2016-9-4,2016,9,4,21,513rwi,self.bangtan,What's one song you wish BTS to create their own version of or a member to cover? Why?,https://www.reddit.com/r/bangtan/comments/513rwi/whats_one_song_you_wish_bts_to_create_their_own/,PotassiumAlum,1472992076,"Considering how much BTS members cover western songs and their history with recreating songs like turning J Cole's Born Sinner to their Born Singer or J-Hope, Jimin, V, and Jungkook's Korean Version of Mariah Carey's Beautiful, what's one song you wish to see a BTS or a BTS member's version of? ",20,10,False,self,,,,,
44,bangtan,t5_2zqih,2016-9-5,2016,9,5,0,514bka,youtube.com,BTS Wings Short Film #1 Begin,https://www.reddit.com/r/bangtan/comments/514bka/bts_wings_short_film_1_begin/,klmnumbers,1473001247,,125,181,False,http://b.thumbs.redditmedia.com/93aWRrBGYWbkXdMZtsoXjyNjvU5wMQtp-xohZ-y0GmQ.jpg,,,,,
45,bangtan,t5_2zqih,2016-9-5,2016,9,5,0,514crn,youtube.com,Short Film #1 (WINGS),https://www.reddit.com/r/bangtan/comments/514crn/short_film_1_wings/,[deleted],1473001739,[deleted],0,1,False,default,,,,,
46,bangtan,t5_2zqih,2016-9-5,2016,9,5,0,514cv8,youtube.com,BTS WINGS Short Film #1 BEGIN,https://www.reddit.com/r/bangtan/comments/514cv8/bts_wings_short_film_1_begin/,[deleted],1473001783,[deleted],0,1,False,default,,,,,
47,bangtan,t5_2zqih,2016-9-5,2016,9,5,3,51571j,self.bangtan,"Hey, I have a question.",https://www.reddit.com/r/bangtan/comments/51571j/hey_i_have_a_question/,Merlysauce,1473013014,"First off, I'm really bad with names, faces, and putting names and faces together. So is there an easy way to remember who is who? [This] (https://s-media-cache-ak0.pinimg.com/originals/84/15/74/841574457b9a22ffc1a816fd188b46a8.gif) is legit me right now. I know the names, but not the faces. 

Edit: added some stuff",26,11,False,self,,,,,
48,bangtan,t5_2zqih,2016-9-5,2016,9,5,3,515bm2,youtube.com,BTS() WINGS SHORT FILM #1 BEGIN,https://www.reddit.com/r/bangtan/comments/515bm2/bts_wings_short_film_1_begin/,screambledeggs,1473014649,,1,29,False,http://b.thumbs.redditmedia.com/16yJbgwJqHhf61AJx5ZUdRcgvx1eTngbYLqcC4WqaTY.jpg,,,,,
49,bangtan,t5_2zqih,2016-9-5,2016,9,5,4,515onv,youtube.com,RM vs Awkward Moments (1/3),https://www.reddit.com/r/bangtan/comments/515onv/rm_vs_awkward_moments_13/,mllelingling,1473019194,,1,18,False,http://a.thumbs.redditmedia.com/ciwP80hWy1ZJ99T1n9KVd8fUxVWsj9kzwf8GpjILs60.jpg,,,,,
50,bangtan,t5_2zqih,2016-9-5,2016,9,5,6,5165r6,youtube.com,"What you (probably) didn't notice in BTS ""Wings"" Short Film #1",https://www.reddit.com/r/bangtan/comments/5165r6/what_you_probably_didnt_notice_in_bts_wings_short/,screambledeggs,1473025338,,5,11,False,http://b.thumbs.redditmedia.com/v_AbFzGS53lmLSBXuvE-Laa_N-ywdRXNs6WdoVSuzyw.jpg,,,,,
51,bangtan,t5_2zqih,2016-9-5,2016,9,5,8,516j2t,twitter.com,BTS are coming back with a second album. Wings is part of a series of short films.,https://www.reddit.com/r/bangtan/comments/516j2t/bts_are_coming_back_with_a_second_album_wings_is/,keymanthan,1473030560,,35,136,False,http://b.thumbs.redditmedia.com/EXaUWCWj2tDOCIe0PzCJdxN887tNjRDlRnX3hnCCN5Q.jpg,,,,,
52,bangtan,t5_2zqih,2016-9-5,2016,9,5,8,516k97,instagram.com,I attempted to draw the painting from Wings,https://www.reddit.com/r/bangtan/comments/516k97/i_attempted_to_draw_the_painting_from_wings/,SasakiWai,1473031055,,17,69,False,http://b.thumbs.redditmedia.com/eoeqK7QGSqMBkXOx62OJQEVM1Dp6SmJUGAAkSUGYsGg.jpg,,,,,
53,bangtan,t5_2zqih,2016-9-5,2016,9,5,9,516u0v,self.bangtan,What do you expect/hope from the new full album?,https://www.reddit.com/r/bangtan/comments/516u0v/what_do_you_expecthope_from_the_new_full_album/,StaRapture,1473035148,,19,19,False,self,,,,,
54,bangtan,t5_2zqih,2016-9-5,2016,9,5,9,516w93,peachisoda.blogspot.com,"160905 Homme ""Rap like lyrics... it's still hard for us to memorize, it's 'Dilemma'."" (Mentions RM as a producer)",https://www.reddit.com/r/bangtan/comments/516w93/160905_homme_rap_like_lyrics_its_still_hard_for/,dorkprincess,1473036064,,1,22,False,http://a.thumbs.redditmedia.com/ghhJb7iziPS_eZCavAvNyPU9z1iHpVueuxpmhfAbBk8.jpg,,,,,
55,bangtan,t5_2zqih,2016-9-5,2016,9,5,10,5173ji,self.bangtan,BTS = Burn The Stuffs,https://www.reddit.com/r/bangtan/comments/5173ji/bts_burn_the_stuffs/,LovesBigWords,1473039144,"Just for fun, let's list all the things BTS burns in their MV's, teasers, etc.:

* Their Manager's car

* Piano

*Yoongi's bed

* Couple of cars in Yoongi's MV's

* Yoongi's Trailer ""House"" in Give It To Me

* Creepy portrait in the Begining #1 Wings short film

* Door at the end of Fire

* Namjoon drags the mic through fire in Fire

* Jimin nearly burns his damn hand in Fire

In Conclusion: Will Bangtan ever stop burning their shiteu?

...no.",1,27,False,self,,,,,
56,bangtan,t5_2zqih,2016-9-5,2016,9,5,11,517azb,self.bangtan,Guessing(Hoping) their upcoming promo plans,https://www.reddit.com/r/bangtan/comments/517azb/guessinghoping_their_upcoming_promo_plans/,btskoreanfan,1473042354,"Edit: it is so funny. Today ""Demian"" copies in school / public libraries are gone, some say, and people are ordering the book: BTS exerting cultural influence on the youth. :)

September: Japan promotion + weekly teaser release (four maybe)
Mid-October: Comeback and active promotion in Korea 
November: Continuing the promotion and Muster (Muster being a wrapping up of the title song and showcase of a follow-up song??) 
December: Great performances on year-ending shows (like they did last year. I heard that Perfect Man performance with Run success lead to huge influx of Korean fans. I hope this year will be the same case.)

This is kinda ideal schedule if they want  (the Grand prize) on awards shows. Suga himself wrote in a letter to members (on the Bon Voyage last ep) ""I hope to receive the Grand prize, because we all worked so hard.) So, if Big Hit cares about the grand prize, they will better look at the schedule. 

With Suga mixtape and this unprecedented teaser strategy, I guess BTS can step up to a bigger position. What do you think? Do you think BigHit making us headache will eventually get BTS more fans? Even though it is not, I really respect their effort to be genuine to themselves and have this artistry tone in all their work. I starting to appreciate BTS and BH as an artists team. ",4,22,False,self,,,,,
57,bangtan,t5_2zqih,2016-9-5,2016,9,5,14,5181nc,i.reddituploads.com,"""Rude boy"" - accurate",https://www.reddit.com/r/bangtan/comments/5181nc/rude_boy_accurate/,CL1225,1473054630,,0,16,False,http://b.thumbs.redditmedia.com/Cfvf-pSYcnGVqZeMd7xAbDyMPgF_mJgafLNf49_-7vU.jpg,,,,,
58,bangtan,t5_2zqih,2016-9-5,2016,9,5,16,518co8,ent.mbc.co.kr,Idol Cooking King Teaser!,https://www.reddit.com/r/bangtan/comments/518co8/idol_cooking_king_teaser/,EndyLovah,1473060596,,8,50,False,http://b.thumbs.redditmedia.com/PiMzPbK9LA2Ojpm4L5ni44rMnE-Oi8Qcd-o4zDokehs.jpg,,,,,
59,bangtan,t5_2zqih,2016-9-5,2016,9,5,17,518glj,soompi.com,"SOOMPI about the BTS ""WINGS"" Teaser ... Also features a lot of theories which are really good ... including comment section!",https://www.reddit.com/r/bangtan/comments/518glj/soompi_about_the_bts_wings_teaser_also_features_a/,IamNR,1473063139,,0,7,False,http://b.thumbs.redditmedia.com/3lVgVajXOy4zbAnXFgXz4wSw1sg9mxyMGBgwOELr5dM.jpg,,,,,
60,bangtan,t5_2zqih,2016-9-5,2016,9,5,18,518o62,youtube.com,PUMA CF BOG SOCK X BTS : ISSUE 1 (Suga),https://www.reddit.com/r/bangtan/comments/518o62/puma_cf_bog_sock_x_bts_issue_1_suga/,vermeer_9,1473068194,,25,74,False,http://b.thumbs.redditmedia.com/22eobuWovC-YgID04cUMJbYXX0SSbTfxBQ2a6NQI-rc.jpg,,,,,
61,bangtan,t5_2zqih,2016-9-5,2016,9,5,19,518qqc,puma.bogsock.com,[SUGAKOOKIE] Check out PUMA BOG SOCK Website,https://www.reddit.com/r/bangtan/comments/518qqc/sugakookie_check_out_puma_bog_sock_website/,hbmdeen92,1473069681,,1,10,False,default,,,,,
