,sbr,sbr_id,date,year,month,hour,day,id,domain,title,full_link,author,created,selftext,num_comments,score,over_18,thumbnail,media_provider,media_thumbnail,media_title,media_description,media_url
127,bangtan,t5_2zqih,2016-9-9,2016,9,9,6,51tt4e,pann-choa.blogspot.com,Netizens Impressed by Tae's Acting Skills in 'Stigma' ^^ #hypedforhwarang,https://www.reddit.com/r/bangtan/comments/51tt4e/netizens_impressed_by_taes_acting_skills_in/,mllelingling,1473370971,,3,46,False,http://b.thumbs.redditmedia.com/trtTaXjxL65nrbqj0Ni_J81M77LtnilT7ABVUIgJa_Y.jpg,,,,,
128,bangtan,t5_2zqih,2016-9-9,2016,9,9,7,51txbt,peachisoda.blogspot.ca,Nicknames BTS members would like to be called by their future girlfriend! ~ PEACHISODA,https://www.reddit.com/r/bangtan/comments/51txbt/nicknames_bts_members_would_like_to_be_called_by/,mllelingling,1473372361,,17,30,False,http://a.thumbs.redditmedia.com/12htvE49KbGIZyetSuzfIXluW6_iXITRFeEAELrmxT4.jpg,,,,,
129,bangtan,t5_2zqih,2016-9-9,2016,9,9,11,51v1xq,youtube.com,BTS INTRODUCTION:Youth Fan MV,https://www.reddit.com/r/bangtan/comments/51v1xq/bts_introductionyouth_fan_mv/,[deleted],1473387153,[deleted],0,1,False,default,,,,,
130,bangtan,t5_2zqih,2016-9-9,2016,9,9,12,51va6l,youtu.be,"What you (probably) didn't notice in BTS ""Wings"" Short Film #4 FIRST LOVE",https://www.reddit.com/r/bangtan/comments/51va6l/what_you_probably_didnt_notice_in_bts_wings_short/,screambledeggs,1473390324,,1,15,False,http://b.thumbs.redditmedia.com/6wfL1PpxtsRDfO6tFwfEkJs_kptphersqTbRIQUMQnQ.jpg,,,,,
131,bangtan,t5_2zqih,2016-9-9,2016,9,9,13,51vom9,youtu.be,"The Nigerian cover of Fire for the World Kpop festival, is amazing and hilarious with a bit of acrobatics thrown in",https://www.reddit.com/r/bangtan/comments/51vom9/the_nigerian_cover_of_fire_for_the_world_kpop/,shellycjd,1473396353,,11,51,False,http://b.thumbs.redditmedia.com/xr_0eKg5FYt_85iYrai_lFWbzxGLBc_oitZcyAaTOwU.jpg,,,,,
132,bangtan,t5_2zqih,2016-9-9,2016,9,9,14,51vuy9,youtu.be,[- ][KOR-ENG SUBS] BTS () WINGS Short Film #4 FIRST LOVE,https://www.reddit.com/r/bangtan/comments/51vuy9/_koreng_subs_bts__wings_short_film_4/,screambledeggs,1473399383,,1,9,False,http://b.thumbs.redditmedia.com/ed49kXJMY4zMCvbnwoZNOl7xdXLwqeV6aFRqmEmfIyU.jpg,,,,,
133,bangtan,t5_2zqih,2016-9-9,2016,9,9,15,51w294,youtube.com,"160907 ""Save Me"" Fancam @ Pyeongchang Winter Olympic Concert (Fire + Dope in comments)",https://www.reddit.com/r/bangtan/comments/51w294/160907_save_me_fancam_pyeongchang_winter_olympic/,[deleted],1473403253,[deleted],0,1,False,default,,,,,
134,bangtan,t5_2zqih,2016-9-9,2016,9,9,15,51w2ds,youtu.be,"160907 ""Save Me"" Fancam @ Pyeongchang Winter Olympic Concert (Fire + Dope in comments)",https://www.reddit.com/r/bangtan/comments/51w2ds/160907_save_me_fancam_pyeongchang_winter_olympic/,etherealemilyy,1473403323,,11,27,False,http://b.thumbs.redditmedia.com/8iUzUki8kGAaonf6FUDeB9aVSFgRb01YSllMxmOs0sM.jpg,,,,,
135,bangtan,t5_2zqih,2016-9-9,2016,9,9,18,51wl7p,soompi.com,Idol Star Athletics Championships Announces Change To Planned Idol Star Athletics Championships Announces Change To Planned Broadcast Format,https://www.reddit.com/r/bangtan/comments/51wl7p/idol_star_athletics_championships_announces/,desailes,1473414299,,1,4,False,http://b.thumbs.redditmedia.com/sVwa2i6UmUnmIXo9GwghlDp9obwD4LYP46jtuOq2UbE.jpg,,,,,
136,bangtan,t5_2zqih,2016-9-9,2016,9,9,22,51xebw,youtube.com,Our Angel Hobi's Cute Moments (omg my hearteu ),https://www.reddit.com/r/bangtan/comments/51xebw/our_angel_hobis_cute_moments_omg_my_hearteu/,mllelingling,1473427959,,4,23,False,http://b.thumbs.redditmedia.com/lfeu4_v5m1sBVaF2gMmjotGAjYg16InQ94iSFwBGSQg.jpg,,,,,
137,bangtan,t5_2zqih,2016-9-10,2016,9,10,0,51xtro,youtube.com,BTS Short Film #5 - Reflection,https://www.reddit.com/r/bangtan/comments/51xtro/bts_short_film_5_reflection/,klmnumbers,1473433211,,110,133,False,http://b.thumbs.redditmedia.com/krOC2cid7EM3yUCtCptiN94Bx9EbLeMGnY5yiXedngk.jpg,,,,,
138,bangtan,t5_2zqih,2016-9-10,2016,9,10,0,51xubx,youtube.com, (BTS) WINGS Short Film #5 REFLECTION,https://www.reddit.com/r/bangtan/comments/51xubx/_bts_wings_short_film_5_reflection/,[deleted],1473433391,[deleted],1,1,False,default,,,,,
139,bangtan,t5_2zqih,2016-9-10,2016,9,10,1,51y955,twitter.com,Son Sungdeuk (BTS' Choreographer) posts video of him listening to Fire after work,https://www.reddit.com/r/bangtan/comments/51y955/son_sungdeuk_bts_choreographer_posts_video_of_him/,dorkprincess,1473438241,,2,41,False,http://b.thumbs.redditmedia.com/fu7-rJLvEyrqctvnFOq4JzTn8ze1_b6SKftZOQNp4Ew.jpg,,,,,
140,bangtan,t5_2zqih,2016-9-10,2016,9,10,1,51y9tm,youtu.be,BTS () WINGS Short Film #5 REFLECTION,https://www.reddit.com/r/bangtan/comments/51y9tm/bts__wings_short_film_5_reflection/,screambledeggs,1473438462,,0,13,False,http://a.thumbs.redditmedia.com/YigEmtwiLeq8g4gvegSrBd4iafrAaVgupf3exSxxYW0.jpg,,,,,
141,bangtan,t5_2zqih,2016-9-10,2016,9,10,2,51ygc5,self.bangtan,Twitter account recs?,https://www.reddit.com/r/bangtan/comments/51ygc5/twitter_account_recs/,myeonq,1473440611,"(Sorry if I'm spamming the sub but I think there are no rules against posts like this, right?.. i hope so, correct me if I'm wrong and I'll delete it.)

I've never had a twitter account but with all this Wings hype I've decided to create one to keep up with the news. But I don't know what twitters to follow (besides bangtan's official account obviously) and I'd love if any of you could recommend me some? It can be any type of accounts - news twitter, fanclub accounts with fantaken pictures and that kind of stuff, as well as meme/comedy accounts (if those exist?), etc - pretty much anything related to bts is welcome :)

If you tweet about bts, you can leave your username and I'll check you out as well! And if you don't feel like writing a lot, it would still be super helpful if you could simply comment your username so I can check out the ones you follow. Thanks in advance!",19,14,False,self,,,,,
142,bangtan,t5_2zqih,2016-9-10,2016,9,10,3,51z1ku,self.bangtan,"What do you think the pairings for WINGS (fused logos) mean, and what do you think the new logos symbolise?",https://www.reddit.com/r/bangtan/comments/51z1ku/what_do_you_think_the_pairings_for_wings_fused/,StaRapture10,1473447455,,2,7,False,self,,,,,
143,bangtan,t5_2zqih,2016-9-10,2016,9,10,5,51ze23,youtu.be,"What you (probably) didn't notice in BTS ""Wings"" Short Film #5 REFLECTION",https://www.reddit.com/r/bangtan/comments/51ze23/what_you_probably_didnt_notice_in_bts_wings_short/,screambledeggs,1473451581,,1,9,False,http://b.thumbs.redditmedia.com/Q_3Twf3RTeZt1xX7MCwgeZUyhlcLnBx3J9Rv1ZKeLpc.jpg,,,,,
144,bangtan,t5_2zqih,2016-9-10,2016,9,10,8,520gzv,twitter.com,Supreme Boi involved in the production of Iron's Roll,https://www.reddit.com/r/bangtan/comments/520gzv/supreme_boi_involved_in_the_production_of_irons/,keymanthan,1473465272,,33,25,False,http://b.thumbs.redditmedia.com/YzMkEq7W7lABPjKerBImGYBvVpR-QEPnQUAW61kMIZc.jpg,,,,,
145,bangtan,t5_2zqih,2016-9-10,2016,9,10,11,5214vg,youtube.com,"i made a quick remix of ""Wishing on a Star"" :) love their japanese releases so I didn't change much :L",https://www.reddit.com/r/bangtan/comments/5214vg/i_made_a_quick_remix_of_wishing_on_a_star_love/,556pm,1473474956,,0,7,False,http://a.thumbs.redditmedia.com/rBw6N5G9176PuFVSnU6eTmZNiQKjINagwoT41veBYZ8.jpg,,,,,
146,bangtan,t5_2zqih,2016-9-10,2016,9,10,11,521525,self.bangtan,HYYH/Wings Theory,https://www.reddit.com/r/bangtan/comments/521525/hyyhwings_theory/,triseke,1473475029,"So.

My friend and I have been obsessing about Wings since the first video. After multiple nights of sleuthing and scouring videos,  I think we have a theory.

We believe that each album is a new world. A new beginning as it were. Each time there is a beginning, the members get paired up in hopes of  surviving that world. The world from HYYH failed; The members could not protect each other.

Jungkook failed to stop Suga from burning up (""Better to burn out than fade away"")
Suga failed to notice Jungkook's efforts (their fight in ""Run"") and by the time he did, Jungkook had already been hit by a car.

V was possibly the most tragic. He needed Rapmon for strength to get through his awful home situation, and without him, he lost everything. (We see him trying to make the phone call in ""Stigma""). Rapmon provided normalcy and a friendship that V desperately needed.
Rapmon just didnt seem to realise how serious V's situation was, and was perhaps too carefree, and wasn't able to be there when V needed him the most (the phonecall scene in ""Reflection"").

Jimin was in the same situation as J-Hope, in that they were both struggling with mental health issues (we aren't sure, but this is what it appears to be).
This part is specualtion but we believe that Jimin helped J-Hope to forget about his problems for a little while, but not solve them. Jimin helped j-Hope throw his pills away (this was a quick fix to the problem, but didn't actually solve anything).Their situation was bleak (being in a hospital setting in ""Run""). Now Jimin doesn't have J-Hope and is subjected to his situation alone. (which we see in ""Lie"").

Currently the boys are in Purgatory (or equivalent), and each is reliving path that they ****wished**** they had taken, such as Suga returning to the scene of the car crash (Jungkook's death), Jungkook trying to fix the crying painting with no paint. 

We believe that as their new rebirth happens, new pairings will occur., and in the hopes of surviving this new world together. Jungkook's bird and envelope appear with Rapmon. Suga's melting paint appearing on Rapmon's arms lead us to believe that in this new world, Rapmon will be Jungkooks partner, to look out for him.

*FUTURE THEORY*

We believe that the next new pairing will be Suga and Jimin, and we will see J-Hope in his video allowing this to happen. Jimin (being connected to water) will be able to counteract Suga's fire, and both will be able to survive. 

An educated guess would be that V and J-Hope will be the next pairing with Rapmon's blessing in J-Hopes video. (We will update when we see the video).

Finally, we believe that Jin will remain the same. He will continue to observe, as that is what he always does. He remembers each lifetime, he remembers the mistakes, he remembers the deaths. That is why he constantly is recording and cherishing their (what he believes to be) fleeting time together. 

Of course, once all videos are out, and we have watched every single BTS video and analysed all the lyrics, we will post a big ""proof"" post. And also figure out what the hell the band Nirvana has to do with ANY of this! There are too many references to the band for it be a coincidence!

P.S. Edited the Big Bang comment out. I think it was the booze..

Would love to get feedback to this fevered post. If only you could hear the entire ramblings, but I can't type that quick lol

[Edit] Will update with our thoughts on JHopes video, and the connection to Nirvana
",2,7,False,self,,,,,
147,bangtan,t5_2zqih,2016-9-10,2016,9,10,12,52194i,youtube.com, BTS  Park Jimin Sexy / Cute / Funny Moments ,https://www.reddit.com/r/bangtan/comments/52194i/_bts__park_jimin_sexy_cute_funny_moments/,Nojjjjjjjustno,1473476828,,0,17,False,http://b.thumbs.redditmedia.com/OHJxu6GS33wSPAgDP2B2VIN9yrIhev0QeuoFf2aQ1yA.jpg,,,,,
148,bangtan,t5_2zqih,2016-9-10,2016,9,10,12,521bor,youtube.com,If you want to take a break from some theories...,https://www.reddit.com/r/bangtan/comments/521bor/if_you_want_to_take_a_break_from_some_theories/,watergod13,1473478022,,16,40,False,http://b.thumbs.redditmedia.com/CUGzX0bZW42VHySeyN2_AOqcukTiS-0jtnmycVj9k2Q.jpg,,,,,
149,bangtan,t5_2zqih,2016-9-11,2016,9,11,0,523gig,youtube.com, (BTS) WINGS Short Film #6 MAMA,https://www.reddit.com/r/bangtan/comments/523gig/_bts_wings_short_film_6_mama/,mllelingling,1473519615,,101,146,False,http://b.thumbs.redditmedia.com/6cm0J71kMU_dcAthQeiYwO7jyB5Mbb8iSwYUPnF8f7k.jpg,,,,,
150,bangtan,t5_2zqih,2016-9-11,2016,9,11,0,523kly,youtu.be, (BTS) WINGS Short Film #6 MAMA,https://www.reddit.com/r/bangtan/comments/523kly/_bts_wings_short_film_6_mama/,screambledeggs,1473521134,,0,11,False,http://a.thumbs.redditmedia.com/hv4ERLjBsP3HXKtu0lAwSXgDrWpE2cMskHUgffmBae8.jpg,,,,,
151,bangtan,t5_2zqih,2016-9-11,2016,9,11,1,523tjb,youtube.com,[MV THEORY] BTS() - WINGS #1 BEGIN :     BY DREAMTELLER (Probably the best theory breakdown out there),https://www.reddit.com/r/bangtan/comments/523tjb/mv_theory_bts_wings_1_begin_____by/,PotassiumAlum,1473524466,,6,17,False,http://b.thumbs.redditmedia.com/WGgZDdwH-RdvBsM3uFx6G_kHzrpU73A2nOFUmUAQrZA.jpg,,,,,
152,bangtan,t5_2zqih,2016-9-11,2016,9,11,2,52421e,twitter.com,"160910 Too Beautiful for Words - "":D #JIMIN""",https://www.reddit.com/r/bangtan/comments/52421e/160910_too_beautiful_for_words_d_jimin/,mllelingling,1473527553,,8,40,False,http://a.thumbs.redditmedia.com/TV4s-6WB4QohAcq-t4rJ-d2nI7dHyyDzBphylncwNv4.jpg,,,,,
153,bangtan,t5_2zqih,2016-9-11,2016,9,11,5,524xd4,self.bangtan,"Where are the BTS related places in SEOUL, KOREA?",https://www.reddit.com/r/bangtan/comments/524xd4/where_are_the_bts_related_places_in_seoul_korea/,humanoided,1473538549,"Hi all! I'll be heading to Seoul in about 2 weeks from now for vacation and will be staying there for 3 weeks. As of now, I will definitely be visiting Bighit Entertainment, THE MIN's and Hallyu Kstar Road. I am aware of @deokutour on twitter as well but I was wondering if there is any other places that is related to BTS that I should visit? ^^ Please recommend me~ Thank you!",8,14,False,self,,,,,
154,bangtan,t5_2zqih,2016-9-11,2016,9,11,5,5253av,self.bangtan,"These theories for Wings have been great and all, but let's talk about the music!",https://www.reddit.com/r/bangtan/comments/5253av/these_theories_for_wings_have_been_great_and_all/,juliancasablancas,1473540613,"I know we're all going crazy trying to piece together these storylines, making connections and brushing up on our literature, but I don't think we've had a discussion about the songs we've heard so far!

Personally, I've been very impressed with every single song.  I *LOVE* how they're exploring these different genres.  From the R&amp;B in Taehyung's song, the electronic/synth in RM's, and the jazz in J-Hope's.  It's really great to hear them developing their musicianship and maturing in their sound.  But it's interesting how we haven't heard anything distinctly hip-hop or rap...

I just hope these songs are actually *from* the album, and that they haven't been altered too much for the teasers.  But overall, I'm super excited for the album!!

What are your thoughts on the music? :)",33,43,False,self,,,,,
155,bangtan,t5_2zqih,2016-9-11,2016,9,11,6,52591j,vine.co,What a BTS concert is actually like,https://www.reddit.com/r/bangtan/comments/52591j/what_a_bts_concert_is_actually_like/,pleaseseokjin,1473542667,,24,71,False,http://b.thumbs.redditmedia.com/vB2kXGU6rOqR_ZUvagv-YRSbdTBS5HTGdq_EHKViUps.jpg,,,,,
156,bangtan,t5_2zqih,2016-9-11,2016,9,11,7,525h96,self.bangtan,BTS GIF REQUEST THREAD,https://www.reddit.com/r/bangtan/comments/525h96/bts_gif_request_thread/,[deleted],1473545705,[deleted],0,3,False,default,,,,,
157,bangtan,t5_2zqih,2016-9-11,2016,9,11,7,525hvk,imgur.com,WINGS Wallpapers,https://www.reddit.com/r/bangtan/comments/525hvk/wings_wallpapers/,SpaceFrostbite,1473545933,,19,71,False,http://b.thumbs.redditmedia.com/Ci4KKaJEVPe7s2ikDFGu0x0hZTPp-1vEkmq_9jskd1Y.jpg,,,,,
158,bangtan,t5_2zqih,2016-9-11,2016,9,11,10,526695,soundcloud.com,BTS - #6 MAMA SHORT FILM (YUNG's chopped version),https://www.reddit.com/r/bangtan/comments/526695/bts_6_mama_short_film_yungs_chopped_version/,[deleted],1473555645,[deleted],0,5,False,default,,,,,
159,bangtan,t5_2zqih,2016-9-11,2016,9,11,10,526e6e,youtube.com,BTS - MAMA/Whailen 52 MASHUP [by TPDFMixes],https://www.reddit.com/r/bangtan/comments/526e6e/bts_mamawhailen_52_mashup_by_tpdfmixes/,nachaboi,1473558940,,1,7,False,http://a.thumbs.redditmedia.com/ysxHh_bFrYLIu2-g-6G3-vLjXxniYRDT7xApfdx7PL8.jpg,,,,,
160,bangtan,t5_2zqih,2016-9-11,2016,9,11,11,526mov,youtube.com,BTS WINGS' Short Films - Song Compilation (thus far),https://www.reddit.com/r/bangtan/comments/526mov/bts_wings_short_films_song_compilation_thus_far/,mllelingling,1473562495,,7,41,False,http://b.thumbs.redditmedia.com/pe-OERsALpV0wMxI24GveKzuZcwgvdAvpHwbuG-olbw.jpg,,,,,
161,bangtan,t5_2zqih,2016-9-11,2016,9,11,12,526pf4,youtu.be,"What you (probably) didn't notice in BTS ""Wings"" Short Film #6 MAMA",https://www.reddit.com/r/bangtan/comments/526pf4/what_you_probably_didnt_notice_in_bts_wings_short/,screambledeggs,1473563701,,0,10,False,http://b.thumbs.redditmedia.com/K36nLZW1BfSgEwPizn0cT8YZ29P7TPVsXljguRwl7Xw.jpg,,,,,
162,bangtan,t5_2zqih,2016-9-11,2016,9,11,16,527hdf,youtube.com,BTS () Short Film WINGS #5 : Reflection ( EXPLAINED ) | THEORY TIME |,https://www.reddit.com/r/bangtan/comments/527hdf/bts__short_film_wings_5_reflection_explained/,Nojjjjjjjustno,1473577750,,0,5,False,http://b.thumbs.redditmedia.com/0puOPsIdM9pL8LcGi4m9oTQ4BIrb7RM0ginYzapiUmU.jpg,,,,,
163,bangtan,t5_2zqih,2016-9-11,2016,9,11,17,527nfm,youtube.com,I Need To Tell You Something... You Got No Jams!,https://www.reddit.com/r/bangtan/comments/527nfm/i_need_to_tell_you_something_you_got_no_jams/,waniarahinsajid,1473581829,,0,1,False,http://b.thumbs.redditmedia.com/UYkfYDXBc7p-QaRzxo6tSCoenGebqnM1uAx8GtTNclI.jpg,,,,,
164,bangtan,t5_2zqih,2016-9-11,2016,9,11,17,527qqu,docs.google.com,Compilations of WINGS screenshots and some observations,https://www.reddit.com/r/bangtan/comments/527qqu/compilations_of_wings_screenshots_and_some/,Noctoki,1473584185,,8,9,False,http://b.thumbs.redditmedia.com/yDzACWnfREiRizrENNrCxrxom6eqbUDiL_UFv-l4ZiE.jpg,,,,,
165,bangtan,t5_2zqih,2016-9-11,2016,9,11,18,527t03,self.bangtan,[DISCUSSION] Do you consider Jungkook a rapper?,https://www.reddit.com/r/bangtan/comments/527t03/discussion_do_you_consider_jungkook_a_rapper/,blmnkrnz,1473585763,"With all the WINGS hype around, I know this question will seem out of place. However, I just really wanted to know what other people thought about it because personally, I don't. Of course, I love Jungkook to death as much as all the other members (well, except Jimin. I extol him.) but he is not a rapper in my opinion. I just feel like it's an insult for genuine rappers like Yoongi and Namjoon to call Jungkook one. Not even ""sub-rapper"" would do. Because I treat BTS as real musical artists instead of as a normal K-pop group, I want to see them as they really are. Look, here's an example: Minho from SHINEE. I don't think he's a rapper even if that's his role in his group and I quite like Minho, you know? He's a ""rapper"" in the context of being in a kpop group BUT my standards for BTS just aren't that low for me to consider Jungkook a rapper because again, in my eyes, they're not just a kpop group. What do you guys think?",17,17,False,self,,,,,
166,bangtan,t5_2zqih,2016-9-11,2016,9,11,19,527zy6,self.bangtan,random question,https://www.reddit.com/r/bangtan/comments/527zy6/random_question/,mjlmakeup,1473590573,[removed],15,8,False,default,,,,,
167,bangtan,t5_2zqih,2016-9-11,2016,9,11,20,5285e1,youtube.com,BTS WINGS Short Film #5 PARODY [GoToe PARODY],https://www.reddit.com/r/bangtan/comments/5285e1/bts_wings_short_film_5_parody_gotoe_parody/,Pikabouh,1473594148,,4,20,False,http://b.thumbs.redditmedia.com/khjRZubTIKBpdYKIZx0GijB4PJ8JlXDMor7CqBVXscs.jpg,,,,,
168,bangtan,t5_2zqih,2016-9-11,2016,9,11,21,528cxr,self.bangtan,High Expectation about Their New Songs,https://www.reddit.com/r/bangtan/comments/528cxr/high_expectation_about_their_new_songs/,btskoreanfan,1473598118,"I know many have already talked about this on the wing vd posts, but... listening to the songs repeatedly, I cannot contain my thrill about upcoming album. 

The songs! 
They are surprisingly good! actually they are beyond normal good or ok level.. 
This is not from my fan mind, but objectively, they are so fresh/trendy/edge. 
JM's killing track (and his amazing execution of the dance!!!) and J-hope vd's song (I am keep repeating it) was really beyond expectation. JK's song (for me, it is a sad traditional song sound, which allegedly was used for remembering the deceased) causes me curiosity, if that song is included, what kind of BTS style would it make? And Tae's song was also great to listen to. 
This is the first time I am waiting for their new song release since I became BTS fan. And these WING thing blew my mind and I feel blessed that I did not miss this period. 

To understand WINGS, I went back to the HYYH series, and I realized how great the songs were. After Danger, they came back with such mv as I need you/ prologue (butterfly included)/ run/ Dope... What? I cannot even imagine how old fans felt about these changes at that time. They are just so good...  If you remember, let me know how you felt and how fans reacted at that time. Thanks. ",11,41,False,self,,,,,
169,bangtan,t5_2zqih,2016-9-11,2016,9,11,21,528czq,self.bangtan,[For Sale] Merch from The Red Bullet and more (Crosspost from r/KpopforSale,https://www.reddit.com/r/bangtan/comments/528czq/for_sale_merch_from_the_red_bullet_and_more/,[deleted],1473598146,[deleted],0,4,False,default,,,,,
170,bangtan,t5_2zqih,2016-9-11,2016,9,11,23,528v6r,self.bangtan,"Happy Birthday, Namjoon!!",https://www.reddit.com/r/bangtan/comments/528v6r/happy_birthday_namjoon/,ABlackUnicorn,1473605940,"As a diehard Namjoon stan, I'm feeling pretty emotional right now, not gonna lie! 

Happy birthday to this wonderful leader, this [totally adorkable dude](https://www.youtube.com/watch?v=NtSDtzbbVr8) with [deep thoughts](https://www.youtube.com/watch?v=6wpvP5eaPBI) and an [even deeper love for his members](https://youtu.be/d4bCr2EFXN0?t=11s). Happy birthday to this [God of Destruction](http://amandapearl2.tumblr.com/post/150261337813/ttanji-classic-namjoon-x), this [style icon](http://hobiekookie.tumblr.com/post/135877951400/hobilu-namjoons-airport-fashion) who sometimes looks like a confused uncle/grandpa but who can also [dial up the sexy at any given moment](https://www.youtube.com/watch?v=UGX6vU86IqI). Happy birthday to [Namjoon the poet](http://www.allkpop.com/article/2016/03/netizens-are-amazed-by-the-patriotic-poem-bts-rap-monster-wrote-at-age-12), [Namjoon the motivational speaker](https://twitter.com/BTS_twt/status/770678677847756800), and [Namjoon the trailblazer](http://noisey.vice.com/blog/rap-monster-rm-bts-korean-hip-hop-2015). I sincerely hope he achieves everything he wants in life and his career, and as his fan I intend to be there for every moment! 

I'd love to hear your reasons for loving Namjoon! Let's appreciate him a lot!

EDIT: Member uploads for Joonie!

[Yoongi](https://twitter.com/BTS_twt/status/774986653135872000), [Translation](https://twitter.com/Bulletproof_SG/status/774989343622434816)

[Jin](https://twitter.com/BTS_twt/status/774986741799194624), [Translation](https://twitter.com/Bulletproof_SG/status/774987387206119424)

Thanks to u/dorkprincess for commenting with the rest of the uploads!

[BTS_Bighit tweet](https://twitter.com/bts_bighit/status/774985871045033989)

[BTS_JP tweet](https://twitter.com/BTS_jp_official/status/774986129036546049)

[Hobi](https://twitter.com/BTS_twt/status/774995106260590592), [Translation](https://twitter.com/Bulletproof_SG/status/774995836451233792)

[Jimin on Cake Patrol, as per usual!](https://twitter.com/BTS_twt/status/774995308392488961), [Translation](https://twitter.com/Bulletproof_SG/status/774996274349084672)

[Jungkook](https://twitter.com/BTS_twt/status/774996268141547520) (I personally died seeing this pic)

[The boys torturing Joonie with debut (pre-debut?) videos! They are *hilarious*!](https://twitter.com/BTS_twt/status/774998794538627072)

[The birthday boy himself! T_T](https://twitter.com/BTS_twt/status/774999752060444673)

[Namjoon Birthday Bus!](https://twitter.com/89MODOkit/status/774887503413161984)",52,130,False,self,,,,,
171,bangtan,t5_2zqih,2016-9-12,2016,9,12,0,5294pe,youtube.com,[Throwback] RM Chooses BTS over Solo (HBD RM!),https://www.reddit.com/r/bangtan/comments/5294pe/throwback_rm_chooses_bts_over_solo_hbd_rm/,fluffymushroom757,1473609405,,6,30,False,http://b.thumbs.redditmedia.com/5qK3jq_FD5GohdowvMdsCYG5PQqmm4wCiJVmcyR-yMs.jpg,,,,,
172,bangtan,t5_2zqih,2016-9-12,2016,9,12,2,529m3v,youtube.com,BTS WINGS SUBUNITS???,https://www.reddit.com/r/bangtan/comments/529m3v/bts_wings_subunits/,infiresingjams,1473615184,,0,1,False,default,,,,,
173,bangtan,t5_2zqih,2016-9-12,2016,9,12,2,529mrd,i.reddituploads.com,The ultimate ARMY,https://www.reddit.com/r/bangtan/comments/529mrd/the_ultimate_army/,moonrose98,1473615401,,2,35,False,http://b.thumbs.redditmedia.com/wN2cUUNqdrlzrssmUjPExk9bgRWUnKBM_oR8nEnsnBk.jpg,,,,,
174,bangtan,t5_2zqih,2016-9-12,2016,9,12,7,52b3hm,self.bangtan,Suggestion for Youtuber Reactions to WINGS?,https://www.reddit.com/r/bangtan/comments/52b3hm/suggestion_for_youtuber_reactions_to_wings/,SpaceFrostbite,1473632976,"Who have you been following on Youtube that reacts to BTS videos? I am the type of person who once I watch one of their videos, I need to watch someone else reacting because I don't know anyone in real life who like Kpop and I need to get my feelings out haha. Do you have favourite Youtubers or channels that you enjoy watching react to BTS things?

Here are some of mine: [2MinJinkJongKey](https://www.youtube.com/user/2MinJinkJongKey), [TheJessLyfe](https://www.youtube.com/user/thejesslyfe), [Jen N Em](https://www.youtube.com/channel/UCgDhpVN0WkHW4k2xAxnQMpw), and [MigoTV](https://www.youtube.com/channel/UCELbunfydYNarK3Fglga0qg).",29,6,False,self,,,,,
