,date,year,month,day,hour,id,title,full_link,author,created,selftext,num_comments,score
0,2017-4-1,2017,4,1,9,62pdfx,Which statistics courses are most relevant for data science?,https://www.reddit.com/r/datascience/comments/62pdfx/which_statistics_courses_are_most_relevant_for/,asd987fgh,1491006313,,34,53
1,2017-4-1,2017,4,1,10,62pvf9,Best college for machine learning/ai undergrad,https://www.reddit.com/r/datascience/comments/62pvf9/best_college_for_machine_learningai_undergrad/,Zornp,1491011940,"Hi, 

I know this is a bit out of the scope of this subreddit but I figured I'd get people's professional opinions. I have been accepted to 

University of Waterloo (co-op and honors),

 Rpi (honors),

 Wisconsin-madison (honors) 

and ucsc. 

I want to study computer science with a focus on machine learning and just want to know which of there's colleges would be best for that. 

Thanks",1,1
2,2017-4-1,2017,4,1,23,62t0os,Estimated Model Training Time Library?,https://www.reddit.com/r/datascience/comments/62t0os/estimated_model_training_time_library/,Turin_Martell,1491056916,"Does anyone know if such a library exists (preferably in Python/R)? From what I understand it shouldn't be too hard to implement a simple version since the time complexity of the algorithms is known, but I'd like to know if one exists before I go down that road.",6,5
3,2017-4-1,2017,4,1,23,62t3m7,"A great list with pytorch implementations of various papers, tutorials and more.",https://www.reddit.com/r/datascience/comments/62t3m7/a_great_list_with_pytorch_implementations_of/,xen-m-rph,1491057765,,0,11
4,2017-4-2,2017,4,2,3,62ue3k,Is data analytics growing in the Netherlands? Can you make as much money as when working in finance/insurance?,https://www.reddit.com/r/datascience/comments/62ue3k/is_data_analytics_growing_in_the_netherlands_can/,[deleted],1491070140,[deleted],7,2
5,2017-4-2,2017,4,2,4,62uuxp,Facebook Prophet,https://www.reddit.com/r/datascience/comments/62uuxp/facebook_prophet/,juicemoney,1491074614,"https://facebookincubator.github.io/prophet/

Prophet forecasting package tailored to creating business time series predictions. Very interesting to me because it's often what I am working on. It's also available for Python and R.

One of the creators recently talked about it in episode 35 of the Not So Standard Deviations podcast linked below:

https://soundcloud.com/nssd-podcast",5,16
6,2017-4-2,2017,4,2,7,62vvt7,"Query Graph - Python package (""language"") for joining data from different database types (e.g. Postgres -&gt; Mongo Db) - Useful?",https://www.reddit.com/r/datascience/comments/62vvt7/query_graph_python_package_language_for_joining/,pw__,1491084334,"Query Graph is a side project I've been working on for the past little while (for fun). It lets you join data from any number of different database types in a single query (using a graph structure). It's not ready yet, but I've never actually had to join data from different databases so I'm just hoping for any feedback as to whether this is useful in any way (or makes any sense).

Link to Github repo:
https://github.com/peter-woyzbun/querygraph

Jump right to example/introduction:
https://github.com/peter-woyzbun/querygraph#query-graph-language---brief-introduction",0,3
7,2017-4-2,2017,4,2,8,62wfv9,"Found some sensitive retailer data online, what should I do?",https://www.reddit.com/r/datascience/comments/62wfv9/found_some_sensitive_retailer_data_online_what/,longprogression,1491090402,"Hope this is the right place to post this, considering a lot of people here partake in web scraping to gather data.


I was online shopping this morning for a few big ticket items and for fun decided to sniff the network traffic to see how some of the retailers were populating their item pages. I stumbled across this medium size US-based retailer that is sending a json response with all their items in addition to the items' wholesale prices and a bunch of other really sensitive data points. None of these sensitive data points appear on the page, but none the less everything is right there in the response. 


I was wondering what process is usually taken to inform big companies like this about their data being exposed......and I hate to be this guy, but is there any precedent to asking for a reward for catching this. I was looking to spend a lot of money on some of their items, but it'd be awesome if I could get some for free or at a heavy discount.....considering i know the wholesale prices now :/ ",7,7
8,2017-4-2,2017,4,2,9,62wnwz,"Is logistic regression an efficient tool for large, binary data with multiple independent variables?",https://www.reddit.com/r/datascience/comments/62wnwz/is_logistic_regression_an_efficient_tool_for/,GiveEmMoZo,1491092929,,9,2
9,2017-4-2,2017,4,2,14,62y563,Applying Sentiment Analysis to Black Mirror Subtitles to Rank Episodes in terms of Negativity [xpost from /r/blackmirror],https://www.reddit.com/r/datascience/comments/62y563/applying_sentiment_analysis_to_black_mirror/,[deleted],1491112698,[deleted],0,1
10,2017-4-2,2017,4,2,16,62ygr4,Extracting events from news archives,https://www.reddit.com/r/datascience/comments/62ygr4/extracting_events_from_news_archives/,freedaemons,1491118530,"I have a large spatial-temporal data set of node sizes and trajectories between nodes. What I'd like to do is perform some association or prediction between spatial-temporal events, and world/local news events. Is there some well-established methodology to extract features from news archives, or am I flying by the seat of my pants here?",0,2
11,2017-4-2,2017,4,2,17,62ym2p,How ISP's / telco's monetize your network data,https://www.reddit.com/r/datascience/comments/62ym2p/how_isps_telcos_monetize_your_network_data/,networkdata,1491121478,I'm a data scientist for a large telco / ISP. Part of my job is  to explore options for what financial benefit my company can derive from sale of the data moving across our networks - as well as privacy implications involved in that sale. There's a lot of discussion around this point at the moment - wondering if people are interested in asking questions. Note: I don't believe in privacy invasion and feel like I continually walk a tightrope between legitimate use cases and downright evil doing. Its a little scary how easy it is to use network data to derive insight into individual's lives though. ,8,10
12,2017-4-2,2017,4,2,18,62yt1m,Data science architecture,https://www.reddit.com/r/datascience/comments/62yt1m/data_science_architecture/,cmd_data,1491125445,"Hi everybody,
I would like to get a deeper knowledge about the common architecture which is used to store and analyze big data (incl. structured data). Currently I've just some basic knowledge about frameworks like hadoop &amp; spark and as far as I know hadoop in combination with map reduce isn't efficient for e.g. modifying lot of datasets so you would probably go for spark &amp; cassandra but perhaps this is already an outdated information? Instead of reading tons of books I prefer to apply a course on edx for example but I actually didn't find a course where you learn both: the architecture and the analysis of structured big data. Perhaps some one of you can recommend a good starting point whether it is a book or online-course.

Thank you! ",5,27
13,2017-4-2,2017,4,2,20,62z7mg,What was your undergrad project on?,https://www.reddit.com/r/datascience/comments/62z7mg/what_was_your_undergrad_project_on/,techolah,1491133247,"I asked this in [math](https://www.reddit.com/r/math/comments/60pge6/what_was_your_end_of_undergrad_project_on/), and I'm curious what people here did. 

So in the UK there's generally a project at the end of undergrad studies, I'm curious what people here did theirs on. 

cheers",31,1
14,2017-4-2,2017,4,2,22,62zk6k,Doc-Diff (Python Library),https://www.reddit.com/r/datascience/comments/62zk6k/docdiff_python_library/,Renien,1491138842,,0,4
15,2017-4-3,2017,4,3,1,630nr4,Ranking the Negativity of Black Mirror Episodes with Sentiment Analysis [xpost from /r/blackmirror],https://www.reddit.com/r/datascience/comments/630nr4/ranking_the_negativity_of_black_mirror_episodes/,[deleted],1491151454,[deleted],0,1
16,2017-4-3,2017,4,3,3,631cuw,Data for Democracy Hackathon Community Showcase,https://www.reddit.com/r/datascience/comments/631cuw/data_for_democracy_hackathon_community_showcase/,bklpkl,1491158298,,1,0
17,2017-4-3,2017,4,3,4,631js5,Survey-What scenarios do you use machine learning for in your applications?,https://www.reddit.com/r/datascience/comments/631js5/surveywhat_scenarios_do_you_use_machine_learning/,asthana86,1491160153,,0,1
18,2017-4-3,2017,4,3,4,631rc9,Expanding data science projects to production,https://www.reddit.com/r/datascience/comments/631rc9/expanding_data_science_projects_to_production/,[deleted],1491162228,[deleted],7,9
19,2017-4-3,2017,4,3,6,632922,Are Online Data Science Certificate programs worth it? I am looking at UCLA extension school and UC Berkeley extension school.,https://www.reddit.com/r/datascience/comments/632922/are_online_data_science_certificate_programs/,powernit,1491167175,"Are Online Data Science Certificate programs worth it? I am looking at UCLA extension school and UC Berkeley extension school.

https://www.uclaextension.edu/public/category/programStream.do?method=load&amp;selectedProgramAreaId=73128159&amp;selectedProgramStreamId=93754

http://www.extension.berkeley.edu/public/category/courseCategoryCertificateProfile.do?method=load&amp;certificateId=28652248&amp;selectedProgramAreaId=15499&amp;selectedProgramStreamId=15608

Any suggestions on how employers look at such degrees? 
I am working as programmer / analyst and have a MS in Computer Science and just want to transition towards Data Science because it is interesting to me.",20,37
20,2017-4-3,2017,4,3,6,632al1,[P] I am testing an OS X app to organize PDFs that I tend to download from arXiv into categories and rename the files into something that is easier when looking at a folder.,https://www.reddit.com/r/datascience/comments/632al1/p_i_am_testing_an_os_x_app_to_organize_pdfs_that/,just_some_new_stuff,1491167627,"Does anyone want to help test this? (**Message here or PM me and I will provide the download code**). I think it should work fully since it works on my machine but I want to see how it works on other people's end.

It basically takes a directory of PDFs of your choice and assigns categories and renames it if you want (useful for arXiv PDFs) then outputs it. Also any useful features would be useful since this was mostly for my personal use case and I prefer folders to Mendeley?

I am still working on playing with the NLP and clustering to change the results. Not a serious project so I just named it GroupMeDF. If this isn't an appropriate place feel free to chuck the post

https://itunes.apple.com/us/app/groupmedf-intelligently-organize-pdfs/id1214161731?ls=1&amp;mt=12",0,2
21,2017-4-3,2017,4,3,6,632d4r,"What's a very reputable data science, business intelligence, or business analytics ONLINE program? I'm a full time worker, and want to take this career path, but quitting work just isn't feasible. I want it to be worth my time, money, and effort.",https://www.reddit.com/r/datascience/comments/632d4r/whats_a_very_reputable_data_science_business/,CaptainKyloStark,1491168355,,6,1
22,2017-4-3,2017,4,3,6,632f86,Life of a Data Scientist?,https://www.reddit.com/r/datascience/comments/632f86/life_of_a_data_scientist/,0lipops,1491168949,"Hi, I've done quite a bit of research on the field but would really like to talk to some actual data scientists, to help shine some light on a few questions I haven't really found clear answers to. If you're a data scientist with some free time on your hands, I would really appreciate it if you shared some insight on the following questions.

1. Is your job ever stressful? If so, how stressful? keeping in mind that not all stress is bad.

2. Who do you report to?

3. What is the career growth like in terms of upward mobility?

4. How many hours do you usually work a week, and can you talk a bit about the work-life balance?

5. What is your academic background?

Thank you so much in advance.

I am torn between pursuing a graduate degree that leads to a career in data and another that leads to a career in IT product management. I've talked to a lot of current PMs, but not many data scientists.",9,5
23,2017-4-3,2017,4,3,9,633gsl,List of essential data science skills from Udacity.,https://www.reddit.com/r/datascience/comments/633gsl/list_of_essential_data_science_skills_from_udacity/,Pythonmcsnakysnake,1491180245,,0,22
24,2017-4-3,2017,4,3,11,633ziv,Why are you doing Data Science?,https://www.reddit.com/r/datascience/comments/633ziv/why_are_you_doing_data_science/,mad100141,1491186144,"Is it passion, money, power, convenience, curiosity? 
",4,1
25,2017-4-3,2017,4,3,12,634chn,Time Keeps on Slipping: Exploiting Time for Causal Inference with Difference-in-Differences and Panel Methods (using R and Python),https://www.reddit.com/r/datascience/comments/634chn/time_keeps_on_slipping_exploiting_time_for_causal/,[deleted],1491190547,[deleted],0,1
26,2017-4-3,2017,4,3,16,6357hs,Understand what exactly Data Science is - Very helpful for beginners to get started with Data Science,https://www.reddit.com/r/datascience/comments/6357hs/understand_what_exactly_data_science_is_very/,pooja_edureka,1491203082,,0,1
27,2017-4-3,2017,4,3,16,635bo7,Ranking the Negativity of Black Mirror Episodes with Sentiment Analysis [xpost from /r/blackmirror],https://www.reddit.com/r/datascience/comments/635bo7/ranking_the_negativity_of_black_mirror_episodes/,[deleted],1491205051,[deleted],1,2
28,2017-4-3,2017,4,3,16,635bt6,What's the fundamental fundamental difference between data science and business analytics?,https://www.reddit.com/r/datascience/comments/635bt6/whats_the_fundamental_fundamental_difference/,hebbar,1491205118,,15,16
29,2017-4-3,2017,4,3,16,635dfr,List of Free Must-Read Books for Machine Learning,https://www.reddit.com/r/datascience/comments/635dfr/list_of_free_mustread_books_for_machine_learning/,gargisharmapd,1491205935,,1,16
30,2017-4-3,2017,4,3,18,635poc,"Stand a chance to win a full pass to AI-ASIA 2017 worth SGD1,200 by completing the final survey (only 5 tickets).",https://www.reddit.com/r/datascience/comments/635poc/stand_a_chance_to_win_a_full_pass_to_aiasia_2017/,corpasia,1491212097,,0,0
31,2017-4-3,2017,4,3,20,6367kl,Getting started with Data Visualization,https://www.reddit.com/r/datascience/comments/6367kl/getting_started_with_data_visualization/,vishalagarwal,1491219675,"Suggest me some resources to get started with data visualization for Machine Learning. I cannot decide what to do or where to proceed, after plotting some visualizations for the data, to improve my prediction accuracy. What to do?",3,5
32,2017-4-3,2017,4,3,21,636btn,Solving some Data Science Job Interview questions together! [LIVE WEBINAR],https://www.reddit.com/r/datascience/comments/636btn/solving_some_data_science_job_interview_questions/,mestitomi,1491221114,,4,24
33,2017-4-3,2017,4,3,21,636cy8,How does one go about doing your own independent data science project and making sure everything is correct without a professor/mentor to verify everything is correct?,https://www.reddit.com/r/datascience/comments/636cy8/how_does_one_go_about_doing_your_own_independent/,[deleted],1491221516,"I would love to be able to come up with a portfolio of data science projects of my own and lack of guidance but I'm worried about my interpretations/'my story' is correct. So far, I have one from a data fest competition with my friends. I am a beginner in R so I would like to use this as a way to learn. Any recommended sources is much appreciated. ",4,3
34,2017-4-3,2017,4,3,22,636pcq,Sharp Sight Labs: Starting Data Science in R - $600US... Is it worth it?,https://www.reddit.com/r/datascience/comments/636pcq/sharp_sight_labs_starting_data_science_in_r_600us/,DrunkInMontana,1491225536,"[Link to the class is here.](https://learn.sharpsightlabs.com/join-starting-data-science-top/)

I love reading the [Sharp Sight Labs blog](http://sharpsightlabs.com/), and I've signed up for their newsletter because they always have interesting data science articles and analyses.

I was interested in their course that they advertise on their site, and got the e-mail today that signups had opened. I'm just wondering based on what you see for their advertisement of this course from the linked site is this class really worth $600US?

I've been learning R using DataCamp and it's been going ok, although I've been putting it on the backburner due to a Java class that I signed up and paid for. But I've been using R a lot at work again lately and the fundamentals have been tripping me up. I spend a lot of time looking the same syntax up because I just can't get it to stick in my brain.

I know that nothing is a magic bullet, but a course specifically designed to address my needs currently is very enticing. Am I being overly hopeful here?

I'm just looking for opinions, thanks for your time.",8,1
35,2017-4-3,2017,4,3,22,636w0c,What's the best way to display three-dimensional data?,https://www.reddit.com/r/datascience/comments/636w0c/whats_the_best_way_to_display_threedimensional/,Croves,1491227564,"I have a dataset that contains the adjusted close price for a certain security in a range of dates, and for each day I may have a third column with a fact that happened that day.

I'm looking for a nice way to display this information since I need to inform my audience if something happened on that specified date.

I'm currently using Python for general data science tasks, but I'm always open to new technologies and techniques.",4,1
36,2017-4-3,2017,4,3,23,6374ct,Python the most popular language for data science,https://www.reddit.com/r/datascience/comments/6374ct/python_the_most_popular_language_for_data_science/,[deleted],1491229845,[deleted],0,1
37,2017-4-4,2017,4,4,2,638bc1,Delays of US domestic flights: trends and predictability,https://www.reddit.com/r/datascience/comments/638bc1/delays_of_us_domestic_flights_trends_and/,localfield,1491240970,,0,1
38,2017-4-4,2017,4,4,2,638cw8,Time Keeps on Slipping: Exploiting Time for Causal Inference with Difference-in-Differences and Panel Methods (an applied intro with Python/R) [x-post from /r/pystats],https://www.reddit.com/r/datascience/comments/638cw8/time_keeps_on_slipping_exploiting_time_for_causal/,Spamlie,1491241347,,1,10
39,2017-4-4,2017,4,4,6,639kaj,Ideas for a political data science blog?,https://www.reddit.com/r/datascience/comments/639kaj/ideas_for_a_political_data_science_blog/,atm_vestibule,1491253295,"Looking to start a political data science blog and was wondering if anyone had interesting ideas, however vague, to explore? 

One idea is analyzing representative voting on proposed bill with respect to their DW-NOMINATE scores, to understand how certain policies resonate with certain ideologies. For example, fivethirtyeight @ https://fivethirtyeight.com/features/the-two-cracks-in-the-republican-party/ realized there exists two varying views within the Republicans on the healthcare bill and shows why it's such a big challenge for the Trump administration.

Also, I'd love to hear some great name ideas! 'seventyfourvotes' for the electoral difference maybe? I'm sure you can come up with something better. 

Thanks! ",16,24
40,2017-4-4,2017,4,4,10,63b9f6,"Masters degree dilemma, which degree should I choose?",https://www.reddit.com/r/datascience/comments/63b9f6/masters_degree_dilemma_which_degree_should_i/,ktsinthehouse,1491270644,"I am between two schools for a masters degree... One is an MS in computer science at UMass Amherst and M.Eng in Operations Research and Information Engineering at Cornell Tech. UMass is $23K for the degree and Cornell is $80k, which is also a another factor in my decision.

I'm hoping to pursue a career in data science after graduating... which option should I choose?

",5,0
41,2017-4-4,2017,4,4,12,63bq2k,DataScience A-Z:RealLife DS Exercises Included,https://www.reddit.com/r/datascience/comments/63bq2k/datascience_azreallife_ds_exercises_included/,techhadooper,1491276181,,0,1
42,2017-4-4,2017,4,4,14,63c6up,What types of things are you working on as a data scientist?,https://www.reddit.com/r/datascience/comments/63c6up/what_types_of_things_are_you_working_on_as_a_data/,csthrowaway9449,1491282547,"Really interested in data science, but from what i've gathered, it's a very broad field. Just wanted to get a few data points -- those of you with the job title, are the types of projects you work on more product-related (building things like recommendation systems, smarter auto-fill features, other ML-related work), or business-related (doing things like customer engagement, measuring marketing effectiveness, inventory management, supply chain, etc.)?
",1,3
43,2017-4-4,2017,4,4,17,63cw0a,I need your help,https://www.reddit.com/r/datascience/comments/63cw0a/i_need_your_help/,yes420,1491294494,"I may be looking in the wrong place so maybe someone could help me if I'm wrong and point me in the right direction. I'm currently doing a school project in school where I'm attempting to find if there's a relationship between the number of preterm births and particulate matter concentration by country. I have been able to find data for the number of preterm births by country however I have been unable to find data of particulate matter concentration by country, I have been able to find particulate matter concentration by city (not all cities just the polluted ones) however this doesn't help my investigation. It's too late to change the topic of my investigation. This is one of my final projects for my biology class and I need your help. I need your help finding data on particulate matter concentration by country or data on preterm births by city. Or if someone finds data for a different form of measurement for air pollution.
I know I should be able to find this my self but I've tried my hardest and I can find anything. Any help is welcome, thank you reddit",1,1
44,2017-4-4,2017,4,4,17,63cwy5,Introduction to text clustering,https://www.reddit.com/r/datascience/comments/63cwy5/introduction_to_text_clustering/,Nico_lrx,1491294996,,6,26
45,2017-4-4,2017,4,4,18,63d0gb,A Data Science Slack Team.,https://www.reddit.com/r/datascience/comments/63d0gb/a_data_science_slack_team/,abhisvnit,1491296821,,1,4
46,2017-4-4,2017,4,4,19,63d91x,What are the course objectives of Data Science?,https://www.reddit.com/r/datascience/comments/63d91x/what_are_the_course_objectives_of_data_science/,hadoop_training,1491301041,,0,1
47,2017-4-4,2017,4,4,21,63drrt,Can I use this Cause &amp; Effect Analysis here? Or am i getting ahead of myself,https://www.reddit.com/r/datascience/comments/63drrt/can_i_use_this_cause_effect_analysis_here_or_am_i/,loct99,1491308604,"**Problem**
I have a dataset of used car lots.  From 2015-October 2016, the used cars were resold immediately without any car detailing or thorough washing.

From November to Present,  Cars received a thorough interior or exterior detailing. and then resold.

**results**
the average sales price went up after the car washes were instituted. This is holding make/model of the car constant.

**My Question**
Showing a table of car make/models and the before and after prices isnt really much of an analysis.  I want to take this as an opportunity to do more.

I need to have a value statement that shows the value the car washes added.

**My idea**
I came across this neat cause and effect analysis done in R and Tableau.
https://boraberan.wordpress.com/2016/06/24/cause-effect-a-different-way-to-explore-temporal-data-in-tableau-with-r/

Could this be used here or is my thinking wrong?  The one issue is that if the car mix changed slightly, then an overall forecast like that would be inaccurate and im not sure how to account for that.

I still think that analysis is cool either way and a  good read.

Any other ideas on things i can read up on/learn?",5,1
48,2017-4-4,2017,4,4,21,63dwvd,Hiring Data Scientists!,https://www.reddit.com/r/datascience/comments/63dwvd/hiring_data_scientists/,datasciencemanager,1491310392,"Hi! I'm hiring for 3 data science team positions. Two are posted below, the third is not posted yet, but is an entry level data science role with a preferred focus on NLP. 

Both postings can be found [here](https://web.garretsongroup.com/careers).

Thanks!",5,14
49,2017-4-4,2017,4,4,21,63dx45,Looking for data science support groups?,https://www.reddit.com/r/datascience/comments/63dx45/looking_for_data_science_support_groups/,[deleted],1491310484,Would like to do more  personal projects but total newbie. Have taken some stat courses and familiar with R. Don't have any in person data science figures in my life right now. ,1,1
50,2017-4-4,2017,4,4,23,63efjw,How Uber Uses Psychological Tricks (... and data) to Push Its Drivers Buttons,https://www.reddit.com/r/datascience/comments/63efjw/how_uber_uses_psychological_tricks_and_data_to/,dtelad11,1491316171,,5,33
51,2017-4-5,2017,4,5,0,63ezfs,Theoretical vs Project centric approach to Data Science,https://www.reddit.com/r/datascience/comments/63ezfs/theoretical_vs_project_centric_approach_to_data/,[deleted],1491321496,[deleted],0,1
52,2017-4-5,2017,4,5,1,63f2r7,Google Cloud Platform for Data Scientists: Using R with Google BigQuery,https://www.reddit.com/r/datascience/comments/63f2r7/google_cloud_platform_for_data_scientists_using_r/,jkestelyn,1491322340,,0,2
