,date,year,month,day,hour,id,title,full_link,author,created,selftext,num_comments,score
161,2017-4-9,2017,4,9,23,64dfd1,The rise and rise of Dubai schools : https://t.co/60VubyYn2L #Mubarak_Al_Beloushi #Information #Shape #Data,https://www.reddit.com/r/datascience/comments/64dfd1/the_rise_and_rise_of_dubai_schools/,behnamrahdari,1491749611,,0,0
162,2017-4-10,2017,4,10,1,64dybx,text mining : https://t.co/hm55zWu4H7 #Qualitative #Data_model #IETF #XML #Database_schema,https://www.reddit.com/r/datascience/comments/64dybx/text_mining_httpstcohm55zwu4h7_qualitative_data/,behnamrahdari,1491755906,,0,0
163,2017-4-10,2017,4,10,2,64e9ub,Text Mining - Going Way Beyond Just Listening to the Voice of the Customer : https://t.co/hjm8vs3wM8 #Voice_of_the_customer,https://www.reddit.com/r/datascience/comments/64e9ub/text_mining_going_way_beyond_just_listening_to/,behnamrahdari,1491759495,,0,0
164,2017-4-10,2017,4,10,3,64elj0,Phd Research Proposal Data Mining : https://t.co/Paw5LoEPhy #PhD,https://www.reddit.com/r/datascience/comments/64elj0/phd_research_proposal_data_mining/,behnamrahdari,1491763093,,0,0
165,2017-4-10,2017,4,10,3,64eo0i,Need help with text prediction problem,https://www.reddit.com/r/datascience/comments/64eo0i/need_help_with_text_prediction_problem/,Param-eter,1491763852,"I have a data set which includes a few hundred thousand free text entries and a collection of topics that the text is about. I want to use this training set to build a model that i'd be able to use to classify new free text data I get.

My plan was to turn the free text into a document term matrix and then use Xgboost to train a model using all of the terms against a particular topic label.

Even if I limit my training set to a few thousand records, the matrix of words is just absurdly large and slams any computer I use.

Is there a better strategy to approach this type of problem? Any advice would be great.
 ",3,3
166,2017-4-10,2017,4,10,5,64f40s,Become a data analyst with a humanities background?,https://www.reddit.com/r/datascience/comments/64f40s/become_a_data_analyst_with_a_humanities_background/,throw_away_2357,1491768689,"Hello all. I'm in my late twenties with a BA and MA in history, and my job is a fairly niche one (data coordinator working in publishing). I love my job but it would be difficult to replicate if I had to move, which means I'd likely have to pivot to some degree. My responsibilities and industry are closest to those of librarians, however most librarian positions require a degree in library science that I can't afford. I'm wondering how doable (with some hard work) it would be for me to land a job as a data analyst given that I don't have a CS/business/statistics background. I want to be clear that I'm under no illusions as to my chances of becoming a data scientist. I do wonder, though, if I could get a job as and be a competent data analyst without obtaining another degree. What do I need to learn/do to get there? I have somewhere between beginner and intermediate skill with Excel and Python. I'm beginning to study VBA and pandas since they would be of benefit for my current position and likely any future prospects, whether as a data analyst or some form of coordinator. I've held off on getting into the weeds of SQL because, although it seems integral to many data analyst positions, it would be of no use for my current job. Would I be able to land a job as a data analyst? Should I be focusing my efforts on a different field/position in case I need to find a new job? Thanks!",6,1
167,2017-4-10,2017,4,10,5,64f89t,Retrospective on leaving academia for industry data science,https://www.reddit.com/r/datascience/comments/64f89t/retrospective_on_leaving_academia_for_industry/,tblancha,1491770035,,16,49
168,2017-4-10,2017,4,10,11,64h2dq,Possible venture into the Data Science career. I could use some pointers.,https://www.reddit.com/r/datascience/comments/64h2dq/possible_venture_into_the_data_science_career_i/,Goldburst,1491791934,"Hi folks, yeah it's going to be one of those posts, I apologize, but better to be sure before committing 100% I suppose.

Anyway, I am currently an analyst in the risk management department of a major utility company. I was originally planning to go the actuarial route (even having 3 exams passed as of now AND having majored in Actuarial Science). Recently though, I have been doing some soul-searching and am realizing more each day that the data science field is a better fit for me. I won't list why for the sake of this post, but it goes beyond the just $ of course.

At my current job, I got R and SAS on my computer (the former I have used in a project before in my last year of college). One of my performance goals this year is to at least show something basic that I believe the manager would like to see with one or more programs (especially if I discover more useful tools down the road) of this caliber, and then get more complex with it as time goes by. It's also worth mentioning that this manager *wanted* someone who can learn this stuff, so me learning whatever program I can get my hands on will benefit both of us. On top of this of course, my job (as well as my college major, as the AS program did at least involve some programming projects) consists a lot of organizing and communicating the data. I also downloaded Python on my home computer a day ago and am planning to play around with it (and possibly get a textbook of sorts on it). 

While I'm ready and willing to work hard, there is one possible caveat, I don't have a Masters/PhD, is this necessary to have? I'm primarily worried about having to go into some pricey loan if I were to do this (i.e. extra financial planning I suppose). Regardless of whether I need more schooling or not, I guess all my post boils down to is: what else should this aspiring data scientist be doing now from here?

Thanks for listening.

EDIT: I also was introduced to SQL before my current job, perhaps that is something to learn more of as well?
",2,0
169,2017-4-10,2017,4,10,13,64hibj,Exploring Reddit sentiment-based Soccer Result prediction,https://www.reddit.com/r/datascience/comments/64hibj/exploring_reddit_sentimentbased_soccer_result/,[deleted],1491797834,[deleted],0,1
170,2017-4-10,2017,4,10,13,64hm3s,How to approach the multi-digit recognition problem using the SVHN dataset?,https://www.reddit.com/r/datascience/comments/64hm3s/how_to_approach_the_multidigit_recognition/,mdlee6,1491799376,"For a little background information, the dataset can be found [here](http://ufldl.stanford.edu/housenumbers/).

I'm using the original images (Format 1), and all the train, test, and extra directories come with bounding box information in digitStruct.mat.  So far my plan is to crop the images using the bounding box information, normalize the image, and then reshape the images into a 64x64 squares.  These will be my inputs.

Would it be okay for me to then use the given bounding box information to crop out the individual digits in the image, then feed them into separate classifiers?  Or am I supposed to somehow be able to predict the bounding box coordinates for the digits in the image?  I tried looking up how to predict bounding box coordinates, but it seems like everyone had to somehow manually crop their photos.

Thanks in advance!",1,1
171,2017-4-10,2017,4,10,14,64hu6p,Not sure on where to head for my self-learning project (cities of similar climate),https://www.reddit.com/r/datascience/comments/64hu6p/not_sure_on_where_to_head_for_my_selflearning/,barnabusp,1491802917,"I'm a comfortable Python programmer, and getting my feet wet with scikit-learn, and having a lot of fun.  My project is to find cities with a similar climate as mine. Here's how I have the data structured:

100 tables (each table is a city)
each column (feature?) is a meteorological measurement (min/max temp, min/max precip, etc.)
each row is a month

So in Python, it'd look something like this:
weather[city][weather_feature][month] = &lt;float&gt; 

My test data would be:
city_data[weather_feature][month]

Could anyone point me in the direction to go? Much thanks!",0,0
172,2017-4-10,2017,4,10,15,64hzkk,The DevMasters @ Twitter.com,https://www.reddit.com/r/datascience/comments/64hzkk/the_devmasters_twittercom/,thedevmastersreviews,1491805405,,0,0
173,2017-4-10,2017,4,10,16,64i597,The DevMasters || About.me,https://www.reddit.com/r/datascience/comments/64i597/the_devmasters_aboutme/,thedevmastersreviews,1491808193,,0,1
174,2017-4-10,2017,4,10,17,64idkp,When you forget to delete kalman series when estimating a P-value matrix. Fuck it looks sweet,https://www.reddit.com/r/datascience/comments/64idkp/when_you_forget_to_delete_kalman_series_when/,saat4484,1491812649,,1,1
175,2017-4-10,2017,4,10,17,64ig52,Am I following the right path to a career in Data Science?,https://www.reddit.com/r/datascience/comments/64ig52/am_i_following_the_right_path_to_a_career_in_data/,FuXYoo,1491814074,"Hey all, first time poster here. I'm a soon-to-be Chemistry graduate from the University of East Anglia in the UK, and I can confidently say that I don't want to pursue a career in Chemistry. During my course, I've done modules in Analytical and Forensic Chemistry, and I really enjoyed the analysis of data given to me, and communicating my findings through technical reports and presentations. I started applying for graduate schemes as an Analyst this year, and although I wasn't successful, I was getting feedback that my CV and applications were good. I started applying for job ads as an analyst in various different sectors, and I'm getting rejected straight away. I think it's because I'm not trained in Data Science skills, things like R, Python, SQL...

So I've applied to do a Masters conversion course in Computing Science at UEA (link below) and I've been offered a place. It looks to me like a good course for me to get a grounding in those skills. The department also sounds as if it has a very good research group involved in Data Science and Machine Learning, so my dissertation could be quite interesting. I could also do my research project in collaboration with a company, as a paid placement.

My question is how valuable is a Masters degree in Computing Science for Data Science providers in the UK. It's a career path I definitely want, but I want to be sure that I'm going to stand a good chance of getting a good job at the end of it. Apologies if this is just a US-based subreddit, I'm not sure!

MSc in Computing Science at UEA: https://www2.uea.ac.uk/study/postgraduate/taught-degree/detail/msc-computing-science",4,5
176,2017-4-10,2017,4,10,19,64ivdu,CS109 homeworks 2015 and similar courses,https://www.reddit.com/r/datascience/comments/64ivdu/cs109_homeworks_2015_and_similar_courses/,investopim,1491821680,"Hey is there similar course that is available online to the CS109 from Harvard in terms of content and level, but more up to date( like 2016 one?)
Or maybe someone knows/ or maybe would be willing to share the homeworks and solutions(if there are) from the 2015 CS109 course (the only available online are from 2014 and 2013). 
Thanks.",1,4
177,2017-4-10,2017,4,10,21,64j9mq,"New feature by BJ Dooley for TDWI: Case Study: NationBuilder Goes Data Wrangling, by Brian J. Dooley",https://www.reddit.com/r/datascience/comments/64j9mq/new_feature_by_bj_dooley_for_tdwi_case_study/,bjdooley,1491827220,,0,5
178,2017-4-10,2017,4,10,21,64jave,"Which would be better for a job in Data Science? A minor in CS, or a minor or possible double major in mathematics?",https://www.reddit.com/r/datascience/comments/64jave/which_would_be_better_for_a_job_in_data_science_a/,GiveEmMoZo,1491827684,"So I'm a Stat major and Computational Modeling Major. I was debating if I should pursue a CS minor or take some extra math classes. The CS minor here is basically covered in mt Comp Modeling degree, besides a computer organization class in C, and a Data Structures and Algorithms class in Java (which is an elective for my degree). On the other hand, in my major, I will cover machine learning, data analytics, data visualization, and parallel computing classes. I'd be able to put R, Python, Matlab, C, and Linux on my resume WITHOUT the CS minor alone. But I've always heard that CS is a huge aspect of data science, and even though I hate the department at my school, I'm considering the minor. On the other hand, I already have a minor in mathematics, but wanted to take a few extra classes like Real Analysis, Time Series Analysis, advanced Linear Algebra, etc. Just wanted to know which of these paths would make me a better data scientist in the future? I am definitely more of a Statistics/Mathematics guy than CS, but I know I can't skimp CS completely.",22,18
179,2017-4-10,2017,4,10,22,64joeg,Using data science to optimize the bed capacity utilization,https://www.reddit.com/r/datascience/comments/64joeg/using_data_science_to_optimize_the_bed_capacity/,nitin13293,1491832186,,0,1
180,2017-4-10,2017,4,10,23,64jqmn,UK Government releases Kaggle-like data science challenge platform to solve intelligence problems with machine learning (X-post /r/machinelearning),https://www.reddit.com/r/datascience/comments/64jqmn/uk_government_releases_kagglelike_data_science/,[deleted],1491832873,[deleted],1,40
181,2017-4-10,2017,4,10,23,64jsij,Tool to do a full-text search over a billion of files,https://www.reddit.com/r/datascience/comments/64jsij/tool_to_do_a_fulltext_search_over_a_billion_of/,sochix,1491833388,,6,6
182,2017-4-10,2017,4,10,23,64jwyd,Finding natural scales of human movement with Instagram data,https://www.reddit.com/r/datascience/comments/64jwyd/finding_natural_scales_of_human_movement_with/,GraphBrain,1491834692,,0,9
183,2017-4-11,2017,4,11,0,64kbyr,Is there a place for art/design in data?,https://www.reddit.com/r/datascience/comments/64kbyr/is_there_a_place_for_artdesign_in_data/,brandius,1491838897,"Do you believe that a person has to have a degree in data science/data analytics to be able to work in the field?

My background is in design (because fine arts degree are the best way to throw yourself into debt) and I've worked in the interactive and tech industry since forever. I have a massive interest in data science/analytics and have overlapped with a few data scientists. I'd love to get more involved, but am entirely unsure as to how to get started or what is available as far as merging design and data science together. Does anyone have insights? Should I attempt to go back to schoolif so, in what? Is there a specific job role I could potentially jump into without a background in it?",5,2
184,2017-4-11,2017,4,11,1,64kkk3,Analyzing Survey Responses - Determining which questions drive the overall response?,https://www.reddit.com/r/datascience/comments/64kkk3/analyzing_survey_responses_determining_which/,28FortnightsLater,1491841255,"I am working on a project where I am analyzing survey data that asks a number of questions where the person can answer on a scale of 0-10. At the end there is a question of would you recommend this product to someone else and that is the question that we are trying to understand using the previous questions. What I want to do is determine which of the other questions drives that response of yes or no. 

My ideas are to use decision trees and logistic regression to understand which questions are the most significant but I was wondering if there are other techniques I should look into as well. I assumed that there would be a lot of multicollinearity issues with the data but when I ran a logistic model the VIF was under 2 for all questions. 

Any ideas from those who have done this sort of thing in the past?",5,9
185,2017-4-11,2017,4,11,1,64kr6g,"I have a capstone project that I'm going to be doing for the next month and a half and I'm lost, anyone have any good ideas?",https://www.reddit.com/r/datascience/comments/64kr6g/i_have_a_capstone_project_that_im_going_to_be/,drunklemur,1491843014,"I'm at a data science bootcamp and my original idea to try to parse the picks from r/sportsbook from the daily picks to try to generate a betting model based on the daily subthreads + users.  It seems like it would yield way too many problems in parsing and result in serious data quality issues and I have no idea what to expect for a baseline for the model.

Any other ideas would be useful, any questions that you'd like to see answered, based on data from reddit, twitter, anywhere? HELP!",7,1
186,2017-4-11,2017,4,11,2,64kvn6,Current MBA candidate - how useful will a data analytics bootcamp be?,https://www.reddit.com/r/datascience/comments/64kvn6/current_mba_candidate_how_useful_will_a_data/,[deleted],1491844177,[deleted],8,1
187,2017-4-11,2017,4,11,2,64kzf1,Thoughts on this MsC Marketing Analytics Program at Tilburg University (Netherlands),https://www.reddit.com/r/datascience/comments/64kzf1/thoughts_on_this_msc_marketing_analytics_program/,standardizedeviant,1491845186,"I come from a marketing/management background and am 32 years old. In marketing, there is a great emphasis on understanding the customer and I am fascinated by the new potential of big data in achieving this. 

I applied to [this program at Tilburg Univeristy](https://mystudy.uvt.nl/it10.owp?taal=e&amp;pfac=FEB&amp;variantcode=1N300). I would like to get some thoughts from *data analysts* who are already in the field about whether this program is solid. 

My concern is that it may be a tad basic in terms of depth and focus. 

Another thing: I'm a US citizen and will likely be looking for work stateside afterwards. ",0,5
188,2017-4-11,2017,4,11,2,64l1tv,After Python and R would a Data Scientist benefit more from Java or C++ ?,https://www.reddit.com/r/datascience/comments/64l1tv/after_python_and_r_would_a_data_scientist_benefit/,[deleted],1491845810,[deleted],12,7
189,2017-4-11,2017,4,11,3,64ldn0,A few Product Analyst Interview Questions I was asked. Would like to get the sub's approach towards it.,https://www.reddit.com/r/datascience/comments/64ldn0/a_few_product_analyst_interview_questions_i_was/,iKidA,1491848867,"Context - Said product helps small merchants conduct transactions. Subscription based service. 

Q) Free trial of product sent out - some merchants convert, some dont.
How to build a strategy to target in the future? How to decide whether to send out free trials or not?

Q)		

           Converted	Not converted
	
Called	     75	             25
	
Not called	      70	            30
	
Given this data, has the strategy of calling been successful in this case?
	
Q)
This question pertains to - Early delivery of products. Normally the delivery takes around 8 to 10 days but company would like to reduce it to 2 to 5 days in some specific cases - to enable new businesses start their business early.

In what cases would it make sense for a company to send it out early? On what basis can one make that decision?
",8,12
190,2017-4-11,2017,4,11,3,64lhsa,"Distributed, Docker-ized, Deep Learning",https://www.reddit.com/r/datascience/comments/64lhsa/distributed_dockerized_deep_learning/,dwhitena,1491849960,,0,2
191,2017-4-11,2017,4,11,4,64lt3l,Real World Data Science Use Cases,https://www.reddit.com/r/datascience/comments/64lt3l/real_world_data_science_use_cases/,tomholli,1491852888,"I'm interested in the best blog posts or articles that describe real world data science use cases in various companies. Here are some I've collected so far, but I'm sure there are good ones I've missed!

Atlassian
https://blog.dominodatalab.com/atlassian-uses-data-science-improve-collaboration/

Stitch Fix
http://algorithms-tour.stitchfix.com/

AirBnB
https://medium.com/airbnb-engineering/tagged/data-science

Twitter
https://medium.com/@rchang/my-two-year-journey-as-a-data-scientist-at-twitter-f0c13298aee6

Yelp
https://engineeringblog.yelp.com/2015/10/how-we-use-deep-learning-to-classify-business-photos-at-yelp.html",3,29
192,2017-4-11,2017,4,11,5,64mbli,Rethinking distance in New York City (Clustering NYC Neighborhoods),https://www.reddit.com/r/datascience/comments/64mbli/rethinking_distance_in_new_york_city_clustering/,topos_ai,1491857805,,0,4
193,2017-4-11,2017,4,11,7,64mrl2,There's No Free Lunch Theorum,https://www.reddit.com/r/datascience/comments/64mrl2/theres_no_free_lunch_theorum/,mariaspanadoris,1491862306,,0,0
194,2017-4-11,2017,4,11,9,64njxl,Picking a college (High school senior),https://www.reddit.com/r/datascience/comments/64njxl/picking_a_college_high_school_senior/,collegethrowaway9969,1491870793,"I'm a high school senior and I'm having some difficulties picking where I'm spending my next few years. 

I made a thread over in the /r/applyingtocollege subreddit.

https://www.reddit.com/r/ApplyingToCollege/comments/64l1vo/ubc_vancouver_vs_uoft_st_george_vs_uwaterloo_vs/

Looking for some insight from people over here. 

I was originally leaning towards going to U of T and just working my ass off but now I'm considering just going to UNC , enjoying my undergrad experience, and applying to a top grad program (Looking to get industry afterwards though.)

Anyone have experience with these two schools? Thoughts? I've been hearing about how Canadian job growth isn't too great and it's better to have an American degree???",6,1
195,2017-4-11,2017,4,11,9,64no1p,Securonix Named Most Advanced Security Analytics Platform by Leading Analysts - Securonix,https://www.reddit.com/r/datascience/comments/64no1p/securonix_named_most_advanced_security_analytics/,Baird_ird,1491872066,,0,1
196,2017-4-11,2017,4,11,10,64nsqs,The Field Guide to Data Science,https://www.reddit.com/r/datascience/comments/64nsqs/the_field_guide_to_data_science/,mminoli,1491873545,,11,67
197,2017-4-11,2017,4,11,13,64oq7u,The DevMasters on Issuu.com,https://www.reddit.com/r/datascience/comments/64oq7u/the_devmasters_on_issuucom/,thedevmastersreviews,1491884905,,0,1
198,2017-4-11,2017,4,11,15,64p8hd,Follow theDevMasters on Behance.net,https://www.reddit.com/r/datascience/comments/64p8hd/follow_thedevmasters_on_behancenet/,thedevmastersreviews,1491892690,,0,0
199,2017-4-11,2017,4,11,17,64pmk1,Why We Created dtSearch Replacement,https://www.reddit.com/r/datascience/comments/64pmk1/why_we_created_dtsearch_replacement/,sochix,1491899690,,0,1
200,2017-4-11,2017,4,11,17,64pmpj,Am I too ADHD for a corporate career?,https://www.reddit.com/r/datascience/comments/64pmpj/am_i_too_adhd_for_a_corporate_career/,maxmoo,1491899772,"I'm 3 years into my job post Math PhD (1 year Data Analyst followed by 2 years Data Scientist) and I'm wondering if I'm not suited for the corporate world. I'm doing OK with my job (good performance reviews etc) and feel like I could likely have my pick of sideways-career moves, but I really struggle  staying focussed on my work in the office for 8+ hours a day, I find I get bored after 2 or 3 hours each day. And I find it hard to care about what I'm doing. I look around me and see people happily plodding along doing whatever the Product Managers tell them but I get so restless and bored. And my work has a very ""flat"" management structure, so there's almost no opportunities for advancement which I feel might motivate me in the short term at least.

I never thought I would work in a corporate office, I kind of fell into the job since I decided that I couldn't face the stress of postdoc life but i'm wondering if it's not suited to my strengths.

My favourite things about my job are 

 * answering questions on stackoverflow
 * fixing bugs in jupyter/pandas/scikit-learn
 * helping people at work with questions
 * pair programming where i can teach or learn something
 * becoming a course mentor for AI/ML on Udacity (I didn't do the course but qualified due to my work experience)


My favourite things about my PhD were:

 * Mastering difficult proofs
 * TA'ing
 * Talking with other researchers about research problems and working things out together

I'm trying to decide whether I should change careers and become a high-school teacher. Or maybe go into management where at least I would have some bigger-picture responsibilities and mentoring (or would I?). I feel like I'm not suited for the hacking away at nitty-gritty details, I don't have the patience for it and I don't think it's good for my mental health trying to fit int this. I really think I want something more conceptual/bigger-picture.

Does this ring any bells for people here? Am I deluding myself that there's a better fitting job for me? Should I just devote all my energy to get better at focussing on boring tasks?

(By the way I don't have diagnosed ADHD but i'm seriously thinking I might have an undiagnosed case.)",6,1
201,2017-4-11,2017,4,11,18,64pq93,Need to turn my career (and life) around - Data Science/Data Analysis seems like the obvious choice - Can I do it alone?,https://www.reddit.com/r/datascience/comments/64pq93/need_to_turn_my_career_and_life_around_data/,The-Dood,1491901569,"Long story short: I have had 6 miserable years at university, with a minor depression along the way. I never found any joy in what I did, but continued because I believed that my studies HAD to lead to something in the end. Turns out my gutfeeling was right, and I'm now what most americans would call a ""useless liberal arts""-student with no craft (besides methodologies) or formal skills (I even feel I fall short analytically).

However, I do have a bit of IT-knowledge, and datascience/data analysis strikes me as something I would be good at. I have a full-time job now, but I'm not very good at it, nor am I developing any new skills. This limits the time I have to study by myself, but if I want, I can put 20-30 hours a week into a new field of study in my spare time. 

Currently, my focus has been on learning Python, and I've picked up the data-analyst course on Dataquest.io, which seems like a nice solution. 

My question is - is this a field I can study on my own? What are some of the best ressources (blogs, books etc.) that talk about this field? ",15,6
