,date,year,month,day,hour,id,title,full_link,author,created,selftext,num_comments,score
359,2017-4-22,2017,4,22,14,66ue1t,Any advice or tips for someone who is trying hard!,https://www.reddit.com/r/datascience/comments/66ue1t/any_advice_or_tips_for_someone_who_is_trying_hard/,mo_jo_jo_jo_19,1492838742,"Hello guys, 

I feel extremely lost so I thought I would ask you all for help. I do use this platform a lot silently and it has helped me a lot, but I have never posted before. 

A bit about me, I am a 22 year old female, doing my Master's in Electrical Engineering from top University in USA. My original career plan was to follow Signal Processing.  But due to the freedom of choosing courses at my university I was lucky enough to get a Data Science and Signal Processing track and I absolutely fell in love with Data. 

So I ended up taking courses like Probability, Natural Language Processing, Machine Learning etc. 

Now I am an international student here and ideally I should have a summer internship. I have applied wide and far, to more than 100+ internships. I am not even hearing back from them. I have lost hope for this summer because the deadline to submit my internship offer letter at my university is soon approaching (May 12th). 

I code in Python, and I will admit that I am not as fast as a traditional CS Student. However, I do write decent code, eventually. We never got enough exposure to programming in EE, during my bachelors back home in India. I have done a lot of projects (Kaggle, coursework etc) and have worked up on my Mathematics and Statistics. 

I know I am extremely hard-working and can adapt and learn really fast. I am just waiting for that one opportunity to click. I am scared too because I have already taken the leap of faith. I have spent $$$$ on this Master's and have abandoned my EE path. 

It seems almost impossible to crack Data Science without work experience, and I need some work experience to get started. How do I land an opportunity and prove my worth! 

Please any help, any advice, anything that steers my rocky boat in the right direction would greatly appreciate it. I want someone to believe in me and give me that chance :( 

EDIT - Thank you for the responses! You have no idea how much responses mean to me right now!",24,19
360,2017-4-22,2017,4,22,17,66uzn8,"High school student, strong in maths, weak in computers. Is data science an option for me?",https://www.reddit.com/r/datascience/comments/66uzn8/high_school_student_strong_in_maths_weak_in/,spotted_badger,1492850251,"I'm a high school student looking at pursuing a degree and career in data science.  Mainly I want to know how much CS is involved in coursework and jobs.  I'm strong in maths but have had no exposure to anything computer science-related, and I'm not sure if, for this reason, a data science course would be suitable for me.  It's likely that if data science doesn't work out, I'll stick with stats, hopefully focusing on the maths side rather than the computer side of it.

So how much CS is involved in data science, and is succeeding in CS units at uni with no prior knowledge of coding or programming possible?",12,4
361,2017-4-22,2017,4,22,19,66v9xc,[x-post] considering career change to 'data science',https://www.reddit.com/r/datascience/comments/66v9xc/xpost_considering_career_change_to_data_science/,cafepowered,1492856241,"Hello, I am really considering a sort of a difficult career change. I hold a phd in civil engineering (properly: modeling of concrete structures, but somewhat close so https://en.wikipedia.org/wiki/Computational_mechanics ), but I do not see a good demand for my skills where I live (southern Italy, but Italy in general). 


At the moment I also should learn real structural design on the job, since my competences are mainly theoretical. Generally I search for a job in europe, but the only foreign language I know is English (and very little Spanish).


It appears 'data science' jobs are in great demand. Let's say I could be comfortable in modeling, processing of data and consultancy.
I started thinking about it 1 year ago when just out of curiosity I took a machine learning course on coursera. Found it pretty easy and enjoyable (still I know those are kind of watered-down versions). Now I am taking a statistics course.


Given all this do you think it may be possible to find a job in data-science? What kind of positions may I look for to grow professionally?

I know there would be A LOT to learn, but smalls steps are doable if the market really requests data scientist in the mid-term. Any advice is welcome.

[edit:improved text formatting]",1,0
362,2017-4-23,2017,4,23,1,66wzj2,Natural Language Processing on multiple columns in python,https://www.reddit.com/r/datascience/comments/66wzj2/natural_language_processing_on_multiple_columns/,data_science_rules,1492880042,,2,2
363,2017-4-23,2017,4,23,2,66x7ja,https://medium.com/@grantliu/list-of-data-scientist-interview-question-lists-3b38c474cb3b,https://www.reddit.com/r/datascience/comments/66x7ja/httpsmediumcomgrantliulistofdatascientistinterview/,[deleted],1492882487,[deleted],0,1
364,2017-4-23,2017,4,23,4,66xpfn,What can one learn from pages of a journal?,https://www.reddit.com/r/datascience/comments/66xpfn/what_can_one_learn_from_pages_of_a_journal/,Steverob91,1492887777,"Imagine I have journal entries of a person for several years. What kind of useful things can we mine from this. Useful, intriguing and interesting information that I can present to the journal owner.

One thing I can do is perform sentiment analysis and present the person with a heatmap or something..",3,0
365,2017-4-23,2017,4,23,4,66xrgf,Accreditation vs. Results,https://www.reddit.com/r/datascience/comments/66xrgf/accreditation_vs_results/,butterbeean,1492888411,"I've landed my first job from college(BS economics), as a data analyst. I have been studying independently and working on side projects. Based on the assumption that 85%+ knowledge of a graduate degree can be learned independently (challenge me otherwise.), will choosing not to get a masters affect my job and salary prospects?

Is a successful career in data science possible with only a bachelors? Does anyone regret not choosing to get their masters?

Note: I am more interested in driving business value vs. ML research.






",5,3
366,2017-4-23,2017,4,23,8,66z7bb,Best tutorial to get your hands on tensorflow?,https://www.reddit.com/r/datascience/comments/66z7bb/best_tutorial_to_get_your_hands_on_tensorflow/,PM_YOUR_NETFLIX_ACC,1492904869,"Hi,

I would like to know what are the best tutorials to know more about tensorflow. I know the basics of it and want to do some projects using it. What tutorial (on youtube or on PDF) should I see to know the best practices for this?

I've already watched few videos of Sentdex but he doesn't seem to teach good practices and he doesn't explain that much what's going on. 

EDIT: Thanks for all the answers. I'll take a look at the guide made by Tensorflow suggested by /u/BiffWebster115  and the good [syllabus](https://web.stanford.edu/class/cs20si/syllabus.html) suggested by /u/SomeSnm ",10,34
367,2017-4-23,2017,4,23,8,66z7mg,Becoming a data scientist,https://www.reddit.com/r/datascience/comments/66z7mg/becoming_a_data_scientist/,8Clouds,1492904975,"Is it possible for someone without any degree to take data science online courses, be good at it and get a job in the field?",9,0
368,2017-4-23,2017,4,23,10,66zooc,"Jonathan Schwarz of Google DeepMind shares insight on Deep Learning projects. He offers tips and advice for the those interested in DL, and explains whether DL projects relate to other data driven projects",https://www.reddit.com/r/datascience/comments/66zooc/jonathan_schwarz_of_google_deepmind_shares/,OpenDataSciCon,1492911072,,2,8
369,2017-4-23,2017,4,23,13,670dyo,Side projects?,https://www.reddit.com/r/datascience/comments/670dyo/side_projects/,ShinyBaldMan,1492920844,"I'm an academic. Not in the field of machine learning or statistics (rather, in pure Mathematics), but I do have an extremely good understanding of both, being an exceptionally good autodidact. As an academic, I have summers off. I was wondering what some ways of getting payed data science projects over the summer might be.

Note that I would have no problem passing theoretical or practical tests at all, but it's also true that I don't have any portfolio of projects.",7,0
370,2017-4-23,2017,4,23,17,6716qy,Any resources for practicing SQL for interviews?,https://www.reddit.com/r/datascience/comments/6716qy/any_resources_for_practicing_sql_for_interviews/,BoltThrower79,1492934826,"Are there any websites/books like Leetcode or CTCI that have a good collection of SQL exercises? I've used SQL quite a bit but I always hit a wall when it comes to finding something to practice with before interviews. I've already done the SQL questions on Leetcode and pgexercises.com. 

Thank you. ",5,9
371,2017-4-23,2017,4,23,17,671boj,Does anyone know the best way to analyse a likert scale for a dissertation?,https://www.reddit.com/r/datascience/comments/671boj/does_anyone_know_the_best_way_to_analyse_a_likert/,CLEAR_PROP_,1492937794,"i have involved likert scales in my dissertation going from 1(strongly disagree) to 5 (strongly agree) what is the best (the one which would get me more marks!) way to analyse it

https://docs.google.com/forms/d/e/1FAIpQLScmhEhdDVVhs7mj1B-yh--FRLV_Km1iMdZbaaN24Qp4vdb5fg/viewform?usp=sf_link

this is the survey if you'd like to do it",9,3
372,2017-4-23,2017,4,23,23,672m9c,MS in Data Science worth it? From Europe?,https://www.reddit.com/r/datascience/comments/672m9c/ms_in_data_science_worth_it_from_europe/,dinnerdaddy,1492959200,"Although I have a Bachelors Degree in Chemical Engineering from India's top ranked Technical University (IIT Bombay), I have a very sad CGPA (5.46 out of 10). I have a basic grasp of programming languages and am pursuing Data Science courses online from Coursera and EdX. 
What would be your suggestion of a Good Masters in Data Science from Europe (Preferably Sweden). Any other suggestions preferably from peeps already registered in some DS course or have completed.
I have shortlisted a few and would be very obliged if someone could tell me how good the programs actually are
MS Statistics and Data Mining - Linkoping University Sweden,
MS Statistics and Data Analysis - Univ of Oslo,
MS Applied Data Science - Univ of Gothenberg,
Any sort of related input would be of immense help! TIA",20,5
373,2017-4-24,2017,4,24,4,6740tl,Has anyone figured out how to turn on spellchecking in IPython notebook markdown cells?,https://www.reddit.com/r/datascience/comments/6740tl/has_anyone_figured_out_how_to_turn_on/,iamiamwhoami,1492974235,,1,5
374,2017-4-24,2017,4,24,4,67440z,Data Science personal project help?,https://www.reddit.com/r/datascience/comments/67440z/data_science_personal_project_help/,[deleted],1492975144,[deleted],1,1
375,2017-4-24,2017,4,24,4,6746sx,How to make the transition from academia to data science,https://www.reddit.com/r/datascience/comments/6746sx/how_to_make_the_transition_from_academia_to_data/,tblancha,1492975959,,3,14
376,2017-4-24,2017,4,24,6,674stm,United Hackathon,https://www.reddit.com/r/datascience/comments/674stm/united_hackathon/,edimaudo,1492982356,,2,2
377,2017-4-24,2017,4,24,8,675i3k,Anyone going to ODSC East?,https://www.reddit.com/r/datascience/comments/675i3k/anyone_going_to_odsc_east/,spritehead,1492990157,I'm pretty new to data science and don't really know anyone in the field.  I'm attending ODSC East in Boston on May 3rd and wanted to know if anyone else was going and might want to meet up!,6,5
378,2017-4-24,2017,4,24,11,676dzd,What kind of panel data do I have?,https://www.reddit.com/r/datascience/comments/676dzd/what_kind_of_panel_data_do_i_have/,[deleted],1493000660,[deleted],0,1
379,2017-4-24,2017,4,24,17,677tlw,Data science online training courses and certification in pune,https://www.reddit.com/r/datascience/comments/677tlw/data_science_online_training_courses_and/,hadoop_training,1493022667,,1,1
380,2017-4-24,2017,4,24,17,677v91,Kalman Filtering of time series: a tutorial?,https://www.reddit.com/r/datascience/comments/677v91/kalman_filtering_of_time_series_a_tutorial/,EveryOpenEyes,1493023514,"Hey guys,


I have a set of time series with missing values and I am trying to understand how Kalman filters work for inferring these values. I cannot find a simple introduction to this issue could you share one if there is any?


Thank you!",7,30
381,2017-4-24,2017,4,24,19,678bvs,Building and Exploring a Map of Reddit with Python [x-post r/Python],https://www.reddit.com/r/datascience/comments/678bvs/building_and_exploring_a_map_of_reddit_with/,lmcinnes,1493031458,,0,15
382,2017-4-24,2017,4,24,21,678url,Feature importance and why its important,https://www.reddit.com/r/datascience/comments/678url/feature_importance_and_why_its_important/,Weenkus,1493038528,,5,5
383,2017-4-24,2017,4,24,22,6796hq,Question regarding using both R and Python,https://www.reddit.com/r/datascience/comments/6796hq/question_regarding_using_both_r_and_python/,SecretAgentZeroNine,1493042201,"Preface: I've not done Machine Learning yet

What are the pitfalls of using R for Statistical and Probability analysis, visualizations, and reporting while using Python exclusively for Machine Learning, scraping, and Natural Language Processing?

Do I need to know how to do statistics and probability with Python to do the things I've mentioned?

Would calling R when coding ML work?",5,4
384,2017-4-24,2017,4,24,22,6796vy,Exploring Data Skeptic downloads with Periscope Data,https://www.reddit.com/r/datascience/comments/6796vy/exploring_data_skeptic_downloads_with_periscope/,sam535,1493042328,,0,7
385,2017-4-24,2017,4,24,23,6798pu,Learning about Blockchain and its relevance to Data Science leaders,https://www.reddit.com/r/datascience/comments/6798pu/learning_about_blockchain_and_its_relevance_to/,PaulLaughlin,1493042813,,3,2
386,2017-4-24,2017,4,24,23,679a3g,Utilising epidemic modelling to improve advertising click rates on Facebook in networkx,https://www.reddit.com/r/datascience/comments/679a3g/utilising_epidemic_modelling_to_improve/,padam0,1493043209,,0,1
387,2017-4-25,2017,4,25,0,679s2a,"Starting an internship in data science soon, what can I learn before I start?",https://www.reddit.com/r/datascience/comments/679s2a/starting_an_internship_in_data_science_soon_what/,crazypond,1493048061,"Hello, let me begin my saying I'm a junior in college currently working on a CS degree and I was offered an internship position for the summer in the Data Science department of a very large health organization. I've been doing a bit of research on what Data Science really is, as I was quite clueless before. To preface, I have a good knowledge of C and fairly good knowledge of Python (I've built a couple web crawlers and smallish scripts/petty programs for fun). So I have a somewhat decent grasp of programming but I know data science is a whole different ballgame.

I really want to do my best to not be the incompetent newbie who'll need everything explained to him(although I'm sure I'll still need alot to be explained) but I would like to have some miniscule advantage where I could at least say ""Oh, I've learned a bit about that"" so I'm not completely clueless. Basically, what books van I read, what projects can I work on, what software or languages should I learn, so my supervisor can look at me and say ""hey this kid's done his homework."" 

I'd contact my supervisor directly to ask him ahead of starting this internship but the recruiter told me they'd give me that info a few weeks before the job starts in early June. So in the meantime I'd like to get a leg up,if possible, and I was hoping maybe sone fellow data scientists/supervisors could tell me what they'd recommend a new recruit to do/learn.

Any feedback is appreciated, thank you.

Tldr: starting data science internship, what can I learn to ""be ahead"" of expectations?",8,3
388,2017-4-25,2017,4,25,0,679ukg,"Data scientists, what is your average day like?",https://www.reddit.com/r/datascience/comments/679ukg/data_scientists_what_is_your_average_day_like/,yoshisucked,1493048696,,6,1
389,2017-4-25,2017,4,25,2,67anrc,Request: Feedback on my resume for data science positions,https://www.reddit.com/r/datascience/comments/67anrc/request_feedback_on_my_resume_for_data_science/,captnpepsi,1493056001,"If someone has the time could I please ask for some feedback on my resume?  I am currently trying to land a job in data science.   Any input would be appreciated - especially from those working in the field who are used to looking at resumes from candidates!

Currently my plan is to continue applying and if that doesn't take me anywhere in a few weeks then I would begin taking a serious look at these data science bootcamps in addition to building an app that uses image recognition to do something neat. 
 
I built my resume as a guess for what employers want to see - but i may not be emphasizing or describing my experience the best way I could be. 

again many thanks in advance for any that could help out!

Links to my resume can be found below:

https://www.scribd.com/document/346181495/AC-Resume-English-Data-Incubator
https://www.scribd.com/document/346181492/AC-Resume-English-March-2017

I have two different versions - one emphasizes computational aspects and is a 1 pager versus the longer one which uses more general wording and is two pages.  

I would only use the longer one in Europe where 2+ pages is oddly the norm... and the 1 pager in the USA",28,7
390,2017-4-25,2017,4,25,3,67axz2,"Illinois fights technical skills gap with courses in data science, analytics, coding",https://www.reddit.com/r/datascience/comments/67axz2/illinois_fights_technical_skills_gap_with_courses/,dannyeuu,1493058559,,1,1
391,2017-4-25,2017,4,25,3,67az4w,Is considering a career change to data science with no coding back experience. Good idea?,https://www.reddit.com/r/datascience/comments/67az4w/is_considering_a_career_change_to_data_science/,yoshisucked,1493058843,[removed],2,2
392,2017-4-25,2017,4,25,3,67b07i,Building a dataset of funny alternate names,https://www.reddit.com/r/datascience/comments/67b07i/building_a_dataset_of_funny_alternate_names/,jpsky,1493059093,"You know those funny alternate names for things, like snake --&gt; [danger noodle](http://i.onionstatic.com/avclub/5766/80/16x9/960.jpg), kleenex --&gt; nose towel, bumblebee --&gt; fuzzy nope, etc? Would it possible to scrape the web for these kind of lists/memes and build out a ""funny alternate name thesaurus"" as a dictionary dataset, where each key is a normal word and its values are funny alternate names?",3,1
393,2017-4-25,2017,4,25,4,67b7fe,Jonathan Whitmore | Mental Models to Use and Avoid as a Data Scientist,https://www.reddit.com/r/datascience/comments/67b7fe/jonathan_whitmore_mental_models_to_use_and_avoid/,_alphamaximus_,1493060891,,0,3
394,2017-4-25,2017,4,25,4,67bb70,What is the best data science bootcamp?,https://www.reddit.com/r/datascience/comments/67bb70/what_is_the_best_data_science_bootcamp/,yoshisucked,1493061840,,22,40
395,2017-4-25,2017,4,25,4,67bbia,Hands On Python and R In Data Science,https://www.reddit.com/r/datascience/comments/67bbia/hands_on_python_and_r_in_data_science/,rvarinder,1493061922,,1,1
396,2017-4-25,2017,4,25,5,67bvmu,Finding balance in your ETL strategy,https://www.reddit.com/r/datascience/comments/67bvmu/finding_balance_in_your_etl_strategy/,FractalData,1493067108,,0,0
397,2017-4-25,2017,4,25,8,67cvlv,Is non-data science programming experience helpful?,https://www.reddit.com/r/datascience/comments/67cvlv/is_nondata_science_programming_experience_helpful/,Chu_BOT,1493077181,"I'm trying to learn data science but I have a few project ideas in mind that I think would be fun to work on (a game and a web extension). Specifically, I want to gain experience collaborating on programming projects and writing more object oriented code (most of my data driven code has been fairly lacking in the object oriented department).

Would this kind of experience be useful or valuable or is it a waste of time?",6,4
398,2017-4-25,2017,4,25,9,67d9p6,I was just offered a data science internship that I don't feel I'm qualified for. Is this a cause for concern or imposter syndrome?,https://www.reddit.com/r/datascience/comments/67d9p6/i_was_just_offered_a_data_science_internship_that/,LuckyButStupid,1493081406,"For background, I'm a senior graduating with a somewhat technical degree (MIS) and a weak quantitative background (through Calc I and stats 1 &amp; 2 but for business so not much math in it). I've been interested in working in data for a while and for my senior year created a self-guided yearlong project that dealt with data analysis but not really statistical analysis or machine learning (data journalism). 

I applied to this data science internship on a whim and had one interview. They liked me and were aware that I'm an undergrad who is competing against masters students. One of the interviewers had just started working there as a director of what will be their data science/analysis department. He mentioned that what's important isn't what you know but how well you can learn on the job and work through problems. 

I'm planning on accepting the internship because I figure the worst that can happen is that I'm not qualified and they realize they made a mistake and cut their losses at the end of the internship. Is feeling extremely underqualified normal or should I be worried?",9,10
399,2017-4-25,2017,4,25,10,67dix7,"For current data scientists: How many people are on your team, and what demographics like? Also how would you rate the workload and stress level of your job? Any/all insight is much appreciated!",https://www.reddit.com/r/datascience/comments/67dix7/for_current_data_scientists_how_many_people_are/,[deleted],1493084259,[deleted],0,2
400,2017-4-25,2017,4,25,12,67e82z,"For current data scientists: How many people are on your team, and what are the demographics like? Also how would you rate the workload and stress level of your job? Any/all insight is much appreciated!",https://www.reddit.com/r/datascience/comments/67e82z/for_current_data_scientists_how_many_people_are/,alcapwne,1493092576,"Since I graduated I have had 1 job as a software developer at a Fortune 100 company, so I don't really have any experience working with different types of companies. I would say that my job's workload/stress level is extremely low. I believe this is due to fact that the company is not a tech company, and also because the company is so big that everything moves really really slowly and the rate that my team and I can finish our work is much faster than the snail's pace at which they give it out.",6,4
401,2017-4-25,2017,4,25,14,67ekzv,Manage Query Workloads with Query Monitoring Rules in Amazon Redshift http://bit.ly/2pfXxGb,https://www.reddit.com/r/datascience/comments/67ekzv/manage_query_workloads_with_query_monitoring/,hadooparticles,1493097391,[removed],0,1
402,2017-4-25,2017,4,25,15,67ez09,How Big Data is transforming benefits and rewards,https://www.reddit.com/r/datascience/comments/67ez09/how_big_data_is_transforming_benefits_and_rewards/,sodexoph,1493103533,,0,1
403,2017-4-25,2017,4,25,17,67f9fh,Basic Question on Cross Validation! Help!,https://www.reddit.com/r/datascience/comments/67f9fh/basic_question_on_cross_validation_help/,peenta1410,1493108562,"I am doing a classification task, the data is heavily imbalanced. 
I divided the whole data set into 5 folds using stratified folds and then did cross validation by training on 4 folds and testing on 1, repeating this 5 times , so by the end of cross validation i have 5 ROC curves AUC. Now basically i have 5 models with somewhat varying performance. Now whats the next step? How should i chose the model to go into production? ",25,3
404,2017-4-25,2017,4,25,17,67fafk,MLJAR: Machine Learning in your browser,https://www.reddit.com/r/datascience/comments/67fafk/mljar_machine_learning_in_your_browser/,pp314159,1493109085,,6,4
405,2017-4-26,2017,4,26,0,67hbl4,Anyone know any good resources for coding Gradient Descent / Ascent by hand in Python?,https://www.reddit.com/r/datascience/comments/67hbl4/anyone_know_any_good_resources_for_coding/,ketchupisfruitjam,1493134668,"Although it runs under the hood on most SKlearn models, there are times where it's nice to get some slight differences in speed or a few percent decrease in error rate by coding it out by hand. I did it last week and it took about a week - I need some help figuring out how to be more efficient - does anyone have any ipynbs or good articles on coding out GD in Python?",4,7
406,2017-4-26,2017,4,26,0,67hc57,How would I go about addressing sampling for a major class imbalance for topic modeling for modelling in SKlearn?,https://www.reddit.com/r/datascience/comments/67hc57/how_would_i_go_about_addressing_sampling_for_a/,drunklemur,1493134815,"I'm unable to use SMOTE in a pipeline and I want to plug into a Gridsearch. What's the best way to choose a sample with say 10 articles with y = 1 out of 1000 for a training set where I want to make it say 100/1000? 

Should it matter?",2,4
407,2017-4-26,2017,4,26,2,67hyxi,How to combine LDA and WordVec feature vectors for classification?,https://www.reddit.com/r/datascience/comments/67hyxi/how_to_combine_lda_and_wordvec_feature_vectors/,thecity2,1493140505,"One option is to create two separate models and average (in whatever way works best) the predictions for each. Another way is to concatenate the vectors generated from each model, but this could be problematic, since LDA produces a probability vector, whereas WordVec does not. Should I softmax the WordVec vector first? ",4,3
