,date,year,month,day,hour,id,title,full_link,author,created,selftext,num_comments,score
335,2015-6-17,2015,6,17,3,3a2crl,Bayesian Dark Knowledge &lt;paper by Kevin Murphy's group at Google &gt;,https://www.reddit.com/r/MachineLearning/comments/3a2crl/bayesian_dark_knowledge_paper_by_kevin_murphys/,muktabh,1434477981,,0,18
336,2015-6-17,2015,6,17,3,3a2d5f,I redrew the Scikit-learn algorithm cheat sheet in a more minimal style.,https://www.reddit.com/r/MachineLearning/comments/3a2d5f/i_redrew_the_scikitlearn_algorithm_cheat_sheet_in/,groovesnark,1434478153,"Hey, everyone. I've seen this[ Scikit-learn cheat sheet/flow chart](http://peekaboo-vision.blogspot.com/2013/01/machine-learning-cheat-sheet-for-scikit.html) a while back from Andreas Mueller. And while I liked the general principle, I disliked the design. To me, it was rather difficult to read. So I fired up Illustrator and drew a cleaner version. I thought someone out there might appreciate it so here it is:

http://i.imgur.com/ryOuViG.png",7,9
337,2015-6-17,2015,6,17,3,3a2erh,Introduction to Neural Machine Translation with GPUs (Part 2),https://www.reddit.com/r/MachineLearning/comments/3a2erh/introduction_to_neural_machine_translation_with/,clbam8,1434478787,,0,12
338,2015-6-17,2015,6,17,4,3a2lku,"High Schooler getting into AI, how should I get started?",https://www.reddit.com/r/MachineLearning/comments/3a2lku/high_schooler_getting_into_ai_how_should_i_get/,moinnadeem,1434481579,"Hey! 

I'm a rising senior attempting to get started in AI. I've been programming since the fifth grade, and am now researching Intelligent Agents at my local university. What would be the best thing for me to get started doing on a hands on level? My professor has me reading ""AI: A Modern Approach"", but I also want to get coding soon. Any suggestions on what to get started with would be really appreciated, thanks! ",5,1
339,2015-6-17,2015,6,17,4,3a2moo,Better understanding MarI/O,https://www.reddit.com/r/MachineLearning/comments/3a2moo/better_understanding_mario/,neanderslob,1434482028,"Hi all, there's a fantastic video that's been floating around of teaching a program how to play Super Mario via neuroevolution.  Check it out here (worth it): https://www.youtube.com/watch?v=qv6UVOQ0F44  Anyway, the narrator gives a basic overview of the neural network involved but I feel like a couple things are left unexplained.  I'm wondering if anyone can shed some light on them.

In particular, my confusion seems to center around MarI/O's negotiation of obstacles (black squares).  In the video it's mentioned (at least in one instance) that a black square triggers a jump, but I can't imagine this is hard-coded (and doesn't seem to be based on the video).  

Below I have some hypotheses as to how certain aspects of the learning algorithm work that seemed to be glossed over on the video.  I'd love to hear what everyone's thoughts are on them.

1)  When MarI/O is hit/killed by an object, the program iterates over random possible earlier points to jump until he lands on the ground with a new threshold of fitness (and therefore has successfully negotiated the obstacle).

2)  When he reaches a new fitness level after negotiating an obstacle, his right/left movement is randomized again until he re-discovers how to increase fitness (move right) after jumping.

3)  Once he successfully negotiates an obstacle, he puts this technique in his ""obstacle negotiation bag-o-tricks.""  Upon seeing another obstacle, he iterates through his learned tricks.  If none work, he resorts to the iterations described in Item 1 to find a new jump-point that will achieve maximum fitness.  Once he finds one that works, he adds it to his memory to try in the future.

Finally, the video never described what constituted a species or genome.  I'm guessing the genome refers to an individual sequence of commands that can be combined randomly to search for fitness gains, a species is a collection of different genomes that randomly combine.  I'm further guessing that genomes cannot combine across different species.  Finally, generation is one iteration of intra-species genome combinations, across all species.  If this is true, I wonder the following: what marks the creation of a new genome within a species and a new species within a generation?

Anyway, if any of the above makes sense, feel free to let me know your thoughts.  If you actually have read the paper on this type of neuroevolution please feel free to give a definitive answer.  If (like me) you haven't but have thoughts about the above assumptions/questions please share those too.  ",7,1
340,2015-6-17,2015,6,17,4,3a2qj7,How to generalize prediction performance to further data?,https://www.reddit.com/r/MachineLearning/comments/3a2qj7/how_to_generalize_prediction_performance_to/,ienaplissken,1434483659,"Let's suppose we are training a model (say a ConvNet for image classification) to fit a dataset. After the proper splitting into train, validation and test sets, we train the net and obtain a certain accuracy, e.g. 80% on the test set. Let assume a test set with an appropriate size (not noisy).

Now, more data are coming, and our deployed net classify them with much smaller accuracy, say 50%. The images, of course, belong to the same classes of the original dataset, but they clearly have not the same distribution.

Is it a ""normal"" behavior, an implicit dataset bias? We can of course expand our dataset with the incoming new data, but is it the right thing to do? Or am I missing something?",5,1
341,2015-6-17,2015,6,17,4,3a2ssn,What is the best tool for ANN building?,https://www.reddit.com/r/MachineLearning/comments/3a2ssn/what_is_the_best_tool_for_ann_building/,redlikeazebra,1434484586,"I like matlabs toolbox and easy to use matrix manipulations, deployability, but I am unsure of the commonplace software used by the experts.",7,0
342,2015-6-17,2015,6,17,5,3a2yvf,New ML &amp; Data Science Platform!,https://www.reddit.com/r/MachineLearning/comments/3a2yvf/new_ml_data_science_platform/,pr_lumi,1434487108,,0,0
343,2015-6-17,2015,6,17,6,3a39ta,Video labeling tools?,https://www.reddit.com/r/MachineLearning/comments/3a39ta/video_labeling_tools/,basicbean3,1434491760,"Are there any decent semi-automatic tools for video segmentation and labeling?

I am thinking of something that would allow to select object boundary (kinda like Photoshop's ""magic wand"") in the first frame, choose a label for it, then propagate the boundaries forward in the sequence while allowing the user to make corrections.",2,0
344,2015-6-17,2015,6,17,8,3a3idr,Speech Recognition from Brain Activity,https://www.reddit.com/r/MachineLearning/comments/3a3idr/speech_recognition_from_brain_activity/,Noncomment,1434495688,,1,0
345,2015-6-17,2015,6,17,8,3a3m0o,Real-Time Object Detection With YOLO,https://www.reddit.com/r/MachineLearning/comments/3a3m0o/realtime_object_detection_with_yolo/,pjreddie,1434497539,,15,14
346,2015-6-17,2015,6,17,8,3a3n47,Deep learning for cannabis strain identification. Deep convolutional networks at it again.,https://www.reddit.com/r/MachineLearning/comments/3a3n47/deep_learning_for_cannabis_strain_identification/,jimmie21,1434498122,,7,1
347,2015-6-17,2015,6,17,15,3a4x8t,Beam search,https://www.reddit.com/r/MachineLearning/comments/3a4x8t/beam_search/,bge0,1434523572,So I have read a few papers that refer to this concept of matching the outputs of rnn encoders to decoders. What exactly is this? Is it just linear search on some subset?,12,2
348,2015-6-17,2015,6,17,16,3a4zuh,How much of an effect does colorspace have on image recognition networks?,https://www.reddit.com/r/MachineLearning/comments/3a4zuh/how_much_of_an_effect_does_colorspace_have_on/,quadrapod,1434525678,"Machine learning isn't really my forte but I've been curious, it would seem to me at least that as humans since we get so much more information out of luminescence than we do from color that our images would all be better understood and recognized in YCbCr than RGB.  Simply because we're more likely to vary distort or drop color information than we are luminescence information.  Is there any merit to this theory, and likewise has anyone actually done work on this and compared various matching confidences in deep neural networks taught in differing colorspaces. 
",2,0
349,2015-6-17,2015,6,17,16,3a50jb,[1506.02626] Learning both Weights and Connections for Efficient Neural Networks,https://www.reddit.com/r/MachineLearning/comments/3a50jb/150602626_learning_both_weights_and_connections/,[deleted],1434526224,,0,1
350,2015-6-17,2015,6,17,16,3a50zj,Chances for Acceptance into ML Ph.D. Program,https://www.reddit.com/r/MachineLearning/comments/3a50zj/chances_for_acceptance_into_ml_phd_program/,mlQuestionThrowaway,1434526616,"I'm an Electrical &amp; Computer Engineering Masters student at a large private school in the US that's well known, although not for its engineering program. I am wondering what my chances are of ever being able to attend a top 15 ML Ph.D. program given the following:

1. My M.S. thesis involves statistics, signal processing, and a small bit of machine learning. It is good research, not ground-breaking, but it is a novel application of statistical techniques in its particular domain.
2. I am the primary author on one regional IEEE conference paper, and a secondary author on a national IEEE conference paper. However, neither papers are in the machine learning field. 
3. I am in the final stages of writing the first draft of a stats-heavy signal processing journal article, but its acceptance is far from a guarantee.
4. My GRE scores were 97% for verbal, 86% for quant., and 80% for writing.
5. My GPA is a 3.9, and my undergraduate GPA (at the same school) was a 3.28.
6. My programming work is about 50/50 split between Python and Matlab, and I'm comfortable in both.

I will graduate in May of 2016. I am debating either continuing into Ph.D. straightaway or entering industry for a while. I'm looking to determine how crazy it would be for me to apply for some top ML schools, or if I should save my money, time, and dignity and play it a little more safely.

/r/machinelearning, what are my chances of ever being able to enter an excellent ML graduate program, now or in the future? Are there any steps beside what I've listed that I should be taking at this point to help me achieve this goal? Is there prejudice against applicants who have waited a while to continue on to get their doctorate? I'm assuming next May is my most likely time to get accepted into any form of Ph.D. program, but I'm looking to crowdsource confirmation of my intuition. ",8,0
351,2015-6-17,2015,6,17,17,3a549t,"Tonight: Paris Machine Learning Meetup #10 Season 2 Finale: ""And so it begins"": Deep Learning, Recovering Robots, Vowpal and Hadoop, Predicsis, Matlab, Bayesian test, Experiments on #ComputationalComedy &amp; A.I.",https://www.reddit.com/r/MachineLearning/comments/3a549t/tonight_paris_machine_learning_meetup_10_season_2/,compsens,1434529543,,4,9
352,2015-6-17,2015,6,17,21,3a5lpi,Facial-recognition talks collapse over privacy issues - BBC News,https://www.reddit.com/r/MachineLearning/comments/3a5lpi/facialrecognition_talks_collapse_over_privacy/,organic-neural-net,1434543466,,0,23
353,2015-6-17,2015,6,17,21,3a5med,"Ambulance Service, Data in Search of a Question",https://www.reddit.com/r/MachineLearning/comments/3a5med/ambulance_service_data_in_search_of_a_question/,Simusid,1434543934,"I am brand new to ML and I've been self-learning via the Andrew Ng videos.   I work at an ambulance service and have a dump of 10k ambulance run data (non-HIPAA data) that consists of:

* date/time for dispatch, arrival on scene, departure from scene, arrival at hospital
* odometer mileage (we bill per mile)
* incident priority 1 (life threat), 2 (serious), 3 (normal), 4 (no transport)
* call reason (selection from a pre-populated list)
* Destination hospital (one of about 6)
* clinical impression (pp list but different from call reason)
* age/sex of patient

So I have two goals.  First, I want to understand some ML tools and how I can properly use them.   Second, and maybe more important, I would love to get some operational insight into our ambulance organization.  That is, I would love to discover some new fact that is hidden in our data that I can use to make an improvement in our service.

Obviously we have no control over when 911 will be called.   But we do know that we get 7 calls per day on average, and it is essentially a poisson process.  We ""bin"" the call count per hour and know our peak demand and slow times per day.   Our ""analysis"" is very rudimentary and mostly done with excel.  

I would be interested if anyone has any suggestions for research questions based on this data that are suitable for an ML topic.  ",2,5
354,2015-6-17,2015,6,17,23,3a63gn,Anomaly Detection in a Single Command Line,https://www.reddit.com/r/MachineLearning/comments/3a63gn/anomaly_detection_in_a_single_command_line/,osroca,1434553026,,0,1
355,2015-6-18,2015,6,18,0,3a676r,Aerosolve: Machine learning for humans,https://www.reddit.com/r/MachineLearning/comments/3a676r/aerosolve_machine_learning_for_humans/,It_Is1-24PM,1434554675,,0,2
356,2015-6-18,2015,6,18,1,3a6cnf,ZEN-RRNN - On Meditation &amp; Machines,https://www.reddit.com/r/MachineLearning/comments/3a6cnf/zenrrnn_on_meditation_machines/,samim23,1434557049,,1,0
357,2015-6-18,2015,6,18,1,3a6efs,Brain-to-text: decoding spoken phrases from phone representations in the brain,https://www.reddit.com/r/MachineLearning/comments/3a6efs/braintotext_decoding_spoken_phrases_from_phone/,xamdam,1434557801,,0,6
358,2015-6-18,2015,6,18,1,3a6fem,Decided on ML as a learning topic for my vacation. What books does MLReddit recommend?,https://www.reddit.com/r/MachineLearning/comments/3a6fem/decided_on_ml_as_a_learning_topic_for_my_vacation/,pure_x01,1434558226,"When i'm on vacation i like to spend some time learning and this time i decided on ML. I would like books that covers the following topics:

* An overview of the recent advancements and the different areas
* Machine Learning
* Data Mining
* Text Extraction
* Any other recommended books

If they are available on kindle it would be nice :-)

Thanks",6,3
359,2015-6-18,2015,6,18,2,3a6kox,Is there an area where neural networks work best?,https://www.reddit.com/r/MachineLearning/comments/3a6kox/is_there_an_area_where_neural_networks_work_best/,ModerateEntropy,1434560484,"**[edit] Please, take this as a question born from honest curiosity. It seems some people thought I'm looking down on NNs, and that's not the case.**

This is kind of general, but recently I went to a conference where someone had this quote in her presentation:
""Neural networks will one day rule the world (Kurzweil, 1999)""

This got me wondering if presently, after 16 years of that statement being made, there is any type of problem/application where neural networks performance is really superior to other methods.
I have worked for a few years in classification, and neural networks where never the optimal solution to any of my tasks.

What's your input or experience about this?
",17,2
360,2015-6-18,2015,6,18,2,3a6lw2,(theoretical fun post) what would it take for a vision-language system to explain visual irony?,https://www.reddit.com/r/MachineLearning/comments/3a6lw2/theoretical_fun_post_what_would_it_take_for_a/,Articulated-rage,1434561015,,21,38
361,2015-6-18,2015,6,18,2,3a6q18,Does modeling with Random Forests requre cross-validation?,https://www.reddit.com/r/MachineLearning/comments/3a6q18/does_modeling_with_random_forests_requre/,srkiboy83,1434562781,"As far as I've seen, opinions tend to differ about this. Best practice would certainly dictate using cross-validation (especially if comparing RFs with other algortihms on the same dataset). On the other hand, the original source states that the fact OOB error is calculated during model trainig is enough of an indicator of test set performance. Even Trevor Hastie, in a relatively recent talks says that ""Random Forests provide free cross-validation"". Intuitively, this makes sense to me, if training and trying to improve a RF-based model on one dataset.

So, what's MLReddit's opinion on this?

",4,4
362,2015-6-18,2015,6,18,3,3a6uh7,Where to get started with AI/machine learning?,https://www.reddit.com/r/MachineLearning/comments/3a6uh7/where_to_get_started_with_aimachine_learning/,RedditBazinga,1434564584,I understand the basics of programming and have a degree in mathematics. Is there any programming language that is recommended? Where would I get started in general?,2,0
363,2015-6-18,2015,6,18,3,3a6unu,IBM Working with Spark Creators on Open Source Machine Learning Language/Platform,https://www.reddit.com/r/MachineLearning/comments/3a6unu/ibm_working_with_spark_creators_on_open_source/,[deleted],1434564663,,0,2
364,2015-6-18,2015,6,18,3,3a712u,Launch Karapthy's Char-RNN,https://www.reddit.com/r/MachineLearning/comments/3a712u/launch_karapthys_charrnn/,[deleted],1434567392,,0,1
365,2015-6-18,2015,6,18,4,3a71p5,Is reverse engineering of device drivers with machine learning possible?,https://www.reddit.com/r/MachineLearning/comments/3a71p5/is_reverse_engineering_of_device_drivers_with/,fimari,1434567641,"Is this a thing? Anyone out there who tried that?
Where to start? Webcam, Keyboard, Mouse?",3,1
366,2015-6-18,2015,6,18,5,3a7b5y,ImageNet Data,https://www.reddit.com/r/MachineLearning/comments/3a7b5y/imagenet_data/,Xixiduro,1434571605,"Hello :)

I'm a researcher and i'm trying to get imagenet dataset to make experiments in deep learning for my masters degree. I already search in web but i can't find the data.

I made some experiments using the training model available in caffe framework with cool results, however i don't need that amount of classes and i want to implement my own network

If anyone know a repository or a direct link to download the raw data i will be grateful.

Thanks ",1,0
367,2015-6-18,2015,6,18,5,3a7fxt,Launch Karpathy's Char-RNN,https://www.reddit.com/r/MachineLearning/comments/3a7fxt/launch_karpathys_charrnn/,tfimg24,1434573662,,0,0
368,2015-6-18,2015,6,18,5,3a7gxy,More data always better than better algorithms? by Xavier Amatriain,https://www.reddit.com/r/MachineLearning/comments/3a7gxy/more_data_always_better_than_better_algorithms_by/,tomtung,1434574092,,0,0
369,2015-6-18,2015,6,18,6,3a7jpl,Picked up this as I'm interested in sentiment-analysis I'm finding it worth-while perhaps others here will too. Just published by Cambridge.,https://www.reddit.com/r/MachineLearning/comments/3a7jpl/picked_up_this_as_im_interested_in/,theirfReddit,1434575249,,0,0
370,2015-6-18,2015,6,18,6,3a7mol,"Best tools for GLMNET, GAMs and Mixed Effects Models on Large Data?",https://www.reddit.com/r/MachineLearning/comments/3a7mol/best_tools_for_glmnet_gams_and_mixed_effects/,NotAHomeworkQuestion,1434576517,"I have 10,000 features (the vast majority are sparse) measured on 1,000,000 samples. For different applications Ill need to use GLMNET, generalized additive models and mixed effects models. Options Ive found so far:

R: reading this matrix into R obviously doesnt work. Theres the sparse matrix option in the Matrix package which I know glmnet and lmer4 can use (not sure about any of the gam packages). However Matrix doesnt seem to have a way of loading from a file that isnt in some special format. Even if I do go to the hassle of converting it, Im not sure whether these functions will be able to handle data of this size in a reasonable time frame. Does anyone have thoughts about loading and runtimes in this regard?

H2O: Ive been using this through R. Its buggy as hell (both versions 2 and 3) but managed to get GLMNET to give me something reasonable (though I have trouble completely trusting it given the flagrant bugs in simpler munging functions). Theres no support for GAMs or mixed effects.

Other popular options like Python, Spark, etc. dont seem to support anything but the most basic of stats/ML models.

Would something like Stan (Gelmans new version of BUGS) work? Is the R Matrix package capable of handling this? Are there other options people are aware of that would work? I cant believe theres nothing out there given how frequently this problem must come up.",1,1
371,2015-6-18,2015,6,18,6,3a7omn,HarlMCMC Shake,https://www.reddit.com/r/MachineLearning/comments/3a7omn/harlmcmc_shake/,polylogarithmic,1434577332,"Youtube videos comparing Metropolis Hastings to other sampling techniques, all to the tune of **Harlem Shake**!

**Original:** 

* [Metropolis Hastings vs. HMC](https://www.youtube.com/watch?v=Vv3f0QNWvWQ)
by [David Duvenaud](http://people.seas.harvard.edu/~dduvenaud/) &amp; [Tamara Broderick](http://people.csail.mit.edu/tbroderick/index.html)


**Follow ups:**

* [Metropolis Hastings vs. Parallel Temporing](https://www.youtube.com/watch?v=J6FrNf5__G0)
by [Dave Campbell](http://people.stat.sfu.ca/~dac5/Dave_Campbell/Dave_Campbell.html)

* [Metropolis Hastings vs. emcee](https://www.youtube.com/watch?v=yow7Ol88DRk)
by [Dan Foreman-Mackey](http://dan.iel.fm)


",1,9
372,2015-6-18,2015,6,18,6,3a7pd6,"Twitter acquires machine learning startup, Whetlab.",https://www.reddit.com/r/MachineLearning/comments/3a7pd6/twitter_acquires_machine_learning_startup_whetlab/,jchaines,1434577654,,0,11
373,2015-6-18,2015,6,18,10,3a8efs,The Unreasonable Effectiveness of Random Forests,https://www.reddit.com/r/MachineLearning/comments/3a8efs/the_unreasonable_effectiveness_of_random_forests/,D33B,1434590025,,30,24
374,2015-6-18,2015,6,18,11,3a8o9o,Question about how to structure a time series (R)NN problem,https://www.reddit.com/r/MachineLearning/comments/3a8o9o/question_about_how_to_structure_a_time_series_rnn/,ekoneko,1434595142,"In the past 5 months or so I have done a lot of reading and learning about ML in general, and neural networks in particular, and I may be able to apply what I've learned in an upcoming project for school (Mech Eng, final year).

I don't have the full spec yet, but it will probably be some sort of time series analysis for prediction and/or anomaly detection.

All of the neural network TS prediction problem discussions I have seen have been N (usually a fairly small number, frequently just one or two) input nodes, a reasonable size input nodes, and a single output node.

But if the problem works out like I think it will, we will need to predict multiple parameters - say 10 or so out of maybe twice that many (that is, we're not predicting ambient temp, humidity, time, etc). Maybe more, maybe less.

So would it make sense to put all of my parameters in to individual input nodes, and have one output node per parameter that I want to predict?

Or should I train multiple nets, each with a single output node?

My brain tells me it should be fine, though may require more hidden units. It's entirely possible that my brain is wrong, as I'm afraid I'm neither a doctor nor a data scientist (P &lt; 0.001). Also, it may end up being a recurrent net, depending on the data. Probably, but I'm not sure yet.

Thanks!

**tl;dr** Simply: is it realistic/workable to have multiple output predicting neurons for time series analysis? Or is there some issue with that design that I haven't come across?",1,0
375,2015-6-18,2015,6,18,11,3a8phr,Inceptionism: Going Deeper into Neural Networks,https://www.reddit.com/r/MachineLearning/comments/3a8phr/inceptionism_going_deeper_into_neural_networks/,LLCoolZ,1434595862,,100,327
376,2015-6-18,2015,6,18,13,3a92p4,Going Deep into Neural Networks - Google,https://www.reddit.com/r/MachineLearning/comments/3a92p4/going_deep_into_neural_networks_google/,john_philip,1434603506,,0,0
377,2015-6-18,2015,6,18,14,3a93ln,Looking to do a ML beginner project on UK election data,https://www.reddit.com/r/MachineLearning/comments/3a93ln/looking_to_do_a_ml_beginner_project_on_uk/,[deleted],1434604085,"Specifically how AV systems would change parliaments makeup. While the simple answer to this is just compare majorities, like in Kaggles Titanic Data, Id like to try ML techniques on it. Perhaps also comparing it with countries that doe have AV.

Im really quite new at this, despite being a physics grad with a final year course in statistical models and hypothesis testing. So if someone could tell me what technique would be most realiable I can read about it and implement. ",0,1
378,2015-6-18,2015,6,18,14,3a945k,Who can/cannot learn programming?? The Data Science Answer,https://www.reddit.com/r/MachineLearning/comments/3a945k/who_cancannot_learn_programming_the_data_science/,varaggarwal,1434604449,,0,0
379,2015-6-18,2015,6,18,14,3a95zg,The History of Machine Learning,https://www.reddit.com/r/MachineLearning/comments/3a95zg/the_history_of_machine_learning/,john_philip,1434605679,,1,3
380,2015-6-18,2015,6,18,15,3a99h5,2015 Global Anti-Electromagnetic radiation fabric performance Tester Industry,https://www.reddit.com/r/MachineLearning/comments/3a99h5/2015_global_antielectromagnetic_radiation_fabric/,janiebmr,1434608164,"2015 Global Anti-Electromagnetic radiation fabric performance Tester Industry Report is a professional and in-depth research report on the worlds major regional market conditions of the Anti-Electromagnetic radiation fabric performance Tester industry, focusing on the main regions (North America, Europe and Asia) and the main countries (United States, Germany, Japan and China) .

Read more details at: http://www.bigmarketresearch.com/global-anti-electromagnetic-radiation-fabric-performance-tester-industry-2015-research-report-market

",0,1
