,date,year,month,day,hour,id,title,full_link,author,created,selftext,num_comments,score
176,2015-6-10,2015,6,10,0,396988,Machine Learning of Software User's Behaviour,https://www.reddit.com/r/MachineLearning/comments/396988/machine_learning_of_software_users_behaviour/,BobBeaney,1433864320,"I am learning about Machine Learning by myself. I have a passable understanding of some common basic Machine Learning algorithms and have seen common examples covered in introductory courses : digit recognition, spam email classification, movie recommender systems and so on. 

I am also quite interested in finding out more about complex software systems that can learn their users behaviour. I am sure that such systems exist (eg I have an Outlook addin that learns how I like to file my emails) but I don't know where to look for more info or even what the right search terms to use. At the heart of the matter I suspect that the same kind of algorithms would be used to learn user behaviour as are used to recognize hand written digits. However I think there are probably other aspects involved (eg how do you create an adaptive ""learning"" user interface that doesn't drive your users crazy) and I would be interested in real experiences and case studies. I suspect that there are journals, forums, websites and blogs that deal with these topics specifically but I am not sure where to look. Can someone point me in the right direction (even if it is to say ""No that kind of thing does not exist"")
",5,0
177,2015-6-10,2015,6,10,2,396o0n,Experience training Support Vector Data Description (SVDD) with counter examples?,https://www.reddit.com/r/MachineLearning/comments/396o0n/experience_training_support_vector_data/,mryanbell,1433870214,"I am currently working on a problem where [SVDD](http://insy.ewi.tudelft.nl/sites/default/files/ML_SVDD_04.pdf) seems like an ideal classification approach. My training data covers the range of my target class pretty well, but I have spotty coverage of the negative class. SVDD will allow me to train a decision boundary that explicitly surrounds the positive class examples in my training set. Anything outside of that enclosed surface should be classified as being a negative example.

Now for my question: Does anyone have any experience training SVDD *including counter-examples?* Tax &amp; Duin discuss this possibility in their paper and it seems useful to me. I *have* counter-examples after all, and even if they don't fully represent the space of all counter-examples, including them in training will still be helpful.

Are there any implementations of SVDD out there that allow for this? There is an [extension to libsvm](http://www.csie.ntu.edu.tw/~cjlin/libsvmtools/) that implements SVDD, but it is not immediately clear to me whether it can handle counter-examples. Will I have to write my own SVDD implementation? Not a big deal if so, but I would prefer to avoid it if something exists already. ",0,0
178,2015-6-10,2015,6,10,4,39793c,Is everything I know about ML/stats outdated?,https://www.reddit.com/r/MachineLearning/comments/39793c/is_everything_i_know_about_mlstats_outdated/,townie92,1433878439,"Came across this article http://www.datasciencecentral.com/profiles/blogs/data-science-without-statistics-is-possible-even-desirable

Almost every point in the article runs counter to what I have learned about stats/ml/data science. I understand that the most salient methods/models vary widely depending on the application and that there are areas where ""new"" statistical techniques work better than ""old"" ones. But the argument that ""old"" statistical techniques are barely used in data science is, to put it mildly, surprising to me.


",12,3
179,2015-6-10,2015,6,10,5,397dma,"Hands on with a simple problem (Rotated OCR Text), advices??",https://www.reddit.com/r/MachineLearning/comments/397dma/hands_on_with_a_simple_problem_rotated_ocr_text/,[deleted],1433880177,"Hello all,

Long time ~~programmer~~ tinkerer (C++, but mostly Matlab with a dab of Python) first time in Neural net.

I followed Andrew Ng's coursera class, to help me get a rudimentary overview of ML concepts. I am halfway through following Geoffrey Hinton's class, which goes into greater details about bits and pieces of NN. I have been through Theano's first tutorials, and feel that I am starting to get a hang of things, though on a Macbook Air, it feels like experimenting will be painful.

I feel I have reached a point where I should start experimenting more and apply some of the techniques covered in Geoffrey Hinton's class. I have selected a simple problem, that of skewed numbers for OCR purposes. Essentially, I would like to OCR text that may have been warped (as in perspective projection) and rotated.

In order to keep the problem simple, I have decided to use a monospace font, with black printed on white. So we are looking at digits ranging from 0-9, with rotation angles ranging from -15 degrees to +15 degrees, and non-uniform scaling ranging from -20% to +20% on the left side and -20% to +20% on the right side of the letters (this whole approach is subject to debate, but I have found this to be most practical to generate test cases and size the search space).

So, if we break this down by single degrees and single %, the search space yields 30 * 40 * 40 for each digit, so a total of 480000 combinations, spread over a grid of w x p (= n) pixels.

Does this mean I need a minimum 480000 x n  inputs?
If I want to use convolutional NN, does this means I need to use this say x 4 or x 16?

What about the hidden layers?

Last bit, regarding outputs: would it be possible to have 10 outputs (for each digits) + 3 (rotation + scale1 + scale2)?

Thanks for any pointers, considerations or other approaches.

PS: Any good books or references on the design of NN (choice of parameters etc..)?






",0,0
180,2015-6-10,2015,6,10,5,397f3z,SparkR will ship with Apache Spark version 1.4,https://www.reddit.com/r/MachineLearning/comments/397f3z/sparkr_will_ship_with_apache_spark_version_14/,gradientflow,1433880769,,3,24
181,2015-6-10,2015,6,10,6,397s62,DeepMind Nature paper question,https://www.reddit.com/r/MachineLearning/comments/397s62/deepmind_nature_paper_question/,[deleted],1433885898,"Stupid question but still looking for clarification: In the Nature paper, why are they using expected values when creating their cost-value function Q? What is it about the atari games that are stochastic? Are there random values being generated in the games, or are they completely deterministic (yet largely complex, state/action space wise). 

Or is the expected value taken just because the user does not know how actions will affect the game? This is a fundamental difference in the way I've traditionally though of stochastic control, that actions affect the * system * by altering transition probabilities and immediate rewards, not through affecting the user's knowledge of these system properties.  Any thoughts are appreciated!

Edit: From the downvotes I'm guessing this is the wrong subreddit for this question, so suggestions for other places to post are appreciated as well!",9,5
182,2015-6-10,2015,6,10,6,397uxi,Developments in deep learning by Geoff Hinton,https://www.reddit.com/r/MachineLearning/comments/397uxi/developments_in_deep_learning_by_geoff_hinton/,ojaved,1433886954,,1,0
183,2015-6-10,2015,6,10,8,39897w,Significant Machine Learning Milestones?,https://www.reddit.com/r/MachineLearning/comments/39897w/significant_machine_learning_milestones/,devDorito,1433893092,"I've been following this sub for a bit and wanted to have a discussion on what you would consider significant milestones have been reached in machine learning.

",29,5
184,2015-6-10,2015,6,10,9,398gtj,Learning to Transduce with Unbounded Memory | The latest publication from Google DeepMind,https://www.reddit.com/r/MachineLearning/comments/398gtj/learning_to_transduce_with_unbounded_memory_the/,mrprint,1433896595,,0,2
185,2015-6-10,2015,6,10,13,3999hj,The Subreddit Simulator - Pure genius.,https://www.reddit.com/r/MachineLearning/comments/3999hj/the_subreddit_simulator_pure_genius/,Dwood15,1433910293,,2,4
186,2015-6-10,2015,6,10,15,399ku2,ELI5 Variational Autoencoders,https://www.reddit.com/r/MachineLearning/comments/399ku2/eli5_variational_autoencoders/,CreativePunch,1433916852,"Hi all,

I have been reading up on variational autoencoders and I am slowly starting to understand it but I was wondering if anyone could give me a good explanation.

I also am particularly lost on the reparametrization trick which seems to be very important for VAE's

Thanks!",4,5
187,2015-6-10,2015,6,10,15,399m06, Why its time for small business to get onboard with machine learning,https://www.reddit.com/r/MachineLearning/comments/399m06/why_its_time_for_small_business_to_get_onboard/,ITmonitoring,1433917612,,0,1
188,2015-6-10,2015,6,10,15,399m14,Using LDA to identify rotated characters,https://www.reddit.com/r/MachineLearning/comments/399m14/using_lda_to_identify_rotated_characters/,jackbrucesimpson,1433917629,"I was reading this [paper](http://ieeexplore.ieee.org/stamp/stamp.jsp?arnumber=4232994) and am interested in trying to use LDA to identify rotated shapes that look like letters. Would the best way to test this idea out be to take a training set of images (30x30 pixels), convert the pixels in each image to a column in a matrix and then perform an LDA on them to see if this can work? I'm interested in LDA rather than PCA because there's a fair bit of variation in the brightness of my characters and Eigenfaces is supposed to not cope too well with this.",0,0
189,2015-6-10,2015,6,10,15,399nv6,China Automotive Heat Exchanger Industry Market Research Report 2014-2018,https://www.reddit.com/r/MachineLearning/comments/399nv6/china_automotive_heat_exchanger_industry_market/,rakeshmrr,1433918883,,0,1
190,2015-6-10,2015,6,10,15,399ooe,Testing image recognition platforms on a famous psychology image.,https://www.reddit.com/r/MachineLearning/comments/399ooe/testing_image_recognition_platforms_on_a_famous/,Noncomment,1433919466,,15,60
191,2015-6-10,2015,6,10,16,399p2q,Visualizing and Understanding Recurrent Networks,https://www.reddit.com/r/MachineLearning/comments/399p2q/visualizing_and_understanding_recurrent_networks/,iori42,1433919725,,1,15
192,2015-6-10,2015,6,10,16,399pde,Path-SGD: Path-Normalized Optimization in Deep Neural Networks,https://www.reddit.com/r/MachineLearning/comments/399pde/pathsgd_pathnormalized_optimization_in_deep/,iori42,1433919928,,3,10
193,2015-6-10,2015,6,10,16,399pdi,How accurate is current object recognition through texture analysis?,https://www.reddit.com/r/MachineLearning/comments/399pdi/how_accurate_is_current_object_recognition/,[deleted],1433919930,"Could you hypothetically tell the difference between a white towel and a white bed sheet purely through image processing? Are there any tools that do this currently?
",0,0
194,2015-6-10,2015,6,10,16,399s29,Deep learning techniques that do NOT rely on gradient descent?,https://www.reddit.com/r/MachineLearning/comments/399s29/deep_learning_techniques_that_do_not_rely_on/,zakou,1433921785,"Are there credible alternatives, i.e. that could approach the state-of-the-art on images or language, but that construct a deep representation in other ways?",13,3
195,2015-6-10,2015,6,10,17,399w7u,Validation set size tradeoffs in NNs,https://www.reddit.com/r/MachineLearning/comments/399w7u/validation_set_size_tradeoffs_in_nns/,ddofer,1433925010,"I've started playing with CNNs (In Lasagne/Keras) - my instinct in general is to use a ""large"" validation set (out of my training data) when training my model. 
However, this means my model is training without all that data! (And makes it ""weaker"" for, say, making a prediction on unknown data for Kaggle :) ). 

I was curious how people work-around this, assuming more data is not available. 

One option would be to select an architecture and number of epochs (i.e hyperparameters) based on the validation error with a large validation set hold-out, then retrain the network with no hold-out data. 
This suffers, in that more training epochs might be needed given the increased amount of data. 

Another option would be to build an ensemble of models trained on the partial data /validation hold-out. This is statistically sound at least, but we're still training weaker models, which is a problem in cases where I suspect that a larger model with more data might be better. It's also VERY expensive computationally, when building CNNs. 

One could also try option 1, but keep a small (e.g. ""1%"") validation set as a ""sanity check"", although this is likely to be biased, and somewhat misses the point. 
 
Any other options? Or am I missing something in how the validation sets are constructed and sampled in training Nets?",2,0
196,2015-6-10,2015,6,10,18,39a05v,Dimensionality reduction at the command line with PCA and t-SNE from Tapkee,https://www.reddit.com/r/MachineLearning/comments/39a05v/dimensionality_reduction_at_the_command_line_with/,cast42,1433928129,,3,0
197,2015-6-10,2015,6,10,19,39a433,[1506.02025] Spatial Transformer Networks,https://www.reddit.com/r/MachineLearning/comments/39a433/150602025_spatial_transformer_networks/,aloisg,1433931051,,8,12
198,2015-6-10,2015,6,10,20,39a8qf,Why does Latent Dirichlet Allocation assume that topics are distributed like a Dirichlet?,https://www.reddit.com/r/MachineLearning/comments/39a8qf/why_does_latent_dirichlet_allocation_assume_that/,cavalierejody,1433934414,"Why do not choose a Gaussian or other distribution?
Thanks",5,2
199,2015-6-10,2015,6,10,20,39ad2c,Free intermediate course in R - Datacamp,https://www.reddit.com/r/MachineLearning/comments/39ad2c/free_intermediate_course_in_r_datacamp/,clbam8,1433937280,,0,0
200,2015-6-10,2015,6,10,21,39ai8q,Chainer: A flexible framework of neural networks for deep learning,https://www.reddit.com/r/MachineLearning/comments/39ai8q/chainer_a_flexible_framework_of_neural_networks/,chaika_user,1433940386,,4,5
201,2015-6-10,2015,6,10,23,39at0y,Cool data mining software!,https://www.reddit.com/r/MachineLearning/comments/39at0y/cool_data_mining_software/,datapablo,1433945765,,0,0
202,2015-6-10,2015,6,10,23,39av5e,"Generating Magic cards using deep, recursive neural networks",https://www.reddit.com/r/MachineLearning/comments/39av5e/generating_magic_cards_using_deep_recursive/,[deleted],1433946712,,11,54
203,2015-6-10,2015,6,10,23,39ax98,Converting continuous data to discrete data for multi-class classification.,https://www.reddit.com/r/MachineLearning/comments/39ax98/converting_continuous_data_to_discrete_data_for/,ThrowawayTartan,1433947625,"Hey everyone!

So I've got a question that isn't directly ML but it's kind of interesting. I've got a set of continuous data associated with movement(e.g running, crawling and so forth) where it's measured in terms of time, and angle of flex.

The way I see it, multi-class classification wouldn't be able to classify things accurately because the data isn't discrete. So, is there a way to convert the continuous data to a discrete form without losing data? I've tried Googling but couldn't find anything that seemed satisfying (the example they were handling was really simple, or there were no replies) Or is there another algorithm/ ML-framework that I should be employing? ",12,0
204,2015-6-11,2015,6,11,1,39bd6y,Call for ML Writers,https://www.reddit.com/r/MachineLearning/comments/39bd6y/call_for_ml_writers/,tfimg24,1433954490,"Hey all,

I'm an editor over at Terminal.com and I posted here a few days ago calling for questions about ML for our writers to field. As I expected we got some thought-provoking responses -- this is a really great community.

I wanted to return and mention that we are always actively seeking out strong, opinionated writers from the ML community (among others). Our founders have a deep background in ML, and it is a large part of the vision for the platform. Articles don't have to be strictly about Terminal (though we certainly like those). As an example, here's one of our more popular posts from the last few weeks.

http://blog.terminal.com/recurrent-neural-networks-deep-net-optimization-lstm/

If you're interested in writing for our blog please drop me a line here or via direct message with a little bit about your background, what you're working on in the field, and a link to some of your writing and I'd be happy to look it over.",0,0
205,2015-6-11,2015,6,11,2,39bo7k,Can softmax be used with cross entropy?,https://www.reddit.com/r/MachineLearning/comments/39bo7k/can_softmax_be_used_with_cross_entropy/,billconan,1433958890,"Hello guys,

sorry for this basic question. I'm following Stanford's machine learning for NLP. but the material for that course isn't easy to understand, so I'm also reading this online book:

http://neuralnetworksanddeeplearning.com/chap3.html

inside this book, it says that sigmoid can be used with cross-entropy. and softmax can be used with log-likelihood cost.

I therefore have the impression that they need to appear in pairs. if the last activation is sigmoid, cross-entropy should be used. if the last activation is softmax, log-likelihood should be used. mixture of softmax with cross-entropy should be avoided, the reason is that you want the derivatives be simple.


But at few different places, the standord material seems to suggest to use softmax with cross-entropy. I just want to confirm that they can be mixed?",4,0
206,2015-6-11,2015,6,11,3,39bqbe,Mahout's SGD Logistic Regression -- can we get the output of scoring to calibrate to probability(event = 1) ???,https://www.reddit.com/r/MachineLearning/comments/39bqbe/mahouts_sgd_logistic_regression_can_we_get_the/,wil_dogg,1433959703,"Hi

We are embedding a simple logistic regression step into our machine learning system so that the output of our Java-based genetic algorithm (GA) can be automatically calibrated to the scale of p(event = 1) where the p_event score will never be outside of the range of (0,1) and will be well calibrated within that range.  The current output of the GA is an interval level vector of scores that rank orders very well and has a nice normal-ish distribution, but the scale is arbitrary and meaningless.  Transforming that to P(event) scale is needed in order to use the score in downstream BI and decision sciences.

Currently we calibrate using SAS PROC LOGISTIC and the usual transformation of the resulting log odds to p_event, but I want to eliminate the I/O step that involves scoring the raw data file, running PROC LOGISTIC, saving the output of that regression, and then writing the equation to get the log odds, and then transforming log odds to probability of event, and then finally saving the data set at the end of that last data step. 

The issue we are running into is that we have implemented Mahout's SGD classifier, which yields final scaling that ranges from 0 to 1, but the calibration is off.  Sometimes it is off by just a little, sometimes it is very far off.  Here's an example of where it is far off:

http://i.imgur.com/eYBF3eK.jpg

DEPVAR_ARTHRITIS is the dependent variable, predicted probability is what we get when we take the score generated by the GA and run it through logistic regression, derive the log odds, and transform to p_arthritis, and MLRP is what we get from implementing Mahout's SGD logistic regression as described on this web page:

http://blog.trifork.com/2014/02/04/an-introduction-to-mahouts-logistic-regression-sgd-classifier/

As you can see the Mahout's value is scaled correctly between 0 and 1 across the entire range of observed scores, but it is not calibrated as well as what we get when we use simple logistic regression in SAS or SPSS.  In fact, the calibration sucks.  The rate of arthritis diagnosis is .62, but the average p_arthritis score coming out of the system is .66.  Ugh.

However, the results vary from case to case.  In this second example, the average value of the output of Mahout's procedure is equal to the actual event rate to the 3rd decimal place, but the calibration is off at both tails of the distribution, relative to the calibration achieved by running the score the GA creates through PROC LOGISTIC and then scaling the log odds to P_OUTCOME.

http://i.imgur.com/SGo9vnC.jpg

We are not beholden to Mahout's SGD method of logistic regression, we just need something that works in Java, that can take the output of what the GA has created that is on an arbitrary numeric scale, and translate that to p_event in a manner that is well calibrated and meaningful / easy to interpret / works every time.  The faster it operates the better.

Any assistance / guidance would be appreciated, am posting here first to give redditors first dibs on a solution but also will follow up with Mahout experts at the various websites if we come up dry here.",0,0
207,2015-6-11,2015,6,11,4,39c1tg,Does anybody know what kind of data the Google Prediction API?,https://www.reddit.com/r/MachineLearning/comments/39c1tg/does_anybody_know_what_kind_of_data_the_google/,[deleted],1433964099,"I working on a job application right now that's asking me to build an example predictive model use the Google Prediction API. My idea was to build a regression model for predicting box office performance for ~20 movies given 1000 tweets for each movie. I'm not sure whats going on under the hood there/if it's gonna do sentiment analysis and regression for me.

Thanks in advance, sorry if this was the wrong place to post this but every other likely sub seemed dead in regards to these kinds of questions.",0,1
208,2015-6-11,2015,6,11,4,39c7jk,Videos of a complete course on Deep Learning by Nando de Freitas (University of Oxford) - 2015,https://www.reddit.com/r/MachineLearning/comments/39c7jk/videos_of_a_complete_course_on_deep_learning_by/,ojaved,1433966290,,7,107
209,2015-6-11,2015,6,11,5,39cb8b,Is it practical to use a trained neural net on novel data in another experiment?,https://www.reddit.com/r/MachineLearning/comments/39cb8b/is_it_practical_to_use_a_trained_neural_net_on/,about3fitty,1433967639,"Trying to understand the boundaries of the transferability of neural nets.

Assuming that the training phase of a neural network takes time and resources, it would be nice to shorten or do away with this step altogether if possible.

What is a situation where you can take a net previously trained by another researcher and use it on novel data? How similar does the data have to be to yield reliable results? Is it more of a gradient that improves with each iteration?

I don't see a lot of researchers taking other nets as a starting point to try and shorten the number of iterations it takes for them to get their neural nets up to speed and I'm wondering why this technique isn't used.

Thanks!",1,1
210,2015-6-11,2015,6,11,5,39cfoe,Kaggle videotutorials for beginners,https://www.reddit.com/r/MachineLearning/comments/39cfoe/kaggle_videotutorials_for_beginners/,[deleted],1433969261,,0,3
211,2015-6-11,2015,6,11,5,39cg10,Cross selling + Classifier modeling strategy?,https://www.reddit.com/r/MachineLearning/comments/39cg10/cross_selling_classifier_modeling_strategy/,rsdenijs,1433969388,"(I repost this from the Data Science stackexchange, which does not seem to have much activity yet)
http://datascience.stackexchange.com/questions/6075/cross-selling-classifier-modeling-strategy

Product A or B can be offered to a customer in a cross-selling setting. Through A/B testing, data was collected about the customers that buy A and those that buy B.

Now there are different ways to model this. We could have two models that model P(buysA; X) and P(buysB; X) and offer the product that we believe has the highest probability of being bought. The problem with this is that it requires well calibrated probabilities.

Another possibility is to use a model that directly chooses between showing A or B. The problem with this case is that there is no direct data where the customer HAD to choose between both, either they were presented with one OR the other.

What would be the sane approach to model this?",0,0
212,2015-6-11,2015,6,11,5,39ch71,word-rnn modification of Andrej Karpathy's char-rnn code (handles UTF8 encoded text input),https://www.reddit.com/r/MachineLearning/comments/39ch71/wordrnn_modification_of_andrej_karpathys_charrnn/,namp243,1433969807,,12,6
213,2015-6-11,2015,6,11,6,39chs8,Bayesian Penalty/Boost Function,https://www.reddit.com/r/MachineLearning/comments/39chs8/bayesian_penaltyboost_function/,whatcausespolitics,1433970029,,0,1
214,2015-6-11,2015,6,11,6,39cqmj,How Airbnb Uses Big Data And Machine Learning To Guide Hosts To The Perfect Price,https://www.reddit.com/r/MachineLearning/comments/39cqmj/how_airbnb_uses_big_data_and_machine_learning_to/,squarerootof-1,1433973402,,0,0
215,2015-6-11,2015,6,11,7,39cs8d,"In implementing sentiment analysis, how do I distinguish between inputs / sequences when training an RNN?",https://www.reddit.com/r/MachineLearning/comments/39cs8d/in_implementing_sentiment_analysis_how_do_i/,[deleted],1433974002,"I'm trying to implement sentiment analysis with an LSTM and when I train it with various inputs and corresponding outputs, the inputs are all associated with the last input's output as if it is all a sequence. Which make sense, it is because of the recurrency.

I came up with a way to turn off the recurrent connections and it works fine, but then it is essentially a single-hidden-layer feed-forward network. There the classification works fine.

I have built a lstm. My plan is to split up the sentence using nlp techniques and then activating separate networks with the adjectives and the emotions. Is there a better way I can do this?

How can I implement sentiment-analysis that can train with a sentence or a paragraph like a review with an rnn?

I'd greatly appreciate any help.",3,0
