,date,year,month,day,hour,id,title,full_link,author,created,selftext,num_comments,score
0,2015-6-1,2015,6,1,10,381033,Prof. Dr. Max Welling explaining Deep Learning,https://www.reddit.com/r/MachineLearning/comments/381033/prof_dr_max_welling_explaining_deep_learning/,booketor,1433122662,,1,0
1,2015-6-1,2015,6,1,13,381hnf,Experiences with Target Propagation?,https://www.reddit.com/r/MachineLearning/comments/381hnf/experiences_with_target_propagation/,alexmlamb,1433131787,"I've been working through this paper on target propagation: 

http://arxiv.org/abs/1407.7906

http://arxiv.org/pdf/1412.7525v3.pdf

I'm wondering if anyone has implemented target propagation and studied the method empirically.  Does anyone have theano code?  Has anyone tried extending the method to RNNs?  ",1,2
2,2015-6-1,2015,6,1,13,381k5n,Is there any package joint training RNN and CNN?,https://www.reddit.com/r/MachineLearning/comments/381k5n/is_there_any_package_joint_training_rnn_and_cnn/,ihacku,1433133260,"For jointly training a RNN/CNN model, one needs to propagate the error from RNN to CNN. I've searched a lot and didn't find any joint RNN/CNN implementation. 

Do I have to scaffold RNNLIB[3] and Caffe[4] myself to do this? Is there any package already implemented this?

Specifically, I need a RNN package with MDLSTM[1] and CTC[2] implemented.

Thanks in advance.


**References:**

[1] A. Graves and J. Schmidhuber. Offline handwriting recognition with multidimensional recurrent neural networks. NIPS 2008, Vancouver, Canada, pp. 545-552.

[2] A. Graves, S. Fernndez, F. Gomez, J. Schmidhuber. Connectionist Temporal Classification: Labelling Unsegmented Sequence Data with Recurrent Neural Networks. ICML 2006, Pittsburgh, USA, pp. 369-376.

[3] http://sourceforge.net/projects/rnnl/

[4] http://caffe.berkeleyvision.org",9,3
3,2015-6-1,2015,6,1,20,382fjd,Sentiment Analysis using SVM,https://www.reddit.com/r/MachineLearning/comments/382fjd/sentiment_analysis_using_svm/,Murium,1433156451,Can anyone please explain me all the steps to classify  a text as positive or negative using SVM in simple words.I fully understood how to classify text using Naive Bayes. I would be very thankful.,5,1
4,2015-6-1,2015,6,1,20,382j8h,Tips for successful email marketing campaigns,https://www.reddit.com/r/MachineLearning/comments/382j8h/tips_for_successful_email_marketing_campaigns/,webseoanalytics,1433158981,,0,1
5,2015-6-1,2015,6,1,21,382n6e,Agrison Tractors,https://www.reddit.com/r/MachineLearning/comments/382n6e/agrison_tractors/,agrison,1433161429,,0,1
6,2015-6-1,2015,6,1,21,382pbq,Training of sentiment data using SVM,https://www.reddit.com/r/MachineLearning/comments/382pbq/training_of_sentiment_data_using_svm/,Murium,1433162648,"ELI5: Please explain the steps to train data for sentiment analysis of text using SVM.
",4,0
7,2015-6-1,2015,6,1,21,382r39,Why invest in Content Marketing,https://www.reddit.com/r/MachineLearning/comments/382r39/why_invest_in_content_marketing/,webseoanalytics,1433163583,,0,1
8,2015-6-1,2015,6,1,22,382srr,"Finally, Machine Learning without Writing Code",https://www.reddit.com/r/MachineLearning/comments/382srr/finally_machine_learning_without_writing_code/,tarpus,1433164403,,0,0
9,2015-6-2,2015,6,2,0,3837g0,Deep Learning algorithm trained to recognize gaze direction with computer-generated dataset,https://www.reddit.com/r/MachineLearning/comments/3837g0/deep_learning_algorithm_trained_to_recognize_gaze/,fabioperez,1433171187,,9,39
10,2015-6-2,2015,6,2,1,383lgd,Reinforcement noob question.,https://www.reddit.com/r/MachineLearning/comments/383lgd/reinforcement_noob_question/,ai_noob,1433176839,"I'm wondering how, in reinforcement learning you would treat multiple outputs during training.  For example let's say I have an agent that can move up, down, left, right.  I am using temporal difference learning with a neural net that has 4 outputs.  One for each direction.  When running the agent if I choose ""up"" and get it's td score from the next iteration.  How do I set the ideal outputs for the backpropagation?  My guess would be to set ""up"" to the ideal score observed and the other 3 directions to their output as to not change any of the weights flowing directly into them.  Is there a better way?  Am I completely off?",7,0
11,2015-6-2,2015,6,2,3,38436k,Robots that can adapt like animals (Nature cover article),https://www.reddit.com/r/MachineLearning/comments/38436k/robots_that_can_adapt_like_animals_nature_cover/,PLOSScienceWednesday,1433183686,,0,3
12,2015-6-2,2015,6,2,3,3843x2,If you could only take 1 data set to a desert island what would it be and why?,https://www.reddit.com/r/MachineLearning/comments/3843x2/if_you_could_only_take_1_data_set_to_a_desert/,DanielSlater8,1433183966,After some interesting data sets and thought this was a fun way to ask...,7,0
13,2015-6-2,2015,6,2,3,3844z9,Noob question on creating a lstm: size of connection from memoryCell to outputLayer is memoryCell count * outputLayer count. Why?,https://www.reddit.com/r/MachineLearning/comments/3844z9/noob_question_on_creating_a_lstm_size_of/,[deleted],1433184375,"I'm trying to build a lstm and I am having an issue with the output-gates. When I make a connection from the memoryCell to the output Layer, the size of that connection is the amount of memoryCells times the amount of output layers. In my case ( 16 * 5 = 80 ). Then when I try to connect the outputGate to the connection of the memoryCell to the outputLayer, I can't as I get an error that the size of the outputGate ( 1 ) and the connection ( 80 ) are not the same.

I'm creating an instance of the lstm like so new lstm(1, 16, 5). 1 input-layers, 16 memoryCells and 5 output-layers. And in that I get the error that the gate can not be made.

     //connections from memory cell
    var output = memoryCell.project(this.outputLayer);
    /*memoryCell has a size of 16 and outputLayer has a size of 5
   the size of output is 80.

    //...

    this.outputGate.gate(output, Layer.gateType.OUTPUT);
    /*how can I create this gate when the size of the gate is 1 and the size of the output is 80?*/

The library I am using is throwing an error that the connection must be from something of the same size to something of that same size. I am able to make an input-gate and forget-gate, but not the output-gate because the size is different. It make sense the size is the same and in the author's implementation of an lstm, he does the same thing, but without an error. However, I'm trying to create my own lstm constructor for learning purposes and I can't figure out how to go beyond or fix this. Don't the sizes need to be the exact same? And I need 5 output layers in this implementation. The author's constructor works with any size output-layers, but mine only does with a size of 1 despite what seems like the same code to me at least. 
",0,0
14,2015-6-2,2015,6,2,4,384bjk,Which architecture of RNN would you recommend for speech recognition?,https://www.reddit.com/r/MachineLearning/comments/384bjk/which_architecture_of_rnn_would_you_recommend_for/,AraneusAdoro,1433186974,,6,1
15,2015-6-2,2015,6,2,4,384ddd,Recommendation Engine Confusion,https://www.reddit.com/r/MachineLearning/comments/384ddd/recommendation_engine_confusion/,GTDinkleberg,1433187683,"I've been assigned the task of creating a recommendation engine to suggest movies and television shows. I'm having a lot of trouble getting started as I've found the volume of material to be overwhelming, and i'm not even sure what language would be the best to use. I was told R might be a good choice (I don't know it, but i heard that it's mostly used for statistics and it has a steep learning curve). I'm not even sure if i might need more than one. I've taken a look at some of andrew ng's material on coursera (linear/logistic regression, and most of the recommender system material) but i'm still not sure how to actual program it either. So, i was hoping you guys could give me some advice on how to get started. What should i focus on learning really well first so i can modify the algorithms appropriately to suit my needs? Would using prediction.io be a good idea? What languages should i look into using, and would R be worth learning for this particular instance? With simulatenous gradient descent for Collaborative filtering, how do you pick a feature scaling constant that will work for both the user rating and the movie feature if they are just arbitrary values initially?

Background: I've had zero experience with machine learning or data science. I'm a third year in college with no classes relating to machine learning taken. 

I'd really appreciate any help at all. Thank You.

Edit: Thanks for the resources, they are very helpful!",3,0
16,2015-6-2,2015,6,2,5,384jtr,What implicit feedback for a news recommender system?,https://www.reddit.com/r/MachineLearning/comments/384jtr/what_implicit_feedback_for_a_news_recommender/,ta-da-scientist,1433190161,"I am working on a content-based recommender system for news articles where users don't give explicit feedback like ratings, so we use implicit feedback.

Here are possible metrics for estimating whether a user liked an article, but don't feel limited to those:

* the user opened the page of the article
* how long did the user keep the tab open
* how long did the user spend reading the article (see how it can be estimated [here](https://medium.com/data-lab/mediums-metric-that-matters-total-time-reading-86c4970837d5))
* the user left a comment (whatever he wrote)
* the user shared the article (or ""liked"" it, sent it by email, ...)

What metrics are usually used? How well do they predict the user's opinion?
Basically, I would like to know which are worth implementing.

I doubt there is a definite answer, so your experience and case studies are welcome.

",2,0
17,2015-6-2,2015,6,2,7,384yvs,Hardware for Machine Learning (x-post r/CompressiveSensing ),https://www.reddit.com/r/MachineLearning/comments/384yvs/hardware_for_machine_learning_xpost/,compsens,1433196171,,0,0
18,2015-6-2,2015,6,2,7,3853z7,How to query ANN with features not in training set?,https://www.reddit.com/r/MachineLearning/comments/3853z7/how_to_query_ann_with_features_not_in_training_set/,desegel,1433198258,"Hi! I'm a noob regarding ML, and I found a nice python library that generally fit my needs:  [NearPy.io](http://nearpy.io).
My features are strings (words).  I could build a occurence-counting vector by it, but how could I search for a new vector that contains strings that are not in the training set?  
The number and order of features would be absolutely different.

Thanks!

(EDIT:  these words/strings are not in natural language so I can't have a corpus)",7,0
19,2015-6-2,2015,6,2,8,385dnd,How to fast-track into entry level AI project/work?,https://www.reddit.com/r/MachineLearning/comments/385dnd/how_to_fasttrack_into_entry_level_ai_projectwork/,BinaryAlgorithm,1433202315,"I've been wondering how to respec certifications to work in AI or related field (possibly also robotics). In a world where employers only seem to look at credentials, I'm unsure what they are looking *for* exactly. I programmed in VB6 for about 15 years (since I was 12), and did some C# and other languages and even assembly, but what I really need is a training experience. I have an MBA instead of a CS degree but I don't have time right now to go re-do my degree (don't feel it's particularly useful at this point compared to real life experiences); I'd rather take a few pertinent training classes or work an internship because that's practical and efficient. I can't seem to find any community here in Reno NV for AI (maybe I need to look nationally and coordinate online, but where/how? I'm not that good at finding it apparently); I have guessed that socialization is the key to finding some opportunity. Right now I just design A-Life simulations at home, but I would like to learn more working on a real AI project. I have a specific interest in intelligent agents / digital organisms and general AI development, but I see most of the work is on narrow AI for vision and other specific problem domains.

I am completely lost at how to find a mentor for this. I originally learned to program because I wanted to make games, so my approach is half art and half science (and I think some creativity and philosophy is necessary in these fields - to think out of the box and design new patterns). Outside a university, I haven't seen where I can get into this. I don't think it's an intractable problem; after all, I can read and learn what I don't know. It's just unlocking an opportunity to learn that is challenging. Does anyone have ideas on where I can go, who I can talk to? What communities have projects I can learn from/participate in? There must be some action I can take to advance, to get help with it (even if just theory discussions)?

I believe AI is what will fundamentally change mankind, and thus is among the most important focus points along with supporting technologies like quantum computers. I am also interested in computer ethics, a very small but important field. I believe I will have ideas to contribute when I encounter new information; I just want the chance to do so.

Thank you for any input regarding this. I feel very lost right now when people keep telling me what I can't do based only on credentials when I know that I can do it with a passion; I can learn, after all ...",5,0
20,2015-6-2,2015,6,2,10,385po4,Transition-Based Dependency Parsing with Stack Long Short-Term Memory,https://www.reddit.com/r/MachineLearning/comments/385po4/transitionbased_dependency_parsing_with_stack/,SuperFX,1433207485,,0,16
21,2015-6-2,2015,6,2,12,3866k1,Extracting data from real estate websites,https://www.reddit.com/r/MachineLearning/comments/3866k1/extracting_data_from_real_estate_websites/,richardbeerd,1433215197,"Hey guys, just discovered /r/machinelearning. I hope this question is relevant to the sub.

I'm trying to find ways of extracting data on home price, #bathrooms, square footage etc. from realtor websites. Does anyone know how I could go about doing this? 

Thanks",5,1
22,2015-6-2,2015,6,2,13,386dgw,[1506.00619] Blocks and Fuel: Frameworks for deep learning,https://www.reddit.com/r/MachineLearning/comments/386dgw/150600619_blocks_and_fuel_frameworks_for_deep/,[deleted],1433218668,,3,16
23,2015-6-2,2015,6,2,13,386hro,6 Common Problems That Can Occur In Your Coffee Machine,https://www.reddit.com/r/MachineLearning/comments/386hro/6_common_problems_that_can_occur_in_your_coffee/,jassicaon,1433221134,,5,0
24,2015-6-2,2015,6,2,14,386kiy,Are there any datasets freely available on which I can test the autocomplete algorithm I have developed?,https://www.reddit.com/r/MachineLearning/comments/386kiy/are_there_any_datasets_freely_available_on_which/,rohanpota,1433222826,,2,0
25,2015-6-2,2015,6,2,14,386lqz,"Best cost function for sparse, real-valued data?",https://www.reddit.com/r/MachineLearning/comments/386lqz/best_cost_function_for_sparse_realvalued_data/,CreativePunch,1433223622,"Hi all,

Suppose the target output of my network is an MxN matrix where 95% of the values are 0.0 and the other values are anywhere between 0.0 and 1.0, what would be a good loss function to use for this data?

As long as my NN outputs a lot of 0's the MSE would be really small, but it has a hard time learning the values properly that are bigger than 0

Any ideas? Thanks!",1,0
26,2015-6-2,2015,6,2,14,386moj,Proceedings of The 32nd International Conference on Machine Learning,https://www.reddit.com/r/MachineLearning/comments/386moj/proceedings_of_the_32nd_international_conference/,cast42,1433224238,,0,19
27,2015-6-2,2015,6,2,15,386njm,Questionable Result on ImageNet Benchmark in Baidu's Deep Image Paper,https://www.reddit.com/r/MachineLearning/comments/386njm/questionable_result_on_imagenet_benchmark_in/,ResHacker,1433224802,,16,53
28,2015-6-2,2015,6,2,15,386ss8,What Factors Increased The Demand of Global and Chinese Oil-Sealed Vacuum Pump Industry 2010-2020 ?,https://www.reddit.com/r/MachineLearning/comments/386ss8/what_factors_increased_the_demand_of_global_and/,profresearchreports,1433228351,,0,1
29,2015-6-2,2015,6,2,18,3873ov,PyData Berlin 2015: Probabilistic Programming and Sports Analytics (Video of presentation of Youtube),https://www.reddit.com/r/MachineLearning/comments/3873ov/pydata_berlin_2015_probabilistic_programming_and/,cast42,1433236654,,1,2
30,2015-6-2,2015,6,2,18,3875rm,Automatic music genre classification using Machine Learning,https://www.reddit.com/r/MachineLearning/comments/3875rm/automatic_music_genre_classification_using/,john_philip,1433238234,,2,5
31,2015-6-2,2015,6,2,19,387741,"[Discuss] To machine learning researchers, this isn't just Baidu's problem",https://www.reddit.com/r/MachineLearning/comments/387741/discuss_to_machine_learning_researchers_this_isnt/,rantana,1433239277,"Machine learning is a wonderful research field. The pace of progress and the applicability to my line of work is so high that I have to keep up with papers that are only months or even weeks old. It's a great feeling to be on the cutting edge in industry. I can't think of any other research field that creates tangible results as fast as this one.

...but please cut the [marginally state-of-the-art](http://www.reddit.com/r/MachineLearning/comments/2wk8yi/discuss_the_elephant_in_the_room_of_machine/) crap. You may think that this recent [Baidu ImageNet retraction](http://www.image-net.org/challenges/LSVRC/announcement-June-2-2015) is just a lapse in moral judgement, but it's part of a bigger issue in the community. 

-Those who participate in writing state-of-the-art in their papers without any statistic showing how significant that number are just as guilty. You're hiding the reproducibility of your research. If it takes too long to run more than one sample, note that in your results.

-Those that consider state-of-the-art as a bar that should be met for publication (especially reviewers) are just as guilty. You're creating an environment that supports this state-of-the-art endemic. Having collarborated with those in research, it clearly pressures researchers in a highly competitive field to run and re-run their analyses with tiny tweaks till they get the result they want.

So those of you that are writing the phrase state-of-the-art in your next papers, think about what it means before writing it. It may seem like a golden ticket to getting your paper published, but stop for a moment and think about how you came to your result. How much effort did you spend on the actual idea and how much did you spend on trying to get it to converge to the number you wanted?

Hal Daume III wrote a [great piece about this issue](http://nlpers.blogspot.com/2014/11/the-myth-of-strong-baseline.html). Here's an excerpt:

&gt;[...] There are lots of ways to be better than such a baseline, and so ""beating"" it does not teach me anything. I always tell students not to get too pleased when they get state of the art performance on some standard task: someone else will beat them next year. If the only thing that I learn from their papers is that they win on task X, then next year there's nothing to learn from that paper. The paper has to teach me something else to have any sort of lasting effect: what is the generalizable knowledge.

&gt; The point is that an evaluation is not an end in itself. An evaluation is there to teach you something, or to substantiate something that I want to teach you. If I want to show you that X is important, then I should show you an experiment that isolates X to the best of my ability and demonstrates an improvement, preferably also with an error analysis that shows that what I claim my widget is doing is actually what it's doing.

To deep learning researchers: Stop throwing all the tricks in the book to push your numbers up (ie dropout, sophisticated optimizers, fancy parameter initialization, dataset augmentation). If you need these tricks to prove your point, then I'm sorry to say you don't have one. Your results are meaningless since you've confounded it with so many other things. **Instead of spending so much effort pushing your method to state-of-the-art performance, how about spending some time simplifying it.** Show that the intuitions you had for your idea is in fact what's happening. Coming from someone on the application side, **if your idea isn't simple to implement or intuitive, no one will use it.** 

Occam's razor has so much truth in this field. There are too many times where I reproduce a result only to find it only works exactly in the conditions described in the paper. This is a great way to waste another person's time.

....In other words, I just want to stop reading crappy papers.......",45,131
32,2015-6-2,2015,6,2,21,387h3a,Real-time image recognition demo?,https://www.reddit.com/r/MachineLearning/comments/387h3a/realtime_image_recognition_demo/,morganKo,1433246563,"Hi everyone,

In order to introduce Machine Learning to non-IT people, I am trying to find a real-time image recognition demo, or something close to that.

I have tried to access to the Stanford Vision Lab demo, but the webpage seems broken (https://cs.stanford.edu/people/karpathy/deepimagesent/rankingdemo/).

I am thinking of trying to run my own https://github.com/karpathy/neuraltalk, but it doesn't seem trivial.

Many thanks for your help!
",1,2
33,2015-6-2,2015,6,2,22,387r5d,Introducing Facebook AI Research Paris,https://www.reddit.com/r/MachineLearning/comments/387r5d/introducing_facebook_ai_research_paris/,mrprint,1433251832,,4,8
34,2015-6-2,2015,6,2,23,387vko,what base classifier/regressors do you use for stacking?,https://www.reddit.com/r/MachineLearning/comments/387vko/what_base_classifierregressors_do_you_use_for/,godspeed_china,1433253905,"As stacking is computational intensive (10 CV or LOO), I think the base classifier must be fast. As I known decision tree and linear regression is that fast. However linear regression is not powerful enough. What classifier do you use for stacking?",1,1
35,2015-6-2,2015,6,2,23,3880fp,Looking for a NLP API to help parse support tickets,https://www.reddit.com/r/MachineLearning/comments/3880fp/looking_for_a_nlp_api_to_help_parse_support/,NoelDavies,1433256017,"I've been looking online (via mashape, and via other sites including reviews, etc) for a Natural Language Processing API / Service / Package / etc that will allow me to parse out text into basic actions.

For example something like ""Remove this account immediately. 
my user id is 999999""

to ['delete' =&gt; 'account', 'id' =&gt; 999999]",2,0
36,2015-6-2,2015,6,2,23,3881a0,A Deeper Look at Planning as Learning from Replay,https://www.reddit.com/r/MachineLearning/comments/3881a0/a_deeper_look_at_planning_as_learning_from_replay/,pierrelux,1433256356,,0,0
37,2015-6-2,2015,6,2,23,3881d9,Variational Generative Stochastic Networks with Collaborative Shaping,https://www.reddit.com/r/MachineLearning/comments/3881d9/variational_generative_stochastic_networks_with/,pierrelux,1433256392,,2,2
38,2015-6-3,2015,6,3,0,388ahy,Modelling time series data with Convolutional RBM,https://www.reddit.com/r/MachineLearning/comments/388ahy/modelling_time_series_data_with_convolutional_rbm/,[deleted],1433259928,"I am trying to model time-series data with Convolutional RBM (Lee's model). I am doing mean zero, variance one normalization for each file before sending to CRBM. Time-series data is of variable length e.g. 40,000 samples in one file. The problem I am facing is when reconstruction is good weights are not learned and vice versa. I also tried using only probabilities in reconstruction. I am using 50-80 filters (K-Groups in CRBM). I tried to debug CRBM and found that standard deviation factor (sigma) in CRBM seems to have problem. As I am making unity of each training example, it may be good to have unit sigma. However, doing so reconstruction improves but weights become more and more noisy in each iteration. My questions are:
1) How to choose sigma (standard deviation parameter) in CRBM (it also have roots in sparse RBM) ?
2) How to properly initialize weights and biases in CRBM so that units will not saturate?
3) Is it good to ignore probabilistic max-pooling (as right now I'm using only single machine) in sampling and use only probabilities (soft-max units) in reconstruction and other calculations?
Hoping for positive reply.
Thank you",0,1
39,2015-6-3,2015,6,3,1,388lz1,computing lexical chains without using wordnet,https://www.reddit.com/r/MachineLearning/comments/388lz1/computing_lexical_chains_without_using_wordnet/,new2machinelearning,1433263972,"Hi folks .. i am trying to work on extracting important sentences in a document (meaning any generic document including but not limited to news paper articles) and i have figured that the wordnet based approach of finding synsets for all noun terms is proving quite challenging for tech heavy articles. Tech articles are quite heavy on NNP's (for instance using words like twitter, uber , mail-client etc) and i doubt if WordNet can help here. Has any one here faced similar issues and if so any pointers on what can help ? I am toying with the idea of using collocations (as synonyms) of nouns from a base of 100's of articles that i am currently collecting from different sources. Given that the articles are going to be specific to a certain domain i would need something similar for all major domains. Any flaws you notice / pointers here will be accepted with a bow :)

Regards,
vikram",3,0
40,2015-6-3,2015,6,3,2,388nso,The Unknown Perils of Mining Wikipedia,https://www.reddit.com/r/MachineLearning/comments/388nso/the_unknown_perils_of_mining_wikipedia/,benjaminwilson,1433264473,,1,94
41,2015-6-3,2015,6,3,2,388r0f,Google x Amazon x Microsoft ML service comparison - Part 2,https://www.reddit.com/r/MachineLearning/comments/388r0f/google_x_amazon_x_microsoft_ml_service_comparison/,seni9,1433265523,,2,0
