,sbr,sbr_id,date,year,month,hour,day,id,domain,title,full_link,author,created,selftext,num_comments,score,over_18,thumbnail,media_provider,media_thumbnail,media_title,media_description,media_url
495,Futurology,t5_2t7no,2013-6-20,2013,6,20,21,1gq0aa,self.Futurology,"Project Loon, global surveillance network?",https://www.reddit.com/r/Futurology/comments/1gq0aa/project_loon_global_surveillance_network/,veepumto,1371729680,"My initial reaction to Project Loon was pure delight in the fact that everyone in the world will soon have access to the internet... But then PRISM happened, and now I'm pretty sure it's going to be the backbone of a global surveillance network. It has already been stated that the balloons can coordinate, but if they can do that, surely they'll be able to triangulate signals too. The NSA could now have access to accurate real time coordinates of individual users, not just user profiles and the content they produce/receive. 

On the semi-bright side, it will also open doors for civilian surveillance networks where villagers can report spotted targets. This could mean a lot for places like Central Africa where they are constantly under threat of rebel groups. Combine Drones... Bye bye bad people... But where does this end? It's a lot of power to give one company with a track record of cooperating with illegal surveillance networks. While I like the idea of global internet a lot, and everything Google has made for that matter, I'm not so sure about this. This sounds strangely Orwellian given the reach of the government, and Obama's refusal to stop PRISM. What do you think?",5,4,False,self,,,,,
496,Futurology,t5_2t7no,2013-6-20,2013,6,20,21,1gq0lq,nature.com,Cortical responses elicited by photovoltaic subretinal prostheses exhibit similarities to visually evoked potentials | Can anyone share a free link to this content?,https://www.reddit.com/r/Futurology/comments/1gq0lq/cortical_responses_elicited_by_photovoltaic/,[deleted],1371730116,,2,4,False,default,,,,,
497,Futurology,t5_2t7no,2013-6-20,2013,6,20,21,1gq285,youtube.com,The Cyborg Mind: Future of Google Glasses - SpaceRip,https://www.reddit.com/r/Futurology/comments/1gq285/the_cyborg_mind_future_of_google_glasses_spacerip/,mind_bomber,1371732268,,0,20,False,http://a.thumbs.redditmedia.com/SuZK8FUHIPVb2PYB.jpg,,,,,
498,Futurology,t5_2t7no,2013-6-21,2013,6,21,0,1gqboi,m.popsci.com,Remember the super hydrophobic coating that we all heard about couple years ago? Well it's finally hitting the shelves! And it's only $20!,https://www.reddit.com/r/Futurology/comments/1gqboi/remember_the_super_hydrophobic_coating_that_we/,uxl,1371741306,,153,961,False,http://c.thumbs.redditmedia.com/hBZqx2v_fMsSxqOP.jpg,,,,,
499,Futurology,t5_2t7no,2013-6-21,2013,6,21,1,1gqfmm,hardsciencenews.com,Researchers Have Found For the First Time Where Emotion Occurs in Our Brains,https://www.reddit.com/r/Futurology/comments/1gqfmm/researchers_have_found_for_the_first_time_where/,[deleted],1371744432,,1,0,False,default,,,,,
500,Futurology,t5_2t7no,2013-6-21,2013,6,21,1,1gqiii,self.Futurology,"Matt Ridley in ""The Ratown. ional Optimist"" writes:Should the world decide to go organic.. then many of the nine billions will starve and all rainforests will be cut down. Thoughts?",https://www.reddit.com/r/Futurology/comments/1gqiii/matt_ridley_in_the_ratown_ional_optimist/,[deleted],1371746783,"&gt;Should the world decide to go organic  that is, should farming get its nitrogen from plants and fish rather than direct from the air using factories and fossil fuels  then many of the nine billions will starve and all rainforests will be cut down. Yes, I wrote all. Organic farming is low-yield, whether you like it or not. The reason for this is simple chemistry. Since organic farming eschews all synthetic fertiliser, it exhausts the mineral nutrients in the soil  especially phosphorous and potassium, but eventually also sulphur, calcium and manganese. It gets round this problem by adding crushed ro to ck and squashed fish to the soil. These have to be mined or netted. Its main problem, though, is itrogen deficiency, which it can reverse by growing legumes (clover, alfalfa or beans), which fix nitrogen from the air, and either ploughing them into the soil or feeding them to cattle whose manure is then ploughed into the soil. With such help a particular organic plot can match non-organic yields, but only by using extra land elsewhere to grow the legumes and feed the cattle, effectively doubling the area under the plough. Conventional farming, by contrast, gets its nitrogen from what are in effect point sources  factories, which fix it from the air.",0,1,False,default,,,,,
501,Futurology,t5_2t7no,2013-6-21,2013,6,21,1,1gqijy,self.Futurology,"Matt Ridley in ""The Rational Optimist"" writes:Should the world decide to go organic.. then many of the nine billions will starve and all rainforests will be cut down. Thoughts?",https://www.reddit.com/r/Futurology/comments/1gqijy/matt_ridley_in_the_rational_optimist_writesshould/,[deleted],1371746814,"&gt;Should the world decide to go organic  that is, should farming get its nitrogen from plants and fish rather than direct from the air using factories and fossil fuels  then many of the nine billions will starve and all rainforests will be cut down. Yes, I wrote all. Organic farming is low-yield, whether you like it or not. The reason for this is simple chemistry. Since organic farming eschews all synthetic fertiliser, it exhausts the mineral nutrients in the soil  especially phosphorous and potassium, but eventually also sulphur, calcium and manganese. It gets round this problem by adding crushed ro to ck and squashed fish to the soil. These have to be mined or netted. Its main problem, though, is itrogen deficiency, which it can reverse by growing legumes (clover, alfalfa or beans), which fix nitrogen from the air, and either ploughing them into the soil or feeding them to cattle whose manure is then ploughed into the soil. With such help a particular organic plot can match non-organic yields, but only by using extra land elsewhere to grow the legumes and feed the cattle, effectively doubling the area under the plough. Conventional farming, by contrast, gets its nitrogen from what are in effect point sources  factories, which fix it from the air.",28,17,False,self,,,,,
502,Futurology,t5_2t7no,2013-6-21,2013,6,21,1,1gqir9,plus.google.com,Google+ Hangout happening right now with Peter H. Diamandis,https://www.reddit.com/r/Futurology/comments/1gqir9/google_hangout_happening_right_now_with_peter_h/,[deleted],1371746979,,0,1,False,default,,,,,
503,Futurology,t5_2t7no,2013-6-21,2013,6,21,2,1gqjy4,oak.ctx.ly,"f NASA continues with its current budget, a manned mission to Mars could be permanently beyond reach, space industry experts say.",https://www.reddit.com/r/Futurology/comments/1gqjy4/f_nasa_continues_with_its_current_budget_a_manned/,[deleted],1371747946,,0,1,False,default,,,,,
504,Futurology,t5_2t7no,2013-6-21,2013,6,21,2,1gqjzv,youtube.com,Hangout with Peter Diamandis,https://www.reddit.com/r/Futurology/comments/1gqjzv/hangout_with_peter_diamandis/,ambiguish,1371747974,,3,11,False,http://c.thumbs.redditmedia.com/2FtZRtC7Su4e9UBn.jpg,,,,,
505,Futurology,t5_2t7no,2013-6-21,2013,6,21,2,1gqmyv,money.cnn.com,CNN report from Global Futures 2045 Congress,https://www.reddit.com/r/Futurology/comments/1gqmyv/cnn_report_from_global_futures_2045_congress/,obi-nine,1371750150,,2,15,False,http://a.thumbs.redditmedia.com/UQwnHlgsLWG_Cf5l.jpg,,,,,
506,Futurology,t5_2t7no,2013-6-21,2013,6,21,3,1gqq1y,i.imgur.com,My voice in our government: remove United States District Attorney Carmen Ortiz from office,https://www.reddit.com/r/Futurology/comments/1gqq1y/my_voice_in_our_government_remove_united_states/,[deleted],1371752317,,3,9,False,default,,,,,
507,Futurology,t5_2t7no,2013-6-21,2013,6,21,3,1gqqng,io9.com,This pathetic GIF could be the first message aliens receive from us,https://www.reddit.com/r/Futurology/comments/1gqqng/this_pathetic_gif_could_be_the_first_message/,Trickish,1371752716,,19,9,False,default,,,,,
508,Futurology,t5_2t7no,2013-6-21,2013,6,21,3,1gqs1v,phys.org,World's most powerful microscope ready for research. The resolution is about 20 million times better than human sight and can differentiate individual atoms.,https://www.reddit.com/r/Futurology/comments/1gqs1v/worlds_most_powerful_microscope_ready_for/,slipstream37,1371753685,,2,26,False,http://d.thumbs.redditmedia.com/pTZscZjyv-zEZ03W.jpg,,,,,
509,Futurology,t5_2t7no,2013-6-21,2013,6,21,3,1gqsck,bbc.co.uk,BBC News - Scientists create first 3D digital brain,https://www.reddit.com/r/Futurology/comments/1gqsck/bbc_news_scientists_create_first_3d_digital_brain/,Emphursis,1371753898,,5,35,False,http://c.thumbs.redditmedia.com/aaV_7APss2x5an_D.jpg,,,,,
510,Futurology,t5_2t7no,2013-6-21,2013,6,21,4,1gqudz,youtube.com,Automation is becoming insane. Here is a highly automated warehouse system.,https://www.reddit.com/r/Futurology/comments/1gqudz/automation_is_becoming_insane_here_is_a_highly/,Two-Tone-,1371755343,,28,62,False,http://c.thumbs.redditmedia.com/fH6XPREvumqN7HRn.jpg,,,,,
511,Futurology,t5_2t7no,2013-6-21,2013,6,21,4,1gqwuc,reddit.com,What is the future of Board Gaming (X-POST),https://www.reddit.com/r/Futurology/comments/1gqwuc/what_is_the_future_of_board_gaming_xpost/,gripmyhand,1371757187,,0,2,False,default,,,,,
512,Futurology,t5_2t7no,2013-6-21,2013,6,21,4,1gqx9x,self.Futurology,Technologies to empower people,https://www.reddit.com/r/Futurology/comments/1gqx9x/technologies_to_empower_people/,farmvilleduck,1371757515,"When looking at the world, it seems to me that there's a string repeating theme:the rich and the powerfull use technology(and everything else) to increase their power over common people. You see it the issues over privacy, in increasing automation,  in the many networks and ecosystems who try to achieve control and monopoly over various services, or others by developing unique patented knowledge might achieve control over huge industries like chemical manufacturing and food production. 

On the other hand, some types of technologies distribute power to people:cryptography, better open source development tools, solar panels. 

What other kinds of power distributing technologies you know of? 

Will people here would be interested to read more about such technologies? ",4,1,False,self,,,,,
513,Futurology,t5_2t7no,2013-6-21,2013,6,21,4,1gqxk9,gajitz.com,Augmented Reality Glasses See What Students Understand,https://www.reddit.com/r/Futurology/comments/1gqxk9/augmented_reality_glasses_see_what_students/,misnamed,1371757712,,2,19,False,http://f.thumbs.redditmedia.com/C-qBcvTVejKDYbMk.jpg,,,,,
514,Futurology,t5_2t7no,2013-6-21,2013,6,21,5,1gr1xe,news.cnet.com,Accelerating the future - Google Fiber spawns start up renaissance in Kansas City,https://www.reddit.com/r/Futurology/comments/1gr1xe/accelerating_the_future_google_fiber_spawns_start/,libbrichus,1371760915,,0,34,False,http://a.thumbs.redditmedia.com/gUp3SDS9jP8w0ynf.jpg,,,,,
515,Futurology,t5_2t7no,2013-6-21,2013,6,21,7,1grb2g,greenbiz.com,Andrew McAfee - Why droids are taking our jobs,https://www.reddit.com/r/Futurology/comments/1grb2g/andrew_mcafee_why_droids_are_taking_our_jobs/,Buck-Nasty,1371768125,,0,2,False,http://b.thumbs.redditmedia.com/zrIhZAiXTR7SnVJI.jpg,,,,,
516,Futurology,t5_2t7no,2013-6-21,2013,6,21,10,1grmh3,inapcache.boston.com,"Welcome to the future, best you get used to it.",https://www.reddit.com/r/Futurology/comments/1grmh3/welcome_to_the_future_best_you_get_used_to_it/,Transhumanus,1371778199,,0,1,False,default,,,,,
517,Futurology,t5_2t7no,2013-6-21,2013,6,21,10,1gro0v,arstechnica.com,New tech may let current graphics cards drive a $500 holographic display,https://www.reddit.com/r/Futurology/comments/1gro0v/new_tech_may_let_current_graphics_cards_drive_a/,KingLouisXVII,1371779605,,10,41,False,http://d.thumbs.redditmedia.com/0_0qOHxKZxDvFmT3.jpg,,,,,
518,Futurology,t5_2t7no,2013-6-21,2013,6,21,11,1grpyw,youtube.com,ITN News - Amazing moment deaf three-year-old boy hears for the first time - I Love Technology!,https://www.reddit.com/r/Futurology/comments/1grpyw/itn_news_amazing_moment_deaf_threeyearold_boy/,[deleted],1371781399,,4,34,False,default,,,,,
519,Futurology,t5_2t7no,2013-6-21,2013,6,21,14,1gs0de,hardsciencenews.com,Researchers Have Found For the First Time Where Emotion Occurs in Our Brains,https://www.reddit.com/r/Futurology/comments/1gs0de/researchers_have_found_for_the_first_time_where/,presaging,1371791317,,8,22,False,http://d.thumbs.redditmedia.com/mxRhVOxP-p6nwWU3.jpg,,,,,
520,Futurology,t5_2t7no,2013-6-21,2013,6,21,14,1gs2pl,news.msn.com,Engineer working on man-made Tornado power.,https://www.reddit.com/r/Futurology/comments/1gs2pl/engineer_working_on_manmade_tornado_power/,to11mtm,1371793964,,6,17,False,http://e.thumbs.redditmedia.com/xceRwhRP_fWOco8p.jpg,,,,,
521,Futurology,t5_2t7no,2013-6-21,2013,6,21,17,1gs9df,teslamotors.com,Elon Musk demonstrates new battery swapping technology for the Tesla Model S.,https://www.reddit.com/r/Futurology/comments/1gs9df/elon_musk_demonstrates_new_battery_swapping/,[deleted],1371803979,,0,1,False,default,,,,,
522,Futurology,t5_2t7no,2013-6-21,2013,6,21,18,1gsbjm,reddit.com,"I have had Deep Brain Stimulation Surgery for Parkinson's Disease, and this is what happens when I turn off my neurostimulator. (x-post r/WTF)",https://www.reddit.com/r/Futurology/comments/1gsbjm/i_have_had_deep_brain_stimulation_surgery_for/,Simcurious,1371808094,,15,312,False,default,,,,,
523,Futurology,t5_2t7no,2013-6-21,2013,6,21,19,1gscbk,vimeo.com,Elon Musk demonstrates battery-change technology for the Tesla Model S.,https://www.reddit.com/r/Futurology/comments/1gscbk/elon_musk_demonstrates_batterychange_technology/,MaleFascistAdvice,1371809600,,0,1,False,default,,,,,
524,Futurology,t5_2t7no,2013-6-21,2013,6,21,19,1gscq2,ceoworld.biz,A Quick Rundown: Cool New Technology And Gadgets Struggling For Survival,https://www.reddit.com/r/Futurology/comments/1gscq2/a_quick_rundown_cool_new_technology_and_gadgets/,ceoworld,1371810409,,0,1,False,default,,,,,
525,Futurology,t5_2t7no,2013-6-21,2013,6,21,21,1gsh99,youtube.com,What will future jobs look like?,https://www.reddit.com/r/Futurology/comments/1gsh99/what_will_future_jobs_look_like/,SpeakMouthWords,1371818219,,10,19,False,http://c.thumbs.redditmedia.com/MmWoJUTzo17HtdnP.jpg,,,,,
526,Futurology,t5_2t7no,2013-6-21,2013,6,21,22,1gsjfu,self.Futurology,Any fellow futurists in Philly?,https://www.reddit.com/r/Futurology/comments/1gsjfu/any_fellow_futurists_in_philly/,FutureShocked,1371821015,"I'm here for a couple days. If anyone would like to get lunch today (Fri 21), I was planning to grab a bite at PYT burger, probably around one. ",0,0,False,self,,,,,
527,Futurology,t5_2t7no,2013-6-21,2013,6,21,22,1gsjr2,immortallife.info,The Future Is Scientific - with Less Uncertainty,https://www.reddit.com/r/Futurology/comments/1gsjr2/the_future_is_scientific_with_less_uncertainty/,[deleted],1371821391,,0,1,False,default,,,,,
528,Futurology,t5_2t7no,2013-6-21,2013,6,21,22,1gsklt,xenology.info,"Xenology: An Introduction to the Scientific Study of Extraterrestrial Life, Intelligence, and Civilization",https://www.reddit.com/r/Futurology/comments/1gsklt/xenology_an_introduction_to_the_scientific_study/,Omni314,1371822352,,4,9,False,http://a.thumbs.redditmedia.com/DW0O4B03U4IfNVQB.jpg,,,,,
529,Futurology,t5_2t7no,2013-6-21,2013,6,21,22,1gskvt,indiegogo.com,"Tilden, Goertzel, Hanson and Yu looking to crowdfund AI development",https://www.reddit.com/r/Futurology/comments/1gskvt/tilden_goertzel_hanson_and_yu_looking_to/,alito,1371822632,,4,27,False,default,,,,,
530,Futurology,t5_2t7no,2013-6-21,2013,6,21,23,1gsmcx,popsci.com,China vs. United States | Whos More Powerful [Infographic],https://www.reddit.com/r/Futurology/comments/1gsmcx/china_vs_united_states_whos_more_powerful/,presaging,1371824104,,8,5,False,default,,,,,
531,Futurology,t5_2t7no,2013-6-21,2013,6,21,23,1gsmkv,engadget.com,Tesla's 90 second battery swaps will power EVs faster than gas pumps fill tanks,https://www.reddit.com/r/Futurology/comments/1gsmkv/teslas_90_second_battery_swaps_will_power_evs/,cptn_jtk,1371824312,,236,826,False,http://a.thumbs.redditmedia.com/ZE2IPcIueLGtIbAZ.jpg,,,,,
532,Futurology,t5_2t7no,2013-6-21,2013,6,21,23,1gsnff,nextbigfuture.com,Starship Varieties,https://www.reddit.com/r/Futurology/comments/1gsnff/starship_varieties/,presaging,1371825106,,8,20,False,http://c.thumbs.redditmedia.com/OChwZqLp26uiqksn.jpg,,,,,
533,Futurology,t5_2t7no,2013-6-22,2013,6,22,0,1gspfm,businessinsider.com,"Computer generated people (link is from 2011, but still interesting)",https://www.reddit.com/r/Futurology/comments/1gspfm/computer_generated_people_link_is_from_2011_but/,1337_n00b,1371826937,,7,6,False,http://c.thumbs.redditmedia.com/r0wDwcgk2zlgWR-J.jpg,,,,,
534,Futurology,t5_2t7no,2013-6-22,2013,6,22,2,1gt03n,theatlantic.com,What the Digital Brains of the Future Might Be Like - Alexis C. Madrigal,https://www.reddit.com/r/Futurology/comments/1gt03n/what_the_digital_brains_of_the_future_might_be/,Yosarian2,1371835329,,1,4,False,http://b.thumbs.redditmedia.com/jIufARDYmQKPPvWO.jpg,,,,,
535,Futurology,t5_2t7no,2013-6-22,2013,6,22,5,1gtcr1,news.sciencemag.org,Japan to Relax Ban on Chimeric Embryo Experiments - Technology ready for markets in 5 years?,https://www.reddit.com/r/Futurology/comments/1gtcr1/japan_to_relax_ban_on_chimeric_embryo_experiments/,DaPorter,1371844924,,4,18,False,http://c.thumbs.redditmedia.com/UhgP7NOiYqoB5K-V.jpg,,,,,
536,Futurology,t5_2t7no,2013-6-22,2013,6,22,5,1gteri,hardsciencenews.com,A New Discovery Reveals Previously Unknown Requirements for Brain Development--Brain Requires Thalamic Input as Well as Genetics,https://www.reddit.com/r/Futurology/comments/1gteri/a_new_discovery_reveals_previously_unknown/,presaging,1371846501,,1,15,False,http://d.thumbs.redditmedia.com/QVyIveF5RGgSAg33.jpg,,,,,
537,Futurology,t5_2t7no,2013-6-22,2013,6,22,6,1gtkvz,self.Futurology,When was the Earth born? And what was it's fetal period?,https://www.reddit.com/r/Futurology/comments/1gtkvz/when_was_the_earth_born_and_what_was_its_fetal/,Turil,1371851361,"So, there are theories that the Earth is a living organism (which is generally obvious, but some people have ""issues"" with this idea), and that means that the Earth probably has developmental periods just like individual animals and such.  If so, then we might be able to use human developmental stages as a predictor for what the Earth will be like in the future, in some general way.

But, we'd have to identify at least some of the basic stages of the Earth's growth.  For example, do we know what the time period was for the prenatal gestation of our planet?  What would that even mean?  Is that the time between when things started being solid and when there life?  Or the time between when the planet first had life and when it finally started ""breathing"" oxygen (when plants first showed up)?

Thoughts?

(Also, for reference, I'm using a theory that suggests that humans grow following a Fibonacci sequence pattern, using 9 months of gestation as the first full unit.)",19,0,False,self,,,,,
538,Futurology,t5_2t7no,2013-6-22,2013,6,22,8,1gtq0l,robotics.umd.edu,Newly Developed Robot Flies Like Real Bird,https://www.reddit.com/r/Futurology/comments/1gtq0l/newly_developed_robot_flies_like_real_bird/,Gerbertronic,1371855779,,3,8,False,http://c.thumbs.redditmedia.com/IGLAPP-t6AwdVuJh.jpg,,,,,
539,Futurology,t5_2t7no,2013-6-22,2013,6,22,9,1gtuct,self.Futurology,List of jobs that will be replaced by automation / technological unemployment (xpost from r/Automate),https://www.reddit.com/r/Futurology/comments/1gtuct/list_of_jobs_that_will_be_replaced_by_automation/,jjshinobi,1371859799,"Has anyone came across a realistic list of all the jobs / tasks that will be replaced by automation / robots?

I'm not satisfied with ""anything but the creative field, military and R&amp;D fields.""

The original list was:

- Bartenders

- Cashiers

- Waiters

- Delivery People

- Fastfood Workers

- Maids

- Basic Mechanics

- Basic Managers

- Basic IT / Sysadmin

You can contribute to the current list in real time, and stay up to date with it's new entries on it's [hackpad here](https://hackpad.com/List-of-Jobs-that-will-be-lost-to-Automation-Technological-Unemployment-ejhajuZc3cB) (you don't need an account).

Source: [Original Post](http://www.reddit.com/r/Automate/comments/1gttmn/list_of_jobs_that_will_be_replaced_by_automation/)",85,45,False,self,,,,,
540,Futurology,t5_2t7no,2013-6-22,2013,6,22,9,1gtun2,self.Futurology,Is it okay to smoke cigarettes since 3D printers can make you a new one?,https://www.reddit.com/r/Futurology/comments/1gtun2/is_it_okay_to_smoke_cigarettes_since_3d_printers/,[deleted],1371860087,"This may be a silly question but I was wondering if it is okay for people to smoke cigarettes since 3D printed lungs etc may go mainstream in the coming decades? 

(I myself do not smoke)",11,0,False,default,,,,,
541,Futurology,t5_2t7no,2013-6-22,2013,6,22,9,1gtvga,youtube.com,Humans Merge with Machines at Global Future 2045 Congress - TechFeed,https://www.reddit.com/r/Futurology/comments/1gtvga/humans_merge_with_machines_at_global_future_2045/,mind_bomber,1371860859,,3,12,False,http://e.thumbs.redditmedia.com/gSuUNSszqMRu_qk4.jpg,,,,,
542,Futurology,t5_2t7no,2013-6-22,2013,6,22,11,1gu1zi,youtube.com,The Google Brain's Andrew Ng - Machine Learning via Large-scale Brain Simulations,https://www.reddit.com/r/Futurology/comments/1gu1zi/the_google_brains_andrew_ng_machine_learning_via/,Buck-Nasty,1371867623,,5,22,False,http://e.thumbs.redditmedia.com/46M_fRHZ5Kp_e-l4.jpg,,,,,
543,Futurology,t5_2t7no,2013-6-22,2013,6,22,11,1gu38x,youtube.com,AnkiDrive - Autonomous Toy Cars,https://www.reddit.com/r/Futurology/comments/1gu38x/ankidrive_autonomous_toy_cars/,Eryemil,1371868863,,6,19,False,http://d.thumbs.redditmedia.com/XFHWf3Yo-ryk-cjo.jpg,,,,,
544,Futurology,t5_2t7no,2013-6-22,2013,6,22,13,1gu82w,i.imgur.com,Future wallpaper,https://www.reddit.com/r/Futurology/comments/1gu82w/future_wallpaper/,RecklessCanadian,1371873975,,27,156,False,default,,,,,
545,Futurology,t5_2t7no,2013-6-22,2013,6,22,16,1guh53,self.Futurology,'So I had a few drinks...' An NSA Love Story: or 'Why I hate the coming future.' Should I keep writing?,https://www.reddit.com/r/Futurology/comments/1guh53/so_i_had_a_few_drinks_an_nsa_love_story_or_why_i/,[deleted],1371886084,"The NSA, you, are currently always watching us. So I had a few drinks tonight Ever since I checked in at Sunset Tavern you knew I had been drinking. You knew I was a threat. Once I paid the tab at Brewski's Pub I was classified as a Level 197b risk. Jessica had been studying theater in New York, she was visiting for the week. It was a few years since I had last spoken to her, and she looked great. We sort of hit it off, in that awkward ""it's been a while, I know nothing of theater kind of way, but I think she liked me. I knew you were watching through the CCTV cameras, as you watch everyone. What you didn't know was that non of this mattered to me.",0,1,False,default,,,,,
546,Futurology,t5_2t7no,2013-6-22,2013,6,22,16,1guhdu,self.Futurology,'So I had a few drinks...' An NSA Love Story: Or 'Why I hate the coming future.' Should I keep writing?,https://www.reddit.com/r/Futurology/comments/1guhdu/so_i_had_a_few_drinks_an_nsa_love_story_or_why_i/,[deleted],1371886521,"The NSA, you, are currently always watching us. So I had a few drinks tonight Ever since I checked in at Sunset Tavern you knew I had been drinking. You knew I was a threat. Once I paid the tab at Brewski's Pub I was classified as a Level 197b risk. Jessica had been studying theater in New York, she was visiting for the week. It was a few years since I had last spoken to her, and she looked great. We sort of hit it off, in that awkward ""it's been a while, I know nothing of theater kind of way, but I think she liked me. I knew you were watching through the CCTV cameras, as you watch everyone. What you didn't know was that non of this mattered to me.",3,0,False,default,,,,,
547,Futurology,t5_2t7no,2013-6-22,2013,6,22,20,1guntt,bbc.co.uk,Hands-tied kit: Designer tests bluetooth glove phone,https://www.reddit.com/r/Futurology/comments/1guntt/handstied_kit_designer_tests_bluetooth_glove_phone/,BanquetForOne,1371900550,,1,3,False,http://c.thumbs.redditmedia.com/aaV_7APss2x5an_D.jpg,,,,,
548,Futurology,t5_2t7no,2013-6-22,2013,6,22,23,1gutpq,vimeo.com,Why Build a Sun on Earth?,https://www.reddit.com/r/Futurology/comments/1gutpq/why_build_a_sun_on_earth/,mind_bomber,1371910423,,3,0,False,http://d.thumbs.redditmedia.com/c6esU5LGBKPn_KYW.jpg,,,,,
549,Futurology,t5_2t7no,2013-6-23,2013,6,23,0,1guycf,readwrite.com,Robots Ride To The Rescue In DARPA's Virtual Robotics Challenge,https://www.reddit.com/r/Futurology/comments/1guycf/robots_ride_to_the_rescue_in_darpas_virtual/,Buck-Nasty,1371916210,,4,22,False,http://c.thumbs.redditmedia.com/hYWNKrVoiytnxFXb.jpg,,,,,
550,Futurology,t5_2t7no,2013-6-23,2013,6,23,0,1guysh,self.Futurology,So how is the state of weathering modeling using supercomputers today? and what will it be like in the future?,https://www.reddit.com/r/Futurology/comments/1guysh/so_how_is_the_state_of_weathering_modeling_using/,fact0,1371916718,"I know there is constant upgrades in the computing word, and we're soon to break the exaflop barrier. So how will all this power effect weather modeling? will we be able to accurately predicted all of the worlds weather in the future?",1,4,False,self,,,,,
551,Futurology,t5_2t7no,2013-6-23,2013,6,23,1,1gv05i,asmarterplanet.com,IBM Watson coming to cell phones via cloud service.,https://www.reddit.com/r/Futurology/comments/1gv05i/ibm_watson_coming_to_cell_phones_via_cloud_service/,Buck-Nasty,1371918121,,128,662,False,http://a.thumbs.redditmedia.com/TsfSpyqR-oJ9khjH.jpg,,,,,
