,sbr,sbr_id,date,year,month,hour,day,id,domain,title,full_link,author,created,selftext,num_comments,score,over_18,thumbnail,media_provider,media_thumbnail,media_title,media_description,media_url
365,Futurology,t5_2t7no,2013-6-15,2013,6,15,3,1gcpd9,youtube.com,Sony's look at what the Playstation may offer in 2078,https://www.reddit.com/r/Futurology/comments/1gcpd9/sonys_look_at_what_the_playstation_may_offer_in/,[deleted],1371233603,,4,0,False,default,,,,,
366,Futurology,t5_2t7no,2013-6-15,2013,6,15,3,1gcqkm,movies.yahoo.com,"After loving the stunning futuristic movie Oblivion, I can't wait to see this one too: 'Elysium'",https://www.reddit.com/r/Futurology/comments/1gcqkm/after_loving_the_stunning_futuristic_movie/,Trickish,1371234496,,41,66,False,http://e.thumbs.redditmedia.com/fZKqOy3lGMFr67xF.jpg,,,,,
367,Futurology,t5_2t7no,2013-6-15,2013,6,15,3,1gcqvs,expandiverse.com,Four ways to defeat competitors and own tomorrows markets,https://www.reddit.com/r/Futurology/comments/1gcqvs/four_ways_to_defeat_competitors_and_own_tomorrows/,danabelow,1371234728,,0,1,False,default,,,,,
368,Futurology,t5_2t7no,2013-6-15,2013,6,15,4,1gcw64,extremetech.com,Recharge your electric vehicle in 20 minutes starting later this year,https://www.reddit.com/r/Futurology/comments/1gcw64/recharge_your_electric_vehicle_in_20_minutes/,[deleted],1371238635,,0,2,False,http://c.thumbs.redditmedia.com/y9zxT0Hwyas8wDEz.jpg,,,,,
369,Futurology,t5_2t7no,2013-6-15,2013,6,15,4,1gcw6d,salon.com,I guess in some ways this incident is evidence that its hard to encode ideals in a piece of software. The right way to do that is via legislation.,https://www.reddit.com/r/Futurology/comments/1gcw6d/i_guess_in_some_ways_this_incident_is_evidence/,obi-nine,1371238640,,0,6,False,http://b.thumbs.redditmedia.com/XcuxfLeWk1H4woUy.jpg,,,,,
370,Futurology,t5_2t7no,2013-6-15,2013,6,15,4,1gcxki,guardian.co.uk,Pentagon bracing for public dissent over climate and energy shocks,https://www.reddit.com/r/Futurology/comments/1gcxki/pentagon_bracing_for_public_dissent_over_climate/,obi-nine,1371239748,,43,44,False,http://c.thumbs.redditmedia.com/dLkKkQizBCOCpk7h.jpg,,,,,
371,Futurology,t5_2t7no,2013-6-15,2013,6,15,5,1gcyej,youtube.com,"Recon Jet HUD: Bro, Does Google Glass Even Lift?",https://www.reddit.com/r/Futurology/comments/1gcyej/recon_jet_hud_bro_does_google_glass_even_lift/,corruption1,1371240406,,0,6,False,http://a.thumbs.redditmedia.com/mH1NlgCsoZe4vBzl.jpg,,,,,
372,Futurology,t5_2t7no,2013-6-15,2013,6,15,7,1gd7o0,sciencefriday.com,Science Friday (NPR podcast)-Decoding 'the Most Complex Object in the Universe',https://www.reddit.com/r/Futurology/comments/1gd7o0/science_friday_npr_podcastdecoding_the_most/,Yosarian2,1371247866,,1,7,False,http://d.thumbs.redditmedia.com/yWItRtpp2iK4sBEi.jpg,,,,,
373,Futurology,t5_2t7no,2013-6-15,2013,6,15,7,1gd7ui,youtube.com,Is 2013 Actually '1984'? - THNKR,https://www.reddit.com/r/Futurology/comments/1gd7ui/is_2013_actually_1984_thnkr/,[deleted],1371248039,,0,1,False,default,,,,,
374,Futurology,t5_2t7no,2013-6-15,2013,6,15,7,1gd7wu,youtube.com,I bet a ton of people will live like this in 10 to 15 years,https://www.reddit.com/r/Futurology/comments/1gd7wu/i_bet_a_ton_of_people_will_live_like_this_in_10/,AtmanRising,1371248095,,145,265,False,http://f.thumbs.redditmedia.com/I62kUW2w5IY8MHYq.jpg,,,,,
375,Futurology,t5_2t7no,2013-6-15,2013,6,15,7,1gd9mu,self.Futurology,My idea for bringing back savage and gory gladiator games,https://www.reddit.com/r/Futurology/comments/1gd9mu/my_idea_for_bringing_back_savage_and_gory/,WolfySnackrib,1371249561,"It requires a ton of progress in science, probably up to the point where we could do what they did in the movie Avatar, temporarily transferring consciousness into a new body.

Say we had this sort of technology, it was cheap, living in an age of plenty, and we could easily print out a vessel or grow it very cheaply, and then make whatever alterations we wanted, we could then make up a sport using printed out gladiator bodies that has flesh, blood and bones, but with modified pain to make it less uncomfortable to have your throat slashed, make it a bit more videogame-like to the driver, but from the spectator perspective, we just saw someone get brutally murdered in the arena.

Ever wondered about the canon of games like Quake 3 Arena? How come the same characters can die millions of times and come back seconds later unharmed? This might be a fun explanation to it. Hopefully there'll be something like this in the future. It wouldn't harm anyone and it would be great fun. Maybe we wouldn't even need to print physical bodies, assuming that we've built brain computers that by far surpass the smartest humans in intelligence and can hook you up to a matrix which they regulate with your input.

Tell them a bunch of variables that you want in your simulations, and going on some of that basic info, they'll have creative freedom to make anything you want. Hell why not ask a matrix computer like that ""Computer, simulate a brilliant sequel to the movie 'Pulp Fiction' which includes the actors Charlton Heston, Sean Connery, Heath Ledger and Bruce Lee"", and its intelligence and abilities might very well simulate the best of possible scenarios for what you described!
That's the world I want to live in.

""Computer, show me the movie The Matrix except Agent Smith survives and wins at the end.""

What a world of fun to play with, I want. :(",9,0,False,self,,,,,
376,Futurology,t5_2t7no,2013-6-15,2013,6,15,9,1gdfi6,youtube.com,Falcon 9-Reusable (F9-R) 1st Stage Firing,https://www.reddit.com/r/Futurology/comments/1gdfi6/falcon_9reusable_f9r_1st_stage_firing/,RushAndAPush,1371255024,,1,7,False,http://e.thumbs.redditmedia.com/oaU7BgpMnRa0cUTR.jpg,,,,,
377,Futurology,t5_2t7no,2013-6-15,2013,6,15,16,1ge2j8,self.Futurology,What would you tell a poor laborer whose job will be lost to mechanization?,https://www.reddit.com/r/Futurology/comments/1ge2j8/what_would_you_tell_a_poor_laborer_whose_job_will/,snifty,1371281794,"Suppose I drive you out to a field in Oxnard, California, where a Zapotec field laborer picks strawberries for hours a day, bent over. You work for StrawberryPickerCorp, which has designed a strawberry-picking robot which can do the mans job more efficiently.

You have to speak through two translators, because this guy doesnt know Spanish. 

How do you tell him that this job is no more?

(I dont think this kind of thing is too far in the future, personally.)",40,16,False,self,,,,,
378,Futurology,t5_2t7no,2013-6-15,2013,6,15,16,1ge31l,phys.org,MIT develops an automated 'coach' could help with social interactions,https://www.reddit.com/r/Futurology/comments/1ge31l/mit_develops_an_automated_coach_could_help_with/,DullDieHard,1371282746,,8,37,False,http://d.thumbs.redditmedia.com/oPe_rCleToSvCTsu.jpg,,,,,
379,Futurology,t5_2t7no,2013-6-15,2013,6,15,17,1ge4bq,youtube.com,Project Loon - Google Wants to Use Balloons to Cover the World in Wi-Fi (xpost r/videos),https://www.reddit.com/r/Futurology/comments/1ge4bq/project_loon_google_wants_to_use_balloons_to/,housicker,1371285445,,121,507,False,http://c.thumbs.redditmedia.com/GOXg9oc6yxO39QS2.jpg,,,,,
380,Futurology,t5_2t7no,2013-6-15,2013,6,15,18,1ge63s,jfs.tku.edu.tw,The Journal of Futures Studies,https://www.reddit.com/r/Futurology/comments/1ge63s/the_journal_of_futures_studies/,PolarisDiB,1371289310,,5,4,False,http://b.thumbs.redditmedia.com/a3X2MXmZPsu6MO_m.jpg,,,,,
381,Futurology,t5_2t7no,2013-6-15,2013,6,15,18,1ge6gq,profuturists.org,The Association of Professional Futurists,https://www.reddit.com/r/Futurology/comments/1ge6gq/the_association_of_professional_futurists/,PolarisDiB,1371290038,,0,6,False,http://c.thumbs.redditmedia.com/egBC3_1mzg-qfg_2.jpg,,,,,
382,Futurology,t5_2t7no,2013-6-15,2013,6,15,19,1ge6vw,youtube.com,"Japanese Documentary ""Robot Revolution""",https://www.reddit.com/r/Futurology/comments/1ge6vw/japanese_documentary_robot_revolution/,Buck-Nasty,1371291139,,5,25,False,http://a.thumbs.redditmedia.com/SCwYUPHmo8w9fF-r.jpg,,,,,
383,Futurology,t5_2t7no,2013-6-15,2013,6,15,23,1gegsc,intelligenceexplosion.com,Facing the Intelligence Explosion,https://www.reddit.com/r/Futurology/comments/1gegsc/facing_the_intelligence_explosion/,[deleted],1371308377,,3,8,False,default,,,,,
384,Futurology,t5_2t7no,2013-6-16,2013,6,16,0,1geii6,sci-news.com,"Scientists use new engineered virus to restore sight: `we have now created a virus that you just inject into the liquid vitreous humor inside the eye and it delivers genes to a very difficult-to-reach population of delicate cells. It's a 15-minute procedure, and you can likely go home that day`",https://www.reddit.com/r/Futurology/comments/1geii6/scientists_use_new_engineered_virus_to_restore/,pateras,1371310312,,27,649,False,http://a.thumbs.redditmedia.com/zJ68NRoCnx-Cc3PH.jpg,,,,,
385,Futurology,t5_2t7no,2013-6-16,2013,6,16,1,1gem6j,youtube.com,Quantum Computing - Gate Model v Adiabatic,https://www.reddit.com/r/Futurology/comments/1gem6j/quantum_computing_gate_model_v_adiabatic/,mind_bomber,1371314100,,1,28,False,http://d.thumbs.redditmedia.com/TuTDBwLrTVOdQfFi.jpg,,,,,
386,Futurology,t5_2t7no,2013-6-16,2013,6,16,3,1gess1,news.rice.edu,Rice University lab combines graphene nanoribbons with tin oxide for improved lithium ion batteries,https://www.reddit.com/r/Futurology/comments/1gess1/rice_university_lab_combines_graphene_nanoribbons/,Yosarian2,1371320569,,2,87,False,http://c.thumbs.redditmedia.com/efxM_jxu_LexysJt.jpg,,,,,
387,Futurology,t5_2t7no,2013-6-16,2013,6,16,3,1get84,theverge.com,"Google unveils 'Project Loon,' an experiment to bring balloon-powered internet to 'the entire world'",https://www.reddit.com/r/Futurology/comments/1get84/google_unveils_project_loon_an_experiment_to/,[deleted],1371321017,,0,1,False,default,,,,,
388,Futurology,t5_2t7no,2013-6-16,2013,6,16,3,1geuwg,spectrum.ieee.org,GM Foods Grow Up - IEEE Spectrum,https://www.reddit.com/r/Futurology/comments/1geuwg/gm_foods_grow_up_ieee_spectrum/,Yosarian2,1371322590,,14,4,False,default,,,,,
389,Futurology,t5_2t7no,2013-6-16,2013,6,16,6,1gf3r6,self.Futurology,The purpose of humanity.,https://www.reddit.com/r/Futurology/comments/1gf3r6/the_purpose_of_humanity/,accountt1234,1371331123,"The purpose of the human race is not what you think it is. You're not going to colonize the rest of the universe. Humans are merely part of a greater whole, known as the biosphere.

Millions of years of plant matter and algae have been stored beneath our feet, in the form of coal, gas and oil. These reserves generally keep growing, and as a result, our planet has until recently been suffering from conditions of very low atmospheric CO2. This led to the evolution of grasses, with a C4 carbon fixation system.

In the grassy plains that emerge as a result of low CO2 conditions, a niche automatically opens up for a bipedal tool-using organism. An ape runs around the Savannah, scouring the Earth in search of other animal's corpses, which he consumes through use of his hands and stone tools. Eventually he begins to hunt to supplement his diet.

It's inevitable that this bipedal organism eventually figures out how to domesticate the grasses that surround it. In fact, this happened multiple times independently in different places.

Eventually, the naked ape runs out of wood to burn, and moves over to coal. This leads to a point where most coal available to the ape is underwater. The ape then decides to build a pump, allowing him to extract more coal. The pump is then transformed, allowing it to be used for different purposes as well. The burning of fossilized carbon accelerates, and eventually it is discovered that something must be done to cease burning carbon, but nobody can afford to stop. 

The climate now begins to change in rapid fashion. CO2 concentrations are high enough to favor the growth of woody plants over grasses. Temperatures rise, and the Earth gets wetter. Insects grow in number, preying on the agricultural fields. 

Humans find that like any other species they suffered from an overshoot, growing beyond the natural levels that could be sustained for their species. Humans discover that all of nature is evolving to take down their domination. Rats spread to every place that knows civilization, bacteria evolve antibiotic resistance, new fungi evolve to consume the grains we grow, tics infect the only prey left for them.

Nature, stimulated by increased levels of CO2, reconquers those portions of the planet once dominated by Homo Sapiens Sapiens. Even the deserts become green, as plants now have to lose less water molecules when taking up CO2.

Nature had a problem. Carbon was stored beneath the ground, with no way to retrieve it. Nature evolved a quick and dirty solution; A hairless megalomaniac ape that thinks he will spread throughout the galaxy. The solution worked, and is soon discarded.

What follows? Clever creatures, but not necessarily us. Dinosaurs were rapidly increasing their brain size until they were hit by a meteor. Today we have Elephants, Ravens, Octopuses, Dolphins, Whales, Parrots and many more. [Animals with larger brains are less prone to extinction.](http://phys.org/news/2012-07-animals-bigger-brains-prone-extinction.html) Rats are evolving to delay gratification. Rats have learned to eat a little bit of food and wait to see if they feel poisoned, before continuing on to eat more of it. Crows are starting to attack humans.

We are soon to be victims of the wild beasts that surround us, and humans will be remember as a species of useful idiots, good for retrieving fossilized carbon and not much else.",20,0,False,self,,,,,
390,Futurology,t5_2t7no,2013-6-16,2013,6,16,7,1gf6jw,youtube.com,Researchers Use Supercomputer to Solve the Structure of the HIV-1 Capsid,https://www.reddit.com/r/Futurology/comments/1gf6jw/researchers_use_supercomputer_to_solve_the/,Buck-Nasty,1371333865,,7,53,False,http://f.thumbs.redditmedia.com/7bxnNfAKG6Mop2XS.jpg,,,,,
391,Futurology,t5_2t7no,2013-6-16,2013,6,16,7,1gf6pl,washingtonpost.com,Immortality by 2045 or bust: Russian tycoon wants to transfer minds to machines,https://www.reddit.com/r/Futurology/comments/1gf6pl/immortality_by_2045_or_bust_russian_tycoon_wants/,[deleted],1371334024,,7,16,False,default,,,,,
392,Futurology,t5_2t7no,2013-6-16,2013,6,16,9,1gfeyi,m.youtube.com,"Underwater colonies: Near future aquacultural farming, power generation from currents and mineral extraction",https://www.reddit.com/r/Futurology/comments/1gfeyi/underwater_colonies_near_future_aquacultural/,Aquareon,1371342412,,3,35,False,http://e.thumbs.redditmedia.com/IZ8m1M9lgLEF75od.jpg,,,,,
393,Futurology,t5_2t7no,2013-6-16,2013,6,16,14,1gfw7q,self.Futurology,Could portions of a government be run by a computer program?,https://www.reddit.com/r/Futurology/comments/1gfw7q/could_portions_of_a_government_be_run_by_a/,dudeman_hayden,1371361284,"This sounds a tad ""I, Robot""-esque but couldnt we use computer programs to maximize the efficiency of resource distribution from taxes better than a politician could? For instance: national defense. How much should we spend on it?

 [this article right here talks about how an algorithm can be used to predict social unrest](http://tpmmuckraker.talkingpointsmemo.com/2011/01/new_computer_program_predicts_likelihood_of_violen.php) . Couldn't we use algorithms like this to create a program to figure out what threats we face, what the probabilities are for them arising, and how much spending we need to allocate to national defense in order to maximize our security? 

I'd imagine that this isn't the only case of social issues being explained by a mathematical formula. Perhaps the computers could take into account all of these social and economic phenomenon from average crop yields based on climate forecasts and to how to maximize school graduation rates by distributing what schools get how much money (much more than what one human brain in the form of a politician could think through). The goal would to be to reach the maximum balance between general public satisfaction and GDP earnings, while maintaining strict rules on what human rights cannot be violated EVER, regardless of national security (which frankly, is better than most governments can claim)

Thoughts? Is it do able? Should it be done? And how could it be implemented? ",30,28,False,self,,,,,
394,Futurology,t5_2t7no,2013-6-16,2013,6,16,14,1gfwmu,hardsciencenews.com,Study Finds Teaching Complete Evolutionary Stories To Students Increases Their Learning Potential,https://www.reddit.com/r/Futurology/comments/1gfwmu/study_finds_teaching_complete_evolutionary/,presaging,1371361824,,31,255,False,default,,,,,
395,Futurology,t5_2t7no,2013-6-16,2013,6,16,21,1gg8ve,youtube.com,"""PEACE"" is in everyone's self interest - Vision of Humanity",https://www.reddit.com/r/Futurology/comments/1gg8ve/peace_is_in_everyones_self_interest_vision_of/,mind_bomber,1371385453,,16,29,False,http://a.thumbs.redditmedia.com/WcGJc6jxcgSI05er.jpg,,,,,
396,Futurology,t5_2t7no,2013-6-17,2013,6,17,1,1ggk4d,storagezilla.typepad.com,The ARM server apocalypse,https://www.reddit.com/r/Futurology/comments/1ggk4d/the_arm_server_apocalypse/,obi-nine,1371399139,,1,9,False,http://b.thumbs.redditmedia.com/HaJj4Oo8u7oJTKTU.jpg,,,,,
397,Futurology,t5_2t7no,2013-6-17,2013,6,17,2,1ggmzi,news-wtf.com,Nikola Tesla the Eugenicist: Eliminating Undesirables by 2100,https://www.reddit.com/r/Futurology/comments/1ggmzi/nikola_tesla_the_eugenicist_eliminating/,VasedertSe,1371402029,,4,0,False,http://e.thumbs.redditmedia.com/i0CG_SFTPji2rtcp.jpg,,,,,
398,Futurology,t5_2t7no,2013-6-17,2013,6,17,2,1ggou4,thoughtinfection.com,"The automation revolution can save the world, but only if we want it to.",https://www.reddit.com/r/Futurology/comments/1ggou4/the_automation_revolution_can_save_the_world_but/,mcscom,1371404070,,118,310,False,http://c.thumbs.redditmedia.com/-pw_ZgLy6O2k1WRn.jpg,,,,,
399,Futurology,t5_2t7no,2013-6-17,2013,6,17,4,1ggwym,youtube.com,Transhuman - Do you want to live forever? (full documentary film),https://www.reddit.com/r/Futurology/comments/1ggwym/transhuman_do_you_want_to_live_forever_full/,Buck-Nasty,1371411091,,44,52,False,http://c.thumbs.redditmedia.com/cb9r8YyWnjMeU6HP.jpg,,,,,
400,Futurology,t5_2t7no,2013-6-17,2013,6,17,5,1gh2sc,self.Futurology,What do you think the cut off age for immortality is?,https://www.reddit.com/r/Futurology/comments/1gh2sc/what_do_you_think_the_cut_off_age_for_immortality/,[deleted],1371416279,What age do you think (presently) is the cut off age for immortality? I know I heard that babies being presently born will be able to live 150+ years. I am 19--have I missed the cut?,43,21,False,default,,,,,
401,Futurology,t5_2t7no,2013-6-17,2013,6,17,6,1gh3kz,vimeo.com,Just an update with a small behind the scenes video on the short project Sundays that I posted before. [Old thread in comments],https://www.reddit.com/r/Futurology/comments/1gh3kz/just_an_update_with_a_small_behind_the_scenes/,[deleted],1371416991,,1,4,False,default,,,,,
402,Futurology,t5_2t7no,2013-6-17,2013,6,17,7,1gh7qf,self.Futurology,Dystopia or utopia? Do you think the future will be better than now or worse?,https://www.reddit.com/r/Futurology/comments/1gh7qf/dystopia_or_utopia_do_you_think_the_future_will/,[deleted],1371421369,"Also, what do you think qualifies as ""better""?

Predictions, folks. Let's hear 'em.

EDIT: Why are so many people here borderline marxist? Statistical anomaly? ",91,19,False,default,,,,,
403,Futurology,t5_2t7no,2013-6-17,2013,6,17,8,1ghdfj,digitaltrends.com,Augmented-reality technology will help bikers better navigate the road,https://www.reddit.com/r/Futurology/comments/1ghdfj/augmentedreality_technology_will_help_bikers/,threenoms,1371426429,,2,11,False,http://e.thumbs.redditmedia.com/nvsikWLfsuiWse5X.jpg,,,,,
404,Futurology,t5_2t7no,2013-6-17,2013,6,17,9,1ghemt,cbsnews.com,Private underwater colonization experiment sees 6 divers living in 4 submerged habitat pods for 2 weeks,https://www.reddit.com/r/Futurology/comments/1ghemt/private_underwater_colonization_experiment_sees_6/,Aquareon,1371427513,,7,44,False,http://a.thumbs.redditmedia.com/0eYz7Vcw5vwtXLpr.jpg,,,,,
405,Futurology,t5_2t7no,2013-6-17,2013,6,17,9,1ghf8i,cbc.ca,Rise of the Robots: The Automated Workforce - CBC radio interview with Martin Ford,https://www.reddit.com/r/Futurology/comments/1ghf8i/rise_of_the_robots_the_automated_workforce_cbc/,Buck-Nasty,1371428072,,3,14,False,http://f.thumbs.redditmedia.com/OrqX_Kx1TaRhEMPS.jpg,,,,,
406,Futurology,t5_2t7no,2013-6-17,2013,6,17,10,1ghipc,abc.net.au,Ocean farming: Sustainable protein for tomorrow,https://www.reddit.com/r/Futurology/comments/1ghipc/ocean_farming_sustainable_protein_for_tomorrow/,Aquareon,1371432609,,1,3,False,http://e.thumbs.redditmedia.com/sKhSvm0Pxh5s0sGX.jpg,,,,,
407,Futurology,t5_2t7no,2013-6-17,2013,6,17,14,1ghxd9,xkcd.com,xkcd: Balloon Internet,https://www.reddit.com/r/Futurology/comments/1ghxd9/xkcd_balloon_internet/,[deleted],1371445781,,0,1,False,default,,,,,
408,Futurology,t5_2t7no,2013-6-17,2013,6,17,15,1gi0oc,self.Futurology,Where are all the lecture videos from the 'Global Future 2045' conference that just finished in NYC?,https://www.reddit.com/r/Futurology/comments/1gi0oc/where_are_all_the_lecture_videos_from_the_global/,zombiesingularity,1371449246,"I can't find any videos online, anyone know when/if they'll be posted (and where)?

I'm particularly interested in the talks given by Ray Kurzweil, George Church, Marvin Minksy, Peter Diamandis, Ken Hayworth (discussing mapping the connectome of the brain), Randal Koene (discussing whole brain emulation) and the roundtable discussion on life-extension.

[**Here's a link**](http://gf2045.com/program/) to a list of all the speakers who were at the two day event, and a description of what they talked about.",10,88,False,self,,,,,
409,Futurology,t5_2t7no,2013-6-17,2013,6,17,15,1gi35o,self.Futurology,"Human knowledge doubling every 11 hours in 2014? Wait what?! Is the rate of exponential growth of human knowledge itself growing exponentially? AKA, an exponential curve on a log scale?",https://www.reddit.com/r/Futurology/comments/1gi35o/human_knowledge_doubling_every_11_hours_in_2014/,[deleted],1371452031,"I am totally confused, someone help me out here. 

I just read that [human knowledge will be doubling every 11 hours](http://epoq.wikia.com/wiki/Knowledge_doubling) by 2014 and I.... I can't wrap my head around that. Surely this can't be true? They didn't even give a source for that claim, which makes me suspicious. 

I mean...I understand exponential growth: 2, 4, 8, 16, 32... Moore's law is a great example where doubling happens every 18 months. This means that the doubling happens at a fixed rate, 18 months, and that rate, 18 months, does not change.

But is the doubling rate itself accelerating when it comes to human knowledge? 

(Suppose you have your x-axis showing shorter and shorter increments for the time it takes for a quantity to double on the y-axis). 

I'm asking this because I just did some basic excel calculations with this assumption and came to some absurd conclusions. I won't post them here because they are so ridiculous...",8,2,False,default,,,,,
410,Futurology,t5_2t7no,2013-6-17,2013,6,17,17,1gi7qm,self.Futurology,Where do you see human spaceflight going in the next 20 to 30 years?,https://www.reddit.com/r/Futurology/comments/1gi7qm/where_do_you_see_human_spaceflight_going_in_the/,douchebagtime,1371458759,"I'm thinking more along the lines of the technology and not the places, but places are fine too.",49,23,False,self,,,,,
411,Futurology,t5_2t7no,2013-6-17,2013,6,17,20,1gidif,wired.com,Now You Can Build Google's $1M Artificial Brain on the Cheap With GPU's,https://www.reddit.com/r/Futurology/comments/1gidif/now_you_can_build_googles_1m_artificial_brain_on/,Simcurious,1371469278,,63,395,False,http://b.thumbs.redditmedia.com/pwOtVOFsjYkurD17.jpg,,,,,
