,sbr,sbr_id,date,year,month,hour,day,id,domain,title,full_link,author,created,selftext,num_comments,score,over_18,thumbnail,media_provider,media_thumbnail,media_title,media_description,media_url
0,Futurology,t5_2t7no,2013-6-1,2013,6,1,9,1ffra8,weburbanist.com,Thinker Thing: 3D-Printed Object Made Using Brain Waves,https://www.reddit.com/r/Futurology/comments/1ffra8/thinker_thing_3dprinted_object_made_using_brain/,[deleted],1370045577,,2,12,False,default,,,,,
1,Futurology,t5_2t7no,2013-6-1,2013,6,1,9,1ffrq9,cyberpunkforums.com,Collective Cyberpunk Community Forums [CCCF],https://www.reddit.com/r/Futurology/comments/1ffrq9/collective_cyberpunk_community_forums_cccf/,S-ph,1370046017,,0,1,False,http://e.thumbs.redditmedia.com/gZWx6qqPZyBmtbcv.jpg,,,,,
2,Futurology,t5_2t7no,2013-6-1,2013,6,1,9,1ffttk,cnn.com,New mammoth find raises hope for clone,https://www.reddit.com/r/Futurology/comments/1ffttk/new_mammoth_find_raises_hope_for_clone/,N0BODYSPECIAL,1370048033,,0,17,False,http://d.thumbs.redditmedia.com/6DE2lt5CB9osKA6Q.jpg,,,,,
3,Futurology,t5_2t7no,2013-6-1,2013,6,1,10,1ffwig,self.Futurology,Are some countries better prepared for a 100% automated economy?,https://www.reddit.com/r/Futurology/comments/1ffwig/are_some_countries_better_prepared_for_a_100/,ajsdklf9df,1370050685,"Or in other words, who will have the best transition and who will have the worst?

Are countries in Europe, with their already existing cradle to gave social safety net, better prepared for an easy transition to an economy where 90 to 100 percent of all jobs are automated?

Among Europeans is a great exporter combined with a great social safety net, like Germany for example, most likely to have a smooth transition?

Or how about Japan, already a leader in robotics and automation, they've also had to deal with many unemployed people, especially the young, thanks to the never ending recession they have been in past 20 years. Are they closest to a switch from the current everybody needs a job economy, to the new - no one can get a job economy?

And what about the US, with its abundance of cheap labor, and hatred of all things socialist, except for social security and medicare?

What about the developing world? They have been jumping over some of the developments the industrialized world went through. For example why build out a land line phone network with all the lines and stuff, when you can just jump straight to a mobile phone network. Skip the whole land line deal. 

Could the developing world adopt to a new reality faster than the developed world? For example, some Indian sates, among them Kerala: http://en.wikipedia.org/wiki/Communism_in_Kerala
have a history of Marxist governance. Are they best poised for a transition to a fully automated economy?

If you could move anywhere, where would you go and why?



",4,0,False,self,,,,,
4,Futurology,t5_2t7no,2013-6-1,2013,6,1,12,1fg27b,youtube.com,D-Wave Quantum Computer Scaling - The quest for more qubits,https://www.reddit.com/r/Futurology/comments/1fg27b/dwave_quantum_computer_scaling_the_quest_for_more/,mind_bomber,1370056574,,14,41,False,http://a.thumbs.redditmedia.com/XjuhHFRwNrUnGg1f.jpg,,,,,
5,Futurology,t5_2t7no,2013-6-1,2013,6,1,13,1fg56s,globalpost.com,Zinc-air battery created at Stanford may eventually replace lithium-ion,https://www.reddit.com/r/Futurology/comments/1fg56s/zincair_battery_created_at_stanford_may/,Buck-Nasty,1370059668,,9,87,False,http://f.thumbs.redditmedia.com/nMUw-yFZQjj7LlfM.jpg,,,,,
6,Futurology,t5_2t7no,2013-6-1,2013,6,1,14,1fg9lv,abclocal.go.com,Oculus Rift co-founder dead(X-Post from r/Technology),https://www.reddit.com/r/Futurology/comments/1fg9lv/oculus_rift_cofounder_deadxpost_from_rtechnology/,PotentTroll,1370064835,,135,527,False,http://d.thumbs.redditmedia.com/vRrmUm_58_Amnio9.jpg,,,,,
7,Futurology,t5_2t7no,2013-6-1,2013,6,1,16,1fge2e,bbc.com,"Space Oddity, Chris Hadfield and the law in space",https://www.reddit.com/r/Futurology/comments/1fge2e/space_oddity_chris_hadfield_and_the_law_in_space/,filosoful,1370071765,,2,13,False,http://f.thumbs.redditmedia.com/yBvavURntKpOWvH5.jpg,,,,,
8,Futurology,t5_2t7no,2013-6-1,2013,6,1,16,1fgef2,vimeo.com,Eric Drexler on Nanotechnology,https://www.reddit.com/r/Futurology/comments/1fgef2/eric_drexler_on_nanotechnology/,Buck-Nasty,1370072486,,12,17,False,http://b.thumbs.redditmedia.com/LtRE0gd2t7RE1eRC.jpg,,,,,
9,Futurology,t5_2t7no,2013-6-1,2013,6,1,17,1fgfbf,youtube.com,Is Developing Artificial Intelligence (AI) Ethical? [the video is talking about how it is unethical to not create AI],https://www.reddit.com/r/Futurology/comments/1fgfbf/is_developing_artificial_intelligence_ai_ethical/,gamelizard,1370074323,,11,17,False,http://a.thumbs.redditmedia.com/mivPlmh11nQnIOYr.jpg,,,,,
10,Futurology,t5_2t7no,2013-6-1,2013,6,1,20,1fgked,wired.com,"Google wants to build trillion+ parameter deep learning machines, a thousand times bigger than the current billion parameters, When you get to a trillion parameters, youre getting to something thats got a chance of really understanding some stuff.",https://www.reddit.com/r/Futurology/comments/1fgked/google_wants_to_build_trillion_parameter_deep/,Buck-Nasty,1370085983,,82,524,False,default,,,,,
11,Futurology,t5_2t7no,2013-6-1,2013,6,1,20,1fgken,huffingtonpost.com,"'Strawscraper' Design Proposes Bizarre Addition To Stockholm Building - ""By using piezoelectric technology a large number of thin straws can produce electricity merely through small movements generated by the wind""",https://www.reddit.com/r/Futurology/comments/1fgken/strawscraper_design_proposes_bizarre_addition_to/,green_flash,1370086012,,4,15,False,http://d.thumbs.redditmedia.com/LsFpQLA_Eq78s3FQ.jpg,,,,,
12,Futurology,t5_2t7no,2013-6-1,2013,6,1,21,1fgmgx,self.Futurology,"Could experts from a wide range of different fields (neuroscience, medicine, philosophy, etc) come together and solve the problems in Artificial Intelligence?",https://www.reddit.com/r/Futurology/comments/1fgmgx/could_experts_from_a_wide_range_of_different/,[deleted],1370090050,"I remember reading something (I can't remember where) that claimed that most people working in AI agreed that most of the fundamental problems in artificial intelligence could be solved in a few days by group of the world's leading experts from various fields. To what extent is this true, and why doesn't this happen?",1,0,False,default,,,,,
13,Futurology,t5_2t7no,2013-6-1,2013,6,1,23,1fgptq,youtube.com,Google I/O 2013: Keynote - GoogleDevelopers,https://www.reddit.com/r/Futurology/comments/1fgptq/google_io_2013_keynote_googledevelopers/,mind_bomber,1370095230,,4,13,False,http://b.thumbs.redditmedia.com/KiJBmNdNWoLmlwUa.jpg,,,,,
14,Futurology,t5_2t7no,2013-6-2,2013,6,2,2,1fh29p,wimp.com,Could be the next step to hot fusion energy.,https://www.reddit.com/r/Futurology/comments/1fh29p/could_be_the_next_step_to_hot_fusion_energy/,[deleted],1370109483,,0,5,False,http://c.thumbs.redditmedia.com/tN3BGrmLh4RfaZ8J.jpg,,,,,
15,Futurology,t5_2t7no,2013-6-2,2013,6,2,4,1fh6dc,juliansarokin.com,"Practical Immortality  If Age Is a Disease, Can We Cure it?",https://www.reddit.com/r/Futurology/comments/1fh6dc/practical_immortality_if_age_is_a_disease_can_we/,jcsarokin,1370113301,,76,110,False,http://a.thumbs.redditmedia.com/mgvFEk-8YwoZuaYH.jpg,,,,,
16,Futurology,t5_2t7no,2013-6-2,2013,6,2,4,1fh96d,self.Futurology,Something that is common today but will be gone in the near future.,https://www.reddit.com/r/Futurology/comments/1fh96d/something_that_is_common_today_but_will_be_gone/,BoredBurrito,1370115963,"Can anyone name a few things we use in our daily lives now, but will be something of the past within five to ten years.

For example, I think people will soon not need phone numbers as wireless internet access is more publicly available.",56,18,False,self,,,,,
17,Futurology,t5_2t7no,2013-6-2,2013,6,2,5,1fhb87,youtube.com,"""A computer is the equivalent of a bicycle for our minds"" - Steve Jobs",https://www.reddit.com/r/Futurology/comments/1fhb87/a_computer_is_the_equivalent_of_a_bicycle_for_our/,mind_bomber,1370117902,,16,99,False,http://f.thumbs.redditmedia.com/dmRtMsosM6bXpbYA.jpg,,,,,
18,Futurology,t5_2t7no,2013-6-2,2013,6,2,6,1fhe1x,techcrunch.com,After Your Job Is Gone,https://www.reddit.com/r/Futurology/comments/1fhe1x/after_your_job_is_gone/,RushAndAPush,1370120524,,20,64,False,http://d.thumbs.redditmedia.com/Kf6svfRCKAhEI3z9.jpg,,,,,
19,Futurology,t5_2t7no,2013-6-2,2013,6,2,6,1fhfky,self.Futurology,Reality Glitch?,https://www.reddit.com/r/Futurology/comments/1fhfky/reality_glitch/,solarcity,1370121928,"Let's assume the Universe is a complicated ""program"" relying on mathematical operations (sorta like string theory, kinda). Would it be possible that the physical principles of time and space could loop or glitch? It would essentially be a random ""bit of code"" or an outlier/variation of physical properties.",2,0,False,self,,,,,
20,Futurology,t5_2t7no,2013-6-2,2013,6,2,7,1fhkl8,nytimes.com,This Man Is Not a Cyborg. Yet.,https://www.reddit.com/r/Futurology/comments/1fhkl8/this_man_is_not_a_cyborg_yet/,[deleted],1370126429,,34,102,False,default,,,,,
21,Futurology,t5_2t7no,2013-6-2,2013,6,2,7,1fhkzy,economist.com,Terminator or Robocop? - the Killer Robot discussion continues...,https://www.reddit.com/r/Futurology/comments/1fhkzy/terminator_or_robocop_the_killer_robot_discussion/,chlordane2501,1370126845,,3,14,False,http://d.thumbs.redditmedia.com/zceujH_deVAOk99o.jpg,,,,,
22,Futurology,t5_2t7no,2013-6-2,2013,6,2,9,1fhqko,youtube.com,The Social Revolution - Remember Me,https://www.reddit.com/r/Futurology/comments/1fhqko/the_social_revolution_remember_me/,mind_bomber,1370132250,,18,67,False,http://f.thumbs.redditmedia.com/rOQWdeKJy0ny2dwe.jpg,,,,,
23,Futurology,t5_2t7no,2013-6-2,2013,6,2,9,1fhrqk,brandonhtomlin.blogspot.com,"4 Part Series: The Methods Behind Futuring. Part: 1 History, Part 2: Technological Laws, Part 3: Trends, Part 4: Applying Methods.",https://www.reddit.com/r/Futurology/comments/1fhrqk/4_part_series_the_methods_behind_futuring_part_1/,timefold,1370133389,,0,16,False,default,,,,,
24,Futurology,t5_2t7no,2013-6-2,2013,6,2,10,1fhtop,nytimes.com,Camera only self driving car. (with reduced capability) A glimpse into the cheap autonomous car future?,https://www.reddit.com/r/Futurology/comments/1fhtop/camera_only_self_driving_car_with_reduced/,Mguy123456789,1370135403,,9,34,False,default,,,,,
25,Futurology,t5_2t7no,2013-6-2,2013,6,2,12,1fi0q2,self.Futurology,"Access your money from any Internet-enabled place without creating a single account or logging in anywhere - all through a single password. With BrainPay, you can do that today.",https://www.reddit.com/r/Futurology/comments/1fi0q2/access_your_money_from_any_internetenabled_place/,ThePiachu,1370142707,"[Here's a relevant Reddit post](http://www.reddit.com/r/Bitcoin/comments/1fgjxb/brainpay_a_new_way_to_send_transactions_from_your/), and here is the [BrainPay Chrome Extension](https://chrome.google.com/webstore/detail/tps-brainpay/aihogeigcnkcklfaljfimkefkmbmlomi).

So what's this all about? Well, some of you already know [Bitcoin](/r/Bitcoin), a futuristic crypto currency that uses math to make itself secure. Normally, you access your Bitcoin money through the use of a Client, which is a piece of software synchronising your computer with the rest of the Bitcoin Network, and a special wallet file containing your private keys - think of them like keys to your gold vault. The problem with the current model is that if you lose your wallet file, you lose access to your money. So some people decided to store your wallet online and access your money like a bank account - through logins and so forth. But the problem with those is that the wallet files are usually stored online so people can potentially gain access to them and steal them.

This is where BrainPay comes in. Basically, it creates your private keys on the fly from a strong password and never stores them anywhere. This means that while you still have access to your money, unless someone intercepts your password from your computer the moment you are entering it, there is no way your money can get stolen (assuming your password is strong enough). You no longer have to rely on someone else keeping your money safe for you, or worry that you can lose your money in a hard disk crash.

When I heard about the concept for the first time I was really intrigued, so I had to implement it myself. And thus, I went ahead and implemented [BrainPay](https://chrome.google.com/webstore/detail/tps-brainpay/aihogeigcnkcklfaljfimkefkmbmlomi).

Do you think we will be using such technology in the future? Is this a next step in the future of personal financing?",7,19,False,self,,,,,
26,Futurology,t5_2t7no,2013-6-2,2013,6,2,12,1fi2x3,gajitz.com,Futuristic Suit Will Make Space Diving the New Extreme Sport,https://www.reddit.com/r/Futurology/comments/1fi2x3/futuristic_suit_will_make_space_diving_the_new/,misnamed,1370144955,,48,260,False,http://c.thumbs.redditmedia.com/2NpzP483gsquOLWP.jpg,,,,,
27,Futurology,t5_2t7no,2013-6-2,2013,6,2,13,1fi5gf,dancemusicnw.com,[Feature] A Track Created Only By The Mind Documentary - emotions into brainwaves and brainwaves into sound waves - inspiring video,https://www.reddit.com/r/Futurology/comments/1fi5gf/feature_a_track_created_only_by_the_mind/,[deleted],1370147663,,0,1,False,default,,,,,
28,Futurology,t5_2t7no,2013-6-2,2013,6,2,15,1fib39,self.Futurology,Science Fiction &amp; The Future,https://www.reddit.com/r/Futurology/comments/1fib39/science_fiction_the_future/,JDNTX,1370155007,"So I've been watching a bit of a series called Prophets of Science Fiction.

If you haven't seen I'll sum it up. If I had to give the show a thesis it would be that Science Fiction seems to affect the way future technologies develop.

That's not particularly difficult to understand, but it got me wondering. What science fiction of today will become influential on the technologies of tomorrow?

Any thoughts? Books, movies, comics, whatever. I'm looking to find some Sci-Fi made within the last 20 or so years that offers some sort of unique vision of the future and the technologies in it.

",6,6,False,self,,,,,
29,Futurology,t5_2t7no,2013-6-2,2013,6,2,15,1fibcx,hpcwire.com,Is China Set to Unveil Record-Shattering Supercomputer?,https://www.reddit.com/r/Futurology/comments/1fibcx/is_china_set_to_unveil_recordshattering/,Buck-Nasty,1370155421,,25,54,False,http://c.thumbs.redditmedia.com/ABeqjArW3sfrWoKJ.jpg,,,,,
30,Futurology,t5_2t7no,2013-6-2,2013,6,2,16,1fic12,self.Futurology,How might the Syrian Civil War get reenacted decades from now?,https://www.reddit.com/r/Futurology/comments/1fic12/how_might_the_syrian_civil_war_get_reenacted/,EgaoNoGenki-III,1370156527,"You've seen how the [American Civil War gets reenacted](http://www.youtube.com/watch?v=tRY5jMvYJ_U).

However, can you imagine how reenactors would reenact the [Syrian Civil War](http://www.youtube.com/watch?v=9vdkyJ0cjgo)? What technology not available now, would help the Syrian Civil War reenactors reenact better?",3,0,False,self,,,,,
31,Futurology,t5_2t7no,2013-6-2,2013,6,2,20,1fijzl,kickstarter.com,Project Babylon 2.0 @ kickstarter,https://www.reddit.com/r/Futurology/comments/1fijzl/project_babylon_20_kickstarter/,[deleted],1370173835,,3,0,False,default,,,,,
32,Futurology,t5_2t7no,2013-6-2,2013,6,2,23,1fipi8,russellbulletin.com,"Is the US military prepared for an alien invasion? Maybe, if it's a ground war they're looking for.",https://www.reddit.com/r/Futurology/comments/1fipi8/is_the_us_military_prepared_for_an_alien_invasion/,[deleted],1370182926,,0,0,False,default,,,,,
33,Futurology,t5_2t7no,2013-6-2,2013,6,2,23,1fipnn,huffingtonpost.com,Nations should agree to a moratorium on developing robots for war that can function autonomously before it is too late to stop their use,https://www.reddit.com/r/Futurology/comments/1fipnn/nations_should_agree_to_a_moratorium_on/,Tormodb,1370183099,,126,380,False,http://d.thumbs.redditmedia.com/PJVX_O3_dNUYdI7K.jpg,,,,,
34,Futurology,t5_2t7no,2013-6-2,2013,6,2,23,1fiqe8,youtube.com,The Dangers of Big Data - THNKR,https://www.reddit.com/r/Futurology/comments/1fiqe8/the_dangers_of_big_data_thnkr/,mind_bomber,1370184011,,45,83,False,http://a.thumbs.redditmedia.com/rcooLRzB_Kpc5nrf.jpg,,,,,
35,Futurology,t5_2t7no,2013-6-3,2013,6,3,1,1fivgt,immortallife.info,Boredom is a KILLER - will it disappear in the future?,https://www.reddit.com/r/Futurology/comments/1fivgt/boredom_is_a_killer_will_it_disappear_in_the/,[deleted],1370189558,,0,1,False,default,,,,,
36,Futurology,t5_2t7no,2013-6-3,2013,6,3,5,1fjccg,news.discovery.com,Eat a Password Vitamin Daily to Log In: Motorola presents idea for a vitamin authentication pill one could take daily,https://www.reddit.com/r/Futurology/comments/1fjccg/eat_a_password_vitamin_daily_to_log_in_motorola/,mikepetroff,1370204820,,17,100,False,http://b.thumbs.redditmedia.com/B5Kp1aQ835G4xBza.jpg,,,,,
37,Futurology,t5_2t7no,2013-6-3,2013,6,3,6,1fji0d,space.com,50 Years of Presidential Visions for Space Exploration [r/FuturistParty],https://www.reddit.com/r/Futurology/comments/1fji0d/50_years_of_presidential_visions_for_space/,Xenophon1,1370209573,,0,6,False,http://c.thumbs.redditmedia.com/bVai1H6qIJlFy-DV.jpg,,,,,
38,Futurology,t5_2t7no,2013-6-3,2013,6,3,6,1fjia1,self.Futurology,The feasibility of time travel for posthumans,https://www.reddit.com/r/Futurology/comments/1fjia1/the_feasibility_of_time_travel_for_posthumans/,[deleted],1370209809,"If in the far future, a hyper-advanced human race or posthumans manage to create a way of time travel, wouldn't it be unethical for them to not travel back in time to 'uplift' us and solve all of our problems such as cancer, pointless wars and other faults? Since we haven't been visited by any time travelers perhaps it means time travel into the past will always remain impossible? Maybe they don't care? Maybe we never reach that stage because we destroy ourselves?",41,18,False,self,,,,,
39,Futurology,t5_2t7no,2013-6-3,2013,6,3,7,1fjjn8,self.Futurology,Could AI replace government?,https://www.reddit.com/r/Futurology/comments/1fjjn8/could_ai_replace_government/,Eight_Rounds_Rapid,1370210937,"I've heard this idea briefly mentioned here, but never fleshed out. How could it work? 

Would a collection of AIs run different systems or would a single one govern a country? Does it just replace the bureaucracy or the entire electoral system of representatives too? Would a benefit be that given guiding principles, an AI should be ultra efficient and immune to corruption in the traditional sense? Humans tend to fear government because other fallible, corruptible humans run it - could an AI be the ultimate benevolent arbitrator of governance?

What do you envision?

**Edit 1 -** 

A better elaboration from my comment:

""Regarding the point about corruption due to human making, I find it helpful to think of a governance AI as being much like a constitution - yes there are shitty constitutions out there that are explicitly biased towards those who wrote it, but occasionally sound democratic and rights-ensuring provisions make their way into what are some of the most enlightened documents humanity has ever conceived. 

An AI could be much the same - if the intentions are good of the founding populace, they could encode rights and principles into an intelligent entity that would forever put them beyond the tampering of dictators or corrupt politicians. 

The server farms or supercomputers the AI was hosted on could be isolated or sealed off to avoid tamping, perhaps within a ""capital territory"" inside which the AI has force jurisdiction to protect itself should the need arise. 

Any ""patches"" or updates to the AI program by a representative body of the population  would be analysed by the AI itself to judge it's consistency with its founding principles and fundamental guaranteed rights. 

So an ""intelligent self protecting constitution"" that also handles the bureaucratic functions of government. ""
 

**Edit 2 -**

It seems most people feel an AI governance system would be very hard to implement in an existing nation-state, given competing interests, entrenched values and a population unaccustomed to it. 

Perhaps an alternative would be a prototype small scale city-state built from scratch, perhaps under the collaboration of the new class of young tech rich. 

**FINAL EDIT**

A lot of people have recommended some great fiction that has explored the ideas we've all discussed here, so I thought I might compile them in one easy place for anyone who is interested. Thanks to everyone who suggested something.

- ""Player Piano"" by Kurt Vonnegut, a heavily automated society divided into two distinct classes 
- ""I, Robot"" by Issac Asimov, specifically the last story 
- ""The Culture Series"" by Iain M. Banks, for an exploration of benevolent AIs (also where my username is from by coincidence)
- ""Polity"" by Neal Asher, Human/AI empire background
- ""The Dispossessed"" by Ursula LeGuin, Libertarian moon colonists working with AI systems
- ""Neon Genesis Evangelion"", Anime
- ""PSYCHO-PASS"", Anime

Thanks!
",257,209,False,self,,,,,
40,Futurology,t5_2t7no,2013-6-3,2013,6,3,9,1fjtje,self.Futurology,How do you respond to the Luddite fallacy argument?,https://www.reddit.com/r/Futurology/comments/1fjtje/how_do_you_respond_to_the_luddite_fallacy_argument/,bean829,1370219718,"Occasionally I'll have a discussion with my conservative father about the economy. Our last discussion involved lack of jobs. His argument is that the government is the problem and the free market isn't allowed to do its thing. I point out that there is a ton more automation occurring and the need for employees is declining. Then he states that  thinking is bullshit and that there will always be enough jobs for everyone. I know in the past new industries have popped up thanks to technological innovations, but frequenting this sub and /r/Automate  on a regular basis makes me realize that we're on a tipping point.

So how do I convince/show him that jobs aren't coming back like in the past?",77,59,False,self,,,,,
41,Futurology,t5_2t7no,2013-6-3,2013,6,3,10,1fjvjr,futureleap.com,Root Cause of Grey Hair / Vitiligo Discovered; Treatment in Development,https://www.reddit.com/r/Futurology/comments/1fjvjr/root_cause_of_grey_hair_vitiligo_discovered/,Rindain,1370221424,,26,77,False,http://f.thumbs.redditmedia.com/iaV1e_96gelkI925.jpg,,,,,
42,Futurology,t5_2t7no,2013-6-3,2013,6,3,10,1fjyce,web.mit.edu,Researchers are one step closer to artificial livers,https://www.reddit.com/r/Futurology/comments/1fjyce/researchers_are_one_step_closer_to_artificial/,Medhacker,1370223894,,4,44,False,http://a.thumbs.redditmedia.com/2apYaYxWQet81jcH.jpg,,,,,
43,Futurology,t5_2t7no,2013-6-3,2013,6,3,12,1fk5mi,youtube.com,I wonder if these reactions will change with Google Glass.,https://www.reddit.com/r/Futurology/comments/1fk5mi/i_wonder_if_these_reactions_will_change_with/,Halcyon_Red,1370230338,,10,10,False,http://f.thumbs.redditmedia.com/tHNdXfiE4Vp1T2fM.jpg,,,,,
44,Futurology,t5_2t7no,2013-6-3,2013,6,3,13,1fk7e5,self.Futurology,Synthesized Voices? When will we hear good ones?,https://www.reddit.com/r/Futurology/comments/1fk7e5/synthesized_voices_when_will_we_hear_good_ones/,lenes010,1370232022,"Anybody know of any natural-sounding computer voices, or progress in that area? I want JARVIS waking me up in the mornings.

[iron man clip] http://www.youtube.com/watch?v=sXH2K2ZlrjQ",17,13,False,self,,,,,
