,sbr,sbr_id,date,year,month,hour,day,id,domain,title,full_link,author,created,selftext,num_comments,score,over_18,thumbnail,media_provider,media_thumbnail,media_title,media_description,media_url
212,Futurology,t5_2t7no,2013-6-9,2013,6,9,6,1fy1x2,self.Futurology,I think gradually decreasing the maximum allowed hours in a workweek might be a great way to usher in a post-scarcity and post-work society,https://www.reddit.com/r/Futurology/comments/1fy1x2/i_think_gradually_decreasing_the_maximum_allowed/,cybrbeast,1370725678,"Long text, but please give it a chance.

I was thinking what might happen if the governments of developed countries made new regulations which would cap the allowed workweek at 40 hours and decrease the workweek by something like two hours every year so that after ten years the maximum is 20 hours or even less. Critical jobs such as brain surgeons for example would be temporarily excluded from this rule until they can reach the capacity where it is possible to decrease the workweek without sacrificing health of patients in the case of the surgeon.

I think that while it would initially cause quite a shock to the system it would also yield a great number of benefits:

* One the one hand sharing the jobs that are still around reduces unemployment. While the scarcity of labor will increase the hourly wages as companies have to compete to be able to fill their vacancies. As hourly wages increase the huge gap that has grown over the past decades between worker productivity and wages will narrow again. In the short term this would give the middle and lower classes more money again, and since they are most likely to spend money it might boost consumption and the economy too.

* Another effect of these measures could be to speed up the transition to a post-scarcity and post-work society. This is because the increased wages of the employees will drive companies to put even more effort in automation.

* There will be a lot of people who, even with the scarcity of labor that will result, won't be able to find a job because they lack the skills and are unable to learn them. However, these people will be out of a job soon regardless of how work is arranged. I'm thinking about all the people replaced by driverless cars, 3D printing, robotics, and Watson-like systems. In the scenario I propose these people might actually have a better chance as companies might be willing to invest more in the training of low skilled people when there is such high scarcity of labor. 

* Like in all future scenarios, it will be tough for the first people who become permanently unemployed, but if the scarcity of work does result in less unemployment in the near term, paying these people a decent amount of welfare won't be such a big drain on the rest of society. 

* Another huge advantage I see is that this system almost automatically insure a somewhat gradual transition to a post-work society. People will have to find new activities to fill the extra leisure time that keeps building until it's the primary concern that labor used to be. Once people find new meaning it won't feel like they've become worthless once their day job ceases to exist. 

* The increase in leisure time of the employed will also drive an enormous expansion of the entertainment industry and technology. The demand for things to do with the increased leisure time might also create a huge number of new jobs that people like to do but can't at this point. Think about the huge increases in demand for people who can teach the whole gamut of sport, crafts, and hobbies. Also the whole education system is ripe for a revolution where the ratio of teachers to pupils increases dramatically, giving teachers nicer jobs and children a much better and personalized education.

* In this system it's also clear to everyone from the outset that unemployment is the logical endpoint of the transition. This will also help low-skilled people who become unemployed earlier to feel and be less marginalized by society.

To me this seems almost too good to be possible, so I think I might be overlooking some macro-economic disaster that this system would result in. What do you guys think?

**TL;DR**  
Gradually decreasing the workweek will make everyone better off, bring post-scarcity even closer, and prepare people and society for a life of leisure.
",98,117,False,self,,,,,
213,Futurology,t5_2t7no,2013-6-9,2013,6,9,6,1fy4gi,npr.org,MIT's Incredible Smart Sand (predicted to be perfected in 10 years),https://www.reddit.com/r/Futurology/comments/1fy4gi/mits_incredible_smart_sand_predicted_to_be/,Tobislu,1370728091,,18,136,False,http://c.thumbs.redditmedia.com/IF7al4DBcOJ1hDuD.jpg,,,,,
214,Futurology,t5_2t7no,2013-6-9,2013,6,9,7,1fy5y8,self.Futurology,We should start a political Internet Party,https://www.reddit.com/r/Futurology/comments/1fy5y8/we_should_start_a_political_internet_party/,epSos-DE,1370729449,"How about some political Internet Party that takes suggestions from the people on the Internet, instead of deciding everything behind closed doors.

We could use github for suggestions and law writing.

It seems that the established governance systems are 10 years behind reality. None of the major political parties are using the Internet for moderated decision processes. Only a few crowd sourced laws have been created until now.

I think the time is right to start an Internet based political party that uses the Internet as a tool for the people to control political decisions that are later forced upon them. Think of it like a wikipedia or a crowd-sourced type of a party. It would be messy, but powerful. Very overcrowded, but rich in ideas and passion.

Yes, I know there are the Pirate Parties and established parties that use the Internet for publicity or some form of communication, but I bet that there is almost no political party that obeys the people who democratically participate in the governance through the means of the Internet tools and communications platforms.",2,2,False,self,,,,,
215,Futurology,t5_2t7no,2013-6-9,2013,6,9,8,1fya4m,youtube.com,DJ Fresh &amp; Mindtunes: A track created only by the mind | Smirnoff,https://www.reddit.com/r/Futurology/comments/1fya4m/dj_fresh_mindtunes_a_track_created_only_by_the/,mind_bomber,1370733534,,1,8,False,http://f.thumbs.redditmedia.com/kvebfuh7IHu9TPf5.jpg,,,,,
216,Futurology,t5_2t7no,2013-6-9,2013,6,9,8,1fyagj,self.Futurology,What does /r/Futurology think of PRISM?,https://www.reddit.com/r/Futurology/comments/1fyagj/what_does_rfuturology_think_of_prism/,[deleted],1370733879,"The U.S. government is trying to read some of the private data from large companies like Google, Microsoft, and Yahoo.

So, with all this talk of privacy concerns (and a lot of referencing Orwell's 1984), what does /r/Futurology think of this PRISM program?",29,30,False,self,,,,,
217,Futurology,t5_2t7no,2013-6-9,2013,6,9,8,1fyc7e,seriouswonder.com,Methods for Furturing: Part 1  Learning From History,https://www.reddit.com/r/Futurology/comments/1fyc7e/methods_for_furturing_part_1_learning_from_history/,[deleted],1370735679,,0,1,False,default,,,,,
218,Futurology,t5_2t7no,2013-6-9,2013,6,9,9,1fye1e,youtu.be,Jeremy Rifkin on global issues and the future of our planet,https://www.reddit.com/r/Futurology/comments/1fye1e/jeremy_rifkin_on_global_issues_and_the_future_of/,evolutiveEARTH,1370737595,,0,5,False,http://a.thumbs.redditmedia.com/TmeVCZL3AP3vkHUB.jpg,,,,,
219,Futurology,t5_2t7no,2013-6-9,2013,6,9,9,1fyei9,self.Futurology,Is privacy a relic of the past?,https://www.reddit.com/r/Futurology/comments/1fyei9/is_privacy_a_relic_of_the_past/,this_thadd,1370738081,"In the Culture series of novels by Iain Banks, he comments that there's really no such thing as privacy in the far future (with the exception of your consciousness, i.e. your private thoughts).

In light of the recent spying news, is the loss of privacy an inevitable consequence of technological advancement and if so, how do we adapt to it? If not, what does a future where privacy remains intact look like when technology makes it so easy to spy?",5,11,False,self,,,,,
220,Futurology,t5_2t7no,2013-6-9,2013,6,9,10,1fyj4g,self.Futurology,Most medical treatments are chemical based. When do you think we will see a shift to physical based treatments? Is this already on the horizon?,https://www.reddit.com/r/Futurology/comments/1fyj4g/most_medical_treatments_are_chemical_based_when/,curiousx,1370742765,"I'm mainly referring to using physical nano-scale objects to root out and neutralize various disease elements.  I see this coming in 2 phases.  
  

1) molecular objects used to deliver drugs or disrupt disease pathways  
2) molecular machines that circulate in the body and physically destroy disease  
  
Are there any companies working on nano-scale machines to rid the body of disease?  I have a feeling some obscure companies are in a race to be first.  Whichever company gets there first will not doubt be the next Intel or Microsoft.  They'll be a trillion dollar corporation.",5,6,False,self,,,,,
221,Futurology,t5_2t7no,2013-6-9,2013,6,9,11,1fyjrh,self.Futurology,Can we make an obligatory time estimate for posts about future technology? Something like [~5 years].,https://www.reddit.com/r/Futurology/comments/1fyjrh/can_we_make_an_obligatory_time_estimate_for_posts/,Tobislu,1370743417,"Not only would it give people a more immediate view of the future, but it would also make timelines MUCH easier.",0,0,False,self,,,,,
222,Futurology,t5_2t7no,2013-6-9,2013,6,9,11,1fyl73,self.Futurology,THINKER: Will rape laws soon be a relic of the past?,https://www.reddit.com/r/Futurology/comments/1fyl73/thinker_will_rape_laws_soon_be_a_relic_of_the_past/,officialdanieltosh,1370744856,,0,1,False,default,,,,,
223,Futurology,t5_2t7no,2013-6-9,2013,6,9,11,1fyltp,youtube.com,Controlling a Flying Robot... With Your Mind,https://www.reddit.com/r/Futurology/comments/1fyltp/controlling_a_flying_robot_with_your_mind/,Quipster99,1370745417,,2,10,False,http://e.thumbs.redditmedia.com/YU8dPQaqQOnMmzpj.jpg,,,,,
224,Futurology,t5_2t7no,2013-6-9,2013,6,9,11,1fymat,nextbigfuture.com,Vacuum pumps 300x smaller &amp; 10x less power,https://www.reddit.com/r/Futurology/comments/1fymat/vacuum_pumps_300x_smaller_10x_less_power/,Wicked_Inygma,1370745879,,2,18,False,http://a.thumbs.redditmedia.com/WK2370-2PUyERtf0.jpg,,,,,
225,Futurology,t5_2t7no,2013-6-9,2013,6,9,12,1fypup,c-spanvideo.org,"Cities of the Future - Annalee Newitz talked about her Discover Magazine article on death-proofing a city, converting urban spaces into biological organisms to prevent starvation and environmental destruction",https://www.reddit.com/r/Futurology/comments/1fypup/cities_of_the_future_annalee_newitz_talked_about/,slappymcnutface,1370749368,,0,54,False,http://d.thumbs.redditmedia.com/eP0nyvlZpQqcs5pE.jpg,,,,,
226,Futurology,t5_2t7no,2013-6-9,2013,6,9,17,1fz200,youtube.com,Money &amp; Life:A nice documentary dealing only with money and its effects on society today.,https://www.reddit.com/r/Futurology/comments/1fz200/money_lifea_nice_documentary_dealing_only_with/,[deleted],1370766268,,1,10,False,http://e.thumbs.redditmedia.com/D81l3twBpgS6Ajsp.jpg,,,,,
227,Futurology,t5_2t7no,2013-6-9,2013,6,9,17,1fz28t,youtube.com,Mike Schmidt@TEDxUVM - The Robotic Scientist: Accelerating Discovery with Eureqa,https://www.reddit.com/r/Futurology/comments/1fz28t/mike_schmidttedxuvm_the_robotic_scientist/,cybrbeast,1370766779,,0,16,False,http://e.thumbs.redditmedia.com/wKzhK1jLbtjtf4Jv.jpg,,,,,
228,Futurology,t5_2t7no,2013-6-9,2013,6,9,19,1fz4wq,ieet.org,"The Hubris of Neo-Luddism; Essay, Institute for Ethics &amp; Emerging Technologies, 2nd most popular item of May, republished by H+ Magazine, ImmortalLife.info and Transhumanity.net. Featured by RealClearScience.com, BioMedLaw.com, PhillyFuturists.org, News.Silobreaker.com",https://www.reddit.com/r/Futurology/comments/1fz4wq/the_hubris_of_neoluddism_essay_institute_for/,signalscience,1370773119,,0,3,False,http://c.thumbs.redditmedia.com/NRxxOI9lY1R-qdQz.jpg,,,,,
229,Futurology,t5_2t7no,2013-6-9,2013,6,9,19,1fz58t,guardian.co.uk,What happened when I had my genome sequenced,https://www.reddit.com/r/Futurology/comments/1fz58t/what_happened_when_i_had_my_genome_sequenced/,usrname42,1370773872,,8,57,False,http://b.thumbs.redditmedia.com/8MwvpEACfW5RSq-O.jpg,,,,,
230,Futurology,t5_2t7no,2013-6-9,2013,6,9,22,1fzacm,youtube.com,European Citizens' Initiative for an Unconditional Basic Income,https://www.reddit.com/r/Futurology/comments/1fzacm/european_citizens_initiative_for_an_unconditional/,cybrbeast,1370784456,,898,932,False,http://b.thumbs.redditmedia.com/FcwucVJ06vYuYCuC.jpg,,,,,
231,Futurology,t5_2t7no,2013-6-9,2013,6,9,22,1fzaz0,itechpost.com,Quantum teleportation between clouds of gas is now reliable,https://www.reddit.com/r/Futurology/comments/1fzaz0/quantum_teleportation_between_clouds_of_gas_is/,ravencef,1370785421,,1,2,False,http://f.thumbs.redditmedia.com/iHLM_MVokh4UmaDM.jpg,,,,,
232,Futurology,t5_2t7no,2013-6-9,2013,6,9,23,1fzdu4,youtube.com,The rise of personal robots - Cynthia Breazeal | TEDtalksDirector,https://www.reddit.com/r/Futurology/comments/1fzdu4/the_rise_of_personal_robots_cynthia_breazeal/,mind_bomber,1370789241,,1,5,False,http://c.thumbs.redditmedia.com/AZO7hGY1Rg8N99Ob.jpg,,,,,
233,Futurology,t5_2t7no,2013-6-9,2013,6,9,23,1fze4m,waltherpragerandphilosophy1.blogspot.ro,Some great expectations,https://www.reddit.com/r/Futurology/comments/1fze4m/some_great_expectations/,[deleted],1370789551,,0,1,False,default,,,,,
234,Futurology,t5_2t7no,2013-6-10,2013,6,10,4,1fztug,thoughtinfection.com,"Exploding into the Age of Quantum Computing - ""I am become death, the destroyer of economies""",https://www.reddit.com/r/Futurology/comments/1fztug/exploding_into_the_age_of_quantum_computing_i_am/,mcscom,1370804419,,11,31,False,http://c.thumbs.redditmedia.com/-pw_ZgLy6O2k1WRn.jpg,,,,,
235,Futurology,t5_2t7no,2013-6-10,2013,6,10,4,1fzuxl,hardsciencenews.com,Cellular Based Precise Nutrition Production Could Feed The World Using a Land Area Smaller Than New York City,https://www.reddit.com/r/Futurology/comments/1fzuxl/cellular_based_precise_nutrition_production_could/,apmechev,1370805343,,9,28,False,http://b.thumbs.redditmedia.com/aBLG9ZW24H4_1xAs.jpg,,,,,
236,Futurology,t5_2t7no,2013-6-10,2013,6,10,4,1fzy4b,finance.yahoo.com,Genetically Engineering an Icon: Can Biotech Bring the Chestnut Back to America's Forests?,https://www.reddit.com/r/Futurology/comments/1fzy4b/genetically_engineering_an_icon_can_biotech_bring/,Yosarian2,1370807898,,4,10,False,http://d.thumbs.redditmedia.com/CN6vQhA_D8caJ5lW.jpg,,,,,
237,Futurology,t5_2t7no,2013-6-10,2013,6,10,11,1g0ovi,self.Futurology,"I have seen a lot of news that insects can feed the world, have superb nutritional qualities, far less environmental impact, etc. So how do I get started?",https://www.reddit.com/r/Futurology/comments/1g0ovi/i_have_seen_a_lot_of_news_that_insects_can_feed/,curiousx,1370830391,"Ok, I'm in.  I would much prefer eating bugs than beef and chicken.  The nutritional values are amazing.  2 Billion people already consume bugs daily.  As someone living in the western world how could I get started farming my own bugs at home?  I don't intend to eat them whole but I would happily cook them up and then liquify them in my Vitamix to add to soups etc.  What are the logistics of home bug farming, can this be dangerous in any way?",39,71,False,self,,,,,
238,Futurology,t5_2t7no,2013-6-10,2013,6,10,12,1g0ss5,iontom.com,"The Digital Parallel Universe: my nine months of research on procedural generation, and considerations about how micro-contracts built into open source content could change the way people earn money",https://www.reddit.com/r/Futurology/comments/1g0ss5/the_digital_parallel_universe_my_nine_months_of/,ion-tom,1370833635,,3,17,False,http://f.thumbs.redditmedia.com/gJUlqZLP827c0ZPM.jpg,,,,,
239,Futurology,t5_2t7no,2013-6-10,2013,6,10,12,1g0ss9,m.guardiannews.com,My own genome project,https://www.reddit.com/r/Futurology/comments/1g0ss9/my_own_genome_project/,[deleted],1370833641,,0,1,False,default,,,,,
240,Futurology,t5_2t7no,2013-6-10,2013,6,10,16,1g18av,vimeo.com,The Power of Community (2006 documentary) - How Cuba survived Peak Oil [And some lessons we can take from them],https://www.reddit.com/r/Futurology/comments/1g18av/the_power_of_community_2006_documentary_how_cuba/,JamieKlinger,1370851021,,1,1,False,http://c.thumbs.redditmedia.com/DIDpbn44wviHGuPb.jpg,,,,,
241,Futurology,t5_2t7no,2013-6-10,2013,6,10,17,1g18w8,guardian.co.uk,"Iain M. Banks, author of The Culture Series, dies at age 59",https://www.reddit.com/r/Futurology/comments/1g18w8/iain_m_banks_author_of_the_culture_series_dies_at/,Eight_Rounds_Rapid,1370852101,,66,373,False,http://b.thumbs.redditmedia.com/s-2fAuJMqE8bCZpm.jpg,,,,,
242,Futurology,t5_2t7no,2013-6-10,2013,6,10,18,1g1b85,technologyreview.com,The Avatar Will See You Now: an experiment in remote medical care,https://www.reddit.com/r/Futurology/comments/1g1b85/the_avatar_will_see_you_now_an_experiment_in/,Yosarian2,1370856521,,0,11,False,http://b.thumbs.redditmedia.com/VeaCWZvptzY5tHY7.jpg,,,,,
243,Futurology,t5_2t7no,2013-6-10,2013,6,10,20,1g1eua,asianscientist.com,Metal-Free Graphene Catalyst Outperforms Platinum In Fuel Cell | Asian Scientist Magazine,https://www.reddit.com/r/Futurology/comments/1g1eua/metalfree_graphene_catalyst_outperforms_platinum/,DaPorter,1370863486,,5,60,False,http://f.thumbs.redditmedia.com/ZakuWmwyvp2tVCvG.jpg,,,,,
244,Futurology,t5_2t7no,2013-6-10,2013,6,10,23,1g1mmj,self.Futurology,"So with human analysts releasing secret data, wont they speed up using A.I?",https://www.reddit.com/r/Futurology/comments/1g1mmj/so_with_human_analysts_releasing_secret_data_wont/,poincare_theorem,1370873470,If I was a massively funded hyper tech secret organisation why not just start funding artificial intelligence to analyse data. Discuss!,8,14,False,self,,,,,
245,Futurology,t5_2t7no,2013-6-11,2013,6,11,0,1g1s8x,timesofindia.indiatimes.com,"India developing robotic soldiers to replace humans in warfare -- ""Slowly in due course of time, the robotic soldier would be at the front end and the human soldier would be assisting him""",https://www.reddit.com/r/Futurology/comments/1g1s8x/india_developing_robotic_soldiers_to_replace/,mepper,1370878315,,24,108,False,http://a.thumbs.redditmedia.com/roEruiXu-M-sfrG6.jpg,,,,,
246,Futurology,t5_2t7no,2013-6-11,2013,6,11,0,1g1sdq,designboom.com,Tallest building in the world [x-post from r/architecture],https://www.reddit.com/r/Futurology/comments/1g1sdq/tallest_building_in_the_world_xpost_from/,Red076,1370878427,,9,10,False,http://d.thumbs.redditmedia.com/l_9H0cc2c1sg3mXQ.jpg,,,,,
247,Futurology,t5_2t7no,2013-6-11,2013,6,11,0,1g1sn0,randalolson.com,Evolved artificial intelligence can play video games better than humans,https://www.reddit.com/r/Futurology/comments/1g1sn0/evolved_artificial_intelligence_can_play_video/,[deleted],1370878616,,0,0,False,default,,,,,
248,Futurology,t5_2t7no,2013-6-11,2013,6,11,1,1g1vrg,forum.uschamber.com,Will Big Data change the Big City?,https://www.reddit.com/r/Futurology/comments/1g1vrg/will_big_data_change_the_big_city/,Franconia,1370880983,,0,2,False,default,,,,,
249,Futurology,t5_2t7no,2013-6-11,2013,6,11,1,1g1w3w,technologyreview.com,"Space-based quantum communications experiment from China. ""Chinese Quantum Science Satellite"" to launch in 2016, could make China the first space-faring nation with quantum communication capability.",https://www.reddit.com/r/Futurology/comments/1g1w3w/spacebased_quantum_communications_experiment_from/,aluminio,1370881249,,9,72,False,http://f.thumbs.redditmedia.com/qXvP_7tTyV5aSnQk.jpg,,,,,
250,Futurology,t5_2t7no,2013-6-11,2013,6,11,1,1g1wrx,grist.org,Marijuana vending machines are the future of recreational drug use,https://www.reddit.com/r/Futurology/comments/1g1wrx/marijuana_vending_machines_are_the_future_of/,troglozyte,1370881743,,108,554,False,http://e.thumbs.redditmedia.com/CLj8IGhfr0v3zB8p.jpg,,,,,
251,Futurology,t5_2t7no,2013-6-11,2013,6,11,1,1g1y3v,youtube.com,Andrew McAfee: What will future jobs look like?,https://www.reddit.com/r/Futurology/comments/1g1y3v/andrew_mcafee_what_will_future_jobs_look_like/,data-stream,1370882779,,9,42,False,http://c.thumbs.redditmedia.com/MmWoJUTzo17HtdnP.jpg,,,,,
252,Futurology,t5_2t7no,2013-6-11,2013,6,11,2,1g234u,basicincoming.blogspot.se,"""...a #basicincome will optimize the flow of resources..."" #hypermimesis #memetics",https://www.reddit.com/r/Futurology/comments/1g234u/a_basicincome_will_optimize_the_flow_of_resources/,bipedaljoe,1370886448,,0,1,False,default,,,,,
253,Futurology,t5_2t7no,2013-6-11,2013,6,11,3,1g248d,technologyreview.com,Human-Scale Invisibility Cloak Unveiled - Researchers demonstrate an invisibility cloak that can be scaled to almost any size and say it could be used to hide orbiting satellites,https://www.reddit.com/r/Futurology/comments/1g248d/humanscale_invisibility_cloak_unveiled/,[deleted],1370887210,,0,1,False,default,,,,,
254,Futurology,t5_2t7no,2013-6-11,2013,6,11,4,1g2a10,hydrofusion.com,Hydro Fusion looking to give a 1 MW LENR heating plant to a pilot customer,https://www.reddit.com/r/Futurology/comments/1g2a10/hydro_fusion_looking_to_give_a_1_mw_lenr_heating/,Nihy,1370891225,,1,0,False,http://f.thumbs.redditmedia.com/WgG8GvpMqeR-n-qS.jpg,,,,,
255,Futurology,t5_2t7no,2013-6-11,2013,6,11,4,1g2bk2,wired.co.uk,"Predator Much? Lightweight, micrometre-thin invisibility cloak shields from all angles",https://www.reddit.com/r/Futurology/comments/1g2bk2/predator_much_lightweight_micrometrethin/,sickeninghero,1370892287,,0,4,False,http://b.thumbs.redditmedia.com/ASLAD7o38dQByxwU.jpg,,,,,
256,Futurology,t5_2t7no,2013-6-11,2013,6,11,4,1g2cbw,self.Futurology,The future of Trucking,https://www.reddit.com/r/Futurology/comments/1g2cbw/the_future_of_trucking/,partyrobots,1370892831,"I know this isn't a sexy subject like quantum computing or AI, but the future of the transportation of goods (B2B and B2C) is something that I think about from time to time because well, I operate a transportation and logistics business! 


I have a difficult time thinking of self-driving trucks and such just because I see the industry the way it is now, and couldn't fathom a world without truck drivers because let's face it, literally everything you eat, use, wear, drink, and otherwise consume is brought to you (or your retail store) via truck, delivery van, 5-ton, 53' highway trailer, flat deck, intermodal container, ocean container, etc. And then take into account the industrial side of the transportation industry and all the B2B trucking that happens! 



So my question is, where do you think the industry is going in terms of technology and advancements? I'd like to hear what you people think!",30,9,False,self,,,,,
257,Futurology,t5_2t7no,2013-6-11,2013,6,11,6,1g2kmx,unamur.be,"A Brief History of Piracetam, ""a drug in search of a disease"" [r/Nootropics]",https://www.reddit.com/r/Futurology/comments/1g2kmx/a_brief_history_of_piracetam_a_drug_in_search_of/,Xenophon1,1370898327,,1,5,False,default,,,,,
258,Futurology,t5_2t7no,2013-6-11,2013,6,11,7,1g2pns,33rdsquare.com,Andrew McAfee Asks - What Will Future Jobs Look Like? Read more: http://www.33rdsquare.com/2013/06/andrew-mcafee-asks-what-will-future.html#ixzz2VqxipoME,https://www.reddit.com/r/Futurology/comments/1g2pns/andrew_mcafee_asks_what_will_future_jobs_look/,33rdsquare,1370901604,,0,1,False,default,,,,,
259,Futurology,t5_2t7no,2013-6-11,2013,6,11,7,1g2u3x,thevenusproject.com,Cities in the Sea - Aquatic design from the folks at the Venus Project,https://www.reddit.com/r/Futurology/comments/1g2u3x/cities_in_the_sea_aquatic_design_from_the_folks/,theteuth,1370904754,,1,7,False,http://a.thumbs.redditmedia.com/gRTbYaeQsLSbRh_x.jpg,,,,,
260,Futurology,t5_2t7no,2013-6-11,2013,6,11,7,1g2u4y,youtu.be,Biosphere 2: An American Space Odyssey - Retro Report,https://www.reddit.com/r/Futurology/comments/1g2u4y/biosphere_2_an_american_space_odyssey_retro_report/,intravenus_de_milo,1370904775,,1,10,False,http://b.thumbs.redditmedia.com/O4eWeZ8s2fx6eOrI.jpg,,,,,
261,Futurology,t5_2t7no,2013-6-11,2013,6,11,7,1g2udd,masonsmusings.wordpress.com,"More than 1 in 3 Americans now own Tablets, what do you think the impact of the rise of tablets is going to be on the developing world?",https://www.reddit.com/r/Futurology/comments/1g2udd/more_than_1_in_3_americans_now_own_tablets_what/,Masowb8,1370904939,,7,10,False,http://d.thumbs.redditmedia.com/hSy11BCcOn0JFAuc.jpg,,,,,
262,Futurology,t5_2t7no,2013-6-11,2013,6,11,7,1g2uf3,ted.com,TED: What future jobs will look like,https://www.reddit.com/r/Futurology/comments/1g2uf3/ted_what_future_jobs_will_look_like/,Aceofspades25,1370904979,,3,21,False,http://c.thumbs.redditmedia.com/y-m2lvUFq1DUlfWh.jpg,,,,,
263,Futurology,t5_2t7no,2013-6-11,2013,6,11,8,1g2ve6,umn.edu,Controlling a flying robot...with only your brain,https://www.reddit.com/r/Futurology/comments/1g2ve6/controlling_a_flying_robotwith_only_your_brain/,blinkergoesleft,1370905713,,0,1,False,http://b.thumbs.redditmedia.com/vFvMy88lgN8tAx-C.jpg,,,,,
264,Futurology,t5_2t7no,2013-6-11,2013,6,11,8,1g2w3j,news.sky.com,Flying trays to replace waitresses by 2014 at this Sushi restaurant,https://www.reddit.com/r/Futurology/comments/1g2w3j/flying_trays_to_replace_waitresses_by_2014_at/,blinkergoesleft,1370906278,,11,10,False,http://f.thumbs.redditmedia.com/oo203mZ6JmGWsHpY.jpg,,,,,
