,date,year,month,day,hour,id,title,full_link,author,created,selftext,num_comments,score
953,2014-5-16,2014,5,16,1,25mxgs,Self-learning Humanoid Amelia poses existential threat to BPOs,https://www.reddit.com/r/Futurology/comments/25mxgs/selflearning_humanoid_amelia_poses_existential/,starspawn0,1400171583,"http://www.zdnet.com/self-learning-humanoid-amelia-poses-existential-threat-to-bpos-7000029286/

It sounds over-the-top.  Also see this, even more grandiose statement:

http://www.ipsoft.com/promo/turing-centennial

On the other hand, the company has some bragging rights.  See what Gartner analysts had to say about the company:


&gt; Both Blue Prism and Interactive Media are at the first level of an extended spectrum of autonomic platforms, as these platforms primarily use structured/repeatable rule-based processes with a defined start and endpoint, such as data re-entry tasks. IBM, with Watson, is several levels higher on the spectrum; **and IPsoft's cognitive platform is the next level up from that.**

&gt; In October 2013, IBM announced the Cognitive Systems Colloquium where IBM reached out to partners in academia, industry and its client base in ""an effort to hasten and guide the progress of cognitive computing."" And just one month later, in November 2013, there was the announcement of IBM's Watson as a development platform on the cloud. Additionally, Crdit Agricole CIB in the U.S. (financial advisors) have predicted that the market for Watson-derived smart advisors will account for more than 12% of IBM's total revenue in 2018 (see ""Smart Machines Mean Big Impacts: Benefits, Risks and Massive Disruption""). Similarly, albeit with less fanfare, IPsoft is a global managed services provider of autonomic-based services that is also generating a significant amount of interest and insider buzz within the IT services marketplace. **Gartner analysis of IPsoft's cognitive platforms is that its approach is a breakthrough innovation in service delivery and serves as a proof point for the end of outsourcing as we know it. Gartner verified over 10 direct examples of IPsoft client references that all unanimously supported productivity benefits of a much higher magnitude (consistently over 50%) than any other managed services offerings in the industry. It's rare to find a unanimous endorsement of this type. One client example had 56% of its client incidents resolved without human intervention and a 60% reduction in the mean time to resolution for its IT service desk.**
",0,12
954,2014-5-16,2014,5,16,1,25mzgd,Makers grapple with how to integrate their data to the rest of the 'Internet of Things',https://www.reddit.com/r/Futurology/comments/25mzgd/makers_grapple_with_how_to_integrate_their_data/,CalebGarling,1400172805,,2,4
955,2014-5-16,2014,5,16,1,25mzy7,Womans cancer killed by measles virus in unprecedented trial,https://www.reddit.com/r/Futurology/comments/25mzy7/womans_cancer_killed_by_measles_virus_in/,DerpyGrooves,1400173128,,1,4
956,2014-5-16,2014,5,16,2,25n19j,"The Myths, Realities, and Ethics of Neuroenhancement 'The only drug thats helped anyone win the Nobel Prize is LSD, he said, referring to famed laureate Kary Mullis, who has spoken about LSD's role in his invention of PCR in DNA sequencing.'",https://www.reddit.com/r/Futurology/comments/25n19j/the_myths_realities_and_ethics_of/,DerpyGrooves,1400173887,,29,144
957,2014-5-16,2014,5,16,2,25n1n5,What the FCC paid priority plan will do to the future of technology,https://www.reddit.com/r/Futurology/comments/25n1n5/what_the_fcc_paid_priority_plan_will_do_to_the/,ion-tom,1400174106,"Today the [FCC decided to propose policy](http://www.washingtonpost.com/blogs/the-switch/wp/2014/05/15/fcc-approves-plan-to-allow-for-paid-priority-on-internet/) whereby the common carrier expectation of the internet will no longer be considered by internet service providers. This means that certain sites will need to pay Comcast or your mobile carrier a structured fee, otherwise they will not be allowed to stream content to your client device.

Recently I've been going through the paperwork of trying to start a startup with a friend of mine. However, this change in policy is going to start impacting cloud services **HARD.** The purpose of this policy is to funnel revenue from the hands of content creators or internet retailers into the hands of the ISPs. Within a year, it's going to accelerate the death cycle on startups, and make the market for new ones essentially impossible (without sponsorship/approval by big players.)

Have you heard of ""internet of things"" which is often talked about in this sub? Where people have wearables and all your devices are synced to the net and then usable to analyze everything from health to climate? This new FCC policy will likely push this reality off by another decade or so.

This new policy might also shutdown a vast array of distributed technologies. Distributed systems have no central authority by which to pay off ISP data usage rates. This will kill (or significantly hurt) the following:

* High bandwidth usage connected devices
* Cyptocurrency &amp; DACs
* VPNs and Onion networks
* Torrents and any P2P
* Small services with WebRTC
* Scientific projects using BOINC
* Startups hosting on AWS, Azure, Heroku will see massive rate hikes
* Sites which significantly rely on aggregating services through an API (iftt.com, etc)

**My prediction:** By Q4 2015, we will experience a larger recession than the one in 2008, triggered first by another DotCom bust. This will have a long term destructive impact on the future of the US and will have global repercussions.

At this stage, the hostile political climate of lobbyist-&gt;committee-chair is putting progress into reverse for the US economy. **Comcast has lobbied to destroy the American Future, and they won.** 

This new policy is not fight-able in a kangaroo court. We do have 120 days to protest this policy, but nothing short of an internet ""Freedom March"" or widescale domestic disturbance will change the minds of the FCC panel.

I think it's time for entrepreneurial types and scientists to abandon the United States and emigrate to better conditions. Which countries have the most favorable internet conditions and are most open to immigration?

What are your predictions for the impact from this new policy?

**Edit:** Would anybody be interested in starting a petition that would show congress how much business would get lost if this legislation passes? It would state your occupation, onlline assets, and how this would affect you. 

(Example: I own a business/website and this law would cause me to emigrate or to close my business in the US) 

On the plus side, anybody who expedites American emigration to foreign countries could do very well for themselves in these circumstances. I'd move to Europe, Iceland or New Zealand in a heartbeat if it were easy.

Is there any action that the people can take? Not much, but you can [follow the step here.](https://www.dearfcc.org/)",117,305
958,2014-5-16,2014,5,16,2,25n2o9,"A new company wants to pedal forward with what it's calling the world's first smart and connected bicycle. The concept is part of a greater effort to help bikers keep their eyes on the road, especially during high-traffic commuting times.",https://www.reddit.com/r/Futurology/comments/25n2o9/a_new_company_wants_to_pedal_forward_with_what/,blinke1,1400174735,,2,6
959,2014-5-16,2014,5,16,2,25n2pm,3D Printing and disruptive Scenarios,https://www.reddit.com/r/Futurology/comments/25n2pm/3d_printing_and_disruptive_scenarios/,[deleted],1400174757,,0,1
960,2014-5-16,2014,5,16,2,25n2yv,Velodyne CEO David Hall Interview (Inventor of Velodyne LiDAR) + his thoughts on Autonomous Vehicles - [25:07],https://www.reddit.com/r/Futurology/comments/25n2yv/velodyne_ceo_david_hall_interview_inventor_of/,[deleted],1400174899,,0,10
961,2014-5-16,2014,5,16,3,25n6nz,Imogen Heap demonstrates a motion and gesture based approach to performing forward thinking electronic music,https://www.reddit.com/r/Futurology/comments/25n6nz/imogen_heap_demonstrates_a_motion_and_gesture/,CONelson,1400176979,,1,6
962,2014-5-16,2014,5,16,3,25n9k6,Jaunt VR Reveal How Their 3D 360 Video Technology Works at SVVR #10,https://www.reddit.com/r/Futurology/comments/25n9k6/jaunt_vr_reveal_how_their_3d_360_video_technology/,scottknowls,1400178673,,0,1
963,2014-5-16,2014,5,16,3,25nbh1,(Short Film) FUTURESTATES - A Robot Walks into a Bar - futurestates.tv,https://www.reddit.com/r/Futurology/comments/25nbh1/short_film_futurestates_a_robot_walks_into_a_bar/,mind_bomber,1400179801,,1,9
964,2014-5-16,2014,5,16,4,25ndkd,5 Optimistic News Headlines People Will Read In 100 Years Time,https://www.reddit.com/r/Futurology/comments/25ndkd/5_optimistic_news_headlines_people_will_read_in/,jondavidbrooks,1400181012,,0,1
965,2014-5-16,2014,5,16,4,25nfvz,"New battery tech may lead to inexpensive, safer electric cars",https://www.reddit.com/r/Futurology/comments/25nfvz/new_battery_tech_may_lead_to_inexpensive_safer/,DefendHouston,1400182390,,12,59
966,2014-5-16,2014,5,16,4,25nii2,"Michio Kaku: ""The map of the brain make us immortal""",https://www.reddit.com/r/Futurology/comments/25nii2/michio_kaku_the_map_of_the_brain_make_us_immortal/,darkmortem,1400183858,"[interview video](http://www.nbcnews.com/feature/meet-the-press-24-7/unlocking-secrets-brain-dr-michio-kaku-press-pass-n97046)

-------------------------------------------------------------------
Interview Text
-------------------------------------------------------------------
**Why this book now?**

We have learned more about the brain in the last 10 years than in the entire history of mankind. Now there is telepathy, can move objects with his mind, simple register and download memories, dreams or photograph. Thanks to physics, we can see how blood moves into the brain, primarily oxygen, and see the neuronal activity, thoughts. We can also connect the brain to a computer and then the internet. Ultimately, the Internet will become a network of the brain ( brain- net). We may share thoughts and emotions on the network. Young people will love. Not only may put on Facebook what they are doing, but the memory of course prom or first date. We will have two albums in the future, genome, all the genes in our body, and the connectome, the map of neural connections with memories, feelings and personality. Everything will be on two discs. Obama and the EU invest in short term this because we understand mental illness. In the long term, we can live forever. Even after death, our genome and our mental map survive. We can resurrect sensations and memories. In a sense, we become immortal.

**When will it be accessible to any brain-computer connection?**

The Pentagon is spending tens of millions of dollars in prosthetic legs, arms and robotic skeletons because there are thousands of war wounded from Iraq and Afghanistan. In the World Cup in Brazil a person who is partially paralyzed will launch the kick off thanks to an exoskeleton. Now we can connect the mind of a person with a spinal injury to a computer to do the same to anyone. My colleague Stephen Hawking is completely paralyzed , only flashes. But the right lens of his glasses have a chip with an antenna connected to a notebook that allows you to communicate and mentally. In the next decade , people with paralysis can move and communicate. The first to be connected will be the victims of sports injuries , strokes or car accidents. Later, we can create people with superpowers. We have already downloaded memories in animals. Last year , it was in North Carolina: I grab a mouse, you connect your hippocampus you record two electrons and the messages that travel through the hippocampus when learning a task. Then forget it. But if you insert the memory in the animal, the mouse does good job on the first try.

**Which is closer?**

The short-term goal is to build a pacemaker for the brain of Alzheimer's patients, for the millions who do not know where they live or who they are. In the future, you will have a button shall squeeze and remember who you are, where you live and where you need to go. In this decade we animal studies , recording and downloading memories, and the next we will do with humans. In the 2030s, we can download complex tasks, such as for workers who have to learn new skills because their jobs have become obsolete or youth skipped a course at the University.

**What has surprised you most?**

The longer we can photograph a thought. In Berkeley, put patients on a brain scan and convert 30,000 points in mind. These points represent the brain flows. A computer analyzes and creates a picture of the thoughts. The pictures are blurry because we are in the initial phase.

**Who are we if our consciousness can be downloaded?**

How would the former president Bill Clinton, it depends on how you define who you are. When you die, there may be a soul. Or maybe there is nothing left, but if I have the genome and the information in your brain, I can recreate. The question is, are you? If there is a map of your brain connections, a part of you survives. As with a recording. That part of you survives. This can raise your personality and your desires because it is connected to the genome and that's what you are. Who are we? The extreme view is that we are information.

**A robot with a human mind is downloaded ?**

If you speak like a human and has a personality like a human, maybe we can call it that. In the future , we can have a library of souls like today can read biographies or movies of people who have died. You can talk to them. If you were a politician, would not you want to talk to Winston Churchill? Your grandchildren will have access to the library where they can have a conversation with you, even if not perfect.

**What are the most urgent ethical boundaries ?**

The drug to forget traumatic experiences, which has been rejected by the bioethics committee of the President, and is generating debate. There will be much discussion also with the brain pacemaker. What if memories are downloaded wrong? What if the memory of a crime you did not commit is downloaded to your mind? Have a memory of you killed someone, but you did not. We have laws to regulate or false memories are downloaded without permission.
_________________________________________________________
**reviews open**
__________________________________________________________",3,3
967,2014-5-16,2014,5,16,5,25njkf,Robot News Anchor,https://www.reddit.com/r/Futurology/comments/25njkf/robot_news_anchor/,supersonic3974,1400184460,"After reading this article on robots and eye contact, I started thinking that someone should create the first robotic news anchor.  This would be almost trivial to implement.  Thoughts?",7,5
968,2014-5-16,2014,5,16,5,25nl0p,Franklins list action for science.,https://www.reddit.com/r/Futurology/comments/25nl0p/franklins_list_action_for_science/,Nomad47,1400185308,,0,1
969,2014-5-16,2014,5,16,5,25nmym,Chattanooga's taxpayer-owned public internet is 50 times faster than anywhere else in the country,https://www.reddit.com/r/Futurology/comments/25nmym/chattanoogas_taxpayerowned_public_internet_is_50/,austin101123,1400186409,,3,1
970,2014-5-16,2014,5,16,6,25nstt,"""An Oculus Rift For Chickens"". Is it 1 April again, already?",https://www.reddit.com/r/Futurology/comments/25nstt/an_oculus_rift_for_chickens_is_it_1_april_again/,ActualStack,1400189913,,2,2
971,2014-5-16,2014,5,16,6,25ntdq,What does fashion lack? Microcontrollers.,https://www.reddit.com/r/Futurology/comments/25ntdq/what_does_fashion_lack_microcontrollers/,ActualStack,1400190252,,0,3
972,2014-5-16,2014,5,16,7,25nv2x,Please take a few minutes to contact the FCC. EFF has made it dead simple.,https://www.reddit.com/r/Futurology/comments/25nv2x/please_take_a_few_minutes_to_contact_the_fcc_eff/,chowder007,1400191342,,21,190
973,2014-5-16,2014,5,16,7,25nwg4,Video: Chris Lewicki Planetary Resources The future of mining Asteroid mining ~ Frequency (x-post /r/spaceresources),https://www.reddit.com/r/Futurology/comments/25nwg4/video_chris_lewicki_planetary_resources_the/,crsf29,1400192201,,2,5
974,2014-5-16,2014,5,16,7,25nyq4,Scientists Warn of Rising Oceans From Polar Melt,https://www.reddit.com/r/Futurology/comments/25nyq4/scientists_warn_of_rising_oceans_from_polar_melt/,ImLivingAmongYou,1400193663,,1,18
975,2014-5-16,2014,5,16,7,25nysn,Advance brings 'hyperbolic metamaterials' closer to reality,https://www.reddit.com/r/Futurology/comments/25nysn/advance_brings_hyperbolic_metamaterials_closer_to/,ImLivingAmongYou,1400193720,,1,8
976,2014-5-16,2014,5,16,7,25nywl,"Iran Going Big With Renewables! 5,000 MW Of New Solar &amp; Wind Capacity By 2018?",https://www.reddit.com/r/Futurology/comments/25nywl/iran_going_big_with_renewables_5000_mw_of_new/,ImLivingAmongYou,1400193788,,18,131
977,2014-5-16,2014,5,16,7,25nyyt,Larry Summers says Piketty isnt scared enough of our robot overlords,https://www.reddit.com/r/Futurology/comments/25nyyt/larry_summers_says_piketty_isnt_scared_enough_of/,starspawn0,1400193821,,7,13
978,2014-5-16,2014,5,16,7,25nznt,From China with love: can Oppo and OnePlus upend the way we buy smartphones?,https://www.reddit.com/r/Futurology/comments/25nznt/from_china_with_love_can_oppo_and_oneplus_upend/,[deleted],1400194296,,0,1
979,2014-5-16,2014,5,16,7,25nzty,A Japanese Soda Company Will Be the First to Advertise on the Moon,https://www.reddit.com/r/Futurology/comments/25nzty/a_japanese_soda_company_will_be_the_first_to/,[deleted],1400194390,,0,1
980,2014-5-16,2014,5,16,7,25nzul,The First Space Colonies Might Be Illegal,https://www.reddit.com/r/Futurology/comments/25nzul/the_first_space_colonies_might_be_illegal/,ImLivingAmongYou,1400194405,,238,318
981,2014-5-16,2014,5,16,7,25o028,The factory of the future,https://www.reddit.com/r/Futurology/comments/25o028/the_factory_of_the_future/,b_crowder,1400194548,,0,10
982,2014-5-16,2014,5,16,7,25o03m,A Japanese drink company is putting the first billboard on the moon,https://www.reddit.com/r/Futurology/comments/25o03m/a_japanese_drink_company_is_putting_the_first/,blinkergoesleft,1400194572,,80,235
983,2014-5-16,2014,5,16,7,25o0ar,"A giant, mysterious Amazon locker has appeared right in the middle of downtown San Francisco. For future Amazon event?",https://www.reddit.com/r/Futurology/comments/25o0ar/a_giant_mysterious_amazon_locker_has_appeared/,[deleted],1400194698,,3,12
984,2014-5-16,2014,5,16,8,25o1h2,(People working to accelerate progress on technology moonshots) Solve for X - A recap of our 2014 event,https://www.reddit.com/r/Futurology/comments/25o1h2/people_working_to_accelerate_progress_on/,mind_bomber,1400195469,,1,2
985,2014-5-16,2014,5,16,8,25o1ix,China and Germany Freight rail links will increase by about 7 times over the next 6 years,https://www.reddit.com/r/Futurology/comments/25o1ix/china_and_germany_freight_rail_links_will/,fireredballs,1400195498,,11,25
986,2014-5-16,2014,5,16,8,25o3j9,3D Printing Creates Disruptive Scenarios,https://www.reddit.com/r/Futurology/comments/25o3j9/3d_printing_creates_disruptive_scenarios/,[deleted],1400196810,,0,1
987,2014-5-16,2014,5,16,8,25o5ri,OpenGov Secures $15M Series B Led By A16Z To Bring Cities Financial Data Online,https://www.reddit.com/r/Futurology/comments/25o5ri/opengov_secures_15m_series_b_led_by_a16z_to_bring/,GreatestInstruments,1400198300,,0,12
988,2014-5-16,2014,5,16,9,25o9g5,For the Future Generation,https://www.reddit.com/r/Futurology/comments/25o9g5/for_the_future_generation/,Wanderlust225,1400200785,,0,1
989,2014-5-16,2014,5,16,9,25o9po,Strongly interacting electrons in wacky oxide synchronize to work like the brain,https://www.reddit.com/r/Futurology/comments/25o9po/strongly_interacting_electrons_in_wacky_oxide/,DoctorBlasphemy,1400200970,,0,1
990,2014-5-16,2014,5,16,10,25od30,When would we be able to hive mind using nano technology?,https://www.reddit.com/r/Futurology/comments/25od30/when_would_we_be_able_to_hive_mind_using_nano/,NotAnAI,1400203387,,2,0
991,2014-5-16,2014,5,16,10,25od5z,Watch MIT's Amazing Fog Harvesters Produce Fresh Water in the Atacama Desert,https://www.reddit.com/r/Futurology/comments/25od5z/watch_mits_amazing_fog_harvesters_produce_fresh/,censoredandagain,1400203442,,13,77
992,2014-5-16,2014,5,16,10,25odot,Cockulus Rift,https://www.reddit.com/r/Futurology/comments/25odot/cockulus_rift/,redthreaded,1400203810,,0,1
993,2014-5-16,2014,5,16,10,25ofq8,First 'heavy mouse' leads to first lab-grown tissue mapped from atomic life.,https://www.reddit.com/r/Futurology/comments/25ofq8/first_heavy_mouse_leads_to_first_labgrown_tissue/,RushAndAPush,1400205206,,0,2
994,2014-5-16,2014,5,16,11,25ogpi,DARPA Warrior Web Supersuit Projects targets to enable Soldiers to Run 4 Minute Miles,https://www.reddit.com/r/Futurology/comments/25ogpi/darpa_warrior_web_supersuit_projects_targets_to/,ImLivingAmongYou,1400205945,,3,10
995,2014-5-16,2014,5,16,11,25ohkq,"Rambus lens-free camera is smaller than a pencil point, could give sight to all gadgets soon",https://www.reddit.com/r/Futurology/comments/25ohkq/rambus_lensfree_camera_is_smaller_than_a_pencil/,[deleted],1400206541,,0,0
996,2014-5-16,2014,5,16,11,25ohma,Consumers to be big winners in solar/storage revolution,https://www.reddit.com/r/Futurology/comments/25ohma/consumers_to_be_big_winners_in_solarstorage/,[deleted],1400206566,,0,0
997,2014-5-16,2014,5,16,11,25ohom,"From Filmmakers to Farmers, Everyone Is Lobbying for Drones",https://www.reddit.com/r/Futurology/comments/25ohom/from_filmmakers_to_farmers_everyone_is_lobbying/,[deleted],1400206609,,0,0
998,2014-5-16,2014,5,16,11,25ohz1,Google's self-driving car turns out to be a very smart ride,https://www.reddit.com/r/Futurology/comments/25ohz1/googles_selfdriving_car_turns_out_to_be_a_very/,ImLivingAmongYou,1400206802,,0,10
999,2014-5-16,2014,5,16,11,25oi0m,Obat Tradisional Sembuhkan Buat Benjolan Di Punggung,https://www.reddit.com/r/Futurology/comments/25oi0m/obat_tradisional_sembuhkan_buat_benjolan_di/,sedantenup,1400206827,,0,1
1000,2014-5-16,2014,5,16,11,25oi1k,Tesla CEO Elon Musk: Gigafactory will take battery production 'to another level',https://www.reddit.com/r/Futurology/comments/25oi1k/tesla_ceo_elon_musk_gigafactory_will_take_battery/,ImLivingAmongYou,1400206847,,333,1262
1001,2014-5-16,2014,5,16,11,25oiaf,Stem cell therapy shows promise for multiple sclerosis,https://www.reddit.com/r/Futurology/comments/25oiaf/stem_cell_therapy_shows_promise_for_multiple/,[deleted],1400207031,,0,0
1002,2014-5-16,2014,5,16,11,25oie6,"Magnetic topological insulators are 1,000 times more energy-efficient for switching",https://www.reddit.com/r/Futurology/comments/25oie6/magnetic_topological_insulators_are_1000_times/,[deleted],1400207110,,0,0
1003,2014-5-16,2014,5,16,11,25oih9,"With half the planet up for grabs, a call for deep-ocean stewardship",https://www.reddit.com/r/Futurology/comments/25oih9/with_half_the_planet_up_for_grabs_a_call_for/,[deleted],1400207175,,0,1
1004,2014-5-16,2014,5,16,11,25oii9,First 'heavy mouse' leads to first lab-grown tissue mapped from atomic life,https://www.reddit.com/r/Futurology/comments/25oii9/first_heavy_mouse_leads_to_first_labgrown_tissue/,[deleted],1400207198,,0,1
1005,2014-5-16,2014,5,16,11,25oijk,Silly Putty material inspires better batteries,https://www.reddit.com/r/Futurology/comments/25oijk/silly_putty_material_inspires_better_batteries/,ImLivingAmongYou,1400207218,,1,9
1006,2014-5-16,2014,5,16,11,25oiow,Going beyond the surface: New tech could take light-based cancer treatment deep inside the body,https://www.reddit.com/r/Futurology/comments/25oiow/going_beyond_the_surface_new_tech_could_take/,[deleted],1400207317,,0,0
1007,2014-5-16,2014,5,16,11,25oiuj,UAB researchers use roundworms to unlock new information on fertility,https://www.reddit.com/r/Futurology/comments/25oiuj/uab_researchers_use_roundworms_to_unlock_new/,[deleted],1400207427,,0,0
1008,2014-5-16,2014,5,16,11,25ojuu,Applied Materials sets cobalt on path to future chips,https://www.reddit.com/r/Futurology/comments/25ojuu/applied_materials_sets_cobalt_on_path_to_future/,[deleted],1400208101,,0,2
1009,2014-5-16,2014,5,16,11,25ol2w,Low cost and impressive performance thrust new solar-cell technology into spotlight,https://www.reddit.com/r/Futurology/comments/25ol2w/low_cost_and_impressive_performance_thrust_new/,ImLivingAmongYou,1400208982,,0,3
1010,2014-5-16,2014,5,16,12,25om59,A path forward,https://www.reddit.com/r/Futurology/comments/25om59/a_path_forward/,EverettHubbard,1400209716,"Knowing all that we do with how the current trends in automation, robotics and energy/battery improvements are starting to disrupt quality and standards of living, has any thought been given to a way forward for populations as a whole?  It seems that newer generations will be okay with the shifts but those who already have debts are at an extreme risk of being left behind.  I know if managed correctly, the changes can be beneficial to all, it's just there doesn't seem to be a laid out plan to follow.",1,4
1011,2014-5-16,2014,5,16,12,25onk0,What Would People Eat In A Permanent Space Colony?,https://www.reddit.com/r/Futurology/comments/25onk0/what_would_people_eat_in_a_permanent_space_colony/,[deleted],1400210805,,1,0
1012,2014-5-16,2014,5,16,12,25onm0,Has The End Of The Banana Arrived?,https://www.reddit.com/r/Futurology/comments/25onm0/has_the_end_of_the_banana_arrived/,[deleted],1400210845,,0,0
1013,2014-5-16,2014,5,16,12,25onty,"Robot Reads Novels, Writes Songs About Them",https://www.reddit.com/r/Futurology/comments/25onty/robot_reads_novels_writes_songs_about_them/,[deleted],1400210999,,0,0
1014,2014-5-16,2014,5,16,12,25onut,Will Russia Colonize The Moon?,https://www.reddit.com/r/Futurology/comments/25onut/will_russia_colonize_the_moon/,[deleted],1400211022,,0,0
