,date,year,month,day,hour,id,title,full_link,author,created,selftext,num_comments,score
0,2014-5-1,2014,5,1,9,24eyye,Google asked kids to create doodles of what they would invent to make the world a better placea great way to get kids thinking about technology and the future! You can vote for the doodles you want to see on Google's homepage now!,https://www.reddit.com/r/Futurology/comments/24eyye/google_asked_kids_to_create_doodles_of_what_they/,spacecyborg,1398904260,,9,16
1,2014-5-1,2014,5,1,11,24f8q6,Imagining the Post-Antibiotics Future,https://www.reddit.com/r/Futurology/comments/24f8q6/imagining_the_postantibiotics_future/,cryptogenes1s,1398910715,,0,1
2,2014-5-1,2014,5,1,12,24fd4z,"Ground breaking technique offers DNA 'Sat Nav' direct to your ancestor's home 1,000 years ago",https://www.reddit.com/r/Futurology/comments/24fd4z/ground_breaking_technique_offers_dna_sat_nav/,Capitalism_Prevails,1398913690,,0,5
3,2014-5-1,2014,5,1,12,24fd5a,"In a Post-Scarcity world, would we provide subsistence feeding for wild animals?",https://www.reddit.com/r/Futurology/comments/24fd5a/in_a_postscarcity_world_would_we_provide/,Leovinus_Jones,1398913693,,17,16
4,2014-5-1,2014,5,1,13,24fjta,Fluid Expert Personal Shopper App (IBM Watson) Demo (Final Product May Be Somewhat Different),https://www.reddit.com/r/Futurology/comments/24fjta/fluid_expert_personal_shopper_app_ibm_watson_demo/,starspawn0,1398918577,,6,22
5,2014-5-1,2014,5,1,13,24flyq,Experimental Technique Coaxes Muscles Destroyed By War To Regrow,https://www.reddit.com/r/Futurology/comments/24flyq/experimental_technique_coaxes_muscles_destroyed/,DerpyGrooves,1398920307,,0,7
6,2014-5-1,2014,5,1,14,24fmv6,Cyborg nation,https://www.reddit.com/r/Futurology/comments/24fmv6/cyborg_nation/,ERICsoBAD,1398921081,"At what point do you think we will opt to trade our perfectly good human limbs for some sweet ass superior prosthetics. Im dont mean weeny cyborgs that use internet interfaced huds all the time like google glass. Im talking people making major upgrades to the point it be comes a major body modding community. ""Pfft you still rockin your stock parts bro? Im straight inspector gadget!"" What social/ethical hurdles do we have to pass? ",9,11
7,2014-5-1,2014,5,1,14,24fpfh,"AGI, Consciousness &amp; Building General Intelligence - Colin Hales",https://www.reddit.com/r/Futurology/comments/24fpfh/agi_consciousness_building_general_intelligence/,adam_ford,1398923511,,0,7
8,2014-5-1,2014,5,1,15,24fr8a,"The Problem Isn't The Robots, It's Us - Our problem today is not that we face a world of increasing automation, but that too many of us have grown accustomed to acting like robots, striving to perform rote tasks with efficiency and accuracy. We are educated to provide answers, not questions",https://www.reddit.com/r/Futurology/comments/24fr8a/the_problem_isnt_the_robots_its_us_our_problem/,DerpyGrooves,1398925368,,18,117
9,2014-5-1,2014,5,1,15,24freh,"Do you think we're heading for another AI ""winter""?",https://www.reddit.com/r/Futurology/comments/24freh/do_you_think_were_heading_for_another_ai_winter/,[deleted],1398925558,"We've had two in the past. From 1974-1980 and 1987-1993. These were preceded by lots of hype, that promised unrealistic advances in unrealistically short timespans. We're hearing a lot about the promises of AI today, could we be building too much hype? I'd like to hear what you guys have to say.",29,15
10,2014-5-1,2014,5,1,15,24froj,"AGMPPV's- Anti Gravitational Magnetically Powered Personal Vehicles ""Moon Shoes""",https://www.reddit.com/r/Futurology/comments/24froj/agmppvs_anti_gravitational_magnetically_powered/,[deleted],1398925892,,0,0
11,2014-5-1,2014,5,1,15,24fs11,Is your job at risk from robot labor? Check this handy interactive chart,https://www.reddit.com/r/Futurology/comments/24fs11/is_your_job_at_risk_from_robot_labor_check_this/,DerpyGrooves,1398926233,,10,22
12,2014-5-1,2014,5,1,17,24fwit,The Neuroprosthetic Paradox - How technology will alter our definition of humanity,https://www.reddit.com/r/Futurology/comments/24fwit/the_neuroprosthetic_paradox_how_technology_will/,teaDrinkingShoe,1398932115,,0,1
13,2014-5-1,2014,5,1,17,24fwv6,With a Bullet: China's High-Speed Rail Dream Begins to take Flight,https://www.reddit.com/r/Futurology/comments/24fwv6/with_a_bullet_chinas_highspeed_rail_dream_begins/,Buck-Nasty,1398932661,,0,6
14,2014-5-1,2014,5,1,17,24fwzm,Drawing analogies between computer science and physics is not a compelling argument for believing that we live in a computer simulation.,https://www.reddit.com/r/Futurology/comments/24fwzm/drawing_analogies_between_computer_science_and/,CPH_DK16,1398932857,,1,4
15,2014-5-1,2014,5,1,18,24fydp,Black Hawk Drone: Armys Iconic Helicopter Goes Pilotless,https://www.reddit.com/r/Futurology/comments/24fydp/black_hawk_drone_armys_iconic_helicopter_goes/,Buck-Nasty,1398934981,,0,4
16,2014-5-1,2014,5,1,20,24g48p,Experiment grows new muscle in men's injured legs,https://www.reddit.com/r/Futurology/comments/24g48p/experiment_grows_new_muscle_in_mens_injured_legs/,N8theGr8,1398943143,,38,721
17,2014-5-1,2014,5,1,20,24g4oi,Mind Upload (Infographic),https://www.reddit.com/r/Futurology/comments/24g4oi/mind_upload_infographic/,[deleted],1398943662,,0,1
18,2014-5-1,2014,5,1,20,24g54j,Is surveillance technology benefical for society?,https://www.reddit.com/r/Futurology/comments/24g54j/is_surveillance_technology_benefical_for_society/,[deleted],1398944179,"So we all know we've arrived to a point in which technology is being used by governments and powerful corporations to gather data, and constantly watch on the citizens.

There's also the technology that's increasingly becoming more intrusive in our privacy/lives, for instance the social networks and google glass.

However, the data which these technologies gather is not the actual problem, but how its used, by whom and for which purpose. So it makes me wonder, what if these technologies could be used to make a more transparent government for example? could massive vigilance of the police cause a reduction in corruption. Could social networks enable cooperation between the police force and the citizens?

There already are ideas about using social networks to increase democracy. What Im talking about is that, if the surveillance state is inevitable, then let it be both-ways (reciprocal, mutual) between a government and it's citizens
",51,58
19,2014-5-1,2014,5,1,20,24g57s,Cool things happen when you upload your mind into a computer,https://www.reddit.com/r/Futurology/comments/24g57s/cool_things_happen_when_you_upload_your_mind_into/,[deleted],1398944282,,0,2
20,2014-5-1,2014,5,1,21,24g6ki,Team uses unused iPhone energy for case lights,https://www.reddit.com/r/Futurology/comments/24g6ki/team_uses_unused_iphone_energy_for_case_lights/,gari-soflo,1398945769,,1,6
21,2014-5-1,2014,5,1,21,24g940,Kickstart these tricorders!,https://www.reddit.com/r/Futurology/comments/24g940/kickstart_these_tricorders/,[deleted],1398948223,,0,1
22,2014-5-1,2014,5,1,21,24g9v8,"A seminar with the 2 leading author of the now famous ""47% of jobs will be automated"" study. [Xpost from /lectures]",https://www.reddit.com/r/Futurology/comments/24g9v8/a_seminar_with_the_2_leading_author_of_the_now/,mcscom,1398948878,,0,4
23,2014-5-1,2014,5,1,22,24gayl,Help me realize the future of job search,https://www.reddit.com/r/Futurology/comments/24gayl/help_me_realize_the_future_of_job_search/,solidwhetstone,1398949812,"Hello /r/futurology. Im solidwhetstone- and I am trying to change the way people get jobs online. I Have created and moderated many of the subreddits you might have used to get work such as /r/forhire, /r/chicagojobs, or /r/designjobs. I also work with redditors like /u/7oby and /u/thepoopsmith who have an equal passion to help redditors get work.

The bulletin board model of job search that demonstrated by sites like monster, dice, and indeed all benefit from a cynical job ecosystem that favors those with the jobs. I believe that the reddit model of job posting holds job posters accountable for their claims. Scams, misinformation, and other kinds of deception saturate the other job boards- most notably craigslist. Introducing a new approach:

**http://karmajobs.net** : [Here's the release post on /r/forhire](http://www.reddit.com/r/forhire/comments/24ga8p/introducing_karmajobs/)

Ive been working on this idea for nearly two years. The premise is simple: Make it easy to find jobs on reddit- and change the way people look for work. I feel that job search shouldnt be filling out hundreds of online applications. So many times, we have questions about a job post- the salary, the work conditions, the exact location- and we cant get those answers because we only have the option to apply.

The internet job search model hasnt fundamentally changed in a decade- but I think reddit could be the catalyst for it. Community job search is the next evolution- and I created KarmaJobs so that we could realize it. But my team cant do anything unless KarmaJobs becomes a success. So please, come and take a look at it and if you feel like its a better solution- share it with your friends who are out of work!

If youd like to read about the features weve built into this 1.0 release, take a look at the stickied post in /r/karmajobs (and give us a subscribe if you want to get updates on new features in the future).

I believe that community job search is the future- but I cant know for sure without you.

Here's a link to the official release post on /r/forhire.

Thanks for reading and happy job hunting!

Dan (solidwhetstone)
",14,50
24,2014-5-1,2014,5,1,22,24gd7c,This article was written by a robot.,https://www.reddit.com/r/Futurology/comments/24gd7c/this_article_was_written_by_a_robot/,Sourcecode12,1398951628,,74,482
25,2014-5-1,2014,5,1,22,24gdpf,Tricorders!!,https://www.reddit.com/r/Futurology/comments/24gdpf/tricorders/,Mozeeon,1398952015,,2,0
26,2014-5-1,2014,5,1,22,24ge9o,"The slow death of purposeless walking. : TrueReddit (or, what happened to our guy?)",https://www.reddit.com/r/Futurology/comments/24ge9o/the_slow_death_of_purposeless_walking_truereddit/,drhugs,1398952470,,1,1
27,2014-5-1,2014,5,1,23,24gf4s,"Introducing LIX, the world's smallest 3D printing pen",https://www.reddit.com/r/Futurology/comments/24gf4s/introducing_lix_the_worlds_smallest_3d_printing/,[deleted],1398953092,,0,1
28,2014-5-1,2014,5,1,23,24gfys,Are Hollywood Enhancements Really The Future?,https://www.reddit.com/r/Futurology/comments/24gfys/are_hollywood_enhancements_really_the_future/,gammablew,1398953696,,0,2
29,2014-5-1,2014,5,1,23,24gh08,"A breakthrough in the study of high-temperature superconductivity, which could make an array of fantastical-sounding technologies commercially viable, from power grids that never lose energy and cheap water purification systems to magnetically levitating vehicles.",https://www.reddit.com/r/Futurology/comments/24gh08/a_breakthrough_in_the_study_of_hightemperature/,Kylde,1398954460,,19,203
30,2014-5-1,2014,5,1,23,24ghok,Why the Smart Reading Device of the Future May Be  Paper,https://www.reddit.com/r/Futurology/comments/24ghok/why_the_smart_reading_device_of_the_future_may_be/,riaz981,1398954885,,3,3
31,2014-5-2,2014,5,2,0,24gklx,The self-driving car masters city-street driving,https://www.reddit.com/r/Futurology/comments/24gklx/the_selfdriving_car_masters_citystreet_driving/,Pax_Romana_300,1398956762,,0,3
32,2014-5-2,2014,5,2,1,24grm7,Scientist predicts cancer deaths will end,https://www.reddit.com/r/Futurology/comments/24grm7/scientist_predicts_cancer_deaths_will_end/,DerpyGrooves,1398961010,,22,79
33,2014-5-2,2014,5,2,1,24grq0,Japan Has A Plan To Start Using Space-based Solar Power By The 2030s,https://www.reddit.com/r/Futurology/comments/24grq0/japan_has_a_plan_to_start_using_spacebased_solar/,DerpyGrooves,1398961078,,7,28
34,2014-5-2,2014,5,2,1,24gs8u,"Fossil fuels face $30 trillion losses from climate, renewables : Renew Economy",https://www.reddit.com/r/Futurology/comments/24gs8u/fossil_fuels_face_30_trillion_losses_from_climate/,DerpyGrooves,1398961417,,0,2
35,2014-5-2,2014,5,2,1,24gt2s,A new self-assembling graphene-like material for flat semiconductors,https://www.reddit.com/r/Futurology/comments/24gt2s/a_new_selfassembling_graphenelike_material_for/,ion-tom,1398961929,,0,5
36,2014-5-2,2014,5,2,1,24gu2q,"""Hack Your Body to Have Superpowers"" (Fw:Thinking explores the future of biohacking)",https://www.reddit.com/r/Futurology/comments/24gu2q/hack_your_body_to_have_superpowers_fwthinking/,calkangaroo,1398962557,,0,20
37,2014-5-2,2014,5,2,2,24gwko,Next Future Terrifying Technology Will Blow Your Mind,https://www.reddit.com/r/Futurology/comments/24gwko/next_future_terrifying_technology_will_blow_your/,gari-soflo,1398964075,,3,3
38,2014-5-2,2014,5,2,2,24gxf3,NASA releases results of voting on futuristic design of next generation space-suits,https://www.reddit.com/r/Futurology/comments/24gxf3/nasa_releases_results_of_voting_on_futuristic/,ion-tom,1398964592,,1,2
39,2014-5-2,2014,5,2,2,24gyl7,"""We're not playing superficial games with languagewe're starting to understand it."" -- Oren Etzioni",https://www.reddit.com/r/Futurology/comments/24gyl7/were_not_playing_superficial_games_with/,starspawn0,1398965300,,0,8
40,2014-5-2,2014,5,2,2,24h19k,"The End of Jobs? ""The end of jobs doesn't have to be a dystopian nightmare. We should be working to ensure that a future without jobs is a future where we all get to enjoy the benefits of free time.""",https://www.reddit.com/r/Futurology/comments/24h19k/the_end_of_jobs_the_end_of_jobs_doesnt_have_to_be/,DerpyGrooves,1398966913,,357,1369
41,2014-5-2,2014,5,2,2,24h1m2,"After Words: Patrick Tucker, ""The Naked Future: What Happens in a World that Anticipates Your Every Move,"" hosted by Heidi Boghosian, National Lawyers Guild",https://www.reddit.com/r/Futurology/comments/24h1m2/after_words_patrick_tucker_the_naked_future_what/,[deleted],1398967118,,0,1
42,2014-5-2,2014,5,2,3,24h2e7,"After Words: Patrick Tucker, ""The Naked Future: What Happens in a World that Anticipates Your Every Move,"" hosted by Heidi Boghosian, National Lawyers Guild",https://www.reddit.com/r/Futurology/comments/24h2e7/after_words_patrick_tucker_the_naked_future_what/,petskup,1398967552,,0,5
43,2014-5-2,2014,5,2,3,24h2v8,NASA decides on crowdsourced Tron look for Mars Z-2 spacesuit,https://www.reddit.com/r/Futurology/comments/24h2v8/nasa_decides_on_crowdsourced_tron_look_for_mars/,deviaan,1398967847,,15,32
44,2014-5-2,2014,5,2,3,24h39o,5 predictions for computer human interaction in 25 years,https://www.reddit.com/r/Futurology/comments/24h39o/5_predictions_for_computer_human_interaction_in/,truth_fool,1398968078,,0,4
45,2014-5-2,2014,5,2,3,24h51i,Robo-advisers could pick your investments - Business - CBC News. Would you sign up?,https://www.reddit.com/r/Futurology/comments/24h51i/roboadvisers_could_pick_your_investments_business/,mn108,1398969126,,0,4
46,2014-5-2,2014,5,2,3,24h5dd,"Retirement planning is about the future, so why aren't retirement (financial) advisors futurists? (My recent blog post)",https://www.reddit.com/r/Futurology/comments/24h5dd/retirement_planning_is_about_the_future_so_why/,mn108,1398969318,,0,1
47,2014-5-2,2014,5,2,3,24h5wo,Will food be obsolete in the future?,https://www.reddit.com/r/Futurology/comments/24h5wo/will_food_be_obsolete_in_the_future/,jdroletjd,1398969635,"Not sure if this is for r/ask anthropology, but I have been curious for a while with an unsupported assumption. If all of the nutirents that a body needs is known, and moslty the proportions of this nutrition are quit known as well to each body type, then are we on a path to where  the construcution of food as we are familiar with, will be obsolete? I am seeing a future where there is no cooking of any sort, kitchens, restaurants, cafe's, etc will all be replaced by food only a form of nutrients in its pure form suplied in its approriate quanitity with any persons' intake.  So that food, when seen, is only in powders, oils, and water. For example, a banana could be exactly replicated to the quantity of lipids, carbohydrates, amino acids, vitamins and minerals, to where the banana would now be unrecognizable but have the same nutritional value, just organized and seperated. 

A side question would be that could this and is this being utilized with 3d printing food. Especially I find this perspective useful when attempting to construct food for space travel. I understand that a company Soylent kind of does this, but not to the extent that I am trying to express. And possibly one day nutrition will be genetically integrated. But I think they are on the right track. Also this curiosity was derived from my studies with food culturally, how it varies, and how preference and familiarity comes into play when travelling the world. That food is so variant from civilization to civilization, where preference and familiarity and numerous other factors are prominent in distinguishing an areas cusisne.

Would this still be a legitimate question to ask or is this not even possible...I just find it a bit frustrating at why things vary so much from civilization to civilization, and why there can't be a universal with sustainability of nutrition and health.",9,6
48,2014-5-2,2014,5,2,3,24h5xb,"This kickstarter blew up, and it looks like we will have a pocket molecular analyzer by December",https://www.reddit.com/r/Futurology/comments/24h5xb/this_kickstarter_blew_up_and_it_looks_like_we/,freeofthought,1398969644,,1,1
49,2014-5-2,2014,5,2,3,24h7dm,Defining the Sharing Economy,https://www.reddit.com/r/Futurology/comments/24h7dm/defining_the_sharing_economy/,Rogerh91,1398970532,,0,1
50,2014-5-2,2014,5,2,3,24h7js,NASAs Curiosity Rover &amp; The Future Of Mars Exploration,https://www.reddit.com/r/Futurology/comments/24h7js/nasas_curiosity_rover_the_future_of_mars/,techinkc,1398970630,,0,2
51,2014-5-2,2014,5,2,4,24h9el,a History of Books that Forecast the Future (timeline infographic),https://www.reddit.com/r/Futurology/comments/24h9el/a_history_of_books_that_forecast_the_future/,ASA09,1398971688,,58,425
52,2014-5-2,2014,5,2,4,24hbeg,Britain seeking remote site for first spaceport | MNN,https://www.reddit.com/r/Futurology/comments/24hbeg/britain_seeking_remote_site_for_first_spaceport/,beaucepower,1398972898,,1,8
53,2014-5-2,2014,5,2,4,24hbpw,The ad from Greenpeace actually seems kinda cool,https://www.reddit.com/r/Futurology/comments/24hbpw/the_ad_from_greenpeace_actually_seems_kinda_cool/,OthelloJones,1398973080,,13,18
54,2014-5-2,2014,5,2,4,24hca9,Brain Implant Could Restore Memory : Discovery News,https://www.reddit.com/r/Futurology/comments/24hca9/brain_implant_could_restore_memory_discovery_news/,wulfdesign,1398973428,,11,97
55,2014-5-2,2014,5,2,5,24hfbz,Millions of these robotic bees may roam the world in the near future,https://www.reddit.com/r/Futurology/comments/24hfbz/millions_of_these_robotic_bees_may_roam_the_world/,[deleted],1398975218,,0,1
56,2014-5-2,2014,5,2,5,24hidn,FIRST Robotics Competition,https://www.reddit.com/r/Futurology/comments/24hidn/first_robotics_competition/,GalacticPA2030,1398977068,"At the most basic level The FIRST Robotics Competition, founded by inventor Dean Kamen, looks to the future by developing the next generation of the world's engineers. Many of the students at FIRST go on to work at very influential titans of technology, or at future oriented organizations such as NASA. This documentary on FIRST Robotics is our eighth main piece in our Galactic Public Archives series in which we explore compelling visions of our future from influential individuals. So far, we've covered an interesting collection of viewpoints and topics regarding our possible future, ranging from the future of longevity, to the future of search and even the future of democracy. FIRST seemed like a natural opportunity to explore another 'puzzle-piece' of what the future might look like. And of course, the competition features Robots, which are an integral piece of any self-respecting utopian or dystopian future. What we did not realize as we started our exploration of the program was that FIRST is not attempting to be a humble building block towards the future. Although only time will tell to what degree it succeeds, it aspires to be a catalyst for much more far-reaching change.

In a society that praises the utmost competitive spirit in all the wrong ways, Inventor Dean Kamen noticed less and less youth using this spirit towards opportunities in math and science, instead aspiring to become celebrities, or sports superstars. In turn, he provided an answer to make kids excited about changing the world through technology. Kamens endeavor, FIRST Robotics offers teens a chance, in competition form, to use their skills and teamwork to problem solve a piece of machinery to life. 

FIRST was modeled off the allure of professional sports leagues but without  hopefully - the dog eat dog spirit. David Lavery, FIRST Robotics Mentor and NASA Engineer, grew up during the Cold War when competition through technology meant joining in on the race to the moon. An interesting aspect of FIRSTs philosophy, is that as much as it embraces competition, students are also forced to realize that your greatest competitor could  in the future - work as one of your greatest collaborators. This generation may be bombarded with news about Kardashians as opposed to scientists, astronauts and cosmonauts - but what FIRST aims to cultivate, is a hunger to make a difference  made possible now more than ever due to widespread access to information. 

Directly and tangentially, the experiment of FIRST both tackles and raises an entire swarth of deeper questions about our future. What values will our culture celebrate in the future? What will the repercussions be of the values that we celebrate today? How much time do we have to solve some of the great challenges looming on the horizon? Will there be enough individuals with the skills required to tackle those problems? To what degree will the 'fixes' be technological vs. cultural? How will the longstanding ideological struggle of competition vs. cooperation evolve as the next generations take over? What is the future of education? What is the proper role of a teacher? A  mentor? Where does cultural change come from? Where should it come from? It's an impressive list of questions to be raised by a competition involving robots shooting frisbees. We hope you find it as compelling as we did. 


",2,10
57,2014-5-2,2014,5,2,5,24hj7w,Experimental drug prolongs life span in mice.,https://www.reddit.com/r/Futurology/comments/24hj7w/experimental_drug_prolongs_life_span_in_mice/,RushAndAPush,1398977553,,1,8
58,2014-5-2,2014,5,2,5,24hjjn,The one question you don't want a machine to answer,https://www.reddit.com/r/Futurology/comments/24hjjn/the_one_question_you_dont_want_a_machine_to_answer/,starspawn0,1398977755,,2,9
59,2014-5-2,2014,5,2,6,24hkqy,Capitalism and Automation,https://www.reddit.com/r/Futurology/comments/24hkqy/capitalism_and_automation/,Qasaur,1398978488,,0,2
60,2014-5-2,2014,5,2,6,24hl2q,Asimov - The Answer for Humanity,https://www.reddit.com/r/Futurology/comments/24hl2q/asimov_the_answer_for_humanity/,DerpyGrooves,1398978675,,3,7
61,2014-5-2,2014,5,2,6,24hmn3,Enlightenment Engineering: Tech as Catalyst for Inner &amp; Outer Peace,https://www.reddit.com/r/Futurology/comments/24hmn3/enlightenment_engineering_tech_as_catalyst_for/,SeanPlusPlus,1398979613,,0,4
62,2014-5-2,2014,5,2,6,24hmub,"DARPA researchers are set to announcing in a few months progress of a brain implant which could help restore memories, which will help patients suffering from Amnesia . The project is called: RAM",https://www.reddit.com/r/Futurology/comments/24hmub/darpa_researchers_are_set_to_announcing_in_a_few/,S_K_I,1398979732,,2,21
63,2014-5-2,2014,5,2,7,24hqcz,History of the Cell Phone [OC],https://www.reddit.com/r/Futurology/comments/24hqcz/history_of_the_cell_phone_oc/,[deleted],1398981878,,0,1
64,2014-5-2,2014,5,2,7,24hqw5,Unbuilt Buildings: 12 Architectural Designs for the Future,https://www.reddit.com/r/Futurology/comments/24hqw5/unbuilt_buildings_12_architectural_designs_for/,[deleted],1398982195,,1,0
65,2014-5-2,2014,5,2,8,24hvpu,"Michio Kaku on reading minds, recording dreams and brain imaging. Being able to wake up in the morning and watch a recording of your dream in the next 5-10 years is a possibility.",https://www.reddit.com/r/Futurology/comments/24hvpu/michio_kaku_on_reading_minds_recording_dreams_and/,joycaptain,1398985347,,0,1
66,2014-5-2,2014,5,2,8,24hw0a,Heart cells created from human embryonic stem cells successfully restored damaged heart muscles in monkeys,https://www.reddit.com/r/Futurology/comments/24hw0a/heart_cells_created_from_human_embryonic_stem/,le_epic_fedora,1398985546,,1,10
67,2014-5-2,2014,5,2,8,24hwn1,What Is The Venus Project?,https://www.reddit.com/r/Futurology/comments/24hwn1/what_is_the_venus_project/,SatyapriyaCC,1398985963,,0,1
