,date,year,month,day,hour,id,title,full_link,author,created,selftext,num_comments,score
1603,2014-5-24,2014,5,24,0,26axl4,What will money be in the future?,https://www.reddit.com/r/Futurology/comments/26axl4/what_will_money_be_in_the_future/,PerfectCapitalism,1400858176,"Today, most people have little or no net financial assets and are treated like slaves in the current system of manipulated financial control. Governments bailing out the financial system by forcing massive debts and obligations upon future generations simply engineered financial slavery for many in this generation and beyond. Those supporting this immoral behavior are essentially financial pedophiles for bankrupting our future so a few can retain present control. Unless society evolves beyond the current narrative, inequality, fear, and anger will only increase as enviroments and ecosystems deteriorate for everyone around the world.

In the mean time, since money has become the debts, obligations, and resources of future generations, people must ask whether we have become financial slaves or financial pedophiles?
",4,4
1604,2014-5-24,2014,5,24,0,26axyf,Terence Mckenna on approaching the future and chaos theory,https://www.reddit.com/r/Futurology/comments/26axyf/terence_mckenna_on_approaching_the_future_and/,[deleted],1400858442,,0,1
1605,2014-5-24,2014,5,24,0,26azso,Terence Mckenna on the future of the internet and the collective mind (1994),https://www.reddit.com/r/Futurology/comments/26azso/terence_mckenna_on_the_future_of_the_internet_and/,thatguywhoisthatguy,1400859612,,17,8
1606,2014-5-24,2014,5,24,0,26b16g,Driverless Cars could be an enormous ecological and economical benefit to society,https://www.reddit.com/r/Futurology/comments/26b16g/driverless_cars_could_be_an_enormous_ecological/,UtopicVision,1400860503,,1174,3054
1607,2014-5-24,2014,5,24,1,26b263,Thermal touch could help AR and let you use objects in the real world as a touch screen.,https://www.reddit.com/r/Futurology/comments/26b263/thermal_touch_could_help_ar_and_let_you_use/,[deleted],1400861150,,1,11
1608,2014-5-24,2014,5,24,1,26b5rh,"Samsung is making a VR headset, has an OLED screen, as good or better than in the second Rift dev kit",https://www.reddit.com/r/Futurology/comments/26b5rh/samsung_is_making_a_vr_headset_has_an_oled_screen/,[deleted],1400863487,,0,0
1609,2014-5-24,2014,5,24,1,26b739,The future's First World Problems,https://www.reddit.com/r/Futurology/comments/26b739/the_futures_first_world_problems/,[deleted],1400864318,,1,1
1610,2014-5-24,2014,5,24,2,26b7cl,Samsung reportedly working on it's own VR headset.,https://www.reddit.com/r/Futurology/comments/26b7cl/samsung_reportedly_working_on_its_own_vr_headset/,theinternetism,1400864465,,3,5
1611,2014-5-24,2014,5,24,2,26b7wh,Suspended animation is about to make death political,https://www.reddit.com/r/Futurology/comments/26b7wh/suspended_animation_is_about_to_make_death/,HeroLeander,1400864818,,14,73
1612,2014-5-24,2014,5,24,2,26b9q3,When do you believe this story could be a reality?,https://www.reddit.com/r/Futurology/comments/26b9q3/when_do_you_believe_this_story_could_be_a_reality/,ftt555,1400865987,"I read this on r/writingprompts and I thought this was not only a well written story but also something that could legitimately exist in a few decades. I wanted to share this here thinking that people might appreciate it from a possible technological future. In addition, I know this subreddit has had a few posts about increasing ones life this would be a great way to increase their life-span by only altering their perception so they can live 1000's of lives in their one life-time. 
  
  
On another note technology like this could help people understand each other better and Policy-makers will now be able to have first-hand experience of what they are doing and how it will affect people... just a thought
  
  
Edit: sorry here is the link http://www.reddit.com/r/WritingPrompts/comments/26adfm/pi_a_man_wakes_up_after_death_realizing_that_his/




",4,3
1613,2014-5-24,2014,5,24,3,26bhix,"When I Was Your Age, We Had to Plug in Our Electronics",https://www.reddit.com/r/Futurology/comments/26bhix/when_i_was_your_age_we_had_to_plug_in_our/,sagehazzard,1400870827,,1,4
1614,2014-5-24,2014,5,24,3,26bibo,A new way to make sheets of graphene,https://www.reddit.com/r/Futurology/comments/26bibo/a_new_way_to_make_sheets_of_graphene/,gari-soflo,1400871342,,3,12
1615,2014-5-24,2014,5,24,4,26bk88,The future of hygiene,https://www.reddit.com/r/Futurology/comments/26bk88/the_future_of_hygiene/,Sasquatchzilla,1400872538,,0,3
1616,2014-5-24,2014,5,24,4,26bkkc,"Been there, drone that: Pizza air-delivery in Mumbai",https://www.reddit.com/r/Futurology/comments/26bkkc/been_there_drone_that_pizza_airdelivery_in_mumbai/,petskup,1400872757,,0,6
1617,2014-5-24,2014,5,24,4,26bknj,The Future Of Your Home Office Gadgets (infograph),https://www.reddit.com/r/Futurology/comments/26bknj/the_future_of_your_home_office_gadgets_infograph/,jsm272727,1400872800,,3,12
1618,2014-5-24,2014,5,24,5,26borx,Cali tech startup working to bring visibility and influence to the people with digital voting system. Two candidates already using it!,https://www.reddit.com/r/Futurology/comments/26borx/cali_tech_startup_working_to_bring_visibility_and/,[deleted],1400875395,,1,21
1619,2014-5-24,2014,5,24,5,26bp97,Comfy or Creepy? Robot Furniture Rearranges Itself on Demand,https://www.reddit.com/r/Futurology/comments/26bp97/comfy_or_creepy_robot_furniture_rearranges_itself/,[deleted],1400875710,,2,7
1620,2014-5-24,2014,5,24,5,26bqpt,This subreddit cover/banner image?,https://www.reddit.com/r/Futurology/comments/26bqpt/this_subreddit_coverbanner_image/,MrMartin1337,1400876605,What the image of this subreddit banner/cover? Not the one of the man standing but the one with the astronaut. It is simply gorgeous.,4,5
1621,2014-5-24,2014,5,24,5,26btit,There's More Porn Coming to Oculus Rift,https://www.reddit.com/r/Futurology/comments/26btit/theres_more_porn_coming_to_oculus_rift/,ImLivingAmongYou,1400878483,,0,7
1622,2014-5-24,2014,5,24,5,26btu5,New Omega Mice Produce Their Own Essential Fats,https://www.reddit.com/r/Futurology/comments/26btu5/new_omega_mice_produce_their_own_essential_fats/,qdragon,1400878680,,0,5
1623,2014-5-24,2014,5,24,6,26bu0z,The Startup Trying to Replace Congress With Software Is Running Two Candidates,https://www.reddit.com/r/Futurology/comments/26bu0z/the_startup_trying_to_replace_congress_with/,[deleted],1400878801,,0,1
1624,2014-5-24,2014,5,24,6,26buu1,Are killer robots inevitable ?,https://www.reddit.com/r/Futurology/comments/26buu1/are_killer_robots_inevitable/,[deleted],1400879359,,4,5
1625,2014-5-24,2014,5,24,6,26buze,"Crowdfunding Fusion - Focus Fusion as the Short Route to Fusion Power, a talk by Eric Lerner at Oxford Uni. Scientific Society",https://www.reddit.com/r/Futurology/comments/26buze/crowdfunding_fusion_focus_fusion_as_the_short/,aviroy,1400879460,,1,10
1626,2014-5-24,2014,5,24,6,26bw4d,An in depth guide to the future technology everyone should know about,https://www.reddit.com/r/Futurology/comments/26bw4d/an_in_depth_guide_to_the_future_technology/,[deleted],1400880199,,3,19
1627,2014-5-24,2014,5,24,6,26bw9z,[In-Depth] Is there any current estimates or predictions on the cost of fitting older cars with self-driving?,https://www.reddit.com/r/Futurology/comments/26bw9z/indepth_is_there_any_current_estimates_or/,Vincetti,1400880292,"Hey /r/futurology,

I am an avid believer in autonomous vehicles. They are a great advancing technology which will improve the safety and quality of life for millions. Automotive manufacturers (as well as independent corporations such as Google) are getting very close and within the next couple of years will be releasing mostly-to-fully autonomous cars.

That all being said, these systems are going to be installed in new (and thus generally expensive) models only. What's to be said about your average person who already has a vehicle? Or your average person who can't afford a new car?",7,9
1628,2014-5-24,2014,5,24,6,26bwso,The US Is Ready to Make a $16 Billion Bet on Driverless Cars,https://www.reddit.com/r/Futurology/comments/26bwso/the_us_is_ready_to_make_a_16_billion_bet_on/,ImLivingAmongYou,1400880630,,3,33
1629,2014-5-24,2014,5,24,6,26bwuh,Ending Pain Could Make Us Live Longer,https://www.reddit.com/r/Futurology/comments/26bwuh/ending_pain_could_make_us_live_longer/,ImLivingAmongYou,1400880665,,0,13
1630,2014-5-24,2014,5,24,6,26bx4o,"Meet Aubrey de Grey, the Researcher Who Wants to Cure Old Age",https://www.reddit.com/r/Futurology/comments/26bx4o/meet_aubrey_de_grey_the_researcher_who_wants_to/,ImLivingAmongYou,1400880865,,4,48
1631,2014-5-24,2014,5,24,6,26bxf9,Solar FREAKIN Roadways! The solution for energy problems in the world.,https://www.reddit.com/r/Futurology/comments/26bxf9/solar_freakin_roadways_the_solution_for_energy/,Logan_sk,1400881053,,0,0
1632,2014-5-24,2014,5,24,6,26bz5u,Eleven Million Hits on INCOG MAN,https://www.reddit.com/r/Futurology/comments/26bz5u/eleven_million_hits_on_incog_man/,solo4cano,1400882206,,0,1
1633,2014-5-24,2014,5,24,7,26c0gb,Political Leanings of /r/Futurology users,https://www.reddit.com/r/Futurology/comments/26c0gb/political_leanings_of_rfuturology_users/,3ryanisland,1400883108,"I am curious what the political leanings of /r/Futurology users are. I've been seeing a lot of articles posted recently about a minimum income and about a future in which the majority of currently employed people will no longer be needed (I think 80% was a figure I saw thrown out). I was curious how members of this subreddit saw this fitting into their politics. Like, it seems as though a future in which the majority of us are no longer needed as employees wouldn't be well-suited to an economic system that preaches free-market capitalism. But maybe I'm wrong and somehow you can square what I see as the circle.",37,12
1634,2014-5-24,2014,5,24,7,26c0jj,UK military creates quantum compass that could be the successor to GPS,https://www.reddit.com/r/Futurology/comments/26c0jj/uk_military_creates_quantum_compass_that_could_be/,[deleted],1400883166,,1,3
1635,2014-5-24,2014,5,24,7,26c0kk,"Amazon will have 10,000 robots in its warehouses by years end",https://www.reddit.com/r/Futurology/comments/26c0kk/amazon_will_have_10000_robots_in_its_warehouses/,ImLivingAmongYou,1400883181,,9,61
1636,2014-5-24,2014,5,24,7,26c3jr,Google engineers open gates to Quantum Computing Playground,https://www.reddit.com/r/Futurology/comments/26c3jr/google_engineers_open_gates_to_quantum_computing/,dirk_bruere,1400885286,,0,12
1637,2014-5-24,2014,5,24,8,26c6xy,Super buses that glide over traffic,https://www.reddit.com/r/Futurology/comments/26c6xy/super_buses_that_glide_over_traffic/,[deleted],1400887698,,2,2
1638,2014-5-24,2014,5,24,8,26c7ku,Samsung reportedly building smartwatch that doesn't need a phone,https://www.reddit.com/r/Futurology/comments/26c7ku/samsung_reportedly_building_smartwatch_that/,gari-soflo,1400888143,,0,4
1639,2014-5-24,2014,5,24,8,26c7n9,"Can we make a sub just for the ""this week in"" summaries",https://www.reddit.com/r/Futurology/comments/26c7n9/can_we_make_a_sub_just_for_the_this_week_in/,reefbreland,1400888191,"Can we make a sub just for the ""this week in"" summaries ",1,0
1640,2014-5-24,2014,5,24,9,26cbws,A Silicon Valley VC Imagines A Future Where Most Of Us (Except Robots) Don't Have Jobs,https://www.reddit.com/r/Futurology/comments/26cbws/a_silicon_valley_vc_imagines_a_future_where_most/,imitationcheese,1400891529,,2,5
1641,2014-5-24,2014,5,24,9,26cc0g,A screenshot of Reddit from the year 3012,https://www.reddit.com/r/Futurology/comments/26cc0g/a_screenshot_of_reddit_from_the_year_3012/,[deleted],1400891617,,1,1
1642,2014-5-24,2014,5,24,9,26cch6,Panera Bread Will Replace Cashiers With Robots By 2016,https://www.reddit.com/r/Futurology/comments/26cch6/panera_bread_will_replace_cashiers_with_robots_by/,SatyapriyaCC,1400891975,,101,47
1643,2014-5-24,2014,5,24,9,26cd1j,"McDonald's hires 7,000 touch-screen cashiers to replace workers on strike who are demanding a $15/hour wage",https://www.reddit.com/r/Futurology/comments/26cd1j/mcdonalds_hires_7000_touchscreen_cashiers_to/,SatyapriyaCC,1400892464,,16,17
1644,2014-5-24,2014,5,24,10,26ceuk,An army of robots may soon be deployed: to care for the aged,https://www.reddit.com/r/Futurology/comments/26ceuk/an_army_of_robots_may_soon_be_deployed_to_care/,mind_bomber,1400893962,,0,5
1645,2014-5-24,2014,5,24,10,26cg5l,"Do you think there will be attempts at depopulation by the elite as technological unemployment continues to rise? Through killer viruses, engineered wars, poisoned food/water supplies...etc. Why or why not?",https://www.reddit.com/r/Futurology/comments/26cg5l/do_you_think_there_will_be_attempts_at/,SatyapriyaCC,1400895073,"Seriously. It's either that, widespread suffering, or we implement /r/BasicIncome in some form. Let's make the right choice here.",34,7
1646,2014-5-24,2014,5,24,11,26cizl,The futuristic dream of wirelessly charging your smartphone while you stand in line at the coffee shop may soon come to pass,https://www.reddit.com/r/Futurology/comments/26cizl/the_futuristic_dream_of_wirelessly_charging_your/,gari-soflo,1400897465,,0,2
1647,2014-5-24,2014,5,24,11,26cloh,Walking dogs with drones,https://www.reddit.com/r/Futurology/comments/26cloh/walking_dogs_with_drones/,canausernamebetoolon,1400899784,,3,2
1648,2014-5-24,2014,5,24,11,26cm5h,"A prototype of the Tactical Assault Light Operator Suit, or TALOS, will be available later this month, according to Battelle. The suit would protect from bullets, assist in lifting heavy loads and provide the wearer information about their environment using cameras, sensors &amp; displays.",https://www.reddit.com/r/Futurology/comments/26cm5h/a_prototype_of_the_tactical_assault_light/,God_Wills_It_,1400900190,,10,13
1649,2014-5-24,2014,5,24,12,26cn5x,Driving license in the age of self driving cars,https://www.reddit.com/r/Futurology/comments/26cn5x/driving_license_in_the_age_of_self_driving_cars/,[deleted],1400901063,How will we license drivers to use vehicles in which no human interaction is required? Who would be responsible for insurance?,2,7
1650,2014-5-24,2014,5,24,12,26comp,"If/when this goes through, our Highways will be totally different and high tech. ""Solar Powered Roads.""",https://www.reddit.com/r/Futurology/comments/26comp/ifwhen_this_goes_through_our_highways_will_be/,rreighe2,1400902323,,0,1
1651,2014-5-24,2014,5,24,12,26cp2o,"Back to the Future is here in the flying car, in-depth",https://www.reddit.com/r/Futurology/comments/26cp2o/back_to_the_future_is_here_in_the_flying_car/,EthicalWoman,1400902681,,0,1
1652,2014-5-24,2014,5,24,12,26cpx5,"[In-depth] let us have a discussion about an area of science so over looked by futurists, biology.",https://www.reddit.com/r/Futurology/comments/26cpx5/indepth_let_us_have_a_discussion_about_an_area_of/,[deleted],1400903415,"Biology is far superior than any technology by today's standards, nothing is more adaptable than the genetic code that is housed inside each of us. DNA is at the same time the most complex programing language ever devised and the simplest. 4 letters that can be arranged into 3 letter words only, these words how ever can be used to create sentences of any length; be it 1000 letters long or 300 billion. If one could learn the language of DNA one could dream of limitless possibilities. The structures you could make from the labors of DNA, the materials you could coax into existence simply by gradually creating a need for them to exist in a colony of bacteria. Want a material that is incredibly heat resistance. Slowly turn the temperature up in a controlled environment filled with resources, gradual enough change will allow the bacteria to survive the ever increasing temperature. You could do the same with any situation you can think of. You need not even know how it works and that is the beauty of it, even without knowing the language you could solve any problem given time, knowing the language would only cut the time out of the equation. 

Technology can not do these things. It can not self sustain, it cannot solve any problem given time, it requires constant coaxing, nothing will be created from it if left by itself. Nor does it have the adaptability of biology. So many futurists are willing to abandon biology for technology, to throw away the gifts of a laboratory that has functioned by itself for 4 billion years. To abandon it for a laboratory of our own design that has existed for a few thousand. Why start from stratch in an inferior lab when the place of the experimenter is left open in the far more ancient and far more profitable lab. Without any guide biology created us, the possibilities if it was give a guide are endless. There is a great loss when so many are so willing to throw that away because they fail to see what is there and what could be there. ",45,22
1653,2014-5-24,2014,5,24,13,26cuar,Will Drones Make The U.S. Navy Migrate To The Cloud?,https://www.reddit.com/r/Futurology/comments/26cuar/will_drones_make_the_us_navy_migrate_to_the_cloud/,[deleted],1400907552,,0,0
1654,2014-5-24,2014,5,24,14,26cuff,Can A Digital Connection Replace A Physical One?,https://www.reddit.com/r/Futurology/comments/26cuff/can_a_digital_connection_replace_a_physical_one/,[deleted],1400907656,,0,1
1655,2014-5-24,2014,5,24,14,26cvsj,U.S. Government Preparing for Collapse (and Not in a Nice Way),https://www.reddit.com/r/Futurology/comments/26cvsj/us_government_preparing_for_collapse_and_not_in_a/,arrowclock,1400909039,,4,0
1656,2014-5-24,2014,5,24,15,26d000,Solar FREAKIN' Roadways!,https://www.reddit.com/r/Futurology/comments/26d000/solar_freakin_roadways/,i_pee_in_the_sink,1400913727,,3,0
1657,2014-5-24,2014,5,24,15,26d0n2,Central Coast Wedding Photographers,https://www.reddit.com/r/Futurology/comments/26d0n2/central_coast_wedding_photographers/,Michael0124,1400914598,,1,1
1658,2014-5-24,2014,5,24,17,26d419,"When human life can be indefinitely extended (via organ replacement and cybernetics), will social change stagnate?",https://www.reddit.com/r/Futurology/comments/26d419/when_human_life_can_be_indefinitely_extended_via/,webitube,1400919219,"I've often heard how social change is hastened as the ""older"" generation passes away. What will happen when the biases of the ""older"" generation never go away because no one dies (or is extremely long lived)?

Or, is social interaction (like on the internet or IRL) a more powerful fuel for social change?",5,20
1659,2014-5-24,2014,5,24,17,26d5jb,Dystopia Tracker  explore and contribute predictions about the future and their realizations.,https://www.reddit.com/r/Futurology/comments/26d5jb/dystopia_tracker_explore_and_contribute/,davidbauer,1400921578,,0,10
1660,2014-5-24,2014,5,24,20,26dafa,The Fermi Paradox: Where the Hell Are the Other Earths?,https://www.reddit.com/r/Futurology/comments/26dafa/the_fermi_paradox_where_the_hell_are_the_other/,jimbiscuit,1400929211,,0,1
1661,2014-5-24,2014,5,24,20,26dai2,Solar Roadways Support Campaign - 8 Days Left! Reddit let's change the world!,https://www.reddit.com/r/Futurology/comments/26dai2/solar_roadways_support_campaign_8_days_left/,lovingthechaos,1400929322,,0,1
1662,2014-5-24,2014,5,24,20,26dajh,"When will the whole world be online, and what effect will it have on culture?",https://www.reddit.com/r/Futurology/comments/26dajh/when_will_the_whole_world_be_online_and_what/,[deleted],1400929390,Imagine Reddit when it is filled with people from less developed countries. The hive mind is bound to change. ,25,35
1663,2014-5-24,2014,5,24,20,26dbmy,California Will Start Granting Licenses For Driverless Cars In September,https://www.reddit.com/r/Futurology/comments/26dbmy/california_will_start_granting_licenses_for/,Sourcecode12,1400931029,,752,2936
1664,2014-5-24,2014,5,24,20,26dcmg,Why You Should Upload Yourself to a Supercomputer,https://www.reddit.com/r/Futurology/comments/26dcmg/why_you_should_upload_yourself_to_a_supercomputer/,Majoby,1400932503,,45,8
1665,2014-5-24,2014,5,24,20,26dcth,Here is an awesome invitation code for all of you thx :D b3594842,https://www.reddit.com/r/Futurology/comments/26dcth/here_is_an_awesome_invitation_code_for_all_of_you/,Pooprageop,1400932786,,0,1
1666,2014-5-24,2014,5,24,21,26deeg,Opiomes the Domes,https://www.reddit.com/r/Futurology/comments/26deeg/opiomes_the_domes/,AEReiff,1400934782,,0,0
1667,2014-5-24,2014,5,24,21,26dfc3,Future augmentation of GPS systems.,https://www.reddit.com/r/Futurology/comments/26dfc3/future_augmentation_of_gps_systems/,[deleted],1400935887,,1,27
1668,2014-5-24,2014,5,24,22,26dh13,Making Rockets  the Democratization of Matter - Steve Jurvetson,https://www.reddit.com/r/Futurology/comments/26dh13/making_rockets_the_democratization_of_matter/,mrprint,1400937728,,0,5
1669,2014-5-24,2014,5,24,22,26dhet,"My No-Soap, No-Shampoo, Bacteria-Rich Hygiene Experiment (AOBiome AO+)",https://www.reddit.com/r/Futurology/comments/26dhet/my_nosoap_noshampoo_bacteriarich_hygiene/,czottmann,1400938140,,13,24
1670,2014-5-24,2014,5,24,22,26dj3g,Forget the 3D Printer: 4D Printing Could Change Everything,https://www.reddit.com/r/Futurology/comments/26dj3g/forget_the_3d_printer_4d_printing_could_change/,mind_bomber,1400939838,,5,9
1671,2014-5-24,2014,5,24,22,26dj52,Solar Roadways,https://www.reddit.com/r/Futurology/comments/26dj52/solar_roadways/,moondoggie_00,1400939879,,0,0
1672,2014-5-24,2014,5,24,23,26dlor,Can future technology lead to a sustainable future?,https://www.reddit.com/r/Futurology/comments/26dlor/can_future_technology_lead_to_a_sustainable_future/,eggfriedbryce,1400942159,,6,7
1673,2014-5-24,2014,5,24,23,26dmcv,All This Talk of Suspended Animation's Got Me Thinking...,https://www.reddit.com/r/Futurology/comments/26dmcv/all_this_talk_of_suspended_animations_got_me/,[deleted],1400942765,"Replacing the entire blood content of the body with cold saline? Fantastic, to say the least, but what happens when we take it a step further? Perhaps the key to true suspended animation is with not just cold saline, but a cold nutrient rich liquid somewhere between saline and Soylent, the new food product that could potentially replace stuff like rice as the cheapest food on earth. This way, metabolism still falls to a crawl, but the body is not forced to rely on anaerobic respiration (the reason why current suspended animation technology could only keep pigs alive for a few hours after traumatic injury). Just speculation, I know, but I found it to be an extremely interesting thought, and I wanted to share it with you all.",1,13
1674,2014-5-24,2014,5,24,23,26dmqh,Explosion of Student Interest in Computer Science,https://www.reddit.com/r/Futurology/comments/26dmqh/explosion_of_student_interest_in_computer_science/,aloisdg,1400943089,,21,42
1675,2014-5-25,2014,5,25,1,26dtdg,world's largest prefabricated tower will be built in new york,https://www.reddit.com/r/Futurology/comments/26dtdg/worlds_largest_prefabricated_tower_will_be_built/,b_crowder,1400948433,,5,14
1676,2014-5-25,2014,5,25,1,26dtkp,"   : Kairos,     ",https://www.reddit.com/r/Futurology/comments/26dtkp/____kairos__/,argiman1,1400948593,,0,1
1677,2014-5-25,2014,5,25,2,26dxfk,I need some quick help with remembering the name of a book involving universal basic income.,https://www.reddit.com/r/Futurology/comments/26dxfk/i_need_some_quick_help_with_remembering_the_name/,hungryhungryHIPAAs,1400951530,"I've been trying to remember the name of a short story or book that I think I read about in a thread here on /r/Futurology at some point in the past couple months. It had something to do with providing a universal basic income and then incentivizing people to use their newfound leisure time to be productive (increasing stipends/awards for automation, contributions to aging and space exploration research, etc).

For the past half an hour, I've been feeling like an idiot typing random strings of key words into google and searchreddit to no avail. Does anyone have any idea what I'm talking about, or is this some weird thing my brain happened to come up with? Thanks in advance!

**Edit** Forgot to mention that it was a science fiction book. Think it was supposed to take place in the somewhat near future.",12,4
1678,2014-5-25,2014,5,25,2,26dxoz,What the near future is actually going to look like?,https://www.reddit.com/r/Futurology/comments/26dxoz/what_the_near_future_is_actually_going_to_look/,My_soliloquy,1400951744,,0,4
1679,2014-5-25,2014,5,25,2,26dywa,Google To Buy Skybox Imaging $1 Billion.,https://www.reddit.com/r/Futurology/comments/26dywa/google_to_buy_skybox_imaging_1_billion/,[deleted],1400952615,,0,1
1680,2014-5-25,2014,5,25,2,26dyyt,Google To Buy Skybox Imaging for $1 Billion dollars.,https://www.reddit.com/r/Futurology/comments/26dyyt/google_to_buy_skybox_imaging_for_1_billion_dollars/,RushAndAPush,1400952670,,3,10
1681,2014-5-25,2014,5,25,2,26dzdd,Robots that can read and respond to human emotions - what does the future in virtual characters got in store?,https://www.reddit.com/r/Futurology/comments/26dzdd/robots_that_can_read_and_respond_to_human/,[deleted],1400952976,,2,7
1682,2014-5-25,2014,5,25,2,26e05o,Time Traveler Who Spent 2 Years in The Future 2749 Tells All,https://www.reddit.com/r/Futurology/comments/26e05o/time_traveler_who_spent_2_years_in_the_future/,ufomania,1400953588,,1,1
1683,2014-5-25,2014,5,25,2,26e0bm,Japan Wants To Put A Giant Solar Farm In Space,https://www.reddit.com/r/Futurology/comments/26e0bm/japan_wants_to_put_a_giant_solar_farm_in_space/,Cakethief29,1400953709,,6,26
1684,2014-5-25,2014,5,25,2,26e0kv,New X-ray technique uses thousand year old pinhole camera technology to see the unseen,https://www.reddit.com/r/Futurology/comments/26e0kv/new_xray_technique_uses_thousand_year_old_pinhole/,singeblanc,1400953906,,1,2
