,date,year,month,day,hour,id,title,full_link,author,created,selftext,num_comments,score
495,2014-5-9,2014,5,9,18,25462f,How to sensitize public opinion to climate change,https://www.reddit.com/r/Futurology/comments/25462f/how_to_sensitize_public_opinion_to_climate_change/,claudenougat,1399626113,"Climate fiction - in books, movies and TV series - is one way to stimulate public opinion about future threats to our survival as a species on this earth. 
How does it work? Because it plays on our emotions, something strings of scientific data and numbers cannot do. But to work well, it must be credible. It needs to build suspenseful stories about people like you and me struggling in a changed environment that has a high degree of ""likelihood"".
So climate fiction is necessarily linked to futurology as it makes use of the various alternative scenarios that futurologists come up with. 

So far, climate fiction, cli-fi for short, is a new genre (the term was coined by climate activist Dan Bloom in 2008), with still relatively few book titles though it is growing. Professor Adeline Johns-Putra, chair of the Association for the Study of Literature and Environment in the UK and Ireland, in a recent interview on the Financial Times, noted this was a definite growing trend. Until the 1990s, there were ""only a handful of novels using climate change as a setting, she said, but since 2006, some 150 have made it into print, including at least 50 in which [climate change] is a central theme.""

What is the future of climate fiction in your opinion, taking into account the success of some recent cli-fi books like Barbara Kingsolver's Flight Behavior or Nathaniel Rich's Odds Against Tomorrow?",26,23
496,2014-5-9,2014,5,9,18,254712,Modern Warfare,https://www.reddit.com/r/Futurology/comments/254712/modern_warfare/,DaPorter,1399627501,,6,0
497,2014-5-9,2014,5,9,19,2549i2,$17.9-billion funding plan for NASA would boost planetary science,https://www.reddit.com/r/Futurology/comments/2549i2/179billion_funding_plan_for_nasa_would_boost/,N8theGr8,1399630946,,80,1067
498,2014-5-9,2014,5,9,19,2549ws,3D-printed mouthpiece clears the air for sleep apnea sufferers,https://www.reddit.com/r/Futurology/comments/2549ws/3dprinted_mouthpiece_clears_the_air_for_sleep/,Lolkac,1399631480,,0,1
499,2014-5-9,2014,5,9,19,254aqm,A Nano Material Harder than Diamond.,https://www.reddit.com/r/Futurology/comments/254aqm/a_nano_material_harder_than_diamond/,1800PullOut,1399632651,,9,109
500,2014-5-9,2014,5,9,19,254atx,Scientists from Boston University are developing a Matrix like technology that will let us upload/download skills directly into our brain.,https://www.reddit.com/r/Futurology/comments/254atx/scientists_from_boston_university_are_developing/,nyquiljunky,1399632769,,0,1
501,2014-5-9,2014,5,9,20,254ctz,BBC News - Braille e-books: Why can't you buy a budget e-reader?,https://www.reddit.com/r/Futurology/comments/254ctz/bbc_news_braille_ebooks_why_cant_you_buy_a_budget/,alexgmcm,1399635203,,3,2
502,2014-5-9,2014,5,9,20,254dpx,Experts say those houses that were 3D printed over 24-hours in China are not worth building as they don't work as homes and we should focus on 3D printing small components instead,https://www.reddit.com/r/Futurology/comments/254dpx/experts_say_those_houses_that_were_3d_printed/,internetsquirrel,1399636155,,145,234
503,2014-5-9,2014,5,9,21,254eq9,Mathematical Model Of Consciousness Proves Human Experience Cannot Be Modelled On A Computer,https://www.reddit.com/r/Futurology/comments/254eq9/mathematical_model_of_consciousness_proves_human/,[deleted],1399637172,,78,17
504,2014-5-9,2014,5,9,21,254fo8,"Novel antioxidant makes old arteries seem young again, CU-Boulder study finds",https://www.reddit.com/r/Futurology/comments/254fo8/novel_antioxidant_makes_old_arteries_seem_young/,stardustingly,1399638124,,1,5
505,2014-5-9,2014,5,9,21,254g42,"World's First Urban Algae Canopy Produces the Oxygen Equivalent of Four Hectares of Woodland Every Day Read more: World's First Urban Algae Canopy Produces the Oxygen Equivalent of Four Hectares of Woodland Every Day | Inhabitat - Sustainable Design Innovation, Eco Architecture, Green Building",https://www.reddit.com/r/Futurology/comments/254g42/worlds_first_urban_algae_canopy_produces_the/,[deleted],1399638550,,0,1
506,2014-5-9,2014,5,9,21,254g6x,"World's First Urban Algae Canopy Produces the Oxygen Equivalent of Four Hectares of Woodland Every Day Read more: World's First Urban Algae Canopy Produces the Oxygen Equivalent of Four Hectares of Woodland Every Day | Inhabitat - Sustainable Design Innovation, Eco Architecture, Green Building",https://www.reddit.com/r/Futurology/comments/254g6x/worlds_first_urban_algae_canopy_produces_the/,[deleted],1399638614,,0,1
507,2014-5-9,2014,5,9,21,254gat,"World's First Urban Algae Canopy Produces the Oxygen Equivalent of Four Hectares of Woodland Every Day Read more: World's First Urban Algae Canopy Produces the Oxygen Equivalent of Four Hectares of Woodland Every Day | Inhabitat - Sustainable Design Innovation, Eco Architecture, Green Building",https://www.reddit.com/r/Futurology/comments/254gat/worlds_first_urban_algae_canopy_produces_the/,[deleted],1399638701,,0,1
508,2014-5-9,2014,5,9,21,254gre,Provender Aims to Disrupt Global Food Industry by Returning Control to Farmers,https://www.reddit.com/r/Futurology/comments/254gre/provender_aims_to_disrupt_global_food_industry_by/,Rogerh91,1399639145,,0,1
509,2014-5-9,2014,5,9,22,254ly1,"US military begins research into moral, ethical robots, to stave off Skynet-like apocalypse",https://www.reddit.com/r/Futurology/comments/254ly1/us_military_begins_research_into_moral_ethical/,gari-soflo,1399643328,,78,177
510,2014-5-9,2014,5,9,22,254mop,"inspiration to ""live life the real way""",https://www.reddit.com/r/Futurology/comments/254mop/inspiration_to_live_life_the_real_way/,Roguec,1399643875,,1,1
511,2014-5-9,2014,5,9,23,254n8g,"I dont believe I will see a robot or computer have an original thought, the Holy Grail of Artificial General Intelligence, in my lifetime. Robots and computerized machines are tools, albeit remarkably sophisticated tools, used by humans.",https://www.reddit.com/r/Futurology/comments/254n8g/i_dont_believe_i_will_see_a_robot_or_computer/,robotenomics,1399644232,,16,7
512,2014-5-9,2014,5,9,23,254pdn,Worlds Largest Solar Array Set to Crank Out 290 Megawatts of Sunshine Power,https://www.reddit.com/r/Futurology/comments/254pdn/worlds_largest_solar_array_set_to_crank_out_290/,cryptoz,1399645782,,6,63
513,2014-5-9,2014,5,9,23,254ppv,A Problem of Concepts (Part 1 of 2) IEET by Valkyrieice,https://www.reddit.com/r/Futurology/comments/254ppv/a_problem_of_concepts_part_1_of_2_ieet_by/,egaliste,1399645998,,2,8
514,2014-5-10,2014,5,10,0,254tsx,Citi Disruptive Innovations 2014 - Business Insider,https://www.reddit.com/r/Futurology/comments/254tsx/citi_disruptive_innovations_2014_business_insider/,Capitalism_Prevails,1399648660,,1,2
515,2014-5-10,2014,5,10,0,254uh3,Ray Kurzweil for president,https://www.reddit.com/r/Futurology/comments/254uh3/ray_kurzweil_for_president/,GalacticPA2030,1399649086,,20,26
516,2014-5-10,2014,5,10,0,254vfa,What do you think of fusion? Will ITER work? Is fusion power the future of energy production?,https://www.reddit.com/r/Futurology/comments/254vfa/what_do_you_think_of_fusion_will_iter_work_is/,Haxhage,1399649705,,62,45
517,2014-5-10,2014,5,10,0,254vh4,'Killer Robots' to be Debated at UN - Meetings held from 13th to 16th of May,https://www.reddit.com/r/Futurology/comments/254vh4/killer_robots_to_be_debated_at_un_meetings_held/,AndySEO,1399649741,,5,11
518,2014-5-10,2014,5,10,0,254vlc,A Lunar Retirement Home,https://www.reddit.com/r/Futurology/comments/254vlc/a_lunar_retirement_home/,[deleted],1399649811,,0,2
519,2014-5-10,2014,5,10,0,254weg,What do you think of fusion? Will ITER work? Is fusion power the future of energy production?,https://www.reddit.com/r/Futurology/comments/254weg/what_do_you_think_of_fusion_will_iter_work_is/,[deleted],1399650328,,0,1
520,2014-5-10,2014,5,10,1,254xz5,This Week in Technology,https://www.reddit.com/r/Futurology/comments/254xz5/this_week_in_technology/,Sourcecode12,1399651315,,308,3397
521,2014-5-10,2014,5,10,1,254y56,Are there any jobs left in which you genuinely need to be able to do math without some sort of calculator machine?,https://www.reddit.com/r/Futurology/comments/254y56/are_there_any_jobs_left_in_which_you_genuinely/,[deleted],1399651423,"can't really think of one.  Trader (like on Wall Street) comes to mind, and it's still a pissing contest to be able to do fast percentages in your brain, but as we know the VAST majority of trades done on the Street are done by computers themselves.

I guess Professional Black Jack Gambler.

Maybe some sort of Intelligence Officer/Secret Agent- you're stuck in the field, need to figure out a signal or something with no equipment

That's about all I got.",11,3
522,2014-5-10,2014,5,10,1,254yl2,"Breaking the Destructive Cycle: Understanding El Nio. ""The poisonous soup that El Nio and global warming are cooking up is just one of the huge threats we have thoughtlessly and greedily concocted in a mere two centuries.""",https://www.reddit.com/r/Futurology/comments/254yl2/breaking_the_destructive_cycle_understanding_el/,[deleted],1399651710,,0,1
523,2014-5-10,2014,5,10,1,254z2r,Open Source Software is Important for Modern Science,https://www.reddit.com/r/Futurology/comments/254z2r/open_source_software_is_important_for_modern/,[deleted],1399652028,,0,1
524,2014-5-10,2014,5,10,1,254zhm,"Hi again, Futurology. A cpl weeks ago you guys gave us great feedback on clips from our new TV show about emerging tech that we're trying to get on the air. Michio Kaku was the guest. Tomorrow we're shooting the 2nd pilot about 3D printing. We'd love to include your thoughts",https://www.reddit.com/r/Futurology/comments/254zhm/hi_again_futurology_a_cpl_weeks_ago_you_guys_gave/,rolleverything,1399652293,"We really want this show to be great and help spread a positive view and awareness of sci/tech. Our guests will be Anthony Mochella, The Director of Product at MakerBot and Erica Orange, Vice President of Weiner Edrich &amp; Brown a leading futurist consulting group in NYC. We have a better [Graphic Look](http://i.imgur.com/XMAhuMK.png) now too! u/nootchmyer is our host.  Thanks in advance for all your thoughts! How do you think 3D printing will impact our world in the future? 

**UPDATE** Anthony Mochella just cancelled on us. We're scrambling to find a lead guest for tomorrow's taping. Need someone in NYC who's a leader in the 3D Printing world. I don't think we'll be able to find someone quick enough for tomorrow. Looks like we may have to postpone and regroup. Thanks for all your thoughts and questions.

**2nd UPDATE** Bill Buel, director of mechanical engineering at MakerBot will now join us tomorrow, so game on!

**3rd Update** Piers Fawkes will now be joining us as well. Looks like we might get a great show after a scramble!  ",15,15
525,2014-5-10,2014,5,10,1,25517b,White House petition to remove Tom Wheeler as chairman of the FCC,https://www.reddit.com/r/Futurology/comments/25517b/white_house_petition_to_remove_tom_wheeler_as/,rod333,1399653410,,0,1
526,2014-5-10,2014,5,10,2,25544s,Learning Tools Of The Future,https://www.reddit.com/r/Futurology/comments/25544s/learning_tools_of_the_future/,jsm2727,1399655271,,0,15
527,2014-5-10,2014,5,10,2,2555jg,Should automated systems be taxed based on the revenue they provide?,https://www.reddit.com/r/Futurology/comments/2555jg/should_automated_systems_be_taxed_based_on_the/,Arowx,1399656108,"Workers incomes are taxed but as automated systems and AI systems take over jobs from people should they also be taxed?

Ideally the wealth the automated systems provide would be enough to allow the displaced workers to live a basic modern life on welfare.

What are you thoughts on taxation, automation and the seismic changes to the employment landscape being caused by technology?",19,14
528,2014-5-10,2014,5,10,2,25560p,Chinese experts 'in discussions' over building intercontintenal high-speed Beijing-US railway,https://www.reddit.com/r/Futurology/comments/25560p/chinese_experts_in_discussions_over_building/,[deleted],1399656400,,0,1
529,2014-5-10,2014,5,10,2,255654,Labia,https://www.reddit.com/r/Futurology/comments/255654/labia/,hanging2low,1399656482,,0,1
530,2014-5-10,2014,5,10,2,2556fd,"Graphene photonics breakthrough promises fast-speed, low-cost communications",https://www.reddit.com/r/Futurology/comments/2556fd/graphene_photonics_breakthrough_promises/,Capitalism_Prevails,1399656615,,7,17
531,2014-5-10,2014,5,10,2,2558y7,"Been enjoying this futuristic app inspired by the movie 'Her', a personal assistant/curated news reader",https://www.reddit.com/r/Futurology/comments/2558y7/been_enjoying_this_futuristic_app_inspired_by_the/,NewWaveArch90,1399658177,,1,2
532,2014-5-10,2014,5,10,2,255988,Come help us crowdsource the design of online robots (x-posted from r/robotics),https://www.reddit.com/r/Futurology/comments/255988/come_help_us_crowdsource_the_design_of_online/,wm_mw,1399658358,,0,1
533,2014-5-10,2014,5,10,3,2559mp,Please help Tara and Skyler,https://www.reddit.com/r/Futurology/comments/2559mp/please_help_tara_and_skyler/,babyval89,1399658600,,1,1
534,2014-5-10,2014,5,10,3,255anj,Experimental Color-Changing Fabric Could Turn You Into a Chameleon,https://www.reddit.com/r/Futurology/comments/255anj/experimental_colorchanging_fabric_could_turn_you/,yourbasicgeek,1399659245,,0,1
535,2014-5-10,2014,5,10,3,255aw6,Human progress site,https://www.reddit.com/r/Futurology/comments/255aw6/human_progress_site/,brokenarrow8,1399659369,,1,13
536,2014-5-10,2014,5,10,3,255b12,The Next Great Space Race  Space-Based Power Stations,https://www.reddit.com/r/Futurology/comments/255b12/the_next_great_space_race_spacebased_power/,petskup,1399659457,,3,16
537,2014-5-10,2014,5,10,3,255bte,"Welcome to /r/Futurology, the equivalent of /r/upliftingnews only about tech and the future! Please leave your pessimism and realism behind.",https://www.reddit.com/r/Futurology/comments/255bte/welcome_to_rfuturology_the_equivalent_of/,spamholderman,1399659929,,7,0
538,2014-5-10,2014,5,10,3,255c30,New Consumer-to-Business (c2b) matchmaking technology,https://www.reddit.com/r/Futurology/comments/255c30/new_consumertobusiness_c2b_matchmaking_technology/,WebsterPi,1399660110,,0,1
539,2014-5-10,2014,5,10,3,255cam,"A new project and currency that will fund science, technology and the future!",https://www.reddit.com/r/Futurology/comments/255cam/a_new_project_and_currency_that_will_fund_science/,brokenarrow8,1399660254,,0,2
540,2014-5-10,2014,5,10,3,255ddo,Genes and intelligence: The 3% solution - Source of genetic variation in cognitive ability has just been discovered,https://www.reddit.com/r/Futurology/comments/255ddo/genes_and_intelligence_the_3_solution_source_of/,wulfdesign,1399660913,,10,58
541,2014-5-10,2014,5,10,3,255dys,China proposes high speed rail from China to the US,https://www.reddit.com/r/Futurology/comments/255dys/china_proposes_high_speed_rail_from_china_to_the/,[deleted],1399661273,,0,1
542,2014-5-10,2014,5,10,3,255e56,"A future entirely without fossil fuels may be desirable, but currently it is not achievable.",https://www.reddit.com/r/Futurology/comments/255e56/a_future_entirely_without_fossil_fuels_may_be/,stefeyboy,1399661377,,7,2
543,2014-5-10,2014,5,10,3,255etm,Quantum Entanglement: Subatomic Swingers and Ansible Questions,https://www.reddit.com/r/Futurology/comments/255etm/quantum_entanglement_subatomic_swingers_and/,Phoenixbeta,1399661805,,0,1
544,2014-5-10,2014,5,10,4,255kjd,How to throttle the FCC to dial up modem speeds on your website using Nginx,https://www.reddit.com/r/Futurology/comments/255kjd/how_to_throttle_the_fcc_to_dial_up_modem_speeds/,DocJ2786,1399665384,,1,1
545,2014-5-10,2014,5,10,5,255m3r,Are there any companies or startups that are currently working on fridges keeping a self-inventory of products?,https://www.reddit.com/r/Futurology/comments/255m3r/are_there_any_companies_or_startups_that_are/,cheddarben,1399666353,,19,16
546,2014-5-10,2014,5,10,5,255mtf,Lawrenceville Plasma Physics is Crowdsourcing Fusion Energy!,https://www.reddit.com/r/Futurology/comments/255mtf/lawrenceville_plasma_physics_is_crowdsourcing/,efh1,1399666781,,0,2
547,2014-5-10,2014,5,10,5,255o5c,Researchers Print Artificial Liver-like Device to Detoxify The Blood,https://www.reddit.com/r/Futurology/comments/255o5c/researchers_print_artificial_liverlike_device_to/,[deleted],1399667617,,0,1
548,2014-5-10,2014,5,10,5,255opq,"The future of food: a diet centered on wild/local greens. Greens are free/cheap to grow and harvest, they offer the highest quality nutrients per calorie, have few to no pest problems, and improve the soil.",https://www.reddit.com/r/Futurology/comments/255opq/the_future_of_food_a_diet_centered_on_wildlocal/,Turil,1399667986,,19,8
549,2014-5-10,2014,5,10,5,255p3b,(Great technology becomes invisible) Astro Teller of Google[X] Wants to Get Technology Out of Our Way | Disrupt NY 2014,https://www.reddit.com/r/Futurology/comments/255p3b/great_technology_becomes_invisible_astro_teller/,mind_bomber,1399668223,,0,12
550,2014-5-10,2014,5,10,5,255pm2,Popcorn Time is now on Android.,https://www.reddit.com/r/Futurology/comments/255pm2/popcorn_time_is_now_on_android/,[deleted],1399668543,,0,1
551,2014-5-10,2014,5,10,5,255qdg,Popcorn Time now on Android,https://www.reddit.com/r/Futurology/comments/255qdg/popcorn_time_now_on_android/,[deleted],1399669013,,0,1
552,2014-5-10,2014,5,10,5,255qm8,Internet of things connected to Cortana,https://www.reddit.com/r/Futurology/comments/255qm8/internet_of_things_connected_to_cortana/,jaynemesis,1399669164,,2,7
553,2014-5-10,2014,5,10,6,255rs0,Scientists find solution to two long-standing mysteries of cuprate high-temperature superconductivity,https://www.reddit.com/r/Futurology/comments/255rs0/scientists_find_solution_to_two_longstanding/,ajsdklf9df,1399669923,,3,7
554,2014-5-10,2014,5,10,6,255s69,San Francisco's future with Lt Gov Gavin Newsom,https://www.reddit.com/r/Futurology/comments/255s69/san_franciscos_future_with_lt_gov_gavin_newsom/,SpeakMouthWords,1399670179,,1,3
555,2014-5-10,2014,5,10,6,255sln,3D printing makeup with exact hues.,https://www.reddit.com/r/Futurology/comments/255sln/3d_printing_makeup_with_exact_hues/,qkdhfjdjdhd,1399670466,,0,1
556,2014-5-10,2014,5,10,7,255y15,The great disruption: how machine intelligence will change the role of lawyers in the delivery of legal services,https://www.reddit.com/r/Futurology/comments/255y15/the_great_disruption_how_machine_intelligence/,starspawn0,1399674076,,12,16
557,2014-5-10,2014,5,10,7,255yyn,A Tractor Beam Made Of Sound Waves,https://www.reddit.com/r/Futurology/comments/255yyn/a_tractor_beam_made_of_sound_waves/,blinkergoesleft,1399674778,,1,5
558,2014-5-10,2014,5,10,7,256013,"Einsteinium: A new way of funding science, technology and the future...",https://www.reddit.com/r/Futurology/comments/256013/einsteinium_a_new_way_of_funding_science/,brokenarrow8,1399675518,,0,3
559,2014-5-10,2014,5,10,8,2563qh,LPP Fusion is fundraising now. Let's make it happen.,https://www.reddit.com/r/Futurology/comments/2563qh/lpp_fusion_is_fundraising_now_lets_make_it_happen/,[deleted],1399678098,,1,2
560,2014-5-10,2014,5,10,8,2564f9,Growth of consumer product use (1920-1998).,https://www.reddit.com/r/Futurology/comments/2564f9/growth_of_consumer_product_use_19201998/,Rx16,1399678574,,6,5
561,2014-5-10,2014,5,10,8,2564pu,test ama please ignore,https://www.reddit.com/r/Futurology/comments/2564pu/test_ama_please_ignore/,[deleted],1399678779,,0,1
562,2014-5-10,2014,5,10,8,2564q7,A Breakthrough in Upper-Limb Prosthetics - DARPA,https://www.reddit.com/r/Futurology/comments/2564q7/a_breakthrough_in_upperlimb_prosthetics_darpa/,Haulik,1399678786,,8,19
563,2014-5-10,2014,5,10,8,2565vz,The Cepheid Galactic Internet - Tony Zee (SETITalks),https://www.reddit.com/r/Futurology/comments/2565vz/the_cepheid_galactic_internet_tony_zee_setitalks/,nmyunit,1399679620,,0,3
564,2014-5-10,2014,5,10,9,2566rf,(Synthetic lungs from pigs) Biotech Alliance to Humanize Pig Lungs for Transplant,https://www.reddit.com/r/Futurology/comments/2566rf/synthetic_lungs_from_pigs_biotech_alliance_to/,mind_bomber,1399680280,,2,7
565,2014-5-10,2014,5,10,9,2566zt,Emerging Technologies category on Wikipedia,https://www.reddit.com/r/Futurology/comments/2566zt/emerging_technologies_category_on_wikipedia/,quinonoid,1399680463,,5,21
566,2014-5-10,2014,5,10,10,256e3y,T bp Acrylic nh ch Hnh ti Ph Nhun,https://www.reddit.com/r/Futurology/comments/256e3y/t_bp_acrylic_nh_ch_hnh_ti_ph_nhun/,tubepxinhtv,1399686117,,0,0
567,2014-5-10,2014,5,10,11,256gkt,Old world,https://www.reddit.com/r/Futurology/comments/256gkt/old_world/,sgatie,1399687983,,0,1
568,2014-5-10,2014,5,10,11,256hy3,a test of the [serious] system,https://www.reddit.com/r/Futurology/comments/256hy3/a_test_of_the_serious_system/,[deleted],1399689085,,0,1
569,2014-5-10,2014,5,10,11,256i8d,this is another test of the automated [serious] system,https://www.reddit.com/r/Futurology/comments/256i8d/this_is_another_test_of_the_automated_serious/,[deleted],1399689318,you better work this time,0,1
570,2014-5-10,2014,5,10,11,256ihk,House Hearing on Protecting Electric Grid from Solar Flares,https://www.reddit.com/r/Futurology/comments/256ihk/house_hearing_on_protecting_electric_grid_from/,w0rldn3ws,1399689525,,5,19
571,2014-5-10,2014,5,10,12,256ljr,"this is a test of the [serious] system, please ignore",https://www.reddit.com/r/Futurology/comments/256ljr/this_is_a_test_of_the_serious_system_please_ignore/,[deleted],1399692033,,3,1
572,2014-5-10,2014,5,10,12,256m6d,"[Serious] It was the best of times, it was the worst of times, but any time is good to suck my dick",https://www.reddit.com/r/Futurology/comments/256m6d/serious_it_was_the_best_of_times_it_was_the_worst/,[deleted],1399692577,,0,0
573,2014-5-10,2014,5,10,12,256n13,"""The implementation of our Solar Roadways project on a grand scale would change the world as we know it in significant ways.""",https://www.reddit.com/r/Futurology/comments/256n13/the_implementation_of_our_solar_roadways_project/,positivespectrum,1399693314,,18,38
574,2014-5-10,2014,5,10,13,256ozu,AI Overdrive and We Are in the Way,https://www.reddit.com/r/Futurology/comments/256ozu/ai_overdrive_and_we_are_in_the_way/,Socrates_Sonatas,1399694885,,13,6
575,2014-5-10,2014,5,10,13,256ru1,Thieves beware: future ATMs will spray foam that helps track stolen cash,https://www.reddit.com/r/Futurology/comments/256ru1/thieves_beware_future_atms_will_spray_foam_that/,hariseldon2,1399697673,,0,0
576,2014-5-10,2014,5,10,15,256vfn,peas in a pod,https://www.reddit.com/r/Futurology/comments/256vfn/peas_in_a_pod/,[deleted],1399701701,,0,0
577,2014-5-10,2014,5,10,15,256xno,'Killer Robots' to be debated at the UN,https://www.reddit.com/r/Futurology/comments/256xno/killer_robots_to_be_debated_at_the_un/,[deleted],1399704308,,1,0
578,2014-5-10,2014,5,10,15,256y05,3DigiPrints Blog: 3D Printing and its Impacts on Manufacturing Industry,https://www.reddit.com/r/Futurology/comments/256y05/3digiprints_blog_3d_printing_and_its_impacts_on/,3DgPrints,1399704731,,0,1
579,2014-5-10,2014,5,10,16,256ywy,Hult Reviews - Why I Chose Hult?|Hult MBA Reviews by Anand Deshpande |Hult International Business School,https://www.reddit.com/r/Futurology/comments/256ywy/hult_reviews_why_i_chose_hulthult_mba_reviews_by/,hultreviews,1399705868,,0,1
580,2014-5-10,2014,5,10,16,256zgg,Hult MBA Review by Anand Deshpande,https://www.reddit.com/r/Futurology/comments/256zgg/hult_mba_review_by_anand_deshpande/,hultreviews,1399706635,,0,1
581,2014-5-10,2014,5,10,17,2571fq,COME INIZIARE AD USARE MICROSOFT EXCEL - Automaticando,https://www.reddit.com/r/Futurology/comments/2571fq/come_iniziare_ad_usare_microsoft_excel/,ggianti,1399709453,,0,1
582,2014-5-10,2014,5,10,18,2573nl,Solar Roadways wants $1 million to turn the US' roads into an energy farm (Make sure to watch the video also),https://www.reddit.com/r/Futurology/comments/2573nl/solar_roadways_wants_1_million_to_turn_the_us/,coojw,1399712794,,487,1600
583,2014-5-10,2014,5,10,21,257ctj,"I have an interest in Programming, Computers, Math, Biology and Physics. What should I do as a career?",https://www.reddit.com/r/Futurology/comments/257ctj/i_have_an_interest_in_programming_computers_math/,whypcisbetter,1399726357,"I really have no preference between these subjects and I would like to do them as a career or do something with all of them. What would be the best career path to take, what collage, jobs, projects do you know that can help me find some orientation and can earn money? ",17,1
584,2014-5-10,2014,5,10,22,257f9b,One of the many reasons why we need bees: Honey out-performs antibiotics,https://www.reddit.com/r/Futurology/comments/257f9b/one_of_the_many_reasons_why_we_need_bees_honey/,Mike_Husky,1399728935,,0,1
585,2014-5-10,2014,5,10,22,257fw9,(Take the computer interface off the screen and put it into your hands) James Patten: The best computer interface? Maybe ... your hands - TED,https://www.reddit.com/r/Futurology/comments/257fw9/take_the_computer_interface_off_the_screen_and/,mind_bomber,1399729579,,2,17
586,2014-5-10,2014,5,10,22,257gij,COME SCRIVERE POTENZE E FORMULE CHIMICHE IN WORD - Automaticando,https://www.reddit.com/r/Futurology/comments/257gij/come_scrivere_potenze_e_formule_chimiche_in_word/,ggianti,1399730185,,1,0
587,2014-5-10,2014,5,10,23,257ik3,The Roof of the White House,https://www.reddit.com/r/Futurology/comments/257ik3/the_roof_of_the_white_house/,petskup,1399732078,,0,1
588,2014-5-10,2014,5,10,23,257ioj,Inside the White House: Solar Panels,https://www.reddit.com/r/Futurology/comments/257ioj/inside_the_white_house_solar_panels/,petskup,1399732187,,1,1
