,date,year,month,day,hour,id,title,full_link,author,created,selftext,num_comments,score
707,2016-4-8,2016,4,8,5,4dsxd0,NASA Is Facing a Climate Change Countdown. Kennedy Space Center and other NASA facilities near coastlines are facing the prospect of continually rising waters.,https://www.reddit.com/r/Futurology/comments/4dsxd0/nasa_is_facing_a_climate_change_countdown_kennedy/,cryptoz,1460060165,,14,66
708,2016-4-8,2016,4,8,5,4dsxmt,Lets advance humanity. This sub is for geniuses with great arts or real scientific discoveries but due to mental illness they cant publish their works. This sub will provide tools to help publish your work. Did you know Emily Dickinsons works were discovered and published posthumously?,https://www.reddit.com/r/Futurology/comments/4dsxmt/lets_advance_humanity_this_sub_is_for_geniuses/,RedditsUniverse,1460060277,,1,1
709,2016-4-8,2016,4,8,5,4dsyft,"Global warming may be far worse than thought, cloud analysis suggests. Researchers find clouds contain more liquid  as opposed to ice  than was previously believed, threatening greater increase in temperatures",https://www.reddit.com/r/Futurology/comments/4dsyft/global_warming_may_be_far_worse_than_thought/,cryptoz,1460060557,,3,14
710,2016-4-8,2016,4,8,5,4dsyva,The World's First 3D Printed Drug Is Now Selling In the US,https://www.reddit.com/r/Futurology/comments/4dsyva/the_worlds_first_3d_printed_drug_is_now_selling/,RA2lover,1460060700,,0,1
711,2016-4-8,2016,4,8,5,4dszgg,eftali Nektarin ve Badem Klon Analar,https://www.reddit.com/r/Futurology/comments/4dszgg/eftali_nektarin_ve_badem_klon_analar/,caglarbilicii,1460060903,,0,1
712,2016-4-8,2016,4,8,5,4dt1ph,"Most computer simulations of climate change are underestimating by at least one degree Fahrenheit how warm the world will get this century, a new study suggests.",https://www.reddit.com/r/Futurology/comments/4dt1ph/most_computer_simulations_of_climate_change_are/,dustofoblivion123,1460061710,,32,39
713,2016-4-8,2016,4,8,5,4dt3qo,How the CIA could use Facebook to prevent terrorist bombings,https://www.reddit.com/r/Futurology/comments/4dt3qo/how_the_cia_could_use_facebook_to_prevent/,lovetotraveltheglobe,1460062490,,0,1
714,2016-4-8,2016,4,8,5,4dt479,"Tesla Model 3 reservations top 325,000",https://www.reddit.com/r/Futurology/comments/4dt479/tesla_model_3_reservations_top_325000/,Greg-2012,1460062670,,1,5
715,2016-4-8,2016,4,8,6,4dt5aw,HOSPITAL VISIT,https://www.reddit.com/r/Futurology/comments/4dt5aw/hospital_visit/,JOSHUAJAUSHUA,1460063056,[removed],2,1
716,2016-4-8,2016,4,8,6,4dtbr4,Eris: the modular blockchain application platform for developers,https://www.reddit.com/r/Futurology/comments/4dtbr4/eris_the_modular_blockchain_application_platform/,prestonjbyrne,1460065402,,1,1
717,2016-4-8,2016,4,8,6,4dtcfe,Why the next hot jobs in Silicon Valley are for poets.,https://www.reddit.com/r/Futurology/comments/4dtcfe/why_the_next_hot_jobs_in_silicon_valley_are_for/,BatmanDracula,1460065648,,0,3
718,2016-4-8,2016,4,8,7,4dterj,The Future of Finance is Automated,https://www.reddit.com/r/Futurology/comments/4dterj/the_future_of_finance_is_automated/,IntelligenceIsReal,1460066519,,0,7
719,2016-4-8,2016,4,8,7,4dtjou,Self-Driving Delivery Robots May (VERY) Soon Become A Real Thing,https://www.reddit.com/r/Futurology/comments/4dtjou/selfdriving_delivery_robots_may_very_soon_become/,jonhalo,1460068406,,2,12
720,2016-4-8,2016,4,8,7,4dtjqh,Microsoft Is Developing a New JARVIS-Like Artificial Intelligence System,https://www.reddit.com/r/Futurology/comments/4dtjqh/microsoft_is_developing_a_new_jarvislike/,jonhalo,1460068421,,6,5
721,2016-4-8,2016,4,8,7,4dtk0k,These Are the Skyscrapers of Tomorrow (INFOGRAPHIC),https://www.reddit.com/r/Futurology/comments/4dtk0k/these_are_the_skyscrapers_of_tomorrow_infographic/,jonhalo,1460068528,,12,41
722,2016-4-8,2016,4,8,7,4dtlwp,How AI could take over the World!,https://www.reddit.com/r/Futurology/comments/4dtlwp/how_ai_could_take_over_the_world/,huktheavenged,1460069238,,0,1
723,2016-4-8,2016,4,8,7,4dtn4m,Self-driving truck convoy completes its first major journey across Europe,https://www.reddit.com/r/Futurology/comments/4dtn4m/selfdriving_truck_convoy_completes_its_first/,humanexplorer,1460069730,,43,225
724,2016-4-8,2016,4,8,8,4dtobg,Researchers turn carbon dioxide into sustainable concrete,https://www.reddit.com/r/Futurology/comments/4dtobg/researchers_turn_carbon_dioxide_into_sustainable/,[deleted],1460070196,[deleted],1,1
725,2016-4-8,2016,4,8,8,4dtpln,UW team stores digital images in DNA -- and retrieves them perfectly,https://www.reddit.com/r/Futurology/comments/4dtpln/uw_team_stores_digital_images_in_dna_and/,[deleted],1460070682,[deleted],0,1
726,2016-4-8,2016,4,8,8,4dtuy3,VR Sex Robots May Be Coming Soon,https://www.reddit.com/r/Futurology/comments/4dtuy3/vr_sex_robots_may_be_coming_soon/,IntelligenceIsReal,1460072873,,2,0
727,2016-4-8,2016,4,8,8,4dtvau,"Fancy a sex robot? Even if you don't think so, it could turn you on",https://www.reddit.com/r/Futurology/comments/4dtvau/fancy_a_sex_robot_even_if_you_dont_think_so_it/,IntelligenceIsReal,1460073015,,0,1
728,2016-4-8,2016,4,8,8,4dtw8y,Tuition-free digital university launches MBA program,https://www.reddit.com/r/Futurology/comments/4dtw8y/tuitionfree_digital_university_launches_mba/,IntelligenceIsReal,1460073405,,19,119
729,2016-4-8,2016,4,8,9,4dtwu0,Derrick Jensen: When I Dream of a Planet in Recovery,https://www.reddit.com/r/Futurology/comments/4dtwu0/derrick_jensen_when_i_dream_of_a_planet_in/,norristh,1460073656,,1,2
730,2016-4-8,2016,4,8,9,4dtxdz,Video: Humans Could Engineer Themselves for Long-Term Space Travel,https://www.reddit.com/r/Futurology/comments/4dtxdz/video_humans_could_engineer_themselves_for/,BatmanDracula,1460073877,,2,14
731,2016-4-8,2016,4,8,9,4du35h,Look inside the future of Bentley with this holographic virtual assistant,https://www.reddit.com/r/Futurology/comments/4du35h/look_inside_the_future_of_bentley_with_this/,IntelligenceIsReal,1460076335,,0,4
732,2016-4-8,2016,4,8,9,4du48m,"13 graphs that show why we're screwed [July, 2013]",https://www.reddit.com/r/Futurology/comments/4du48m/13_graphs_that_show_why_were_screwed_july_2013/,[deleted],1460076813,[deleted],0,1
733,2016-4-8,2016,4,8,9,4du4du,"This is what overpopulation will do to us [July, 2013]",https://www.reddit.com/r/Futurology/comments/4du4du/this_is_what_overpopulation_will_do_to_us_july/,[deleted],1460076872,[deleted],1,1
734,2016-4-8,2016,4,8,9,4du4ka,Metal foam shreds armor-piercing bullets,https://www.reddit.com/r/Futurology/comments/4du4ka/metal_foam_shreds_armorpiercing_bullets/,pelathorn,1460076944,,0,25
735,2016-4-8,2016,4,8,10,4du5bm,"13 GRAPHS ON OVERPOPULATION, from Microsoft scientist Stephen Emmott's book, 10 Billion",https://www.reddit.com/r/Futurology/comments/4du5bm/13_graphs_on_overpopulation_from_microsoft/,[deleted],1460077284,[deleted],0,1
736,2016-4-8,2016,4,8,10,4du5m5,"13 GRAPHS ON OVERPOPULATION (from Microsoft scientist Stephen Emmott's book, 10 Billion) [July, 2013]",https://www.reddit.com/r/Futurology/comments/4du5m5/13_graphs_on_overpopulation_from_microsoft/,[deleted],1460077400,[deleted],3,2
737,2016-4-8,2016,4,8,10,4du7r2,Superhabitable Worlds,https://www.reddit.com/r/Futurology/comments/4du7r2/superhabitable_worlds/,cshin9,1460078327,,2,2
738,2016-4-8,2016,4,8,10,4du97i,Volvo plans tests of 100 driverless cars in China,https://www.reddit.com/r/Futurology/comments/4du97i/volvo_plans_tests_of_100_driverless_cars_in_china/,[deleted],1460078986,[deleted],0,1
739,2016-4-8,2016,4,8,11,4dufw5,Computer paints 'new Rembrandt' after old works analysis,https://www.reddit.com/r/Futurology/comments/4dufw5/computer_paints_new_rembrandt_after_old_works/,raymestalez,1460081937,,9,17
740,2016-4-8,2016,4,8,11,4duhwd,iBot,https://www.reddit.com/r/Futurology/comments/4duhwd/ibot/,nmelssx,1460082846,[removed],0,1
741,2016-4-8,2016,4,8,11,4dukg3,"Silicon Valley robot block party showcases the future of companion bots, warehouse assistants, and even robots that make custom sandwiches.",https://www.reddit.com/r/Futurology/comments/4dukg3/silicon_valley_robot_block_party_showcases_the/,RabidOctopus,1460084001,,1,21
742,2016-4-8,2016,4,8,12,4dupt4,Metal foam obliterates bullets  and that's just the beginning,https://www.reddit.com/r/Futurology/comments/4dupt4/metal_foam_obliterates_bullets_and_thats_just_the/,[deleted],1460086519,[deleted],0,0
743,2016-4-8,2016,4,8,12,4duqts,"The Panama Papers prove it: we can afford a universal basic income l ""If the super-rich actually paid what they owe in taxes, the US would have loads more money available for public services""",https://www.reddit.com/r/Futurology/comments/4duqts/the_panama_papers_prove_it_we_can_afford_a/,spacecyborg,1460086995,,149,309
744,2016-4-8,2016,4,8,12,4dur3i,"New Metal Foam effective at shielding X-rays, gamma rays and neutron radiation; also effective against bullets/micro-meteorites.",https://www.reddit.com/r/Futurology/comments/4dur3i/new_metal_foam_effective_at_shielding_xrays_gamma/,Nachtigall44,1460087116,,10,57
745,2016-4-8,2016,4,8,12,4dusbh,"Afraid of artificial intelligence? You probably won't be obsolete for a long time, if ever.",https://www.reddit.com/r/Futurology/comments/4dusbh/afraid_of_artificial_intelligence_you_probably/,NinjaDiscoJesus,1460087724,,2,1
746,2016-4-8,2016,4,8,13,4dut7g,Toyota's developing a 'guardian angel' to take the wheel,https://www.reddit.com/r/Futurology/comments/4dut7g/toyotas_developing_a_guardian_angel_to_take_the/,California254,1460088158,,6,21
747,2016-4-8,2016,4,8,13,4dutra,From remote monitoring to remote control. The future factory might look like this?,https://www.reddit.com/r/Futurology/comments/4dutra/from_remote_monitoring_to_remote_control_the/,kenmoriyasu,1460088419,,0,6
748,2016-4-8,2016,4,8,13,4duw1e,Video Review: Jaguar's XE S is a big cat that knows how to boogie,https://www.reddit.com/r/Futurology/comments/4duw1e/video_review_jaguars_xe_s_is_a_big_cat_that_knows/,Benjamin5366,1460089613,,1,1
749,2016-4-8,2016,4,8,14,4dv026,Implantable computer chip could spot seizures before they start,https://www.reddit.com/r/Futurology/comments/4dv026/implantable_computer_chip_could_spot_seizures/,TYRmusic,1460091841,,1,5
750,2016-4-8,2016,4,8,14,4dv24i,US military christens self-driving Sea Hunter warship,https://www.reddit.com/r/Futurology/comments/4dv24i/us_military_christens_selfdriving_sea_hunter/,bat_in_the_stacks,1460093047,,4,6
751,2016-4-8,2016,4,8,14,4dv4et,When Is the Singularity? Probably Not in Your Lifetime,https://www.reddit.com/r/Futurology/comments/4dv4et/when_is_the_singularity_probably_not_in_your/,[deleted],1460094401,[deleted],4,5
752,2016-4-8,2016,4,8,14,4dv5bn,US Navys solar drone flies from and lands on water,https://www.reddit.com/r/Futurology/comments/4dv5bn/us_navys_solar_drone_flies_from_and_lands_on_water/,Guy575,1460094944,,142,2350
753,2016-4-8,2016,4,8,15,4dv5uv,How technology will murder capitalism,https://www.reddit.com/r/Futurology/comments/4dv5uv/how_technology_will_murder_capitalism/,FutureAvenir,1460095273,,51,27
754,2016-4-8,2016,4,8,15,4dv7tx,"Scientists store digital images in DNA, and retrieves them perfectly",https://www.reddit.com/r/Futurology/comments/4dv7tx/scientists_store_digital_images_in_dna_and/,itsherbirthday,1460096549,,2,4
755,2016-4-8,2016,4,8,16,4dvf07,Biologists just built a piece of software that can program living cells like a computer,https://www.reddit.com/r/Futurology/comments/4dvf07/biologists_just_built_a_piece_of_software_that/,[deleted],1460101276,[deleted],9,125
756,2016-4-8,2016,4,8,16,4dvgjf,"If consciousness is an algorithm, then a robot can be conscious",https://www.reddit.com/r/Futurology/comments/4dvgjf/if_consciousness_is_an_algorithm_then_a_robot_can/,Vailhem,1460102399,,66,64
757,2016-4-8,2016,4,8,17,4dvh2c,How high? How fast? How much? Five questions about jetpacks,https://www.reddit.com/r/Futurology/comments/4dvh2c/how_high_how_fast_how_much_five_questions_about/,dirk_bruere,1460102791,,1,5
758,2016-4-8,2016,4,8,17,4dvh5b,Samsung starts mass producing industry's first 10-nanometer class DRAM,https://www.reddit.com/r/Futurology/comments/4dvh5b/samsung_starts_mass_producing_industrys_first/,dirk_bruere,1460102861,,22,37
759,2016-4-8,2016,4,8,17,4dvhmj,Are drones really dangerous to airplanes?,https://www.reddit.com/r/Futurology/comments/4dvhmj/are_drones_really_dangerous_to_airplanes/,dirk_bruere,1460103201,,4,6
760,2016-4-8,2016,4,8,17,4dvi4y,Could scientfic research be open source in the future?,https://www.reddit.com/r/Futurology/comments/4dvi4y/could_scientfic_research_be_open_source_in_the/,[deleted],1460103609,[deleted],0,1
761,2016-4-8,2016,4,8,17,4dvizp,Could scientific research be open source in the future?,https://www.reddit.com/r/Futurology/comments/4dvizp/could_scientific_research_be_open_source_in_the/,Metroplaza,1460104225,,1,11
762,2016-4-8,2016,4,8,17,4dvl2x,Apps can now diagnose respiratory diseases by coughing into your phone.,https://www.reddit.com/r/Futurology/comments/4dvl2x/apps_can_now_diagnose_respiratory_diseases_by/,Catbirdbrewer,1460105765,,0,1
763,2016-4-8,2016,4,8,17,4dvlac,Timber skyscrapers could transform London's future skyline,https://www.reddit.com/r/Futurology/comments/4dvlac/timber_skyscrapers_could_transform_londons_future/,HairySavage,1460105913,,18,20
764,2016-4-8,2016,4,8,18,4dvnva,From jetpacks to flying cars: The crazy future of transport,https://www.reddit.com/r/Futurology/comments/4dvnva/from_jetpacks_to_flying_cars_the_crazy_future_of/,ahmedshahreer,1460107807,,2,12
765,2016-4-8,2016,4,8,18,4dvpac,At 40 Apple needs to revive its start-up spirit,https://www.reddit.com/r/Futurology/comments/4dvpac/at_40_apple_needs_to_revive_its_startup_spirit/,Nandita65,1460108836,,1,1
766,2016-4-8,2016,4,8,19,4dvqmo,Transferring Your Brain To A New Body May Be Possible Within 30 Years. Immortality Beyond Computers,https://www.reddit.com/r/Futurology/comments/4dvqmo/transferring_your_brain_to_a_new_body_may_be/,TYRmusic,1460109708,,12,5
767,2016-4-8,2016,4,8,19,4dvquz,"Tony Starks ""Arch Reactor"". What do you think?",https://www.reddit.com/r/Futurology/comments/4dvquz/tony_starks_arch_reactor_what_do_you_think/,And_The-Teddy_Bach,1460109864,"Computers went from a huge machine that filled a room to a wrist watch sized gadget that changed the world. Now, I believe that energy is the next big thing. My question is: ""Will we manage to get from huge nuclear plants to little, compact devices that can power-up the house?"". Let me know what you think.",37,0
768,2016-4-8,2016,4,8,19,4dvs08,Drones: The future and the challenges,https://www.reddit.com/r/Futurology/comments/4dvs08/drones_the_future_and_the_challenges/,topgun2016,1460110648,,1,6
769,2016-4-8,2016,4,8,19,4dvsvz, 5       BEST 5 FUTURE INNOVATION TECH AVAILABLE NOW,https://www.reddit.com/r/Futurology/comments/4dvsvz/_5______/,houssin7,1460111283,,0,1
770,2016-4-8,2016,4,8,19,4dvtmw,FINALLY a marketplace to buy DRUGS LEGALLY???,https://www.reddit.com/r/Futurology/comments/4dvtmw/finally_a_marketplace_to_buy_drugs_legally/,Toffy123,1460111777,[removed],0,1
771,2016-4-8,2016,4,8,19,4dvtrb,Convoys of self-driving trucks cross Europe,https://www.reddit.com/r/Futurology/comments/4dvtrb/convoys_of_selfdriving_trucks_cross_europe/,RapidCreek,1460111867,,3,9
772,2016-4-8,2016,4,8,19,4dvupc,Fallout 4 wins best game at Bafta awards,https://www.reddit.com/r/Futurology/comments/4dvupc/fallout_4_wins_best_game_at_bafta_awards/,petskup,1460112504,,1,3
773,2016-4-8,2016,4,8,19,4dvuzx,FINALLY BUY DRUGS LEGALLY ON THIS MARKETPLACE??? 08/04/2016,https://www.reddit.com/r/Futurology/comments/4dvuzx/finally_buy_drugs_legally_on_this_marketplace/,Toffy123,1460112703,[removed],0,1
774,2016-4-8,2016,4,8,20,4dvxbz,Killer Robots on the Battlefield,https://www.reddit.com/r/Futurology/comments/4dvxbz/killer_robots_on_the_battlefield/,stormforce7916,1460114165,,1,9
775,2016-4-8,2016,4,8,20,4dvy5r,Exploring the future of healthcare,https://www.reddit.com/r/Futurology/comments/4dvy5r/exploring_the_future_of_healthcare/,stormforce7916,1460114690,,0,9
776,2016-4-8,2016,4,8,21,4dw1wl,Scientists invent robotic 'artist' that spray paints giant murals,https://www.reddit.com/r/Futurology/comments/4dw1wl/scientists_invent_robotic_artist_that_spray/,Arzu1982,1460116810,,4,31
777,2016-4-8,2016,4,8,21,4dw3or,U.S. military christens self-driving 'Sea Hunter' warship,https://www.reddit.com/r/Futurology/comments/4dw3or/us_military_christens_selfdriving_sea_hunter/,BakerAtNMSU,1460117694,,13,76
778,2016-4-8,2016,4,8,21,4dw3us,The Future of Work Is  Ordering Taco Bell Through Slack?,https://www.reddit.com/r/Futurology/comments/4dw3us/the_future_of_work_is_ordering_taco_bell_through/,Arzu1982,1460117777,,0,1
779,2016-4-8,2016,4,8,21,4dw4gn,American Cities Are Nowhere Near Ready for Self-Driving Cars,https://www.reddit.com/r/Futurology/comments/4dw4gn/american_cities_are_nowhere_near_ready_for/,Arzu1982,1460118094,,0,7
780,2016-4-8,2016,4,8,21,4dw4nl,"We are far behind on self-driving cars, says EIB boss",https://www.reddit.com/r/Futurology/comments/4dw4nl/we_are_far_behind_on_selfdriving_cars_says_eib/,Arzu1982,1460118187,,14,11
781,2016-4-8,2016,4,8,21,4dw55d,Robots are set to Seep into Every Aspect of our Lives,https://www.reddit.com/r/Futurology/comments/4dw55d/robots_are_set_to_seep_into_every_aspect_of_our/,Arzu1982,1460118425,,1,12
782,2016-4-8,2016,4,8,21,4dw85e,Curing Neuroendocrine Cancer-Research and Funding,https://www.reddit.com/r/Futurology/comments/4dw85e/curing_neuroendocrine_cancerresearch_and_funding/,pan2946,1460119771,,0,14
783,2016-4-8,2016,4,8,21,4dw8wf,Hi,https://www.reddit.com/r/Futurology/comments/4dw8wf/hi/,smai_7r,1460120103,,0,1
784,2016-4-8,2016,4,8,22,4dwaz1,This new pen digitises your notebooks as you write in them,https://www.reddit.com/r/Futurology/comments/4dwaz1/this_new_pen_digitises_your_notebooks_as_you/,[deleted],1460121027,[deleted],3,21
785,2016-4-8,2016,4,8,22,4dwb2v,Rooftop solar could provide almost 40 percent of US electricity,https://www.reddit.com/r/Futurology/comments/4dwb2v/rooftop_solar_could_provide_almost_40_percent_of/,Arzu1982,1460121071,,16,100
786,2016-4-8,2016,4,8,22,4dwcge,"Cable cord-cutting numbers soar in Canada thanks to Netflix, high prices, says report",https://www.reddit.com/r/Futurology/comments/4dwcge/cable_cordcutting_numbers_soar_in_canada_thanks/,[deleted],1460121662,[deleted],1,14
787,2016-4-8,2016,4,8,22,4dwfmz,3D-printed hydraulic robot 'can practically walk right out of the printer',https://www.reddit.com/r/Futurology/comments/4dwfmz/3dprinted_hydraulic_robot_can_practically_walk/,FrostyBook,1460123033,,1,22
788,2016-4-8,2016,4,8,22,4dwhgh,Alphabet owned Schaft reveals a new bi-pedal robot,https://www.reddit.com/r/Futurology/comments/4dwhgh/alphabet_owned_schaft_reveals_a_new_bipedal_robot/,Fyrefish,1460123790,,90,291
789,2016-4-8,2016,4,8,23,4dwlbp,"IBM's Power9 CPU Could Be Game Changer In Servers And Supercomputers With Help From Google, Nvidia",https://www.reddit.com/r/Futurology/comments/4dwlbp/ibms_power9_cpu_could_be_game_changer_in_servers/,johnmountain,1460125269,,3,49
790,2016-4-8,2016,4,8,23,4dwqqt,"This Week in Tech: Smart Contact Lenses with a Built in Camera, the FDA Approves the First 3D Printed Drug, and More",https://www.reddit.com/r/Futurology/comments/4dwqqt/this_week_in_tech_smart_contact_lenses_with_a/,[deleted],1460127370,[deleted],0,1
791,2016-4-9,2016,4,9,0,4dwsb3,"This Week in Tech: Robotic DNA Factories, The FDA Approves the First 3D Printed Drug, and More",https://www.reddit.com/r/Futurology/comments/4dwsb3/this_week_in_tech_robotic_dna_factories_the_fda/,Portis403,1460127908,,7,211
792,2016-4-9,2016,4,9,0,4dwul9,FBI Spy Planes Are Using Augmented Reality To Watch America,https://www.reddit.com/r/Futurology/comments/4dwul9/fbi_spy_planes_are_using_augmented_reality_to/,screaming_librarian,1460128724,,1,1
793,2016-4-9,2016,4,9,0,4dwxb6,Google owned Schaft unveils new bipedal robot,https://www.reddit.com/r/Futurology/comments/4dwxb6/google_owned_schaft_unveils_new_bipedal_robot/,numlok,1460129709,,22,126
794,2016-4-9,2016,4,9,0,4dwzjf,We finally have VR. But why aren't virtual worlds a big deal?,https://www.reddit.com/r/Futurology/comments/4dwzjf/we_finally_have_vr_but_why_arent_virtual_worlds_a/,Speckart,1460130565,"For our digital needs, we already have the internet, apps and videogames. Is there a place for a multi-purpose single-instance virtual world?


Why aren't we creating/expecting one?",17,0
795,2016-4-9,2016,4,9,1,4dx2qz,Google owned Schaft unveils new bipedal robot,https://www.reddit.com/r/Futurology/comments/4dx2qz/google_owned_schaft_unveils_new_bipedal_robot/,izumi3682,1460131736,,2,9
796,2016-4-9,2016,4,9,1,4dx2vh,Firebird 1 at the High in Atlanta 2014,https://www.reddit.com/r/Futurology/comments/4dx2vh/firebird_1_at_the_high_in_atlanta_2014/,choosingtangent,1460131785,,1,7
797,2016-4-9,2016,4,9,1,4dx4j7,Ferrari and Lambo concepts at the High in Atlanta 2014,https://www.reddit.com/r/Futurology/comments/4dx4j7/ferrari_and_lambo_concepts_at_the_high_in_atlanta/,choosingtangent,1460132388,,2,3
798,2016-4-9,2016,4,9,1,4dx8ou,Space Elevator  Science Fiction or the Future of Mankind?,https://www.reddit.com/r/Futurology/comments/4dx8ou/space_elevator_science_fiction_or_the_future_of/,itsherbirthday,1460133906,,42,127
799,2016-4-9,2016,4,9,1,4dx9hm,Rule in the Future : Driving is illegal no matter what age,https://www.reddit.com/r/Futurology/comments/4dx9hm/rule_in_the_future_driving_is_illegal_no_matter/,[deleted],1460134198,[deleted],5,1
800,2016-4-9,2016,4,9,1,4dx9pd,Zen-book Release to ASUS company-2016,https://www.reddit.com/r/Futurology/comments/4dx9pd/zenbook_release_to_asus_company2016/,mani885,1460134280,,1,1
801,2016-4-9,2016,4,9,2,4dxb7g,Rule of Future : Driving is illegal no matter what age,https://www.reddit.com/r/Futurology/comments/4dxb7g/rule_of_future_driving_is_illegal_no_matter_what/,aktiwari158,1460134821,,22,0
802,2016-4-9,2016,4,9,2,4dxd6a,Industrial gas giant Air Liquide to build 12 hydrogen fuel stations in northeast U.S.,https://www.reddit.com/r/Futurology/comments/4dxd6a/industrial_gas_giant_air_liquide_to_build_12/,overstretched_slinky,1460135529,,8,30
803,2016-4-9,2016,4,9,2,4dxegs,Watch this next-gen combat suit take a brutal beating,https://www.reddit.com/r/Futurology/comments/4dxegs/watch_this_nextgen_combat_suit_take_a_brutal/,AmazonGuy16,1460135952,,13,45
804,2016-4-9,2016,4,9,3,4dxnnf,   mlm orilider com,https://www.reddit.com/r/Futurology/comments/4dxnnf/___mlm_orilider_com/,MARUSIZKA,1460139296,,0,1
805,2016-4-9,2016,4,9,3,4dxsk1,Physicists discover flaws in superconductor theory,https://www.reddit.com/r/Futurology/comments/4dxsk1/physicists_discover_flaws_in_superconductor_theory/,BlaineMiller,1460141087,,9,60
806,2016-4-9,2016,4,9,4,4dxvgi,Artificial intelligence: a super power on the rise in the cloud,https://www.reddit.com/r/Futurology/comments/4dxvgi/artificial_intelligence_a_super_power_on_the_rise/,izumi3682,1460142171,,0,4
807,2016-4-9,2016,4,9,4,4dxw9z,Self-Taught Robot Is Ready to Seize Another Warehouse Job,https://www.reddit.com/r/Futurology/comments/4dxw9z/selftaught_robot_is_ready_to_seize_another/,Arzu1982,1460142498,,4,52
808,2016-4-9,2016,4,9,4,4dxyhs,"Sweet drug clears cholesterol, reverses heart diseaseand was found by parents",https://www.reddit.com/r/Futurology/comments/4dxyhs/sweet_drug_clears_cholesterol_reverses_heart/,hexydes,1460143290,,79,79
809,2016-4-9,2016,4,9,4,4dxzgi,"How does Naomi Klein's ""This Changes Everything Relate to Karl Polyani's ""The Great Transformation"" ?",https://www.reddit.com/r/Futurology/comments/4dxzgi/how_does_naomi_kleins_this_changes_everything/,rimz101,1460143643,"So im working on a paper and would love to hear your thoughts.

1) Naomi Klein's book alternates between a critique of capitalism as a system and the specific form of unfettered, neoliberal capitalism that emerged in the 1990's . Which of these two assessments is more compatible with Polayni's argument in the Great Transformation and why
",1,6
810,2016-4-9,2016,4,9,4,4dxzj6,Psychic and Spiritual Counselor,https://www.reddit.com/r/Futurology/comments/4dxzj6/psychic_and_spiritual_counselor/,judyhevenly,1460143670,,1,0
811,2016-4-9,2016,4,9,4,4dy0vf,Giving people free money could be the only solution when robots finally take our jobs,https://www.reddit.com/r/Futurology/comments/4dy0vf/giving_people_free_money_could_be_the_only/,Arzu1982,1460144179,,209,169
812,2016-4-9,2016,4,9,4,4dy17z,World Predictions 2016,https://www.reddit.com/r/Futurology/comments/4dy17z/world_predictions_2016/,judyhevenly,1460144317,,4,0
813,2016-4-9,2016,4,9,4,4dy1ax,Chinese scientists use CRISPR/Cas9 to introduce the CCR5delta32 mutation for HIV resistance into human (tripronuclear) embryos.,https://www.reddit.com/r/Futurology/comments/4dy1ax/chinese_scientists_use_crisprcas9_to_introduce/,e_swartz,1460144348,,11,65
814,2016-4-9,2016,4,9,4,4dy2yx,An AI assistant that schedules meetings for you,https://www.reddit.com/r/Futurology/comments/4dy2yx/an_ai_assistant_that_schedules_meetings_for_you/,[deleted],1460144982,[deleted],0,5
815,2016-4-9,2016,4,9,5,4dyaof,What is the future of American capitalism when much of the capital today is state created by or guaranteed by the STATE?,https://www.reddit.com/r/Futurology/comments/4dyaof/what_is_the_future_of_american_capitalism_when/,[deleted],1460147917,[removed],0,1
816,2016-4-9,2016,4,9,5,4dybbk,A space elevator would change the world,https://www.reddit.com/r/Futurology/comments/4dybbk/a_space_elevator_would_change_the_world/,_Wyse_,1460148178,,3,12
