,date,year,month,day,hour,id,title,full_link,author,created,selftext,num_comments,score
0,2016-4-1,2016,4,1,9,4csvh4,O que  Arduino ?- Lium Robtica e Inteligencia Artificial,https://www.reddit.com/r/Futurology/comments/4csvh4/o_que__arduino_lium_robtica_e_inteligencia/,fago01,1459469430,,0,1
1,2016-4-1,2016,4,1,9,4cswbc,(Question) why have we both seen a big push to grow crops in factory settings where environmently factors do not apply?,https://www.reddit.com/r/Futurology/comments/4cswbc/question_why_have_we_both_seen_a_big_push_to_grow/,[deleted],1459469769,[deleted],0,1
2,2016-4-1,2016,4,1,9,4csztr,Chinese Artificial Intelligence Team Announces Plans To Challenge Googles AlphaGo,https://www.reddit.com/r/Futurology/comments/4csztr/chinese_artificial_intelligence_team_announces/,dustofoblivion123,1459471141,,27,178
3,2016-4-1,2016,4,1,9,4ct0p5,Why hasn't factory farming blown up?,https://www.reddit.com/r/Futurology/comments/4ct0p5/why_hasnt_factory_farming_blown_up/,Door2doorcalgary,1459471476,[removed],1,1
4,2016-4-1,2016,4,1,9,4ct0ur,"Pentagon Coming to Terms With Technological Realities - We are absolutely confident that deep-learning machines will let us get after ISIS, said Deputy Defense Secretary Robert Work.",https://www.reddit.com/r/Futurology/comments/4ct0ur/pentagon_coming_to_terms_with_technological/,Buck-Nasty,1459471537,,9,33
5,2016-4-1,2016,4,1,10,4ct8v3,Black-hole computing: Might natures bottomless pits actually be ultra-efficient quantum computers?,https://www.reddit.com/r/Futurology/comments/4ct8v3/blackhole_computing_might_natures_bottomless_pits/,mjk1093,1459474861,,13,38
6,2016-4-1,2016,4,1,10,4ctb9y,A future without jobs two views of the changing work force,https://www.reddit.com/r/Futurology/comments/4ctb9y/a_future_without_jobs_two_views_of_the_changing/,[deleted],1459475859,[deleted],1,8
7,2016-4-1,2016,4,1,11,4ctcyz,[In-Depth] fUCI concept bike flips the bird at racing rules.,https://www.reddit.com/r/Futurology/comments/4ctcyz/indepth_fuci_concept_bike_flips_the_bird_at/,[deleted],1459476525,[deleted],1,1
8,2016-4-1,2016,4,1,11,4cteic,"EFF YOU SEE EYE: fUCI Concept Bike for People who want to ""live"" outside of the box.",https://www.reddit.com/r/Futurology/comments/4cteic/eff_you_see_eye_fuci_concept_bike_for_people_who/,[deleted],1459477133,[deleted],2,0
9,2016-4-1,2016,4,1,11,4ctipc,Is AlphaGo Really Such a Big Deal?,https://www.reddit.com/r/Futurology/comments/4ctipc/is_alphago_really_such_a_big_deal/,PatientModestHumble,1459478771,,4,10
10,2016-4-1,2016,4,1,11,4ctjjq,Welcome to the Virtual Age,https://www.reddit.com/r/Futurology/comments/4ctjjq/welcome_to_the_virtual_age/,[deleted],1459479107,[deleted],0,1
11,2016-4-1,2016,4,1,11,4ctk8d,Renewable Technology: 4 Futuristic Gadgets for Sustainable Living,https://www.reddit.com/r/Futurology/comments/4ctk8d/renewable_technology_4_futuristic_gadgets_for/,Humanist-,1459479361,,1,4
12,2016-4-1,2016,4,1,12,4ctkvu,Scientists create TRANSPARENT wood and could replace glass in windows,https://www.reddit.com/r/Futurology/comments/4ctkvu/scientists_create_transparent_wood_and_could/,2radioactive4u,1459479646,,4,0
13,2016-4-1,2016,4,1,12,4ctqtb,Visualizing The Automation Potential Of U.S. Jobs,https://www.reddit.com/r/Futurology/comments/4ctqtb/visualizing_the_automation_potential_of_us_jobs/,IntelligenceIsReal,1459482195,,2,12
14,2016-4-1,2016,4,1,13,4cttez,Tesla Model 3 Release- Electric car for 35k with autopilot!,https://www.reddit.com/r/Futurology/comments/4cttez/tesla_model_3_release_electric_car_for_35k_with/,trexdinosaur,1459483321,,174,390
15,2016-4-1,2016,4,1,13,4cttor,Tesla Model 3 unveiled.,https://www.reddit.com/r/Futurology/comments/4cttor/tesla_model_3_unveiled/,aac1111,1459483428,,51,309
16,2016-4-1,2016,4,1,13,4cttqx,"Tesla received 115,000 Model 3 reservations with deposits within just 24hrs  worth over $4 billion in backlog",https://www.reddit.com/r/Futurology/comments/4cttqx/tesla_received_115000_model_3_reservations_with/,[deleted],1459483452,[deleted],33,213
17,2016-4-1,2016,4,1,13,4cttta,Tesla Model 3 | First Look,https://www.reddit.com/r/Futurology/comments/4cttta/tesla_model_3_first_look/,kirkisartist,1459483477,,4,14
18,2016-4-1,2016,4,1,13,4ctuci,Tesla Model 3 unveiled -- and it's gorgeous!,https://www.reddit.com/r/Futurology/comments/4ctuci/tesla_model_3_unveiled_and_its_gorgeous/,deathfaith,1459483687,,2,1
19,2016-4-1,2016,4,1,13,4ctvcr,BMW Now Connecting Owners With Azure Cloud For BMW Connected App,https://www.reddit.com/r/Futurology/comments/4ctvcr/bmw_now_connecting_owners_with_azure_cloud_for/,Daniel4780,1459484127,,0,1
20,2016-4-1,2016,4,1,13,4ctvhe,The Fifth Estate | Transparent wood: the future of windows and solar panels?,https://www.reddit.com/r/Futurology/comments/4ctvhe/the_fifth_estate_transparent_wood_the_future_of/,[deleted],1459484189,[deleted],1,0
21,2016-4-1,2016,4,1,13,4ctx7q,Elon Musk Unveils New Tesla Model 3,https://www.reddit.com/r/Futurology/comments/4ctx7q/elon_musk_unveils_new_tesla_model_3/,ErikIsYoDaddy,1459484948,,1,0
22,2016-4-1,2016,4,1,13,4ctxj9,"Wood windows? Transparent wood material used for buildings, solar cells.",https://www.reddit.com/r/Futurology/comments/4ctxj9/wood_windows_transparent_wood_material_used_for/,candiedbug,1459485080,,0,3
23,2016-4-1,2016,4,1,13,4ctzpa,"Edible cutlery, the eco-friendly future?",https://www.reddit.com/r/Futurology/comments/4ctzpa/edible_cutlery_the_ecofriendly_future/,ckdarby,1459486094,,1,1
24,2016-4-1,2016,4,1,14,4cu18m,"Tesla Unveils Highly-Anticipated Model 3: Its Most Important Electric Car Yet, Tesla shows off its $35,000 sedan for the masses.",https://www.reddit.com/r/Futurology/comments/4cu18m/tesla_unveils_highlyanticipated_model_3_its_most/,Orangutan,1459486828,,0,1
25,2016-4-1,2016,4,1,14,4cu25j,Tesla Model 3: This Is It,https://www.reddit.com/r/Futurology/comments/4cu25j/tesla_model_3_this_is_it/,neil454,1459487254,,1,1
26,2016-4-1,2016,4,1,14,4cu2i6,Is Google a monopoly?,https://www.reddit.com/r/Futurology/comments/4cu2i6/is_google_a_monopoly/,har_r,1459487414,[removed],10,1
27,2016-4-1,2016,4,1,14,4cu3fy,Tesla Motors offers sneak peak of the new Model 3,https://www.reddit.com/r/Futurology/comments/4cu3fy/tesla_motors_offers_sneak_peak_of_the_new_model_3/,[deleted],1459487879,[deleted],0,0
28,2016-4-1,2016,4,1,14,4cu3oa,Intelliber - Open Invention Network,https://www.reddit.com/r/Futurology/comments/4cu3oa/intelliber_open_invention_network/,lanielaurente88,1459487987,,0,1
29,2016-4-1,2016,4,1,14,4cu3pi,Quick question about UBI and society.,https://www.reddit.com/r/Futurology/comments/4cu3pi/quick_question_about_ubi_and_society/,avidya1997,1459488003,"UBI is regarded quite highly in this community. With the advancements in AI, soon we will start run into the issue of mass unemployment. This is where UBI comes in (or something else, I can't predict the future). I think this community is pretty driven, but I feel like a LOT of people will just do nothing or sink into VR, etc, etc. Now that they got their basic needs taken care of, won't it just become a parasitic relationship inside this new society? Well I guess they have that right... I don't know. I need your perspective!

edit: Is there any other theories or models being debated upon, that have high potential of acceptance and sustainability?",7,3
30,2016-4-1,2016,4,1,14,4cu3yq,Tesla's Model E has been unveiled and will ship in 2017,https://www.reddit.com/r/Futurology/comments/4cu3yq/teslas_model_e_has_been_unveiled_and_will_ship_in/,[deleted],1459488135,[deleted],0,1
31,2016-4-1,2016,4,1,14,4cu42x,Tesla's Model 3 has been unveiled and will ship in 2017,https://www.reddit.com/r/Futurology/comments/4cu42x/teslas_model_3_has_been_unveiled_and_will_ship_in/,[deleted],1459488200,[deleted],3,1
32,2016-4-1,2016,4,1,14,4cu5kg,Dyson launches Pure Cool Link air purifier to clean up household air,https://www.reddit.com/r/Futurology/comments/4cu5kg/dyson_launches_pure_cool_link_air_purifier_to/,Guy575,1459488927,,4,2
33,2016-4-1,2016,4,1,14,4cu5wl,Mathematicians mapped out every Game of Thrones relationship to find the main character,https://www.reddit.com/r/Futurology/comments/4cu5wl/mathematicians_mapped_out_every_game_of_thrones/,cultoftech,1459489078,,0,1
34,2016-4-1,2016,4,1,14,4cu7g2,An AI assistant that schedules meetings for you,https://www.reddit.com/r/Futurology/comments/4cu7g2/an_ai_assistant_that_schedules_meetings_for_you/,lermanj,1459489845,,0,1
35,2016-4-1,2016,4,1,15,4cu8wd,The European Human Brain Project Releases Progress Update,https://www.reddit.com/r/Futurology/comments/4cu8wd/the_european_human_brain_project_releases/,33rdsquare,1459490610,,0,1
36,2016-4-1,2016,4,1,15,4cubc2,Amazing projects of Google you haven't heard about,https://www.reddit.com/r/Futurology/comments/4cubc2/amazing_projects_of_google_you_havent_heard_about/,[deleted],1459491928,[deleted],4,10
37,2016-4-1,2016,4,1,15,4cubct,Does your business need digital marketing strategy?,https://www.reddit.com/r/Futurology/comments/4cubct/does_your_business_need_digital_marketing_strategy/,saleszoomer,1459491938,,0,1
38,2016-4-1,2016,4,1,15,4cuc7n,RISE (2016) - Computer says no to human oppression!,https://www.reddit.com/r/Futurology/comments/4cuc7n/rise_2016_computer_says_no_to_human_oppression/,MrTorture,1459492430,,34,84
39,2016-4-1,2016,4,1,15,4cuebk,Home Laptop Repair Service Center,https://www.reddit.com/r/Futurology/comments/4cuebk/home_laptop_repair_service_center/,lappysoft,1459493595,,1,1
40,2016-4-1,2016,4,1,15,4cuel9,A programming language for living cells,https://www.reddit.com/r/Futurology/comments/4cuel9/a_programming_language_for_living_cells/,dirk_bruere,1459493739,,8,39
41,2016-4-1,2016,4,1,16,4cufss,Quantum computing breakthrough: Scientists build the first-ever qubit Fredkin gate,https://www.reddit.com/r/Futurology/comments/4cufss/quantum_computing_breakthrough_scientists_build/,miraoister,1459494406,,0,15
42,2016-4-1,2016,4,1,16,4cul95,Fridge-sized machine makes prescription drugs 'on demand',https://www.reddit.com/r/Futurology/comments/4cul95/fridgesized_machine_makes_prescription_drugs_on/,dirk_bruere,1459497513,,78,619
43,2016-4-1,2016,4,1,17,4culrv,The infinite mpg car review,https://www.reddit.com/r/Futurology/comments/4culrv/the_infinite_mpg_car_review/,[deleted],1459497861,[deleted],2,0
44,2016-4-1,2016,4,1,17,4cum7o,Flagship brain project releases neuro-computing tools,https://www.reddit.com/r/Futurology/comments/4cum7o/flagship_brain_project_releases_neurocomputing/,vernes1978,1459498134,,1,22
45,2016-4-1,2016,4,1,17,4cupvx,How to accept the reality of Gravitational waves?,https://www.reddit.com/r/Futurology/comments/4cupvx/how_to_accept_the_reality_of_gravitational_waves/,hypermental,1459500498,,0,1
46,2016-4-1,2016,4,1,18,4cuthe,"""At some point, every single person leaves behind a mini-dead civilization  from inactive MySpace band pages to atrophied OkCupid profiles""",https://www.reddit.com/r/Futurology/comments/4cuthe/at_some_point_every_single_person_leaves_behind_a/,Laserfalcon,1459502855,,0,14
47,2016-4-1,2016,4,1,18,4cuutv,Can military officers be automated,https://www.reddit.com/r/Futurology/comments/4cuutv/can_military_officers_be_automated/,jain16276,1459503739,,0,4
48,2016-4-1,2016,4,1,18,4cuuv8,"Developing the Art of Group Buy Medical Tourism: 100 People Traveling to Pay $10-20,000 for a Rejuvenation Therapy",https://www.reddit.com/r/Futurology/comments/4cuuv8/developing_the_art_of_group_buy_medical_tourism/,reasonattlm,1459503760,,1,2
49,2016-4-1,2016,4,1,18,4cuv71,Should religion be abolished,https://www.reddit.com/r/Futurology/comments/4cuv71/should_religion_be_abolished/,Dante-dhampire,1459503978,[removed],15,0
50,2016-4-1,2016,4,1,19,4cuyyf,"Cyborgs are not just science fiction, they are becoming reality",https://www.reddit.com/r/Futurology/comments/4cuyyf/cyborgs_are_not_just_science_fiction_they_are/,WhizzMirray,1459506211,,12,16
51,2016-4-1,2016,4,1,19,4cuzk5,"Heard about the EmDrive? It's an Inertial Propulsion, that barely works. Here's another one - a CONE COIL",https://www.reddit.com/r/Futurology/comments/4cuzk5/heard_about_the_emdrive_its_an_inertial/,aspagnito,1459506571,[removed],0,1
52,2016-4-1,2016,4,1,19,4cv05l,An astounding nanoscale magnified view of bacterial 'motors',https://www.reddit.com/r/Futurology/comments/4cv05l/an_astounding_nanoscale_magnified_view_of/,Ham686,1459506924,,25,174
53,2016-4-1,2016,4,1,19,4cv083,Nanoparticle 'cluster bombs' destroy cancer cells,https://www.reddit.com/r/Futurology/comments/4cv083/nanoparticle_cluster_bombs_destroy_cancer_cells/,Ham686,1459506964,,2,33
54,2016-4-1,2016,4,1,19,4cv1ed,Estonia has launched government-as-service product for other countries. Cool stuff!,https://www.reddit.com/r/Futurology/comments/4cv1ed/estonia_has_launched_governmentasservice_product/,[deleted],1459507640,[deleted],16,35
55,2016-4-1,2016,4,1,19,4cv24d,Museums and Art Galleries Of The Future,https://www.reddit.com/r/Futurology/comments/4cv24d/museums_and_art_galleries_of_the_future/,Bowarcher,1459508068,,2,6
56,2016-4-1,2016,4,1,20,4cv4py,Tesla Model 3 pre-orders stack up as Elon Musk unveils lower-priced car,https://www.reddit.com/r/Futurology/comments/4cv4py/tesla_model_3_preorders_stack_up_as_elon_musk/,Colorado688,1459509565,,0,11
57,2016-4-1,2016,4,1,20,4cv51e,iPS cell research is entering second stage,https://www.reddit.com/r/Futurology/comments/4cv51e/ips_cell_research_is_entering_second_stage/,ellerdrop,1459509741,,0,5
58,2016-4-1,2016,4,1,20,4cv7iy,Light Traffic / MIT Senseable City Lab,https://www.reddit.com/r/Futurology/comments/4cv7iy/light_traffic_mit_senseable_city_lab/,mofossser,1459511070,,2,11
59,2016-4-1,2016,4,1,20,4cv7vk,How Elon Musk's hyperloop dream is moving from sci-fi fantasy to reality,https://www.reddit.com/r/Futurology/comments/4cv7vk/how_elon_musks_hyperloop_dream_is_moving_from/,[deleted],1459511240,[deleted],0,1
60,2016-4-1,2016,4,1,21,4cvbog,Your AI cheat sheet,https://www.reddit.com/r/Futurology/comments/4cvbog/your_ai_cheat_sheet/,stormforce7916,1459513036,,2,1
61,2016-4-1,2016,4,1,21,4cvd5y,Why Cryonics Makes Sense,https://www.reddit.com/r/Futurology/comments/4cvd5y/why_cryonics_makes_sense/,[deleted],1459513685,,5,11
62,2016-4-1,2016,4,1,21,4cvdx6,Deep Learning Experts Predictions for the Next 5 Years &amp; Impact on Healthcare,https://www.reddit.com/r/Futurology/comments/4cvdx6/deep_learning_experts_predictions_for_the_next_5/,reworksophie,1459513976,,0,1
63,2016-4-1,2016,4,1,21,4cveuz,Google Has a Room Full of Robot Arms Learning Hand-Eye Coordination: The machine learning experiment seeks to teach bots how to interact with their environment.,https://www.reddit.com/r/Futurology/comments/4cveuz/google_has_a_room_full_of_robot_arms_learning/,JackassWhisperer,1459514381,,27,310
64,2016-4-1,2016,4,1,21,4cvfim,EU US Privacy Shield vs. GDPR Infographic from TRUSTe,https://www.reddit.com/r/Futurology/comments/4cvfim/eu_us_privacy_shield_vs_gdpr_infographic_from/,JackDawson838,1459514649,,0,1
65,2016-4-1,2016,4,1,22,4cvi4o,"This Week in Tech: 3D Printed Bones for Cancer Patients, Insect-Computer Hybrids, and So Much More",https://www.reddit.com/r/Futurology/comments/4cvi4o/this_week_in_tech_3d_printed_bones_for_cancer/,[deleted],1459515683,[deleted],5,22
66,2016-4-1,2016,4,1,22,4cvjxc,Successfully Engineering Water-loving Nanoparticle Diodes,https://www.reddit.com/r/Futurology/comments/4cvjxc/successfully_engineering_waterloving_nanoparticle/,[deleted],1459516397,[deleted],1,1
67,2016-4-1,2016,4,1,22,4cvkf4,Man builds 'Scarlett Johansson' robot from scratch to 'fulfil childhood dream' - and it's scarily lifelike,https://www.reddit.com/r/Futurology/comments/4cvkf4/man_builds_scarlett_johansson_robot_from_scratch/,Arzu1982,1459516594,,1318,3710
68,2016-4-1,2016,4,1,22,4cvkp3,David Brin: building future societies with transparency and freedom,https://www.reddit.com/r/Futurology/comments/4cvkp3/david_brin_building_future_societies_with/,futurethinkers,1459516703,,8,8
69,2016-4-1,2016,4,1,22,4cvoeu,Proposal: Use lasers to hide Earth from aliens,https://www.reddit.com/r/Futurology/comments/4cvoeu/proposal_use_lasers_to_hide_earth_from_aliens/,miraoister,1459518112,,6,3
70,2016-4-1,2016,4,1,23,4cvxj4,Quantifying Ourselves to Feed the Algorithm,https://www.reddit.com/r/Futurology/comments/4cvxj4/quantifying_ourselves_to_feed_the_algorithm/,Mynameis__--__,1459521396,,0,2
71,2016-4-1,2016,4,1,23,4cvzks,The Future of Youtube,https://www.reddit.com/r/Futurology/comments/4cvzks/the_future_of_youtube/,[deleted],1459522139,[deleted],1,0
72,2016-4-1,2016,4,1,23,4cvztw,Is this new free app the future of animation?,https://www.reddit.com/r/Futurology/comments/4cvztw/is_this_new_free_app_the_future_of_animation/,BabyWheelBro,1459522231,,0,1
73,2016-4-1,2016,4,1,23,4cvzvb,A Basic Income Is Smarter Than a Minimum Wage,https://www.reddit.com/r/Futurology/comments/4cvzvb/a_basic_income_is_smarter_than_a_minimum_wage/,[deleted],1459522242,[deleted],0,0
74,2016-4-1,2016,4,1,23,4cw1ev,Is Artificial Intelligence really dangerous?,https://www.reddit.com/r/Futurology/comments/4cw1ev/is_artificial_intelligence_really_dangerous/,robinpeterson90,1459522752,,119,30
75,2016-4-2,2016,4,2,0,4cw31f,"Designers Have Invented A New Way to Live On After ""Death""",https://www.reddit.com/r/Futurology/comments/4cw31f/designers_have_invented_a_new_way_to_live_on/,xxfalcon69,1459523296,,0,0
76,2016-4-2,2016,4,2,0,4cw32l,Rolls-Royce future shore control centre,https://www.reddit.com/r/Futurology/comments/4cw32l/rollsroyce_future_shore_control_centre/,eberkut,1459523307,,4,8
77,2016-4-2,2016,4,2,0,4cw3q9,Response from British Islamic school accused of promoting extremist views,https://www.reddit.com/r/Futurology/comments/4cw3q9/response_from_british_islamic_school_accused_of/,[deleted],1459523514,[deleted],0,1
78,2016-4-2,2016,4,2,0,4cw63x,AI speach advancement through digital relationship building and... sex,https://www.reddit.com/r/Futurology/comments/4cw63x/ai_speach_advancement_through_digital/,amidigital,1459524303,,1,1
79,2016-4-2,2016,4,2,0,4cw6r5,Facebook plans to ship a mind-blowing number of Oculus Rift units in the next two years,https://www.reddit.com/r/Futurology/comments/4cw6r5/facebook_plans_to_ship_a_mindblowing_number_of/,izumi3682,1459524511,,5,8
80,2016-4-2,2016,4,2,0,4cw8oi,Hi r/Futurology! What are your thoughts on Warbots?,https://www.reddit.com/r/Futurology/comments/4cw8oi/hi_rfuturology_what_are_your_thoughts_on_warbots/,cocompadres,1459525138,"Hi guys, waiting for a meeting to start and I just found this sub. I thought I'd share my thoughts on a conversation starter I like to play around with that I call ""War Robots"". Yeah... I'm not exactly big hit at parties... Anyway, the idea goes like this, the robot revolution is coming. In just a short while we will see most menial tasks replaced by robots that do this work cheaper and more consistently. The kind of robots that will move into replace humans will not look like the ones in movies like iRobot and Blade Runner, their task will dictate their form like Roombas. To that end they will be good at whatever task(s) they are designed for and not much else. Like everything else war will also become more automated, with healthy government contracts getting awarded to private companies to create purpose built machines designed to destroy facilities, resources, and people. These devices will probably take familiar forms, like a jet fighter that is run by a computer, and not a person, or a hand grenade with spider legs, or a bullet. 

Ideally these robots will all work together on one platform, where each cog in the robot military wheel is cognizant of the others. They will be automated devices, and have awareness of each others location, capabilities, and directives. In human terms, they will be dumb as rocks, humans will still be the ones who deploy them and assign their directives. The manner of their stupidity will be an asset not a liability however, they will not hesitate to kill, and they will follow their directives blindly. 

In addition to their absolute devotion to the objective, they will have super human abilities, which will be multiplied by the abilities of every other robot on the battlefield. Fighter Jets will be able to perform at the edge of their capabilities without worry of it pilot passing out, bullets will transmit data about the battlefield on their way to their target, and inform the weapons platform they were fired from their location and if they hit something hard, cold and dry, or soft wet and warm.  Kamikaze grenades will serve two purposes as they run on four legs towards bright spots they see on their 360 degree infrared cameras. They explode when their within optimal range, and transmit a three dimensional point-cloud of the battlefield on their journey to oblivion, complete with infrared, visible light data on every voxel.

Due to the systems relative stupidity, allied humans anywhere near the battlefield will become liabilities. Adding the ability to distinguish between friend and foe will reduce the effectiveness of the war robot platform. Additionally it opens a backdoor that would allow objectives to disguise themselves as assets. It will be more effective to tell the system to destroy anything that is even remotely human. Conversely due to the systems relative intelligence it will render older weapons systems obsolete, ICBMs and first strike submarines wont be the deterrent that they are now that because they will be nullified with 100% efficiency. 

So now comes the fun part! What happens then? I theres a possibility that this madness will be avoided with agreements like the Geneva Convention, where everyone agrees to not create war robots. That being said since compliance would be voluntary, governments cant really trust the EU, Russia, China or the USA to comply with blind faith. The advantage that such a system would give one side over the others would be so absolute that trust could be a catastrophic mistake. Private enterprise could become a scary enemy, in a bond villain twist, what if a Warbots Inc., creates the entire platform, and through some ingenuity creates three robots for every one the USA purchases? Warbots Inc. keeps the two others hidden somewhere else. This would mean that they now have two times as many war robots as their client the USA, or worse they could pull off the iRobot plot of issuing an upgrade that puts them in control of the USAs system.

Its a fun conversation, Im a pessimist myself and see human kind being enslaved for the entertainment of our robot-owning-overlords, but others I pose this to see a world where robots free us and create a robot fueled Utopia. What are your thoughts?",0,0
81,2016-4-2,2016,4,2,0,4cwag9,What are your views on war and the military?,https://www.reddit.com/r/Futurology/comments/4cwag9/what_are_your_views_on_war_and_the_military/,Valgor,1459525722,[removed],8,2
82,2016-4-2,2016,4,2,0,4cwaik,US Doctors Successfully Transplant HIV-Infected Organs For the First Time,https://www.reddit.com/r/Futurology/comments/4cwaik/us_doctors_successfully_transplant_hivinfected/,dustofoblivion123,1459525749,,2,17
83,2016-4-2,2016,4,2,1,4cwfvp,Benefits of Atheism,https://www.reddit.com/r/Futurology/comments/4cwfvp/benefits_of_atheism/,DURAMAX_POWA,1459527417,[removed],3,0
84,2016-4-2,2016,4,2,1,4cwgrb,VR and PVP Gaming,https://www.reddit.com/r/Futurology/comments/4cwgrb/vr_and_pvp_gaming/,INTP-02,1459527664,,2,10
85,2016-4-2,2016,4,2,1,4cwgx9,City of the Future  The Dialogue,https://www.reddit.com/r/Futurology/comments/4cwgx9/city_of_the_future_the_dialogue/,DrSheldon_Lee_Cooper,1459527717,,5,5
86,2016-4-2,2016,4,2,1,4cwhck,"Model 3 orders at 180,000 in 24 hours. Selling price w avg option mix prob $42k, so ~$7.5B in a day. Future of electric cars looking bright!",https://www.reddit.com/r/Futurology/comments/4cwhck/model_3_orders_at_180000_in_24_hours_selling/,[deleted],1459527834,[deleted],1,1
87,2016-4-2,2016,4,2,1,4cwjmp,"Elon Musk Announces $7.5 Billion in Tesla Model 3 Sales: ""Future of electric cars looking bright!",https://www.reddit.com/r/Futurology/comments/4cwjmp/elon_musk_announces_75_billion_in_tesla_model_3/,nick314,1459528534,,28,89
88,2016-4-2,2016,4,2,1,4cwl8t,The future of secrecy in a digital age,https://www.reddit.com/r/Futurology/comments/4cwl8t/the_future_of_secrecy_in_a_digital_age/,stormforce7916,1459529024,,0,3
89,2016-4-2,2016,4,2,1,4cwlcg,"YouTube unveils new feature SnoopaVision (Beta) - ""A revolutionary way to watch YouTube"".",https://www.reddit.com/r/Futurology/comments/4cwlcg/youtube_unveils_new_feature_snoopavision_beta_a/,reizorc,1459529052,,3,4
90,2016-4-2,2016,4,2,1,4cwlef,Crafting a sustainable future for humanity,https://www.reddit.com/r/Futurology/comments/4cwlef/crafting_a_sustainable_future_for_humanity/,stormforce7916,1459529067,,0,4
91,2016-4-2,2016,4,2,1,4cwnem,The future is now.,https://www.reddit.com/r/Futurology/comments/4cwnem/the_future_is_now/,[deleted],1459529688,[deleted],7,10
92,2016-4-2,2016,4,2,1,4cwnfb,Is there any way currently where I can change my genetics as an adult?,https://www.reddit.com/r/Futurology/comments/4cwnfb/is_there_any_way_currently_where_i_can_change_my/,sllexypizza,1459529693,From what I heard Crispar is only used on human embryos. as someone who is not an embryo I feel kind of left out.,7,2
93,2016-4-2,2016,4,2,2,4cworq,IBM Brain-Inspired Computer Will Look After Our Nuclear Weapons,https://www.reddit.com/r/Futurology/comments/4cworq/ibm_braininspired_computer_will_look_after_our/,furyfairy,1459530071,,1,1
94,2016-4-2,2016,4,2,2,4cwpxu,Laser cloaking device could help us hide from aliens,https://www.reddit.com/r/Futurology/comments/4cwpxu/laser_cloaking_device_could_help_us_hide_from/,acidacetylsalicylic,1459530408,,2,1
