,date,year,month,day,hour,id,title,full_link,author,created,selftext,num_comments,score
2210,2016-4-24,2016,4,24,8,4g5wyn,Guy creates cement 3D printer - prints a castle.,https://www.reddit.com/r/Futurology/comments/4g5wyn/guy_creates_cement_3d_printer_prints_a_castle/,ghostenema,1461455394,,1,0
2211,2016-4-24,2016,4,24,8,4g5x5i,Licensing Laws Are Shutting Young People Out Of The Job Market. Could there be less regulatory capture in the future?,https://www.reddit.com/r/Futurology/comments/4g5x5i/licensing_laws_are_shutting_young_people_out_of/,[deleted],1461455478,[deleted],0,0
2212,2016-4-24,2016,4,24,8,4g5xub,Scientists Create Model For A Functional Living Bio-Supercomputer,https://www.reddit.com/r/Futurology/comments/4g5xub/scientists_create_model_for_a_functional_living/,DavidTheOwned,1461455811,,13,162
2213,2016-4-24,2016,4,24,9,4g5y9q,The Future of Truly Levitating Vehicles and Fusion Reactors,https://www.reddit.com/r/Futurology/comments/4g5y9q/the_future_of_truly_levitating_vehicles_and/,BlaineMiller,1461456002,"I'm going to be either a pissed off grump old fucker or a really happy one depending on two things: 1.Fusion takes off or doesn't.
                                             2.Flying Cars.
If I don't get one of those things by the time I'm 80 I'm going to be a pissed off old fucker.  Which would you like to see happen?
",23,11
2214,2016-4-24,2016,4,24,9,4g5zlb,"Author of Scandinavian Unexceptionalism explains why universal welfare (UBI) won't work: ""From 1870 until 1970, Sweden was a free market success story. Sweden had the highest growth rate in the industrialized world. .. [After taxes were raised in the late 60s and 70s] Sweden stagnated"" [August 2015]",https://www.reddit.com/r/Futurology/comments/4g5zlb/author_of_scandinavian_unexceptionalism_explains/,aminok,1461456590,,14,5
2215,2016-4-24,2016,4,24,10,4g69hm,Kevin Interviews Jeff Meredith and Johnny Lee on Project Tango Partnership,https://www.reddit.com/r/Futurology/comments/4g69hm/kevin_interviews_jeff_meredith_and_johnny_lee_on/,remotemass,1461461161,,0,7
2216,2016-4-24,2016,4,24,10,4g6a5m,Solar Impulse 2 reaches San Francisco Bay Area following 56 hours of flight over Pacific Ocean.,https://www.reddit.com/r/Futurology/comments/4g6a5m/solar_impulse_2_reaches_san_francisco_bay_area/,[deleted],1461461465,[deleted],18,267
2217,2016-4-24,2016,4,24,10,4g6cuh,This could be the year we eliminate one of the most tragic diseases in history. WHO announces that Polio will be gone by 2017,https://www.reddit.com/r/Futurology/comments/4g6cuh/this_could_be_the_year_we_eliminate_one_of_the/,The_Jolene,1461462833,,36,99
2218,2016-4-24,2016,4,24,11,4g6g2b,3D Printing in Space in the Year 2050,https://www.reddit.com/r/Futurology/comments/4g6g2b/3d_printing_in_space_in_the_year_2050/,nocturnalvoice,1461464443,,0,1
2219,2016-4-24,2016,4,24,11,4g6gnb,Cover your body in light with organic photonic skin,https://www.reddit.com/r/Futurology/comments/4g6gnb/cover_your_body_in_light_with_organic_photonic/,[deleted],1461464748,[deleted],0,10
2220,2016-4-24,2016,4,24,11,4g6it2,"Like the sun, the use of solar is rising.",https://www.reddit.com/r/Futurology/comments/4g6it2/like_the_sun_the_use_of_solar_is_rising/,arclathe,1461465868,,3,54
2221,2016-4-24,2016,4,24,12,4g6ohz,When will we have a virtual assistant with IBM Watson capabilities or better?,https://www.reddit.com/r/Futurology/comments/4g6ohz/when_will_we_have_a_virtual_assistant_with_ibm/,HumpyMagoo,1461468840,[removed],1,1
2222,2016-4-24,2016,4,24,12,4g6p5c,What is the maxed out future can weimagine of?,https://www.reddit.com/r/Futurology/comments/4g6p5c/what_is_the_maxed_out_future_can_weimagine_of/,PauperPhilosopher,1461469196,"We have been talking about future,But i seems to me that even the discussion can be exended beyond the limits ( Something beyond the likes of matrix)",8,0
2223,2016-4-24,2016,4,24,12,4g6pdf,"Soooo, you can now race a drone with your brain",https://www.reddit.com/r/Futurology/comments/4g6pdf/soooo_you_can_now_race_a_drone_with_your_brain/,VegasTamborini,1461469309,,0,6
2224,2016-4-24,2016,4,24,14,4g71h3,If we reach a point where robots can do all jobs why would would we need money ?,https://www.reddit.com/r/Futurology/comments/4g71h3/if_we_reach_a_point_where_robots_can_do_all_jobs/,Animalmutha76,1461476730,Does Ubi become pointless ? ,50,14
2225,2016-4-24,2016,4,24,15,4g74wy,Chinese firms accelerate in race toward driverless future,https://www.reddit.com/r/Futurology/comments/4g74wy/chinese_firms_accelerate_in_race_toward/,California254,1461479073,,32,132
2226,2016-4-24,2016,4,24,15,4g76gt,NASA pours $67 million into solar electric spacecraft engines,https://www.reddit.com/r/Futurology/comments/4g76gt/nasa_pours_67_million_into_solar_electric/,Danieltomp472,1461480170,,13,282
2227,2016-4-24,2016,4,24,16,4g78na,Solar Impulse has landed in San Francisco after 3-day flight without fuel.,https://www.reddit.com/r/Futurology/comments/4g78na/solar_impulse_has_landed_in_san_francisco_after/,[deleted],1461481718,[deleted],0,1
2228,2016-4-24,2016,4,24,16,4g7933,New Metamaterial Can Create Solar Panels That Generate Electricity In The Dark,https://www.reddit.com/r/Futurology/comments/4g7933/new_metamaterial_can_create_solar_panels_that/,TYRmusic,1461482033,,15,17
2229,2016-4-24,2016,4,24,16,4g7ajb,Check What Your Finger Length Says About Your Hormones and Personality,https://www.reddit.com/r/Futurology/comments/4g7ajb/check_what_your_finger_length_says_about_your/,Rose_1992,1461483087,,0,1
2230,2016-4-24,2016,4,24,16,4g7ase,"Ready, set, think! Mind-controlled drones race to the future",https://www.reddit.com/r/Futurology/comments/4g7ase/ready_set_think_mindcontrolled_drones_race_to_the/,Daniel4780,1461483280,,0,9
2231,2016-4-24,2016,4,24,17,4g7dxj,First gene therapy successful against human aging,https://www.reddit.com/r/Futurology/comments/4g7dxj/first_gene_therapy_successful_against_human_aging/,virusxp,1461485451,,1049,3723
2232,2016-4-24,2016,4,24,18,4g7i57,DUNIASELEBRITI99.BLOGSPOT.COM | PASHA UNGU KOMENTARI CIBIRAN NETIZEN,https://www.reddit.com/r/Futurology/comments/4g7i57/duniaselebriti99blogspotcom_pasha_ungu_komentari/,tanyuni,1461488614,,0,1
2233,2016-4-24,2016,4,24,18,4g7iae,#JobsRoulette freelancers marketplace idea!,https://www.reddit.com/r/Futurology/comments/4g7iae/jobsroulette_freelancers_marketplace_idea/,remotemass,1461488726," Imagine a freelancers marketplace where each skilled worker has more chances of being picked randomly for a specific task to which he is available: the better ratings he has and the less money/time he is willing to charge. 
If employer for some reason doesn't get satisfied with delivered solution he can direct the payment to a charity or kickstarter project of his choice!",5,6
2234,2016-4-24,2016,4,24,18,4g7jqz,30 companies are now making self-driving cars,https://www.reddit.com/r/Futurology/comments/4g7jqz/30_companies_are_now_making_selfdriving_cars/,lughnasadh,1461489817,,47,292
2235,2016-4-24,2016,4,24,18,4g7kqi,DAO's (Decentralised Autonomous Organisations) explained - a way to use blockchain tech to create alternative future economic sharing and distribution networks and act as a mechanism for meeting the challenges of automation.,https://www.reddit.com/r/Futurology/comments/4g7kqi/daos_decentralised_autonomous_organisations/,lughnasadh,1461490569,,3,8
2236,2016-4-24,2016,4,24,18,4g7lej,Final Piece of Type 1 Diabetes Puzzle Solved,https://www.reddit.com/r/Futurology/comments/4g7lej/final_piece_of_type_1_diabetes_puzzle_solved/,pcjwss,1461491092,,7,55
2237,2016-4-24,2016,4,24,19,4g7nf9,I Went Inside Magic Leaps Mysterious HQ. Heres What I Saw,https://www.reddit.com/r/Futurology/comments/4g7nf9/i_went_inside_magic_leaps_mysterious_hq_heres/,INTP-02,1461492572,,1,6
2238,2016-4-24,2016,4,24,19,4g7pde,"Phillips release SpeechAir Digital Voice Recorder, Android-Powered",https://www.reddit.com/r/Futurology/comments/4g7pde/phillips_release_speechair_digital_voice_recorder/,warnergiver,1461494239,,2,9
2239,2016-4-24,2016,4,24,20,4g7rwz,Who's Responsible When a Self-Driving Car Crashes?,https://www.reddit.com/r/Futurology/comments/4g7rwz/whos_responsible_when_a_selfdriving_car_crashes/,Arzu1982,1461496201,,11,15
2240,2016-4-24,2016,4,24,20,4g7rxd,Japan panel OKs gene editing of human eggs for basic study,https://www.reddit.com/r/Futurology/comments/4g7rxd/japan_panel_oks_gene_editing_of_human_eggs_for/,ellerdrop,1461496208,,194,1753
2241,2016-4-24,2016,4,24,20,4g7s4p,How drones will change the world in the next 5 years,https://www.reddit.com/r/Futurology/comments/4g7s4p/how_drones_will_change_the_world_in_the_next_5/,Arzu1982,1461496367,,0,18
2242,2016-4-24,2016,4,24,20,4g7t73,Is This How Boeing and Lockheed Martin Beat SpaceX?,https://www.reddit.com/r/Futurology/comments/4g7t73/is_this_how_boeing_and_lockheed_martin_beat_spacex/,Arzu1982,1461497160,,3,13
2243,2016-4-24,2016,4,24,20,4g7uft,"Uranium From Seawater Could Keep Our Lights On for 13,000 Years",https://www.reddit.com/r/Futurology/comments/4g7uft/uranium_from_seawater_could_keep_our_lights_on/,clanlord,1461498006,,35,37
2244,2016-4-24,2016,4,24,20,4g7vcr,China's first security robot debuts,https://www.reddit.com/r/Futurology/comments/4g7vcr/chinas_first_security_robot_debuts/,petskup,1461498634,,11,24
2245,2016-4-24,2016,4,24,21,4g7xxe,"New Russian mach 6 hypersonic missile will enter production 2018 and then be used on ships, submarines, bombers",https://www.reddit.com/r/Futurology/comments/4g7xxe/new_russian_mach_6_hypersonic_missile_will_enter/,Arzu1982,1461500381,,8,17
2246,2016-4-24,2016,4,24,21,4g811v,"This Week in Science (Video Edition): The Complete Eradication of Polio, Using CRISPR to Edit Single Lines of DNA, and More",https://www.reddit.com/r/Futurology/comments/4g811v/this_week_in_science_video_edition_the_complete/,[deleted],1461502360,[deleted],1,1
2247,2016-4-24,2016,4,24,21,4g818n,"When Facebook and Google finally destroy the competition, a new age of feudalism will arrive - Evgeny Morozov",https://www.reddit.com/r/Futurology/comments/4g818n/when_facebook_and_google_finally_destroy_the/,Kradiant,1461502486,,26,90
2248,2016-4-24,2016,4,24,22,4g81zm,Australia's postal service is testing drone deliveries,https://www.reddit.com/r/Futurology/comments/4g81zm/australias_postal_service_is_testing_drone/,[deleted],1461502920,[deleted],1,13
2249,2016-4-24,2016,4,24,22,4g826v,This Week in Science in under Two Minutes (Video and Infographic),https://www.reddit.com/r/Futurology/comments/4g826v/this_week_in_science_in_under_two_minutes_video/,Portis403,1461503028,,9,134
2250,2016-4-24,2016,4,24,22,4g82wp,This is how we will make cars more accessible for wheelchairs. Two young guys invented the most suitable car for wheelchairs!,https://www.reddit.com/r/Futurology/comments/4g82wp/this_is_how_we_will_make_cars_more_accessible_for/,avaimovement,1461503434,,1,1
2251,2016-4-24,2016,4,24,22,4g857x,This is how we will make cars more accessible for wheelchairs. Two young guys invented the most suitable car for wheelchairs!,https://www.reddit.com/r/Futurology/comments/4g857x/this_is_how_we_will_make_cars_more_accessible_for/,avaimovement,1461504695,[removed],1,1
2252,2016-4-24,2016,4,24,22,4g87fh,"Disney invents near-instantaneous 3D printing technology. During testing, Disney was successful in printing 3D objects in just a few minutes.",https://www.reddit.com/r/Futurology/comments/4g87fh/disney_invents_nearinstantaneous_3d_printing/,r3ydild0,1461505824,,23,110
2253,2016-4-24,2016,4,24,23,4g89ui,"If we did find the cure for aging, and could live forever as long as we don't get injured, how do you think society would change?",https://www.reddit.com/r/Futurology/comments/4g89ui/if_we_did_find_the_cure_for_aging_and_could_live/,Heknarf,1461506979,"I'm thinking that people who had the treatment to live forever would need to be sterilized to stop huge population growth as more are born and no one dies. 

Any other impacts? Entrenched wealth might be another problem. Suicide rates would likely go up. ",32,4
2254,2016-4-24,2016,4,24,23,4g8bh2,The future of party politics,https://www.reddit.com/r/Futurology/comments/4g8bh2/the_future_of_party_politics/,IntelligenceIsReal,1461507724,,1,2
2255,2016-4-24,2016,4,24,23,4g8cu6,"Teslas Autopilot lowers probability of having an accident by 50% based on early data, says Musk",https://www.reddit.com/r/Futurology/comments/4g8cu6/teslas_autopilot_lowers_probability_of_having_an/,FredTesla,1461508393,,1062,5256
2256,2016-4-24,2016,4,24,23,4g8g0y,Dutch man takes care of the grave outside World War II soldier,https://www.reddit.com/r/Futurology/comments/4g8g0y/dutch_man_takes_care_of_the_grave_outside_world/,[deleted],1461509869,[deleted],0,1
2257,2016-4-25,2016,4,25,0,4g8ho1,The Future is Here And The Future Is Zukul Ad Network,https://www.reddit.com/r/Futurology/comments/4g8ho1/the_future_is_here_and_the_future_is_zukul_ad/,repapif,1461510579,,2,1
2258,2016-4-25,2016,4,25,0,4g8jpz,Kevin Kelly Says 12 Technological Forces Will Shape Our Future,https://www.reddit.com/r/Futurology/comments/4g8jpz/kevin_kelly_says_12_technological_forces_will/,33rdsquare,1461511494,,0,1
2259,2016-4-25,2016,4,25,0,4g8juv,First gene therapy successful against human aging..,https://www.reddit.com/r/Futurology/comments/4g8juv/first_gene_therapy_successful_against_human_aging/,[deleted],1461511547,[deleted],1,1
2260,2016-4-25,2016,4,25,0,4g8l1b,Samsung Galaxy S7 vs iPhone 7 - who will win the trophy for best smartphone of 2016,https://www.reddit.com/r/Futurology/comments/4g8l1b/samsung_galaxy_s7_vs_iphone_7_who_will_win_the/,JobbiesOnTheGo,1461512030,,0,1
2261,2016-4-25,2016,4,25,0,4g8mpn,"Tesla Model S is Epic. The Model X, Not So Much: Consumer Reports",https://www.reddit.com/r/Futurology/comments/4g8mpn/tesla_model_s_is_epic_the_model_x_not_so_much/,401billion,1461512758,,0,1
2262,2016-4-25,2016,4,25,0,4g8my4,European Cloud Initiative to give Europe a global lead in the data-driven economy,https://www.reddit.com/r/Futurology/comments/4g8my4/european_cloud_initiative_to_give_europe_a_global/,techlawz,1461512868,,0,1
2263,2016-4-25,2016,4,25,1,4g8pbk,"All of the problems Universal Basic Income can solve that have nothing to do with unemployment (from stress to meaningless jobs, from inequality to climate change)",https://www.reddit.com/r/Futurology/comments/4g8pbk/all_of_the_problems_universal_basic_income_can/,[deleted],1461513848,[deleted],753,1334
2264,2016-4-25,2016,4,25,1,4g8pqn,The Future is Here And The Future Is Zukul Ad Network,https://www.reddit.com/r/Futurology/comments/4g8pqn/the_future_is_here_and_the_future_is_zukul_ad/,paulus11,1461514016,,2,2
2265,2016-4-25,2016,4,25,1,4g8qa8,Diet: One highly important aspect of living as long as possible,https://www.reddit.com/r/Futurology/comments/4g8qa8/diet_one_highly_important_aspect_of_living_as/,jimii,1461514240,[removed],0,0
2266,2016-4-25,2016,4,25,1,4g8r75,BBC R&amp;D are developing Dynamic Binaural Sound for use with Virtual Reality. Dynamic Binaural Sound is 360 degree sound that changes depending on which direction you are facing. From BBC Click.,https://www.reddit.com/r/Futurology/comments/4g8r75/bbc_rd_are_developing_dynamic_binaural_sound_for/,keef2000,1461514603,,0,1
2267,2016-4-25,2016,4,25,1,4g8rd1,Why The 9.7-Inch iPad Pro May Still Not Replace Laptops,https://www.reddit.com/r/Futurology/comments/4g8rd1/why_the_97inch_ipad_pro_may_still_not_replace/,arnell75,1461514666,,0,1
2268,2016-4-25,2016,4,25,1,4g8rjx,The Status Quo Politics Of Today Offer Bleak Future,https://www.reddit.com/r/Futurology/comments/4g8rjx/the_status_quo_politics_of_today_offer_bleak/,IntelligenceIsReal,1461514747,,0,2
2269,2016-4-25,2016,4,25,1,4g8uqi,"A good read on the economics of the future (micropayments, etc)",https://www.reddit.com/r/Futurology/comments/4g8uqi/a_good_read_on_the_economics_of_the_future/,judogoat,1461516100,"Ever read any of Jaron Lanier's stuff?  He's been involveed in virtual reality and the cutting edge of technology for 40 years.  Here's my review of his book (not too much detail):

http://hubpages.com/literature/the-economics-of-the-approaching-technological-singularity-jaron-laniers-insightful-read

I found it to be a nice counterpart to some of the rah-rah singularity stuff I've read in the past.",6,9
2270,2016-4-25,2016,4,25,1,4g8wvw,Wallpapers Technology Hd Math Science Pin Stunning For Your On Pinterest 1920x1080,https://www.reddit.com/r/Futurology/comments/4g8wvw/wallpapers_technology_hd_math_science_pin/,ThiefWorlds,1461516967,,1,1
2271,2016-4-25,2016,4,25,1,4g8x0o,Bomb-sniffing drone technology developed at UW could become nightmare for terrorists,https://www.reddit.com/r/Futurology/comments/4g8x0o/bombsniffing_drone_technology_developed_at_uw/,Noticemenot,1461517024,,16,171
2272,2016-4-25,2016,4,25,2,4g965u,Physics Driven Tank,https://www.reddit.com/r/Futurology/comments/4g965u/physics_driven_tank/,NahLeaveItOut,1461520645,,3,0
2273,2016-4-25,2016,4,25,3,4g96pq,VID 20160417 162602,https://www.reddit.com/r/Futurology/comments/4g96pq/vid_20160417_162602/,dpranita583,1461520864,,0,1
2274,2016-4-25,2016,4,25,3,4g97z9,An all glass iPhone 8 coming next year. All glass unibody and nothing else.,https://www.reddit.com/r/Futurology/comments/4g97z9/an_all_glass_iphone_8_coming_next_year_all_glass/,RustinKohli,1461521324,,4,1
2275,2016-4-25,2016,4,25,3,4g99to,Digital Risk Insurance Coverage is Critical,https://www.reddit.com/r/Futurology/comments/4g99to/digital_risk_insurance_coverage_is_critical/,Elifoncul,1461521954,,0,1
2276,2016-4-25,2016,4,25,3,4g9ar6,Spyce - The Automated Kitchen Made By MIT Students - Video Dailymotion,https://www.reddit.com/r/Futurology/comments/4g9ar6/spyce_the_automated_kitchen_made_by_mit_students/,chudder1,1461522291,,6,10
2277,2016-4-25,2016,4,25,3,4g9b9q,"Your Personal Sim--Part 2 of My Medium Series on the Most Important IT Advance of the Next Generation (IMO, obviously).",https://www.reddit.com/r/Futurology/comments/4g9b9q/your_personal_simpart_2_of_my_medium_series_on/,JohnMSmart,1461522466,,5,10
2278,2016-4-25,2016,4,25,3,4g9ddx,These Earth-Saving Robots Might Be The Future Recyclers,https://www.reddit.com/r/Futurology/comments/4g9ddx/these_earthsaving_robots_might_be_the_future/,[deleted],1461523192,[deleted],1,26
2279,2016-4-25,2016,4,25,3,4g9g1z,"Although I still use Mi Band (1st generation) I'm really happy to see a ""screen"" on the new Mi Band 2 which this leaked image shows",https://www.reddit.com/r/Futurology/comments/4g9g1z/although_i_still_use_mi_band_1st_generation_im/,sonijd,1461524185,,1,3
2280,2016-4-25,2016,4,25,5,4g9tzf,EU discuss next steps for a future direct democracy,https://www.reddit.com/r/Futurology/comments/4g9tzf/eu_discuss_next_steps_for_a_future_direct/,IntelligenceIsReal,1461529403,,5,19
2281,2016-4-25,2016,4,25,5,4g9u26,"Solar cell mystery solved, expected to greatly increase efficiency",https://www.reddit.com/r/Futurology/comments/4g9u26/solar_cell_mystery_solved_expected_to_greatly/,[deleted],1461529434,[deleted],8,106
2282,2016-4-25,2016,4,25,6,4ga0po,"This Week @ NASA  April 22, 2016",https://www.reddit.com/r/Futurology/comments/4ga0po/this_week_nasa_april_22_2016/,mind_bomber,1461531956,,0,4
2283,2016-4-25,2016,4,25,7,4gad7z,The Future of Jobs,https://www.reddit.com/r/Futurology/comments/4gad7z/the_future_of_jobs/,somethingwhatever123,1461536730,,1,1
2284,2016-4-25,2016,4,25,7,4gafsc,Universal basic income is mentioned on here daily. Has anyone detailed who would be funding this endeavor?,https://www.reddit.com/r/Futurology/comments/4gafsc/universal_basic_income_is_mentioned_on_here_daily/,[deleted],1461537712,[deleted],7,0
2285,2016-4-25,2016,4,25,9,4gaskk,The future is here today and it is weirder than we were promised,https://www.reddit.com/r/Futurology/comments/4gaskk/the_future_is_here_today_and_it_is_weirder_than/,taleffector,1461542948,,8,34
2286,2016-4-25,2016,4,25,9,4gavys,A new bill will force companies to place a backdoor in their devices to undermine their own encryption,https://www.reddit.com/r/Futurology/comments/4gavys/a_new_bill_will_force_companies_to_place_a/,joepinnapple,1461544373,,90,362
2287,2016-4-25,2016,4,25,9,4gaxw3,"Air force research lab roadmaps for game changing hypersonic vehicles, directed energy weapons and drones",https://www.reddit.com/r/Futurology/comments/4gaxw3/air_force_research_lab_roadmaps_for_game_changing/,Arzu1982,1461545194,,0,2
2288,2016-4-25,2016,4,25,10,4gb72s,"Occupational Licenses May Be Bad for the Economy, But Good for Workers Who Have Them. As unemployment goes up, could the future be reduced licensing requirements?",https://www.reddit.com/r/Futurology/comments/4gb72s/occupational_licenses_may_be_bad_for_the_economy/,[deleted],1461549188,[deleted],1,1
2289,2016-4-25,2016,4,25,11,4gbayx,"NASA launches new X-plane program to create cleaner, more efficient planes.",https://www.reddit.com/r/Futurology/comments/4gbayx/nasa_launches_new_xplane_program_to_create/,[deleted],1461550903,[deleted],0,4
2290,2016-4-25,2016,4,25,11,4gbb7k,Is magic leap the future of computing?!!?,https://www.reddit.com/r/Futurology/comments/4gbb7k/is_magic_leap_the_future_of_computing/,Narksdog,1461551009,[removed],1,1
2291,2016-4-25,2016,4,25,11,4gbcec,This is important. NASA conducts the toughest test yet for drone traffic control,https://www.reddit.com/r/Futurology/comments/4gbcec/this_is_important_nasa_conducts_the_toughest_test/,Damon6325,1461551564,,0,1
2292,2016-4-25,2016,4,25,11,4gbcf7,What Can Be Eaten to Prevent Protein Loss in IgA Nephropathy,https://www.reddit.com/r/Futurology/comments/4gbcf7/what_can_be_eaten_to_prevent_protein_loss_in_iga/,tietiett,1461551575,,0,1
2293,2016-4-25,2016,4,25,11,4gbd1o,Microsoft's futurologist has a plan to beat the robots,https://www.reddit.com/r/Futurology/comments/4gbd1o/microsofts_futurologist_has_a_plan_to_beat_the/,TYRmusic,1461551860,,1,3
2294,2016-4-25,2016,4,25,11,4gbe09,Will a robot take your job? An overview of automation and stuff,https://www.reddit.com/r/Futurology/comments/4gbe09/will_a_robot_take_your_job_an_overview_of/,theinformedape,1461552301,,7,39
2295,2016-4-25,2016,4,25,12,4gbg16,hey guys could you guys please do my survey? its for my ict projects thanks heaps :),https://www.reddit.com/r/Futurology/comments/4gbg16/hey_guys_could_you_guys_please_do_my_survey_its/,danielisajewdog123,1461553240,[removed],0,1
2296,2016-4-25,2016,4,25,12,4gbggh,Google's Ray Kurzweil Receives Honorary Doctorate from York University,https://www.reddit.com/r/Futurology/comments/4gbggh/googles_ray_kurzweil_receives_honorary_doctorate/,INTP-02,1461553422,,5,37
2297,2016-4-25,2016,4,25,12,4gbib0,US Armed Services studying restart of F-22 stealth fighter production,https://www.reddit.com/r/Futurology/comments/4gbib0/us_armed_services_studying_restart_of_f22_stealth/,TYRmusic,1461554290,,54,38
2298,2016-4-25,2016,4,25,12,4gbnjg,What are some realistic technological advancements humanity may make within the next 100 years?,https://www.reddit.com/r/Futurology/comments/4gbnjg/what_are_some_realistic_technological/,[deleted],1461556756,[removed],1,1
2299,2016-4-25,2016,4,25,13,4gbp60,What are some realistic technological advancements humanity may make within the next 100 years?,https://www.reddit.com/r/Futurology/comments/4gbp60/what_are_some_realistic_technological/,BOOmabad,1461557518,"and what will the ""realistic"" technological advancements be the next 100 years after? How much will things change? Would daily life be similar or different?",29,11
2300,2016-4-25,2016,4,25,13,4gbqyx,"Elon Musk: Tesla will follow up the Model 3 with a fourth generation, lower-priced electric vehicle",https://www.reddit.com/r/Futurology/comments/4gbqyx/elon_musk_tesla_will_follow_up_the_model_3_with_a/,Nachtigall44,1461558477,,184,1118
2301,2016-4-25,2016,4,25,13,4gbrt1,NASA Awards Design Contract Of New Quiet Supersonic Passenger Jet,https://www.reddit.com/r/Futurology/comments/4gbrt1/nasa_awards_design_contract_of_new_quiet/,TheDrambus,1461558916,,1,8
2302,2016-4-25,2016,4,25,13,4gbswj,Unmanned truck of future,https://www.reddit.com/r/Futurology/comments/4gbswj/unmanned_truck_of_future/,Colorado688,1461559473,,13,60
2303,2016-4-25,2016,4,25,13,4gbuje,"China built 7.14GW of solar in the first quarter of 2016, bringing cumulative, nationwide installed capacity to 50.31GW, up 52% from a year earlier, according to new government statistics.",https://www.reddit.com/r/Futurology/comments/4gbuje/china_built_714gw_of_solar_in_the_first_quarter/,Buck-Nasty,1461560338,,12,88
2304,2016-4-25,2016,4,25,14,4gbwdq,Augmented Reality is getting serious at Magic Leap (video),https://www.reddit.com/r/Futurology/comments/4gbwdq/augmented_reality_is_getting_serious_at_magic/,FutureAvenir,1461561396,,4,19
2305,2016-4-25,2016,4,25,14,4gbz3i,Concept VR headset for 2020,https://www.reddit.com/r/Futurology/comments/4gbz3i/concept_vr_headset_for_2020/,Eitan455,1461562985,,1,6
2306,2016-4-25,2016,4,25,14,4gbz9g,Man-made 'breathing' leaf is an oxygen factory for space travel,https://www.reddit.com/r/Futurology/comments/4gbz9g/manmade_breathing_leaf_is_an_oxygen_factory_for/,[deleted],1461563079,[deleted],2,7
2307,2016-4-25,2016,4,25,15,4gc1pf,Blue Light Special: Colored Streetlamps Could Lead to Decline in Criminal Activity &amp; Suicide Rates,https://www.reddit.com/r/Futurology/comments/4gc1pf/blue_light_special_colored_streetlamps_could_lead/,CapnTrip,1461564553,,9,64
2308,2016-4-25,2016,4,25,16,4gcag6,Terra Metropolis [Fiction],https://www.reddit.com/r/Futurology/comments/4gcag6/terra_metropolis_fiction/,[deleted],1461570037,[deleted],0,0
2309,2016-4-25,2016,4,25,16,4gcb1u,Will there ever be reddit account that I don't shit post on?,https://www.reddit.com/r/Futurology/comments/4gcb1u/will_there_ever_be_reddit_account_that_i_dont/,i_will_not_shit_post,1461570454,[removed],0,1
