,date,year,month,day,hour,id,title,full_link,author,created,selftext,num_comments,score
1448,2016-4-15,2016,4,15,21,4eweo8,"Scientists at Rice University have found a way to make carbon nanotubes self-assemble, possibly the futuristic first step in creating force fields that can move larger objects.",https://www.reddit.com/r/Futurology/comments/4eweo8/scientists_at_rice_university_have_found_a_way_to/,NinjaDiscoJesus,1460722157,,2,11
1449,2016-4-15,2016,4,15,21,4ewev8,Your kids might live on Mars. Here's how they'll survive,https://www.reddit.com/r/Futurology/comments/4ewev8/your_kids_might_live_on_mars_heres_how_theyll/,Arzu1982,1460722251,,4,4
1450,2016-4-15,2016,4,15,21,4ewf1d,A flying saucer that fights fire with sound,https://www.reddit.com/r/Futurology/comments/4ewf1d/a_flying_saucer_that_fights_fire_with_sound/,[deleted],1460722333,[deleted],8,40
1451,2016-4-15,2016,4,15,21,4ewfwp,"This Week in Tech: Generating Electricity from Raindrops, A 15 Billion Transistor Chip, and So Much More",https://www.reddit.com/r/Futurology/comments/4ewfwp/this_week_in_tech_generating_electricity_from/,Portis403,1460722740,,14,237
1452,2016-4-15,2016,4,15,21,4ewhwi,"Alphabet's Sidewalk Labs Plans Digital City for Google Car, Internet | Re/code",https://www.reddit.com/r/Futurology/comments/4ewhwi/alphabets_sidewalk_labs_plans_digital_city_for/,furyfairy,1460723617,,1,6
1453,2016-4-15,2016,4,15,21,4ewiec,Why the Future of Design Is Emotional,https://www.reddit.com/r/Futurology/comments/4ewiec/why_the_future_of_design_is_emotional/,[deleted],1460723823,[deleted],0,1
1454,2016-4-15,2016,4,15,21,4ewkue,Beware VMware users! Hackers Could Hijack Your Web Session! Install updates to protect your system form Future threats!,https://www.reddit.com/r/Futurology/comments/4ewkue/beware_vmware_users_hackers_could_hijack_your_web/,CDI_Consulting-Blog,1460724879,,0,1
1455,2016-4-15,2016,4,15,22,4ewm5q,IDRA and ESPN Announce Drone Racing International Media Distribution Deal - bringing drone racing to TV,https://www.reddit.com/r/Futurology/comments/4ewm5q/idra_and_espn_announce_drone_racing_international/,[deleted],1460725461,[deleted],0,4
1456,2016-4-15,2016,4,15,22,4ewno2,The future of artificial intelligence is linked with blockchain,https://www.reddit.com/r/Futurology/comments/4ewno2/the_future_of_artificial_intelligence_is_linked/,macx0r,1460726130,,2,21
1457,2016-4-15,2016,4,15,22,4ewoys,Does Tesla Have a Faraday Future Problem?,https://www.reddit.com/r/Futurology/comments/4ewoys/does_tesla_have_a_faraday_future_problem/,401billion,1460726691,,0,1
1458,2016-4-15,2016,4,15,22,4ewrxw,The face of the man whose team will finally defeat death! - The Reanima Project - www.reanima.tech,https://www.reddit.com/r/Futurology/comments/4ewrxw/the_face_of_the_man_whose_team_will_finally/,iraspastor,1460727942,,0,1
1459,2016-4-15,2016,4,15,22,4ewsu7,"Rooftop solar panels could provide nearly half of our power - if all suitable roof areas in the United States were plastered with solar panels, they would generate about 1,118 gigawatts of solar power. That is 40% of the power that Americans consume every year.",https://www.reddit.com/r/Futurology/comments/4ewsu7/rooftop_solar_panels_could_provide_nearly_half_of/,Orangutan,1460728319,,15,77
1460,2016-4-15,2016,4,15,23,4ewu9q,How To Change Facebook Profile Name Before 60 Days Limitation.,https://www.reddit.com/r/Futurology/comments/4ewu9q/how_to_change_facebook_profile_name_before_60/,hakeem123,1460728895,,1,1
1461,2016-4-15,2016,4,15,23,4ewupa,What will the bank of the future look like?,https://www.reddit.com/r/Futurology/comments/4ewupa/what_will_the_bank_of_the_future_look_like/,thefunkylemon,1460729075,,2,3
1462,2016-4-15,2016,4,15,23,4ewwsj,Alphabet's Sidewalk Labs wants to build the city of the futu,https://www.reddit.com/r/Futurology/comments/4ewwsj/alphabets_sidewalk_labs_wants_to_build_the_city/,[deleted],1460729892,[deleted],0,1
1463,2016-4-15,2016,4,15,23,4ewxd7,Japan looks to extend intellectual property protection to creative works created by artificial intelligence,https://www.reddit.com/r/Futurology/comments/4ewxd7/japan_looks_to_extend_intellectual_property/,TopTrumpWANKER,1460730106,,10,49
1464,2016-4-15,2016,4,15,23,4ewzd4,Top 10 World War 3 Predictions That Might Be True  World War Is here,https://www.reddit.com/r/Futurology/comments/4ewzd4/top_10_world_war_3_predictions_that_might_be_true/,warbeguns,1460730868,,0,1
1465,2016-4-15,2016,4,15,23,4ex11p,A greener road ahead?,https://www.reddit.com/r/Futurology/comments/4ex11p/a_greener_road_ahead/,let-the-mother-bern,1460731536,,0,3
1466,2016-4-15,2016,4,15,23,4ex134,"Forget Iron Man, Student's smart gloves translates sign language into speech",https://www.reddit.com/r/Futurology/comments/4ex134/forget_iron_man_students_smart_gloves_translates/,ExchangeLingo,1460731551,,0,1
1467,2016-4-15,2016,4,15,23,4ex17p,MIT researchers have developed a system that can quickly comb through tens of thousands of lines of application code to find security flaws.,https://www.reddit.com/r/Futurology/comments/4ex17p/mit_researchers_have_developed_a_system_that_can/,martiansvsgoblins,1460731597,,0,1
1468,2016-4-15,2016,4,15,23,4ex3ap,Chickenless Eggs Are Almost Here,https://www.reddit.com/r/Futurology/comments/4ex3ap/chickenless_eggs_are_almost_here/,lnfinity,1460732380,,5,17
1469,2016-4-16,2016,4,16,0,4ex3o1,The Benefits of Purchasing Drugs from an Online Pharmacy,https://www.reddit.com/r/Futurology/comments/4ex3o1/the_benefits_of_purchasing_drugs_from_an_online/,guest1237,1460732512,,1,1
1470,2016-4-16,2016,4,16,0,4ex6ee,Public energy would pay for itself in ten years: New report,https://www.reddit.com/r/Futurology/comments/4ex6ee/public_energy_would_pay_for_itself_in_ten_years/,stormforce7916,1460733481,,0,33
1471,2016-4-16,2016,4,16,0,4ex6yu,Wallpaper Camera Wraps Around Any Surface,https://www.reddit.com/r/Futurology/comments/4ex6yu/wallpaper_camera_wraps_around_any_surface/,izumi3682,1460733698,,1,15
1472,2016-4-16,2016,4,16,0,4ex7dh,Japanese electronic device manufacturer Sharp Corporation has unveiled a unique robot-cum-smartphone that not only lets you communicate with your friends but also talks to you through simple verbal commands,https://www.reddit.com/r/Futurology/comments/4ex7dh/japanese_electronic_device_manufacturer_sharp/,chota-bheem,1460733847,,2,3
1473,2016-4-16,2016,4,16,0,4exba9,Regenerative Medicine Comes of Age,https://www.reddit.com/r/Futurology/comments/4exba9/regenerative_medicine_comes_of_age/,izumi3682,1460735249,,3,8
1474,2016-4-16,2016,4,16,0,4excv7,Telepresence Robots Will Become Commonplace By 2020 - Research group Tractica projects a 50 percent increase in telepresence in four years.,https://www.reddit.com/r/Futurology/comments/4excv7/telepresence_robots_will_become_commonplace_by/,Noticemenot,1460735828,,2,19
1475,2016-4-16,2016,4,16,0,4exdb6,The autonomous cars reality check,https://www.reddit.com/r/Futurology/comments/4exdb6/the_autonomous_cars_reality_check/,stormforce7916,1460735990,,1,29
1476,2016-4-16,2016,4,16,1,4exeec,Urban biomining meets printable electronics: end-to-end destination biological recycling and reprinting,https://www.reddit.com/r/Futurology/comments/4exeec/urban_biomining_meets_printable_electronics/,Quantumfog,1460736363,,1,20
1477,2016-4-16,2016,4,16,1,4exi9h,"I, Phone - CGPGrey.",https://www.reddit.com/r/Futurology/comments/4exi9h/i_phone_cgpgrey/,Fenixius,1460737760,,1,68
1478,2016-4-16,2016,4,16,1,4exihw,Small attachable motor transforms a bike to an electric bike.,https://www.reddit.com/r/Futurology/comments/4exihw/small_attachable_motor_transforms_a_bike_to_an/,Republiken,1460737835,,0,7
1479,2016-4-16,2016,4,16,1,4exj40,Discuss: Issues with Mind Uploading and Brain Replacement,https://www.reddit.com/r/Futurology/comments/4exj40/discuss_issues_with_mind_uploading_and_brain/,RobotJohnson,1460738044,"Ok futurology, let's talk about something that's been on my mind. When it comes to the subject of uploading my mind to a computer vs having nanobots slowly replace my brain cells, I feel like both have some major issues. I'll explain. If my mind is uploaded to a computer it doesn't do ME much good since it's just a copy of me and my physical self is still gonna die. On the other hand nanobots could slowly begin to replace my brain cells and form an enhanced version of my brain. On the surface this sounds better. But isn't this process actually killing me? Aren't I just creating another copy of myself? Only in this case the copy of me lives inside my skull instead of the Internet. Aren't I just creating an illusion of being preserved when in actuality I'm now dead and a mechanical replica has taken my place?

I'm interested to hear your thoughts on this.",9,2
1480,2016-4-16,2016,4,16,1,4exjte,Kazuyo Sejima is designing an invisible train,https://www.reddit.com/r/Futurology/comments/4exjte/kazuyo_sejima_is_designing_an_invisible_train/,Sulde,1460738284,,2,4
1481,2016-4-16,2016,4,16,1,4exk0g,This Company Just Introduced 20 Million People to Oculus Rift,https://www.reddit.com/r/Futurology/comments/4exk0g/this_company_just_introduced_20_million_people_to/,[deleted],1460738354,[deleted],0,0
1482,2016-4-16,2016,4,16,1,4exlyy,"Huawei enters the virtual reality fray with a new wearable headset that connects to your phone, similar to Gear VR",https://www.reddit.com/r/Futurology/comments/4exlyy/huawei_enters_the_virtual_reality_fray_with_a_new/,Yuli-Ban,1460739033,,2,5
1483,2016-4-16,2016,4,16,1,4exn9m,A Universal Basic Income Is the Utopia We Deserve,https://www.reddit.com/r/Futurology/comments/4exn9m/a_universal_basic_income_is_the_utopia_we_deserve/,[deleted],1460739464,[deleted],1,1
1484,2016-4-16,2016,4,16,2,4exns7,Beautiful 'Sea Trees' could be haven for nature in big cities,https://www.reddit.com/r/Futurology/comments/4exns7/beautiful_sea_trees_could_be_haven_for_nature_in/,HammeredandPantsless,1460739638,,28,141
1485,2016-4-16,2016,4,16,2,4exnyh,What would society look like with universal basic income?,https://www.reddit.com/r/Futurology/comments/4exnyh/what_would_society_look_like_with_universal_basic/,2noame,1460739695,,9,6
1486,2016-4-16,2016,4,16,2,4exp5x,Your packages could someday be delivered by a fleet of autonomous robots,https://www.reddit.com/r/Futurology/comments/4exp5x/your_packages_could_someday_be_delivered_by_a/,jjlew080,1460740120,,2,19
1487,2016-4-16,2016,4,16,2,4expfv,"A cheeky reporter asks Canadian PM Justin Trudeau whether he can explain Quantum Computing, gets owned",https://www.reddit.com/r/Futurology/comments/4expfv/a_cheeky_reporter_asks_canadian_pm_justin_trudeau/,bopollo,1460740219,,6,9
1488,2016-4-16,2016,4,16,2,4exun6,Custom-fit headphone with EEG and biosensing,https://www.reddit.com/r/Futurology/comments/4exun6/customfit_headphone_with_eeg_and_biosensing/,[deleted],1460742020,[deleted],1,1
1489,2016-4-16,2016,4,16,2,4exx3w,The VR idea maze,https://www.reddit.com/r/Futurology/comments/4exx3w/the_vr_idea_maze/,cryptoz,1460742871,,0,4
1490,2016-4-16,2016,4,16,3,4exy15,World's Strongest Material 'Carbyne' Is Possible To Mass Produce According to New Research,https://www.reddit.com/r/Futurology/comments/4exy15/worlds_strongest_material_carbyne_is_possible_to/,RA2lover,1460743200,,0,1
1491,2016-4-16,2016,4,16,3,4exyyd,Casts of the Future - cortex exoskeleton,https://www.reddit.com/r/Futurology/comments/4exyyd/casts_of_the_future_cortex_exoskeleton/,[deleted],1460743503,[deleted],0,2
1492,2016-4-16,2016,4,16,3,4ey3i5,LED's in your skin?,https://www.reddit.com/r/Futurology/comments/4ey3i5/leds_in_your_skin/,ninersteve,1460745060,,22,108
1493,2016-4-16,2016,4,16,3,4ey71u,"Meet Oscar, the reanimated meat from Modular Body",https://www.reddit.com/r/Futurology/comments/4ey71u/meet_oscar_the_reanimated_meat_from_modular_body/,CryoftheBanshee,1460746276,,13,10
1494,2016-4-16,2016,4,16,4,4ey8sb,"If the PUBLIC debt keeps growing in the future, America will be forced to evolve from a Capitalist money system into something else",https://www.reddit.com/r/Futurology/comments/4ey8sb/if_the_public_debt_keeps_growing_in_the_future/,IntelligenceIsReal,1460746877,"A Capitalist money system is simply a system where currency is bank notes that are primarily created out of PRIVATE debt.  Currency in a capitalist system supports private capital, private wealth, private property and private profits.  Government's role in such a system is to oversee the system and tax the private wealth/income to support activities that are more efficiently done by government like defense and the highway system.

However, since the near collapse of the Capitalist money system in 2007, more and more of the of America's Capital is being created out of PUBLIC efforts.  The National Debt is now above $19 Trillion creating Trillions of NEW bank notes/money in circulation supporting the current economic system.  And as the following link supports, the PUBLIC debt is growing rapidly.

http://www.usdebtclock.org/

Increasingly, as the PUBLIC DEBT grows, the economy is becoming more and more PUBLICLY capitalized.  In such a system where capital is PUBLIC, morally and logically, the capital should belong to the PUBLIC.

Consequently, in a PUBLICLY capitalized system like America is evolving into, concepts like Universal Basic Income not only make practical sense considering rapidly advancing technology, it is a natural outcome of a PUBLICLY CAPITALIZED economic system.",9,1
1495,2016-4-16,2016,4,16,5,4eykpn,Why All Central Planning Is Doomed To Fail In The Future,https://www.reddit.com/r/Futurology/comments/4eykpn/why_all_central_planning_is_doomed_to_fail_in_the/,IntelligenceIsReal,1460751104,,7,12
1496,2016-4-16,2016,4,16,5,4eyky3,Good news: automation already destroyed most of the jobs,https://www.reddit.com/r/Futurology/comments/4eyky3/good_news_automation_already_destroyed_most_of/,IntelligenceIsReal,1460751181,,13,10
1497,2016-4-16,2016,4,16,5,4eym87,An AI assistant that schedules meetings for you,https://www.reddit.com/r/Futurology/comments/4eym87/an_ai_assistant_that_schedules_meetings_for_you/,tresboston,1460751620,,0,4
1498,2016-4-16,2016,4,16,5,4eyrji,Canada's Prime Minister Justin Trudeau Explains Quantum Computing,https://www.reddit.com/r/Futurology/comments/4eyrji/canadas_prime_minister_justin_trudeau_explains/,johnmountain,1460753558,,3,6
1499,2016-4-16,2016,4,16,6,4eytup,Matchmaking Algorithms Are Unraveling the Causes of Rare Genetic Diseases,https://www.reddit.com/r/Futurology/comments/4eytup/matchmaking_algorithms_are_unraveling_the_causes/,PrimeMind,1460754429,,0,11
1500,2016-4-16,2016,4,16,6,4eyvyn,Neurostimulation Caps: Fitbit For Your Brain,https://www.reddit.com/r/Futurology/comments/4eyvyn/neurostimulation_caps_fitbit_for_your_brain/,[deleted],1460755227,[deleted],0,1
1501,2016-4-16,2016,4,16,6,4eyx3a,This artificial-intelligence algorithm can clean up pixelated video to make it look more realistic,https://www.reddit.com/r/Futurology/comments/4eyx3a/this_artificialintelligence_algorithm_can_clean/,b8561,1460755681,,11,53
1502,2016-4-16,2016,4,16,6,4eyz79,Emdrive thermal static test 02,https://www.reddit.com/r/Futurology/comments/4eyz79/emdrive_thermal_static_test_02/,Memetic1,1460756533,,19,30
1503,2016-4-16,2016,4,16,6,4eyz9q,Facebook Envisions Virtual Social Future,https://www.reddit.com/r/Futurology/comments/4eyz9q/facebook_envisions_virtual_social_future/,Bloomsey,1460756559,,0,2
1504,2016-4-16,2016,4,16,6,4eyzbl,"The Oculus Rift is an overwhelming disappointment, and might make you hurl",https://www.reddit.com/r/Futurology/comments/4eyzbl/the_oculus_rift_is_an_overwhelming_disappointment/,[deleted],1460756582,[deleted],15,3
1505,2016-4-16,2016,4,16,7,4ez2rk,Futurist Ray Kurzweil Predicts Solar Industry Dominance In 12 Years Trajectories Are Exponential,https://www.reddit.com/r/Futurology/comments/4ez2rk/futurist_ray_kurzweil_predicts_solar_industry/,slev7n,1460757996,,21,103
1506,2016-4-16,2016,4,16,7,4ez6zf,Stem Cell Technique Could Regenerate Any Human Tissue Damaged By Aging or Disease,https://www.reddit.com/r/Futurology/comments/4ez6zf/stem_cell_technique_could_regenerate_any_human/,kkoolook,1460759678,,182,994
1507,2016-4-16,2016,4,16,7,4ez8d0,"Googles Smart Contacts Analyze Your Tears, Augment Your Reality",https://www.reddit.com/r/Futurology/comments/4ez8d0/googles_smart_contacts_analyze_your_tears_augment/,[deleted],1460760247,[deleted],0,1
1508,2016-4-16,2016,4,16,7,4ez9rj,"Fossil fuels could be phased out worldwide in a decade, says new study",https://www.reddit.com/r/Futurology/comments/4ez9rj/fossil_fuels_could_be_phased_out_worldwide_in_a/,[deleted],1460760817,[deleted],2,1
1509,2016-4-16,2016,4,16,8,4ezd9b,A New Map for America - An interesting take on removing the artificial borders created by US states in the interest of more pragmatic connections,https://www.reddit.com/r/Futurology/comments/4ezd9b/a_new_map_for_america_an_interesting_take_on/,Jedi_Helen_Keller,1460762262,,1,0
1510,2016-4-16,2016,4,16,8,4ezdzd,Superconductor Nearing Room Temp | EE Times,https://www.reddit.com/r/Futurology/comments/4ezdzd/superconductor_nearing_room_temp_ee_times/,BlaineMiller,1460762545,,2,37
1511,2016-4-16,2016,4,16,8,4ezhtk,New phenomena in the ultrasonic scattering in nanofluids,https://www.reddit.com/r/Futurology/comments/4ezhtk/new_phenomena_in_the_ultrasonic_scattering_in/,Ham686,1460764133,,0,5
1512,2016-4-16,2016,4,16,8,4ezi6r,A New Map for America,https://www.reddit.com/r/Futurology/comments/4ezi6r/a_new_map_for_america/,pilgrimboy,1460764293,,1,1
1513,2016-4-16,2016,4,16,8,4ezich,Google Is Working on a Wireless Home Internet Service So You Can Dump Comcast,https://www.reddit.com/r/Futurology/comments/4ezich/google_is_working_on_a_wireless_home_internet/,Orangutan,1460764362,,708,5518
1514,2016-4-16,2016,4,16,8,4ezide,Phosphorene as a promising anchoring material for lithium-sulfur batteries,https://www.reddit.com/r/Futurology/comments/4ezide/phosphorene_as_a_promising_anchoring_material_for/,Ham686,1460764372,,0,18
1515,2016-4-16,2016,4,16,8,4ezj3z,Seafood made from plants to be available in eight months,https://www.reddit.com/r/Futurology/comments/4ezj3z/seafood_made_from_plants_to_be_available_in_eight/,Arzu1982,1460764680,,10,58
1516,2016-4-16,2016,4,16,9,4ezjnb,"Fossil fuels could be phased out worldwide in a decade, says new study",https://www.reddit.com/r/Futurology/comments/4ezjnb/fossil_fuels_could_be_phased_out_worldwide_in_a/,Arzu1982,1460764909,,20,120
1517,2016-4-16,2016,4,16,9,4ezm6k,"New interactive ""robot goddess"" unveiled in east China",https://www.reddit.com/r/Futurology/comments/4ezm6k/new_interactive_robot_goddess_unveiled_in_east/,only1allowed,1460765953,,3,17
1518,2016-4-16,2016,4,16,9,4ezmu1,"The Rise of A.I., Shifting Economies, and Corporate Consciousness Will Define the Future",https://www.reddit.com/r/Futurology/comments/4ezmu1/the_rise_of_ai_shifting_economies_and_corporate/,mind_bomber,1460766254,,1,11
1519,2016-4-16,2016,4,16,10,4ezt1g,A simple and efficient 3-D fabrication technique for bio-inspired hierarchical structures,https://www.reddit.com/r/Futurology/comments/4ezt1g/a_simple_and_efficient_3d_fabrication_technique/,mememeeeeee,1460769097,,0,12
1520,2016-4-16,2016,4,16,10,4ezyeq,"Is The Swallow Frightened In The Storm? ""Until now we have known almost nothing of animals behave in the wild. For better or worse, the Animal Internet is about to change that. Tracking devices and sensors will enable us to surveil animals as closely as we surveil one another.""",https://www.reddit.com/r/Futurology/comments/4ezyeq/is_the_swallow_frightened_in_the_storm_until_now/,mjk1093,1460771539,,0,5
1521,2016-4-16,2016,4,16,11,4f02i1,Is it okay for a company to threaten someone during an interview? True story.,https://www.reddit.com/r/Futurology/comments/4f02i1/is_it_okay_for_a_company_to_threaten_someone/,doodidier,1460773488,[removed],0,0
1522,2016-4-16,2016,4,16,11,4f03ar,Check Out the Autodesk looks to future of 3D printing #MadeTheHeadline #Autodesk #3DPrinting #MTH,https://www.reddit.com/r/Futurology/comments/4f03ar/check_out_the_autodesk_looks_to_future_of_3d/,madetheheadline,1460773868,,0,1
1523,2016-4-16,2016,4,16,11,4f0511,This Guy Wants to Rearrange the U.S. Into Seven Mega Regions...I'd Like to Hear the r/Futurology Opinions,https://www.reddit.com/r/Futurology/comments/4f0511/this_guy_wants_to_rearrange_the_us_into_seven/,donedealio,1460774655,,4,8
1524,2016-4-16,2016,4,16,12,4f07qd,"Alphabet Is Plotting A Digital City Full Of Google Cars, High-Speed Internet And Maybe More",https://www.reddit.com/r/Futurology/comments/4f07qd/alphabet_is_plotting_a_digital_city_full_of/,Mynameis__--__,1460775979,,8,80
1525,2016-4-16,2016,4,16,12,4f093y,To change the face of human psychology completely,https://www.reddit.com/r/Futurology/comments/4f093y/to_change_the_face_of_human_psychology_completely/,OOBEJuanKenobi,1460776703,[removed],0,1
1526,2016-4-16,2016,4,16,13,4f0ep4,"All Prior Art is a project attempting to algorithmically create and publicly publish all possible new prior art, thereby making the published concepts not patent-able. The concept is to democratize ideas, provide an impetus for change in the patent system.",https://www.reddit.com/r/Futurology/comments/4f0ep4/all_prior_art_is_a_project_attempting_to/,misnamed,1460779641,,1,15
1527,2016-4-16,2016,4,16,13,4f0eqy,Teslaphoresis: Controlled assembly of nanomaterials from the bottom up could be useful in applications including regenerative medicine where the nanotubes would act as nerves as well as fabricating electronic circuits without touching them.,https://www.reddit.com/r/Futurology/comments/4f0eqy/teslaphoresis_controlled_assembly_of/,candiedbug,1460779667,,0,16
1528,2016-4-16,2016,4,16,13,4f0g16,"BMW Enhances Partnership With GoPro, Integrating Cameras For App",https://www.reddit.com/r/Futurology/comments/4f0g16/bmw_enhances_partnership_with_gopro_integrating/,California254,1460780389,,0,2
1529,2016-4-16,2016,4,16,14,4f0o00,Is Amazons Dome Headquarters The Workspace Of The Future?,https://www.reddit.com/r/Futurology/comments/4f0o00/is_amazons_dome_headquarters_the_workspace_of_the/,Daniel4780,1460784886,,0,5
1530,2016-4-16,2016,4,16,14,4f0ojq,Samsung Reportedly Supplies Apple with 100 Million OLED Displays Starting 2017,https://www.reddit.com/r/Futurology/comments/4f0ojq/samsung_reportedly_supplies_apple_with_100/,AniasWare,1460785200,,1,2
1531,2016-4-16,2016,4,16,15,4f0vw0,Instagram follow me @domalexander28,https://www.reddit.com/r/Futurology/comments/4f0vw0/instagram_follow_me_domalexander28/,Domalexander28,1460789844,[removed],1,1
1532,2016-4-16,2016,4,16,16,4f0xll,Top 10 New Future Inventions - 2020 - 2050,https://www.reddit.com/r/Futurology/comments/4f0xll/top_10_new_future_inventions_2020_2050/,[deleted],1460790987,[deleted],1,1
1533,2016-4-16,2016,4,16,16,4f104o,Could Google or Apple create their own country?,https://www.reddit.com/r/Futurology/comments/4f104o/could_google_or_apple_create_their_own_country/,thedoodnz,1460792766,"A country doesn't have to be huge (japan or new zealand are roughly the size of colorado).  There is a hell of a lot of unused land out there, I suspect for the right amount a large tech company could purchase a 100,000 square mile block of land for what 25 billion or so?  That's nothing.  They could then use their additional resources to form a country.  They could use 3D building technology to scale it up.  The first citizens would be employees and the rest would follow.  I would migrate to a tech oriented country where technology, health, longevity are the priorities in their way of life.  It could be a country of clean living, self driving cars, very futuristic and utopia like.  Thoughts?",26,26
1534,2016-4-16,2016,4,16,16,4f10kn,We may have found a Dark Matter Galaxy.,https://www.reddit.com/r/Futurology/comments/4f10kn/we_may_have_found_a_dark_matter_galaxy/,[deleted],1460793085,[deleted],1,6
1535,2016-4-16,2016,4,16,17,4f14xc,H+ Weekly - Issue #45,https://www.reddit.com/r/Futurology/comments/4f14xc/h_weekly_issue_45/,evilcat1337,1460796413,,1,1
1536,2016-4-16,2016,4,16,17,4f15je,"10 minutes to see future world here, NewBorn Technology",https://www.reddit.com/r/Futurology/comments/4f15je/10_minutes_to_see_future_world_here_newborn/,DeviGorn,1460796865,,0,0
1537,2016-4-16,2016,4,16,18,4f16ek,China plans to dominate clean tech race,https://www.reddit.com/r/Futurology/comments/4f16ek/china_plans_to_dominate_clean_tech_race/,Buck-Nasty,1460797506,,11,41
1538,2016-4-16,2016,4,16,18,4f170o,Researchers at Columbia University develop flexible sheet camera,https://www.reddit.com/r/Futurology/comments/4f170o/researchers_at_columbia_university_develop/,onthezenith,1460797980,,0,1
