,date,year,month,day,hour,id,title,full_link,author,created,selftext,num_comments,score
1488,2017-11-16,2017,11,16,6,7d7h6q,What will be left to do - and what is worth learning?,https://www.reddit.com/r/Futurology/comments/7d7h6q/what_will_be_left_to_do_and_what_is_worth_learning/,ScientiaOmnisEst,1510782127,"Technological unemployment scares the heck out of me; now and them someone can placate me by saying it's a long way off or speculations never pan out, futurists are idiots, etc...but it never sticks and I don't know who to trust. So, might as well ask the people who keep their ears to the tech wall:

1. Seriously, what will a post-human-work future look like? I mean one where even research, programming, medicine, personal service, and all creative endeavors are done by AI. They do it better, do it faster, and there's little room for humans to do anything. There's nothing worth doing. I tried to discuss this in the past and had someone slam me with a lot of nihilistic BS, how my existential anxiety is stupid and delusional, there's no Meaning and AI won't change that - when my whole point is how do you do carve out a worthwhile life when there's *nothing worth doing*? When everything that can be done, has, or is done with no effort or process to enjoy?
One thing I banked on as a ""future endeavor"", something really cool for society to do and that could lead to so much was space travel and colonization. Except now I think we'll probably just have drones do it all and AI manage it, and seriously, what's the point of going to another planet to sit in your apartment consuming media - presumably the only thing left to do. Seriously, what will we do? Where will we redirect our sense of value? Assuming life is okay and we're not struggling to survive, we'll likely do this naturally, but I can't even speculate. And I can say from experience, that gets boring after a while, which leads to my other question. 

2. In a practical sense, what's the most ""future-resistant"" area of study. I know it's STEM, but what areas? I'm already hopelessly stupid, I failed several STEM gen-eds multiple times. But if I could work a miracle and not fail at them again, I kept thinking I wanted to go into engineering. For whatever reason it sounded like that's where the interesting projects are (and that mentality is partly what fuels my whole existential issue. Nothing worth doing, no interesting projects to get involved in, and I'm not smart enough to invent my own). I've never tried programming mostly due to knowing I'll fail, but, like engineering, it seems that's on its way out from automation too. Maybe something in the humanities? Not smart enough to make it to a high level, and will probably be automated. I've toyed with the idea of business, but apparently financial skills are unnecessary with programs now. Plus business is tanking, and I'm unfortunately not an idea person. I'm just getting by on crappy jobs now, but I'm bored, I'm frustrated, and I have no idea where to apply myself. If I'm part of the last working generation, the last generation to do things and be involved in things before it's all ceded to AI, I'd like to not miss too much.

Holy wall of text Batman, I didn't mean for this to be so long. Advice appreciated nonetheless.",18,2
1489,2017-11-16,2017,11,16,6,7d7jlz,How Driverless Cars Will Change the Feel of Cities,https://www.reddit.com/r/Futurology/comments/7d7jlz/how_driverless_cars_will_change_the_feel_of_cities/,nliausacmmv,1510782700,,0,2
1490,2017-11-16,2017,11,16,6,7d7jp7,Anyone interested in this premium domain??,https://www.reddit.com/r/Futurology/comments/7d7jp7/anyone_interested_in_this_premium_domain/,Anza99,1510782727,,1,0
1491,2017-11-16,2017,11,16,7,7d7t5l,What will technology really be like in 2049?,https://www.reddit.com/r/Futurology/comments/7d7t5l/what_will_technology_really_be_like_in_2049/,[deleted],1510785025,[deleted],0,0
1492,2017-11-16,2017,11,16,7,7d7war,You can now conduct an Ultrasound with your smartphone - pointers to a future of self-direct medicine,https://www.reddit.com/r/Futurology/comments/7d7war/you_can_now_conduct_an_ultrasound_with_your/,AmericanNestar,1510785840,,0,1
1493,2017-11-16,2017,11,16,7,7d7xyx,"Elon Musk: Inventor's Plans for Outer Space, Cars, Finding Love",https://www.reddit.com/r/Futurology/comments/7d7xyx/elon_musk_inventors_plans_for_outer_space_cars/,vulcangreen,1510786249,,6,14
1494,2017-11-16,2017,11,16,7,7d7z0i,Ads Of The Future - The New Way For Businesses To Increase Revenue With Crypto Mining,https://www.reddit.com/r/Futurology/comments/7d7z0i/ads_of_the_future_the_new_way_for_businesses_to/,Odins3,1510786513,,0,0
1495,2017-11-16,2017,11,16,7,7d7zqe,Future of Highways?,https://www.reddit.com/r/Futurology/comments/7d7zqe/future_of_highways/,Chispy,1510786695,"I was standing outside a highway earlier today and was mesmerized at the thought of how the concept of the highway has evolved over the last 100 years and how drastically it's slated to change with exponential technologies like AI, Robotics, Solar, Mixed Reality, and Electric Vehicles

How do you forsee highways changing in the next 10-20 years with the advent of self-driving (and self-flying) vehicles? Do you think laws will keep em pretty much the same or will we see radical evolution?",7,3
1496,2017-11-16,2017,11,16,8,7d86kx,This $5 Billion Startup Made Its First Cancer VaccineFor Just One Person,https://www.reddit.com/r/Futurology/comments/7d86kx/this_5_billion_startup_made_its_first_cancer/,justcubes,1510788387,,11,45
1497,2017-11-16,2017,11,16,8,7d88jt,Rebar robot ties steel for fast construction,https://www.reddit.com/r/Futurology/comments/7d88jt/rebar_robot_ties_steel_for_fast_construction/,Smasborgen,1510788937,,9,24
1498,2017-11-16,2017,11,16,9,7d8i4i,"Meet SAM, the artificially intelligent politician",https://www.reddit.com/r/Futurology/comments/7d8i4i/meet_sam_the_artificially_intelligent_politician/,[deleted],1510791397,[deleted],0,1
1499,2017-11-16,2017,11,16,9,7d8lp5,"In a Major First, Scientists Edit DNA Within the Human Body",https://www.reddit.com/r/Futurology/comments/7d8lp5/in_a_major_first_scientists_edit_dna_within_the/,eggn00dles,1510792302,,1,1
1500,2017-11-16,2017,11,16,10,7d8tx3,Another billionaire is actually buying thousands of acres in Vermont to build a smart city,https://www.reddit.com/r/Futurology/comments/7d8tx3/another_billionaire_is_actually_buying_thousands/,unused_xbox,1510794507,,3,9
1501,2017-11-16,2017,11,16,10,7d8z07,Jordan Peterson on Universal Basic Income - JRE podcast,https://www.reddit.com/r/Futurology/comments/7d8z07/jordan_peterson_on_universal_basic_income_jre/,lnclincoln,1510795931,,14,0
1502,2017-11-16,2017,11,16,10,7d92dw,First in vivo gene editing in humans ever..the future has started,https://www.reddit.com/r/Futurology/comments/7d92dw/first_in_vivo_gene_editing_in_humans_everthe/,spaddy11,1510796849,,4,5
1503,2017-11-16,2017,11,16,10,7d94la,"Misleading by ""telling the truth"" is so pervasive in daily life that a new term has recently been coined to describe it: paltering. That it is so widespread in society now gives us more insight into the grey area between truth and lies",https://www.reddit.com/r/Futurology/comments/7d94la/misleading_by_telling_the_truth_is_so_pervasive/,[deleted],1510797452,[deleted],0,0
1504,2017-11-16,2017,11,16,11,7d98zl,"Misleading by ""telling the truth"" is so pervasive in daily life that a new term has recently been coined to describe it: paltering. That it is so widespread in society now gives us more insight into the grey area between truth and lies",https://www.reddit.com/r/Futurology/comments/7d98zl/misleading_by_telling_the_truth_is_so_pervasive/,AkivaLane,1510798677,,5,8
1505,2017-11-16,2017,11,16,12,7d9jb1,Free Money: The Surprising Effects of a Basic Income Supplied by Government,https://www.reddit.com/r/Futurology/comments/7d9jb1/free_money_the_surprising_effects_of_a_basic/,[deleted],1510801660,[deleted],1,2
1506,2017-11-16,2017,11,16,12,7d9kw8,"Worlds First Floating City To Emerge In The Pacific Ocean By 2020, And Heres How The Life Will Look On It",https://www.reddit.com/r/Futurology/comments/7d9kw8/worlds_first_floating_city_to_emerge_in_the/,taipingshan,1510802138,,13,22
1507,2017-11-16,2017,11,16,12,7d9rv7,First self driving bus in NSW!,https://www.reddit.com/r/Futurology/comments/7d9rv7/first_self_driving_bus_in_nsw/,[deleted],1510804218,[deleted],0,1
1508,2017-11-16,2017,11,16,12,7d9s7r,"Meet Quitty - a bot to help you quit your job. Will you choose the ""go down in burning flames"" option?",https://www.reddit.com/r/Futurology/comments/7d9s7r/meet_quitty_a_bot_to_help_you_quit_your_job_will/,Obmm1,1510804324,,0,1
1509,2017-11-16,2017,11,16,12,7d9t91,The Imminent Digital Exile,https://www.reddit.com/r/Futurology/comments/7d9t91/the_imminent_digital_exile/,asmj,1510804640,,0,1
1510,2017-11-16,2017,11,16,13,7d9twb,Einstein's spacetime doesn't exist!!!,https://www.reddit.com/r/Futurology/comments/7d9twb/einsteins_spacetime_doesnt_exist/,ajps2hotmailcom,1510804841,,0,1
1511,2017-11-16,2017,11,16,13,7d9vgx,Elon Musk says the Tesla Semi will blow your mind out of your skull - Live stream tomorrow at 8!,https://www.reddit.com/r/Futurology/comments/7d9vgx/elon_musk_says_the_tesla_semi_will_blow_your_mind/,Jodslife,1510805298,,1,1
1512,2017-11-16,2017,11,16,13,7d9vpg,"A gene variant that arose decades ago in an Amish group seems to be enough to make people live ten years longer, as well as making them less likely to develop diabetes.",https://www.reddit.com/r/Futurology/comments/7d9vpg/a_gene_variant_that_arose_decades_ago_in_an_amish/,maxwellhill,1510805360,,12,31
1513,2017-11-16,2017,11,16,13,7d9xsn,We've just found a nearby exoplanet that could be right for life,https://www.reddit.com/r/Futurology/comments/7d9xsn/weve_just_found_a_nearby_exoplanet_that_could_be/,Fallcious,1510805967,,19,41
1514,2017-11-16,2017,11,16,13,7da3js,Google to build Artificial Intelligence Programming that will build another AI,https://www.reddit.com/r/Futurology/comments/7da3js/google_to_build_artificial_intelligence/,neutron1814,1510807760,,30,53
1515,2017-11-16,2017,11,16,14,7da8n2,A Quick Rundown On Ross 128 b (EARTH LIKE PLANET) Finally discovered close to us !,https://www.reddit.com/r/Futurology/comments/7da8n2/a_quick_rundown_on_ross_128_b_earth_like_planet/,[deleted],1510809377,[deleted],0,0
1516,2017-11-16,2017,11,16,14,7daa06,China fires up next-generation neutron-science facility,https://www.reddit.com/r/Futurology/comments/7daa06/china_fires_up_nextgeneration_neutronscience/,[deleted],1510809828,[deleted],0,0
1517,2017-11-16,2017,11,16,14,7daab7,introducing R,https://www.reddit.com/r/Futurology/comments/7daab7/introducing_r/,9-NINE-9,1510809929,,4,0
1518,2017-11-16,2017,11,16,14,7dac1b,Forecasts for the New World Order of 2030,https://www.reddit.com/r/Futurology/comments/7dac1b/forecasts_for_the_new_world_order_of_2030/,[deleted],1510810523,[deleted],0,0
1519,2017-11-16,2017,11,16,15,7daldy,Self-Driving Mobile Living Rooms: 10 Car Concepts for the Next 50 Years,https://www.reddit.com/r/Futurology/comments/7daldy/selfdriving_mobile_living_rooms_10_car_concepts/,misnamed,1510813739,,5,11
1520,2017-11-16,2017,11,16,15,7dalet,Check out this amazing canvas art!,https://www.reddit.com/r/Futurology/comments/7dalet/check_out_this_amazing_canvas_art/,GraffitiJunkies,1510813749,,0,1
1521,2017-11-16,2017,11,16,15,7daox2,"Nikola Motor Company Chooses Nel Hydrogen As The Sole Equipment Supplier To Create The Largest Hydrogen Network In The World Covering Over 2,000 Miles And 16 Stations",https://www.reddit.com/r/Futurology/comments/7daox2/nikola_motor_company_chooses_nel_hydrogen_as_the/,chopchopped,1510815115,,3,2
1522,2017-11-16,2017,11,16,15,7dap4o,Tim Berners-Lee on the future of the web: 'The system is failing',https://www.reddit.com/r/Futurology/comments/7dap4o/tim_bernerslee_on_the_future_of_the_web_the/,Benjaminsen,1510815197,,42,48
1523,2017-11-16,2017,11,16,15,7dapep,Packers and Movers in Hyderabad - 100% Safe &amp; Reliable Service.,https://www.reddit.com/r/Futurology/comments/7dapep/packers_and_movers_in_hyderabad_100_safe_reliable/,Gajemeena,1510815302,,1,1
1524,2017-11-16,2017,11,16,16,7daxd3,Futurist Ray Kurzweil discusses the Future of AI and its Impact on Society,https://www.reddit.com/r/Futurology/comments/7daxd3/futurist_ray_kurzweil_discusses_the_future_of_ai/,[deleted],1510818385,[deleted],0,1
1525,2017-11-16,2017,11,16,16,7dayua,Futurist Ray Kurzweil discusses the Future of AI and its Impact on Society (60 min),https://www.reddit.com/r/Futurology/comments/7dayua/futurist_ray_kurzweil_discusses_the_future_of_ai/,onegoofy,1510818997,,1,2
1526,2017-11-16,2017,11,16,17,7db2wk,Its Time to Tax Companies for Using Our Personal Data,https://www.reddit.com/r/Futurology/comments/7db2wk/its_time_to_tax_companies_for_using_our_personal/,stormforce7916,1510820748,,0,3
1527,2017-11-16,2017,11,16,17,7db3vm,Scientists make first attempt at gene-editing on a live patient: A patient with a genetic defect had their DNA permanently edited through a new and experimental gene therapy technique.,https://www.reddit.com/r/Futurology/comments/7db3vm/scientists_make_first_attempt_at_geneediting_on_a/,madazzahatter,1510821188,,1,1
1528,2017-11-16,2017,11,16,17,7db47x,Trump Tax Plan Gives Jobs Away to Robots and Will Increase Unemployment,https://www.reddit.com/r/Futurology/comments/7db47x/trump_tax_plan_gives_jobs_away_to_robots_and_will/,[deleted],1510821355,[deleted],0,0
1529,2017-11-16,2017,11,16,17,7db4mg,Microsoft Pledges To Cut Emissions By 75% By 2030,https://www.reddit.com/r/Futurology/comments/7db4mg/microsoft_pledges_to_cut_emissions_by_75_by_2030/,mvea,1510821525,,1,17
1530,2017-11-16,2017,11,16,17,7db7b6,"Customized Retail Data(APIs) , Gain deeper insights into your competitive landscape",https://www.reddit.com/r/Futurology/comments/7db7b6/customized_retail_dataapis_gain_deeper_insights/,Fridajon,1510822692,,1,1
1531,2017-11-16,2017,11,16,18,7db7qe,"Jobs you may have thought safe from automation, like mortgage brokers or paralegals, may soon be replaced by intelligent software",https://www.reddit.com/r/Futurology/comments/7db7qe/jobs_you_may_have_thought_safe_from_automation/,Mrleibniz,1510822850,,22,21
1532,2017-11-16,2017,11,16,18,7dba8t,It's just a LOL,https://www.reddit.com/r/Futurology/comments/7dba8t/its_just_a_lol/,MindGate_tm,1510823941,[removed],15,0
1533,2017-11-16,2017,11,16,18,7dbb0y,HIV Aids Research and Herbal Medication - Its possible to cure HIV,https://www.reddit.com/r/Futurology/comments/7dbb0y/hiv_aids_research_and_herbal_medication_its/,faizifm,1510824266,,1,0
1534,2017-11-16,2017,11,16,18,7dbcnz,"Thousands to benefit as 'breakthrough' breast cancer drugs approved for NHS use: Annually, 8,000 women in England with previously untreatable advanced breast cancer will have access to drugs shown to slow diseases progression.",https://www.reddit.com/r/Futurology/comments/7dbcnz/thousands_to_benefit_as_breakthrough_breast/,madazzahatter,1510825012,,1,13
1535,2017-11-16,2017,11,16,18,7dbfi6,"Europe steps in to cover US shortfall in funding climate science: ""These international interconnections will be aimed at utilising renewables most efficiently across our continent, throughout the EU""",https://www.reddit.com/r/Futurology/comments/7dbfi6/europe_steps_in_to_cover_us_shortfall_in_funding/,[deleted],1510826274,[deleted],0,5
1536,2017-11-16,2017,11,16,19,7dbhzw,o hn th tn dng HSBC  Rt tin th tn dng,https://www.reddit.com/r/Futurology/comments/7dbhzw/o_hn_th_tn_dng_hsbc_rt_tin_th_tn_dng/,huyenmit2b,1510827295,,0,1
1537,2017-11-16,2017,11,16,19,7dbjqw,Bananapocalypse: genetic modification may save $12bn industry - Researchers in Queensland modify Cavendish bananas to protect them from devastating Panama disease fungus,https://www.reddit.com/r/Futurology/comments/7dbjqw/bananapocalypse_genetic_modification_may_save/,[deleted],1510828003,[deleted],0,0
1538,2017-11-16,2017,11,16,19,7dbkpx,o hn th tn dng Maritime Bank,https://www.reddit.com/r/Futurology/comments/7dbkpx/o_hn_th_tn_dng_maritime_bank/,huyenmit2b,1510828431,,0,1
1539,2017-11-16,2017,11,16,19,7dbmkl,Volkswagen announces $12 billion effort to bring 40 new electric cars to China - by 2025,https://www.reddit.com/r/Futurology/comments/7dbmkl/volkswagen_announces_12_billion_effort_to_bring/,[deleted],1510829211,[deleted],0,1
1540,2017-11-16,2017,11,16,19,7dbmo4,"An Architect Made Floating Homes, And They Are Hurricane-Proof",https://www.reddit.com/r/Futurology/comments/7dbmo4/an_architect_made_floating_homes_and_they_are/,hSysErr06p,1510829251,,0,1
1541,2017-11-16,2017,11,16,19,7dbmpq,Volkswagen announces $12 billion effort to bring 40 new electric cars to China - by 2025,https://www.reddit.com/r/Futurology/comments/7dbmpq/volkswagen_announces_12_billion_effort_to_bring/,[deleted],1510829273,[deleted],2,10
1542,2017-11-16,2017,11,16,20,7dbs3t,First gene-editing in human body attempt,https://www.reddit.com/r/Futurology/comments/7dbs3t/first_geneediting_in_human_body_attempt/,zbot16,1510831494,,1,1
1543,2017-11-16,2017,11,16,20,7dbtsh,We just sent a message to try to talk to aliens on another world: Astronomers have sent a radio message to a neighbouring star system  one of the closest known to contain a potentially habitable planet  and its nearby enough that we could receive a reply in less than 25 years.,https://www.reddit.com/r/Futurology/comments/7dbtsh/we_just_sent_a_message_to_try_to_talk_to_aliens/,mvea,1510832165,,1984,17193
1544,2017-11-16,2017,11,16,20,7dbutr,Can an autonomous sailboat cross the Atlantic? Sailing a boat across the Atlantic is challenging enough for a human sailor. But what about a computer? BBC Future visits a sailing regatta for robots,https://www.reddit.com/r/Futurology/comments/7dbutr/can_an_autonomous_sailboat_cross_the_atlantic/,[deleted],1510832570,[deleted],1,3
1545,2017-11-16,2017,11,16,20,7dbvy4,"George Church Will Make Virus-Proof Organisms, Transplant Pig Organs to Humans, and Reverse Aging",https://www.reddit.com/r/Futurology/comments/7dbvy4/george_church_will_make_virusproof_organisms/,[deleted],1510833033,[deleted],0,0
1546,2017-11-16,2017,11,16,20,7dbwr9,Iranian saffron,https://www.reddit.com/r/Futurology/comments/7dbwr9/iranian_saffron/,rajeshseo50,1510833366,,1,1
1547,2017-11-16,2017,11,16,21,7dbyf0,"Cool Airbus Vahana Project Is Ready For Flight Testing - claims it wont need a runway, will be self-piloted, and can automatically detect and avoid obstacles and other aircraft... full-size prototype before the end of 2017 with a productizable demonstrator by 2020, and so far, it is on target",https://www.reddit.com/r/Futurology/comments/7dbyf0/cool_airbus_vahana_project_is_ready_for_flight/,[deleted],1510833950,[deleted],0,9
1548,2017-11-16,2017,11,16,21,7dbypg,Denmark revives goal to be coal free by 2030 at UN climate summit,https://www.reddit.com/r/Futurology/comments/7dbypg/denmark_revives_goal_to_be_coal_free_by_2030_at/,mvea,1510834063,,0,92
1549,2017-11-16,2017,11,16,21,7dbzu1,"Scientists create three-eyed beetle to help unlock secrets of human body: Interfering with a gene results in significant changes in the beetles anatomy, with implications for the development of human organs for transplantation.",https://www.reddit.com/r/Futurology/comments/7dbzu1/scientists_create_threeeyed_beetle_to_help_unlock/,madazzahatter,1510834462,,1,0
1550,2017-11-16,2017,11,16,21,7dc5iv,"A Cutting-Edge Technique Allows MIT Scientists to Control Individual Neurons in the Brain: 'If only we could see exactly how the neurons in our brain affect behavior, we could cure psychological illnesses and disorders like Alzheimers or Parkinsons.'",https://www.reddit.com/r/Futurology/comments/7dc5iv/a_cuttingedge_technique_allows_mit_scientists_to/,maxwellhill,1510836452,,17,73
1551,2017-11-16,2017,11,16,22,7dc9gv,Way of the Future  AI's First Church,https://www.reddit.com/r/Futurology/comments/7dc9gv/way_of_the_future_ais_first_church/,PrivacyPolicy2016,1510837710,,1,2
1552,2017-11-16,2017,11,16,22,7dcatt,Transplanting wild microbes from healthy related plants can make a native Hawaiian plant healthier and likelier to survive in wild according to new research from the Amend Laboratory in the University of Hawaii at Mnoa botany department and the Oahu Army Natural Resources Program (OANRP).,https://www.reddit.com/r/Futurology/comments/7dcatt/transplanting_wild_microbes_from_healthy_related/,madazzahatter,1510838118,,0,14
1553,2017-11-16,2017,11,16,22,7dcbq0,"Sun, wind and water: Africa's renewable energy set to soar by 2022 | driving cumulative capacity up more than 70 percent in the next five years",https://www.reddit.com/r/Futurology/comments/7dcbq0/sun_wind_and_water_africas_renewable_energy_set/,pnewell,1510838394,,0,6
1554,2017-11-16,2017,11,16,22,7dcjqy,"Twenty countries join global alliance to phase out coal by 2030. The alliance includes Angola, Austria, Belgium, Britain, Canada, Costa Rica, Denmark, El Salvador, Fiji, Finland, France, Italy, Luxembourg, the Marshall Islands, Mexico, the Netherlands, New Zealand, Niue, Portugal and Switzerland",https://www.reddit.com/r/Futurology/comments/7dcjqy/twenty_countries_join_global_alliance_to_phase/,pnewell,1510840788,,22,226
1555,2017-11-16,2017,11,16,23,7dcklf,"Germany and Britain will provide a combined $153 million to expand programs to fight climate change and deforestation in the Amazon rainforest, according to a statement from the Brazilian government on Tuesday.",https://www.reddit.com/r/Futurology/comments/7dcklf/germany_and_britain_will_provide_a_combined_153/,madazzahatter,1510841009,,2,10
1556,2017-11-16,2017,11,16,23,7dcl13,The power of a living medicine: Gene therapy creates replacement skin to save a dying boy,https://www.reddit.com/r/Futurology/comments/7dcl13/the_power_of_a_living_medicine_gene_therapy/,SirT6,1510841142,,4,252
1557,2017-11-16,2017,11,16,23,7dcmh8,Tesla reveal electric semi truck tomorrow | NextBigFuture.com,https://www.reddit.com/r/Futurology/comments/7dcmh8/tesla_reveal_electric_semi_truck_tomorrow/,[deleted],1510841530,[deleted],0,1
1558,2017-11-16,2017,11,16,23,7dcml8,Tesla reveal electric semi truck tomorrow,https://www.reddit.com/r/Futurology/comments/7dcml8/tesla_reveal_electric_semi_truck_tomorrow/,izumi3682,1510841561,,90,769
1559,2017-11-16,2017,11,16,23,7dcmzs,"21st century peace from aging populations, debt, pension and medical costs",https://www.reddit.com/r/Futurology/comments/7dcmzs/21st_century_peace_from_aging_populations_debt/,izumi3682,1510841677,,2,5
1560,2017-11-16,2017,11,16,23,7dcu4p,Floating buildings made from recycled plastic bottles designed to protect from storms,https://www.reddit.com/r/Futurology/comments/7dcu4p/floating_buildings_made_from_recycled_plastic/,Portis403,1510843671,,1,10
1561,2017-11-17,2017,11,17,0,7dcx7w,"Asgardia, the world's first 'space nation'",https://www.reddit.com/r/Futurology/comments/7dcx7w/asgardia_the_worlds_first_space_nation/,fingerguns_pew_pew,1510844478,,15,58
1562,2017-11-17,2017,11,17,0,7dcxo6,Habitable Planet Reality Check: The Nearby Ross 128,https://www.reddit.com/r/Futurology/comments/7dcxo6/habitable_planet_reality_check_the_nearby_ross_128/,Galileos_grandson,1510844591,,1,4
1563,2017-11-17,2017,11,17,0,7dcy4d,Automation will impact the global workforce in 2018 | ZDNet,https://www.reddit.com/r/Futurology/comments/7dcy4d/automation_will_impact_the_global_workforce_in/,gone_his_own_way,1510844687,,1,0
1564,2017-11-17,2017,11,17,0,7dcycr,"Big changes are coming to banks, and 'not in onesies and twosies,' Morgan Stanley CEO says - Despite that, the banking industry is not the sector most affected by automation presently, he added",https://www.reddit.com/r/Futurology/comments/7dcycr/big_changes_are_coming_to_banks_and_not_in/,gone_his_own_way,1510844753,,1,16
1565,2017-11-17,2017,11,17,0,7dcydd,Design Thinking Is Your Secret Weapon for Building a Greater Good,https://www.reddit.com/r/Futurology/comments/7dcydd/design_thinking_is_your_secret_weapon_for/,dwaxe,1510844757,,0,3
1566,2017-11-17,2017,11,17,0,7dcyo7,Why Decentralized Artificial Intelligence Will Reinvent The Industry As We Know It,https://www.reddit.com/r/Futurology/comments/7dcyo7/why_decentralized_artificial_intelligence_will/,gone_his_own_way,1510844835,,1,5
1567,2017-11-17,2017,11,17,0,7dcz5j,Artificial intelligence: the medical connection,https://www.reddit.com/r/Futurology/comments/7dcz5j/artificial_intelligence_the_medical_connection/,gone_his_own_way,1510844954,,0,2
1568,2017-11-17,2017,11,17,0,7dd1lq,"George Church Will Make Virus-Proof Organisms, Transplant Pig Organs to Humans, and Reverse Aging",https://www.reddit.com/r/Futurology/comments/7dd1lq/george_church_will_make_virusproof_organisms/,dbsps,1510845599,,14,33
1569,2017-11-17,2017,11,17,0,7dd3fs,Can machine learning save the planet | London Business School,https://www.reddit.com/r/Futurology/comments/7dd3fs/can_machine_learning_save_the_planet_london/,stormforce7916,1510846082,,0,1
1570,2017-11-17,2017,11,17,0,7dd3qv,"I've built a crypto Airbnb to marry P2P currency with P2P travel, after a few weeks of hustling I now have around 300 listings all over the world",https://www.reddit.com/r/Futurology/comments/7dd3qv/ive_built_a_crypto_airbnb_to_marry_p2p_currency/,[deleted],1510846163,[deleted],1,13
1571,2017-11-17,2017,11,17,0,7dd59z,At least 15 states join global alliance to phase out coal by 2030,https://www.reddit.com/r/Futurology/comments/7dd59z/at_least_15_states_join_global_alliance_to_phase/,gone_his_own_way,1510846558,,0,10
1572,2017-11-17,2017,11,17,0,7dd5fu,Bt Aut Insurance Agn - 3 Key Qualities T Look Fr Bfr Chng,https://www.reddit.com/r/Futurology/comments/7dd5fu/bt_aut_insurance_agn_3_key_qualities_t/,[deleted],1510846603,[deleted],1,1
