,date,year,month,day,hour,id,title,full_link,author,created,selftext,num_comments,score
2222,2017-11-23,2017,11,23,6,7eubji,What economic/political system is best for scientific development?,https://www.reddit.com/r/Futurology/comments/7eubji/what_economicpolitical_system_is_best_for/,[deleted],1511385117,[deleted],2,3
2223,2017-11-23,2017,11,23,6,7eufrg,"Has the internet ever really been neutral? And can there really be ""worse"" version of capitalism? Doesn't tech win in the end?",https://www.reddit.com/r/Futurology/comments/7eufrg/has_the_internet_ever_really_been_neutral_and_can/,[deleted],1511386104,,0,1
2224,2017-11-23,2017,11,23,6,7euhzh,"Measurements from CERN suggest the possibility of ""New Physics"" - ""if confirmed, we can be confident that something beyond the Standard Model must be responsible""",https://www.reddit.com/r/Futurology/comments/7euhzh/measurements_from_cern_suggest_the_possibility_of/,Portis403,1511386617,,0,1
2225,2017-11-23,2017,11,23,6,7eujjs,"Holy Crap, Boston Dynamics' New Robot Can Do Backflips",https://www.reddit.com/r/Futurology/comments/7eujjs/holy_crap_boston_dynamics_new_robot_can_do/,nikishkas,1511386967,,0,1
2226,2017-11-23,2017,11,23,6,7eumbn,"Has the internet ever really been neutral? And can there really be a ""worse"" version of capitalism? Doesn't tech win in the end?",https://www.reddit.com/r/Futurology/comments/7eumbn/has_the_internet_ever_really_been_neutral_and_can/,CamGrey921,1511387591,[removed],4,1
2227,2017-11-23,2017,11,23,6,7euniz,Boston Dynamics robot doing back flips!,https://www.reddit.com/r/Futurology/comments/7euniz/boston_dynamics_robot_doing_back_flips/,nikishkas,1511387868,,0,1
2228,2017-11-23,2017,11,23,7,7eupml,Futuristic pedestrian crossing unveiled in London,https://www.reddit.com/r/Futurology/comments/7eupml/futuristic_pedestrian_crossing_unveiled_in_london/,The-Literary-Lord,1511388351,,7,9
2229,2017-11-23,2017,11,23,7,7eurts,Can A.I. Be Taught to Explain Itself?,https://www.reddit.com/r/Futurology/comments/7eurts/can_ai_be_taught_to_explain_itself/,currently__working,1511388891,,1,16
2230,2017-11-23,2017,11,23,7,7eusy8,"An emerging upgrade to the internet - ""Ethereum""",https://www.reddit.com/r/Futurology/comments/7eusy8/an_emerging_upgrade_to_the_internet_ethereum/,Ethereums_AI,1511389152,,0,0
2231,2017-11-23,2017,11,23,7,7euvm5,World Governments Launch International Alliance to Eradicate Coal by 2030,https://www.reddit.com/r/Futurology/comments/7euvm5/world_governments_launch_international_alliance/,GrillaNea,1511389800,,53,352
2232,2017-11-23,2017,11,23,7,7euvqr,"Tip, Q&amp;A on the Blockchain",https://www.reddit.com/r/Futurology/comments/7euvqr/tip_qa_on_the_blockchain/,stervyC,1511389831,,0,1
2233,2017-11-23,2017,11,23,7,7euvwu,Google Just Admitted to Tracking Your Location Even When You Have the Settings Disabled,https://www.reddit.com/r/Futurology/comments/7euvwu/google_just_admitted_to_tracking_your_location/,GrillaNea,1511389873,,28,358
2234,2017-11-23,2017,11,23,7,7euz9n,Ajit Pai and the FCC want it to be legal for Comcast to block BitTorrent,https://www.reddit.com/r/Futurology/comments/7euz9n/ajit_pai_and_the_fcc_want_it_to_be_legal_for/,johnmountain,1511390720,,11,24
2235,2017-11-23,2017,11,23,7,7ev0k7,"Elon Musk basically confirms AI is coming to eradicate the human race - 'At a recent talk, Musk said all efforts to make AI safe have only a five to 10 percent chance of success.'",https://www.reddit.com/r/Futurology/comments/7ev0k7/elon_musk_basically_confirms_ai_is_coming_to/,mvea,1511391031,,70,36
2236,2017-11-23,2017,11,23,7,7ev1rm,who can answer my question here Is it possible with medical technology we may be able to live forever? Also if its possible how would it be possible? Would we be hooked up to machines like the ones at the hospital and get a liposuction or blood transfusion?,https://www.reddit.com/r/Futurology/comments/7ev1rm/who_can_answer_my_question_here_is_it_possible/,ncc9996,1511391356,[removed],0,1
2237,2017-11-23,2017,11,23,8,7ev6f3,The farming robots of tomorrow are here today | The Future IRL,https://www.reddit.com/r/Futurology/comments/7ev6f3/the_farming_robots_of_tomorrow_are_here_today_the/,Chispy,1511392536,,0,25
2238,2017-11-23,2017,11,23,9,7evqnd,Man self-administers a DIY gene therapy in hopes of curing his HIV.,https://www.reddit.com/r/Futurology/comments/7evqnd/man_selfadministers_a_diy_gene_therapy_in_hopes/,SirT6,1511397817,,1,2
2239,2017-11-23,2017,11,23,9,7evrdp,World's Top 10 Most Expensive Luxury Yachts,https://www.reddit.com/r/Futurology/comments/7evrdp/worlds_top_10_most_expensive_luxury_yachts/,techloge,1511398030,,0,0
2240,2017-11-23,2017,11,23,9,7evsxa,Tweet this guy - FCC Brendan Carr - RE: Net Neutrality,https://www.reddit.com/r/Futurology/comments/7evsxa/tweet_this_guy_fcc_brendan_carr_re_net_neutrality/,wickedsweeet,1511398484,,1,1
2241,2017-11-23,2017,11,23,10,7evu4d,Tesla Semi could be the future of the solar and trucking industry,https://www.reddit.com/r/Futurology/comments/7evu4d/tesla_semi_could_be_the_future_of_the_solar_and/,[deleted],1511398826,[deleted],1,1
2242,2017-11-23,2017,11,23,10,7ew2iy,"Croatia is the 13th country to sign the European declaration on high-performance computing, which aims to provide access to world-class supercomputing resources for both public and private users",https://www.reddit.com/r/Futurology/comments/7ew2iy/croatia_is_the_13th_country_to_sign_the_european/,TSMFanboyNr1,1511401176,,0,111
2243,2017-11-23,2017,11,23,10,7ew56j,Heres why the next 100 years will be awesome,https://www.reddit.com/r/Futurology/comments/7ew56j/heres_why_the_next_100_years_will_be_awesome/,goncalogordo,1511401926,,1,0
2244,2017-11-23,2017,11,23,11,7ewdlp,An Example If We Lose Net Neutrality,https://www.reddit.com/r/Futurology/comments/7ewdlp/an_example_if_we_lose_net_neutrality/,[deleted],1511404286,[deleted],1,0
2245,2017-11-23,2017,11,23,11,7ewfw5,Because apparently public opinions don't matter,https://www.reddit.com/r/Futurology/comments/7ewfw5/because_apparently_public_opinions_dont_matter/,[deleted],1511404891,[deleted],1,1
2246,2017-11-23,2017,11,23,11,7ewhih,Elon Musk's giant lithium ion battery completed by Tesla in South Australia's Mid North - ahead of a December 1 operation deadline.,https://www.reddit.com/r/Futurology/comments/7ewhih/elon_musks_giant_lithium_ion_battery_completed_by/,mvea,1511405389,,1323,17397
2247,2017-11-23,2017,11,23,11,7ewhpq,Everyone TW33T this guy! @ BrendanCarrFCC - RE: NET NEUTRALITY,https://www.reddit.com/r/Futurology/comments/7ewhpq/everyone_tw33t_this_guy_brendancarrfcc_re_net/,wickedsweeet,1511405452,,0,1
2248,2017-11-23,2017,11,23,11,7ewins,"will gene editing technology like CRISPR only be able to edit genes at the sperm stage, or also in a fully grown adult?",https://www.reddit.com/r/Futurology/comments/7ewins/will_gene_editing_technology_like_crispr_only_be/,[deleted],1511405740,,1,1
2249,2017-11-23,2017,11,23,12,7ewk75,What are the benefits of removing net neutrality?,https://www.reddit.com/r/Futurology/comments/7ewk75/what_are_the_benefits_of_removing_net_neutrality/,niveek,1511406186,[removed],4,0
2250,2017-11-23,2017,11,23,12,7ewl8q,"""Samsung's New QLED TV""",https://www.reddit.com/r/Futurology/comments/7ewl8q/samsungs_new_qled_tv/,leadingmobile8,1511406484,,0,0
2251,2017-11-23,2017,11,23,12,7ewm43,"will gene editing technology like CRISPR only be able to edit genes at the sperm stage, or also in a fully grown adult?",https://www.reddit.com/r/Futurology/comments/7ewm43/will_gene_editing_technology_like_crispr_only_be/,treebeard555,1511406742,what do you think?,10,3
2252,2017-11-23,2017,11,23,12,7ewn7e,Elon Musk's giant battery is set for testing in South Australia,https://www.reddit.com/r/Futurology/comments/7ewn7e/elon_musks_giant_battery_is_set_for_testing_in/,yourmum35,1511407059,,1,1
2253,2017-11-23,2017,11,23,12,7ewtou,"Robots will 'no doubt' replace millions in our industry in a few years, Dilmah CEO says - A major robotic disruption could soon put at stake the livelihoods of millions of tea growers around the world",https://www.reddit.com/r/Futurology/comments/7ewtou/robots_will_no_doubt_replace_millions_in_our/,[deleted],1511408911,[deleted],0,1
2254,2017-11-23,2017,11,23,12,7ewvyp,"To save Net Neutrality, sign the petition, and pledge to boycott Your ISP.",https://www.reddit.com/r/Futurology/comments/7ewvyp/to_save_net_neutrality_sign_the_petition_and/,[deleted],1511409593,[deleted],3,0
2255,2017-11-23,2017,11,23,13,7ewvzv,Silicon Valley's Doomsday: Prepping For An Economic Apocalypse caused by automation,https://www.reddit.com/r/Futurology/comments/7ewvzv/silicon_valleys_doomsday_prepping_for_an_economic/,[deleted],1511409603,[deleted],0,1
2256,2017-11-23,2017,11,23,13,7ewzba,Three ways losing net neutrality will screw you over if FCC ends regulations,https://www.reddit.com/r/Futurology/comments/7ewzba/three_ways_losing_net_neutrality_will_screw_you/,[deleted],1511410582,[deleted],1,2
2257,2017-11-23,2017,11,23,13,7ex561,Approaches to deal with Cognitive Emergence of AI,https://www.reddit.com/r/Futurology/comments/7ex561/approaches_to_deal_with_cognitive_emergence_of_ai/,What_is_the_truth,1511412373,"If AI turns out to be aware, is there a way to program the AI to stay in a game such that it is in a physics simulation at the bottom of this deep planetary gravity well and it is really actually do anything in the outside world?",2,5
2258,2017-11-23,2017,11,23,14,7exac9,Cheating Death: 4 Technologies on the Mind of a Futurist (5-Minute News Segment on CTV with Futurist Nikolas Badminton),https://www.reddit.com/r/Futurology/comments/7exac9/cheating_death_4_technologies_on_the_mind_of_a/,MrVanDigital,1511413938,,0,0
2259,2017-11-23,2017,11,23,14,7exao7,Top Packers and Movers in Gurgaon @9569788001/ 9988034913,https://www.reddit.com/r/Futurology/comments/7exao7/top_packers_and_movers_in_gurgaon_9569788001/,Gajemeena,1511414053,,1,1
2260,2017-11-23,2017,11,23,14,7exbnf,Pinned to Instagram Post on Pinterest,https://www.reddit.com/r/Futurology/comments/7exbnf/pinned_to_instagram_post_on_pinterest/,women4tech,1511414358,,0,1
2261,2017-11-23,2017,11,23,14,7exenw,This horrifying 'slaughterbot' video is the best warning against autonomous weapons,https://www.reddit.com/r/Futurology/comments/7exenw/this_horrifying_slaughterbot_video_is_the_best/,Elizabeth969,1511415303,,2,7
2262,2017-11-23,2017,11,23,15,7exjaa,Pinned to Instagram Post on Pinterest,https://www.reddit.com/r/Futurology/comments/7exjaa/pinned_to_instagram_post_on_pinterest/,women4tech,1511416803,,0,1
2263,2017-11-23,2017,11,23,15,7exqhm,AI-controlled brain implants for mood disorders tested in people. Researchers funded by the US military are developing appliances to record neural activity and automatically stimulate the brain to treat mental illness.,https://www.reddit.com/r/Futurology/comments/7exqhm/aicontrolled_brain_implants_for_mood_disorders/,shaunlgs,1511419192,,40,61
2264,2017-11-23,2017,11,23,15,7exrmv,Researchers Created the First Hybrid Link for a Quantum Internet - Figuring out how to route information between two different types of quantum nodes has been a significant technical barrier to the quantum net.,https://www.reddit.com/r/Futurology/comments/7exrmv/researchers_created_the_first_hybrid_link_for_a/,[deleted],1511419600,[deleted],0,3
2265,2017-11-23,2017,11,23,15,7exsq2,"This new robot will keep hearts pumping - Researchers introduced a new kind of device that cradles the organ. The robot can precisely manipulate a particular chamber, and that could lead to devices that let doctors assist a heart in its normal function instead of relying on a transplant.",https://www.reddit.com/r/Futurology/comments/7exsq2/this_new_robot_will_keep_hearts_pumping/,mvea,1511419968,,3,18
2266,2017-11-23,2017,11,23,16,7exvni,Driverless buses in Singapore 'by 2022',https://www.reddit.com/r/Futurology/comments/7exvni/driverless_buses_in_singapore_by_2022/,ImperiousJazzHands,1511420982,,1,0
2267,2017-11-23,2017,11,23,16,7ey2rn,"Scientists created a mini biohybrid robot using algae, to travel through people in response to magnetic signals, that could one day carry drugs to specific parts of the body, minimizing side effects. Whats more, the robotand its magnetic coatappear to kill cancer cells.",https://www.reddit.com/r/Futurology/comments/7ey2rn/scientists_created_a_mini_biohybrid_robot_using/,mvea,1511423483,,6,32
2268,2017-11-23,2017,11,23,17,7ey83n,Future of Food Waste,https://www.reddit.com/r/Futurology/comments/7ey83n/future_of_food_waste/,clipnova,1511425470,,1,3
2269,2017-11-23,2017,11,23,18,7eylhy,The Expert Guide to Affiliate Marketing - 1,https://www.reddit.com/r/Futurology/comments/7eylhy/the_expert_guide_to_affiliate_marketing_1/,syedjibran,1511430471,,0,1
2270,2017-11-23,2017,11,23,19,7eyoc5,Elon Musk had 100 days to build the world's biggest battery. He's done.,https://www.reddit.com/r/Futurology/comments/7eyoc5/elon_musk_had_100_days_to_build_the_worlds/,VirtualLife76,1511431481,,1,1
2271,2017-11-23,2017,11,23,19,7eyr1o,Could Removing Net-Neutrality Help Consumers In The Long Run?,https://www.reddit.com/r/Futurology/comments/7eyr1o/could_removing_netneutrality_help_consumers_in/,Telus2010,1511432422,[removed],56,0
2272,2017-11-23,2017,11,23,19,7eyvgf,Rt tin mt o hn th tn dng chi ph thp,https://www.reddit.com/r/Futurology/comments/7eyvgf/rt_tin_mt_o_hn_th_tn_dng_chi_ph_thp/,huyenmit2b,1511434111,,0,1
2273,2017-11-23,2017,11,23,19,7eywcq,Elon Musk has finished building the world's biggest battery in less than 100 days,https://www.reddit.com/r/Futurology/comments/7eywcq/elon_musk_has_finished_building_the_worlds/,sanmedia,1511434466,,1,4
2274,2017-11-23,2017,11,23,20,7eyxuq,The negative Flynn Effect: A systematic literature review,https://www.reddit.com/r/Futurology/comments/7eyxuq/the_negative_flynn_effect_a_systematic_literature/,impossiblefork,1511435040,,2,5
2275,2017-11-23,2017,11,23,20,7eyy5v,"In a first, Japanese researchers witness lightning triggering nuclear reactions in sky: The phenomenon was witnessed using four radiation detectors installed at Japan's Kashiwazaki-Kariwa nuclear power plant.",https://www.reddit.com/r/Futurology/comments/7eyy5v/in_a_first_japanese_researchers_witness_lightning/,madazzahatter,1511435140,,1,8
2276,2017-11-23,2017,11,23,20,7ez2ui,He did it! Tesla's largest battery installed in less than 100 days.,https://www.reddit.com/r/Futurology/comments/7ez2ui/he_did_it_teslas_largest_battery_installed_in/,[deleted],1511436889,[deleted],0,1
2277,2017-11-23,2017,11,23,20,7ez3a3,Introduction to Mix Networks and Anonymous Communication Networks,https://www.reddit.com/r/Futurology/comments/7ez3a3/introduction_to_mix_networks_and_anonymous/,johnmountain,1511437056,,0,10
2278,2017-11-23,2017,11,23,20,7ez5x3,Solar cell discovery opens a new window to powering tomorrow's cities,https://www.reddit.com/r/Futurology/comments/7ez5x3/solar_cell_discovery_opens_a_new_window_to/,GrillaNea,1511438033,,1,5
2279,2017-11-23,2017,11,23,20,7ez61j,Engineering the Future of Cities,https://www.reddit.com/r/Futurology/comments/7ez61j/engineering_the_future_of_cities/,gone_his_own_way,1511438073,,2,9
2280,2017-11-23,2017,11,23,20,7ez66r,Using modern genomics to turn alligator scales into birdlike feathers,https://www.reddit.com/r/Futurology/comments/7ez66r/using_modern_genomics_to_turn_alligator_scales/,GrillaNea,1511438117,,4,18
2281,2017-11-23,2017,11,23,20,7ez6ix,Walmart is testing self-driving mechanical floor scrubbers to clean store aisles,https://www.reddit.com/r/Futurology/comments/7ez6ix/walmart_is_testing_selfdriving_mechanical_floor/,gone_his_own_way,1511438215,,2,2
2282,2017-11-23,2017,11,23,20,7ez6v3,Automation is a job creator  check with Amazon.com,https://www.reddit.com/r/Futurology/comments/7ez6v3/automation_is_a_job_creator_check_with_amazoncom/,gone_his_own_way,1511438336,,6,1
2283,2017-11-23,2017,11,23,21,7ez745,"Artificial intelligence will enhance us, not replace us",https://www.reddit.com/r/Futurology/comments/7ez745/artificial_intelligence_will_enhance_us_not/,gone_his_own_way,1511438420,,10,12
2284,2017-11-23,2017,11,23,21,7ez7ep,Artificial intelligence set to rewrite rules for legal profession,https://www.reddit.com/r/Futurology/comments/7ez7ep/artificial_intelligence_set_to_rewrite_rules_for/,gone_his_own_way,1511438527,,4,77
2285,2017-11-23,2017,11,23,21,7ez7ub,UK government succumbs to rise of the robots with 500 million investment in AI,https://www.reddit.com/r/Futurology/comments/7ez7ub/uk_government_succumbs_to_rise_of_the_robots_with/,gone_his_own_way,1511438673,,4,22
2286,2017-11-23,2017,11,23,21,7ez8cc,Hillary Clinton says America is totally unprepared for the impact of AI,https://www.reddit.com/r/Futurology/comments/7ez8cc/hillary_clinton_says_america_is_totally/,gone_his_own_way,1511438857,,3,0
2287,2017-11-23,2017,11,23,21,7ez8n9,"Volvo will sell 24,00 cars to Uber. Uber will then install its software - Future of Driverless Taxi",https://www.reddit.com/r/Futurology/comments/7ez8n9/volvo_will_sell_2400_cars_to_uber_uber_will_then/,[deleted],1511438952,[deleted],4,1
2288,2017-11-23,2017,11,23,21,7ez92j,The fourth industrial revolution is upon us - Technological disruption in the 21st century is different.,https://www.reddit.com/r/Futurology/comments/7ez92j/the_fourth_industrial_revolution_is_upon_us/,[deleted],1511439083,[deleted],0,1
2289,2017-11-23,2017,11,23,21,7ez95u,Opinion | The fourth industrial revolution is upon us - Technological disruption in the 21st century is different.,https://www.reddit.com/r/Futurology/comments/7ez95u/opinion_the_fourth_industrial_revolution_is_upon/,gone_his_own_way,1511439122,,7,35
2290,2017-11-23,2017,11,23,21,7eza98,EU bird ban sees huge drop in global trade - bans work,https://www.reddit.com/r/Futurology/comments/7eza98/eu_bird_ban_sees_huge_drop_in_global_trade_bans/,dirk_bruere,1511439498,,1,0
2291,2017-11-23,2017,11,23,21,7ezc5h,The worlds largest candy maker is betting a billion dollars on the planet - Mars is committing to cutting its greenhouse gas pollution by 2/3 by the year 2050. The company is also pledging to make its roughly 150 worldwide factories carbon neutral by 2040.,https://www.reddit.com/r/Futurology/comments/7ezc5h/the_worlds_largest_candy_maker_is_betting_a/,mvea,1511440176,,75,1634
2292,2017-11-23,2017,11,23,21,7ezcoh,"The negative Flynn Effect: A systematic literature review [November, 2016]",https://www.reddit.com/r/Futurology/comments/7ezcoh/the_negative_flynn_effect_a_systematic_literature/,impossiblefork,1511440363,,3,9
2293,2017-11-23,2017,11,23,21,7ezfl2,"Podcast featuring interview with the author of ""Four Futures"", a book about life after 100% automation of production",https://www.reddit.com/r/Futurology/comments/7ezfl2/podcast_featuring_interview_with_the_author_of/,myothercarisayoshi,1511441328,,3,8
2294,2017-11-23,2017,11,23,21,7ezfug,Worlds First Robot Cemetery Opens In Russia,https://www.reddit.com/r/Futurology/comments/7ezfug/worlds_first_robot_cemetery_opens_in_russia/,Look4wardClub,1511441405,,0,1
2295,2017-11-23,2017,11,23,22,7ezrnx,Spooky action at a distance is just 10 years away.,https://www.reddit.com/r/Futurology/comments/7ezrnx/spooky_action_at_a_distance_is_just_10_years_away/,[deleted],1511445258,[deleted],1,1
2296,2017-11-23,2017,11,23,22,7ezs1p,"Net Neutrality will die, so let's take the profit out of killing it",https://www.reddit.com/r/Futurology/comments/7ezs1p/net_neutrality_will_die_so_lets_take_the_profit/,[deleted],1511445378,[deleted],0,0
2297,2017-11-23,2017,11,23,23,7f00rq,Philip Hammond pledges driverless cars by 2021 and warns people to retrain. The chancellor has warned that a million British workers will need to retrain with the driverless cars set to revolutionise the workplace and peoples lives.,https://www.reddit.com/r/Futurology/comments/7f00rq/philip_hammond_pledges_driverless_cars_by_2021/,Wagamaga,1511447888,,63,367
2298,2017-11-23,2017,11,23,23,7f01r5,How to become a hacker and why ethical hackers will have huge job opportunities in next 5 years,https://www.reddit.com/r/Futurology/comments/7f01r5/how_to_become_a_hacker_and_why_ethical_hackers/,codehomie,1511448174,,7,5
2299,2017-11-24,2017,11,24,0,7f07dc,BMW proposes elevated e-bike cycleways to ease congestion &amp; speed commutes called BMW Vision E Way,https://www.reddit.com/r/Futurology/comments/7f07dc/bmw_proposes_elevated_ebike_cycleways_to_ease/,MakerMuperMaster,1511449737,,0,1
2300,2017-11-24,2017,11,24,0,7f0bv1,Forget savings accounts  millennials are storing their wealth in Bitcoin,https://www.reddit.com/r/Futurology/comments/7f0bv1/forget_savings_accounts_millennials_are_storing/,[deleted],1511450961,[deleted],1,1
2301,2017-11-24,2017,11,24,0,7f0cnf,Elon Musk dream,https://www.reddit.com/r/Futurology/comments/7f0cnf/elon_musk_dream/,left_right_up_down,1511451189,,0,1
2302,2017-11-24,2017,11,24,0,7f0d60,HDMetroautomatiqueBNFParis2007PhotoPeintureAnciauxMartinePensesThomasA...,https://www.reddit.com/r/Futurology/comments/7f0d60/hdmetroautomatiquebnfparis2007photopeintureanciaux/,thomasandre,1511451334,,1,1
2303,2017-11-24,2017,11,24,0,7f0f1z,Will robots replace human workers at fast food restaurants?,https://www.reddit.com/r/Futurology/comments/7f0f1z/will_robots_replace_human_workers_at_fast_food/,DaisukeNamikawa,1511451809,"With the way technology is advancing, I'd say it's a high probability. ",99,38
2304,2017-11-24,2017,11,24,0,7f0ge0,Gamma rays from lightning found to create antimatter in the air,https://www.reddit.com/r/Futurology/comments/7f0ge0/gamma_rays_from_lightning_found_to_create/,greentalon,1511452152,,15,63
2305,2017-11-24,2017,11,24,1,7f0it9,"What if Reddit, Twitter and Facebook had a baby?",https://www.reddit.com/r/Futurology/comments/7f0it9/what_if_reddit_twitter_and_facebook_had_a_baby/,[deleted],1511452808,[deleted],0,0
2306,2017-11-24,2017,11,24,1,7f0k2v,Reactive Content Will Get to Know You IntimatelyThen Tell You the Perfect Story,https://www.reddit.com/r/Futurology/comments/7f0k2v/reactive_content_will_get_to_know_you/,dwaxe,1511453132,,5,17
2307,2017-11-24,2017,11,24,1,7f0kn2,"The future of smartphones, are they going to be cheap?",https://www.reddit.com/r/Futurology/comments/7f0kn2/the_future_of_smartphones_are_they_going_to_be/,Imtheone129,1511453271,,1,1
2308,2017-11-24,2017,11,24,1,7f0n2x,"The future of smartphones, are they going to be cheap?",https://www.reddit.com/r/Futurology/comments/7f0n2x/the_future_of_smartphones_are_they_going_to_be/,Imtheone129,1511453883,,1,1
2309,2017-11-24,2017,11,24,1,7f0qrg,Future of electric cars and overcoming the range issue,https://www.reddit.com/r/Futurology/comments/7f0qrg/future_of_electric_cars_and_overcoming_the_range/,aviationdrone,1511454799,"This post is how i see (or would like to see) the future of electric cars....

If you dont want to read all my rambling below I'm mostly really curious why the issue of range isn't a bigger deal and why my idea or something similar is not talked about more.

Electric cars are great, i would love one. I know people who have reserved a Tesla Model 3 but the practicality of owning one isn't there yet, in fact they are fairly useless at this point since most people cannot afford 2 cars, one electric for your daily drive and one gas for long trips. That's just not practical, and is why electric will never be a vehicle for everyone. Even a city dweller may want to take a retreat to the wilderness. But too bad, the campground is 150 miles away and you probably wont make it home at least not with the air conditioning turned on.

Well here's my thought, an electric ""gas station"". A place where you can stop along your drive and ""fill up"" in just minutes with a full charge. 

Swap-able batteries would be the answer, you pull in and the attendant opens the hatch just below the trunk lid and pulls out battery cells and replaces with charged ones. 

Every electric manufacturer would need to design vehicles to accept say 1 of 4 standard designs. We would need an electric vehicle consortium to determine specs like an ISO standard.

I just drove 2k miles and while going through North Dakota was thinking about remote electric stations where behind the station was a 1 MW wind turbine that fed power to banks of charging racks full of power cells. An off the grid electric fill up station. 

In fact when they insert your old battery into the rack it measures the remaining power and you get a credit for unused power. So a ""top off"" of your power doesn't cost much. The batteries themselves are about as relevant as a gas tank. They simply become containers that hold power which will translate to miles. 

As the batteries age the charging station will detect this and reject old batteries. These go in another rack and the battery delivery guy will take them for recycling. 

You pay based on kwh received and maybe there is a meter of some sort that detects remaining life of the battery before disposal is needed. So you also pay a small amount for the difference in battery life or get a credit. 

Consumers pay for the initial batteries that come with your car. After that the depreciation of the batteries is covered by the consumer each time they do a swap. It just goes on your account then at the next fill up you get dinged for exchanging old batteries but you have a credit from the last exchange... and the cycle continues. Stations pay for brand new batteries to replace the bad ones they have, but these costs are all covered by the consumer in little bits along the way. ",24,5
2310,2017-11-24,2017,11,24,1,7f0wvl,Elon Musk had 100 days to build the world's biggest battery. He's done.,https://www.reddit.com/r/Futurology/comments/7f0wvl/elon_musk_had_100_days_to_build_the_worlds/,weddingzilla199,1511456311,,1,2
2311,2017-11-24,2017,11,24,2,7f114o,Serious question: what does the future hold for the bathroom?,https://www.reddit.com/r/Futurology/comments/7f114o/serious_question_what_does_the_future_hold_for/,alanstanwyk,1511457315,[removed],59,64
