,date,year,month,day,hour,id,title,full_link,author,created,selftext,num_comments,score
0,2017-11-1,2017,11,1,9,7a09pa,Pinned to Instagram Post on Pinterest,https://www.reddit.com/r/Futurology/comments/7a09pa/pinned_to_instagram_post_on_pinterest/,women4tech,1509497364,,0,1
1,2017-11-1,2017,11,1,10,7a0mvl,These 5 companies are using Ethereum to completely reinvent the back end of the internet,https://www.reddit.com/r/Futurology/comments/7a0mvl/these_5_companies_are_using_ethereum_to/,nevercomindown,1509501351,,1,0
2,2017-11-1,2017,11,1,11,7a0nzi,It's Awsome technologies video must watch you should to know about technology,https://www.reddit.com/r/Futurology/comments/7a0nzi/its_awsome_technologies_video_must_watch_you/,shahidanwar,1509501684,,0,1
3,2017-11-1,2017,11,1,11,7a0r01,Pinned to Instagram Post on Pinterest,https://www.reddit.com/r/Futurology/comments/7a0r01/pinned_to_instagram_post_on_pinterest/,women4tech,1509502587,,0,1
4,2017-11-1,2017,11,1,11,7a0so0,The cost of renewable energy is dropping so fast that it's disrupting global markets,https://www.reddit.com/r/Futurology/comments/7a0so0/the_cost_of_renewable_energy_is_dropping_so_fast/,yuge_balls,1509503081,,1775,31099
5,2017-11-1,2017,11,1,11,7a0ulm,Basic income vs UBI,https://www.reddit.com/r/Futurology/comments/7a0ulm/basic_income_vs_ubi/,emoposer,1509503684,"There's a big difference. One hands out checks to everyone; one is a replacement for entitlements. 

**Basic income** (common definition) 

Rather than having welfare, unemployment, food stamps, Medicare, Medicaid, etc. A single check is handed out to all qualifying individuals. Qualifying individuals are individuals whose households cannot afford the basic standard of living.

Obviously, households with more dependents would have a lower qualifying income threshold. This has the benefits of a UBI but avoids giving checks to the rich. 

Individuals can choose purchase items that are best suited for them. An older individual would spend more on health coverage and his grandkids, while a younger individual might invest in her education startup. 

Jobs are disappearing. Basic incomes are inevitable. Giving money to the rich is just stupid. ",11,0
6,2017-11-1,2017,11,1,12,7a10go,"Ca li chng mui, ca li chng cn trng ,bo gi ca li mi nht 2017",https://www.reddit.com/r/Futurology/comments/7a10go/ca_li_chng_mui_ca_li_chng_cn_trng_bo/,huyenmit2b,1509505594,,0,1
7,2017-11-1,2017,11,1,12,7a10ud,"Virgin Hyperloop One to begin building first transport system by 2019, CEO says",https://www.reddit.com/r/Futurology/comments/7a10ud/virgin_hyperloop_one_to_begin_building_first/,mvea,1509505722,,2,20
8,2017-11-1,2017,11,1,12,7a16it,An Alternative to Religious Gatherings,https://www.reddit.com/r/Futurology/comments/7a16it/an_alternative_to_religious_gatherings/,Shayfly,1509507654,[removed],0,1
9,2017-11-1,2017,11,1,12,7a18lv,Waymo gave me a ride in a car with no driver,https://www.reddit.com/r/Futurology/comments/7a18lv/waymo_gave_me_a_ride_in_a_car_with_no_driver/,nliausacmmv,1509508388,,0,6
10,2017-11-1,2017,11,1,16,7a2413,"Top 10 SuperHuman, Who could Bring the Change in the World.",https://www.reddit.com/r/Futurology/comments/7a2413/top_10_superhuman_who_could_bring_the_change_in/,anna_joseph,1509521429,,0,1
11,2017-11-1,2017,11,1,17,7a2a6h,The U.S. Isnt Prepared for the Next Recession,https://www.reddit.com/r/Futurology/comments/7a2a6h/the_us_isnt_prepared_for_the_next_recession/,johnmountain,1509524477,,32,33
12,2017-11-1,2017,11,1,17,7a2btp,Nhng h hong thng gp cua h thng lam mat may cng trinh,https://www.reddit.com/r/Futurology/comments/7a2btp/nhng_h_hong_thng_gp_cua_h_thng_lam_mat_may/,huyenmit2b,1509525347,,0,1
13,2017-11-1,2017,11,1,17,7a2cta,The Largest Ever Tropical Reforestation Is Planting 73 Million Trees - This project will help Brazil move toward its Paris Agreement target of reforesting 12 million hectares of land by 2030,https://www.reddit.com/r/Futurology/comments/7a2cta/the_largest_ever_tropical_reforestation_is/,mvea,1509525902,,1,62
14,2017-11-1,2017,11,1,17,7a2efc,Rt tin mt t th tn dng HSBC,https://www.reddit.com/r/Futurology/comments/7a2efc/rt_tin_mt_t_th_tn_dng_hsbc/,huyenmit2b,1509526774,,0,1
15,2017-11-1,2017,11,1,18,7a2fh3,"Can Japan burn flammable ice for energy? - Nankai Trough, a long, narrow depression 50 kilometers off the coast of central Japan... Analysis of extracted core samples and seismic data has revealed that 1.1 trillion cubic meters of methane - enough to meet Japan's gas needs for more than a decade",https://www.reddit.com/r/Futurology/comments/7a2fh3/can_japan_burn_flammable_ice_for_energy_nankai/,[deleted],1509527248,[deleted],1,2
16,2017-11-1,2017,11,1,18,7a2gud,Rt tin mt t th tn dng Techcombank,https://www.reddit.com/r/Futurology/comments/7a2gud/rt_tin_mt_t_th_tn_dng_techcombank/,huyenmit2b,1509527948,,0,1
17,2017-11-1,2017,11,1,18,7a2i56,"A huge ""monster"" planet that's far too big for its sun could lead scientists to rethink their theories of astronomy. The planet, known as NGTS-1b, is the size of Jupiter. But orbits around a red dwarf star that's only half the size of its sun.",https://www.reddit.com/r/Futurology/comments/7a2i56/a_huge_monster_planet_thats_far_too_big_for_its/,madazzahatter,1509528603,,3,0
18,2017-11-1,2017,11,1,18,7a2kyp,"Stephen Hawking: ""I fear that AI may replace humans altogether. If people design computer viruses, someone will design AI that improves and replicates itself. This will be a new form of life that outperforms humans.""",https://www.reddit.com/r/Futurology/comments/7a2kyp/stephen_hawking_i_fear_that_ai_may_replace_humans/,mvea,1509529988,,244,828
19,2017-11-1,2017,11,1,19,7a2mvp,"Living my anxiety dream: taking a ride in a Google self-driving car - Waymos vehicles may not have the cool quotient of Teslas Model S, but they manage to navigate a minefield of potential accidents.",https://www.reddit.com/r/Futurology/comments/7a2mvp/living_my_anxiety_dream_taking_a_ride_in_a_google/,madazzahatter,1509530836,,0,6
20,2017-11-1,2017,11,1,19,7a2nr9,"Emissions gap remains 'alarmingly high' says UN - Pledges made so far cover only one-third of the cuts needed by 2030 to keep below that goal, the review warns. Even if all the promises are kept, temperatures might still rise by 3 degrees by 2100.",https://www.reddit.com/r/Futurology/comments/7a2nr9/emissions_gap_remains_alarmingly_high_says_un/,mvea,1509531198,,1,14
21,2017-11-1,2017,11,1,19,7a2orj,Kinh nghim gi taxi sn bay cht lng gi r,https://www.reddit.com/r/Futurology/comments/7a2orj/kinh_nghim_gi_taxi_sn_bay_cht_lng_gi_r/,huyenmit2b,1509531632,,0,1
22,2017-11-1,2017,11,1,19,7a2p6j,What should governments be doing about the rise of Artificial Intelligence?,https://www.reddit.com/r/Futurology/comments/7a2p6j/what_should_governments_be_doing_about_the_rise/,stormforce7916,1509531813,,2,4
23,2017-11-1,2017,11,1,19,7a2qqi,"If you think technologies from Star Trek seem far-fetched, think again. Many of the devices from the acclaimed television series are slowly becoming a reality.",https://www.reddit.com/r/Futurology/comments/7a2qqi/if_you_think_technologies_from_star_trek_seem/,madazzahatter,1509532503,,0,29
24,2017-11-1,2017,11,1,19,7a2ss2,"Under the skin: how insertable microchips could unlock the future - Volunteers in Melbourne have had microchips inserted for three months, designed to unlock doors and carry out other tasks.",https://www.reddit.com/r/Futurology/comments/7a2ss2/under_the_skin_how_insertable_microchips_could/,[deleted],1509533427,[deleted],1,1
25,2017-11-1,2017,11,1,19,7a2tvn,"This handheld 3D body scanning device could replace the MRI  using the motion-sensing technology from a Nintendo Wii. It's not as precise as an MRI machine or CT scan, but it's much quicker, and avoids the need to sit still in an MRI machine or getting exposed to the radiation of CT scans.",https://www.reddit.com/r/Futurology/comments/7a2tvn/this_handheld_3d_body_scanning_device_could/,mvea,1509533899,,7,44
26,2017-11-1,2017,11,1,19,7a2u3m,"Richard Branson leads effort to create 'Caribbean Marshall Plan': The multi-billionaire founder of Virgin Group, Richard Branson, plans to lead the post-hurricane rebuilding effort in the Caribbean islands, possibly including debt relief negotiation efforts led by the International Monetary Fund.",https://www.reddit.com/r/Futurology/comments/7a2u3m/richard_branson_leads_effort_to_create_caribbean/,madazzahatter,1509533998,,1,26
27,2017-11-1,2017,11,1,20,7a2vqc,Twisted Light Could Create an Ultra-Fast Internet and Make Fiber Optics Obsolete,https://www.reddit.com/r/Futurology/comments/7a2vqc/twisted_light_could_create_an_ultrafast_internet/,GrillaNea,1509534614,,1,26
28,2017-11-1,2017,11,1,20,7a2vuw,"DHS expanding national biometrics database to hold details on over 500 million people, including many US citizens - We are fast approaching a world where vast national biometrics databases are the norm.",https://www.reddit.com/r/Futurology/comments/7a2vuw/dhs_expanding_national_biometrics_database_to/,[deleted],1509534669,[deleted],0,6
29,2017-11-1,2017,11,1,20,7a2xvr,You Can Charge Your Phone As You Walk using this Technology in Future,https://www.reddit.com/r/Futurology/comments/7a2xvr/you_can_charge_your_phone_as_you_walk_using_this/,rahulkart,1509535448,[removed],3,0
30,2017-11-1,2017,11,1,20,7a2zzt,"Invention Generates Power, Cleans Water Using Untapped Source - Engineering professor wins $1.14M grant through the Bill &amp; Melinda Gates Foundation to solve water and sanitation crisis worldwide. NEWgenerator generates nutrients, energy and water by safely recovering them from wastewater.",https://www.reddit.com/r/Futurology/comments/7a2zzt/invention_generates_power_cleans_water_using/,mvea,1509536267,,1,182
31,2017-11-1,2017,11,1,20,7a317f,A wind-wind situation - Exponential Energy | Ramez Naam | SingularityU,https://www.reddit.com/r/Futurology/comments/7a317f/a_windwind_situation_exponential_energy_ramez/,er1end,1509536740,,0,6
32,2017-11-1,2017,11,1,20,7a339q,In a future with AR/VR and fully digital economic transactions do we still need politics?,https://www.reddit.com/r/Futurology/comments/7a339q/in_a_future_with_arvr_and_fully_digital_economic/,Arowx,1509537515,"Politics allow people to choose the laws and taxes of the country/region they live in.

In a future where what we see and experience is as much virtual as real could we choose how we live digitally.

For instance...

People who believe all women should be covered could live in an AR world that Burka's all women they see.

Or people that want to experience a Star War / Cyberpunk / WOW overlay of reality could do so.

People that choose to pay minimum taxes to the government could do that knowing they will get minimum service provision and have to pay privately for everything.

People that choose to pay higher taxes to get maximum service provision could choose that option.

Even legal aspects of life could be virtualised allowing people to choose as much or as little freedom as they wish to pay for.

This of course can only fully work if we have maximised our automation of the legal and government systems and services.

So in a fully digital automated future do we still need politics?
",3,0
33,2017-11-1,2017,11,1,21,7a3a6q,Saudis Techwashing Part 1: Why did Saudi Arabia Give A Robot Citizenship?,https://www.reddit.com/r/Futurology/comments/7a3a6q/saudis_techwashing_part_1_why_did_saudi_arabia/,Yazeedmakh,1509539851,,2,5
34,2017-11-1,2017,11,1,21,7a3b0b,"Extreme weather caused some $129 billion in economic losses last year, said a report that warned the bill will keep climbing as climate change increases the severity of droughts, storms and floods",https://www.reddit.com/r/Futurology/comments/7a3b0b/extreme_weather_caused_some_129_billion_in/,Wagamaga,1509540130,,0,37
35,2017-11-1,2017,11,1,21,7a3c5d,"New analysis says more jobs safer from automation than previously believed. The Future of Skills: Employment in 2030, published in September, is their most detailed investigation to date on the impact of technology and it now puts 20% of workers in the vulnerable category.",https://www.reddit.com/r/Futurology/comments/7a3c5d/new_analysis_says_more_jobs_safer_from_automation/,Wagamaga,1509540485,,2,6
36,2017-11-1,2017,11,1,21,7a3dn8,Automation and AI are destroying jobs but not the future of work,https://www.reddit.com/r/Futurology/comments/7a3dn8/automation_and_ai_are_destroying_jobs_but_not_the/,JacobResch,1509540989,,0,10
37,2017-11-1,2017,11,1,22,7a3g59,LED and Laser Wifi replacement can boost speeds to 100 gigabits per second without interference,https://www.reddit.com/r/Futurology/comments/7a3g59/led_and_laser_wifi_replacement_can_boost_speeds/,izumi3682,1509541760,,1,27
38,2017-11-1,2017,11,1,22,7a3gia,The world's first AI exchange-traded fund is set to run in Canada,https://www.reddit.com/r/Futurology/comments/7a3gia/the_worlds_first_ai_exchangetraded_fund_is_set_to/,izumi3682,1509541865,,0,1
39,2017-11-1,2017,11,1,22,7a3gt7,New Research Suggests Alzheimer's Starts Outside the Brain,https://www.reddit.com/r/Futurology/comments/7a3gt7/new_research_suggests_alzheimers_starts_outside/,izumi3682,1509541958,,0,1
40,2017-11-1,2017,11,1,22,7a3gzf,China Has Begun Testing a Brand New Type of Electric Transportation,https://www.reddit.com/r/Futurology/comments/7a3gzf/china_has_begun_testing_a_brand_new_type_of/,izumi3682,1509542011,,0,1
41,2017-11-1,2017,11,1,22,7a3i4s,Waymo has a big lead in driverless carsbut heres how it could lose it,https://www.reddit.com/r/Futurology/comments/7a3i4s/waymo_has_a_big_lead_in_driverless_carsbut_heres/,izumi3682,1509542344,,0,2
42,2017-11-1,2017,11,1,22,7a3ifa,"It's not just online privacy, Verizon also wants FCC to ban states from protecting your net neutrality",https://www.reddit.com/r/Futurology/comments/7a3ifa/its_not_just_online_privacy_verizon_also_wants/,[deleted],1509542437,[deleted],0,0
43,2017-11-1,2017,11,1,23,7a3rib,The Day-to-Day Practices That Will Help You Get What Matters Done,https://www.reddit.com/r/Futurology/comments/7a3rib/the_daytoday_practices_that_will_help_you_get/,dwaxe,1509545116,,0,4
44,2017-11-1,2017,11,1,23,7a3sdu,The Top 10 Technology Trends To Watch: 2018 To 2020,https://www.reddit.com/r/Futurology/comments/7a3sdu/the_top_10_technology_trends_to_watch_2018_to_2020/,Dialexa,1509545354,,0,1
45,2017-11-1,2017,11,1,23,7a3tge,Smashed smartphone screens may soon be a thing of the past after scientists developed a cheap and ultra-strong touchscreen display using the miracle material graphene.,https://www.reddit.com/r/Futurology/comments/7a3tge/smashed_smartphone_screens_may_soon_be_a_thing_of/,Plymouth03,1509545649,,32,271
46,2017-11-1,2017,11,1,23,7a3u1y,Texas Engineering Develop New Material for Better Lithium-Ion Batteries,https://www.reddit.com/r/Futurology/comments/7a3u1y/texas_engineering_develop_new_material_for_better/,Spacer86,1509545809,,12,173
47,2017-11-1,2017,11,1,23,7a3wdv,What its like to live in Phoenix? Waymo units all over the damn place,https://www.reddit.com/r/Futurology/comments/7a3wdv/what_its_like_to_live_in_phoenix_waymo_units_all/,izumi3682,1509546431,,0,9
48,2017-11-1,2017,11,1,23,7a3wwi,Many viruses activate a single RNA to enable successful infections,https://www.reddit.com/r/Futurology/comments/7a3wwi/many_viruses_activate_a_single_rna_to_enable/,izumi3682,1509546559,,1,18
49,2017-11-1,2017,11,1,23,7a3zvj,New report: Entrepreneurial space age began in 2009,https://www.reddit.com/r/Futurology/comments/7a3zvj/new_report_entrepreneurial_space_age_began_in_2009/,izumi3682,1509547392,,0,5
50,2017-11-1,2017,11,1,23,7a430v,What to worry about when youre worrying about lithium-ion batteries - Were living in a time when new technology is extremely material-dependent.,https://www.reddit.com/r/Futurology/comments/7a430v/what_to_worry_about_when_youre_worrying_about/,[deleted],1509548228,[deleted],0,1
51,2017-11-1,2017,11,1,23,7a4350,What to worry about when you're worrying about lithium-ion batteries - Were living in a time when new technology is extremely material-dependent.,https://www.reddit.com/r/Futurology/comments/7a4350/what_to_worry_about_when_youre_worrying_about/,izumi3682,1509548259,,1,11
52,2017-11-2,2017,11,2,0,7a4540,"Heres How to Get to Conscious Machines, Neuroscientists Say",https://www.reddit.com/r/Futurology/comments/7a4540/heres_how_to_get_to_conscious_machines/,dwaxe,1509548748,,7,9
53,2017-11-2,2017,11,2,0,7a4dun,An algorithm that uses AI to enhance low resolution images,https://www.reddit.com/r/Futurology/comments/7a4dun/an_algorithm_that_uses_ai_to_enhance_low/,MaxinMusic,1509550967,,28,251
54,2017-11-2,2017,11,2,0,7a4fgx,You wouldn't believe what it said when asked about the future!! | Sophia...,https://www.reddit.com/r/Futurology/comments/7a4fgx/you_wouldnt_believe_what_it_said_when_asked_about/,LearnAbout_TV,1509551376,,2,0
55,2017-11-2,2017,11,2,1,7a4ih5,Can Japan burn flammable ice for energy?,https://www.reddit.com/r/Futurology/comments/7a4ih5/can_japan_burn_flammable_ice_for_energy/,jhogal,1509552090,,2,4
56,2017-11-2,2017,11,2,1,7a4ima,3 Keys To A Successful Bank-Fintech Partnership,https://www.reddit.com/r/Futurology/comments/7a4ima/3_keys_to_a_successful_bankfintech_partnership/,fintechAI,1509552116,,0,0
57,2017-11-2,2017,11,2,1,7a4jwt,Scientists Model the Living Brain with Virtual Neurons,https://www.reddit.com/r/Futurology/comments/7a4jwt/scientists_model_the_living_brain_with_virtual/,izumi3682,1509552432,,0,5
58,2017-11-2,2017,11,2,1,7a4k4j,Google Docs Glitch That Locked Out Users Underscores Privacy Concerns,https://www.reddit.com/r/Futurology/comments/7a4k4j/google_docs_glitch_that_locked_out_users/,johnmountain,1509552490,,1,2
59,2017-11-2,2017,11,2,1,7a4m5d,The robot lawyers are here and winning,https://www.reddit.com/r/Futurology/comments/7a4m5d/the_robot_lawyers_are_here_and_winning/,stormforce7916,1509552982,,4,55
60,2017-11-2,2017,11,2,1,7a4mii,This Guy Just Injected Himself With a DIY HIV Treatment on Facebook Live,https://www.reddit.com/r/Futurology/comments/7a4mii/this_guy_just_injected_himself_with_a_diy_hiv/,[deleted],1509553067,[deleted],1,1
61,2017-11-2,2017,11,2,2,7a50xx,"Peer-to-Peer Cryptocurrency Marketplace OpenBazaar Launches Version 2.0 with Over 10,000 Nodes",https://www.reddit.com/r/Futurology/comments/7a50xx/peertopeer_cryptocurrency_marketplace_openbazaar/,majorpaynei86,1509556607,,1,29
62,2017-11-2,2017,11,2,2,7a50yy,A Machine Might Just Read Your Mind and Predict If You're Suicidal,https://www.reddit.com/r/Futurology/comments/7a50yy/a_machine_might_just_read_your_mind_and_predict/,redditsteddy,1509556615,,0,1
63,2017-11-2,2017,11,2,2,7a54o6,"Will technology take your job? New analysis says more of us are safer than we thought, but not all",https://www.reddit.com/r/Futurology/comments/7a54o6/will_technology_take_your_job_new_analysis_says/,stormforce7916,1509557479,,2,5
64,2017-11-2,2017,11,2,2,7a5530,An alternative take on Revolution IV,https://www.reddit.com/r/Futurology/comments/7a5530/an_alternative_take_on_revolution_iv/,OliverSparrow,1509557570,"This subReddit is a bubble, and I thought that its denizens might appreciate an alternative view. This from Macro-Strategy Partners: 

The power of liquidity in driving markets is no more apparent than in tech, where the equity markets are pricing stocks at bubble levels despite a collapse in tech productivity, despite clear signs of a downturn in their major source of profits (advertising) and despite a zero-sum content escalation war. 

At MacroStrategy we see it as a great irony that the second major tech boom in our generation is taking place at the exact time that a breakdown in Moores law, Dennard scaling &amp; Kryders law is undermining the entire premise behind the fourth industrial revolution. 

In this note Ill explain why the next tech bust may coincide with a self-reinforcing collapse in advertising. When productivity &amp; the capital stock is growing, advertising is a fundamental driver of increased value. When productivity is falling, advertising becomes just another cost to be cut in a race to the bottom. Witness Unilevers 17% reduction ad spend in H1 this year. 

Bitcoin is the posterchild of Tech bubble 2.0. Bitcoin has no intrinsic value. Transaction costs are averaging 28,500x those of Visa, and transaction clearance times average 1.1m times longer, with a 20% failure rate. As my colleague Andy Lees has argued it is totally non-viable as a currency, and is nothing more than a speculative instrument. 

When global US$ liquidity starts to tighten on a sustained basis (I anticipate that the next leg of tightening will start in early-mid December), I expect Bitcoin to go the way of Pets.com. It will likely lead a 2001 style tech de-rating. ",3,3
65,2017-11-2,2017,11,2,2,7a57te,University of Texas Makes New Material to Double Battery Energy,https://www.reddit.com/r/Futurology/comments/7a57te/university_of_texas_makes_new_material_to_double/,jps246,1509558221,,2,39
66,2017-11-2,2017,11,2,2,7a5brb,Exploring the future of politics,https://www.reddit.com/r/Futurology/comments/7a5brb/exploring_the_future_of_politics/,myothercarisayoshi,1509559185,,3,3
67,2017-11-2,2017,11,2,3,7a5jjp,Immortality: What's Going To Happen?,https://www.reddit.com/r/Futurology/comments/7a5jjp/immortality_whats_going_to_happen/,KidMentalist,1509561041,"Hi all, at the moment I'm creating a mini series on YT about various scientific topics that I'm encountering whilst reading Homo Deus: A Brief History of Tomorrow by Yuval Noah Harari. One of the first futuristic topics that is discussed is the invention of immortality or the extension of the human life span to 150 years+. I'm really interested in hearing some feedback from the Reddit community on what you think is going to happen. Any links to other bodies of work on this topic would be much appreciated as well. ",15,1
68,2017-11-2,2017,11,2,3,7a5lhf,"The Data Doesn't Back Up That ""Automation Creates Jobs"" Theory",https://www.reddit.com/r/Futurology/comments/7a5lhf/the_data_doesnt_back_up_that_automation_creates/,2noame,1509561528,,217,543
69,2017-11-2,2017,11,2,3,7a5o7a,AI and the Second Coming,https://www.reddit.com/r/Futurology/comments/7a5o7a/ai_and_the_second_coming/,owlman89,1509562200,"Does anyone else think that religious people will interpret the rise of AI, and the point at which it has superhuman capabilities, as the fulfillment of biblical prophecies? Or will AI always be seen as something separate from religion by such people?",3,2
70,2017-11-2,2017,11,2,4,7a5wrf,Sony just announced a new Aibo robot dog,https://www.reddit.com/r/Futurology/comments/7a5wrf/sony_just_announced_a_new_aibo_robot_dog/,izumi3682,1509564307,,0,7
71,2017-11-2,2017,11,2,4,7a62lz,Massive global research collaboration known as the Earth Microbiome Project catalogues planets microbial diversity at unprecedented scale,https://www.reddit.com/r/Futurology/comments/7a62lz/massive_global_research_collaboration_known_as/,CMI_UCSD,1509565759,,0,19
72,2017-11-2,2017,11,2,4,7a62si,"Eric Schmidt says America needs to get its act together in AI competition with China - Trust me, these Chinese people are good",https://www.reddit.com/r/Futurology/comments/7a62si/eric_schmidt_says_america_needs_to_get_its_act/,izumi3682,1509565803,,2208,16302
73,2017-11-2,2017,11,2,5,7a678q,"Google's AI Wizard Unveils a New Twist on Neural Networks - Hintons new approach, known as capsule networks, is a twist on neural networks intended to make machines better able to understand the world through images or video.",https://www.reddit.com/r/Futurology/comments/7a678q/googles_ai_wizard_unveils_a_new_twist_on_neural/,mvea,1509566881,,2,22
74,2017-11-2,2017,11,2,5,7a67g3,'We can't compete': why universities are losing their best AI scientists,https://www.reddit.com/r/Futurology/comments/7a67g3/we_cant_compete_why_universities_are_losing_their/,mvea,1509566936,,56,178
75,2017-11-2,2017,11,2,5,7a67oc,What's next for Africa?,https://www.reddit.com/r/Futurology/comments/7a67oc/whats_next_for_africa/,gabrielhoc666,1509566995,[removed],0,1
76,2017-11-2,2017,11,2,5,7a68ja,"Robots in Finance Bring New Risks to Stability, Regulators Warn - Financial Stability Board issues paper on AI, machine learning",https://www.reddit.com/r/Futurology/comments/7a68ja/robots_in_finance_bring_new_risks_to_stability/,[deleted],1509567208,[deleted],1,8
77,2017-11-2,2017,11,2,5,7a6ajb,"UK citizens should be entitled to 'universal basic infrastructure', says independent commission - The state should use its purchasing power to create new markets and drive innovation in healthcare and technology to tackle climate change",https://www.reddit.com/r/Futurology/comments/7a6ajb/uk_citizens_should_be_entitled_to_universal_basic/,mvea,1509567706,,82,928
78,2017-11-2,2017,11,2,5,7a6byc,Google is launching an AR and VR object library called Poly,https://www.reddit.com/r/Futurology/comments/7a6byc/google_is_launching_an_ar_and_vr_object_library/,izumi3682,1509568077,,1,49
79,2017-11-2,2017,11,2,5,7a6c64,"New cancer drug could help people with heart problems - ""the drug Trodusquemine could completely reverse the build-up of fatty material inside arteries""",https://www.reddit.com/r/Futurology/comments/7a6c64/new_cancer_drug_could_help_people_with_heart/,Juicy_K_Girl,1509568127,,51,245
80,2017-11-2,2017,11,2,5,7a6c99,Never take advice from these people- Grant Cardone,https://www.reddit.com/r/Futurology/comments/7a6c99/never_take_advice_from_these_people_grant_cardone/,My30sblog,1509568148,,0,1
81,2017-11-2,2017,11,2,5,7a6do3,"Oyster-tecture - Trillions of oysters once surrounded New York City, filtering bacteria and acting as a natural buffer against storm surges. But pollution and other environmental changes killed off that helpful oyster population. Now, forward-looking landscape architects are bringing them back.",https://www.reddit.com/r/Futurology/comments/7a6do3/oystertecture_trillions_of_oysters_once/,misnamed,1509568506,,48,1538
