,date,year,month,day,hour,id,title,full_link,author,created,selftext,num_comments,score
705,2017-11-8,2017,11,8,23,7blpyr,Fighter jets with lasers will become a reality in 2021,https://www.reddit.com/r/Futurology/comments/7blpyr/fighter_jets_with_lasers_will_become_a_reality_in/,EuGENE87,1510152168,,1076,11736
706,2017-11-9,2017,11,9,0,7bluf3,Uber announces partnership with NASA to launch flying cars in Los Angeles by 2020,https://www.reddit.com/r/Futurology/comments/7bluf3/uber_announces_partnership_with_nasa_to_launch/,Portis403,1510153352,,3,9
707,2017-11-9,2017,11,9,0,7blvtv,Millennials will dictate and lead the transition to a Bitcoin based financial and economic future of the world.,https://www.reddit.com/r/Futurology/comments/7blvtv/millennials_will_dictate_and_lead_the_transition/,[deleted],1510153699,[deleted],1,4
708,2017-11-9,2017,11,9,0,7bm4gc,Objections to Ai,https://www.reddit.com/r/Futurology/comments/7bm4gc/objections_to_ai/,Jakeypoos,1510155965,"I think Steven Hawking doesn't like the idea of Ai taking away his pre-eminence as a theoretical physicist. And the same is true to  a lesser extent with Elon Musk. I think Ai could be a pretty wild ride though as using quantum computing it improves exponentially, so that it can do 20,000 years of human thinking in a billionth of a second and then improve to 100,000 years per billionth before the second is out. ",12,0
709,2017-11-9,2017,11,9,0,7bm5no,Nasdaq Vice Chairman: AI Business Sector Will Come from Future Tech,https://www.reddit.com/r/Futurology/comments/7bm5no/nasdaq_vice_chairman_ai_business_sector_will_come/,izumi3682,1510156259,,0,1
710,2017-11-9,2017,11,9,0,7bm5zp,A New Discovery May Allow Us to Finally Make an Invisibility Cloak,https://www.reddit.com/r/Futurology/comments/7bm5zp/a_new_discovery_may_allow_us_to_finally_make_an/,izumi3682,1510156343,,0,1
711,2017-11-9,2017,11,9,0,7bm6bw,IBM Just Simulated the Biggest Quantum Computer to Date - What That Means for the Field,https://www.reddit.com/r/Futurology/comments/7bm6bw/ibm_just_simulated_the_biggest_quantum_computer/,izumi3682,1510156421,,10,25
712,2017-11-9,2017,11,9,0,7bm6ue,Will AR replace phones?,https://www.reddit.com/r/Futurology/comments/7bm6ue/will_ar_replace_phones/,TemporaryUser10,1510156549,"So, a few years back Google Glass entered the market, but many people were not comfortable with that level of technology. Now, we are getting to a point where there are 4 or 5 different companies about to release AR technologies. As the public gets use to having their computer on their glasses rather than on a phone screen, do you think that phones will start to disappear, or will they take on a new role. 


Personally I am inclined to believe that phones will act as ""servers"" to unify multiple devices (glasses, watches, trackers, headsets and necklaces) due to their ability to pack in a large battery, and large storage while acting as a router to necessary devices, but I was wondering what other people think",107,41
713,2017-11-9,2017,11,9,0,7bm766,Stuytown Apartments in NYC is going to have the country's largest private multi-family residential solar array.,https://www.reddit.com/r/Futurology/comments/7bm766/stuytown_apartments_in_nyc_is_going_to_have_the/,PowerOf10,1510156637,,0,4
714,2017-11-9,2017,11,9,0,7bm7nl,Full Tilt: When 100% of Cars Are Autonomous,https://www.reddit.com/r/Futurology/comments/7bm7nl/full_tilt_when_100_of_cars_are_autonomous/,[deleted],1510156761,[deleted],1,0
715,2017-11-9,2017,11,9,1,7bma7n,"Meet Sophia, the first robot citizen",https://www.reddit.com/r/Futurology/comments/7bma7n/meet_sophia_the_first_robot_citizen/,Stark_Warg,1510157343,,0,0
716,2017-11-9,2017,11,9,1,7bmdea,A.I. system finds cracks in nuclear reactors,https://www.reddit.com/r/Futurology/comments/7bmdea/ai_system_finds_cracks_in_nuclear_reactors/,izumi3682,1510158123,,74,2272
717,2017-11-9,2017,11,9,1,7bmfri,"EU on track for 2020 CO2 emissions targets  Two years after the adoption of the Paris Agreement, the EU remains fully committed to reducing its domestic emissions by at least 40% between 1990 and 2030",https://www.reddit.com/r/Futurology/comments/7bmfri/eu_on_track_for_2020_co2_emissions_targets_two/,[deleted],1510158691,[deleted],0,1
718,2017-11-9,2017,11,9,1,7bmidw,Can stem cells restore hearing without causing cancer?,https://www.reddit.com/r/Futurology/comments/7bmidw/can_stem_cells_restore_hearing_without_causing/,izumi3682,1510159353,,1,7
719,2017-11-9,2017,11,9,1,7bmk64,The EPA has approved the release of weaponized mosquitoes in 20 US states,https://www.reddit.com/r/Futurology/comments/7bmk64/the_epa_has_approved_the_release_of_weaponized/,izumi3682,1510159788,,6,33
720,2017-11-9,2017,11,9,1,7bmkej,Only danger from robotics is falling behind our rivals,https://www.reddit.com/r/Futurology/comments/7bmkej/only_danger_from_robotics_is_falling_behind_our/,izumi3682,1510159848,,0,8
721,2017-11-9,2017,11,9,1,7bmkvd,Democracy Needs a Reboot for the Age of Artificial Intelligence,https://www.reddit.com/r/Futurology/comments/7bmkvd/democracy_needs_a_reboot_for_the_age_of/,izumi3682,1510159953,,156,1121
722,2017-11-9,2017,11,9,1,7bml3w,Why Google's Artificial Intelligence Confused A Turtle for A Rifle,https://www.reddit.com/r/Futurology/comments/7bml3w/why_googles_artificial_intelligence_confused_a/,izumi3682,1510160008,,0,5
723,2017-11-9,2017,11,9,1,7bmllz,VW taps Google's quantum computers to help develop EV batteries,https://www.reddit.com/r/Futurology/comments/7bmllz/vw_taps_googles_quantum_computers_to_help_develop/,izumi3682,1510160132,,0,10
724,2017-11-9,2017,11,9,1,7bmlvt,Hard computing problem might be solvable only by quantum computers,https://www.reddit.com/r/Futurology/comments/7bmlvt/hard_computing_problem_might_be_solvable_only_by/,izumi3682,1510160202,,1,9
725,2017-11-9,2017,11,9,2,7bmn0i,Supercomputer in your pocket: AT&amp;T creating test site for edge computing,https://www.reddit.com/r/Futurology/comments/7bmn0i/supercomputer_in_your_pocket_att_creating_test/,izumi3682,1510160466,,2,4
726,2017-11-9,2017,11,9,2,7bmn0u,SpaceX is Investigating a Rocket Engine Explosion at its Texas Facility,https://www.reddit.com/r/Futurology/comments/7bmn0u/spacex_is_investigating_a_rocket_engine_explosion/,Evan2895,1510160467,,3,8
727,2017-11-9,2017,11,9,2,7bmnb5,Can Technology Help Mend Americas Divided Healthcare System?,https://www.reddit.com/r/Futurology/comments/7bmnb5/can_technology_help_mend_americas_divided/,dwaxe,1510160531,,3,2
728,2017-11-9,2017,11,9,2,7bmqog,Scientists Hypothesize 'Quark Fusion' Could Outperform Nuclear Fusion,https://www.reddit.com/r/Futurology/comments/7bmqog/scientists_hypothesize_quark_fusion_could/,izumi3682,1510161293,,41,255
729,2017-11-9,2017,11,9,2,7bmr76,CRISPR-Cas9 and the future of gene editing and genetic counseling,https://www.reddit.com/r/Futurology/comments/7bmr76/crisprcas9_and_the_future_of_gene_editing_and/,izumi3682,1510161418,,0,25
730,2017-11-9,2017,11,9,2,7bmw1u,Graffiti on stop signs could trick driverless cars into driving dangerously,https://www.reddit.com/r/Futurology/comments/7bmw1u/graffiti_on_stop_signs_could_trick_driverless/,truilt,1510162548,,71,361
731,2017-11-9,2017,11,9,2,7bmybg,"Plug-In EV Sales In Norway Up 48% In October, Overall Market Share at 43%",https://www.reddit.com/r/Futurology/comments/7bmybg/plugin_ev_sales_in_norway_up_48_in_october/,johnmountain,1510163085,,0,16
732,2017-11-9,2017,11,9,2,7bn1j0,Stephen Hawking: Earth will be a fireball by 2600,https://www.reddit.com/r/Futurology/comments/7bn1j0/stephen_hawking_earth_will_be_a_fireball_by_2600/,[deleted],1510163823,[deleted],2,0
733,2017-11-9,2017,11,9,3,7bn3v6,AI is worth the existential risk,https://www.reddit.com/r/Futurology/comments/7bn3v6/ai_is_worth_the_existential_risk/,Johnfcarlos8,1510164320,"While there's an inherent risk in developing AI, in that it may decide to exterminate humans, I'd like to suggest that we look at this risk in a different way. 

Yes, AI can pose an existential risk, but it's only one of perhaps a dozen. There are existential risks via super volcanoes, meteor strikes, nuclear fallout, superbugs, and more. If we don't figure out AI, then eventually we'll have to deal with one of these other existential risks. 

If we create AI that is hostile to humans, then chances are it would simply be an extinction event that happens sooner than the other possibilities. In other words, the end result of malevolent AI is that same as these other existential risks, just that it'd destroy us earlier than, say, a meteor strike happening in 1000 years.

But what if we manage to create AI that serves us exactly as we hope it does? For one, it means that the existential risk of AI is out of the way, but more so, it would mean we have the ultimate tool for dealing with the various other existential risks that I listed. A benevolent super AI would be significantly more capable than humans in dealing with a super volcano, or a meteor strike, or a superbug. Solving AI, therefore, would be our best bet for ensuring long-term human survival.",63,14
734,2017-11-9,2017,11,9,3,7bn5oz,How to Think Like Leonardo da Vinci and Unlock Your Creative Potential,https://www.reddit.com/r/Futurology/comments/7bn5oz/how_to_think_like_leonardo_da_vinci_and_unlock/,dwaxe,1510164739,,1,15
735,2017-11-9,2017,11,9,3,7bn6fy,Former GM Vice Chair just predicted the car industrys future: it has no future,https://www.reddit.com/r/Futurology/comments/7bn6fy/former_gm_vice_chair_just_predicted_the_car/,stevestgermain,1510164901,,155,234
736,2017-11-9,2017,11,9,3,7bn9yt,Huge carbon sink in soil minerals: New avenue for offsetting rising greenhouse gases,https://www.reddit.com/r/Futurology/comments/7bn9yt/huge_carbon_sink_in_soil_minerals_new_avenue_for/,IchTanze,1510165714,,0,3
737,2017-11-9,2017,11,9,3,7bncyi,"""Killer"" mosquitoes are being unleashed in the US to fight disease",https://www.reddit.com/r/Futurology/comments/7bncyi/killer_mosquitoes_are_being_unleashed_in_the_us/,eggn00dles,1510166414,,5,4
738,2017-11-9,2017,11,9,4,7bnjlj,"Ben Goertzel of Hanson Robotics on stage with robots, Einstein and Sophia at #WebSummit 2017",https://www.reddit.com/r/Futurology/comments/7bnjlj/ben_goertzel_of_hanson_robotics_on_stage_with/,LeviathanPrivick,1510167890,,0,1
739,2017-11-9,2017,11,9,4,7bnkqs,The future is here: Genetically engineered stem cells save a patient,https://www.reddit.com/r/Futurology/comments/7bnkqs/the_future_is_here_genetically_engineered_stem/,TheRage77,1510168115,,8,112
740,2017-11-9,2017,11,9,4,7bnqtj,TIL Thin Film lets you turn any surface into a solar panel,https://www.reddit.com/r/Futurology/comments/7bnqtj/til_thin_film_lets_you_turn_any_surface_into_a/,[deleted],1510169506,[deleted],0,2
741,2017-11-9,2017,11,9,4,7bnqux,Air Taxi Service,https://www.reddit.com/r/Futurology/comments/7bnqux/air_taxi_service/,Shadowguard50,1510169516,,0,2
742,2017-11-9,2017,11,9,4,7bnr3x,Killer robots: Australias AI leaders urge PM to support a ban on lethal autonomous weapons,https://www.reddit.com/r/Futurology/comments/7bnr3x/killer_robots_australias_ai_leaders_urge_pm_to/,johnmountain,1510169565,,1,3
743,2017-11-9,2017,11,9,4,7bnrvv,Groundbreaking quark fusion generates 10 time as much energy as nuclear fusion,https://www.reddit.com/r/Futurology/comments/7bnrvv/groundbreaking_quark_fusion_generates_10_time_as/,[deleted],1510169759,[deleted],0,1
744,2017-11-9,2017,11,9,4,7bnwsp,"Uber dominates the streets and the company hopes to tackle the sky next, with flying taxis tested by 2020and they signed a partnership with NASA to do so.",https://www.reddit.com/r/Futurology/comments/7bnwsp/uber_dominates_the_streets_and_the_company_hopes/,[deleted],1510170914,[deleted],1,1
745,2017-11-9,2017,11,9,5,7bnz7m,"IBM's New, Cutting Edge Tech Could Make Computers 200 Times Faster",https://www.reddit.com/r/Futurology/comments/7bnz7m/ibms_new_cutting_edge_tech_could_make_computers/,ibmzrl,1510171470,,0,1
746,2017-11-9,2017,11,9,5,7bnz9o,"'Butterfly child' given life-saving skin - A child has been given a new genetically modified skin that covers 80% of his body, in a series of lifesaving operations.",https://www.reddit.com/r/Futurology/comments/7bnz9o/butterfly_child_given_lifesaving_skin_a_child_has/,[deleted],1510171485,[deleted],0,1
747,2017-11-9,2017,11,9,5,7bo04g,Lockheed contracted to develop airborne laser capability,https://www.reddit.com/r/Futurology/comments/7bo04g/lockheed_contracted_to_develop_airborne_laser/,nliausacmmv,1510171689,,1,4
748,2017-11-9,2017,11,9,5,7bo0t2,"100% Renewable Electricity to Power the World by 2050? It's Happening, Study Says",https://www.reddit.com/r/Futurology/comments/7bo0t2/100_renewable_electricity_to_power_the_world_by/,mvea,1510171849,,1,24
749,2017-11-9,2017,11,9,5,7bo0tm,"The Justice Department is demanding that AT&amp;T sell Turner Broadcasting, which includes CNN, or sell DirecTV, for approval of the $85 billion merger with Time Warner.",https://www.reddit.com/r/Futurology/comments/7bo0tm/the_justice_department_is_demanding_that_att_sell/,[deleted],1510171852,[deleted],2,20
750,2017-11-9,2017,11,9,5,7bo23s,"For Brain-Computer Interfaces to Be Useful, Theyll Need to Be Wireless",https://www.reddit.com/r/Futurology/comments/7bo23s/for_braincomputer_interfaces_to_be_useful_theyll/,[deleted],1510172146,[deleted],1,8
751,2017-11-9,2017,11,9,5,7bo2lv,This is how tech can help us all survive a modern-day apocalypse,https://www.reddit.com/r/Futurology/comments/7bo2lv/this_is_how_tech_can_help_us_all_survive_a/,izumi3682,1510172256,,0,0
752,2017-11-9,2017,11,9,5,7bo2ub,Genetically Altered Skin Saves A Boy Dying Of A Rare Disease,https://www.reddit.com/r/Futurology/comments/7bo2ub/genetically_altered_skin_saves_a_boy_dying_of_a/,nliausacmmv,1510172309,,1,2
753,2017-11-9,2017,11,9,5,7bo4op,IBMs plan to regulate pot with blockchains isnt as crazy as it sounds,https://www.reddit.com/r/Futurology/comments/7bo4op/ibms_plan_to_regulate_pot_with_blockchains_isnt/,nliausacmmv,1510172740,,0,2
754,2017-11-9,2017,11,9,5,7bo4uh,Artificial Intelligence Could Hijack Brain-Computer Interfaces and Take Control of Our Minds,https://www.reddit.com/r/Futurology/comments/7bo4uh/artificial_intelligence_could_hijack/,mvea,1510172781,,8,19
755,2017-11-9,2017,11,9,5,7bo5jl,"We must not let big tech threaten our security, freedoms and democracy - Al Franken",https://www.reddit.com/r/Futurology/comments/7bo5jl/we_must_not_let_big_tech_threaten_our_security/,mvea,1510172939,,2,28
756,2017-11-9,2017,11,9,5,7bo94h,Boy is given new skin thanks to gene therapy,https://www.reddit.com/r/Futurology/comments/7bo94h/boy_is_given_new_skin_thanks_to_gene_therapy/,izumi3682,1510173817,,2,3
757,2017-11-9,2017,11,9,5,7boc9l,Meet the scientists building a library of designer drugs,https://www.reddit.com/r/Futurology/comments/7boc9l/meet_the_scientists_building_a_library_of/,izumi3682,1510174585,,0,6
758,2017-11-9,2017,11,9,6,7bohz0,"Human Mini-Brains Growing Inside Rat Bodies Are Starting to Integrate: ""We are entering totally new ground here.""",https://www.reddit.com/r/Futurology/comments/7bohz0/human_minibrains_growing_inside_rat_bodies_are/,mvea,1510175972,,74,209
759,2017-11-9,2017,11,9,6,7bojad,Well 1.5 hours into the Hop On launch and it crashes into semi truck in downtown Las Vegas,https://www.reddit.com/r/Futurology/comments/7bojad/well_15_hours_into_the_hop_on_launch_and_it/,Lvchapino,1510176316,,0,1
760,2017-11-9,2017,11,9,6,7bojla,Technology is. But if managed and directed we can avoid negative consequences.,https://www.reddit.com/r/Futurology/comments/7bojla/technology_is_but_if_managed_and_directed_we_can/,[deleted],1510176399,[deleted],1,0
761,2017-11-9,2017,11,9,6,7bon74,Graphene Takes Us One Step Closer to Flexible Terahertz Electronics,https://www.reddit.com/r/Futurology/comments/7bon74/graphene_takes_us_one_step_closer_to_flexible/,Vailhem,1510177275,,0,8
762,2017-11-9,2017,11,9,6,7bop66,"In Amazons game engine, voice actors can now be replaced with robots - Just after actor strike ends, Lumberyard update adds a full text-to-speech pipeline.",https://www.reddit.com/r/Futurology/comments/7bop66/in_amazons_game_engine_voice_actors_can_now_be/,mvea,1510177759,,11,35
763,2017-11-9,2017,11,9,6,7bop6w,China's Race to Find Aliens First,https://www.reddit.com/r/Futurology/comments/7bop6w/chinas_race_to_find_aliens_first/,lughnasadh,1510177763,,5,11
764,2017-11-9,2017,11,9,6,7boql6,Self-driving shuttle hits Las Vegas streets,https://www.reddit.com/r/Futurology/comments/7boql6/selfdriving_shuttle_hits_las_vegas_streets/,izumi3682,1510178131,,6,9
765,2017-11-9,2017,11,9,7,7bov3p,Four ethical priorities for neurotechnologies and AI,https://www.reddit.com/r/Futurology/comments/7bov3p/four_ethical_priorities_for_neurotechnologies_and/,philotrow,1510179305,,0,2
766,2017-11-9,2017,11,9,7,7bp58k,Report: Apple AR Headset Coming In 2020 With Brand New OS,https://www.reddit.com/r/Futurology/comments/7bp58k/report_apple_ar_headset_coming_in_2020_with_brand/,Chispy,1510181891,,0,3
767,2017-11-9,2017,11,9,8,7bp7fg,"Golden potato delivers bounty of vitamins A and E - Experimental tuber could cut disease in developing nations, study suggests",https://www.reddit.com/r/Futurology/comments/7bp7fg/golden_potato_delivers_bounty_of_vitamins_a_and_e/,mvea,1510182455,,3,30
768,2017-11-9,2017,11,9,8,7bp9w4,17 STEM Politicians Won Elections Tuesday,https://www.reddit.com/r/Futurology/comments/7bp9w4/17_stem_politicians_won_elections_tuesday/,Evan2895,1510183134,,6,61
769,2017-11-9,2017,11,9,8,7bpb0s,"Star A.I. expert leaves Elon Musk's OpenAI to form 'Embodied Intelligence,' which aims to develop AI software that makes it easy to teach robots new, complex skills.",https://www.reddit.com/r/Futurology/comments/7bpb0s/star_ai_expert_leaves_elon_musks_openai_to_form/,Evan2895,1510183448,,0,12
770,2017-11-9,2017,11,9,8,7bpch4,Uber Elevate | The Future Of Urban Air Transport,https://www.reddit.com/r/Futurology/comments/7bpch4/uber_elevate_the_future_of_urban_air_transport/,[deleted],1510183867,[deleted],0,1
771,2017-11-9,2017,11,9,8,7bpcqp,Lamborghini Terzo Millennio is a self-healing supercar from the Future,https://www.reddit.com/r/Futurology/comments/7bpcqp/lamborghini_terzo_millennio_is_a_selfhealing/,[deleted],1510183940,[deleted],0,1
772,2017-11-9,2017,11,9,8,7bpedv,[Prediction] Self-Driving Cars will replace most long-distance trains,https://www.reddit.com/r/Futurology/comments/7bpedv/prediction_selfdriving_cars_will_replace_most/,bayernguy9,1510184401,"Since Waymo announcement Ive been thinking about self driving cars and the effect on public transportation.  Traffic on big cities like New York or Tokyo ist already very congested which is why I think people will still use the subway at least at first.

Between big cities(100-300km apart) most people in Europe travel with the train but trains are usually very expensive. With self driving cars sharing with 3 or 4 other people would make the trip faster, more comfortable and cheaper. You wouldnt need to go to the station or from the station and you would have to wait or plan for the train. These trips are made daily by tens thousands of people, that would mean there would be cars leaving every 2 minutes in both directions making the trip with self driving cars the better one.

Or the price of the trains would have to decrease a LOT so that people would take the train.

What do you guys think? ",1,0
773,2017-11-9,2017,11,9,8,7bpejm,Driverless cars dont have to be that good to be better than humans,https://www.reddit.com/r/Futurology/comments/7bpejm/driverless_cars_dont_have_to_be_that_good_to_be/,mvea,1510184440,,220,630
774,2017-11-9,2017,11,9,9,7bpj8l,Training for Artificial Intelligence in Warfare,https://www.reddit.com/r/Futurology/comments/7bpj8l/training_for_artificial_intelligence_in_warfare/,amsterdam4space,1510185760,,1,1
775,2017-11-9,2017,11,9,9,7bpjz2,Uber's plans low flying taxi service.,https://www.reddit.com/r/Futurology/comments/7bpjz2/ubers_plans_low_flying_taxi_service/,[deleted],1510185990,[deleted],2,1
776,2017-11-9,2017,11,9,9,7bpkor,Elon Musk met with controversial Turkish President to discuss potential 'cooperation',https://www.reddit.com/r/Futurology/comments/7bpkor/elon_musk_met_with_controversial_turkish/,[deleted],1510186188,[deleted],0,1
777,2017-11-9,2017,11,9,9,7bpl1k,Elon Musk met with controversial Turkish President Erdoan to discuss potential 'cooperation',https://www.reddit.com/r/Futurology/comments/7bpl1k/elon_musk_met_with_controversial_turkish/,IronyWentOverMyHead,1510186270,,6,7
778,2017-11-9,2017,11,9,9,7bpo6g,Pinned to Instagram Post on Pinterest,https://www.reddit.com/r/Futurology/comments/7bpo6g/pinned_to_instagram_post_on_pinterest/,women4tech,1510187108,,0,1
779,2017-11-9,2017,11,9,9,7bppwz,IS ANYONE INTERESTED IN VOTING IN LOUISIANA?,https://www.reddit.com/r/Futurology/comments/7bppwz/is_anyone_interested_in_voting_in_louisiana/,jimbrownusa,1510187562,[removed],0,1
780,2017-11-9,2017,11,9,10,7bq3az,New Technology Should Be Neither Feared Nor Trusted,https://www.reddit.com/r/Futurology/comments/7bq3az/new_technology_should_be_neither_feared_nor/,wbbarth,1510191308,,1,12
781,2017-11-9,2017,11,9,10,7bq3eq,China is heading for the future: Russian President Putin,https://www.reddit.com/r/Futurology/comments/7bq3eq/china_is_heading_for_the_future_russian_president/,[deleted],1510191337,[deleted],1,1
782,2017-11-9,2017,11,9,10,7bq46g,The power of a living medicine: Gene therapy creates replacement skin to save a dying boy,https://www.reddit.com/r/Futurology/comments/7bq46g/the_power_of_a_living_medicine_gene_therapy/,SirT6,1510191566,,1,1
783,2017-11-9,2017,11,9,10,7bq4f9,"Would cyborgs/uploaded conciousnesses be vulnerable to hackers, and if so, would there be anything we could do to stop such things from happening?",https://www.reddit.com/r/Futurology/comments/7bq4f9/would_cyborgsuploaded_conciousnesses_be/,Foxmanded42,1510191645,Would we just need antiviruses or would we have to form a real life Section 9?,4,0
784,2017-11-9,2017,11,9,10,7bq51z,Driverless shuttle hit by truck on first day in Las Vegas,https://www.reddit.com/r/Futurology/comments/7bq51z/driverless_shuttle_hit_by_truck_on_first_day_in/,[deleted],1510191829,[deleted],0,2
785,2017-11-9,2017,11,9,10,7bq5eq,China is heading for the future: Russian President Putin,https://www.reddit.com/r/Futurology/comments/7bq5eq/china_is_heading_for_the_future_russian_president/,TheRedDragon88,1510191936,,0,6
786,2017-11-9,2017,11,9,10,7bq5q2,"Scientists grow replacement skin for boy suffering devastating genetic disorder: Seven-year-old boy suffering illness causing untreatable wounds over 80% of his body has had his skin replaced by new, genetically modified epidermis.",https://www.reddit.com/r/Futurology/comments/7bq5q2/scientists_grow_replacement_skin_for_boy/,[deleted],1510192032,[deleted],1,1
787,2017-11-9,2017,11,9,11,7bqh55,"Self-driving bus crashes two hours after launch in Las Vegas ""According to the Las Vegas Review-Journal, the human driver of the other vehicle was at fault,""",https://www.reddit.com/r/Futurology/comments/7bqh55/selfdriving_bus_crashes_two_hours_after_launch_in/,endtimesranter,1510195339,,14,22
788,2017-11-9,2017,11,9,12,7bqkvp,Anyone been over to r/environment? You guys really should check this shit out.,https://www.reddit.com/r/Futurology/comments/7bqkvp/anyone_been_over_to_renvironment_you_guys_really/,realestnwah,1510196469,[removed],3,4
789,2017-11-9,2017,11,9,12,7bqnl4,"China and US A.I. rivalry like space race of the 1950s, Jim Breyer says",https://www.reddit.com/r/Futurology/comments/7bqnl4/china_and_us_ai_rivalry_like_space_race_of_the/,shaunlgs,1510197294,,3,9
790,2017-11-9,2017,11,9,12,7bqnsu,Reversing Aging: Scientists Make Old Human Cells Look and Act Younger In Breakthrough Discovery,https://www.reddit.com/r/Futurology/comments/7bqnsu/reversing_aging_scientists_make_old_human_cells/,stepsinstereo,1510197352,,6,19
791,2017-11-9,2017,11,9,12,7bqqrc,Plastic-eating caterpillars could save the planet,https://www.reddit.com/r/Futurology/comments/7bqqrc/plasticeating_caterpillars_could_save_the_planet/,stepsinstereo,1510198268,,11,64
792,2017-11-9,2017,11,9,12,7bqt3s,CSIRO launch program to make Australia hydrogen fuel leader. The CSIRO has launched new Future Science Platforms to make Australia a renewable energy exporter and hydrogen fuel hotspot.,https://www.reddit.com/r/Futurology/comments/7bqt3s/csiro_launch_program_to_make_australia_hydrogen/,chopchopped,1510199012,,0,4
793,2017-11-9,2017,11,9,12,7bqt5s,Mt s lu y khi bay tri Thim Th,https://www.reddit.com/r/Futurology/comments/7bqt5s/mt_s_lu_y_khi_bay_tri_thim_th/,huyenmit2b,1510199037,,0,1
794,2017-11-9,2017,11,9,12,7bquci,What Teslas Model 3 UI Reveals About Its Vision for the Future,https://www.reddit.com/r/Futurology/comments/7bquci/what_teslas_model_3_ui_reveals_about_its_vision/,freebsdmonkey,1510199391,,1,0
795,2017-11-9,2017,11,9,13,7br220,Will AI Take Your Job?,https://www.reddit.com/r/Futurology/comments/7br220/will_ai_take_your_job/,Profyte,1510201860,,0,0
796,2017-11-9,2017,11,9,13,7br51x,Uber Air coming to LA in 2020,https://www.reddit.com/r/Futurology/comments/7br51x/uber_air_coming_to_la_in_2020/,xorflame,1510202829,[removed],1,1
797,2017-11-9,2017,11,9,14,7br9g7,The Trolley Problem: The ethics of self-driving cars,https://www.reddit.com/r/Futurology/comments/7br9g7/the_trolley_problem_the_ethics_of_selfdriving_cars/,QuincyOwusuABuyADM,1510204355,,0,0
798,2017-11-9,2017,11,9,15,7brpsk,How Does DeepMind's AlphaGo Zero Work?,https://www.reddit.com/r/Futurology/comments/7brpsk/how_does_deepminds_alphago_zero_work/,mind_bomber,1510210433,,1,0
799,2017-11-9,2017,11,9,16,7brrmi,From Smart to wise: cities of the future - RSA,https://www.reddit.com/r/Futurology/comments/7brrmi/from_smart_to_wise_cities_of_the_future_rsa/,stormforce7916,1510211176,,0,0
