,sbr,sbr_id,date,year,month,hour,day,id,domain,title,full_link,author,created,selftext,num_comments,score,over_18,thumbnail,media_provider,media_thumbnail,media_title,media_description,media_url
240,gameofthrones,t5_2rjz2,2011-5-15,2011,5,15,6,hbh05,self.gameofthrones,Anyone get any letters from their ISP for downloading torrents of the show?,https://www.reddit.com/r/gameofthrones/comments/hbh05/anyone_get_any_letters_from_their_isp_for/,collegebound123,1305409395,"I haven't yet, but PeerBlock shows various big corporations and small special copyright firms monitoring the traffic.

Note: I plan on buying the DVD once it comes out, but I'm not willing to purchase cable AND HBO just for one show. That's my only justification. Yes, yes, I know...",42,17,False,self,,,,,
241,gameofthrones,t5_2rjz2,2011-5-15,2011,5,15,6,hbh3y,self.gameofthrones,Swordfighting Scenes in GoT,https://www.reddit.com/r/gameofthrones/comments/hbh3y/swordfighting_scenes_in_got/,Fearghas,1305409781,"How accurate are the swordfighting scenes in the series so far? I've read they have a fight trainer for the actors, but I wonder if they are using actual styles and such. 

I'm curious to see if Arya is going to be shown using different techniques since her teacher isn't from Westeros like Rodrik Cassel or Alliser Thorne.

Note. I don't know anything about sword fighting so any differences in the series would be lost on me unless I knew what to look for.",78,40,False,self,,,,,
242,gameofthrones,t5_2rjz2,2011-5-15,2011,5,15,8,hbje0,youtube.com,Who is in love with this theme?,https://www.reddit.com/r/gameofthrones/comments/hbje0/who_is_in_love_with_this_theme/,[deleted],1305417546,,0,1,False,default,,,,,
243,gameofthrones,t5_2rjz2,2011-5-16,2011,5,16,2,hbxqg,google.com,DAE jam out on their ASOIAF books?,https://www.reddit.com/r/gameofthrones/comments/hbxqg/dae_jam_out_on_their_asoiaf_books/,tigger_trigger,1305481391,,0,0,False,default,,,,,
244,gameofthrones,t5_2rjz2,2011-5-16,2011,5,16,6,hc22d,i.imgur.com,"Jumping the gun on Season 2 a bit, but this is my vote for Lady Melisandre of Asshai",https://www.reddit.com/r/gameofthrones/comments/hc22d/jumping_the_gun_on_season_2_a_bit_but_this_is_my/,barrymccochenor,1305494404,,83,122,False,http://thumbs.reddit.com/t3_hc22d.png,,,,,
245,gameofthrones,t5_2rjz2,2011-5-16,2011,5,16,6,hc2uh,self.gameofthrones,Spoilerish Questions - I can't wait! ;),https://www.reddit.com/r/gameofthrones/comments/hc2uh/spoilerish_questions_i_cant_wait/,suprfli,1305496571,"I haven't read the books.  I'm absolutely loving this series.  People have complained about it being exposition and dialog heavy but I don't mind that.  The complexity and immersion is amazing.  I'm glad that HBO didn't shy away from that and from someone who didn't read the novels, while it can be a bit confusing, it's fun piecing it all together.  Anyway, I don't want explicit answers but I'm incredibly curious about the direction.  Onto my questions...

* I'm assuming this season follows one single novel.  So, this season can we expect that winter will come?  There's so much discussion about it I can't wait to see what it's like.  If we're 2 seasons in and they're still talking about, ""You've never seen anything like winter. It's more brutal than anything you can imagine."" I won't be able to take it anymore.
* Will we see supernatural elements?  There's talk of what's beyond the wall, the dire wolves seems mystical, the dragon talk. I don't want to know specifics but I want to know if we can expect that type of thing in the season. I mistakenly read part of another post that discussed in previous novels the reason the kingdoms were conquered was in part due to the dragons so it almost sounds like that part is behind us and maybe they are dead.  Again, a yes or no will suffice.  I don't want specifics of what to expect.
* Will Ned's son walk again?  I'm almost hesitant to ask this one and maybe I should wait. There seems to be some foreshadowing. A cryptic answer followed by something covered by the spoiler tag for others would be great.",14,6,False,self,,,,,
246,gameofthrones,t5_2rjz2,2011-5-16,2011,5,16,8,hc4ap,imgur.com,I wish these two could team up again as Stannis and Melisandre,https://www.reddit.com/r/gameofthrones/comments/hc4ap/i_wish_these_two_could_team_up_again_as_stannis/,[deleted],1305500978,,12,9,False,http://thumbs.reddit.com/t3_hc4ap.png,,,,,
247,gameofthrones,t5_2rjz2,2011-5-16,2011,5,16,8,hc54x,self.gameofthrones,[Book Speculation] Two more lineage theories to throw into the mix.,https://www.reddit.com/r/gameofthrones/comments/hc54x/book_speculation_two_more_lineage_theories_to/,TheKingInTheNorth,1305503462,"If you're willing to click on a [Book Speculation] link, I'm assuming that you're already familiar with two of the biggest lineage theories out there: R+L=J and A+J=T.  Here are my two personal theories to throw into the mix.  You don't need to point out the evidence that is stronger for the more popular theories, that's why they're more popular.  I just don't doubt that Martin's is directing the theories where he wants them to go.

Theory #1

 My first theory is an alternate to R+L=J, its just another possibility that I consider, but even I would probably vote for the popular R+L=J theory if I had to choose.  But anyways here it is: R+L=J, but R = Robert.


* Robert was betrothed to Lyanna.
* Robert does not seem like the kind of man to wait for a wedding to bed his woman.
* Rhaegar may have loved Lyanna as well, but missed his chance after she was betrothed to Robert and Lyanna fell in love with Robert.  He 'kidnapped' her hoping that she still loved him, found out that she was pregnant with Robert's child, and decided to keep her safe anyways, away from the war in the Tower of Joy.
* Lyanna made Ned promise her that he would tell Robert that the child was his.  After learning that Robert would be betrothed instead to Cersei, Ned decided that telling Robert was impossible.  It would probably lead to another war with the Lannisters when Robert declared Jon his heir.  Or the child would have to be killed in order to save the peace.
* Ned has thoughts about broken promises right after Robert's death, meaning he failed to ever tell him that Jon was his son.


Ok, that's theory #1, admittedly, I still believe Rhaegar is Jon's father because Jon deserves to be one of the three heads of the Dragon.  And Dany's vision is probably the strongest piece of evidence that isn't covered in my theory.

Theory #2

Instead of A+J=T, I'm putting up for consideration A+J=C+J.

* Cersei and Jamie have a very 'Targaryen like' relationship.
* Cersei and Jamie both lack the sheer cunning that Tywin and Tyrion share.
* After years of failed attempts at an heir, even though they weren't his own children, Tywin accepted Cersei and Jamie as his own so that he may have an heir.
* Once Jamie joined the Kingsguard and Tywin was left without an heir he tried again for years more, and finally Joanna conceived Tyrion, Tywin's biggest shame.  Tyrion's aunt, forget her name, makes a comment about how Tyrion is the most like his father out of his children.
* Cersei takes after the mad king with her paranoia and cruelty.
* Jamie has started on the road to redemption and could become the third head of the dragon.
* This leaves Tyrion to embrace what the world views him as and become the tragic villain later in the story.  I see his final encounter with Jamie becoming the pinnacle of the story's climax in a later book.


Feel free to pick this apart, tell me how I'm obviously wrong, or find some other evidence that could lend support to these theories that I haven't seen covered elsewhere much.",15,11,False,self,,,,,
248,gameofthrones,t5_2rjz2,2011-5-16,2011,5,16,9,hc5p5,youtube.com,http://www.youtube.com/watch?feature=player_embedded&amp;v=qYNeT2nzEgA#at=41,https://www.reddit.com/r/gameofthrones/comments/hc5p5/httpwwwyoutubecomwatchfeatureplayer/,[deleted],1305505250,,0,1,False,default,,,,,
249,gameofthrones,t5_2rjz2,2011-5-16,2011,5,16,9,hc5ts,self.gameofthrones,"Episode Discussion - 1.05 ""The Wolf and the Lion""",https://www.reddit.com/r/gameofthrones/comments/hc5ts/episode_discussion_105_the_wolf_and_the_lion/,DafyddLlyr,1305505655,"Hey there guys, it's that time of the week again!

* **This is a TV spoiler friendly zone** - turn away now if you haven't seen the episode!

* **Book spoilers still need tags!**

Please read our [new spoiler policy](http://www.reddit.com/r/gameofthrones/comments/gyo4k/rgots_new_spoiler_policy/)  before posting.

There's a whole bunch of us chatting live throughout the episode - [details here](http://www.reddit.com/r/gameofthrones/comments/gs984/rgameofthrones_live_chat_join_us/)!

P.S. - I'm quite behind on dishing out the House Tags behind people's names. It's the week of my final exams and things are pretty hectic on my end! I'm going to have to ask all of you who are waiting to be patient with me and wait until Thursday when I can set aside some time to do them all. Thanks.",631,127,False,self,,,,,
250,gameofthrones,t5_2rjz2,2011-5-16,2011,5,16,9,hc5tz,self.gameofthrones,"so how many people have you turned on to GoT, hbo series or the books?",https://www.reddit.com/r/gameofthrones/comments/hc5tz/so_how_many_people_have_you_turned_on_to_got_hbo/,protell,1305505663,"out of the approximately  5280 people i've told, 4 people have read the first book and all 4 LOVED it.  pretty much everyone at my work is watching the hbo series now, not sure who started watching it because of me, so cant really take credit for all of them.  who have you ""turned on"" to GoT?",32,17,False,self,,,,,
251,gameofthrones,t5_2rjz2,2011-5-16,2011,5,16,9,hc6a5,self.gameofthrones,Episode 1 question (Spoilers from Episode 1),https://www.reddit.com/r/gameofthrones/comments/hc6a5/episode_1_question_spoilers_from_episode_1/,I_Raid_Fridges,1305506845,"I was re-watching the first episode of Game of Thrones and I was wondering how the guy from the night's watch made it past the wall and almost back to Winterfell.  When they crossed the wall, they had to go under a gate, but it never explains why he didn't just go back the same way and return to their castle (Castle Black), or how he even managed to cross the wall and go south.

",4,5,False,self,,,,,
252,gameofthrones,t5_2rjz2,2011-5-16,2011,5,16,10,hc6t1,self.gameofthrones,I expected someone larger to be cast as the Mountain.,https://www.reddit.com/r/gameofthrones/comments/hc6t1/i_expected_someone_larger_to_be_cast_as_the/,DivemasterDoug,1305508362,,31,0,False,self,,,,,
253,gameofthrones,t5_2rjz2,2011-5-16,2011,5,16,10,hc7i2,self.gameofthrones,"What?! Knight of Flowers and Renly as [TV Spoiler](/s ""a gay couple""). Did I miss this in the books?",https://www.reddit.com/r/gameofthrones/comments/hc7i2/what_knight_of_flowers_and_renly_as_tv_spoilers_a/,[deleted],1305510391,,0,1,False,default,,,,,
254,gameofthrones,t5_2rjz2,2011-5-16,2011,5,16,10,hc7kh,i.imgur.com,Another milestone passed!,https://www.reddit.com/r/gameofthrones/comments/hc7kh/another_milestone_passed/,[deleted],1305510617,,5,27,False,http://thumbs.reddit.com/t3_hc7kh.png,,,,,
255,gameofthrones,t5_2rjz2,2011-5-16,2011,5,16,10,hc7kt,imgur.com,Only Thing I Could Focus On...,https://www.reddit.com/r/gameofthrones/comments/hc7kt/only_thing_i_could_focus_on/,isocline,1305510652,,18,186,False,http://thumbs.reddit.com/t3_hc7kt.png,,,,,
256,gameofthrones,t5_2rjz2,2011-5-16,2011,5,16,10,hc7nz,self.gameofthrones,Sir Loras and Renly are gay?!?!,https://www.reddit.com/r/gameofthrones/comments/hc7nz/sir_loras_and_renly_are_gay/,asherdante,1305510913,,7,0,False,default,,,,,
257,gameofthrones,t5_2rjz2,2011-5-16,2011,5,16,11,hc7t9,self.gameofthrones,Why the HELL did they do this? *spoilers*,https://www.reddit.com/r/gameofthrones/comments/hc7t9/why_the_hell_did_they_do_this_spoilers/,[deleted],1305511343,"For those of you who read the books, [TV Spoiler] (/s ""Why are Renly and Loras gay lovers? What purpose does this serve? They weren't lovers in the book."") It just seems stupid...",1,1,False,default,,,,,
258,gameofthrones,t5_2rjz2,2011-5-16,2011,5,16,11,hc80s,self.gameofthrones,Why did they do this? *spoilers*,https://www.reddit.com/r/gameofthrones/comments/hc80s/why_did_they_do_this_spoilers/,fecalbeetle,1305511945,"For those of you who read the books, Why did they make Renly and Loras gay lovers? They didnt do this in he books, so what purpose does this serve in the series? Seems pointless. ",21,0,False,self,,,,,
259,gameofthrones,t5_2rjz2,2011-5-16,2011,5,16,11,hc852,self.gameofthrones,"Congratulations, 4000 readers and counting!",https://www.reddit.com/r/gameofthrones/comments/hc852/congratulations_4000_readers_and_counting/,protell,1305512350,,1,9,False,self,,,,,
260,gameofthrones,t5_2rjz2,2011-5-16,2011,5,16,11,hc8b0,self.gameofthrones,Was anyone else disappointed that there was no melee?,https://www.reddit.com/r/gameofthrones/comments/hc8b0/was_anyone_else_disappointed_that_there_was_no/,randolfbubblegum,1305512847,was really looking forward to watching that part especially thoros and his flaming sword,9,12,False,self,,,,,
261,gameofthrones,t5_2rjz2,2011-5-16,2011,5,16,11,hc8hf,itsh.bo,"Game of Thrones Episode 6 Preview - ""A Golden Crown""",https://www.reddit.com/r/gameofthrones/comments/hc8hf/game_of_thrones_episode_6_preview_a_golden_crown/,ReallyBroReally,1305513335,,17,24,False,http://thumbs.reddit.com/t3_hc8hf.png,,,,,
262,gameofthrones,t5_2rjz2,2011-5-16,2011,5,16,11,hc902,self.gameofthrones,Game of Thrones Backstory: Robert's Rebellion  (Varying Degrees of Spoiler; All Clearly Marked and Labeled),https://www.reddit.com/r/gameofthrones/comments/hc902/game_of_thrones_backstory_roberts_rebellion/,theDashRendar,1305514713,"EDIT - Several Edits to add images to help visualizations (all Low/No Spoiler); also added a small correction (thanks libbykino)

The purpose of this is to give some context as to how and why Robert Baratheon became King, and how the Targaryen dynasty was ended, and to give some perspective to non-readers and serve as a refresher for those who don't remember.    Spoilers will range from almost totally safe (ie/ things that I seriously doubt the TV show will have time to show or mention) to some larger ones - which I urge anyone who has not read all the books to avoid.  Read the description before mousing over a paragraph.

*[PART I]*

[Map of Westeros at the start of Robert's Rebellion](http://1.bp.blogspot.com/-QNgFA7OlZJ0/TaZVCUi6IcI/AAAAAAAABd0/Ol8vuzkGHxs/s1600/Map_Westeros_Political.gif) - 100% safe

**The Beginning of the War** (LOW/NO SPOILER (VERY SAFE) - most details have already been implied on the show, larger spoilers omitted)

[Mad King Aerys Targaryen](http://www.terra-di-mezzo.it/immagini/amok/hr/aerys2.jpg)

[Book Spoiler](/b ""Outraged over ongoing indiscretions of the Royal Family, heir to the North and Ned's older brother, Brandon Stark rode to King's Landing to protest the actions of the Targaryens.  Mad King Aerys Targaryen turned out to be a most unreasonable man, and perceived this indignation as a threat and insult.  After arresting Brandon, Rickard Stark, father of Ned and Lord of Winterfell, comes to King's Landing with a small host of men.  Aerys took both Starks, as well as their escort (including the nephew and heir to Jon Arryn, Elbert Arryn) captive, held a dubious show trial, and then burned them all alive, with one exception: witness Ethan Glover as the sole survivor."")

(On a side note, this is exactly why I agree that Sean Bean is the best suited person to play Ned Stark.  I heard many people argue for Liam Neeson, but Liam always strikes me as the eldest/only child.  Sean Bean comes across better as the middle child that had to step up.)

[Book Spoiler](/b ""However, this burnt offering was not enough to appease Mad King Aerys, as he then called for the heads of Ned Stark and the closest friend and ally to Ned, Robert Baratheon - who were both squiring at the Eyrie under Jon Arryn.  Jon Arryn was too noble and decent a man to turn over his students, and undoubtedly outraged at the death of his nephew and heir, so instead raised his banners in revolt.  Many of the lords and nobles of the Vale opted to remain loyal to Aerys, and Jon Arryn was forced to capture Gulltown from the loyalist Lord Grafton, to secure ships so that Robert could flee to his home of Storm's End to muster his army, where he was rightful Lord.  At the same time, Ned took a ship to Winterfell, calling his own banners and hastily arranging a marriage to Catelyn Tully of Riverrun (who had been set to marry Brandon Stark before his untimely death), bringing the longtime friend of the Starks, Hoster Tully, into the conflict on their side (though many Tully Lords and bannermen remained loyal to Aerys, or took no side).   The rebellion had begun."")

**Battle of Summerhall** (LOW/NO SPOILER (VERY SAFE))

[Book Spoiler](/b ""Not all of Robert's bannermen came to his aid when he summoned them.  Lords Fell, Cafferen, and Grandison chose to side with King Aerys, and planned to join their smaller forces at Summerhall to form a single large army, capable of crushing Robert's.  Unexpectedly, Robert took the initiative, and attacked each Lord in turn before they could merge forces.  Fighting three battles in one day, Robert scored three victories, crushing opposition within his lands and scoring the first major victories of the war.  Lord Fell was slain, while Cafferen and Grandison bent their knee and joined Robert in his cause.  King Aerys blamed the defeat on his hand, Lord Merryweather, stripping him of his lands and titles and exiling him to die.  Lord Jon Connington became the next hand, and vowed to take a more active role in stopping Robert."")

[Book Spoiler](/b ""Robert left a sizeable portion of his army under his loyal brother, Stannis (and young Renly), to hold his capital and home of Storm's End, while he marched westward."")

**Battle of Ashford** (LOW/NO SPOILER (VERY SAFE))

[Book Spoiler](/b ""Mace Tyrell of Highgarden, loyal to the crown, lead his much larger force to meet Robert at Ashford.  Randyll Tarly of Horn Hill lead the vanguard of the Tyrell forces, pressed into Robert's force in a bloody but indecisive skirmish - one that sent Robert into a northwards retreat before the larger Tyrell force could join the battle.  With Robert fleeing northward, and Jon Connington moving to pursue from the east, Mace Tyrell marched his forces to lay siege Storm's End (along with the Redwyne navy [from the Arbor]."")

[Modest Spoilers in this paragraph - character spoilers for the personality of Mace Tyrell and Randyll Tarly, important characters later in the series]

[Mace Tyrell](http://www.terra-di-mezzo.it/immagini/amok/hr/maceuc0.jpg)

[Book Spoiler](/b ""Despite that most accounts declare the battle inconclusive, Mace Tyrell frequently cites it as his one great victory over Robert, and as dubious proof that he is a masterful battlefield commander.  During the battle, Randyll Tarly (Sam's [Jon Snow's fat friend's] Father) killed Lord Cafferen and sent his head to King Aerys."") ",52,141,False,self,,,,,
263,gameofthrones,t5_2rjz2,2011-5-16,2011,5,16,13,hcakc,collegehumor.com,The inspiration for Tyrion's fighting style,https://www.reddit.com/r/gameofthrones/comments/hcakc/the_inspiration_for_tyrions_fighting_style/,[deleted],1305519369,,1,25,False,http://thumbs.reddit.com/t3_hcakc.png,,,,,
264,gameofthrones,t5_2rjz2,2011-5-16,2011,5,16,13,hcama,self.gameofthrones,Am I the only one that is LOVING the added scenes?,https://www.reddit.com/r/gameofthrones/comments/hcama/am_i_the_only_one_that_is_loving_the_added_scenes/,libbykino,1305519545,"No they're not directly from the book, but my God, they are all absolutely true to the characters and the spirit of the book.  They are wonderful!

The scene with Cersei and Robert in the royal solar... *perfect!*

Renly and Loras?  Yeah, it's a little bit more explicit, but it was absolutely true to the nature of their characters *and* it sets up season 2 quite nicely.

Littlefinger vs. Varys?  I was tickled pink to watch these guys have a verbal swordfight right in front of the Iron Throne.  They are spitting daggers at eachother, matching wit for sneaky wit, and it makes their relationship perfectly clear: neither trusts the other but they are both extremely wary of eachother!

And the added scenes in the other episodes as well... they all added something valuable to the story without changing it, and I am *loving* that!

I think my favorite added scene so far is the one where Robert, Ser Barristan and Jaime are sharing war stories, but this might just be because I'm so fond of Ser Barristan.",84,66,False,self,,,,,
265,gameofthrones,t5_2rjz2,2011-5-16,2011,5,16,13,hcap8,self.gameofthrones,So furious with Time Warner Cable,https://www.reddit.com/r/gameofthrones/comments/hcap8/so_furious_with_time_warner_cable/,Kittehhh,1305519837,"Why is HBO GO a no-go for Time Warner Cable customers? A bitch move, if you ask me... I desperately want to watch GoT without having to pirate it, but I don't have HBO on campus D:",15,13,False,self,,,,,
266,gameofthrones,t5_2rjz2,2011-5-16,2011,5,16,13,hcauz,self.gameofthrones,We need to talk about Renly and Ser Loras. Did I miss this in the book? (spoilers inside),https://www.reddit.com/r/gameofthrones/comments/hcauz/we_need_to_talk_about_renly_and_ser_loras_did_i/,highmoon,1305520276,GAY!? Say what?!,13,0,False,self,,,,,
267,gameofthrones,t5_2rjz2,2011-5-16,2011,5,16,13,hcbcr,self.gameofthrones,The Wall/Night's Watch,https://www.reddit.com/r/gameofthrones/comments/hcbcr/the_wallnights_watch/,helpmeobiwon,1305521889,"As a non-reader, I liked tonight's episode but I felt like something was missing, and that it wasn't as good as the previous ones.  Then I realized that there were no scenes with The Wall, or the Night's Watch.

To me, the whole concept of the Wall, and the Night's Watch protecting the realm from the enigmatic White Walkers is what's making the show for me.  Although I only have limited knowledge of GoT so far, I feel like it is what separates this series from other fantasy novels/movies so far.  There is something very romantic (not sure if this is the right word to use), about the Night's Watch, peering out over the wall and the snow covered land scape, with nothing but a small fire for comfort, while the cold breeze and darkness engulfs him.  I don't blame Jon Snow for romanticizing and admiring the Night's Watch. 

/coolstorybro",19,8,False,self,,,,,
268,gameofthrones,t5_2rjz2,2011-5-16,2011,5,16,14,hcbjo,i.imgur.com,Do with this what you will.,https://www.reddit.com/r/gameofthrones/comments/hcbjo/do_with_this_what_you_will/,[deleted],1305522542,,34,286,False,http://thumbs.reddit.com/t3_hcbjo.png,,,,,
269,gameofthrones,t5_2rjz2,2011-5-16,2011,5,16,14,hcbvi,insidetv.ew.com,GoT prosucers talk about episode 5 (and why they're ignoring your comments),https://www.reddit.com/r/gameofthrones/comments/hcbvi/got_prosucers_talk_about_episode_5_and_why_theyre/,BrandyAlexander9,1305523688,,4,9,False,http://thumbs.reddit.com/t3_hcbvi.png,,,,,
270,gameofthrones,t5_2rjz2,2011-5-16,2011,5,16,14,hcc8l,i.imgur.com,I laughed out loud when it happened.,https://www.reddit.com/r/gameofthrones/comments/hcc8l/i_laughed_out_loud_when_it_happened/,[deleted],1305524838,,0,2,False,default,,,,,
271,gameofthrones,t5_2rjz2,2011-5-16,2011,5,16,15,hcd0r,self.gameofthrones,Who do you think has been cast the best?,https://www.reddit.com/r/gameofthrones/comments/hcd0r/who_do_you_think_has_been_cast_the_best/,[deleted],1305527809,,28,8,False,self,,,,,
272,gameofthrones,t5_2rjz2,2011-5-16,2011,5,16,15,hcdco,reddit.com,(Self-repost from TodayILearned) Renly and Loras are gay for each other.,https://www.reddit.com/r/gameofthrones/comments/hcdco/selfrepost_from_todayilearned_renly_and_loras_are/,[deleted],1305529196,,0,0,False,default,,,,,
273,gameofthrones,t5_2rjz2,2011-5-16,2011,5,16,16,hcdj4,self.gameofthrones,IAE pissed that they're releasing Episode 7 on an iPad-only feed? ,https://www.reddit.com/r/gameofthrones/comments/hcdj4/iae_pissed_that_theyre_releasing_episode_7_on_an/,krucz36,1305529934,That fills me with rage. Maybe I'm reading it wrong. But does HBO GO work on anything other than an iPad? I hate those things.,6,0,False,self,,,,,
274,gameofthrones,t5_2rjz2,2011-5-16,2011,5,16,16,hcdok,imgur.com,This guy was the highlight of episode 5 for me,https://www.reddit.com/r/gameofthrones/comments/hcdok/this_guy_was_the_highlight_of_episode_5_for_me/,fuckin_bubbles,1305530547,,26,83,False,http://thumbs.reddit.com/t3_hcdok.png,,,,,
275,gameofthrones,t5_2rjz2,2011-5-16,2011,5,16,16,hce59,youtube.com,OtakuAssemble review of 1.05 -- everyone's favorite enthusiastic fan!,https://www.reddit.com/r/gameofthrones/comments/hce59/otakuassemble_review_of_105_everyones_favorite/,libbykino,1305532614,,9,25,False,http://thumbs.reddit.com/t3_hce59.png,,,,,
276,gameofthrones,t5_2rjz2,2011-5-16,2011,5,16,17,hce7q,self.gameofthrones,How many episodes will the season be?,https://www.reddit.com/r/gameofthrones/comments/hce7q/how_many_episodes_will_the_season_be/,AmmoBear,1305532947,"It's already on episode 6, and it might be because I haven't read the book in a while, but if seems as if there is not much left. Any idea how long the season is?",2,2,False,self,,,,,
277,gameofthrones,t5_2rjz2,2011-5-16,2011,5,16,18,hcfnj,self.gameofthrones,Dose anyone else fear this? No spoilers in saying this. (May be spoilers in comments),https://www.reddit.com/r/gameofthrones/comments/hcfnj/dose_anyone_else_fear_this_no_spoilers_in_saying/,jimbobway,1305539668,"Based on the tv series and also on what G.R.R.M said about how long the next book would take, is anyone other then me worried about how rest of the story (book 5 and on) will be heavaly influneced by the show, and more so, fan input? I mean making fans happy is one thing, but he has to keep true to his ideas and not HBO's, right?",21,6,False,self,,,,,
