,sbr,sbr_id,date,year,month,hour,day,id,domain,title,full_link,author,created,selftext,num_comments,score,over_18,thumbnail,media_provider,media_thumbnail,media_title,media_description,media_url
0,gameofthrones,t5_2rjz2,2011-5-1,2011,5,1,10,h154m,self.gameofthrones,How did you first learn about Game of Thrones (book or show)?,https://www.reddit.com/r/gameofthrones/comments/h154m/how_did_you_first_learn_about_game_of_thrones/,nekowolf,1304213213,"Back in the dark days of Usenet, I use to read and post a little on rec.arts.sf.written.robert-jordan.  It's always difficult finding new novels to read that aren't by authors I already liked.  But when A Game of Thrones was released, it got a lot of talk in the group.  I didn't pick it up until it was out in paperback (being a poor college student at the time), but I was instantly hooked.  Of course, just like after recently reading Brandon Sanderson's The Way of Kings, I wanted more immediately, and having to wait so long for the next meant I had forgotten most of what had happened.",93,15,False,self,,,,,
1,gameofthrones,t5_2rjz2,2011-5-1,2011,5,1,14,h192e,i.imgur.com,"Dear /GameofThrones, my new tattoo may perhaps be relevant to your interests.",https://www.reddit.com/r/gameofthrones/comments/h192e/dear_gameofthrones_my_new_tattoo_may_perhaps_be/,witchyz,1304227672,,41,39,False,http://thumbs.reddit.com/t3_h192e.png,,,,,
2,gameofthrones,t5_2rjz2,2011-5-1,2011,5,1,21,h1d7o,self.gameofthrones,"Have they changed the dialogue to drop more hints 
about Jon's parents?",https://www.reddit.com/r/gameofthrones/comments/h1d7o/have_they_changed_the_dialogue_to_drop_more_hints/,g2petter,1304254203,"When Jon and Eddard part ways, there's some dialogue I don't remember from the books that seems to hint more at the most common theory about Jon's parents. Does anyone agree with me on this?",3,0,False,self,,,,,
3,gameofthrones,t5_2rjz2,2011-5-2,2011,5,2,1,h1g4b,self.gameofthrones,It's Sunday!  Join us in irc.freenode.net | #redditgot for episode and/or book discussion!,https://www.reddit.com/r/gameofthrones/comments/h1g4b/its_sunday_join_us_in_ircfreenodenet_redditgot/,akatch,1304267265,"Please warn the rest of the chan before you share anything that might be construed as a spoiler and feel free to stick around all week to chat with us - we've been rather lonely :(

[Here's the webchat link if you don't have an IRC client installed](http://webchat.freenode.net/)",13,22,False,self,,,,,
4,gameofthrones,t5_2rjz2,2011-5-2,2011,5,2,1,h1gns,self.gameofthrones,Are there differences between the versions being televised in different countries?,https://www.reddit.com/r/gameofthrones/comments/h1gns/are_there_differences_between_the_versions_being/,nowonmai666,1304269140,"Game of Thrones is currently being shown on HBO in the US and Sky Atlantic in the UK. I was wondering if the two versions shown were identical, or are different edits (for instance, American edits often have less sex and more violence than European versions).

Is it known?",5,6,False,self,,,,,
5,gameofthrones,t5_2rjz2,2011-5-2,2011,5,2,3,h1ioa,i.imgur.com,This guy.,https://www.reddit.com/r/gameofthrones/comments/h1ioa/this_guy/,nklotz,1304275496,,66,59,False,http://thumbs.reddit.com/t3_h1ioa.png,,,,,
6,gameofthrones,t5_2rjz2,2011-5-2,2011,5,2,6,h1m4j,self.gameofthrones,Streaming options?,https://www.reddit.com/r/gameofthrones/comments/h1m4j/streaming_options/,redAppleCore,1304286244,"Does anyone know if there are streaming options for the show tonight?  Justin.tv, etc?",13,7,False,self,,,,,
7,gameofthrones,t5_2rjz2,2011-5-2,2011,5,2,9,h1otp,self.gameofthrones,"Episode Discussion - 1.03 ""Lord Snow"" [Spoilers]",https://www.reddit.com/r/gameofthrones/comments/h1otp/episode_discussion_103_lord_snow_spoilers/,DafyddLlyr,1304294694,"This is up a bit early, but here we are!

* **This is a TV spoiler friendly zone** - turn away now if you haven't seen the episode!

* **Book spoilers still need tags!**

Read our new spoiler policy [here](http://www.reddit.com/r/gameofthrones/comments/gyo4k/rgots_new_spoiler_policy/).

There's a bunch of us chatting throughout the episode - [details here](http://www.reddit.com/r/gameofthrones/comments/gs984/rgameofthrones_live_chat_join_us/)!

Enjoy the episode guys!",368,82,False,self,,,,,
8,gameofthrones,t5_2rjz2,2011-5-2,2011,5,2,9,h1pg0,self.gameofthrones,SELLSWORD FOR HIRE,https://www.reddit.com/r/gameofthrones/comments/h1pg0/sellsword_for_hire/,b214n,1304296642,"As rare as a virgin whore, I won't defect for a higher purse - I fight for honor as much as gold and there's no honor in treason. I'm average in bowmanship but gifted with a blade. Make me an offer and see my title changed to befit your House.",14,10,False,self,,,,,
9,gameofthrones,t5_2rjz2,2011-5-2,2011,5,2,10,h1qss,self.gameofthrones,I can't wait to see who wins in the big war...,https://www.reddit.com/r/gameofthrones/comments/h1qss/i_cant_wait_to_see_who_wins_in_the_big_war/,Bouse,1304300632,Will it be Viserys or Robert?,32,25,False,self,,,,,
10,gameofthrones,t5_2rjz2,2011-5-2,2011,5,2,10,h1r4x,dorkshelf.com,"Game of Thrones Episode 1.3 ""Lord Snow"" Review",https://www.reddit.com/r/gameofthrones/comments/h1r4x/game_of_thrones_episode_13_lord_snow_review/,RoninKengo,1304301516,,2,5,False,http://thumbs.reddit.com/t3_h1r4x.png,,,,,
11,gameofthrones,t5_2rjz2,2011-5-2,2011,5,2,11,h1r8h,self.gameofthrones,If a game was to be made...,https://www.reddit.com/r/gameofthrones/comments/h1r8h/if_a_game_was_to_be_made/,instant_noodles,1304301792,"What kind of game should it be made into?  To me it seems like the only way to would be a RTS RPG like Dragon Age (2) but also have smaller scale missions like Assasins Creed? I don't know, there's so many possibilities.  Your thoughts?",20,2,False,self,,,,,
12,gameofthrones,t5_2rjz2,2011-5-2,2011,5,2,11,h1reu,self.gameofthrones,"To those who read the books, do you feel that your experience of watching the show is enhanced?",https://www.reddit.com/r/gameofthrones/comments/h1reu/to_those_who_read_the_books_do_you_feel_that_your/,malfunctionedasimov,1304302270,"I am debating whether or not to start reading the books.  One one hand I don't want to spoil the story for the show, but on the other hand a friend is telling me that watching the show after reading the book allows you to appreciate the show more.  What do you guys say?

EDIT:  Follow up question: How many books does it look like the first season will cover?  Based on the number of books released, how many seasons do you think HBO will release?",52,31,False,self,,,,,
13,gameofthrones,t5_2rjz2,2011-5-2,2011,5,2,11,h1rmk,i.imgur.com,Miltos Yerolemou as Syrio Forel!,https://www.reddit.com/r/gameofthrones/comments/h1rmk/miltos_yerolemou_as_syrio_forel/,The_Law_of_Pizza,1304302868,,13,37,False,http://thumbs.reddit.com/t3_h1rmk.png,,,,,
14,gameofthrones,t5_2rjz2,2011-5-2,2011,5,2,11,h1ryh,self.gameofthrones,"DAE think that the people in the north (Starks, Nights Watch) talk with a slight Scottish accent? ",https://www.reddit.com/r/gameofthrones/comments/h1ryh/dae_think_that_the_people_in_the_north_starks/,dngrCharlie,1304303809,"I'm no expert at accents but it sounds that way to me. If so, kind of a nice, subtle touch to geographically place them.


I can't *stand* that I have to see this show in one hour increments per week. It is driving me crazy!",28,10,False,self,,,,,
15,gameofthrones,t5_2rjz2,2011-5-2,2011,5,2,11,h1sm4,geek-news.mtv.com,Best scene since Joff got slapped.,https://www.reddit.com/r/gameofthrones/comments/h1sm4/best_scene_since_joff_got_slapped/,[deleted],1304304795,,17,68,False,http://thumbs.reddit.com/t3_h1sm4.png,,,,,
16,gameofthrones,t5_2rjz2,2011-5-2,2011,5,2,13,h1wto,self.gameofthrones,Ned Stark would be disappointed with Obama.,https://www.reddit.com/r/gameofthrones/comments/h1wto/ned_stark_would_be_disappointed_with_obama/,danhm,1304309543,"He who passes the sentence should swing the sword, right?",14,17,False,self,,,,,
17,gameofthrones,t5_2rjz2,2011-5-2,2011,5,2,13,h1xjx,loombo.com,"Season 1 Episode 3, Stream",https://www.reddit.com/r/gameofthrones/comments/h1xjx/season_1_episode_3_stream/,games0124,1304310489,,0,1,False,default,,,,,
18,gameofthrones,t5_2rjz2,2011-5-2,2011,5,2,13,h1ypb,imgur.com,George R. R. Martin,https://www.reddit.com/r/gameofthrones/comments/h1ypb/george_r_r_martin/,Teknosaurus,1304312170,,0,0,False,http://thumbs.reddit.com/t3_h1ypb.png,,,,,
19,gameofthrones,t5_2rjz2,2011-5-2,2011,5,2,14,h1zl4,self.gameofthrones,The Wheel of Time,https://www.reddit.com/r/gameofthrones/comments/h1zl4/the_wheel_of_time/,b214n,1304313677,"Everyone I've talked A Song of Ice and Fire with has suggested I also read this series. Literally every one of them. So, maybe you guys should check it out too.",96,6,False,self,,,,,
20,gameofthrones,t5_2rjz2,2011-5-2,2011,5,2,15,h20xm,self.gameofthrones,How perfect was Barristan The Bold?,https://www.reddit.com/r/gameofthrones/comments/h20xm/how_perfect_was_barristan_the_bold/,Benevolent1,1304316259,"One of my favorite characters from the books.  Old enough to [Book Spoiler](/b ""be dismissed for his age.  Yet still he looks capable of being one of the most dangerous man in Westeros and beyond!"")",36,35,False,self,,,,,
21,gameofthrones,t5_2rjz2,2011-5-2,2011,5,2,15,h21h0,i.imgur.com,I'm going to go out on a limb here and call this the best scene from ep. 3.,https://www.reddit.com/r/gameofthrones/comments/h21h0/im_going_to_go_out_on_a_limb_here_and_call_this/,DiscursiveMind,1304317520,,19,89,False,http://thumbs.reddit.com/t3_h21h0.png,,,,,
22,gameofthrones,t5_2rjz2,2011-5-2,2011,5,2,15,h21jb,youtube.com,"I really like this guy's reviews, here is ep 3.",https://www.reddit.com/r/gameofthrones/comments/h21jb/i_really_like_this_guys_reviews_here_is_ep_3/,genericname12345,1304317683,,6,6,False,http://thumbs.reddit.com/t3_h21jb.png,,,,,
23,gameofthrones,t5_2rjz2,2011-5-2,2011,5,2,17,h249x,self.gameofthrones,So how is the show's narrative supposed to play out?,https://www.reddit.com/r/gameofthrones/comments/h249x/so_how_is_the_shows_narrative_supposed_to_play_out/,[deleted],1304326477,"As of now the show has a second season in the works and no LOST-like end date. So how do you think they're approaching the show? At this pace (idk how many episodes are locked in for this season) it seems like they might be trying for at least 75-100% of the first book in this season. So will it be similar for every season or do you think they'll stretch certain parts of the story to make the series last longer?

I'm picturing some plot points, one being pretty obvious with a main character here, that could make for a damn good season cliffhanger. ",8,6,False,self,,,,,
24,gameofthrones,t5_2rjz2,2011-5-2,2011,5,2,19,h25yi,planetarbitrary.com,"My thoughts on ""Lord Snow""",https://www.reddit.com/r/gameofthrones/comments/h25yi/my_thoughts_on_lord_snow/,docred7,1304333992,,0,6,False,default,,,,,
25,gameofthrones,t5_2rjz2,2011-5-2,2011,5,2,21,h2774,imgur.com,He nailed it.,https://www.reddit.com/r/gameofthrones/comments/h2774/he_nailed_it/,nosfe,1304338961,,16,59,False,http://thumbs.reddit.com/t3_h2774.png,,,,,
26,gameofthrones,t5_2rjz2,2011-5-2,2011,5,2,21,h27ld,youtube.com,"And...here's enthusiastic guy with the Review for Episode 3: ""Jon Snow is the Man""",https://www.reddit.com/r/gameofthrones/comments/h27ld/andheres_enthusiastic_guy_with_the_review_for/,juanito89,1304340336,,25,24,False,http://thumbs.reddit.com/t3_h27ld.png,,,,,
27,gameofthrones,t5_2rjz2,2011-5-2,2011,5,2,21,h27mx,self.gameofthrones,"I'm new to /r/gameofthrones, so forgive if this has been said and done, but could they have done a better job casting?!",https://www.reddit.com/r/gameofthrones/comments/h27mx/im_new_to_rgameofthrones_so_forgive_if_this_has/,[deleted],1304340477,,1,0,False,default,,,,,
28,gameofthrones,t5_2rjz2,2011-5-2,2011,5,2,22,h28c1,youtube.com,OAW's review of episode 3. I love this guy.,https://www.reddit.com/r/gameofthrones/comments/h28c1/oaws_review_of_episode_3_i_love_this_guy/,[deleted],1304342523,,0,0,False,default,,,,,
29,gameofthrones,t5_2rjz2,2011-5-2,2011,5,2,23,h29bt,self.gameofthrones,"Old Nan, master storyteller",https://www.reddit.com/r/gameofthrones/comments/h29bt/old_nan_master_storyteller/,EdricStorm,1304345349,"Seriously, I was actually a little scared when she was telling the story about the white walkers. And I already know about them!",24,58,False,self,,,,,
30,gameofthrones,t5_2rjz2,2011-5-2,2011,5,2,23,h2agt,self.gameofthrones,The Dire Wolves,https://www.reddit.com/r/gameofthrones/comments/h2agt/the_dire_wolves/,[deleted],1304348272,"I apologize if this has been posted before, but I didn't see anything in my searches. 

I've noticed a lack of usage when it comes to the wolves. I don't remember seeing one last night, I would of expected to of seen Ghost with Jon at some point. 

Is there something I'm missing?",50,22,False,self,,,,,
31,gameofthrones,t5_2rjz2,2011-5-3,2011,5,3,0,h2b15,nj.com,Good Episode 3 Recap from NJ.com,https://www.reddit.com/r/gameofthrones/comments/h2b15/good_episode_3_recap_from_njcom/,IIMsmartII,1304349535,,0,3,False,default,,,,,
32,gameofthrones,t5_2rjz2,2011-5-3,2011,5,3,1,h2d9b,youtube.com,"""Cripples, Bastards and Broken Things"" Preview",https://www.reddit.com/r/gameofthrones/comments/h2d9b/cripples_bastards_and_broken_things_preview/,[deleted],1304354774,,18,26,False,default,,,,,
33,gameofthrones,t5_2rjz2,2011-5-3,2011,5,3,2,h2dzz,winter-is-coming.net,Tony Curran in talks for season two?,https://www.reddit.com/r/gameofthrones/comments/h2dzz/tony_curran_in_talks_for_season_two/,DafyddLlyr,1304356343,,7,4,False,default,,,,,
34,gameofthrones,t5_2rjz2,2011-5-3,2011,5,3,2,h2f7l,self.gameofthrones,Maps of the world,https://www.reddit.com/r/gameofthrones/comments/h2f7l/maps_of_the_world/,barbapappa,1304358830,"Im about halfway through the second book. [book spoiler](/b ""In it Danerys is outside westeros and travels around quite a bit"").

Is there no maps of the world outside of westeros? It's not really needed but it is quite nice to know where places are in relation to aech other.",7,3,False,self,,,,,
35,gameofthrones,t5_2rjz2,2011-5-3,2011,5,3,3,h2gnd,i.imgur.com,My favorite part of episode 3,https://www.reddit.com/r/gameofthrones/comments/h2gnd/my_favorite_part_of_episode_3/,littledigits,1304361959,,2,23,False,http://thumbs.reddit.com/t3_h2gnd.png,,,,,
36,gameofthrones,t5_2rjz2,2011-5-3,2011,5,3,4,h2his,i.imgur.com,Daenerys and I aren't a match,https://www.reddit.com/r/gameofthrones/comments/h2his/daenerys_and_i_arent_a_match/,[deleted],1304363768,,0,1,False,default,,,,,
37,gameofthrones,t5_2rjz2,2011-5-3,2011,5,3,5,h2ito,i.imgur.com,Daenerys and I aren't a match,https://www.reddit.com/r/gameofthrones/comments/h2ito/daenerys_and_i_arent_a_match/,miketucci,1304366555,,60,199,False,http://thumbs.reddit.com/t3_h2ito.png,,,,,
38,gameofthrones,t5_2rjz2,2011-5-3,2011,5,3,5,h2jee,self.gameofthrones,Yoren not at all how i expected...,https://www.reddit.com/r/gameofthrones/comments/h2jee/yoren_not_at_all_how_i_expected/,binermoots,1304367756,"...I was a little dissapointed. I always kind of saw him as the dark, mangy Viggo at the beginning of the first LotR film.

[Edit] Dammit I was thinking of Bronn, not Yoren. juanito89 jogged my memory.",22,15,False,self,,,,,
39,gameofthrones,t5_2rjz2,2011-5-3,2011,5,3,5,h2k62,self.gameofthrones,Something of growing concern,https://www.reddit.com/r/gameofthrones/comments/h2k62/something_of_growing_concern/,b214n,1304369478,"According to the show's [IMDB](http://www.imdb.com/title/tt0944947/fullcredits#cast) Petyr and Tywin and Samwell Tarly are in more episodes than every perspective character, sans Bran who is one up from the fat man. How the eff could this be?",3,0,False,self,,,,,
40,gameofthrones,t5_2rjz2,2011-5-3,2011,5,3,8,h2o19,yayacosplay.deviantart.com,"It Doesn't Make Sense, But I Sure Like It!",https://www.reddit.com/r/gameofthrones/comments/h2o19/it_doesnt_make_sense_but_i_sure_like_it/,bckids1208two,1304378481,,1,0,False,http://thumbs.reddit.com/t3_h2o19.png,,,,,
41,gameofthrones,t5_2rjz2,2011-5-3,2011,5,3,10,h2qws,self.gameofthrones,direwolves in the TV series vs. the book series,https://www.reddit.com/r/gameofthrones/comments/h2qws/direwolves_in_the_tv_series_vs_the_book_series/,catertots,1304385529,"I'm a little disappointed in how little screen time the direwolves are getting, especially with Jon and Ghost. I've only read A Game of Thrones and about 100 pages of A Clash of Kings, so I don't even know the full extent of their involvement yet, but already they've been pretty damn important in the books. I couldn't even tell whether Ghost went with Jon to the Wall or not. I feel like it wouldn't be difficult to include them in the shots, just have them walking beside the kids all the time. If they were just regular pets, it wouldn't matter, but they're not. Just feeling disgruntled about this, anyone else? I love everything else about the show, but this bothers me. ",10,5,False,self,,,,,
42,gameofthrones,t5_2rjz2,2011-5-3,2011,5,3,10,h2r9f,planetarbitrary.com,An interview with the Chefs from Inn at the Crossroads,https://www.reddit.com/r/gameofthrones/comments/h2r9f/an_interview_with_the_chefs_from_inn_at_the/,docred7,1304386380,,1,14,False,http://thumbs.reddit.com/t3_h2r9f.png,,,,,
43,gameofthrones,t5_2rjz2,2011-5-3,2011,5,3,10,h2roo,self.gameofthrones,Thoughts on Tommy Carcetti,https://www.reddit.com/r/gameofthrones/comments/h2roo/thoughts_on_tommy_carcetti/,Benevolent1,1304387313,"I must admit that his glorious mustache is a bit distracting, but all in all I think he's an excellent Petyr Baelish.",37,12,False,self,,,,,
44,gameofthrones,t5_2rjz2,2011-5-3,2011,5,3,10,h2rxl,self.gameofthrones,My thoughts after watching the first three episodes,https://www.reddit.com/r/gameofthrones/comments/h2rxl/my_thoughts_after_watching_the_first_three/,[deleted],1304387879,"My main reaction: ""Eh...""

I'm a little disappointed.  The books may be my favorite series of all time.  Hell, I even love AFfC.  The show has really underwhelmed me, though.  I definitely realize that there are some major difficulties putting this stuff on the screen, but even considering that I'm pretty disappointed.  Hopefully it will get better as it goes on.  There are some good parts to it.  I think Arya is great.  I think Robb is really good...hopefully he'll get more facetime than he does in the novels [book spoiler](/b ""for the first few seasons at least..."").   Jaime also seems to have nailed how I pictured him.

I think Catelyn is not quite right.  I think Jon Snow is not quite right.  I think Cersei is not quite right.",4,0,False,self,,,,,
45,gameofthrones,t5_2rjz2,2011-5-3,2011,5,3,11,h2stj,self.gameofthrones,People who watch Game of Thrones but haven't read George Martin's books: Do you like the show so far?,https://www.reddit.com/r/gameofthrones/comments/h2stj/people_who_watch_game_of_thrones_but_havent_read/,drolltroll,1304389933,"I just wanted to know people's thoughts about the show. Not the thoughts of rabid fans like myself who have read all the books cover to cover repeatedly, but completely new fans who are only watching the show and haven't read the books at all. 

I wanted to know if you guys were finding the story easy to follow. (As there's so much going on and there's so much backstory as well that's only gradually revealed) 

Also, do you find the pacing fast or slow. Would you hope for more action or do you find the political intrigue and backstabbing exciting. 

Lets hear your thoughts!

EDIT: Looks like every single person here is a die hard Rabid fan even if they haven't read the books. ALSO AS MENTIONED, sampling bias might be an issue. After all, only a die-hard fan would subscribe to a subReddit on Game of Thrones. We'll have to start the same discussion post on a more mainstream Reddit thread. Thanks for sharing your views my Reddit brethren! 

FOLLOW UP QUESTION recommended by another Redditor: how much is this subreddit and the out-of-show discussion contributing to your enjoyment / comprehension?
",100,40,False,self,,,,,
46,gameofthrones,t5_2rjz2,2011-5-3,2011,5,3,11,h2t3j,self.gameofthrones,Cersei's Child?,https://www.reddit.com/r/gameofthrones/comments/h2t3j/cerseis_child/,mrsaturnjd,1304390589,"I could be wrong about the books. Please correct me if that's the case.

In the second episode, Cersei has a chat with Catelyn, at Bran's side, about her (first?) child. She shares the pain of motherhood by confiding that this child died of an illness at a young age. The child had black hair.

Um. [Book Spoiler](/b ""That would mean it's Robert's son, not Jaime's. That would mean that she has had at least one child who wasn't her twin's. Remember, in the books, when Tyrion mentally chides her? If she had only given birth to ONE of Robert's children, it would have cast away suspicion, but that just wouldn't have been Cersei?"")

Is this something in the books I'd missed? Otherwise... why add it at all? It doesn't really add anything, and kind of takes away some of the ""evidence"" for a rather important plot point",7,3,False,self,,,,,
47,gameofthrones,t5_2rjz2,2011-5-3,2011,5,3,11,h2tei,self.gameofthrones,I'm starting to remember why I stopped on my reread...,https://www.reddit.com/r/gameofthrones/comments/h2tei/im_starting_to_remember_why_i_stopped_on_my_reread/,ApocalypseThen,1304391225,It's just so depressing...,16,7,False,self,,,,,
48,gameofthrones,t5_2rjz2,2011-5-3,2011,5,3,12,h2ubr,youtube.com,Rock version of the GoT opening theme song,https://www.reddit.com/r/gameofthrones/comments/h2ubr/rock_version_of_the_got_opening_theme_song/,torgospizza,1304393126,,1,1,False,http://thumbs.reddit.com/t3_h2ubr.png,,,,,
49,gameofthrones,t5_2rjz2,2011-5-3,2011,5,3,12,h2uvx,i.imgur.com,Oh my sweet summer child...What do you know about fear?,https://www.reddit.com/r/gameofthrones/comments/h2uvx/oh_my_sweet_summer_childwhat_do_you_know_about/,folkTheory,1304394332,,9,26,False,http://thumbs.reddit.com/t3_h2uvx.png,,,,,
50,gameofthrones,t5_2rjz2,2011-5-3,2011,5,3,12,h2uzk,self.gameofthrones,Dothraki language,https://www.reddit.com/r/gameofthrones/comments/h2uzk/dothraki_language/,skatch,1304394570,"The language of the Dothraki seems familiar to me in the TV show.  It rolls a little to well to be completely made up in my opinion.  Anyone know what it might be, or am I just crazy?",13,6,False,self,,,,,
51,gameofthrones,t5_2rjz2,2011-5-3,2011,5,3,13,h2vrv,i.imgur.com,I love you guys. It is known.,https://www.reddit.com/r/gameofthrones/comments/h2vrv/i_love_you_guys_it_is_known/,cthulhu_zuul,1304396379,,0,0,False,http://thumbs.reddit.com/t3_h2vrv.png,,,,,
52,gameofthrones,t5_2rjz2,2011-5-3,2011,5,3,13,h2wk6,self.gameofthrones,Reading book three. Red Wedding. WTF?!!,https://www.reddit.com/r/gameofthrones/comments/h2wk6/reading_book_three_red_wedding_wtf/,[deleted],1304398448,,0,0,False,default,,,,,
53,gameofthrones,t5_2rjz2,2011-5-3,2011,5,3,14,h2x81,self.gameofthrones,"Ugh, bad acting!",https://www.reddit.com/r/gameofthrones/comments/h2x81/ugh_bad_acting/,[deleted],1304400238,"Littlefinger! Wow, this man has absolutely no ability to deliver his lines! He ruins every scene he's in.",1,0,False,default,,,,,
54,gameofthrones,t5_2rjz2,2011-5-3,2011,5,3,16,h2zg4,i.imgur.com,I get a strong Obi-wan vibe coming from Jorah Mormont,https://www.reddit.com/r/gameofthrones/comments/h2zg4/i_get_a_strong_obiwan_vibe_coming_from_jorah/,emuporium,1304407825,,15,74,False,http://thumbs.reddit.com/t3_h2zg4.png,,,,,
55,gameofthrones,t5_2rjz2,2011-5-3,2011,5,3,16,h2zmh,self.gameofthrones,Game of Thrones - Trivia! Answer questions and post your own. ,https://www.reddit.com/r/gameofthrones/comments/h2zmh/game_of_thrones_trivia_answer_questions_and_post/,Flammy,1304408586,"**Please use spoilers**

Post Questions as general questions, true/false, etc. Argue when you know you were actually right. Answer questions and upvote good ones. 

Example Question: 

Book 1: [book spoiler](/b ""The dagger used to attack Cat and Bran was made of Valyrian Steel and Ivory. True/false? "")

Example Answer: [tv spoiler](/s ""False! Dragonbone hilt!"")",18,10,False,self,,,,,
56,gameofthrones,t5_2rjz2,2011-5-3,2011,5,3,19,h31uk,i.imgur.com,Does Daenerys remind anyone else of Topanga?,https://www.reddit.com/r/gameofthrones/comments/h31uk/does_daenerys_remind_anyone_else_of_topanga/,[deleted],1304419081,,6,0,False,default,,,,,
57,gameofthrones,t5_2rjz2,2011-5-3,2011,5,3,21,h32yz,geeksaresexy.net,Game of Thrones Theme Rock Cover,https://www.reddit.com/r/gameofthrones/comments/h32yz/game_of_thrones_theme_rock_cover/,bckids1208two,1304424337,,2,4,False,http://thumbs.reddit.com/t3_h32yz.png,,,,,
58,gameofthrones,t5_2rjz2,2011-5-3,2011,5,3,22,h346e,images.allmoviephoto.com,As we know the tournament is next week. Our Robert played a slightly different role in his last tournament.,https://www.reddit.com/r/gameofthrones/comments/h346e/as_we_know_the_tournament_is_next_week_our_robert/,The-Dudemeister,1304428616,,0,0,False,http://thumbs.reddit.com/t3_h346e.png,,,,,
59,gameofthrones,t5_2rjz2,2011-5-3,2011,5,3,23,h35p7,i.imgur.com,Kingsguard uniforms - Yay or nay?,https://www.reddit.com/r/gameofthrones/comments/h35p7/kingsguard_uniforms_yay_or_nay/,[deleted],1304432980,,88,161,False,http://thumbs.reddit.com/t3_h35p7.png,,,,,
60,gameofthrones,t5_2rjz2,2011-5-3,2011,5,3,23,h35td,images4.fanpop.com,Ser Lancel is so feminine,https://www.reddit.com/r/gameofthrones/comments/h35td/ser_lancel_is_so_feminine/,orko1995,1304433247,,21,63,False,http://thumbs.reddit.com/t3_h35td.png,,,,,
61,gameofthrones,t5_2rjz2,2011-5-4,2011,5,4,0,h3787,youtube.com,"Game of Thrones Q&amp;A with Mark Addy, Sean Bean, Harry Lloyd, and Gemma Jackson.",https://www.reddit.com/r/gameofthrones/comments/h3787/game_of_thrones_qa_with_mark_addy_sean_bean_harry/,FaramirofWI,1304436439,,5,28,False,default,,,,,
