,sbr,sbr_id,date,year,month,hour,day,id,domain,title,full_link,author,created,selftext,num_comments,score,over_18,thumbnail,media_provider,media_thumbnail,media_title,media_description,media_url
388,gameofthrones,t5_2rjz2,2011-5-19,2011,5,19,23,hf2eo,self.gameofthrones,Loras too skinny?,https://www.reddit.com/r/gameofthrones/comments/hf2eo/loras_too_skinny/,edwin23,1305816137,"Now I know the Knight of Flowers is a young guy, but in his scene with Renly he looks like he couldn't even pickup a sword. Anyone else a little disappointed?

Also, as a side note - I don't think he's handsome enough as well.",70,21,False,self,,,,,
389,gameofthrones,t5_2rjz2,2011-5-20,2011,5,20,2,hf62g,realcityny.com,Does Westeros already think it has Tyrion figured out?,https://www.reddit.com/r/gameofthrones/comments/hf62g/does_westeros_already_think_it_has_tyrion_figured/,RealcityNY,1305824685,,0,3,False,http://thumbs.reddit.com/t3_hf62g.png,,,,,
390,gameofthrones,t5_2rjz2,2011-5-20,2011,5,20,2,hf6k3,self.gameofthrones,If only Bob Ross was still alive [Xpost from /videos],https://www.reddit.com/r/gameofthrones/comments/hf6k3/if_only_bob_ross_was_still_alive_xpost_from_videos/,rocketsauce82,1305825660,He could have done some amazing interpretations of Westeros architecture ,2,0,False,self,,,,,
391,gameofthrones,t5_2rjz2,2011-5-20,2011,5,20,2,hf72i,self.gameofthrones,Melisandre casting,https://www.reddit.com/r/gameofthrones/comments/hf72i/melisandre_casting/,estein1030,1305826741,,0,1,False,default,,,,,
392,gameofthrones,t5_2rjz2,2011-5-20,2011,5,20,3,hf7v9,buzzfeed.com,Stupid Ned Stark,https://www.reddit.com/r/gameofthrones/comments/hf7v9/stupid_ned_stark/,Buckaroo2,1305828450,,1,2,False,default,,,,,
393,gameofthrones,t5_2rjz2,2011-5-20,2011,5,20,3,hf8qc,youtube.com,Game Of Thrones: Episode 6 Sneak Preview Clip #2,https://www.reddit.com/r/gameofthrones/comments/hf8qc/game_of_thrones_episode_6_sneak_preview_clip_2/,regisfrost,1305830261,,20,27,False,http://thumbs.reddit.com/t3_hf8qc.png,,,,,
394,gameofthrones,t5_2rjz2,2011-5-20,2011,5,20,5,hfblb,youtube.com,Game Of Thrones: Episode 6 Sneak Preview Clip #1,https://www.reddit.com/r/gameofthrones/comments/hfblb/game_of_thrones_episode_6_sneak_preview_clip_1/,biggern,1305836582,,1,6,False,default,,,,,
395,gameofthrones,t5_2rjz2,2011-5-20,2011,5,20,6,hfcp8,imgur.com,I'll miss you guys...,https://www.reddit.com/r/gameofthrones/comments/hfcp8/ill_miss_you_guys/,Sdemps1398,1305838983,,0,0,False,http://thumbs.reddit.com/t3_hfcp8.png,,,,,
396,gameofthrones,t5_2rjz2,2011-5-20,2011,5,20,6,hfcvo,castofthrones.com,Game of Thrones Podcast and Contest,https://www.reddit.com/r/gameofthrones/comments/hfcvo/game_of_thrones_podcast_and_contest/,thriftynerd,1305839405,,5,0,False,http://thumbs.reddit.com/t3_hfcvo.png,,,,,
397,gameofthrones,t5_2rjz2,2011-5-20,2011,5,20,6,hfdm1,self.gameofthrones,Was that really in the book?,https://www.reddit.com/r/gameofthrones/comments/hfdm1/was_that_really_in_the_book/,Rockytriton,1305841089,Am I the only one who read the book twice and didn't notice that Renly and the knight of flowers were gay?  Or did they just put that in the TV show to make it HBO friendly?,35,3,False,self,,,,,
398,gameofthrones,t5_2rjz2,2011-5-20,2011,5,20,6,hfdyb,images.starpulse.com,"It'll never happen, but my choice for Jaqen H'gar...",https://www.reddit.com/r/gameofthrones/comments/hfdyb/itll_never_happen_but_my_choice_for_jaqen_hgar/,[deleted],1305841953,,0,1,False,default,,,,,
399,gameofthrones,t5_2rjz2,2011-5-20,2011,5,20,6,hfe12,google.com,"It'll never happen, but my choice to play Jaqen H'gar...",https://www.reddit.com/r/gameofthrones/comments/hfe12/itll_never_happen_but_my_choice_to_play_jaqen_hgar/,libbykino,1305842131,,26,39,False,default,,,,,
400,gameofthrones,t5_2rjz2,2011-5-20,2011,5,20,6,hfe4c,self.gameofthrones,AMA request: someone that works at HBO,https://www.reddit.com/r/gameofthrones/comments/hfe4c/ama_request_someone_that_works_at_hbo/,Stubb,1305842372,HBO's online distribution of GoT seems retarded. There seem to be a number of people that resort to stealing the show because HBO doesn't make it available online in a per-episode or season-pass format. I'd love to hear HBO's side of this.,2,5,False,self,,,,,
401,gameofthrones,t5_2rjz2,2011-5-20,2011,5,20,8,hffmy,self.gameofthrones,TIL that Alphie Allen (Theon Greyjoy) is Lily Allen's brother,https://www.reddit.com/r/gameofthrones/comments/hffmy/til_that_alphie_allen_theon_greyjoy_is_lily/,tenehemia,1305846241,"Personally, I'd be in favor of Lily Allen being cast as Asha Greyjoy.",1,0,False,self,,,,,
402,gameofthrones,t5_2rjz2,2011-5-20,2011,5,20,8,hfg6k,self.gameofthrones,"Well well, look who is guarding Illyrio's house...",https://www.reddit.com/r/gameofthrones/comments/hfg6k/well_well_look_who_is_guarding_illyrios_house/,[deleted],1305847610,,0,1,False,default,,,,,
403,gameofthrones,t5_2rjz2,2011-5-20,2011,5,20,8,hfgfp,i.imgur.com,Rewatching Ep 1: Look who is guarding Illyrio's house,https://www.reddit.com/r/gameofthrones/comments/hfgfp/rewatching_ep_1_look_who_is_guarding_illyrios/,Dr_Buttes,1305848286,,16,37,False,default,,,,,
404,gameofthrones,t5_2rjz2,2011-5-20,2011,5,20,8,hfgp1,i.imgur.com,Does Jaime still remind anyone else of Prince Charming? (Spoilers),https://www.reddit.com/r/gameofthrones/comments/hfgp1/does_jaime_still_remind_anyone_else_of_prince/,Bouse,1305848920,,18,25,False,http://thumbs.reddit.com/t3_hfgp1.png,,,,,
405,gameofthrones,t5_2rjz2,2011-5-20,2011,5,20,9,hfh34,seal.com,The perfect Walder Frey,https://www.reddit.com/r/gameofthrones/comments/hfh34/the_perfect_walder_frey/,[deleted],1305849964,,12,39,False,default,,,,,
406,gameofthrones,t5_2rjz2,2011-5-20,2011,5,20,9,hfhbv,self.gameofthrones,Jon Snow's parents [Possible Book and TV Show Spoilers],https://www.reddit.com/r/gameofthrones/comments/hfhbv/jon_snows_parents_possible_book_and_tv_show/,practo,1305850606,,25,0,False,default,,,,,
407,gameofthrones,t5_2rjz2,2011-5-20,2011,5,20,10,hfisq,self.gameofthrones,Ep. 7 Discussion: hold off for a week?,https://www.reddit.com/r/gameofthrones/comments/hfisq/ep_7_discussion_hold_off_for_a_week/,DiscursiveMind,1305854597,"I was thinking; HBOGO is showing Ep. 7 early on Sunday, but not every HBO subscriber has access to HBOGO. Purhaps Ep. 7's discussion should be delayed till next week to allow everyone the chance to legally watch if they want. But, I could be wrong, thoughts?",20,8,False,self,,,,,
408,gameofthrones,t5_2rjz2,2011-5-20,2011,5,20,10,hfjh0,amazon.com,"All 4 Game of Thrones books for 20 bucks, 16 dollars less than if you bought the kindle version. ",https://www.reddit.com/r/gameofthrones/comments/hfjh0/all_4_game_of_thrones_books_for_20_bucks_16/,redddedd,1305856478,,11,8,False,http://thumbs.reddit.com/t3_hfjh0.png,,,,,
409,gameofthrones,t5_2rjz2,2011-5-20,2011,5,20,12,hfldb,self.gameofthrones,How many years have the novels spanned?,https://www.reddit.com/r/gameofthrones/comments/hfldb/how_many_years_have_the_novels_spanned/,markgringo,1305861599,I mean to say how much time has passed from the beginning of the first novel to the latest one released. Thank you.,10,5,False,self,,,,,
410,gameofthrones,t5_2rjz2,2011-5-20,2011,5,20,12,hflu9,self.gameofthrones,"So, about Gendry...",https://www.reddit.com/r/gameofthrones/comments/hflu9/so_about_gendry/,MajesticSCB,1305862894,"Is he the same kid from Skins?
Also, I pictured him bigger and stronger looking, I didn't get the feeling he was a blacksmith's apprentice, or [TV Spoiler](/s ""in any way related to a physically powerful person like King Robert, at least in his prime, which is pretty much the same problem I have with Renly btw""). Anyone else thinks the same?",12,1,False,self,,,,,
411,gameofthrones,t5_2rjz2,2011-5-20,2011,5,20,12,hfm3g,grrm.livejournal.com,So ADWD has many POVs and it's a hair shorter than ASoS [Spoilers for ADWD],https://www.reddit.com/r/gameofthrones/comments/hfm3g/so_adwd_has_many_povs_and_its_a_hair_shorter_than/,[deleted],1305863773,,0,1,False,default,,,,,
412,gameofthrones,t5_2rjz2,2011-5-20,2011,5,20,12,hfm4q,grrm.livejournal.com,So ADWD has many POVs and it's a hair shorter than ASoS [Spoilers for ADWD],https://www.reddit.com/r/gameofthrones/comments/hfm4q/so_adwd_has_many_povs_and_its_a_hair_shorter_than/,[deleted],1305863872,,0,1,False,default,,,,,
413,gameofthrones,t5_2rjz2,2011-5-20,2011,5,20,12,hfm5i,grrm.livejournal.com,So ADWD is a hair shorter than ASoS [Spoilers for ADWD],https://www.reddit.com/r/gameofthrones/comments/hfm5i/so_adwd_is_a_hair_shorter_than_asos_spoilers_for/,LostRadiant,1305863942,,58,57,False,default,,,,,
414,gameofthrones,t5_2rjz2,2011-5-20,2011,5,20,13,hfmac,imgur.com,It is known.,https://www.reddit.com/r/gameofthrones/comments/hfmac/it_is_known/,veeveemarie,1305864334,,1,0,False,http://thumbs.reddit.com/t3_hfmac.png,,,,,
415,gameofthrones,t5_2rjz2,2011-5-20,2011,5,20,14,hfnq9,i.imgur.com,Souhhow do you convince your mom to let you audition for this part?,https://www.reddit.com/r/gameofthrones/comments/hfnq9/souhhow_do_you_convince_your_mom_to_let_you/,snookums,1305868685,,31,42,False,http://thumbs.reddit.com/t3_hfnq9.png,,,,,
416,gameofthrones,t5_2rjz2,2011-5-20,2011,5,20,14,hfod4,self.gameofthrones,"If you've never listened to Roy Dotrice's audiobook performance, you're missing out big time (book spoilers)",https://www.reddit.com/r/gameofthrones/comments/hfod4/if_youve_never_listened_to_roy_dotrices_audiobook/,r2002,1305870728,,34,21,False,self,,,,,
417,gameofthrones,t5_2rjz2,2011-5-20,2011,5,20,23,hfvs4,self.gameofthrones,TIL I learned you don't have to type the stuff in the brackets for spoilers.,https://www.reddit.com/r/gameofthrones/comments/hfvs4/til_i_learned_you_dont_have_to_type_the_stuff_in/,The-Dudemeister,1305900045,"Sometimes I didn't even bother commenting on something becaue i didn't want to type all that out, but evidently you can just do [ ] ( / b "" this "" ) = [](/b ""this"").",2,0,False,self,,,,,
418,gameofthrones,t5_2rjz2,2011-5-20,2011,5,20,23,hfx5l,content9.flixster.com,Who my brain always pictured Stannis as...,https://www.reddit.com/r/gameofthrones/comments/hfx5l/who_my_brain_always_pictured_stannis_as/,binermoots,1305903473,,31,29,False,http://thumbs.reddit.com/t3_hfx5l.png,,,,,
419,gameofthrones,t5_2rjz2,2011-5-21,2011,5,21,0,hfxzg,i.imgur.com,Did anyone else notice?,https://www.reddit.com/r/gameofthrones/comments/hfxzg/did_anyone_else_notice/,Sator,1305905499,,85,147,False,http://thumbs.reddit.com/t3_hfxzg.png,,,,,
420,gameofthrones,t5_2rjz2,2011-5-21,2011,5,21,0,hfyg3,docs.google.com,"Attention Canadian GoT Fans: HBO Go isn't available in Canada, but Episode 7 will be on HBO Canada Online and OnDemand on Sunday night!",https://www.reddit.com/r/gameofthrones/comments/hfyg3/attention_canadian_got_fans_hbo_go_isnt_available/,RoninKengo,1305906533,,4,14,False,default,,,,,
421,gameofthrones,t5_2rjz2,2011-5-21,2011,5,21,1,hfzf9,sporcle.com,Can you name the 7 houses?,https://www.reddit.com/r/gameofthrones/comments/hfzf9/can_you_name_the_7_houses/,[deleted],1305908730,,0,1,False,default,,,,,
422,gameofthrones,t5_2rjz2,2011-5-21,2011,5,21,1,hfzgu,nerdvortex.wordpress.com,Top 5 Tyrion Lannister Moments (HBO's Game of Thrones),https://www.reddit.com/r/gameofthrones/comments/hfzgu/top_5_tyrion_lannister_moments_hbos_game_of/,keyzero,1305908835,,8,9,False,http://thumbs.reddit.com/t3_hfzgu.png,,,,,
423,gameofthrones,t5_2rjz2,2011-5-21,2011,5,21,1,hfzgz,sporcle.com,Can you name the 7 major houses?,https://www.reddit.com/r/gameofthrones/comments/hfzgz/can_you_name_the_7_major_houses/,protell,1305908840,,28,3,False,default,,,,,
424,gameofthrones,t5_2rjz2,2011-5-21,2011,5,21,2,hg0mk,self.gameofthrones,Will they give more insight into the Hound?,https://www.reddit.com/r/gameofthrones/comments/hg0mk/will_they_give_more_insight_into_the_hound/,[deleted],1305911272,I was a bit surprised when watching the last episode of Game of Thrones to see Littlefinger telling the story of how the hound had his face burnt instead of him telling it to Sansa himself as depicted in the books. It kind of makes me wonder whether or not  they are going to show any of the scenes between the Hound and Sansa in the television show (I know there weren't many in the book but frankly I found the character extremely interesting). What do you guys think?,0,1,False,default,,,,,
425,gameofthrones,t5_2rjz2,2011-5-21,2011,5,21,2,hg213,self.gameofthrones,Does anyone else worry that TWOW will be split into two books as well?,https://www.reddit.com/r/gameofthrones/comments/hg213/does_anyone_else_worry_that_twow_will_be_split/,Drfruitloop,1305914118,,7,2,False,self,,,,,
426,gameofthrones,t5_2rjz2,2011-5-21,2011,5,21,3,hg2pu,i.imgur.com,At least he knows his own name,https://www.reddit.com/r/gameofthrones/comments/hg2pu/at_least_he_knows_his_own_name/,[deleted],1305915495,,5,0,False,default,,,,,
427,gameofthrones,t5_2rjz2,2011-5-21,2011,5,21,7,hg8pp,self.gameofthrones,Question about Renly,https://www.reddit.com/r/gameofthrones/comments/hg8pp/question_about_renly/,LordofLannister,1305929199,Since when is he gay?  Or did I completely miss something?  Did anyone pick up on this?,8,0,False,self,,,,,
428,gameofthrones,t5_2rjz2,2011-5-21,2011,5,21,7,hg9ju,self.gameofthrones,What has exceeded your expectations?,https://www.reddit.com/r/gameofthrones/comments/hg9ju/what_has_exceeded_your_expectations/,cassander,1305931304,"We already did a thread on disappointments, and while this thread will be much less popular I'm curious to know what people have liked about the series that they didn't think they would, or what they thought would get screwed up but didn't.  Basically, where has the series has exceeded your expectations?

For me, Nikki as Jaime definitely takes pride of place.  Never heard of the actor before, thought he looked a little too dark and serious.  Jaime was going to be a hard part to get right, but it would ruin the series if they got him wrong.  Then bam, we get a Jaime that looks perfect (more aristocratic than the blonde vampire from True Blood, less masculine than Aaron Eckhart) and completely nails the part beyond my wildest expectations.  He's stolen every scene he's been in.

The Wall has been great as well.  Between the inherent illogic of the structure, all the CGI that would be needed, and the difficulty of filming snow, I was worried it would end up looking silly.  But it feels like a grim, serious place filled with grim, serious people.  Definitely better than I expected.",20,15,False,self,,,,,
429,gameofthrones,t5_2rjz2,2011-5-21,2011,5,21,8,hg9z8,i.imgur.com,Game of Thrones meets Anti-Zombie Fortress.,https://www.reddit.com/r/gameofthrones/comments/hg9z8/game_of_thrones_meets_antizombie_fortress/,[deleted],1305932418,,21,200,False,http://thumbs.reddit.com/t3_hg9z8.png,,,,,
430,gameofthrones,t5_2rjz2,2011-5-21,2011,5,21,8,hga38,self.gameofthrones,Where can I find a Kindle version of the Dunk &amp; Egg stories?,https://www.reddit.com/r/gameofthrones/comments/hga38/where_can_i_find_a_kindle_version_of_the_dunk_egg/,libbykino,1305932701,"I'd be happy to pay, but Amazon.com is sort of letting me down.  Or else, I'm not searching for the right thing...",8,14,False,self,,,,,
431,gameofthrones,t5_2rjz2,2011-5-21,2011,5,21,8,hga9h,self.gameofthrones,Where can I find ASOIAF maps?,https://www.reddit.com/r/gameofthrones/comments/hga9h/where_can_i_find_asoiaf_maps/,TheMainChochacho,1305933155,"Particularly, of the lands Daenerys rides through in A Clash of Kings?",10,11,False,self,,,,,
432,gameofthrones,t5_2rjz2,2011-5-21,2011,5,21,8,hgaxj,youtube.com,I've been listening to this a lot at the gym lately.,https://www.reddit.com/r/gameofthrones/comments/hgaxj/ive_been_listening_to_this_a_lot_at_the_gym_lately/,latarian,1305935083,,3,5,False,http://thumbs.reddit.com/t3_hgaxj.png,,,,,
433,gameofthrones,t5_2rjz2,2011-5-21,2011,5,21,9,hgcal,reddit.com,I think this show deserves more upvotes at /r/tvcritic,https://www.reddit.com/r/gameofthrones/comments/hgcal/i_think_this_show_deserves_more_upvotes_at/,BSpolice,1305939143,,0,3,False,default,,,,,
434,gameofthrones,t5_2rjz2,2011-5-21,2011,5,21,11,hgeo2,self.gameofthrones,Question about Tyrion and the Eyrie? (book spoilers),https://www.reddit.com/r/gameofthrones/comments/hgeo2/question_about_tyrion_and_the_eyrie_book_spoilers/,MAC_TRUCK_HITS_BABY,1305946495,"I'm at the part in the book where  [Book Spoiler](/b ""Bronn duels Ser Vardis for Tyrions freedom. Does Bronn kill Vardis or just wound him?"")",9,5,False,self,,,,,
435,gameofthrones,t5_2rjz2,2011-5-21,2011,5,21,17,hgk5r,self.gameofthrones,"OK, we're a few episodes in, favorite characters everyone?",https://www.reddit.com/r/gameofthrones/comments/hgk5r/ok_were_a_few_episodes_in_favorite_characters/,_loki_,1305966373,"Favorite major character: Tyrion. What a fantastic smartass. 

Favorite minor character: Bronn. I know we've only seen a little bit of Bronn, but I am thoroughly looking forward to his role in the next episode.  


Edit: So far it looks like a tie between Tyrion and Arya, with Littlefinger in a close third. ",109,27,False,self,,,,,
436,gameofthrones,t5_2rjz2,2011-5-22,2011,5,22,0,hgprm,self.gameofthrones,Jon Arryn's last words.,https://www.reddit.com/r/gameofthrones/comments/hgprm/jon_arryns_last_words/,tidefan94,1305992706,"In Ep. 5 Lysa said Arryn's last words were ""the seed is strong"" or something similar.  Without getting book spoiler-y would it be correct to assume he was talking about Robert's bastard and not his own son?",33,37,False,self,,,,,
437,gameofthrones,t5_2rjz2,2011-5-22,2011,5,22,2,hgrw8,self.gameofthrones,"The Hound. (Spoilers)  Also (sorry if this has been discussed before, but I could not find a thread)",https://www.reddit.com/r/gameofthrones/comments/hgrw8/the_hound_spoilers_also_sorry_if_this_has_been/,yflmd,1305999360,"I would like to discuss a possible theory involving The Hound.  Apologies for the vague descriptions, I don't have my books with me for reference on exact quotes. 

[](/b ""Arya left the The Hound for dead after the trouble they had in the Inn and later on Brienne is discussing him with the beggar priest, I forget his name.  The Beggar priest tells her that The Hound is dead, he knows because he treated the wounds to his best ability."")

 
My theory is this:

[](/?""During the time we meet The Hound he goes through quite a large character change, in my opinion one of the most rapid and significant in the whole series. He is literally sobbing with remorse during his last encounter with Sansa and he nearly beats Arya to death when she mentions Micah the butchers boy. He even knocks Arya out to spare her the sight of the red wedding.  I think it is highly possible that when the beggar priest says that the Hound is dead, he simply means the old Hound, and with the help of the Seven Gods he is able to live again, healed from his wounds as a new person.  We are yet to see the last of The Hound in my opinion."")",21,9,False,self,,,,,
438,gameofthrones,t5_2rjz2,2011-5-22,2011,5,22,2,hgs1b,i.imgur.com,At the Godswood [Xpost from r/Trees,https://www.reddit.com/r/gameofthrones/comments/hgs1b/at_the_godswood_xpost_from_rtrees/,orko1995,1305999764,,6,54,False,http://thumbs.reddit.com/t3_hgs1b.png,,,,,
439,gameofthrones,t5_2rjz2,2011-5-22,2011,5,22,3,hgsk5,self.gameofthrones,To read or not to read? (Advice Needed),https://www.reddit.com/r/gameofthrones/comments/hgsk5/to_read_or_not_to_read_advice_needed/,freudwasright,1306001387,"I am partway through the first novel, right around where the last episode left off, and my question is this: Should I read onward? Or should I set the book aside and watch the show without knowing what comes next?",35,12,False,self,,,,,
440,gameofthrones,t5_2rjz2,2011-5-22,2011,5,22,8,hgzb0,self.gameofthrones,"As well as the house tags, would it be possible to display how far through the books each user is? ",https://www.reddit.com/r/gameofthrones/comments/hgzb0/as_well_as_the_house_tags_would_it_be_possible_to/,_loki_,1306021856,It would be it easier to know what level of detail to go into when replying to a question. ,19,0,False,self,,,,,
441,gameofthrones,t5_2rjz2,2011-5-22,2011,5,22,10,hh1fq,self.gameofthrones,"I found a fansite that had character sketches from the books a while ago, but I can't seem to find it. Anyone know of a site like this?",https://www.reddit.com/r/gameofthrones/comments/hh1fq/i_found_a_fansite_that_had_character_sketches/,Drandall85,1306029100,"The site had sketches of a lot of the main characters from the books. I can't remember if it stopped after the first book or not. If anyone knows the site or a site like it, I would really appreciate it if you would share.",10,8,False,self,,,,,
442,gameofthrones,t5_2rjz2,2011-5-22,2011,5,22,11,hh1zz,images.allmoviephoto.com,The obvious casting choice for Balon Greyjoy.,https://www.reddit.com/r/gameofthrones/comments/hh1zz/the_obvious_casting_choice_for_balon_greyjoy/,[deleted],1306031163,,0,1,False,default,,,,,
443,gameofthrones,t5_2rjz2,2011-5-22,2011,5,22,13,hh4pn,en.wikipedia.org,Surely some other art knowledgeable person noticed this relating to opening credits?,https://www.reddit.com/r/gameofthrones/comments/hh4pn/surely_some_other_art_knowledgeable_person/,smokesteam,1306040049,,4,6,False,http://thumbs.reddit.com/t3_hh4pn.png,,,,,
444,gameofthrones,t5_2rjz2,2011-5-22,2011,5,22,14,hh4wo,self.gameofthrones,A politically incorrect comment on episode 5,https://www.reddit.com/r/gameofthrones/comments/hh4wo/a_politically_incorrect_comment_on_episode_5/,smokesteam,1306040663,"[TV Spoiler](/s ""What was with the gay scene with Loras and Renly? Why was this change needed? Does *every* HBO show have to do this?"")",13,0,False,self,,,,,
445,gameofthrones,t5_2rjz2,2011-5-22,2011,5,22,16,hh6ng,self.gameofthrones,Anyone else stop watching the show in favor of finishing the first book?,https://www.reddit.com/r/gameofthrones/comments/hh6ng/anyone_else_stop_watching_the_show_in_favor_of/,[deleted],1306047639,"Watched up to last week, started reading the first book and am officially hooked. Going to hold off on watching the rest of HBO season until completion.",0,1,False,default,,,,,
446,gameofthrones,t5_2rjz2,2011-5-22,2011,5,22,18,hh8jl,a-game-of-thrones.net,50 Impressions from Game of Thrones  The Wolf and the Lion,https://www.reddit.com/r/gameofthrones/comments/hh8jl/50_impressions_from_game_of_thrones_the_wolf_and/,Tanatie,1306056832,,0,0,False,http://thumbs.reddit.com/t3_hh8jl.png,,,,,
447,gameofthrones,t5_2rjz2,2011-5-22,2011,5,22,20,hh9jt,i.imgur.com,Lady Gaga auditioning for ACOK? (xpost from wtf),https://www.reddit.com/r/gameofthrones/comments/hh9jt/lady_gaga_auditioning_for_acok_xpost_from_wtf/,[deleted],1306063277,,1,0,False,default,,,,,
448,gameofthrones,t5_2rjz2,2011-5-23,2011,5,23,0,hhch2,d2mca3jhrjcsa8.cloudfront.net,Awesome map from the creators of the GoT credits sequence - Now my desktop background,https://www.reddit.com/r/gameofthrones/comments/hhch2/awesome_map_from_the_creators_of_the_got_credits/,ZtiWinterfell,1306078310,,48,118,False,http://thumbs.reddit.com/t3_hhch2.png,,,,,
449,gameofthrones,t5_2rjz2,2011-5-23,2011,5,23,3,hhfwx,fmabrendan.imgur.com,My Minecraft reproduction of The Eyrie in honor of the new episode,https://www.reddit.com/r/gameofthrones/comments/hhfwx/my_minecraft_reproduction_of_the_eyrie_in_honor/,FMABrendan,1306089289,,10,53,False,default,,,,,
450,gameofthrones,t5_2rjz2,2011-5-23,2011,5,23,3,hhgam,self.gameofthrones,Discrepancies between the book and the show,https://www.reddit.com/r/gameofthrones/comments/hhgam/discrepancies_between_the_book_and_the_show/,Ze_Carioca,1306090338,"I finally saw last Sunday's game of thrones on HBO and didn't remember several events happening in the book. 

- I dont remember the Knight of Flowers being gay. Especially with a Brother of Robert and Stannis. I thought Stannis was his only brother. 

- I don't remember Ned Stark being stabbed in the leg during a fight with Jaime. 

It has been 2 years since I read the books so maybe my memory is a little rusty. ",3,0,False,self,,,,,
451,gameofthrones,t5_2rjz2,2011-5-23,2011,5,23,5,hhhog,self.gameofthrones,A thought regarding Jon Snow's Mother... [BOOK AND TV SPOILERS WITH SPECULATION],https://www.reddit.com/r/gameofthrones/comments/hhhog/a_thought_regarding_jon_snows_mother_book_and_tv/,CerpinTaxt11,1306094446,"I've always liked the Rhaegar and Lyanna theories, and now with my second read-through, I'm noticing lots of allusions towards it (Ned saying that it doesn't matter who his mother is, all that matters is that he ""has my blood"", also the deathbed ""Promise me Ned..."".

I'm not 100% sure if what I'm gonna say makes sense, or is true. I'd like someone who is more familiar with the book to verify this thought.

Jon Snow is 14 years old. At one stage in GoT, Cat begins thinking of Winterfell, and remembering each of her children. When she thinks of the bastard son, she says something along the lines of ""Jon is as old as Ned was when he fathered him, that's a strange thought.""

However, later when Ned is in the dungeon of the Red Keep, he recalls a tourney at Harrenhall where he was 18 years old. Rhaegar and The Mad King are alive at this flashback. The battle of the Trident must have happened later. This means that Jon Snow is too young to be born at this stage, so he was not a result of R+L.

Does this sound right? Can someone verify that quote? I can't find it at the moment.

",3,0,False,self,,,,,
452,gameofthrones,t5_2rjz2,2011-5-23,2011,5,23,5,hhi13,self.gameofthrones,Is there a difference between The Others and The White Walkers or are they the same thing?,https://www.reddit.com/r/gameofthrones/comments/hhi13/is_there_a_difference_between_the_others_and_the/,cleverass_username,1306095471,"I thought that they were two distinct groups but my wife, who's read the series more recently than I have, thinks that they are two names for the same creatures.

She's half way through ASoS, so please be careful with the spoilers. ",27,14,False,self,,,,,
