,sbr,sbr_id,date,year,month,hour,day,id,domain,title,full_link,author,created,selftext,num_comments,score,over_18,thumbnail,media_provider,media_thumbnail,media_title,media_description,media_url
574,gameofthrones,t5_2rjz2,2011-5-25,2011,5,25,11,hjfwd,self.gameofthrones,DAE think Harry Lloyd played Viserys so well?,https://www.reddit.com/r/gameofthrones/comments/hjfwd/dae_think_harry_lloyd_played_viserys_so_well/,[deleted],1306291207,"He should win an award. Still can't get his bittersweet, drunken expression when Dany told him Drogo's giving him his crown off my mind. Harry Lloyd &gt; Peter Dinklage to me now.",0,1,False,self,,,,,
575,gameofthrones,t5_2rjz2,2011-5-25,2011,5,25,12,hjh1m,self.gameofthrones,"""To Take the Black"" is a great fucking song and full of George R.R. Martin influence.",https://www.reddit.com/r/gameofthrones/comments/hjh1m/to_take_the_black_is_a_great_fucking_song_and/,[deleted],1306294070,"Lyrics:

Cast out from the lands of their births
Banished from hearth and home
All brothers must swear the oath
Forsaking all they've ever known

Those who choose to take the black
Bid farewell to comforts great and small
Those who do, don't come back
Prepare yourself for life on the wall

Night gathers and the watch begins
The wind carries an unnatural chill
There are things beyond the northern borders
Mere steel can't kill

Men who choose to take the black
Rogues and rangers, one and all
Those who do, won't come back
Prepare yourself for life on the wall ",0,2,False,default,,,,,
576,gameofthrones,t5_2rjz2,2011-5-25,2011,5,25,13,hji1i,self.gameofthrones,Will Episode 8 be shown next week at HBO GO website?,https://www.reddit.com/r/gameofthrones/comments/hji1i/will_episode_8_be_shown_next_week_at_hbo_go/,PraetorianX,1306296574,...like Episode 7 was shown this week? Or was it a one-time thing?,6,9,False,self,,,,,
577,gameofthrones,t5_2rjz2,2011-5-25,2011,5,25,14,hjjuc,betexposure.com,Stannis Baratheon.,https://www.reddit.com/r/gameofthrones/comments/hjjuc/stannis_baratheon/,tme001,1306301401,,0,0,False,http://thumbs.reddit.com/t3_hjjuc.png,,,,,
578,gameofthrones,t5_2rjz2,2011-5-25,2011,5,25,14,hjk42,self.gameofthrones,Need a little bit of clarification from book readers on Ep 7,https://www.reddit.com/r/gameofthrones/comments/hjk42/need_a_little_bit_of_clarification_from_book/,[deleted],1306302133,"In the scene in the brothel with Littlefinger's monologue, is the girl he loved referring to Catelyn Stark?",9,15,False,default,,,,,
579,gameofthrones,t5_2rjz2,2011-5-25,2011,5,25,15,hjkh6,self.gameofthrones,I have a question I've been kicking around since I read A Game Of Thrones *YEAH ITS GONNA SPOLIERS*,https://www.reddit.com/r/gameofthrones/comments/hjkh6/i_have_a_question_ive_been_kicking_around_since_i/,[deleted],1306303288,"I know I said spoilers in the title but just to be safe [Book Spoiler](/b ""When the Starks first find the Direwolves in....what was it? Chapter 1? They find a dead direwolf mother with a broken stag horn in it's throat. Now the stag clearly dead having fought with a direwolf, and the direwolf clearly died from the stag horn. I've always wondered if this was mean to be foreshadowing, or just coincidence."") Thoughts?",0,1,False,default,,,,,
580,gameofthrones,t5_2rjz2,2011-5-25,2011,5,25,15,hjkku,self.gameofthrones,Does Tyrion remind anybody else of this guy?,https://www.reddit.com/r/gameofthrones/comments/hjkku/does_tyrion_remind_anybody_else_of_this_guy/,[deleted],1306303621,,0,1,False,default,,,,,
581,gameofthrones,t5_2rjz2,2011-5-25,2011,5,25,16,hjlnr,self.gameofthrones,Can we make a plan to break into a studio and get the reels for last episodes of Season 1? I don't wanna wait two weeks.,https://www.reddit.com/r/gameofthrones/comments/hjlnr/can_we_make_a_plan_to_break_into_a_studio_and_get/,[deleted],1306307029,,14,11,False,self,,,,,
582,gameofthrones,t5_2rjz2,2011-5-25,2011,5,25,18,hjns9,self.gameofthrones,IAMA Torrenter that is seriously considering sending HBO a money order and a letter.,https://www.reddit.com/r/gameofthrones/comments/hjns9/iama_torrenter_that_is_seriously_considering/,SpaceBanker,1306316005,"This show is bloody amazing. And I feel like a total dick about torrenting it. 

But, I don't have cable, and am not going to spend the money to get cable, just so I can pay even more for HBO (it'll be like, what $50 a month total?). But I really want to show support (and put my money where my mouth is). So, I was thinking about sending them a letter, explaining my situation, apologize for torrenting and include a money order for $50 or so bucks ($5 an episode seems fair). 

What do y'all think? Good idea? Bad? Will it work? Where and who do I send it too? Else one else want to do it (if enough do, it might gain some traction/attention).

Thanks!

edit: 
Thanks for all the great responses. 

I guess I just wanted to go above and beyond to show how much I care about this show. HBOGO should be available for non-hbo subscribers for a for a monthly premium like netflix (but obviously more expensive - similar, if not more expensive to than a regular HBO cable subscription [since you don't have to pay the cable cost]).

I definitely plan on getting the DVDs when they come out. I guess in the meantime I will settle for getting a set of these sweet [mugs](http://store.hbo.com/?v=hbo_shows_game-of-thrones_mugs-and-glasses&amp;nvbar=Left+Navigation:Shop+Game+of+Thrones:Mugs+and+Glasses).",72,70,False,self,,,,,
583,gameofthrones,t5_2rjz2,2011-5-25,2011,5,25,20,hjps2,i.imgur.com,My vote for Brienne of Tarth!,https://www.reddit.com/r/gameofthrones/comments/hjps2/my_vote_for_brienne_of_tarth/,[deleted],1306324613,,0,1,False,default,,,,,
584,gameofthrones,t5_2rjz2,2011-5-25,2011,5,25,20,hjptp,blastr.com,GRRM wrote Episode 8! Now it's going to be more difficult than I thought to wait 2 weeks for the next episode...,https://www.reddit.com/r/gameofthrones/comments/hjptp/grrm_wrote_episode_8_now_its_going_to_be_more/,eudaimonean,1306324795,,0,0,False,default,,,,,
585,gameofthrones,t5_2rjz2,2011-5-25,2011,5,25,22,hjr6f,self.gameofthrones,"I just watched episode 7 on HBO Go, both of which kick ass: is it too late to start reading the books?",https://www.reddit.com/r/gameofthrones/comments/hjr6f/i_just_watched_episode_7_on_hbo_go_both_of_which/,Monty_Brogan,1306329324,"I'm just absolutely hooked on watching the series, but not sure if I should start reading it. Any advice is appreciated. ",30,15,False,self,,,,,
586,gameofthrones,t5_2rjz2,2011-5-25,2011,5,25,22,hjreh,store.hbo.com,Who would wear this T-shirt in public?,https://www.reddit.com/r/gameofthrones/comments/hjreh/who_would_wear_this_tshirt_in_public/,[deleted],1306329904,,0,1,False,default,,,,,
587,gameofthrones,t5_2rjz2,2011-5-25,2011,5,25,22,hjrgu,store.hbo.com,Stick 'em with the pointy end!,https://www.reddit.com/r/gameofthrones/comments/hjrgu/stick_em_with_the_pointy_end/,Universus,1306330086,,0,2,False,http://thumbs.reddit.com/t3_hjrgu.png,,,,,
588,gameofthrones,t5_2rjz2,2011-5-25,2011,5,25,22,hjrm9,self.gameofthrones,"Assuming GoT continues to be popular, what will happen when then run out of books?",https://www.reddit.com/r/gameofthrones/comments/hjrm9/assuming_got_continues_to_be_popular_what_will/,rugbysquid,1306330463,"So far the series is wildly popular (they've already confirmed Season 2), and it looks like they're aiming for one book per season.  Assuming the do one season per year, they'll run out of books before GRRM finishes writing the series.  What do you think they'll do then?",98,12,False,self,,,,,
589,gameofthrones,t5_2rjz2,2011-5-25,2011,5,25,22,hjrmr,self.gameofthrones,"Choose your House, v2.0?",https://www.reddit.com/r/gameofthrones/comments/hjrmr/choose_your_house_v20/,Universus,1306330512,"I came a few days late to the party and would absolutely love to have house tags like all the cool kids. Mods, I know you are busy, but is there any way to make this happen? Maybe appoint another mod? (Not it.) 

T'would be much appreciated, my lords!

**EDIT:** Guys, I am not an admin, so posting your requested House here isn't going to do anything. Try emailing the admins and see if they will tag your house for you!",72,25,False,self,,,,,
590,gameofthrones,t5_2rjz2,2011-5-25,2011,5,25,23,hjsd8,self.gameofthrones,"Seven books, seven gods?",https://www.reddit.com/r/gameofthrones/comments/hjsd8/seven_books_seven_gods/,[deleted],1306332473,"Coincidence?

A rare commodity in the writing of GRRM.

Can we assign one book to each of the Seven perhaps?

I'm guessing here;

#1 Father (It kinda follows Ned)
#2 Mother (It kinda follows Caitlyn)
#3 Warrior (Bigass war everywhere)
#4 Maiden (Thinking of the Stark girls here)
.
.
.

What are your thoughts? Feel free to correct/slap/insult my thinking.",54,38,False,self,,,,,
591,gameofthrones,t5_2rjz2,2011-5-25,2011,5,25,23,hjsg2,reddit.com,xpost from /r/TIL Re: Robert Baratheon,https://www.reddit.com/r/gameofthrones/comments/hjsg2/xpost_from_rtil_re_robert_baratheon/,[deleted],1306332666,,0,1,True,nsfw,,,,,
592,gameofthrones,t5_2rjz2,2011-5-26,2011,5,26,0,hjtnm,self.gameofthrones,Is this foreshadowing or am I reading too much into this? *YEAH....SPOILERS*,https://www.reddit.com/r/gameofthrones/comments/hjtnm/is_this_foreshadowing_or_am_i_reading_too_much/,tibxero,1306335661,"I know I said spoilers in the title but just to be safe [Book Spoiler](/b ""When the Starks first find the Direwolves in....what was it? Chapter 1? They find a dead direwolf mother with a broken stag horn in it's throat. Now the stag clearly dead having fought with a direwolf, and the direwolf clearly died from the stag horn. I've always wondered if this was mean to be foreshadowing, or just coincidence."") Thoughts?",0,1,False,self,,,,,
593,gameofthrones,t5_2rjz2,2011-5-26,2011,5,26,0,hjufv,self.gameofthrones,1.07 You Win or You Die,https://www.reddit.com/r/gameofthrones/comments/hjufv/107_you_win_or_you_die/,markusdee,1306337452,"Great episode. Perhaps the best thus far.

Tywin!!!! Telling Jamie how it is - great scene.

Cercei - killled it. She told Ned how it is (see episode title).

Winterfell: Theon and the Wildling (does she have a name?). I think the actor playing Theon is doing a great job. I don't like him at all.

Super view from the wall. Jon and Sam are playing really well off of each other.

Renly, for as gay as they are making him, is doing a tremendous job. He understands power and tells Eddard what's up, but will he listen ...

Varys ... top notch, but perhaps Lancel is being made out to be a little too robotic .. sure he's ..., but ...

Dany and Drogo, looks like love. The guy playing Jorah is killing it too. It's not too over the top, but we know what he's thinking. And Dany, if you had concerns in the beginning, I hope they've been alleviated. She's on fire.

The wall again. The Old Bear told the recruits exactly what they needed to hear: awesome. Aemon is spot on, although basically he has to be bald, old, and squinty. Still, I loved it. 

Ned! Renly's telling you what you need to do! Classic scene. Almost perfect. I loved when Littlefinger tells Ned that it's treason only if you lose. Do you think he'll listen?

I think the Night's Watch vows were well done: ""I am the sword in the night."" And, like always, Ghosts!!

Jorah saves Dany. Drogo goes nuts.

Who is the decider in the end? Janos Slynt. Who? Yeah, Janos Slynt sides with Lions and that's the way it is. Shout out to Barriston the Bold, but too bad Ned - you lose.",0,1,False,self,,,,,
594,gameofthrones,t5_2rjz2,2011-5-26,2011,5,26,0,hjukn,i.imgur.com,"ASSISTANT TO the King of the Andals and the Rhoynar and the First Men, Lord of the Seven Kingdoms, and Protector of the Realm.",https://www.reddit.com/r/gameofthrones/comments/hjukn/assistant_to_the_king_of_the_andals_and_the/,Hybrid-Paul,1306337783,,12,117,False,http://thumbs.reddit.com/t3_hjukn.png,,,,,
595,gameofthrones,t5_2rjz2,2011-5-26,2011,5,26,0,hjurm,self.gameofthrones,[Book Spoiler/Speculation] Regarding Jon Snow,https://www.reddit.com/r/gameofthrones/comments/hjurm/book_spoilerspeculation_regarding_jon_snow/,[deleted],1306338228,"My friend and I were discussing [Book Speculation](/? ""Jon Snow's parentage"") via email.  I suggested (and I've read similar speculations) that [Book Speculation](/? ""Jon's mother was a Targaryen and Ned saved him from slaughter b/c he's awesome like that.  I questioned it, though, b/c of his lack of silver hair."")  My friend has a better theory:

[Book Speculation](/? ""I think it's almost certain that Jon Snow is the son of Rhaegar Targaryan and Lyanna Stark.  The latter's Helen of Troy-esque kidnapping by the former, was most likely a consensual tryst."")

[Book Speculation](/? ""The nature of their relationship has never been satisfactorily explained, and the only insight into her is via Robert's alcoholic pinnings.  And he's obviously biased... It also explains his rage at Rhaegar during the battle on the Trident."")


[Book Speculation](/? ""Ned says that Jon IS of his blood, and Ned does his best not to lie, so Stark blood from his mom would satisfy that requirement.  also the timing is perfect.  also, the last words 'Promise me Ned' are a bit telling.  As for his looks, he is always described as having strong northern Stark features, so perhaps the Targaryan seeds aren't quite as strong as the Baratheon.  One of Rhaegar's legitimate kids with Elia Martell was said to have very Martell-like features, so..."")

[Book Spoiler](/b ""Could be wrong of course, but either way, Ned's ""Wylla the wetnurse"" story doesn't shake."")

I really like this theory and think it is definitely possible.  What do you folks think?",12,5,False,default,,,,,
596,gameofthrones,t5_2rjz2,2011-5-26,2011,5,26,1,hjvcx,self.gameofthrones,What are the titles of nobility in the Seven Kingdoms?,https://www.reddit.com/r/gameofthrones/comments/hjvcx/what_are_the_titles_of_nobility_in_the_seven/,iamdanthemanstan,1306339522,"The king is referred to as ""your grace"" in Dorne they use prince but I can't remember what the honorific is. Is it all feudal land owners who are referred to as ""lord"" or just the major ones? Some positions, like being on the Small Council, or being in charge of the Night's Wath also seem to come with the title ""lord."" The system of knights also seems separate from nobility, this was pretty standard in European monarchies since knights weren't technically hereditary titles. But can only the king make knights or can some lords?",21,5,False,self,,,,,
597,gameofthrones,t5_2rjz2,2011-5-26,2011,5,26,1,hjvgh,self.gameofthrones,New Book Speculation After Watching Ep. 7 (Major book spoilers/speculation discussion),https://www.reddit.com/r/gameofthrones/comments/hjvgh/new_book_speculation_after_watching_ep_7_major/,TheKingInTheNorth,1306339746,"I started a discussion on here not too long ago about a couple new theories I had.  Both were counter theories to the popular ones about Jon Snow's and Tyrion's lineage.  I won't go into it in depth again here, but I theorized that Jamie/Cersei were actually Targaryens and Tyrion was his father's only true son.

After watching episode 7 I want to take that back.  I'm back on board with thinking that Tyrion is the bastard Lannister.  Why?
   

Because with the show, we now have another possible source for clues to go along with the books.  And because of their brevity, its become obvious that the show has to sacrifice some of the subtlety they the books are able to maintain.  A good example of this would be the scene with Joffery and Sansa kissing in Episode 7.  The show can't spend several scenes showing minor interactions between the two, or Sansa conversing with Jeyne and her other friends about Joffery.  They need to get to the point, and jack up the intensity of what scenes they do have together in order to bring the characters to the correct point in their relationship in less time.


This brings me back to the point of this post, and speculating about Tyrion's lineage.  I believe the scene last night that introduced Tywin was one of those added by the writers to condense a whole lot of character development into a single scene.  And just like the book, there need to be clues about about future plot twists so that once those twists are revealed, we'll revisit those quotes from book and scenes from the show and thing ""fuuckk... I totally missed that clue.  Now that I know the twist, it totally changes what I imagine the character is thinking""


I imagine that Martin has made the two executive producers of the show privy to knowledge about some of these plot twists he's planning later.  This would prevent the show from having the characters contradict what they know, but the reader/watcher has yet to find out.  Episode 7 was one of the episodes written directly by Benioff and Weiss.  And in that scene with Tywin the dialog between him and Jamie had Jamie constantly referring to Tyrion as ""my brother this, my brother that.""  And Tywin referring to him as ""one of us, he's a Lannister, my blood.""  But I don't believe he was ever once referred to as ""your son"" by Jamie or ""my son"" by Tywin.  And I feel like the clue didn't have the subtlety that I mentioned above.  You don't write a scene with long dialog like that about Tyrion and never explicitly establishing the father/son relationship without doing it intentionally.

So to me, that scene may have not hinted anything about Tyrion being a Targaryen, but I felt it was certainly a heavy-handed clue that Tywin is not his father.


**tl;dr** The conversation between Jamie and Tywin in Ep. 7 leads me to believe that Tyrion is not Tywin's son.
",24,3,False,self,,,,,
598,gameofthrones,t5_2rjz2,2011-5-26,2011,5,26,1,hjw2i,nerdvortex.wordpress.com,Game Of Thrones Top 5 Arya Moments,https://www.reddit.com/r/gameofthrones/comments/hjw2i/game_of_thrones_top_5_arya_moments/,Phoenix_torn,1306341203,,3,4,False,default,,,,,
599,gameofthrones,t5_2rjz2,2011-5-26,2011,5,26,2,hjy95,self.gameofthrones,Game of Thrones drinking game,https://www.reddit.com/r/gameofthrones/comments/hjy95/game_of_thrones_drinking_game/,b00ger,1306345980,"Let's make one!

Exposition scene in a whorehouse - drink!

Blood spurting out of a slit throat - drink!

""A Lannister always pays his debts"" - drink!

Actually seeing one of the damn direwolves - drink twice!

What else?

(edit: formatting)",81,41,False,self,,,,,
600,gameofthrones,t5_2rjz2,2011-5-26,2011,5,26,2,hjyfn,3.bp.blogspot.com,My Favorite actress so far :),https://www.reddit.com/r/gameofthrones/comments/hjyfn/my_favorite_actress_so_far/,MrJaiDinesh,1306346349,,35,21,False,http://thumbs.reddit.com/t3_hjyfn.png,,,,,
601,gameofthrones,t5_2rjz2,2011-5-26,2011,5,26,3,hk002,self.gameofthrones,"HBO cheapens itself in Episode 7, You Win or You Die (Spoilers)",https://www.reddit.com/r/gameofthrones/comments/hk002/hbo_cheapens_itself_in_episode_7_you_win_or_you/,veeveemarie,1306349581,"Did anyone else think that the lesbian scene in Littlefingers whore house was unnecessary and cheap? I mean, Im all for sex, and theres plenty of it in the book series. I was prepared for HBO to ramp up the sex factor, and even prepared for a Loras and Renly love scene, albeit jokingly, but after watching the early premiere for Episode 7 I felt like they went beyond their usual tawdry self. 

While the scene lasted about 5 minutes, most of it was completely unnecessary. I understand the need for Littlefinger to give us some back story on his [TV Spoiler](/s ""Catelyn Tully crush and the battle against her betrothed""), but play with her ass while hes mid-sentence in revealing his lost love story? Too much. Give us a minute of back story and instead of 4 minutes of lesbian boobage, you give us direwolves (remember them?) or explain why [TV Spoiler](/s ""Dany is eating a horse heart""). You know, actual story. 
	
In my opinion that scene was there strictly for the girl-on-girl action. It was forced, cheap, and changed my views toward the show. HBO, there is plenty of sex in the series; you really dont need to add any more. The intelligence and grace of the books are slowly being lost thanks to this kind of directing. If I wanted to watch porn, Id go watch porn and I sure as hell wouldnt pay $15 a month for it. Im paying to see my favorite book series come to life as no other network could produce and theyre bringing it down to the level of True Blood. Seriously, HBO? Have some class. These arent Twilight fans youre dealing with; we expect more.

Im sure some of my male counterparts may disagree with my feelings on this, and thats to be expected. I was just disappointed with HBOs need to flaunt sex so desperately that they would forego any real story telling. The books are hard enough to condense; you would think that they would want to put in as much detail as possible. But no time for that! MOAR BOOBS!

Other than that particular scene, I loved the episode.

If HBO decides to keep adding cheap sex scenes instead of showing all the amazing things in the book that they had to cut (in order to fit in the cheap sex scenes), I might have to cancel my subscription. 

(Id probably still watch, but HBO can kiss my money goodbye if they're not going to do it justice.)



",9,4,False,self,,,,,
602,gameofthrones,t5_2rjz2,2011-5-26,2011,5,26,3,hk050,i.imgur.com,"Can we please soften the spoiler colors, like so? Source code is in comments.",https://www.reddit.com/r/gameofthrones/comments/hk050/can_we_please_soften_the_spoiler_colors_like_so/,[deleted],1306349891,,1,2,False,default,,,,,
603,gameofthrones,t5_2rjz2,2011-5-26,2011,5,26,4,hk0b2,self.gameofthrones,Alignment Chart,https://www.reddit.com/r/gameofthrones/comments/hk0b2/alignment_chart/,miserlou,1306350220,What would a GoT alignment chart look like? Anybody want to make one?,8,3,False,self,,,,,
604,gameofthrones,t5_2rjz2,2011-5-26,2011,5,26,4,hk0gf,guardian.co.uk,The Guardian - Game of Thrones series blog. Episode by episode guide. ,https://www.reddit.com/r/gameofthrones/comments/hk0gf/the_guardian_game_of_thrones_series_blog_episode/,TheGoodOttoKatz,1306350542,,0,8,False,default,,,,,
605,gameofthrones,t5_2rjz2,2011-5-26,2011,5,26,4,hk0in,self.gameofthrones,"Now that Chris Meloni says he's not returning to SVU, don't you think he'd be a perfect Stannis?",https://www.reddit.com/r/gameofthrones/comments/hk0in/now_that_chris_meloni_says_hes_not_returning_to/,poptophazard,1306350665,"I've always pictured Stannis in the books looking like Christopher Meloni, and now that he's confirmed he's not returning to Law &amp; Order: SVU, and Season 2 shooting later on, I think it'd be a perfect opportunity to cast him.  Thoughts?

Reference:  http://imgur.com/xBGgH",20,7,False,self,,,,,
606,gameofthrones,t5_2rjz2,2011-5-26,2011,5,26,4,hk0w0,i.imgur.com,"I propose a small change to this subreddit. Can we please soften the colors for the spoilers, like so? (source code is in comments)",https://www.reddit.com/r/gameofthrones/comments/hk0w0/i_propose_a_small_change_to_this_subreddit_can_we/,deodrus,1306351574,,21,75,False,http://thumbs.reddit.com/t3_hk0w0.png,,,,,
607,gameofthrones,t5_2rjz2,2011-5-26,2011,5,26,4,hk0z6,i.imgur.com,Oh hey guys! I'm here for the feast!,https://www.reddit.com/r/gameofthrones/comments/hk0z6/oh_hey_guys_im_here_for_the_feast/,[deleted],1306351773,,0,1,False,default,,,,,
608,gameofthrones,t5_2rjz2,2011-5-26,2011,5,26,4,hk1dz,i.imgur.com,GRRM's newest POV character,https://www.reddit.com/r/gameofthrones/comments/hk1dz/grrms_newest_pov_character/,NihilCredo,1306352607,,18,58,False,http://thumbs.reddit.com/t3_hk1dz.png,,,,,
609,gameofthrones,t5_2rjz2,2011-5-26,2011,5,26,5,hk1xr,mlkshk.com,What the real title of the show should be.,https://www.reddit.com/r/gameofthrones/comments/hk1xr/what_the_real_title_of_the_show_should_be/,RoninKengo,1306353651,,36,110,False,http://thumbs.reddit.com/t3_hk1xr.png,,,,,
610,gameofthrones,t5_2rjz2,2011-5-26,2011,5,26,5,hk306,self.gameofthrones,Question about Thoros? (book 1 spoilers),https://www.reddit.com/r/gameofthrones/comments/hk306/question_about_thoros_book_1_spoilers/,MAC_TRUCK_HITS_BABY,1306356015,"[Book Spoiler](/b ""What the fuck happened to him and the other people that Ned sent to kill Gregor? I'm about to finish book 1 (at the Tyrion PoV where he is being sent to King's Landing by Tywin). Obviously, Gregor was not killed. So, what happened to Thoros and that other knight when they went to kill Gregor? And what are they doing at this point in the book 1?"")",12,3,False,self,,,,,
611,gameofthrones,t5_2rjz2,2011-5-26,2011,5,26,6,hk41a,self.gameofthrones,"""Making the 8"" was pretty good",https://www.reddit.com/r/gameofthrones/comments/hk41a/making_the_8_was_pretty_good/,[deleted],1306358331,"Found it a funny little addition.  Didn't really understand Renly during this scene, though.",11,20,False,self,,,,,
612,gameofthrones,t5_2rjz2,2011-5-26,2011,5,26,6,hk497,reddit.com,"Since the colorblind have difficulty in differentiating between the spoiler-colors, I've added relevant icons to the spoilers. Here's a live demonstration.",https://www.reddit.com/r/gameofthrones/comments/hk497/since_the_colorblind_have_difficulty_in/,deodrus,1306358853,,9,14,False,default,,,,,
