,sbr,sbr_id,date,year,month,hour,day,id,domain,title,full_link,author,created,selftext,num_comments,score,over_18,thumbnail,media_provider,media_thumbnail,media_title,media_description,media_url
885,gameofthrones,t5_2rjz2,2012-3-16,2012,3,16,22,qzbik,imgur.com,My new Adopt a Dire Wolf tshirt :D,https://www.reddit.com/r/gameofthrones/comments/qzbik/my_new_adopt_a_dire_wolf_tshirt_d/,anno-jr,1331903468,,133,653,False,http://d.thumbs.redditmedia.com/F9hYEwHlATLXRzL9.jpg,,,,,
886,gameofthrones,t5_2rjz2,2012-3-16,2012,3,16,23,qzdby,self.gameofthrones,(Clash of Kings/season 2 spoilers) How do you think they'll handle a certain scene in season 2?,https://www.reddit.com/r/gameofthrones/comments/qzdby/clash_of_kingsseason_2_spoilers_how_do_you_think/,Dovienya,1331906666,"Do you think they will make it obvious that Bran and Rickon aren't dead?  In reading, I thought they were, though there are people who put the clues together and realized they weren't.  

If they are going to imply that Bran and Rickon are dead, do you think it will be resolved by the end of that episode, or will there be a cliffhanger?",56,24,False,self,,,,,
887,gameofthrones,t5_2rjz2,2012-3-16,2012,3,16,23,qzdxr,quickmeme.com,One of the best quotes in the series.,https://www.reddit.com/r/gameofthrones/comments/qzdxr/one_of_the_best_quotes_in_the_series/,[deleted],1331907663,,1,0,False,default,,,,,
888,gameofthrones,t5_2rjz2,2012-3-16,2012,3,16,23,qzeeu,conanstevens.com,Conan Stevens on why he isn't returning as Gregor Clegane,https://www.reddit.com/r/gameofthrones/comments/qzeeu/conan_stevens_on_why_he_isnt_returning_as_gregor/,Carninator,1331908363,,74,74,False,http://b.thumbs.redditmedia.com/trF28RIOXl5IOuGO.jpg,,,,,
889,gameofthrones,t5_2rjz2,2012-3-17,2012,3,17,0,qzh1a,store.hbo.com,The best t-shirt on the HBO store IMO.,https://www.reddit.com/r/gameofthrones/comments/qzh1a/the_best_tshirt_on_the_hbo_store_imo/,RedditAvalanche,1331911907,,2,20,False,default,,,,,
890,gameofthrones,t5_2rjz2,2012-3-17,2012,3,17,1,qzit2,youtube.com,"The show opening sung by (the actors who play) Sansa, Arya and Bran",https://www.reddit.com/r/gameofthrones/comments/qzit2/the_show_opening_sung_by_the_actors_who_play/,lumpsofit,1331914088,,4,0,False,http://c.thumbs.redditmedia.com/u8nSY-OTbgrMjJGh.jpg,,,,,
891,gameofthrones,t5_2rjz2,2012-3-17,2012,3,17,1,qzjpl,gameofthronestournament.com,Tyrion Lannister is about to get a beatdown by Sansa Stark...,https://www.reddit.com/r/gameofthrones/comments/qzjpl/tyrion_lannister_is_about_to_get_a_beatdown_by/,spoonito,1331915320,,15,11,False,default,,,,,
892,gameofthrones,t5_2rjz2,2012-3-17,2012,3,17,3,qzpg3,i.imgur.com,How Amazon describes the entire cast of Game of Thrones...,https://www.reddit.com/r/gameofthrones/comments/qzpg3/how_amazon_describes_the_entire_cast_of_game_of/,[deleted],1331922336,,0,0,False,default,,,,,
893,gameofthrones,t5_2rjz2,2012-3-17,2012,3,17,3,qzpm5,towerofthehand.com,"Titles and descriptions of April episodes revealed! [Spoilers, obviously]",https://www.reddit.com/r/gameofthrones/comments/qzpm5/titles_and_descriptions_of_april_episodes/,[deleted],1331922544,,2,0,False,default,,,,,
894,gameofthrones,t5_2rjz2,2012-3-17,2012,3,17,3,qzqos,i.imgur.com,Right Guys?,https://www.reddit.com/r/gameofthrones/comments/qzqos/right_guys/,[deleted],1331923796,,0,0,False,default,,,,,
895,gameofthrones,t5_2rjz2,2012-3-17,2012,3,17,5,qzums,imgur.com,Book Covers I designed,https://www.reddit.com/r/gameofthrones/comments/qzums/book_covers_i_designed/,victoriar531,1331928703,,18,61,False,default,,,,,
896,gameofthrones,t5_2rjz2,2012-3-17,2012,3,17,5,qzv5a,self.gameofthrones,"A question for you all about Daenerys...(AGoT,ACoK,ASoS spoilers)",https://www.reddit.com/r/gameofthrones/comments/qzv5a/a_question_for_you_all_about_daenerysagotacokasos/,E3_Lunatic,1331929329,"So I'm about 300 pages into ASoS and I'm starting to have quite the opinion about Daenerys. It might not be the popular opinion on /r/gameofthrones but I'm really starting to dislike the way G.R.R.M develops her character for instance when she's [ACoK Spoiler](/b ""in Qarth and she describes the shade-of-the-evening as tasting like Drogo's cum"") I just think it's completely unrealistic for any female to describe something like that, Westeros or not. The cherry on top was reading in ASoS [ASoS Spoiler](/b ""After inspecting the unsullied, she describes a previous night where Irri goes down on her after waking up to find her touching herself""). I just find her character a bit too over the top and am dissapointed considering how well G.R.R.M develops other characters(e.g Arya). 


TL;DR: I find Daenerys' character way over the top. Anybody else dislike her character/ will things change later on in the series?",13,0,False,self,,,,,
897,gameofthrones,t5_2rjz2,2012-3-17,2012,3,17,5,qzvmf,ew.com,Entertainment Weekly GoT Cast Portraits!,https://www.reddit.com/r/gameofthrones/comments/qzvmf/entertainment_weekly_got_cast_portraits/,featpete,1331929885,,14,19,False,http://c.thumbs.redditmedia.com/JkwEUF4XXNRdi-BD.jpg,,,,,
898,gameofthrones,t5_2rjz2,2012-3-17,2012,3,17,6,qzzbr,self.gameofthrones,I want inside the head of Qyburn Naow!. FFC Spoilers.,https://www.reddit.com/r/gameofthrones/comments/qzzbr/i_want_inside_the_head_of_qyburn_naow_ffc_spoilers/,sicksorry,1331934340,"[Book Spoiler FFC](/b ""I don't mind this small part being spoiled for me, because I just have to know.. When Qyburn mentions he has a fit and able Champion to fight on behalf of Cersi I can't help but picture some Frankensteined version of Gregor Clegane, wits and mind gone, ready to serve for whoever commands him. Please tell me this is the case?"")

I'd love a few Qyburn Chapters though, [Book Spoiler](/b ""To see what is really going on inside those Black cells."")
",8,7,False,self,,,,,
899,gameofthrones,t5_2rjz2,2012-3-17,2012,3,17,7,r001z,self.gameofthrones,anyone know of someplace to download the countdown timer thingie?,https://www.reddit.com/r/gameofthrones/comments/r001z/anyone_know_of_someplace_to_download_the/,CharmedP5,1331935253,Sister found a countdown timer for the season premiere but it doesn't have an download link; wants one for phone. ,0,2,False,self,,,,,
900,gameofthrones,t5_2rjz2,2012-3-17,2012,3,17,7,r00yg,ew.com,New Season 2 Pictures,https://www.reddit.com/r/gameofthrones/comments/r00yg/new_season_2_pictures/,ElGalactico,1331936381,,38,83,False,http://c.thumbs.redditmedia.com/AU-6G6sBZbEXcSTt.jpg,,,,,
901,gameofthrones,t5_2rjz2,2012-3-17,2012,3,17,7,r02gd,imgur.com,Rock out with your estoc out,https://www.reddit.com/r/gameofthrones/comments/r02gd/rock_out_with_your_estoc_out/,[deleted],1331938327,,1,0,False,default,,,,,
902,gameofthrones,t5_2rjz2,2012-3-17,2012,3,17,7,r02o7,self.gameofthrones,Rewatching GoT Season 1 a heartbreaking reminder of what's to come. ,https://www.reddit.com/r/gameofthrones/comments/r02o7/rewatching_got_season_1_a_heartbreaking_reminder/,ridditamk,1331938637,"My first introduction to the ASOIAF series was the Game of Thrones TV show. I watched the whole thing avidly and at its conclusion immediately picked up the books, the five novels and the fantastic Dunk and Egg novellas (Seriously, if you haven't read them you're missing out on some excellent back story and tie ins. Plus they're all less than 100 pages). Nothing I've ever read has been so captivating and remained at that level across 8 books and ~5000 pages. 

Now, as the Season 2 premiere draws close I decided to re-watch the first season. Wow, was I not prepared. Knowing the events to come, the betrayals, the deaths, the promises not kept, those who were never avenged, all of it, made it impossible to watch with dry eyes. [Season 1 Spoiler](/s ""When the Greatjon roused the crowd and declared for the King in the North I wanted nothing more than to pick up a sword in his name."")

So as Season 2 approaches I await with ravenous excitement and the highest of hopes, but with a box of tissues as well. 

**TL;DR: After reading the books, GoT Season 1 is damn hard to watch stoically.**",21,7,False,self,,,,,
903,gameofthrones,t5_2rjz2,2012-3-17,2012,3,17,8,r04lg,self.gameofthrones,Do I have to read AGOT to read ACOK if I have seen season 1 of the TV series?,https://www.reddit.com/r/gameofthrones/comments/r04lg/do_i_have_to_read_agot_to_read_acok_if_i_have/,infinite_zero00,1331941165,Title. ,5,0,False,self,,,,,
904,gameofthrones,t5_2rjz2,2012-3-17,2012,3,17,9,r063z,optionated.com,Atlus Reveals a New Game of Thrones Trailer for the RPG Game! so excited!,https://www.reddit.com/r/gameofthrones/comments/r063z/atlus_reveals_a_new_game_of_thrones_trailer_for/,ssommer01,1331943395,,0,1,False,default,,,,,
905,gameofthrones,t5_2rjz2,2012-3-17,2012,3,17,9,r069x,self.gameofthrones,Question about the show from a reader who hasn't seen it (spoiler free).,https://www.reddit.com/r/gameofthrones/comments/r069x/question_about_the_show_from_a_reader_who_hasnt/,DayToDayInFlipFlops,1331943682,"I was reading the faq and it says season one covers events in the first three books. I'm just starting SOS so I want to know if I should finish it first or can I watch the show without getting book spoilers?

Also, sidenote: This series won't end in my lifetime will it?",34,12,False,self,,,,,
906,gameofthrones,t5_2rjz2,2012-3-17,2012,3,17,10,r08kx,cghub.com,What batle is this?? Greyjoy vs ???,https://www.reddit.com/r/gameofthrones/comments/r08kx/what_batle_is_this_greyjoy_vs/,[deleted],1331947280,,18,21,False,http://c.thumbs.redditmedia.com/r18YpO6ahW1gD88t.jpg,,,,,
907,gameofthrones,t5_2rjz2,2012-3-17,2012,3,17,11,r0aiq,youtu.be,Recently the Toronto International Film Festival group (TIFF) hosted an event called In Conversation With... George R.R. Martin.  They have made videos available of the talk and I thought you guys might enjoy them.,https://www.reddit.com/r/gameofthrones/comments/r0aiq/recently_the_toronto_international_film_festival/,big_red737,1331950176,,5,10,False,http://f.thumbs.redditmedia.com/2nWEEFZ6rOR9rS9e.jpg,,,,,
908,gameofthrones,t5_2rjz2,2012-3-17,2012,3,17,12,r0cjt,imgur.com,Got to meet Hodor today at WonderCon!,https://www.reddit.com/r/gameofthrones/comments/r0cjt/got_to_meet_hodor_today_at_wondercon/,notthatjesus,1331953219,,21,265,False,http://b.thumbs.redditmedia.com/KNZ7SEsORM89gnL1.jpg,,,,,
909,gameofthrones,t5_2rjz2,2012-3-17,2012,3,17,12,r0czm,self.gameofthrones,Has HBO released any photos of Ian Whyte as the new Gregor Clegane?,https://www.reddit.com/r/gameofthrones/comments/r0czm/has_hbo_released_any_photos_of_ian_whyte_as_the/,joftheinternet,1331953926,"I mean, I trust them to make it work...but I still have concerns about it.  The dude is definately tall enough, but he seems more lanky than *mountainous*.  And he looks definately younger than their Sandor.",17,18,False,self,,,,,
910,gameofthrones,t5_2rjz2,2012-3-17,2012,3,17,13,r0evf,imgur.com,This was my favorite moment in the books.  Wait...what?,https://www.reddit.com/r/gameofthrones/comments/r0evf/this_was_my_favorite_moment_in_the_books_waitwhat/,[deleted],1331956805,,0,0,False,default,,,,,
911,gameofthrones,t5_2rjz2,2012-3-17,2012,3,17,13,r0fj4,imgur.com,Book Covers I Designed [Books 1 &amp; 2 Spoilers],https://www.reddit.com/r/gameofthrones/comments/r0fj4/book_covers_i_designed_books_1_2_spoilers/,victoriar531,1331957902,,18,26,False,http://b.thumbs.redditmedia.com/kyvzJDvb-pbC3H7U.jpg,,,,,
912,gameofthrones,t5_2rjz2,2012-3-17,2012,3,17,13,r0fk1,i.imgur.com,First thing I thought when seeing the Spice King photo.,https://www.reddit.com/r/gameofthrones/comments/r0fk1/first_thing_i_thought_when_seeing_the_spice_king/,[deleted],1331957939,,0,1,False,default,,,,,
913,gameofthrones,t5_2rjz2,2012-3-17,2012,3,17,13,r0fkm,i.imgur.com,First thing I thought when I saw the Spice King photo,https://www.reddit.com/r/gameofthrones/comments/r0fkm/first_thing_i_thought_when_i_saw_the_spice_king/,[deleted],1331957967,,15,47,False,http://e.thumbs.redditmedia.com/ZyHb-6Luk_xsD_FX.jpg,,,,,
914,gameofthrones,t5_2rjz2,2012-3-17,2012,3,17,13,r0gcj,redditry.tumblr.com,#GameOfThrones Season 2 Controversial Poster: F*#k Joffrey Baratheon for doing this to Eddard Stark! Hes not even the rightful king of the Iron Throne and son of the immoral twins Cersei and Jaime Lannister,https://www.reddit.com/r/gameofthrones/comments/r0gcj/gameofthrones_season_2_controversial_poster_fk/,hourru,1331959264,,1,0,False,default,,,,,
915,gameofthrones,t5_2rjz2,2012-3-17,2012,3,17,16,r0kzo,imgur.com,Planked the Iron Throne,https://www.reddit.com/r/gameofthrones/comments/r0kzo/planked_the_iron_throne/,daringu,1331968381,,4,0,False,http://d.thumbs.redditmedia.com/jmVLbGRtah1Z3dF9.jpg,,,,,
916,gameofthrones,t5_2rjz2,2012-3-17,2012,3,17,19,r0o69,24.media.tumblr.com,"Is it me, or is Jamie's hair darker than Cersei's in season two?",https://www.reddit.com/r/gameofthrones/comments/r0o69/is_it_me_or_is_jamies_hair_darker_than_cerseis_in/,Spamiard,1331979196,,43,45,False,http://c.thumbs.redditmedia.com/fR8ajMQwrxNCZoSb.jpg,,,,,
917,gameofthrones,t5_2rjz2,2012-3-17,2012,3,17,20,r0ozw,i.imgur.com,The Old Gods are not pleased...,https://www.reddit.com/r/gameofthrones/comments/r0ozw/the_old_gods_are_not_pleased/,superknilch,1331982475,,26,984,False,http://e.thumbs.redditmedia.com/F7HqP3SjCAmzMaKv.jpg,,,,,
918,gameofthrones,t5_2rjz2,2012-3-17,2012,3,17,21,r0qhe,youtube.com,Game of Ponies,https://www.reddit.com/r/gameofthrones/comments/r0qhe/game_of_ponies/,ihateirony,1331987732,,12,15,False,http://f.thumbs.redditmedia.com/RCRiTDvPsdoP5Mm_.jpg,,,,,
919,gameofthrones,t5_2rjz2,2012-3-17,2012,3,17,22,r0rm6,facebook.com,Apparently Joffrey hates WonderWoman... [Wondercon S2 Poster/Spoilers? haha...],https://www.reddit.com/r/gameofthrones/comments/r0rm6/apparently_joffrey_hates_wonderwoman_wondercon_s2/,[deleted],1331990980,,0,1,False,default,,,,,
920,gameofthrones,t5_2rjz2,2012-3-17,2012,3,17,22,r0rqj,youtube.com,New in game trailer for GoT computer game,https://www.reddit.com/r/gameofthrones/comments/r0rqj/new_in_game_trailer_for_got_computer_game/,The_Second_Best,1331991286,,22,27,False,http://a.thumbs.redditmedia.com/L6F7T069ayh1GyIT.jpg,,,,,
921,gameofthrones,t5_2rjz2,2012-3-17,2012,3,17,23,r0tul,i.imgur.com,[ACOK SPOILERS] A scene I'm not looking forward to,https://www.reddit.com/r/gameofthrones/comments/r0tul/acok_spoilers_a_scene_im_not_looking_forward_to/,MadeInAMinute,1331995970,,18,97,False,http://a.thumbs.redditmedia.com/ZCQzWMnzacpKFuWr.jpg,,,,,
922,gameofthrones,t5_2rjz2,2012-3-18,2012,3,18,0,r0uqb,26.media.tumblr.com,A higher quality picture of a man...,https://www.reddit.com/r/gameofthrones/comments/r0uqb/a_higher_quality_picture_of_a_man/,[deleted],1331997869,,50,244,False,http://e.thumbs.redditmedia.com/1YyBmVbLfPk0UW94.jpg,,,,,
923,gameofthrones,t5_2rjz2,2012-3-18,2012,3,18,0,r0vjz,youtube.com,Game of Thrones - Main Title (brand new cover),https://www.reddit.com/r/gameofthrones/comments/r0vjz/game_of_thrones_main_title_brand_new_cover/,zakkaz,1331999349,,0,0,False,default,,,,,
924,gameofthrones,t5_2rjz2,2012-3-18,2012,3,18,1,r0xi7,imgur.com,friend zone level: littlefinger,https://www.reddit.com/r/gameofthrones/comments/r0xi7/friend_zone_level_littlefinger/,[deleted],1332002800,,1,0,False,default,,,,,
925,gameofthrones,t5_2rjz2,2012-3-18,2012,3,18,2,r0yxc,i.imgur.com,A Lannister is no housecat,https://www.reddit.com/r/gameofthrones/comments/r0yxc/a_lannister_is_no_housecat/,redditor3000,1332004877,,29,61,False,http://e.thumbs.redditmedia.com/0_YtjFCWd4Gz5GiF.jpg,,,,,
926,gameofthrones,t5_2rjz2,2012-3-18,2012,3,18,2,r0zy0,1.bp.blogspot.com,Who is that Cersei girl?,https://www.reddit.com/r/gameofthrones/comments/r0zy0/who_is_that_cersei_girl/,[deleted],1332006343,,0,1,False,default,,,,,
927,gameofthrones,t5_2rjz2,2012-3-18,2012,3,18,2,r10g3,1.bp.blogspot.com,Who is that Cersei girl?,https://www.reddit.com/r/gameofthrones/comments/r10g3/who_is_that_cersei_girl/,dahlig2,1332007082,,5,14,False,default,,,,,
928,gameofthrones,t5_2rjz2,2012-3-18,2012,3,18,3,r127m,imgur.com,"Look who I met at WonderCon, Anaheim yesterday! (also posted on r/ASoIaF) :D",https://www.reddit.com/r/gameofthrones/comments/r127m/look_who_i_met_at_wondercon_anaheim_yesterday/,[deleted],1332009540,,0,1,False,default,,,,,
929,gameofthrones,t5_2rjz2,2012-3-18,2012,3,18,3,r12eo,self.gameofthrones,A Question On Pronunciation (spoilers in this thread),https://www.reddit.com/r/gameofthrones/comments/r12eo/a_question_on_pronunciation_spoilers_in_this/,astrobear,1332009825,"How do you actually pronounce Valar Morghulis?  Also, am almost half-way through Storm of Swords, so please no spoilers, it's just driving me crazy hear all my friends pronounce it differently.  I myself pronounce it Va-lar More Gall Iss.  I've been looking for a video that has Martin pronounce.  Any ideas?",8,2,False,self,,,,,
930,gameofthrones,t5_2rjz2,2012-3-18,2012,3,18,3,r12ps,youtube.com,Khal Drogo is Pretty Badass,https://www.reddit.com/r/gameofthrones/comments/r12ps/khal_drogo_is_pretty_badass/,CEONeil,1332010321,,13,0,True,nsfw,,,,,
931,gameofthrones,t5_2rjz2,2012-3-18,2012,3,18,4,r1439,imgur.com,"Look who I met at WonderCon, Anaheim! (also posted in r/ASoIaF) :D",https://www.reddit.com/r/gameofthrones/comments/r1439/look_who_i_met_at_wondercon_anaheim_also_posted/,rockabillylove,1332012366,,14,48,False,http://c.thumbs.redditmedia.com/abRHIXAwcqT3VFcz.jpg,,,,,
932,gameofthrones,t5_2rjz2,2012-3-18,2012,3,18,4,r14cc,self.gameofthrones,I just read the 51st chapter of ASoS (spoilerish),https://www.reddit.com/r/gameofthrones/comments/r14cc/i_just_read_the_51st_chapter_of_asos_spoilerish/,custerb11,1332012723,I have never been more demoralized by a chapter in a book. Not sure if I can keep going. I can't even feel anymore.,15,13,False,self,,,,,
933,gameofthrones,t5_2rjz2,2012-3-18,2012,3,18,5,r15vr,imgur.com,Something that has been on my mind - a AGOT themed iphone stand.,https://www.reddit.com/r/gameofthrones/comments/r15vr/something_that_has_been_on_my_mind_a_agot_themed/,thegreatnick,1332014975,,13,49,False,http://b.thumbs.redditmedia.com/8eV2P78ZTlh9biRm.jpg,,,,,
934,gameofthrones,t5_2rjz2,2012-3-18,2012,3,18,5,r1648,self.gameofthrones,Something I missed: GOT EP 1 (Spinners all),https://www.reddit.com/r/gameofthrones/comments/r1648/something_i_missed_got_ep_1_spinners_all/,bromanvt,1332015316,"So most are aware of the Jon parentage theories, and many believe that Howland Reed may be the last to know the truth.  But, in the show when Benjen first sees John in the courtyard he says something like 'you might, it you knew what it meant' in response to Jon saying he didn't care about marriage or kids.  Subtle nod?  ",9,0,False,self,,,,,
935,gameofthrones,t5_2rjz2,2012-3-18,2012,3,18,5,r16ib,self.gameofthrones,SPOILERS: What scene from the books are you looking forward to seeing?,https://www.reddit.com/r/gameofthrones/comments/r16ib/spoilers_what_scene_from_the_books_are_you/,[deleted],1332015920,"I haven't finished the series myself and I hate spoilers as much as anyone else, so mark your spoilers. I'm only halfway through a Feast for Crows right now.

Now, I know it'll be a few seasons off, but I can't wait to see...[A Feast for Crows](/b ""Brienne's fight at the Whispers. It's such a defining moment for her character, and GRRM's blow by blow had me on the edge of my seat. I can't wait to hear her tell the jester the laugh."" )
",71,13,False,self,,,,,
936,gameofthrones,t5_2rjz2,2012-3-18,2012,3,18,5,r17c9,i.imgur.com,A White Walker in the GoT Comic Book,https://www.reddit.com/r/gameofthrones/comments/r17c9/a_white_walker_in_the_got_comic_book/,FeroxDeoVacuusVinco,1332017238,,37,63,False,http://c.thumbs.redditmedia.com/m4nYG2773VRyagrJ.jpg,,,,,
937,gameofthrones,t5_2rjz2,2012-3-18,2012,3,18,6,r17we,westeros.org,Game of Thrones is the fastest-selling DVD release in HBO's history,https://www.reddit.com/r/gameofthrones/comments/r17we/game_of_thrones_is_the_fastestselling_dvd_release/,local_low,1332018120,,1,7,False,default,,,,,
938,gameofthrones,t5_2rjz2,2012-3-18,2012,3,18,6,r184a,self.gameofthrones,Who is t.e best fighter in ASOIAF?,https://www.reddit.com/r/gameofthrones/comments/r184a/who_is_te_best_fighter_in_asoiaf/,BearFootGrizzly,1332018481,"Basically exactly what it says. Just wanted to pick everyone's brains on the matter, cause it's been bugging me forever. I would've said Gregor Clegane, but by ASoS I was having second thoughts.",37,8,False,self,,,,,
939,gameofthrones,t5_2rjz2,2012-3-18,2012,3,18,6,r196t,quickmeme.com,GOT SPOILER Hipster Daenerys,https://www.reddit.com/r/gameofthrones/comments/r196t/got_spoiler_hipster_daenerys/,mikedahltron,1332020157,,24,547,False,http://b.thumbs.redditmedia.com/wvOh4ABlTMrwy6Ia.jpg,,,,,
940,gameofthrones,t5_2rjz2,2012-3-18,2012,3,18,7,r1ash,youtube.com,George R.R. Martin Reads a Chapter from The Winds of Winter,https://www.reddit.com/r/gameofthrones/comments/r1ash/george_rr_martin_reads_a_chapter_from_the_winds/,[deleted],1332022752,,0,1,False,default,,,,,
941,gameofthrones,t5_2rjz2,2012-3-18,2012,3,18,7,r1c4x,24.media.tumblr.com,This lol,https://www.reddit.com/r/gameofthrones/comments/r1c4x/this_lol/,VodoSioskBaas,1332024817,,37,473,False,default,,,,,
942,gameofthrones,t5_2rjz2,2012-3-18,2012,3,18,8,r1d7u,hw.libsyn.com,Big O &amp; Dukes podcast discussing Game of Thrones-The Nerds Watch,https://www.reddit.com/r/gameofthrones/comments/r1d7u/big_o_dukes_podcast_discussing_game_of_thronesthe/,hokeywebb22,1332026633,,0,0,False,default,,,,,
943,gameofthrones,t5_2rjz2,2012-3-18,2012,3,18,8,r1e6r,i.imgur.com,Why the Old Gods are not happy,https://www.reddit.com/r/gameofthrones/comments/r1e6r/why_the_old_gods_are_not_happy/,[deleted],1332028168,,1,0,False,default,,,,,
944,gameofthrones,t5_2rjz2,2012-3-18,2012,3,18,9,r1fcm,towerofthehand.com,Titles and Descriptions of April Episodes of Season 2,https://www.reddit.com/r/gameofthrones/comments/r1fcm/titles_and_descriptions_of_april_episodes_of/,FedaykinII,1332030015,,1,1,False,default,,,,,
945,gameofthrones,t5_2rjz2,2012-3-18,2012,3,18,9,r1fma,i.imgur.com,Browsing /r/gaming..noticed something in the Battlefield:  Heroes screenshot (Check the right character skin),https://www.reddit.com/r/gameofthrones/comments/r1fma/browsing_rgamingnoticed_something_in_the/,Remsquared,1332030424,,0,0,False,default,,,,,
946,gameofthrones,t5_2rjz2,2012-3-18,2012,3,18,11,r1jhj,qkme.me,Season 2 (spoliers),https://www.reddit.com/r/gameofthrones/comments/r1jhj/season_2_spoliers/,om1ss10nsixsix,1332036766,,1,0,False,default,,,,,
947,gameofthrones,t5_2rjz2,2012-3-18,2012,3,18,11,r1kb7,s3.amazonaws.com,House Stark,https://www.reddit.com/r/gameofthrones/comments/r1kb7/house_stark/,Edodge,1332038122,,1,0,False,default,,,,,
948,gameofthrones,t5_2rjz2,2012-3-18,2012,3,18,11,r1kqu,self.gameofthrones,Renly and the Knight of Flowers,https://www.reddit.com/r/gameofthrones/comments/r1kqu/renly_and_the_knight_of_flowers/,aaronwe,1332038816,So I'm watching GoT on HBO right now and there was a scene where Renly and the knight of flowers where talking about Renly taking over the throne after Robert.  Then the knight of flowers goes down on Renly.  Was this in the book? I don't remember this scene.,10,5,False,self,,,,,
949,gameofthrones,t5_2rjz2,2012-3-18,2012,3,18,12,r1lv8,self.gameofthrones,Just noticed something about Daenerys,https://www.reddit.com/r/gameofthrones/comments/r1lv8/just_noticed_something_about_daenerys/,shwinnebego,1332040662,"No one actually calls her ""Dany"" besides her own POV narrator.  Isn't kind of strange that a major character has a nickname known only to the readers of the book, but not by any characters in the book?",18,25,False,self,,,,,
950,gameofthrones,t5_2rjz2,2012-3-18,2012,3,18,12,r1n8c,i.imgur.com,"""Needlework""",https://www.reddit.com/r/gameofthrones/comments/r1n8c/needlework/,r2002,1332042873,,13,265,False,http://b.thumbs.redditmedia.com/s4jawdgiYGv3Q6km.jpg,,,,,
951,gameofthrones,t5_2rjz2,2012-3-18,2012,3,18,13,r1nmi,i.imgur.com,Watching Game Of Thrones... Those eyes,https://www.reddit.com/r/gameofthrones/comments/r1nmi/watching_game_of_thrones_those_eyes/,[deleted],1332043570,,2,0,False,default,,,,,
952,gameofthrones,t5_2rjz2,2012-3-18,2012,3,18,13,r1o1d,youtube.com,"The only 5 minutes worth watching in the the ""Kate Hudson"" vehicle ""A Little Bit of Heaven"".  ",https://www.reddit.com/r/gameofthrones/comments/r1o1d/the_only_5_minutes_worth_watching_in_the_the_kate/,[deleted],1332044262,,0,1,False,default,,,,,
953,gameofthrones,t5_2rjz2,2012-3-18,2012,3,18,13,r1ohf,youtube.com,"I am pretty sure that this is the only 5 minutes worth watching in the Kate Hudson vehicle: ""A Little Bit of Heaven"".  ",https://www.reddit.com/r/gameofthrones/comments/r1ohf/i_am_pretty_sure_that_this_is_the_only_5_minutes/,[deleted],1332044992,,0,0,False,default,,,,,
954,gameofthrones,t5_2rjz2,2012-3-18,2012,3,18,13,r1pas,winteriscoming.net,"""You Win or You Die"" exclusive preview to air on March 25th",https://www.reddit.com/r/gameofthrones/comments/r1pas/you_win_or_you_die_exclusive_preview_to_air_on/,[deleted],1332046433,,0,1,False,default,,,,,
955,gameofthrones,t5_2rjz2,2012-3-18,2012,3,18,13,r1pds,self.gameofthrones,"Tomorrow morning, Game of Thrones marathon from start to finish... with my family",https://www.reddit.com/r/gameofthrones/comments/r1pds/tomorrow_morning_game_of_thrones_marathon_from/,mcnealy,1332046569,"What a great way to spend a Sunday afternoon! No one else in my family is really familiar with A Song of Ice and Fire, so this is gonna be great. Especially for that *one part*, and the other one, and also that part... lol, I can't wait.
In attendance will be me, my 42 year old father, my 41 year old mother, and my 15 year old sister.

Haha, let's cross our fingers and hope things don't get *too* awkward ;)",18,17,False,self,,,,,
