,sbr,sbr_id,date,year,month,hour,day,id,domain,title,full_link,author,created,selftext,num_comments,score,over_18,thumbnail,media_provider,media_thumbnail,media_title,media_description,media_url
1312,gameofthrones,t5_2rjz2,2012-3-24,2012,3,24,21,rbc56,imgur.com,"My friend and I at the 'Game of Thrones', season 2 premier. ",https://www.reddit.com/r/gameofthrones/comments/rbc56/my_friend_and_i_at_the_game_of_thrones_season_2/,skynolongerblue,1332593455,,7,4,False,http://d.thumbs.redditmedia.com/X6GWHyMgWOonkGuK.jpg,,,,,
1313,gameofthrones,t5_2rjz2,2012-3-24,2012,3,24,23,rbdsc,i.imgur.com,Poor Jon Snow...,https://www.reddit.com/r/gameofthrones/comments/rbdsc/poor_jon_snow/,[deleted],1332597712,,0,1,False,default,,,,,
1314,gameofthrones,t5_2rjz2,2012-3-25,2012,3,25,0,rbgkz,imgur.com,Brace Yourselves (X-post r/Pics),https://www.reddit.com/r/gameofthrones/comments/rbgkz/brace_yourselves_xpost_rpics/,CrypticCoke,1332603332,,0,0,False,default,,,,,
1315,gameofthrones,t5_2rjz2,2012-3-25,2012,3,25,1,rbit2,imgur.com,"I was playing Dungeons of Dredmor, and I found a Tome of Ice or Fire",https://www.reddit.com/r/gameofthrones/comments/rbit2/i_was_playing_dungeons_of_dredmor_and_i_found_a/,steaksawse,1332606986,,8,101,False,http://f.thumbs.redditmedia.com/F2YVz24qqlRQ4YIe.jpg,,,,,
1316,gameofthrones,t5_2rjz2,2012-3-25,2012,3,25,1,rbita,flickr.com,My friend had the opportunity to sit in the GoT Throne...so naturally he went home and got his Santa suit. (x-post from r/pics),https://www.reddit.com/r/gameofthrones/comments/rbita/my_friend_had_the_opportunity_to_sit_in_the_got/,elstompy,1332606994,,70,1311,False,http://d.thumbs.redditmedia.com/99zyGQilyhzwu7BQ.jpg,,,,,
1317,gameofthrones,t5_2rjz2,2012-3-25,2012,3,25,1,rbjoe,i.imgur.com,The other Stark,https://www.reddit.com/r/gameofthrones/comments/rbjoe/the_other_stark/,[deleted],1332608338,,1,0,False,default,,,,,
1318,gameofthrones,t5_2rjz2,2012-3-25,2012,3,25,2,rbjxq,pixygypsy.deviantart.com,I'm a total dork for Game of Thrones,https://www.reddit.com/r/gameofthrones/comments/rbjxq/im_a_total_dork_for_game_of_thrones/,[deleted],1332608740,,1,0,False,default,,,,,
1319,gameofthrones,t5_2rjz2,2012-3-25,2012,3,25,2,rbl0q,self.gameofthrones,Anyone else agree with me on Catelyn Tully?,https://www.reddit.com/r/gameofthrones/comments/rbl0q/anyone_else_agree_with_me_on_catelyn_tully/,[deleted],1332610333,"Her dumb irrational behavior pretty much created justification for the Lanisters to fuck with the Starkes. She seems to act like a fucking retard, but most people like her because shes a Starke. I think she is definitely one of the more unlikable characters. ",6,0,False,self,,,,,
1320,gameofthrones,t5_2rjz2,2012-3-25,2012,3,25,3,rbmew,pxleyes.com,the world most beautiful baby girl,https://www.reddit.com/r/gameofthrones/comments/rbmew/the_world_most_beautiful_baby_girl/,guttkaru,1332612266,,3,0,False,default,,,,,
1321,gameofthrones,t5_2rjz2,2012-3-25,2012,3,25,3,rbnji,imgur.com,Carl Drogo,https://www.reddit.com/r/gameofthrones/comments/rbnji/carl_drogo/,[deleted],1332613912,,10,301,False,http://a.thumbs.redditmedia.com/-b1TrLCX8jAs9-i6.jpg,,,,,
1322,gameofthrones,t5_2rjz2,2012-3-25,2012,3,25,3,rboe4,farm3.static.flickr.com,Is this how anybody else pictured Pod Payne?,https://www.reddit.com/r/gameofthrones/comments/rboe4/is_this_how_anybody_else_pictured_pod_payne/,nedak,1332615059,,0,0,False,default,,,,,
1323,gameofthrones,t5_2rjz2,2012-3-25,2012,3,25,4,rbr2q,i.imgur.com,Saddest line ever in ADWD. Poor Unsullied.,https://www.reddit.com/r/gameofthrones/comments/rbr2q/saddest_line_ever_in_adwd_poor_unsullied/,[deleted],1332618903,,29,195,False,http://b.thumbs.redditmedia.com/tYaLnuTHxHna3XB1.jpg,,,,,
1324,gameofthrones,t5_2rjz2,2012-3-25,2012,3,25,4,rbr7o,gainesville.craigslist.org,a game of ice and fire?,https://www.reddit.com/r/gameofthrones/comments/rbr7o/a_game_of_ice_and_fire/,lesliev2001,1332619098,,2,13,False,http://f.thumbs.redditmedia.com/aLPuyCPTjhvRd_oY.jpg,,,,,
1325,gameofthrones,t5_2rjz2,2012-3-25,2012,3,25,5,rbs5n,i.imgur.com,"(Winter is Coming!) I invented a group dynamic activity for college students using some themes from GOT. My co-leader wrote the ""Module"" based on my ideas. (She hasn't read the books or watched the series)",https://www.reddit.com/r/gameofthrones/comments/rbs5n/winter_is_coming_i_invented_a_group_dynamic/,poopak,1332620383,,1,4,False,http://a.thumbs.redditmedia.com/a5737mHYmE-NRxDr.jpg,,,,,
1326,gameofthrones,t5_2rjz2,2012-3-25,2012,3,25,5,rbteu,imgur.com,"You know nothing, WordsWithFriends!",https://www.reddit.com/r/gameofthrones/comments/rbteu/you_know_nothing_wordswithfriends/,[deleted],1332622205,,1,0,False,default,,,,,
1327,gameofthrones,t5_2rjz2,2012-3-25,2012,3,25,7,rbwb8,self.gameofthrones,18 Player Game of Thrones,https://www.reddit.com/r/gameofthrones/comments/rbwb8/18_player_game_of_thrones/,meatwad819,1332626455,"Anyone interested in playing/helping finish the unfinished 18 player Game of Thrones variant (possible spoilers)? Link is provided below.

http://boardgamegeek.com/thread/780143/18-player-expansion-possible-spoilers/page/1",1,7,False,self,,,,,
1328,gameofthrones,t5_2rjz2,2012-3-25,2012,3,25,7,rbyng,imgur.com,What if...,https://www.reddit.com/r/gameofthrones/comments/rbyng/what_if/,ckingdom,1332629832,,1,0,False,http://f.thumbs.redditmedia.com/2eNeLDJ3JrWFWNa_.jpg,,,,,
1329,gameofthrones,t5_2rjz2,2012-3-25,2012,3,25,8,rc0s4,self.gameofthrones,"If you have HBO Go on your phone, Game of thronese season 2 episode 1 is available RIGHT FUCKING NOW!",https://www.reddit.com/r/gameofthrones/comments/rc0s4/if_you_have_hbo_go_on_your_phone_game_of_thronese/,[deleted],1332632922,commence the upvotes.,6,1,False,default,,,,,
1330,gameofthrones,t5_2rjz2,2012-3-25,2012,3,25,8,rc0vx,youtube.com,I found Ned Stark's favorite song!,https://www.reddit.com/r/gameofthrones/comments/rc0vx/i_found_ned_starks_favorite_song/,matap821,1332633060,,3,0,False,default,,,,,
1331,gameofthrones,t5_2rjz2,2012-3-25,2012,3,25,9,rc1zh,explosm.net,When did it become acceptable to be a nerd?,https://www.reddit.com/r/gameofthrones/comments/rc1zh/when_did_it_become_acceptable_to_be_a_nerd/,Zombie_Hunter,1332634679,,6,80,False,http://b.thumbs.redditmedia.com/8XMSgTesqlIGN2la.jpg,,,,,
1332,gameofthrones,t5_2rjz2,2012-3-25,2012,3,25,9,rc24z,i.imgur.com,My friends sweet picture from the Season 2 sneak preview,https://www.reddit.com/r/gameofthrones/comments/rc24z/my_friends_sweet_picture_from_the_season_2_sneak/,SonOfSalem,1332634871,,0,0,False,http://c.thumbs.redditmedia.com/MFxH-nVSdGyJsxgn.jpg,,,,,
1333,gameofthrones,t5_2rjz2,2012-3-25,2012,3,25,9,rc2n9,i.imgur.com,Don't Mess with Summer,https://www.reddit.com/r/gameofthrones/comments/rc2n9/dont_mess_with_summer/,[deleted],1332635651,,0,1,False,default,,,,,
1334,gameofthrones,t5_2rjz2,2012-3-25,2012,3,25,9,rc372,i.imgur.com,Water Dancer Wisdom,https://www.reddit.com/r/gameofthrones/comments/rc372/water_dancer_wisdom/,[deleted],1332636549,,0,1,False,default,,,,,
1335,gameofthrones,t5_2rjz2,2012-3-25,2012,3,25,10,rc3o2,imgur.com,Game of Thrones season 1 Art I made for you guys!,https://www.reddit.com/r/gameofthrones/comments/rc3o2/game_of_thrones_season_1_art_i_made_for_you_guys/,[deleted],1332637263,,1,0,False,default,,,,,
1336,gameofthrones,t5_2rjz2,2012-3-25,2012,3,25,10,rc4d4,self.gameofthrones,Is Jon Snow destined to be king?,https://www.reddit.com/r/gameofthrones/comments/rc4d4/is_jon_snow_destined_to_be_king/,newswilson,1332638273,,1,0,False,default,,,,,
1337,gameofthrones,t5_2rjz2,2012-3-25,2012,3,25,10,rc4k0,i.imgur.com,Sansa's Castle in the Sky (x-post from pics),https://www.reddit.com/r/gameofthrones/comments/rc4k0/sansas_castle_in_the_sky_xpost_from_pics/,Serendipities,1332638552,,3,22,False,http://b.thumbs.redditmedia.com/VD1zJKK6H6sbi4Jg.jpg,,,,,
1338,gameofthrones,t5_2rjz2,2012-3-25,2012,3,25,10,rc56a,i.imgur.com,How I picture Wyman Manderly,https://www.reddit.com/r/gameofthrones/comments/rc56a/how_i_picture_wyman_manderly/,expedient,1332639507,,4,4,False,default,,,,,
1339,gameofthrones,t5_2rjz2,2012-3-25,2012,3,25,10,rc5vi,free-tv-video-online.me,Link to Game of Thrones Season 2. One week early.,https://www.reddit.com/r/gameofthrones/comments/rc5vi/link_to_game_of_thrones_season_2_one_week_early/,[deleted],1332640550,,0,0,False,default,,,,,
1340,gameofthrones,t5_2rjz2,2012-3-25,2012,3,25,11,rc88k,self.gameofthrones,New to GoT,https://www.reddit.com/r/gameofthrones/comments/rc88k/new_to_got/,jedimasterlenny,1332644181,"Everyone tells me i'd love it as i am an avid fantasy reader, is ""Game of Thrones the first book? Where do i start?",18,0,False,self,,,,,
1341,gameofthrones,t5_2rjz2,2012-3-25,2012,3,25,13,rcb0e,memecrunch.com,Baby Prune Juice Poop,https://www.reddit.com/r/gameofthrones/comments/rcb0e/baby_prune_juice_poop/,uncle_jojo,1332648468,,2,0,False,default,,,,,
1342,gameofthrones,t5_2rjz2,2012-3-25,2012,3,25,14,rccxx,imgur.com,"Look whom I got to slay, today!",https://www.reddit.com/r/gameofthrones/comments/rccxx/look_whom_i_got_to_slay_today/,ycerovce,1332651821,,0,0,False,default,,,,,
1343,gameofthrones,t5_2rjz2,2012-3-25,2012,3,25,14,rcdya,imgur.com,Beat His Skull In!!!!!! ,https://www.reddit.com/r/gameofthrones/comments/rcdya/beat_his_skull_in/,[deleted],1332653625,,0,0,False,default,,,,,
1344,gameofthrones,t5_2rjz2,2012-3-25,2012,3,25,14,rce4e,kalidraws.tumblr.com,This is exactly how I pictured the Leech Lord,https://www.reddit.com/r/gameofthrones/comments/rce4e/this_is_exactly_how_i_pictured_the_leech_lord/,agentqed,1332653939,,9,35,False,default,,,,,
1345,gameofthrones,t5_2rjz2,2012-3-25,2012,3,25,15,rcets,self.gameofthrones,Which character in season two are you guys looking forward to most?,https://www.reddit.com/r/gameofthrones/comments/rcets/which_character_in_season_two_are_you_guys/,theprogdude,1332655213,"Personally i can't wait the see Davos he has always been an interesting character. And to see his loyalty on screen would be interesting. Plus the whole him learning to read will be adorable.
Also his rise is probably my favorite only seconded to Bronn. ",62,27,False,self,,,,,
1346,gameofthrones,t5_2rjz2,2012-3-25,2012,3,25,15,rcewd,images.4chan.org,They are just being honest,https://www.reddit.com/r/gameofthrones/comments/rcewd/they_are_just_being_honest/,[deleted],1332655343,,1,0,False,http://a.thumbs.redditmedia.com/5l3oV8BsKQ_3H6-B.jpg,,,,,
1347,gameofthrones,t5_2rjz2,2012-3-25,2012,3,25,16,rcgqc,i.imgur.com,This reminds me of: The Stark's Crypts,https://www.reddit.com/r/gameofthrones/comments/rcgqc/this_reminds_me_of_the_starks_crypts/,poopak,1332659534,,1,0,False,default,,,,,
1348,gameofthrones,t5_2rjz2,2012-3-25,2012,3,25,16,rch90,tv.ign.com,"Game of Thrones: Season 2 is ""Really Badass""",https://www.reddit.com/r/gameofthrones/comments/rch90/game_of_thrones_season_2_is_really_badass/,akki115,1332661007,,6,5,False,http://c.thumbs.redditmedia.com/eURqJNx5sJZCRHO2.jpg,,,,,
1349,gameofthrones,t5_2rjz2,2012-3-25,2012,3,25,16,rchmk,youtube.com,"Game of Thrones intro sung by Sansa, Arya and Bran",https://www.reddit.com/r/gameofthrones/comments/rchmk/game_of_thrones_intro_sung_by_sansa_arya_and_bran/,cl0tho,1332662099,,2,0,False,http://c.thumbs.redditmedia.com/u8nSY-OTbgrMjJGh.jpg,,,,,
1350,gameofthrones,t5_2rjz2,2012-3-25,2012,3,25,17,rcihz,imgur.com,This man would have been perfect as Loras Tyrell,https://www.reddit.com/r/gameofthrones/comments/rcihz/this_man_would_have_been_perfect_as_loras_tyrell/,rumzii,1332664573,,9,0,False,default,,,,,
1351,gameofthrones,t5_2rjz2,2012-3-25,2012,3,25,18,rcjg6,facebook.com,Game of Thrones debating tournament in Londony by SOAS,https://www.reddit.com/r/gameofthrones/comments/rcjg6/game_of_thrones_debating_tournament_in_londony_by/,klyonrad,1332668025,,4,3,False,http://d.thumbs.redditmedia.com/SqV0XpChMoIK2Jc-.jpg,,,,,
1352,gameofthrones,t5_2rjz2,2012-3-25,2012,3,25,18,rcjsd,self.gameofthrones,Joffrey Baratheon house/sigil question(spoilers GoT maybe ASOS),https://www.reddit.com/r/gameofthrones/comments/rcjsd/joffrey_baratheon_housesigil_questionspoilers_got/,Ashleightx,1332669442,"When Joffrey Baratheon becomes king his sigil is the Stag and Lion both. Why was the lion on there? Why wouldnt it be just the Stag since hes supposed to be a ""Baratheon""(obviously hes lion all the way) Is is normal to have both houses on the kings sigil?

To me it seems a very in your face way of saying, Lannisters are ruling now. Also with Joffreys father parentage being questioned/rumors I just see it as a bad choice.

im sure im just over thinking this, it is 5am after all lol",13,10,False,self,,,,,
1353,gameofthrones,t5_2rjz2,2012-3-25,2012,3,25,19,rck8b,nixelpixel.com,Stunning Game of Thrones Artwork,https://www.reddit.com/r/gameofthrones/comments/rck8b/stunning_game_of_thrones_artwork/,[deleted],1332672101,,1,1,False,default,,,,,
1354,gameofthrones,t5_2rjz2,2012-3-25,2012,3,25,19,rckbi,imgur.com,Best realisation I've had out of all the books. (ADwD Spoilers),https://www.reddit.com/r/gameofthrones/comments/rckbi/best_realisation_ive_had_out_of_all_the_books/,SovietBatman64,1332672426,,37,191,False,http://f.thumbs.redditmedia.com/QfTmD2mzu8ueBmpw.jpg,,,,,
1355,gameofthrones,t5_2rjz2,2012-3-25,2012,3,25,20,rckru,nixelpixel.com,Game of Thrones Artwork,https://www.reddit.com/r/gameofthrones/comments/rckru/game_of_thrones_artwork/,[deleted],1332674214,,1,2,False,default,,,,,
1356,gameofthrones,t5_2rjz2,2012-3-25,2012,3,25,21,rclvl,nixelpixel.com,Game of Thrones Artwork from Season 1,https://www.reddit.com/r/gameofthrones/comments/rclvl/game_of_thrones_artwork_from_season_1/,neel28,1332678188,,9,61,False,http://d.thumbs.redditmedia.com/ZvgLnZZUCJGRfH2c.jpg,,,,,
1357,gameofthrones,t5_2rjz2,2012-3-26,2012,3,26,1,rcrj9,self.gameofthrones,Rattlebones looks amazing!,https://www.reddit.com/r/gameofthrones/comments/rcrj9/rattlebones_looks_amazing/,[deleted],1332691341,"Sorry I don't have a pic yet but I just saw him in a commercial on G4. I was shocked when I saw him because I hadn't seen that clip anywhere before.... but man does he look badass.

If/when I find a pic i'll post it.",0,0,False,default,,,,,
1358,gameofthrones,t5_2rjz2,2012-3-26,2012,3,26,1,rcrrp,i.imgur.com,Rattlebones!,https://www.reddit.com/r/gameofthrones/comments/rcrrp/rattlebones/,[deleted],1332691739,,3,1,False,default,,,,,
1359,gameofthrones,t5_2rjz2,2012-3-26,2012,3,26,1,rcru9,quickmeme.com,Thinking of having a dinner party? (aSoS spoiler),https://www.reddit.com/r/gameofthrones/comments/rcru9/thinking_of_having_a_dinner_party_asos_spoiler/,[deleted],1332691868,,4,2,False,default,,,,,
1360,gameofthrones,t5_2rjz2,2012-3-26,2012,3,26,1,rcrw5,i.imgur.com,Rattleshirt!!,https://www.reddit.com/r/gameofthrones/comments/rcrw5/rattleshirt/,qp0n,1332691944,,71,522,False,http://e.thumbs.redditmedia.com/4p0AVTk6rve3jfHR.jpg,,,,,
1361,gameofthrones,t5_2rjz2,2012-3-26,2012,3,26,1,rcscw,self.gameofthrones,What are you doing in preparation for the 2nd season?,https://www.reddit.com/r/gameofthrones/comments/rcscw/what_are_you_doing_in_preparation_for_the_2nd/,[deleted],1332692693,Just curious.  I might as well watch the first season again.,2,0,False,default,,,,,
1362,gameofthrones,t5_2rjz2,2012-3-26,2012,3,26,1,rcstn,i.imgur.com,There must always be a Stark in Winterfell,https://www.reddit.com/r/gameofthrones/comments/rcstn/there_must_always_be_a_stark_in_winterfell/,[deleted],1332693377,,7,46,False,default,,,,,
1363,gameofthrones,t5_2rjz2,2012-3-26,2012,3,26,1,rcsvd,youtube.com,TIL that the GOFT theme video has been removed from youtube :(,https://www.reddit.com/r/gameofthrones/comments/rcsvd/til_that_the_goft_theme_video_has_been_removed/,[deleted],1332693460,,0,0,False,default,,,,,
1364,gameofthrones,t5_2rjz2,2012-3-26,2012,3,26,1,rctoy,hbowatch.com,"Season Two, Episode 1 Review",https://www.reddit.com/r/gameofthrones/comments/rctoy/season_two_episode_1_review/,Longwand,1332694629,,13,20,False,http://e.thumbs.redditmedia.com/UilBZlcDWmN_fA8v.jpg,,,,,
1365,gameofthrones,t5_2rjz2,2012-3-26,2012,3,26,2,rcufb,i.imgur.com,Ours is the Fury,https://www.reddit.com/r/gameofthrones/comments/rcufb/ours_is_the_fury/,WeirdAlLoser,1332695628,,13,48,False,http://b.thumbs.redditmedia.com/yJ36f7q0dUrh2lgC.jpg,,,,,
1366,gameofthrones,t5_2rjz2,2012-3-26,2012,3,26,2,rcuhc,liquidsouldesign.deviantart.com,Game of Thrones iPhone Cases by *LiquidSoulDesign on deviantART,https://www.reddit.com/r/gameofthrones/comments/rcuhc/game_of_thrones_iphone_cases_by_liquidsouldesign/,liquidsouldesign,1332695706,,8,23,False,http://e.thumbs.redditmedia.com/tbmugmdiPRbm2qqv.jpg,,,,,
1367,gameofthrones,t5_2rjz2,2012-3-26,2012,3,26,2,rcvuk,memegenerator.net,Game of Thrones Pedobear,https://www.reddit.com/r/gameofthrones/comments/rcvuk/game_of_thrones_pedobear/,[deleted],1332697578,,0,0,False,default,,,,,
1368,gameofthrones,t5_2rjz2,2012-3-26,2012,3,26,3,rcx07,reddit.com,[SPOILERS All Books] George R. R. Martin reading a new excerpt from The Winds of Winter,https://www.reddit.com/r/gameofthrones/comments/rcx07/spoilers_all_books_george_r_r_martin_reading_a/,[deleted],1332699055,,0,1,False,default,,,,,
1369,gameofthrones,t5_2rjz2,2012-3-26,2012,3,26,3,rcx1h,youtube.com,[SPOILERS All Books] George R. R. Martin reading a new excerpt from The Winds of Winter ,https://www.reddit.com/r/gameofthrones/comments/rcx1h/spoilers_all_books_george_r_r_martin_reading_a/,dihuxley,1332699091,,43,49,False,http://c.thumbs.redditmedia.com/wv5rOYzKgmo_SGah.jpg,,,,,
1370,gameofthrones,t5_2rjz2,2012-3-26,2012,3,26,3,rcxel,i.imgur.com,There must always be a Stark in Winterfell [Season One/GoT Spoiler],https://www.reddit.com/r/gameofthrones/comments/rcxel/there_must_always_be_a_stark_in_winterfell_season/,[deleted],1332699487,,1,0,False,default,,,,,
1371,gameofthrones,t5_2rjz2,2012-3-26,2012,3,26,3,rcxn4,imgur.com,Brian Blessed as Tormund Giantsbane? (No real spoilers),https://www.reddit.com/r/gameofthrones/comments/rcxn4/brian_blessed_as_tormund_giantsbane_no_real/,[deleted],1332699808,,3,34,False,http://a.thumbs.redditmedia.com/stzqkz5CZSkzxsrf.jpg,,,,,
1372,gameofthrones,t5_2rjz2,2012-3-26,2012,3,26,3,rcy83,i.imgur.com,"I doodled this sketch in my English lecture... Needless to say, I missed countless notes. Worth it?",https://www.reddit.com/r/gameofthrones/comments/rcy83/i_doodled_this_sketch_in_my_english_lecture/,FelixIzGeeky,1332700615,,0,0,False,http://a.thumbs.redditmedia.com/gQnwTO1khfkn_ATr.jpg,,,,,
1373,gameofthrones,t5_2rjz2,2012-3-26,2012,3,26,3,rcyuh,imgur.com,"Hey Mods, this thing is getting out of hand. Please change it. ",https://www.reddit.com/r/gameofthrones/comments/rcyuh/hey_mods_this_thing_is_getting_out_of_hand_please/,[deleted],1332701400,,16,4,False,default,,,,,
1374,gameofthrones,t5_2rjz2,2012-3-26,2012,3,26,4,rd02k,i.imgur.com,"So was watching Your Highness this morning and look who I recognised, with a bit more hair.",https://www.reddit.com/r/gameofthrones/comments/rd02k/so_was_watching_your_highness_this_morning_and/,Nathionez,1332702839,,1,0,False,http://c.thumbs.redditmedia.com/sHbOaHSXHBHhWgT8.jpg,,,,,
1375,gameofthrones,t5_2rjz2,2012-3-26,2012,3,26,4,rd26h,self.gameofthrones,Who do you think was the best casting in the series?,https://www.reddit.com/r/gameofthrones/comments/rd26h/who_do_you_think_was_the_best_casting_in_the/,The_Second_Best,1332705472,"We know that Game of Thrones has almost universal perfect casting but I was intrested to see who the memebers of [r/gameofthrones](http://www.reddit.com/r/gameofthrones) think was the best casting in the show?

For me it would be Charles Dance as Tywin. He doesn't necessarily look exactly how Tywin is described in the books but his mannerisms and personality on screen are exactly how I pictured Tywin.",168,50,False,self,,,,,
1376,gameofthrones,t5_2rjz2,2012-3-26,2012,3,26,5,rd2cq,img259.imageshack.us,How cute,https://www.reddit.com/r/gameofthrones/comments/rd2cq/how_cute/,akloukas,1332705701,,0,0,False,http://c.thumbs.redditmedia.com/lidzJpnQucRtaxK2.jpg,,,,,
1377,gameofthrones,t5_2rjz2,2012-3-26,2012,3,26,5,rd4qu,i.imgur.com,This is how I picture  ex-maester Qyburn.,https://www.reddit.com/r/gameofthrones/comments/rd4qu/this_is_how_i_picture_exmaester_qyburn/,sostartled,1332708597,,0,0,False,default,,,,,
1378,gameofthrones,t5_2rjz2,2012-3-26,2012,3,26,6,rd6lj,i.imgur.com,Snow and Ghost by Captain Howdy,https://www.reddit.com/r/gameofthrones/comments/rd6lj/snow_and_ghost_by_captain_howdy/,Ralome,1332710928,,37,718,False,http://a.thumbs.redditmedia.com/qf2aLl4A5Ti6pxhB.jpg,,,,,
1379,gameofthrones,t5_2rjz2,2012-3-26,2012,3,26,6,rd6tb,i.imgur.com,I feel like this is very relevant here... (x post from /r/books),https://www.reddit.com/r/gameofthrones/comments/rd6tb/i_feel_like_this_is_very_relevant_here_x_post/,nlombardi3,1332711189,,2,40,False,http://b.thumbs.redditmedia.com/LjowRb99GpG1LuCg.jpg,,,,,
1380,gameofthrones,t5_2rjz2,2012-3-26,2012,3,26,7,rdabf,i.imgur.com,Meet Dany. We rescued her from the shelter yesterday. ,https://www.reddit.com/r/gameofthrones/comments/rdabf/meet_dany_we_rescued_her_from_the_shelter/,[deleted],1332715704,,0,0,False,default,,,,,
1381,gameofthrones,t5_2rjz2,2012-3-26,2012,3,26,7,rdaqe,self.gameofthrones,Maybe spoilers. Looking for a picture from Season 2,https://www.reddit.com/r/gameofthrones/comments/rdaqe/maybe_spoilers_looking_for_a_picture_from_season_2/,MrxSparkles,1332716243,"Seen  a post a while ago that had a picture showing [TV Spoiler](/s ""two guys riding through a gate on horses and there were bodies being hung on both sides of the gate"") I went as far back as I could here and couldn't find it. If someone knows what picture I'm talking about would they be able to post it or post a link to the post?",2,1,False,self,,,,,
1382,gameofthrones,t5_2rjz2,2012-3-26,2012,3,26,8,rdaw6,online.wsj.com,Game of Thrones Season 2 Review,https://www.reddit.com/r/gameofthrones/comments/rdaw6/game_of_thrones_season_2_review/,heisenberg27,1332716444,,4,12,False,http://c.thumbs.redditmedia.com/q69-ASE5PKF2Nart.jpg,,,,,
1383,gameofthrones,t5_2rjz2,2012-3-26,2012,3,26,8,rdaya,funnyordie.com,Sunday is coming (FunnyorDie),https://www.reddit.com/r/gameofthrones/comments/rdaya/sunday_is_coming_funnyordie/,queenofthed,1332716517,,37,348,False,http://a.thumbs.redditmedia.com/-y7LHyW4VR2_bsQl.jpg,,,,,
1384,gameofthrones,t5_2rjz2,2012-3-26,2012,3,26,9,rdekx,amazon.com,Amazon.com Recommended Viewing for Daenerys Targaryen,https://www.reddit.com/r/gameofthrones/comments/rdekx/amazoncom_recommended_viewing_for_daenerys/,LTComedy,1332721096,,0,5,False,default,,,,,
1385,gameofthrones,t5_2rjz2,2012-3-26,2012,3,26,9,rdeq8,self.gameofthrones,Anyone else buy a blu ray player just for aGoT?,https://www.reddit.com/r/gameofthrones/comments/rdeq8/anyone_else_buy_a_blu_ray_player_just_for_agot/,MrDrummond,1332721269,Im planning on buying both next week. Anyone else do the same?,26,23,False,self,,,,,
1386,gameofthrones,t5_2rjz2,2012-3-26,2012,3,26,9,rdgf1,youtube.com,Nowhere to Hide Promo Video,https://www.reddit.com/r/gameofthrones/comments/rdgf1/nowhere_to_hide_promo_video/,ThornyPlebeian,1332723355,,17,42,False,default,,,,,
1387,gameofthrones,t5_2rjz2,2012-3-26,2012,3,26,10,rdgmv,self.gameofthrones,Hedge Knight Trade Paperback - Where can I get it?,https://www.reddit.com/r/gameofthrones/comments/rdgmv/hedge_knight_trade_paperback_where_can_i_get_it/,aussiekinga,1332723608,"Anyone know where I can buy a copy online that isn't going to cost a lot?

[Everywhere](http://www.alibris.com/search/books/isbn/9781932796063) I [look](http://www.amazon.com/Hedge-Knight-George-R-R-Martin/dp/0785127240) it [costs](http://www.ebay.com/sch/Graphic-Novels-TPBs-/3954/i.html?_from=R40&amp;_nkw=hedge+knight) a small fortune.

I'm guessing this is because it is out of print. anyone know if there are plans to reprint, based on ASOIAF's recent popularity? ",5,1,False,self,,,,,
1388,gameofthrones,t5_2rjz2,2012-3-26,2012,3,26,10,rdh8s,m.youtube.com,Season 2: Nowhere To Hide Promo,https://www.reddit.com/r/gameofthrones/comments/rdh8s/season_2_nowhere_to_hide_promo/,FireChrome,1332724358,,0,3,False,default,,,,,
1389,gameofthrones,t5_2rjz2,2012-3-26,2012,3,26,10,rdibb,imgur.com,Just saying.,https://www.reddit.com/r/gameofthrones/comments/rdibb/just_saying/,Not_Rick_Santorum,1332725720,,0,0,False,default,,,,,
1390,gameofthrones,t5_2rjz2,2012-3-26,2012,3,26,10,rdioh,imgur.com,"Jorah Mormont wasn't always an exile lord in Essos, he once was a King...",https://www.reddit.com/r/gameofthrones/comments/rdioh/jorah_mormont_wasnt_always_an_exile_lord_in_essos/,kapsama,1332726150,,4,0,False,http://f.thumbs.redditmedia.com/0lKGjQG65qO6PKHY.jpg,,,,,
1391,gameofthrones,t5_2rjz2,2012-3-26,2012,3,26,11,rdm8z,i.imgur.com,Poor girl... (Vague spoilers all),https://www.reddit.com/r/gameofthrones/comments/rdm8z/poor_girl_vague_spoilers_all/,p4warrior,1332730496,,48,219,False,http://f.thumbs.redditmedia.com/A3sjc32ck9oe7LaY.jpg,,,,,
1392,gameofthrones,t5_2rjz2,2012-3-26,2012,3,26,12,rdnav,youtube.com,GRRM himself Reading Children's stories as if he had written them. [youtube],https://www.reddit.com/r/gameofthrones/comments/rdnav/grrm_himself_reading_childrens_stories_as_if_he/,HCG3873,1332731752,,0,1,False,default,,,,,
1393,gameofthrones,t5_2rjz2,2012-3-26,2012,3,26,12,rdnf5,quickmeme.com,Results of Warden in the North Elections,https://www.reddit.com/r/gameofthrones/comments/rdnf5/results_of_warden_in_the_north_elections/,Beelzebufo05,1332731891,,2,3,False,default,,,,,
1394,gameofthrones,t5_2rjz2,2012-3-26,2012,3,26,12,rdnn6,vimeo.com,"Edited together the few final moments of Season 1, to prepare myself for what's coming. What do you think? (Season 1 spoilers)",https://www.reddit.com/r/gameofthrones/comments/rdnn6/edited_together_the_few_final_moments_of_season_1/,rettic,1332732220,,11,57,True,nsfw,,,,,
1395,gameofthrones,t5_2rjz2,2012-3-26,2012,3,26,12,rdo70,cdn.memegenerator.net,preparing for sunday.,https://www.reddit.com/r/gameofthrones/comments/rdo70/preparing_for_sunday/,[deleted],1332732898,,1,0,False,default,,,,,
