,sbr,sbr_id,date,year,month,hour,day,id,domain,title,full_link,author,created,selftext,num_comments,score,over_18,thumbnail,media_provider,media_thumbnail,media_title,media_description,media_url
451,gameofthrones,t5_2rjz2,2012-3-9,2012,3,9,8,qo1w1,flickr.com,Saw this on r/fireporn... first thought was of Melisandre,https://www.reddit.com/r/gameofthrones/comments/qo1w1/saw_this_on_rfireporn_first_thought_was_of/,Kinfolk_Thuggin,1331249585,,1,4,False,http://c.thumbs.redditmedia.com/9ehNCXLBNvUJoMH8.jpg,,,,,
452,gameofthrones,t5_2rjz2,2012-3-9,2012,3,9,8,qo2bm,self.gameofthrones,"Toronto Students! Free George R.R. Martin Master Class, Tuesday March 13th @ 9:30am!",https://www.reddit.com/r/gameofthrones/comments/qo2bm/toronto_students_free_george_rr_martin_master/,[deleted],1331250135,"Hey everyone!

Just wanting to make sure Toronto post-secondary students know that Random House of Canada, HBO Canada and TIFF's Higher Learning program are hosting a free Master Class with George R.R. Martin. Here's the press release:

&gt; Post-secondary students and faculty are invited to join bestselling author George R.R. Martin at 9:30am on March 13 as he discusses his epic saga A Song of Ice and Fire and its adaptation to the small screen for HBO Canada's hit series Game of Thrones. Post-secondary students can claim a free ticket on the day of the event by showing their student ID at the TIFF Bell Lightbox Box Office.

Reminder: It's for post-secondary students only. Unfortunately the paid In Conversation With... event the night before has been sold out for weeks. There will be approximately 75 tickets available at the Box Office. They're first come, first served. There may be a short clip from the upcoming season during the Master Class. Hint, hint. See you Tuesday ;)

P.S.: The free Game of Thrones exhibit opens tomorrow until March 19th. You can have your picture taken by The Movie Network while you sit on the Iron Throne.",4,8,False,default,,,,,
453,gameofthrones,t5_2rjz2,2012-3-9,2012,3,9,8,qo2eb,arrestedwesteros.com,Game of Thrones + Arrested Development =win!,https://www.reddit.com/r/gameofthrones/comments/qo2eb/game_of_thrones_arrested_development_win/,Ray3142,1331250218,,11,72,False,http://d.thumbs.redditmedia.com/CIEr1xeeYmh9pBVi.jpg,,,,,
454,gameofthrones,t5_2rjz2,2012-3-9,2012,3,9,8,qo2g5,self.gameofthrones,Can someone point me in the direction of Season 1 episode 6 please (A Golden Crown),https://www.reddit.com/r/gameofthrones/comments/qo2g5/can_someone_point_me_in_the_direction_of_season_1/,Flirty_Birdy,1331250280,,7,0,False,default,,,,,
455,gameofthrones,t5_2rjz2,2012-3-9,2012,3,9,8,qo2ik,arrestedwesteros.com,Arrested Development + GoT = Awesomeness (Season 1 spoilers (maybe)),https://www.reddit.com/r/gameofthrones/comments/qo2ik/arrested_development_got_awesomeness_season_1/,captain_croco,1331250354,,0,4,False,default,,,,,
456,gameofthrones,t5_2rjz2,2012-3-9,2012,3,9,9,qo385,self.gameofthrones,I finished A Clash of Kings this morning. Who else can't wait for April!,https://www.reddit.com/r/gameofthrones/comments/qo385/i_finished_a_clash_of_kings_this_morning_who_else/,[deleted],1331251205,"My face has melted from my face after finishing that book. All I've got to say is 

Half man! Half man! Half man!",1,3,False,default,,,,,
457,gameofthrones,t5_2rjz2,2012-3-9,2012,3,9,9,qo3ag,youtube.com,"Sansa, Arya, and Bran sing the Game of Thrones Theme",https://www.reddit.com/r/gameofthrones/comments/qo3ag/sansa_arya_and_bran_sing_the_game_of_thrones_theme/,Jragghen,1331251276,,2,2,False,default,,,,,
458,gameofthrones,t5_2rjz2,2012-3-9,2012,3,9,9,qo4qt,whatculture.com,10 Reasons Why We Cant Wait For Game Of Thrones Season 2...,https://www.reddit.com/r/gameofthrones/comments/qo4qt/10_reasons_why_we_cant_wait_for_game_of_thrones/,kimme,1331253184,,0,3,False,default,,,,,
459,gameofthrones,t5_2rjz2,2012-3-9,2012,3,9,9,qo5fj,self.gameofthrones,How can I watch Game of Thrones Season 2 without cable/HBO?,https://www.reddit.com/r/gameofthrones/comments/qo5fj/how_can_i_watch_game_of_thrones_season_2_without/,Rowbond,1331254079,"Hey reddit, I live on campus at a University and don't have cable. Is there a way I can watch it online? I'm willing to pay a modest amount to see it... Otherwise I can always just pirate it I guess but I like the show and I want to support it. Any ideas?",2,2,False,self,,,,,
460,gameofthrones,t5_2rjz2,2012-3-9,2012,3,9,10,qo69y,self.gameofthrones,Who's your favorite unappreciated or unpopular character and why?,https://www.reddit.com/r/gameofthrones/comments/qo69y/whos_your_favorite_unappreciated_or_unpopular/,ImStillAwesome,1331255098,"Mine is Brienne. GRRM writes women so well, and as much as I love Dany, Arya, and Sansa, Brienne has always been the most relatable for me. I hit 5'6'' in 4th Grade onwards, so her thoughts obout being too big and feeling ugly and out-of-place resonated with me.

What about you?

[AFFC](/b ""EDIT: Just finished AFFC. Oh God, why."")

Sorry!",108,29,False,self,,,,,
461,gameofthrones,t5_2rjz2,2012-3-9,2012,3,9,10,qo84i,i.imgur.com,"Customer service, you're doing it right!",https://www.reddit.com/r/gameofthrones/comments/qo84i/customer_service_youre_doing_it_right/,doot_doot,1331257392,,8,19,False,http://e.thumbs.redditmedia.com/z9tYnrkPzKGpo3NX.jpg,,,,,
462,gameofthrones,t5_2rjz2,2012-3-9,2012,3,9,11,qo9ah,imgur.com,When ravens go off course...,https://www.reddit.com/r/gameofthrones/comments/qo9ah/when_ravens_go_off_course/,Korist,1331258799,,12,114,False,default,,,,,
463,gameofthrones,t5_2rjz2,2012-3-9,2012,3,9,11,qobdx,self.gameofthrones,A question for those who have played A Game of Thrones: The Card Game...,https://www.reddit.com/r/gameofthrones/comments/qobdx/a_question_for_those_who_have_played_a_game_of/,[deleted],1331261450,"I was gifted the [core set of the living card game](http://amzn.com/1589944208) after I devoured the TV series and have now almost finished reading the first book. My only concern is spoilers within the game itself.

Am I safe to play with the base set without spoiling future plot lines and characters? If not, how far should I have read before playing?",0,1,False,default,,,,,
464,gameofthrones,t5_2rjz2,2012-3-9,2012,3,9,12,qoch7,self.gameofthrones,After Watching the Commentary...,https://www.reddit.com/r/gameofthrones/comments/qoch7/after_watching_the_commentary/,isocline,1331262824,I'm not sure I'm going to be able to hate Cersei enough anymore. Lena Headey is so funny and delightfully foulmouthed. I don't think I'll be able to disassociate her from her character. ,12,12,False,self,,,,,
465,gameofthrones,t5_2rjz2,2012-3-9,2012,3,9,12,qod4h,self.gameofthrones,Frustrations with Season 1 Blu-ray,https://www.reddit.com/r/gameofthrones/comments/qod4h/frustrations_with_season_1_bluray/,woodandiron,1331263640,"So the set looks gorgeous, the episodes are fantastic, and the features (especially Complete Guide to Westeros) are great. Why am I so frustrated with the blu-ray?

Well, it's because the menus have every single episode and every single feature listed, whether or not they're on the disc I'm currently playing. Thus, I'll go to click the next episode or some other feature, there will be about twenty seconds of blank screen and then ""Please insert disc whatever"".

WTF? That is really frustrating, no?",6,8,False,self,,,,,
466,gameofthrones,t5_2rjz2,2012-3-9,2012,3,9,13,qogev,imgur.com,People tell me I look just like Cersei...,https://www.reddit.com/r/gameofthrones/comments/qogev/people_tell_me_i_look_just_like_cersei/,[deleted],1331267876,,1,0,False,default,,,,,
467,gameofthrones,t5_2rjz2,2012-3-9,2012,3,9,13,qoh9h,self.gameofthrones,Help with ideas for book covers would be appreciated!,https://www.reddit.com/r/gameofthrones/comments/qoh9h/help_with_ideas_for_book_covers_would_be/,weatherstorm,1331269061,"For fun, I've decided to try and create some book covers for the five current ASoIaF books. I've been trying to think of major themes within each book that could be represented pictorially, but my best ideas thus far are too repetitive between each book. 

If anyone is willing to help and has ideas, I'd love to hear them! I promise I'll post the resulting images when I'm finished (which ideally will be in under a month). 

Thanks in advance for any help you can offer!",3,1,False,self,,,,,
468,gameofthrones,t5_2rjz2,2012-3-9,2012,3,9,14,qohsu,youtube.com,Simpsons Intro,https://www.reddit.com/r/gameofthrones/comments/qohsu/simpsons_intro/,gw8t3st,1331269764,,0,0,False,default,,,,,
469,gameofthrones,t5_2rjz2,2012-3-9,2012,3,9,14,qohx8,imgur.com,Got bored so I made my facebook into this.,https://www.reddit.com/r/gameofthrones/comments/qohx8/got_bored_so_i_made_my_facebook_into_this/,[deleted],1331269967,,3,8,False,default,,,,,
470,gameofthrones,t5_2rjz2,2012-3-9,2012,3,9,14,qoip5,self.gameofthrones,GoT DVD Extra at Costco?,https://www.reddit.com/r/gameofthrones/comments/qoip5/got_dvd_extra_at_costco/,featpete,1331271094,"I was at my local Costco today in Culver City, CA and saw the Game of Thrones DVD (not BluRay) and noticed that on the back, it said there was an extra mini-book included with the DVD set! It seemed like there was an book attached, which I am totally interested in. 

I haven't heard a single thing about it though. Did anyone pick up their DVD/BD at Costco? The only other place with a different kind of extra/packaging I've seen is Best Buy with their Stark/Targaryen covers.",3,1,False,self,,,,,
471,gameofthrones,t5_2rjz2,2012-3-9,2012,3,9,15,qojy3,accesshollywood.com,Viserys is one sexy mofo.,https://www.reddit.com/r/gameofthrones/comments/qojy3/viserys_is_one_sexy_mofo/,Fanfarlo,1331273034,,4,2,False,default,,,,,
472,gameofthrones,t5_2rjz2,2012-3-9,2012,3,9,15,qoku9,self.gameofthrones,How many boners are there in aSoIaF?,https://www.reddit.com/r/gameofthrones/comments/qoku9/how_many_boners_are_there_in_asoiaf/,[deleted],1331274497,,0,0,False,default,,,,,
473,gameofthrones,t5_2rjz2,2012-3-9,2012,3,9,16,qomtm,i.imgur.com,"Advertising: you're doing it right, HBO",https://www.reddit.com/r/gameofthrones/comments/qomtm/advertising_youre_doing_it_right_hbo/,[deleted],1331278267,,27,451,False,http://d.thumbs.redditmedia.com/jMxRhTXONyAUvD4i.jpg,,,,,
474,gameofthrones,t5_2rjz2,2012-3-9,2012,3,9,16,qona4,i.imgur.com,Khal Drogo's Facebook (Season 1 spoiler),https://www.reddit.com/r/gameofthrones/comments/qona4/khal_drogos_facebook_season_1_spoiler/,[deleted],1331279318,,3,48,False,http://a.thumbs.redditmedia.com/2IZVm3lDSk7Am2UB.jpg,,,,,
475,gameofthrones,t5_2rjz2,2012-3-9,2012,3,9,17,qoomw,youtu.be,so apparently this is in the bluray...,https://www.reddit.com/r/gameofthrones/comments/qoomw/so_apparently_this_is_in_the_bluray/,little_panda,1331282682,,1,0,False,default,,,,,
476,gameofthrones,t5_2rjz2,2012-3-9,2012,3,9,18,qopw9,i.imgur.com,Best line in ADWD,https://www.reddit.com/r/gameofthrones/comments/qopw9/best_line_in_adwd/,[deleted],1331286257,,26,225,False,http://c.thumbs.redditmedia.com/-qT6HlxKVii37urz.jpg,,,,,
477,gameofthrones,t5_2rjz2,2012-3-9,2012,3,9,20,qorvc,youtube.com,I really wish this scene had made it's way into the show. ,https://www.reddit.com/r/gameofthrones/comments/qorvc/i_really_wish_this_scene_had_made_its_way_into/,EdmundRice,1331292537,,62,518,False,http://c.thumbs.redditmedia.com/tknK-ETf5sCDoGwz.jpg,,,,,
478,gameofthrones,t5_2rjz2,2012-3-9,2012,3,9,21,qotja,imgur.com,Lori[Walking Dead] and Catelyn,https://www.reddit.com/r/gameofthrones/comments/qotja/loriwalking_dead_and_catelyn/,[deleted],1331297584,,3,0,False,default,,,,,
479,gameofthrones,t5_2rjz2,2012-3-9,2012,3,9,22,qov4d,heyuguys.co.uk,Game of Thrones Interview  Emilia Clarke (Daenerys Targaryen),https://www.reddit.com/r/gameofthrones/comments/qov4d/game_of_thrones_interview_emilia_clarke_daenerys/,DavosLostFingers,1331301180,,14,29,False,http://d.thumbs.redditmedia.com/rdyONtUMoQEyosbQ.jpg,,,,,
480,gameofthrones,t5_2rjz2,2012-3-9,2012,3,9,22,qovar,self.gameofthrones,Self: Stark / Warg Speculation,https://www.reddit.com/r/gameofthrones/comments/qovar/self_stark_warg_speculation/,SilentJay74,1331301528,"I do not think Ned Stark is truly [GOT] ( /b ""dead"" ) [ADWD] ( /b  ""A Warg can smell a Warg and Jon Snow had the scent but he is untrained""). I also think I know where Benjin Stark is, and he is in plain sight.  ""Lord Mormont's Raven ""Snow, snow, snow"" [GOT] ( /b ""All the Starks are Wargs and Ned skin walked before his beheading into the raven flying above Baelor's Sept."") Sansa does not have the [GOT] (/b ""Green Dreams as Lady is dead."")  All the others have them. Arya [ADWD] (/b "" Skin walks into a cat when she is blind"" ) tl;dr  /g ""Benjin is the Raven, Ned has skin walked into something else.Thoughts?",7,1,False,self,,,,,
481,gameofthrones,t5_2rjz2,2012-3-9,2012,3,9,23,qovj4,thisisfakediy.co.uk,Interview: Game Of Thrones Kit Harington,https://www.reddit.com/r/gameofthrones/comments/qovj4/interview_game_of_thrones_kit_harington/,stephenackroyd,1331301933,,0,7,False,http://d.thumbs.redditmedia.com/9KZHxelScAAjRw2Q.jpg,,,,,
482,gameofthrones,t5_2rjz2,2012-3-9,2012,3,9,23,qowsw,flickr.com,The Lannisters always pay their debts | Flickr - Photo Sharing!,https://www.reddit.com/r/gameofthrones/comments/qowsw/the_lannisters_always_pay_their_debts_flickr/,CSNX,1331304165,,11,113,False,http://f.thumbs.redditmedia.com/NeAHRCnZ0pCJNfxe.jpg,,,,,
483,gameofthrones,t5_2rjz2,2012-3-10,2012,3,10,0,qoxz6,2shared.com,Targaryen Boot Screen for Windows 7 [use Win7BootUpdater],https://www.reddit.com/r/gameofthrones/comments/qoxz6/targaryen_boot_screen_for_windows_7_use/,[deleted],1331306195,,2,1,False,default,,,,,
484,gameofthrones,t5_2rjz2,2012-3-10,2012,3,10,0,qoy4i,self.gameofthrones,Quick Question - HBO Series (Season 1) What did Robert Baratheon say? ,https://www.reddit.com/r/gameofthrones/comments/qoy4i/quick_question_hbo_series_season_1_what_did/,hoosthatgirl,1331306431,"I just watched some of the first episodes of Season 1 last night and had a quick question.  There was a scene where Robert Baratheon, Jaime Lannister and Barristan Selmy are in a meeting and they were talking about their first kill.  Did anyone catch what King Robert said?  Did he say he killed a Tarly boy with his warhammer?  I didn't catch the name or where it took place.  TIA!",10,5,False,self,,,,,
485,gameofthrones,t5_2rjz2,2012-3-10,2012,3,10,0,qozkd,reddit.com,Wish they had been filming in Iceland yesterday (xpost r/pics),https://www.reddit.com/r/gameofthrones/comments/qozkd/wish_they_had_been_filming_in_iceland_yesterday/,[deleted],1331308479,,0,1,False,default,,,,,
486,gameofthrones,t5_2rjz2,2012-3-10,2012,3,10,1,qp04s,youtube.com,"Game of Thrones the show opening sung by Sansa, Arya and Bran",https://www.reddit.com/r/gameofthrones/comments/qp04s/game_of_thrones_the_show_opening_sung_by_sansa/,neondemon,1331309256,,0,1,False,default,,,,,
487,gameofthrones,t5_2rjz2,2012-3-10,2012,3,10,1,qp1bs,self.gameofthrones,ASOIAF/GOT inspired food for watch party? Share your recipes!,https://www.reddit.com/r/gameofthrones/comments/qp1bs/asoiafgot_inspired_food_for_watch_party_share/,dangerssnake,1331310902,I am wanting to try and make some food that is in theme of the show for the premiere that won't totally break my budget. Suggestions?,21,13,False,self,,,,,
488,gameofthrones,t5_2rjz2,2012-3-10,2012,3,10,1,qp1pp,phillyburbs.com,HBO to offer new sneak peak of Game of Thrones sneak peak about a week before the Season 2 premiere,https://www.reddit.com/r/gameofthrones/comments/qp1pp/hbo_to_offer_new_sneak_peak_of_game_of_thrones/,[deleted],1331311441,,0,1,False,default,,,,,
489,gameofthrones,t5_2rjz2,2012-3-10,2012,3,10,1,qp1qp,upcoming4.me,A Dance with Dragons UK paperback release and cover art announced,https://www.reddit.com/r/gameofthrones/comments/qp1qp/a_dance_with_dragons_uk_paperback_release_and/,[deleted],1331311474,,10,4,False,default,,,,,
490,gameofthrones,t5_2rjz2,2012-3-10,2012,3,10,1,qp1r1,phillyburbs.com,HBO to offer new sneak peak of Game of Thrones about a week before the Season 2 premiere,https://www.reddit.com/r/gameofthrones/comments/qp1r1/hbo_to_offer_new_sneak_peak_of_game_of_thrones/,EGribby,1331311485,,0,7,False,default,,,,,
491,gameofthrones,t5_2rjz2,2012-3-10,2012,3,10,1,qp1zr,amazon.com,Amazon now selling GoT Season 1 Blu-Ray for half off!,https://www.reddit.com/r/gameofthrones/comments/qp1zr/amazon_now_selling_got_season_1_bluray_for_half/,[deleted],1331311820,,6,2,False,default,,,,,
492,gameofthrones,t5_2rjz2,2012-3-10,2012,3,10,1,qp21u,en.wikipedia.org,"Does anyone picture Asha Greyjoy like this?
",https://www.reddit.com/r/gameofthrones/comments/qp21u/does_anyone_picture_asha_greyjoy_like_this/,theprogdude,1331311890,,4,0,False,http://e.thumbs.redditmedia.com/TGm0wVxl0U7tWyHX.jpg,,,,,
493,gameofthrones,t5_2rjz2,2012-3-10,2012,3,10,1,qp28u,self.gameofthrones,"Question on Asha (Maybe spoilers, just to be safe)",https://www.reddit.com/r/gameofthrones/comments/qp28u/question_on_asha_maybe_spoilers_just_to_be_safe/,smokey815,1331312167,Why did they change her name to Yara in the show?  I couldn't find a reason.,32,4,False,self,,,,,
494,gameofthrones,t5_2rjz2,2012-3-10,2012,3,10,1,qp28z,youtube.com,"Theme song accompanied by vocals Bran, Sansa and Arya",https://www.reddit.com/r/gameofthrones/comments/qp28z/theme_song_accompanied_by_vocals_bran_sansa_and/,iamalrker,1331312170,,1,1,False,default,,,,,
495,gameofthrones,t5_2rjz2,2012-3-10,2012,3,10,1,qp2bu,i.imgur.com,..so what do you think about my new fanpage timeline design ?,https://www.reddit.com/r/gameofthrones/comments/qp2bu/so_what_do_you_think_about_my_new_fanpage/,lojke,1331312282,,9,26,False,http://d.thumbs.redditmedia.com/c3xMuzRLqIsNvrb-.jpg,,,,,
496,gameofthrones,t5_2rjz2,2012-3-10,2012,3,10,2,qp2z0,self.gameofthrones,Why are the Twins strategically important? (Possible Spoilers),https://www.reddit.com/r/gameofthrones/comments/qp2z0/why_are_the_twins_strategically_important/,[deleted],1331313147,"So, on the map, the Kingsroad clealry goes to the East of the twins, yet Robb has to cross the Twins twice to get to and from the South. Their locations is in the chokepoint (the neck) of Westeros but, wouldn't it make more sense to stay on the Kingsroad and only have to cross the Trident once?",21,9,False,self,,,,,
497,gameofthrones,t5_2rjz2,2012-3-10,2012,3,10,2,qp38p,youtube.com,THE NORTH REMEMBERS!!! Tribute for Eddard Stark!,https://www.reddit.com/r/gameofthrones/comments/qp38p/the_north_remembers_tribute_for_eddard_stark/,rotems119,1331313465,,0,0,False,http://a.thumbs.redditmedia.com/eOF3rCQcOr2nJ-lB.jpg,,,,,
498,gameofthrones,t5_2rjz2,2012-3-10,2012,3,10,2,qp3kk,youtube.com,Rory McCann's audition for the Hound,https://www.reddit.com/r/gameofthrones/comments/qp3kk/rory_mccanns_audition_for_the_hound/,[deleted],1331313936,,1,1,False,default,,,,,
499,gameofthrones,t5_2rjz2,2012-3-10,2012,3,10,2,qp3mx,youtube.com,"Emilia Clarke's GQ photo shoot
",https://www.reddit.com/r/gameofthrones/comments/qp3mx/emilia_clarkes_gq_photo_shoot/,rowbotik,1331313996,,0,1,False,default,,,,,
500,gameofthrones,t5_2rjz2,2012-3-10,2012,3,10,3,qp5de,self.gameofthrones,News about the Game of Thrones MMO,https://www.reddit.com/r/gameofthrones/comments/qp5de/news_about_the_game_of_thrones_mmo/,digibond,1331316213,"Lots of details here from Bigpoint: http://massively.joystiq.com/2012/03/09/gdc-2012-bigpoint-discusses-the-game-of-thrones-mmo/#continued

If you're thinking about playing, come over to /r/gotmmo!",3,8,False,self,,,,,
501,gameofthrones,t5_2rjz2,2012-3-10,2012,3,10,3,qp6h4,i.imgur.com,I don't remember that character from the books,https://www.reddit.com/r/gameofthrones/comments/qp6h4/i_dont_remember_that_character_from_the_books/,[deleted],1331317627,,1,0,False,default,,,,,
502,gameofthrones,t5_2rjz2,2012-3-10,2012,3,10,4,qp8d1,fullbodytransplant.files.wordpress.com,[aCoK spoilers]This is exactly how I imagined the wildfire in The Battle of The Blackwater. (X-post from r/pics),https://www.reddit.com/r/gameofthrones/comments/qp8d1/acok_spoilersthis_is_exactly_how_i_imagined_the/,phantomxxlord,1331319944,,0,0,False,default,,,,,
503,gameofthrones,t5_2rjz2,2012-3-10,2012,3,10,4,qp9pa,self.gameofthrones,When the winter finally arrives,https://www.reddit.com/r/gameofthrones/comments/qp9pa/when_the_winter_finally_arrives/,jess_sp,1331321646,"does the Stark's motto change to ""told'ya""?",0,0,False,self,,,,,
504,gameofthrones,t5_2rjz2,2012-3-10,2012,3,10,4,qpa2o,s3.amazonaws.com,Amazing Arya Drawing,https://www.reddit.com/r/gameofthrones/comments/qpa2o/amazing_arya_drawing/,Scrufferrs,1331322102,,13,124,False,http://f.thumbs.redditmedia.com/y7XaBog1lTo_sukw.jpg,,,,,
505,gameofthrones,t5_2rjz2,2012-3-10,2012,3,10,4,qpao7,imgur.com,My sister and her friend drew some funny sketches of ASOIAF! (light spoilers up to ASOS),https://www.reddit.com/r/gameofthrones/comments/qpao7/my_sister_and_her_friend_drew_some_funny_sketches/,Will_Im_Not,1331322862,,21,94,False,http://e.thumbs.redditmedia.com/5NI4cJufOu5c4i_d.jpg,,,,,
506,gameofthrones,t5_2rjz2,2012-3-10,2012,3,10,5,qpbax,hbowatch.com,The Office Spoofs Game of Thrones,https://www.reddit.com/r/gameofthrones/comments/qpbax/the_office_spoofs_game_of_thrones/,Reinhart,1331323647,,3,5,False,http://c.thumbs.redditmedia.com/mjS792hdMpvOTIXn.jpg,,,,,
507,gameofthrones,t5_2rjz2,2012-3-10,2012,3,10,5,qpc0t,self.gameofthrones,"So r/gameofthrones, you're having a dinner party and can invite 5 characters from asoiaf. Who's coming? ",https://www.reddit.com/r/gameofthrones/comments/qpc0t/so_rgameofthrones_youre_having_a_dinner_party_and/,robflo,1331324516,"I saw this on westeros a while back, seemed quite fun

My five would be...

Robert Baratheon: A drunk Robert telling stories of his battles and whoring, wouldn't be a dull moment

Tyrion Lannister: Could anyone seriously not include this guy?

Dolorus Edd: For some top class dry humour.

Lord Manderly: He'll get the best pies in. 

Asha/Yara Greyjoy: Got to make sure it's not a complete sausage-fest, and she could hold her own with the guys.",100,31,False,self,,,,,
508,gameofthrones,t5_2rjz2,2012-3-10,2012,3,10,5,qpcp7,i.imgur.com,Real World Geographical/Political Equivalents of GoT Universe,https://www.reddit.com/r/gameofthrones/comments/qpcp7/real_world_geographicalpolitical_equivalents_of/,soapwater,1331325342,,40,32,False,http://c.thumbs.redditmedia.com/dvDFzw0hWpGAv7Vh.jpg,,,,,
509,gameofthrones,t5_2rjz2,2012-3-10,2012,3,10,5,qpcx7,nbc.com,"""The Office"" mentions GOT",https://www.reddit.com/r/gameofthrones/comments/qpcx7/the_office_mentions_got/,[deleted],1331325595,,0,0,False,default,,,,,
510,gameofthrones,t5_2rjz2,2012-3-10,2012,3,10,5,qpdsn,i.imgur.com,How I feel when I'm at work and a girl invites me to go to the beach.,https://www.reddit.com/r/gameofthrones/comments/qpdsn/how_i_feel_when_im_at_work_and_a_girl_invites_me/,Will_Im_Not,1331326656,,9,92,False,http://f.thumbs.redditmedia.com/yLh7PEbKlSxR8Nd5.jpg,,,,,
511,gameofthrones,t5_2rjz2,2012-3-10,2012,3,10,5,qpdsp,self.gameofthrones,Question about the season 2 trailers,https://www.reddit.com/r/gameofthrones/comments/qpdsp/question_about_the_season_2_trailers/,fullmetal9900,1331326657,"I've heard a few people mention that they thought they saw wildfire in the trailers for season 2, but wildfire is supposed to be green.  My question is, did people see green fire and I'm just blind, or are people just assuming that they're seeing wildfire with all the fire that's seen in the trailer",3,8,False,self,,,,,
512,gameofthrones,t5_2rjz2,2012-3-10,2012,3,10,6,qpek5,youtube.com,Made me think of Tyrion....and not just because of the title.  (Little Lion Man by Mumford and Sons),https://www.reddit.com/r/gameofthrones/comments/qpek5/made_me_think_of_tyrionand_not_just_because_of/,[deleted],1331327561,,0,0,False,default,,,,,
513,gameofthrones,t5_2rjz2,2012-3-10,2012,3,10,6,qpfh2,redbubble.com,Bloody Mummers T-Shirt,https://www.reddit.com/r/gameofthrones/comments/qpfh2/bloody_mummers_tshirt/,guyfawkes48,1331328666,,7,20,False,http://a.thumbs.redditmedia.com/Ol1HC7w3NMT7PCGT.jpg,,,,,
514,gameofthrones,t5_2rjz2,2012-3-10,2012,3,10,6,qpgn3,self.gameofthrones,Targaryen Win7 Boot Screen,https://www.reddit.com/r/gameofthrones/comments/qpgn3/targaryen_win7_boot_screen/,montyman77,1331330096,"Here's a windows 7 boot screen I made animating the targaryen sigil
http://www.mediafire.com/?ikideq6bhrv8qd7
open the file with Win7BootUpdater and you can change the text to whatever you want like a book quote or something
http://www.coderforlife.com/projects/win7boot/

SCREENSHOT: http://imgur.com/3TTwC",9,10,False,self,,,,,
515,gameofthrones,t5_2rjz2,2012-3-10,2012,3,10,7,qpihb,pc.ign.com,IGN: First Look at Game of Thrones MMO,https://www.reddit.com/r/gameofthrones/comments/qpihb/ign_first_look_at_game_of_thrones_mmo/,grimsweeper,1331332355,,5,16,False,http://c.thumbs.redditmedia.com/eZiT2nOihJ-eKWDD.jpg,,,,,
516,gameofthrones,t5_2rjz2,2012-3-10,2012,3,10,8,qpk0d,i.imgur.com,Does this remind you of anyone?,https://www.reddit.com/r/gameofthrones/comments/qpk0d/does_this_remind_you_of_anyone/,[deleted],1331334206,,0,1,False,default,,,,,
517,gameofthrones,t5_2rjz2,2012-3-10,2012,3,10,10,qpp1v,gameofthronestournament.com,A Game of Thrones March Madness Bracket Tournament? Yes Please.,https://www.reddit.com/r/gameofthrones/comments/qpp1v/a_game_of_thrones_march_madness_bracket/,spoonito,1331341290,,52,84,False,http://a.thumbs.redditmedia.com/AbVQBV3aNk9qGmjB.jpg,,,,,
518,gameofthrones,t5_2rjz2,2012-3-10,2012,3,10,11,qprf1,i.imgur.com,Clash of Kings House Banners Wallpaper,https://www.reddit.com/r/gameofthrones/comments/qprf1/clash_of_kings_house_banners_wallpaper/,[deleted],1331344885,,0,1,False,default,,,,,
