,sbr,sbr_id,date,year,month,hour,day,id,domain,title,full_link,author,created,selftext,num_comments,score,over_18,thumbnail,media_provider,media_thumbnail,media_title,media_description,media_url
0,gameofthrones,t5_2rjz2,2012-3-1,2012,3,1,9,qc40r,geektyrant.com,My Little- OH GOD,https://www.reddit.com/r/gameofthrones/comments/qc40r/my_little_oh_god/,[deleted],1330560586,,0,0,False,default,,,,,
1,gameofthrones,t5_2rjz2,2012-3-1,2012,3,1,9,qc45n,i.imgur.com,Visual for the new Game of Thrones season is out!,https://www.reddit.com/r/gameofthrones/comments/qc45n/visual_for_the_new_game_of_thrones_season_is_out/,nohiddenmeaning,1330560738,,0,0,False,http://e.thumbs.redditmedia.com/ow6Go4TQ3ACpNHqp.jpg,,,,,
2,gameofthrones,t5_2rjz2,2012-3-1,2012,3,1,9,qc69r,ewinsidetv.files.wordpress.com,New Season 2 Art released!,https://www.reddit.com/r/gameofthrones/comments/qc69r/new_season_2_art_released/,silencesc,1330563356,,0,0,False,default,,,,,
3,gameofthrones,t5_2rjz2,2012-3-1,2012,3,1,10,qc730,amazon.co.uk,"DoD Part 2? Just got this sent to me via email, can anyone elaborate?",https://www.reddit.com/r/gameofthrones/comments/qc730/dod_part_2_just_got_this_sent_to_me_via_email_can/,[deleted],1330564344,,5,1,False,default,,,,,
4,gameofthrones,t5_2rjz2,2012-3-1,2012,3,1,10,qc7yo,self.gameofthrones,"Hey, convince me to start watching Game of Thrones. I'm just not quite sure. ",https://www.reddit.com/r/gameofthrones/comments/qc7yo/hey_convince_me_to_start_watching_game_of_thrones/,froopla1,1330565476,winner gets a cookie. ,12,0,False,self,,,,,
5,gameofthrones,t5_2rjz2,2012-3-1,2012,3,1,10,qc85x,self.gameofthrones,Robert Kirkman vs GRRM,https://www.reddit.com/r/gameofthrones/comments/qc85x/robert_kirkman_vs_grrm/,APowell23,1330565729,"Robert Kirkman kills all his characters, GRRM just seems like a sissy compared to this guy. Thoughts?",14,0,False,self,,,,,
6,gameofthrones,t5_2rjz2,2012-3-1,2012,3,1,10,qc91e,i.imgur.com,It would be so awesome to have Robb POV chapters (ASOS),https://www.reddit.com/r/gameofthrones/comments/qc91e/it_would_be_so_awesome_to_have_robb_pov_chapters/,[deleted],1330566809,,5,0,False,default,,,,,
7,gameofthrones,t5_2rjz2,2012-3-1,2012,3,1,10,qc9bl,self.gameofthrones,"GoT bags I'm so excited about I wanted to show you 
all.",https://www.reddit.com/r/gameofthrones/comments/qc9bl/got_bags_im_so_excited_about_i_wanted_to_show_you/,folawriting,1330567132,"Hi guys, I'm a new fan of the TV series and the books. I'm currently on Clash of Kings. Anyway, I love the Stark siblings and their direwolves and I've been looking for merch that featured them. Bags are my favorite and [this store](http://fencingandarchery.com/) had shirts and bags and I was so excited when [I saw this I bought it.](http://imgur.com/3xYIK) I use it as my school bag. I was pretty stoked but I really wanted one with the direwolves too, I randomly posted on their facebook wall about how I love the Stark one and a direwolf one would be awesome, they already had shirts. I was so surprised when they added it as an item to their store and they let me know when it was up! [Obviously I had to get it and it came in the mail today.](http://imgur.com/45bDu) 

Does this show how much of a newbie I am? I really just wanted to show off my cool bags.",7,6,False,self,,,,,
8,gameofthrones,t5_2rjz2,2012-3-1,2012,3,1,11,qcaci,youtube.com,Awesome Arya music video - Do it like a dude ,https://www.reddit.com/r/gameofthrones/comments/qcaci/awesome_arya_music_video_do_it_like_a_dude/,[deleted],1330568320,,4,4,False,default,,,,,
9,gameofthrones,t5_2rjz2,2012-3-1,2012,3,1,12,qcdro,ow.ly,"Now we know who wins the ""Game Of Thrones""...... :)",https://www.reddit.com/r/gameofthrones/comments/qcdro/now_we_know_who_wins_the_game_of_thrones/,[deleted],1330572433,,0,1,False,default,,,,,
10,gameofthrones,t5_2rjz2,2012-3-1,2012,3,1,12,qce0q,self.gameofthrones,Would anyone have sex with that Tyrion guy? Honestly I'm just curious.,https://www.reddit.com/r/gameofthrones/comments/qce0q/would_anyone_have_sex_with_that_tyrion_guy/,peter_dinklage,1330572725,,27,36,False,self,,,,,
11,gameofthrones,t5_2rjz2,2012-3-1,2012,3,1,12,qced8,i.imgur.com,Now we know who wins the Game of Thrones... :),https://www.reddit.com/r/gameofthrones/comments/qced8/now_we_know_who_wins_the_game_of_thrones/,kimme,1330573126,,54,187,False,http://f.thumbs.redditmedia.com/ybOCmZyWlJM7ib1G.jpg,,,,,
12,gameofthrones,t5_2rjz2,2012-3-1,2012,3,1,12,qceja,i.imgur.com,"I found Hodor in r/WTF (check out #3 named ""Hordor"")",https://www.reddit.com/r/gameofthrones/comments/qceja/i_found_hodor_in_rwtf_check_out_3_named_hordor/,[deleted],1330573318,,0,2,False,default,,,,,
13,gameofthrones,t5_2rjz2,2012-3-1,2012,3,1,13,qcfmn,imgur.com,So guess what I noticed in the new GoT Season 2 trailer...,https://www.reddit.com/r/gameofthrones/comments/qcfmn/so_guess_what_i_noticed_in_the_new_got_season_2/,[deleted],1330574605,,12,0,False,default,,,,,
14,gameofthrones,t5_2rjz2,2012-3-1,2012,3,1,13,qcfno,siliconera.com,Persona 2: Eternal Punishment's New Scenario Focuses On Tatsuya | Siliconera,https://www.reddit.com/r/gameofthrones/comments/qcfno/persona_2_eternal_punishments_new_scenario/,[deleted],1330574634,,0,1,False,default,,,,,
15,gameofthrones,t5_2rjz2,2012-3-1,2012,3,1,13,qcg63,thameofgroans.tumblr.com,Stark kids and wolves,https://www.reddit.com/r/gameofthrones/comments/qcg63/stark_kids_and_wolves/,kjhatch,1330575284,,11,45,False,http://f.thumbs.redditmedia.com/U9dUIDHmowJCPwZG.jpg,,,,,
16,gameofthrones,t5_2rjz2,2012-3-1,2012,3,1,13,qcgfm,youtube.com,I found this on youtube...,https://www.reddit.com/r/gameofthrones/comments/qcgfm/i_found_this_on_youtube/,[deleted],1330575609,,0,1,False,default,,,,,
17,gameofthrones,t5_2rjz2,2012-3-1,2012,3,1,13,qcgtc,qkme.me,Sam the Slayer [AFFC spoilers],https://www.reddit.com/r/gameofthrones/comments/qcgtc/sam_the_slayer_affc_spoilers/,Strug-ga-ling,1330576106,,37,308,False,http://b.thumbs.redditmedia.com/Sj8Lc3xxF_woxCI1.jpg,,,,,
18,gameofthrones,t5_2rjz2,2012-3-1,2012,3,1,13,qcgtj,imgur.com,Filling a request for a 1920x1200 version (Photoshop),https://www.reddit.com/r/gameofthrones/comments/qcgtj/filling_a_request_for_a_1920x1200_version/,VillainGuy,1330576111,,5,31,False,http://a.thumbs.redditmedia.com/keMMwU8o3L1cSjMT.jpg,,,,,
19,gameofthrones,t5_2rjz2,2012-3-1,2012,3,1,13,qcia9,youtube.com,George's take on nursery rhymes...,https://www.reddit.com/r/gameofthrones/comments/qcia9/georges_take_on_nursery_rhymes/,[deleted],1330577985,,2,0,False,default,,,,,
20,gameofthrones,t5_2rjz2,2012-3-1,2012,3,1,14,qcjdx,qkme.me,"Read Game of Thrones, They said",https://www.reddit.com/r/gameofthrones/comments/qcjdx/read_game_of_thrones_they_said/,gameofthrones111,1330579478,,10,83,False,http://a.thumbs.redditmedia.com/J_YnjjezcOro_VmN.jpg,,,,,
21,gameofthrones,t5_2rjz2,2012-3-1,2012,3,1,14,qcjoa,vulture.com,Carice van Houten (Melisandre) interview (warning a very poorly marked ADWD spoiler inside),https://www.reddit.com/r/gameofthrones/comments/qcjoa/carice_van_houten_melisandre_interview_warning_a/,lbzng,1330579876,,12,13,False,http://f.thumbs.redditmedia.com/elMOYmqMiLE9cBve.jpg,,,,,
22,gameofthrones,t5_2rjz2,2012-3-1,2012,3,1,14,qcjqf,desmond.imageshack.us,Omar coming,https://www.reddit.com/r/gameofthrones/comments/qcjqf/omar_coming/,baitgba,1330579977,,0,0,False,default,,,,,
23,gameofthrones,t5_2rjz2,2012-3-1,2012,3,1,14,qcjwl,saportfolio.deviantart.com,Victarion Greyjoy sketch,https://www.reddit.com/r/gameofthrones/comments/qcjwl/victarion_greyjoy_sketch/,unfilterthought,1330580212,,5,12,False,http://f.thumbs.redditmedia.com/cfDBzlcsQA0TYSKM.jpg,,,,,
24,gameofthrones,t5_2rjz2,2012-3-1,2012,3,1,15,qclsi,self.gameofthrones,House motto's,https://www.reddit.com/r/gameofthrones/comments/qclsi/house_mottos/,biggin-,1330583015,Just wondering what your favourite House motto is. Might give me a chance to hear some that i haven't hear before,23,6,False,self,,,,,
25,gameofthrones,t5_2rjz2,2012-3-1,2012,3,1,17,qcpb4,amazon.co.uk,Was not expecting this,https://www.reddit.com/r/gameofthrones/comments/qcpb4/was_not_expecting_this/,[deleted],1330589995,,0,1,False,default,,,,,
26,gameofthrones,t5_2rjz2,2012-3-1,2012,3,1,17,qcpsf,i.imgur.com,'War is Coming' poster,https://www.reddit.com/r/gameofthrones/comments/qcpsf/war_is_coming_poster/,[deleted],1330591268,,1,0,False,default,,,,,
27,gameofthrones,t5_2rjz2,2012-3-1,2012,3,1,18,qcr2p,winteran.blogspot.com,I feel so much like Arya,https://www.reddit.com/r/gameofthrones/comments/qcr2p/i_feel_so_much_like_arya/,poopak,1330594977,,3,0,True,nsfw,,,,,
28,gameofthrones,t5_2rjz2,2012-3-1,2012,3,1,19,qcrst,self.gameofthrones,Season 2 Finale speculations. Spoilers ACOK ,https://www.reddit.com/r/gameofthrones/comments/qcrst/season_2_finale_speculations_spoilers_acok/,uziair,1330597591,"[Book Spoiler ACOK](/b ""Do guys think during this season finale instead of showing Jon and Halfhand talking about how Jon needs to betray him to survive and spy on the wildings for the watch. They should just show the fight without any background story. Making the tv fandom guessing for a year why the hell Jon do such a thing."")",17,16,False,self,,,,,
29,gameofthrones,t5_2rjz2,2012-3-1,2012,3,1,19,qcs6f,wallbase.cc,Awesome map of the Seven Kingdoms of Westeros (possible spoilers),https://www.reddit.com/r/gameofthrones/comments/qcs6f/awesome_map_of_the_seven_kingdoms_of_westeros/,Quickdust,1330598788,,3,0,False,default,,,,,
30,gameofthrones,t5_2rjz2,2012-3-1,2012,3,1,19,qcsal,i.imgur.com,(ASOS spoilers) It would be awesome to have Robb POV chapters.,https://www.reddit.com/r/gameofthrones/comments/qcsal/asos_spoilers_it_would_be_awesome_to_have_robb/,[deleted],1330599123,,17,33,False,http://a.thumbs.redditmedia.com/5-uXtSoLmyliy_TB.jpg,,,,,
31,gameofthrones,t5_2rjz2,2012-3-1,2012,3,1,22,qcvbl,self.gameofthrones,What's the difference btw Wights and Others?!,https://www.reddit.com/r/gameofthrones/comments/qcvbl/whats_the_difference_btw_wights_and_others/,TheMagicalQuill,1330607691,,4,1,False,default,,,,,
32,gameofthrones,t5_2rjz2,2012-3-1,2012,3,1,23,qcxo4,images.wikia.com,"Since new seasons of ""Game of Thrones"" and ""Mad Men"" are both coming, I give you my casting choice for Melisandre.",https://www.reddit.com/r/gameofthrones/comments/qcxo4/since_new_seasons_of_game_of_thrones_and_mad_men/,officemonkey,1330612602,,7,0,False,http://f.thumbs.redditmedia.com/gWr4RlbgeLA5nRRq.jpg,,,,,
33,gameofthrones,t5_2rjz2,2012-3-2,2012,3,2,0,qcyi3,i.imgur.com,It's shit like this (guess I should post in a different subreddit next time),https://www.reddit.com/r/gameofthrones/comments/qcyi3/its_shit_like_this_guess_i_should_post_in_a/,Badmojoe,1330614029,,69,160,False,http://a.thumbs.redditmedia.com/5EtGpgNOR4vUWNZB.jpg,,,,,
34,gameofthrones,t5_2rjz2,2012-3-2,2012,3,2,0,qcyx1,self.gameofthrones,Amazon DVD shipping. ,https://www.reddit.com/r/gameofthrones/comments/qcyx1/amazon_dvd_shipping/,captain_croco,1330614684,When do the DVDs ship from amazon if you pre ordered them? Thanks in advance guys. ,7,1,False,self,,,,,
35,gameofthrones,t5_2rjz2,2012-3-2,2012,3,2,0,qcyxn,self.gameofthrones,Does anyone else have a Love/Hate conflict with  Cersei?,https://www.reddit.com/r/gameofthrones/comments/qcyxn/does_anyone_else_have_a_lovehate_conflict_with/,Rendez,1330614708,"I find myself loving Cersei's chapters and am desperately eager to read some more, I dont always agree with her actions, but I do love her POV and I think it gives her such richness and development.  I know I cant be the only one, do any other redditors share my feelings?",57,41,False,self,,,,,
36,gameofthrones,t5_2rjz2,2012-3-2,2012,3,2,0,qczja,self.gameofthrones,Meme Request (ASOS Spoiler),https://www.reddit.com/r/gameofthrones/comments/qczja/meme_request_asos_spoiler/,[deleted],1330615563,"Someone should make a meme with Jon Snow that says ""I used to be an adventurer like you, then I took an arrow in the thigh and became the Lord Commander of the Night's Watch""",1,0,False,default,,,,,
37,gameofthrones,t5_2rjz2,2012-3-2,2012,3,2,0,qczt1,self.gameofthrones,Alton Lannister ,https://www.reddit.com/r/gameofthrones/comments/qczt1/alton_lannister/,Owlsome,1330615982,"I was poking around IMDB to see who they cast for the second season, and the name ""Alton Lannister"" came up. I'm almost finished ASOS, but I don't remember anyone by that name... Is this a show-only character like Ros, or am I forgetting someone important?",10,2,False,self,,,,,
38,gameofthrones,t5_2rjz2,2012-3-2,2012,3,2,1,qd16k,denofgeek.com,46 things we learned from the Game Of Thrones Blu-rays,https://www.reddit.com/r/gameofthrones/comments/qd16k/46_things_we_learned_from_the_game_of_thrones/,BigMike86,1330617915,,122,550,False,http://f.thumbs.redditmedia.com/wYRMeC9raMrSTpZ5.jpg,,,,,
39,gameofthrones,t5_2rjz2,2012-3-2,2012,3,2,2,qd53q,self.gameofthrones,"in honor of my (real life) name day, i am putting all my shirt designs on sale, incl. my winter is coming design!",https://www.reddit.com/r/gameofthrones/comments/qd53q/in_honor_of_my_real_life_name_day_i_am_putting/,mjc5077,1330623021,"As the title suggests, In honor of my name day, i decided to put my shirts on sale, on redbubble so more people have the oppurtunity to have one. Unfortunately the base price is set by the folks at redbubble. we can only increase our percentages, so I dropped mine for today, and the next few days depending on how the response goes. Id prefer people buying and enjoying my work rather than making a few extra bucks. 

[here are all my designs](http://www.redbubble.com/people/mjc5077/collections/81331-shirt-designs)

[Here is my jon and ghost design](http://www.redbubble.com/people/mjc5077/works/7448846-jon-and-ghost?c=81331-shirt-designs)",8,4,False,self,,,,,
40,gameofthrones,t5_2rjz2,2012-3-2,2012,3,2,2,qd5tw,i.imgur.com,What I use to listen to my ASOIAF audiobooks ;),https://www.reddit.com/r/gameofthrones/comments/qd5tw/what_i_use_to_listen_to_my_asoiaf_audiobooks/,fluffymuha,1330623936,,12,96,False,http://a.thumbs.redditmedia.com/pNB9daYhmiOGzXQr.jpg,,,,,
41,gameofthrones,t5_2rjz2,2012-3-2,2012,3,2,3,qd7ec,dailymail.co.uk,"Some of the ladies of GOT showing off their dresses 
at the GOT DVD launch party",https://www.reddit.com/r/gameofthrones/comments/qd7ec/some_of_the_ladies_of_got_showing_off_their/,Watanabex,1330625876,,26,18,False,http://d.thumbs.redditmedia.com/sqrSNjUzqlX4sMzu.jpg,,,,,
42,gameofthrones,t5_2rjz2,2012-3-2,2012,3,2,4,qd9p3,i.imgur.com,New HBO Poster,https://www.reddit.com/r/gameofthrones/comments/qd9p3/new_hbo_poster/,rdfiii,1330628638,,0,1,False,default,,,,,
43,gameofthrones,t5_2rjz2,2012-3-2,2012,3,2,4,qdb68,i.imgur.com,A Lannister always pays his debts (Pre-Ordered through Best Buy- Check out how much I got it for),https://www.reddit.com/r/gameofthrones/comments/qdb68/a_lannister_always_pays_his_debts_preordered/,[deleted],1330630357,,0,0,False,default,,,,,
44,gameofthrones,t5_2rjz2,2012-3-2,2012,3,2,4,qdbn5,imgur.com,Something awesome you probably missed,https://www.reddit.com/r/gameofthrones/comments/qdbn5/something_awesome_you_probably_missed/,[deleted],1330630962,,1,1,False,default,,,,,
45,gameofthrones,t5_2rjz2,2012-3-2,2012,3,2,4,qdbpa,self.gameofthrones,Are the Dunk and Egg Tales worth reading if you loved the 5 books?,https://www.reddit.com/r/gameofthrones/comments/qdbpa/are_the_dunk_and_egg_tales_worth_reading_if_you/,HoustonTexan,1330631034,I'm reading Dance right now and I'm sad that this is the last in the series of A Song of Ice and Fire for the time being. I learned that there are 3 Dunk and Egg Tales books written about 90 years before A Song of Ice and Fire. Have any of you read them? Was it worth it?,14,10,False,self,,,,,
46,gameofthrones,t5_2rjz2,2012-3-2,2012,3,2,5,qde0k,i.imgur.com,The Stark Girls,https://www.reddit.com/r/gameofthrones/comments/qde0k/the_stark_girls/,r2002,1330633923,,371,832,False,http://c.thumbs.redditmedia.com/3HO7blHL46H8lEYz.jpg,,,,,
47,gameofthrones,t5_2rjz2,2012-3-2,2012,3,2,5,qdf2w,quickmeme.com,Its Coming!,https://www.reddit.com/r/gameofthrones/comments/qdf2w/its_coming/,[deleted],1330635152,,1,0,False,default,,,,,
48,gameofthrones,t5_2rjz2,2012-3-2,2012,3,2,6,qdhbo,self.gameofthrones,Do I really have to???,https://www.reddit.com/r/gameofthrones/comments/qdhbo/do_i_really_have_to/,Br3akdown,1330637693,"Ive watched the series about 4 times all the way through because of getting different friends into it. I love it. The show was the first I had heard of the series though.

After finishing the first time, I NEEDED to know more and continue. I decided I would read the book, but have been pretty busy and am moving. Whenever I try to get into it, I just cant. Knowing whats going to happen already really drains the fun out it for me, and I find more important things to do.

Is it really that bad for me to just start the second book? Would anyone be willing to jsut tell me the big differences to help me transition better into the second book?

EDIT: I should have said over the last month or so, I have pushed myself half way through the books, and there are some parts that make think ""BOOK SOO GOOD KEEP GOING!"" But then there are just too many times where I find myself skimming paragraphs because I know whats going to happen and its only hindering me.",20,0,False,self,,,,,
49,gameofthrones,t5_2rjz2,2012-3-2,2012,3,2,6,qdhsg,youtube.com,GRRM season 1 commentary sample,https://www.reddit.com/r/gameofthrones/comments/qdhsg/grrm_season_1_commentary_sample/,d3m0n0id,1330638257,,10,31,False,http://b.thumbs.redditmedia.com/yf4pWsnzR254fd9m.jpg,,,,,
50,gameofthrones,t5_2rjz2,2012-3-2,2012,3,2,7,qdkg2,imgur.com,Awesome Easter Egg from Season 1 (TV Show Spoiler),https://www.reddit.com/r/gameofthrones/comments/qdkg2/awesome_easter_egg_from_season_1_tv_show_spoiler/,aspbergerinparadise,1330641322,,11,69,False,http://d.thumbs.redditmedia.com/UmOOr2W_4D_DFO3K.jpg,,,,,
51,gameofthrones,t5_2rjz2,2012-3-2,2012,3,2,7,qdknh,qkme.me,I hate those OCD moments,https://www.reddit.com/r/gameofthrones/comments/qdknh/i_hate_those_ocd_moments/,UsernameTaken321,1330641578,,38,140,False,http://a.thumbs.redditmedia.com/eAiqXIreH3YQ7oMZ.jpg,,,,,
52,gameofthrones,t5_2rjz2,2012-3-2,2012,3,2,7,qdlk9,mememaker.net,MemeMaker.net - Meme Maker - BRACE YOURSELF Dalight saving time will be here soon,https://www.reddit.com/r/gameofthrones/comments/qdlk9/mememakernet_meme_maker_brace_yourself_dalight/,d3wayne,1330642597,,0,0,False,default,,,,,
53,gameofthrones,t5_2rjz2,2012-3-2,2012,3,2,8,qdnop,accesshollywood.com,"Access Countdown To Game Of Thrones Season 2 Q&amp;A: Tom Wlaschiha Talks Jaqen Hghar
",https://www.reddit.com/r/gameofthrones/comments/qdnop/access_countdown_to_game_of_thrones_season_2_qa/,bobosaurs,1330645213,,8,16,False,http://d.thumbs.redditmedia.com/2A_OPb547ih2z4Z9.jpg,,,,,
54,gameofthrones,t5_2rjz2,2012-3-2,2012,3,2,8,qdoda,imgur.com,Was reading AFFC when we drove past this,https://www.reddit.com/r/gameofthrones/comments/qdoda/was_reading_affc_when_we_drove_past_this/,[deleted],1330646109,,0,1,False,default,,,,,
55,gameofthrones,t5_2rjz2,2012-3-2,2012,3,2,9,qdop7,i.imgur.com,I thought you guys would enjoy this small exhibit in Wisconsin,https://www.reddit.com/r/gameofthrones/comments/qdop7/i_thought_you_guys_would_enjoy_this_small_exhibit/,Jackpot96,1330646498,,4,0,False,http://a.thumbs.redditmedia.com/ZARlEkFT5GAQKC9Z.jpg,,,,,
56,gameofthrones,t5_2rjz2,2012-3-2,2012,3,2,9,qdp4p,i.imgur.com,How I feel when I 'accidentally' hover over a spoiler from a book I am yet to read,https://www.reddit.com/r/gameofthrones/comments/qdp4p/how_i_feel_when_i_accidentally_hover_over_a/,seanisgod,1330647025,,15,216,False,http://f.thumbs.redditmedia.com/3QPmQrLVsyaGh9YG.jpg,,,,,
57,gameofthrones,t5_2rjz2,2012-3-2,2012,3,2,9,qdper,imgur.com,We found king's landing!,https://www.reddit.com/r/gameofthrones/comments/qdper/we_found_kings_landing/,gnarlyninja,1330647391,,4,14,False,default,,,,,
58,gameofthrones,t5_2rjz2,2012-3-2,2012,3,2,10,qdsrc,i.imgur.com,Ian McNeice as Illyrio in the unaired original GoT Pilot episode,https://www.reddit.com/r/gameofthrones/comments/qdsrc/ian_mcneice_as_illyrio_in_the_unaired_original/,[deleted],1330651630,,22,62,False,http://a.thumbs.redditmedia.com/MS7pI_tcdDerkcmT.jpg,,,,,
59,gameofthrones,t5_2rjz2,2012-3-2,2012,3,2,10,qdt42,grrm.livejournal.com,Game of Thrones MMORPG to be made (Not Cyanide this time!),https://www.reddit.com/r/gameofthrones/comments/qdt42/game_of_thrones_mmorpg_to_be_made_not_cyanide/,[deleted],1330652056,,0,1,False,default,,,,,
60,gameofthrones,t5_2rjz2,2012-3-2,2012,3,2,10,qdu83,gameofthrones.wikia.com,Did the pilot episode ever get aired or is it online or on the blu-rays?,https://www.reddit.com/r/gameofthrones/comments/qdu83/did_the_pilot_episode_ever_get_aired_or_is_it/,steloshow,1330653420,,5,7,False,http://f.thumbs.redditmedia.com/gqaBAYlnoI8plnj_.jpg,,,,,
61,gameofthrones,t5_2rjz2,2012-3-2,2012,3,2,11,qduk0,self.gameofthrones,"I just watched ""A Golden Crown"" and...",https://www.reddit.com/r/gameofthrones/comments/qduk0/i_just_watched_a_golden_crown_and/,ratatatar,1330653840,"Holy shit.  I mean........... 
*ho
*ly.
*shit.
Fucking awesome.

That is all.",10,1,False,self,,,,,
62,gameofthrones,t5_2rjz2,2012-3-2,2012,3,2,11,qdvdq,grrm.livejournal.com,"""Yes, Virginia, it's true... there is going to be a GAME OF THRONES MMORPG""",https://www.reddit.com/r/gameofthrones/comments/qdvdq/yes_virginia_its_true_there_is_going_to_be_a_game/,DrJulianBashir,1330654906,,14,12,False,default,,,,,
63,gameofthrones,t5_2rjz2,2012-3-2,2012,3,2,11,qdwv3,self.gameofthrones,"Conversation in the Dungeons (Spoilers and 
Speculation within)",https://www.reddit.com/r/gameofthrones/comments/qdwv3/conversation_in_the_dungeons_spoilers_and/,You-Can-Quote-Me,1330656761,"**Edited for spelling and to add the following disclaimer: The spoilers within my post are all marked but the comments below may include spoilers FROM ALL BOOKS. Be warned.**

During a re-watch of the series I noticed just how different the conversation in the dungeons between the two conspirators is then how it was in the book. The main difference being the ending. [Spoiler Book and Show](/b ""In the Book the conversation ends with Varys asking Illyrio for more gold and more birds - the part about 'Delay you say, Hasten I reply' is still in the show, but in the show the conversation ends with Varys saying 'This is no longer a game for two players' and Illyrio responding with 'It never was'"")  Now please, correct me if I am mistaken - a friend has my copy of book one so I cannot verify - but I don't recall that part being mentioned in the book. My [Speculation](/g ""Is that this is further hint/tease for Ned being alive. In the books Arya never actually witnesses it, Cersi and Sansa are stated as actually being farther away and at an awkward angle and it's even mentioned how only the profile matches Ned Stark's, that the face is different. Also I recall that in one of the books"")[aSoS](/b ""Bran has a dream about his father but when he wakes he convinces himself that it was stupid and just a normal dream because his father is dead"") It's very convoluted I know, unlikely, but why change that part of the conversation in the show if there wasn't a reason for it?

TL;DR [Speculation](/g ""I ~~suspect~~ am probably imagining things that aren't there which suggest Ned is still alive based on a conversation being changed, a dream and my own desire."")",27,2,False,self,,,,,
64,gameofthrones,t5_2rjz2,2012-3-2,2012,3,2,14,qe3ey,self.gameofthrones,how did you vision stannis?,https://www.reddit.com/r/gameofthrones/comments/qe3ey/how_did_you_vision_stannis/,[deleted],1330665689,"i just watched the new GOT trailer (which can be seen here-http://www.youtube.com/watch?v=X66PDW1Mjf8)
i have to say that stannis looks nothing like i imagined him to be and i was interested to know how you guys imagined him. this how i imagined him http://cdn.screenrant.com/wp-content/uploads/pirates-of-the-caribbean-4-on-stranger-tides-ian-mcshane-as-blackbeard.jpg (without the filthy mullet)",31,8,False,default,,,,,
65,gameofthrones,t5_2rjz2,2012-3-2,2012,3,2,15,qe59e,self.gameofthrones,How long does a raven take to fly from one place to another?,https://www.reddit.com/r/gameofthrones/comments/qe59e/how_long_does_a_raven_take_to_fly_from_one_place/,[deleted],1330668525,"I've heard before that Westeros is supposed to be the size of South America or something? And I think in the first episode, when Cersei and the King's caravan arrive in Winterfell from Kings Landing, she mentions that they had been on the road for a month. Are there any other things like this mentioned in the books?

I wonder because, for example, episode 10 begins with [TV Spoiler](/s ""news of Ned's death in Winterfell."") Although this is shown immediately after it happens, it must be some time in the future because of the time it takes the ravens to get there. Of course it makes sense to just skip ahead in time and show that, but I also like how in Clash of Kings, [ACOK Spoiler](/b ""Dany finally hears news from Westeros -- King Robert's death. Of course a lot had happened since then, but being so far east, there is quite a delay."") I like this realism. It's a lot more believable than when someone dies at the end of one chapter, and the next chapter begins with someones reaction from 1000 miles away.

I went off topic. My question is how big is Westeros, and what are some examples of how long it takes for people/ravens to travel from city to city?",4,3,False,default,,,,,
