,sbr,sbr_id,date,year,month,hour,day,id,domain,title,full_link,author,created,selftext,num_comments,score,over_18,thumbnail,media_provider,media_thumbnail,media_title,media_description,media_url
0,deeplearning,t5_2t5eh,2018-2-1,2018,2,1,10,7ufaf2,medium.com,Intuitive and practical guide for building neural networks from scratch: Using perceptrons to solve university acceptance problem,https://www.reddit.com/r/deeplearning/comments/7ufaf2/intuitive_and_practical_guide_for_building_neural/,hackintoshrao,1517450321,,0,4,False,https://b.thumbs.redditmedia.com/IUjLTAVmJj_dOZymaP-6wVcSjEcL3fdjN9OII4zCvoo.jpg,,,,,
1,deeplearning,t5_2t5eh,2018-2-1,2018,2,1,19,7uhvb5,medium.com,Detecting cancer with neural networks fast and easy,https://www.reddit.com/r/deeplearning/comments/7uhvb5/detecting_cancer_with_neural_networks_fast_and/,roman-kh,1517481034,,0,9,False,https://b.thumbs.redditmedia.com/Ne8r9OH4Izw6WZA-p2sTckpVg_vg6sNOzDZN_Hz3XsY.jpg,,,,,
2,deeplearning,t5_2t5eh,2018-2-1,2018,2,1,23,7uj9na,blogs.technet.microsoft.com,Hearing AI: Getting Started with Deep Learning for Audio on Azure,https://www.reddit.com/r/deeplearning/comments/7uj9na/hearing_ai_getting_started_with_deep_learning_for/,friscotime,1517497120,,0,2,False,default,,,,,
3,deeplearning,t5_2t5eh,2018-2-2,2018,2,2,8,7umxno,self.deeplearning,Anyone knows a open-source deep / machine learning for sentiment analysis.,https://www.reddit.com/r/deeplearning/comments/7umxno/anyone_knows_a_opensource_deep_machine_learning/,YahooGuys,1517526751,[removed],0,1,False,default,,,,,
4,deeplearning,t5_2t5eh,2018-2-2,2018,2,2,11,7uo5yg,engineering.curalate.com,A Case Study of Deep Metric Embedding,https://www.reddit.com/r/deeplearning/comments/7uo5yg/a_case_study_of_deep_metric_embedding/,databas,1517538568,,0,8,False,https://b.thumbs.redditmedia.com/rW59uQOwncC0Znk7csm05kvqKsi_hyZ4tiKktvEUdRo.jpg,,,,,
5,deeplearning,t5_2t5eh,2018-2-2,2018,2,2,17,7uq2wp,self.deeplearning,LSTM for time series forecasting with H20.ai,https://www.reddit.com/r/deeplearning/comments/7uq2wp/lstm_for_time_series_forecasting_with_h20ai/,padfootedHighlander,1517561837,"I want to implement a time-series prediction model using LSTMs like the one mentioned here: https://machinelearningmastery.com/time-series-prediction-lstm-recurrent-neural-networks-python-keras/

The model works pretty well using a similar Keras code above, though I want to implement the same using H20.ai

This [documentation here on H2O Deep Water](http://docs.h2o.ai/h2o/latest-stable/h2o-docs/data-science/deep-learning.html) says ""The H2O Deep Water project supports CNNs and **RNNs** though third-party integrations of other deep learning libraries such as TensorFlow, Caffe and MXNet."". Though there are no demos for the same. 

In this conversation here in Jan '16 on ['Recurrent Neural Networks in H2O for time series prediction?'](https://groups.google.com/forum/#!topic/h2ostream/qU2FezMCyW8), they say it hasn't been implemented yet.

Any advice or links to similar implementations on H2O would be deeply appreciated  
Thank You",2,1,False,self,,,,,
6,deeplearning,t5_2t5eh,2018-2-2,2018,2,2,22,7ur9pb,kdnuggets.com,Understanding Learning Rates and How It Improves Performance in Deep Learning,https://www.reddit.com/r/deeplearning/comments/7ur9pb/understanding_learning_rates_and_how_it_improves/,chris_shpak,1517577985,,2,8,False,https://b.thumbs.redditmedia.com/fECrvAbQRLZlKJ2HoM8hH6T_xifli78PCoKHl6tGsoY.jpg,,,,,
7,deeplearning,t5_2t5eh,2018-2-3,2018,2,3,4,7utrgb,facebook.com,AI Weekly 2 Feb 2018,https://www.reddit.com/r/deeplearning/comments/7utrgb/ai_weekly_2_feb_2018/,TomekB,1517599309,,0,3,False,https://b.thumbs.redditmedia.com/8XI28j5tWKFP6tiNr1bNbNwN1VICX9PXcuxd974mi4w.jpg,,,,,
8,deeplearning,t5_2t5eh,2018-2-3,2018,2,3,8,7uvivb,quora.com,Is it a good idea to switch from Pytorch to TensorFlow Eager?,https://www.reddit.com/r/deeplearning/comments/7uvivb/is_it_a_good_idea_to_switch_from_pytorch_to/,real_charlie_parker,1517613995,,8,7,False,default,,,,,
9,deeplearning,t5_2t5eh,2018-2-4,2018,2,4,6,7v22l8,self.deeplearning,Opening TensorFlow .pb model,https://www.reddit.com/r/deeplearning/comments/7v22l8/opening_tensorflow_pb_model/,[deleted],1517691754,[deleted],0,1,False,default,,,,,
10,deeplearning,t5_2t5eh,2018-2-4,2018,2,4,22,7v6nir,self.deeplearning,"A DL version of HSTracker (i.e. ""watching"" a video card game)",https://www.reddit.com/r/deeplearning/comments/7v6nir/a_dl_version_of_hstracker_ie_watching_a_video/,giantgrothe,1517750057,"NOTE: I have only minimal experience with DL but have been writing code for 20+ years - I am *very* interested in learning more about DL and thought the following might be a fun pet project for me.

I have video recordings of hundreds of games of [Hearthstone](https://playhearthstone.com/en-us/). [typical gameplay](https://www.youtube.com/watch?v=4W_LdRIWN_g).

I thought it would fun to see if, using only the video as input, I could build a DNN that would automatically tell me which player played which card, in order, throughout the game.

I realize that in many ways this is a straightforward object detection problem which doesn't require DL. The cards played by both players are clearly displayed (upper-left for the opponent, lower-right for the current player). But it *could* though... right? Also, there is a lot of other information embedded in the video: which creatures attacked other creatures, the specific damage done, which spells were played and their targets, etc.

[HSTracker](https://hsdecktracker.net) already does some of the above by injecting into the Hearthstone process and monitoring it from within. But again, I think it would be a fun way for me way to jump into DL.

Input: video file

Output: detailed gameplay information

I can easily obtain graphics of each card. Also, it would be fine to start with only a limited set of cards (e.g. the same deck played against each other).

So... where would you suggest I start? A CNN that takes in each frame of the video and predicts which card(s) are visible, etc.?

TIA
",4,2,False,self,,,,,
11,deeplearning,t5_2t5eh,2018-2-5,2018,2,5,6,7v9kfg,self.deeplearning,"Pre Crime Comes 2 ""Life"" ?!",https://www.reddit.com/r/deeplearning/comments/7v9kfg/pre_crime_comes_2_life/,HouseOfOZz,1517778117,https://twitter.com/Wicked_Mercy/status/960241763444289538?ref_src=twcamp%5Eshare%7Ctwsrc%5Em5%7Ctwgr%5Eemail%7Ctwcon%5E7046%7Ctwterm%5E1 ,0,0,False,self,,,,,
12,deeplearning,t5_2t5eh,2018-2-5,2018,2,5,8,7valxe,medium.com,Installation of CUDA Toolkit on Linux A short guideline for installation of CUDA Toolkit 9.1 on Ubuntu 17.10,https://www.reddit.com/r/deeplearning/comments/7valxe/installation_of_cuda_toolkit_on_linux_a_short/,Y4Rv1K,1517787521,,0,3,False,https://b.thumbs.redditmedia.com/5gF49EJpWFyCuRweXw-NXr5grMjUtXfGNQ3cuH9JGdc.jpg,,,,,
13,deeplearning,t5_2t5eh,2018-2-5,2018,2,5,17,7vdevg,oreilly.com,Logo detection using Apache MXNet,https://www.reddit.com/r/deeplearning/comments/7vdevg/logo_detection_using_apache_mxnet/,digitalson,1517818768,,0,2,False,https://b.thumbs.redditmedia.com/IvPmlrtBr1-AqVf8qnx_5pViDiYULHHwyxXKrPqbYpA.jpg,,,,,
14,deeplearning,t5_2t5eh,2018-2-5,2018,2,5,17,7vdju4,self.deeplearning,Has anyone worked with 512x512 images for classification?,https://www.reddit.com/r/deeplearning/comments/7vdju4/has_anyone_worked_with_512x512_images_for/,bhargava27,1517820875,"I was successful in training 224x224 images using densenets. My images are mostly chest X Rays (approx 100k images). I was able to get an AUC of 0.9 but when I train with 512X512 images using the same densenets the network is over fitting and wasn't able to learn as good as 224 images. My AUC dropped to 0.85.
Any suggestions on how I can improve the training on bigger images or is it still a big challenge in AI/ML?",5,6,False,self,,,,,
15,deeplearning,t5_2t5eh,2018-2-6,2018,2,6,0,7vfnq3,self.deeplearning,February issue of COMPUTER VISION NEWS [LINKS],https://www.reddit.com/r/deeplearning/comments/7vfnq3/february_issue_of_computer_vision_news_links/,Gletta,1517846198,"Here is the February 2018 issue of Computer Vision News, published by RSIP Vision: a 36-pages magazine about Computer Vision, Image Processing, Deep Learning and Artificial Intelligence. Don't miss the fascinating interview with Professor Roy Davies, one of the pioneers of our field. Free subscription at page 36.
HTML5 version (recommended) ==&gt; http://www.rsipvision.com/ComputerVisionNews-2018February/
and
PDF version ==&gt; http://www.rsipvision.com/computer-vision-news-2018-february-pdf/
Enjoy!",0,4,False,self,,,,,
16,deeplearning,t5_2t5eh,2018-2-6,2018,2,6,6,7vibzv,self.deeplearning,Finding a deep learning job after completing the Udacity Deep Learning nanodegree,https://www.reddit.com/r/deeplearning/comments/7vibzv/finding_a_deep_learning_job_after_completing_the/,itsmeomarj,1517867536,Hello. My name is Omar. I very recently completed the Udacity Deep Learning Nanodegree that they recently added to their list of Nanodegrees. I want to go out and start looking for a Junior Deep Learning Scientist position. Do anyone have any advice they can give me on how to go about looking for a deep learning job or things to look out for. I would really appreciate it.,7,6,False,self,,,,,
17,deeplearning,t5_2t5eh,2018-2-6,2018,2,6,8,7vj2or,youtube.com, From Artificial Intelligence to Machine Learning &amp; Deep Learning,https://www.reddit.com/r/deeplearning/comments/7vj2or/_from_artificial_intelligence_to_machine/,AhmedGadFCIT,1517873750,,0,1,False,default,,,,,
18,deeplearning,t5_2t5eh,2018-2-6,2018,2,6,15,7vlg3k,towardsdatascience.com,Convolutional Neural Networks For All | Part I  Towards Data Science,https://www.reddit.com/r/deeplearning/comments/7vlg3k/convolutional_neural_networks_for_all_part_i/,pmz,1517898020,,0,6,False,https://b.thumbs.redditmedia.com/CN1HD0VbOdHMIg-7dJleIY8nJrIIrrQRNaRcseBgEnA.jpg,,,,,
19,deeplearning,t5_2t5eh,2018-2-6,2018,2,6,16,7vls3v,towardsdatascience.com,Deep Learning summary for 2017: Machine Perception Developments,https://www.reddit.com/r/deeplearning/comments/7vls3v/deep_learning_summary_for_2017_machine_perception/,pmz,1517902540,,0,1,False,https://b.thumbs.redditmedia.com/t_EsPeIdQgTm9kG891i1rJsguwO39GVGwPJIKv_Zbkk.jpg,,,,,
20,deeplearning,t5_2t5eh,2018-2-6,2018,2,6,20,7vmt24,thenextweb.com,"This technology, called RadIO, is freely available for anyone (https://github.com/analysiscenter/radio). And while it doesnt represent a magical cancer detection button, it will almost certainly save lives.",https://www.reddit.com/r/deeplearning/comments/7vmt24/this_technology_called_radio_is_freely_available/,roman-kh,1517917642,,0,1,False,https://a.thumbs.redditmedia.com/CEdqhjDpe1bHdj08tz5-AOflC-qEW8jt3G_jDy1FOJ0.jpg,,,,,
21,deeplearning,t5_2t5eh,2018-2-6,2018,2,6,21,7vmwmu,datascience.com,"Understanding AI, Machine Learning, and Deep Learning",https://www.reddit.com/r/deeplearning/comments/7vmwmu/understanding_ai_machine_learning_and_deep/,chris_shpak,1517918935,,0,1,False,https://b.thumbs.redditmedia.com/mMfeIuG8RlCoJvVgVYYpkLcLF4t_LrQYdiL2IWdgIus.jpg,,,,,
22,deeplearning,t5_2t5eh,2018-2-6,2018,2,6,21,7vn1fx,self.deeplearning,Face recognition.,https://www.reddit.com/r/deeplearning/comments/7vn1fx/face_recognition/,parthiv9,1517920639,"Hey I know the basic understanding of neural networks.
I want to prepare face detection by my own.
So where should I start and which data set should I use ?",4,1,False,self,,,,,
23,deeplearning,t5_2t5eh,2018-2-7,2018,2,7,3,7vpiu7,self.deeplearning,"The human brain has roughly 100bn neurones, with each connecting to up to roughly 1000 neighbours - how do current neural networks compare to this?",https://www.reddit.com/r/deeplearning/comments/7vpiu7/the_human_brain_has_roughly_100bn_neurones_with/,FIREATWlLL,1517942689,Title.,7,2,False,self,,,,,
24,deeplearning,t5_2t5eh,2018-2-7,2018,2,7,12,7vt7y6,self.deeplearning,Is regularisation needed If I have more than 10B samples?,https://www.reddit.com/r/deeplearning/comments/7vt7y6/is_regularisation_needed_if_i_have_more_than_10b/,[deleted],1517974052,[deleted],0,1,False,default,,,,,
25,deeplearning,t5_2t5eh,2018-2-7,2018,2,7,12,7vtaet,self.deeplearning,Is regularization needed if I have a lot of data (&gt;10B samples),https://www.reddit.com/r/deeplearning/comments/7vtaet/is_regularization_needed_if_i_have_a_lot_of_data/,pythomad,1517974709,"Hello, I am working on a computer vision problem and I have a metric ton of data so I was thinking not to apply regularization (l2, dropout,etc..) as the model would never see the same sample twice, Should I do that or not, If so why?
,thank you",3,5,False,self,,,,,
26,deeplearning,t5_2t5eh,2018-2-7,2018,2,7,17,7vumri,github.com,Visual Feature Attribution Using Wasserstein GANs (with Python and Pytorch),https://www.reddit.com/r/deeplearning/comments/7vumri/visual_feature_attribution_using_wasserstein_gans/,[deleted],1517990912,[deleted],0,1,False,default,,,,,
27,deeplearning,t5_2t5eh,2018-2-7,2018,2,7,19,7vva0m,medium.com,Neural Spelling Corrections and the Importance of Accuracy,https://www.reddit.com/r/deeplearning/comments/7vva0m/neural_spelling_corrections_and_the_importance_of/,chris_shpak,1518000352,,0,5,False,https://b.thumbs.redditmedia.com/UkmGCQ9kAnoehVPNNVx6f41jYM7h-pWeVjdZ6ZrCCmQ.jpg,,,,,
28,deeplearning,t5_2t5eh,2018-2-7,2018,2,7,19,7vvasb,self.deeplearning,Video recognition,https://www.reddit.com/r/deeplearning/comments/7vvasb/video_recognition/,ItIsOkSuraj,1518000632,"Can anybody give some ideas to dig for video recognition? Let's say we've to classify a human walking or jumping. Training a model using static images won't work. 

P.s. Please tell me about the layers of CNN which I should use and why.",6,2,False,self,,,,,
29,deeplearning,t5_2t5eh,2018-2-7,2018,2,7,21,7vvt19,kdnuggets.com,5 Fantastic Practical Machine Learning Resources,https://www.reddit.com/r/deeplearning/comments/7vvt19/5_fantastic_practical_machine_learning_resources/,trumtra,1518007166,,0,1,False,default,,,,,
30,deeplearning,t5_2t5eh,2018-2-7,2018,2,7,21,7vvwki,exastax.com,Internet of Things and Data Visualization,https://www.reddit.com/r/deeplearning/comments/7vvwki/internet_of_things_and_data_visualization/,y-emre,1518008296,,0,1,False,https://b.thumbs.redditmedia.com/ZDf8i-uKRUrahbxC37IZmnKbbbOKQtopj7HDeTroqdY.jpg,,,,,
31,deeplearning,t5_2t5eh,2018-2-8,2018,2,8,8,7w0909,self.deeplearning,Broken screen detection help!,https://www.reddit.com/r/deeplearning/comments/7w0909/broken_screen_detection_help/,lokeshsonii,1518044420,"I wassolving a problem recently for an insurance company inwhich I have to build a model to classify a Phone screen into broken or non brokenfollowed bytempered vs screen glass classification. I have triedlot of fine tuning with different architectures but it seems that the models are Biased towards one class I spite of the training data containing equal no of classes. As both the classes are very identical.

Can you please help me out?
Im attaching training data link
https://www.dropbox.com/sh/7vt0fdpawzj3znm/AABQPT7BDGyjC105HBj0aJZqa?dl=0

Thankyou so very much",12,1,False,self,,,,,
32,deeplearning,t5_2t5eh,2018-2-8,2018,2,8,11,7w1hvr,self.deeplearning,"Noob ?: Difference between &gt;= ""level"", and deep learning",https://www.reddit.com/r/deeplearning/comments/7w1hvr/noob_difference_between_level_and_deep_learning/,DelosBoard2052,1518055866,"Apologies, complete noob, not even sure what to search to get this answer, but - I want to understand the following:

In the example where I want to have a chatbot, for example, understand what a ""cold"" temperature is, vs a ""hot"" temperature, standard programming is easy.  After I use NLTK (for example) and REs to determine that the respondent is stating a temperature value, it is very easy to simply use a comparison, if t &lt; 60, for example (F obviously), then it is ""cold"".  If t &gt; 80 then it is ""hot"", else it's ""comfortable"".  But how can I NOT do this with deep learning.  How do I train a neural net (say I'm using TensorFlow or SciKit Learn?) to know this distinction without setting a simple if/then/else comparison?

Thanks for your help and patience.
",3,0,False,self,,,,,
33,deeplearning,t5_2t5eh,2018-2-8,2018,2,8,14,7w2njt,self.deeplearning,Can DL write an efficient sorting algorithm?,https://www.reddit.com/r/deeplearning/comments/7w2njt/can_dl_write_an_efficient_sorting_algorithm/,xiaodai,1518068001,"I have a stat background but no DL experience. I  have been thinking about whether DL can be applied to write a sorting algorithm for integers. 

I think I can supply alot of arrays and define all the atomic operations you can apply to an array e.g. swaps, and atomic operations you can apply to the elements e.g. &lt;&lt; &gt;&gt; etc. Then I ""guide"" the DL machine towards sorted array i.e. reward it if it makes the array more sorted; I also reward if it does it faster than quicksort or for getting close to quicksort for performance.  Over time it should have developed an algorithms that can sort arrays fast.

Do you think it will work? ",6,0,False,self,,,,,
34,deeplearning,t5_2t5eh,2018-2-8,2018,2,8,16,7w3abc,self.deeplearning,Suggestions for a neural network that contains groupings?,https://www.reddit.com/r/deeplearning/comments/7w3abc/suggestions_for_a_neural_network_that_contains/,NeuralNetHelp,1518076345,"Ive been working on a fairly complex problem, but may have reached the lowest MSE possible for the data, but need it lower. I thought I would ask the community for any ideas as some additional experience could help.

The inputs:

Y = A (relatively small) continuous variable.  EX: -15.000 to 15.000 but some outliers going much higher (~50).

X= *multiple properties referring to an object
*multiple properties referring to a replacement for that object
*multiple properties referring to nearby objects as well as their distance to the initial object/replacement.

There are ~65-70 features, no categoricals for the groups (but could be), properties can be the same if the objects are the same, and over 10k rows. 

With Keras (sequential/dense), the data is input all together. The 3 layers start large ( ~250 and fan down to ~100. Relu function, Adam or Nadam optimizer, uniform kernel initiation, 50 batch size and the lowest MSE (0.5-7) at 250-350 epochs. Only ~50% of the predicted Y are near the actual Y. 

It could potentially be getting caught in a minima, which I am not sure just yet how to fix exactly as I havent had a problem like this previously.  Would definitely be glad to hear any suggestions the community has. 

Edit: Should also mention that different parameters don't affect the MSE or custom accuracy much. ",6,1,False,self,,,,,
35,deeplearning,t5_2t5eh,2018-2-8,2018,2,8,20,7w48ne,towardsdatascience.com,How to learn Deep Learning in 6 months,https://www.reddit.com/r/deeplearning/comments/7w48ne/how_to_learn_deep_learning_in_6_months/,petrwilson,1518090372,,7,12,False,https://a.thumbs.redditmedia.com/Vgkg_qTlwF8ld4U20GO1FCOMZx4FpbfcfgFFpERURJ8.jpg,,,,,
36,deeplearning,t5_2t5eh,2018-2-8,2018,2,8,21,7w4g29,blog.godatadriven.com,Deep Learning for Sentiment Classification,https://www.reddit.com/r/deeplearning/comments/7w4g29/deep_learning_for_sentiment_classification/,janemoz,1518092993,,0,1,False,default,,,,,
37,deeplearning,t5_2t5eh,2018-2-9,2018,2,9,15,7wbqri,self.deeplearning,NOOB: What should my loss graph look like if I have a low number layers?,https://www.reddit.com/r/deeplearning/comments/7wbqri/noob_what_should_my_loss_graph_look_like_if_i/,pythomad,1518159445,"I know If I have too many layers the graph should display the loss decreasing then bouncing back up, but my loss graph looks like [this](https://imgur.com/a/DcWXK) 
what does that mean?
,thank you",5,3,False,self,,,,,
38,deeplearning,t5_2t5eh,2018-2-9,2018,2,9,20,7wcwqs,dzone.com,Predicting Cancer Type With KNIME Deep Learning and Keras,https://www.reddit.com/r/deeplearning/comments/7wcwqs/predicting_cancer_type_with_knime_deep_learning/,chris_shpak,1518176843,,0,1,False,https://b.thumbs.redditmedia.com/udPoTTCfdst6K424WkZChmySq82CaqatecXz_3V_n8c.jpg,,,,,
39,deeplearning,t5_2t5eh,2018-2-9,2018,2,9,21,7wd3x5,kdnuggets.com,Fast.ai Lesson 1 on Google Colab (Free GPU),https://www.reddit.com/r/deeplearning/comments/7wd3x5/fastai_lesson_1_on_google_colab_free_gpu/,polllyyy,1518179343,,1,12,False,https://b.thumbs.redditmedia.com/8FHydMjNvWHxBQT0Y9113lc_6CJ6JCiNL1Z1wC_yLxo.jpg,,,,,
40,deeplearning,t5_2t5eh,2018-2-9,2018,2,9,21,7wd7e5,kdnuggets.com,My Journey into Deep Learning,https://www.reddit.com/r/deeplearning/comments/7wd7e5/my_journey_into_deep_learning/,chris_shpak,1518180476,,0,1,False,https://b.thumbs.redditmedia.com/ltwIqrjQEmFg1jWQHYnsGsYcuY6d4yPXYCyCv1XkDUE.jpg,,,,,
41,deeplearning,t5_2t5eh,2018-2-9,2018,2,9,23,7wduxy,self.deeplearning,Where to start for Text Summarizer,https://www.reddit.com/r/deeplearning/comments/7wduxy/where_to_start_for_text_summarizer/,atulsingh0,1518187410,I have to design a text Summarizer tool in Python/NLP/DL but need some guidance there. I have started with Standford course CS224d. Please add what else I have to study or look into for being able to develop this tool. ,3,1,False,self,,,,,
42,deeplearning,t5_2t5eh,2018-2-10,2018,2,10,2,7weugz,avclub.com,Deep learning technology is now being used to put Nic Cage in every movie,https://www.reddit.com/r/deeplearning/comments/7weugz/deep_learning_technology_is_now_being_used_to_put/,zemcunha,1518195853,,0,1,False,https://a.thumbs.redditmedia.com/gOoNItQP3RpLGN7MiosEgKHA7mpkZJow2K6wZt4u_w0.jpg,,,,,
43,deeplearning,t5_2t5eh,2018-2-10,2018,2,10,2,7wf26g,facebook.com,AI Weekly 9 Feb 2018,https://www.reddit.com/r/deeplearning/comments/7wf26g/ai_weekly_9_feb_2018/,TomekB,1518197583,,0,1,False,https://b.thumbs.redditmedia.com/THW8_yl7Y8XWOx5m1VGp5xhDi2LfbuYFvsAyQWvlHXY.jpg,,,,,
44,deeplearning,t5_2t5eh,2018-2-10,2018,2,10,9,7whwd9,self.deeplearning,"Loss hovers around 0.7, then jumps to 500,000+ once every epoch. Not on the same training sample either.",https://www.reddit.com/r/deeplearning/comments/7whwd9/loss_hovers_around_07_then_jumps_to_500000_once/,bonbonbaron,1518221975,"I'm implementing the YOLO network in Tensorflow (not the same network as Darkflow). The input data all makes sense, so... any idea what could be causing this???",1,2,False,self,,,,,
45,deeplearning,t5_2t5eh,2018-2-10,2018,2,10,18,7wkj4o,self.deeplearning,Testing the correctiveness of my ML Engine,https://www.reddit.com/r/deeplearning/comments/7wkj4o/testing_the_correctiveness_of_my_ml_engine/,el_drone,1518255048,"
Im learning about ML engines and testing them. I had a few questions on how to go about doing that. I have an ML engine which recommend what movies based on my list of recently watched movies.

My Questions, does anyone know any resources that would help me learn how to:

1. Test the correctiveness of my engine
2. How to train the model

Im more interested in #1

Essentially the workflow is:
[List of recently watched videos] &gt; [ML Engine] &gt; [Recommended Videos]

Resources or examples in python would be very helpful ",0,0,False,self,,,,,
46,deeplearning,t5_2t5eh,2018-2-10,2018,2,10,23,7wlsl4,self.deeplearning,f1score values goes to nan for few classes,https://www.reddit.com/r/deeplearning/comments/7wlsl4/f1score_values_goes_to_nan_for_few_classes/,harshadeepg27,1518273895,"input samples = (1044552, 17, 100)
output samples = (1044552,17, 10) 

using tensorflow - dynamic rnn - LSTM cell - with the below parameters:

word_dim= 100
sentence_length = 17
class_size = 10
rnn_size = 80
num_layers = 2
batch_size = 16
epoch = 500
lr = 0.0000001
decay = lr/epoch

the f1score it return is : 
[c1, c2, c3, c4, c5, c6, c7 , c8, c9 , c10] = 
[1, 0.99, 0.89, 0.98, 0.97,nan,nan,nan,nan,nan] .

AS you can see, the last four classes accuracy as in f1score is returning nan. 

could somebody tell me why this is happening. 

I have tried with different batch size, learning rate, rnn size but it still recurs and I dont why.
",2,1,False,self,,,,,
47,deeplearning,t5_2t5eh,2018-2-11,2018,2,11,0,7wlzzl,self.deeplearning,New course Practical Deep Learning with Keras and Python (x-post r/learnmachinelearning),https://www.reddit.com/r/deeplearning/comments/7wlzzl/new_course_practical_deep_learning_with_keras_and/,recluzestudy,1518276112,"Hi all,

I have just created a new course on Udemy called, ""Practical Deep Learning with Keras and Python"". This course tries to cover the gap left by many deep learning courses -- applying the models on non-toy examples. In my time as a university teacher teaching Machine Learning, I have repeatedly seen students come up to me and ask me why they are getting ""shape mismatch"" issues and how to prepare their data to feed to deep models. I have tried to cover the ""why"" of the concepts that starters struggle with (and not cover the whole deep learning curriculum for which there are already quite a few great courses.)

If you are new to deep learning and need a soft introduction, this might be a good place to start. If you have already taken a theory course and want to know how to use this amazing tool Keras, you only have to spend about 3 hours on this course. I sincerely believe this will be worth your time.

This is for complete newbies (either to ML/DL or to Keras). If you have had experience before (and are not struggling), it would not be worth your time.

Use this coupon for a discounted price of $12.99: https://www.udemy.com/practical-deep-learning-with-keras/?couponCode=REDDIT-QU-OFF

Hope you like it.",2,9,False,self,,,,,
