,sbr,sbr_id,date,year,month,hour,day,id,domain,title,full_link,author,created,selftext,num_comments,score,over_18,thumbnail,media_provider,media_thumbnail,media_title,media_description,media_url
89,deeplearning,t5_2t5eh,2018-2-19,2018,2,19,14,7ykki8,self.deeplearning,DAgger Explanation,https://www.reddit.com/r/deeplearning/comments/7ykki8/dagger_explanation/,sauhaarda,1519019649,"Anyone willing to break down/explain the DAgger algorithm in simpler terms? I'm not quite sure what it's doing from the paper:
https://www.cs.cmu.edu/~sross1/publications/Ross-AIStats11-NoRegret.pdf

Is it attempting to train a network based on a combination of perfect imitation behavior and the networks bad behavior? Or is it something different?",2,3,False,self,,,,,
90,deeplearning,t5_2t5eh,2018-2-19,2018,2,19,15,7ykm7o,self.deeplearning,Sampling,https://www.reddit.com/r/deeplearning/comments/7ykm7o/sampling/,niteshsekhar,1519020227,"Is there a way to get an informative sampling of 3d point clouds? while farthest point sampling does give a decent sample, is there any neural network implementation which can give a more informative sampling?",1,4,False,self,,,,,
91,deeplearning,t5_2t5eh,2018-2-19,2018,2,19,17,7ylb6l,mapreveal.com,Assemble and Configure Your Ubuntu 16.04 Server for Deep Learning,https://www.reddit.com/r/deeplearning/comments/7ylb6l/assemble_and_configure_your_ubuntu_1604_server/,chris_shpak,1519029455,,0,1,False,https://a.thumbs.redditmedia.com/A4f1IVrSfmqgBByxTjuO0IUv88BadJ1l-Vvo4xOY2z0.jpg,,,,,
92,deeplearning,t5_2t5eh,2018-2-19,2018,2,19,19,7ylnma,kdnuggets.com,7 Steps to Mastering Deep Learning with Keras,https://www.reddit.com/r/deeplearning/comments/7ylnma/7_steps_to_mastering_deep_learning_with_keras/,molode,1519034497,,2,11,False,https://b.thumbs.redditmedia.com/Wkj7xTrJ401fGBm5Jy5zAgNHEFM9jB_KIZV6nbHSmJY.jpg,,,,,
93,deeplearning,t5_2t5eh,2018-2-20,2018,2,20,1,7yntdp,youtube.com,Deep Learning for DNA Synthesis,https://www.reddit.com/r/deeplearning/comments/7yntdp/deep_learning_for_dna_synthesis/,alexmlamb,1519057552,,0,5,False,https://b.thumbs.redditmedia.com/_xbtuJ64LB03Xq1b_nrf-EA-MA1ck1MXQwOxG6wDYjY.jpg,,,,,
94,deeplearning,t5_2t5eh,2018-2-20,2018,2,20,4,7yp9lt,self.deeplearning,CORe50: a new Dataset and Benchmark for Continuous/Lifelong Object RecognitionNews (self.MachineLearning),https://www.reddit.com/r/deeplearning/comments/7yp9lt/core50_a_new_dataset_and_benchmark_for/,[deleted],1519068169,[deleted],0,1,False,default,,,,,
95,deeplearning,t5_2t5eh,2018-2-20,2018,2,20,9,7yrnmc,medium.com,Knowledge Graph Inference with Neural Embeddings,https://www.reddit.com/r/deeplearning/comments/7yrnmc/knowledge_graph_inference_with_neural_embeddings/,bsubs,1519086403,,0,6,False,https://b.thumbs.redditmedia.com/PNQm8alZNNLg-8R9QtObfz9rlFuUBJWeqDTkWG2vejE.jpg,,,,,
96,deeplearning,t5_2t5eh,2018-2-20,2018,2,20,21,7yvmed,jsideas.net,Which Continent Does Pyeongchang Belong To? LSTM models in PyTorch,https://www.reddit.com/r/deeplearning/comments/7yvmed/which_continent_does_pyeongchang_belong_to_lstm/,junkwhinger,1519130875,,1,3,False,https://a.thumbs.redditmedia.com/0VZROolE9zRMkDXOr_0TNYhmwrwHDtXeHPTsOqUgal0.jpg,,,,,
97,deeplearning,t5_2t5eh,2018-2-20,2018,2,20,23,7yw6x9,exastax.com,The Importance of Predictive Analytics for Your Business,https://www.reddit.com/r/deeplearning/comments/7yw6x9/the_importance_of_predictive_analytics_for_your/,y-emre,1519136350,,0,6,False,https://b.thumbs.redditmedia.com/KSSrx6p9YmVWcpnRfe_zflBYuEHaw5Gp1rPMkX3iIjo.jpg,,,,,
98,deeplearning,t5_2t5eh,2018-2-21,2018,2,21,1,7yx14v,datasciencecentral.com,Off the Beaten path  Using Deep Forests to Outperform CNNs and RNNs,https://www.reddit.com/r/deeplearning/comments/7yx14v/off_the_beaten_path_using_deep_forests_to/,psangrene,1519143006,,1,7,False,https://b.thumbs.redditmedia.com/dHAjB21DSU_C11wcPrYVC6eWOooYYFzxyNWMknVlAAk.jpg,,,,,
99,deeplearning,t5_2t5eh,2018-2-21,2018,2,21,1,7yx5t8,self.deeplearning,Introducing Capsule Networks by @aureliengeron via @OReillyMedia https://t.co/WEBdq2a5n5 #DeepLearning #NeuralNetworks,https://www.reddit.com/r/deeplearning/comments/7yx5t8/introducing_capsule_networks_by_aureliengeron_via/,iraquitan,1519143972,[removed],0,1,False,default,,,,,
100,deeplearning,t5_2t5eh,2018-2-21,2018,2,21,1,7yxcfy,self.deeplearning,CORe50: a new Dataset and Benchmark for Continuous/Lifelong Object Recognition,https://www.reddit.com/r/deeplearning/comments/7yxcfy/core50_a_new_dataset_and_benchmark_for/,Gengiolo,1519145287,"Dear all,

We are happy to announce that the CORe50 dataset from the paper CORe50: a new Dataset and Benchmark for Continuous Object Recognition (CoRL, 2017) is now publicly available at the link: https://vlomonaco.github.io/core50/

CORe50, specifically designed for Continuous/Lifelong Learning and Object Recognition, is a collection of more than 500 videos (30fps) of 50 domestic objects belonging to 10 different categories. Instance level granularity, temporal coherence, first-person point-of-view and very different environmental conditions and backgrounds (outdoor sessions included) is what makes CORe50 particularly useful for assessing Continuous Learning techniques.

On top of the CORe50 dataset we are also happy to release a 3-way benchmark with multiple baselines and a living leaderboard to keep track of the progresses made in this new exciting area! For downloading the code, the dataset, the benchmark and more, check out the official website https://vlomonaco.github.io/core50/

Vincenzo Lomonaco, PhD student @ University of Bologna",0,1,False,self,,,,,
101,deeplearning,t5_2t5eh,2018-2-21,2018,2,21,3,7yybc1,self.deeplearning,Navigation with End-to-End deep learning for Self driving cars,https://www.reddit.com/r/deeplearning/comments/7yybc1/navigation_with_endtoend_deep_learning_for_self/,scmmishra,1519152289,I am following this tutorial by Microsoft for AirSim: https://github.com/Microsoft/AutonomousDrivingCookbook/tree/master/AirSimE2EDeepLearning so far I have used Udacity simulator for a similar project. However this tutorial works for a scenario with just a single lane road without turns. How do I extend end to end learning where the car takes turns when required based on the destination it needs to go like in a city scenario (Assuming GPS singals can be emulated for the purpose).  Thanks in advance.,0,2,False,self,,,,,
102,deeplearning,t5_2t5eh,2018-2-21,2018,2,21,7,7z07e1,github.com,[project] Dynamic Neural Networks in Tensorflow,https://www.reddit.com/r/deeplearning/comments/7z07e1/project_dynamic_neural_networks_in_tensorflow/,Miejuib,1519165656,,1,5,False,https://b.thumbs.redditmedia.com/3MgWghiv8J8kYmbfY7UPPBjt9lYnpySF1Y3YlxsMcik.jpg,,,,,
103,deeplearning,t5_2t5eh,2018-2-21,2018,2,21,10,7z1fwd,self.deeplearning,CMU Deep Learning Course,https://www.reddit.com/r/deeplearning/comments/7z1fwd/cmu_deep_learning_course/,taurish,1519175532,"Carnegie Mellon's Deep Learning Course is being broadcasted for the first time this semester. So far we have had 9-10 lectures.
The class covers some topics that I haven't really seen in any other online course yet.

Lecturer: Bhiksha Raj

Channel link :https://www.youtube.com/channel/UC8hYZGEkI2dDO8scT8C5UQA/videos

Syllabus and Slides: http://deeplearning.cs.cmu.edu/",2,37,False,self,,,,,
104,deeplearning,t5_2t5eh,2018-2-21,2018,2,21,11,7z23xs,self.deeplearning,Votes needed for competition please!!,https://www.reddit.com/r/deeplearning/comments/7z23xs/votes_needed_for_competition_please/,py-guy,1519181172,"Hey Guys, my friend and I have been working on an autonomous drone project for a competition, if you can please take a look at our submission video an if you liked it please vote!! Heres the link https://challengerocket.com/as2399/TITUS-f18f33.html",0,0,False,self,,,,,
105,deeplearning,t5_2t5eh,2018-2-21,2018,2,21,17,7z450f,self.deeplearning,Porting Lua code with Torch7 and Loadcaffe to Python Jupyter Notebook?,https://www.reddit.com/r/deeplearning/comments/7z450f/porting_lua_code_with_torch7_and_loadcaffe_to/,rraallvv,1519202457,"I'd like to try some implementations of neural style transfer in Jupyter Notebook, the problem is that they are written in Lua and use Torch7 and Loadcaffe. So, I wonder what could I use to port the code to Python running on a Jupyter Notebook?",1,1,False,self,,,,,
106,deeplearning,t5_2t5eh,2018-2-21,2018,2,21,20,7z4zx7,kdnuggets.com,"Deep Learning Development with Google Colab, TensorFlow, Keras &amp; PyTorch",https://www.reddit.com/r/deeplearning/comments/7z4zx7/deep_learning_development_with_google_colab/,dearpetra,1519214025,,0,9,False,https://a.thumbs.redditmedia.com/UzS-HnZTGI2-lgHMTH7nGp0APBETT_N3xxGHSnehiS4.jpg,,,,,
107,deeplearning,t5_2t5eh,2018-2-21,2018,2,21,21,7z58vh,kdnuggets.com,"Neural Networks, Step 1: Where to Begin with Neural Nets &amp; Deep Learning",https://www.reddit.com/r/deeplearning/comments/7z58vh/neural_networks_step_1_where_to_begin_with_neural/,jackblun,1519216862,,0,12,False,https://b.thumbs.redditmedia.com/Cq_hmEbh2ye67-P1u8pVRV1OQ4_7a6AJTawE71l_3Aw.jpg,,,,,
108,deeplearning,t5_2t5eh,2018-2-22,2018,2,22,1,7z6pzb,research.baidu.com,Voice Cloning with only a few samples - Baidu,https://www.reddit.com/r/deeplearning/comments/7z6pzb/voice_cloning_with_only_a_few_samples_baidu/,fuckme,1519229904,,2,2,False,https://b.thumbs.redditmedia.com/B9SXvPvRrxLPIrRiGQLRJFjAQQwcyTyJijFQllucqxw.jpg,,,,,
109,deeplearning,t5_2t5eh,2018-2-22,2018,2,22,5,7z8rft,self.deeplearning,Deep learning with microphone and speaker,https://www.reddit.com/r/deeplearning/comments/7z8rft/deep_learning_with_microphone_and_speaker/,Tobaganner,1519244834,"So I have recently discovered deep learning, and was wondering if you could get a computer to learn language through you speaking into a microphone, maybe the reward for a proper word could be a response or something, just an idea",5,3,False,self,,,,,
110,deeplearning,t5_2t5eh,2018-2-22,2018,2,22,8,7za8oi,self.deeplearning,Order agnostic search,https://www.reddit.com/r/deeplearning/comments/7za8oi/order_agnostic_search/,the_bored_potato,1519256447,"I wish to implement a sampled softmax classification algorithm that classifies the given input to an item number. For example: 
ABCLS10PJ40 -&gt; Item 3

The user often makes a mistake in entering the input. Like they might confuse l with 1, or i with 1 or O with 0 or S with 5. Also, they might mess up the order in which the input is arranged, for example:
ABC3000P20 can sometimes be put in like 3000ABC20P or 3000ABCP20.

I thought about training the model by emulating these mistakes, but I thought it would be worth asking if there's an efficient way to handle problems like this. Any suggestions would be great. Thanks!
",0,1,False,self,,,,,
111,deeplearning,t5_2t5eh,2018-2-22,2018,2,22,18,7zdrx6,self.deeplearning,Face recognition systems (CNNs),https://www.reddit.com/r/deeplearning/comments/7zdrx6/face_recognition_systems_cnns/,maildivert,1519292910,"Consider a CNN trained on dataset of faces of 10 different people.
It can predict new images of the people from the dataset.

Is there any Face Rec CNN/software/system that can identify new faces other than the ones from the data set and automatically create a new node for the face to predict for it in the future?

Thanks.",1,3,False,self,,,,,
112,deeplearning,t5_2t5eh,2018-2-22,2018,2,22,21,7zel5f,self.deeplearning,Deep Neural Networks for YouTube Recommendations paper implementation,https://www.reddit.com/r/deeplearning/comments/7zel5f/deep_neural_networks_for_youtube_recommendations/,dpoulopoulos,1519303133,"Is there anyone who has implemented the techniques described in the paper ""Deep Neural Networks for YouTube Recommendations"", so I could ask some relevant questions?",1,3,False,self,,,,,
113,deeplearning,t5_2t5eh,2018-2-23,2018,2,23,1,7zg4y0,tintup.com,Deep Learning and Smart Curation with HUE,https://www.reddit.com/r/deeplearning/comments/7zg4y0/deep_learning_and_smart_curation_with_hue/,abigagildunncmsn,1519316916,,0,1,False,default,,,,,
114,deeplearning,t5_2t5eh,2018-2-23,2018,2,23,2,7zgjpv,self.deeplearning,How to apply constraint to 2D-Conv weights to make it symmetric?,https://www.reddit.com/r/deeplearning/comments/7zgjpv/how_to_apply_constraint_to_2dconv_weights_to_make/,[deleted],1519320011,[deleted],6,2,False,default,,,,,
115,deeplearning,t5_2t5eh,2018-2-23,2018,2,23,3,7zh7u4,blog.wolfram.com,Deep learning technique to find answers in a text,https://www.reddit.com/r/deeplearning/comments/7zh7u4/deep_learning_technique_to_find_answers_in_a_text/,WerewolfBar-Mitzvah,1519325007,,0,9,False,https://b.thumbs.redditmedia.com/3MrZeoAJPuJvqMdnj9wlDIF2RFuZjSx3sAgBTiRubAM.jpg,,,,,
116,deeplearning,t5_2t5eh,2018-2-23,2018,2,23,4,7zhgac,self.deeplearning,TensorFlow on AWS (EC2?) for Dummies?,https://www.reddit.com/r/deeplearning/comments/7zhgac/tensorflow_on_aws_ec2_for_dummies/,PullThisFinger,1519326743,"I want to upload an existing Git repo from my laptop (Ubuntu 14.04 LTS) to an AWS instance. The repo is a TensorFlow-based deep learning example (https://github.com/LouieYang/deep-photo-styletransfer-tf) and can be launched from my command line with $python &lt;opts&gt;.

This is my first time using AWS for anything other than S3 services, and there's nobody around to provide hints. Does anybody know of a step-by-step tutorial?",3,0,False,self,,,,,
117,deeplearning,t5_2t5eh,2018-2-23,2018,2,23,4,7zhoyc,stdlog.net,Testing Nvidia GTX 1050 on Generative Adversarial Network (GAN) | stdlog.net,https://www.reddit.com/r/deeplearning/comments/7zhoyc/testing_nvidia_gtx_1050_on_generative_adversarial/,pvsukale1,1519328543,,0,4,False,https://b.thumbs.redditmedia.com/BqazoLCojtXvmKlX1IgVagYuEzuewtPUcXV2Ws35uXY.jpg,,,,,
118,deeplearning,t5_2t5eh,2018-2-23,2018,2,23,8,7zjmn2,self.deeplearning,"if I have tensors, `v`, `w`, I know you can multiply them together with a = Multiply()([v, w]) But what if I want to multiply `v` or `w` by a scalar?",https://www.reddit.com/r/deeplearning/comments/7zjmn2/if_i_have_tensors_v_w_i_know_you_can_multiply/,[deleted],1519343794,[deleted],0,1,False,default,,,,,
119,deeplearning,t5_2t5eh,2018-2-23,2018,2,23,9,7zjsum,self.deeplearning,How to multiply Keras tensor by scalar?,https://www.reddit.com/r/deeplearning/comments/7zjsum/how_to_multiply_keras_tensor_by_scalar/,74throwaway,1519345306,"if I have tensors, `v`, `w`, I know you can multiply them together with

    a = Multiply()([v, w])

But what if I want to multiply `v` or `w` by a scalar?",0,0,False,self,,,,,
120,deeplearning,t5_2t5eh,2018-2-23,2018,2,23,10,7zk6a6,self.deeplearning,How big are the largest datasets for Deep Learning ?,https://www.reddit.com/r/deeplearning/comments/7zk6a6/how_big_are_the_largest_datasets_for_deep_learning/,GrandGuitar,1519348600,Just curious what are the largest training sets for Deep Learning. Do people train a model with petabytes of data for example ? use cases ?,2,3,False,self,,,,,
121,deeplearning,t5_2t5eh,2018-2-23,2018,2,23,10,7zkbho,self.deeplearning,Relation between weight matrix and filter in CNN,https://www.reddit.com/r/deeplearning/comments/7zkbho/relation_between_weight_matrix_and_filter_in_cnn/,74throwaway,1519349935,"Let's say I have an original image and use just 1 filter to blur that image for the first part of the CNN. Suppose the original image is 100x100, the filter is 20x20 and the resulting blurred image is 100x100. In that case, wouldn't the weight matrix be 10000x10000? Shouldn't the output of the weight matrix with `imshow` resemble the 20x20 filter used to blur the image?

How do the values in the 20x20 filter correspond to the 10000x10000 weight matrix? Would it be something like rows/columns 49990 to 50010 contain the 20x20 filter values, and the remaining 99980x99980 values of the weight matrix are all 0?",62,2,False,self,,,,,
122,deeplearning,t5_2t5eh,2018-2-24,2018,2,24,4,7zqjxb,facebook.com,AI Weekly 23 Feb 2018,https://www.reddit.com/r/deeplearning/comments/7zqjxb/ai_weekly_23_feb_2018/,TomekB,1519412903,,0,5,False,https://a.thumbs.redditmedia.com/tCu_oPOGPll4OqFSiRYPrxG8-hdsVZAINgaHol04gj8.jpg,,,,,
123,deeplearning,t5_2t5eh,2018-2-24,2018,2,24,11,7zth1s,self.deeplearning,Codementor worth it to get individual help?,https://www.reddit.com/r/deeplearning/comments/7zth1s/codementor_worth_it_to_get_individual_help/,74throwaway,1519437734,"I'm really stuck on a current deep learning problem using Tensorflow, Keras, and PyTorch. I've asked for help here, other subreddits, StackOveflow, etc, but I need help quickly and with more individual focus on my problem. I'm willing to pay to get expert advice on my problem where we can talk about it over the phone or skype

The only site I've found which offers instant help with individual attention is codementor. Has anyone tried this? Is it worth it?",0,3,False,self,,,,,
124,deeplearning,t5_2t5eh,2018-2-24,2018,2,24,11,7ztikn,youtube.com,Keras TensorFlow Model in 7 Minutes,https://www.reddit.com/r/deeplearning/comments/7ztikn/keras_tensorflow_model_in_7_minutes/,keghn,1519438158,,0,11,False,https://b.thumbs.redditmedia.com/1zZ8oZEXuEBleWQ4-AlwKFXXwKNuCTGxdYkCnCZwaAo.jpg,,,,,
125,deeplearning,t5_2t5eh,2018-2-24,2018,2,24,12,7ztyz1,self.deeplearning,Image Segmentation Does Not Improve Results,https://www.reddit.com/r/deeplearning/comments/7ztyz1/image_segmentation_does_not_improve_results/,bikermicefrmars,1519442918,"Hey every one, I am working on a binary image classification problem. I have ~300 images each for the class ""Yes"" and ""No"". I have written the code in Keras using VGG-16.

Now, I was getting an accuracy of 85 percent. To improve the results, I segmented (through masking) the area of interest from the image in hopes of increasing the accuracy. To my dismay, the accuracy dropped to 50%.

One reason that came to my mind was that the neural net might be learning the edges of the segmented image for classification rather than the area of interest itself. So I smoothed the edges, but still no improvement in results.

Can anyone please help?",1,1,False,self,,,,,
126,deeplearning,t5_2t5eh,2018-2-25,2018,2,25,0,7zxdot,self.deeplearning,"Any complex-valued, labelled dataset out there?",https://www.reddit.com/r/deeplearning/comments/7zxdot/any_complexvalued_labelled_dataset_out_there/,OK92,1519487493,"I am trying to work on my thesis related to Complex Valued Convolutional Neural networks for the classification task, for which I also require complex-valued data. Is there such a dataset available? Thank you.",4,2,False,self,,,,,
127,deeplearning,t5_2t5eh,2018-2-25,2018,2,25,11,801oa0,mlsociety.com,We are getting closer to our 5000 signature goal every day! Support our DeepBIO Conference (maybe Hackathon) by signing our Scientific Petition,https://www.reddit.com/r/deeplearning/comments/801oa0/we_are_getting_closer_to_our_5000_signature_goal/,Mathriddle,1519526895,,0,6,False,https://b.thumbs.redditmedia.com/TEFIhDlmBy5iPfA38pXPY-Rlss0hsIOgdQx-dxZZDKc.jpg,,,,,
128,deeplearning,t5_2t5eh,2018-2-26,2018,2,26,0,8052ab,self.deeplearning,What DeepLearning Technique for this kind of problem?,https://www.reddit.com/r/deeplearning/comments/8052ab/what_deeplearning_technique_for_this_kind_of/,juice_456,1519572290,"I just started last week with reading on deeplearning.
I am interested in solving this Problem with deeplearning but i dont know which technique should i consider?

Example:
Columns: Before  --&gt;    After       

- a      --&gt;       ab
- c       --&gt;    null
- null    --&gt;      a
- b=1.1  --&gt;    b=1.3


I want to classify/cluster the transistion types of {BEFORE} --&gt; {After} with an unsupervised manner

Really appreciate if you could help me",3,1,False,self,,,,,
129,deeplearning,t5_2t5eh,2018-2-26,2018,2,26,14,80apjl,self.deeplearning,How to make feature-wise heatmap images,https://www.reddit.com/r/deeplearning/comments/80apjl/how_to_make_featurewise_heatmap_images/,plznw4me,1519623849,"I'm new in tensorflow.
I've been implementing Paper 'Learning of subtle features in retinal images'


But I really don't know how to implement feature-wise heatmap like below(link)

https://imgur.com/BM8Crdr

more precisely , i understand about using neural network to make prediction each slide , but i don't know how to make heatmap

 did research on this issue, making heatmap

Class Activation Map
http://cnnlocalization.csail.mit.edu/

Regression Activation Map
https://arxiv.org/pdf/1703.10757.pdf

Grad-CAM Activation Map
https://arxiv.org/pdf/1610.02391.pdf


so, Could you give me some information about how to make feature-wise heatmap? web page, github, code, anything is ok thank you :)",2,5,False,self,,,,,
130,deeplearning,t5_2t5eh,2018-2-26,2018,2,26,20,80cc6y,self.deeplearning,Cryptoassets and Investments: Deep Learning Approach,https://www.reddit.com/r/deeplearning/comments/80cc6y/cryptoassets_and_investments_deep_learning/,AleksandrTavgen,1519644061,"We are currently developing portfolio optimization program for trading with crypto assets. Here is the second article about our research based on latest academic publications which involves Reinforcement Learning Agent's performance at the cryptomarket. All questions and suggestions are welcome!
https://medium.com/@ATavgen/cryptoassets-and-investments-deep-learning-approach-97f3d649afc1",0,2,False,self,,,,,
131,deeplearning,t5_2t5eh,2018-2-26,2018,2,26,22,80d04x,self.deeplearning,Multi-view Mask-R-CNN: Combining multiple images of the same object to generate a super accurate segmentation. Ideas how to get started?,https://www.reddit.com/r/deeplearning/comments/80d04x/multiview_maskrcnn_combining_multiple_images_of/,[deleted],1519651770,[deleted],0,1,False,default,,,,,
132,deeplearning,t5_2t5eh,2018-2-26,2018,2,26,23,80d8fb,self.deeplearning,Can I use Relu-&gt;SoftMax activation for this case?,https://www.reddit.com/r/deeplearning/comments/80d8fb/can_i_use_relusoftmax_activation_for_this_case/,marcelo_brazil,1519653991,"Hello everyone.
In Coursera Hyperparameter Tuning Course, I learned about using SoftMax for multi class problems.

I am trying to apply it to different problems to check if I really got it. Just for fun, I chose a problem that I know the deep net won't learn, but I would like to see it trying to learn.

The problem is: try to predict the number of a lottery here in Brazil called ""megasena"". The result of each game is a set of 6 numbers between 1 and 60. The training set is the last 2.000 games and each training example has 4 features: 

	1. the number of the game (eg. the 1st... until the 2000th)
	2. day of the game
	3. month of the game
	4. year of the game

For each Y of the example, I have a column with 60 rows, and in each row where the number was chosen in a particular game, I assigned ""1"". Eg. If the game 11th the result was (1, 2, 3, 5, 59 60), Y (column vector) will be = [1, 1, 1, 0, 1, 0, 0...., 0, 1, 1]. If the 12th game the result was (2, 4, 7, 57, 58, 60), Y will be = [0, 1, 0, 1, 0, 0, 1, 0..., 0, 1, 1, 0, 1].

It is a little bit different of the example in the course. In the class, the professor used an example where he has only one row where ""1"" was assigned for each example (when one row is ""1"", other rows are ""0""). In my experiment, I have 6 rows in the same column with ""1"" assigned and the other 54 rows with ""0"".

Do you guys know if I can use the same configuration for my example? (relu -&gt; relu -&gt; ... -&gt; relu -&gt; softmax?

Or as I have more than one row with ""1"", I should use another configuration or activation function?

Thank you! :)
",2,3,False,self,,,,,
133,deeplearning,t5_2t5eh,2018-2-27,2018,2,27,2,80ejw9,youtube.com,Machine Learning vs Deep Learning vs Artificial Intelligence - Are they really all that different - The best video explanation I came across,https://www.reddit.com/r/deeplearning/comments/80ejw9/machine_learning_vs_deep_learning_vs_artificial/,pooja307,1519664787,,0,12,False,https://b.thumbs.redditmedia.com/I3Q4cqatKbwqm-RrRN9rOQcCOQVhAzr4sN_iLCyuZng.jpg,,,,,
134,deeplearning,t5_2t5eh,2018-2-27,2018,2,27,2,80epnk,gigadom.wordpress.com,"Deep Learning from first principles in Python, R and Octave  Part 4",https://www.reddit.com/r/deeplearning/comments/80epnk/deep_learning_from_first_principles_in_python_r/,tvganesh,1519665910,,0,1,False,default,,,,,
135,deeplearning,t5_2t5eh,2018-2-27,2018,2,27,3,80f19q,i.imgur.com,Please solve and join the conversation:,https://www.reddit.com/r/deeplearning/comments/80f19q/please_solve_and_join_the_conversation/,levelship,1519668225,,0,0,False,https://b.thumbs.redditmedia.com/mf2HbnlDUlsOab4fhU-YbZF-EBWI7RKCYwERSxLo1lg.jpg,,,,,
136,deeplearning,t5_2t5eh,2018-2-27,2018,2,27,6,80gu6h,medium.com,Benevolent AI drug discovery paper at ICLR 2018: review,https://www.reddit.com/r/deeplearning/comments/80gu6h/benevolent_ai_drug_discovery_paper_at_iclr_2018/,mostafabenh,1519681627,,0,2,False,https://a.thumbs.redditmedia.com/IVKlEgw_oFZylvmC2RvznwNhFQJFOoaHf5BtTkZa-K8.jpg,,,,,
137,deeplearning,t5_2t5eh,2018-2-27,2018,2,27,9,80i2ns,youtube.com,Transfer Learning - Use Inception V3 to Solve Any ML Problem (Tempo Detection),https://www.reddit.com/r/deeplearning/comments/80i2ns/transfer_learning_use_inception_v3_to_solve_any/,tim_macgyver,1519691652,,1,7,False,https://b.thumbs.redditmedia.com/lualAwgzT_07t_eZ2XLp5B4d4UAw2wFpLW3pTWP_GKo.jpg,,,,,
138,deeplearning,t5_2t5eh,2018-2-27,2018,2,27,10,80iicp,i.redd.it,Total memory is sum up to 15.1 M instead of 24. Am i incorrect??,https://www.reddit.com/r/deeplearning/comments/80iicp/total_memory_is_sum_up_to_151_m_instead_of_24_am/,ram_dl,1519695525,,0,0,False,https://b.thumbs.redditmedia.com/GrhSV3HURTgkIab7XVkJgVMHgueWtUEr7W4xPGa209E.jpg,,,,,
139,deeplearning,t5_2t5eh,2018-2-27,2018,2,27,13,80jpsn,self.tensorflow,Can anyone with tensorflow experience please help me with this??,https://www.reddit.com/r/deeplearning/comments/80jpsn/can_anyone_with_tensorflow_experience_please_help/,alluriharikishan,1519706818,,0,0,False,https://b.thumbs.redditmedia.com/_6JmEh7ZG2_oTgDg051o7wtmLHcuxjea_JvefEkPYMQ.jpg,,,,,
