,date,year,month,day,hour,id,title,full_link,author,created,selftext,num_comments,score
0,2015-9-2,2015,9,2,14,3jbgvi,What can I do with Deep Learning?,https://www.reddit.com/r/deeplearning/comments/3jbgvi/what_can_i_do_with_deep_learning/,john_philip,1441170198,,0,1
1,2015-9-2,2015,9,2,21,3jcitg,Mocha.jl: Deep Learning for Julia,https://www.reddit.com/r/deeplearning/comments/3jcitg/mochajl_deep_learning_for_julia/,harrism,1441195465,,0,1
2,2015-9-3,2015,9,3,2,3jdoiu,Find your Dream Job!,https://www.reddit.com/r/deeplearning/comments/3jdoiu/find_your_dream_job/,[deleted],1441213719,[deleted],0,1
3,2015-9-3,2015,9,3,2,3jdq4o,Find your Dream Job! A Recurrent Neural Network learns Indeed.com Job Postings,https://www.reddit.com/r/deeplearning/comments/3jdq4o/find_your_dream_job_a_recurrent_neural_network/,mwakanosya,1441214329,,1,2
4,2015-9-7,2015,9,7,0,3jv21j,Good tutorials on Youtube from this guy.,https://www.reddit.com/r/deeplearning/comments/3jv21j/good_tutorials_on_youtube_from_this_guy/,DeepDeadMind,1441552016,,1,4
5,2015-9-24,2015,9,24,5,3m41or,Deep Learning Tutorial by Lizhen Qu,https://www.reddit.com/r/deeplearning/comments/3m41or/deep_learning_tutorial_by_lizhen_qu/,ojaved,1443040407,,0,1
6,2015-9-24,2015,9,24,7,3m4m3k,apple's deep learning challenge,https://www.reddit.com/r/deeplearning/comments/3m4m3k/apples_deep_learning_challenge/,toisanji,1443048748,,0,0
