,sbr,sbr_id,date,year,month,hour,day,id,domain,title,full_link,author,created,selftext,num_comments,score,over_18,thumbnail,media_provider,media_thumbnail,media_title,media_description,media_url
160,MachineLearning,t5_2r3gv,2014-7-22,2014,7,22,3,2bbd2h,self.MachineLearning,Is the apparent similarity between the random subspace method and dropout anything more than superficial?,https://www.reddit.com/r/MachineLearning/comments/2bbd2h/is_the_apparent_similarity_between_the_random/,alexgmcm,1405965943,"As I understand in the random subspace method  (e.g. random forests) you randomly omit some of your features in the weak classifiers so you don't end up with all the weak classifiers using a few good features and being highly correlated as then you basically have an ensemble of loads of copies of the same classifier which is pretty useless.

In dropout you randomly omit units from the neural network during training to prevent co-adaptation (i.e. where a unit becomes dependent on other units, so a learned feature/metafeature (what is the proper term for this? I guess just referring to it as a unit?) becomes useful only in the presence of certain other learned features). 

In both cases you use model averaging on the resulting ensemble to obtain the final model.

I could be completely wrong, please feel free to correct me!",8,9,False,self,,,,,
161,MachineLearning,t5_2r3gv,2014-7-22,2014,7,22,4,2bbmdm,jmlr.org,Dropout: A Simple Way to Prevent Neural Networks from Overfitting,https://www.reddit.com/r/MachineLearning/comments/2bbmdm/dropout_a_simple_way_to_prevent_neural_networks/,galapag0,1405970704,,9,36,False,default,,,,,
162,MachineLearning,t5_2r3gv,2014-7-22,2014,7,22,4,2bbmjc,new.livestream.com,ML &amp; Data Science talks streaming live today from @graphlabconf,https://www.reddit.com/r/MachineLearning/comments/2bbmjc/ml_data_science_talks_streaming_live_today_from/,[deleted],1405970775,,0,4,False,default,,,,,
163,MachineLearning,t5_2r3gv,2014-7-22,2014,7,22,7,2bc9kg,inovancetech.com,A Step-by-Step Guide to Using Machine Learning in Your Trading,https://www.reddit.com/r/MachineLearning/comments/2bc9kg/a_stepbystep_guide_to_using_machine_learning_in/,thetzz,1405982921,,0,0,False,default,,,,,
164,MachineLearning,t5_2r3gv,2014-7-22,2014,7,22,11,2bcuae,github.com,A growing collection of machine learning definitions in less than 50 words,https://www.reddit.com/r/MachineLearning/comments/2bcuae/a_growing_collection_of_machine_learning/,[deleted],1405995282,,0,1,False,default,,,,,
165,MachineLearning,t5_2r3gv,2014-7-22,2014,7,22,12,2bd2ea,github.com,machine learning related definitions in less than 50 words,https://www.reddit.com/r/MachineLearning/comments/2bd2ea/machine_learning_related_definitions_in_less_than/,rasbt,1406000393,,4,6,False,http://a.thumbs.redditmedia.com/tf6XtV6Xxn07wX4B.jpg,,,,,
166,MachineLearning,t5_2r3gv,2014-7-22,2014,7,22,16,2bdhih,self.MachineLearning,Kernel Method Performance Comparable to Deep Learning?,https://www.reddit.com/r/MachineLearning/comments/2bdhih/kernel_method_performance_comparable_to_deep/,penguinElephant,1406012465,"So there have been kernels engineered for specific tasks that rival deep nets (e.g., http://arxiv.org/abs/1406.3332) which makes sense, since they do what is known to work well.



But then this paper just came out today on arxiv which scales up kernel methods:

http://arxiv.org/abs/1407.5599

The authors use *RBF kernels* for their experiments and seem to achieve performance comparable to deep nets with minimal preprocessing (some normalization or PCA) on multiple standard datasets (e.g., CIFAR-10, MNIST, ImageNet)

Makes me wonder if RBF kernels were good all along... Do we really need to learn deep feature representations?",4,6,False,self,,,,,
167,MachineLearning,t5_2r3gv,2014-7-22,2014,7,22,17,2bdn75,purposeof.com.au,Purpose of Mining Excavator Attachments - PurposeOf,https://www.reddit.com/r/MachineLearning/comments/2bdn75/purpose_of_mining_excavator_attachments_purposeof/,jessicperson,1406018476,,0,1,False,default,,,,,
168,MachineLearning,t5_2r3gv,2014-7-22,2014,7,22,20,2bdxdf,self.MachineLearning,What are the axes in t-SNE?,https://www.reddit.com/r/MachineLearning/comments/2bdxdf/what_are_the_axes_in_tsne/,alexgmcm,1406029581,"I read the t-SNE paper and understood most (well, some) of it.

I see how it can represent the structure of the data at lower dimensions but if I include it in a presentation and someone asks what the axes are for the plot (a common question) I would just have to say it's one of the great mysteries of the Universe - like the meaning of life, or the location of Geoffrey Hinton's highly-advanced homeworld.

I guess that as it is a graph in the graph theory sense it indicates the pairwise relations between the points and so the distance between any two points is a measure of their similarity but it isn't a scatterplot with axes?

Or am I completely wrong?",15,6,False,self,,,,,
169,MachineLearning,t5_2r3gv,2014-7-22,2014,7,22,23,2beblk,self.MachineLearning,Question: How can i choose the most confident samples in self-training with multi-label dataset ?,https://www.reddit.com/r/MachineLearning/comments/2beblk/question_how_can_i_choose_the_most_confident/,nimakhan66,1406039831,"I want to Implement self-training method on a common multi-label dataset (e.g  yeast.arff) . how can i choose the most confident samples to add them to label set for next iteration? 

Best regards",3,0,False,self,,,,,
170,MachineLearning,t5_2r3gv,2014-7-23,2014,7,23,1,2bemt6,new.livestream.com,Graphlab full day training free via live stream,https://www.reddit.com/r/MachineLearning/comments/2bemt6/graphlab_full_day_training_free_via_live_stream/,shonburton,1406045937,,1,7,False,http://b.thumbs.redditmedia.com/s-kC6PrI4eoe73bc.jpg,,,,,
171,MachineLearning,t5_2r3gv,2014-7-23,2014,7,23,4,2bfc2t,self.MachineLearning,Non-Decomposable Bayesian Network Scoring Functions,https://www.reddit.com/r/MachineLearning/comments/2bfc2t/nondecomposable_bayesian_network_scoring_functions/,[deleted],1406059125,"I have been studying the property of decomposability that most Bayesian network scoring functions have.  That is, the score assigned to the structure can be expressed as a sum of local values that depend only on each node and its parents.  Are there any examples of Bayesian network scoring functions that are not decomposable?",4,0,False,default,,,,,
172,MachineLearning,t5_2r3gv,2014-7-23,2014,7,23,7,2bfuor,self.MachineLearning,Using OCR to read a receipt,https://www.reddit.com/r/MachineLearning/comments/2bfuor/using_ocr_to_read_a_receipt/,Searial,1406068954,"I am looking to try and make an android app to pull out data from a receipt as an exercise. After some basic research I think tesseract may be a good choice, but it looks like some pre-processing is required and opinions vary. Does anyone have suggestions on what sort of pre-processing I should look into (grayscale, binary conversion, gaussian blur, etc.) or if there are any other libraries that may help me out?",4,7,False,self,,,,,
173,MachineLearning,t5_2r3gv,2014-7-23,2014,7,23,14,2bgw3b,datasciencecentral.com,10 types of regressions. Which one to use?,https://www.reddit.com/r/MachineLearning/comments/2bgw3b/10_types_of_regressions_which_one_to_use/,rasbt,1406092153,,4,0,False,default,,,,,
174,MachineLearning,t5_2r3gv,2014-7-23,2014,7,23,16,2bh6ur,purposeof.com.au,The Purpose Of Using Mining Excavator At Mining Sites - PurposeOf,https://www.reddit.com/r/MachineLearning/comments/2bh6ur/the_purpose_of_using_mining_excavator_at_mining/,jessicperson,1406101740,,0,1,False,default,,,,,
175,MachineLearning,t5_2r3gv,2014-7-23,2014,7,23,23,2bhwyy,docs.google.com,"Identifying early stage Parkinson's using Real Time Tweets. Non-profit Project. ** Please fill out Google form, need training data **.",https://www.reddit.com/r/MachineLearning/comments/2bhwyy/identifying_early_stage_parkinsons_using_real/,[deleted],1406125629,,0,1,False,default,,,,,
176,MachineLearning,t5_2r3gv,2014-7-24,2014,7,24,1,2biax2,self.MachineLearning,Artificial Intelligence used to provide a 10X improvement in personalized education using little data,https://www.reddit.com/r/MachineLearning/comments/2biax2/artificial_intelligence_used_to_provide_a_10x/,U5r4F5k,1406133451,"So we have an interesting problem that I want to get some advice on:

**Background:** We are a nonprofit built by a bunch of tech startup founders and enthusiasts that want to do something for our kids: We are building an educational platform, initially for the poorest people on the planet, who don't have access to schools, teachers or the internet, let alone basic infrastructure. A test was done 18 months ago when a box of 40 tablets that were pre-installed with hundreds of educational apps and were given to a remote village in Ethiopia who were 100% illiterate. This box of tablets were left there without any guidance or training on how to use them. The village had a large group of children who had never seen modern technology let alone heard the English language however within hours the first child figured out how to turn one of them on. A few minutes later he taught the rest of the kids how to turn theirs on. 2 weeks later the kids were using on average 57 apps each, a few more weeks after that, they were singing the alphabet song and starting to learn how to read and write letters. After 5 months they learnt how to hack Android. 

Recently the Global Literacy Project expanded on this test and deployed an additional 600 tablets to 8  locations around the world and they are getting back some really great results. We are now convinced that this approach can work and we are taking it to the next stage by developing an AI amongst other things to guide the child through a completely personalized learning experience that dynamically unfolds as the AI learns more about them. The trick is we need to AI to be on-device as we cannot rely on internet connectivity or the creation of local computing nodes. In addition, because we are ultimately also building it for our kids we don't want their highly personal data sitting on some server or being transferred over the internet where it could be intercepted. 

**So the problem is this:** We want the on-device AI to build an increasingly large and personal data set about the learner (E.G. Learner is X age, has X interests, is good at X,Y,Z, is not so good at A,B,C, Has personality traits Q,R,S, works better with X learning style, has completed T,U,V modules .). In addition, the content the learner is learning from will have an increasingly detailed list of metadata associated with it. (E.G. Content Type: Video, Topic: English Nouns, Level: 1, Related to: X,Y,Z..., prerequisites: Q,R,S) however this metadata will also become increasingly large and complex, through learner generated meta data, and updates from our library. 

The AI will then be tasked with many processes to perform like:

* 1. The AI will need to create a map of the content, similar to the [Khan academy Knowledge map](https://www.khanacademy.org/exercisedashboard) Each learners map may be different as they may all have different content installed on their device, or they may have added custom user generated meta data to a piece of content which affects its position in the map.

* 2. The AI will need to use data it has collected from the user through various interactions, personality tests and their general usage and create dynamic learning plans that constantly need to adapt to the needs, goals and interests of the learner. It will do this by analyzing the personal data of the learner, the meta data of the content, and how the content fits within the relational map of linked content. 

* 3. A key focus of this platform is the facilitation of social and collaborative learning. We are using mesh networking technology to link the devices together within the community. The AIs on the network will communicate with each other with the permission of the learner and match up learning pairs or groups to work on problems together. They will also pair Learner X who may have mastered a concept with Learner B who needs help with that concept.

**Our current strategy:** We intend to start off using almost 100% hard coded recommendation engine type logic then gradually use machine learning to develop these further. The key here is that its not a Big data issue, we calling it a little data issue as we need to gain insights from one users data, on device, and make adjustments locally. 

So this is the challenge, how would you structure a solution and what approaches would you use?

Here is some more information about our project: [www.dev4x.com](http://www.dev4x.com)
",6,0,False,self,,,,,
177,MachineLearning,t5_2r3gv,2014-7-24,2014,7,24,2,2bigsf,self.MachineLearning,Why is reinforcement learning so rare here?,https://www.reddit.com/r/MachineLearning/comments/2bigsf/why_is_reinforcement_learning_so_rare_here/,CireNeikual,1406136487,"It seems like machine learning is synonymous with supervised learning and a bit of unsupervised learning. Also deep learning is everything nowadays.

I assume the reason for this is because it is good for applications in which there is money to be had (search engines for example, Google bait stuff).

So, seeing how the field of machine learning works at the moment, I feel like it will only be a footnote on the way to strong AI.

At one point I presented a reinforcement learning technique (I have a FOSS library full of them), and people asked me for MINST results. That doesn't really make sense.

Am I right in drawing these conclusions? Or do you see a clear progression from current supervised learning techniques into strong AI reinforcement learning techniques?

Thank you for your time!",53,46,False,self,,,,,
178,MachineLearning,t5_2r3gv,2014-7-24,2014,7,24,6,2bj8xn,blog.yhathq.com,Fuzzy matching example,https://www.reddit.com/r/MachineLearning/comments/2bj8xn/fuzzy_matching_example/,agconway,1406150679,,1,1,False,http://a.thumbs.redditmedia.com/ozkFneLQe6meJu96.jpg,,,,,
179,MachineLearning,t5_2r3gv,2014-7-24,2014,7,24,10,2bk0s1,haifengl.wordpress.com,The Regularized EM Algorithm,https://www.reddit.com/r/MachineLearning/comments/2bk0s1/the_regularized_em_algorithm/,haifengl,1406167134,,0,6,False,http://b.thumbs.redditmedia.com/4udtA3py8h6W0Jgi.jpg,,,,,
180,MachineLearning,t5_2r3gv,2014-7-24,2014,7,24,17,2bkt83,machineryequipment123.blogspot.com,The Suggested Safety Tips For Working With Forklifts - Machinery &amp; Equipment Part Online,https://www.reddit.com/r/MachineLearning/comments/2bkt83/the_suggested_safety_tips_for_working_with/,jessicperson,1406189344,,0,1,False,default,,,,,
181,MachineLearning,t5_2r3gv,2014-7-24,2014,7,24,17,2bkthw,self.MachineLearning,What are the state of the art techniques for speech based language identification?,https://www.reddit.com/r/MachineLearning/comments/2bkthw/what_are_the_state_of_the_art_techniques_for/,usernaamee,1406189676,"Journal articles, conference papers would help.",4,5,False,self,,,,,
182,MachineLearning,t5_2r3gv,2014-7-24,2014,7,24,20,2bl3fh,falconpumps.weebly.com,Vacuum Pressure Pumps for Paper Folding Machine,https://www.reddit.com/r/MachineLearning/comments/2bl3fh/vacuum_pressure_pumps_for_paper_folding_machine/,falconpumps,1406200841,,0,1,False,default,,,,,
183,MachineLearning,t5_2r3gv,2014-7-25,2014,7,25,1,2blslx,github.com,"MOE, the Metric Optimization Engine. An open source, Bayesian Global Optimization framework for optimal experiment design.",https://www.reddit.com/r/MachineLearning/comments/2blslx/moe_the_metric_optimization_engine_an_open_source/,Zephyr314,1406218252,,9,52,False,http://b.thumbs.redditmedia.com/fmstjAYSDSnWNDeS.jpg,,,,,
184,MachineLearning,t5_2r3gv,2014-7-25,2014,7,25,4,2bmdnp,cbinsights.com,News Classification - Step by Step Our Pipeline,https://www.reddit.com/r/MachineLearning/comments/2bmdnp/news_classification_step_by_step_our_pipeline/,bugra,1406229401,,0,2,False,http://b.thumbs.redditmedia.com/bJdxnjp4TCzgE8Ey.jpg,,,,,
185,MachineLearning,t5_2r3gv,2014-7-25,2014,7,25,6,2bms9q,self.MachineLearning,Is there a ML technique applicable to this problem? (knapsack variation with an item of 'variable' volume),https://www.reddit.com/r/MachineLearning/comments/2bms9q/is_there_a_ml_technique_applicable_to_this/,tperrigo,1406236887,"I'm very, very new to machine learning, but I'm dealing with a problem that seems like it might be a candidate for a ML approach.  It's basically a knapsack problem, with a twist.  I've got a set of items (A, B, C,...) each with a known volume (the percentage of the container it will take up).  However, there's another item, X, which often fits in the 'spaces between' other items, but how many X's a container can hold depends on what other items are in the container.  For example, if the container holds 2 A's and 1 B, then I can fit 4 X's.  However, if I add a C to the container, I can now only fit 2 X's.  I have some historical data to work with, so I know in the past the various configurations and how many X's they were able to contain.  Is there a way to construct a model based on this historical data so that I can feed it a proposed consolidation, and get back how many X's such a configuration could contain?  

Any suggestions would be appreciated (even if it's just to tell me I'm on the wrong track and should look into some other-- non-ML-- approach).  Thanks!",12,2,False,self,,,,,
186,MachineLearning,t5_2r3gv,2014-7-25,2014,7,25,12,2bntuw,self.MachineLearning,What are some state of the art ML techniques in emotion recognition from speech?,https://www.reddit.com/r/MachineLearning/comments/2bntuw/what_are_some_state_of_the_art_ml_techniques_in/,holo11,1406260044,,3,2,False,self,,,,,
187,MachineLearning,t5_2r3gv,2014-7-25,2014,7,25,14,2bo1p0,falconpumps.wordpress.com,Vacuum Pressure Pumps for Komori,https://www.reddit.com/r/MachineLearning/comments/2bo1p0/vacuum_pressure_pumps_for_komori/,falconpumps,1406265872,,0,0,False,default,,,,,
188,MachineLearning,t5_2r3gv,2014-7-25,2014,7,25,20,2bomsa,self.MachineLearning,Question: Vanishing gradient in RNNs - yes or no?,https://www.reddit.com/r/MachineLearning/comments/2bomsa/question_vanishing_gradient_in_rnns_yes_or_no/,qwer1304,1406288276,"Hi,  
One of the often cited issues in RNN training is the vanishing gradient problem ([Y.Bengio et al.](http://dx.doi.org/10.1109/72.279181), [S.Hochreiter](http://dx.doi.org/10.1142/S0218488598000094), [S.Hochreiter et al.](ftp://ftp.idsia.ch/pub/juergen/gradientflow.pdf), [R.Pascanu et al.](http://arxiv.org/abs/1211.5063)).  
However, I came across several papers by Anton Maximilian Schaefer, Steffen Udluft and Hans-Georg Zimmermann (e.g., [here](http://www.sciencedirect.com/science/article/pii/S0925231208002105)) in which it is claimed that the problem doesn't exist even in a simple RNN, if shared weights are used.  

So, which one is true - does the vanishing gradient problem exist or not?

Thx,  
D",2,2,False,self,,,,,
189,MachineLearning,t5_2r3gv,2014-7-25,2014,7,25,21,2booeb,falconpumps.wordpress.com,Vacuum Pressure Pumps for Mitsubishi,https://www.reddit.com/r/MachineLearning/comments/2booeb/vacuum_pressure_pumps_for_mitsubishi/,falconpumps,1406289890,,0,0,False,default,,,,,
190,MachineLearning,t5_2r3gv,2014-7-25,2014,7,25,21,2bopxs,self.MachineLearning,Question about the max-norm constraint used with the Dropout technique,https://www.reddit.com/r/MachineLearning/comments/2bopxs/question_about_the_maxnorm_constraint_used_with/,rishok,1406291314,"Maxout uses the max-norm constraint (or dropout does). Do you know when to enforce the constraint, during update ? or during calculating the pre-activation?",5,5,False,self,,,,,
191,MachineLearning,t5_2r3gv,2014-7-25,2014,7,25,23,2bp0v3,youtube.com,Machine Learning and the Big Data Ecosystem with Adam Drake of zanox,https://www.reddit.com/r/MachineLearning/comments/2bp0v3/machine_learning_and_the_big_data_ecosystem_with/,[deleted],1406299265,,0,0,False,default,,,,,
192,MachineLearning,t5_2r3gv,2014-7-26,2014,7,26,0,2bp5na,scottlocklin.wordpress.com,Neglected machine learning ideas,https://www.reddit.com/r/MachineLearning/comments/2bp5na/neglected_machine_learning_ideas/,dafcok,1406302141,,25,52,False,http://a.thumbs.redditmedia.com/qtgox0l_DHcm0mZ4.jpg,,,,,
193,MachineLearning,t5_2r3gv,2014-7-26,2014,7,26,3,2bpo2m,boozallen.com,The Field Guide to Data Science,https://www.reddit.com/r/MachineLearning/comments/2bpo2m/the_field_guide_to_data_science/,redknightlois,1406312388,,5,0,False,default,,,,,
194,MachineLearning,t5_2r3gv,2014-7-26,2014,7,26,6,2bq8xp,self.MachineLearning,List of most important ML research labs?,https://www.reddit.com/r/MachineLearning/comments/2bq8xp/list_of_most_important_ml_research_labs/,makakimekaki,1406324162,"what are the most important and famous machine learning, robotics, data mining research labs?",6,1,False,self,,,,,
195,MachineLearning,t5_2r3gv,2014-7-26,2014,7,26,8,2bqku9,richardminerich.com,"Review: Sony Digital Paper DPT-S1, an e-ink device ideal for notes and papers",https://www.reddit.com/r/MachineLearning/comments/2bqku9/review_sony_digital_paper_dpts1_an_eink_device/,Rickasaurus,1406331658,,9,5,False,http://a.thumbs.redditmedia.com/M2pZjnlBCuob2wp6.jpg,,,,,
196,MachineLearning,t5_2r3gv,2014-7-26,2014,7,26,10,2bqsly,self.MachineLearning,Dirichlet Process background?,https://www.reddit.com/r/MachineLearning/comments/2bqsly/dirichlet_process_background/,frogwarzez,1406337185,"I was reading this introduction to Dirichlet processes http://www.gatsby.ucl.ac.uk/~ywteh/research/npbayes/dp.pdf but I found that I'm not familiar with a lot of concepts and terminology.I have intermediate knowledge of stats, not much beyond regressions and good understanding of common machine learning algorithms (classification, clustering). What background gaps do I need to fill to understand this article? Do I need a first course in Bayesian nonparametrics? Anything even before that? Recommendations are appreciated. Thanks.",6,13,False,self,,,,,
197,MachineLearning,t5_2r3gv,2014-7-26,2014,7,26,10,2bqtj9,auai.org,Uncertainty In Artificial,https://www.reddit.com/r/MachineLearning/comments/2bqtj9/uncertainty_in_artificial/,[deleted],1406337819,,0,1,False,default,,,,,
198,MachineLearning,t5_2r3gv,2014-7-26,2014,7,26,11,2bqxup,datascienceassn.org,Data Fusion is Data Destruction [OC],https://www.reddit.com/r/MachineLearning/comments/2bqxup/data_fusion_is_data_destruction_oc/,michaelmalak,1406340863,,1,0,False,http://b.thumbs.redditmedia.com/AeDS017tyb38QPyc.jpg,,,,,
199,MachineLearning,t5_2r3gv,2014-7-26,2014,7,26,14,2brcvh,falconpumps.weebly.com,Vacuum Pressure Pumps for Diary Making Plants,https://www.reddit.com/r/MachineLearning/comments/2brcvh/vacuum_pressure_pumps_for_diary_making_plants/,falconpumps,1406352710,,0,1,False,default,,,,,
200,MachineLearning,t5_2r3gv,2014-7-26,2014,7,26,18,2bro4f,self.MachineLearning,Suggestions for enrolling into university for ML,https://www.reddit.com/r/MachineLearning/comments/2bro4f/suggestions_for_enrolling_into_university_for_ml/,SaMSaMSaMv2,1406365709,"Hey guys

I am interested in doing my masters in Machine Learning. Can you suggest me universities which are currently doing a lot of work in this field? I only know of CMU as of now. Also if it helps I am more interested in NLP. 

Thanks for the help.",10,1,False,self,,,,,
201,MachineLearning,t5_2r3gv,2014-7-27,2014,7,27,11,2btuqb,thoughtly.co,IntelliButler - A Deep Learning Assistant for Social Media (launching Aug 2014),https://www.reddit.com/r/MachineLearning/comments/2btuqb/intellibutler_a_deep_learning_assistant_for/,[deleted],1406428460,,7,0,False,default,,,,,
202,MachineLearning,t5_2r3gv,2014-7-28,2014,7,28,1,2bv8bf,self.MachineLearning,Where can I find a good intro to random forests?,https://www.reddit.com/r/MachineLearning/comments/2bv8bf/where_can_i_find_a_good_intro_to_random_forests/,[deleted],1406479087,"While I know a little about regression and associated topics from Andrew Ng's class, I'm a total newb to trees, bagging, boosting, and random forests. What's a good place to start? I'm willing to put in the time, but feeling a little lost.

Things I've already tried: Hastie-Tibshirani-Friedman's ""The Elements of Statistical Learning"" is comprehensive but difficult as a first intro, whereas the JHU ""Practical Machine Learning"" class on Coursera quickly breezes through all of the above leaving me feeling like I have little understanding of it.

Any suggestions would be appreciated, even if they are ""Go back to The Elements of Statistical Learning and read it ten times!""",7,6,False,self,,,,,
203,MachineLearning,t5_2r3gv,2014-7-28,2014,7,28,2,2bvee7,self.MachineLearning,Can I use Go as a replacement for Octave/Python for machine learning projects?,https://www.reddit.com/r/MachineLearning/comments/2bvee7/can_i_use_go_as_a_replacement_for_octavepython/,whiskeybandit,1406483235,"In particular, to do things like vector and matrix manipulation. I was even thinking about using it to do image processing. Is it worth the effort?",20,0,False,self,,,,,
204,MachineLearning,t5_2r3gv,2014-7-28,2014,7,28,4,2bvn1f,datascienceweekly.org,Social Media &amp; Machine Learning tell Stores where to locate,https://www.reddit.com/r/MachineLearning/comments/2bvn1f/social_media_machine_learning_tell_stores_where/,hrb1979,1406488863,,0,2,False,http://b.thumbs.redditmedia.com/0fldkP0QXjJJ1FPS.jpg,,,,,
