,sbr,sbr_id,date,year,month,hour,day,id,domain,title,full_link,author,created,selftext,num_comments,score,over_18,thumbnail,media_provider,media_thumbnail,media_title,media_description,media_url
0,MachineLearning,t5_2r3gv,2014-7-1,2014,7,1,16,29jnbk,machineryequipment123.blogspot.com,Mobile Crushers Are On The Move - Machinery &amp; Equipment Part Online,https://www.reddit.com/r/MachineLearning/comments/29jnbk/mobile_crushers_are_on_the_move_machinery/,jessicperson,1404198814,,0,1,False,default,,,,,
1,MachineLearning,t5_2r3gv,2014-7-1,2014,7,1,21,29k2p4,dataconomy.com,IBM's Chef Watson: Using Data to Delight Your Tastebuds,https://www.reddit.com/r/MachineLearning/comments/29k2p4/ibms_chef_watson_using_data_to_delight_your/,[deleted],1404217374,,4,12,False,default,,,,,
2,MachineLearning,t5_2r3gv,2014-7-1,2014,7,1,21,29k48v,self.MachineLearning,"Are the data dimensions independent after applying PCA to the data? If yes, why?",https://www.reddit.com/r/MachineLearning/comments/29k48v/are_the_data_dimensions_independent_after/,velosheep,1404218786,,6,2,False,self,,,,,
3,MachineLearning,t5_2r3gv,2014-7-1,2014,7,1,23,29keji,self.MachineLearning,Generalized Additive Neural Networks,https://www.reddit.com/r/MachineLearning/comments/29keji/generalized_additive_neural_networks/,sidk,1404226468,"So I'm working on a research problem.And I need to learn about something called ""Generalized Additive Neural Networks"" and apply them on data sets.Now since there are hardly any tutorials available(and I'm a undergrad) how should I study them?",4,2,False,self,,,,,
4,MachineLearning,t5_2r3gv,2014-7-2,2014,7,2,1,29kqaa,accesswire.com,Discovery of Nature's Transistor Inspires General-purpose Neural Processor,https://www.reddit.com/r/MachineLearning/comments/29kqaa/discovery_of_natures_transistor_inspires/,NeuroCode1,1404233600,,4,4,False,http://b.thumbs.redditmedia.com/xObb3OIm0t-tQ-ye.jpg,,,,,
5,MachineLearning,t5_2r3gv,2014-7-2,2014,7,2,4,29l8y0,self.MachineLearning,New to nlp and ml. Tried to automatically generate a stopword list for any language. Failed.,https://www.reddit.com/r/MachineLearning/comments/29l8y0/new_to_nlp_and_ml_tried_to_automatically_generate/,gardinal,1404244341,"Disclaimer : I am really new to everything, and actually just completed the first week of ML MOOC on Coursera. I've had good experience in nlp, and currently am developing for Tatoeba as part of Google Summer of Code. I am about to start the last year of college.

I was fooling around with Frequency Distributions when I thought I could automatically generate list of stopwords for each language given a good sizeable corpus in that language. I assumed that stopwords would be the most frequent and I was proven wrong by myself when I tinkered with some data and plots. 

[Here](http://hashcomment.blogspot.in/2014/07/why-clipping-of-frequency-distribution.html), I have documented the whole experiement. 

Again, I am really new to the concepts, and I could have done something horribly wrong, but I am here to learn. Share constructive criticism.

Also, if I had to cluster or clip the graph, what would have been the correct method to do so?",0,1,False,self,,,,,
6,MachineLearning,t5_2r3gv,2014-7-2,2014,7,2,6,29lgm3,self.MachineLearning,Neural Net Rorschach Test,https://www.reddit.com/r/MachineLearning/comments/29lgm3/neural_net_rorschach_test/,GratefulTony,1404249045,"If anyone happens to have a trained image-recognition net laying around, it might be fun to see what the top classification categories are for the Rorschach ink blot test cards...

http://en.wikipedia.org/wiki/Rorschach_inkblot_test",7,20,False,self,,,,,
7,MachineLearning,t5_2r3gv,2014-7-2,2014,7,2,6,29liju,self.MachineLearning,L1 penalty on the activation values?,https://www.reddit.com/r/MachineLearning/comments/29liju/l1_penalty_on_the_activation_values/,rishok,1404250384,"Glorot presents in his paper  ( Deep Sparse Rectier Neural Networks
) his idea to penalize activation values with L1 norm in order to to use the relu function for an autoencoder.

Does anybody know how it is done?
",4,4,False,self,,,,,
8,MachineLearning,t5_2r3gv,2014-7-2,2014,7,2,10,29m4q5,dataconomy.com,Big Data Proving to Be A Real Challenge for Data Scientists,https://www.reddit.com/r/MachineLearning/comments/29m4q5/big_data_proving_to_be_a_real_challenge_for_data/,[deleted],1404265218,,1,0,False,default,,,,,
9,MachineLearning,t5_2r3gv,2014-7-2,2014,7,2,16,29mtfd,machines4u.altervista.org,The Unique Structure And Working Principle Of Vibrating Screen,https://www.reddit.com/r/MachineLearning/comments/29mtfd/the_unique_structure_and_working_principle_of/,jessicperson,1404285822,,0,1,False,default,,,,,
10,MachineLearning,t5_2r3gv,2014-7-2,2014,7,2,17,29mvhl,machineryequipment123.blogspot.com,The Unique Type Of Stone Crusher - Machinery &amp; Equipment Part Online,https://www.reddit.com/r/MachineLearning/comments/29mvhl/the_unique_type_of_stone_crusher_machinery/,jessicperson,1404288287,,0,1,False,default,,,,,
11,MachineLearning,t5_2r3gv,2014-7-2,2014,7,2,23,29ng3a,self.MachineLearning,Please recommend some good books on Genetic Algorithms.,https://www.reddit.com/r/MachineLearning/comments/29ng3a/please_recommend_some_good_books_on_genetic/,Privarchy,1404310344,"This question was [asked three years ago](http://www.reddit.com/r/MachineLearning/comments/cquuu/please_recommend_a_good_book_on_genetic_algorithms/) and there's nothing really for it in the FAQ, so I think it is time for an update, especially considering how much this subreddit has grown. For reference, the books posted in that thread were:

* *Genetic Algorithms in Search, Optimization, and Machine Learning* by David E. Goldberg
* *An Introduction to Genetic Algorithms* by Melanie Mitchell
* *Practical Genetic Algorithms* by Randy L. Haupt and Sue Ellen Haup
* [*Essentials of Metaheuristics: Lecture Notes* by Sean Luke](http://cs.gmu.edu/~sean/book/metaheuristics/)

If possible please suggest some more, wholly for my greedy selfish self, although others might benefit in the future. Any criticism you have of the books posted above would be welcome too (*x* is out of date, *y* is just wrong, *z* ran away with my wife, etcetera). Thank you!",4,3,False,self,,,,,
12,MachineLearning,t5_2r3gv,2014-7-2,2014,7,2,23,29ni0g,github.com,"A collection of useful, freely available datasets for machine learning experiments",https://www.reddit.com/r/MachineLearning/comments/29ni0g/a_collection_of_useful_freely_available_datasets/,rasbt,1404311661,,8,80,False,http://a.thumbs.redditmedia.com/tf6XtV6Xxn07wX4B.jpg,,,,,
13,MachineLearning,t5_2r3gv,2014-7-2,2014,7,2,23,29njot,self.MachineLearning,Good Machine Learning methods for mix of discrete (categorical) and continuous features?,https://www.reddit.com/r/MachineLearning/comments/29njot/good_machine_learning_methods_for_mix_of_discrete/,[deleted],1404312786,"What are the best methods for dealing with a combination of these features, for both regression and classification tasks?",4,3,False,default,,,,,
14,MachineLearning,t5_2r3gv,2014-7-3,2014,7,3,8,29oyf0,medium.com,Why becoming a data scientist is NOT actually easier than you think,https://www.reddit.com/r/MachineLearning/comments/29oyf0/why_becoming_a_data_scientist_is_not_actually/,clarkest,1404342625,,9,2,False,http://b.thumbs.redditmedia.com/V6kk7VRCDye_3xwI.jpg,,,,,
15,MachineLearning,t5_2r3gv,2014-7-3,2014,7,3,11,29ph9a,arxiv.org,Deep Learning in Neural Networks: An Overview,https://www.reddit.com/r/MachineLearning/comments/29ph9a/deep_learning_in_neural_networks_an_overview/,[deleted],1404355099,,0,1,False,default,,,,,
16,MachineLearning,t5_2r3gv,2014-7-3,2014,7,3,16,29q2ew,self.MachineLearning,Minimum Description Length,https://www.reddit.com/r/MachineLearning/comments/29q2ew/minimum_description_length/,neeratyoy,1404372488,How can MDL be explained to provide an intuitive understanding of the principle ? What can be its application other than decision tree pruning ?,3,5,False,self,,,,,
17,MachineLearning,t5_2r3gv,2014-7-3,2014,7,3,16,29q2ld,crushingandscreening.wordpress.com,Introduction To High Frequency Vibrating Screen | Crushing &amp; Screening Equipment  Australia,https://www.reddit.com/r/MachineLearning/comments/29q2ld/introduction_to_high_frequency_vibrating_screen/,jessicperson,1404372692,,0,1,False,default,,,,,
18,MachineLearning,t5_2r3gv,2014-7-3,2014,7,3,17,29q5lj,self.MachineLearning,Dropout during pre-training?,https://www.reddit.com/r/MachineLearning/comments/29q5lj/dropout_during_pretraining/,rishok,1404376057,"I know of the possibility of using the dropout technique in combination with the pre-training. 

However, is there anybody who has used it or knows about using dropout during pre-training of an autoencoder?",2,1,False,self,,,,,
19,MachineLearning,t5_2r3gv,2014-7-3,2014,7,3,17,29q69v,self.MachineLearning,Can you post some machine learning projects that have source code included?,https://www.reddit.com/r/MachineLearning/comments/29q69v/can_you_post_some_machine_learning_projects_that/,lucidxistence,1404376934,"I'm trying to learn machine learning by myself and even though I'm beginning to understand the theory, I am very weak in actual programming. 

I want to have a look at source codes of other projects and see if I can understand them. 

Also are the source codes of finished kaggle Challenges available anywhere?",6,3,False,self,,,,,
20,MachineLearning,t5_2r3gv,2014-7-3,2014,7,3,18,29q75z,onlinemachinery.tumblr.com,What Do You Need To Know About Vibrating Screen - Online Machinery,https://www.reddit.com/r/MachineLearning/comments/29q75z/what_do_you_need_to_know_about_vibrating_screen/,jessicperson,1404378113,,0,1,False,default,,,,,
21,MachineLearning,t5_2r3gv,2014-7-3,2014,7,3,21,29qg42,smallbiztrends.com,How Hackathons Paved the Way for a New Machine Learning Platform,https://www.reddit.com/r/MachineLearning/comments/29qg42/how_hackathons_paved_the_way_for_a_new_machine/,digbata,1404388990,,0,0,False,http://b.thumbs.redditmedia.com/3BfbfUqsowkkRBTU.jpg,,,,,
22,MachineLearning,t5_2r3gv,2014-7-3,2014,7,3,21,29qi9n,jmlr.org,Using dynamic topic models to understand musical influence from the 1930s to 2010 (OC) [PDF],https://www.reddit.com/r/MachineLearning/comments/29qi9n/using_dynamic_topic_models_to_understand_musical/,[deleted],1404391033,,0,7,False,default,,,,,
23,MachineLearning,t5_2r3gv,2014-7-3,2014,7,3,23,29qqmd,self.MachineLearning,Can anyone help me grasp multiple readout trajectory projection in relation to echo state networks?,https://www.reddit.com/r/MachineLearning/comments/29qqmd/can_anyone_help_me_grasp_multiple_readout/,[deleted],1404397549,"I can't figure out how the network can be efficiently trained on a k-step ahead output. My best guess so far is to give the network a k-dimensional target signal where each signal is offset by k-steps. So for example, the first input would be the standard target signal, the second would be the target signal with every other step, the third would be every third step and so on. The issue with that is you would need a much longer history for larger values of k and there would be a lot of wasted data.

I would guess you could have a moving window somehow to use all data in the same time period for each k value but I don't see how giving the network non-subsequent data at subsequent windows would work.


The specific paragraph i'm trying to understand is:
&gt; 
&gt; Multiple-readout trajectory projection - In the contrary to feedback-loop,
&gt; this technique immediately predicts the entire output trajectory. This is achieved
&gt; by training k independent outputs, each regressed to predict i'th step-ahead
&gt; value of the target signal, where i C {1,...,k}. In other words, k-dimensional
&gt; output corresponds to predicted future trajectory of the target signal, up to k
&gt; steps ahead.
&gt; 
&gt; ",0,1,False,default,,,,,
24,MachineLearning,t5_2r3gv,2014-7-4,2014,7,4,1,29r50d,self.MachineLearning,Incanter (or statistical work in Clojure in general) resources? (X-post /r/clojure),https://www.reddit.com/r/MachineLearning/comments/29r50d/incanter_or_statistical_work_in_clojure_in/,nikonikolai,1404406524,"Does anyone have any great go-to resources for statistical analysis in Clojure? I mention ""in general"" alongside Incanter to include material on the other possible problems in numeric work like huge datasets, optimizing for speed etc.",6,5,False,self,,,,,
25,MachineLearning,t5_2r3gv,2014-7-4,2014,7,4,3,29rcxf,self.MachineLearning,Expected error of PCA?,https://www.reddit.com/r/MachineLearning/comments/29rcxf/expected_error_of_pca/,Splanky222,1404411232,"On and off for the past few months I have been looking at trying to find a way to get at the expected L2 error when you project a dataset on to a single line.  More specifically, I would like to figure out if there is a bound for the expected ratio of the error using a random line to that of the optimal one, which I believe is given by the first Principal Component of the data set.

Has this sort of thing been done before?",4,0,False,self,,,,,
26,MachineLearning,t5_2r3gv,2014-7-4,2014,7,4,3,29repj,bayesimpact.org,Nonprofit Fellowship to Solve the World's Toughest Problems w/Data Science (x-post r/DataScience),https://www.reddit.com/r/MachineLearning/comments/29repj/nonprofit_fellowship_to_solve_the_worlds_toughest/,BayesImpactTeam,1404412225,,12,20,False,http://a.thumbs.redditmedia.com/4GiG6i5-qpizrRnb.jpg,,,,,
27,MachineLearning,t5_2r3gv,2014-7-4,2014,7,4,4,29rlem,self.MachineLearning,SciPy Image Analysis,https://www.reddit.com/r/MachineLearning/comments/29rlem/scipy_image_analysis/,mskramer,1404416215,"Hey All,

New here. And new to ML. And amateur in python...

Looking for some more information on image analysis using Python. I came across a paper that is in the vein of what I am researching, but it uses WEKA and Java for its image analysis: 

http://www.few.vu.nl/~vbr240/publications/Webist10Names.pdf

Does anyone have any experience here? My end goal is to build the aesthetic component of a tool that evaluates the ""experience"" of websites.",6,0,False,self,,,,,
28,MachineLearning,t5_2r3gv,2014-7-4,2014,7,4,13,29sv9y,69.195.124.161,A breakthrough in Machine Translation: A paper on using Neural Network Joint Models reports unseen gains in translation quality; wins best paper award at top Computational Linguistics conference by a landslide,https://www.reddit.com/r/MachineLearning/comments/29sv9y/a_breakthrough_in_machine_translation_a_paper_on/,boxstabber,1404447429,,28,98,False,default,,,,,
29,MachineLearning,t5_2r3gv,2014-7-4,2014,7,4,16,29t6m5,xenuocmiavietthong.com,"My p nc ma siu sch, Xe nc ma siu sch",https://www.reddit.com/r/MachineLearning/comments/29t6m5/my_p_nc_ma_siu_sch_xe_nc_ma_siu_sch/,[deleted],1404458004,,0,1,False,default,,,,,
30,MachineLearning,t5_2r3gv,2014-7-4,2014,7,4,19,29th3s,self.MachineLearning,Reinforcement Learning for Obstacle Avoidance,https://www.reddit.com/r/MachineLearning/comments/29th3s/reinforcement_learning_for_obstacle_avoidance/,poonwumpa,1404470884,"http://www.cs.utexas.edu/~dana/MLClass/hw7/hw7.html

How would you implement the module in the above link regarding obstacle avoidance?
",4,0,False,self,,,,,
31,MachineLearning,t5_2r3gv,2014-7-5,2014,7,5,0,29tx1h,dssg.io,Data Science for Social Good,https://www.reddit.com/r/MachineLearning/comments/29tx1h/data_science_for_social_good/,turnersr,1404486453,,0,2,False,http://a.thumbs.redditmedia.com/itOBuaYsH8KXikIx.jpg,,,,,
32,MachineLearning,t5_2r3gv,2014-7-5,2014,7,5,4,29ujsd,self.MachineLearning,I have developed an indicator for the stock market and would like help analyzing it. How do I get started?,https://www.reddit.com/r/MachineLearning/comments/29ujsd/i_have_developed_an_indicator_for_the_stock/,dornstar18,1404502116,"http://imgur.com/EB1u55C

Some of the output is above for 5 stocks chosen randomly. The top half of each pages shows the indicator for the last year charted against the 60D return in that equity from that day. On the bottom of that page is the indicator on the X-axis, 30 day change in the indicator on the Y-Axis and returns in that equity as the bubble size. 

I have been investing on my own using this indicator, trying to buy at peaks and sell at valleys and have done decently (given a 4 month time frame of investing). I am looking to try and hire someone who can analyze the data and bring a new level of analysis to changes in the indicator telling us to do one thing and comparing different equity indicators to try and find trend patterns.

I have a lot of interest in data analytics, but I don't have the knowledge base. If I were going to try and find someone to help me analyze this, what kind of skillsets would they have, what kind of background and how would you analyze this?

Is this a machine learning dataset or is it something more simple? Any kind of advice is appreciated. Cross posted on r/statistics",7,0,False,self,,,,,
33,MachineLearning,t5_2r3gv,2014-7-5,2014,7,5,7,29uwi1,self.MachineLearning,Why are extremely randomized trees more efficient than standard Random Forests?,https://www.reddit.com/r/MachineLearning/comments/29uwi1/why_are_extremely_randomized_trees_more_efficient/,BagOfWords1000,1404511695,"Ok so I have learned recently about decision trees, and some of the developments to adress overfitting of such technique. It is not suprising that by combining different decision trees (Random Forest), using subsets of the training data and randomization, lead to a more general solution and therefore less overfitting. 

Then it seems that by completly randomize either the feature selection and the split threshold (this one makes no sense to me) a better method can be developed.

Can someone explain why such method works and why is it better than Random Forests? Is this anyhow different from blindly throw a threshold multiple times and choosing the one that gives the best result?

EDIT:
Thank you all for the insightful comments. I appreciated your views on how and why ERT can potencially be better than RF in some cases. However, as a general overview I would not trust this method for my own research, as in my opinion the statements are until a certain way weak. I hope this had been interesting also for you.",15,10,False,self,,,,,
34,MachineLearning,t5_2r3gv,2014-7-5,2014,7,5,12,29vhmd,self.MachineLearning,"Are giants like Facebook, Google and Baidu making machine learning a big data sport?",https://www.reddit.com/r/MachineLearning/comments/29vhmd/are_giants_like_facebook_google_and_baidu_making/,meandtree,1404530391,"I'm seeing a trend in papers coming from companies with big resources. They're showing results on benchmark datasets by training with additional outside data. Here are a couple examples:

http://arxiv.org/pdf/1403.2802v1.pdf
https://www.facebook.com/publications/546316888800776/

This fundamentally changes the way we interpret benchmark results. Take a look at the 2013 imagenet leaderboard:

http://www.image-net.org/challenges/LSVRC/2013/results.php

Andrew Ng's group released this paper: http://arxiv.org/pdf/1406.7806.pdf

which mentions:
&gt;This work suggests that scaling up model and dataset size
may provide a more direct path than algorithmic modications
for improving ASR systems

Competitors using outside data are being ranked alongside those that didn't. How does the community feel about this trend? Will ML be a competition where whoever has the most data wins?",10,11,False,self,,,,,
35,MachineLearning,t5_2r3gv,2014-7-5,2014,7,5,15,29vs6z,self.MachineLearning,Is my new job a step forward or backwards?,https://www.reddit.com/r/MachineLearning/comments/29vs6z/is_my_new_job_a_step_forward_or_backwards/,ml_throw,1404541652,"Hi there.  I'm not sure if this is the right place for this question, but I can't think of anywhere else where people might know the answer.

Right out of my math masters, I got a job at a start-up where my title was data scientist and my work was building a estimate for the revenue of various apps based on their performance in the app store and a few other metrics.  There was nobody else at the company who did what I did and no real oversight, so I was very self-led.  I did the Andrew Ng course on Coursera, picked up a bunch of O'Reilly books like ""Python for Data Analysis,"" ""Doing Data Science,"" and ""Data Analysis with Open Source Tools.""

Eventually I decided I wanted to move to a company where I could learn from other people.  I ended up taking a job at a cool company under a guy with a really impressive resume.  My new title is data analyst, because he says my experience doesn't qualify me for the data scientist title or role.  But the new job paid more and I thought I could learn a lot.  After a bit of time there, though, I have some misgivings:

- I haven't been asked to use a single ML algorithm; the most mathematically interesting thing I've done is a log-log regression.
- Even simple approaches I've tried, he's asked me to dumb down - one example, we were examining a collection of metrics to see which one had that largest effect on another metric, and I did a simple multivariate linear regression on a bunch of our historical data just to get an idea of what I was looking at.  He said this was unecessary and to just treat each metric as if it was independent from the others.
- Almost all analysis that isn't done in the sql query is done in excel, and any visualization we put in our presentations has to be an excel graph ""so we can go back and tweak it easily.""
- We spend as much time building powerpoint presentations as we do combing through data
- We don't use any of the software that I understand most companies are looking for in new hires - Hadoop, Hive, etc.

So, my question is, is this job really helping me grow my career in data, or am I stuck in a dead end?
",14,12,False,self,,,,,
36,MachineLearning,t5_2r3gv,2014-7-5,2014,7,5,22,29w97k,techeffigy.wordpress.com,Markov Chains  Explained,https://www.reddit.com/r/MachineLearning/comments/29w97k/markov_chains_explained/,[deleted],1404566206,,31,48,False,default,,,,,
37,MachineLearning,t5_2r3gv,2014-7-6,2014,7,6,7,29xffb,quora.com,What is the difference between SVD and matrix factorization in context of recommendation engine?,https://www.reddit.com/r/MachineLearning/comments/29xffb/what_is_the_difference_between_svd_and_matrix/,rrenaud,1404600424,,0,0,False,http://b.thumbs.redditmedia.com/yKRiZnL6ELf1pOZU.jpg,,,,,
38,MachineLearning,t5_2r3gv,2014-7-6,2014,7,6,10,29xste,self.MachineLearning,Spark?,https://www.reddit.com/r/MachineLearning/comments/29xste/spark/,rm999,1404611257,"Does anyone here have experience using Spark? I went to the Spark Summit in SF this week, and my takeaway is that Spark is almost certainly going to be huge because so many practical computations (both in ML and outside it) fall neatly into its computational model. I see wide agreement that Spark will eventually be Hadoop's successor, plus a whole lot more. 

I've been playing with it a bit (mostly mllib), and I like what I've seen so far. I'm curious if any of you have started projects on top of Spark, and if you have recommendations of a good place/community to discuss its applications and development. I couldn't find a subreddit so I started [r/apachespark](http://www.reddit.com/r/apachespark), but I'd rather find an established place to discuss it. ",19,28,False,self,,,,,
39,MachineLearning,t5_2r3gv,2014-7-7,2014,7,7,1,29z3dr,nlpers.blogspot.com,Hal Daume's ACL 2014 picks...,https://www.reddit.com/r/MachineLearning/comments/29z3dr/hal_daumes_acl_2014_picks/,rrenaud,1404662811,,1,25,False,http://b.thumbs.redditmedia.com/sqSGRFqq-cwYsvpW.jpg,,,,,
40,MachineLearning,t5_2r3gv,2014-7-7,2014,7,7,12,2a0qx8,self.MachineLearning,Python theano dot product too slow,https://www.reddit.com/r/MachineLearning/comments/2a0qx8/python_theano_dot_product_too_slow/,purpleladydragons,1404704768,"I've been working on a neural network for a while now. I'm currently held up by a bottleneck from dot product computations I think. There's 5000 time steps for 4 different layers of sizes 3, 3600, 900, and 121 so the matrices are pretty big. I'm using mini batching with batch size 10. I'm using numpy and have tried using theano in order to utilize the GPU. I'm not remotely good with this low level stuff so I'm just assuming that the major bottleneck is IO between GPU and CPU. Profiling the code shows that theano's call function (called every time I try to use a GPU-enabled dot product) takes about .008 seconds (.010 if I use float32). I don't know if this is the best speed I can expect due to sheer size of the matrices or if I'm messing up. My code is about 300 lines long so I'll try to post specific snippets if anyone requests.",5,0,False,self,,,,,
41,MachineLearning,t5_2r3gv,2014-7-7,2014,7,7,16,2a14wp,machine4u.weebly.com,Vibrating Screen Buying Guide - Machine For You,https://www.reddit.com/r/MachineLearning/comments/2a14wp/vibrating_screen_buying_guide_machine_for_you/,jessicperson,1404717329,,0,1,False,default,,,,,
42,MachineLearning,t5_2r3gv,2014-7-7,2014,7,7,18,2a1c65,blog.datumbox.com,Clustering with Dirichlet Process Mixture Model in Java,https://www.reddit.com/r/MachineLearning/comments/2a1c65/clustering_with_dirichlet_process_mixture_model/,datumbox,1404726345,,4,7,False,http://a.thumbs.redditmedia.com/oEuYV08VIDow5m4B.jpg,,,,,
43,MachineLearning,t5_2r3gv,2014-7-7,2014,7,7,22,2a1r6n,youtu.be,Machine Learning Summer School Pittsburgh 2014 live.,https://www.reddit.com/r/MachineLearning/comments/2a1r6n/machine_learning_summer_school_pittsburgh_2014/,matiskay,1404741491,,5,20,False,default,,,,,
