,sbr,sbr_id,date,year,month,hour,day,id,domain,title,full_link,author,created,selftext,num_comments,score,over_18,thumbnail,media_provider,media_thumbnail,media_title,media_description,media_url
122,MachineLearning,t5_2r3gv,2014-7-16,2014,7,16,10,2atjp4,self.MachineLearning,Suggestions for a small Twitter World Cup Project,https://www.reddit.com/r/MachineLearning/comments/2atjp4/suggestions_for_a_small_twitter_world_cup_project/,vantpach,1405475804,"As part of a small school project, I have collected tweets from a few world cup games over the past month.  I was using the 'hash flags' that twitter provided; so if I was grabbing tweets for Brazil vs Colombia I would be searching for '#bra or #col'.

I didn't store all of the information for each tweet, instead I just stored:

* time the tweet was created
* text from the tweet
* language of the tweet
* hashtags
* user location
* user utc offset
* user timezone

I have about 700k tweets for each game.

[Here](http://imgur.com/xS6rJ1I) is something I through together really quickly that demonstrates the volume of tweets based on which hashtags were in the tweet.

The school project is to use this data to preform some sort of machine learning.  Originally I wanted to use the tweet volume to identify potential goals (any spike in the data would be a potential positive), and do some sentiment analysis on each team's tweets to identify the false positives.  The problem with this is that I will have to label the tweets myself.

tldr; I need to use this data to explore some concept in ML or NLP but I don't know what to do.",8,0,False,self,,,,,
123,MachineLearning,t5_2r3gv,2014-7-16,2014,7,16,14,2au3vx,github.com,"Machine Learning frameworks, libraries and software",https://www.reddit.com/r/MachineLearning/comments/2au3vx/machine_learning_frameworks_libraries_and_software/,josephmisiti,1405489785,,13,42,False,http://a.thumbs.redditmedia.com/RK0UnLvQgJ4Kdg9p.jpg,,,,,
124,MachineLearning,t5_2r3gv,2014-7-16,2014,7,16,17,2aubys,scribd.com,Crane Attachments,https://www.reddit.com/r/MachineLearning/comments/2aubys/crane_attachments/,jessicperson,1405498124,,0,1,False,default,,,,,
125,MachineLearning,t5_2r3gv,2014-7-16,2014,7,16,20,2aukmr,self.MachineLearning,"Databases for ""big data"" NLP - how is MongoDB?",https://www.reddit.com/r/MachineLearning/comments/2aukmr/databases_for_big_data_nlp_how_is_mongodb/,in_the_fresh,1405508651,"I am currently working on an NLP project in which I perform semantic analysis on several million social network profiles. As is, they are stored as individual json files on an ec2 instance, each having been scraped from the web. Has anyone had success with NoSQL databases, like MongoDB, for model prototyping and training? Is it going to be a huge hassle to get the several million individual json files into the MongoDB database? 

Thanks in advance!",11,1,False,self,,,,,
126,MachineLearning,t5_2r3gv,2014-7-17,2014,7,17,0,2av5gb,wired.com,(Wired Magazine) Inside the Artificial Brain Thats Remaking the Google Empire,https://www.reddit.com/r/MachineLearning/comments/2av5gb/wired_magazine_inside_the_artificial_brain_thats/,mtnchkn,1405524631,,8,2,False,http://a.thumbs.redditmedia.com/A_21E4lGPDDe2IEV.jpg,,,,,
127,MachineLearning,t5_2r3gv,2014-7-17,2014,7,17,1,2ave5g,self.MachineLearning,How do you estimate the Fisher information matrix from a data set?,https://www.reddit.com/r/MachineLearning/comments/2ave5g/how_do_you_estimate_the_fisher_information_matrix/,oneona,1405529688,"I'm sorry if this is the wrong subreddit but it seems like this must be a trivial question for many of the people active here. Please feel free to point me in the direction of a more appropriate subreddit though if one exists. The question I have is the following:

Suppose I have some black box which given some choice of a fixed number of parameters \theta_{i}, will output a finite amount of data drawn from some unknown distribution which depends on the parameters \theta_{i}. I can vary each parameter in turn and see what the resulting data set looks like. Once I have obtained data sets for a range of parameter values I would then like to estimate the Fisher information matrix for the unknown distribution for a given choice of parameters. Is there a standard way of doing this? It seems like there must be.",8,1,False,self,,,,,
128,MachineLearning,t5_2r3gv,2014-7-17,2014,7,17,9,2awp2c,self.MachineLearning,Seeking a flow chart for selecting an appropriate machine learning or data mining algorithm for a given data set,https://www.reddit.com/r/MachineLearning/comments/2awp2c/seeking_a_flow_chart_for_selecting_an_appropriate/,sleepicat,1405555408,"Does a flow chart exist that helps you quickly decide what type of algorithm is best for answering a certain type of question for a given dataset?

For example, it might suggest one type of algorithm for a classification problem where n &lt; p and another when n &gt; p, then another type of many of your p are collinear or another when many p are simply not predictive, etc. 

Any suggestions?
",3,11,False,self,,,,,
129,MachineLearning,t5_2r3gv,2014-7-17,2014,7,17,10,2awx28,wired.com,So It Begins: Darpa Sets Out to Make Computers That Can Teach Themselves,https://www.reddit.com/r/MachineLearning/comments/2awx28/so_it_begins_darpa_sets_out_to_make_computers/,leewardx,1405560524,,0,0,False,http://b.thumbs.redditmedia.com/tqo_VNRqmorckjLW.jpg,,,,,
130,MachineLearning,t5_2r3gv,2014-7-17,2014,7,17,16,2axp0o,maykhumuiozone.com,Bn ang s dng phng php g  kh mi  t?,https://www.reddit.com/r/MachineLearning/comments/2axp0o/bn_ang_s_dng_phng_php_g__kh_mi__t/,ngoctongvt,1405581190,,0,1,False,default,,,,,
131,MachineLearning,t5_2r3gv,2014-7-17,2014,7,17,16,2axp2h,machineryequipment123.blogspot.com,Purpose Of Using Long Reach Excavator - Machinery &amp; Equipment Part Online,https://www.reddit.com/r/MachineLearning/comments/2axp2h/purpose_of_using_long_reach_excavator_machinery/,jessicperson,1405581244,,0,1,False,default,,,,,
132,MachineLearning,t5_2r3gv,2014-7-17,2014,7,17,16,2axqle,self.MachineLearning,Machine Learning with Computer Vision,https://www.reddit.com/r/MachineLearning/comments/2axqle/machine_learning_with_computer_vision/,fight_off_thy_demons,1405582837,"Say I have a gray scale image, 640x480 pixels, like this image: http://www.chiefdelphi.com/media/photos/39147 How plausible would it be to train a neural network, with the input of each pixel, to calculate distance? In my training data, I would load in thousands of images with corresponding distances.. I think this would be really cool way of doing computer vision to find the distance to a target. 

And how long would it take, approximately, to go through one calculation for a new image?",11,3,False,self,,,,,
133,MachineLearning,t5_2r3gv,2014-7-17,2014,7,17,20,2ay1kc,self.MachineLearning,Feature Extraction using wavelets,https://www.reddit.com/r/MachineLearning/comments/2ay1kc/feature_extraction_using_wavelets/,subszero,1405595764,"Hi,

I am currently working with the WISDM dataset [WISDM](http://www.cis.fordham.edu/wisdm/dataset.php) which contains accelerometer data. I am attempting to perform **activity recognition** using this dataset.

I tried initially with time series data and got decent results for sequence prediction (~87%). I am now looking to improve the results by using **wavelet features**.

I am using the pyWavelets library [pyWavelets](http://www.pybytes.com/pywavelets/) for this purpose. I am not really familiar with wavelets, but am currently using the 'db3' wavelet and trying out the approximate and detail coefficients at different levels (1,2,3,4) as features.

Sadly, my results have not been encouraging. Can you guys suggest techniques to extract wavelet features in a better way ?",1,5,False,self,,,,,
134,MachineLearning,t5_2r3gv,2014-7-17,2014,7,17,22,2aya7k,self.MachineLearning,"If you were hiring/admitting to programs in Machine Learning, what would you expect them to know?",https://www.reddit.com/r/MachineLearning/comments/2aya7k/if_you_were_hiringadmitting_to_programs_in/,TheDrownedKraken,1405603710,"This is really two separate questions, one for hiring and one for admission to schools, but I'm just curious what you're answers are. I read somewhere that someone said they'd expect you to be familiar with and have implemented dozens of advanced algorithms. However, they didn't give any examples of what they considered *advanced*. 

I ask because I'm extremely interested in the subject, and I consider myself familiar on a surface/basic understanding level.  I'd like to go get my PhD in Statistics next year, and I want to focus on machine learning/statistical learning. I'd like to start getting into the deeper things now though.",13,5,False,self,,,,,
135,MachineLearning,t5_2r3gv,2014-7-17,2014,7,17,23,2aydzu,self.MachineLearning,"Do you enjoy your job? If you could do it over again, what would you do differently?",https://www.reddit.com/r/MachineLearning/comments/2aydzu/do_you_enjoy_your_job_if_you_could_do_it_over/,rorschach13,1405606328,"Quick background: I'm an aerospace engineer getting my PhD (I've been aero all the way through BS/MS/PhD). My master's degree ended up being built around computer vision, and my PhD has evolved to the point that it has become a massive machine learning problem. I've discovered a passion for machine learning over the last few years. I will likely break away from aerospace when I finish up my PhD.

My question for you - if you have a job in ML, do you enjoy it? Do you feel like you are able to use your creative talents? What is the work culture like? If you could do it all over again, would you choose ML or would you go into a different field?

Finally, and only tangentially related - do you have any other advice? (beyond the usual ""take the Coursera class, do Kaggle competitions, etc."")",26,22,False,self,,,,,
136,MachineLearning,t5_2r3gv,2014-7-18,2014,7,18,2,2ayycp,self.MachineLearning,"[ANN] TH++(C++ tensor library), FBLuaLib (Torch / Lua components)",https://www.reddit.com/r/MachineLearning/comments/2ayycp/ann_thc_tensor_library_fblualib_torch_lua/,tudorb,1405617995,"Torch (http://torch.ch/) is a scientific computing framework heavily used in the machine learning community. We have been using it in Facebook AI Research, and we've extended it to suit our needs; today we're releasing some of these extensions to the community at large, with more to come in the future:

* A C++ tensor library based on the library underpinning Torch's functionality, https://github.com/facebook/thpp
* A bridge between Lua / Torch and Python, allowing seamless integration between the two, https://github.com/facebook/fblualib/tree/master/fblualib/python (for example, using SciPy (http://scipy.org/) with Torch becomes easy)
* A fast serialization library for Lua / Torch (https://github.com/facebook/fblualib/tree/master/fblualib/thrift) using Thrift (https://github.com/facebook/fbthrift) as the interchange format, facilitating easy sharing of large amounts of data among code written in multiple languages
* A fully-featured source debugger for Lua / Torch (https://github.com/facebook/fblualib/tree/master/fblualib/debugger)
* ... and more; see https://github.com/facebook/fblualib for the full list.

We hope that other researchers will find these components useful as well.",4,23,False,self,,,,,
137,MachineLearning,t5_2r3gv,2014-7-18,2014,7,18,4,2azdpc,lauradhamilton.com,10 Tips for Better Deep Learning Models,https://www.reddit.com/r/MachineLearning/comments/2azdpc/10_tips_for_better_deep_learning_models/,emperor-penguin,1405626398,,0,0,False,default,,,,,
138,MachineLearning,t5_2r3gv,2014-7-18,2014,7,18,4,2azes2,blogs.wsj.com,Germanys 12th Man at the World Cup: Big Data,https://www.reddit.com/r/MachineLearning/comments/2azes2/germanys_12th_man_at_the_world_cup_big_data/,[deleted],1405626988,,1,0,False,default,,,,,
139,MachineLearning,t5_2r3gv,2014-7-18,2014,7,18,5,2aziht,machinesolutions.ca,press brake tooling ontario - Machine Solutions Inc,https://www.reddit.com/r/MachineLearning/comments/2aziht/press_brake_tooling_ontario_machine_solutions_inc/,machineryguide101,1405628963,,2,0,False,default,,,,,
140,MachineLearning,t5_2r3gv,2014-7-18,2014,7,18,15,2b10rl,ideasfor.com.au,Ideas and Tips for Choosing the Right Mining Equipment - Ideas For Blog,https://www.reddit.com/r/MachineLearning/comments/2b10rl/ideas_and_tips_for_choosing_the_right_mining/,jessicperson,1405666685,,0,1,False,default,,,,,
141,MachineLearning,t5_2r3gv,2014-7-18,2014,7,18,22,2b1kre,techcrunch.com,"Unbabel Raises $1.5M To Expand Translation Service, Grow Customer Base",https://www.reddit.com/r/MachineLearning/comments/2b1kre/unbabel_raises_15m_to_expand_translation_service/,gracaninja,1405689073,,0,0,False,http://b.thumbs.redditmedia.com/-yZeQnw9CkGlB_gI.jpg,,,,,
142,MachineLearning,t5_2r3gv,2014-7-19,2014,7,19,1,2b20ct,self.MachineLearning,What are appropriate validation methods for a Bayesian network model with low sample size?,https://www.reddit.com/r/MachineLearning/comments/2b20ct/what_are_appropriate_validation_methods_for_a/,SymphMeta,1405699410,"I am currently using a Bayesian network model with 20 variables and 210 data points, with 15 locations measured at 14 different time points each. There are also some restrictions on what types of connections are allowed.

I have looked at leave-one-out cross-validation methods (and arguably leave-two-out would be computationally feasible with this sample size), and I am currently using that method.  However, I want to know which of the following, if any, are appropriate means of going about this:

1. k-fold cross-validation, leaving out a single location (14 points).  My main concern is that if the model were to be applied to locations not sampled, it is quite possible that correlations within a single locations's set of measurements may be unnecessarily influential on a model.  Additionally, it's been suggested that k-fold cross-validation produces better results for simpler models such as linear regression. ^[1] . Since my sample size is small, however, I'm not sure how much I can afford to cut out.


2. Bagging (bootstrap aggregating) ^[3] .  I've mostly seen this method applied to decision trees, but it's used to avoid overfitting.  

3. Jacknifing to determine the properties of the estimators being derived.  

Additionally, one interesting property (at least for the datasets used in Zuk et al. ^[2] ) of the Bayesian Networks is that underfitting decays exponentially fast with sample size, whereas overfitting decays as a power of N.  Keeping that in mind, I am trying to decide what methods are most appropriate for my scenario.

Sources used:

^1 [FAQs.org: What are cross-validation and bootstrapping?](http://www.faqs.org/faqs/ai-faq/neural-nets/part3/section-12.html)

^2 [Zuk et al. ""On the Number of Samples Needed to Learn the Correct Structure of a Bayesian Network"".](http://arxiv.org/ftp/arxiv/papers/1206/1206.6862.pdf)

^3 [Elidan, Gel. ""Bagged Learning Structure of Bayesian Networks"".](http://jmlr.org/proceedings/papers/v15/elidan11a/elidan11a.pdf)

__________________________

I asked this question on [cross-validated](http://stats.stackexchange.com/questions/108355/what-are-appropriate-validation-methods-for-a-bayesian-network-model-with-low-sa), although the only response was that leave-one-out cross-validation is preferable to bagging, and the explanation was not super-detailed.",0,18,False,self,,,,,
143,MachineLearning,t5_2r3gv,2014-7-19,2014,7,19,3,2b2g88,hakkalabs.co,Spectral Algorithms for Learning Latent Variable Models,https://www.reddit.com/r/MachineLearning/comments/2b2g88/spectral_algorithms_for_learning_latent_variable/,BKDev,1405708470,,1,0,False,default,,,,,
144,MachineLearning,t5_2r3gv,2014-7-19,2014,7,19,15,2b46mj,self.MachineLearning,Two rookie questions about randomforest,https://www.reddit.com/r/MachineLearning/comments/2b46mj/two_rookie_questions_about_randomforest/,[deleted],1405752240,"Hi,

1. I have experimented with implementing Random Forests with Salford Predictive Modeler, and the R library caret. Salford Predictive Modeler regularly yields higher r^2 values than I can produce using caret. Does anyone have any idea why?  I would expect caret to outperform Salford Systems, given it's supposedly enlightened recursive feature elimination.


2. I would expect model r^2 to go up consistently with the number of predictors used. But I frequently find that the strongest model uses only a few predictors, and r^2 goes down as I add more. How can this be?

Thanks a lot!",2,0,False,default,,,,,
145,MachineLearning,t5_2r3gv,2014-7-19,2014,7,19,16,2b49zi,theclevermachine.wordpress.com,MCMC: Hamiltonian Monte Carlo (a.k.a. Hybrid Monte Carlo).,https://www.reddit.com/r/MachineLearning/comments/2b49zi/mcmc_hamiltonian_monte_carlo_aka_hybrid_monte/,qkdhfjdjdhd,1405756094,,6,31,False,http://b.thumbs.redditmedia.com/I3WPbNBzuADgejLk.jpg,,,,,
146,MachineLearning,t5_2r3gv,2014-7-19,2014,7,19,21,2b4nxd,self.MachineLearning,[ELI5] Singular Value Decomposition,https://www.reddit.com/r/MachineLearning/comments/2b4nxd/eli5_singular_value_decomposition/,reidhoch,1405774776,"I'm having trouble understanding SVD, how would you explain it to a child?",9,8,False,self,,,,,
147,MachineLearning,t5_2r3gv,2014-7-19,2014,7,19,22,2b4oon,self.MachineLearning,Question on linear SVMs and curse of dimensionality,https://www.reddit.com/r/MachineLearning/comments/2b4oon/question_on_linear_svms_and_curse_of/,Er4zor,1405775610,"Hello, for a project I'm trying to analyze a binary SVM classifier on a set of images. Each image is represented by a vector of 330 values in [0,1], which sum up to 1.  

(I won't explain what those features represent: it would be useless since they lack a clear meaning. Actually, my goal is to try to explain what does the classifier learn from the set)

My training set comprises 1500 training samples (hence with a set of corresponding binary labels), with over 5000 test samples.

As you can see, the dimensionality of the problem is rather high: the data matrix has 1500 rows and 330 columns. Still, I am able to train a linear SVM on 4/5th of the training set, and achieve over 95% accuracy on the remaining 1/5th part of the training set.

I am using LIBLINEAR, with L^2 regularization and L^2 loss function. 

I also made sure to not overfit in any way: inside the 4/5ths I perform feature transformation (z-score normalization) and SVM calibration with an additional 5-fold CV.

What's more interesting is that the same SVM still achieves around 88% of accuracy over the entire test set, which is almost four times as big as the full training set. Results are very robust to choice of cross-validation set.

Why does it perform so well, despite the curse of dimensionality? Is it a general (unexpected?) characteristic of SVMs? Also, do I need to do some sort of dimensionality reduction? (bear in mind that it is impossible to put any meaningful probabilistic structure on the features, hence no LDA, QDA, etc.)

My ansatz is that the classes are truly well-separated, both in the training and in the test set. Still, marginal feature distributions are almost overlapped between classes (although I know that this happens easily, even on R^2), and no feature is particularly dominant over the others, judging by the SVM hyperplane coefficients. However, I would like to rule out the dimensionality effect, to be sure of having obtained a good classifier.

Thank you!",12,4,False,self,,,,,
148,MachineLearning,t5_2r3gv,2014-7-20,2014,7,20,0,2b4xl2,self.MachineLearning,Automated feature extraction,https://www.reddit.com/r/MachineLearning/comments/2b4xl2/automated_feature_extraction/,Regentag,1405783557,"Hello guys,

is there any research done on ""Automated feature extraction""? Any ideas how to realize such a method?

I appreciate your answer!",8,6,False,self,,,,,
149,MachineLearning,t5_2r3gv,2014-7-20,2014,7,20,3,2b5clb,projectbotticelli.com,Azure Machine Learning: A Brief Introduction,https://www.reddit.com/r/MachineLearning/comments/2b5clb/azure_machine_learning_a_brief_introduction/,RockDiesel,1405793846,,1,1,False,http://a.thumbs.redditmedia.com/TnDm-nW3B2bDAP0z.jpg,,,,,
150,MachineLearning,t5_2r3gv,2014-7-20,2014,7,20,11,2b6gsp,self.MachineLearning,Easy way to convert text to low-dimensional representation,https://www.reddit.com/r/MachineLearning/comments/2b6gsp/easy_way_to_convert_text_to_lowdimensional/,alexmlamb,1405822385,"Are there any easy ways to convert a small block of text (10-100 words) into a &lt;1000 dimensional feature vector?  One solution that I'm considering is doing an n-gram encoding, then using random projections to reduce the dimensionality.  ",5,3,False,self,,,,,
151,MachineLearning,t5_2r3gv,2014-7-20,2014,7,20,13,2b6suc,projecteuclid.org,Leo Breiman -- Statistical Modeling: The Two Cultures (with comments and a rejoinder by the author),https://www.reddit.com/r/MachineLearning/comments/2b6suc/leo_breiman_statistical_modeling_the_two_cultures/,carmichael561,1405831863,,3,36,False,http://a.thumbs.redditmedia.com/D0WoG249OKeBbm9Z.jpg,,,,,
152,MachineLearning,t5_2r3gv,2014-7-20,2014,7,20,20,2b7bk7,self.MachineLearning,"Multivariate data mining to extract relevant ""business"" plots?",https://www.reddit.com/r/MachineLearning/comments/2b7bk7/multivariate_data_mining_to_extract_relevant/,Gere1,1405854631,"How would you approach multivariate data analysis, if you want to create ""ordinary"" plots for business where one variable is plotted against another and some meaningful statement is in the plot?

I assume that there is no clear supervised setting, but that some general correlations or causal relations should be extracted. For example I have table-like data for travel orders with customer data, departure, arrival, destination, price, duration of stay, etc.
In a plot I can visualize three dimensions: x, y and color. I can also drill down by one another variable, by creating multiple plots filtered on this variable. Candidates for quantities are the variables and possible aggregations on numerical variables (prize sum, prize per day mean, ...).

*I would like to data-mine for interesting relations/plots as automatized as possible.*

Some ideas are to find 2-variable correlations or 3-variables correlations with lift. Maybe you can automatize it so that valid thresholds are taken? Maybe some graph network analysis would help for causal relationships? Because a plot with some relations could be explained by another variable indirectly. Maybe Random Forests could determine relevant or correlated variables somehow? I could state that variables that have high correlation (e.g. prize and destination) should always be picked together for a plot.

Of course, an algorithm trained on this data would be most accurate, however, I cannot delivery program code, but it should be plots instead.

Do you have any ideas how to decide which of the many combinations for plots are candidates for interesting relations?",2,6,False,self,,,,,
153,MachineLearning,t5_2r3gv,2014-7-21,2014,7,21,8,2b8wpq,metacademy.org,Level-Up Your Machine Learning,https://www.reddit.com/r/MachineLearning/comments/2b8wpq/levelup_your_machine_learning/,RockDiesel,1405898162,,29,73,False,http://b.thumbs.redditmedia.com/g7WSfSN8S90Vmq1M.jpg,,,,,
154,MachineLearning,t5_2r3gv,2014-7-21,2014,7,21,10,2b973c,self.MachineLearning,[Fun] Here are some tough classification problems . . .,https://www.reddit.com/r/MachineLearning/comments/2b973c/fun_here_are_some_tough_classification_problems/,[deleted],1405905154,"http://www.reddit.com/r/misleadingthumbnails

Wow.",0,0,False,self,,,,,
155,MachineLearning,t5_2r3gv,2014-7-21,2014,7,21,13,2b9pg9,dynamicyield.com,Doing Data Science in a Startup: The Hard Truth,https://www.reddit.com/r/MachineLearning/comments/2b9pg9/doing_data_science_in_a_startup_the_hard_truth/,ynavot,1405917980,,1,0,False,http://a.thumbs.redditmedia.com/c62zuXwia920AkQT.jpg,,,,,
156,MachineLearning,t5_2r3gv,2014-7-21,2014,7,21,16,2ba15g,realtechsupport.org,Introduction to Machine Learning by Ethem Alpaydin,https://www.reddit.com/r/MachineLearning/comments/2ba15g/introduction_to_machine_learning_by_ethem_alpaydin/,TwilyS,1405928877,,0,6,False,default,,,,,
157,MachineLearning,t5_2r3gv,2014-7-21,2014,7,21,17,2ba22a,machineryequipment123.blogspot.com,What Do Telehandlers Offer - Machinery &amp; Equipment Part Online,https://www.reddit.com/r/MachineLearning/comments/2ba22a/what_do_telehandlers_offer_machinery_equipment/,jessicperson,1405929997,,0,1,False,default,,,,,
158,MachineLearning,t5_2r3gv,2014-7-21,2014,7,21,22,2baj3j,self.MachineLearning,Best Machine Learning Blogs; Suggestions?,https://www.reddit.com/r/MachineLearning/comments/2baj3j/best_machine_learning_blogs_suggestions/,ilikebigdata,1405948409,Looking for the best websites and blogs specifically dedicated to machine learning; what should I read?,7,14,False,self,,,,,
159,MachineLearning,t5_2r3gv,2014-7-21,2014,7,21,22,2baj8x,self.MachineLearning,Question about the Dropout technique,https://www.reddit.com/r/MachineLearning/comments/2baj8x/question_about_the_dropout_technique/,rishok,1405948512,"I Understand that you apply Dropout for every training set in order to get multiple sub-models to train ones network on. However, do you create new set of sub-models for next iteration (apply Dropout for every training set again) or do you keep set reuse the sub-models?",8,3,False,self,,,,,
