,sbr,sbr_id,date,year,month,hour,day,id,domain,title,full_link,author,created,selftext,num_comments,score,over_18,thumbnail,media_provider,media_thumbnail,media_title,media_description,media_url
80,MachineLearning,t5_2r3gv,2014-7-11,2014,7,11,21,2af3y8,self.MachineLearning,Biologically Plausible Learning Algorithms in ANN's,https://www.reddit.com/r/MachineLearning/comments/2af3y8/biologically_plausible_learning_algorithms_in_anns/,NeuroCavalry,1405080557,"Hi MachineLearning, 

Let me preface this with an apology. I'm not sure if this is the right subreddit for this question. CogSci seems more interested in the philosophical side of Neural Networks, and Neuro is obviously more interested in straight Neuroscience. If you feel this is the wrong subreddit, feel free to ignore this and, mods, please lock it - but in this case, a pointer in the right direction would be great. 

A friend and I were introduced to Neural Networks by a professor. I am a Neuroscience student, he is a Computer Science student. For the purposes of curiosity and learning, we have decided to try our hand at them.  He has already made a few with good results. 

At the moment we are building an ANN with a special focus on adherence to known Neuroscience.  Whereas before, we were using some basic positive/negative reinforcement for our learning, now we are looking at more closely modelling synaptic plasticity - probably with some variation of Hebbian Learning. At present, we have implemented Oja's rule, But I was wondering what else where was out there. The Neuroscientist in me bristles at some of the assumptions and foundations of Oja's rule (especially the default 'decaying' of synapatic weight), so I was wondering if there were any papers presenting algorithms more closely based on long-term potentiation and long-term depression. I've been searching via my university library, but it has been fruitless so far. 

Any references would be a great help, and thank you in advance.",15,10,False,self,,,,,
81,MachineLearning,t5_2r3gv,2014-7-11,2014,7,11,21,2af4e7,self.MachineLearning,Google Analytics research,https://www.reddit.com/r/MachineLearning/comments/2af4e7/google_analytics_research/,zibenmoka,1405081009,Is there any known scientific research on Google Analytics data in the context of classification problem ?,4,0,False,self,,,,,
82,MachineLearning,t5_2r3gv,2014-7-11,2014,7,11,21,2af55f,sebastianraschka.com,About Feature Scaling: Z-Score Standardization and Min-Max Scaling (+ how to in Python),https://www.reddit.com/r/MachineLearning/comments/2af55f/about_feature_scaling_zscore_standardization_and/,rasbt,1405081661,,1,8,False,http://b.thumbs.redditmedia.com/RgETG-byKij51E3M.jpg,,,,,
83,MachineLearning,t5_2r3gv,2014-7-11,2014,7,11,23,2afeet,self.MachineLearning,Seeking Industry Leading Algorithm Developer Connections,https://www.reddit.com/r/MachineLearning/comments/2afeet/seeking_industry_leading_algorithm_developer/,[deleted],1405088897,"I work for a large healthcare organization who is seeking to develop a telehealth program to better predict clinical outcomes of our patients.

We are seeking the leading minds from outside the healthcare industry in algorithm development from other industries.

How can I best connect with these experts from organization like Amazon, Netflix, eBay, etc.?

Please feel free to also PM me if you are one of them - or connected to them -and interested in helping out.",4,0,False,self,,,,,
84,MachineLearning,t5_2r3gv,2014-7-11,2014,7,11,23,2afgv1,jvns.ca,Fun with stats: How big of a sample size do I need?,https://www.reddit.com/r/MachineLearning/comments/2afgv1/fun_with_stats_how_big_of_a_sample_size_do_i_need/,bork,1405090382,,0,0,False,default,,,,,
85,MachineLearning,t5_2r3gv,2014-7-12,2014,7,12,0,2afl9k,dataconomy.com,Numenta: Technologies Which Can Mimic How the Brain Works,https://www.reddit.com/r/MachineLearning/comments/2afl9k/numenta_technologies_which_can_mimic_how_the/,[deleted],1405093047,,0,1,False,default,,,,,
86,MachineLearning,t5_2r3gv,2014-7-12,2014,7,12,20,2ai5jq,blog.cigrainger.com,Using Python to determine the natural number of topics for Latent Dirichlet Allocation,https://www.reddit.com/r/MachineLearning/comments/2ai5jq/using_python_to_determine_the_natural_number_of/,heisakukosawa,1405164778,,6,16,False,http://b.thumbs.redditmedia.com/q-Tany7cBmIDhN8C.jpg,,,,,
87,MachineLearning,t5_2r3gv,2014-7-13,2014,7,13,0,2aiilg,stackoverflow.com,"Question I posted on Stack Overflow: ""Binary classification of dated documents with seasonal class variation""",https://www.reddit.com/r/MachineLearning/comments/2aiilg/question_i_posted_on_stack_overflow_binary/,briandastous,1405178371,,0,1,False,http://a.thumbs.redditmedia.com/80tnunXhQJXBAP3L.jpg,,,,,
88,MachineLearning,t5_2r3gv,2014-7-13,2014,7,13,1,2aiqmk,leon.bottou.org,The infinite MNIST dataset,https://www.reddit.com/r/MachineLearning/comments/2aiqmk/the_infinite_mnist_dataset/,urish,1405184340,,1,7,False,default,,,,,
89,MachineLearning,t5_2r3gv,2014-7-13,2014,7,13,3,2aiy4h,self.MachineLearning,Polarity sentiment analysis for non English language,https://www.reddit.com/r/MachineLearning/comments/2aiy4h/polarity_sentiment_analysis_for_non_english/,reizelx,1405189710,"hi, I need to analize few texts in non English language. For English there are many free tools that do that for me, but not in my language. One my friend that studies IT said that I could get English word polrity table (table that represents words and their positive/negative value) and give to traslators to translate.

Any one has idea where i could get English word polarity table, or its technical name, so iI could lok for. So far no luck :(",1,0,False,self,,,,,
90,MachineLearning,t5_2r3gv,2014-7-13,2014,7,13,6,2ajcl9,self.MachineLearning,Implementation details of Olshausen and Fields sparse coding paper in Nature,https://www.reddit.com/r/MachineLearning/comments/2ajcl9/implementation_details_of_olshausen_and_fields/,entron,1405199882,"I want to find a working implementation of the 1996 Nature paper **Emergence of simple-cell receptive field properties by learning a sparse code for natural images**  or the authors' other paper with more details published on Vision Research **Sparse coding with an overcomplete basis set: a strategy employed by V1?** to help me learn their method.

They have a matlab version calling c implementation of fast conjugate gradient [here](http://redwood.berkeley.edu/bruno/sparsenet/). However I haven't successfully made in run on my computer. Does anyone have code available (preferably in python) reproduced their results?

Another question is what is the reasoning behind the ""rate parameter for the gain adjustment"" $\alpha$ in Eq.(18) of the second paper?",0,1,False,self,,,,,
91,MachineLearning,t5_2r3gv,2014-7-13,2014,7,13,7,2ajjxs,cs.pitt.edu,Quoc Les Lectures on Deep Learning,https://www.reddit.com/r/MachineLearning/comments/2ajjxs/quoc_les_lectures_on_deep_learning/,x2342,1405205061,,1,29,False,default,,,,,
92,MachineLearning,t5_2r3gv,2014-7-13,2014,7,13,19,2akqaq,datasciencecentral.com,Curse of Dimensionality,https://www.reddit.com/r/MachineLearning/comments/2akqaq/curse_of_dimensionality/,neeratyoy,1405246169,,6,24,False,http://a.thumbs.redditmedia.com/29UaB_BpqVP6-O_R.jpg,,,,,
93,MachineLearning,t5_2r3gv,2014-7-14,2014,7,14,4,2alsx0,bugra.github.io,Discrete Cosine Transform and A Case Study on Image Compression,https://www.reddit.com/r/MachineLearning/comments/2alsx0/discrete_cosine_transform_and_a_case_study_on/,[deleted],1405280704,,0,0,False,default,,,,,
94,MachineLearning,t5_2r3gv,2014-7-14,2014,7,14,5,2alum3,self.MachineLearning,"New intern, a bit terrified by my dataset. OK to ask questions in this sub?",https://www.reddit.com/r/MachineLearning/comments/2alum3/new_intern_a_bit_terrified_by_my_dataset_ok_to/,[deleted],1405281884,"Alright, the situation is that I have an unpaid gig on a healthcare policy project with one hell of a (well, to me) dataset.  

I'm dealing with about 70k rows and 300+ features.  Some features are categorical, some continuous vars.  Definite structure in the dataset as well.

I need to do some amount of exploratory analysis.  My ultimate goal is to find a way to cluster the individuals in my dataset, then explore those clusters (WHY are those individuals alike?) and also identify outliers who don't fit well into ANY cluster.

I'd dearly love to pull out FactoMineR and go to town, but it's not built for a dataset of this size.

Any advice on packages/environments?

Or, am I in No Man's Land and I have to design my own solution?

**EDIT:** Will give you guys an update once I get cleared and allowed to access the true, actual data itself.  You were right- the first step is simply to apply the machine learning located between my ears in order to make a first pass on what matters and what doesn't.  OP will deliver.  But without divulging anything inappropriate, as /u/cavedave was right to point out.",8,8,False,default,,,,,
95,MachineLearning,t5_2r3gv,2014-7-14,2014,7,14,6,2am2rh,youtube.com,All CMU Machine Learning Summer School lecture videos online now,https://www.reddit.com/r/MachineLearning/comments/2am2rh/all_cmu_machine_learning_summer_school_lecture/,egrefen,1405287725,,4,85,False,http://a.thumbs.redditmedia.com/yqL6XFKnOgIL27GP.jpg,,,,,
96,MachineLearning,t5_2r3gv,2014-7-14,2014,7,14,8,2amai9,blog.twitter.com,Goal! Detecting the most important World Cup moments | Twitter Blogs,https://www.reddit.com/r/MachineLearning/comments/2amai9/goal_detecting_the_most_important_world_cup/,a_jey,1405292559,,0,2,False,http://a.thumbs.redditmedia.com/3dh8_OhsV5MRybCt.jpg,,,,,
97,MachineLearning,t5_2r3gv,2014-7-14,2014,7,14,11,2amqz6,self.MachineLearning,Motorcyclist detection,https://www.reddit.com/r/MachineLearning/comments/2amqz6/motorcyclist_detection/,[deleted],1405303955,"Hello

I try to detect motorcyclists on a videostream and I'd like to try out these hot deep learning models. I've found a promising article from LeCun's lab (Pedestrian Detection with Unsupervised Multi-Stage Feature Learning: http://cs.nyu.edu/~sermanet/papers/sermanet-cvpr-13.pdf) and going to stick with it. But i'd also like to hear community opinions on my problem.

Do you know other approaches? Or do you have something to say about aforementioned paper?
Thanks in advance.
P.S. I'm not interested in computer vision's hand-engineered features since I want to play with deep learning",1,1,False,default,,,,,
98,MachineLearning,t5_2r3gv,2014-7-14,2014,7,14,16,2and4j,machineryequipment123.blogspot.com,What To Consider When Choosing Wheeled Excavator - Machinery &amp; Equipment Part Online,https://www.reddit.com/r/MachineLearning/comments/2and4j/what_to_consider_when_choosing_wheeled_excavator/,jessicperson,1405321502,,0,1,False,default,,,,,
99,MachineLearning,t5_2r3gv,2014-7-14,2014,7,14,18,2anj4v,maykhumuiozone.com,Kh mi hi ca du m trong nh bp n gin vi my Ozone,https://www.reddit.com/r/MachineLearning/comments/2anj4v/kh_mi_hi_ca_du_m_trong_nh_bp_n_gin_vi/,ngoctongvt,1405328703,,0,0,False,default,,,,,
100,MachineLearning,t5_2r3gv,2014-7-14,2014,7,14,18,2anjd1,colah.github.io,Understanding Convolutions,https://www.reddit.com/r/MachineLearning/comments/2anjd1/understanding_convolutions/,egrefen,1405328980,,7,39,False,http://a.thumbs.redditmedia.com/1twbojaAzC8mNhb8.jpg,,,,,
101,MachineLearning,t5_2r3gv,2014-7-14,2014,7,14,21,2anuch,self.MachineLearning,How to test whether there is a significant difference in mean squared error between two datasets? (cross-post from /r/statistics),https://www.reddit.com/r/MachineLearning/comments/2anuch/how_to_test_whether_there_is_a_significant/,alexgmcm,1405341692,"I want to test whether Alzheimer's disease causes a change in brain aging compared to healthy patients.

Therefore I have constructed a linear regression model of spectral parameters of brain recordings versus age (age is the independent variable).

Now I wish to fit the model on the healthy patients, and then use the coefficients to calculate the expected age of the Alzheimer's patients - comparing the mean squared error of the healthy dataset and the Alzheimer's dataset should help show whether or not there is a difference to the aging due to the disease. (i.e. if the model that works well for healthy patients fails miserably for Alzheimer's patients then there is probably a difference)

I guess I will fit the linear regression model on 80% of the healthy patients (the training set), holding back 20% (as a test set) to calculate the MSE with because it seems unfair to calculate the MSE on data that the model was trained on and compare it to a dataset which the model never saw.

I would use cross-validation but then I will end up with as many different sets of coefficients as I have folds and how would I know which to fit the Alzheimer's patients with? The mean of the coefficients perhaps? An advantage to cross validation though is that I would have a mean and standard deviation of the MSE  estimates from the sets of healthy patients so I could use that to determine the significance of deviation between the healthy and diseased MSE's, which is handy.

I guess I could also sample subsets many times from the Alzheimer's patients and create a set of MSE estimates which I could then calculate the standard deviation and mean of to get some idea of the variance there as well so I have an idea about how sensitive it is to that particular dataset. (Should I do this with replacement i.e. bootstrapping? Why or why not?)

Any advice is greatly appreciated.",0,0,False,self,,,,,
102,MachineLearning,t5_2r3gv,2014-7-14,2014,7,14,21,2anvkp,wired.co.uk,Algorithm identifies rare genetic disorders from family pics,https://www.reddit.com/r/MachineLearning/comments/2anvkp/algorithm_identifies_rare_genetic_disorders_from/,cavedave,1405342749,,3,17,False,http://b.thumbs.redditmedia.com/Y-WUzv_NiI8CC2QY.jpg,,,,,
103,MachineLearning,t5_2r3gv,2014-7-14,2014,7,14,22,2anzao,electronicsforu.com,15 Free eBooks On Machine Learning,https://www.reddit.com/r/MachineLearning/comments/2anzao/15_free_ebooks_on_machine_learning/,rasbt,1405345688,,3,28,False,http://b.thumbs.redditmedia.com/kbnNQ8FnVbeB4IYu.jpg,,,,,
104,MachineLearning,t5_2r3gv,2014-7-15,2014,7,15,1,2aohti,wired.com,The AI Startup Google Should Probably Snatch Up Fast,https://www.reddit.com/r/MachineLearning/comments/2aohti/the_ai_startup_google_should_probably_snatch_up/,Historical_Fiction,1405356868,,0,0,False,http://a.thumbs.redditmedia.com/Hs6by-YhzXpqOkqb.jpg,,,,,
105,MachineLearning,t5_2r3gv,2014-7-15,2014,7,15,2,2aomie,dataconomy.com,LinkedIn Acquires Machine Learning Startup Newsle,https://www.reddit.com/r/MachineLearning/comments/2aomie/linkedin_acquires_machine_learning_startup_newsle/,[deleted],1405359438,,0,1,False,default,,,,,
106,MachineLearning,t5_2r3gv,2014-7-15,2014,7,15,4,2aoy2m,self.MachineLearning,Scientific research about machine learning and the real estate market,https://www.reddit.com/r/MachineLearning/comments/2aoy2m/scientific_research_about_machine_learning_and/,Regentag,1405365557,"Hello guys,

I am a private researcher on various machine learning topics. I would like to solve some open problems using machine learning within the real estate market. Some problems, where machine learning and real estate is connected are automated valuation models.(I cannot find a lot of research and open problems with this keyword ;( ) However, I am looking for current problems to work on, which connect real estate and machine learning together.

Is there any scientific research done in this field? What are current problems to work and research on?

Would appreciate papers/keywords and ideas!!!

Best regards!
",4,0,False,self,,,,,
107,MachineLearning,t5_2r3gv,2014-7-15,2014,7,15,4,2aozgp,dataorigami.net,8 great data blogs to follow,https://www.reddit.com/r/MachineLearning/comments/2aozgp/8_great_data_blogs_to_follow/,[deleted],1405366271,,0,0,False,default,,,,,
108,MachineLearning,t5_2r3gv,2014-7-15,2014,7,15,4,2aozp3,github.com,Understanding Random Forests (a PhD thesis),https://www.reddit.com/r/MachineLearning/comments/2aozp3/understanding_random_forests_a_phd_thesis/,rasbt,1405366382,,5,34,False,http://a.thumbs.redditmedia.com/1h7yUTLIUBGrevjP.jpg,,,,,
109,MachineLearning,t5_2r3gv,2014-7-15,2014,7,15,4,2ap06q,trivedigaurav.com,Quoc Les (from Google Brain) Lectures on Deep Learning,https://www.reddit.com/r/MachineLearning/comments/2ap06q/quoc_les_from_google_brain_lectures_on_deep/,[deleted],1405366646,,0,0,False,default,,,,,
110,MachineLearning,t5_2r3gv,2014-7-15,2014,7,15,4,2ap0av,wired.com,Microsoft Challenges Googles Artificial Brain With Project Adam.,https://www.reddit.com/r/MachineLearning/comments/2ap0av/microsoft_challenges_googles_artificial_brain/,qkdhfjdjdhd,1405366709,,4,6,False,http://a.thumbs.redditmedia.com/a1T3BMmVvhC8GNN0.jpg,,,,,
111,MachineLearning,t5_2r3gv,2014-7-15,2014,7,15,6,2apepn,self.MachineLearning,"Estimating residual/error distribution from regularised regression (ridge, lasso, eslastic net)",https://www.reddit.com/r/MachineLearning/comments/2apepn/estimating_residualerror_distribution_from/,PoddyOne,1405374486,"Hi there,

I'm trying to use an elastic net to fit a predictive model where I have some high correlation between my covariates. However, I really need a model for my error distribution. So just to be clear, I'm fitting a model

    y=\beta X + \epsilon

and I want the distribution of \epsilon, (it may depend on X, or at least \hat{y}).

Ideally the model would be fit taking into account this distribution, but I'll settle with a good way of estimating it after the fact for now.

Thanks.",4,0,False,self,,,,,
112,MachineLearning,t5_2r3gv,2014-7-15,2014,7,15,6,2apf9b,self.MachineLearning,"Computer Vision: Models, Learning, and Inference by Prince",https://www.reddit.com/r/MachineLearning/comments/2apf9b/computer_vision_models_learning_and_inference_by/,TheJesterBrother,1405374791,"Hello, Im new to CV and machine learning, I was wondering if anyone has anything to say about this book. Would it be a good place to start ML (or CV, for that matter)?
",1,3,False,self,,,,,
113,MachineLearning,t5_2r3gv,2014-7-15,2014,7,15,7,2apjhl,thisismetis.com,Metis Data Science Bootcamp accepting applications through 8/11 for autumn session in NYC,https://www.reddit.com/r/MachineLearning/comments/2apjhl/metis_data_science_bootcamp_accepting/,bailey_jameson,1405377200,,5,0,False,default,,,,,
114,MachineLearning,t5_2r3gv,2014-7-15,2014,7,15,8,2apoih,self.MachineLearning,What are some of the best books related to Machine Learning?,https://www.reddit.com/r/MachineLearning/comments/2apoih/what_are_some_of_the_best_books_related_to/,[deleted],1405380085,"This sub has tons of posts on free books related to machine learning, but I just don't know how many of them are good.

Posts like these http://redd.it/2anzao and http://redd.it/1jeawf give dozens of books to read, but I don't know which ones to pick.

So what is the sub's opinion on some of the best book?

Note: The book does not have to be free. I would prefer books of all levels, introductory to advanced.

EDIT: I just saw this http://www.reddit.com/r/MachineLearning/comments/20i0vi/meta_collection_of_links_for_beginners_faq/ but this applies to beginner books so I guess show me your favorite moderate/advanced books.",4,10,False,default,,,,,
115,MachineLearning,t5_2r3gv,2014-7-15,2014,7,15,9,2apwjf,arxiv.org,Microsoft's Project Adam is using 'HOGWILD!' for Neural Networks on CPUs,https://www.reddit.com/r/MachineLearning/comments/2apwjf/microsofts_project_adam_is_using_hogwild_for/,glaksh09,1405385043,,1,2,False,default,,,,,
116,MachineLearning,t5_2r3gv,2014-7-15,2014,7,15,11,2aq4l6,self.MachineLearning,Machine Learning Study Group Week 4: Solomonoff's 'An Inductive Inference Machine',https://www.reddit.com/r/MachineLearning/comments/2aq4l6/machine_learning_study_group_week_4_solomonoffs/,rovingr,1405390066,"This week's blog post is up -- check out http://datasciencetalk.blogspot.com . This week's article is Solomonoff's 'An Inductive Inference Machine'-- feel free to discuss the article either in this thread or in the blog's comments, as well as last week's post on Breiman's 'Statistical Modeling: The Two Cultures'. 


Links to past threads: 
http://www.reddit.com/r/MachineLearning/comments/2967qh/machine_learning_study_group_week_3_breimans/
http://www.reddit.com/r/MachineLearning/comments/28hlal/machine_learning_study_group_thread_2/ http://www.reddit.com/r/MachineLearning/comments/27p3aj/machine_learning_study_group_thread_1_update/ http://www.reddit.com/r/MachineLearning/comments/26x06e/machine_learning_study_group_thread_1/",0,5,False,self,,,,,
117,MachineLearning,t5_2r3gv,2014-7-15,2014,7,15,12,2aqbv5,self.MachineLearning,need help with brainmaker NN software for horse racing,https://www.reddit.com/r/MachineLearning/comments/2aqbv5/need_help_with_brainmaker_nn_software_for_horse/,heguerra,1405394495,,0,0,False,default,,,,,
118,MachineLearning,t5_2r3gv,2014-7-15,2014,7,15,13,2aqh63,self.MachineLearning,Understanding ROC curve,https://www.reddit.com/r/MachineLearning/comments/2aqh63/understanding_roc_curve/,rincewinds,1405398051,"Hi all,

I know the basics of machine learning and the logic behind many algorithms. But no reading helped intuitively understand the AUC metric used for a kaggle competition. I wanted to understand intuitively ROC curve and what increases area under curve. So I built a simple graphic using d3 at http://www.navan.name/roc/. You can drag the threshold bar and also adjust position of the curve for negatives using the slider at the top of graphic. You can play with these values to understand its effect on the ROC curve. It is not very polished, but it served the purpose for me.

I posted it to kaggle forums initially and I am posting it here in the hope it benefits others who are in the same boat.",16,30,False,self,,,,,
119,MachineLearning,t5_2r3gv,2014-7-15,2014,7,15,15,2aqs58,issuu.com,ISSUU - Excavator Attachments for Sale by Machines4u,https://www.reddit.com/r/MachineLearning/comments/2aqs58/issuu_excavator_attachments_for_sale_by_machines4u/,jessicperson,1405407419,,0,1,False,default,,,,,
120,MachineLearning,t5_2r3gv,2014-7-16,2014,7,16,7,2asxe9,plus.google.com,Why Probabilistic Programming Matters.,https://www.reddit.com/r/MachineLearning/comments/2asxe9/why_probabilistic_programming_matters/,qkdhfjdjdhd,1405462134,,24,40,False,http://b.thumbs.redditmedia.com/sdN9ZlGHyYFMoCT9.jpg,,,,,
121,MachineLearning,t5_2r3gv,2014-7-16,2014,7,16,9,2at8ns,self.MachineLearning,Time Series Question- Please Help,https://www.reddit.com/r/MachineLearning/comments/2at8ns/time_series_question_please_help/,fhadley,1405468909,"So this is something with which I've been struggling  lately, and I think I have a solution, but I'm curious as to how others would handle this. 

I have a dataset that describes a discrete (temporal) sequence of ~15 events observed in specific individuals. The target here is a rolling cost measurement, and I also have temporal inputs that describe items that contributed to the cost in the given period. FWIW, the cost variable alone for a specific individual isn't rather informative (i.e. an AR(I)MA on just the cost for just one person wouldn't be insightful). However, there are patterns in cost shared across the entire population, and there are also similar trends in the target-input relationship shared across individuals.

In addition to the sequential information, for each individual I have another set of data with static features that contain data similar to demographics. This set includes ~100 features. The static and sequential data for each individual are linked.

So I know there are stats-y kinds of ways to deal with this (hierarchical models, ignoring sequential nature of the data, etc.), but my data violates most of the necessary assumptions. Similarly, I could either ignore the sequential nature of the data and feed it to any of a number of ML models, but through personal experience and domain research, I've found that this results in significant information loss and poor model performance. Likewise, I suppose that I could mash the static data together with the sequential, essentially repeating a demographic characteristic 15 times. That doesn't seem like a good idea from a math point of view.

Thus, here's what I'm currently considering: a hybrid HMM-RNN model. The HMM will model the relationship between the static data and the rolling cost, and will have access to cost at t-1 (relatively standard HMM). The RNN- recurrent neural net- will be used to model the relationship between the sequential inputs and the rolling target. As the sequences would be too short to train independently, and it would be illogical to combine all of the sequences into one long one, I'll use a slightly different training method for the RNN. I'll train each sequence (i.e. each individual) separately, then use the final weights for the first individual as the starting weights for the following, and repeat until convergence.

I'd greatly appreciate criticism of my idea, recommendations of different techniques, or paper suggestions. Honestly, I'd be exceedingly grateful for just a hint on search keywords, as I'm at a loss here.",3,0,False,self,,,,,
