,date,year,month,day,hour,id,title,full_link,author,created,selftext,num_comments,score
0,2015-5-1,2015,5,1,12,34hb57,Learning for sensor data,https://www.reddit.com/r/MachineLearning/comments/34hb57/learning_for_sensor_data/,xkSeeD,1430451529,"I am working on a robot which has a few IR sensors. I'm trying to find the distance of a wall to each sensor but there is a lot of noise on the data that I'm getting from the sensors. I'm using some filters and [this](http://imgur.com/89WTT5z) is the output from the filter. There is a 10% error in the readings after the filter. I would like to decrease the error to around 5%, but I am not sure how I should proceed. I was thinking if I could drive the robot in a known environment, where I can easily measure the real distance of the walls and sensors with a very high accuracy, and then use the data from the sensors and some how train(??) the sensors to get a better reading from the sensors. Is this possible? How should I do it? I have absolutely no idea if training is the right term to use in here. I would greatly appreciate any help. Thanks!",5,2
1,2015-5-1,2015,5,1,20,34ib1e,Stereovision Autoencoder: Learning better object representations from 3D assets. Does this idea make sense?,https://www.reddit.com/r/MachineLearning/comments/34ib1e/stereovision_autoencoder_learning_better_object/,fhuszar,1430481496,,12,0
2,2015-5-1,2015,5,1,22,34imod,Reminder: tonight submission deadline for Deep Learning @ ICML'15. Minimum length: 2 pages. World-class reviewers.,https://www.reddit.com/r/MachineLearning/comments/34imod/reminder_tonight_submission_deadline_for_deep/,dpkingma,1430488476,,9,3
3,2015-5-1,2015,5,1,22,34imr8,"Knowing precision on one data set, can I make claims about precision on another?",https://www.reddit.com/r/MachineLearning/comments/34imr8/knowing_precision_on_one_data_set_can_i_make/,ulta,1430488516,"I am building a spam classifier for email.

Let's say I have 3 million emails and I have a hypothesis that 1% of them are spam. So, I expect 30,000 of these 3 million emails to be spam but I don't know which ones.

Now, lets say I randomly choose 1 million of these emails and label them using a classifier I've trained. My classifier predicts that 40,000 of these 1 million are spam. I go review those 40,000 and find that only 10,000 of them are actually spam.

So, my precision is 10,000 out of 40,000 or 25%.

Now, let's say I go review those 3 million emails manually and find that my initial guess is correct and 30,000 of them actually are spam.

Can I make any guesses about what the precision of my classifier would be given another set of email with different distribution? Say 50% spam? 20% spam?

On one hand, it seems like precision says nothing except how my classifier did on this particular data set. But, on the other hand, it seems that if my classifier has a precision of 25% on a data set that was only 1% spam then surely it will do better on a data set that is 50% spam!

Is this logic flawed?",3,0
4,2015-5-2,2015,5,2,0,34iyrz,Want to test your machine learning skills? Work on real problem with real data? Join us at GMUM Challenge!,https://www.reddit.com/r/MachineLearning/comments/34iyrz/want_to_test_your_machine_learning_skills_work_on/,szampa,1430494367,,10,19
5,2015-5-2,2015,5,2,2,34jcqe,Fast R-CNN for object detection with 9x faster at training and 213x faster at test-time (for VGG16),https://www.reddit.com/r/MachineLearning/comments/34jcqe/fast_rcnn_for_object_detection_with_9x_faster_at/,vkhuc,1430500955,,7,17
6,2015-5-2,2015,5,2,3,34jkz7,Practical Text Analysis using Deep Learning,https://www.reddit.com/r/MachineLearning/comments/34jkz7/practical_text_analysis_using_deep_learning/,michaelfi,1430504777,,2,25
7,2015-5-2,2015,5,2,3,34jlwf,What is the error on my regression value from a BDT?,https://www.reddit.com/r/MachineLearning/comments/34jlwf/what_is_the_error_on_my_regression_value_from_a/,soveraign,1430505214,"Hello all,  in my research I am using boosted decision trees (as a regressor) in TMVA (Root) and sklearn.  I want an error estimate along with the prediction (e.g. predict(X) --&gt; 2.5 +- 0.5).  I've combed through the documentation and cannot find any reference to this feature.  Is this possible with the tools above?  Other tools?  Is it even common or clearly defined?

I have implemented a simple decision tree on my own primarily to learn how they work and behave.  My intuition is to use the RMS of the values in the leaves to estimate the error of that leaf.  This seems to produce results that are consistent with being correct (i.e. my pull distribution is unit normal).  But my code is very simple and cannot match the performance of much more mature implementations (like forests and fancier splitting).

I would prefer not to use my custom code for this purpose and instead take a best practices approach.  Thoughts?  Did I miss something obvious?

Edit: words",2,1
8,2015-5-2,2015,5,2,4,34jq5h,A perceptron estimates only the average in batch learning,https://www.reddit.com/r/MachineLearning/comments/34jq5h/a_perceptron_estimates_only_the_average_in_batch/,FluffyMarsianin,1430507304,"Hi folks!

I am stuck with this problem with a perceptron and really need advice. Everything I've googled so far didn't give me a clear answer, although this problem seems to be not completely uncommon.

I checked the code several times and also back propagation (BP) itself works just fine. But something weird happens in batch learning.

A snippet looks like this basically:

    weights = weights_old
    
    weight_deltas_sum = 0

    for I = 1:number of patterns
    
    [neuron_outputs, weighted_sums] = perceptron ( pattern_input(I), weights_old, ... )
    
    weight_deltas = backpropagaition( neuron_outputs, weighted_sums, ... ) 
    
    weight_deltas_sum = weight_deltas_sum + weight_deltas
    
    end;
    
    weights = weights_old + weight_deltas_sum 

The result that I get doing simple scalar function approximation looks like this:

[Parabola fit](http://imgur.com/MfzCPtd)

I am sure some of you have experienced something like this. I'd appreciate any further information on this issue.

Here is where some more details may be found:
[SO question](http://stackoverflow.com/questions/29973691/perceptron-learns-to-reproduce-just-one-pattern-all-the-time)",5,1
9,2015-5-2,2015,5,2,15,34lkg0,"Speech synthesis from collection of (audio sample, transcript) pairs?",https://www.reddit.com/r/MachineLearning/comments/34lkg0/speech_synthesis_from_collection_of_audio_sample/,Speedloaf,1430546431,"Hello everyone!

I'm new to the ML world and would greatly appreciate any guidance with a project I might soon undertake.    
    
I am wondering if it would be possible to take a set of audio samples of a particular person (and associated transcripts) and generate a synthesized voice.     

An issue I foresee would be handling words that I don't have a sample of. For instance, if I don't have a clip of the person saying ""banana"" but in my mind I can imagine a plausible sound for the word in their voice. How could I go about generating that ""plausible sound""?    

I imagine that in addition to developing a map of words that have an available transcription, I would also need to construct a mapping between specific letters (or combinations of letters) and a phonetic sample for that sub-word element so I can generate new words (like banana).    

I would appreciate any guidance, links, terminology, or papers which might be relevant that I should investigate.    

Thanks in advance!",5,0
10,2015-5-2,2015,5,2,18,34ly4j,ML challenge: Model Reuse with Bike rental Station data,https://www.reddit.com/r/MachineLearning/comments/34ly4j/ml_challenge_model_reuse_with_bike_rental_station/,szampa,1430560053,,0,1
11,2015-5-2,2015,5,2,18,34lyl2,EM vs gradient descent,https://www.reddit.com/r/MachineLearning/comments/34lyl2/em_vs_gradient_descent/,letitgo12345,1430560565,"In what cases is it better to use EM vs just simple gradient descent (using Monte Carlo approximation if you've integrals in your likelihood function)

The general context is that I was reading the paper here (http://www.cs.toronto.edu/~tang/papers/sfnn.pdf) and they present a generalized EM algorithm for training stochastic feedforward neural nets and I was wondering if I'm just being dumb and using gradient descent isn't possible in this context or if not, then if there's a well known reason why gradient descent wouldn't work well here.",16,15
12,2015-5-2,2015,5,2,20,34m42d,Autoencoders for image classification,https://www.reddit.com/r/MachineLearning/comments/34m42d/autoencoders_for_image_classification/,cenkbircanoglu,1430566153,,0,1
13,2015-5-2,2015,5,2,20,34m44j,Understanding ripples in my learning curve.,https://www.reddit.com/r/MachineLearning/comments/34m44j/understanding_ripples_in_my_learning_curve/,donnaprima,1430566206,"I have a [learning curve](https://drive.google.com/file/d/0B-vJfhWswxvdanVSN1pMMHE4MEk/view?usp=sharing) that from time to time develops ripples, that fade away. What could be causing this?

Increasing momentum often increases the amplitude of these ripples.",13,1
14,2015-5-2,2015,5,2,22,34mbh2,How can I perform symbolic differentiation on a function with indexed terms?,https://www.reddit.com/r/MachineLearning/comments/34mbh2/how_can_i_perform_symbolic_differentiation_on_a/,fuckinghelldad,1430572432,"I ask because I'm inexperienced with symbolic differentiation programs and Google returns no results which seem useful to me.

The problem is that I'm trying to differentiate a function. It's too complex for me to differentiate by hand, so I need a computer to do it for me. However, the function contains a summation whose summands' factors are indexed (i.e. when you write them down they contain subscripts). If it's even possible, I'd like to know how to differentiate such a function symbolically.

I've considered automatic differentiation and numerical approximations for my application, though they seem like lesser alternatives.

Thanks!

**Edit:** /u/carette has suggested I give an example: http://i.imgur.com/JxaYLkG.png",5,2
15,2015-5-2,2015,5,2,23,34mflu,roc area score (classification): weka vs scikit-learn. Is there a difference?,https://www.reddit.com/r/MachineLearning/comments/34mflu/roc_area_score_classification_weka_vs_scikitlearn/,[deleted],1430575310,"Do this scores calculate exactly the same thing in the exact same way?

- in scikit-learn this is called roc_auc: 

- in weka it is called ROC area (in the gui)

The weird thing is that WEKA's ROC area seems to be always higher (upto 0.05) than scikit-learns roc_auc, even when they use exactly the same data and both use logistic regression with exactly the same parameters.

So the thing is, I'd prefer to use my scikit-learn solution, as I feel like I have more control over what happens. But the Weka solution gives a better score. So I wanted to know if they are comparable or that there will be real differences for predicting new items.

",3,0
16,2015-5-3,2015,5,3,0,34mobi,Text detection on images,https://www.reddit.com/r/MachineLearning/comments/34mobi/text_detection_on_images/,SuperGore,1430580663,"What are possible ways to improve a method (Naive Bayes for example) to get better results classifying images into text or non-text images, instead of just inputing a x number of images and telling the system which have text and which do not?

Thank you for the help reddit
Regards",3,8
17,2015-5-3,2015,5,3,1,34mwoo,How to deal with very skewed distribution of training instances,https://www.reddit.com/r/MachineLearning/comments/34mwoo/how_to_deal_with_very_skewed_distribution_of/,onewugtwowugs,1430585253,"I'm having a classification problem where I am to train a neural network on a set of sentences to predict one out of about ten possible words, based on the content of the sentences as well as a few other features. One of my problems is that the class distribution is very skewed, where some of the classes only occur in a few percent of the entire training set, while others could be up towards 60%. 

I was wondering if there are some general guidelines for dealing with this type of problem? Are there some cost functions or activation functions that are better than others, or do you have tips of other tricks to get around the worst of it?

Thanks",11,7
18,2015-5-3,2015,5,3,4,34nfeh,Matlab NN: Problem with my backProp Algo,https://www.reddit.com/r/MachineLearning/comments/34nfeh/matlab_nn_problem_with_my_backprop_algo/,WorkingoNN,1430595024,"Dear Redditors,
i'm an undergrad writing his thesis about financial forecasting using ANNs. I try to write as much code as possible by myself, so I can understand whats happening. The Input data is X (2517x11) where the first column is the bias unit, Y is the binary output data, Theta(j) are matrizes containing the weights, iter=iterations and LR=learning rate. When i let this rum a few thousand iterations Output J (which is the cost function) begins to oscilate, so i think i just found a local minima. Maybe theres something wrong with my gradient descent backprop Algo? I guess its the updating or delta rule part. Heres the code: 
",7,0
19,2015-5-3,2015,5,3,4,34nico,Best way to train image classifier model?,https://www.reddit.com/r/MachineLearning/comments/34nico/best_way_to_train_image_classifier_model/,bears343,1430596583,"Let's say you are trying to predict what type of vehicle is in an image. You can assume that all images will have the vehicle as the main object in the image (so mostly center and infront of everything), but there will not be a plain background. For example, a car may be on the street, or a tractor may be on a field of grass with blue sky above. 

Given that you want to classify the vehicle type, is it better to train a CNN on images with no filtering, then when classifying a new image, to classify on images with the noisy background? Or is it better to run some object detection / graph cut algorithm to get the main object, then train on that for all images, then at test time filter the image and classify using the same CNN?

Example1: http://nadacarvalue.org/wp-content/uploads/2014/11/nada-car-value.jpg
Example2:http://car-pictures.cars.com/images/?IMG=cac10foc051c01401.png&amp;WIDTH=624&amp;AUTOTRIM=1&amp;SPECIAL=&amp;ACT=F",1,0
20,2015-5-3,2015,5,3,5,34nkj9,First steps in data science: author-aware sentiment analysis,https://www.reddit.com/r/MachineLearning/comments/34nkj9/first_steps_in_data_science_authoraware_sentiment/,yanirse,1430597750,,0,2
21,2015-5-3,2015,5,3,7,34nz0n,How would you describe your one typical day at work?,https://www.reddit.com/r/MachineLearning/comments/34nz0n/how_would_you_describe_your_one_typical_day_at/,warriorkitty0,1430605786,"I'm a software engineer for a company where I mostly do BI development in CakePHP and ExtJS. I'm interested in ML, AI, recommendation algorithms, etc.


I'm from Croatia and I'm finishing college next year. My problem is that there are no jobs related to ML here and I can't find internship in ML (even though I'm senior in a company where I work now).


After college (next year), my plan is to move to Germany and start looking for some sort of ML job and they will (for sure) ask me where I've worked in this field. Since I don't have any professional experience in this field, I would like to start doing open source projects related to machine learning to ""mimic"" a professional day-to-day job.


If I could describe my typical day to a person who asked me about web development in CakePHP and ExtJS I would say:

1.) Add another function to your API for Android apps.

2.) Write a few unit tests for your new functions.

3.) Add another column inside the Users grid in ExtJS.

4.) Make an AJAX call to get all the active users and paginate them.

...

(you get the point)


From my answers, you can see really important keywords like unit tests, API, grids, AJAX, pagination, etc.


Could you describe me your normal day as data scientists and ML professionals so I could create my own tasks and solve them in my free time?


Thank you very much!",14,21
22,2015-5-3,2015,5,3,8,34o520,CNNs: What happened at ~130 epoch ?,https://www.reddit.com/r/MachineLearning/comments/34o520/cnns_what_happened_at_130_epoch/,Tom-Demijohn,1430609292,"[plot](http://postimg.org/image/3lebpsqip/)

So my impression is that somehow, at late point in time, model escaped local minima/plateau. Right?",24,6
23,2015-5-3,2015,5,3,8,34o5eb,Best Deep Learning Packages For Python?,https://www.reddit.com/r/MachineLearning/comments/34o5eb/best_deep_learning_packages_for_python/,YourWelcomeOrMine,1430609489,"I have googled this question, and realize there is an abundance of available packages. What are some of your experiences with the different packages? Which do you recommend/not recommend? ",4,2
24,2015-5-3,2015,5,3,16,34p734,Machine Learning for Emoji Trends (Instagram),https://www.reddit.com/r/MachineLearning/comments/34p734/machine_learning_for_emoji_trends_instagram/,sko2sko,1430638333,,11,66
25,2015-5-3,2015,5,3,20,34piyi,Why can Constant Error Carousels (CECs) prevent LSTM from the problems of vanishing/exploding gradients?,https://www.reddit.com/r/MachineLearning/comments/34piyi/why_can_constant_error_carousels_cecs_prevent/,freemind2009,1430652071,,5,2
26,2015-5-4,2015,5,4,0,34q50i,[Question] developing/testing Basic Recurrent Neural Networks,https://www.reddit.com/r/MachineLearning/comments/34q50i/question_developingtesting_basic_recurrent_neural/,RossoFiorentino,1430668398,"I have been writing my own neural network package and i have until now only worked with feed-forward neural networks. I might be interested in extending my work towards recurrent neural networks. I have never worked with recurrent neural networks in practice, i have only read theory. 

I was wondering if there exists some basic one hidden layer neural network problem for developing, debugging and testing? For example similar to the and/or/xor problems for feed forward neural networks.

And maybe some basic data set like the MNIST data set for feed forward nets?",4,5
27,2015-5-4,2015,5,4,4,34qw21,"Follow up on ""Competing in a data science contest without reading the data""",https://www.reddit.com/r/MachineLearning/comments/34qw21/follow_up_on_competing_in_a_data_science_contest/,RinzeWind,1430682464,"This is very related to [this other thread](https://www.reddit.com/r/MachineLearning/comments/2ypyt7/competing_in_a_data_science_contest_without/).

In Kaggle's [*Restaurant Revenue Prediction*](https://www.kaggle.com/c/restaurant-revenue-prediction) challenge, a team has managed to obtain a perfect score following the same strategy. [Here is the leaderboard with their perfect entry](https://www.kaggle.com/c/restaurant-revenue-prediction/leaderboard) and [here is the forum post talking about their strategy](https://www.kaggle.com/c/restaurant-revenue-prediction/forums/t/13950/our-perfect-submission). They will hopefully follow up with a detailed explanation after the competition ends.",10,25
28,2015-5-4,2015,5,4,7,34rfc1,Canova: A Vectorization Lib for Machine-Learning Tools (WIP),https://www.reddit.com/r/MachineLearning/comments/34rfc1/canova_a_vectorization_lib_for_machinelearning/,vonnik,1430692318,,3,7
29,2015-5-4,2015,5,4,11,34s5de,Need a new idea for a little application to demonstrate my prowess in machine learning.,https://www.reddit.com/r/MachineLearning/comments/34s5de/need_a_new_idea_for_a_little_application_to/,[deleted],1430706506,"I am making a little application for a potential job in machine learning and my first idea fell through because of how Facebook set up their app permissions. Here is what I *was* going to do. 

1. User is able to log in with Facebook. 
2. Get the user's likes and their friends likes. 
3. Get the user's ""best friends"" (i.e. the top 5 people by the number of shared likes). &lt;-- This is the step that fell through because Facebook no longer lets an app view friends and their likes.
4. Suggest new restaurants to like to the user based on what the user's best friends liked. This would demonstrate my use of collaborative filtering / recommendation system. 
5. ... Profit? 


I could try to do the same thing with Twitter, but I can't understand how to use their API just yet... Any other suggestions to specifically demonstrate my knowledge of recommendation systems in an interactive manner? ",4,1
30,2015-5-4,2015,5,4,13,34shoe,Interview question- how did I do?,https://www.reddit.com/r/MachineLearning/comments/34shoe/interview_question_how_did_i_do/,mltape,1430713710,"I had an interview where some of the interviewers set up the following scenario:

You are trying to predict how many days a certain employee of a company will stay with that company.  You have three models that predict an output of 80 days, 90 days, and 100 days.  If the CEO of a company will not hire anyone that will stay under 85 days, do you reccomend hiring this employee? 


My answer was yes, you do if you mix the models and the output is more than 85 days, which is essentially a small ensemble method.  My reasoning was that if you made a couple models that you considered to be applicable, they would probably have similar errors, and mixing them would probably produce a better output with a lower overall error.  They didn't like that answer...the answer they were looking for was to pick the single model with the lowest error and go with that.  Was my reasoning out of line? ",4,4
31,2015-5-4,2015,5,4,16,34svtp,Data Scientists Thoughts that Inspired Me !,https://www.reddit.com/r/MachineLearning/comments/34svtp/data_scientists_thoughts_that_inspired_me/,HappyDataScientist,1430724996,,0,1
32,2015-5-4,2015,5,4,17,34sxb8,"The connection between sensing, signal processing and machine learning",https://www.reddit.com/r/MachineLearning/comments/34sxb8/the_connection_between_sensing_signal_processing/,compsens,1430726470,,0,11
33,2015-5-4,2015,5,4,19,34t6ma,Datumbox Machine Learning Framework 0.6.0 Released,https://www.reddit.com/r/MachineLearning/comments/34t6ma/datumbox_machine_learning_framework_060_released/,datumbox,1430735748,,0,0
34,2015-5-4,2015,5,4,19,34t7sm,What is the state of the art on recommender system applications for e-commerce?,https://www.reddit.com/r/MachineLearning/comments/34t7sm/what_is_the_state_of_the_art_on_recommender/,RecSysDude,1430736798,"Hi everyone.

I've been looking at [this](http://link.springer.com/chapter/10.1007/978-1-4615-1627-9_6) and [this](http://linkinghub.elsevier.com/retrieve/pii/S0167923615000627) that sort of have surveys around modern applications of recommender systems for ecommerce. Nonetheless, the first paper is from 2001 and even though the 2nd is from 2015, the applications presented in the survey section for ecommerce are ~10 years old.

I'm mostly interested in the applicability ~~space~~ of Recommender Systems and not so much around the technical details of the different algorithms. 

Any papers worth looking at?

Thank you :)",3,1
35,2015-5-4,2015,5,4,22,34tjk7,"RapidMiner Boosts Security, Collaboration &amp; Extensibility in Big Data with Latest Platform Updates",https://www.reddit.com/r/MachineLearning/comments/34tjk7/rapidminer_boosts_security_collaboration/,[deleted],1430745003,,0,1
36,2015-5-4,2015,5,4,22,34tl7d,Why so awfully deep? [Google+ repost],https://www.reddit.com/r/MachineLearning/comments/34tl7d/why_so_awfully_deep_google_repost/,tabacof,1430745958,"This interesting question was posted in [Google+ Deep Learning community](https://plus.google.com/u/0/+HouYunqing/posts/LuBVhALFrnN) by Hou Yunqing but there wasn't a single answer there, so I'd like to see what you guys think about it (this community usually gives great answers):

&gt; Why so awfully deep?

&gt; Recent ImageNet CNN architectures such as GoogLeNet, NIN, and VGG's net are usually really deep, having 10-20 convolutional layers. I can't help but ask: why so deep?

&gt; When I think about a conv layer, I think about composition. That is, a conv filter composes multiple ""parts"" into a ""whole"". In the early conv layers (1-3) this is clearly true. In the later layers it's less clear what is going on.

&gt; My hypothesis is that in the later convs the composition transits from ""hierarchical"" to ""combinatorial. That is, they become more like those kernel classifiers and no longer give us the exponentially better representation power they are supposed to deliver.

&gt; What do you guys think?",13,30
37,2015-5-4,2015,5,4,23,34trgw,What is the best way to calculate similarity among discussion trees?,https://www.reddit.com/r/MachineLearning/comments/34trgw/what_is_the_best_way_to_calculate_similarity/,tocunha,1430749425,"I am trying to cluter 80.000 trees that represent discussion cascades of reddit, I tried to use the tree edit distance (http://www.inf.unibz.it/dis/projects/tree-edit-distance/) as my similarity distance, but unfortunatelly this algorithm is O(n) and is not feasible to my context. What you guys suggest as similarity measure?",0,0
38,2015-5-4,2015,5,4,23,34trvq,ML/NLP competition to predict Boston hygiene violations using Yelp reviews,https://www.reddit.com/r/MachineLearning/comments/34trvq/mlnlp_competition_to_predict_boston_hygiene/,isms_,1430749638,,0,3
