,date,year,month,day,hour,id,title,full_link,author,created,selftext,num_comments,score
381,2015-5-24,2015,5,24,3,370gks,PCANet: A Simple Deep Learning Baseline for Image Classification? (x-post r/CompressiveSensing ),https://www.reddit.com/r/MachineLearning/comments/370gks/pcanet_a_simple_deep_learning_baseline_for_image/,compsens,1432406314,,3,0
382,2015-5-24,2015,5,24,4,370jh3,[Question] Separate individual speakers in conversation (audio),https://www.reddit.com/r/MachineLearning/comments/370jh3/question_separate_individual_speakers_in/,hannson,1432407740,"IIRC there was an algorithm that separates an audio input of two (or more?) speakers into different channels. 

As in, if you have two people speaking at the same time in an audio file you get two audio files each with what a single person said.

Does anyone recall which algorithm I'm talking about?",15,1
383,2015-5-24,2015,5,24,4,370q7y,"Has anybody worked with these common IR test collections? (CRAN, CISI, MED)",https://www.reddit.com/r/MachineLearning/comments/370q7y/has_anybody_worked_with_these_common_ir_test/,[deleted],1432411042,"I have been working with [these](http://web.eecs.utk.edu/research/lsi/corpa.html) common IR test collections. Basically, I wrote a clustering algorithm that shuffles the documents from every collection and tries to reassemble the collections afterwards (the purpose of this is to see how well the algorithm performs). 

I decided to print the distances between every element of a set composed of the first three documents in every collection (i.e. a set composed of the first three documents of CRAN, the first three documents of CISI, and the first three documents of MED). It turns out that the collections do not seem to be very separated. For example, some of the documents in CRAN are closer to documents in CISI than they are to other documents in CRAN. All of the first three documents in MED are closer to documents in other collections than to one another. 

I want to know if somebody else has worked with these collections and got similar results or could give me some insight into how to use these collections. It could also be that there are bugs in my program and it is not reading the CCS sparse matrix format right. However, I wrote three small and very separated test collections in the same format as the given collections and the program runs great. ",0,0
384,2015-5-24,2015,5,24,5,370td5,"Given multiple time series (each in their own file) to train on, is there anyway to classify a sequence according to which time series it most resembles to ?",https://www.reddit.com/r/MachineLearning/comments/370td5/given_multiple_time_series_each_in_their_own_file/,[deleted],1432412598,How does one measure likelihood of  that a sequence is part of a given time series ? ,0,1
385,2015-5-24,2015,5,24,6,3710de,Question about LSTMs,https://www.reddit.com/r/MachineLearning/comments/3710de/question_about_lstms/,my_sane_persona,1432416278,"Hi all,

I'm fairly novice to the ML field, having only recently taken some introductory ML courses, and I have a question about LSTMs that I thought maybe you could help me with.

My understanding is that LSTMs are RNNs with memory cells. The way a memory cell works is like this:

* we have an **input gate**, which determines whether the current input to the cell will be ""written to memory""
* we have an **output gate**, which determines whether the current state of the cell will be ""read out of memory""
* we have a **forget gate** (or alternatively, a keep gate) which determines whether to erase the memory of the cell

These memory cells, like any other units, can have the weights of their gates learned through backpropagation.

The part I am having trouble with is this: where are these memory cells placed in the system? Do they replace your typical hidden unit, and a hidden layer is just a row of LSTM cells, or do they work in conjunction with typical hidden units - in which case, what does the architecture look like? Does each typical hidden unit have an LSTM cell attached to it, or something similar?

I hope this makes sense, if not perhaps I can clarify further.

Thank you!",2,0
386,2015-5-24,2015,5,24,7,3718ku,Why are Eight Bits Enough for Deep Neural Networks?,https://www.reddit.com/r/MachineLearning/comments/3718ku/why_are_eight_bits_enough_for_deep_neural_networks/,petewarden,1432420592,,2,22
387,2015-5-24,2015,5,24,7,371a8j,Document clustering,https://www.reddit.com/r/MachineLearning/comments/371a8j/document_clustering/,hahze,1432421449,"Hi,

I'm trying to cluster documents based on their content. I've tried a couple of different methods and I'm just not sure about how they're shaping up. None of them really are satisfactory.

The documents are questions from a reddit AMA.

I've tried doing DBSCAN on TFIDF cluster of documents with large or small n-grams. It works OK, but they're leaving out a lot of documents that could be still clustered.

Doc2Vec was another idea and it was OK but I get connections between sentences and words where they don't quite seem to cluster like I thought they did. Maybe an AMA, even a large AMA, doesn't have enough questions? Should I try to train on a lot of AMAs or other text? I suppose NNs need a lot of data.

Other ideas were semantic hash or Random Forest Classifiers (or gradient boosting tree). 

Any ideas?",7,0
388,2015-5-24,2015,5,24,13,3729vj,How would one use a lstm to generate similar nl sentences? What input and ideal-output would I train it with?,https://www.reddit.com/r/MachineLearning/comments/3729vj/how_would_one_use_a_lstm_to_generate_similar_nl/,[deleted],1432442978,"how would I go about nl generation with sentences similar to ones I have trained a lstm with?

For example, how could I do per this input, create a sentence that looks like this. I assume I'd train it as a sequence with different words at time-steps, but how would I conceptually go about starting that?

Thank you!",0,0
389,2015-5-24,2015,5,24,18,372tyj,Naive Bayes for document clustering,https://www.reddit.com/r/MachineLearning/comments/372tyj/naive_bayes_for_document_clustering/,komitori,1432461332,I've read some studies that it is possible to cluster documents using Naive bayes but how does it fare with soft or hard clustering algorithms like LDA or k means?,3,0
390,2015-5-24,2015,5,24,21,3731ns,How does word2vec allow me to train an rnn the semantic value of a word in vector form when it gives me the same length vector if I give it 5 or 100005 words?,https://www.reddit.com/r/MachineLearning/comments/3731ns/how_does_word2vec_allow_me_to_train_an_rnn_the/,[deleted],1432469057,,5,1
391,2015-5-24,2015,5,24,22,3738d5,Trend (regime) change detection with t-test,https://www.reddit.com/r/MachineLearning/comments/3738d5/trend_regime_change_detection_with_ttest/,mhfirooz,1432474185,,4,16
392,2015-5-25,2015,5,25,2,37409m,Sum of functions using RNN,https://www.reddit.com/r/MachineLearning/comments/37409m/sum_of_functions_using_rnn/,pedromnasc,1432489763,"Hi! 
Is anyone aware of some paper or work related to a RNN trying to sum time series? Given N time series the RNN try to infer the sum of these time series.
I tried to implement this using LSTM and it doesn't seem to be an easy task. Am i making some mistake?

Edit: Yes, i am :) The problem is just with deep LSTM. They are harder to train even in an easy task.

Thanks in Advance. ",8,0
393,2015-5-25,2015,5,25,4,374e8h,UC Berkley labs develops a deep learning algorithm that enables robot mastery of skills via trial &amp; error.,https://www.reddit.com/r/MachineLearning/comments/374e8h/uc_berkley_labs_develops_a_deep_learning/,ovidius007,1432496735,"Article: http://newscenter.berkeley.edu/2015/05/21/deep-learning-robot-masters-skills-via-trial-and-error/

Video: https://youtu.be/JeVppkoloXs

Edit:

* Here's the comment thread on /u/futurology:
     * https://www.reddit.com/r/Futurology/comments/375o39/brett_the_robot_learns_to_put_things_together_on/
* /u/buck-nasty posted this YouTube video from one of the robot's creators on the /u/futurology thread: 
     * https://youtu.be/EtMyH_--vnU
* /u/gwern provided some useful links in the /r/singularity thread:
     * https://www.reddit.com/r/singularity/comments/375oio/brett_the_robot_learns_to_put_things_together_on/crkjhqt
",9,9
394,2015-5-25,2015,5,25,4,374eco,Building a self-learning crawler to screen most referenced durations in youtube videos,https://www.reddit.com/r/MachineLearning/comments/374eco/building_a_selflearning_crawler_to_screen_most/,Noweightsatthegym,1432496798,"We want to build a crawler or algorithm that takes the most referenced durations in YouTube videos. We want that algorithm to eventually be able to identify the reoccurring durations so that it can eventually splice up  Youtube videos according to those most common durations. How would I go about building that? 

Keep in mind. I'm new to machine learning. So any references to where to start in building a project like this would be greatly appreciated. I apologize in advance if this explanation is too vague. ",11,1
395,2015-5-25,2015,5,25,6,374roc,"Stanford's Deep Learning Javascript library is learning to draw Reddit Mascot (Snoo), just go to link and wait for Image Regresssion procedure",https://www.reddit.com/r/MachineLearning/comments/374roc/stanfords_deep_learning_javascript_library_is/,cagbal,1432503555,,19,63
396,2015-5-25,2015,5,25,6,374scs,20 Articles on deep learning &amp; neural networks Andrew Y NG shared in last 6 weeks!,https://www.reddit.com/r/MachineLearning/comments/374scs/20_articles_on_deep_learning_neural_networks/,[deleted],1432503908,,0,1
397,2015-5-25,2015,5,25,6,374tyv,20 articles on Deep learning shared by Andrew Y NG in 4 weeks. He literally brought back Neural Network from dead!,https://www.reddit.com/r/MachineLearning/comments/374tyv/20_articles_on_deep_learning_shared_by_andrew_y/,nlp911,1432504720,,0,0
398,2015-5-25,2015,5,25,15,376b28,Comparison of official test scores of current Image Captioning systems,https://www.reddit.com/r/MachineLearning/comments/376b28/comparison_of_official_test_scores_of_current/,flukeskywalker,1432534145,,5,2
399,2015-5-25,2015,5,25,16,376gpy,Data mining algorithms in plain English,https://www.reddit.com/r/MachineLearning/comments/376gpy/data_mining_algorithms_in_plain_english/,bckygldstn,1432538490,,0,4
400,2015-5-25,2015,5,25,17,376msi,Feature Extraction from arbitrary Time-Series help?,https://www.reddit.com/r/MachineLearning/comments/376msi/feature_extraction_from_arbitrary_timeseries_help/,ddofer,1432543851,"I work in a (non-standard) domain, in which I can represent sequences of variable (or fixed length sub-sequences) length as (different) time-series.
I don't have any experience working with time-series, or extracting them into fixed-length feature vectors, and was hoping for some intuitions. 

I know that an option is using the Fourier Transform or wavelets, but I don't know which type of transform is best, or how to interprete it. (The FFT/DFT gives the ""coefficients"" - and I can choose the top coefficients to keep, right?)
 Is this a good way to represent the time-series in a way that's more ""informative"" than simply taking the time-series' Average, Min, Max ? 

Some Python code examples would be great (I'm assuming SciPy would be best or PyWavelets, but I would want to see some examples of feature extraction code)... 
[PS - Just to reiterate, these time series are not speech, audio or stock/market data].

(The end goal is to apply this to a supervised machine learning classification task, to improve the represented features).
",17,0
401,2015-5-25,2015,5,25,19,376ufe,Help with classifying fMRI sequences using neural networks,https://www.reddit.com/r/MachineLearning/comments/376ufe/help_with_classifying_fmri_sequences_using_neural/,ppries,1432549986,"Hi machine learning experts    

I'm working with a motor-task fMRI dataset where I want to classify which action they are doing from a sequence of 3D images. I've tried different neural network architectures, but I'm having trouble getting them to learn anything.

Here's what I've done so far - I'll try to keep it brief.

Originally, the dataset is split up in two experiments of 284 frames of 91 x 109 x 91 voxels per subject. In each experiment, there is 170 frames where they are performing an action (moving each hand, each foot and the tongue twice continually for 17 frames). I've extracted each action from the data, delayed according to a cannonical hemodynamic response function peak (~6 seconds). That is, when I know they are starting an action, I extract 17 frames 6 seconds later in the experiment and label them accordingly. Additionally, the data is normalized to values between 0 and 1.

OK, on to the stuff I've tried. I've tried both CNNs and RNNs with LSTM units. For the CNNs, I've tried both flattening the image, treating the sequences as a dimension in the image (that is, the input is #timesteps x (h x w x d)) and collapsing the depth of the 3D images by taking the mean, treating the sequences as channels of the image. The architecture has been different number of convolutional -&gt; max pooling layers, with 32 filters of size 5 or 15 (arbitrarily chosen, I'm not sure how to pick these hyperparameters) followed by one or several fully connected layers of sizes 128-512 and a softmax output layer. The results has been around random (~20 %) in all cases. 

The RNN has been trained on the flattened images (either downsampled or collapsed, to reduce input dimensionality), where I only take the last output of the recurrent layer (in a sense, I want the network to process the entire sequence before attempting to predict what action is being performed). The architecture has been one or more (mostly one) recurrent layers with 128-512 LSTM units followed by zero or more fully connected layers with 128-512 units, with a softmax output layer. Again, only random accuracy was achieved.

In both cases I have been able to get the network to overfit on very small subsets of the data set (8-16 data points), but when training on the full dataset, the accuracy does not change significantly. However, the mean training loss (categorical cross entropy) does seem to be declining, albeit on the 5th or 6th decimal point.

I am completely new to the world of fMRI, and not an expert on deep learning at all, so it might be that I have missed something completely. I have tried finding similar work, but have not been successful. If anyone have any pointers, or know of someone who has done something similar with some success, the help would be appreciated. Let me know if something I have written is not clear.

(For the records - I am using Theano with Lasagne to implement these networks)",14,9
402,2015-5-25,2015,5,25,20,376wza,For those who are getting into Machine Learning,https://www.reddit.com/r/MachineLearning/comments/376wza/for_those_who_are_getting_into_machine_learning/,_blub,1432552109,"All the peeps who try to give help in subreddit will always recommend the the basic shit. Cliche coursera courses with Andrew Ng (geeezus that guy is a king), and ""do this"" style of guidance. So here is my advice as an individual who has already taken courses with artificial intelligence and machine learning.

So as an unorthodox approach, I will describe things in terms of microsoft excel.

**Math** - Machine learning is the most practical harmony of statistics, calculus, linear algebra and discrete mathematics. You have to think multidimensionally all the time, and not just 3d. You need to be very comfortable with thinking in nearly infinitely many dimensions.

Surprisingly (actually very surprisingly) it's actually quite easy to think multi-dimensionally (*cue the linear algebra*) where each column of an excel spreadsheet is a particular dimension. So if we were to assume small images of handwriting that are 30 pixels by 30 pixels then we can flatten this into 900 columns of a spreadsheet (aka a 900 dimensional vector).


Considering that each row is a character image, we then load thousands upon thousands of rows of images that we already know as the particular characters (courtesy of [the MNIST](http://yann.lecun.com/exdb/mnist/) dataset). 

Divide the dataset into the 52 (uppercase and lowercase english characters) that we have known since kindergarten. And for each ""classification"" (there are 52 classes) of letters that we already know, take a statistical average (*cue the statistics*) for each 900 columns per each few thousand images that are an ""a"", ""b"", ""c"", ... ""Z"". 

We now have 52 averages in 900 dimensions. You now just figured out the near perfect averages of handwritten characters. 

What if we add in a new letter? Well, we figure out which statistical mean (in 900 dimensions) our new letter is close to. If you think of Euclidian distance, then its actually quite easy ([Pythagoreans theorem in multiple dimensions](http://en.wikipedia.org/wiki/Norm_%28mathematics%29))

And now we can do character recognition. Fuck yeah.


**Programming** - Excel Sucks, so here is where Python, R and Haskell come into play. The machine learning model I described above is similar to the K-Means and Logistic Regression models, but if you want to get into the more brilliant models of ML, then learn yourself some set-comprehensions to chef up data-representations and multi dimensional sets in to the way you are the most comfortable with. [Discrete mathematics](http://www.people.vcu.edu/~rhammack/BookOfProof/), Its easier than calculus.

**The Bigger Picture**

Honestly, have fun with this. Allow yourself to be very, very confused. The best advise is to be patient and allow your mind some time to all of a sudden *click*, This moment you realize something, you will feel as though you just got projected to fucking pluto. For those who are Mathematicians or Computational Scientists, this is a frequent sensation that often occurs right before sleep and results in frantic ""Holy shit, I know how the world works"" chants until 8:00am the next morning. The following models will make sure you have multiple of these ""HOLY SHIT"" moments that induce said insomnia.

- Gaussian Mixed Models
- Support Vector Machines
- Fast Fourier Transforms
- Convolutional Neural Networks
- Hidden Markov Models
- Statistics (Honestly simple confidence intevals and Regression, but Multi-Dimensionally)",39,35
403,2015-5-26,2015,5,26,0,377lh5,6 Tricks I Learned From The OTTO Kaggle Challenge,https://www.reddit.com/r/MachineLearning/comments/377lh5/6_tricks_i_learned_from_the_otto_kaggle_challenge/,john_philip,1432566960,,4,48
404,2015-5-26,2015,5,26,1,377z6b,Optimization and functional analysis,https://www.reddit.com/r/MachineLearning/comments/377z6b/optimization_and_functional_analysis/,bagelorder,1432573089,"I know read quite a few times that optimization and functional analysis are math topics with relevance (or even important?) topics in ML.
What do you mean by optimization? My university has two directions here: numerical optimization (non-linear) and linear optimization/combinatory optimization. Which of these is meant here?

And what do you meant by functional analysis? Which parts of it are useful?",9,1
405,2015-5-26,2015,5,26,3,3789d0,New 'Deep Learning' Robot Learns Skills Through Trial and Error,https://www.reddit.com/r/MachineLearning/comments/3789d0/new_deep_learning_robot_learns_skills_through/,[deleted],1432577479,,0,0
406,2015-5-26,2015,5,26,3,378but,Are there any good resources for learning about neural networks?,https://www.reddit.com/r/MachineLearning/comments/378but/are_there_any_good_resources_for_learning_about/,Kurren123,1432578509,"I'm looking for resources on neural nets which:

* Don't move too fast. The more ""for dummies"" the better.
* Introduce you to the basics (perceptron, sigmoid neurons etc), then take you through all the flavours like convolutional and recurrent neural nets.
* Are easy to read, and keep things interesting
* Preferably have code samples

I did maths and comp sci at university although I'm a little rusty. So resources with maths in are fine as long as they don't drop you in the deep end.

So far I've worked through [this online book](http://neuralnetworksanddeeplearning.com/) which is great for beginners and I recommend anyone reading who knows some math to look at.

Thanks in advance for any help!",12,20
407,2015-5-26,2015,5,26,3,378fju,"What are your opinions on the paper ""On event-based optical flow detection""?",https://www.reddit.com/r/MachineLearning/comments/378fju/what_are_your_opinions_on_the_paper_on_eventbased/,andrewbarto28,1432580025,"Is it original? Is it really useful for detecting objects? Are there better alternatives?

Link: http://journal.frontiersin.org/article/10.3389/fnins.2015.00137/abstract",0,1
408,2015-5-26,2015,5,26,4,378o6a,Master Thesis - Machine Learning - Survey (About Games),https://www.reddit.com/r/MachineLearning/comments/378o6a/master_thesis_machine_learning_survey_about_games/,sheepsy90,1432583685,"Hello,

I am currently writing my master thesis in computer science with the Topic ""Ordinal Data in Games"". I already did a small study and want to refine my results now.

I therefore need a lot more people who can answer my small survey. You decide yourself how long do you want to participate. The questions are not depended on each other.

Just give it a try and read the one page description on http://heleska.de:8000/ and continue afterwards directly to the study.

I would be glad if you help me.

Greetings Sheepy
",3,0
409,2015-5-26,2015,5,26,5,378r8j,New Keyword Extractor: smarter and more flexible extractor,https://www.reddit.com/r/MachineLearning/comments/378r8j/new_keyword_extractor_smarter_and_more_flexible/,wildcodegowrong,1432584994,,0,0
410,2015-5-26,2015,5,26,5,378ssh,Do you have a good way of debugging Torch7 code?,https://www.reddit.com/r/MachineLearning/comments/378ssh/do_you_have_a_good_way_of_debugging_torch7_code/,ticcky,1432585670,"In Python I use the magical ""import pdb; pdb.set_trace()"" for debugging. However, in Torch7 I couldn't find anything as useful. Therefore, I'd like to ask if you have some tricks how do you go about debugging Torch7 code? =)

Thanks!",6,8
411,2015-5-26,2015,5,26,7,379cmt,I Let IBMs Robot Chef Tell Me What to Cook for a Week,https://www.reddit.com/r/MachineLearning/comments/379cmt/i_let_ibms_robot_chef_tell_me_what_to_cook_for_a/,bs2sb,1432594540,,10,57
412,2015-5-26,2015,5,26,8,379kn4, Machine Learning: Algorithms Terminology,https://www.reddit.com/r/MachineLearning/comments/379kn4/machine_learning_algorithms_terminology/,kingvicc,1432598320,"I'm a bit confused on terminology, so I would appreciate some help.

I've seen many sites and resources refer to Linear Regression, Logistic Regression, Neural Networks, SVMs, etc. as machine learning algorithms.

However I've also seen the same sources refer to Ordinary Least Squares, Elastic Net, Batch Gradient Descent, etc. referred to as machine learning algorithms.

So my question is, If I had to group these into two groups, what would a better less ambiguous term be?

AlgorithmTypes &amp; OptimizationTypes? 

(P.S. I know what they all do, I'm just trying to find a simple way to denote the difference between categories for a project I'm building).
",4,0
413,2015-5-26,2015,5,26,9,379rbk,How do ML researchers approach collecting training data from humans?,https://www.reddit.com/r/MachineLearning/comments/379rbk/how_do_ml_researchers_approach_collecting/,mike_bolt,1432601666,"I'm considering creating a website geared towards allowing researchers to gather training data from human users for specialized machine learning projects. I'm trying to do some background research here to figure out if there is a need for this website. I would appreciate it if you could answer some of these questions.

How do researchers or research teams typically approach this problem? Is it common to use a site like mechanical turk? Does mechanical turk meet the needs of most researchers? Is it too expensive? Are there any alternative sites like the one I described? Would you like to see a site like this? Would you use it?",6,1
414,2015-5-26,2015,5,26,11,37a5wx,Classifying Golf Players with K-Means and Hierarchical Clustering,https://www.reddit.com/r/MachineLearning/comments/37a5wx/classifying_golf_players_with_kmeans_and/,bigdatabucket,1432608820,,0,3
415,2015-5-26,2015,5,26,12,37aal6,Setting up a GPU accelerated deep learning environment on Elementary OS freya with CUDA,https://www.reddit.com/r/MachineLearning/comments/37aal6/setting_up_a_gpu_accelerated_deep_learning/,wolfchimneyrock,1432611233,,2,6
416,2015-5-26,2015,5,26,12,37acsk,Linear Algebra for Beginners Course,https://www.reddit.com/r/MachineLearning/comments/37acsk/linear_algebra_for_beginners_course/,rickmister24,1432612462,,0,1
417,2015-5-26,2015,5,26,13,37ahe9,Do tree models benefit from feature selection?,https://www.reddit.com/r/MachineLearning/comments/37ahe9/do_tree_models_benefit_from_feature_selection/,Nixonite,1432614959,"Hello everyone,

I'm learning about ML and I've been thinking about this a lot, but are tree models sensitive to feature selection? 

I mean, do they improve by cutting out features of little importance/variance? By benefit, I mean in model performance not computational time.",4,0
418,2015-5-26,2015,5,26,15,37ardy,Softmax vs sigmoid for output of a neural network,https://www.reddit.com/r/MachineLearning/comments/37ardy/softmax_vs_sigmoid_for_output_of_a_neural_network/,XalosXandrez,1432621231,"It is common practice to use a softmax function for the output of a neural network. Doing this gives us a probability distribution over the classes.

What if, instead, we use a sigmoid activation on each output neuron? We get one-vs-all probabilities for each class. If this is conceptually sound, has someone does this before? Does this affect training in any way? ",11,3
