,date,year,month,day,hour,id,title,full_link,author,created,selftext,num_comments,score
83,2015-5-7,2015,5,7,4,3539vm,Artificial Intelligence Research Project - need players and survey data,https://www.reddit.com/r/MachineLearning/comments/3539vm/artificial_intelligence_research_project_need/,airesearchproject,1430939600,"Hey everyone,

I am a computer science student conducting a research project on Artificial Intelligence. Specifically, I am seeing how online game players perceive their opponents, as human or AI.

I have a short survey (2 questions that will take a minute at most) that I would appreciate any responses to: https://docs.google.com/forms/d/1EBdIY-22c_kAvUKLLvpKooEXXHsMYRSp7ODmE0ZjdU4/viewform?usp=send_form.

In addition, I have a small game of Checkers that people can play - you are randomly paired with either another human player or an AI. Then, at the end of the game, you are asked for some feedback (whether you think your opponent was human or not and any details). That is located here: https://panchr.me/focus.

Both the survey and game are very short and would greatly aid in my project, so I appreciate any responses (to either the game or the survey, or both). Thank you in advance!",0,0
84,2015-5-7,2015,5,7,4,353a5g,"Nervana Systems open sources Neon, a python-based deep learning framework",https://www.reddit.com/r/MachineLearning/comments/353a5g/nervana_systems_open_sources_neon_a_pythonbased/,[deleted],1430939720,,0,1
85,2015-5-7,2015,5,7,4,353foi,Do convolutional autoencoders exist?,https://www.reddit.com/r/MachineLearning/comments/353foi/do_convolutional_autoencoders_exist/,regularized,1430942187,I have recently read Schmidhuber's paper on Convolutional Autoencoders. Are there any new papers/advancements on conv autoencoders? If not do you know why? ,2,2
86,2015-5-7,2015,5,7,5,353lz0,"Neon, an open-source, Python-based, deep learning framework from Nervana Systems",https://www.reddit.com/r/MachineLearning/comments/353lz0/neon_an_opensource_pythonbased_deep_learning/,meepmeepmoopmoop,1430944975,,27,92
87,2015-5-7,2015,5,7,7,35433h,Anyone heard of Re Work Deep Learning Conference or know of a discount code for it?,https://www.reddit.com/r/MachineLearning/comments/35433h/anyone_heard_of_re_work_deep_learning_conference/,matlab484,1430952986,"Debating going, I'm a student so the prices are pretty expensive, has anyone gone to these before? Are they worth attending?

https://www.re-work.co/events/deep-learning-boston-2015",0,2
88,2015-5-7,2015,5,7,8,3544ij,Anyone down to review my resume (I'll return the favor if needed!)?,https://www.reddit.com/r/MachineLearning/comments/3544ij/anyone_down_to_review_my_resume_ill_return_the/,[deleted],1430953641,"Hey, PM me if you want to look at my resume and suggest any edits. I have a B.S. + M.S. in Applied Mathematics and a year in the industry, but I am looking into moving to California and find a Data Scientist or Machine Learning job. ",2,1
89,2015-5-7,2015,5,7,8,3546js,"Problem: to reliably detect a human, in nature, wearing blue jeans, from &gt;30m away, with sensors mounted on a quadcopter. How would you go about solving this?",https://www.reddit.com/r/MachineLearning/comments/3546js/problem_to_reliably_detect_a_human_in_nature/,about3fitty,1430954723,"Have been thinking - would OpenCV library with camera work? Is there a role for IR/UV/LIDAR? How would one overcome the problem of the camera being mounted on a moving quadcopter? How would you go about using Machine Learning for this task? Was exploring the use of Support Vector Machines to help solve this challenge, but don't have a good idea of where to start. Has anyone on this sub done something similar?",9,2
90,2015-5-7,2015,5,7,11,354plh,math degree for ML?,https://www.reddit.com/r/MachineLearning/comments/354plh/math_degree_for_ml/,dsocma,1430964743,"I want to be a researcher in deep learning.  I've thought about it for a while and I think the best undergrad education for this would be to get a math degree, heavy in stats, with a minor in CS, and specifically take the more fundamental theoretical CS classes like complexity theory, automata theory, ect, and skip the classes about compilers, software engineering, and other low level or practical stuff, and also take a few neuroscience classes, and also do practical machine learning on my own and take online machine learning MOOCs.

Does this sound like the best undergrad education?

For people that have a math degree, do you feel it was the best preparation? ",4,1
91,2015-5-7,2015,5,7,11,354sdg,ICML '15 Accepted Papers,https://www.reddit.com/r/MachineLearning/comments/354sdg/icml_15_accepted_papers/,goblin_got_game,1430966252,,0,29
92,2015-5-7,2015,5,7,13,3555q6,I could use a bit of help implementing a decision tree in SQL,https://www.reddit.com/r/MachineLearning/comments/3555q6/i_could_use_a_bit_of_help_implementing_a_decision/,[deleted],1430974172,"I've played around a bit with weka decision tree analysis and I've found a good combination of parameters that work well to classify my data. The issue is the number is number of nested case statements, SQL throws an error if the nest depth is greater than 10. 

I'm guessing that I'm just not doing it right. Are there tricks to implementing a highly nested decision tree in SQL I should know about?",5,0
93,2015-5-7,2015,5,7,16,355jqc,"The Past, Present, and Future of Machine Learning APIs",https://www.reddit.com/r/MachineLearning/comments/355jqc/the_past_present_and_future_of_machine_learning/,osroca,1430985377,,0,1
94,2015-5-7,2015,5,7,17,355man,ICLR 2015 Conference Schedule/Publication overview,https://www.reddit.com/r/MachineLearning/comments/355man/iclr_2015_conference_schedulepublication_overview/,AlcaDotS,1430987869,,2,2
95,2015-5-7,2015,5,7,18,355qm9,"The Past, Present, and Future of Machine Learning APIs",https://www.reddit.com/r/MachineLearning/comments/355qm9/the_past_present_and_future_of_machine_learning/,czuriaga,1430991971,,0,1
96,2015-5-7,2015,5,7,19,355scr,Machine Tools Suppliers,https://www.reddit.com/r/MachineLearning/comments/355scr/machine_tools_suppliers/,Md-Malik,1430993558,,0,1
97,2015-5-7,2015,5,7,21,3562o7,"Does anyone have thoughts/documentation on how to build a recommendation system (i.e. collaborative filtering, matrix factorization) for binary data (probability of 1 occurring) rather than ranking data (movie ratings etc)?",https://www.reddit.com/r/MachineLearning/comments/3562o7/does_anyone_have_thoughtsdocumentation_on_how_to/,TheRandomForest,1431001636,Most documentation seems to be around problems such as the Netflix prize which uses rankings of 1-5 - but my data is around which offer is best suited for each customer based on other offers as well as customer demographics...  ,8,0
98,2015-5-7,2015,5,7,21,356571,How does the twitter handle work ?,https://www.reddit.com/r/MachineLearning/comments/356571/how_does_the_twitter_handle_work/,deathbullet,1431003268,The twitter handle @mxlearn auto tweets if there is any update on the MachineLearning subreddit. How dies it work ?,2,0
99,2015-5-7,2015,5,7,23,356cv2,Richmond ECPI University Student Wows Faculty with Senior Project,https://www.reddit.com/r/MachineLearning/comments/356cv2/richmond_ecpi_university_student_wows_faculty/,taylorsmith22,1431007431,,0,1
100,2015-5-7,2015,5,7,23,356e76,Ask r/machinelearning: Is this CloudSight API just smoke and mirrors (humans) as opposed to deep learning as implied in their PR? Try it out yourself here.,https://www.reddit.com/r/MachineLearning/comments/356e76/ask_rmachinelearning_is_this_cloudsight_api_just/,MyMomSaysImHot,1431008152,,49,23
101,2015-5-8,2015,5,8,1,356swa,Who's in San Diego right now (@ICLR)?,https://www.reddit.com/r/MachineLearning/comments/356swa/whos_in_san_diego_right_now_iclr/,taion,1431015004,"Which posters are you excited about?

It's friggin' cold here.",8,2
102,2015-5-8,2015,5,8,3,357dwl,Is there a way to denote the non-independence of features in any machine learning framework? [cognitive neuroscience / neuroimaging application for spatiotemporal patterns of brain activity],https://www.reddit.com/r/MachineLearning/comments/357dwl/is_there_a_way_to_denote_the_nonindependence_of/,mobiuscydonia,1431024536,"Hey guys,

I've been using machine-learning in conjunction with neuroimaging for quite some time now.

The long and short of it is that:

1) I have time-series of brain data (~1 3D picture of the brain every second)

2) I denote activity-states of the brain based on onsets-of-interest (e.g at this point in the time-series they were doing a memory task)

3) separate each picture into voxels (3D pixels)

4) Use subsets of those voxels as features in a classification that aims to dissociate activity states from one another.

Typically, someone may be doing a task over the course of 10 seconds. In this case, we'd have 10 pictures. Normally, we confound this with a hemodynamic response function, sum, and end up with 1 set of features-- 1 average activity value for each voxel.

Recently, I've been playing around with skipping this part and feeding all 10 pictures in at once, so as to capture a spatio-temporal pattern of activity instead of just a spatial pattern.

While classification improves significantly, I was worried about the lack of independence amongst my features. That is, one feature is the same as another feature, just one time-point in the future.

Is this okay? If not (or even if it is), is there a way to ""bind"" certain features such that they can still contribute to a classifier, but the classifier knows about their non-independence?

I'm used to SVM, LASSO, and logistic regression, but would be more than happy to explore new classifiers.

Thanks for any and all insights!",6,0
103,2015-5-8,2015,5,8,4,357jo6,Detect the facing direction of a distorted rect (4 points given) in a Augmented Reality Manner,https://www.reddit.com/r/MachineLearning/comments/357jo6/detect_the_facing_direction_of_a_distorted_rect_4/,Indyaner,1431027107,"Hello

I'm working with a small pattern recognition class that is able to detect a QR Codes. I noticed that that class gives me the shape of the detected QR code and its position on the screen. [I draw a diagram to make this clearer.](http://i.imgur.com/Uhr5KZT.jpg). I could solve X by some geometry but how can I figure out the Direction/Angle the red axis would face? I would like to achieve something like a very simple Augmented Reality Effect.

Thanks in advance for any links.",0,0
104,2015-5-8,2015,5,8,4,357k9k,What approach should I use?,https://www.reddit.com/r/MachineLearning/comments/357k9k/what_approach_should_i_use/,[deleted],1431027365,"I'm looking at a project that would require me to determine if product descriptions across multiple websites (ex: amazon, ebay, etc...) are referring to the same product. I was wondering if anyone had some input on the best approach to tackle this problem.",0,0
105,2015-5-8,2015,5,8,5,357nu6,Is there a term for regularization to a non-zero value?,https://www.reddit.com/r/MachineLearning/comments/357nu6/is_there_a_term_for_regularization_to_a_nonzero/,rasmoo,1431028918,"Basically, I needed a method to keep the weights of an encoder matrix from becoming zero, since this is a trivial, but low-cost solution to my reconstruction error.

I came up with a 'regularization' cost based on summing up the squared difference between 1 and the 1-norm of each row in the matrix (sorry, no LaTeX here), although any vector norm could've been used. I've implemented it, and it works quite well. Now, this both achieves my initial goal and also results in a relatively sparse matrix, but now I'm left wondering whether anyone has done this before?",7,0
106,2015-5-8,2015,5,8,5,357qbl,List of Deep Learning Tools with brief descriptions and links,https://www.reddit.com/r/MachineLearning/comments/357qbl/list_of_deep_learning_tools_with_brief/,bigblue53,1431030026,,0,1
107,2015-5-8,2015,5,8,5,357qh1,The tensor renaissance in data science,https://www.reddit.com/r/MachineLearning/comments/357qh1/the_tensor_renaissance_in_data_science/,gradientflow,1431030089,,11,29
108,2015-5-8,2015,5,8,5,357qtj,Why do people use GPUs for calculations?,https://www.reddit.com/r/MachineLearning/comments/357qtj/why_do_people_use_gpus_for_calculations/,bwaxxlo,1431030248,"I've been following a few cool ML guys on twitter. A couple of months back, before being bought out by Google, one of them posted an image of his rig using a GPU for calculations. I thought video cards wouldn't be so good at performing such tasks (considering they were built to do rendering) but I can only speculate. So, what's the deal with using GPUs? Is it a non-intrusive memory thing where they avoid overloading the processor/machine-memory or is the GPU just better at dealing with certain ML tasks? If the answer is the latter, could someone expand on how GPU are better than the processor/RAM?",16,3
109,2015-5-8,2015,5,8,5,357rot,Free Open Source Bayesian Network Software,https://www.reddit.com/r/MachineLearning/comments/357rot/free_open_source_bayesian_network_software/,bigblue53,1431030648,,0,1
110,2015-5-8,2015,5,8,6,357x7s,"Convolutional NN. If loss is going down but accuracy i not increasing, what can I do?",https://www.reddit.com/r/MachineLearning/comments/357x7s/convolutional_nn_if_loss_is_going_down_but/,[deleted],1431033207,"I have CNN with softmax at the end. ~50k of images, binary classification. Loss graph looks like this:

http://i.imgur.com/gTffPBZ.png?1

Loss is going down, but no gain in accuracy.What can you recommend?




",2,1
111,2015-5-8,2015,5,8,6,3580q5,ARTMAP in Python?,https://www.reddit.com/r/MachineLearning/comments/3580q5/artmap_in_python/,bschu,1431034847,"Hello, I am having trouble finding an ARTMAP implementation in Python. Before I write one has anyone heard of ARTMAP in python source?",0,0
112,2015-5-8,2015,5,8,7,35854i,"Computational Network Toolkit (CNTK) from Microsoft: NN, CNN, RNN.",https://www.reddit.com/r/MachineLearning/comments/35854i/computational_network_toolkit_cntk_from_microsoft/,Foxtr0t,1431036932,"A new deep learning framework every day! Yesterday Neon, today this: http://cntk.codeplex.com/

182-page manual: http://research.microsoft.com/apps/pubs/?id=226641

Someone please translate the license to English for me.",3,7
113,2015-5-8,2015,5,8,10,358qr9,Getting Started with Deep Learning,https://www.reddit.com/r/MachineLearning/comments/358qr9/getting_started_with_deep_learning/,carmichael561,1431048071,,2,57
114,2015-5-8,2015,5,8,10,358u81,Interdisciplinary Data and Helping Humans Be Creative,https://www.reddit.com/r/MachineLearning/comments/358u81/interdisciplinary_data_and_helping_humans_be/,vkhuc,1431049907,,0,4
115,2015-5-8,2015,5,8,12,3593oz,Exposure to Diverse Information on Facebook,https://www.reddit.com/r/MachineLearning/comments/3593oz/exposure_to_diverse_information_on_facebook/,kunalj101,1431055137,,0,4
116,2015-5-8,2015,5,8,15,359iwb,Grad School Choices,https://www.reddit.com/r/MachineLearning/comments/359iwb/grad_school_choices/,a_technicolor_skye,1431065296,"Hi,

I've done a BEng in Aeronautics and am switching to ML. I have a background in MatLab and wrote my bachelor's thesis in Python. I have been accepted to UCL's MS ML and Columbia's MS CS programs. I'll be focused solely on ML in UCL while I'll have a more general education at Columbia as they have systems and theory requirements. I'm concerted about my lack of a formal CS background which might adversely impact my chances of getting hired after I graduate and going to Columbia seems like a good way to rectify that. At the end of the day, I hope to learn more about ML through the graduate program, gain employable skills and figure out if I want to do a PhD. Any thoughts?",9,1
117,2015-5-8,2015,5,8,18,359uv7,Datamining for Growth Hacking,https://www.reddit.com/r/MachineLearning/comments/359uv7/datamining_for_growth_hacking/,[deleted],1431076212,,0,1
118,2015-5-8,2015,5,8,18,359xq7,CNNs: Strange plots.,https://www.reddit.com/r/MachineLearning/comments/359xq7/cnns_strange_plots/,Tom-Demijohn,1431079103,"CIFAR-10.  Conv + MaxPool + Conv + MaxPool + Conv + FC
SGD + sigmoid. No regularization
I was trying different learning rates values. 
[plot](http://postimg.org/image/p5i1zk417/)
Why there is a flat plot at the beginning? I though it might be because pictures were in 0 .. 255 values format and sigmoid suck at these values so I normalized these values to 0 .. 1 but I keep getting the same.
",10,3
119,2015-5-8,2015,5,8,21,35a9bw,Using K-Means to cluster wine dataset,https://www.reddit.com/r/MachineLearning/comments/35a9bw/using_kmeans_to_cluster_wine_dataset/,brotherrain,1431088801,,4,7
120,2015-5-8,2015,5,8,22,35afr3,Visual Turing Test Dataset: VQA Visual Question Answering,https://www.reddit.com/r/MachineLearning/comments/35afr3/visual_turing_test_dataset_vqa_visual_question/,glassackwards,1431092588,,0,10
121,2015-5-8,2015,5,8,23,35an18,Pushing the Frontiers of Computer Vision: A Q&amp;A with Google's Christian Szegedy,https://www.reddit.com/r/MachineLearning/comments/35an18/pushing_the_frontiers_of_computer_vision_a_qa/,reworksophie,1431096299,,0,1
122,2015-5-8,2015,5,8,23,35ao1a,[1505.01809] Language Models for Image Captioning: The Quirks and What Works,https://www.reddit.com/r/MachineLearning/comments/35ao1a/150501809_language_models_for_image_captioning/,exgr,1431096816,,1,8
123,2015-5-9,2015,5,9,2,35b7a6,[Question][Noob] Text Classification question,https://www.reddit.com/r/MachineLearning/comments/35b7a6/questionnoob_text_classification_question/,Iwdst,1431106006,"I've been working on a way to classify SMSs based on whether they are useful for an app my company currently makes. I obtained a large dataset and managed to make a sparse matrix of all the words, SMS-wise. I'm looking for an algorithm which will tell me which words occur together the most in this data set(and perhaps with what probability), I'm probably going to write it myself over the weekend but thought I'd ask once before possibly reinventing the wheel. Something which gave me conditional probability as well would be great. The purpose of all these output will be to create a scoring system since the number of useless messages vastly outnumber the useful ones. Any alternate method suggestions would be greatly appreciated as well :) . 


As always, I apologise for the noobness",0,0
124,2015-5-9,2015,5,9,3,35bdlm,Help sanity checking LSTMs with Hochreiter &amp; Schmidhuber's sequence order task,https://www.reddit.com/r/MachineLearning/comments/35bdlm/help_sanity_checking_lstms_with_hochreiter/,spurious_recollectio,1431109016,"I've been trying to sanity check my LSTM implementation because its had problems when I try to use it for language modelling (though I'm not sure this is related to the LSTM itself).  I've checked that finite differences matches my back-propped derivatives even over large sequences (at least when I use a CPU implementation...on a GPU there are often significant precision issues).

But to really check the architecture I want my implementation to pass the sequence order task (6a) of the Hochreiter-Schmidhuber 1997 paper.  I modified the test slightly so the two tokens are placed somewhat randomly but always with a significant seperation between them (that grows with the sequence length) and also I ask the network to output the correct answer when it sees a particular input token rather than at the end of the sequence.  So e.g. I have a random alphabet (a,b,c,d) for most of the sequence, two special tokens (x,y) input at random timesteps but spaced far apart and a final input token e which always appears at a random timestep near the end of the sequence.  After the network sees the input e it should output 1-4 depending on the possible orderings of x and y (xx, xy, yx, yy).

Unlike HS97 I train with minibatch learning (rather than online) and backprop through time rather than RTRL (which I don't know anything about).  This makes it very hard to compare results unfortunately or to steal hyper-params from them.

My LSTMs are able to acheive 100% accuracy after several epochs (of a few thousand examples) for sequence up to length ~75 (here the min seperation between the x,y tokens is ~30) but when I try sequences of length 100 I can't get it to work.  They claim to get 100% accuracy after only 30k examples but of course they use online learning (so they're doing far more updates than I am).  

Even for sequences of length 50 or 75 there is a lot of hyper-parameter tuning needed to get it to work so I'm wondering if  my implementation really has a problem or if I just need to work harder to find the right parameters.  

Has anyone had any luck with this task using BPTT and if so can you share your hyper-params and # of training examples?  ",6,3
125,2015-5-9,2015,5,9,3,35beva,[Paper] Facebook studying ways to identify people in different angles and positions in photos,https://www.reddit.com/r/MachineLearning/comments/35beva/paper_facebook_studying_ways_to_identify_people/,unchandosoahi,1431109594,,0,9
126,2015-5-9,2015,5,9,3,35biev,"Julia, the scripting language of the future. Really.",https://www.reddit.com/r/MachineLearning/comments/35biev/julia_the_scripting_language_of_the_future_really/,LokiNjord,1431111303,,65,84
127,2015-5-9,2015,5,9,6,35byty,Please review my method,https://www.reddit.com/r/MachineLearning/comments/35byty/please_review_my_method/,mobone,1431119374,"I've been working with stock market data for some time now and have developed this method, I'm wondering if this is a good approach or if there is a better one.


The goal is to have machine learning pick which stocks will outperform the market indexes following earnings announcement. This should be recognizable because there is a lot of known and successful research in ""post earnings announcement drift"", showing stocks do drift upwards following announcements of specific quality levels.


This being the case, I setup the problem basically as follows:
Input for SVM:
% Beat EPS, % Beat Rev, (A couple other columns)
Mapped to an Observation state of percent change after x days, where x can be 1, 5, 10, 20, etc.


I train on data from 2011, and test on 2012, (etc) asking the machine what predicted state the stock will end up in, and then reveal what the actual changes were. I have data from 2011 to today.


I bin the input data into 3 or 4 different states, so that something like 857% is bin 4, and -20% is bin 2, and -756% is bin 0, etc.


To optimize the problem I am running through all the different combinations of the bin cut offs and finding the model that has the most consistent median and average return, and with the smallest standard deviation, for each year.


My question is, is there a better way to find this ""most consistent model"". And the thing that really stumps me is the ""number of days"" to hold the stock. The research papers say 1/6th of the movement is in the first day, but I've had good results on each x days I've tried (5, 10, 20). 


My plan is to add all the days, from 1 - 90, to the model search, so I have to perform 40*40*40*90 model tests essentially. This will take my computer all week, so I was wondering if there might be a better way. Is there a way to map the attributes to two observation states?


Thanks, let me know if anything is not clear. 



",4,0
128,2015-5-9,2015,5,9,11,35cuot,"bagofwords.net, my naive bayesian subreddit classifier webapp",https://www.reddit.com/r/MachineLearning/comments/35cuot/bagofwordsnet_my_naive_bayesian_subreddit/,[deleted],1431137394,,6,11
129,2015-5-9,2015,5,9,13,35d61u,How to use Thompson Sampling for non-Beta?,https://www.reddit.com/r/MachineLearning/comments/35d61u/how_to_use_thompson_sampling_for_nonbeta/,gogogadgetlegz,1431144833,"Hi,

How would I use thompson sampling for optimizing a value such as price or maximizing the time on a page?  

I'm familiar with thompson sampling on the Beta distribution, but I'm not clear how you extend this for rewards that are greater than 1.

Do you just use a normal distribution, calculate a mean / variance for your arms using an online / streaming method and then just sample that gaussian?

THANKS!",1,4
130,2015-5-9,2015,5,9,13,35d89s,[Question] Which one will be the best approach to create a model to predict soccer (football) winner?,https://www.reddit.com/r/MachineLearning/comments/35d89s/question_which_one_will_be_the_best_approach_to/,unchandosoahi,1431146501,"Soon the oldest football cup will be played in Chile and I want to do some predictions to know if my country team will have chances to win or not. 
Should I use nnets or SVM? Forest trees or something else? I don't know how to start.

Thanks in advance :D",7,5
131,2015-5-9,2015,5,9,16,35dji7,Bayesian Inference Successes in Machine Learning,https://www.reddit.com/r/MachineLearning/comments/35dji7/bayesian_inference_successes_in_machine_learning/,lol__wut,1431156370,"Hi /r/machinelearning,

I'm giving a brief talk at my university to students about bayesian inference and would like to give some good real life examples of where bayesian inference has achieved state of the art performance or where a bayesian inference approach is commonly used in some relatable application. Does anyone have any good examples off the top of their head?",11,5
132,2015-5-9,2015,5,9,21,35e2ai,[1505.00387] Highway Networks,https://www.reddit.com/r/MachineLearning/comments/35e2ai/150500387_highway_networks/,SuperFX,1431176164,,24,39
133,2015-5-10,2015,5,10,0,35eitw,Neural Nets with Caffe Utilizing the GPU,https://www.reddit.com/r/MachineLearning/comments/35eitw/neural_nets_with_caffe_utilizing_the_gpu/,joyofdata,1431186934,,0,0
134,2015-5-10,2015,5,10,1,35emhu,Looking to take Data science specialization from John Hopkins University. Will it be good enough to fetch an entry level job for me in Data Science field ?,https://www.reddit.com/r/MachineLearning/comments/35emhu/looking_to_take_data_science_specialization_from/,nerdof2014,1431188999,,4,2
