,sbr,sbr_id,date,year,month,hour,day,id,domain,title,full_link,author,created,selftext,num_comments,score,over_18,thumbnail,media_provider,media_thumbnail,media_title,media_description,media_url
194,MachineLearning,t5_2r3gv,2015-11-9,2015,11,9,11,3s30wd,github.com,"I answered a whole bunch of general ML questions which I just compiled to a FAQ, looking for feedback!",https://www.reddit.com/r/MachineLearning/comments/3s30wd/i_answered_a_whole_bunch_of_general_ml_questions/,rasbt,1447036565,,14,67,False,http://b.thumbs.redditmedia.com/wFogt4p2M-GlqOGVGCLepW1qSfeebQAk33uxgZls6kM.jpg,,,,,
195,MachineLearning,t5_2r3gv,2015-11-9,2015,11,9,16,3s3vnt,youtube.com,POLYESTER FLAKES PELLEIZING MACHINE_PET BOTTLE FLAKES GUANULATING LINE_F...,https://www.reddit.com/r/MachineLearning/comments/3s3vnt/polyester_flakes_pelleizing_machine_pet_bottle/,cisscomachine,1447053225,,1,0,False,default,,,,,
196,MachineLearning,t5_2r3gv,2015-11-9,2015,11,9,18,3s44rr,self.MachineLearning,[Question] Recommendations for literature on using neural network for information extraction from structured data?,https://www.reddit.com/r/MachineLearning/comments/3s44rr/question_recommendations_for_literature_on_using/,mimighost,1447060360,"Hi, I am looking into a potentially interesting topic recently. There are a lot of tools/library to help you extract a *cleaner* and more *readable* view from a html page, like the one below:
https://github.com/mozilla/readability

However, those tools/library often runs on the client side, so most of them uses hand-tuned rules or simple scoring system for picking important element, it is inevitable sometimes the result is not quite good. 

Now suppose we can label some of the output from those rule-based systems as good, others as bad, is there any existing machine learning method, particularly neural network powered ones can help to improve the performance? ",1,1,False,self,,,,,
197,MachineLearning,t5_2r3gv,2015-11-9,2015,11,9,18,3s457t,youtube.com,POLYESTER ZIPPER MONOFILAMENT MAKING MACHINE_POLYPROPYLENE ZIPPER FILAME...,https://www.reddit.com/r/MachineLearning/comments/3s457t/polyester_zipper_monofilament_making_machine/,cisscomachine,1447060752,,0,0,False,default,,,,,
198,MachineLearning,t5_2r3gv,2015-11-9,2015,11,9,18,3s45bm,questechie.com,Gmail AI: What's Privacy concerns about Smart Reply?,https://www.reddit.com/r/MachineLearning/comments/3s45bm/gmail_ai_whats_privacy_concerns_about_smart_reply/,Questechie,1447060830,,1,1,False,default,,,,,
199,MachineLearning,t5_2r3gv,2015-11-9,2015,11,9,19,3s4cbr,medium.com,Regressing Images: 24 Hours in New Orleans (incl. video),https://www.reddit.com/r/MachineLearning/comments/3s4cbr/regressing_images_24_hours_in_new_orleans_incl/,samim23,1447066651,,0,5,False,http://b.thumbs.redditmedia.com/scrmEQVoZQ7TqIkK50Ur1ufNVJBpC89aFS_0XbRR3IU.jpg,,,,,
200,MachineLearning,t5_2r3gv,2015-11-9,2015,11,9,20,3s4gbu,machinelearningmastery.com,Tips to deal with class imbalance,https://www.reddit.com/r/MachineLearning/comments/3s4gbu/tips_to_deal_with_class_imbalance/,arclite123,1447069689,,0,0,False,http://a.thumbs.redditmedia.com/VjF_JiTfPtn-I-MnVZG-GzJhxCBd_3Tx8seLxb9uT78.jpg,,,,,
201,MachineLearning,t5_2r3gv,2015-11-9,2015,11,9,22,3s4qpm,tensorflow.org,Google Tensorflow released,https://www.reddit.com/r/MachineLearning/comments/3s4qpm/google_tensorflow_released/,samim23,1447076147,,152,679,False,default,,,,,
202,MachineLearning,t5_2r3gv,2015-11-9,2015,11,9,23,3s4yaf,self.MachineLearning,[Question] Want to know more about OCR guidance needed.,https://www.reddit.com/r/MachineLearning/comments/3s4yaf/question_want_to_know_more_about_ocr_guidance/,tazonis,1447079914,"I want to create an OCR app for android for Greek characters. Am thinking of using a multi layer percepron network for the core but am fairly new to this. I know how to create the network but I have some holes to fill in. I read that for the training process I need to feed it with with some training images witch I made and match the exit nodes of the network, so for all Greek letters upper case and lower, numbers and characters I need to create some binarized training images, and if I want more than one font then I multiply by the number of fonts I want it to support. This method I think is called back propagation? After I train the network I save the values of the weights to use for the network I will include in the app. In the app i want to take a picture and then crop it where i want to read, so for example if I take a picture of a menu I will crop the image where there is something I want to read to avoid unnecessary pixels. After the image is croped I know that you need to preprocess it somehow. You need to scale it down to black and white, correct the orientation and somehow crop each character out of it to start the recognition. Where I need help is to how to make my training images, I know you need to use some binarize method to make the data understandable for the neurons. Do you know any library on android that does image processing? And what size must the train images must be? Also I have no idea how to crop the images of the characters from an image, do they have to be same size as the training images?. Anything could help, even general guidelines am not seeking a programming answer more than an answer that helps me learn more about the OCR in general. 

Thank you for your time,
best regards.",2,1,False,self,,,,,
203,MachineLearning,t5_2r3gv,2015-11-10,2015,11,10,0,3s58fu,self.MachineLearning,Right skewed vars and applying Log to them.,https://www.reddit.com/r/MachineLearning/comments/3s58fu/right_skewed_vars_and_applying_log_to_them/,hellomachinelearning,1447084408,"Hello,
I have a dataset with a lot of variables/predictors with right skewed distributions. When I apply log to them it fixes it and they become normal distributed but since dataset has a lot of 0 values they become -Inf and most algorithms do not accept that. How can I fix this?",2,0,False,self,,,,,
204,MachineLearning,t5_2r3gv,2015-11-10,2015,11,10,1,3s59lg,arxiv.org,[1511.02222] Deep Kernel Learning,https://www.reddit.com/r/MachineLearning/comments/3s59lg/151102222_deep_kernel_learning/,iori42,1447084898,,1,15,False,default,,,,,
205,MachineLearning,t5_2r3gv,2015-11-10,2015,11,10,1,3s59pz,aysent.github.io,Visualization of decision tree leaf nodes in Random Forests,https://www.reddit.com/r/MachineLearning/comments/3s59pz/visualization_of_decision_tree_leaf_nodes_in/,senyat,1447084948,,0,9,False,http://b.thumbs.redditmedia.com/iIjMA2Ybkq5NbeoZYVVpNPhYAdHMTvKXMS2BVlOgtyk.jpg,,,,,
206,MachineLearning,t5_2r3gv,2015-11-10,2015,11,10,1,3s5bx5,googleresearch.blogspot.de,"TensorFlow - Googles latest machine learning system, open sourced for everyone",https://www.reddit.com/r/MachineLearning/comments/3s5bx5/tensorflow_googles_latest_machine_learning_system/,[deleted],1447085800,[deleted],0,1,False,default,,,,,
207,MachineLearning,t5_2r3gv,2015-11-10,2015,11,10,2,3s5j8o,wired.com,Google Just Open Sourced the Artificial Intelligence Engine at the Heart of Its Online Empire,https://www.reddit.com/r/MachineLearning/comments/3s5j8o/google_just_open_sourced_the_artificial/,cast42,1447088668,,0,2,False,default,,,,,
208,MachineLearning,t5_2r3gv,2015-11-10,2015,11,10,2,3s5lta,unofficialgoogledatascience.com,"Using Empirical Bayes to approximate posteriors for large ""black box"" estimators",https://www.reddit.com/r/MachineLearning/comments/3s5lta/using_empirical_bayes_to_approximate_posteriors/,carmichael561,1447089659,,0,1,False,http://b.thumbs.redditmedia.com/Aux2AdP0BHIanfTVEQBowNCnODsNmy3dt43HjTPRxyk.jpg,,,,,
209,MachineLearning,t5_2r3gv,2015-11-10,2015,11,10,2,3s5nzq,self.MachineLearning,"What does TensorFlow mean for Keras, Lasagne, Block, Nervana?",https://www.reddit.com/r/MachineLearning/comments/3s5nzq/what_does_tensorflow_mean_for_keras_lasagne_block/,solololol,1447090443,The title is self explanatory. I'm a noob and would like a perspective from the kind people on this site.,39,30,False,self,,,,,
210,MachineLearning,t5_2r3gv,2015-11-10,2015,11,10,4,3s64b0,self.MachineLearning,Unsupervised Learning (Specifically ART),https://www.reddit.com/r/MachineLearning/comments/3s64b0/unsupervised_learning_specifically_art/,g_wm,1447096613,"I understand the basics of supervised learning in neural networks in relation to classification, but can't get my head around how unsupervised learning works, specifically adaptive resonance theory. Can anyone link me to any good resources (preferably ones which are noob friendly) or briefly explain how it works?",0,1,False,self,,,,,
211,MachineLearning,t5_2r3gv,2015-11-10,2015,11,10,4,3s65x8,tensorflow.org,"[TensorFlow] relu6 = min(max(features, 0), 6)",https://www.reddit.com/r/MachineLearning/comments/3s65x8/tensorflow_relu6_minmaxfeatures_0_6/,[deleted],1447097244,,8,1,False,default,,,,,
212,MachineLearning,t5_2r3gv,2015-11-10,2015,11,10,4,3s691e,3blades.io,Big Data in the Cloud: Predictive Analytics Driving Efficiency,https://www.reddit.com/r/MachineLearning/comments/3s691e/big_data_in_the_cloud_predictive_analytics/,aaron_shugert,1447098427,,0,1,False,http://b.thumbs.redditmedia.com/mL3AXe6nHF3lAvaWcSVZ4IVS2BIj8bQcac8L0Y7tLcs.jpg,,,,,
213,MachineLearning,t5_2r3gv,2015-11-10,2015,11,10,4,3s69n2,techcrunch.com,H2O.ai Raises $20M For Its Open Source Machine Learning Platform,https://www.reddit.com/r/MachineLearning/comments/3s69n2/h2oai_raises_20m_for_its_open_source_machine/,smoothjazzradiohits,1447098660,,5,3,False,http://b.thumbs.redditmedia.com/4w3N_V29zJ8nwh3f3piQT3U1j19hxW3iqAYLgwqy0qI.jpg,,,,,
214,MachineLearning,t5_2r3gv,2015-11-10,2015,11,10,5,3s6e5m,github.com,"Thanks for your feedback reddit!, here is the improved polyssifier (python module for running various classifiers) that now includes the brand new Voting classifier from sklearn.",https://www.reddit.com/r/MachineLearning/comments/3s6e5m/thanks_for_your_feedback_reddit_here_is_the/,aulloa,1447100373,,0,4,False,http://b.thumbs.redditmedia.com/8cGH4mo10Se4CjGM4-10zCtIzRa9-670eS0k6WXSrVg.jpg,,,,,
215,MachineLearning,t5_2r3gv,2015-11-10,2015,11,10,5,3s6fpe,self.MachineLearning,Algorithm for learning with multiple Hierarchical labels?,https://www.reddit.com/r/MachineLearning/comments/3s6fpe/algorithm_for_learning_with_multiple_hierarchical/,napsternxg,1447100935,"I have some text data in which each instance has multiple labels and these labels are also part of a hierarchy where each label can belong to multiple branches. 

1. Each instance can have multiple labels
2. Each of the labels are part of a hierarchy. E.g. Labels are as follows: R.0.0, R.1.0, R.2.0, R.0.1, R.1.1, where R is the root node. 

Example row will be:
&lt;features&gt; &lt;L1, L2, L3&gt;

Where,
L1 = R.0.0 and R.1.0
L2 = R.1.1
L3 = R.2.3.1 and R.1.4.3

I can imagine that one way to train this model would be to use a softmax classifier for each possible label, however, in that case I will loose the information provided by the hierarchy of the labels. 

Using a softmax for all possible paths in the tree is also an option but then I loose information that 1 label can point to 2 different paths in the hierarchy (see Labels L1 and L3)

Is there any literature describing a way to train a neural network or any other machine learning algorithm to train a prediction model using this kind of data?",1,4,False,self,,,,,
216,MachineLearning,t5_2r3gv,2015-11-10,2015,11,10,6,3s6ldu,self.MachineLearning,[Lasagne] Simple LSTM failing due undefined input dimension,https://www.reddit.com/r/MachineLearning/comments/3s6ldu/lasagne_simple_lstm_failing_due_undefined_input/,lucas_0,1447103174,"I'm trying to build an LSTM model for classifying the ATIS dataset.

From a sentence of undefined size N, I generate a context window word embedding matrix. That's what I need to feed on my model, but I can't figure out how to make it so.

When I define my input layer as:

    def build_lstm(input_var=None):
        l_in = lasagne.layers.InputLayer(shape=(None, 1, None, None), input_var=input_var)
        l_hid = l_lstm = lasagne.layers.LSTMLayer(l_in, num_units=300)
        l_out = lasagne.layers.DenseLayer(l_hid, num_units=127, nonlinearity=lasagne.nonlinearities.softmax)
    return l_out

I get:

    TypeError: unsupported operand type(s) for *: 'NoneType' and 'NoneType'

While if I define the input shape in the l_in declaration it works, for example:

    l_in = lasagne.layers.InputLayer(shape=(None, 1, 30, 30), input_var=input_var)

The point is that each sentence has a different size, thus resulting in a context window word embedding matrix of different shape. What can I do?",2,0,False,self,,,,,
217,MachineLearning,t5_2r3gv,2015-11-10,2015,11,10,6,3s6r25,datasciencecentral.com,7 Free Machine Learning Courses,https://www.reddit.com/r/MachineLearning/comments/3s6r25/7_free_machine_learning_courses/,vincentg64,1447105323,,0,1,False,default,,,,,
218,MachineLearning,t5_2r3gv,2015-11-10,2015,11,10,6,3s6t6l,self.MachineLearning,Data Mining/Machine Learning for advertising products to customers.,https://www.reddit.com/r/MachineLearning/comments/3s6t6l/data_miningmachine_learning_for_advertising/,Vespco,1447106108,"So, I am launching an online marketplace and I like the idea of using something that can look at all of the customers behavior and data and from that learn what other products to advertise to them - and get feedback of it's ad success rate so that it can learn from them and improve. 

Is this possible, or remotely practical to do this? Where would I even begin?
Seems like it would be hugely helpful. 

I could imagine various scenarios where if someone purchased agar + a pressure cooker, vs pectin + a pressure cooker, it means an awful lot from just those two data points. 
One is making sterile agar, and likely doing something with bacteria and fungi/mushroom growing - while the other is most likely just making a jam or jelly and is into food preservation. 

This would be helpful to know what to advertise to them next, petri dishes, or mason jar lids.  

With more customer data and ad feedback you could get even better at finding their niche interests and advertise relevant products. 

I'm no expert in any of this, so maybe it's easy or insanely difficult. I'd love to explore this option if it is possible. 

",4,0,False,self,,,,,
219,MachineLearning,t5_2r3gv,2015-11-10,2015,11,10,7,3s6v24,self.MachineLearning,[Question] How to detrend time series for clustering?,https://www.reddit.com/r/MachineLearning/comments/3s6v24/question_how_to_detrend_time_series_for_clustering/,rutherfordofman,1447106817,"I have a bunch (~300) different time series that I would like to cluster together based on some simple similarity measure e.g. Pearson coefficient. The problem is they all share a couple of large peaks which dominate the behaviour leading to uniformly high correlations (see figures [here](http://imgur.com/mgbL4aL) and [here](http://imgur.com/jEdv2cV)). I'm familiar with detrending a linear trend from time series, but I would like to know if there is some established way to 'remove' the affect of the large peaks.",5,1,False,self,,,,,
220,MachineLearning,t5_2r3gv,2015-11-10,2015,11,10,8,3s7728,self.MachineLearning,When is cloning in torch necessary and why?,https://www.reddit.com/r/MachineLearning/comments/3s7728/when_is_cloning_in_torch_necessary_and_why/,logrech,1447111569,"As of late, I've found myself needing a deeper understanding of how torch and nn, and so I've come to you guys. 

[Karpathy's char rnn](https://github.com/karpathy/char-rnn/blob/master/train.lua) has been the means with which I've picked up torch on a beginner level. 

As I understand it, the nn library does not at any point modify inputs sent to the forward function or the backward function. Those inputs are used to update values and gradients for various modules (values that are internal to the module), but at no point are the inputs themselves modified. 

As a question that I have, at these two places: [1](https://github.com/karpathy/char-rnn/blob/master/train.lua#L247), [2](https://github.com/karpathy/char-rnn/blob/master/train.lua#L272), a clone is performed. A clone allocates an entirely new space in memory. Why is this necessary?

So I understand why [3](https://github.com/karpathy/char-rnn/blob/master/train.lua#L192) is necessary. At each timestep, the model has different activation/gradient values and therefore you need a clone for each timestep. That makes sense. But are these clones sharing the same weights and parameters? How does torch then accumulate gradients across all the timesteps? 

But going back to the previous example, why can you not pass in the same h_init for the first call to forward in any pass of a batch? Is this necessary for cuda? 

I guess if someone could just give a run down of what I'm missing here, and how torch and nn and nngraph actually does what it does specifically in this context that would be awesome. ",2,3,False,self,,,,,
221,MachineLearning,t5_2r3gv,2015-11-10,2015,11,10,9,3s7har,self.MachineLearning,how much machine learning can you do on a desktop?,https://www.reddit.com/r/MachineLearning/comments/3s7har/how_much_machine_learning_can_you_do_on_a_desktop/,machinestupidity,1447115869,"

Ive got an 8 core 4.0Ghz system with 32 gig of ram and one enthusiast graphics card (4gb of onboard ram). How much could I do with this hardware? Could I drive a car? Could I run Deepdream real time? Could I create a virtual assistant? Could I pass the turing test? Could I run a simulation of a self balancing robot? How much exactly can you do with a high end desktop these days?",3,0,False,self,,,,,
222,MachineLearning,t5_2r3gv,2015-11-10,2015,11,10,14,3s8i87,youtube.com,Jeff Dean explains TensorFlow [video],https://www.reddit.com/r/MachineLearning/comments/3s8i87/jeff_dean_explains_tensorflow_video/,TDaltonC,1447132119,,11,179,False,http://b.thumbs.redditmedia.com/OG47HjTf1apVwYsB0gKLB242ke3kncb53kf1PCZ_u2A.jpg,,,,,
223,MachineLearning,t5_2r3gv,2015-11-10,2015,11,10,16,3s8ul0,youtube.com,POLYESTER SOLID SHEET PRODUCTION LINE_PET PANEL MAKING MACHINE_PET BOARD...,https://www.reddit.com/r/MachineLearning/comments/3s8ul0/polyester_solid_sheet_production_line_pet_panel/,cisscomachine,1447139003,,0,1,False,default,,,,,
224,MachineLearning,t5_2r3gv,2015-11-10,2015,11,10,16,3s8vqq,velesnet.ml,Veles - deep learning platform from Samsung,https://www.reddit.com/r/MachineLearning/comments/3s8vqq/veles_deep_learning_platform_from_samsung/,outlacedev,1447139765,,13,28,False,default,,,,,
225,MachineLearning,t5_2r3gv,2015-11-10,2015,11,10,16,3s8wm5,oreilly.com,"Big science problems, big data solutions",https://www.reddit.com/r/MachineLearning/comments/3s8wm5/big_science_problems_big_data_solutions/,gradientflow,1447140356,,0,1,False,default,,,,,
226,MachineLearning,t5_2r3gv,2015-11-10,2015,11,10,17,3s90iv,self.MachineLearning,"TensorFlow and the Apache 2.0 License, what does it mean for startups contributing and using TensorFlow?",https://www.reddit.com/r/MachineLearning/comments/3s90iv/tensorflow_and_the_apache_20_license_what_does_it/,tensorflow,1447143200,What liabilities do startups and companies outside of Google have to worry about when using TensorFlow?,7,10,False,self,,,,,
227,MachineLearning,t5_2r3gv,2015-11-10,2015,11,10,17,3s91ty,fuegobot.blogspot.com.es,The Science Behind Money Making (Investment),https://www.reddit.com/r/MachineLearning/comments/3s91ty/the_science_behind_money_making_investment/,adeniyiks,1447144202,,0,1,False,default,,,,,
228,MachineLearning,t5_2r3gv,2015-11-10,2015,11,10,17,3s92f9,self.MachineLearning,"So, should I scrap theano, torch, caffe, and dive into TesorFlow?",https://www.reddit.com/r/MachineLearning/comments/3s92f9/so_should_i_scrap_theano_torch_caffe_and_dive/,polytop3,1447144686,"Hi All,

So as we are all aware, big news today with google's release of TensorFlow. I have been skimming their docs, and it looks brilliant!

It can be quite expensive to switch from one system to another; but going forward into the future, which do you think is the best learning investment: theano, torch, caffe, or TensorFlow?

Currently I am quite comfortable with theano, but TensorFlow looks very interesting. I don't want to use multiple systems for deep learning, so I am thinking about scrapping theano for TensorFlow, as going forward I think we can expect TensorFlow to overtake many of the alternatives (if it hasn't already upon initial release).

What are your thoughts?",16,18,False,self,,,,,
229,MachineLearning,t5_2r3gv,2015-11-10,2015,11,10,19,3s9b9b,self.MachineLearning,Best scalable cloud option for playing with TensorFlow?,https://www.reddit.com/r/MachineLearning/comments/3s9b9b/best_scalable_cloud_option_for_playing_with/,Tenoke,1447151673,"I want to start playing with TensorFlow, and have no idea what I'll really get to doing, so I am looking for something that is cost-effective and easily scalable based on how much resources I need that day/month.

As a web developer, I'll usually spin something on DigitalOcean or AWS, but it doesn't seem like they will be very good options for Machine Learning.",7,6,False,self,,,,,
230,MachineLearning,t5_2r3gv,2015-11-10,2015,11,10,20,3s9g00,self.MachineLearning,Automatic data visualization instrument?,https://www.reddit.com/r/MachineLearning/comments/3s9g00/automatic_data_visualization_instrument/,Fortyq,1447155369,"Hi, I wonder if there is any simple instrument for automatic data visualization. In python or standalone app. I need something like: upload csv, do aggregation and plotting by choosing columns, with scaling and some other perks.",0,3,False,self,,,,,
231,MachineLearning,t5_2r3gv,2015-11-10,2015,11,10,21,3s9i9j,dmtk.io,Microsoft Distributed Machine Learning Toolkit (DMTK),https://www.reddit.com/r/MachineLearning/comments/3s9i9j/microsoft_distributed_machine_learning_toolkit/,BillZheng,1447157011,,7,34,False,default,,,,,
232,MachineLearning,t5_2r3gv,2015-11-10,2015,11,10,22,3s9pa8,self.MachineLearning,Using RNN to turn variable-length series of vectors to a single vector where the order of the input vectors does not matter?,https://www.reddit.com/r/MachineLearning/comments/3s9pa8/using_rnn_to_turn_variablelength_series_of/,adagradlace,1447161538,"Recurrent NNs are used to process sequences of vectors and turn them into a single vector representation.

But can they also be used to turn a set of input vectors (like a bag-of-words, only that the words are vectors) into a single output vector, where the order of the set is not important? Can I somehow make the output single vector representation invariant to the input order?

If you happen to know literature references or experience on that I would be very grateful, as I am just starting to learn about (R)NNs",4,1,False,self,,,,,
233,MachineLearning,t5_2r3gv,2015-11-10,2015,11,10,22,3s9qj8,self.MachineLearning,[4fun] build a dataset for translating across programming languages with seq2seq,https://www.reddit.com/r/MachineLearning/comments/3s9qj8/4fun_build_a_dataset_for_translating_across/,pilooch,1447162211,"Now that there's a nice / simple to use seq2seq implementation available within the newly released TensorFlow (TF), I'm wondering what would be the best data source for translation across programming languages.

I would be very glad to team up with whoever is interested in building a proof of concept. I'm an experienced deep / machine learnist, just too much stuff on my plate workwise / lifewise to consider playing with this one alone. I see this as a potential good way to put TF to work and get a verdict from the practice side.",4,2,False,self,,,,,
234,MachineLearning,t5_2r3gv,2015-11-11,2015,11,11,0,3sa3om,self.MachineLearning,Why deep learning?,https://www.reddit.com/r/MachineLearning/comments/3sa3om/why_deep_learning/,thenerdstation,1447168350,So I'm taking a class in machine learning at my college and my professor showed us that you can implement any function to arbitrary precision with only a 3 layer neural network. If this is true (or atleast my understanding of it is true) then why was there such a big push recently about deep learning?,16,12,False,self,,,,,
235,MachineLearning,t5_2r3gv,2015-11-11,2015,11,11,0,3sa5rv,nextplatform.com,A Wider Net is Cast for Deep Learning on GPUs,https://www.reddit.com/r/MachineLearning/comments/3sa5rv/a_wider_net_is_cast_for_deep_learning_on_gpus/,[deleted],1447169225,[deleted],0,7,False,default,,,,,
236,MachineLearning,t5_2r3gv,2015-11-11,2015,11,11,0,3sa7gq,medium.com,Facebook M  The Anti-Turing Test,https://www.reddit.com/r/MachineLearning/comments/3sa7gq/facebook_m_the_antituring_test/,Lyle_Cantor,1447169918,,33,114,False,http://b.thumbs.redditmedia.com/pVY98q1NemakdDRgiElTf3jwkfhqUKSjDzb1VgGhfVo.jpg,,,,,
237,MachineLearning,t5_2r3gv,2015-11-11,2015,11,11,1,3saakq,self.MachineLearning,Using CDF (or ECDF) for feature scaling,https://www.reddit.com/r/MachineLearning/comments/3saakq/using_cdf_or_ecdf_for_feature_scaling/,justanotherta5,1447171214,"I want my normalized values to lie in the interval [0, 1], so I propose using the empirical CDF of the feature values to scale the raw values into the normalized ones. The problem is that [this turns an arbitrary distribution into a uniform one](http://math.stackexchange.com/questions/868400/showing-that-y-has-a-uniform-distribution-if-y-fx-where-f-is-the-cdf-of-x). Does that make this form of scaling invalid for general feature scaling?",7,5,False,self,,,,,
238,MachineLearning,t5_2r3gv,2015-11-11,2015,11,11,1,3safll,arxiv.org,Generating Images from Captions with Attention,https://www.reddit.com/r/MachineLearning/comments/3safll/generating_images_from_captions_with_attention/,emansim,1447173218,,7,16,False,default,,,,,
