,sbr,sbr_id,date,year,month,hour,day,id,domain,title,full_link,author,created,selftext,num_comments,score,over_18,thumbnail,media_provider,media_thumbnail,media_title,media_description,media_url
350,MachineLearning,t5_2r3gv,2015-11-14,2015,11,14,2,3sok8k,self.MachineLearning,Tensorflow basic RNN example with 'variable length' sequences,https://www.reddit.com/r/MachineLearning/comments/3sok8k/tensorflow_basic_rnn_example_with_variable_length/,siblbombs,1447434901,"I've finally gotten a chance to look at recurrence in tensorflow, the documentation examples are a bit complicated for understanding the bare bones of what is happening. This is the basic example I've come up with for just passing some data through a LSTM with no learning going on, its useful for understanding how to set things up.

My takeaways from writing this are:

 * Getting the inputs in is a little weird, since the recurrence loop is built with a python loop. Because of this I had to define the input, then use tf.split to break it into discrete timesteps. Split also keeps the dimension you split on, so there is a reshape in there as well. If you aren't comfortable with list comprehension, it feels like something you will want to bone up on for TF.

 * Variable initialization is an operation you run, not a function you call. This threw me off (coming from theano), I assumed tf.initialize_all_variables() was what I needed, but you have to actually pass that into the session. Makes sense in hindsight.

 * Conditionals aren't documented at all on the tensorflow website, but are in the library. This is how we 'bail' from the recurrent loop for variable length sequences. check out rnn.py for how it is used in action. Same idea as theano's ifelse.

 * For variable length sequences you will need to build the graph out to the maximum length you want to support, then exit early during runtime. You can pass in the bail point for your sequence at each .run() call, since the conditional check is in tensorflow and not python. 

 * You are going to need to pad your input to the maximum size of the loop. I didn't play with tf.pad enough to figure out if you can actually pass in variable length sequences to the .run() call, but the inputs you pass to the rnn when constructing it needs to be the maximum length so I had to make the placeholder that long. Worst case is you will need to pad your data before passing it into .run(), I assume the pain of this is lessened with the Queue setup that is available.

I couldn't get the code block working in the post, so the code is in the comments.",18,44,False,self,,,,,
351,MachineLearning,t5_2r3gv,2015-11-14,2015,11,14,3,3sor0r,self.MachineLearning,Any recommended methods/resources for clustering time series data by features?,https://www.reddit.com/r/MachineLearning/comments/3sor0r/any_recommended_methodsresources_for_clustering/,LemurPrime,1447437730,I have data in which the shape of the curve is more informative than the numerical values at an exact time. I'm looking for a good way to cluster millions of time series that's robust to random shifting and scaling. Any suggestions? ,6,2,False,self,,,,,
352,MachineLearning,t5_2r3gv,2015-11-14,2015,11,14,3,3sotjm,self.MachineLearning,Advice on a tensorflow mlp example not using MNIST data?,https://www.reddit.com/r/MachineLearning/comments/3sotjm/advice_on_a_tensorflow_mlp_example_not_using/,[deleted],1447438804,[deleted],0,1,False,default,,,,,
353,MachineLearning,t5_2r3gv,2015-11-14,2015,11,14,3,3soub7,self.MachineLearning,What Python (evolutionary) neural network library allows for inputting the result of an objective function?,https://www.reddit.com/r/MachineLearning/comments/3soub7/what_python_evolutionary_neural_network_library/,[deleted],1447439116,[deleted],0,1,False,default,,,,,
354,MachineLearning,t5_2r3gv,2015-11-14,2015,11,14,4,3sp28d,self.MachineLearning,Help with mlp example not using MNIST data?,https://www.reddit.com/r/MachineLearning/comments/3sp28d/help_with_mlp_example_not_using_mnist_data/,aquajets1,1447442271,"Hello!

So Ive been experimenting with tensorflow, specifically modifying americdamiens examples (https://github.com/aymericdamien/TensorFlow-Examples) to try to create a mlp to solve multi float input, single float output problems (like XOR as a basic example).  Ive had problems getting it to converge, Im wondering if anyone can tell if its obviously an issue with my cost function, or my chosen optimizer, or something else? 

Thanks!

(code, i was having trouble getting it to format right)
https://gist.github.com/dpcollin/fef642bfc684380bfbb5",10,0,False,self,,,,,
355,MachineLearning,t5_2r3gv,2015-11-14,2015,11,14,4,3sp45c,self.MachineLearning,Transfer learning with CNN (Incremental learning)?,https://www.reddit.com/r/MachineLearning/comments/3sp45c/transfer_learning_with_cnn_incremental_learning/,mikos,1447443039,"Hi all, I trained a CNN for about 2000 classes with a few hundred samples each (""Model-1""). I used pre-trained model Imagenet for transfer learning.

For **incremental** training, should I add new samples into the folder and:

1. Use imagenet again as pre-trained model? or 
1. Should I point to  the previous model (""model 1"")? 

what is the more advisable route? I am using DIGITS/Caffe  and generating GoogLeNet.

Note: I am not adding new classes, just augmenting the training samples in existing classes.

Thanks all for your fantastic help in helping out a newbie.

",0,0,False,self,,,,,
356,MachineLearning,t5_2r3gv,2015-11-14,2015,11,14,5,3spee6,nextplatform.com,The Real Trouble with Cognitive Computing,https://www.reddit.com/r/MachineLearning/comments/3spee6/the_real_trouble_with_cognitive_computing/,[deleted],1447447236,[deleted],0,0,False,default,,,,,
357,MachineLearning,t5_2r3gv,2015-11-14,2015,11,14,6,3spm6d,self.MachineLearning,Multi-label (Convolutional) Neural Networks w\ Label Interdependence,https://www.reddit.com/r/MachineLearning/comments/3spm6d/multilabel_convolutional_neural_networks_w_label/,TheCocoanaut,1447450530,"Hey there,

I'm currently looking into utilising a CNN learned on text (several different architectures[1][2][3][4]) for multi-label text classification. I found this report (https://cs224d.stanford.edu/reports/BergerMark.pdf) but it was missing some informations and I am not sure it is correct (it's just a students report, not a paper):

We then add a fully connected output layer of size |L| with a sigmoid activation function, which produces a probability for each of our potential labels. y =  (Uc' + b^o)

Is `U` supposed to be the dropout matrix? I don't know. Also from my understanding one can't model multivariate dependent probabilities with the sigmoid function, or is it only dependent on the error function I use? I'd need to do some thresholding on the dependencies (summing to one) to say this is positively associated with the input x^i.

I didn't found that much (read: almost none) papers on this topic. Especially using CNN/RNN/DBN/DBM/RBMs/ANN etc.

Some other possibilities I've found or came up with include using 2^n softmax outputs modelling a label power set (I think it should be ok, because n = 8 in my specific case, untested yet). Also I wanted to have a look at cross-entropy as an error function for this case[5], but not sure yet (well, mostly because I have to do some reading about this).


I'd love some clarification or hints on my thoughts. I was not able to find papers on the basics (sigmoid/logsoftmax/cross-entropy etc for multi label) and thus cannot verify any of this. If you can provide any resources I'd be glad if you could refer me to them! I'm looking forward to your input.


TL;DR: Can I use sigmoid/log softmax for multi-label? Does it model label interdependence? If not, can I incorporate this without label power set?


[1]: Effective Use of Word Order for Text Categorization with Convolutional Neural Networks, Rie &amp; Zhang

[2]: Convolutional Neural Networks for Sentence Classification, Kim

[3]: A Convolutional Neural Network for Modelling Sentences, Kalchbrenner, Grefenstette, Blunsom

[4]: Character-level Convolutional Networks for Text Classification, Zhang, Zhao, LeCun (not sure if this is multi-label already to be honest, uses log soft max as output)

[5]: Large-scale Multi-label Text Classification  Revisiting Neural Networks, Nam et al.",3,4,False,self,,,,,
358,MachineLearning,t5_2r3gv,2015-11-14,2015,11,14,7,3sps3p,self.MachineLearning,Is variance reduction SGD used in training deep neural networks?,https://www.reddit.com/r/MachineLearning/comments/3sps3p/is_variance_reduction_sgd_used_in_training_deep/,george_redit,1447453075,Anyone has experience using variance reduction methods for training deep neural networks?,6,0,False,self,,,,,
359,MachineLearning,t5_2r3gv,2015-11-14,2015,11,14,7,3spslo,github.com,Simple Tensor Flow demo: XOR learning,https://www.reddit.com/r/MachineLearning/comments/3spslo/simple_tensor_flow_demo_xor_learning/,nivwusquorum,1447453298,,0,2,False,http://b.thumbs.redditmedia.com/yRyuuioMAfnLxFmz_IpP-7g7BZS9qTt4zHZ65ryKNpY.jpg,,,,,
360,MachineLearning,t5_2r3gv,2015-11-14,2015,11,14,7,3sptmo,nikkostrom.com,Strong scaling DNN training on commodity g2.2xlarge instances,https://www.reddit.com/r/MachineLearning/comments/3sptmo/strong_scaling_dnn_training_on_commodity/,XeonPhitanium,1447453768,,3,5,False,default,,,,,
361,MachineLearning,t5_2r3gv,2015-11-14,2015,11,14,7,3spulp,self.MachineLearning,Pylearn2 is no longer developed?,https://www.reddit.com/r/MachineLearning/comments/3spulp/pylearn2_is_no_longer_developed/,SamyMel,1447454207,"While I was asking about different deepLearning Frameworks, some people (from another framework community other than pytlearn2's) told me that pylearn2 was no longer very maintained.
Is it true? is there a reason why? And what do you guys (python programmers) use for deepLearning? (my work will be mainly to implement and try out different ConvNets configs, no RNN)",8,5,False,self,,,,,
362,MachineLearning,t5_2r3gv,2015-11-14,2015,11,14,12,3sqqvv,self.MachineLearning,Discussion of Juergen Schmidhuber's 'Brainstorm' package?,https://www.reddit.com/r/MachineLearning/comments/3sqqvv/discussion_of_juergen_schmidhubers_brainstorm/,discgolfingQnet,1447472461,"As found here: http://people.idsia.ch/~juergen/brainstorm.html 

I was trying to find some general overviews, analysis, or reviews outside of the documentation and have been unable to do so.

Any thoughts on Brainstorm or what Juergen is up to these days?",6,4,False,self,,,,,
363,MachineLearning,t5_2r3gv,2015-11-14,2015,11,14,13,3sqvl3,youtube.com,SPFC 0202,https://www.reddit.com/r/MachineLearning/comments/3sqvl3/spfc_0202/,dongfengpacking,1447475188,,1,1,False,default,,,,,
364,MachineLearning,t5_2r3gv,2015-11-14,2015,11,14,15,3sr9h4,slideshare.net,10 more lessons learned from building real-life machine learning systems @quora (and the master algorithm),https://www.reddit.com/r/MachineLearning/comments/3sr9h4/10_more_lessons_learned_from_building_reallife/,cast42,1447484130,,0,0,False,http://b.thumbs.redditmedia.com/0s00uX3dIpFTeazx_DnLbxIMaIwbAcOFm-keodHIKSE.jpg,,,,,
365,MachineLearning,t5_2r3gv,2015-11-14,2015,11,14,17,3srhqn,self.MachineLearning,Is using PHP alot helpful for ML/data science?,https://www.reddit.com/r/MachineLearning/comments/3srhqn/is_using_php_alot_helpful_for_mldata_science/,[deleted],1447490940,[deleted],4,0,False,default,,,,,
366,MachineLearning,t5_2r3gv,2015-11-14,2015,11,14,18,3sriww,fuegobot.blogspot.com.es,"ShhhDont touch me, the TV is watching!",https://www.reddit.com/r/MachineLearning/comments/3sriww/shhhdont_touch_me_the_tv_is_watching/,adeniyiks,1447492087,,0,1,False,default,,,,,
367,MachineLearning,t5_2r3gv,2015-11-14,2015,11,14,19,3srnzr,self.MachineLearning,Classification-aware regression loss function?,https://www.reddit.com/r/MachineLearning/comments/3srnzr/classificationaware_regression_loss_function/,ekerazha,1447496699,"Suppose I use the MSE loss function for a regression problem.

Let's say my ideal value is ""+10"" and my output/predicted value is ""-5"". Now, let's say my output/predicted value is ""+100"".

Obviously, -5 is closer to +10 than +100, so the squared error for -5 is lower.

However, if we classify the value as sign(value), then the +100 prediction got the classification right (because +100 and +10 have the same sign), while -5 is a classification error.

It would be nice to have a regression loss function which also penalizes a discordant sign. So, maybe, when my ideal value is ""+10"", then ""-5"" isn't much better than ""+100"", because it is closer to ""+10"" but it has the wrong sign.

Is there a well-known regression loss function which is also ""classification-aware""?",10,2,False,self,,,,,
368,MachineLearning,t5_2r3gv,2015-11-14,2015,11,14,21,3srxf3,youtube.com,Symphonies from Synapses - The Brain as Universal Dynamical Systems Computer,https://www.reddit.com/r/MachineLearning/comments/3srxf3/symphonies_from_synapses_the_brain_as_universal/,fergbyrne,1447504809,,10,0,False,http://b.thumbs.redditmedia.com/wh1X4N_voRIXYEDnaXOIgSs03TdQrYFyb4T8w83f37c.jpg,,,,,
369,MachineLearning,t5_2r3gv,2015-11-14,2015,11,14,21,3srxgp,self.MachineLearning,Reverse classification using ANN?,https://www.reddit.com/r/MachineLearning/comments/3srxgp/reverse_classification_using_ann/,JonnyRobbie,1447504834,The classic approach with ANNs is to have some input (ie. images) and the output is a classification vector. Are there any examples/papers reversing the problem? When you have a classification vectors as an input and the output would be generated image?,3,0,False,self,,,,,
370,MachineLearning,t5_2r3gv,2015-11-14,2015,11,14,22,3ss2hl,sonarlearning.co.uk,Online MIT Lectures Covering Artificial Intelligence,https://www.reddit.com/r/MachineLearning/comments/3ss2hl/online_mit_lectures_covering_artificial/,RANDOMDBZ,1447508446,,0,0,False,default,,,,,
371,MachineLearning,t5_2r3gv,2015-11-15,2015,11,15,1,3ssh6r,self.MachineLearning,Reinforcement Learning By David Silver Google Drive Link!,https://www.reddit.com/r/MachineLearning/comments/3ssh6r/reinforcement_learning_by_david_silver_google/,code2hell,1447516874,"I found this course very useful and informative for learning RL.
Thought it would be helpful to others to so Im sharing the link [here](https://drive.google.com/folderview?id=0B6EE3Sw2jmZWNTZXNW9ucHhHS2M&amp;usp=sharing)",10,25,False,self,,,,,
372,MachineLearning,t5_2r3gv,2015-11-15,2015,11,15,2,3ssphx,slideshare.net,Speaker Slides from MLconf San Francisco 2015,https://www.reddit.com/r/MachineLearning/comments/3ssphx/speaker_slides_from_mlconf_san_francisco_2015/,dafcok,1447520770,,0,1,False,default,,,,,
373,MachineLearning,t5_2r3gv,2015-11-15,2015,11,15,2,3sstt2,codesachin.wordpress.com,K-Means Clustering with TensorFlow,https://www.reddit.com/r/MachineLearning/comments/3sstt2/kmeans_clustering_with_tensorflow/,sachinrjoglekar,1447522721,,5,25,False,http://b.thumbs.redditmedia.com/RwzaeAWrX_lalngIRIvGxKbPqlyeW2AR3dVKSKW-NbM.jpg,,,,,
374,MachineLearning,t5_2r3gv,2015-11-15,2015,11,15,5,3stfo1,horia141.com,Neat problem about building better predictors from simpler ones,https://www.reddit.com/r/MachineLearning/comments/3stfo1/neat_problem_about_building_better_predictors/,horia141,1447532438,,0,0,False,default,,,,,
375,MachineLearning,t5_2r3gv,2015-11-15,2015,11,15,6,3stoh7,youtube.com,Awesome oxford deep learning lectures,https://www.reddit.com/r/MachineLearning/comments/3stoh7/awesome_oxford_deep_learning_lectures/,swentso,1447536409,,14,151,False,http://a.thumbs.redditmedia.com/P6N-_BcPBYMxV1kAfYEIrK1GOulh86iYyrvuXwa1Rj0.jpg,,,,,
376,MachineLearning,t5_2r3gv,2015-11-15,2015,11,15,7,3su091,livescience.com,Google's New AI System Could Be 'Machine Learning' Breakthrough,https://www.reddit.com/r/MachineLearning/comments/3su091/googles_new_ai_system_could_be_machine_learning/,shugert,1447541952,,0,0,False,default,,,,,
377,MachineLearning,t5_2r3gv,2015-11-15,2015,11,15,8,3su2xf,twistedkeyboardsoftware.com,Neo/RL - a GPU neocortex simulation library,https://www.reddit.com/r/MachineLearning/comments/3su2xf/neorl_a_gpu_neocortex_simulation_library/,CireNeikual,1447543195,,18,5,False,http://b.thumbs.redditmedia.com/6E0YXUncXhFZE-HgC8IH7COjePvS20nr4P30WrcpyiU.jpg,,,,,
378,MachineLearning,t5_2r3gv,2015-11-15,2015,11,15,8,3su569,self.MachineLearning,How versatile is the autoencoder method?,https://www.reddit.com/r/MachineLearning/comments/3su569/how_versatile_is_the_autoencoder_method/,[deleted],1447544288,[deleted],5,2,False,default,,,,,
379,MachineLearning,t5_2r3gv,2015-11-15,2015,11,15,9,3su83r,self.MachineLearning,TensorFlow differentiating matrix determinant,https://www.reddit.com/r/MachineLearning/comments/3su83r/tensorflow_differentiating_matrix_determinant/,bridgebywaterfall,1447545649,"I am interested in computing the derivative of a matrix determinant using TensorFlow. I can see from experimentation that TensorFlow has not implemented a method of differentiating through a determinant:

    LookupError: No gradient defined for operation 'MatrixDeterminant' 
    (op type: MatrixDeterminant)

A little further investigation revealed that it is actually possible to compute the derivative; see for example [Jacobi's formula](https://en.wikipedia.org/wiki/Jacobi%27s_formula). I determined that in order to implement this means of differentiating through a determinant that I need to use the function decorator,

    @tf.RegisterGradient(""MatrixDeterminant"")
    def _sub_grad(op, grad):
        ...

However, I am not familiar enough with tensor flow to understand how this can be accomplished. Does anyone have any insight on this matter?

Here's an example problem where I run into this issue:

    x = tf.Variable(tf.ones(shape=[1]))
    y = tf.Variable(tf.ones(shape=[1]))
    
    A = tf.reshape(
        tf.pack([tf.sin(x), tf.zeros([1, ]), tf.zeros([1, ]), tf.cos(y)]), (2,2)
    )
    loss = tf.square(tf.matrix_determinant(A))
    
    
    optimizer = tf.train.GradientDescentOptimizer(0.001)
    train = optimizer.minimize(loss)
    
    init = tf.initialize_all_variables()
    sess = tf.Session()
    sess.run(init)
    

    for step in xrange(100):
        sess.run(train)
        print sess.run(x)",1,2,False,self,,,,,
380,MachineLearning,t5_2r3gv,2015-11-15,2015,11,15,9,3suf8d,self.MachineLearning,IBM SystemML: Declarative machine learning that works no matter the environment.,https://www.reddit.com/r/MachineLearning/comments/3suf8d/ibm_systemml_declarative_machine_learning_that/,hjoel5,1447549121,"SystemML is a flexible, scalable machine learning (ML) language written in Java. SystemML's distinguishing characteristics are: (1) algorithm customizability, (2) multiple execution modes, including Standalone, Hadoop Batch, and Spark Batch, and (3) automatic optimization.

The latest documentation can be found at the SystemML Documentation web site.

https://github.com/sparktc/systemml

",1,0,False,self,,,,,
381,MachineLearning,t5_2r3gv,2015-11-15,2015,11,15,12,3suu9i,gitxiv.com,Unsupervised Learning of Video Representations using LSTMs (paper+code),https://www.reddit.com/r/MachineLearning/comments/3suu9i/unsupervised_learning_of_video_representations/,samim23,1447557008,,0,5,False,default,,,,,
382,MachineLearning,t5_2r3gv,2015-11-15,2015,11,15,14,3sv7yz,self.MachineLearning,"Question about combinatorial/non-noisy learning (e.g., Chess)",https://www.reddit.com/r/MachineLearning/comments/3sv7yz/question_about_combinatorialnonnoisy_learning_eg/,physixer,1447564884,"I have a question about learning decisions in a state-space, e.g., the space of chess moves.

- Let's say my program is sitting with the start state of a chess board, and doesn't know any tactics/strategies, it only knows the rules of chess, and that own piece elimination or own loss is bad, and opponent's piece elimination, and opponent's loss is good.
- It knows it has to make a move decision out of the 20 (or whatever) possible first moves.
- Since it doesn't know any move being better than any other move, all moves are ""equally valuable"".
- ""Equally valuable"" gives the first clue that we should perhaps assign ""probability"" to each move. So 1/20 to each move. And that the learning process should adjust these probabilities so that the next time the program starts a new game, not all moves are equally valued (have equal move probability) and either the move with highest prob. is picked, or a move is picked by sampling the probability distribution of moves.

So my question is, what kind of learning algorithm helps with updating these probabilities? how is it different if the probability is updated every time a piece (own or opponent's) is eliminated, vs, updating probabilities at the end of a win or loss, vs, a combination of those? finally, how can a ""hierarchical"" probability model is built such that, there are probabilities assigned to, not only each move, but to each tactic (which themselves are learned not fed), as well as each strategy (which also is learned).

I guess it would be a combination of ""reinforcement learning"", ""hierarchical bayesian modeling"", and so on. But I'd appreciate, if anyone can point out specific resource for this kind of approach (not necessarily for chess, but preferably for a combinatorial problem, not things like images, signals, etc).

Also please note that I'm somewhat aware of typical approaches for chess programs (graph search, hard coding openings, end-games etc), I'm not looking for those approaches. (I guess I'm looking for a method that would most mimic the way a human chess newbie learns and improves. Though part of chess training includes ""explicit"" learning of many tactics, strategies, openings, and end games; let's say I want to ignore that for this simple learning approach).

Thanks in advance.",2,0,False,self,,,,,
383,MachineLearning,t5_2r3gv,2015-11-15,2015,11,15,14,3sv8hi,self.MachineLearning,ML tools?,https://www.reddit.com/r/MachineLearning/comments/3sv8hi/ml_tools/,bigd8a,1447565240,"What (easy to use) tools would you recommend for -
1. Collaborative Filtering (recommendations)
2. K-means clustering
3. Multi-class classifier",2,0,False,self,,,,,
384,MachineLearning,t5_2r3gv,2015-11-15,2015,11,15,14,3svacj,wsj.com,Pedro Domingos attempts to predict the future in Wall Street Journal.,https://www.reddit.com/r/MachineLearning/comments/3svacj/pedro_domingos_attempts_to_predict_the_future_in/,lozj,1447566445,,0,0,False,http://b.thumbs.redditmedia.com/p1gRNUB2VD3qfHRUaTRKmHfR3iyzDXmhoJimrDPgyWU.jpg,,,,,
385,MachineLearning,t5_2r3gv,2015-11-15,2015,11,15,16,3svk85,research.microsoft.com,Deep Neural Decision Forests,https://www.reddit.com/r/MachineLearning/comments/3svk85/deep_neural_decision_forests/,Atupis,1447573361,,1,0,False,default,,,,,
386,MachineLearning,t5_2r3gv,2015-11-15,2015,11,15,16,3svlbq,slideshare.net,Python libraries for Deep Learning with Sequences (by hawflake 2015-11-11),https://www.reddit.com/r/MachineLearning/comments/3svlbq/python_libraries_for_deep_learning_with_sequences/,cast42,1447574304,,0,1,False,default,,,,,
387,MachineLearning,t5_2r3gv,2015-11-15,2015,11,15,16,3svlfe,github.com,Bayesian Modelling in Python (PYMC3 Tutorial),https://www.reddit.com/r/MachineLearning/comments/3svlfe/bayesian_modelling_in_python_pymc3_tutorial/,cast42,1447574397,,0,11,False,http://b.thumbs.redditmedia.com/Sl3aDtkcHchhSsfv8PNQxLY3UlCKS0VjnAqZavdkHsA.jpg,,,,,
388,MachineLearning,t5_2r3gv,2015-11-15,2015,11,15,17,3svndc,self.MachineLearning,Anyone know of a good database for music-classification?,https://www.reddit.com/r/MachineLearning/comments/3svndc/anyone_know_of_a_good_database_for/,burgeoning_philosoph,1447576061,"Hi all, I've recently become acquainted with neural networks and I would like to apply them to music classification. The problem i'm trying to solve is to build a classifier like Shazam that works on a composition regardless of it's stylistic properties like instrumentation, bpm, and key, such as being able to recognize a heavy-metal, jazz, or electronic arrangement of a well-known classical piece like Beethoven's 5th. (If this has been done before, great, I'm just using this as a learning experience with the possibility of extending functionality later) For training, I'm looking for a source for classical compositions performed in these different styles.  Does anyone know where I could find such a database? Thanks.",2,5,False,self,,,,,
389,MachineLearning,t5_2r3gv,2015-11-15,2015,11,15,17,3svoo2,github.com,DeepQ learning using tensorflow,https://www.reddit.com/r/MachineLearning/comments/3svoo2/deepq_learning_using_tensorflow/,nivwusquorum,1447577129,,12,71,False,http://b.thumbs.redditmedia.com/9F6Q11qnWOrZJX5KzjTkvIMmWY1qe_DkfssXqlSGHLY.jpg,,,,,
390,MachineLearning,t5_2r3gv,2015-11-15,2015,11,15,18,3svqx7,self.MachineLearning,A short introduction about LSTM and corresponding applications,https://www.reddit.com/r/MachineLearning/comments/3svqx7/a_short_introduction_about_lstm_and_corresponding/,neutronest,1447579289,"http://www.neutronest.moe/2015-11-15-LSTM-survey.html

Hi, friends. These days I keep surveying the LSTM for a long time.. Therefore I make a summary about LSTM and its applications involved in ACL, EMNLP, ICML... hope it can give you some help if you are interested into LSTM and deep learning!

The blog's url is at the above. I'm sure that there are many mistakes therefore I will keep modifying my article... 

Thank you very much.",3,8,False,self,,,,,
391,MachineLearning,t5_2r3gv,2015-11-15,2015,11,15,18,3svtbn,aleph.se,Ensemble methods: Bayes' Broadsword,https://www.reddit.com/r/MachineLearning/comments/3svtbn/ensemble_methods_bayes_broadsword/,kaj_sotala,1447581496,,0,9,False,http://b.thumbs.redditmedia.com/DnWV2Y77SOzNF2rqZUHe9R_9__kz1KaQfYkejC6DzfA.jpg,,,,,
