,date,year,month,day,hour,id,title,full_link,author,created,selftext,num_comments,score
235,2015-5-15,2015,5,15,15,3618bo,My first experience with machine learning using Amazon Machine Learning,https://www.reddit.com/r/MachineLearning/comments/3618bo/my_first_experience_with_machine_learning_using/,LarsHoldgaard,1431670627,,1,1
236,2015-5-15,2015,5,15,18,361kcf,Handling variable size inputs efficiently in Torch,https://www.reddit.com/r/MachineLearning/comments/361kcf/handling_variable_size_inputs_efficiently_in_torch/,subszero,1431681531,"I have thinking about a way of implementing the model from this paper efficiently : http://arxiv.org/pdf/1412.6815v2.pdf
 
[The Model](http://i.imgur.com/RH4ZJD9.png)

How would one go about handling variable sized inputs for neural networks like in this case? Also, I'm unable to think of a way of processing documents in batches using this technique, would appreciate some pointers.


",3,2
237,2015-5-15,2015,5,15,20,361t2x,New York R Conference 2015 Talks &amp; Videos,https://www.reddit.com/r/MachineLearning/comments/361t2x/new_york_r_conference_2015_talks_videos/,kunjaan,1431689407,,0,6
238,2015-5-15,2015,5,15,23,3629lu,Would you buy your child a Chatterbot for *mas?,https://www.reddit.com/r/MachineLearning/comments/3629lu/would_you_buy_your_child_a_chatterbot_for_mas/,back_ache,1431699438,"In the news is that in addition to Barbie, another company is bringing out a talking-toy powered by an internet based Chatterbot, in this case powered by IBM's Watson.

Would you buy one for a child in your life?

As a parent and a techie, I'm torn!

https://en.wikipedia.org/wiki/Chatterbot#Incorporation_in_Childrens_Toys",2,0
239,2015-5-16,2015,5,16,2,362wzf,Segmenting time series into a bunch of known Gaussian distributions.,https://www.reddit.com/r/MachineLearning/comments/362wzf/segmenting_time_series_into_a_bunch_of_known/,cyanogenmod,1431710586,"I have N Gaussians whose parameters are known in advance. I have a series of time sequence values. The series actually is a concatenation of different sized samples drawn from any of these Gaussians. For example, the first 100 samples is from Gaussian A, the next 35 are from Gaussian B, next 50 are again from A and so on. Is there any established technique to segment the time sequence into these distributions? I want to split up the time series like this: segment I: (sample x to sample y, Gaussian K), segment J: (sample x' to sample y', Gaussian K') etc.",7,1
240,2015-5-16,2015,5,16,7,363vta,"How could you train a NN to detect ""fake"" images? (image inside)",https://www.reddit.com/r/MachineLearning/comments/363vta/how_could_you_train_a_nn_to_detect_fake_images/,omniron,1431727582,"https://i.imgur.com/uhMq0Re.jpg

This was posted in another thread, and it occurred to me that looking at it, i know this isn't a real object, but it's only after thinking about this that I become conscious of why I think that (background/foreground color and resolution mismatch).

I can also tell, but I don't know how exactly, that the refractions are off. It's interesting that without doing the snells laws and maxwell's laws equations, I know that light wouldn't bend that way through common materials of that type, given the background. Internally, there's some part of my brain that has a model for light refraction.

Does anyone know of any research or models that are able to learn features this way? Seems like these learned intuitions about how nature works are what lead to insights like Einstein and other great thinkers about unobserved thinks may work.",5,5
241,2015-5-16,2015,5,16,8,364417,"Best results on MNIST, CIFAR-10, CIFAR-100, STL-10, SVHN",https://www.reddit.com/r/MachineLearning/comments/364417/best_results_on_mnist_cifar10_cifar100_stl10_svhn/,[deleted],1431732082,,8,44
242,2015-5-16,2015,5,16,8,3647x4,How does ML applied to text differ from other types of problems?,https://www.reddit.com/r/MachineLearning/comments/3647x4/how_does_ml_applied_to_text_differ_from_other/,5bits,1431734219,"I have experience with applying ML algorithms to numerical and categorical data, but I can't seem to imagine how it can be applied to text (natural languages specifically).

I'm going to have to look into it, but I was hoping for a quick summary, analogy, and/or comparison to help me with the intuition of it.

I expect to have some answers by the end of the day, or you're fired.",6,1
243,2015-5-16,2015,5,16,9,364dip,What Type of Problems Can't be Solved with Neuronal Networks?,https://www.reddit.com/r/MachineLearning/comments/364dip/what_type_of_problems_cant_be_solved_with/,FractalNerve,1431737483,"It's understandable how and what Turing Machines are capable of, but what are the limits of neuronal networks? Are there things that can't be solved with a neuronal network, or are very inefficient to do so?",14,3
244,2015-5-16,2015,5,16,14,3651xg,Searching text in voice recordings,https://www.reddit.com/r/MachineLearning/comments/3651xg/searching_text_in_voice_recordings/,zhamisen,1431753751,"A new [iOS app](https://itunes.apple.com/us/app/english-us-keyword-search/id980529113) lets users search for words in voice recordings. According to [this site](http://www.pcworld.com/article/2914012/casio-iphone-app-does-keyword-searches-in-voice-recordings.html), the technology involves machine learning algorithms that compare the phonetic characteristics of input keywords to the recorded audio.
Have been any research papers published about this approach to searching text in voice recording?",2,2
245,2015-5-16,2015,5,16,17,365fkj,any one has experience of Boltzmann Machine?,https://www.reddit.com/r/MachineLearning/comments/365fkj/any_one_has_experience_of_boltzmann_machine/,godspeed_china,1431766475,"I'm testing my Boltzmann Machine code, but it produces 12% errors on a dataset. other methods such as random forest produces &lt;1% errors on this dataset. I'm not sure what's wrong.
My steps:
1: transform all variable to interval [0,1] by their rank/N. Thus, I treat them as binary variables for the BM training.
2: run positive-negative phase training with weight decay. train and test samples are pooled and trained together. In positive phase, test labels are not clamped. for clamped variables, I provide a random 0-1 value according to the corresponding probability at every iteration.
3: prediction by counting the probability of the ""free"" test labels.",9,1
246,2015-5-17,2015,5,17,0,36672v,[1412.6071] Fractional Max-Pooling,https://www.reddit.com/r/MachineLearning/comments/36672v/14126071_fractional_maxpooling/,downtownslim,1431789524,,0,20
247,2015-5-17,2015,5,17,13,368g3u,Is there an error correcting algorithm for this problem?,https://www.reddit.com/r/MachineLearning/comments/368g3u/is_there_an_error_correcting_algorithm_for_this/,Nixonite,1431836944,"Hello everyone,

So I have an array of class labels (integers ranging from 0 to 9), and it has a variable length but it's about 10-20 elements long.

It kind of looks like

[8 8 8 8 8 8 2 2 2 2 2 2 1 1 1 1 0 0 0 0 0 0 0 0 0 0 0]

Sometimes there are errors where a 2 is a 3 or any other digit, and sometimes there are a lot (although oftentimes &lt;5 errors in any instance). 

I need to convert that into a list of 4 elements. For the above list, the 4 element transformation would be [8 2 1 0]

I tried using the KISS principle and just taking the mode of the quartiles, it seems to work well but I'm wondering if there are any alternative ideas that the community here can suggest for such a problem.

Oh and some more rules to keep in mind:

The list doesn't have to have 4 distinct labels in it, it can have 1, 2, 3, 4, 5, up to 10 different labels (almost always &lt;5) if it's a really noisy list. The quartile mode system works well in the weird situations where the list might look like

[1 1 1 9 1 1 1 1 1 1 1 1 3 3 3 3 3]

where the above list should be converted into

[1 1 1 3]


Anyway, any ideas would be greatly appreciated. ",2,1
248,2015-5-17,2015,5,17,15,368pwk,Time-lapse Mining from Internet Photos,https://www.reddit.com/r/MachineLearning/comments/368pwk/timelapse_mining_from_internet_photos/,ehmo,1431844911,,18,187
249,2015-5-17,2015,5,17,16,368r87,"Artificial Neural Networks, to the point",https://www.reddit.com/r/MachineLearning/comments/368r87/artificial_neural_networks_to_the_point/,ai_maker,1431846216,,6,0
250,2015-5-17,2015,5,17,16,368si7,Open source implementation of FAIR's Memory Networks?,https://www.reddit.com/r/MachineLearning/comments/368si7/open_source_implementation_of_fairs_memory/,captcompile,1431847598,"Hi everyone

Does anyone know of an open-source implementation of Weston et. al.'s Memory Networks?",6,5
251,2015-5-17,2015,5,17,22,369chl,Hacker News Classification,https://www.reddit.com/r/MachineLearning/comments/369chl/hacker_news_classification/,tomtom1808,1431868337,"I'm currently working on a project that streamlines an HN-aggregation and classification service into a single API. I did a  writeup and thought I'll ask the community here what you think, since its packed with professionals. It's not too in-depth detailed, but it should still be interesting for tech-folks as well as non-tech folks. My mother-tongue is German, so please don't kill me if there are some mistakes. 

I'm interested in: 
1. is the article length okay and the content engaging enough to read on? I've deliberately tried to avoid a too scientific writing style. 

2. what do you think about the idea of the project? What would you do differently in terms of used libraries/practices/tools? Did you try something similar?

Thanks.

The (yet unofficial draft) link: http://www.newscombinator.com/2015-05-16",0,4
252,2015-5-17,2015,5,17,23,369hz9,Your path to now work in the area of machine learning,https://www.reddit.com/r/MachineLearning/comments/369hz9/your_path_to_now_work_in_the_area_of_machine/,bagelorder,1431872171,"What did you guys study, what where your milestones on the way to doing what you do today? And what do you do?",22,7
253,2015-5-18,2015,5,18,6,36ark5,Yann LeCun on Stringing GPU Clusters for Massive Neural Networks,https://www.reddit.com/r/MachineLearning/comments/36ark5/yann_lecun_on_stringing_gpu_clusters_for_massive/,[deleted],1431896823,,0,16
254,2015-5-18,2015,5,18,7,36b1zv,"To a MachineLearning laymen, what's the state of the art in the field right now?",https://www.reddit.com/r/MachineLearning/comments/36b1zv/to_a_machinelearning_laymen_whats_the_state_of/,GrilBTW,1431902297,,12,3
255,2015-5-18,2015,5,18,7,36b2nk,MOOC vs reading a book,https://www.reddit.com/r/MachineLearning/comments/36b2nk/mooc_vs_reading_a_book/,bagelorder,1431902648,"As someone who can program and understands some math topics, what is the best way to get into machine learning?
I see the two big alternatives MOOC and reading some book

Pro **MOOC**:
- Interactive which makes the learning process easier (for me)
- You sometimes get an certificate
- I heard that some pretty important researchers already have MOOCs online

Pro **Book**:
- MOOC are often kept easy (or that is how I feel it), difficult subjects are ommited
- You can skip around in a book between the subjects you already know easier

Is there a third alternative I am missing? What do you suggest for someone to get into the subject?",7,2
256,2015-5-18,2015,5,18,7,36b3kt,Data cleaning using multi-target decision trees,https://www.reddit.com/r/MachineLearning/comments/36b3kt/data_cleaning_using_multitarget_decision_trees/,BScHolder,1431903144,,5,12
257,2015-5-18,2015,5,18,8,36b7ci,How far can applied ML books get me in the work place?,https://www.reddit.com/r/MachineLearning/comments/36b7ci/how_far_can_applied_ml_books_get_me_in_the_work/,Nixonite,1431905180,"Hello everyone,

I'm curious, how far can applied ML books go as far as knowledge and usefulness in the workplace with regards to data analyst/scientist jobs, building models, and knowing how to do things 'the right way?'

Applied books such as:

* Introduction to Statistical Learning by Tibshirani
* Applied Predictive Modeling by Kuhn, Johnson
* Machine Learning: The Art and Science of Algorithms that Make Sense of Data by Peter Flach
* Mastering Machine Learning with Scikit-Learn

I'm just wondering what the differences are between someone tasked with a data job with the knowledge contained in the above books vs someone who has read books more like ESL. It's hard to tell from my applied-book bubble.",1,1
258,2015-5-18,2015,5,18,8,36bado,[Talk] Demis Hassabis - The Theory of Everything,https://www.reddit.com/r/MachineLearning/comments/36bado/talk_demis_hassabis_the_theory_of_everything/,vikkamath,1431906859,,1,12
259,2015-5-18,2015,5,18,11,36bnwy,Ring die pellet mill feed Common failure analysis and troubleshooting,https://www.reddit.com/r/MachineLearning/comments/36bnwy/ring_die_pellet_mill_feed_common_failure_analysis/,qiangwin-pellet,1431914539,,0,0
260,2015-5-18,2015,5,18,14,36c6he,Nvidia says Pascal GPUs to arrive next year with 10x speedup for deep learning,https://www.reddit.com/r/MachineLearning/comments/36c6he/nvidia_says_pascal_gpus_to_arrive_next_year_with/,dribnet,1431925940,,23,47
261,2015-5-18,2015,5,18,14,36c9qw,How to Get a Good Deal on Industrial Press Brakes,https://www.reddit.com/r/MachineLearning/comments/36c9qw/how_to_get_a_good_deal_on_industrial_press_brakes/,fcredo,1431928346,,0,0
262,2015-5-18,2015,5,18,15,36cbas,Implementing Neural Turing Machines,https://www.reddit.com/r/MachineLearning/comments/36cbas/implementing_neural_turing_machines/,iori42,1431929535,,8,13
263,2015-5-18,2015,5,18,15,36cdao,In natural language processing what are good ways of dealing with compound terms and contractions,https://www.reddit.com/r/MachineLearning/comments/36cdao/in_natural_language_processing_what_are_good_ways/,chchan,1431931123,"I am playing with NLP for document classification. I want to know what is a good way of processing compound terms such as ""The United States"", ""Wal-Mart Stores"", ""San Francisco"", and ""King James III"" and contractions such as ""don't"", ""won't"", ""ya'll"", and ""you're"".

Do I use a find and replace to replace these terms using regex before tokenization? (eg. United States =&gt; USA , you're =&gt; you are, San Francisco =&gt; San_Francisco) If so is there a library for a generic list of them?



",5,1
264,2015-5-18,2015,5,18,16,36cgm1,Best 1D Convolutions in Theano,https://www.reddit.com/r/MachineLearning/comments/36cgm1/best_1d_convolutions_in_theano/,alexmlamb,1431933891,"Hello, 

Does anyone have an opinion / experience with 1D convolutions in Theano?  I'm going to use a large # of filters, so I still want to keep things on the GPU.  

So far I've tried conv.conv2D, which works, but I'm not sure about how efficient it is.  From profiling, it looks like it doesn't replace it with GPU Corr MM.  ",3,1
265,2015-5-18,2015,5,18,16,36chtq,Petuum: a distributed machine learning framework,https://www.reddit.com/r/MachineLearning/comments/36chtq/petuum_a_distributed_machine_learning_framework/,galapag0,1431934998,,2,5
266,2015-5-18,2015,5,18,18,36cq05,"[help] lstm won't finish training. I think something in the input is causing it to not converge. I've found which piece it is, but not why.",https://www.reddit.com/r/MachineLearning/comments/36cq05/help_lstm_wont_finish_training_i_think_something/,[deleted],1431942565,"I'm training an lstm that I eventually want to use for sentiment analysis.

My plan to to convert the natural lang input into word vectors and then to binary. Currently, I'm just converting to binary, but the network won't finish it's initial training.

Here's the piece of input that is giving me trouble: `{input:binairise('I am happy'),output:[0,0,0,1,0]};`

And the binairise function:
  
    function binairise(input){
	var output=[];
	var inputArray=input.toString().split(/\s+/g);
	for(var i=0; i&lt;inputArray.length; i++){
		for(var j=0; j&lt;inputArray[i].length; j++){
			output.push(parseFloat(inputArray[i][j].charCodeAt(0).toString(2))/10000000);
		}
	}
	return output;
    }

The binairise function works, here's what it returns for binairise('I am happy'): `[0.10010011, 0.11000012, 0.11011013, 0.11014, 0.11000015, 0.1116, 0.1117, 0.1111001]`

I've tried it with the `/10000000` and without. The reason I'm doing that is to get the inputs in-between 0 and 1 so that the network can interpret them.

The network works fine with an input like [0,0] and the same ideal-output.

Does anyone have any ideas why this isn't finishing training? ",0,0
267,2015-5-18,2015,5,18,21,36d4hu,Why am I getting empty matrix from svmpredict ?,https://www.reddit.com/r/MachineLearning/comments/36d4hu/why_am_i_getting_empty_matrix_from_svmpredict/,sharda2309,1431953730,"I want to make predictions from a simple time series. The observations y=[11,22,33,44,55,66,77,88,99,110] at time x=[1,2,3,4,5,6,7,8,9,10]. I am using epsilon-SVR from libsvm toolbox.My code is as follows :

x1 = (1:7)'; % training set

y1 = [11, 22, 33, 44, 55, 66, 77]'; % observations from time series

options = ' -s 3 -t 2 -c 100 -g 0.05 -p 0.0003 ';

model = svmtrain(y1, x1, options)

x2 = (8:10)'; % test set

y2 = [88, 99, 110]'; % hidden values that are not used for training

[y2_predicted, accuracy] = svmpredict(y2, x2, model)

but the svmpredict function is giving me null output as shown below

y2_predicted =

     []
accuracy =

     []
Please help me resolve this .I am new to libsvm.",1,0
268,2015-5-18,2015,5,18,21,36d4wc,Time-lapse Mining from Internet Photos,https://www.reddit.com/r/MachineLearning/comments/36d4wc/timelapse_mining_from_internet_photos/,vadiiim,1431953967,,7,123
269,2015-5-19,2015,5,19,1,36dv77,How accurate are current weather forecasting systems? What sort of machine learning processes are common to the task of predicting weather patterns?,https://www.reddit.com/r/MachineLearning/comments/36dv77/how_accurate_are_current_weather_forecasting/,123A321,1431967227,,6,8
270,2015-5-19,2015,5,19,2,36e5jx,ICLR 2015's videos,https://www.reddit.com/r/MachineLearning/comments/36e5jx/iclr_2015s_videos/,[deleted],1431971833,,0,1
271,2015-5-19,2015,5,19,2,36e5s9,ICLR 2015's videos,https://www.reddit.com/r/MachineLearning/comments/36e5s9/iclr_2015s_videos/,vkhuc,1431971937,,6,10
272,2015-5-19,2015,5,19,3,36e7b7,"Deep Reinforcement Learning (ICLR2015, David Silver, Google DeepMind) [x-post /r/artificial]",https://www.reddit.com/r/MachineLearning/comments/36e7b7/deep_reinforcement_learning_iclr2015_david_silver/,True-Creek,1431973019,,3,19
273,2015-5-19,2015,5,19,3,36e9l6,NNs vs kernel methods,https://www.reddit.com/r/MachineLearning/comments/36e9l6/nns_vs_kernel_methods/,asymptotics,1431973957,"My understanding is that both classes of methods are ""universal approximators"", so what are the cases where we might prefer one over the other?",10,2
274,2015-5-19,2015,5,19,5,36eqpo,The Five Elements of Data Science Process,https://www.reddit.com/r/MachineLearning/comments/36eqpo/the_five_elements_of_data_science_process/,[deleted],1431981242,,0,0
275,2015-5-19,2015,5,19,5,36ernv,Special care when using global average pooling?,https://www.reddit.com/r/MachineLearning/comments/36ernv/special_care_when_using_global_average_pooling/,entron,1431981637,"I have a working CNN code which has some convolutional layers and dense layers with softmax output in the finial layer. The CIFAR-10 error rate of the network is about 20% without pre-processing and data augmentation. I want to try the global average pooling as in the paper: Network In Network (arXiv:1312.4400) and Striving for Simplicity: The All Convolutional Net (arXiv:1412.6806). However, the network stops learning after I added global average pooling. If I connect the output of global average pooling to another logistic regression layer, it learns again. I suspect the reason is due to bad initialization or learning rate. However after some experiment I still could not find any solution. Could some one tell me what might be the cause of my problem?",0,0
276,2015-5-19,2015,5,19,6,36eure,"""Is unsupervised pre-training still useful given recent advances? If so, when?"" (ICLR 2015 workshop paper)",https://www.reddit.com/r/MachineLearning/comments/36eure/is_unsupervised_pretraining_still_useful_given/,[deleted],1431982913,,7,12
277,2015-5-19,2015,5,19,6,36evlc,Particle Swarm Optimization in F# part 2,https://www.reddit.com/r/MachineLearning/comments/36evlc/particle_swarm_optimization_in_f_part_2/,DanielSlater8,1431983281,,1,0
278,2015-5-19,2015,5,19,6,36exww,"One piece of input per input-neuron, but what does one do if the size of the input is unknown?",https://www.reddit.com/r/MachineLearning/comments/36exww/one_piece_of_input_per_inputneuron_but_what_does/,[deleted],1431984298,"I'm wondering what one is to do in constructing an rnn where there is an input-neuron per piece of input, how does one deal with input that is of an unspecified length? Trim it? For example an natural-sentence that I am vectorising ( each word ). I don't know how many words will be in the sentence or even the maximum words in the sentence unless I set a limit. Is there a technique that I am missing for dealing with input of an unspecified length?",10,0
279,2015-5-19,2015,5,19,8,36fdeo,"My output is a scalar vs. time curve, can this be used to make training more efficient?",https://www.reddit.com/r/MachineLearning/comments/36fdeo/my_output_is_a_scalar_vs_time_curve_can_this_be/,EndingPop,1431991294,"I'm new to ML, having completed Andrew Ng's class fairly recently. I have a problem where the key output is a scalar vs. time curve. I know that I can discretize that curve and just use it as is, but I'm wondering if there's a way to use that information to make the training more efficient. 

I know that the value of the scalar at a given time is dependent, in part, on the value of the scalar in the past. If we put in the past values as input to compute the current value, would that make it train faster?

I've done some literature searches on this, but since I'm new to the field I may not know the right keywords. Does anyone know if this has been done before? I appreciate input and any relevant references.",0,2
280,2015-5-19,2015,5,19,10,36fq51,Kingsland iron Workers,https://www.reddit.com/r/MachineLearning/comments/36fq51/kingsland_iron_workers/,fcredo,1431997402,,0,1
281,2015-5-19,2015,5,19,10,36fq6x,Edu-Videos | 100 Most Popular Machine Learning Talks at VideoLectures.Net,https://www.reddit.com/r/MachineLearning/comments/36fq6x/eduvideos_100_most_popular_machine_learning_talks/,Friars1993,1431997423,,0,1
282,2015-5-19,2015,5,19,10,36fqt2,Simple trick to speedup dropout: Efficient batchwise dropout training using submatrices,https://www.reddit.com/r/MachineLearning/comments/36fqt2/simple_trick_to_speedup_dropout_efficient/,downtownslim,1431997728,,1,7
283,2015-5-19,2015,5,19,11,36fxs1,Grinding--mixing--pelletizing--cooling--packing,https://www.reddit.com/r/MachineLearning/comments/36fxs1/grindingmixingpelletizingcoolingpacking/,qiangwin-pellet,1432001183,,1,0
284,2015-5-19,2015,5,19,11,36fy5z,Courser: Introduction to Recommender Systems,https://www.reddit.com/r/MachineLearning/comments/36fy5z/courser_introduction_to_recommender_systems/,[deleted],1432001388,,0,0
285,2015-5-19,2015,5,19,11,36g094,Salary Range for Lead Data position at Fortune 500 Company.,https://www.reddit.com/r/MachineLearning/comments/36g094/salary_range_for_lead_data_position_at_fortune/,[deleted],1432002476,"Hello /r/machinelearning, I'm looking for some help on figuring out the salary range for the follow position:

**Location**: Central United States (Midwest) -  Metro population of a few million.

**Position Title**: Data Integrity Specialist (Lead) at corporate headquarters of a Fortune 500 company.

**Job Summary**

* Daily supervision of operations and functions of the team: scheduling changes, tracking associate attendance, monitoring associate performance, as well as coaching and training associates.
* Participate in hiring and interviewing process / candidate selection.
* Regularly monitor performance, workflow, and provide feedback to the associates, as well as the manager.
* Responsible for providing full coverage of workload and meeting SLAs with overtime and budget constraints in mind; developing weekly team schedules. Monitor these schedules to ensure staff is working the hours, including any modifications.
* Participate and assist in staff department meetings.
* Develop training material and/or make changes changes to existing materials.
* Identify issues in current processes and develop solutions; notify management of concerns and solutions.
* Serve as the liaison between cross-functional departments.
* Through the analysis of tasks and resolution by linking or separating records involved, you will ensure the integrity of data within our enterprise-wide database; responsible for completing linkage, as well as separation requests.
* To ensure all records are from one unique entity, review the records within an Enterprise ID.
* To determine whether records belong to one unique entity or separate ones, it is your responsibility to review records within two separate Enterprise IDs.
* Review daily tasks lists and resolves.
* Ensure data integrity by updating MDM and source system information.
* Work with project team and ensure theyre aware of all program changes/upgrades/outages/.
* Take direction from manager and communicate to the associates on a regular basis.
* Assist Manager to ensure staff is properly trained and is built to execute on the department's needs.

**Minimum Requirements**

* Supervisor Experience, 1 Year Minimum
* Associates Degree
* Previous Data Stewardship Experience
* Administrative Experience, 1-2 Years Minimum
* Intermediate Microsoft Office Knowledge
* Windows OS Experience

**Hierarchy**

Manager &gt; **Lead / Specialist** &gt; Associate / Assistant

Thanks for the help ahead of time!",1,0
