,sbr,sbr_id,date,year,month,hour,day,id,domain,title,full_link,author,created,selftext,num_comments,score,over_18,thumbnail,media_provider,media_thumbnail,media_title,media_description,media_url
0,MachineLearning,t5_2r3gv,2015-11-1,2015,11,1,11,3r1fca,self.MachineLearning,Regarding Google's announcement of large-scale use of word-vector models in its search engine (RankBrain),https://www.reddit.com/r/MachineLearning/comments/3r1fca/regarding_googles_announcement_of_largescale_use/,ranterskanter,1446344577,"I was heavily downvoted by some at this sub just a few months ago for suggesting that Google was probably using word vectors at scale in its products.

I wonder if any of those downvoters would care to speak their minds about this development, and if they feel they have learned something now.",10,0,False,self,,,,,
1,MachineLearning,t5_2r3gv,2015-11-1,2015,11,1,16,3r26k8,singa.incubator.apache.org,"Apache SINGA, A Distributed Deep Learning Platform",https://www.reddit.com/r/MachineLearning/comments/3r26k8/apache_singa_a_distributed_deep_learning_platform/,pilooch,1446364252,,13,55,False,http://b.thumbs.redditmedia.com/U_9oc_6zMuC6rvD-33Fzt69hbhC4b8MuNS0R7je6ces.jpg,,,,,
2,MachineLearning,t5_2r3gv,2015-11-1,2015,11,1,18,3r2bnn,self.MachineLearning,Anyone have experience with TensorFlow? Google's upcoming neural network library?,https://www.reddit.com/r/MachineLearning/comments/3r2bnn/anyone_have_experience_with_tensorflow_googles/,tensorflow,1446369454,"Does anyone have any information on how TensorFlow compares with existing libraries like Theano and Torch? 

I've heard from multiple independent sources that Google will be releasing it soon. Just curious if it brings anything new to the table than what already exists.

",15,13,False,self,,,,,
3,MachineLearning,t5_2r3gv,2015-11-1,2015,11,1,21,3r2och,self.MachineLearning,Is any cluster algorithms suitable for this situation?,https://www.reddit.com/r/MachineLearning/comments/3r2och/is_any_cluster_algorithms_suitable_for_this/,Neuer93,1446381626,"I encountered a clustering problem recently: I have some nodes needed to be clustered and I know the distance (similarity) between each nodes. But there are lots of noisy nodes which dont belong to any clusters. I want to obtain clusters and discard noisy nodes. 
I am not familiar to clustering algorithms (just know some simple algorithm like KNN, K-Means), so I want to ask if there are some mature clustering algorithms suitable this situation?
",7,10,False,self,,,,,
4,MachineLearning,t5_2r3gv,2015-11-2,2015,11,2,0,3r38i2,oneweirdkerneltrick.com,Shockingly Effective Trick To Maximize your Margin!!!,https://www.reddit.com/r/MachineLearning/comments/3r38i2/shockingly_effective_trick_to_maximize_your_margin/,[deleted],1446392876,[deleted],2,0,False,default,,,,,
5,MachineLearning,t5_2r3gv,2015-11-2,2015,11,2,1,3r3dc8,machinelearninghub.blogspot.com.es,Machine Learning To Save Distracted Drivers,https://www.reddit.com/r/MachineLearning/comments/3r3dc8/machine_learning_to_save_distracted_drivers/,[deleted],1446395004,[deleted],0,1,False,default,,,,,
6,MachineLearning,t5_2r3gv,2015-11-2,2015,11,2,2,3r3nqj,arxiv.org,Classifier Technology and the Illusion of Progress,https://www.reddit.com/r/MachineLearning/comments/3r3nqj/classifier_technology_and_the_illusion_of_progress/,mttd,1446399348,,3,5,False,default,,,,,
7,MachineLearning,t5_2r3gv,2015-11-2,2015,11,2,3,3r3tpq,self.MachineLearning,Is there any library in python with proper documentation and tutorial for speech recognition?,https://www.reddit.com/r/MachineLearning/comments/3r3tpq/is_there_any_library_in_python_with_proper/,rohanpota,1446401730,"One option is Caffe Deep Learning Framework but I can't seem to find any tutorials(related to speech recognition) on it.If someone has any links regarding this,please share them.",4,3,False,self,,,,,
8,MachineLearning,t5_2r3gv,2015-11-2,2015,11,2,3,3r3y3a,self.MachineLearning,Where can I get the latest dataset for a network intrusion detection system?,https://www.reddit.com/r/MachineLearning/comments/3r3y3a/where_can_i_get_the_latest_dataset_for_a_network/,rohanpota,1446403521,"I am using machine learning for network intrusion detection(Signature based).
Except kddcup99.
",4,3,False,self,,,,,
9,MachineLearning,t5_2r3gv,2015-11-2,2015,11,2,4,3r40v6,github.com,Mondrian forests: Efficient random forests for streaming data (Python Code and lecture),https://www.reddit.com/r/MachineLearning/comments/3r40v6/mondrian_forests_efficient_random_forests_for/,[deleted],1446404650,[deleted],2,23,False,default,,,,,
10,MachineLearning,t5_2r3gv,2015-11-2,2015,11,2,4,3r425h,blog.shakirm.com,Machine Learning Trick of the Day (4): Reparameterisation Tricks,https://www.reddit.com/r/MachineLearning/comments/3r425h/machine_learning_trick_of_the_day_4/,skrza,1446405168,,0,41,False,http://b.thumbs.redditmedia.com/C1EqHyV20M1ZJW4To1uneNlfRJswBx0EgFgiBj1lwSc.jpg,,,,,
11,MachineLearning,t5_2r3gv,2015-11-2,2015,11,2,5,3r4a97,self.MachineLearning,Best Material for Learning RNNs,https://www.reddit.com/r/MachineLearning/comments/3r4a97/best_material_for_learning_rnns/,atomant30,1446408393,"I have a good understanding of feed-forward neutral networks and I want to learn about RNNs. What are some of the best resources available?

My short-term goal is to implement LSTMs in Torch, but I don't feel like I have a solid enough understanding of RNNs in general. ",8,10,False,self,,,,,
12,MachineLearning,t5_2r3gv,2015-11-2,2015,11,2,5,3r4b63,self.MachineLearning,Preprocessing convnet RGB filters for visualization?,https://www.reddit.com/r/MachineLearning/comments/3r4b63/preprocessing_convnet_rgb_filters_for/,LyExpo,1446408758,"I have so far only experimented with convnets using greyscale images. I have successfully visualized the first layer filters by simply plotting the values of the weights. 

This method doesn't seem to working for me when I change over to rgb images. In this setting, plotting using `ax.imshow(...)` in matplotlib is giving me filters that look like colorful noise. I'm wondering if there is some sort of preprocessing I should do to the first layer weights before plotting them. In particular, it might be possible that the r,g, and b weights are in totally different ranges, in which case simply plotting them as is might not make sense.

Can someone share their experiences?",5,2,False,self,,,,,
13,MachineLearning,t5_2r3gv,2015-11-2,2015,11,2,7,3r4rga,self.MachineLearning,Low dimensional time series.,https://www.reddit.com/r/MachineLearning/comments/3r4rga/low_dimensional_time_series/,[deleted],1446415288,[deleted],6,4,False,default,,,,,
14,MachineLearning,t5_2r3gv,2015-11-2,2015,11,2,7,3r4y9u,self.MachineLearning,Questions about karpathy's char-rnn code,https://www.reddit.com/r/MachineLearning/comments/3r4y9u/questions_about_karpathys_charrnn_code/,Allanqunzi,1446418005,"In the LSTM model (https://github.com/karpathy/char-rnn/blob/master/model/LSTM.lua#L34) at line 34 and 35, code is like below

local reshaped = nn.Reshape(4, rnn_size)(all_input_sums) --line 34

local n1, n2, n3, n4 = nn.SplitTable(2)(reshaped):split(4)  -- line 35


According to my understanding, ""reshaped"" at line 34 is a 4 by rnn_size matrix, 

and at line 35, calling ""nn.SplitTable(2)(reshaped)"" yields a table, and this table has rnn_size elements(since it is splitting along the dimension 2), and each element is a 4-element vector.

But I don't know how "":split(4)"" works? 

Any one can explain how "":split(4)"" splits the results of ""nn.SplitTable(2)(reshaped)""? Thanks!
",2,2,False,self,,,,,
15,MachineLearning,t5_2r3gv,2015-11-2,2015,11,2,11,3r5qw1,github.com,"Python text sentiment analysis server, what do you think?",https://www.reddit.com/r/MachineLearning/comments/3r5qw1/python_text_sentiment_analysis_server_what_do_you/,linux1975,1446430433,,16,36,False,http://b.thumbs.redditmedia.com/rjyyzYL_GglCrrbdO989PI0-J3wIF7EqndFkQLDOJPY.jpg,,,,,
16,MachineLearning,t5_2r3gv,2015-11-2,2015,11,2,13,3r6b18,self.MachineLearning,Good practices for data mining?,https://www.reddit.com/r/MachineLearning/comments/3r6b18/good_practices_for_data_mining/,code_kansas,1446440305,"Hi, I am doing some web scraping to build a data set to do some distributional semantics analysis. My code is basically a python script that does a breadth-first search on all the links found on a particular page that belong to a particular domain (in this case, Huffington Post, because I wanted blog text). The thing is, I am now having to go back through and clean a bunch of it up because my code isn't very good at identifying what is ""blog"" text and what isn't. I was wondering, does anyone have any suggestions on how to go about this well? Are there any resources out there for people like me who would like to do this? Also, if I wanted to make the data available, is there a good way to structure it?",1,1,False,self,,,,,
17,MachineLearning,t5_2r3gv,2015-11-2,2015,11,2,18,3r6xtw,gitxiv.com,Variational Recurrent Neural Network (paper+code),https://www.reddit.com/r/MachineLearning/comments/3r6xtw/variational_recurrent_neural_network_papercode/,samim23,1446456315,,0,6,False,default,,,,,
18,MachineLearning,t5_2r3gv,2015-11-2,2015,11,2,19,3r71ft,self.MachineLearning,Fast Randomized SVD | Facebook Blog + Code,https://www.reddit.com/r/MachineLearning/comments/3r71ft/fast_randomized_svd_facebook_blog_code/,pilooch,1446459318,"This fast randomized SVD / PCA python lib by Facebook just allowed me to scale up some clustering very easily, since I had never heard of it, I thought I would share:

- code: https://github.com/facebook/fbpca
- blog post: https://research.facebook.com/blog/294071574113354/fast-randomized-svd/",8,13,False,self,,,,,
19,MachineLearning,t5_2r3gv,2015-11-2,2015,11,2,19,3r73nl,machinelearninghub.blogspot.com.es,Machine Learning To Save Distracted Drivers,https://www.reddit.com/r/MachineLearning/comments/3r73nl/machine_learning_to_save_distracted_drivers/,[deleted],1446461182,[deleted],0,1,False,default,,,,,
20,MachineLearning,t5_2r3gv,2015-11-2,2015,11,2,20,3r76rm,gitxiv.com,Texture Synthesis Using Convolutional Neural Networks (paper+code),https://www.reddit.com/r/MachineLearning/comments/3r76rm/texture_synthesis_using_convolutional_neural/,samim23,1446463743,,9,31,False,default,,,,,
21,MachineLearning,t5_2r3gv,2015-11-2,2015,11,2,20,3r77mb,self.MachineLearning,Poisson distribution for recommender system(by LDA creator David Blei),https://www.reddit.com/r/MachineLearning/comments/3r77mb/poisson_distribution_for_recommender_systemby_lda/,yobichi,1446464366,"Recently David Blei has published a paper talking about using poisson distribution for recommender system. Given the observed y_ui, which equal one if user u consume item i otherwise it is zero. And y_ui is modeled with a poisson distribution:  y_ui ~ Poisson(theta_u * beta_i)
Anyone can answer me the question that why he can use the poisson model here? How can the recommending scenario fulfil the requirement of poisson distribution? 
The paper is here: http://auai.org/uai2015/proceedings/papers/208.pdf",11,2,False,self,,,,,
22,MachineLearning,t5_2r3gv,2015-11-2,2015,11,2,20,3r78n0,youtube.com,Vacuum packaging machine VS 600,https://www.reddit.com/r/MachineLearning/comments/3r78n0/vacuum_packaging_machine_vs_600/,dongfengpacking,1446465100,,1,1,False,default,,,,,
23,MachineLearning,t5_2r3gv,2015-11-2,2015,11,2,21,3r79hz,youtube.com,Vacuum packing machine DZ 325,https://www.reddit.com/r/MachineLearning/comments/3r79hz/vacuum_packing_machine_dz_325/,dongfengpacking,1446465708,,1,1,False,default,,,,,
24,MachineLearning,t5_2r3gv,2015-11-2,2015,11,2,21,3r7am6,youtube.com,Double chamber vacuum packing machine,https://www.reddit.com/r/MachineLearning/comments/3r7am6/double_chamber_vacuum_packing_machine/,dongfengpacking,1446466487,,1,1,False,default,,,,,
25,MachineLearning,t5_2r3gv,2015-11-2,2015,11,2,21,3r7ejw,blog.brainattica.com,Machine Learning for indentify the author of an email,https://www.reddit.com/r/MachineLearning/comments/3r7ejw/machine_learning_for_indentify_the_author_of_an/,raulgzm,1446469058,,0,0,False,http://a.thumbs.redditmedia.com/MAphUBpvvr9OvqaXhd7pn3uV6SJpLy3D0jsWE0YDOD0.jpg,,,,,
26,MachineLearning,t5_2r3gv,2015-11-2,2015,11,2,23,3r7ldj,self.MachineLearning,"Deep Learning Summer School,Montreal 2015 - Videolectures.net google drive link!",https://www.reddit.com/r/MachineLearning/comments/3r7ldj/deep_learning_summer_schoolmontreal_2015/,code2hell,1446472904,"As videolectures.net  provide download option to a few lectures(they do have a valid reason to do so explained [here!](http://videolectures.net/faq/)
and also the fact that its a streaming video, thereby making it hard for people to download it. I've downloaded and uploaded the lectures in google drive and the link for the same
[here!](https://drive.google.com/folderview?id=0B6EE3Sw2jmZWfnRIcm5rRkNVTDdPTlc3NUFIQU04MmRuVXFUM2JRYURmSVVBQmhqbFBxM00&amp;usp=sharing)

Please do check out the course here:
http://videolectures.net/deeplearning2015_montreal/?q=deep%20learning

Im not much sure of the citations that I have to provide for the material. Please do suggest me about citations in the comments! Thanks!",6,31,False,self,,,,,
27,MachineLearning,t5_2r3gv,2015-11-3,2015,11,3,0,3r7x8q,self.MachineLearning,Scoring for Unsupervised Anomaly Detection,https://www.reddit.com/r/MachineLearning/comments/3r7x8q/scoring_for_unsupervised_anomaly_detection/,DataOmbudsman,1446478315,"Hey all,

I'm in a need of any input regarding my current project so let me ask you a question.

I'm working on unsupervised anomaly detection. I use an ensemble of algorithms for detecting anomalies in the same data. One algorithm is based on frequent pattern mining, another is on PCA etc.

Each of these algorithms outputs an outlier score for each item in my data set; let's call these 'raw scores'. These raw scores could be on various scales; e.g., the raw scores of algorithm #1 are between [0,1], of algorithm #2 between [-inf, 0]. Even if two algorithms score on the same scale, the interpretation of the scores could be different (one is purely probability, the other is not).

My goal is to calibrate these scores and put the raw scores from all algorithms on [0,1] with the following requirements:

- the same calibrated score has the same interpretation across all of my algorithms so that I can compare the scores of different algorithms,

- the same calibrated score has the same interpretation across all of my data sets so that I can compare the scores of different data sets.

So far, my best approach was to score the training data set with my algorithms and somehow use the distribution of the raw scores to calibrate. For example, I used a sigmoid function to convert the normalized raw scores to scores between 0-1. But then, I was a bit disappointed because that forced me in a way such that a fixed portion of calibrated scores went beyond the threshold of anomalousness (let's say, 0.5) now matter how normal my data were (and I don't want normal data to have high scores).

It might be that my requirements are contradicting but I couldn't prove it so far.

Can you point me in the right direction? What should I look into? I'm aware there is a whole area of calibrating the raw scores of supervised algorithms into probabilities (Platt scaling, isotonic regression) but those methods need labels which I don't have.

Thanks for all ideas!",4,1,False,self,,,,,
28,MachineLearning,t5_2r3gv,2015-11-3,2015,11,3,0,3r80gu,avisingh599.github.io,"Tutorial for Visual Question Answering using CNN and LSTMs, code in Python+Keras(Theano)",https://www.reddit.com/r/MachineLearning/comments/3r80gu/tutorial_for_visual_question_answering_using_cnn/,[deleted],1446479648,[deleted],0,1,False,default,,,,,
29,MachineLearning,t5_2r3gv,2015-11-3,2015,11,3,1,3r8a4w,self.MachineLearning,How to measure the similarity between two weight spaces in an ANN,https://www.reddit.com/r/MachineLearning/comments/3r8a4w/how_to_measure_the_similarity_between_two_weight/,joeyglasgow,1446483431,"Hi,

I'm trying to get a metric for the distance between to sets of weights for neural networks in an ensemble to test how different training schemes affect diversity. Does anyone know what kind of measures may be useful?",18,5,False,self,,,,,
30,MachineLearning,t5_2r3gv,2015-11-3,2015,11,3,2,3r8jn5,forbes.com,How Klout Leverages Machine Learning To Calculate Influence,https://www.reddit.com/r/MachineLearning/comments/3r8jn5/how_klout_leverages_machine_learning_to_calculate/,shugert,1446486902,,0,0,False,http://b.thumbs.redditmedia.com/eOW6yyVFQ-6QJFsQjnzUMOgWptiAUDAflPIR5yTJQco.jpg,,,,,
31,MachineLearning,t5_2r3gv,2015-11-3,2015,11,3,2,3r8jwt,self.MachineLearning,"Are models like AlexNet, VGGNet, GoogleNet available in theano/theano-based libraries?",https://www.reddit.com/r/MachineLearning/comments/3r8jwt/are_models_like_alexnet_vggnet_googlenet/,feedthecreed,1446486997,"I want to fine-tune an entire pre-trained model on a new dataset, but I can't find source code that creates the theano expression for these pre-trained models. Does anyone know if something like this exists anywhere? Is theano simply too slow to run networks this larger?",4,1,False,self,,,,,
32,MachineLearning,t5_2r3gv,2015-11-3,2015,11,3,3,3r8lju,self.MachineLearning,NIPS 2015 thread,https://www.reddit.com/r/MachineLearning/comments/3r8lju/nips_2015_thread/,[deleted],1446487603,[removed],0,1,False,default,,,,,
33,MachineLearning,t5_2r3gv,2015-11-3,2015,11,3,3,3r8the,self.MachineLearning,Machine learning and immigration,https://www.reddit.com/r/MachineLearning/comments/3r8the/machine_learning_and_immigration/,__null__,1446490497,Are there any research projects  or papers related to machine learning and immigration ?,6,0,False,self,,,,,
34,MachineLearning,t5_2r3gv,2015-11-3,2015,11,3,4,3r8uxo,cloudacademy.com,Amazon EMR: five ways to improve the way you use Hadoop,https://www.reddit.com/r/MachineLearning/comments/3r8uxo/amazon_emr_five_ways_to_improve_the_way_you_use/,leonardodotio,1446491028,,0,3,False,http://b.thumbs.redditmedia.com/kdtMjVNNJrPZ37_GnBw7OMalG1B2WazBNOq_5PKFqFg.jpg,,,,,
35,MachineLearning,t5_2r3gv,2015-11-3,2015,11,3,4,3r927m,sanjivk.com,"""Considering a fullyconnected neural network layer with d input nodes, and d output nodes, this method improves the time complexity from O(d^2) to O(d log d) and space complexity from O(d^2) to O(d)""",https://www.reddit.com/r/MachineLearning/comments/3r927m/considering_a_fullyconnected_neural_network_layer/,downtownslim,1446493674,,16,12,False,default,,,,,
36,MachineLearning,t5_2r3gv,2015-11-3,2015,11,3,5,3r94eg,self.MachineLearning,word2vec: how to choose embedding space dimensions,https://www.reddit.com/r/MachineLearning/comments/3r94eg/word2vec_how_to_choose_embedding_space_dimensions/,solololol,1446494507,"I am training word2vec on 50GB of English scientific papers with gensim. I created a model with 100 dimensions and one with 300. I've seen people use up to 500 with word2vec.

My impressionistic assessment is that my 100-dim and 300-dim models are quite different. I see no obvious winner though.

Could anyone explain what changing dimension captures, and whether you'd recommend some specific dimension for 50GB of English text?

Here is one sample, notice the important differences:

    model-100-dim.most_similar('scratch')
    [('mar', 0.6890989542007446),
     ('abrasion', 0.6360374093055725),
     ('sticky', 0.560904860496521),
     ('bit-addressable', 0.5505107641220093),
     ('wear', 0.5437108874320984),
     ('corrosion', 0.5321375131607056),
     ('pre-fetch/post-store', 0.5250539779663086),
     ('coating,f.', 0.5158470273017883),
     ('wrinkle', 0.5154947638511658),
     ('good', 0.5135785341262817)

and:

    model-300-dim.most_similar('scratch')
    [('abrasion', 0.5975580811500549),
     ('mar', 0.5910640954971313),
     ('wear', 0.49950164556503296),
     ('scratch,', 0.46674802899360657),
     ('corrosion', 0.462272971868515),
     ('coating,f.', 0.4538571834564209),
     ('stain', 0.4521702826023102),
     ('tintable,', 0.45050448179244995),
     ('scuff', 0.44467946887016296),
     ('abrasion,', 0.4431385099887848)",6,2,False,self,,,,,
37,MachineLearning,t5_2r3gv,2015-11-3,2015,11,3,5,3r9b4s,3blades.io,"6 Biggest Misconceptions About Data Scientists, Data Engineers and Business Analysts.",https://www.reddit.com/r/MachineLearning/comments/3r9b4s/6_biggest_misconceptions_about_data_scientists/,shugert,1446496924,,0,0,False,default,,,,,
38,MachineLearning,t5_2r3gv,2015-11-3,2015,11,3,5,3r9dao,avisingh599.github.io,Tutorial for Visual Question Answering using CNN and LSTM with Python code,https://www.reddit.com/r/MachineLearning/comments/3r9dao/tutorial_for_visual_question_answering_using_cnn/,zapata999,1446497718,,2,4,False,http://b.thumbs.redditmedia.com/pe5tyHNosHHF8lt2a4ERrov1-V1A4mE4adF2DuUNfdE.jpg,,,,,
39,MachineLearning,t5_2r3gv,2015-11-3,2015,11,3,5,3r9dt2,news.nationalgeographic.com,The Rules of Data Visualization Get an Update,https://www.reddit.com/r/MachineLearning/comments/3r9dt2/the_rules_of_data_visualization_get_an_update/,shugert,1446497915,,2,9,False,http://b.thumbs.redditmedia.com/DgViwv4Jndxf40TwM9zi6vkjKF06T5Zg3H4RpcrehjY.jpg,,,,,
40,MachineLearning,t5_2r3gv,2015-11-3,2015,11,3,6,3r9hvk,nature.com,Artificial-intelligence institute launches free science search engine,https://www.reddit.com/r/MachineLearning/comments/3r9hvk/artificialintelligence_institute_launches_free/,bakarr,1446499418,,0,1,False,http://b.thumbs.redditmedia.com/CaZIdHp_MGKrDbWSS46TDUeamhyLNk5C3XJI5AbIorQ.jpg,,,,,
41,MachineLearning,t5_2r3gv,2015-11-3,2015,11,3,7,3r9oys,self.MachineLearning,I have a question in regards to video game design.,https://www.reddit.com/r/MachineLearning/comments/3r9oys/i_have_a_question_in_regards_to_video_game_design/,[deleted],1446502022,"I am asking about this because I want to make sure I understand machine learning correctly in how it would be utilized in the specific situation below. 

Problem:
I am tasked with generating all of the art assets for a video game.

I have a large database of art assets from already existing games. Lets say for arguments sake all of these assets are organized in similar groups.

In the case of utilizing machine learning algorithm I would tell the program to analyze the assets then generate 100 similar assets. I would then pick the top 10 and repeat the process until I got assets I felt were usable for what I currently needed.

Is this correct? 

Side bonus question:
Does anything like this already exist?",4,1,False,self,,,,,
42,MachineLearning,t5_2r3gv,2015-11-3,2015,11,3,7,3r9rvr,machinelearninghub.blogspot.com.es,Machine Learning To Save Distracted Drivers,https://www.reddit.com/r/MachineLearning/comments/3r9rvr/machine_learning_to_save_distracted_drivers/,Pavan19485,1446503105,,0,1,False,default,,,,,
43,MachineLearning,t5_2r3gv,2015-11-3,2015,11,3,8,3r9y1j,github.com,Use evolutionary algorithms instead of gridsearch in scikit-learn. This allows you to exponentially reduce the time required to find the best parameters for your estimator.,https://www.reddit.com/r/MachineLearning/comments/3r9y1j/use_evolutionary_algorithms_instead_of_gridsearch/,rsteca,1446505497,,48,61,False,http://b.thumbs.redditmedia.com/RWHbYmuVK6DALURg0BDaXsOGqoNvPsdC7hGPFph7lro.jpg,,,,,
44,MachineLearning,t5_2r3gv,2015-11-3,2015,11,3,9,3ra8bn,nsf.gov,A Brain Trust for Data Science: NSF announces awards for four regional big data innovation hubs.,https://www.reddit.com/r/MachineLearning/comments/3ra8bn/a_brain_trust_for_data_science_nsf_announces/,Mexicorn,1446509726,,0,7,False,http://a.thumbs.redditmedia.com/FDbCs5O29CEWK-UyegZa2H1rrlkZDM5Z9fnOBiXuvU4.jpg,,,,,
45,MachineLearning,t5_2r3gv,2015-11-3,2015,11,3,10,3raivl,self.MachineLearning,Code to Calculate Confidence Interval for Linear Regression (Sklearn)?,https://www.reddit.com/r/MachineLearning/comments/3raivl/code_to_calculate_confidence_interval_for_linear/,srt19170,1446514149,"Can anyone provide a pointer to existing code I can use to calculate the confidence interval for a new observation (and its prediction) given a fitted Scikit Learn linear regression, as (for example) described [here](http://www.utd.edu/~ammann/stat3360/node35.html)?  I'm specifically interested in the case of calculating the interval for a new prediction.  Any help would be appreciated!",2,1,False,self,,,,,
46,MachineLearning,t5_2r3gv,2015-11-3,2015,11,3,10,3ralkr,self.MachineLearning,What are the most interesting recent developments in penalization since structured sparsity?,https://www.reddit.com/r/MachineLearning/comments/3ralkr/what_are_the_most_interesting_recent_developments/,gabjuasfijwee,1446515343,?,0,6,False,self,,,,,
47,MachineLearning,t5_2r3gv,2015-11-3,2015,11,3,11,3rau4s,self.MachineLearning,Good book for applications of topology in ML?,https://www.reddit.com/r/MachineLearning/comments/3rau4s/good_book_for_applications_of_topology_in_ml/,paulkon,1446518960,A DeepMind researcher recently wrote a blog post about the application of topology in machine learning. Was looking for related books to get a better picture of how it can be used.,5,2,False,self,,,,,
48,MachineLearning,t5_2r3gv,2015-11-3,2015,11,3,13,3rb75w,magizbox.com,Deep Learning Companies,https://www.reddit.com/r/MachineLearning/comments/3rb75w/deep_learning_companies/,brotherrain,1446524665,,0,3,False,http://b.thumbs.redditmedia.com/53NJ4NOWNs5q21diQzTItbXbeg68zVlLZ4SVWUHEXYk.jpg,,,,,
