,sbr,sbr_id,date,year,month,hour,day,id,domain,title,full_link,author,created,selftext,num_comments,score,over_18,thumbnail,media_provider,media_thumbnail,media_title,media_description,media_url
574,MachineLearning,t5_2r3gv,2015-11-23,2015,11,23,3,3tu876,self.MachineLearning,Convolutional Autoencoder,https://www.reddit.com/r/MachineLearning/comments/3tu876/convolutional_autoencoder/,pumpkin105,1448217260,"Hi,

I'm trying to implement a convolutional autoencoder. Doing that, I'm struggling with training more than one layer. My structure looks like this:

- Input Noise
- Conv (1-&gt;32, (4,4)), Maxpooling (2,2)
- Conv (32-&gt;64, (4,4)), Maxpooling (2,2)
- Conv (64-&gt;32, (4,4)), Upsampling (2,2)
- Conv (32-&gt;1, (4,4)), Upsampling (2,2)

When using one layer (i.e. Conv 1-&gt;32, Maxpooling, Upsampling, Conv 32-&gt;1), the results and the reconstrutec pictures look nice. With the mentioned two layered structure, the values are growing and growing, the last layer quickly has values &lt; -1000 after a few iterations, thus the reconstructed images are just black. Has anyone made experience with ConvAEs?

A more general question: When feature maps are created using the input image, the kernel slides across the image and creates its feature map. When doing the second convolution, there are n feature maps, depending on the number of kernels. Are the next kernels using all the feature maps? If so, are they avering their results? It's hard to find any detailed explanation on this..",17,8,False,self,,,,,
575,MachineLearning,t5_2r3gv,2015-11-23,2015,11,23,3,3tu8sh,self.MachineLearning,[Matlab]Help with CNN implementation,https://www.reddit.com/r/MachineLearning/comments/3tu8sh/matlabhelp_with_cnn_implementation/,MarcoROG-SG,1448217511,"Hello!
I'm relatively new to machine learning, and i'm trying to implement a CNN using MatLAB as part of this tutorial:
http://ufldl.stanford.edu/tutorial/supervised/ExerciseConvolutionalNeuralNetwork/

I have tried implementing the backpropagation of the network but i'm having some issues and i'm not really sure if i'm doing it right.
The gradients determined analitically don't match up with the ones backpropagated and i would really appreciate if someone could take a look to my cnnConvolve, cnnPool and cnnCost files:
https://github.com/MarcoROG/ConcurrentNeuralNetwork
You can find it in the cnn folder.

EDIT: Pool and Convolve are OK, so the problem must be in the backProp part of cnnCost

Thanks a lot for your help!",7,0,False,self,,,,,
576,MachineLearning,t5_2r3gv,2015-11-23,2015,11,23,3,3tu9qz,blog.shakirm.com,Machine Learning Trick of the Day (5): Log Derivative Trick  The Spectator,https://www.reddit.com/r/MachineLearning/comments/3tu9qz/machine_learning_trick_of_the_day_5_log/,mttd,1448217923,,7,79,False,http://b.thumbs.redditmedia.com/sRZSr4FILHIBwSoLc9_di_CVXPvxLP3d11-swCMOmlg.jpg,,,,,
577,MachineLearning,t5_2r3gv,2015-11-23,2015,11,23,4,3tug6m,vimeo.com,"""Neural net descriptions generated in realtime during a brief walk around Amsterdam""",https://www.reddit.com/r/MachineLearning/comments/3tug6m/neural_net_descriptions_generated_in_realtime/,s3ma,1448220686,,8,67,False,http://b.thumbs.redditmedia.com/OpmrwjLrqi_elothDuYVQs9IFEb2ncuorzij1-6iNvk.jpg,,,,,
578,MachineLearning,t5_2r3gv,2015-11-23,2015,11,23,5,3tusk9,self.MachineLearning,How to cluster large data set with k-means using silhouettes?,https://www.reddit.com/r/MachineLearning/comments/3tusk9/how_to_cluster_large_data_set_with_kmeans_using/,aprstar,1448225726,[removed],0,1,False,default,,,,,
579,MachineLearning,t5_2r3gv,2015-11-23,2015,11,23,6,3tuxja,self.MachineLearning,Feeding Seq2Seq Decoder with Mean and Last Hidden State,https://www.reddit.com/r/MachineLearning/comments/3tuxja/feeding_seq2seq_decoder_with_mean_and_last_hidden/,LeavesBreathe,1448227694,"Hey Guys,

kknaster helped me greatly with this post discussing hidden states: https://www.reddit.com/r/MachineLearning/comments/3sexmi/transfering_hidden_states_in_sequence_to_sequence/

Currently, I'm using Google's TensorFlow Model for predicting the next sentence given the previous sentence.

My main problem right now is that the predicted sentences are **very repetitive** and go something like this:

	""the stars in the sky are the stars.""
	""the most common planets are the most common planets.""
	""stars are common in the galaxy in the galaxy.""

I think what is going on is that the network is only seeing ""galaxy"", and then predicting ""in"" then ""the"" then ""galaxy""

This has led me to this idea: Using both the *mean* of the hidden states **and** the last hidden state:

 	#decoder_states refers to previous states produced by the encoder AND decoder. 
    mean_decoder_states = np.mean(decoder_states)
  	final_decoder_state = (0.5*decoder_states[-1])+0.5*mean_decoder_states

Where half of the state reflects the last hidden state and the other half represents what has already been said. This seems too obvious that no one has reported on it, so I'm thinking there must be a problem with this idea. I should clarify: that this combined mean and last hidden state average would be for **both training and testing**

Thoughts? Thanks! Open to any ideas.",12,2,False,self,,,,,
580,MachineLearning,t5_2r3gv,2015-11-23,2015,11,23,7,3tv2fl,self.MachineLearning,Are there R packages to create a bigram/trigram frequency matrix for a naive bayes classifier?,https://www.reddit.com/r/MachineLearning/comments/3tv2fl/are_there_r_packages_to_create_a_bigramtrigram/,[deleted],1448229676,[deleted],0,0,False,default,,,,,
581,MachineLearning,t5_2r3gv,2015-11-23,2015,11,23,12,3tw74n,arxiv.org,sense2vec - A Fast and Accurate Method for Word Sense Disambiguation In Neural Word Embeddings,https://www.reddit.com/r/MachineLearning/comments/3tw74n/sense2vec_a_fast_and_accurate_method_for_word/,[deleted],1448248050,[deleted],0,1,False,default,,,,,
582,MachineLearning,t5_2r3gv,2015-11-23,2015,11,23,13,3twdp4,datasciencecentral.com,5 Ways Machine Learning Is Reshaping Our World (by Bernard Marr),https://www.reddit.com/r/MachineLearning/comments/3twdp4/5_ways_machine_learning_is_reshaping_our_world_by/,vincentg64,1448251211,,0,1,False,default,,,,,
583,MachineLearning,t5_2r3gv,2015-11-23,2015,11,23,14,3twqol,zdnet.com,IBM's SystemML machine learning system becomes Apache Incubator project,https://www.reddit.com/r/MachineLearning/comments/3twqol/ibms_systemml_machine_learning_system_becomes/,KeponeFactory,1448258047,,1,7,False,http://b.thumbs.redditmedia.com/feIVCofDebgj0XKaFtXUI4Pf0D9gYziXFUrmTun5biQ.jpg,,,,,
584,MachineLearning,t5_2r3gv,2015-11-23,2015,11,23,15,3twsh3,arxiv.org,Training Neural Networks on Spark : SparkNet,https://www.reddit.com/r/MachineLearning/comments/3twsh3/training_neural_networks_on_spark_sparknet/,muktabh,1448259042,,3,12,False,default,,,,,
585,MachineLearning,t5_2r3gv,2015-11-23,2015,11,23,15,3twtdj,youtube.com,Auotmatic Tray Sealing Machine,https://www.reddit.com/r/MachineLearning/comments/3twtdj/auotmatic_tray_sealing_machine/,dongfengpacking,1448259553,,1,1,False,default,,,,,
586,MachineLearning,t5_2r3gv,2015-11-23,2015,11,23,15,3twwwh,self.MachineLearning,Let's discuss: is arXiv always good?,https://www.reddit.com/r/MachineLearning/comments/3twwwh/lets_discuss_is_arxiv_always_good/,citeordie,1448261743,"Machine learning researcher here. It seems like our field is moving towards 'publish-on-arXiv-ASAP' model of research. This is obviously good for distributing ideas fast, but I am somewhat frustrated by the flag-planting culture that's being implicitly encouraged by arXiv. I've been going through the recent crop of ICLR papers and while some are paragons of good/innovative science, many are obvious rough drafts (just using ICLR as an example. I am well aware that ICLR submissions are currently being reviewed and considered non-archival.)

I've been trying to battle this by citing ""best-executed"" papers (usually conference publications) versus ""first"" papers (usually technical reports on arXiv) when I have to choose one citation (due to space), but I've had several reviewers telling me to cite the ""first"" paper instead. 

Interested to hear what other ML researchers think of this.
",19,26,False,self,,,,,
587,MachineLearning,t5_2r3gv,2015-11-23,2015,11,23,16,3twy86,github.com,Deepwalk algorithm to learn distributed embeddings of Nodes in social networks implemented using Keras and igraph,https://www.reddit.com/r/MachineLearning/comments/3twy86/deepwalk_algorithm_to_learn_distributed/,napsternxg,1448262599,,2,3,False,http://b.thumbs.redditmedia.com/8naG55BDrUlI5gHu6nXNuxhCX2VvhM7Cy5PIKwdo9WM.jpg,,,,,
588,MachineLearning,t5_2r3gv,2015-11-23,2015,11,23,16,3twyev,yanirseroussi.com,The hardest parts of data science,https://www.reddit.com/r/MachineLearning/comments/3twyev/the_hardest_parts_of_data_science/,cast42,1448262718,,1,10,False,http://a.thumbs.redditmedia.com/bvVrcl7YkhgNub21lEg8ozkb3ylANiEm_p_umBHt_v8.jpg,,,,,
589,MachineLearning,t5_2r3gv,2015-11-23,2015,11,23,16,3twys1,youtube.com,FC 5035,https://www.reddit.com/r/MachineLearning/comments/3twys1/fc_5035/,dongfengpacking,1448262953,,1,1,False,default,,,,,
590,MachineLearning,t5_2r3gv,2015-11-23,2015,11,23,17,3tx3j1,arxiv.org,[1511.06391] Order Matters: Sequence to sequence for sets,https://www.reddit.com/r/MachineLearning/comments/3tx3j1/151106391_order_matters_sequence_to_sequence_for/,iori42,1448266066,,0,3,False,default,,,,,
591,MachineLearning,t5_2r3gv,2015-11-23,2015,11,23,17,3tx44w,wikitract.com,WT of [1511.06114] Multi-task Sequence to Sequence Learning (Google team),https://www.reddit.com/r/MachineLearning/comments/3tx44w/wt_of_151106114_multitask_sequence_to_sequence/,[deleted],1448266507,[deleted],2,0,False,default,,,,,
592,MachineLearning,t5_2r3gv,2015-11-23,2015,11,23,17,3tx4kj,beforeitsnews.com,Worldwide Agriculture M2M Market Research and Analysis Report 2019 | Business,https://www.reddit.com/r/MachineLearning/comments/3tx4kj/worldwide_agriculture_m2m_market_research_and/,priyalambani,1448266811,,0,1,False,default,,,,,
593,MachineLearning,t5_2r3gv,2015-11-23,2015,11,23,20,3txip3,self.MachineLearning,Do you really need a PhD to do machine learning? I think this is no longer the case.,https://www.reddit.com/r/MachineLearning/comments/3txip3/do_you_really_need_a_phd_to_do_machine_learning_i/,smith2008,1448277464,"I keep hearing ( reading ) the way to learn how to build things with ML is through obtaining a PhD on a related field. I have a master degree in AI and it helps a lot but I wouldn't say it is a must have to start building cool and useful stuff with AI. 

It could've been the case when ML was mostly science oriented field and not so much of an engineering one. But just like with building software it become a lot easier with rising of powerful frameworks and cheap GPU / cloud solutions.

I think we should not promote the idea that ML is really hard core science stuff only. Well, it is, but there is so much more there. IMO this could slow down the development of the field in a long term.

What do you think?

EDIT: it seems there is a lot of controversy and confusion about my statement. Just wanted to make it clear that I am not saying a PhD in ML is not a good thing. Quite the opposite. If you can get one you should.

To try to explain what I really mean I will give an example with rocket science. Imagine you are really passionate about rockets, you want to build them, to experiment with different ideas and approaches. You want to create amazing rockets. Well that's great but you cannot do a lot if you are not part of some a research lab. Well, probably you can build a small rocket model if you put a couple of grands and a lot of passion but nothing even close to what NASA or SpaceX are doing. Now imagine you have that passion for AI and you want to build your AI ""rocket"". Could you build something close to what big companies are building? Well I can relate to plenty of small startups who are doing it.

So, all I am trying to say is that ML is a really an amazing and powerful approach to AI and it is getting a lot more accessible than it use to be.",63,43,False,self,,,,,
594,MachineLearning,t5_2r3gv,2015-11-23,2015,11,23,20,3txjm5,daeilkim.com,Refinery -- user-friendly interface to do NLP topic modelling with LDA,https://www.reddit.com/r/MachineLearning/comments/3txjm5/refinery_userfriendly_interface_to_do_nlp_topic/,cast42,1448278159,,0,0,False,default,,,,,
595,MachineLearning,t5_2r3gv,2015-11-23,2015,11,23,20,3txlvu,self.MachineLearning,Deep Learning using object recognition (project question),https://www.reddit.com/r/MachineLearning/comments/3txlvu/deep_learning_using_object_recognition_project/,buhburkz,1448279877,"Hello , I'm a third year comp sci student. I have recently been given a project on Deep learning as the title says. It's more of a introduction project whereas I'd have to learn about it and produce a demo for the object recognition part. I've found many resources for the theoretical side of things , but does anyone have any resources on implementation in code ? I've seen most people use Python(Theano), Torch , R etc.  I was leaning towards Python with the libraries myself.  

Thanks in advance for your help.",0,0,False,self,,,,,
596,MachineLearning,t5_2r3gv,2015-11-23,2015,11,23,21,3txm3r,arxiv.org,"Remember FB 20 Q&amp;A tasks? This paper ""achieve near-perfect accuracy on all categories, including positional reasoning and pathfinding that have proved difficult for all previous approaches"".",https://www.reddit.com/r/MachineLearning/comments/3txm3r/remember_fb_20_qa_tasks_this_paper_achieve/,derRoller,1448280048,,3,7,False,default,,,,,
597,MachineLearning,t5_2r3gv,2015-11-23,2015,11,23,21,3txngw,youtube.com,Ken Stanley: Discovery Without Objectives,https://www.reddit.com/r/MachineLearning/comments/3txngw/ken_stanley_discovery_without_objectives/,Ghostlike4331,1448280977,,6,4,False,http://b.thumbs.redditmedia.com/BJDyGVjzXsNQHANLF14ln-w7EncPeUwqNfZFqLDMLno.jpg,,,,,
598,MachineLearning,t5_2r3gv,2015-11-23,2015,11,23,21,3txql2,self.MachineLearning,Optimization of Expectation,https://www.reddit.com/r/MachineLearning/comments/3txql2/optimization_of_expectation/,Kiuhnm,1448283105,"I'm not a mathematician so I'm learning the math I need along the way.

If you go at page 216 of [this pdf](http://goodfeli.github.io/dlbook/contents/regularization.html) you'll see an objective function (7.19) to be minimized w.r.t. a function.
First of all, I think the authors forgot a trace operator. Indeed, the first expectation should be a scalar.
I asked on [math.stackexchange.com](http://math.stackexchange.com/questions/1542039/minimization-of-expected-value) but so far no one answered my question. Can you help me in any way?
I could just move on, but I think optimization is important.",0,0,False,self,,,,,
599,MachineLearning,t5_2r3gv,2015-11-23,2015,11,23,22,3txwfp,youtube.com,EuroSciPy 2015: European Scientific Computing with Python Conference,https://www.reddit.com/r/MachineLearning/comments/3txwfp/euroscipy_2015_european_scientific_computing_with/,ealx10,1448286492,,0,2,False,http://b.thumbs.redditmedia.com/iP5b-h5H45b2tTVEOsaeBQK73WU6Bx5gcmuoKi_2j9U.jpg,,,,,
600,MachineLearning,t5_2r3gv,2015-11-23,2015,11,23,23,3txzfh,self.MachineLearning,"Is there a type of ""reverse collocation"" function for NLTK type programs?; a function that displays words that are the most unused together?",https://www.reddit.com/r/MachineLearning/comments/3txzfh/is_there_a_type_of_reverse_collocation_function/,Rllrllrrlrrl,1448288103,"Sorry if this is a dumb question, I'm new to this and an amateur.",3,0,False,self,,,,,
601,MachineLearning,t5_2r3gv,2015-11-24,2015,11,24,0,3ty5nf,arxiv.org,Sense2vec  A Fast and Accurate Method for Word Sense Disambiguation,https://www.reddit.com/r/MachineLearning/comments/3ty5nf/sense2vec_a_fast_and_accurate_method_for_word/,iamtrask,1448291260,,2,5,False,default,,,,,
602,MachineLearning,t5_2r3gv,2015-11-24,2015,11,24,0,3ty6j9,self.MachineLearning,File Overlap in Big Datasets,https://www.reddit.com/r/MachineLearning/comments/3ty6j9/file_overlap_in_big_datasets/,wxyyxc1992,1448291687,[removed],0,0,False,default,,,,,
603,MachineLearning,t5_2r3gv,2015-11-24,2015,11,24,1,3tydtp,self.MachineLearning,A website for hosting and sharing Machine Learning trained models,https://www.reddit.com/r/MachineLearning/comments/3tydtp/a_website_for_hosting_and_sharing_machine/,_cr_55_,1448294900,"Hi all,


We are building a platform where you can upload and showcase your trained Machine Learning models.


The idea is that you can focus on the Machine Learning algorithms and easily deploy your models without the need of coding UIs, configuring servers, etc.


It is an early prototype and for now it works only with Python code. Here you can play with two classic examples based on scikit-learn (it may take a couple of seconds to load the models):

[https://predictors.ai/#/p/Sales_demo_predictor_probabilities](https://predictors.ai/#/p/Sales_demo_predictor_probabilities)

[https://predictors.ai/#/p/Iris_flower_classifier](https://predictors.ai/#/p/Iris_flower_classifier)


And these are two more recent examples based on Keras and Lasagne:

[https://predictors.ai/index.html#/p/bAbI_size_reasoning_predictor](https://predictors.ai/index.html#/p/bAbI_size_reasoning_predictor)

[https://predictors.ai/#/p/Image_Labeler_VGG_S](https://predictors.ai/#/p/Image_Labeler_VGG_S)


In order to upload a model to the platform you just have to implement an additional method in your code and describe the model with a json file.


Public predictors are hosted for free. You can even deploy a model directly from GitHub and a link to its source code will be displayed. This is a very convenient way of sharing both the source code and an interactive demo of the model, and it also enables people to easily fork existing online models.


We have a long To-Do list full of improvements and new features, but if anyone would like to start uploading models to this beta version and get a profile on the website, send me a PM or an email and we will gladly grant you access.",3,20,False,self,,,,,
604,MachineLearning,t5_2r3gv,2015-11-24,2015,11,24,1,3tykrw,github.com,Unsupervised Representation Learning with Deep Convolutional Generative Adversarial Networks,https://www.reddit.com/r/MachineLearning/comments/3tykrw/unsupervised_representation_learning_with_deep/,r-sync,1448297774,,32,174,False,http://a.thumbs.redditmedia.com/6W8Jqr2HOYvfhRc4dSX_VVwBk6Dum_6cd4N4P2MXbo4.jpg,,,,,
605,MachineLearning,t5_2r3gv,2015-11-24,2015,11,24,2,3tynwl,youtube.com,David Silver (Google DeepMind) - Deep Reinforcement Learning,https://www.reddit.com/r/MachineLearning/comments/3tynwl/david_silver_google_deepmind_deep_reinforcement/,[deleted],1448298977,[deleted],0,0,False,default,,,,,
606,MachineLearning,t5_2r3gv,2015-11-24,2015,11,24,2,3tyrlh,self.MachineLearning,"Highlights from the IEEE International Conference on Data Mining, November 2015",https://www.reddit.com/r/MachineLearning/comments/3tyrlh/highlights_from_the_ieee_international_conference/,thvasilo,1448300366,"I had the chance to attend ICDM last week, so I did a small write-up where I included some of the interesting work I saw there, as well as summary of M.I. Jordan's keynote address.

You can read the whole thing here: http://tvas.me/conferences/2015/11/23/ICDM-2015-Highlights.html

If anyone else here attended I would love to hear your impressions, and specifically if someone attended Lada Adamic's keynote I'd like to see a summary, since I had to miss that.",2,2,False,self,,,,,
607,MachineLearning,t5_2r3gv,2015-11-24,2015,11,24,4,3tz4c3,self.MachineLearning,Input on rigorous online course,https://www.reddit.com/r/MachineLearning/comments/3tz4c3/input_on_rigorous_online_course/,justanotherta5,1448305306,"I find myself in the happy position of being in grad school, needing to take machine learning for my research, but the ML course is full and the elitist comp sci department won't add new slots for non-comp sci students. So my advisor has suggested that I enroll in a couple of research credits and teach myself through an online class. Hooray.

So I want something equally rigorous. I am looking at [Ng's Stanford lectures](https://www.youtube.com/watch?v=UzxYlbK2c7E&amp;list=PLA89DCFA6ADACE599), the Georgia Tech online computer science masters program machine learning course ([here on Udacity](https://www.udacity.com/course/machine-learning-supervised-learning--ud675)), [the CMU 10-701 course lectures taught by Tom Mitchell](https://scs.hosted.panopto.com/Panopto/Pages/Sessions/List.aspx?#folderID=%2285e1b6bf-6ac9-4a92-a0de-aaf8c2dd2418%22), or the [Caltech CS 156 course by Professor Yaser Abu-Mostafa](http://work.caltech.edu/telecourse.html).

I have a strong background in linear algebra, calculus (including matrix calculus), probability theory, and some topics particularly useful for ML like reproducing kernel hilbert spaces, so e.g. the Ng coursera course would be too shallow. What do you guys think?",7,1,False,self,,,,,
608,MachineLearning,t5_2r3gv,2015-11-24,2015,11,24,4,3tz5u4,self.MachineLearning,What are some good strategies for implementing a Trained Machine Learning Model into a Web App?,https://www.reddit.com/r/MachineLearning/comments/3tz5u4/what_are_some_good_strategies_for_implementing_a/,polyglotdev,1448305859,"I've trained some models and wanted to build them into a production application. 

What're some best practices? Is it better to leave everything on the server side and use API Calls from the fronted(this would be the obvious choice for something like KNN)? Or does it ever make since to write the prediction function in Javascript and then pass it the current set of weights to execute on the Client Side (if you're doing a single layer Neural Network)? And for Convolutional Neural Networks are those run ""offline"" and just added to the data model? 

Just wondering what are some strategies used in practice? ",1,1,False,self,,,,,
609,MachineLearning,t5_2r3gv,2015-11-24,2015,11,24,4,3tz633,arxiv.org,Uncovering Temporal Context for Video Question and Answering,https://www.reddit.com/r/MachineLearning/comments/3tz633/uncovering_temporal_context_for_video_question/,ffmpbgrnn,1448305968,,0,2,False,default,,,,,
610,MachineLearning,t5_2r3gv,2015-11-24,2015,11,24,4,3tz7ep,self.MachineLearning,Anyone interested in a study group for Andrew Ng's Machine Learning Coursera / Stanford class?,https://www.reddit.com/r/MachineLearning/comments/3tz7ep/anyone_interested_in_a_study_group_for_andrew_ngs/,sjforman,1448306476,[removed],5,0,False,default,,,,,
611,MachineLearning,t5_2r3gv,2015-11-24,2015,11,24,4,3tzczw,blog.shakirm.com,A Statistical View of Deep Learning,https://www.reddit.com/r/MachineLearning/comments/3tzczw/a_statistical_view_of_deep_learning/,alexeyr,1448308588,,0,4,False,http://b.thumbs.redditmedia.com/6E0YXUncXhFZE-HgC8IH7COjePvS20nr4P30WrcpyiU.jpg,,,,,
612,MachineLearning,t5_2r3gv,2015-11-24,2015,11,24,5,3tzf70,self.MachineLearning,Image classification using R and MXnet (MXNetR),https://www.reddit.com/r/MachineLearning/comments/3tzf70/image_classification_using_r_and_mxnet_mxnetr/,phunter_lau,1448309415,"A Shiny app for image classification using R (trust me, it is pretty fast, and yes this deep learning model runs in R) https://github.com/thirdwing/mxnet_shiny

To run it, the first step is installing MXnet https://github.com/dmlc/mxnet by following the installation guide http://mxnet.readthedocs.org/en/latest/build.html and the second step is, install MXnetR and mxnet_shiny like this http://imgur.com/rpDwtHo That is it!

After setup everything, the shiny app should look like this http://imgur.com/9QEzUbU Enjoy your R deep learning shiny app for classifying images. It is good at classifying types of dogs/cats (well, like other deep learning models), as well as other interesting stuff. 

Any suggestions please comment, and/or submit issues to https://github.com/dmlc/mxnet ",0,0,False,self,,,,,
613,MachineLearning,t5_2r3gv,2015-11-24,2015,11,24,5,3tzfve,quantitativemacro.com,Machine Learning for Finance [Universit Panthon-Assas],https://www.reddit.com/r/MachineLearning/comments/3tzfve/machine_learning_for_finance_universit/,gwulfs,1448309686,,1,6,False,default,,,,,
614,MachineLearning,t5_2r3gv,2015-11-24,2015,11,24,7,3u00l7,self.MachineLearning,Can someone guide me with PyBrain?,https://www.reddit.com/r/MachineLearning/comments/3u00l7/can_someone_guide_me_with_pybrain/,Robotronic777,1448317583,[removed],17,1,False,default,,,,,
615,MachineLearning,t5_2r3gv,2015-11-24,2015,11,24,8,3u08q4,self.MachineLearning,Mining of Massive Data Sets - Solutions Manual? [TLDR],https://www.reddit.com/r/MachineLearning/comments/3u08q4/mining_of_massive_data_sets_solutions_manual_tldr/,Hexzor2204,1448320905,"TLDR: need information on solution manual for data mining textbook.

I've been taking a course in data mining/machine learning and we have been using the free textbook from the stanford university courses described here.
http://www.mmds.org/
Its a great textbook with corresponding slides. However, I am stumped on one of the Exercises and the website alludes to a solutions manual but through all of my searching has turned up nothing. Does anyone have any idea where I could find it or have any other relevant info on the topic?

PS: My apologies for a not so interesting Machine Learning post...",0,0,False,self,,,,,
