,sbr,sbr_id,date,year,month,hour,day,id,domain,title,full_link,author,created,selftext,num_comments,score,over_18,thumbnail,media_provider,media_thumbnail,media_title,media_description,media_url
733,MachineLearning,t5_2r3gv,2017-11-15,2017,11,15,13,7d1s4f,github.com,"PyTorch Version of Visual Attribute Transfer Through Deep Image Analogy [P] Feedback, questions, Issues accepted!",https://www.reddit.com/r/MachineLearning/comments/7d1s4f/pytorch_version_of_visual_attribute_transfer/,harvey_slash,1510721622,,0,0,False,https://b.thumbs.redditmedia.com/FCDzI383kLMgb_Km1C_ekHnFbX2m8_ce1HacvZrRxHg.jpg,,,,,
734,MachineLearning,t5_2r3gv,2017-11-15,2017,11,15,13,7d1smj,frying-equipment.com,Continuous Frying Machine Manufacturer,https://www.reddit.com/r/MachineLearning/comments/7d1smj/continuous_frying_machine_manufacturer/,gelgoogmachinery,1510721796,,1,1,False,default,,,,,
735,MachineLearning,t5_2r3gv,2017-11-15,2017,11,15,15,7d254h,github.com,"A PyTorch Implementation of Densely Connected Convolutional Networks (DenseNets) Hello, this is my first github repository. I have implemented repository in PyTorch. This paper has won best paper award in CVPR 2017. I am looking forward for you feedback that can help to improve me.",https://www.reddit.com/r/MachineLearning/comments/7d254h/a_pytorch_implementation_of_densely_connected/,[deleted],1510725890,[deleted],0,1,False,default,,,,,
736,MachineLearning,t5_2r3gv,2017-11-15,2017,11,15,15,7d25og,self.MachineLearning,[D] In what tasks does deep/machine learning beat humans?,https://www.reddit.com/r/MachineLearning/comments/7d25og/d_in_what_tasks_does_deepmachine_learning_beat/,[deleted],1510726088,,0,1,True,default,,,,,
737,MachineLearning,t5_2r3gv,2017-11-15,2017,11,15,15,7d276q,self.MachineLearning,A PyTorch Implementation of Densely Connected Convolutional Networks (DenseNets),https://www.reddit.com/r/MachineLearning/comments/7d276q/a_pytorch_implementation_of_densely_connected/,[deleted],1510726594,,0,1,False,default,,,,,
738,MachineLearning,t5_2r3gv,2017-11-15,2017,11,15,16,7d2iap,youtube.com,[D] How autonomous weapons with AI could go bad.,https://www.reddit.com/r/MachineLearning/comments/7d2iap/d_how_autonomous_weapons_with_ai_could_go_bad/,LovaszExtension,1510730724,,71,60,False,https://b.thumbs.redditmedia.com/9z3O7-zJdLV5OG1wlm55bCDOARKW9Kbrks1zgXcQdJA.jpg,,,,,
739,MachineLearning,t5_2r3gv,2017-11-15,2017,11,15,17,7d2vk1,self.MachineLearning,[D] What would you include in a first ML course?,https://www.reddit.com/r/MachineLearning/comments/7d2vk1/d_what_would_you_include_in_a_first_ml_course/,NicolasGuacamole,1510736367,"Lets say youve been tasked with designing a first course in ML from scratch, naturally given were living in the year we are.

I was wondering what topics and what rough ordering people would consider to be most critical to include? Also any other special considerations that it would do well to note.",63,72,False,self,,,,,
740,MachineLearning,t5_2r3gv,2017-11-15,2017,11,15,19,7d35u7,self.MachineLearning,[D] Is 32x32 too small of an input image for training/evaluating/inferring an Age Recognition CNN?,https://www.reddit.com/r/MachineLearning/comments/7d35u7/d_is_32x32_too_small_of_an_input_image_for/,FantasyBorderline,1510740668,"I just realized it might be true - when shrinking an image, a lot of information would be lost.

Most of the papers I read about Age Recognition used 224x224, but I can't do it because I intend to use it for a mobile app.

Would 64x64 be enough?",18,4,False,self,,,,,
741,MachineLearning,t5_2r3gv,2017-11-15,2017,11,15,19,7d35yp,blog.kjamistan.com,[P] Towards Interpretable Reliable Models,https://www.reddit.com/r/MachineLearning/comments/7d35yp/p_towards_interpretable_reliable_models/,pmigdal,1510740712,,1,16,False,https://a.thumbs.redditmedia.com/7tF7RC-DPwAg2zlU9UG9CU8MTfb1oj8zBdnAxPu9cd0.jpg,,,,,
742,MachineLearning,t5_2r3gv,2017-11-15,2017,11,15,19,7d380k,arxiv.org,[1711.05195] A learning problem that is independent of the set theory ZFC axioms,https://www.reddit.com/r/MachineLearning/comments/7d380k/171105195_a_learning_problem_that_is_independent/,ihaphleas,1510741475,,0,1,False,default,,,,,
743,MachineLearning,t5_2r3gv,2017-11-15,2017,11,15,20,7d3f06,news.mit.edu,[R]President Reif: We must build a future in which technology works for everyone,https://www.reddit.com/r/MachineLearning/comments/7d3f06/rpresident_reif_we_must_build_a_future_in_which/,digitalson,1510744264,,0,1,False,default,,,,,
744,MachineLearning,t5_2r3gv,2017-11-15,2017,11,15,20,7d3hix,medium.com,Understanding Hintons Capsule Networks.,https://www.reddit.com/r/MachineLearning/comments/7d3hix/understanding_hintons_capsule_networks/,[deleted],1510745229,[deleted],0,1,False,default,,,,,
745,MachineLearning,t5_2r3gv,2017-11-15,2017,11,15,20,7d3hm7,developer.android.com,The new Neural Networks API in Android,https://www.reddit.com/r/MachineLearning/comments/7d3hm7/the_new_neural_networks_api_in_android/,fornwall,1510745265,,0,1,False,default,,,,,
746,MachineLearning,t5_2r3gv,2017-11-15,2017,11,15,20,7d3hna,blog.paralleldots.com,[N]Data Tagging in Medical Imaging - Diving Deep into the Processes,https://www.reddit.com/r/MachineLearning/comments/7d3hna/ndata_tagging_in_medical_imaging_diving_deep_into/,friscotime,1510745278,,0,1,False,default,,,,,
747,MachineLearning,t5_2r3gv,2017-11-15,2017,11,15,20,7d3jyn,medium.com,Understanding Hintons Capsule Networks.,https://www.reddit.com/r/MachineLearning/comments/7d3jyn/understanding_hintons_capsule_networks/,[deleted],1510746162,[deleted],0,1,False,default,,,,,
748,MachineLearning,t5_2r3gv,2017-11-15,2017,11,15,20,7d3lpq,research.google.com,[D] Machine Learning: The High Interest Credit Card of Technical Debt,https://www.reddit.com/r/MachineLearning/comments/7d3lpq/d_machine_learning_the_high_interest_credit_card/,_alphamaximus_,1510746856,,0,1,False,default,,,,,
749,MachineLearning,t5_2r3gv,2017-11-15,2017,11,15,21,7d3nk3,podcastinit.com,Testing Recommender Algorithms in Python with Surprise (Interview),https://www.reddit.com/r/MachineLearning/comments/7d3nk3/testing_recommender_algorithms_in_python_with/,[deleted],1510747467,[deleted],0,1,False,default,,,,,
750,MachineLearning,t5_2r3gv,2017-11-15,2017,11,15,21,7d3o90,podcastinit.com,[P] Testing Recommender Algorithms in Python with Surprise (Interview),https://www.reddit.com/r/MachineLearning/comments/7d3o90/p_testing_recommender_algorithms_in_python_with/,Niourf,1510747716,,0,2,False,https://b.thumbs.redditmedia.com/Ulqyp7xmM_O6A_7kJGC476QPIUIHiQzPxwV20zgdOCc.jpg,,,,,
751,MachineLearning,t5_2r3gv,2017-11-15,2017,11,15,21,7d3pau,noodles-machine.com,Curry Puffs Making Machine for Sale,https://www.reddit.com/r/MachineLearning/comments/7d3pau/curry_puffs_making_machine_for_sale/,liusherry,1510748086,,1,1,False,default,,,,,
752,MachineLearning,t5_2r3gv,2017-11-15,2017,11,15,21,7d3rjy,noodles-machine.com,Steamed Rice Roll Machine for Sale,https://www.reddit.com/r/MachineLearning/comments/7d3rjy/steamed_rice_roll_machine_for_sale/,liusherry,1510748873,,1,1,False,default,,,,,
753,MachineLearning,t5_2r3gv,2017-11-15,2017,11,15,21,7d3srp,self.MachineLearning,Association analysis for a binary target,https://www.reddit.com/r/MachineLearning/comments/7d3srp/association_analysis_for_a_binary_target/,renternainus,1510749291,[removed],0,1,False,default,,,,,
754,MachineLearning,t5_2r3gv,2017-11-15,2017,11,15,21,7d3ubs,medium.com,[D] Understanding Hintons Capsule Networks.,https://www.reddit.com/r/MachineLearning/comments/7d3ubs/d_understanding_hintons_capsule_networks/,aditya_arun,1510749850,,46,71,False,https://a.thumbs.redditmedia.com/5uty9B3YZjDdTOy0llOEbbIi-5smYdu8_Solh_rdcl8.jpg,,,,,
755,MachineLearning,t5_2r3gv,2017-11-15,2017,11,15,21,7d3x4g,github.com,deepLoco,https://www.reddit.com/r/MachineLearning/comments/7d3x4g/deeploco/,vivanov,1510750776,,0,1,False,default,,,,,
756,MachineLearning,t5_2r3gv,2017-11-15,2017,11,15,22,7d48gv,self.MachineLearning,Which Reinforcement Learning toolkit for autonomous driving would you suggest?,https://www.reddit.com/r/MachineLearning/comments/7d48gv/which_reinforcement_learning_toolkit_for/,[deleted],1510754190,,0,1,False,default,,,,,
757,MachineLearning,t5_2r3gv,2017-11-15,2017,11,15,23,7d49yy,developers.googleblog.com,[N] Announcing TensorFlow Lite - Google,https://www.reddit.com/r/MachineLearning/comments/7d49yy/n_announcing_tensorflow_lite_google/,MichaelRahmani,1510754624,,1,32,False,https://b.thumbs.redditmedia.com/QBzlFbr4OWJgmbop7fR7x-1h83Lutex9f245RkUwa_E.jpg,,,,,
758,MachineLearning,t5_2r3gv,2017-11-15,2017,11,15,23,7d4apq,dataprism.co,"[N] Data Prism: weekly newsletter about data science, ML, AI and analytics",https://www.reddit.com/r/MachineLearning/comments/7d4apq/n_data_prism_weekly_newsletter_about_data_science/,angelatina,1510754831,,0,1,False,https://b.thumbs.redditmedia.com/wpyY4Cx_3eeEYmPOzYxCeDjBoc02W484dlsuyFJ6zms.jpg,,,,,
759,MachineLearning,t5_2r3gv,2017-11-15,2017,11,15,23,7d4avr,self.MachineLearning,Which Reinforcement Learning toolkit for autonomous driving would you suggest?,https://www.reddit.com/r/MachineLearning/comments/7d4avr/which_reinforcement_learning_toolkit_for/,nonsingularmatrix,1510754872,[removed],0,1,False,default,,,,,
760,MachineLearning,t5_2r3gv,2017-11-15,2017,11,15,23,7d4m8p,arxiv.org,[R] Resurrecting the sigmoid in deep learning through dynamical isometry: theory and practice,https://www.reddit.com/r/MachineLearning/comments/7d4m8p/r_resurrecting_the_sigmoid_in_deep_learning/,XalosXandrez,1510757930,,7,35,False,default,,,,,
761,MachineLearning,t5_2r3gv,2017-11-16,2017,11,16,0,7d4u66,arxiv.org,[R] [1711.04994] Prediction Under Uncertainty with Error-Encoding Networks (FAIR),https://www.reddit.com/r/MachineLearning/comments/7d4u66/r_171104994_prediction_under_uncertainty_with/,fergbyrne,1510759924,,1,3,False,default,,,,,
762,MachineLearning,t5_2r3gv,2017-11-16,2017,11,16,0,7d4usn,v.redd.it,"water treatment aeration blowers manufacturer in China Shandong dacheng machinery technology co., ltd",https://www.reddit.com/r/MachineLearning/comments/7d4usn/water_treatment_aeration_blowers_manufacturer_in/,zqdicheng,1510760109,,0,1,False,default,,,,,
763,MachineLearning,t5_2r3gv,2017-11-16,2017,11,16,0,7d4z7m,arxiv.org,Using machine learning to redraw political boundaries in the US (and prevent gerrymandering),https://www.reddit.com/r/MachineLearning/comments/7d4z7m/using_machine_learning_to_redraw_political/,adamnhornsby,1510761163,,1,1,False,default,,,,,
764,MachineLearning,t5_2r3gv,2017-11-16,2017,11,16,0,7d4zxi,self.MachineLearning,"Simple Questions Thread November 15, 2017",https://www.reddit.com/r/MachineLearning/comments/7d4zxi/simple_questions_thread_november_15_2017/,AutoModerator,1510761341,[removed],0,1,False,default,,,,,
765,MachineLearning,t5_2r3gv,2017-11-16,2017,11,16,1,7d528r,self.MachineLearning,[R] Data Augmentation Generative Adversarial Networks,https://www.reddit.com/r/MachineLearning/comments/7d528r/r_data_augmentation_generative_adversarial/,AntreasAntoniou,1510761901,"Hello everyone,

Just wanted to present some of my recent work on meta-learning data augmentations from a source domain and applying them to a target domain to augment datasets in order to improve classifier generalization and one shot learning.

Arxiv link: https://arxiv.org/abs/1711.04340
Additional generated samples: https://twitter.com/_AntreasAntonio/status/930799155538251776",18,14,False,self,,,,,
766,MachineLearning,t5_2r3gv,2017-11-16,2017,11,16,1,7d54hh,youtube.com,how to learn machine learning and artificial intelligence in 3-6 months?,https://www.reddit.com/r/MachineLearning/comments/7d54hh/how_to_learn_machine_learning_and_artificial/,atcha1206,1510762437,,0,1,False,default,,,,,
767,MachineLearning,t5_2r3gv,2017-11-16,2017,11,16,1,7d57eb,self.MachineLearning,HAAR cascade for open/closed eyes,https://www.reddit.com/r/MachineLearning/comments/7d57eb/haar_cascade_for_openclosed_eyes/,mrpmorris,1510763156,[removed],0,1,False,default,,,,,
768,MachineLearning,t5_2r3gv,2017-11-16,2017,11,16,2,7d5gcs,self.MachineLearning,MY NEW BITCOIN ADDRESS 1664tJyMdUmhRKbeXho4kSUsVXzVcc5wYo,https://www.reddit.com/r/MachineLearning/comments/7d5gcs/my_new_bitcoin_address/,ankush32112,1510765341,[removed],1,1,False,default,,,,,
769,MachineLearning,t5_2r3gv,2017-11-16,2017,11,16,2,7d5htz,self.MachineLearning,[D] Where do you get our info of whats happening with AI form industry(especially startups)?,https://www.reddit.com/r/MachineLearning/comments/7d5htz/d_where_do_you_get_our_info_of_whats_happening/,spartan12321,1510765681,"This subreddit seem good page to follow AI research and general discussion, but is there any page I can get news about development of AI in industry and about AI startups. Until now I just searched AI related articles on blooberg etc., but is there better solution?",5,6,False,self,,,,,
770,MachineLearning,t5_2r3gv,2017-11-16,2017,11,16,2,7d5joq,self.MachineLearning,[D] LSTM for Automated Data Quality Control,https://www.reddit.com/r/MachineLearning/comments/7d5joq/d_lstm_for_automated_data_quality_control/,dumbAI,1510766086,"I am about to begin a project to automate data quality control (QC) and am requesting feedback/resources on applying AI to this problem. 

Scope: management wants automated QC of data dumps that occur monthly so that manual reviews are no longer required. That's really all I have to go on.

The data: Time series (monthly), approx. 100 variables, with hundreds of millions of training examples going back decades. Data dumps occur monthly with a few million observations.

My thoughts: Train a LSTM on historical data and generate predictions/confidence intervals for current month load, and flag data that are out the interval.

I have looked for research on applying deep learning to data quality problems and haven't found much, mostly applying older algorithms to do anomaly detection. A few more recent papers I found:
[MRI data QC and SVM/Gradient Boosted Trees](https://arxiv.org/pdf/1707.06353.pdf)

[Salary data QC, comparing MLP, CNN, SVM, and regression models](https://www.researchgate.net/publication/318601321_Improving_Data_Quality_Through_Deep_Learning_and_Statistical_Models)

Is an LSTM something I can use for this problem, and does anyone know of any research applying LSTMs to data quality problems?",3,1,False,self,,,,,
771,MachineLearning,t5_2r3gv,2017-11-16,2017,11,16,2,7d5jxg,self.MachineLearning,Is there a way to train models on a blockchain?,https://www.reddit.com/r/MachineLearning/comments/7d5jxg/is_there_a_way_to_train_models_on_a_blockchain/,HarambeTownley,1510766146,[removed],0,1,False,default,,,,,
772,MachineLearning,t5_2r3gv,2017-11-16,2017,11,16,2,7d5mb4,arxiv.org,[R] Fixing Weight Decay Regularization in Adam,https://www.reddit.com/r/MachineLearning/comments/7d5mb4/r_fixing_weight_decay_regularization_in_adam/,[deleted],1510766695,[deleted],0,1,False,default,,,,,
773,MachineLearning,t5_2r3gv,2017-11-16,2017,11,16,2,7d5mpc,arxiv.org,[1711.05101] Fixing Weight Decay Regularization in Adam,https://www.reddit.com/r/MachineLearning/comments/7d5mpc/171105101_fixing_weight_decay_regularization_in/,[deleted],1510766783,[deleted],1,1,False,default,,,,,
774,MachineLearning,t5_2r3gv,2017-11-16,2017,11,16,2,7d5qob,arxiv.org,[R] [1711.05101] Fixing Weight Decay Regularization in Adam,https://www.reddit.com/r/MachineLearning/comments/7d5qob/r_171105101_fixing_weight_decay_regularization_in/,robintibor,1510767703,,9,41,False,default,,,,,
775,MachineLearning,t5_2r3gv,2017-11-16,2017,11,16,2,7d5rrj,research.googleblog.com,[D] On-Device Conversational Modeling with TensorFlow Lite,https://www.reddit.com/r/MachineLearning/comments/7d5rrj/d_ondevice_conversational_modeling_with/,Jackal008,1510767969,,1,2,False,https://b.thumbs.redditmedia.com/a3M5cfKj8HH1AycFUQN6ZTvx1FVG2kWZVNSj2UQQy9w.jpg,,,,,
776,MachineLearning,t5_2r3gv,2017-11-16,2017,11,16,3,7d60u3,self.MachineLearning,How do you properly load models (ckpts) in Tensorflow (Python) to resume training? [Discussion],https://www.reddit.com/r/MachineLearning/comments/7d60u3/how_do_you_properly_load_models_ckpts_in/,Moondra2017,1510769973,"This is something that is giving me a hard time.

There seems to be a different ways. 

I see some blogs using the `.get_checkpoint_state`,

which I tried, but I couldn't properly load my global step.


`NotFoundError (see above for traceback): Key global_step_1 not found in checkpoint`

However, the weights were loaded properly. 

The other way I see is to look at all the nodes with 
`for op in tf.get_default_graph().get_operations():
  print(op.values, '\n')`

And then activiate(?) those nodes within the current graph as such:

accuracy = tf.get_default_graph().get_tensor_by_name('Accuracy/Mean:0')


However, there are so many similar nodes (All have the Accuracy base name), I'm not entirely sure which one I am supposed to load. 

I made a long question on SO, but I don't really get many responses on SO when it comes to tensorflow(everything else is lightning quick). 

Here is my post:

https://stackoverflow.com/questions/47299378/correctly-loading-a-model-to-resume-training-meta-graph-ckpts

What is the correct way to use ckpts to load models?


I'm mainly interested in computer vision tasks and RL with Python, so not sure if I should move to another framework that is easier to use.

I want to build my own custom NNs as well as use a lot of pre-trained models. 




Thank you. 

",4,0,False,self,,,,,
777,MachineLearning,t5_2r3gv,2017-11-16,2017,11,16,3,7d62cw,arxiv.org,[R] Anytime Neural Network: a Versatile Trade-off Between Computation and Accuracy,https://www.reddit.com/r/MachineLearning/comments/7d62cw/r_anytime_neural_network_a_versatile_tradeoff/,xternalz,1510770325,,0,7,False,default,,,,,
778,MachineLearning,t5_2r3gv,2017-11-16,2017,11,16,3,7d62q9,research.googleblog.com,[P] SLING: A Natural Language Frame Semantic Parser,https://www.reddit.com/r/MachineLearning/comments/7d62q9/p_sling_a_natural_language_frame_semantic_parser/,alxndrkalinin,1510770417,,3,23,False,https://b.thumbs.redditmedia.com/PHk0g7JWeB-Fu7tmwKgImxoWfR2mbQArm2MNo1g5h2U.jpg,,,,,
779,MachineLearning,t5_2r3gv,2017-11-16,2017,11,16,4,7d6c13,github.com,AI Consulting Contract,https://www.reddit.com/r/MachineLearning/comments/7d6c13/ai_consulting_contract/,zthoutt,1510772548,,0,1,False,default,,,,,
780,MachineLearning,t5_2r3gv,2017-11-16,2017,11,16,4,7d6dkw,self.MachineLearning,"[D] Should we introduce an ""Inaccurate""/""Misleading"" tag for posts?",https://www.reddit.com/r/MachineLearning/comments/7d6dkw/d_should_we_introduce_an_inaccuratemisleading_tag/,olaf_nij,1510772873,"As a moderator, simply removing a post doesn't seem to curb the amount self-promotion and inaccurate submissions that continue to crop up. This is mainly because these posts come from a different author each time.

There's no incentive to not post since there will be some amount of visibility before it gets removed. To disincentivize these types of posts, should we introduce ""Inaccurate"" and ""Misleading"" tags to inform the community that the post could be misleading. The author can appeal this tag with the moderators, but it will be at our discretion whether it will be removed or not.
",42,291,False,self,,,,,
781,MachineLearning,t5_2r3gv,2017-11-16,2017,11,16,4,7d6jhf,self.MachineLearning,ValueError: setting an array element with a sequence - When trying to feed list into placeholder in feed_dict,https://www.reddit.com/r/MachineLearning/comments/7d6jhf/valueerror_setting_an_array_element_with_a/,bgshishir1994,1510774247,[removed],0,1,False,default,,,,,
782,MachineLearning,t5_2r3gv,2017-11-16,2017,11,16,4,7d6jlq,self.MachineLearning,Get your GPU accelerated cloud platform - Paperspace referral code,https://www.reddit.com/r/MachineLearning/comments/7d6jlq/get_your_gpu_accelerated_cloud_platform/,prawtutorial7,1510774274,[removed],0,1,False,default,,,,,
783,MachineLearning,t5_2r3gv,2017-11-16,2017,11,16,5,7d6z7i,arxiv.org,[R] [1711.02017] NeST: A Neural Network Synthesis Tool Based on a Grow-and-Prune Paradigm,https://www.reddit.com/r/MachineLearning/comments/7d6z7i/r_171102017_nest_a_neural_network_synthesis_tool/,bobchennan,1510777925,,6,12,False,default,,,,,
784,MachineLearning,t5_2r3gv,2017-11-16,2017,11,16,5,7d6zz3,youtube.com,YOLO Object Detection,https://www.reddit.com/r/MachineLearning/comments/7d6zz3/yolo_object_detection/,funmaster11,1510778106,,0,1,False,default,,,,,
785,MachineLearning,t5_2r3gv,2017-11-16,2017,11,16,6,7d7a82,databricks.com,A Technical Overview of Azure Databricks,https://www.reddit.com/r/MachineLearning/comments/7d7a82/a_technical_overview_of_azure_databricks/,dmatrixjsd,1510780476,,0,1,False,default,,,,,
786,MachineLearning,t5_2r3gv,2017-11-16,2017,11,16,6,7d7ge0,github.com,[N] Numpy dropping Python 2.7,https://www.reddit.com/r/MachineLearning/comments/7d7ge0/n_numpy_dropping_python_27/,bobchennan,1510781929,,108,375,False,https://b.thumbs.redditmedia.com/MIs4jh87GSlsia9zWgnWCUEjEKRnzTPh8X3SoA9TeUw.jpg,,,,,
787,MachineLearning,t5_2r3gv,2017-11-16,2017,11,16,8,7d8aad,arxiv.org,[R] [1711.04325] Extremely Large Minibatch SGD: Training ResNet-50 on ImageNet in 15 Minutes,https://www.reddit.com/r/MachineLearning/comments/7d8aad/r_171104325_extremely_large_minibatch_sgd/,shoheihido,1510789411,,24,12,False,default,,,,,
788,MachineLearning,t5_2r3gv,2017-11-16,2017,11,16,9,7d8ews,stanfordmlgroup.github.io,CheXNet: Radiologist-Level Pneumonia Detection on Chest X-Rays with Deep Learning,https://www.reddit.com/r/MachineLearning/comments/7d8ews/chexnet_radiologistlevel_pneumonia_detection_on/,SuperFX,1510790604,,10,10,False,default,,,,,
789,MachineLearning,t5_2r3gv,2017-11-16,2017,11,16,9,7d8oh3,arxiv.org,[R] [1711.05225] CheXNet: Radiologist-Level Pneumonia Detection on Chest X-Rays with Deep Learning,https://www.reddit.com/r/MachineLearning/comments/7d8oh3/r_171105225_chexnet_radiologistlevel_pneumonia/,iownaredball,1510793062,,17,6,False,default,,,,,
790,MachineLearning,t5_2r3gv,2017-11-16,2017,11,16,9,7d8qsq,aaronsadventures.blogspot.com,Statistical and Individual Fairness in Machine Learning,https://www.reddit.com/r/MachineLearning/comments/7d8qsq/statistical_and_individual_fairness_in_machine/,[deleted],1510793676,[deleted],0,1,False,default,,,,,
791,MachineLearning,t5_2r3gv,2017-11-16,2017,11,16,9,7d8rnb,chris-chris.ai,StarCraft2 pysc2 RL Tutorial 2: Observations,https://www.reddit.com/r/MachineLearning/comments/7d8rnb/starcraft2_pysc2_rl_tutorial_2_observations/,[deleted],1510793920,[deleted],0,1,False,default,,,,,
792,MachineLearning,t5_2r3gv,2017-11-16,2017,11,16,9,7d8rqf,self.MachineLearning,Shape recognition w/o learning,https://www.reddit.com/r/MachineLearning/comments/7d8rqf/shape_recognition_wo_learning/,[deleted],1510793941,,0,1,False,default,,,,,
793,MachineLearning,t5_2r3gv,2017-11-16,2017,11,16,10,7d8utl,aaronsadventures.blogspot.com,[R] Statistical and Individual Fairness in Machine Learning,https://www.reddit.com/r/MachineLearning/comments/7d8utl/r_statistical_and_individual_fairness_in_machine/,MagnesiumCarbonate,1510794765,,2,5,False,default,,,,,
794,MachineLearning,t5_2r3gv,2017-11-16,2017,11,16,10,7d9232,self.MachineLearning,[R] Shape Recognition w/o Learning,https://www.reddit.com/r/MachineLearning/comments/7d9232/r_shape_recognition_wo_learning/,egladysh,1510796772,"Recently, I was looking for a way to score simple shapes (ideal and not ideal) in terms of their resemblance to a key shape like a square, circle, line, etc.. I could not find anything simple and reliable. So I put something very simple together that seems to work quite well but I am not sure if I am inventing the wheel here. See details, https://github.com/egladysh/shadow/blob/master/doc/article.pdf

Perhaps combining it with some ML would make it even better...
",6,10,False,self,,,,,
795,MachineLearning,t5_2r3gv,2017-11-16,2017,11,16,10,7d92h8,chris-chris.ai,[P] Deepmind's StarCraft II RL Tutorial 2: Observation,https://www.reddit.com/r/MachineLearning/comments/7d92h8/p_deepminds_starcraft_ii_rl_tutorial_2_observation/,sjhshy,1510796873,,3,28,False,https://a.thumbs.redditmedia.com/q8MS1EhsqgtIzC8fAzx2UQ27Fr9-rjC175CuSI9jLu0.jpg,,,,,
796,MachineLearning,t5_2r3gv,2017-11-16,2017,11,16,10,7d9315,self.MachineLearning,[D] RNADE vs MDR vs BART vs Bayesian Linear Regression,https://www.reddit.com/r/MachineLearning/comments/7d9315/d_rnade_vs_mdr_vs_bart_vs_bayesian_linear/,m1sta,1510797026,"Hi all,

I'm looking at a collection of problems where I need to forecast the probability of a continuous variable. My dependent variables are a combination of categorical and continuous. It looks like there are four primary candidate areas I should be reviewing and/or testing. Can anyone here shed any light on the relative strengths and risks associated with each of RNADE, Mixture Density Networks, Bayesian Additive Regression Trees, and standard Bayesian Linear Regression?
",1,5,False,self,,,,,
797,MachineLearning,t5_2r3gv,2017-11-16,2017,11,16,10,7d931c,qubole.com,[R] Distributed Deep Learning with Keras on Apache Spark,https://www.reddit.com/r/MachineLearning/comments/7d931c/r_distributed_deep_learning_with_keras_on_apache/,Lekter,1510797029,,0,12,False,default,,,,,
798,MachineLearning,t5_2r3gv,2017-11-16,2017,11,16,11,7d9b8o,tanpham.org,"Scrape the web : get data from amazon, airbnb, reddit, pexel, steam",https://www.reddit.com/r/MachineLearning/comments/7d9b8o/scrape_the_web_get_data_from_amazon_airbnb_reddit/,tanphamvan,1510799340,,0,1,False,default,,,,,
799,MachineLearning,t5_2r3gv,2017-11-16,2017,11,16,11,7d9ch1,self.MachineLearning,CPUs or GPUs for deploying models to production?,https://www.reddit.com/r/MachineLearning/comments/7d9ch1/cpus_or_gpus_for_deploying_models_to_production/,zbnone,1510799676,[removed],0,1,False,default,,,,,
