,sbr,sbr_id,date,year,month,hour,day,id,domain,title,full_link,author,created,selftext,num_comments,score,over_18,thumbnail,media_provider,media_thumbnail,media_title,media_description,media_url
368,MachineLearning,t5_2r3gv,2017-11-8,2017,11,8,14,7bjec4,arxiv.org,"[R] Unsupervised Machine Translation using monolingual corpora only by FAIR ( Takes sentences from monolingual corpora in two different languages, reports BLEU scores up to 32.8, without using even a single parallel sentence at training time.)",https://www.reddit.com/r/MachineLearning/comments/7bjec4/r_unsupervised_machine_translation_using/,rishabh135,1510120260,,9,13,False,default,,,,,
369,MachineLearning,t5_2r3gv,2017-11-8,2017,11,8,14,7bjedl,self.MachineLearning,How to program neural networks with sparse connections,https://www.reddit.com/r/MachineLearning/comments/7bjedl/how_to_program_neural_networks_with_sparse/,Kirkland_Light,1510120275,[removed],0,1,False,default,,,,,
370,MachineLearning,t5_2r3gv,2017-11-8,2017,11,8,15,7bjlba,self.MachineLearning,What is the latest state of the art for 2D object detection with only a single training image?,https://www.reddit.com/r/MachineLearning/comments/7bjlba/what_is_the_latest_state_of_the_art_for_2d_object/,kuwt,1510122824,[removed],0,1,False,default,,,,,
371,MachineLearning,t5_2r3gv,2017-11-8,2017,11,8,15,7bjmgi,hi.cs.waseda.ac.jp,Globally and Locally Consistent Image Completion,https://www.reddit.com/r/MachineLearning/comments/7bjmgi/globally_and_locally_consistent_image_completion/,[deleted],1510123287,[deleted],0,1,False,default,,,,,
372,MachineLearning,t5_2r3gv,2017-11-8,2017,11,8,15,7bjmij,hi.cs.waseda.ac.jp,[R] Globally and Locally Consistent Image Completion,https://www.reddit.com/r/MachineLearning/comments/7bjmij/r_globally_and_locally_consistent_image_completion/,Reiinakano,1510123315,,6,80,False,https://b.thumbs.redditmedia.com/ArrgbFzGvCPGQAXCjGPw7vKuKNu_tYFo2wCS1a8FCrQ.jpg,,,,,
373,MachineLearning,t5_2r3gv,2017-11-8,2017,11,8,16,7bjrg3,rilonwelding.co.in,"Rilon Welding | Machinery-Coimbatore-Dealers | Suppliers-Tamil Nadu,India | Rilon TIG | Rilon MIG | Rilon Plasma | Rilon Arc Welding",https://www.reddit.com/r/MachineLearning/comments/7bjrg3/rilon_welding_machinerycoimbatoredealers/,rilonwelding,1510125238,,0,1,False,default,,,,,
374,MachineLearning,t5_2r3gv,2017-11-8,2017,11,8,17,7bk18z,thetechnologygeek.org,Preventing Hacking and Impersonation with Machine Learning,https://www.reddit.com/r/MachineLearning/comments/7bk18z/preventing_hacking_and_impersonation_with_machine/,poojagandhi456,1510129342,,0,1,False,default,,,,,
375,MachineLearning,t5_2r3gv,2017-11-8,2017,11,8,17,7bk4ac,self.MachineLearning,"Hello guys,",https://www.reddit.com/r/MachineLearning/comments/7bk4ac/hello_guys/,Mahar0627,1510130828,[removed],0,1,False,default,,,,,
376,MachineLearning,t5_2r3gv,2017-11-8,2017,11,8,18,7bk8ia,noodlesmake.com,Automatic fresh noodle maker machine for sale,https://www.reddit.com/r/MachineLearning/comments/7bk8ia/automatic_fresh_noodle_maker_machine_for_sale/,liusherry,1510132788,,1,1,False,default,,,,,
377,MachineLearning,t5_2r3gv,2017-11-8,2017,11,8,18,7bka2o,github.com,[P] In order to understand Neural Networks I built a simple NN that solves XOR's from scratch in C++,https://www.reddit.com/r/MachineLearning/comments/7bka2o/p_in_order_to_understand_neural_networks_i_built/,[deleted],1510133501,[deleted],0,0,False,default,,,,,
378,MachineLearning,t5_2r3gv,2017-11-8,2017,11,8,18,7bkb30,noodlesmake.com,Automatic Dry Noodle Making Machine With 9 Rollers,https://www.reddit.com/r/MachineLearning/comments/7bkb30/automatic_dry_noodle_making_machine_with_9_rollers/,liusherry,1510133945,,1,1,False,default,,,,,
379,MachineLearning,t5_2r3gv,2017-11-8,2017,11,8,19,7bkhq4,self.MachineLearning,Advice needed: Methods to predict Bitcoin Price using Google Search Volume Data,https://www.reddit.com/r/MachineLearning/comments/7bkhq4/advice_needed_methods_to_predict_bitcoin_price/,thu-trang,1510136716,[removed],0,1,False,default,,,,,
380,MachineLearning,t5_2r3gv,2017-11-8,2017,11,8,19,7bkj99,self.MachineLearning,Learn to rank implementation in python,https://www.reddit.com/r/MachineLearning/comments/7bkj99/learn_to_rank_implementation_in_python/,ritterkonig,1510137385,[removed],0,1,False,default,,,,,
381,MachineLearning,t5_2r3gv,2017-11-8,2017,11,8,20,7bkt8o,fugenx.com,How Machine Learning and AI can take your business to the next level,https://www.reddit.com/r/MachineLearning/comments/7bkt8o/how_machine_learning_and_ai_can_take_your/,stewartcristan,1510141623,,0,1,False,default,,,,,
382,MachineLearning,t5_2r3gv,2017-11-8,2017,11,8,20,7bku9k,self.MachineLearning,Starting at zero!,https://www.reddit.com/r/MachineLearning/comments/7bku9k/starting_at_zero/,pos123,1510142023,[removed],0,1,False,default,,,,,
383,MachineLearning,t5_2r3gv,2017-11-8,2017,11,8,21,7bkw5j,self.MachineLearning,[D] How to interpret topics from LSI in Gensim?,https://www.reddit.com/r/MachineLearning/comments/7bkw5j/d_how_to_interpret_topics_from_lsi_in_gensim/,trias10,1510142760,"I have been doing topic modeling with LDA in Gensim for a while now, but have decided to move to the SVD approach in LSI for speed (LDA is just way too slow).

My question is, once you fit an LSI model to a tf-idf corpus (using Gensim for example), how exactly are you supposed to interpret the individual topics? For example, both LdaModel and LsiModel classes in Gensim have the show_topic(topic_number, topn) method which prints out a fitted topic along with the topn words which make up that topic, and their weights. In LDA, these weights come from the Dirichlet MLE, so represent a probability distribution over words in that topic, and each weight is positive, and the total sum should be 1.

However, the same show_topic() output for an LsiModel is not based on a probability distribution, and in fact, looking at the individual word weights for show_topic, there are usually loads of negative weights associated to some words for a particular topic. I'm not sure how to interpret these values, as they are clearly not weights. Are they eigenvalues of a sort? And more importantly, can I still interpret the output from show_topic() under LSI the same way I interpret it from LDA? It doesn't seem to me that it is creating proper topics as robust as LDA.",0,5,False,self,,,,,
384,MachineLearning,t5_2r3gv,2017-11-8,2017,11,8,21,7bkzrn,github.com,Tutorial version of CapsNet in PyTorch,https://www.reddit.com/r/MachineLearning/comments/7bkzrn/tutorial_version_of_capsnet_in_pytorch/,laubonghaudoi,1510144037,,0,1,False,default,,,,,
385,MachineLearning,t5_2r3gv,2017-11-8,2017,11,8,21,7bl1a1,m.youtube.com,See HOW Error Optimization works in Machine Learning. Part to of the Error Optimization series.,https://www.reddit.com/r/MachineLearning/comments/7bl1a1/see_how_error_optimization_works_in_machine/,harshMachineLearning,1510144571,,0,1,False,default,,,,,
386,MachineLearning,t5_2r3gv,2017-11-8,2017,11,8,22,7bl70a,self.MachineLearning,[D] What are some seemingly magical applications of Machine Learning?,https://www.reddit.com/r/MachineLearning/comments/7bl70a/d_what_are_some_seemingly_magical_applications_of/,villasv,1510146494,"I'm doing a small tech talk about Clarke's Third Law (sufficiently advanced tech is indistinguishable from magic) and I've been collecting a few examples.

Some notable ones come from the AR/VR world, but a few ones like Video Style Transfer with CycleGAN and Video Impersonation with Face2Face are quite noteworthy.

What other impressive results from the ML field make you feel like you're seeing magic happening?
",20,33,False,self,,,,,
387,MachineLearning,t5_2r3gv,2017-11-8,2017,11,8,22,7blakn,self.MachineLearning,kenza - continuous integration for machine learning,https://www.reddit.com/r/MachineLearning/comments/7blakn/kenza_continuous_integration_for_machine_learning/,pm3310,1510147664,[removed],0,1,False,default,,,,,
388,MachineLearning,t5_2r3gv,2017-11-8,2017,11,8,23,7blhax,github.com,"[P] Visualization of high dimensional dataset, for data scientists",https://www.reddit.com/r/MachineLearning/comments/7blhax/p_visualization_of_high_dimensional_dataset_for/,0011001011,1510149733,,6,25,False,https://b.thumbs.redditmedia.com/xiDp6mf0JiSoivbyeRZMnQ4qt35ctRu86W-3iK_q8Js.jpg,,,,,
389,MachineLearning,t5_2r3gv,2017-11-8,2017,11,8,23,7bllii,youtube.com,Glass bottle washing filling and capping 3-in-1 mono-block machine for l...,https://www.reddit.com/r/MachineLearning/comments/7bllii/glass_bottle_washing_filling_and_capping_3in1/,hymachinery,1510150908,,0,1,False,default,,,,,
390,MachineLearning,t5_2r3gv,2017-11-8,2017,11,8,23,7blm7d,medium.com,Causal inference with pandas dataframes,https://www.reddit.com/r/MachineLearning/comments/7blm7d/causal_inference_with_pandas_dataframes/,akelleh,1510151099,,0,3,False,default,,,,,
391,MachineLearning,t5_2r3gv,2017-11-8,2017,11,8,23,7blmfw,self.MachineLearning,Is anyone training G. E. Hinton's new capsule network on the ImageNet dataset?,https://www.reddit.com/r/MachineLearning/comments/7blmfw/is_anyone_training_g_e_hintons_new_capsule/,Barney6,1510151175,[removed],1,2,False,default,,,,,
392,MachineLearning,t5_2r3gv,2017-11-8,2017,11,8,23,7bln21,nybles.iiita.ac.in,Interview with Ian Goodfellow,https://www.reddit.com/r/MachineLearning/comments/7bln21/interview_with_ian_goodfellow/,[deleted],1510151350,[deleted],0,1,False,default,,,,,
393,MachineLearning,t5_2r3gv,2017-11-8,2017,11,8,23,7blspx,news.mit.edu,"[R]Summit discusses impact of machines on jobs, productivity, and the global economy",https://www.reddit.com/r/MachineLearning/comments/7blspx/rsummit_discusses_impact_of_machines_on_jobs/,jackblun,1510152933,,0,1,False,default,,,,,
394,MachineLearning,t5_2r3gv,2017-11-9,2017,11,9,0,7bltrc,youtube.com,General-purpose Round Bottle Labeling Machine for Vitamin E Emulsion Lab...,https://www.reddit.com/r/MachineLearning/comments/7bltrc/generalpurpose_round_bottle_labeling_machine_for/,hymachinery,1510153213,,0,1,False,default,,,,,
395,MachineLearning,t5_2r3gv,2017-11-9,2017,11,9,0,7blw2i,experfy.com,Useful infographic describing linear regression analysis,https://www.reddit.com/r/MachineLearning/comments/7blw2i/useful_infographic_describing_linear_regression/,[deleted],1510153761,[deleted],0,1,False,default,,,,,
396,MachineLearning,t5_2r3gv,2017-11-9,2017,11,9,0,7bly4n,self.MachineLearning,[D] Can someone explain the error metric reported in this paper?,https://www.reddit.com/r/MachineLearning/comments/7bly4n/d_can_someone_explain_the_error_metric_reported/,Writes_A_Bit,1510154319,"https://arxiv.org/pdf/1609.01596v1.pdf

In Table 3 on page 7. The training error on CIFAR-100 is reported as 0.1% for a ConvNet, but test error is as high as 69%. 
How is backprop on a convnet doing so badly at classifying images, especially when training error is so low? Is this not overfitting? 

Seems like all three methods described for that ConvNet are over-fitting. While I understand that the point is to show that the three methods perform roughly equally well, I'm curious why there is so much overfitting. 

Similarly, for one of the models in that table, training error is 77%. That seems like a bad result to include, but I'm guessing the point was to show that the feedback alignment method is doing as well as backprop... ?",6,1,False,self,,,,,
397,MachineLearning,t5_2r3gv,2017-11-9,2017,11,9,0,7blyc0,i.redd.it,Useful Infographic Describing Linear Regression,https://www.reddit.com/r/MachineLearning/comments/7blyc0/useful_infographic_describing_linear_regression/,jkimbigdata,1510154378,,0,1,False,default,,,,,
398,MachineLearning,t5_2r3gv,2017-11-9,2017,11,9,0,7bm4b2,self.MachineLearning,[D] What is the current state of dropout as Bayesian approximation?,https://www.reddit.com/r/MachineLearning/comments/7bm4b2/d_what_is_the_current_state_of_dropout_as/,sschoener,1510155927,"Some time ago already, Gal &amp; Ghahramani published their [Dropout as Bayesian Approximation](https://arxiv.org/abs/1506.02142) paper, and a few more follow-up papers by Gal and colleagues about epistemic vs. aleatoric risks etc. There they claim that test-time dropout can be seen as Bayesian approximation to a Gaussian process related to the original network. (I would not claim to understand the proof in all of its details.)
So far so good, but at the Bayesian DL workshop at NIPS2016 Ian Osband of Google DeepMind published his note [Risk versus Uncertainty in Deep Learning: Bayes, Bootstrap and the Dangers of Dropout](http://bayesiandeeplearning.org/2016/papers/BDL_4.pdf), where he claims that even for absurdly simple networks you can analytically show that the 'posterior' you get using MC dropout doesn't concentrate asymptotically. Which I take as saying that there's no Bayesian approximation happening, since almost any reasonable prior on the weights should lead to a near-certain posterior in the limit of infinite data.

Alas, there are still papers popping up using the MC dropout approach, without even mentioning Osband's note.
Did I miss something? Is there a follow-up to Osband's note? A rebuttal?
I didn't attend NIPS2016, and I am thus not aware of any discussions that might have happened there, but would certainly appreciate any pointers (-- and given that Yarin Gal was co-organizing that workshop, I am pretty sure that he has seen Osband's note).

Edit:
For completeness, here is [Yarin Gal's thesis](http://www.cs.ox.ac.uk/people/yarin.gal/website/blog_2248.html) on this topic and [the appendix to their 2015 paper](https://arxiv.org/abs/1506.02157) containing the proof.
Additionally, the supplementary material (section A) of [Deep Exploration via Bootstrapped DQN](https://papers.nips.cc/paper/6501-deep-exploration-via-bootstrapped-dqn) contains some more of Ian's thoughts on this issue",39,44,False,self,,,,,
399,MachineLearning,t5_2r3gv,2017-11-9,2017,11,9,0,7bm6sy,self.MachineLearning,"Simple Questions Thread November 08, 2017",https://www.reddit.com/r/MachineLearning/comments/7bm6sy/simple_questions_thread_november_08_2017/,AutoModerator,1510156540,[removed],0,1,False,default,,,,,
400,MachineLearning,t5_2r3gv,2017-11-9,2017,11,9,1,7bm8t2,blog.boltiot.com,"Machine Learning and the Internet of Things. Read how they both work together in this blog by the team who created the 'Bolt IoT Platform, made for Machine Learning.'",https://www.reddit.com/r/MachineLearning/comments/7bm8t2/machine_learning_and_the_internet_of_things_read/,ppv999,1510157009,,0,1,False,default,,,,,
401,MachineLearning,t5_2r3gv,2017-11-9,2017,11,9,1,7bmkun,arxiv.org,[R] Cortical microcircuits as gated-recurrent neural networks,https://www.reddit.com/r/MachineLearning/comments/7bmkun/r_cortical_microcircuits_as_gatedrecurrent_neural/,visarga,1510159948,,26,11,False,default,,,,,
402,MachineLearning,t5_2r3gv,2017-11-9,2017,11,9,2,7bmmtd,aws.amazon.com,[R] AWS Collaborates with Emory University to Develop Cloud-Based NLP Research Platform Using Apache MXNet,https://www.reddit.com/r/MachineLearning/comments/7bmmtd/r_aws_collaborates_with_emory_university_to/,ydereky,1510160427,,0,0,False,https://b.thumbs.redditmedia.com/tkaQMOpodF4K7WqfATof7U1ZDZJHhQB2C037uqufaaQ.jpg,,,,,
403,MachineLearning,t5_2r3gv,2017-11-9,2017,11,9,2,7bmswa,github.com,[P] Alpha pooling for fine-grained recognition (code),https://www.reddit.com/r/MachineLearning/comments/7bmswa/p_alpha_pooling_for_finegrained_recognition_code/,MarcelSimon,1510161806,,2,6,False,https://a.thumbs.redditmedia.com/MeMG7s3t-3HK5jvvhZpV3nqt5cOa-0kjDXM3y0v3Xj8.jpg,,,,,
404,MachineLearning,t5_2r3gv,2017-11-9,2017,11,9,2,7bmu95,tvmlang.org,[P] Remote Profile and Test Deep Learning Cross Compilation on Mobile Phones with TVM RPC,https://www.reddit.com/r/MachineLearning/comments/7bmu95/p_remote_profile_and_test_deep_learning_cross/,javelinjs,1510162123,,0,7,False,https://b.thumbs.redditmedia.com/JC9dTK3b9svPk7233NNyCrjC-BKKoWfHJIifrNxdC9o.jpg,,,,,
405,MachineLearning,t5_2r3gv,2017-11-9,2017,11,9,2,7bmxff,medium.com,Here's my story how you can change gender or race on your selfie with GANs,https://www.reddit.com/r/MachineLearning/comments/7bmxff/heres_my_story_how_you_can_change_gender_or_race/,johnkorn,1510162877,,0,2,False,default,,,,,
406,MachineLearning,t5_2r3gv,2017-11-9,2017,11,9,2,7bn0wj,self.MachineLearning,Machine Learning Cheatsheet - Styled After Pytorch Documentation),https://www.reddit.com/r/MachineLearning/comments/7bn0wj/machine_learning_cheatsheet_styled_after_pytorch/,[deleted],1510163682,,0,1,False,default,,,,,
407,MachineLearning,t5_2r3gv,2017-11-9,2017,11,9,2,7bn1e8,self.MachineLearning,Garbage Detection and Classification,https://www.reddit.com/r/MachineLearning/comments/7bn1e8/garbage_detection_and_classification/,harshitgambhir,1510163789,[removed],0,1,False,default,,,,,
408,MachineLearning,t5_2r3gv,2017-11-9,2017,11,9,2,7bn1sm,self.MachineLearning,What are some research topics that explores the connections between category theory/type theory/functional programming and machine learning?,https://www.reddit.com/r/MachineLearning/comments/7bn1sm/what_are_some_research_topics_that_explores_the/,winstonl,1510163878,[removed],0,1,False,default,,,,,
409,MachineLearning,t5_2r3gv,2017-11-9,2017,11,9,3,7bn49e,ml-cheatsheet.readthedocs.io,Machine Learning Cheatsheet -- Organized like Documentation,https://www.reddit.com/r/MachineLearning/comments/7bn49e/machine_learning_cheatsheet_organized_like/,[deleted],1510164404,[deleted],0,1,False,default,,,,,
410,MachineLearning,t5_2r3gv,2017-11-9,2017,11,9,3,7bn8e8,github.com,[N] SpaCy 2.0 released (Natural Language Processing with Python),https://www.reddit.com/r/MachineLearning/comments/7bn8e8/n_spacy_20_released_natural_language_processing/,pmigdal,1510165353,,45,255,False,https://b.thumbs.redditmedia.com/Z11eVVYR8FTuitYtmNONXkxlbFRHmeMAgedER8y9xvk.jpg,,,,,
411,MachineLearning,t5_2r3gv,2017-11-9,2017,11,9,4,7bnspe,self.MachineLearning,I am doing academic project in Apache spark with help of pyspark. It is about analyzing stock prices time series data. I have found that in melon we have randomSplit for spliting data for training and testing. I am not sure about is this good also for time series data. Am I wrong ?,https://www.reddit.com/r/MachineLearning/comments/7bnspe/i_am_doing_academic_project_in_apache_spark_with/,lastfreelogino,1510169948,[removed],1,1,False,default,,,,,
412,MachineLearning,t5_2r3gv,2017-11-9,2017,11,9,4,7bnv95,medium.com,Machine Learning Will Destroy UI Jobs: I give it 5 years.,https://www.reddit.com/r/MachineLearning/comments/7bnv95/machine_learning_will_destroy_ui_jobs_i_give_it_5/,hamptonfischer,1510170547,,0,1,False,default,,,,,
413,MachineLearning,t5_2r3gv,2017-11-9,2017,11,9,5,7bo2gr,codemade.io,A collection of machine learning tutorials,https://www.reddit.com/r/MachineLearning/comments/7bo2gr/a_collection_of_machine_learning_tutorials/,[deleted],1510172228,[deleted],0,1,False,default,,,,,
414,MachineLearning,t5_2r3gv,2017-11-9,2017,11,9,7,7bosyc,self.MachineLearning,"[D] In your entire run with machine learning, what concepts did you have the most trouble with ?",https://www.reddit.com/r/MachineLearning/comments/7bosyc/d_in_your_entire_run_with_machine_learning_what/,hubbahubba111,1510178731,,48,12,False,self,,,,,
415,MachineLearning,t5_2r3gv,2017-11-9,2017,11,9,7,7boto6,self.MachineLearning,Can machine learning make artistic quote picture ?,https://www.reddit.com/r/MachineLearning/comments/7boto6/can_machine_learning_make_artistic_quote_picture/,[deleted],1510178922,,0,1,False,default,,,,,
416,MachineLearning,t5_2r3gv,2017-11-9,2017,11,9,7,7bou1e,self.MachineLearning,[D] Ok to cite ICLR 2018 submissions?,https://www.reddit.com/r/MachineLearning/comments/7bou1e/d_ok_to_cite_iclr_2018_submissions/,hughperkins,1510179016,The ICLR 2018 submissions at https://openreview.net/group?id=ICLR.cc/2018/Conference contain some very interesting papers. To what extent is it normal-ish/ok-ish to cite such papers?,4,1,False,self,,,,,
417,MachineLearning,t5_2r3gv,2017-11-9,2017,11,9,7,7bowt7,youtube.com,"Building Dota Bots That Beat Pros - OpenAI's Greg Brockman, Szymon Sidor, and Sam Altman",https://www.reddit.com/r/MachineLearning/comments/7bowt7/building_dota_bots_that_beat_pros_openais_greg/,programmingdoc,1510179721,,0,1,False,default,,,,,
418,MachineLearning,t5_2r3gv,2017-11-9,2017,11,9,8,7bpepb,github.com,"[P]My friends and I created a Poker AI that uses what we called ""darwinian q-learning"" to get better over time",https://www.reddit.com/r/MachineLearning/comments/7bpepb/pmy_friends_and_i_created_a_poker_ai_that_uses/,barce99,1510184484,,5,8,False,https://b.thumbs.redditmedia.com/7fVAWKbF90muyn13KAykpQK3m1Bu6Z6HRKLdzPsPoFw.jpg,,,,,
419,MachineLearning,t5_2r3gv,2017-11-9,2017,11,9,8,7bpfnx,fuse.wikichip.org,Bitcoin giant Bitmain enters the AI market with the BM1680 neural processor,https://www.reddit.com/r/MachineLearning/comments/7bpfnx/bitcoin_giant_bitmain_enters_the_ai_market_with/,gwd2,1510184764,,0,1,False,default,,,,,
420,MachineLearning,t5_2r3gv,2017-11-9,2017,11,9,9,7bpjo0,fennellatlaw.com,Atlanta Family Law &amp;amp; Criminal Defense Lawyer | The Law Firm of Caryn S. Fennell,https://www.reddit.com/r/MachineLearning/comments/7bpjo0/atlanta_family_law_amp_criminal_defense_lawyer/,dannavvsimoesvv,1510185901,,0,1,False,default,,,,,
421,MachineLearning,t5_2r3gv,2017-11-9,2017,11,9,9,7bpjru,theviralhq.com,13 Exclusive New Trends in Big Data and Data Science,https://www.reddit.com/r/MachineLearning/comments/7bpjru/13_exclusive_new_trends_in_big_data_and_data/,Marry_owen,1510185933,,0,1,False,default,,,,,
422,MachineLearning,t5_2r3gv,2017-11-9,2017,11,9,10,7bpwp7,self.MachineLearning,Is there any better-compiled resource that keeps track of State of the art results of different problem set?,https://www.reddit.com/r/MachineLearning/comments/7bpwp7/is_there_any_bettercompiled_resource_that_keeps/,[deleted],1510189416,,0,1,False,default,,,,,
423,MachineLearning,t5_2r3gv,2017-11-9,2017,11,9,10,7bpwrt,vincentgranville.com,"New machine learning competition, $2,000 award",https://www.reddit.com/r/MachineLearning/comments/7bpwrt/new_machine_learning_competition_2000_award/,Datascope,1510189429,,0,1,False,default,,,,,
424,MachineLearning,t5_2r3gv,2017-11-9,2017,11,9,10,7bpxbq,self.MachineLearning,[D] Is there any better-compiled resource that keeps track of State of the art results of different problem set?,https://www.reddit.com/r/MachineLearning/comments/7bpxbq/d_is_there_any_bettercompiled_resource_that_keeps/,futbol_account,1510189570,"I am using this: https://www.eff.org/ai/metrics#Problems,-Metrics,-and-Datasets

I do not think it was updated for a long time. Moreover, a lot of problems was not on the list.
Is there any webpage or GitHub page that has compiled SoTA results for all problems with corresponding paper?

If there is not anyone goto source, we should start doing it. Ours is the largest ML community. If we all contribute, we can make it possible.",1,7,False,self,,,,,
425,MachineLearning,t5_2r3gv,2017-11-9,2017,11,9,11,7bqjt2,mixmachinery.com,The polyurethane resin can be maded by jacketed reactor from JCT,https://www.reddit.com/r/MachineLearning/comments/7bqjt2/the_polyurethane_resin_can_be_maded_by_jacketed/,mixmachinery,1510196145,,1,1,False,default,,,,,
426,MachineLearning,t5_2r3gv,2017-11-9,2017,11,9,11,7bqk0n,youtube.com,"[P] A Real-Time Mario Kart 64 AI Using CNNs, Offline Search, and DAGGER",https://www.reddit.com/r/MachineLearning/comments/7bqk0n/p_a_realtime_mario_kart_64_ai_using_cnns_offline/,varunramesh,1510196212,,20,123,False,https://b.thumbs.redditmedia.com/nFcXRHWFiX1qQq-bb7MKeVwLM_n_gJwdNtTV-YjcfBM.jpg,,,,,
427,MachineLearning,t5_2r3gv,2017-11-9,2017,11,9,12,7bqpdi,self.MachineLearning,[D] Collecting state of the art result for all machine learning problems,https://www.reddit.com/r/MachineLearning/comments/7bqpdi/d_collecting_state_of_the_art_result_for_all/,futbol_account,1510197823,"I am starting this ambitious project with the aim of collecting SoTA results for all machine learning problems and all datasets. I certainly can not do this alone. It requires support from a large community. I strongly believe r/MachineLearning can do this because ours is the largest machine learning community.

URL: https://github.com/RedditSota/state-of-the-art-result-for-machine-learning-problems

I need few things from you all:

1. Please often visit that GitHub page and provide SoTA results periodically.

2. Need many collaborators who can actively update the GitHub. Please PM me if you are interested. 

3. In this thread, provide SoTA result for the problems you know.
In need this info: 

           * Type of learning problem

           * Modality

           * Research paper

           * Datasets

           * Metric

           * Source Code

           * Year


4. Please give visibility to this by sharing it on Facebook, Twitter, your research labs, professors, etc. 

If you have comments on the structure, please write to me.

This is definitely possible if we work together on this.

EDIT:

Can someone provide common NLP tasks and its datasets? Similarly for Image, Speech, RL, etc.",28,35,False,self,,,,,
