,sbr,sbr_id,date,year,month,hour,day,id,domain,title,full_link,author,created,selftext,num_comments,score,over_18,thumbnail,media_provider,media_thumbnail,media_title,media_description,media_url
0,MachineLearning,t5_2r3gv,2017-11-1,2017,11,1,11,7a0vpf,github.com,"""Continual Learning with Deep Generative Replay"" PyTorch Implementation",https://www.reddit.com/r/MachineLearning/comments/7a0vpf/continual_learning_with_deep_generative_replay/,kuc2477,1509504029,,0,1,False,default,,,,,
1,MachineLearning,t5_2r3gv,2017-11-1,2017,11,1,11,7a0wcv,github.com,[P] Voice Style Transfer: Speaking like Kate Winslet,https://www.reddit.com/r/MachineLearning/comments/7a0wcv/p_voice_style_transfer_speaking_like_kate_winslet/,andabi,1509504251,,46,232,False,https://b.thumbs.redditmedia.com/hmKZ3csvXOBmP44QjaWDOeemLyME2voNyNbdvAlchYs.jpg,,,,,
2,MachineLearning,t5_2r3gv,2017-11-1,2017,11,1,12,7a17kr,arxiv.org,[R] Deep Learning as a Mixed Convex-Combinatorial Optimization Problem,https://www.reddit.com/r/MachineLearning/comments/7a17kr/r_deep_learning_as_a_mixed_convexcombinatorial/,verveandfervor,1509508029,,0,28,False,default,,,,,
3,MachineLearning,t5_2r3gv,2017-11-1,2017,11,1,12,7a181m,self.MachineLearning,Unsure about this Indexing Error while using NMF,https://www.reddit.com/r/MachineLearning/comments/7a181m/unsure_about_this_indexing_error_while_using_nmf/,madzthakz,1509508197,[removed],0,1,False,default,,,,,
4,MachineLearning,t5_2r3gv,2017-11-1,2017,11,1,14,7a1jvh,newgenapps.com,Precision vs Recall - Demystifying Accuracy Paradox in Machine Learning,https://www.reddit.com/r/MachineLearning/comments/7a1jvh/precision_vs_recall_demystifying_accuracy_paradox/,NGA-YJ,1509512481,,0,1,False,default,,,,,
5,MachineLearning,t5_2r3gv,2017-11-1,2017,11,1,14,7a1qj7,coursera.org,Andrew Ng's Deep learning specialization's 4th course is up now on Coursera which is on CNNs,https://www.reddit.com/r/MachineLearning/comments/7a1qj7/andrew_ngs_deep_learning_specializations_4th/,[deleted],1509515261,[deleted],0,1,False,default,,,,,
6,MachineLearning,t5_2r3gv,2017-11-1,2017,11,1,15,7a1spt,coursera.org,[N] Andrew Ng's Deep learning specialization's 4th course is up now on Coursera which is on CNNs,https://www.reddit.com/r/MachineLearning/comments/7a1spt/n_andrew_ngs_deep_learning_specializations_4th/,curious_riddler,1509516185,,25,95,False,https://b.thumbs.redditmedia.com/Pkqjp2K0cyv8XvEkwK9ZOGuGbcfTmZrbkAH70qEX4IQ.jpg,,,,,
7,MachineLearning,t5_2r3gv,2017-11-1,2017,11,1,15,7a1y89,github.com,CapsNet in Tensorflow,https://www.reddit.com/r/MachineLearning/comments/7a1y89/capsnet_in_tensorflow/,pilooch,1509518704,,0,1,False,default,,,,,
8,MachineLearning,t5_2r3gv,2017-11-1,2017,11,1,15,7a1zf5,colab.research.google.com,TF Eager example code in a Google colab notebook - allow playing with TF Eager directly in your browser,https://www.reddit.com/r/MachineLearning/comments/7a1zf5/tf_eager_example_code_in_a_google_colab_notebook/,[deleted],1509519261,[deleted],0,1,False,default,,,,,
9,MachineLearning,t5_2r3gv,2017-11-1,2017,11,1,16,7a23zj,noodles-equipment.com,Rice Noodle Maker Machine|Corn Noodle Making Machine For Sale,https://www.reddit.com/r/MachineLearning/comments/7a23zj/rice_noodle_maker_machinecorn_noodle_making/,liusherry,1509521409,,1,1,False,default,,,,,
10,MachineLearning,t5_2r3gv,2017-11-1,2017,11,1,16,7a2661,self.MachineLearning,Vermicelli Machine| Rice Noodle Machine Manufacturer,https://www.reddit.com/r/MachineLearning/comments/7a2661/vermicelli_machine_rice_noodle_machine/,liusherry,1509522482,[removed],1,1,False,default,,,,,
11,MachineLearning,t5_2r3gv,2017-11-1,2017,11,1,17,7a2dh5,colab.research.google.com,[R] TF Eager example code in a Google colab Jupyter notebook - allow playing with TF Eager directly in your browser,https://www.reddit.com/r/MachineLearning/comments/7a2dh5/r_tf_eager_example_code_in_a_google_colab_jupyter/,thntk,1509526241,,2,6,False,https://b.thumbs.redditmedia.com/Zf4O1STZNrqdqio-yUM3Fg47ORxflxer3YZ4o8Z7B1o.jpg,,,,,
12,MachineLearning,t5_2r3gv,2017-11-1,2017,11,1,18,7a2h97,arxiv.org,How deep learning works  The geometry of deep learning,https://www.reddit.com/r/MachineLearning/comments/7a2h97/how_deep_learning_works_the_geometry_of_deep/,aseembits93,1509528146,,0,1,False,default,,,,,
13,MachineLearning,t5_2r3gv,2017-11-1,2017,11,1,18,7a2kxx,self.MachineLearning,Why do many tracking or alignment works use Lie group instead of Affine and Homography to parameterize motion?,https://www.reddit.com/r/MachineLearning/comments/7a2kxx/why_do_many_tracking_or_alignment_works_use_lie/,scotty20172017,1509529980,[removed],0,1,False,default,,,,,
14,MachineLearning,t5_2r3gv,2017-11-1,2017,11,1,19,7a2mii,self.MachineLearning,[D] Ideas about application of CycleGAN-like algorithm,https://www.reddit.com/r/MachineLearning/comments/7a2mii/d_ideas_about_application_of_cycleganlike/,HigherTopoi,1509530672,"I'm currently finishing up implementing CycleGAN-like algorithm by incorporating all the relevant recent developments, including progressive growing of GANs, and several other ICLR papers, including CyCADA, for realistic end product. Especially, I hope this will result in realistic video-to-video translation. Naively it can be extended to speech-to-speech, text-to-image (like StackGAN), possibly text-to-text and (image+text)-to-image with the existing technology in unpaired style. Here are some questions:

1) There are already numerous algorithms like this, including unpaired speech-to-speech, one of which was posted here, and there was one ICLR paper about this; on the other hand, I have only limited time. Is it worth pursuing this direction? Or is there no more outstanding problem about this particular task? 

2) There is one ICLR paper about text-style transfer. Is it unreasonable to expect that Cycle-GAN-like algorithm can do unsupervised translation (another ICLR paper) like this (with RNN)? If that would be realized, then Cycle-like-GAN can possibly solely do unsupervised voice-to-voice inter-language translation with the user's own voice, which is interesting.  

3) If you have any idea about nice (academic or industrial) applications of unpaired translation of X-to-Y please comment it. 


",2,9,False,self,,,,,
15,MachineLearning,t5_2r3gv,2017-11-1,2017,11,1,19,7a2qo3,self.MachineLearning,[Q] Textbook/resources on network centrality measures and applications?,https://www.reddit.com/r/MachineLearning/comments/7a2qo3/q_textbookresources_on_network_centrality/,meechosch,1509532470,[removed],0,1,False,default,,,,,
16,MachineLearning,t5_2r3gv,2017-11-1,2017,11,1,20,7a2vvw,self.MachineLearning,"[D] Does a convolution layer decrease the input's dimensions like a pooling layer, or does it not?",https://www.reddit.com/r/MachineLearning/comments/7a2vvw/d_does_a_convolution_layer_decrease_the_inputs/,FantasyBorderline,1509534677,"I'm a bit perplexed about this. Let's say I have a 32x32x3 input (RGB image), and am about to use a CNN on it, with several Conv-Pool layers and one or two Fully Connected (dense-dropout) layers.

I read [this paper](https://annals-csis.org/Volume_8/pliks/472.pdf) that uses Torch, and apparently its Conv layer reduces the size by `kernel_size-1`, so when the 32x32x3 image passes through the first Conv layer with 5x5 kernel size and 64 filters, it produces 28x28x64 segments/features.

Whereas in Tensorflow, as far as I know, it doesn't, so when the 32x32x3 image passes through its Conv layer with 5x5 kernel size, and 64 filters it produces 32x32x64 features.

Does it depend on the type of ML used (Caffe/Tensorflow/Torch/scikit-learn), and what effect does it have?",9,3,False,self,,,,,
17,MachineLearning,t5_2r3gv,2017-11-1,2017,11,1,20,7a2wcy,docs.google.com,I need help for my machine learning/NLP project. It is about a context aware text classification. Please see the link for detailed problem statement.,https://www.reddit.com/r/MachineLearning/comments/7a2wcy/i_need_help_for_my_machine_learningnlp_project_it/,rbansalrahul6,1509534854,,0,1,False,default,,,,,
18,MachineLearning,t5_2r3gv,2017-11-1,2017,11,1,20,7a2wz6,marketingland.com,How machine learning levels the SERP playing field,https://www.reddit.com/r/MachineLearning/comments/7a2wz6/how_machine_learning_levels_the_serp_playing_field/,evacms003,1509535095,,0,1,False,default,,,,,
19,MachineLearning,t5_2r3gv,2017-11-1,2017,11,1,20,7a2yqe,self.MachineLearning,How can I find contextually related words and add custom tags/labels?,https://www.reddit.com/r/MachineLearning/comments/7a2yqe/how_can_i_find_contextually_related_words_and_add/,karakorakura,1509535770,[removed],0,1,False,default,,,,,
20,MachineLearning,t5_2r3gv,2017-11-1,2017,11,1,21,7a377r,self.MachineLearning,[D]Why do I need to install python packages inside Tensorflow environment?,https://www.reddit.com/r/MachineLearning/comments/7a377r/dwhy_do_i_need_to_install_python_packages_inside/,huyhcmut,1509538844,[removed],0,1,False,default,,,,,
21,MachineLearning,t5_2r3gv,2017-11-1,2017,11,1,21,7a3av6,arxiv.org,[R] TreeQN and ATreeC: Differentiable Tree Planning for Deep Reinforcement Learning,https://www.reddit.com/r/MachineLearning/comments/7a3av6/r_treeqn_and_atreec_differentiable_tree_planning/,_rockt,1509540080,,27,24,False,default,,,,,
22,MachineLearning,t5_2r3gv,2017-11-1,2017,11,1,22,7a3fqs,quantamagazine.org,[R]Making Algorithms Fair: An Interview With Cynthia Dwork,https://www.reddit.com/r/MachineLearning/comments/7a3fqs/rmaking_algorithms_fair_an_interview_with_cynthia/,dearpetra,1509541644,,0,1,False,default,,,,,
23,MachineLearning,t5_2r3gv,2017-11-1,2017,11,1,22,7a3q5b,self.MachineLearning,What's the difference between a single-model result and a multi-model result?,https://www.reddit.com/r/MachineLearning/comments/7a3q5b/whats_the_difference_between_a_singlemodel_result/,abrbbb,1509544743,[removed],0,1,False,default,,,,,
24,MachineLearning,t5_2r3gv,2017-11-1,2017,11,1,23,7a3vak,wired.com,[N] Googles AI Wizard Unveils a New Twist on Neural Networks,https://www.reddit.com/r/MachineLearning/comments/7a3vak/n_googles_ai_wizard_unveils_a_new_twist_on_neural/,ps_dillon,1509546132,,36,70,False,https://b.thumbs.redditmedia.com/tTchtpk3KVu-1Kg4VCcrfO3uzfsdXA-WNmh4BqexkYQ.jpg,,,,,
25,MachineLearning,t5_2r3gv,2017-11-1,2017,11,1,23,7a3zxi,blog.janestreet.com,Does batch size matter,https://www.reddit.com/r/MachineLearning/comments/7a3zxi/does_batch_size_matter/,[deleted],1509547404,[deleted],0,1,False,default,,,,,
26,MachineLearning,t5_2r3gv,2017-11-1,2017,11,1,23,7a42ci,neuromation.io,[P] Neuromation: Distributed Synthetic Data Platform for Deep Learning Applications,https://www.reddit.com/r/MachineLearning/comments/7a42ci/p_neuromation_distributed_synthetic_data_platform/,nicknikolaev,1509548043,,0,38,False,https://b.thumbs.redditmedia.com/Wh22ah68D8beJHj7F0rZGpAGeCpy-q9ZeNfEy1jNSNk.jpg,,,,,
27,MachineLearning,t5_2r3gv,2017-11-2,2017,11,2,0,7a46j2,blog.janestreet.com,Does batch size matter? [D],https://www.reddit.com/r/MachineLearning/comments/7a46j2/does_batch_size_matter_d/,[deleted],1509549083,[deleted],0,1,False,default,,,,,
28,MachineLearning,t5_2r3gv,2017-11-2,2017,11,2,0,7a494o,blog.janestreet.com,[D] Does batch size matter?,https://www.reddit.com/r/MachineLearning/comments/7a494o/d_does_batch_size_matter/,kmanon,1509549739,,8,31,False,https://b.thumbs.redditmedia.com/MQEaOi92xMto07r0ut1gFO7KTKTFC26EBrj70qSRi9U.jpg,,,,,
29,MachineLearning,t5_2r3gv,2017-11-2,2017,11,2,0,7a4gwm,self.MachineLearning,"Simple Questions Thread November 01, 2017",https://www.reddit.com/r/MachineLearning/comments/7a4gwm/simple_questions_thread_november_01_2017/,AutoModerator,1509551737,[removed],0,1,False,default,,,,,
30,MachineLearning,t5_2r3gv,2017-11-2,2017,11,2,1,7a4j2t,nature.com,[R] Machine learning of neural representations of suicide and emotion concepts identifies suicidal youth,https://www.reddit.com/r/MachineLearning/comments/7a4j2t/r_machine_learning_of_neural_representations_of/,GreenFrog76,1509552232,,18,115,False,https://a.thumbs.redditmedia.com/I0oRJFU75o3xeTQs-qFIdeQn-e8iziG5rhzmdBxwhF4.jpg,,,,,
31,MachineLearning,t5_2r3gv,2017-11-2,2017,11,2,1,7a4jl3,openreview.net,[R] A Bayesian Perspective on Generalization and Stochastic Gradient Descent &lt;- identifying an optimum batch size which maximizes the test set accuracy.,https://www.reddit.com/r/MachineLearning/comments/7a4jl3/r_a_bayesian_perspective_on_generalization_and/,downtownslim,1509552359,,1,8,False,default,,,,,
32,MachineLearning,t5_2r3gv,2017-11-2,2017,11,2,1,7a4oxq,self.MachineLearning,Is a Udacity nano degree worth it?,https://www.reddit.com/r/MachineLearning/comments/7a4oxq/is_a_udacity_nano_degree_worth_it/,Shi7am,1509553687,[removed],0,1,False,default,,,,,
33,MachineLearning,t5_2r3gv,2017-11-2,2017,11,2,1,7a4twy,numenta.com,New Experiment Sheds Light on HTM Theory,https://www.reddit.com/r/MachineLearning/comments/7a4twy/new_experiment_sheds_light_on_htm_theory/,numenta,1509554914,,0,2,False,default,,,,,
34,MachineLearning,t5_2r3gv,2017-11-2,2017,11,2,1,7a4v3e,arxiv.org,Stochastic Video Prediction in Real Videos,https://www.reddit.com/r/MachineLearning/comments/7a4v3e/stochastic_video_prediction_in_real_videos/,[deleted],1509555208,[deleted],0,1,False,default,,,,,
35,MachineLearning,t5_2r3gv,2017-11-2,2017,11,2,2,7a541s,self.MachineLearning,Neural net based game needs some data!,https://www.reddit.com/r/MachineLearning/comments/7a541s/neural_net_based_game_needs_some_data/,tomosevans,1509557324,[removed],0,2,False,default,,,,,
36,MachineLearning,t5_2r3gv,2017-11-2,2017,11,2,2,7a54pe,medium.com,Technical terms used in Deep Learning and their meaning in simple words,https://www.reddit.com/r/MachineLearning/comments/7a54pe/technical_terms_used_in_deep_learning_and_their/,curious_rv,1509557485,,0,1,False,default,,,,,
37,MachineLearning,t5_2r3gv,2017-11-2,2017,11,2,2,7a59uf,self.MachineLearning,Datasets for text document summarization ARABIC,https://www.reddit.com/r/MachineLearning/comments/7a59uf/datasets_for_text_document_summarization_arabic/,Mouzbarak,1509558714,[removed],0,1,False,default,,,,,
38,MachineLearning,t5_2r3gv,2017-11-2,2017,11,2,3,7a5ea7,self.MachineLearning,Patenting a system,https://www.reddit.com/r/MachineLearning/comments/7a5ea7/patenting_a_system/,ArtlockScofield,1509559778,[removed],0,1,False,default,,,,,
39,MachineLearning,t5_2r3gv,2017-11-2,2017,11,2,3,7a5kr9,self.MachineLearning,Applying ML to EEG Lab,https://www.reddit.com/r/MachineLearning/comments/7a5kr9/applying_ml_to_eeg_lab/,The_Real_Tupac,1509561345,[removed],0,1,False,default,,,,,
40,MachineLearning,t5_2r3gv,2017-11-2,2017,11,2,3,7a5p9l,theodo.fr,Building a Trump/Obama Tweet Classifier with 98% accuracy in 1 hour!,https://www.reddit.com/r/MachineLearning/comments/7a5p9l/building_a_trumpobama_tweet_classifier_with_98/,[deleted],1509562471,[deleted],0,1,False,default,,,,,
41,MachineLearning,t5_2r3gv,2017-11-2,2017,11,2,4,7a5ulq,self.MachineLearning,Reverse Engineering Songs,https://www.reddit.com/r/MachineLearning/comments/7a5ulq/reverse_engineering_songs/,sniloiac,1509563767,[removed],0,1,False,default,,,,,
42,MachineLearning,t5_2r3gv,2017-11-2,2017,11,2,4,7a5vai,self.MachineLearning,Autonomous Vehicles with Human Perception Will Make Our Cities Smarter,https://www.reddit.com/r/MachineLearning/comments/7a5vai/autonomous_vehicles_with_human_perception_will/,yildiz17,1509563936,[removed],0,1,False,default,,,,,
43,MachineLearning,t5_2r3gv,2017-11-2,2017,11,2,4,7a5x46,github.com,Neural Adaptive Machine Translation,https://www.reddit.com/r/MachineLearning/comments/7a5x46/neural_adaptive_machine_translation/,marcotrombetti,1509564398,,0,1,False,default,,,,,
44,MachineLearning,t5_2r3gv,2017-11-2,2017,11,2,4,7a60fe,theodo.fr,[P] Building a Trump/Obama Tweet Classifier with 98% accuracy in 1 hour!,https://www.reddit.com/r/MachineLearning/comments/7a60fe/p_building_a_trumpobama_tweet_classifier_with_98/,benellerby,1509565222,,9,10,False,https://b.thumbs.redditmedia.com/ca03UkP3rabdpk5-tp9pYcR3Lg-sd9TpT8vwzeeAXLY.jpg,,,,,
45,MachineLearning,t5_2r3gv,2017-11-2,2017,11,2,5,7a6a29,self.MachineLearning,[D] How to detect orientation of objects?,https://www.reddit.com/r/MachineLearning/comments/7a6a29/d_how_to_detect_orientation_of_objects/,austeritygirlone,1509567593,"I want to simultaneously detect objects within a scene, and also know their orientation using an ANN. This could be done by regressing on two scalars (for each pixel). One is orientation angle, and the other is existence probability. Are there any other mentionable approaches for this?

My problem is actually more contrived, as there could be multiple objects with different orientation at the same position, and I need to count them. But I'd be happy with some pointers for the base case.",4,4,False,self,,,,,
46,MachineLearning,t5_2r3gv,2017-11-2,2017,11,2,5,7a6fy8,arxiv.org,Fooling neural networks in the physical world with 3D adversarial objects,https://www.reddit.com/r/MachineLearning/comments/7a6fy8/fooling_neural_networks_in_the_physical_world/,[deleted],1509569108,[deleted],0,1,False,default,,,,,
47,MachineLearning,t5_2r3gv,2017-11-2,2017,11,2,6,7a6v7d,kickstarter.com,Math for Machine Learning Online Course,https://www.reddit.com/r/MachineLearning/comments/7a6v7d/math_for_machine_learning_online_course/,rickmister24,1509572915,,0,1,False,default,,,,,
48,MachineLearning,t5_2r3gv,2017-11-2,2017,11,2,7,7a71ti,self.MachineLearning,[D] Just finished Andrew Ng's Stanford course. Is there another theory/math heavy resource to go from here (not looking for anything too practical ie programming language heavy),https://www.reddit.com/r/MachineLearning/comments/7a71ti/d_just_finished_andrew_ngs_stanford_course_is/,TeslaCarBot,1509574583,"I'm not looking for anything too practical or programming heavy at the moment as I already have a bit of experience being a machine learning hobbyist. 

A while back I asked if there's a good resource for ML learning hobbyist with low ML theory background but strong math( differential equations, stats, linear algebra) background. 

The top recommendation was Andrew Ng's Stanford course and I got to say it really hit the spot. As someone with the correct math background and practical experience with ML, the course was really fantastic for me for getting the theory, and as I am about to wrap up the series I'm a bit sad about finishing it, sort of like when you finish a book you're really into. 

I am wondering if a machine learning course to go from here, something like a continuation of Andrew Ng's course, which is heavy in math and theory. I've been looking at some of the other courses/resources/books out there, it seems like the most prevalent ones are those that heavy in the programming implementations of machine learning, and light in theory/math. 

I don't mind a course that is practical and programming, but I want to continue to strengthen my math/theory background is I already have a bit of experience on the practical implementation side. ",10,14,False,self,,,,,
49,MachineLearning,t5_2r3gv,2017-11-2,2017,11,2,8,7a7gzp,github.com,TensorFlow implementation of Mask R-CNN for pixelwise object detection and segmentation,https://www.reddit.com/r/MachineLearning/comments/7a7gzp/tensorflow_implementation_of_mask_rcnn_for/,[deleted],1509578506,[deleted],0,1,False,default,,,,,
50,MachineLearning,t5_2r3gv,2017-11-2,2017,11,2,8,7a7hm1,github.com,[P] TensorFlow implementation of Mask R-CNN for pixelwise object detection and segmentation,https://www.reddit.com/r/MachineLearning/comments/7a7hm1/p_tensorflow_implementation_of_mask_rcnn_for/,feather_of_maat,1509578674,,15,122,False,https://b.thumbs.redditmedia.com/cTcYuIRqZYM5juIhEm2EVx9JricJMc1ukQeQOXp1pyI.jpg,,,,,
51,MachineLearning,t5_2r3gv,2017-11-2,2017,11,2,9,7a7w6c,self.MachineLearning,Tensorflow Eager vs Pytorch,https://www.reddit.com/r/MachineLearning/comments/7a7w6c/tensorflow_eager_vs_pytorch/,uotsca,1509582404,[removed],0,1,False,default,,,,,
52,MachineLearning,t5_2r3gv,2017-11-2,2017,11,2,12,7a91s7,self.MachineLearning,"What do you think of this paper/work? -""Towards deep learning with segregated dendrites""",https://www.reddit.com/r/MachineLearning/comments/7a91s7/what_do_you_think_of_this_paperwork_towards_deep/,rsChron,1509594528,[removed],1,1,False,default,,,,,
53,MachineLearning,t5_2r3gv,2017-11-2,2017,11,2,13,7a94e6,arxiv.org,Deep learning with segregated dendrites,https://www.reddit.com/r/MachineLearning/comments/7a94e6/deep_learning_with_segregated_dendrites/,rsChron,1509595322,,2,1,False,default,,,,,
54,MachineLearning,t5_2r3gv,2017-11-2,2017,11,2,14,7a9fqq,self.MachineLearning,Kernel Tricks with SVM in Python,https://www.reddit.com/r/MachineLearning/comments/7a9fqq/kernel_tricks_with_svm_in_python/,pradeepsathyamurthy,1509599279,[removed],0,1,False,default,,,,,
55,MachineLearning,t5_2r3gv,2017-11-2,2017,11,2,14,7a9i6o,i.redd.it,Beyond brassiere search...Apples machine learning at its finest:,https://www.reddit.com/r/MachineLearning/comments/7a9i6o/beyond_brassiere_searchapples_machine_learning_at/,[deleted],1509600242,[deleted],0,1,False,default,,,,,
56,MachineLearning,t5_2r3gv,2017-11-2,2017,11,2,14,7a9lv7,github.com,"Preparing for ML interviews. Hence, created a growing repo for listing different questions that might be asked. Thought of sharing. Feedback appreciated.",https://www.reddit.com/r/MachineLearning/comments/7a9lv7/preparing_for_ml_interviews_hence_created_a/,Sroy20,1509601718,,0,1,False,default,,,,,
57,MachineLearning,t5_2r3gv,2017-11-2,2017,11,2,15,7a9o6f,flyyufelix.github.io,[P] Implementation of DeepMind's Distributional Bellman and the C51 Algorithm,https://www.reddit.com/r/MachineLearning/comments/7a9o6f/p_implementation_of_deepminds_distributional/,hardmaru,1509602694,,2,13,False,https://b.thumbs.redditmedia.com/zpGbjfnXIJuAdy_sYnHXrxy950QN61qYwFJLxIDvW4M.jpg,,,,,
58,MachineLearning,t5_2r3gv,2017-11-2,2017,11,2,15,7a9r8n,rtoz.org,NVIDIA has developed a new machine learning methodology for generating unique and realistic looking faces,https://www.reddit.com/r/MachineLearning/comments/7a9r8n/nvidia_has_developed_a_new_machine_learning/,[deleted],1509603946,[deleted],0,1,False,default,,,,,
59,MachineLearning,t5_2r3gv,2017-11-2,2017,11,2,15,7a9tpn,self.MachineLearning,How find patterns in categorical data with respect to time?,https://www.reddit.com/r/MachineLearning/comments/7a9tpn/how_find_patterns_in_categorical_data_with/,helpseeker8390,1509605059,[removed],0,1,False,default,,,,,
60,MachineLearning,t5_2r3gv,2017-11-2,2017,11,2,15,7a9u3l,rtoz.org,[N] NVIDIA has developed a new machine learning methodology for generating unique and realistic looking faces,https://www.reddit.com/r/MachineLearning/comments/7a9u3l/n_nvidia_has_developed_a_new_machine_learning/,karthikaag,1509605222,,0,1,False,default,,,,,
61,MachineLearning,t5_2r3gv,2017-11-2,2017,11,2,16,7a9xbn,self.MachineLearning,"Accepting Posters for NIPS Workshop ""Deep Learning at Supercomputer Scale""",https://www.reddit.com/r/MachineLearning/comments/7a9xbn/accepting_posters_for_nips_workshop_deep_learning/,ekelsen,1509606684,[removed],0,1,False,default,,,,,
62,MachineLearning,t5_2r3gv,2017-11-2,2017,11,2,16,7a9yd3,noodle-plant.com,Thai flat rice noodle making machine for sale,https://www.reddit.com/r/MachineLearning/comments/7a9yd3/thai_flat_rice_noodle_making_machine_for_sale/,liusherry,1509607159,,1,1,False,default,,,,,
63,MachineLearning,t5_2r3gv,2017-11-2,2017,11,2,16,7a9ye7,theguardian.com,[N] 'We can't compete': why universities are losing their best AI scientists,https://www.reddit.com/r/MachineLearning/comments/7a9ye7/n_we_cant_compete_why_universities_are_losing/,hlynurd,1509607176,,161,363,False,https://b.thumbs.redditmedia.com/fdS1oNxgS7j3UPI0vc9MzgwLlAJxRUOOckA7hzS4zcI.jpg,,,,,
64,MachineLearning,t5_2r3gv,2017-11-2,2017,11,2,16,7aa296,noodles-machine.com,Commercial Noodle Making Machine | Noodle Maker For Sale,https://www.reddit.com/r/MachineLearning/comments/7aa296/commercial_noodle_making_machine_noodle_maker_for/,liusherry,1509609123,,1,1,False,default,,,,,
65,MachineLearning,t5_2r3gv,2017-11-2,2017,11,2,18,7aago5,self.MachineLearning,Using Gans to generate fighting game character from zero? Where to start?,https://www.reddit.com/r/MachineLearning/comments/7aago5/using_gans_to_generate_fighting_game_character/,VideogameTheoristBR,1509616277,[removed],0,1,False,default,,,,,
66,MachineLearning,t5_2r3gv,2017-11-2,2017,11,2,19,7aaidm,ocregister.com,[N]World Series ballparks compared in by-the-numbers look at Minute Maid Park and Dodger Stadium,https://www.reddit.com/r/MachineLearning/comments/7aaidm/nworld_series_ballparks_compared_in_bythenumbers/,chris_shpak,1509617006,,1,2,False,https://b.thumbs.redditmedia.com/SoeUKEoMDnEKqYkU5mCUTw7OQu5e0O19WkKFtqD1kXY.jpg,,,,,
67,MachineLearning,t5_2r3gv,2017-11-2,2017,11,2,19,7aajcr,kdnuggets.com,[R]3 different types of machine learning,https://www.reddit.com/r/MachineLearning/comments/7aajcr/r3_different_types_of_machine_learning/,molode,1509617417,,0,1,False,default,,,,,
68,MachineLearning,t5_2r3gv,2017-11-2,2017,11,2,19,7aakxx,arxiv.org,Unsupervised Machine Translation Using Monolingual Corpora Only,https://www.reddit.com/r/MachineLearning/comments/7aakxx/unsupervised_machine_translation_using/,[deleted],1509618056,[deleted],0,1,False,default,,,,,
69,MachineLearning,t5_2r3gv,2017-11-2,2017,11,2,19,7aalh5,monkeylearn.com,[R]The Divided Kingdom: a machine learning analysis on the Brexit result,https://www.reddit.com/r/MachineLearning/comments/7aalh5/rthe_divided_kingdom_a_machine_learning_analysis/,polllyyy,1509618291,,0,1,False,default,,,,,
70,MachineLearning,t5_2r3gv,2017-11-2,2017,11,2,19,7aaq95,sudarshanwatersoftner.com,Water Conditioner Manufactures in India,https://www.reddit.com/r/MachineLearning/comments/7aaq95/water_conditioner_manufactures_in_india/,gobusinessin,1509620335,,0,1,False,default,,,,,
