,date,year,month,day,hour,id,title,full_link,author,created,selftext,num_comments,score
0,2017-8-1,2017,8,1,9,6qsmim,[R] Fashioning with Networks: Neural Style Transfer to Design Clothes,https://www.reddit.com/r/MachineLearning/comments/6qsmim/r_fashioning_with_networks_neural_style_transfer/,codehacked,1501546788,,0,14
1,2017-8-1,2017,8,1,10,6qsvdm,Will their be jobs in ML outside of companies who only do ML?,https://www.reddit.com/r/MachineLearning/comments/6qsvdm/will_their_be_jobs_in_ml_outside_of_companies_who/,[deleted],1501549396,[removed],0,1
2,2017-8-1,2017,8,1,10,6qsw49,[R] Meta-SGD: Learning to Learn Quickly for Few Shot Learning,https://www.reddit.com/r/MachineLearning/comments/6qsw49/r_metasgd_learning_to_learn_quickly_for_few_shot/,xternalz,1501549618,,5,11
3,2017-8-1,2017,8,1,11,6qt794,Jetson TX1 Development Projects,https://www.reddit.com/r/MachineLearning/comments/6qt794/jetson_tx1_development_projects/,SaC-SeBaS,1501553035,[removed],0,1
4,2017-8-1,2017,8,1,12,6qtknl,[N] Facebook engineers had to ctrl-c their NIPS submission experiments; deep implications about future of human existence.,https://www.reddit.com/r/MachineLearning/comments/6qtknl/n_facebook_engineers_had_to_ctrlc_their_nips/,thebackpropaganda,1501557264,,18,0
5,2017-8-1,2017,8,1,12,6qtkuw,When is an internship worth all the trouble?,https://www.reddit.com/r/MachineLearning/comments/6qtkuw/when_is_an_internship_worth_all_the_trouble/,[deleted],1501557337,[removed],0,1
6,2017-8-1,2017,8,1,13,6qtw07,[P] Pytorch Implementation of Dynamic Memory Networks plus [+ pretrained models],https://www.reddit.com/r/MachineLearning/comments/6qtw07/p_pytorch_implementation_of_dynamic_memory/,dandelin,1501561106,,0,1
7,2017-8-1,2017,8,1,13,6qtzmd,[Project] Open source auto/semi-auto audio mastering/processing. Ideas?,https://www.reddit.com/r/MachineLearning/comments/6qtzmd/project_open_source_autosemiauto_audio/,dannyhw,1501562380,"So my experience with machine learning has been limited to a few courses that were basically case studies on implementation. I do have a strong background in software engineering and strong enough background in audio engineering to get this project going as long as I have guidance on what approach to ML I should take.

I have a data structure designed, and I've already looked into the feasibility of extracting all this data from audio files. It's actually fairly simple. Basically, a song is broken up into measures, and each of those is broken up into frequency bands that are essentially 1 measure long wavs. For each of those, I measure overall loudness using a standard algorithm, and stereo width based on an algorithm that I've already worked out.

A measure made up of bands, their loudness and widths make up the general sound of a mix as it encapsulates the parameters that go into the mixing and mastering process.

Now, the plan is to populate a database with mountains and mountains of records extracted from professionally mixed and mastered major label releases across a wide range of genres. Using this, we should be able to create something that when provided a sound profile on any rough audio mix will build a target profile based on the dynamics found in similar sounding professional recordings. Then a standard loudness normalization algorithm can be fed target values from this target profile. A similar algorithm will be adapted to adjust the stereo width.

In mastering audio this is called multiband dynamics, using a technique called compression, and it's done manually and takes a lot of skill, parameter tweaking that depends on other factors and time. Instead of compression we can achieve the same effect using normalization because we don't have to be linear.

There is a company that offers this as a proprietary service, but they offer a one size fits all process that provides ""good enough"" processing to pass off as mastering, but my intention is to also provide a GUI that will let the user use actual audio engineering skill to easily adjust the values, but in manageable numerical values in chunks of one measure at a time as opposed to drawing linear automation to manipulate an audio signal.

Any help, insight, suggestions would be greatly appreciated. If you have ideas on theory I can handle implementation no problem, and I think the data I'm working with should be very manageable. 

My only documentation so far is a commentated javascript object prototype representing an audio file built as I researched how this could all be done earlier: https://github.com/dabbamont/brainy-mastering/blob/master/design-docs/object-prototypes.js",3,4
8,2017-8-1,2017,8,1,14,6qu57t,[R] [1706.08098] Flexible Rectified Linear Units for Improving Convolutional Neural Networks <---- Beats ELU!,https://www.reddit.com/r/MachineLearning/comments/6qu57t/r_170608098_flexible_rectified_linear_units_for/,darkconfidantislife,1501564462,,48,13
9,2017-8-1,2017,8,1,14,6qu6fc,Looking for suggestions on a neural net design,https://www.reddit.com/r/MachineLearning/comments/6qu6fc/looking_for_suggestions_on_a_neural_net_design/,[deleted],1501564920,[removed],0,1
10,2017-8-1,2017,8,1,14,6qua9k,1.1 Billion Taxi Rides with BrytlytDB & 2 GPU-Powered p2.16xlarge EC2 Instances,https://www.reddit.com/r/MachineLearning/comments/6qua9k/11_billion_taxi_rides_with_brytlytdb_2_gpupowered/,flabbyboggart,1501566479,,0,1
11,2017-8-1,2017,8,1,15,6quhfp,[R] Unsupervised Visual Attribute Transfer with Reconfigurable Generative Adversarial Networks,https://www.reddit.com/r/MachineLearning/comments/6quhfp/r_unsupervised_visual_attribute_transfer_with/,jazzsaxmafia,1501569402,,1,11
12,2017-8-1,2017,8,1,16,6quo2s,An implementation of Hidden Markov Model with Gaussian emissions on top of TensorFlow,https://www.reddit.com/r/MachineLearning/comments/6quo2s/an_implementation_of_hidden_markov_model_with/,kesmarag,1501572206,[removed],0,1
13,2017-8-1,2017,8,1,17,6quvsy,"Numerical Linear Algebra elective in USF's MSAN program, summer 2017",https://www.reddit.com/r/MachineLearning/comments/6quvsy/numerical_linear_algebra_elective_in_usfs_msan/,upulbandara,1501575739,,1,1
14,2017-8-1,2017,8,1,17,6quvzg,DAE find the transfer learning process for tensorflow to be difficult?,https://www.reddit.com/r/MachineLearning/comments/6quvzg/dae_find_the_transfer_learning_process_for/,notrolljustafraid,1501575831,[removed],0,1
15,2017-8-1,2017,8,1,18,6qv2k9,My ly tm,https://www.reddit.com/r/MachineLearning/comments/6qv2k9/my_ly_tm/,vietchemhn,1501578890,,0,1
16,2017-8-1,2017,8,1,19,6qvamo,Color gule lamination kitchen towel and toilet paper rewinding machine p...,https://www.reddit.com/r/MachineLearning/comments/6qvamo/color_gule_lamination_kitchen_towel_and_toilet/,chinatissuemachine,1501582482,,0,1
17,2017-8-1,2017,8,1,19,6qvbu8,[D] Where does this hyped news come from? *Facebook shut down AI that invented its own language.*,https://www.reddit.com/r/MachineLearning/comments/6qvbu8/d_where_does_this_hyped_news_come_from_facebook/,nomaderx,1501583012,"My Facebook wall is full of people sharing this story that Facebook *had* to shut down an AI system it developed that invented it's own language. Here are some of these articles:

[Independent: Facebook's AI robots shut down after they start talking to each other in their own language](http://www.independent.co.uk/life-style/gadgets-and-tech/news/facebook-artificial-intelligence-ai-chatbot-new-language-research-openai-google-a7869706.html)

[BGR: Facebook engineers panic, pull plug on AI after bots develop their own language](http://bgr.com/2017/07/31/facebook-ai-shutdown-language/)

[Forbes: Facebook AI Creates Its Own Language In Creepy Preview Of Our Potential Future](https://www.forbes.com/sites/tonybradley/2017/07/31/facebook-ai-creates-its-own-language-in-creepy-preview-of-our-potential-future/#192e0e29292c)

[Digital Journal: Researchers shut down AI that invented its own language](http://www.digitaljournal.com/tech-and-science/technology/a-step-closer-to-skynet-ai-invents-a-language-humans-can-t-read/article/498142)

EDIT#3: [FastCoDesign: AI Is Inventing Languages Humans Cant Understand. Should We Stop It?](https://www.fastcodesign.com/90132632/ai-is-inventing-its-own-perfect-languages-should-we-let-it) [Likely the first article]

Note that this is related to the work in the *Deal or No Deal? End-to-End Learning for Negotiation Dialogues* paper. On it's own, it is interesting work.

While the article from Independent seems to be the only one that finally gives the clarification *'The company chose to shut down the chats because ""our interest was having bots who could talk to people""'*, **ALL** the articles say things that suggest that researchers went into panic mode, had to 'pull the plug' out of fear, this stuff is scary. One of the articles (don't remember which) even went on to say something like *'A week after Elon Musk suggested AI needs to be regulated and Mark Zuckerberg disagreed, Facebook had to shut down it's AI because it became too dangerous/scary'* (or something to this effect).

While I understand the hype around deep learning (a.k.a backpropaganda), etc., I think these articles are so ridiculous. I wouldn't even call this hype, but almost 'fake news'. I understand that sometimes articles should try to make the news more interesting/appealing by hyping it a bit, but this is almost detrimental, and is just promoting AI fear-mongering. 

EDIT#1: Some people on Facebook are actually believing this fear to be real, sending me links and asking me about it. :/

EDIT#2: As pointed out in the comments, there's also this opposite article:

[Gizmodo: No, Facebook Did Not Panic and Shut Down an AI Program That Was Getting Dangerously Smart](http://gizmodo.com/no-facebook-did-not-panic-and-shut-down-an-ai-program-1797414922)

EDIT#4: And now, BBC joins in to clear the air as well:

[BBC: The 'creepy Facebook AI' story that captivated the media](http://www.bbc.com/news/technology-40790258)

Opinions/comments?  ",206,468
18,2017-8-1,2017,8,1,20,6qviys,Racing Into Machine Learning: Data Readiness & the Developing World,https://www.reddit.com/r/MachineLearning/comments/6qviys/racing_into_machine_learning_data_readiness_the/,LTP1,1501586061,,0,1
19,2017-8-1,2017,8,1,20,6qvpth,[R] The Port of Los Angeles: Sustainable Progress for the Future of the City,https://www.reddit.com/r/MachineLearning/comments/6qvpth/r_the_port_of_los_angeles_sustainable_progress/,lalypopa123,1501588531,,0,1
20,2017-8-1,2017,8,1,21,6qvt6b,How does TensorFlow implement higher order optimizations?,https://www.reddit.com/r/MachineLearning/comments/6qvt6b/how_does_tensorflow_implement_higher_order/,totallynotAGI,1501589674,[removed],0,1
21,2017-8-1,2017,8,1,21,6qvtur,Blogpost - introduction to doc2vec,https://www.reddit.com/r/MachineLearning/comments/6qvtur/blogpost_introduction_to_doc2vec/,[deleted],1501589930,[deleted],0,1
22,2017-8-1,2017,8,1,21,6qvumd,[R] Open Innovation and Crowdsourcing in Machine Learning,https://www.reddit.com/r/MachineLearning/comments/6qvumd/r_open_innovation_and_crowdsourcing_in_machine/,janemoz,1501590169,,0,1
23,2017-8-1,2017,8,1,21,6qvva8,"Is ""Dual Path Network"" the same as ""Pyramidal Residual Network""?",https://www.reddit.com/r/MachineLearning/comments/6qvva8/is_dual_path_network_the_same_as_pyramidal/,followwar,1501590387,[removed],0,1
24,2017-8-1,2017,8,1,21,6qvvsl,[P] Doc2vec introductory blogpost,https://www.reddit.com/r/MachineLearning/comments/6qvvsl/p_doc2vec_introductory_blogpost/,shgidigo,1501590563,,0,6
25,2017-8-1,2017,8,1,21,6qvvwj,[D] How far away are we in CV and AI?,https://www.reddit.com/r/MachineLearning/comments/6qvvwj/d_how_far_away_are_we_in_cv_and_ai/,Writes_A_Bit,1501590601,"Some friends are asking me about AI following that annoying news article about Facebook accidentally building skynet. 

I remember Andrej Karpathy's post about CV specifically from years ago -
http://karpathy.github.io/2012/10/22/state-of-computer-vision/

That was almost 5 years ago. Have we solved any of the tasks he points out? I know we are getting really good at facial recognition, especially famous people...",6,0
26,2017-8-1,2017,8,1,21,6qvwa4,[R] Logistic Regression,https://www.reddit.com/r/MachineLearning/comments/6qvwa4/r_logistic_regression/,digitalson,1501590731,,0,1
27,2017-8-1,2017,8,1,23,6qwgsn,[R] Machine Learning Translation and the Google Translate Algorithm,https://www.reddit.com/r/MachineLearning/comments/6qwgsn/r_machine_learning_translation_and_the_google/,chaitu_005,1501596673,,0,12
28,2017-8-1,2017,8,1,23,6qwjay,[P] What are the best ways to recognize handwritten numbers from images?,https://www.reddit.com/r/MachineLearning/comments/6qwjay/p_what_are_the_best_ways_to_recognize_handwritten/,cccristi07,1501597367,[removed],0,1
29,2017-8-1,2017,8,1,23,6qwjg9,"[R] New ICML 2017 paper ""Meta Networks"" and code",https://www.reddit.com/r/MachineLearning/comments/6qwjg9/r_new_icml_2017_paper_meta_networks_and_code/,tsendsuren,1501597406,"Code and imagenet samples used: https://bitbucket.org/tsendeemts/metanet/


Paper: http://proceedings.mlr.press/v70/munkhdalai17a.html",1,17
30,2017-8-1,2017,8,1,23,6qwrkq,state of art in semantic representations [nlp],https://www.reddit.com/r/MachineLearning/comments/6qwrkq/state_of_art_in_semantic_representations_nlp/,[deleted],1501599531,[removed],0,1
31,2017-8-2,2017,8,2,0,6qwu7d,[D] State of art in LSTM based semantic representations,https://www.reddit.com/r/MachineLearning/comments/6qwu7d/d_state_of_art_in_lstm_based_semantic/,sivu1,1501600182,"LSTMs are used in Seq2Seq models for generating text with preserved syntactic and semantic features. Just when I thought of including part of speech features in LSTM to link words based on grammatical dependency rather than a linear structure, came across another paper ""Improved Semantic Representations From Tree-Structured Long Short-Term Memory Networks"".

As per the claim made in the paper, it outperformed all other semantic representations by July 2015. Is this the current state of art in semantic representation or some other improved model of it ?.

Pointing me towards new model representations also would help.

Just signed up in reddit for my first post. Kindly go easy on me, if my question breaks any rules.
",1,6
32,2017-8-2,2017,8,2,0,6qx4p8,Looking for a suggestion on neural net design,https://www.reddit.com/r/MachineLearning/comments/6qx4p8/looking_for_a_suggestion_on_neural_net_design/,[deleted],1501602799,[removed],0,1
33,2017-8-2,2017,8,2,1,6qxe0q,[R] Photographic Image Synthesis with Cascaded Refinement Networks,https://www.reddit.com/r/MachineLearning/comments/6qxe0q/r_photographic_image_synthesis_with_cascaded/,downtownslim,1501605072,,16,63
34,2017-8-2,2017,8,2,1,6qxe5j,[D] Searching for fundamental research in Neural Networks,https://www.reddit.com/r/MachineLearning/comments/6qxe5j/d_searching_for_fundamental_research_in_neural/,LeanderKu,1501605111,"I feel like most of the posted papers improve certain ideas or architectures. While they may be math & theory heavy (Wasserstein-GAN comes to mind), i don't see progress or even anything regarding more fundamental research on NNs. Is there really a stalemate or are the papers just not ""hyped"" up enough?
While not a complete beginner, i am relatively new to NNs and have only really focused on GANs yet.

Areas that come to my mind (are probably bogus, just to explain what i mean):

* convergence of SGD-like methods in non-convex environments (with maybe respect to the training data?). Not in terms of experimental success, but theoretical properties.
* Other Training-Algorithms, for example algorithms that are good at finding Nash-Equilibria
* any theoretical bounds 
  * generalisation of NNs
  * convergence to acceptable minima
  * loss
* making sense of the weights of trained NNs
* ??

I can't imagine that nobody is working on these topics. Which groups are the most productive? What are ""hot"" topics in these areas?

EDIT: Sorry for the bad formatting",17,23
35,2017-8-2,2017,8,2,2,6qxp2p,"For meaningful latent representation, do we need GAN / VAE?",https://www.reddit.com/r/MachineLearning/comments/6qxp2p/for_meaningful_latent_representation_do_we_need/,HaiBitG,1501607690,[removed],0,1
36,2017-8-2,2017,8,2,2,6qxv8i,Google Cloud + Particle  r/iotml,https://www.reddit.com/r/MachineLearning/comments/6qxv8i/google_cloud_particle_riotml/,onegazillion,1501609119,,0,1
37,2017-8-2,2017,8,2,3,6qyaau,[D] Layer normalization spatial-temporal convolution?,https://www.reddit.com/r/MachineLearning/comments/6qyaau/d_layer_normalization_spatialtemporal_convolution/,crouching_dragon_420,1501612714,"I am trying to implement layer normalization for 3D convolution (https://arxiv.org/abs/1607.06450). From the paper, to do layer normalization, one needs to know the number of output neurons for that layer, then do normalization on inputs to each output neuron. After searching for a while, I found this code (https://github.com/igul222/improved_wgan_training/blob/4fde7f36d697576d06ee0046630064076c196ed6/tflib/ops/layernorm.py) and this article about img2col (https://petewarden.com/2015/04/20/why-gemm-is-at-the-heart-of-deep-learning/, section **How GEMM works for Convolutions**) which helped me to implement layer norm for 2D convolution successfully. From the article, the number of output neurons in 2D convolution is the depth channels. Extend this to 3D case: the output channels for 3D convolution are the temporal channels. However, my model did worse after putting this 3D layer norm in. I guess the cause is the img2col function in the 3D case is different. Maybe the output channels are both depth and temporal channels and my understanding of layer norm for the 2D case is flawed. Anyone has any tips they can share on this layer normalization or the img2col function for 3D convolution? Thanks.",0,3
38,2017-8-2,2017,8,2,5,6qyvvg,[P] Tensorflow response is making no sense,https://www.reddit.com/r/MachineLearning/comments/6qyvvg/p_tensorflow_response_is_making_no_sense/,aadharna,1501617956,"I am using an MLP to predict whether one of two teams who competed against each other will win said match. However, when I execute my TF graph, I'm getting 0% Loss and 100% Accuracy from the very start.

Ive based a lot of an [initial build](https://github.com/aadharna/Destiny/blob/master/TFTake1.ipynb) off of the [CIFAR-10 project I did](https://github.com/aadharna/CIFAR-10_ConvNet/blob/master/image_classification.ipynb), but adapted to my scenario of an MLP rather than a conv-net. 

To make sure that the problem wasn't with my data (such as I included a feature which closely resembles the target) I spent yesterday testing around with different vertical slices of my data set. No matter what variables I input into the network, the result was always the same -- 0% Loss, 100% Accuracy. 

Furthermore, I spun up an simple SVM using sklearn with both the [rapid iteration data set](https://github.com/aadharna/Destiny/blob/master/testing_dataframe_205.csv) (first 1000 lines of the full dataset) and the full data set and ended up with 91% accuracy and 92% accuracy respectively.

This tells me that my problem is not with my data set but instead with TF and my neural network. To further confirm this, [I put together a NN using Keras](https://github.com/aadharna/Destiny/blob/master/KerasNN.ipynb) and got good results (94.8% Accuracy; 12.1% Loss).

Details about the data set: 

I have a 17 individualized statistics for each person who participated in the match, and I've flattened my vectors to be match-specific. Meaning one line of my CSV file is one match with form =: 

> <person0TeamAstats, person1TeamAstats, ..., person5TeamAstats, person0TeamBstats, ..., person5TeamBstats, targetVariable>


Each row of my CSV has 205 statistics. Which, once the target Class is removed shrinks to 204 making each line a 1x204 vector. 


Therefore, I was hoping someone could take a look at my Tensorflow code and point me in the right direction.

Best,

aadharna

Hopefully this question is more fitting than my last one which I asked at the very start of my project. ",2,0
39,2017-8-2,2017,8,2,5,6qz2re,[D] Attention mechanism on linear models.,https://www.reddit.com/r/MachineLearning/comments/6qz2re/d_attention_mechanism_on_linear_models/,ididntgetchickensoup,1501619673,Is there any project or any paper worked in applying attention mechanism or any thing equivalent of it to a simple linear model?,3,3
40,2017-8-2,2017,8,2,5,6qz5qv,Might be able to get a deal on some old dell servers. Worth moving my NLP project off AWS?,https://www.reddit.com/r/MachineLearning/comments/6qz5qv/might_be_able_to_get_a_deal_on_some_old_dell/,findandwrite,1501620438,[removed],0,1
41,2017-8-2,2017,8,2,6,6qz902,Data sets for trolly problems?,https://www.reddit.com/r/MachineLearning/comments/6qz902/data_sets_for_trolly_problems/,Colt85,1501621236,[removed],0,1
42,2017-8-2,2017,8,2,6,6qzc19,[D] Regarding the AI-invented-its-own-language fiasco: Berating the sensationalist media or start AI-journo programs,https://www.reddit.com/r/MachineLearning/comments/6qzc19/d_regarding_the_aiinventeditsownlanguage_fiasco/,VinayUPrabhu,1501621985,"Here is my shtick: The media doesn't emerge out of thin air. As a community, I believe we have failed to allocate enough resources to create a talent pool that sits at the juncture of AI and journalism that would seed the next generation of responsible journos.


Let's discuss some practical solutions, shall we?

1: Udacity nanodegree in AI journalism (Quality control will be an issue)


2: Dual major BS in CS/Communications (my preferred solution)


3: Joint MS in ML/Comm 


4: Comm minor in all PhD programs in CS/ML/AI.


5: 'AI for presidents' classes made compulsory for Comm/Journo majors

IMHO, even if there are 150 decent quality graduates entering the job market every year, the mainstream media landscape will look very different. 
In case such programs already exist that you can vouch for, please share here.

(Will add the suggestions here as edits as they grow)

6: Oversight/ shaming via some kind of peer review from the community


7: Creating and managing curated lists like /r/AIJournalism


",33,50
43,2017-8-2,2017,8,2,7,6qznz3,[R] Learned in translation: contextualized word vectors,https://www.reddit.com/r/MachineLearning/comments/6qznz3/r_learned_in_translation_contextualized_word/,alrojo,1501624965,,1,11
44,2017-8-2,2017,8,2,8,6r02fp,[N] neat-python (evolution of arbitrary neural networks) v0.92 release: large collection of fixes & doc updates (Cross-post /r/Python),https://www.reddit.com/r/MachineLearning/comments/6r02fp/n_neatpython_evolution_of_arbitrary_neural/,CodeReclaimers,1501628821,,4,21
45,2017-8-2,2017,8,2,8,6r060o,100% CNN Based Nudity Detection API (works w/ gray scale),https://www.reddit.com/r/MachineLearning/comments/6r060o/100_cnn_based_nudity_detection_api_works_w_gray/,tim_macgyver,1501629813,,1,1
46,2017-8-2,2017,8,2,8,6r0bb1,One-class classification using Keras,https://www.reddit.com/r/MachineLearning/comments/6r0bb1/oneclass_classification_using_keras/,tmsbn,1501631339,[removed],0,1
47,2017-8-2,2017,8,2,9,6r0hao,[R] Evading malware detectors with machine learning,https://www.reddit.com/r/MachineLearning/comments/6r0hao/r_evading_malware_detectors_with_machine_learning/,Dim25,1501633026,,1,15
48,2017-8-2,2017,8,2,9,6r0jqm,Do you think the only ML jobs will be in companies who specialize in ML?,https://www.reddit.com/r/MachineLearning/comments/6r0jqm/do_you_think_the_only_ml_jobs_will_be_in/,italktogod,1501633754,[removed],0,1
49,2017-8-2,2017,8,2,9,6r0kgn,Is there a way to handle associative arrays in machine learning without casting to a fixed index?,https://www.reddit.com/r/MachineLearning/comments/6r0kgn/is_there_a_way_to_handle_associative_arrays_in/,itchyspacesuit,1501633966,[removed],0,1
50,2017-8-2,2017,8,2,10,6r0u1c,Will machine learning only ever be done in companies that specialize in machine learning?,https://www.reddit.com/r/MachineLearning/comments/6r0u1c/will_machine_learning_only_ever_be_done_in/,shadowbanned225,1501636854,[removed],0,1
51,2017-8-2,2017,8,2,11,6r1biq,TensorFlow Image Recognition on a Raspberry Pi - Silicon Valley Data Science  r/iotml,https://www.reddit.com/r/MachineLearning/comments/6r1biq/tensorflow_image_recognition_on_a_raspberry_pi/,onegazillion,1501642282,,0,1
52,2017-8-2,2017,8,2,15,6r2cku,Long bread semi-auto packaging machine,https://www.reddit.com/r/MachineLearning/comments/6r2cku/long_bread_semiauto_packaging_machine/,lotus698,1501655077,,1,1
53,2017-8-2,2017,8,2,15,6r2e8a,Semi Automatic Ketchup Chili Seasoning Salad Sauce Filling machine HengY...,https://www.reddit.com/r/MachineLearning/comments/6r2e8a/semi_automatic_ketchup_chili_seasoning_salad/,hymachinery,1501655722,,1,1
54,2017-8-2,2017,8,2,16,6r2ke9,Do i really have to cite an arXiv paper?,https://www.reddit.com/r/MachineLearning/comments/6r2ke9/do_i_really_have_to_cite_an_arxiv_paper/,[deleted],1501658337,[deleted],0,1
55,2017-8-2,2017,8,2,17,6r2x0u,My lc phng th nghim,https://www.reddit.com/r/MachineLearning/comments/6r2x0u/my_lc_phng_th_nghim/,vietchemhn,1501664214,,0,1
56,2017-8-2,2017,8,2,18,6r2xj2,From where can I practice Linear regression and Logistic regression?,https://www.reddit.com/r/MachineLearning/comments/6r2xj2/from_where_can_i_practice_linear_regression_and/,rtvuser,1501664449,[removed],0,1
57,2017-8-2,2017,8,2,20,6r3kzd,[P] Detecting the bats outside of my appartment by recognising their sound with Tensorflow,https://www.reddit.com/r/MachineLearning/comments/6r3kzd/p_detecting_the_bats_outside_of_my_appartment_by/,Dutchcheesehead,1501674071,,18,198
58,2017-8-2,2017,8,2,21,6r3vyb,Embedded MNIST running on TensorFlow in the browser,https://www.reddit.com/r/MachineLearning/comments/6r3vyb/embedded_mnist_running_on_tensorflow_in_the/,PascalPrecht,1501677613,,0,1
