,date,year,month,day,hour,id,title,full_link,author,created,selftext,num_comments,score
648,2017-8-16,2017,8,16,23,6u2kzf,Evolutionary Space Invaders - The Math of Intelligence (Week 9),https://www.reddit.com/r/MachineLearning/comments/6u2kzf/evolutionary_space_invaders_the_math_of/,funmaster11,1502895529,,0,1
649,2017-8-17,2017,8,17,0,6u2mz1,[N] Andrew Ng is raising a $150M AI Fund,https://www.reddit.com/r/MachineLearning/comments/6u2mz1/n_andrew_ng_is_raising_a_150m_ai_fund/,wei_jok,1502895993,,63,339
650,2017-8-17,2017,8,17,0,6u2yvn,"Simple Questions Thread August 16, 2017",https://www.reddit.com/r/MachineLearning/comments/6u2yvn/simple_questions_thread_august_16_2017/,AutoModerator,1502898931,[removed],0,1
651,2017-8-17,2017,8,17,1,6u304t,[N] More on Dota 2,https://www.reddit.com/r/MachineLearning/comments/6u304t/n_more_on_dota_2/,funj0k3r,1502899239,,57,45
652,2017-8-17,2017,8,17,1,6u3755,Help with my Neural Network created from scratch,https://www.reddit.com/r/MachineLearning/comments/6u3755/help_with_my_neural_network_created_from_scratch/,MustafaAdam,1502900881,[removed],0,1
653,2017-8-17,2017,8,17,2,6u3gpw,I2T2I: Learning Text to Image Synthesis with Textual Data Augmentation,https://www.reddit.com/r/MachineLearning/comments/6u3gpw/i2t2i_learning_text_to_image_synthesis_with/,zsdh123,1502903146,,0,1
654,2017-8-17,2017,8,17,2,6u3jmc,Robust Vision Benchmark (--&gt;New Adversarial Example Benchmark w. Leaderboard),https://www.reddit.com/r/MachineLearning/comments/6u3jmc/robust_vision_benchmark_new_adversarial_example/,exception99,1502903832,[removed],2,1
655,2017-8-17,2017,8,17,2,6u3k2u,Question about training data to improve the accuracy in Python 3.,https://www.reddit.com/r/MachineLearning/comments/6u3k2u/question_about_training_data_to_improve_the/,Bellevd,1502903946,[removed],0,1
656,2017-8-17,2017,8,17,2,6u3ljo,[D] Is it normal that the maths details are forgotten after reading the paper some time ago ?,https://www.reddit.com/r/MachineLearning/comments/6u3ljo/d_is_it_normal_that_the_maths_details_are/,fixedrl,1502904312,"It happens to me quite often that when I read some papers, going through mathematical parts (equations, proofs), even with some additional notes, the contents are somehow understood quite well. However, after several weeks or even days, it is so easy to forget the exact math tricks in the paper, although it is trivial to get it back by looking at the paper again for few minutes. 

Is it normal to have this phenomenon, or this is something wrong with the method when study new papers. Because we met some guys in a short conversation in kitchen/outdoor, without any reference materials, they can still reconstruct math details, for even very recent papers. ",10,12
657,2017-8-17,2017,8,17,3,6u3xwm,Best Knitting Machines Distributors - PMPL,https://www.reddit.com/r/MachineLearning/comments/6u3xwm/best_knitting_machines_distributors_pmpl/,adclassified,1502907254,,0,1
658,2017-8-17,2017,8,17,3,6u46kt,Scaling Keras Model Training to Multiple GPUs with MXNet,https://www.reddit.com/r/MachineLearning/comments/6u46kt/scaling_keras_model_training_to_multiple_gpus/,harrism,1502909341,,0,1
659,2017-8-17,2017,8,17,3,6u48rt,Off-road dirt racer with creative driving system!!must watch,https://www.reddit.com/r/MachineLearning/comments/6u48rt/offroad_dirt_racer_with_creative_driving/,AdnanRKhan,1502909872,[removed],0,1
660,2017-8-17,2017,8,17,5,6u4q3x,[P] A Self-Organizing Prediction Algorithm,https://www.reddit.com/r/MachineLearning/comments/6u4q3x/p_a_selforganizing_prediction_algorithm/,inboble,1502914054,,7,0
661,2017-8-17,2017,8,17,5,6u50bw,Machine Learning Is The Most Dangerous Trend In Tech (Though Not For The Reasons You Think),https://www.reddit.com/r/MachineLearning/comments/6u50bw/machine_learning_is_the_most_dangerous_trend_in/,georgek9999,1502916520,,0,1
662,2017-8-17,2017,8,17,5,6u5293,"Google now let's you try Image, Natural Language and Speech Recognition Machine learning APIs for Free, within free tier usage limits.",https://www.reddit.com/r/MachineLearning/comments/6u5293/google_now_lets_you_try_image_natural_language/,dave-taylor,1502916986,,0,1
663,2017-8-17,2017,8,17,6,6u59r8,Thoughts on Machine Learning in Relation to File Uploading and Delivery,https://www.reddit.com/r/MachineLearning/comments/6u59r8/thoughts_on_machine_learning_in_relation_to_file/,[deleted],1502918849,[removed],0,1
664,2017-8-17,2017,8,17,6,6u5age,[D] Thoughts on Machine Learning in Relation to File Upload and Delivery,https://www.reddit.com/r/MachineLearning/comments/6u5age/d_thoughts_on_machine_learning_in_relation_to/,[deleted],1502919028,[deleted],1,0
665,2017-8-17,2017,8,17,7,6u5otp,[Research] Learning to Synthesize a 4D RGBD Light Field from a Single Image,https://www.reddit.com/r/MachineLearning/comments/6u5otp/research_learning_to_synthesize_a_4d_rgbd_light/,fieldsoflight,1502922761,,10,57
666,2017-8-17,2017,8,17,8,6u63cw,Advice for feature engineering of text data using a simple vector space approach,https://www.reddit.com/r/MachineLearning/comments/6u63cw/advice_for_feature_engineering_of_text_data_using/,timmaeus,1502926825,[removed],0,1
667,2017-8-17,2017,8,17,8,6u650u,word2vec use case question,https://www.reddit.com/r/MachineLearning/comments/6u650u/word2vec_use_case_question/,toisanji,1502927295,[removed],0,1
668,2017-8-17,2017,8,17,11,6u6ywr,Whiteboard programming questions for DL jobs,https://www.reddit.com/r/MachineLearning/comments/6u6ywr/whiteboard_programming_questions_for_dl_jobs/,deephive,1502936200,[removed],0,1
669,2017-8-17,2017,8,17,11,6u72vp,[P] Understanding overfitting: an inaccurate meme in supervised learning,https://www.reddit.com/r/MachineLearning/comments/6u72vp/p_understanding_overfitting_an_inaccurate_meme_in/,[deleted],1502937443,[deleted],0,0
670,2017-8-17,2017,8,17,12,6u7i33,"[D] Diversity Crisis in AI, 2017 edition  fast.ai",https://www.reddit.com/r/MachineLearning/comments/6u7i33/d_diversity_crisis_in_ai_2017_edition_fastai/,thebackpropaganda,1502942320,,29,0
671,2017-8-17,2017,8,17,13,6u7oum,"Global Deep Filter Market with detailed analysis, Competitive landscape, forecast and strategies 2017",https://www.reddit.com/r/MachineLearning/comments/6u7oum/global_deep_filter_market_with_detailed_analysis/,Robertwadia8,1502944693,,0,1
672,2017-8-17,2017,8,17,13,6u7qu8,Global Eyepieces  Market Outlook and forecast(2017-2022),https://www.reddit.com/r/MachineLearning/comments/6u7qu8/global_eyepieces_market_outlook_and/,Robertwadia8,1502945408,,0,1
673,2017-8-17,2017,8,17,15,6u81x8,Is Romantic Desire Predictable? Machine Learning Applied to Initial Romantic Attraction,https://www.reddit.com/r/MachineLearning/comments/6u81x8/is_romantic_desire_predictable_machine_learning/,alexeyr,1502949644,,0,1
674,2017-8-17,2017,8,17,15,6u84yk,[D] Understanding overfitting: an inaccurate meme in supervised learning,https://www.reddit.com/r/MachineLearning/comments/6u84yk/d_understanding_overfitting_an_inaccurate_meme_in/,arisbw,1502950835,,7,18
675,2017-8-17,2017,8,17,15,6u8ajs,TensorFlow-Bitcoin-Robot,https://www.reddit.com/r/MachineLearning/comments/6u8ajs/tensorflowbitcoinrobot/,fendouai,1502953133,,0,1
676,2017-8-17,2017,8,17,16,6u8btu,The Ultimate Cheatsheet for Machine Learning,https://www.reddit.com/r/MachineLearning/comments/6u8btu/the_ultimate_cheatsheet_for_machine_learning/,[deleted],1502953624,[deleted],0,1
677,2017-8-17,2017,8,17,16,6u8bx0,"[R] Tutorial Training road scene segmentation on Cityscapes with Supervisely, Tensorflow and UNet: Step-by-step guide of how to train UNet neural network on Cityscapes dataset",https://www.reddit.com/r/MachineLearning/comments/6u8bx0/r_tutorial_training_road_scene_segmentation_on/,tdionis,1502953662,,1,0
678,2017-8-17,2017,8,17,16,6u8dxd,How to implement self-driving car?,https://www.reddit.com/r/MachineLearning/comments/6u8dxd/how_to_implement_selfdriving_car/,harewei,1502954539,[removed],0,1
679,2017-8-17,2017,8,17,16,6u8ffr,Azure Cognitive Service to identify products?,https://www.reddit.com/r/MachineLearning/comments/6u8ffr/azure_cognitive_service_to_identify_products/,b00h,1502955217,[removed],0,1
680,2017-8-17,2017,8,17,16,6u8g04,"Using Google Cloud Platform ML APIs researchers developed ""image recognition technology that can reliably identify skin cancer"".",https://www.reddit.com/r/MachineLearning/comments/6u8g04/using_google_cloud_platform_ml_apis_researchers/,dave-taylor,1502955473,,0,1
681,2017-8-17,2017,8,17,17,6u8nvl,[D] Is LSTM Turing complete or not?,https://www.reddit.com/r/MachineLearning/comments/6u8nvl/d_is_lstm_turing_complete_or_not/,ohtwitterclaims,1502959092,"This question is about one of Chollet's tweets: https://twitter.com/fchollet/status/887709906559741952

He claims with no evidence that a) LSTM is not Turing complete and b) convolutional LSTM is Turing complete.

To me, this doesn't make sense.

Argument 1, based on simple RNNs, which are Turing complete (from Siegelmann / Sontag): In LSTM, choose gating weights s.t. all input gates are 1, all forget gates are 0, all output gates are 1. Then we basically have a simple RNN with a saturating squashing function, tanh(tanh(...)), which, even if not proved explicitly in literature, I can't imagine wouldn't end up being Turing complete, given the other literature on sigmoids vs. squashing functions in general. Even if we can't prove this, his claim seems overly strong, as he would have had to prove that they're not Turing complete.

Argument 2, under the assumption that convolutional LSTM is Turing complete: Convolutions are just matrix multiplies with special form, so all convolutional LSTMs can be expressed as LSTMs.

Am I missing something in these arguments?

I know that in the end representability isn't really what should occupy our minds these days (as opposed to learnability / data efficiency), but I still think Turing completeness is powerful and worth discussing.",37,27
682,2017-8-17,2017,8,17,18,6u8sjt,Any one can suggest me How I encourage my child to read?,https://www.reddit.com/r/MachineLearning/comments/6u8sjt/any_one_can_suggest_me_how_i_encourage_my_child/,moon_soon,1502961173,[removed],0,1
683,2017-8-17,2017,8,17,18,6u8sqr,Does getting a 100 % accuracy makes sense?,https://www.reddit.com/r/MachineLearning/comments/6u8sqr/does_getting_a_100_accuracy_makes_sense/,waterRocket8236,1502961267,[removed],1,1
684,2017-8-17,2017,8,17,19,6u8zuf,[R] [1708.04782] StarCraft II: A New Challenge for Reinforcement Learning,https://www.reddit.com/r/MachineLearning/comments/6u8zuf/r_170804782_starcraft_ii_a_new_challenge_for/,[deleted],1502964476,[deleted],0,1
685,2017-8-17,2017,8,17,19,6u918f,TechRepublic on Google Cloud Machine Learning Engine,https://www.reddit.com/r/MachineLearning/comments/6u918f/techrepublic_on_google_cloud_machine_learning/,dave-taylor,1502965055,,0,1
686,2017-8-17,2017,8,17,19,6u93y3,[D] Simple example of using a logistic regression classifier with encrypted weights,https://www.reddit.com/r/MachineLearning/comments/6u93y3/d_simple_example_of_using_a_logistic_regression/,hard_byte,1502966150,,0,1
687,2017-8-17,2017,8,17,19,6u96pl,Shop online to get great deals on Pivot Pins a Metacrust,https://www.reddit.com/r/MachineLearning/comments/6u96pl/shop_online_to_get_great_deals_on_pivot_pins_a/,businessfuel,1502967276,,0,1
688,2017-8-17,2017,8,17,20,6u9evq,Searching the start,https://www.reddit.com/r/MachineLearning/comments/6u9evq/searching_the_start/,akratox,1502970344,[removed],0,1
689,2017-8-17,2017,8,17,21,6u9hed,"[P] Code available for ""Flow Guided Feature Aggregation for Video Object Detection"", powering the winning entry of ImageNet VID 2017.",https://www.reddit.com/r/MachineLearning/comments/6u9hed/p_code_available_for_flow_guided_feature/,flyforlight,1502971229,,1,71
690,2017-8-17,2017,8,17,21,6u9l8a,"I'm working on to make a list of most popular machine learning algorithms based on parameters such as accuracy, speed etc.",https://www.reddit.com/r/MachineLearning/comments/6u9l8a/im_working_on_to_make_a_list_of_most_popular/,mothivenkatesh,1502972520,[removed],0,1
691,2017-8-17,2017,8,17,23,6uaadh,[R] 5 Machine Learning Projects You Can No Longer Overlook,https://www.reddit.com/r/MachineLearning/comments/6uaadh/r_5_machine_learning_projects_you_can_no_longer/,janemoz,1502979842,,0,1
692,2017-8-17,2017,8,17,23,6uac7q,[R] Generative Adversarial Networks (GANs): engine and applications,https://www.reddit.com/r/MachineLearning/comments/6uac7q/r_generative_adversarial_networks_gans_engine_and/,schubi42,1502980334,,6,39
693,2017-8-17,2017,8,17,23,6uacuv,[R] An introduction to TensorFlow queuing and threading,https://www.reddit.com/r/MachineLearning/comments/6uacuv/r_an_introduction_to_tensorflow_queuing_and/,lalypopa123,1502980497,,0,1
694,2017-8-17,2017,8,17,23,6uafye,[R] Five Principles for Good Data Visualization,https://www.reddit.com/r/MachineLearning/comments/6uafye/r_five_principles_for_good_data_visualization/,molode,1502981314,,0,1
695,2017-8-18,2017,8,18,0,6uakm8,[D] Would you release your code if I payed you?,https://www.reddit.com/r/MachineLearning/comments/6uakm8/d_would_you_release_your_code_if_i_payed_you/,helloitsnotme123,1502982475,"I'm an undergraduate student trying to get into the field. I often find myself trying to replicate the results of research papers from past conferences (NIPS, etc) in an attempt to build improvements on top of them, or understand things better.

Every so often, I can't replicate the result and as you can expect the code is not public. The authors take 5-6 days to answer the smallest question and it can eat up a lot of my time to get a proper result, as a lot of models have tricks when implemented, or work only for some specific parameters.

My question is, if I offered to pay you to release your code, would you do it? So it would be sort of a consulting scenario. I want to start asking people this, but am afraid of how they might react and don't want to soil relationships as I'd like to do a PhD one day. I'd rather just pay you and save myself weeks of headaches where I am doing hyperparameter search or trying to implement something I don't completely understand from the paper, but would understand immediately from code.",20,8
696,2017-8-18,2017,8,18,0,6ualye,Simple clustering algorithm,https://www.reddit.com/r/MachineLearning/comments/6ualye/simple_clustering_algorithm/,vovabe,1502982794,,0,1
697,2017-8-18,2017,8,18,0,6uani2,[Discussion] Is this generative technique novel?,https://www.reddit.com/r/MachineLearning/comments/6uani2/discussion_is_this_generative_technique_novel/,DanielWaterworth,1502983170,"I'm interested in generative models and I have an idea that I haven't seen attempted before. I'm interested to see if it's really original or if there's previous research. The idea is take the inputs and mixed them with noise, then train a neural network to decide what the mixing coefficient was. To generate examples, simply start with noise and optimize the pixel values until the network says that it's real. Perhaps a second network could be trained to speed this process up.",23,3
698,2017-8-18,2017,8,18,0,6uaqr1,Best Splicing Machine Optical Fiber || Best Splicing Machine || Fiber Op...,https://www.reddit.com/r/MachineLearning/comments/6uaqr1/best_splicing_machine_optical_fiber_best_splicing/,rjmasud,1502983956,,0,1
699,2017-8-18,2017,8,18,0,6uauqe,Is apache SOLR worth taking the time to learn ?,https://www.reddit.com/r/MachineLearning/comments/6uauqe/is_apache_solr_worth_taking_the_time_to_learn/,0one0one,1502984949,[removed],0,1
700,2017-8-18,2017,8,18,1,6ub7hx,What is representation learning?,https://www.reddit.com/r/MachineLearning/comments/6ub7hx/what_is_representation_learning/,Dawny33,1502988008,,0,1
701,2017-8-18,2017,8,18,1,6ubaf2,TensorFlow 1.3 released,https://www.reddit.com/r/MachineLearning/comments/6ubaf2/tensorflow_13_released/,brtek,1502988706,,50,347
702,2017-8-18,2017,8,18,2,6ubkkk,[1703.01961] Multiplicative Normalizing Flows for Variational Bayesian Neural Networks,https://www.reddit.com/r/MachineLearning/comments/6ubkkk/170301961_multiplicative_normalizing_flows_for/,[deleted],1502991134,[deleted],0,1
703,2017-8-18,2017,8,18,2,6ubkog,[R] [1703.01961] Multiplicative Normalizing Flows for Variational Bayesian Neural Networks,https://www.reddit.com/r/MachineLearning/comments/6ubkog/r_170301961_multiplicative_normalizing_flows_for/,fixedrl,1502991156,,1,4
704,2017-8-18,2017,8,18,2,6ubpk4,Bringing Deep Learning to OpenCL,https://www.reddit.com/r/MachineLearning/comments/6ubpk4/bringing_deep_learning_to_opencl/,taurandat,1502992364,,0,2
705,2017-8-18,2017,8,18,2,6ubq8v,Are there recent machine learning benchmarks for GPUs?,https://www.reddit.com/r/MachineLearning/comments/6ubq8v/are_there_recent_machine_learning_benchmarks_for/,learn2dev,1502992533,[removed],0,1
706,2017-8-18,2017,8,18,3,6ubtdq,"[P] Making a robot learn how to move, part 1  Evolutionary algorithms",https://www.reddit.com/r/MachineLearning/comments/6ubtdq/p_making_a_robot_learn_how_to_move_part_1/,dantehorrorshow,1502993271,,3,8
707,2017-8-18,2017,8,18,3,6ubw7i,Machine Learning on Prefix Trees,https://www.reddit.com/r/MachineLearning/comments/6ubw7i/machine_learning_on_prefix_trees/,bjmconsulting,1502993932,[removed],0,1
708,2017-8-18,2017,8,18,5,6uclk9,TVM: An End to End IR Stack for Deploying the Deep Learning Workloads to Hardwares,https://www.reddit.com/r/MachineLearning/comments/6uclk9/tvm_an_end_to_end_ir_stack_for_deploying_the_deep/,[deleted],1503000028,[deleted],0,1
709,2017-8-18,2017,8,18,5,6uclqs,[P] TVM: An End to End IR Stack for Deploying the Deep Learning Workloads to Hardwares,https://www.reddit.com/r/MachineLearning/comments/6uclqs/p_tvm_an_end_to_end_ir_stack_for_deploying_the/,antinucleon,1503000074,,5,17
710,2017-8-18,2017,8,18,6,6ud9o5,[P] Looking for feedback on my side project,https://www.reddit.com/r/MachineLearning/comments/6ud9o5/p_looking_for_feedback_on_my_side_project/,ianblu1,1503006029,"Hi folks,
I'm gaining a bit of traction on a side project I've been building for a little while around tutorials like this one: https://www.worldlybayes.com/tutorial_sample

The problem I'm looking to solve is that I see a lot of folks entering our field who have spent time learning algorithms and apis, but are missing critical skills needed to add value in companies (critical thinking, product sense, and systems design). I think this just do to lack of exposure and an absence of good examples (eg. there are lots of tutorials on how to use tensorflow for image recognition on MNIST, but very few on how to think about building a product around a deep learning model). So I've been writing a set of tutorials with more of a product development focus in the hopes that I can help out early career folks level up. The first 4 I have planned are:

- Building basic models (linked above)

- Generating feature hypotheses and iterating on a model

- Writing reusable and shareable code to get rid of cut and paste

- Using a database to back your modeling efforts

And then I'll see where it goes from there. I'm looking for feedback around the tutorials I've written: Are they understandable? Do they make sense? Do they seem useful? I'd like to make this as good as it can be and I think this group would be very helpful.

Thanks!",9,6
711,2017-8-18,2017,8,18,7,6udh17,[D] I remember reading about recurrent neural networks running short Python scripts and I'm looking for the source now.,https://www.reddit.com/r/MachineLearning/comments/6udh17/d_i_remember_reading_about_recurrent_neural/,csxeba,1503007898,There was a paper about running short Python scripts and successfully predicting their return values by LSTM recurrent neural networks. Can someone link me to this article? I can't find it anywhere.,1,4
712,2017-8-18,2017,8,18,8,6udt4y,Assembling a team of Deep Learning enthusiasts for a chatroom for General AI research.,https://www.reddit.com/r/MachineLearning/comments/6udt4y/assembling_a_team_of_deep_learning_enthusiasts/,nkoutrou,1503011135,[removed],0,1
713,2017-8-18,2017,8,18,8,6ue26q,[P] The Ultimate Cheat Sheet for Machine Learning,https://www.reddit.com/r/MachineLearning/comments/6ue26q/p_the_ultimate_cheat_sheet_for_machine_learning/,Ipluton,1503013709,,5,51
714,2017-8-18,2017,8,18,9,6ue7fh,[R] Be careful what you reward,https://www.reddit.com/r/MachineLearning/comments/6ue7fh/r_be_careful_what_you_reward/,gdny,1503015201,,4,32
715,2017-8-18,2017,8,18,10,6uemfv,Let chewing gum making machine supplier tell you about the production line of chewing gum and its technological process!,https://www.reddit.com/r/MachineLearning/comments/6uemfv/let_chewing_gum_making_machine_supplier_tell_you/,mixmachinery,1503019652,,0,1
716,2017-8-18,2017,8,18,10,6uenwx,TensorFlow-Bitcoin-Robot,https://www.reddit.com/r/MachineLearning/comments/6uenwx/tensorflowbitcoinrobot/,fendouai,1503020117,[removed],0,1
717,2017-8-18,2017,8,18,11,6uesqz,SMASH: One-Shot Model Architecture Search through HyperNetworks,https://www.reddit.com/r/MachineLearning/comments/6uesqz/smash_oneshot_model_architecture_search_through/,[deleted],1503021643,[deleted],0,1
718,2017-8-18,2017,8,18,11,6uesw7,[R] SMASH: One-Shot Model Architecture Search through HyperNetworks,https://www.reddit.com/r/MachineLearning/comments/6uesw7/r_smash_oneshot_model_architecture_search_through/,ajmooch,1503021686,,32,81
719,2017-8-18,2017,8,18,11,6uf18i,[R] Neural Nets Can Learn Function Type Signatures From Binaries,https://www.reddit.com/r/MachineLearning/comments/6uf18i/r_neural_nets_can_learn_function_type_signatures/,breandan,1503024297,,2,2
720,2017-8-18,2017,8,18,12,6uf610,[D] Explaining ML to sociology students using a cat analogy  looking for feedback.,https://www.reddit.com/r/MachineLearning/comments/6uf610/d_explaining_ml_to_sociology_students_using_a_cat/,rgh,1503025783,"My partner is a sociology student and is going to be using some machine learning techniques for her masters thesis (and possibly PHD). She has been tasked with explaining machine learning to others in the department; in particular her supervisor who struggles to turn on her computer in the morning!

After discussing it with me, and like all good internet users, she decided to use a cat analogy and I wondered if anyone had any thoughts, suggestions or feedback:


&gt; Can you train a cat and a computer?
&gt; 
&gt; In my research I am hoping to use an e-Research technique called 'machine learning' to identify and extract recipes from about 30 years of newspaper and magazine articles. However, as soon as I say machine learning to many in my faculty, I get blank and often bored looks back.
&gt; 
&gt; So, working from the standpoint that machine learning is understandable to all and that everything computing can be explained with reference to cats . . . here is my attempt:
&gt; 
&gt; This is my cat Trilby. She is 17 years old, a moggy and adored beyond the point which is humanly rational. While Trilby finds us acceptable humans (mostly), her main love in life is food. If Trilby had her way, she'd have an endless supply of biscuits in her bowl and would spend the rest of her time in a food coma. Trying to be responsible humans however, we only feed her twice a day.
&gt; 
&gt; Originally, I fed Trilby in the morning, as soon as I got up. Over several iterations of my getting up and feeding her Trilby *learnt* the parameters of breakfast. A pattern was established, the training was repeated several times and she learnt a new behaviour.
&gt; 
&gt; This worked really well . . . for a while.
&gt; 
&gt; Unfortunately, after a time, Trilby also learnt another cue - if I woke up earlier, she got fed earlier. So, she started waking me up earlier and earlier, I would get up and feed her, the training would be reinforced. Until the morning when at 4.00am she woke me up by slipping her paw under the duvet and swiped my hip *with her claws out*. I can tell you this is not a good way to wake up.
&gt; 
&gt; The training had gone awry and we needed to come up with a new training model. So, rather than my feeding her as soon as I got up, my partner started feeding her *after* he'd had a shower. We all struggled with this new training model at first, but over several iterations Trilby learnt the new pattern of behaviour and does not wake my partner (or myself) in the morning.
&gt; 
&gt; This is just the kind of model I will be using in machine learning. At the moment, my computer can't recognise recipes. So, I will give it some cues and parameters and over several iterations of training, much as Trilby learnt the cues for breakfast, my computer will learn to identify a recipe. Then, once my computer has learnt what a recipe looks like, I can leave it to process my magazine and newspaper article download and find the recipes for me.
&gt; 
&gt; Machine learning is not magic, it is yet another process of learning, it's just my computer which is learning, rather than myself or my cat. Training occurs through small, simple iterative steps, which gives it the ability to process more complex tasks  in this case recognising recipes.
",7,2
721,2017-8-18,2017,8,18,13,6ufgb4,Cosine similarity for user comparison,https://www.reddit.com/r/MachineLearning/comments/6ufgb4/cosine_similarity_for_user_comparison/,shittyleetcoder,1503029191,[removed],0,1
722,2017-8-18,2017,8,18,13,6ufnan,Which OS is preferred,https://www.reddit.com/r/MachineLearning/comments/6ufnan/which_os_is_preferred/,yycglad,1503031695,[removed],0,1
723,2017-8-18,2017,8,18,15,6ug04g,NLP Summarization API with context control,https://www.reddit.com/r/MachineLearning/comments/6ug04g/nlp_summarization_api_with_context_control/,[deleted],1503036606,[deleted],0,1
724,2017-8-18,2017,8,18,15,6ug1vf,Content-controllable NLP summarization,https://www.reddit.com/r/MachineLearning/comments/6ug1vf/contentcontrollable_nlp_summarization/,[deleted],1503037330,[deleted],0,1
