,date,year,month,day,hour,id,title,full_link,author,created,selftext,num_comments,score
997,2017-8-25,2017,8,25,2,6vsd58,[P] I would like to add a feature to my model that contains data that is in a tree like structure.,https://www.reddit.com/r/MachineLearning/comments/6vsd58/p_i_would_like_to_add_a_feature_to_my_model_that/,redditpirateroberts,1503595323,"This is an interesting problem I have not had before to do with a project I am working on. So far the data structures of my features have been basic discrete or continuous numbers or categories. Now I find myself needing to add a feature that has a treelike data structure. Googling to try and find out about how to input a tree like data structure as a feature to my model just has things come up to do with a decision tree model type, but not answering my question.

Does any have any experience/insight on how to use tree like data as a feature to their existing model that already has categorical and continous numerical features? I'm pretty stumped as to how to even start doing this. I thought abotu some how converting the tree to series of categorical features or something but that doesn't seem as clean as this could be. ",10,3
998,2017-8-25,2017,8,25,2,6vsg7y,Launching the Speech Commands Dataset,https://www.reddit.com/r/MachineLearning/comments/6vsg7y/launching_the_speech_commands_dataset/,julian88888888,1503596198,,0,1
999,2017-8-25,2017,8,25,2,6vsjtj,Azure vs Scikit-learn/R,https://www.reddit.com/r/MachineLearning/comments/6vsjtj/azure_vs_scikitlearnr/,BaddWolff-,1503597037,[removed],0,1
1000,2017-8-25,2017,8,25,3,6vsmew,Launching the Speech Commands Dataset,https://www.reddit.com/r/MachineLearning/comments/6vsmew/launching_the_speech_commands_dataset/,cognitivedemons,1503597669,,0,1
1001,2017-8-25,2017,8,25,3,6vsqq2,Healthcare cost estimates using k-shortest paths and canonical episodes of care from claims data,https://www.reddit.com/r/MachineLearning/comments/6vsqq2/healthcare_cost_estimates_using_kshortest_paths/,sasaram,1503598715,,0,1
1002,2017-8-25,2017,8,25,3,6vsx41,"[P] Factorization Machine PyTorch layer, with cythonized forward/backward passes",https://www.reddit.com/r/MachineLearning/comments/6vsx41/p_factorization_machine_pytorch_layer_with/,JacksCornellAccount,1503600277,,5,10
1003,2017-8-25,2017,8,25,4,6vt4lu,Artificial Intelligence In Telecoms &amp; Media,https://www.reddit.com/r/MachineLearning/comments/6vt4lu/artificial_intelligence_in_telecoms_media/,slavakurilyak,1503602140,,0,1
1004,2017-8-25,2017,8,25,4,6vt5no,Why the Robots Won't Watch our Movies,https://www.reddit.com/r/MachineLearning/comments/6vt5no/why_the_robots_wont_watch_our_movies/,[deleted],1503602407,[deleted],0,1
1005,2017-8-25,2017,8,25,4,6vt62k,looking for simple Neural networks tutorial,https://www.reddit.com/r/MachineLearning/comments/6vt62k/looking_for_simple_neural_networks_tutorial/,liranbh,1503602498,[removed],0,1
1006,2017-8-25,2017,8,25,4,6vtd52,Generate anime faces with high quality dataset,https://www.reddit.com/r/MachineLearning/comments/6vtd52/generate_anime_faces_with_high_quality_dataset/,HorriblyGood,1503604290,[removed],0,1
1007,2017-8-25,2017,8,25,5,6vtfox,How useful is neuroscience for machine learning?,https://www.reddit.com/r/MachineLearning/comments/6vtfox/how_useful_is_neuroscience_for_machine_learning/,[deleted],1503604903,[removed],0,1
1008,2017-8-25,2017,8,25,5,6vtiok,"Professional software developer, aspiring AI researcher wants to go back to school. Major in CS, Math, or Neuroscience?",https://www.reddit.com/r/MachineLearning/comments/6vtiok/professional_software_developer_aspiring_ai/,theology_,1503605677,[removed],0,1
1009,2017-8-25,2017,8,25,7,6vuhp1,Random Forest for Predicting Family Football Win/Loss Pool,https://www.reddit.com/r/MachineLearning/comments/6vuhp1/random_forest_for_predicting_family_football/,learning4lif3,1503614764,[removed],0,1
1010,2017-8-25,2017,8,25,8,6vur6n,"[D] ""Learning to Navigate in Complex Environments"" - how is the position decoder classifier trained ?",https://www.reddit.com/r/MachineLearning/comments/6vur6n/d_learning_to_navigate_in_complex_environments/,yazriel0,1503617494,"https://arxiv.org/abs/1611.03673

https://www.youtube.com/watch?v=5Rflbx8y7HY#t=9m22s

This paper has several nice tricks. 

The position decoder supposedly shows the agent ""positional belief"" - the last hidden layer is mapped to a distribution over the grid positions.

Can someone please help me understand how the decoder is trained? What  is the labelled data that is used in training ? ",1,3
1011,2017-8-25,2017,8,25,8,6vutlr,[P] Analyzing Google Trends Data in R,https://www.reddit.com/r/MachineLearning/comments/6vutlr/p_analyzing_google_trends_data_in_r/,scottauds,1503618231,,0,3
1012,2017-8-25,2017,8,25,8,6vutx8,Language Modeling SOTA,https://www.reddit.com/r/MachineLearning/comments/6vutx8/language_modeling_sota/,fminkin,1503618328,[removed],0,1
1013,2017-8-25,2017,8,25,10,6vv8vc,[D] Should I take a Machine Learning course in Python or R?,https://www.reddit.com/r/MachineLearning/comments/6vv8vc/d_should_i_take_a_machine_learning_course_in/,ov3rsight,1503622854,"My university offers two crosslisted courses. One is ""Machine Learning"" and the other is ""Intro to Statistical Learning."" They seem to be pretty much the same other than the fact that ML spends a majority of the class on neural nets (so I assume it goes into less depth on the other topics) whereas ISLR doesn't include neural nets at all. Also, ML is taught in Python whereas ISLR is taught in R. Which should I take?",19,7
1014,2017-8-25,2017,8,25,10,6vvik2,Any review papers on the successes/advancements of machine learning?,https://www.reddit.com/r/MachineLearning/comments/6vvik2/any_review_papers_on_the_successesadvancements_of/,34634634535312,1503625912,[removed],0,1
1015,2017-8-25,2017,8,25,11,6vvna7,[D] What value does Machine Learning have to areas outside of Analytics?,https://www.reddit.com/r/MachineLearning/comments/6vvna7/d_what_value_does_machine_learning_have_to_areas/,coolio777,1503627430,"I apologize if I am not clear, but I am not able to understand the non-research, practical applications of Machine Learning in anything outside of data analytics. Considering that everyone these days is interested in ML, there has to be use cases. I would appreciate if someone could point me in the right direction. For example, take a business' HR data where you have data on each employee's satisfaction, performance and similar statistics. Outside of extracting simple information (such as which employees excel in certain category) from this data, I don't see what an ML-based application would look like that a business owner would want.

There has to be something or everyone wouldn't be excited about it, but what is it?",13,2
1016,2017-8-25,2017,8,25,11,6vvqvg,[P] Machine Learning Playground - visualize ML algorithms on a toy canvas,https://www.reddit.com/r/MachineLearning/comments/6vvqvg/p_machine_learning_playground_visualize_ml/,dankityDankityDank,1503628607,,0,1
1017,2017-8-25,2017,8,25,11,6vvsje,Strategies for combining multiple ROC curves,https://www.reddit.com/r/MachineLearning/comments/6vvsje/strategies_for_combining_multiple_roc_curves/,blahsphemer_,1503629168,[removed],0,1
1018,2017-8-25,2017,8,25,12,6vw5fu,[R] Proportionate gradient updates with PercentDelta,https://www.reddit.com/r/MachineLearning/comments/6vw5fu/r_proportionate_gradient_updates_with_percentdelta/,xternalz,1503633577,,3,2
1019,2017-8-25,2017,8,25,13,6vw797,[D] Good physics courses to become an effective ML engineer?,https://www.reddit.com/r/MachineLearning/comments/6vw797/d_good_physics_courses_to_become_an_effective_ml/,[deleted],1503634227,[deleted],0,0
1020,2017-8-25,2017,8,25,15,6vwpdc,New extrusion machine testing on site,https://www.reddit.com/r/MachineLearning/comments/6vwpdc/new_extrusion_machine_testing_on_site/,ada2017,1503641604,,0,1
1021,2017-8-25,2017,8,25,16,6vwz69,Using Google Trends data in R,https://www.reddit.com/r/MachineLearning/comments/6vwz69/using_google_trends_data_in_r/,gjain840,1503646114,,0,1
1022,2017-8-25,2017,8,25,16,6vwzsm,Machine Learning - Lectures,https://www.reddit.com/r/MachineLearning/comments/6vwzsm/machine_learning_lectures/,[deleted],1503646401,[deleted],0,1
1023,2017-8-25,2017,8,25,16,6vx171,[R] CS281: Advanced Machine Learning,https://www.reddit.com/r/MachineLearning/comments/6vx171/r_cs281_advanced_machine_learning/,matoas7,1503647061,,24,94
1024,2017-8-25,2017,8,25,16,6vx1b5,Search or replace keywords / synonyms in documents in O(n) time with FlashText.,https://www.reddit.com/r/MachineLearning/comments/6vx1b5/search_or_replace_keywords_synonyms_in_documents/,vi3k6i5,1503647120,,0,1
1025,2017-8-25,2017,8,25,16,6vx2hr,Build Suggestion: Deep Learning Build For Beginner,https://www.reddit.com/r/MachineLearning/comments/6vx2hr/build_suggestion_deep_learning_build_for_beginner/,DLbeginner,1503647710,[removed],0,1
1026,2017-8-25,2017,8,25,18,6vxb35,[D] Ways to encourage invariance to properties by penalizing our ability to predict such properties from intermediate representations?,https://www.reddit.com/r/MachineLearning/comments/6vxb35/d_ways_to_encourage_invariance_to_properties_by/,reservedsparrow,1503651968,"I'm wondering if there's a standard term for this, or if anyone has any references to examples of this being done.

Probably clearest through an example:

Let's say we want to predict sentiment from speech, and we have data from 10 people. And we know which recordings came from which people.

Now let's say person 7 always sighs when he or she is unhappy, and that we do not expect this to generalize to other people. We'd like our model to ignore these sighs, and instead rely entirely on other properties of the speech signal, and in particular on properties which generalize over speakers.

More generally, let's say I have reason to believe that *no* speaker-specific properties should be used to predict sentiment. I can imagine addressing this by penalizing intermediate features based on their ability to predict the speaker.

Is this common? Is there terminology for this?",3,12
1027,2017-8-25,2017,8,25,18,6vxfwz,"[D] For comparing architectures, is there any correlation between validation error at the very early stage of training and the validation error at later stage?",https://www.reddit.com/r/MachineLearning/comments/6vxfwz/d_for_comparing_architectures_is_there_any/,HigherTopoi,1503654286,"In the paper posted five days ago here about an algorithm called SMASH, the author found a correlation between the validation error of parameters generated by Hypernet and the validation error after an actual weight optimization and exploited it to obtain a good architecture. So, I was wondering if there is any meaningful correlation as in the title. By ""very early,"" I mean somewhere around 1k steps and could be less than a epoch.  ",14,7
1028,2017-8-25,2017,8,25,20,6vxq85,"[R] New approach to Sparse Discriminant Analysis, looking for feedback!",https://www.reddit.com/r/MachineLearning/comments/6vxq85/r_new_approach_to_sparse_discriminant_analysis/,Gumeo,1503658927,"Hi /r/MachineLearning 

I've been working (in collaboration with others) on this R package [accSDA](https://github.com/gumeo/accSDA), (accelerated sparse discriminant analysis), which is now available on [CRAN](https://cran.r-project.org/web/packages/accSDA/index.html). The research behind this has mostly been application of alternative optimization approaches, which are considerably faster than the traditional approach (old version available as an R package [sparseLDA](https://cran.r-project.org/web/packages/sparseLDA/index.html)). I am currently looking for feedback on the package.

**What problem does this package solve?**

This algorithm solves supervised classification problems with multiple classes, where the number of variables can be considerably larger than the number of samples, i.e. *p&gt;&gt;n* problems. The underlying optimization problem that is solved is called *sparse optimal scoring*. This is achieved with an elastic net regularizer.

What the algorithm essentially does, is that it finds the best projection of the data, to a lower dimensional space (representation) for linear separation. These projection vectors the method finds, (discriminant vectors), can be sparse, meaning that the algorithm ""chooses"" the most promising variables to use for the projection, I.e. the ones that matter for the task at hand. After the selection of variables, you can also use another classification algorithm, so you can use this in a sense as a supervised version of sparse PCA, or you can just classify according to the nearest centroid. The dimensionality reduction is better than PCA, because we use the labels, I.e. it is supervised, we are looking for the directions of variation that separate our classes.

I have several example use cases, but the examples in the accompanying paper are rather convincing. Here are a couple of other ones:

  1) I have used this to [detect foreign objects in multispectral X-ray images of food items](https://link.springer.com/chapter/10.1007/978-3-319-59126-1_29). To summarize, these images are like regular images, except each pixel has 128 channels instead of just 3 for red green and blue. So for each pixel we have a spectrogram, that gives a measure of the material composition of the sample. I can release the code for this article and some example data if there is interest.

  2) I used this in a machine learning competition on [hackerrank](https://www.hackerrank.com/indeed-ml-codesprint-2017), the *indeed* challenge. The task was to create a multilabel classifier to tag job descriptions for tags like, BSc degree needed, 5+ years experience needed, etc. In this case I just used the method to select the best terms from my document term matrix and I fed that to xgboost. I was pretty satisfied with my performance, since I am no expert on NLP problems and this was my second ML codesprint. I ended up in the 25th place and got a t-shirt :)

The feedback I am mostly looking for is:

  1) Can you get this to work? Was it hard or easy? Is the documentation clear? Should I add more examples?

  2) Would a semi-supervised version be interesting?

  3) Would a sparse ordinal classifier be interesting? I.e. ordinal labels.

  4) A C++ backend for the R package, that could also be used as a backend for a python implementation.

  5) Any quirks you want to see fixed?

Hope I get some feedback!

Also, if there is another subreddit where this would be relevant, I would like to hear about that!
",2,17
1029,2017-8-25,2017,8,25,20,6vxvhr,What is a recommended way to construct the loss function for GAN with multiple generator/discriminator according to WGAN-GP?,https://www.reddit.com/r/MachineLearning/comments/6vxvhr/what_is_a_recommended_way_to_construct_the_loss/,HigherTopoi,1503661056,[removed],0,1
1030,2017-8-25,2017,8,25,20,6vxxd1,Doing data science in EE department. Good idea?,https://www.reddit.com/r/MachineLearning/comments/6vxxd1/doing_data_science_in_ee_department_good_idea/,reddittUndecidedEE,1503661830,[removed],0,1
1031,2017-8-25,2017,8,25,21,6vy8xj,Deep Learning From Scratch: Theory and Implementation,https://www.reddit.com/r/MachineLearning/comments/6vy8xj/deep_learning_from_scratch_theory_and/,deepideas,1503665864,,0,1
1032,2017-8-25,2017,8,25,22,6vybkq,"[P] Neptune - Machine Learning Lab (experiment tracking &amp; history, easy GPU computing in the cloud)",https://www.reddit.com/r/MachineLearning/comments/6vybkq/p_neptune_machine_learning_lab_experiment/,pmigdal,1503666673,,1,3
1033,2017-8-25,2017,8,25,22,6vydcv,Convolutional Network as input to LSTM Cells for regression,https://www.reddit.com/r/MachineLearning/comments/6vydcv/convolutional_network_as_input_to_lstm_cells_for/,Nox_90,1503667233,[removed],0,1
1034,2017-8-25,2017,8,25,22,6vydkt,[R] Machine Learning - Lectures,https://www.reddit.com/r/MachineLearning/comments/6vydkt/r_machine_learning_lectures/,liranbh,1503667297,,1,4
1035,2017-8-25,2017,8,25,22,6vyfkm,Building Convolutional Neural Networks with Tensorflow,https://www.reddit.com/r/MachineLearning/comments/6vyfkm/building_convolutional_neural_networks_with/,ataspinar,1503667834,,0,1
1036,2017-8-25,2017,8,25,23,6vyswk,I've designed an artificial intelligence driven app that monitors health and predicts injury,https://www.reddit.com/r/MachineLearning/comments/6vyswk/ive_designed_an_artificial_intelligence_driven/,logitapp,1503671259,[removed],0,1
1037,2017-8-25,2017,8,25,23,6vz02d,Can you pre-train an autoencoder with stacked RBMs and also have a sparsity penalty in the cost?,https://www.reddit.com/r/MachineLearning/comments/6vz02d/can_you_pretrain_an_autoencoder_with_stacked_rbms/,mccl30d,1503673102,[removed],0,1
1038,2017-8-26,2017,8,26,0,6vz3om,[R] TensorFlow Object Detection API Tutorial miniseries,https://www.reddit.com/r/MachineLearning/comments/6vz3om/r_tensorflow_object_detection_api_tutorial/,sentdex,1503674026,"After poking around with the object detection API and the sample tutorial code, I of course immediately wanted to train custom objects, but found myself totally lost with the available information regarding how to do it. In my searching it was pretty clear that there were quite a few other people who were totally lost.

So, I stumbled through it and thought I would share a true step-by-step tutorial covering how it's done, by creating a custom macaroni and cheese object detector. Hopefully I can save some other people some time in this process.

I am personally super excited about this Object Detection API from TF. In practice, you can use as low as 100 images for a new object, train for ~1 hr, and have great results. That's really awesome. 

I'll post a breakdown so you can skip through stuff you already know:

1. **[Introduction and Use](https://pythonprogramming.net/introduction-use-tensorflow-object-detection-api-tutorial/)** - Just runs through the initial setup of the API and getting their tutorial notebook running. Pretty simple to do on your own.
2. **[Streaming Object Detection Video from a webcam](https://pythonprogramming.net/video-tensorflow-object-detection-api-tutorial/)** - Modifies the tutorial ipynb code to instead detect from a live webcam feed.
3. **[Tracking Custom Objects Intro](https://pythonprogramming.net/custom-objects-tracking-tensorflow-object-detection-api-tutorial/)** - Outlines the process to detecting a custom object and the image annotation tool I used.
4. **[Creating TFRecords](https://pythonprogramming.net/creating-tfrecord-files-tensorflow-object-detection-api-tutorial/)** - Creating the TFRecord files for training.
5. **[Training Custom Object Detector](https://pythonprogramming.net/training-custom-objects-tensorflow-object-detection-api-tutorial/)** - Setting up the configuration files, getting a checkpoint file to start with, and training.
6. **[Testing Custom Object Detector](https://pythonprogramming.net/testing-custom-object-detector-tensorflow-object-detection-api-tutorial/)** - How to output the frozen inference graph and then use that to detect your new object.

",11,75
1039,2017-8-26,2017,8,26,0,6vz4oz,"[D] I've been trying to get into ML, but I always stop because I don't have anything to apply ML into",https://www.reddit.com/r/MachineLearning/comments/6vz4oz/d_ive_been_trying_to_get_into_ml_but_i_always/,100phil,1503674293,"The reason that I stuck on learning Android development, was that I really needed it to develop an idea.

I really would like to learn ML, due to its potential and impact (and the buzz), but I never stick and stop learning because I don't have any real world need for ML (ML is a tool after all..)

What motivated you to pick up ML? Did you already have a need for it? Did you find something to apply ML after learning it?",33,31
1040,2017-8-26,2017,8,26,0,6vz739,[Question] How can we deal with data from different modalities (Text/Images) using CovNeuralNets?,https://www.reddit.com/r/MachineLearning/comments/6vz739/question_how_can_we_deal_with_data_from_different/,__Julia,1503674924,[removed],0,1
1041,2017-8-26,2017,8,26,0,6vzch9,[P] Fashion-MNIST a MNIST-like fashion product dataset under MIT,https://www.reddit.com/r/MachineLearning/comments/6vzch9/p_fashionmnist_a_mnistlike_fashion_product/,krasul,1503676363,,14,120
1042,2017-8-26,2017,8,26,1,6vzejw,[P] Optimizing WaveNet for realtime or faster voice synthesis (Gibiansky 2017 slides),https://www.reddit.com/r/MachineLearning/comments/6vzejw/p_optimizing_wavenet_for_realtime_or_faster_voice/,gwern,1503676888,,0,26
1043,2017-8-26,2017,8,26,1,6vzeuo,[D] Conv net combined with recurrent net for video analysis?,https://www.reddit.com/r/MachineLearning/comments/6vzeuo/d_conv_net_combined_with_recurrent_net_for_video/,[deleted],1503676971,[deleted],1,1
1044,2017-8-26,2017,8,26,1,6vzkh0,Is one of the Advantages of AI symbolic systems the fact they are good at abstraction and modularity according to Minsky and Papert?,https://www.reddit.com/r/MachineLearning/comments/6vzkh0/is_one_of_the_advantages_of_ai_symbolic_systems/,real_charlie_parker,1503678400,,0,1
1045,2017-8-26,2017,8,26,1,6vzl0k,Deep Learning for Computer Vision with Python: Become a Deep Learning Expert,https://www.reddit.com/r/MachineLearning/comments/6vzl0k/deep_learning_for_computer_vision_with_python/,demosc,1503678552,,0,1
1046,2017-8-26,2017,8,26,2,6vzt5w,Satellite Image Segmentation: a Workflow with U-Net,https://www.reddit.com/r/MachineLearning/comments/6vzt5w/satellite_image_segmentation_a_workflow_with_unet/,GChe,1503680733,,0,13
1047,2017-8-26,2017,8,26,2,6vzxjq,"Belived to have found an interesting result as an amateur, what should I do next ?",https://www.reddit.com/r/MachineLearning/comments/6vzxjq/belived_to_have_found_an_interesting_result_as_an/,[deleted],1503681842,[removed],0,1
1048,2017-8-26,2017,8,26,2,6w05ry,Best website for helping to use machine learning,https://www.reddit.com/r/MachineLearning/comments/6w05ry/best_website_for_helping_to_use_machine_learning/,datascienceguru,1503683898,,0,1
1049,2017-8-26,2017,8,26,3,6w095o,Are error results top 1 or top 5?,https://www.reddit.com/r/MachineLearning/comments/6w095o/are_error_results_top_1_or_top_5/,michaelx99,1503684764,[removed],0,1
1050,2017-8-26,2017,8,26,3,6w0ase,Mixing AI with climate science helps researchers identify previously unknown atmospheric processes &amp; rank climate models,https://www.reddit.com/r/MachineLearning/comments/6w0ase/mixing_ai_with_climate_science_helps_researchers/,ml_i,1503685170,,0,1
1051,2017-8-26,2017,8,26,3,6w0coz,Canonical examples of RNNs?,https://www.reddit.com/r/MachineLearning/comments/6w0coz/canonical_examples_of_rnns/,paleologos,1503685619,[removed],0,1
1052,2017-8-26,2017,8,26,3,6w0h60,Machine Learning and Human Bias,https://www.reddit.com/r/MachineLearning/comments/6w0h60/machine_learning_and_human_bias/,nerdquadrat,1503686756,,0,1
1053,2017-8-26,2017,8,26,3,6w0iii,"[D] I believe to have found an interesting result as an amateur, what should I do next ?",https://www.reddit.com/r/MachineLearning/comments/6w0iii/d_i_believe_to_have_found_an_interesting_result/,twbmsp,1503687091,"**Disclaimer**: It is not, in fact, interesting, as pointed out by u/gabrielgoh [here](https://www.reddit.com/r/MachineLearning/comments/6w0iii/d_i_believe_to_have_found_an_interesting_result/dm4tzpj/). So I suppose if there is something to take out as an amateur is, do not claim it is interesting and just explain your idea because not getting any feedbacks means you are probably doing something wrong.

Hello r/MachineLearning,

To be short (edit: not so much at posteriori), I am a young software engineer (although I was trained as an applied mathematician (master)) with a passion for machine learning (reading a fair amount of papers on my free time). I believe to have found an efficient algorithm for computing the natural gradient of a neural network (with no approximation of the fisher matrix estimate, I just don't inverse it, it is ""Fisher-free"" in a sense). By efficient I mean it is asymptotically O(WB^2 ) where W is the number of weights and B is the batch size used for the Fisher/gradient estimation, and I believe the ""constant in front"" small enough to have a little/reasonable impact relative to the back-propagation. 

What should I do with it ? Should I write a blog post without somebody reviewing it first ? Should I contact authors of papers who wrote on this topic (I have read some of their work for some of them) ?

Note, as context, I am currently a C++ back-end developer (doing some front-end as well, and a fair bit of linux scripting) my work isn't related to ML. I wasn't really serious about it but I always had the idea at the back of my mind that I might be trying to get into a PhD sometimes or apply to Google Brain residency program (with realistically little hope to get in but it can't harm to try). I definitely have some research ideas that I would like to explore. 

Second note; I have never used any of the modern ML framework (beside trying tensorflow C++ API once, bazel felt quite slow), and my old 40$ AMD GPU is good enough to be toying around with GLSL fragment shaders but not exactly build for CNNs training. But I feel familiar enough with theory and modern C++ to be able to implement a small ANN library to test the algorithm (hopefully fairly quickly, with for main limitation my amount of free time).

Thank you very much in advance for your advices (and sorry about the unreasonable amount of parenthesis (and of uses of the word 'amount')).

Cheers !

p.s: Sorry for the people who have seen the first post, but I read the post rules a bit too late to notice the tag was needed or the post would be removed.",17,10
1054,2017-8-26,2017,8,26,3,6w0joi,[R] Neural Nets for Generating Music,https://www.reddit.com/r/MachineLearning/comments/6w0joi/r_neural_nets_for_generating_music/,kcimc,1503687387,,3,12
