,sbr,sbr_id,date,year,month,hour,day,id,domain,title,full_link,author,created,selftext,num_comments,score,over_18,thumbnail,media_provider,media_thumbnail,media_title,media_description,media_url
193,GilmoreGirls,t5_2sria,2019-7-22,2019,7,22,15,cg9ort,self.GilmoreGirls,Question about something Lorelai said,https://www.reddit.com/r/GilmoreGirls/comments/cg9ort/question_about_something_lorelai_said/,carmelacorleone,1563777303,"Season 3 Episode 6 when Lorelai is showing Rory all their catalogues she says, ""our name is to catalogues what Brooke Shield's picture is to Chinese restaurants.""

&amp;#x200B;

What in the plue-pluckered hell does that mean? No amount of Googling could answer the question for me. I'd be grateful for an answer.",6,7,False,self,,,,,
194,GilmoreGirls,t5_2sria,2019-7-22,2019,7,22,21,cgchox,self.GilmoreGirls,[SPOILER] June 3rd,https://www.reddit.com/r/GilmoreGirls/comments/cgchox/spoiler_june_3rd/,FlikNever,1563797959,"What is up with those dates? The loreluke wedding, Rorys court date. Did they timeskip between episodes or something? Because Rory went to court then 3 months afterward, when her and Lorelai got back together, they set a wedding date for June 3rd, which was so soon??? I just dont know if they time traveled between the prodigal  daughter returns and bread like they sometimes do.",10,28,False,spoiler,,,,,
195,GilmoreGirls,t5_2sria,2019-7-23,2019,7,23,2,cgftyy,self.GilmoreGirls,Rory and Doyle,https://www.reddit.com/r/GilmoreGirls/comments/cgftyy/rory_and_doyle/,Pleasedonthover,1563814905,"When Doyle and Paris broke up, Doyle got upset and threw himself at rory when he was drunk. Did anyone else think that rory should have mentioned this to Paris? I know he probably was just really upset and drunk and might not have any actual meaning, but I know if it were me I'd like to know.",20,40,False,self,,,,,
196,GilmoreGirls,t5_2sria,2019-7-23,2019,7,23,3,cggtcj,self.GilmoreGirls,Logan and Rory would never work,https://www.reddit.com/r/GilmoreGirls/comments/cggtcj/logan_and_rory_would_never_work/,chicasparagus,1563819331,"So, after watching the Original run and the revival, Ive come to the conclusion that Rory and Logan are terrible for each other.

Many say Logan and Rory love each other so much that they cant let go even up till the revival. Shows how enduring their love is etc etc 

BUT no, I disagree

I dont think Rory and Logan actually love each other or have the kind of love that would last. 

Reason being, with Logan, everything is an escape. The life and death brigade was an escape, going off and stealing a boat was an escape, bringing Rory away on spontaneous trips was an escape. Appearing on The rooftop for a night all the way from London just for dinner when she misses him provides her with an escape (from how terrible she was feeling). Asking her to marry him and move to the other side of the country was also him seeking for another escape. 
The affair Rory has with him in the revival: E S C A P E

And finally calling her Ace, when everyone else calls her Rory. When theyre together shes not Rory, shes ace. Shes always in a state of escape when shes Ace. 

Now, meanwhile with Jess, sure there was always uncertainty. Rory and jess shared many interests and were similar, they loved reading and writing and the list goes on. Its a shame he was an angry teenager, but who can blame him, his life wasnt easy. But he always believed in providing for himself. He may have not treated Rory right at the point in time, but deep down Jess is the only one who really knows what Rory needs. He steers her back into the right path when shes lost. Its because of him she went back to Yale and its because of him she started writing Gilmore girls  when she easy struggling with her journalistic career.

And with Dean, it was just so genuine and pure. Dean is and always has been more emotionally mature than Rory and he didnt deserve what she did to him. But Im glad Rory had the self respect to admit that Dean always treated her right. She took him for granted because he taught her what safe was. With Dean, its always safe.  

But one thing Rory mentioned to Dean in the revival hit me. 

She says ""That as much as I wish we'd met when I was older and more mature, I know that if I hadn't had you with me when I did, I wouldn't be the person I am today

I realised that its true, if she met Dean later in life,  they probably would have worked. At least worked best out of the three boyfriends. 

Or maybe even Jess. But Logan? Not so much",29,6,False,self,,,,,
197,GilmoreGirls,t5_2sria,2019-7-23,2019,7,23,3,cghccj,self.GilmoreGirls,"Season 5, Episode 9: Emily Says Hello",https://www.reddit.com/r/GilmoreGirls/comments/cghccj/season_5_episode_9_emily_says_hello/,z0mbiegrl,1563821777,"This is one of my favorite episodes for a variety of reasons..  I do have one issue, however.

Rory just gets away with meddling in her parents' relationship by telling Chris not to talk to Lorelai. While her heart may have been in the right place, she WAY overstepped her bounds and I feel like Lorelai just kind of let her.

Thoughts?",13,5,False,self,,,,,
198,GilmoreGirls,t5_2sria,2019-7-23,2019,7,23,7,cgk3p9,self.GilmoreGirls,In what ways is Lorelai good for Luke?,https://www.reddit.com/r/GilmoreGirls/comments/cgk3p9/in_what_ways_is_lorelai_good_for_luke/,HeartRiseAbove,1563834703,"When people talk about their relationship, the discussion boils down to whether/how Luke is good for her and what he offers her (understandably so, given how hes not the protagonist of the show). Thats why I thought itd be neat to open up a thread about her side of their friendship/relationship. 

I'm curious what everyone's thoughts on this - in what ways do you think she helps him or is a good influence on him?",12,5,False,self,,,,,
199,GilmoreGirls,t5_2sria,2019-7-23,2019,7,23,8,cgkm6b,self.GilmoreGirls,Kirk got hitched IRL to a bona fide hotty,https://www.reddit.com/r/GilmoreGirls/comments/cgkm6b/kirk_got_hitched_irl_to_a_bona_fide_hotty/,DebiDebbyDebbie,1563837275,"Sean Gunn married actress Natasha Halevi, and his big bro James Gunn performed the ceremony.  So Kirk is off the market ladies, sorry, you are too late!

[https://pagesix.com/2019/07/22/guardians-of-the-galaxy-star-sean-gunn-marries-actress-natasha-halevi/](https://pagesix.com/2019/07/22/guardians-of-the-galaxy-star-sean-gunn-marries-actress-natasha-halevi/)",30,146,False,self,,,,,
200,GilmoreGirls,t5_2sria,2019-7-23,2019,7,23,8,cgl23e,self.GilmoreGirls,Do you guys think Tristan genuinely liked Rory?,https://www.reddit.com/r/GilmoreGirls/comments/cgl23e/do_you_guys_think_tristan_genuinely_liked_rory/,sadhikaa,1563839597,"Its something I thought about a lot, especially after rewatching season 1. I think he actually did like Rory, but had a weird way of showing it, mainly because of his personality. What do you guys think?",6,1,False,self,,,,,
201,GilmoreGirls,t5_2sria,2019-7-23,2019,7,23,11,cgmvlc,self.GilmoreGirls,Season 6 ep 2 star wars,https://www.reddit.com/r/GilmoreGirls/comments/cgmvlc/season_6_ep_2_star_wars/,Tasisway,1563849861,As a fan of both GG and /prequelmemes I like Luke claiming he has the high ground.,1,10,False,self,,,,,
202,GilmoreGirls,t5_2sria,2019-7-23,2019,7,23,16,cgpkd7,self.tifu,Found a real life Zack posting about Lane and Mrs. Kim,https://www.reddit.com/r/GilmoreGirls/comments/cgpkd7/found_a_real_life_zack_posting_about_lane_and_mrs/,moodblue,1563867731,,3,16,False,default,,,,,
203,GilmoreGirls,t5_2sria,2019-7-23,2019,7,23,17,cgpzd7,self.GilmoreGirls,Ive been rewatching the show and Im only on season 3 but I feel like this time around Im really starting to notice the shitty things they do.,https://www.reddit.com/r/GilmoreGirls/comments/cgpzd7/ive_been_rewatching_the_show_and_im_only_on/,throwaway66279119,1563871146,"I dont remember when I first watched the show but its been years. I just finished episode 6 of season 3 and Rory is being a complete twat. Shes so fucking rude to Jess when he hasnt done anything to her. He accidentally wrecked her car but thats about it. She left for the summer without saying shit to him, while still dating Dean, and then acts like a complete bitch because hes hooking up with someone else. While being super dismissive of Dean. 

It honestly pissed me off that they egged Jess car. I couldnt really tell if ASP was trying to play it as a funny little prank or pointing out that theyre not perfect and can definitely be selfish assholes. The prank in and of itself isnt a huge deal but Rory doing it because shes pissed at Jess for moving on without her is super shitty. Lorelai was also acting shitty for doing it too. 

Also, Rory flipping out on Shane at the beauty store really made me not like her. Im sure Ill come back around. I do love both characters but as of right now I dont particularly like Rory. Personally, Jess deserves better lol. 

Okay, rant over.",88,125,False,self,,,,,
204,GilmoreGirls,t5_2sria,2019-7-24,2019,7,24,2,cgv9jm,self.GilmoreGirls,We're not supposed to be arguing Taylor... We're supposed to be making love.,https://www.reddit.com/r/GilmoreGirls/comments/cgv9jm/were_not_supposed_to_be_arguing_taylor_were/,HeozD,1563901247,,7,83,False,self,,,,,
205,GilmoreGirls,t5_2sria,2019-7-24,2019,7,24,5,cgy0ur,self.GilmoreGirls,Lorelais Season 4 Black Purse,https://www.reddit.com/r/GilmoreGirls/comments/cgy0ur/lorelais_season_4_black_purse/,DomesticSlacker,1563913836,"Who else owned this purse? It was one of the purses of 2004.  It takes me back in time.   I still have mine packed away.  

This show is such a pop culture time capsule.  I love seeing the trends shown as they emerged.",7,7,False,self,,,,,
206,GilmoreGirls,t5_2sria,2019-7-24,2019,7,24,6,cgyf2c,self.GilmoreGirls,Favorite Friday Night Dinner Scenes,https://www.reddit.com/r/GilmoreGirls/comments/cgyf2c/favorite_friday_night_dinner_scenes/,kittykester,1563915648,"I'm now on my 2nd rewatch, and I've been enjoying the Friday night dinner scenes more than ever before. Just saw the ""where did all the anvils go?"" Scene and had a good laugh. What are other great/underappreciated Friday night dinner scenes?",23,22,False,self,,,,,
207,GilmoreGirls,t5_2sria,2019-7-24,2019,7,24,9,ch0pi1,self.GilmoreGirls,"Midway through his first watch, my boyfriend announced that Emily is his favorite character.",https://www.reddit.com/r/GilmoreGirls/comments/ch0pi1/midway_through_his_first_watch_my_boyfriend/,rosiegreens,1563927060,I think this ones a keeper.,26,179,False,self,,,,,
208,GilmoreGirls,t5_2sria,2019-7-24,2019,7,24,10,ch1cnw,self.GilmoreGirls,Do you guys think Lorelei was right to ghost Rory after she chose to take a year off from Yale?,https://www.reddit.com/r/GilmoreGirls/comments/ch1cnw/do_you_guys_think_lorelei_was_right_to_ghost_rory/,kaynutt,1563930607,"I feel like it was a really bad parent move on Loreleis part. Not coming to Rorys court date and not telling her about her engagement. Since she is the mom, I felt like she should have been more supportive of her choices. Im curios about what yall think!",61,11,False,self,,,,,
209,GilmoreGirls,t5_2sria,2019-7-24,2019,7,24,22,ch8dh3,self.GilmoreGirls,The scene we all deserved,https://www.reddit.com/r/GilmoreGirls/comments/ch8dh3/the_scene_we_all_deserved/,sadhikaa,1563975904,"Lorelai telling Richard and Emily that shes getting married to Max instead of them finding out through Sookie. That wouldve been a memorable scene if they approved of him, and I cant stop thinking about it",19,82,False,self,,,,,
210,GilmoreGirls,t5_2sria,2019-7-24,2019,7,24,23,ch8ns0,self.GilmoreGirls,THE ONLY TEAM DEBATE THAT MATTERS,https://www.reddit.com/r/GilmoreGirls/comments/ch8ns0/the_only_team_debate_that_matters/,mkaries,1563977395,"In an heated argument both the girls were insistent that the other had bigger boobs than them. Who do you agree with, which side and team are/were you one in this case, Lorelai or Rory?",11,0,False,self,,,,,
211,GilmoreGirls,t5_2sria,2019-7-25,2019,7,25,1,cha7td,self.GilmoreGirls,Wedding Bell Blues,https://www.reddit.com/r/GilmoreGirls/comments/cha7td/wedding_bell_blues/,z0mbiegrl,1563984790,"This is one of those episodes I have a love/hate relationship with. So many great moments! But so many sad/cruel/embarrassing ones... Rory as Richard's best man is so perfect. I love the whole bachelorette party scene, and the way Lorelai swooped in and improvised to save the night for her mother... on the other side, Emily's meddling and how rude she is to Luke, and that awful fight between Luke and Chris...

I absolutely love Lorelai's purple sequin bolero jacket... but does anyone else think it doesn't exactly fit with Emily's aesthetic?",25,30,False,self,,,,,
212,GilmoreGirls,t5_2sria,2019-7-25,2019,7,25,4,chcoox,self.GilmoreGirls,"GG-referenced Movie Discussion! Let's do it, here's the plan... West Side Story, discussion begins 8/9!",https://www.reddit.com/r/GilmoreGirls/comments/chcoox/ggreferenced_movie_discussion_lets_do_it_heres/,AgnosticUnicorn,1563996216,"Hi beauties! I'm so excited that so many of you are interested in watching old movies and discussing them!!   
I took all of your comments into consideration and decided we'll do a movie every two weeks or so-- people are busy, plus it'll give us time to really form our thoughts :)   
I'm going to pick movies no matter how small the reference, let's hit em all! (I've linked everything at the bottom)  


First up: West Side Story! 

  
This reference is from Episode 1, Season 1, ""Pilot""   
The scene is Lorelai bugging Luke for coffee at the diner:  
 

\[Lorelai picks up another coffee cup and goes back to the counter. Luke gives her a look.\]

**Lorelai**: What? Its not for me. Its for Rory, I swear.

**Luke**: Youre shameless.  
\[Behind Lorelai, Joey approaches Rorys table.\]

**Lorelai**: Look, Officer Krupke. Shes right at that table, right over there.  


The reference: Officer Krupke was the beat cop in both the play and the movie versions of *West Side Story*.  


I'll post on 8/9 so we can discuss! This should give everyone a chance to watch the film. :)  
(This movie is free with Amazon Prime video, if you have it!)

  
Links:   
West Side Story Movie Wiki:  [https://en.wikipedia.org/wiki/West\_Side\_Story\_(1961\_film)](https://en.wikipedia.org/wiki/West_Side_Story_(1961_film))   
West Side Story IMDB:  [https://www.imdb.com/title/tt0055614/](https://www.imdb.com/title/tt0055614/)   
Amazing blog that lists every tiny reference ever:  [https://gilmoregirlsreferencesblog.wordpress.com/page/6/](https://gilmoregirlsreferencesblog.wordpress.com/page/6/)   
Link to gif of the scene:  [https://www.google.com/search?q=gilmore+girls+lorelai+ask+for+coffee&amp;tbm=isch&amp;tbs=rimg:Cc7FTEVnmTEzIjg8njqz9U-BAGjjVR88C33rt0zPoWUrW2KX2MsB2PJPudbUX\_1OcFjjJsb-5JTlxtwXRvFqDpbtQ3yoSCTyeOrP1T4EAEY4Bz5ciwP6TKhIJaONVHzwLfesRWuG1LfO9JDAqEgm3TM-hZStbYhHwO3Td7cUDmioSCZfYywHY8k-5EXmxp2\_1cSb7mKhIJ1tRf85wWOMkRThiEDN7hShMqEgmxv7klOXG3BRFNRUbBonVpzCoSCdG8WoOlu1DfEQiZjAIhIaRU&amp;tbo=u&amp;sa=X&amp;ved=2ahUKEwiyzqzzy8fjAhVHY6wKHc7xCykQ9C96BAgBEBs&amp;biw=1366&amp;bih=608&amp;dpr=1#imgdii=NSI0d2ZqaRIPLM:&amp;imgrc=CrbIqrrm\_12GpM:](https://www.google.com/search?q=gilmore+girls+lorelai+ask+for+coffee&amp;tbm=isch&amp;tbs=rimg:Cc7FTEVnmTEzIjg8njqz9U-BAGjjVR88C33rt0zPoWUrW2KX2MsB2PJPudbUX_1OcFjjJsb-5JTlxtwXRvFqDpbtQ3yoSCTyeOrP1T4EAEY4Bz5ciwP6TKhIJaONVHzwLfesRWuG1LfO9JDAqEgm3TM-hZStbYhHwO3Td7cUDmioSCZfYywHY8k-5EXmxp2_1cSb7mKhIJ1tRf85wWOMkRThiEDN7hShMqEgmxv7klOXG3BRFNRUbBonVpzCoSCdG8WoOlu1DfEQiZjAIhIaRU&amp;tbo=u&amp;sa=X&amp;ved=2ahUKEwiyzqzzy8fjAhVHY6wKHc7xCykQ9C96BAgBEBs&amp;biw=1366&amp;bih=608&amp;dpr=1#imgdii=NSI0d2ZqaRIPLM:&amp;imgrc=CrbIqrrm_12GpM:) 

&amp;#x200B;

Copper Boom!",17,26,False,self,,,,,
213,GilmoreGirls,t5_2sria,2019-7-25,2019,7,25,9,chgg4c,self.GilmoreGirls,"Still noticing things after rewatch 1,0000+",https://www.reddit.com/r/GilmoreGirls/comments/chgg4c/still_noticing_things_after_rewatch_10000/,oh_geez_up_please,1564014419,"I have watched this show countless times, I probably have watched an episode every day since it was put on Netflix back in 2015 and owned the complete DVD set before that, I love this show. I thought I knew every joke but the show is so dense I actually haven't!

&amp;#x200B;

I was amazed to notice for the first time just now that while the band is rehearsing ""A Mighty Fortress"" in S3E15 ""Face-Off"" that Dave doesn't know the word ""abideth."" ""Is abi-death a word?"" Weird I never caught that before.",3,19,False,self,,,,,
214,GilmoreGirls,t5_2sria,2019-7-25,2019,7,25,12,chikbe,self.GilmoreGirls,Unpopular Opinion- I don't like Dave Rygalski,https://www.reddit.com/r/GilmoreGirls/comments/chikbe/unpopular_opinion_i_dont_like_dave_rygalski/,jaylee-03031,1564026545,"The first time I watched the show I actually did like him but then as I got older, I have grown to dislike him.  I am going to age myself but the way he talks to Mrs. Kim reminds me of the way Eddie Haskell would speak to Wally and Beaver's mom and it drives me crazy every time he talks to Mrs. Kim.  He sounds so patronizing to her as he lies straight to her face about his band and sneaks behind her back to see Lane.  Oh and the way he talked to her about those eggless egg sandwiches makes me roll my  eyes so hard.  Sometimes, I skip that scene when that episode comes on.",14,19,False,self,,,,,
215,GilmoreGirls,t5_2sria,2019-7-25,2019,7,25,13,chj3u0,self.GilmoreGirls,I always admired Rory's study habits/abilities,https://www.reddit.com/r/GilmoreGirls/comments/chj3u0/i_always_admired_rorys_study_habitsabilities/,jaylee-03031,1564029956,I have a learning disability so it made school tough for me.  I always admired how Rory was able to study so long and hard as she did and she did so well in a high pressure school like Chilton. I remember a scene where she mentioned to Lorelai that she found it fun to study and learn and it made me a little envious. I wish it would have been fun for me.  I did through lots of hard would and help with counselors graduate high school and college so that makes me proud.,13,70,False,self,,,,,
216,GilmoreGirls,t5_2sria,2019-7-25,2019,7,25,13,chj8ch,self.GilmoreGirls,My mom watches gilmore girls,https://www.reddit.com/r/GilmoreGirls/comments/chj8ch/my_mom_watches_gilmore_girls/,adhdqueenn,1564030774,"Hey everyone! its been awhile! ive been super busy and have been completely forgetting to update so heres a few thoughts she had while watching a few episodes in season 2
-shes getting super frustrated with luke and lorelai (in her own words just date him already its so frustrating)
-she hates sherry, she thinks the women is a box checker. meaning that christopher wanted her to bond with his daughter, and she immediately had to get it over with, but she doesnt actually want to get to know her
-she feels bad for lane with the whole henry situation 
-she thinks the whole basket bidding concept it weird
-SHES TEAM JESS YOU GUYS (she thinks they are more right for each other. while she thinks dean is a good guy, he is kind of bland and isnt really interesting. jess and rory get along really well and shes excited to see how their relationship grows)
-shes happy that sookie and jackson are getting married
-she still doesnt like paris 
-i also sent her a picture of a poster that i wanted for my birthday of luke, lorelai, rory, and logan. and shes now giving me crap for it bc she said that i spoiled the show for her. it makes me laugh bc im like mom the show has been out for almost 20 years its older than me",4,15,False,self,,,,,
217,GilmoreGirls,t5_2sria,2019-7-25,2019,7,25,15,chk6u4,self.GilmoreGirls,Kim and lane-,https://www.reddit.com/r/GilmoreGirls/comments/chk6u4/kim_and_lane/,savi1880,1564037459,"When talking about mothers and daughters no one talk about Kim and lane in this sub. Mrs Kim is really a bad and conservative mother even though she has her heart at right place. Lane is a perfect daughter and a perfect friend/human being. She respects her mother , wants what she wants in her own life and is a good friend to dean , Rory , everybody.",21,1,False,self,,,,,
218,GilmoreGirls,t5_2sria,2019-7-25,2019,7,25,21,chmvkp,self.GilmoreGirls,Do you think Emily bought the ice cream maker?,https://www.reddit.com/r/GilmoreGirls/comments/chmvkp/do_you_think_emily_bought_the_ice_cream_maker/,huffgil11,1564056835,"In the episode where Lorelai tells Emily she called the wedding off, they have a whole exchange about the wedding gift Emily bought that ends with her saying shes just going to put it away and Lor wont know what it is until she finally gets married. 

Then this high end, obviously expensive (Sookie is practically drooling over it) ice cream maker shows up with no card or note. 

So what if Emily sent it trying to do a nice thing but without a note because she didnt want to make it a whole big thing, she just wanted to be nice? She knows how much Lorelai likes ice cream (kind of like when she served pudding) 

Thoughts?",27,96,False,self,,,,,
219,GilmoreGirls,t5_2sria,2019-7-26,2019,7,26,1,chpxfo,self.GilmoreGirls,Whats the worst and best fashion choices on the show?,https://www.reddit.com/r/GilmoreGirls/comments/chpxfo/whats_the_worst_and_best_fashion_choices_on_the/,sadhikaa,1564071801,There have been a lot of ridiculous fashion choices and a lot of great fashion choices! Id like to know what everyone thinks about it!,9,2,False,self,,,,,
220,GilmoreGirls,t5_2sria,2019-7-26,2019,7,26,3,chrqnm,self.GilmoreGirls,Rory getting upset over Lorelai not wanting the book,https://www.reddit.com/r/GilmoreGirls/comments/chrqnm/rory_getting_upset_over_lorelai_not_wanting_the/,starrrlight,1564080212,Do you think it was fair of Rory to get upset with Lorelai for not wanting her to publish the book based on their life?,12,6,False,self,,,,,
221,GilmoreGirls,t5_2sria,2019-7-26,2019,7,26,4,chs19b,self.GilmoreGirls,How they changed Dean after Jess is introduced,https://www.reddit.com/r/GilmoreGirls/comments/chs19b/how_they_changed_dean_after_jess_is_introduced/,Alastor3,1564081586,"Currently rewatching GG a second time and it's bafling the way they changed Dean personnality when Jess is introduced. From the way he was in the pilot and the first few episodes to the season 2, he was like a completely different characters. He liked books at the beginning, was patient, kind, but it seems the authors just loose that side of him to make him distant, cold, almost as if they want Dean to look even colder than Jess.",48,89,False,self,,,,,
222,GilmoreGirls,t5_2sria,2019-7-26,2019,7,26,6,chthzs,self.GilmoreGirls,Just noticed something....,https://www.reddit.com/r/GilmoreGirls/comments/chthzs/just_noticed_something/,shaymotay,1564088541,"In the episode where Mrs. Kim gives Lorelai Lanes wedding dress to alter, she says this is the dress I wore when I married Mr. Kim 28 years ago. But then, the episode of Lanes wedding when Mrs. Kim gives her the wedding night talk, she says if youre lucky like me youll only have to do it once (one of my favorite Mrs. Kim lines) that would imply that she got pregnant with Lane on their wedding night BUT Lane is only 22 years old...?",21,88,False,self,,,,,
223,GilmoreGirls,t5_2sria,2019-7-26,2019,7,26,7,chuvf5,self.GilmoreGirls,Is GG Influenced by Magical Realism?,https://www.reddit.com/r/GilmoreGirls/comments/chuvf5/is_gg_influenced_by_magical_realism/,Stezinec,1564095485,"I've been pondering some of the odd elements like the precognitive dreams that Lorelai has, or the symbolism and repeating of events between Lorelai and Rory.

Here's a [quote](http://michellewittebooks.com/2015/09/elements-of-magical-realism/) on magical realism:

&gt; Time does not always march forward in the magical realist world view. The distant past is present in every moment, and the future has already happened. Great shifts in the narratives time sequence reflect a reality that is almost outside of time. This accounts for ghosts, for premonitions, and the feeling that time is a great repetition rather than a progression.

There's this almost mystical relationship between Lorelai and Rory, as well as in their relationships to their romantic partners.

Do you think ASP was influenced by magical realism?  

Just to note, Gabriel Garca Mrquez is one of her many literary references.  We see Jess reading One Hundred Years of Solitude.",9,6,False,self,,,,,
224,GilmoreGirls,t5_2sria,2019-7-26,2019,7,26,9,chvx4q,self.GilmoreGirls,Why is Robert a villain?,https://www.reddit.com/r/GilmoreGirls/comments/chvx4q/why_is_robert_a_villain/,CLMRLa,1564101326,"Fan fiction reader here.  There are lots of stories that paint Robert as being a jerk and one of Logans adversaries.  He went ONE date with Rory, and as far as I saw, was completely respectful of their relationship when they became exclusive.  He was no more sarcastic to Rory than Colin and Finn. 

So why all the Robert hate?",6,6,False,self,,,,,
225,GilmoreGirls,t5_2sria,2019-7-26,2019,7,26,9,chw2r6,self.GilmoreGirls,What are your favorite moments that happened throughout the series?,https://www.reddit.com/r/GilmoreGirls/comments/chw2r6/what_are_your_favorite_moments_that_happened/,WillowTree100,1564102214,SPOILERS,24,6,False,self,,,,,
226,GilmoreGirls,t5_2sria,2019-7-26,2019,7,26,12,chxk72,self.GilmoreGirls,Question for those of you who rewatch the series,https://www.reddit.com/r/GilmoreGirls/comments/chxk72/question_for_those_of_you_who_rewatch_the_series/,snapplecracklepop29,1564110929,"Do you skip things? Like, do you skip episodes you don't like or particular scenes you don't like? I'm rewatching for the first time and I keep skipping the big fight scenes because I don't like them. Do you guys do the same, or force yourself to watch it over again while reminding yourself they eventually make up or they aren't always going to be so hostile with one another?",24,4,False,self,,,,,
