,sbr,sbr_id,date,year,month,hour,day,id,domain,title,full_link,author,created,selftext,num_comments,score,over_18,thumbnail,media_provider,media_thumbnail,media_title,media_description,media_url
0,GilmoreGirls,t5_2sria,2019-7-1,2019,7,1,11,c7n53i,self.GilmoreGirls,Do you think Rory would have gotten into Harvard in real life or in todays environment?,https://www.reddit.com/r/GilmoreGirls/comments/c7n53i/do_you_think_rory_would_have_gotten_into_harvard/,Singing-Words,1561949297,"Im applying to colleges right now, so as Im rewatching this application process Im really bothered.

Yeah, she had the grades and the school, but what else? That alone isnt enough.

Her extracurriculars were subpar- just one year of student government and then volunteering (but not for anything related to her major). Unless anyone can think of anything else?

The show doesnt mention standardised testing at all besides the PSAT- she did well on that so I assume she would have done well on the SAT, but theres no mention of her actually taking it (and probably stressing about it) that I can remember.

She probably had decent letters of recommendation, but it didnt show her actually having a relationship with any teacher besides maybe Max.

Where is her interview? She went to talk with the alumnus, but that wasnt actually a Harvard-sanctioned interview, so it should have just been another letter or recommendation, which doesnt seem to count for much. 




So overall, she seems like an average student who only wouldve gotten into Harvard by luck if she had great essays. Yale, sure, but she doesnt have any grandparents donating to Harvard.",32,16,False,self,,,,,
1,GilmoreGirls,t5_2sria,2019-7-1,2019,7,1,12,c7nntn,self.GilmoreGirls,Yale wasn't the first time Rory was away from home,https://www.reddit.com/r/GilmoreGirls/comments/c7nntn/yale_wasnt_the_first_time_rory_was_away_from_home/,jaylee-03031,1561952522,"It just clicked form during my latest re-watch that Yale was not Rory's first time away from home.  She spent a whole summer on her own in Washington DC and was roommates with Paris.  I would think you if you could handle living with Paris, you could live with anyone.  I wonder if Rory forgot that she has left home and lived on her own before she got to Yale and got so homesick Lorelai had to spend the night at her dorm her first night at Yale.  She seemed fine in DC and didn't need her mom to fly to DC and be with her.",6,10,False,self,,,,,
2,GilmoreGirls,t5_2sria,2019-7-1,2019,7,1,12,c7no0l,self.GilmoreGirls,Lorelai talking about proposals with Max final season 1,https://www.reddit.com/r/GilmoreGirls/comments/c7no0l/lorelai_talking_about_proposals_with_max_final/,zimmspro,1561952554,"I think this little bit is a good indication that what we saw of Luke and Lorelai's wedding was DEFINITELY Lorelai's dream from day 1. I mean, clearly her black and white outfit was Amy inserting herself into it haha but Lorelai describes the perfect proposal as magical and planned. 

&amp;#x200B;

That said, I also think her and Luke doing that nighttime small vow exchange is ALSO Lorelai, in the untraditional vein. Sure she wants to celebrate this with the town in a huge way but she also loves a spontaneous event, re: harvard road trip that marks an occasion. 

&amp;#x200B;

I know there are continuity errors through the series which isn't remotely uncommon for tv, but I have no real issues with any of it. Sure Rory becomes a little bratty and spoiled but her flailing in her 30s is a result of that IMO and VERY VERY topical for Today.",0,2,False,self,,,,,
3,GilmoreGirls,t5_2sria,2019-7-1,2019,7,1,14,c7ouit,self.GilmoreGirls,"Finished Gilmore Girls, WHAT DO I DO NOW?!",https://www.reddit.com/r/GilmoreGirls/comments/c7ouit/finished_gilmore_girls_what_do_i_do_now/,sillskate,1561960518,"Okay, I know that I need to watch the Netflix revival but what do I do then? I mean I have fallen madly in love with this show and Im completely hooked on the feeling that watching GG gave me, so I must ask the heinous question:
What in the world do I watch now?!
Sounds overly dramatic and ridiculous but I mean I am the type of person who loves to have my next tv series set up for when I want to binge, which is often and frequent. I have a binge-watching problem, it comes with the territory of not having a life. Anyway, how did everyone else get through the realization of finishing Gilmore Girls all together?",21,2,False,self,,,,,
4,GilmoreGirls,t5_2sria,2019-7-1,2019,7,1,16,c7pe28,self.GilmoreGirls,Boys Doin the Twist - Rorys Love Interests,https://www.reddit.com/r/GilmoreGirls/comments/c7pe28/boys_doin_the_twist_rorys_love_interests/,teapotmountain,1561964515,"I just saw the Girls in Bikinis, Boys Doin the Twist Episode (for the umpteenth time). Its one of my favorite episodes: Rory and Paris awkwardly letting loose and of course Luke in jail. Love it.

Anyhow: I just realized that Rorys love interest, the cute guy who liked Rory and Paris kiss, looks just like a taller version of Jess. And I mean strikingly so. Especially from the side. I cant believe I havent noticed this before.

Now this made me think: Rory seems to have a type (counting in Dean as well) - dark haired and more of a bony/manly face. Also Jess and Dean seem more introverted than excessively outgoing.
And then she falls in love with Logan, a blond, round faced short guy, who is very outgoing. Of course I understand that he is well educated and supposedly reads a lot, even though I cant recall a scene where he reads a book (when would he have the time?). Not like Jess for example, he reads all the time (Dean we know, doesnt like to read).

So, next to being a rich guy in contrast to Dean and Jess, he also looks completely different. He is of course very charming, but this bothers me, that Logan does seem to be someone Rory wouldnt look for, according to seasons 1-4...
Do you think this was on purpose?",2,4,False,self,,,,,
5,GilmoreGirls,t5_2sria,2019-7-1,2019,7,1,21,c7s191,self.GilmoreGirls,Muffin Bottoms,https://www.reddit.com/r/GilmoreGirls/comments/c7s191/muffin_bottoms/,unfazedmama,1561984525,"Everytime I eat a muffin, I think about Sookie making Lorelai a basket full of muffin tops because they're the best part and she is desperate for Lorelai to watch the kids last minute. Who eats only the top of muffins?! I'm not sacrificing one bite of those things even to *muffin bottom pie!*

So the question: Did Sookie purposely make them muffin tops to add that extra incentive for Lorelai to watch the kids or is Lorelai known for only half eating muffins?",33,53,False,self,,,,,
6,GilmoreGirls,t5_2sria,2019-7-1,2019,7,1,22,c7sn1m,self.GilmoreGirls,Unpopular GG opinions!,https://www.reddit.com/r/GilmoreGirls/comments/c7sn1m/unpopular_gg_opinions/,Jeannie_ziggy,1561988094,"Post here your unpopular GG opinions!
It is just for the purpose of discussion and seeing different views on the show we love and has nothing to do with hating!",134,15,False,self,,,,,
7,GilmoreGirls,t5_2sria,2019-7-2,2019,7,2,0,c7ttl4,self.GilmoreGirls,Job in Stars Hollow,https://www.reddit.com/r/GilmoreGirls/comments/c7ttl4/job_in_stars_hollow/,wyoell,1561994256,"If you could work anywhere in Stars Hollow, what job would you want to have and why?",20,7,False,self,,,,,
8,GilmoreGirls,t5_2sria,2019-7-2,2019,7,2,1,c7v872,self.GilmoreGirls,If you had to give each character a birthday/Christmas present...,https://www.reddit.com/r/GilmoreGirls/comments/c7v872/if_you_had_to_give_each_character_a/,HeartRiseAbove,1561998942,"...what would it be?

I'd give Luke a toaster because he's always fixing the one he has.

For Lorelai, I'd pull a Demi (from the Gilmore Guys podcast) and help her drive Luke crazy by (slightly) moving a table at Luke's on a daily basis until he notices.",1,3,False,self,,,,,
9,GilmoreGirls,t5_2sria,2019-7-2,2019,7,2,2,c7whlw,self.GilmoreGirls,Mrs. Kim &amp; Her Mother,https://www.reddit.com/r/GilmoreGirls/comments/c7whlw/mrs_kim_her_mother/,mill__haus,1562002600,"Does anyone speak Korean and can translate the conversations between Mrs. Kim and her mother in I Get a Sidekick Out of You? Its so interesting to see Mrs. Kims submissive side when her mother comes to town, and Im dying to know how their conversations went. 

When I put on the subtitles it just says speaking Korean, but Id love to know the translation. Any Korean speakers out there who can help me out?",4,7,False,self,,,,,
10,GilmoreGirls,t5_2sria,2019-7-2,2019,7,2,4,c7z7hu,self.GilmoreGirls,What do you all make of the Milo abuse claims,https://www.reddit.com/r/GilmoreGirls/comments/c7z7hu/what_do_you_all_make_of_the_milo_abuse_claims/,Time_Hornet,1562010646,"Not Jess. Milo. Just found out that there were a lot of Blind Items about him verbally abusing Alexis in public and physically abusing his other co-star (Hayden Pattaniere?). Since MeToo caught traction I am much more inclined to believe blind items, especially if there are multiple ones. Really bummed as Milo seems so lovely, humble and down to earth.",17,0,False,self,,,,,
11,GilmoreGirls,t5_2sria,2019-7-2,2019,7,2,4,c7zbbh,self.GilmoreGirls,How could the girls afford to eat takeout so much?,https://www.reddit.com/r/GilmoreGirls/comments/c7zbbh/how_could_the_girls_afford_to_eat_takeout_so_much/,lemonjadecat,1562011138,"Throughout the whole show we see the Gilmore Girls struggling with money. If thats the case, how could they order take out and/or go to Lukes every day? I feel like usually its cheaper to buy groceries and cook at home, right? I know neither of them could cook but if its a matter of saving money in their position I think they wouldve cared to learn.",34,56,False,self,,,,,
12,GilmoreGirls,t5_2sria,2019-7-2,2019,7,2,7,c80xsw,self.GilmoreGirls,I need help!,https://www.reddit.com/r/GilmoreGirls/comments/c80xsw/i_need_help/,Its-a-lifestyle,1562019146,"I mean this in most non judgmental way! 

I am not sure if my vision is off, something is wrong with my tv or my brain is making up stuff.. but

I just watched S4 ep 2 and 3 today, and something seems off with Lorelais bottom teeth/ tooth? Like she is missing a tooth or its chipped? 

I need help guys. Am I seeing things?",5,7,False,self,,,,,
13,GilmoreGirls,t5_2sria,2019-7-2,2019,7,2,8,c81i71,self.GilmoreGirls,Max completely overeacted about not having a larger role in Rorys life.,https://www.reddit.com/r/GilmoreGirls/comments/c81i71/max_completely_overeacted_about_not_having_a/,billmask92,1562022227,"I have to say i think Max was in the wrong. 
He isn't her ""new"" dad and its not like he bought her up from young.
She is 16/17 practically an adult and doesn't need a new person telling her what to do. 
Lorelai doesn't let Christopher have such a big say in Rorys life. So a step dad my marriage shouldnt either. 

Lorelai set the rules for her and they are working. So Max should just be okay with that.",35,138,False,self,,,,,
14,GilmoreGirls,t5_2sria,2019-7-2,2019,7,2,10,c83ba3,self.GilmoreGirls,So I'm finally going through the series... I have thoughts. (Possible Spoilers),https://www.reddit.com/r/GilmoreGirls/comments/c83ba3/so_im_finally_going_through_the_series_i_have/,tallicdeth,1562032715,"Okay so I started off hating the series, which was misjudged on my part. My wife was watching it many moons ago when she lost her job as a way to take her mind off. I came home from work which lead to me saying something mean, and she threw the remote at my head, subsequently killing the remote. It was a turbulent time of pregnancy hormones...

Fast forward to today. I watched scattered episodes when I would come home and they were on TV, and imagine my wife's surprise when I wanted to start watching it, after we watched the revival, and I had more questions than answers. But now I'm at S4:E16, and I have some things I love about it, and those I still hate.

-I love the spiritual consistency of the show. One way I enjoy this is that every time the Lorelais enter the Gilmore house, the mood of the entire stay in Hartford is set from the jump. To date, this has held up, but it's also commonplace in the revival as well.
-Dean's unrequited love for Rory is a nagging mess. I want to scream at him ""JUST SAY IT ALREADY!""
-I didn't care for Jess as much, but the episode with him wearing the Metallica t-shirt is priceless.
-Paris will not ever fail to be my favorite character to despise, however when she comes crying to Rory because she didn't get into Harvard gave her a much needed sense of humanity we didn't have up to that point. Plus the breakdown on C-SPAN was one of my top 30 moments. Also, how she comes back in the revival was my favorite
-I got misty when Mrs. Kim finds Lane's stash while she was on the way home from CBGB's. That tension in that moment was palpable and that's easily in the top 10 of my favorite moments.
-Sookie pregnant and being even more dangerous in the kitchen than in season one. Always good for a laugh.
-The episode A Scene In A Mall, and Love and War and Snow, two of my absolute favorite Emily Gilmore moments of all. Her trying foods outside of her palette is always great for a laugh and a perfect facial reaction.
-When Emily reads Gran's letter from the night before her wedding while going through the estate, that's so harsh that her escalation in voice is wonderful.
-The seriously bonkers amount of take out. It's one of the most boggling of plot devices ever.
-The episode where Richard and Rory go to the club. It's delightful.
-By far the least favorite moment is the end of the revival. Y'all who know, know.

Feel free to discuss, and point out things I've missed because I'm sure I've missed some good highlights.

For my first post here, I hope y'all enjoy. Kudos.",2,19,False,spoiler,,,,,
15,GilmoreGirls,t5_2sria,2019-7-2,2019,7,2,11,c83jn4,self.GilmoreGirls,The revival,https://www.reddit.com/r/GilmoreGirls/comments/c83jn4/the_revival/,midnightonight,1562034080,"I just finished watching the show and got around to watching the revival. I am so pissed off of how things went.

Especially the rory pregnancy thing. The memory I have of this show isnt the same anymore. I know I can rewatch the series over and over again but the things that happened in the revival will always stick with me.

How do you guys feel about the revival ending?",8,0,False,self,,,,,
16,GilmoreGirls,t5_2sria,2019-7-2,2019,7,2,22,c89fkp,self.GilmoreGirls,being friends with Rory ruined Paris's life,https://www.reddit.com/r/GilmoreGirls/comments/c89fkp/being_friends_with_rory_ruined_pariss_life/,planetsolemn,1562075278,"Paris is an unconventional woman. she isn't exactly the palatable, easy to swallow, likable person that Rory is. and that's hard. it's hard for everyone even someone as wonderful as Paris. doesn't anyone see that having the epitome of everything you want to be dancing in front of you 24/7 isn't good for you? they should never have been friends. as long as Paris and Rory were friends, Paris could never be happy. she would always be reminded of what she's not. what y'all think?",13,0,False,self,,,,,
17,GilmoreGirls,t5_2sria,2019-7-3,2019,7,3,2,c8cbbx,self.GilmoreGirls,Do you think Christopher would have been more involved if Rory had been a boy?,https://www.reddit.com/r/GilmoreGirls/comments/c8cbbx/do_you_think_christopher_would_have_been_more/,Britany274,1562089664,"He seems like the type to want to bond over sports and other typically male pastimes, so I just got to wondering if anyone thinks he would have been more involved early on if Rory had been a boy?",43,31,False,self,,,,,
18,GilmoreGirls,t5_2sria,2019-7-3,2019,7,3,6,c8f5xz,self.GilmoreGirls,Christiane Amanpour,https://www.reddit.com/r/GilmoreGirls/comments/c8f5xz/christiane_amanpour/,mizmode,1562102100,"Watching the series finale again, and I almost forgot that Christiane Amanpour gave Rory her business card. For Rory to send her some of her work and to stay in touch. Does anyone think that Rory didn't take that opportunity? Or maybe she did, and it just didn't work out between the two? CA could only do so much though. I watched the revival and I'm pretty sure that wasn't brought up. Just something I've wondered about after watching that scene.",28,35,False,self,,,,,
19,GilmoreGirls,t5_2sria,2019-7-3,2019,7,3,6,c8flq5,self.GilmoreGirls,How many times have you watched Gilmore Girls all the way through? (Not necessarily including the revival),https://www.reddit.com/r/GilmoreGirls/comments/c8flq5/how_many_times_have_you_watched_gilmore_girls_all/,Carstairs_01,1562104331,,36,8,False,self,,,,,
20,GilmoreGirls,t5_2sria,2019-7-3,2019,7,3,7,c8g2it,self.GilmoreGirls,Pointless Sasha/Anna rant... Season 6 frustrations,https://www.reddit.com/r/GilmoreGirls/comments/c8g2it/pointless_sashaanna_rant_season_6_frustrations/,sillskate,1562106746,"Sherilyn Fenn.... 
Ive moved past the dreaded part of season 6, Im looking at you The Prodigal Daughter Returns, and Im now on to the point of meeting Anna. I knew who she was within seconds of seeing her face. This women really moves in on the men who are involved in Lukes life. I mean cmon, first she is with Jesss dad and then the daughter that she hid from Luke shows up just as stuff with Lorelai is shaping out. I mean I know that ASP enjoyed working with her but in her previous role she had Lily and her life with Jimmy in California. If they wanted to bring Sherilyn back and work with her again, they couldve included her in the storyline in a way that didnt ruin everything. It took us a long time to get to the Luke and Lorelai point so why the change in the storyline?! Also, WHAT HAPPENED TO LILY?! WAS LILY ACTUALLY APRIL AND APRIL WAS PRETENDING TO BE SASHA THEN FOUND JIMMY WHO THEN WENT TO FIND JESS WHICH LED SASHA/ANNA TO LUKE SO SHE COULD LET LILY/APRIL GO FIND LUKE. None of this makes sense but I have a lot of feelings and needed to vent. I am fully aware that this all sounds like the incoherent ramblings of a deranged lunatic.",4,0,False,self,,,,,
21,GilmoreGirls,t5_2sria,2019-7-3,2019,7,3,8,c8gmwx,self.GilmoreGirls,"S5E3 ""Written in the Stars"" I wish they would expand on Maisy and Buddy's relationship with Luke!",https://www.reddit.com/r/GilmoreGirls/comments/c8gmwx/s5e3_written_in_the_stars_i_wish_they_would/,owl_post017,1562109742,"When Luke brings Lorelai to their restaurant and they act sooo pleased that he finally brought a girl there and made them a special dinner with champaign. Luke claims he grew up knowing them, Bud taught him everything he knows, and he comes to their restaurant 2-3 times a week, yet this was the first and ONLY time we ever saw them or heard about them! They were both so sweet. I wish ASP/DP would have put them in the storyline more, and made them be there for Luke like parental figures or at least good friends. I feel like there was a great opportunity for them to be a sweet addition to the rest of the series. Did anyone love them in this episode and wish they were there more often?",26,99,False,self,,,,,
22,GilmoreGirls,t5_2sria,2019-7-3,2019,7,3,10,c8hyyu,self.GilmoreGirls,Deans thoughts on respect,https://www.reddit.com/r/GilmoreGirls/comments/c8hyyu/deans_thoughts_on_respect/,docnja,1562117638,"The night that Dean and Rory sleep together. A few scenes later Dean and Lindsay are home arguing about how Lindsay answered his phone when he wasnt home (when Rory called and hung up bc Lindsay answered the call).

Then he says to Lindsay you have absolutely no respect for me at all.

Oh okay, but what were you just doing about an hour ago, Dean? Ive always liked Dean, but this was the moment that changed my mind.",5,14,False,self,,,,,
23,GilmoreGirls,t5_2sria,2019-7-3,2019,7,3,11,c8ic37,self.GilmoreGirls,S1E16 Star Crossed Lovers amd Other Strangers,https://www.reddit.com/r/GilmoreGirls/comments/c8ic37/s1e16_star_crossed_lovers_amd_other_strangers/,ginnyeveivashkov32,1562119865,"By far one of my favorite tiny moments in season 1 happens at FND... 

Lorelai makes her DAR/darn joke and she's looking around wait for anyone to crack a smile. The awkward dinner date Chase can't comprehend what she just said and Emily is trying very hard not to call her out because they have a guest. 

But Richard... the dad at the table just gives her the look every person on the face the planet gives when hearing a dad joke. The rolling eyes, exasperated sigh and immediately finding something, anything else to occupy yourself with so you don't get drawn in for another round. His look is priceless, on point and hysterical. 

I love Richard. Anyone else got a tiny moment favorite from this season? Just a look or reaction that makes a scene?",16,24,False,self,,,,,
24,GilmoreGirls,t5_2sria,2019-7-3,2019,7,3,12,c8jdpd,self.GilmoreGirls,parallels between Lorelai/Anna/Sherry,https://www.reddit.com/r/GilmoreGirls/comments/c8jdpd/parallels_between_lorelaiannasherry/,emmsyy,1562126359,"rewatching for the third time with my bf for his first, and we are nearing the end of season two... I just noticed that there is a sort of parallel between Lorelai and Sherry (S2E14 ""it should have been Lorelai"") and Anna and Lorelai when it comes to the whole dad and his girlfriend/fiance thing. 

It just struck me that the basis of the situation in this episode, where Sherry wants to be a part of Rory's life and take her out, and Lorelai is a bit reluctant, is so very similar to the whole Anna &amp; April &amp; Lorelai thing. I know that it's a heavily agreed upon thing that Anna doesn't handle the situation well, but I think especially when compared to Anna, Lorelai handles this very well. 

Interestingly enough my initial impression was that Lorelai could have handled it better, because she was totally acting possessive and weird (although may have had to do with Sherry's comments about not having to know each other), until these parallels/comparisons occurred to me. 

it's also interesting because it never occurred to me before and I wonder if ASP intentionally had any sort of mirroring or if it was coincidental and just happens in a show with single moms and dads in relationships. 

anyone else notice this before?",6,1,False,self,,,,,
25,GilmoreGirls,t5_2sria,2019-7-3,2019,7,3,13,c8jkjb,self.GilmoreGirls,"I do not have to defend my life to you. Im a grown-up, Im independent, Im on my own.",https://www.reddit.com/r/GilmoreGirls/comments/c8jkjb/i_do_not_have_to_defend_my_life_to_you_im_a/,DizzyManda,1562127567,"Rory, in her grandparents pool house which her grandmother is redecorating for her. Love the show, but these chicks really think they hit a home run when they were born on third.",26,176,False,self,,,,,
26,GilmoreGirls,t5_2sria,2019-7-3,2019,7,3,13,c8jwrq,self.GilmoreGirls,Were Jess and Shane having sex in one's got class and the other one dyes?,https://www.reddit.com/r/GilmoreGirls/comments/c8jwrq/were_jess_and_shane_having_sex_in_ones_got_class/,jaylee-03031,1562129850,[removed],0,1,False,self,,,,,
27,GilmoreGirls,t5_2sria,2019-7-3,2019,7,3,14,c8k25g,self.GilmoreGirls,Jess &amp; Shane having sex/Lorelai's talk to the class-One's got class and and the other one dyes,https://www.reddit.com/r/GilmoreGirls/comments/c8k25g/jess_shane_having_sexlorelais_talk_to_the/,jaylee-03031,1562130885,"I just watched One's Got Class and the Other One Dyes last night.  I thought Lorelai handled the situation when she was speaking to the class and they kept asking about her pregnancy very well.  She was caught off guard but she was honest about it. and handled it well. She wasn't telling anyone to get pregnant but that if someone found themselves pregnant, to continue with their education.  I also like how she handled the moms and agree that parents should talk with their kids about even the uncomfortable subjects like sex.  I was proud of her and Luke looked pretty amused watching her talk to those moms.  

Were Jess and Shane having sex in the apartment just before Luke and Lorelai showed up there?  They walked in and Jess was adjusting the front of his pants and tucking in shirt while Shane was hiding in the closet.  If so, that was an interesting parallel between Lorelai's conversation about her pregnancy with the class and Jess/Shane having sex.  It also makes me wonder what a teenage Jess would have done if Shane got pregnant.  Would he repeat his father's abandonment or be there and help raise his child.",2,0,False,self,,,,,
28,GilmoreGirls,t5_2sria,2019-7-3,2019,7,3,14,c8kbj4,self.GilmoreGirls,Jess and Shane/Lorelai and the clas/moms-One's got class and the other one dyes,https://www.reddit.com/r/GilmoreGirls/comments/c8kbj4/jess_and_shanelorelai_and_the_clasmomsones_got/,jaylee-03031,1562132735," 

I  just watched One's Got Class and the Other One Dyes last night.  I  thought Lorelai handled the situation when she was speaking to the class  and they kept asking about her pregnancy very well.  She was caught off  guard but she was honest about it. and handled it well. She wasn't  telling anyone to get pregnant but that if someone found themselves  pregnant, to continue with their education.  I also like how she handled  the moms and agree that parents should talk with their kids about even  the uncomfortable subjects like sex.  I was proud of her and Luke looked  pretty amused watching her talk to those moms.

Were  Jess and Shane having sex in the apartment just before Luke and Lorelai  showed up there?  They walked in and Jess was adjusting the front of  his pants and tucking in shirt while Shane was hiding in the closet.  If  so, that was an interesting parallel between Lorelai's conversation  about her pregnancy with the class and Jess/Shane having sex.  It also  makes me wonder what a teenage Jess would have done if Shane got  pregnant.  Would he repeat his father's abandonment or be there and help  raise his child.",2,8,False,self,,,,,
