,sbr,sbr_id,date,year,month,hour,day,id,domain,title,full_link,author,created,selftext,num_comments,score,over_18,thumbnail,media_provider,media_thumbnail,media_title,media_description,media_url
64,GilmoreGirls,t5_2sria,2019-7-7,2019,7,7,23,ca7i5n,self.GilmoreGirls,Dean was a terrible first boyfriend.,https://www.reddit.com/r/GilmoreGirls/comments/ca7i5n/dean_was_a_terrible_first_boyfriend/,youresoartdeco,1562510324,"I think Dean was horrible first boyfriend for Rory. He was jealous, and whenever Jess came around he would get all mopey. Like in S2 E16, when Jess, Rory, and Paris were eating at Rorys house. Rory was able to convince him that Paris and Jess were on a date, which she did because she knew he be angry with her for just hanging out with him. Even then he was STILL all pouty and just shut down, rather than communicating his feelings. He would smother her with love and attention, even when she made it clear she wanted some alone time. Like when he called her around 14 times in the span a few hours, when she was working on a school project. And that isnt even the beginning of his problems. When he started a fight with Tristan at the school dance, I felt like he did it to establish territory over Rory, not to protect her. 
Hed get mad over such trivial things, like Rory taking off her bracelet. Like who gets mad about that?? 
And last but not least, he got MAD at her when she couldnt say I love you. That was when I realized I couldnt stand him!! 
I dont think Dean was a bad person. I think he was just very insecure and immature even for 17. I dont think it was good for her to be with such an intense person at such a young age.",2,2,False,self,,,,,
65,GilmoreGirls,t5_2sria,2019-7-8,2019,7,8,3,ca9wnq,self.GilmoreGirls,How did Rory screw her life up so bad?,https://www.reddit.com/r/GilmoreGirls/comments/ca9wnq/how_did_rory_screw_her_life_up_so_bad/,mther0dragons,1562523125,"While I refuse to accept the revival as cannon (I might be slightly bitter) it has left me wondering how the heck Rory got into such a bad place. And Im not talking just being career confused because honestly that seemed fairly plausible and up to character due to her pampered upbringing. 

But this girl had 2 trust funds she would receive at 25. One from her great grandma and one from her grandparents. Both are mentioned in the series (however briefly) and we knew that the one from her great grandmother was at least a quarter of a million dollars. So how on earth was this girl living between homes? I cant imagine she completely blew through 2 trust funds of substantial money. Even taking into account rent and travel thats still a lot of money and should of lasted her well into adulthood. 

So at the very least she should have underwear. But yet she still complains she cant find any of her clothes or even afford underwear. Im probably overthinking but goodness this really bothers me. She may not have a lavish life but she certainly should be better off than too broke for underwear.",35,21,False,self,,,,,
66,GilmoreGirls,t5_2sria,2019-7-8,2019,7,8,8,caddls,self.GilmoreGirls,Miss Patty in 1975,https://www.reddit.com/r/GilmoreGirls/comments/caddls/miss_patty_in_1975/,Time_Hornet,1562541225,"[https://www.youtube.com/watch?v=T2tKFr7k4QA](https://www.youtube.com/watch?v=T2tKFr7k4QA)

&amp;#x200B;

She barely changed.",6,31,False,self,,,,,
67,GilmoreGirls,t5_2sria,2019-7-8,2019,7,8,9,caecl6,self.GilmoreGirls,Taylor losing the election to Jackson,https://www.reddit.com/r/GilmoreGirls/comments/caecl6/taylor_losing_the_election_to_jackson/,Time_Hornet,1562546949,The scene alone in the shop eating whipped cream actually breaks my heart.,27,86,False,self,,,,,
68,GilmoreGirls,t5_2sria,2019-7-8,2019,7,8,12,cag4ia,self.GilmoreGirls,Miss Patty doppelgnger??,https://www.reddit.com/r/GilmoreGirls/comments/cag4ia/miss_patty_doppelgnger/,lemonjadecat,1562557840,"This guest at my place of work looked weirdly like Miss Patty, but her friend was kind of mean to me! Must not have been a Stars Hollow friend...",4,1,False,self,,,,,
69,GilmoreGirls,t5_2sria,2019-7-9,2019,7,9,0,camay6,self.GilmoreGirls,If I were Luke...,https://www.reddit.com/r/GilmoreGirls/comments/camay6/if_i_were_luke/,sign09,1562598886,"I would not have taken Lorelai back after marrying Chris. 

Don't get me wrong: I still love Lorelai as a character/ship her with Luke very hard, but whenever I re-watch season 7 and actually apply real-life-standards to their situation I come to the conclusion that I, in Luke's shoes, would have been done with the relationship after what happened in season 7. Probably a pretty unpopular opinion, but I still felt like sharing it and see how others judge the situation.",120,84,False,self,,,,,
70,GilmoreGirls,t5_2sria,2019-7-9,2019,7,9,2,canuh6,self.GilmoreGirls,Liz before and after we meet her,https://www.reddit.com/r/GilmoreGirls/comments/canuh6/liz_before_and_after_we_meet_her/,Banjanjo,1562606051,"They make her sound like a friggin' trainwreck!! Repeatedly!! And when we finally meet her, she's a bit eccentric but not the totally unhinged mom they build her up to be. She's funny, insightful, kind... 

Do we ever get an explanation from ASP about the total character rewrite?",8,8,False,self,,,,,
71,GilmoreGirls,t5_2sria,2019-7-9,2019,7,9,2,cao9o4,self.GilmoreGirls,Does it freak anyone else out that Anna is so much like Lorelai?,https://www.reddit.com/r/GilmoreGirls/comments/cao9o4/does_it_freak_anyone_else_out_that_anna_is_so/,mari_toujours,1562607932,"I don't know, it makes me feel like Lorelai is like a replacement for her for Luke or something. It's not a serious thing or anything, just a thought that's sticking in my brain.",10,4,False,self,,,,,
72,GilmoreGirls,t5_2sria,2019-7-9,2019,7,9,2,caoes0,self.GilmoreGirls,"Happy Birthday, Milo Ventimiglia fave moments",https://www.reddit.com/r/GilmoreGirls/comments/caoes0/happy_birthday_milo_ventimiglia_fave_moments/,geekiod,1562608573,"Happy Birthday, Milo Ventimiglia!

What is your favourite Jess moments?",18,19,False,self,,,,,
73,GilmoreGirls,t5_2sria,2019-7-9,2019,7,9,4,captr8,self.GilmoreGirls,Rory and Logan's separation,https://www.reddit.com/r/GilmoreGirls/comments/captr8/rory_and_logans_separation/,HeyItsLers,1562614793,"I'm curious what the differing opinions are about Rory and Logan's separation. Who do you think was in the right? Should they have gotten back together? I've always been team Logan, but I can definitely see both sides.",10,3,False,self,,,,,
74,GilmoreGirls,t5_2sria,2019-7-9,2019,7,9,6,cark5w,self.GilmoreGirls,"Rewatch #1473927, just noticed some guy holding a chicken in the background",https://www.reddit.com/r/GilmoreGirls/comments/cark5w/rewatch_1473927_just_noticed_some_guy_holding_a/,redrosie10,1562622881,"So Im watching episode 18 of season 2 as Im eating dinner and out of the corner of my eye I notice something. A chicken something. 

I rewound and yep, its a [guy holding a chicken](https://imgur.com/a/bnaT5zZ) in a bag. Still finding new things every time ",16,132,False,self,,,,,
75,GilmoreGirls,t5_2sria,2019-7-9,2019,7,9,11,caupfz,self.GilmoreGirls,Wouldn't Rory's last name be Hayden?,https://www.reddit.com/r/GilmoreGirls/comments/caupfz/wouldnt_rorys_last_name_be_hayden/,Ericr4422,1562639306,,13,0,False,self,,,,,
76,GilmoreGirls,t5_2sria,2019-7-9,2019,7,9,13,caw01r,self.GilmoreGirls,Rewatch #infinite,https://www.reddit.com/r/GilmoreGirls/comments/caw01r/rewatch_infinite/,110hnv,1562646813,"I just realized something cute, funny and interesting at the same time. Kirk asking Laurelai out - Laurelai's face is priceless whrn he says ""you're the prettiest woman I've ever seen outside of filthy magazines"" boy!!!! That was a moment!!!!",4,13,False,self,,,,,
77,GilmoreGirls,t5_2sria,2019-7-9,2019,7,9,15,cawwrz,self.GilmoreGirls,Gilmore Girls is the only thing keeping me from setting myself on fire,https://www.reddit.com/r/GilmoreGirls/comments/cawwrz/gilmore_girls_is_the_only_thing_keeping_me_from/,taciturntilly,1562652650,I'm really channeling Rory real hard while doing my homework.,8,100,False,self,,,,,
78,GilmoreGirls,t5_2sria,2019-7-9,2019,7,9,15,cax945,self.GilmoreGirls,Anna Nardini,https://www.reddit.com/r/GilmoreGirls/comments/cax945/anna_nardini/,amyspace,1562654989,"I just finished watching the episode where April meets Luke for the first time. She obviously did her research in trying to figure who her potential father was, but it never dawned on me how she came up with the three subjects. Was Anna sleeping around that much around the time of Aprils conception?! She had to have at least been dating those three guys within a short time frame. I cant remember if they explain any part of this later in the show, but with how protective Anna is I doubt she filled April in on her dating life. 

I also love that Anna is also Sasha later in the show! Sasha is 100% better of a character imo. I honestly kind of hate the whole Anna-April storyline and how dishonest Luke is with Lorelei about it ESPECIALLY when in the previous episode he throws a fit about honesty because Christopher calls. Ok rant over :)",3,15,False,self,,,,,
79,GilmoreGirls,t5_2sria,2019-7-10,2019,7,10,2,cb43dp,self.GilmoreGirls,Why was Rory so dumb when Jess crashed her car?,https://www.reddit.com/r/GilmoreGirls/comments/cb43dp/why_was_rory_so_dumb_when_jess_crashed_her_car/,mjpoodi,1562694005,"Rory is so bloody smart. She is a Harvard-reaching student and studies so hard. In the episode where Jess agrees to study if They go for ice cream, she lets Jess drive her god damn car. Why?",16,0,False,self,,,,,
80,GilmoreGirls,t5_2sria,2019-7-10,2019,7,10,7,cb81ob,self.GilmoreGirls,whats your thoughts about Lorelai relationship with her parents?,https://www.reddit.com/r/GilmoreGirls/comments/cb81ob/whats_your_thoughts_about_lorelai_relationship/,augnour,1562711811,"i feel like her reasons are not enough for her being selfish and harsh on them they dont deserve it. 
but i dont know im interested to know your thoughts on this",51,34,False,self,,,,,
81,GilmoreGirls,t5_2sria,2019-7-10,2019,7,10,7,cb8670,self.GilmoreGirls,Gilmore Girls and Hart of dixie together,https://www.reddit.com/r/GilmoreGirls/comments/cb8670/gilmore_girls_and_hart_of_dixie_together/,110hnv,1562712406,"I was rewatching Hod right after GG and i just realized, what if they were all living in the same town... Lavon and Taylor would fight to be mayor, Miss Patty and Dash would hold all the town gossip, Laurelai and Zoey would hold a speaking fast contest on one hand and Laurelai and Lemon would compete over the town's attention, Kirk and Tom would compete over who is taking which Job, Magnolia and Rory would be the spoiled brats of the show, Richard, Emily and George's parents would be best friends sharing the obsession of controlling their kids lives.",11,15,False,self,,,,,
82,GilmoreGirls,t5_2sria,2019-7-10,2019,7,10,9,cb9ow2,self.GilmoreGirls,Lorelai or Rory?,https://www.reddit.com/r/GilmoreGirls/comments/cb9ow2/lorelai_or_rory/,bloodybarbies,1562720170,"I know its crass, but whom would you rather?",4,1,False,self,,,,,
83,GilmoreGirls,t5_2sria,2019-7-10,2019,7,10,10,cb9qpl,self.GilmoreGirls,Lorelai's Graduation Day is my Scott's Tots,https://www.reddit.com/r/GilmoreGirls/comments/cb9qpl/lorelais_graduation_day_is_my_scotts_tots/,redrosie10,1562720434,"This episode is just so sad for me to watch. With Rory pushing Lorelai to attend the graduation ceremony and then her not even making the ceremony because of Jess, it's so hard for me to watch. I try not to skip it but I usually do every other watch or so. I just get so blue. 

&amp;#x200B;

Any one else have an episode that they can't/won't watch?",50,177,False,self,,,,,
84,GilmoreGirls,t5_2sria,2019-7-10,2019,7,10,12,cbb8up,self.GilmoreGirls,Rewatch,https://www.reddit.com/r/GilmoreGirls/comments/cbb8up/rewatch/,giaparrillo,1562728671,Do you ever find yourself rewatching the series just for comfort? I have always loved the show and have watched it through and through. I find myself rewatching the series when Im in a rough patch in life- I do the same with friends. Not sure if thats weird or not lol but the show gives me a distraction/laughter with its comedy. I love rewatching light hearted shows to bring my spirit up!,13,16,False,self,,,,,
85,GilmoreGirls,t5_2sria,2019-7-10,2019,7,10,15,cbcx8f,self.GilmoreGirls,I can't believe I didn't catch this inconsistency sooner...,https://www.reddit.com/r/GilmoreGirls/comments/cbcx8f/i_cant_believe_i_didnt_catch_this_inconsistency/,losoba,1562738824,"...but, in S02 E09 Rory has a class assignment to reenact a scene from Romeo and Juliet. Paris originally casts Brad Langford as Romeo. Tristan later joins and everyone says he was born to be Romeo except Paris and Rory. Rory asks Brad if he's able to speak in front of people and he says he tends to throw up. For this reason they recast Tristan as Romeo. Later in S02 E14 Brad can hardly perform at a debate due to nerves. Granted Paris made him nervous, but still. Are we supposed to believe he is a ""winningly nave"" Broadway actor by the following season? It just doesn't make sense!",6,2,False,self,,,,,
86,GilmoreGirls,t5_2sria,2019-7-10,2019,7,10,22,cbgocl,self.GilmoreGirls,Application anxiety,https://www.reddit.com/r/GilmoreGirls/comments/cbgocl/application_anxiety/,karrierpigeon,1562765086,I'm watching the Application Anxiety episode where rory and lorelai are having lunch with the Harvard alumnus. I've never really thought about it but why are those two siblings so odd? I'm curious if anyone has any theories.,7,2,False,self,,,,,
87,GilmoreGirls,t5_2sria,2019-7-10,2019,7,10,22,cbgs2h,self.GilmoreGirls,Lorelai singing I will always love you.,https://www.reddit.com/r/GilmoreGirls/comments/cbgs2h/lorelai_singing_i_will_always_love_you/,grad2010aa,1562765681,This episode where she is singing karaoke at the bar and Luke walks in has to be in my top 5 of all time favorite episodes. Anyone else love this part!,24,85,False,self,,,,,
88,GilmoreGirls,t5_2sria,2019-7-10,2019,7,10,22,cbgw98,self.GilmoreGirls,Emily says hello,https://www.reddit.com/r/GilmoreGirls/comments/cbgw98/emily_says_hello/,Ace-ann93,1562766329,"First of all, I love Emilys character, I love how real the slow build up is to get and Richard separating and how her characterize slowly revealed over the series. 

Now to the point in episode 5.9  she called Lorelai over to help her pick out her outfit for her date with Simon I love how Lorelai suggests that she just wear what she has on and I have to admit that I think that Emily looks good just running around in a robe with the night gown it gives her this care free look while still put together, I would have loved to see her in a simple dress and some type of shawl, not overly fancy.

I absolutely hated her dress in the vow renewal and Lorelais was pretty awful too!",3,3,False,self,,,,,
89,GilmoreGirls,t5_2sria,2019-7-11,2019,7,11,4,cbl4bb,self.GilmoreGirls,I hate Kirk.,https://www.reddit.com/r/GilmoreGirls/comments/cbl4bb/i_hate_kirk/,helpmeiamretarded,1562786418,"As much as I love the show I have a list of characters that I hate and kirk is at the top of that list. On a personal level, as someone with autism I feel like they are hinting that Kirk is autistic, that might just be me, but I bloody hate it, they make him look like such an idiot man child that you cant take him seriously.

Aside from that I just feel like he is in the way, and I always found it frustrating that he cant grasp the word no, like when Lorelai told him he cant help out at the Inn or when he wanted to help Luke out while he was away. He also seems to just invite himself everywhere, like to sleep in Lorelai's garage or do his Realestate buisness at Lorelai's inn.  Also when he made his own diner after crashing into lukes I had a migrane lol.

Aside from that I feel like his only redeeming moment is in the final episode of the Netflix series when he decorated for the wedding, seeing him smile when he got the text saying he did good warmed my heart. 

I feel like with Kirk you either love him or hate him so I am curious to the responce I get lol.",19,0,False,self,,,,,
90,GilmoreGirls,t5_2sria,2019-7-11,2019,7,11,4,cblb0i,self.GilmoreGirls,Season 3 has a lot of weird episodes/storylines that go nowhere...,https://www.reddit.com/r/GilmoreGirls/comments/cblb0i/season_3_has_a_lot_of_weird_episodesstorylines/,dobsco,1562787295,"Not trying to hate on season 3, but upon this rewatch it occurred to me that this season has a very high number of odd storylines or whole episodes that feel out of context and go nowhere. To give a few examples... 

- Eight O'clock at the Oasis - an all around odd episode... why do we never see Dwight again? Another odd character moves to Stars Hollow and is never seen or referenced again?

- Application Anxiety - another weird episode. 

- Peyton and Alex storylines... and while we're talking about Alex, the fishing episode. I think the girls talking to the fish in the tub may be the first and only time we've ever seen that bathroom?

- Sherry's baby shower. 

- Swan Song - an entire episode devoted to Jess being attacked by a swan?

- The hockey game. 

- The Poe Society. 

I don't know... maybe it's just me!  It just feels like season 3 is full of standalone things that don't ever pop up again or are odd in and of themselves.  Perhaps more than any of the other seasons?

Thoughts?",15,9,False,self,,,,,
91,GilmoreGirls,t5_2sria,2019-7-11,2019,7,11,5,cblo08,self.GilmoreGirls,Al's Chow Mein Sandwich (S4E20),https://www.reddit.com/r/GilmoreGirls/comments/cblo08/als_chow_mein_sandwich_s4e20/,HeartRiseAbove,1562788961,"I caught something when rewatching Luke Can See Her Face.

When Rory comes home for dinner--

&gt;RORY: Thank you. Oh, man, I've missed Al's Chinese night.  
&gt;  
&gt;LORELAI: Oh, he's got a new thing now -- chicken chow mein sandwich.

Later on, in the episode, when Jess is staying over with Luke and is unsure on what to eat--

&gt;JESS: Maybe I'll go out.  
&gt;  
&gt;LUKE: I'm hearing a good buzz about a chow mein sandwich.

So it's safe to say that 'buzz' = Lorelai babbling...it's a very small thing but thought I'd share!",1,26,False,self,,,,,
92,GilmoreGirls,t5_2sria,2019-7-11,2019,7,11,6,cbmfo4,self.GilmoreGirls,An oddly satisfying moment...,https://www.reddit.com/r/GilmoreGirls/comments/cbmfo4/an_oddly_satisfying_moment/,microbesindeath,1562792665,"Im rewatching the revival and I just had an EXTREMELY satisfying moment that I didnt expect! 

So, you know how GG often has these scenes where multiple stressful things are going on and theres that person who keeps interrupting with some additionally stressful thing and it creates heightened frustration in the scene? An example that came to mind was when TJ came over and messed up Luke and Lorelais date. Luke is trying to get him to leave, TJ is refusing to leave, and the whole thing is frustrating. BUT ON TOP OF THAT, Lorelai keeps interrupting to tell Luke that she is going to ruin the sauce. So, hes simultaneously arguing with TJ and trying to reassure Lorelai that she cant ruin the sauce. 

Anyway, in Winter, a scene like this happens. Luke and Taylor are arguing about the septic tanks or whatever and theres a lady that keeps interrupting by asking about the WiFi password. When Taylor snaps and goes on this huge long rant at her, it is the single most satisfying moment of the series for me. Every single time one of these scenes happens, this is the response I want. In my example scene, I have always wanted Luke to just be like Lorelai, SHUT UP!!! You cant ruin the stupid sauce and Im talking to TJ so act like a freaking adult and SHUT UP FOR LIKE 2 minutes!!! But obviously he doesnt do that. 

Who would have thought that Taylor of all people would be the one to finally respond the way I wanted someone to in one of these situations? Ha!",4,13,False,self,,,,,
93,GilmoreGirls,t5_2sria,2019-7-11,2019,7,11,6,cbmrs5,self.GilmoreGirls,ASPs Blue Dress symbolism?,https://www.reddit.com/r/GilmoreGirls/comments/cbmrs5/asps_blue_dress_symbolism/,panty_suity,1562794272,"As a chronic re-watcher, I recently did another run through and noticed how many times Blue dresses come up in the series when something significant is happening/about to happen.  

First mention: Rory @ the first Chilton dance. Lorelai makes her a blue dress. 
 
Second mention: Richard, Emily and the girls visit Yale and Richard describes  the way he proposed to Emily and says when you showed up to my fraternity party in that blue dress, I had no choice

Third mention: Emily asks what she should wear to Rorys chilton graduation-Richard responds with the blue. It made you look like a mermaid.

Fourth mention: Rory comes to stars hollow before going to Logans to *the dinner* to meet Logans parents. She tells lorelai I need to find my blue dress. To wear to his parents house tonight.

Fifth mention: Lorelai wears a blue dress after she sleeps with Christopher when she and Luke break up, and she mentions it somewhere prior in the episode 

Im pretty sure it shows up in the revival too, but it stuck out to me the last few times I heard it. Are there any that I missed in the OS? Thoughts?",45,70,False,self,,,,,
94,GilmoreGirls,t5_2sria,2019-7-11,2019,7,11,12,cbqgsa,self.GilmoreGirls,Sookie and Lucien Mills (1x04),https://www.reddit.com/r/GilmoreGirls/comments/cbqgsa/sookie_and_lucien_mills_1x04/,ellism12799,1562814397,"I'm on my billionth rewatch and only JUST NOW realized something. When Sookie goes to Lucien Mill's house to get him to try the risotto with the certain wine, she keeps her back to him the entire time.

It has only just now occurred to me that it's because he's a food critic and has to remain anonymous to be able to keep reviewing her work. Only now. After watching and rewatching this show for well over ten years.  Someone please say I'm not the only one!?",6,42,False,self,,,,,
95,GilmoreGirls,t5_2sria,2019-7-11,2019,7,11,12,cbqrhc,self.GilmoreGirls,Rory and Logan,https://www.reddit.com/r/GilmoreGirls/comments/cbqrhc/rory_and_logan/,Gilmore_Goddess,1562816186,"Just curious what everyones opinions on Rory and Logan are!

Do you think when Rory came to Logan after she realized she truly was a commitment kind of girl was an ultimatum?

Do you think they should have ended up together? Why?

What attracted Logan to Rory and vice versa? After all, Rory hated him at first.",7,3,False,self,,,,,
96,GilmoreGirls,t5_2sria,2019-7-11,2019,7,11,13,cbr6v8,self.GilmoreGirls,Laurelai/Luke - communication,https://www.reddit.com/r/GilmoreGirls/comments/cbr6v8/laurelailuke_communication/,110hnv,1562818878,"I watched this show like a million times and this time my fianc is watching with me and pointed out something. Why Laurelai and luke communicate like 5th graders. She has lunch with Chris and she starts babbling around instead of just telling him - then Luke's dark day, was it necessary for her to ask around instead of just asking point blank because it was public knowledge and Luke knows that stars hallow doesn't have secrets, why didn't she just ask him and give him the possibility to open up to her. And the boat thing, why hide it. I don't get it",21,3,False,self,,,,,
97,GilmoreGirls,t5_2sria,2019-7-11,2019,7,11,21,cbv1vs,self.GilmoreGirls,Luke has floral paper towel,https://www.reddit.com/r/GilmoreGirls/comments/cbv1vs/luke_has_floral_paper_towel/,Banjanjo,1562847355,"In ""dead uncle's and vegetables"" you can see it behind him when he's telling Lorelai that his family won't be there for the funeral. There's something adorable about Luke having paper towel with blue flowers ",10,46,False,self,,,,,
98,GilmoreGirls,t5_2sria,2019-7-11,2019,7,11,22,cbvm9k,self.GilmoreGirls,Emily Gilmore - Simpson reference,https://www.reddit.com/r/GilmoreGirls/comments/cbvm9k/emily_gilmore_simpson_reference/,mrsjanobonano,1562851095,"In season 7 episode 4, Emily Gilmore gets stopped by a cop for talking on her cell phone. After she is asked if she was drinking, she told him You know, right now, someone is robbing a Kwik E Mart. Did Emily watch the Simpsons? Did she allow Lorelai to watch it?",5,17,False,self,,,,,
99,GilmoreGirls,t5_2sria,2019-7-12,2019,7,12,5,cc10gb,self.GilmoreGirls,TJ- Guess what it stands for,https://www.reddit.com/r/GilmoreGirls/comments/cc10gb/tj_guess_what_it_stands_for/,livinghapa,1562877669,"Is the answer Gary or do you think he actually came up with something for it to mean? 

&amp;#x200B;

...Other than Thomas Jefferson, of course. ;)",14,21,False,self,,,,,
100,GilmoreGirls,t5_2sria,2019-7-12,2019,7,12,6,cc1tek,self.GilmoreGirls,Why does Michele hate Luke?,https://www.reddit.com/r/GilmoreGirls/comments/cc1tek/why_does_michele_hate_luke/,Ericr4422,1562881521,,11,18,False,self,,,,,
101,GilmoreGirls,t5_2sria,2019-7-12,2019,7,12,8,cc39n6,self.GilmoreGirls,Does anyone else think Robert is a huge creep?,https://www.reddit.com/r/GilmoreGirls/comments/cc39n6/does_anyone_else_think_robert_is_a_huge_creep/,HeyItsLers,1562888950,,21,0,False,self,,,,,
102,GilmoreGirls,t5_2sria,2019-7-12,2019,7,12,13,cc5z0m,self.GilmoreGirls,Kevin Porter from Gilmore guys TV without pity question,https://www.reddit.com/r/GilmoreGirls/comments/cc5z0m/kevin_porter_from_gilmore_guys_tv_without_pity/,asoncewewere,1562904653,Anyone know what Kevin Porters from GilmoreGuys TV without pitys username was?,1,0,False,self,,,,,
