,sbr,sbr_id,date,year,month,hour,day,id,domain,title,full_link,author,created,selftext,num_comments,score,over_18,thumbnail,media_provider,media_thumbnail,media_title,media_description,media_url
128,GilmoreGirls,t5_2sria,2019-7-16,2019,7,16,5,cdn93s,self.GilmoreGirls,Post Re-Watch Mourning,https://www.reddit.com/r/GilmoreGirls/comments/cdn93s/post_rewatch_mourning/,coffeeplzzzz,1563223763,"Guys, I have one more episode to go before I finish my zillionth re-watch and I'm so sad. My husband actually watches it with me all the time, but it's only a matter of time before he gets sick to death of my Gilmore Girls obsession. Anybody relate?",2,3,False,self,,,,,
129,GilmoreGirls,t5_2sria,2019-7-16,2019,7,16,7,cdomct,self.GilmoreGirls,When Lorelai meets Anna...,https://www.reddit.com/r/GilmoreGirls/comments/cdomct/when_lorelai_meets_anna/,alohamira,1563230418,"To smooth things over after April's birthday party, I noticed on this rewatch that Anna said ""April never meets any man I date unless I've dated him for years. So, basically until I'm ready to get married again, she doesn't meet any of the men I date"".

Married **again**? Did I miss something or is it another slip up? As far as I remember she and Luke never married.",7,0,False,self,,,,,
130,GilmoreGirls,t5_2sria,2019-7-16,2019,7,16,8,cdp3eh,self.GilmoreGirls,Two Burning Questions,https://www.reddit.com/r/GilmoreGirls/comments/cdp3eh/two_burning_questions/,Brown_Eyes512,1563232894,"1. Did Melissa McCarthy take any sort of cooking lessons to prepare for her role as Sookie? She is incredibly confident and professional-looking in the kitchen. I know she doesnt really do much but its the little things like knife skills that make her look like the real deal. (Source: have worked in kitchens and dated a trained chef.)

2. What is Emilys back story? What kind of a family did she come from? What was her relationship with her own mother like? We know she went to college (cant remember where but they discuss it in the episode where Richard and Emily take Rory and Lorelai to tour Yale, season 3 maybe?) but I dont think we do much as get her maiden name.",5,11,False,self,,,,,
131,GilmoreGirls,t5_2sria,2019-7-16,2019,7,16,8,cdphmx,self.GilmoreGirls,My favorite Luke/Rory moment,https://www.reddit.com/r/GilmoreGirls/comments/cdphmx/my_favorite_lukerory_moment/,chrisched,1563235034,"I just rewatched S2E20 Help Wanted and I realized the final scene is probably my favorite Luke/Rory moment on this entire show.

It's right after Jess left, Rory still has a cast over her wrist from the accident, Luke comes back from fishing, and everyone in town is blaming Jess and feeling sorry for Rory. The way the two of them just walk into the diner, he starts making coffee, and she says ""it wasn't his fault"" followed by Luke looking at her and saying ""I know it wasn't"" - it's so sweet, and such a perfect Luke/Rory moment. I can't believe I forgot about this before.

What are your other favorite Luke/Rory moments? (They are quite rare, I think).",24,51,False,self,,,,,
132,GilmoreGirls,t5_2sria,2019-7-16,2019,7,16,9,cdpuwz,self.GilmoreGirls,Very beginning of AYITL question,https://www.reddit.com/r/GilmoreGirls/comments/cdpuwz/very_beginning_of_ayitl_question/,zimmspro,1563237100,"Is Lorelai holding non-Luke coffee cups? 

&amp;#x200B;

the shame hahahahahaha",3,1,False,self,,,,,
133,GilmoreGirls,t5_2sria,2019-7-16,2019,7,16,11,cdqzy4,self.GilmoreGirls,Jam Hands Episode,https://www.reddit.com/r/GilmoreGirls/comments/cdqzy4/jam_hands_episode/,CodyMac85,1563243469,"What episode was it that Luke said ""I don't even like kids. They always have jam on their hands. Even when there isn't any jam in the house, they get jam on their hands. I can't deal with jam hands.'",7,14,False,self,,,,,
134,GilmoreGirls,t5_2sria,2019-7-17,2019,7,17,3,ce0p1q,self.GilmoreGirls,Lorelai and Rory's Karmic Relationship Pairing,https://www.reddit.com/r/GilmoreGirls/comments/ce0p1q/lorelai_and_rorys_karmic_relationship_pairing/,Stezinec,1563300503,"ASP said in an [interview](https://tvline.com/2016/12/01/gilmore-girls-a-year-in-the-life-amy-sherman-palladino-interview-final-four-words/):

&gt; I always wanted [the story] to end in a Life Repeats Itself kind of way. The daughter following in the mothers footsteps. I always thought that was an interesting way to go, with these women who are so tied to each other and who make slightly different choices, but find themselves in interesting situations together. Because they are not like any normal mother and daughter. 

A lot of people I think were surprised by this element in the AYITL finale, but it's present throughout the whole OS.  I made a small [graphic](https://i.imgur.com/36qEIfd.png) that shows how I believe it worked for each season finale.

For example, in the Season 1 finale Lorelai struggles over whether to commit to Max, but Rory admits her feelings to Dean.

In Season 2, Lorelai commits to Christopher (though he leaves her for Sherry), and Rory wavers in her relationship with Dean by kissing Jess.

So you can see the pattern where Lorelai and Rory are making opposite choices in similar situations, but life often throws one of them a ""curveball"" that actually gives them the same outcome, ironically.

So for example Christopher breaking up with Lorelai at the end of Season 2 actually makes her life outcome parallel to Rory's (both then have relationship turmoil).

It's part of the central question for ASP: is life determined by our choices or by cosmic chance?  She seems to provide evidence for both sides, and the fact that Lorelai and Rory are so close gives her the perfect chance to explore it.",31,60,False,self,,,,,
135,GilmoreGirls,t5_2sria,2019-7-17,2019,7,17,10,ce62py,self.GilmoreGirls,That Damn Donna Reed Extra,https://www.reddit.com/r/GilmoreGirls/comments/ce62py/that_damn_donna_reed_extra/,tallnoah,1563326424,"When Emily and Richard are on the phone, the person on the other end's voice sounds SUPER familiar and I was just wondering if anyone else recognized it. It's driving me crazy. 

I feel like he's from some Nickelodeon show but i can't put my finger on it, please help",6,1,False,self,,,,,
136,GilmoreGirls,t5_2sria,2019-7-17,2019,7,17,10,ce64zl,self.GilmoreGirls,The way Lorelei treats Jess...,https://www.reddit.com/r/GilmoreGirls/comments/ce64zl/the_way_lorelei_treats_jess/,muppetpuppeteer,1563326776,"Sorry if this has been written before but Im just so annoyed. The whole town treats Jess terribly but Lorelei acts as if hes the spawn of Satan. I almost cant watch the scenes when shes talking to/about him.

 Im on my umpteenth rewatch and currently watching the episode where Rory and Jess get into a car accident. The way Lorelei is behaving is absolutely ridiculous. It was an accident! An animal ran into the road and he swerved, as anyone would do, but shes acting like he purposely ran into a pole for funsies. 

I teared up a bit seeing Jess on the pier I made sure she was ok. 

If it was Rory who had been driving she wouldnt be acting the same way. She wouldnt have even cared about Jess being hurt.

Not to mention absolutely going off on poor Luke. Hes trying his best to take care of Jess and she just craps all over him. He wanted Rory to help Jess because shes very intelligent and obviously gets through to him.

I am(was?) a die hard GG fan but this time around watching it the whole show is rubbing me the wrong way.",42,49,False,self,,,,,
137,GilmoreGirls,t5_2sria,2019-7-17,2019,7,17,12,ce7dzg,self.GilmoreGirls,Guitarist Zack on Gilmore Girls,https://www.reddit.com/r/GilmoreGirls/comments/ce7dzg/guitarist_zack_on_gilmore_girls/,baileyrosemarshall,1563333905,I hated Zack on Gilmore Girls!!! He treats Lane like a housewife and sends her to do the shopping and always is complaining about money I just find him annoying. And he can be rude to Hep Alien members and Lane in general.,36,52,False,self,,,,,
138,GilmoreGirls,t5_2sria,2019-7-17,2019,7,17,13,ce81wh,self.GilmoreGirls,Emily or Lorelai,https://www.reddit.com/r/GilmoreGirls/comments/ce81wh/emily_or_lorelai/,baileyrosemarshall,1563337950,Would you rather have Emily or Lorelai as a mom and why? I like both for different reasons its hard to choose.,8,0,False,self,,,,,
139,GilmoreGirls,t5_2sria,2019-7-17,2019,7,17,15,ce8ybh,self.GilmoreGirls,Lorelais ultimatum,https://www.reddit.com/r/GilmoreGirls/comments/ce8ybh/lorelais_ultimatum/,twentyonerooms,1563343923,"Why did Lorelai feel it had to be now or never in regards to her getting married ultimatum to Luke? Clearly she got through to himhe shows up the next day ready to elope. But shes so determined that it be over that she sleeps with Christopher, knowing Luke wont be able to forgive her for it. Lorelai had every right to be upset with Luke for keeping her out of his life with his daughter, but it always bugs me that they couldnt have sat down and had a discussion about it.",5,1,False,self,,,,,
140,GilmoreGirls,t5_2sria,2019-7-17,2019,7,17,17,ce9wku,self.GilmoreGirls,Emily demanding to go first,https://www.reddit.com/r/GilmoreGirls/comments/ce9wku/emily_demanding_to_go_first/,coralluck,1563350913,"Does anyone else sob when Emily says ""No! Richard gilmore, there may be many things happening in this hospital, but you dying is not one of them"" and then she demands to go first. After the death of Richard it's super sad to rewatch that episode, Forgiveness and Stuff. 

Ps i think she had the best character development in the revival.",10,172,False,self,,,,,
141,GilmoreGirls,t5_2sria,2019-7-17,2019,7,17,22,ced1p1,self.GilmoreGirls,I made Sookies risotto.,https://www.reddit.com/r/GilmoreGirls/comments/ced1p1/i_made_sookies_risotto/,anniemg01,1563371145,"My husband bought me Eat Like a Gilmore for Mothers Day because Im a huge, long time fan.  Last night I made the magic risotto and it was amazing!  It will definitely keep me alive for at least three more years.",27,131,False,self,,,,,
142,GilmoreGirls,t5_2sria,2019-7-17,2019,7,17,22,ced328,self.GilmoreGirls,The more I watch the more I think I'm turning into Luke his dream about the trunk space is exactly the kind of dream I have,https://www.reddit.com/r/GilmoreGirls/comments/ced328/the_more_i_watch_the_more_i_think_im_turning_into/,llrb11,1563371354,,0,1,False,self,,,,,
143,GilmoreGirls,t5_2sria,2019-7-18,2019,7,18,1,cef8mu,self.GilmoreGirls,Did therapy help Emily and Loralai at all?,https://www.reddit.com/r/GilmoreGirls/comments/cef8mu/did_therapy_help_emily_and_loralai_at_all/,nowonimportant,1563381267,"I was really hoping it would work more than anything in the past had since theyre getting professional help but they spent most of their sessions silent and then Emily quit. 

Also did we ever find out who put the mean letter on Emilys bed? (Ive only seen the revival once I might have missed them talking about it again)",3,2,False,self,,,,,
144,GilmoreGirls,t5_2sria,2019-7-18,2019,7,18,3,cegobs,self.GilmoreGirls,Fan Fest 2019,https://www.reddit.com/r/GilmoreGirls/comments/cegobs/fan_fest_2019/,LindseeBassHead,1563387780,"Have any of you been to a Gilmore gilrs fan Fest since they started in 2016, and what did you think? 
They have two this year and I'm thinking of going to one.",8,4,False,self,,,,,
145,GilmoreGirls,t5_2sria,2019-7-18,2019,7,18,8,cekj5d,self.GilmoreGirls,The Logan class thing made no sense.,https://www.reddit.com/r/GilmoreGirls/comments/cekj5d/the_logan_class_thing_made_no_sense/,Tasisway,1563405798,"When Logan comes in and they do the whole bit to embarrass rory because the Chilton kid shes showing around is kind of bored with it all.

And rorys revenge was to get her grandfather to loudly proclaim on campus how Rory and Logan wers getting married. When an episode or two before that him and emily are talking about the right fit for Rory to be married to and the complexities of it.

Seemed out of character for richard to do that. Unless he's just playing an act for emily with the all set up Rory with someone stuff. But didn't richard also have a scene like a second ago where he was going to get luke to franchise?

Also after they do that and Rory smiles and is like thanks grandpa. She just forgives Logan? 

Christian had done something similar at Chilton and she HATED him. 

I guess i just don't get rorys character development in the college years. She thinks shes too meek so just makes bad choices again for....reasons?

It would make more sense if she was so impressed by the fanciness of Logan (which she is constantly) but at the same time she still turns her nose up everytime her actual family wants to do something fancy.

What a great rebel rory. Your telling your family you don't want that lifestyle while at the same time falling for a guy who is woeing with you his lifestyle.

What is your guys take on rorys change between dean and Logan?",4,0,False,self,,,,,
146,GilmoreGirls,t5_2sria,2019-7-18,2019,7,18,9,celj5u,self.GilmoreGirls,Rory / Alexis,https://www.reddit.com/r/GilmoreGirls/comments/celj5u/rory_alexis/,zimmspro,1563411141,"Ok, I actually enjoyed watching Alexis play Rory as a new actress/naive girl and evolved into a more confident person.

&amp;#x200B;

That said, AYITL really shows just how unnatural Alexis is at acting. I get this in all her works. 

&amp;#x200B;

I don't think it hurt the show but man, her delivery is very programmed.",11,7,False,self,,,,,
147,GilmoreGirls,t5_2sria,2019-7-18,2019,7,18,10,cem353,self.GilmoreGirls,Making Out,https://www.reddit.com/r/GilmoreGirls/comments/cem353/making_out/,hahnsmill,1563414250,"I am not a prude **at all**, but to be honest, the amount of teenage PDA that goes on in Stars Hollow is intense. 

Rory makes out all over town with Dean and Jess. Jess makes out with Shane all over the place. They arent little kisses here and there but deep, long kissing sessions.

I was the same age in the 00s as Rory, and we definitely didnt make out where every adult we knew and our parents knew could see us. 

Just an observation.",8,24,False,self,,,,,
148,GilmoreGirls,t5_2sria,2019-7-18,2019,7,18,11,cemkke,self.GilmoreGirls,Rory and Rachel,https://www.reddit.com/r/GilmoreGirls/comments/cemkke/rory_and_rachel/,VegelantyJustice,1563417050,I was just re-watching the first season and I realized that Rachel is a photojournalist and travels all over the world-but at no point do we get any indication Rory wants to talk to her about her career or is interested in what she's been doing.  I think this is an oversight I've never really noticed before.  Rory's our she wants to be a journalist who travels the world in the first or second episode so we know that's already established. has anybody else noticed this or considered it a missed opportunity for more plot?,25,156,False,self,,,,,
149,GilmoreGirls,t5_2sria,2019-7-18,2019,7,18,12,cen3pa,self.GilmoreGirls,Please tell me someone else has seen Gil on Trailer Park Boys,https://www.reddit.com/r/GilmoreGirls/comments/cen3pa/please_tell_me_someone_else_has_seen_gil_on/,rosiegreens,1563420161,"I wont spoil it, (its on Netflix) but its absolutely insane.",0,1,False,self,,,,,
150,GilmoreGirls,t5_2sria,2019-7-18,2019,7,18,13,cennqo,self.GilmoreGirls,A Couple of Funny Observations,https://www.reddit.com/r/GilmoreGirls/comments/cennqo/a_couple_of_funny_observations/,carmelacorleone,1563423484,"The location used for the Homecoming Dance and Rory's debutante ball is the same but Rory acts like she's never been there before.

&amp;#x200B;

Also, in the episode where the girls go on a road trip to avoid the wedding they stay at The Cheshire Cat Inn in Massachusetts. Later on when the Independence catches fire, and at various other later points, Lorelai is calling other hotels so they can accommodate their guests and she says The Cheshire Cat. But if she's in Western Connecticut why would she send guests to an inn in Massachusetts? \*although, they never explicitly state where The Cheshire Cat Inn actually is so I guess it could feasibly be in Connecticut. But I'm going to refute that because when Rory is reading what's close by she said Boston, Newton, Needham. All of those are a straight line to Boston and Cambridge. 

&amp;#x200B;

Just some early season observations.",6,3,False,self,,,,,
151,GilmoreGirls,t5_2sria,2019-7-18,2019,7,18,15,ceotbq,self.GilmoreGirls,Lukes healthy eating,https://www.reddit.com/r/GilmoreGirls/comments/ceotbq/lukes_healthy_eating/,lenapree,1563431266,"Im rewatching the show and I realized they mentioned Lukes healthy eating a lot in the first two seasons, however I dont remember it being mentioned a lot after that, especially when Luke and Lorelai date. Am I missing anything?",3,3,False,self,,,,,
152,GilmoreGirls,t5_2sria,2019-7-18,2019,7,18,22,cestxs,self.GilmoreGirls,"Daisies in ""Raincoats and Recipes""",https://www.reddit.com/r/GilmoreGirls/comments/cestxs/daisies_in_raincoats_and_recipes/,Stezinec,1563458296,"Re-watching this episode I picked up something I hadn't before: there are yellow daisies on all the dinning tables.

In fact, we see Rory placing them there, see this [screencapture](https://www.homeofthenutty.com/gilmoregirls/screencaps/displayimage.php?album=44&amp;pid=40115#top_display_media).

Also, Lorelai is wearing a flower on her lapel, that looks to me like a blue daisy with a yellow stigma in the center, [screencapture here](https://www.homeofthenutty.com/gilmoregirls/screencaps/displayimage.php?album=44&amp;pid=40543#top_display_media).

What do you make of this symbolism?  Why the yellow daisies on the tables, and Lorelai wearing a blue one?",3,7,False,self,,,,,
153,GilmoreGirls,t5_2sria,2019-7-19,2019,7,19,2,cevkjb,self.GilmoreGirls,Started watching Jane the Virgin and I was struck by something Jane said...,https://www.reddit.com/r/GilmoreGirls/comments/cevkjb/started_watching_jane_the_virgin_and_i_was_struck/,HeartRiseAbove,1563471251,"Both shows are prone to have similarities given how they're both about the familial connection between three generations of women, but this piece of dialogue in particular, shortly after Jane gets artificially inseminated by accident in the Pilot, really speaks to Rory's dilemma at the end of the revival and how that's tied into her previous characterization.

&gt;Look, I know the reasons for wanting to end the pregnancy are so... selfish. That Im not ready. That this wasnt the plan. That I have worked so hard - every second - so that my life would be different from my mother's. I was an accident. And I know my mom loves me, but I also know, in some ways, I derailed her life. I dont want my kid to feel like that. Ever. 

It reminded of that precious Rory-Emily scene at the kitchen in ""Christopher Returns"" (1x15) after Chris' parents make it clear they want nothing to do with her. It's such an interesting moment because it's one of the few times where we see Rory feeling unloved and unwanted, and it's so heartwarming to see Emily reassures her existence isn't a mistake. It also touches an aspect of Rory's psyche that I wish had been tapped into more: the immense pressure she feels to be perfect to overcompensate for the circumstances of her birth. We see that with her academic achievements and her love life - more specifically, being so wishy-washy in regards to the whole Dean/Jess debacle. Dean was her mother's approved choice and was very much in love with her, and she. just. can't. dump. him. No matter how much she wants Jess, who's the more troubled, controversial option, she just can't bring herself to be the ""bad guy"" and ends up causing a lot pain for herself and other people as a result. Another key trait of Rory's: she tends to flounder on her own. Years of being surrounded by doting adults and a mother with she's developed a co-dependent relationship with has instilled in her a strong need for external validation... which is symptomatic of her deep-seated fear of abandonment and that the love she's often showered with - by Lorelai, her grandparents, the town - is contingent to her degree of success at being ""great white hope of the Gilmore clan"". 

(This is why she can't never bring herself to fully forgive Jess for leaving her. Because leaving Rory is the worst thing you can do to her.)",13,212,False,self,,,,,
154,GilmoreGirls,t5_2sria,2019-7-19,2019,7,19,6,cey9lw,self.GilmoreGirls,Chris is a lousy father - to Rory AND TO GIGI,https://www.reddit.com/r/GilmoreGirls/comments/cey9lw/chris_is_a_lousy_father_to_rory_and_to_gigi/,sign09,1563483990,"Currently I re-watch season 7 (cause suffering burns many calories, just like holding grudges ) and the fact that everybody is pretending that Chris is a great dad to Gigi seriously leaves me speechless.

In season 5 the guy doesn't just call Lorelai the moment he is alone with his own child, he also admits that he never supported Sherry when it comes to taking care of GiGi and that this is most likely why she left. The man is that ignorant of his own child'd needs that he can't even change a diaper despite being a father for over a year at this point. And then he proceeds to tell Lorelai that he ""can't do this"" cause he's not as ""strong as Lorelai"" despite HAVING A FREAKING NANNY. Yes, that really sounds like the father of the year.

In season 6 he asks Lorelai to sit Gigi and we find out that she is now doing little else apart from screaming and destroying things, cause her dad really dislikes the word ""no"". Grade A parenting. What he tells us, is that he can't set rules for Gigi because she already lost her mother, which sounds lovely in theory. But what kind of useless father would watch his child behave the way Gigi does without considering that this is going to negatively impact her future if it continues?

Then in season 7 he wants to send a four year old child on a trip alone to Paris to meet a woman that is a complete stranger at this point and only changes his stance because Lorelai gets pissed. But instead of using his time in Paris to actually be around Gigi and make sure that she and Sherry really get along long-term he rather spends a romantic weekend with his girlfriend and harasses her into marrying him. And after moving into Lorelai's house he pretty much tells Gig that this is her new (part-time) home now and that Lorelai is in her life for good, despite the fact that he and Lorelai dated for less than half a year at this point. I mean the whole Lorelai/Chris thing sucked but at least all parties involved were adults (including Rory). If you have a four year old daughter that potentially gets used to your new ""wife"" and her home, however, shouldn't you act a little more grown-up?

As for AYITL, I assume that Chris's ""Gigi is totally french now"" comments means that she stays with her mom for good now. No surprise there. Turns out that Sherry was a much better parent than Chris in the end, not the other way around.",73,18,False,self,,,,,
155,GilmoreGirls,t5_2sria,2019-7-19,2019,7,19,7,cezha6,self.GilmoreGirls,"Because of GG, I now know...",https://www.reddit.com/r/GilmoreGirls/comments/cezha6/because_of_gg_i_now_know/,AZEllieK,1563489980,"I saw this post here forever ago and loved it, so Im hoping to recreate it! Post the funny things youve learned from watching the show. My favorite:

Because of GG, I now know...

...a lap is an illusion.

Have fun! ",29,9,False,self,,,,,
156,GilmoreGirls,t5_2sria,2019-7-19,2019,7,19,8,ceznau,self.GilmoreGirls,Does anyone know if there are transcripts to the DVD commentary?,https://www.reddit.com/r/GilmoreGirls/comments/ceznau/does_anyone_know_if_there_are_transcripts_to_the/,champollion00000,1563490840,I don't own a DVD player and definitely don't want to buy them. Bue Demi and Kevin often make reference to the commentary tracks and it intrigues me. Does a transcript exit anywhere?,4,0,False,self,,,,,
157,GilmoreGirls,t5_2sria,2019-7-19,2019,7,19,9,cf0n9z,self.GilmoreGirls,Lorelai underestimates Emily,https://www.reddit.com/r/GilmoreGirls/comments/cf0n9z/lorelai_underestimates_emily/,champollion00000,1563496383,"Just a small thing. In the Party's Over, Season 5, Lorelai tries to help Rory escape from the party. She says that there is an escape route from the basement that her parents don't know about.

&amp;#x200B;

Well, if you remember the first episode of the season Emily DOES know about that escape route because we see her crawling from it like a teenage girl throwing a tantrum! I thought it was a nice touch.",7,25,False,self,,,,,
158,GilmoreGirls,t5_2sria,2019-7-19,2019,7,19,10,cf1emc,self.GilmoreGirls,rory cheating on dean,https://www.reddit.com/r/GilmoreGirls/comments/cf1emc/rory_cheating_on_dean/,lenapree,1563500634,everyone talks about dean &amp; logan cheating but no one ever talks about how rory kissed jess while dating dean?,13,3,False,self,,,,,
