,date,year,month,day,hour,id,title,full_link,author,created,selftext,num_comments,score
0,2014-8-1,2014,8,1,14,2cb7hi,Need Opinions on Software Engineering program...,https://www.reddit.com/r/computerscience/comments/2cb7hi/need_opinions_on_software_engineering_program/,[deleted],1406870283,"I'm thinking about applying to school for either computer science or software engineering. I heard CS is all theoretical and a lot of the actual programming is going to have to be learned outside of class. Is a CS degree worth it? I'm worried about the amount of math there is. Math has never been my strong subject. I am looking into this software engineering program, although it isn't really an engineering degree by any means. I'm worried getting a B.Computing degree for software engineering wouldn't be the smartest but I could be wrong. There is also a 5 year option to do co-op with this program. Any thoughts? 

https://www.uoguelph.ca/registrar/calendars/undergraduate/current/c10/c10bcomp-seng.shtml",0,1
1,2014-8-2,2014,8,2,1,2ccfax,Difference between Software Engineering and Computer Science???,https://www.reddit.com/r/computerscience/comments/2ccfax/difference_between_software_engineering_and/,FRLSSBrute,1406908857,I'm starting university next year and currently I am still in a dilemma as to what the difference between software engineering and computer science is and which one I should choose. Hope you guys can give me a hand with this :),4,1
2,2014-8-2,2014,8,2,14,2ceioq,Picking the right university for CS major,https://www.reddit.com/r/computerscience/comments/2ceioq/picking_the_right_university_for_cs_major/,MrGhettocraft,1406956940,"I am currently entering my junior year of High school, but I like to be proactive, so I'm trying to look ahead at college opportunities. I need to find a college with a good CS program, but nothing to strict. I live in Southern Missouri, I was looking at Missouri State University,  but I don't think their CS program is exceptional. If anyone can help me find a perfect college for me, I'd really appreciate it... somethings to add:(sorry for poor formatting, on mobile and noob at reddit)
- I'd prefer to stay around Missouri or nearby states, but not an extreme priority.
- I have a 3.94 GPA (weighted)
- I took the pratice ACT and scored a 23, but my goal is 27-30 by senior year
- $15k/yr is probably the max I'd like to spend, although I know there's scholorship opportunities out there.

Any more questions please ask, I'll keep updating as I have more answers.

If this is the wrong sub, I apologize, I can repost elsewhere.",13,2
3,2014-8-2,2014,8,2,17,2cetkw,FileHippo Virus Deletion,https://www.reddit.com/r/computerscience/comments/2cetkw/filehippo_virus_deletion/,gisrteam,1406969036,,0,0
4,2014-8-3,2014,8,3,2,2cfrfe,"self-modifying code, godel machines, and AIG",https://www.reddit.com/r/computerscience/comments/2cfrfe/selfmodifying_code_godel_machines_and_aig/,YourFatherFigure,1407001389,"&gt; There are two reasons, however, why we should not outlaw writing of
self-modifying code forever. First, it may yet be possible to come up with a programming language that allows for writing self-modifying code in a safe and easy-to-understand way. Second, now that automated reasoning systems are becoming more mature, it is worthwhile investigating the
possibility of letting the machineinstead of human programmersdo all the self-modifications based on automated reasoning about its own programming.

-- http://www.idsia.ch/~juergen/selfreflection.pdf

I read some papers about the general theory a few years back, but the chapter above is actually talking about implementation.  This is super interesting stuff to me, but it seems weird that a) no one is saying this is a crackpot approach AND b) no one is saying it's really important/interesting work.  What do people think about this stuff?",1,4
5,2014-8-3,2014,8,3,6,2cgc6t,"Macbook Pro 13"" vs 15"" for Computer Science",https://www.reddit.com/r/computerscience/comments/2cgc6t/macbook_pro_13_vs_15_for_computer_science/,doncable,1407015666,"I'm going to be a student at college studying computer science. I am deciding on which Macbook Pro to get. I can either get the 13"" with 8gb of ram and an i5 dual-core processor, or a 15"" with 16gb of ram and an i7 quad-core processor. Obviously the 15"" is a lot more expensive. Although the 15"" is certainly an attractive option, I'm worried that it won't be portable enough and that I won't be using all the power behind it. In anyone's experience, how much power do university computer science compilers use? In college, I will mostly be using Java and C. Also, has anyone coded on a 13"" computer for a long time? How is the experience?",8,0
6,2014-8-3,2014,8,3,18,2chok3,Longest Path song.. enjoy :),https://www.reddit.com/r/computerscience/comments/2chok3/longest_path_song_enjoy/,Perfectix,1407057413,,1,4
7,2014-8-4,2014,8,4,0,2ci8n2,Artificial Intelligence Rocks!,https://www.reddit.com/r/computerscience/comments/2ci8n2/artificial_intelligence_rocks/,[deleted],1407079040,,0,1
8,2014-8-4,2014,8,4,10,2cjqm9,So I'm looking at going into Cs for my major what am I looking at classwise and job wise in the future?,https://www.reddit.com/r/computerscience/comments/2cjqm9/so_im_looking_at_going_into_cs_for_my_major_what/,Lt_Pickle,1407115264,,3,1
9,2014-8-4,2014,8,4,11,2cjuh6,A Useful NTFS Partition Recovery Tool Is Free of Charge,https://www.reddit.com/r/computerscience/comments/2cjuh6/a_useful_ntfs_partition_recovery_tool_is_free_of/,BlakeClaire,1407117921,,0,1
10,2014-8-4,2014,8,4,17,2cknew,Example code (written in C) that makes strong use of assertions,https://www.reddit.com/r/computerscience/comments/2cknew/example_code_written_in_c_that_makes_strong_use/,perincertus,1407141893,"I'm doing research in the field of software verification for a public university in Germany. To this end, I'm looking for a wide range of example source code (written in C) that makes strong use of assertions. Unfortunately, most open source tools in practice disregard assertions completely (or are already too complex for our tools). That's why I'm asking for your help. Concretely, I'm looking for examples that

- have an average or high complexity (too small examples wouldn't be that interesting for my purpose, too complex ones wouldn't help either),
- have none or only few dependencies to (proprietary) libraries / frameworks (unfortunately, our verification tool doesn't like external library functions very much at this time),
- use assertions to check meaningful properties at runtime,
- have a commandline-interface (i.e. no GUI-only)

It's all about the verification of real-world software - in this case, the automatic verification of assertions inside C code. Thus, I'd like to use such examples to evaluate my verification approach. Moreover, all results will be made public and will be free to use.

Any ideas?",3,1
11,2014-8-4,2014,8,4,19,2cku5n,Preparing for computing AS Level (Britain),https://www.reddit.com/r/computerscience/comments/2cku5n/preparing_for_computing_as_level_britain/,row101,1407149917,"Right, so I'm not doing much this summer and I figured I should prepare for my AS level in computing. I've already learnt to program, but is there a way for me to get a head start in the syllabus before the year starts?",4,2
12,2014-8-4,2014,8,4,20,2ckvd1,http://forums.seochat.com/search-engine-optimization-28/how-improve-ranking-474741.html,https://www.reddit.com/r/computerscience/comments/2ckvd1/httpforumsseochatcomsearchengineoptimization28howi/,renukainptc,1407151197,,0,0
13,2014-8-4,2014,8,4,22,2cl6g2,What Is DNS Server,https://www.reddit.com/r/computerscience/comments/2cl6g2/what_is_dns_server/,saadiqbal00,1407160521,,1,0
14,2014-8-5,2014,8,5,1,2cloy9,for loop in C,https://www.reddit.com/r/computerscience/comments/2cloy9/for_loop_in_c/,Cusp2207,1407171437,,0,0
15,2014-8-5,2014,8,5,2,2clq85,Big O Notation,https://www.reddit.com/r/computerscience/comments/2clq85/big_o_notation/,Cusp2207,1407172101,,0,1
16,2014-8-5,2014,8,5,2,2clqce,       ,https://www.reddit.com/r/computerscience/comments/2clqce/______/,basuony,1407172153,,1,0
17,2014-8-5,2014,8,5,8,2cmx0z,"Newer ""heroes"" of programming?",https://www.reddit.com/r/computerscience/comments/2cmx0z/newer_heroes_of_programming/,[deleted],1407194588,"Hi.

I've just been wondering about the fact that when I was learning how to program (baout 8 years ago), I had some people I considered the ""hot shots"" of programming and/or computer science: Ken Thompson, Gerald Sussman, Knuth, Dijkstra, Guy Steele, Brian Kernighan, Richard Stevens, and so forth (I don't remember them all right now).

I still think they are (although some are already dead), but I imagine some ""new names"" are about that I haven't heard about.

Care to share what people you guys think are the newer ""heroes"" of programming and/or computer science? Or even the older ones I missed in there.",0,1
18,2014-8-5,2014,8,5,11,2cneef,"New ""heroes"" of programming/CS",https://www.reddit.com/r/computerscience/comments/2cneef/new_heroes_of_programmingcs/,phao,1407205154,"Back when I was learning how to program and studying basics of CS (about 8 years ago), I had some people who I considered to be the ""hot shots"" of programming/CS, like Ken Thompson, Kernighan, Ritchie, Gerald Sussman, Hal Abelson, Knuth, Dijkstra, Guy Steele, and so forth.

I still consider them to be on a __pretty different level__, but I was just wondering what are the newer ones out there? I haven't noticed anyone kind of being ""acclaimed"" out there.

What do you people think? Care to mention your ""programming/CS heroes""? What do you think about new ones? Rich Hickey? Douglas Crockford?",9,6
19,2014-8-6,2014,8,6,2,2cpfo6,while loop,https://www.reddit.com/r/computerscience/comments/2cpfo6/while_loop/,Cusp2207,1407259844,,2,0
20,2014-8-6,2014,8,6,16,2crlvi,    ,https://www.reddit.com/r/computerscience/comments/2crlvi/____/,basuony,1407308507,,0,0
21,2014-8-6,2014,8,6,17,2crqud,Student raises money to finish Bachelor's in Computer Science.,https://www.reddit.com/r/computerscience/comments/2crqud/student_raises_money_to_finish_bachelors_in/,[deleted],1407313171,,0,1
22,2014-8-6,2014,8,6,20,2cs207,My start virus deletion Article is in greek,https://www.reddit.com/r/computerscience/comments/2cs207/my_start_virus_deletion_article_is_in_greek/,gisrteam,1407325330,,0,0
23,2014-8-7,2014,8,7,2,2ct0zf,"Computer Programming Is a Trade; Let's Act Like It (from wsj.com, but summary at acm.org)",https://www.reddit.com/r/computerscience/comments/2ct0zf/computer_programming_is_a_trade_lets_act_like_it/,bslade,1407347176,,0,2
24,2014-8-7,2014,8,7,3,2ct54k,do-while loop,https://www.reddit.com/r/computerscience/comments/2ct54k/dowhile_loop/,Cusp2207,1407349425,,1,0
25,2014-8-7,2014,8,7,6,2ctrf2,      ,https://www.reddit.com/r/computerscience/comments/2ctrf2/______/,basuony,1407361354,,0,0
26,2014-8-7,2014,8,7,20,2cvjnl,Computer Organization and Assembly Language,https://www.reddit.com/r/computerscience/comments/2cvjnl/computer_organization_and_assembly_language/,[deleted],1407411993,,0,2
27,2014-8-8,2014,8,8,1,2cw7v0,If programmers were cats...,https://www.reddit.com/r/computerscience/comments/2cw7v0/if_programmers_were_cats/,sailormoonandteam,1407428162,,0,0
28,2014-8-8,2014,8,8,6,2cx8a4,Nesting of loops,https://www.reddit.com/r/computerscience/comments/2cx8a4/nesting_of_loops/,Cusp2207,1407447615,,0,0
29,2014-8-8,2014,8,8,21,2cz3a9,Security Experts Inform About Delta Homes Virus Article is in Greek,https://www.reddit.com/r/computerscience/comments/2cz3a9/security_experts_inform_about_delta_homes_virus/,eurotruck63,1407501053,,1,1
30,2014-8-9,2014,8,9,0,2czh7z,"Already a CS major, trying to figure out which path to take",https://www.reddit.com/r/computerscience/comments/2czh7z/already_a_cs_major_trying_to_figure_out_which/,Atl4s,1407510523,"So I'm a second year computer science major and, though I've only had two CS classes so far, I love it and I'm definitely going to continue pursuing it. My problem is trying to figure out what path to take in terms of course selection.

I'll need to pick a concentration later on, though I'm a bit ahead of schedule so I could probably start taking the classes now. The concentrations range from the hardcore theory and math related ones like artificial intelligence and software engineering, to the less intensive ones (IMO) like internet applications and web design. Aside from the concentration, I'm also currently operating under the idea that I'm minoring in Math and Astronomy, but that may and will likely change.

See, I'm not really sure which path to take, and while these descriptions aren't accurate, I could go the software engineering route or the web design/development route. At least those are the paths that I think I'd be considering anyway.

The software engineering path would probably entail me taking the third calculus class (though it's not required) so that I could take more upper-level math classes and more difficult CS courses. This would very likely lead to me obtaining a minor in Math and also open the door to a minor in Cybersecurity.

The web design/development route, in my mind, is me taking the easiest courses, probably picking up a minor in Interactive Media and concentrating in internet applications, and simply getting the degree with little trouble so I can get out and do real work on my own. See, I'm a web developer intern right now and I love what I do. I love all the web technologies. But I guess I haven't been exposed to enough software engineering to know if I really love that. But then I'm wondering if I'm already overqualified for the Interactive Media minor since I've been doing web stuff for a while and I know my way around. That minor isn't strictly web based either - there's a video, sound, etc. component and I don't think I'm interested in that.

So I know it's probably very hard to give advice to me about this, since it's basically all up to me. I suppose simply writing it all down is helping me to think. I'm a strong student but I'm not sure if it's even worth it for me to go down the math/science/theory route if all I want is my degree so I can probably inevitably get a web development job anyway, though ideally I'd like to work with startups or start my own company. Any advice?

TL;DR already skilled yet love web development/design, should I go the math/science/theory route for software engineering, or stick to the web route and take easier classes and probably get a really good GPA even though I may be learning nothing new, at least with the first few classes involved?",2,7
31,2014-8-9,2014,8,9,14,2d1tcl,Cool summer job for freshman going in to sophomore year?,https://www.reddit.com/r/computerscience/comments/2d1tcl/cool_summer_job_for_freshman_going_in_to/,jsims4,1407563477,I'm planning on working the summer 2015 but not where. I currently work. I want to work somewhere more IT related instead of flipping burgers. I talked with the processors and was told internship would be available until my sophomore-junior year,5,2
32,2014-8-9,2014,8,9,16,2d1yxs,study of Rebotics,https://www.reddit.com/r/computerscience/comments/2d1yxs/study_of_rebotics/,[deleted],1407569332,,0,2
33,2014-8-10,2014,8,10,12,2d4el6,Consciousness in Humans and AI,https://www.reddit.com/r/computerscience/comments/2d4el6/consciousness_in_humans_and_ai/,tharindra_,1407642935,,0,1
34,2014-8-10,2014,8,10,16,2d4r3n,Introduction to Computers,https://www.reddit.com/r/computerscience/comments/2d4r3n/introduction_to_computers/,[deleted],1407654408,,0,0
35,2014-8-11,2014,8,11,0,2d5jgx,skills for primary education to improve future of CS,https://www.reddit.com/r/computerscience/comments/2d5jgx/skills_for_primary_education_to_improve_future_of/,Kurshis,1407686070,"Hello,

So I have been asked to join a project involving reorganization of primary education to include IT subjects. This is to improve development of individuals in IT and subsequently CS. 
And the problem I have - deciding on what skills should minor have by the end of 1st, 2nd, 3rd and 4th year of education. I would apretiate any idea or input on this :)",2,1
36,2014-8-11,2014,8,11,4,2d62wv,Looking into computer science and have a couple questions.,https://www.reddit.com/r/computerscience/comments/2d62wv/looking_into_computer_science_and_have_a_couple/,bhuinker2015,1407698870,"Hello.

I'm fairly new to reddit so this is my first post.  I have a few questions regarding cs as a major.  

1.  I'm going into my senior year in high school.  I have no real programming background to base my decision on but I've always been very tech savvy and skilled in math.  Will no previous knowledge have an adverse effect on me or not?  I've always been a quick learner with things new to me however.  

2.  I live in a small town in Iowa and would preferably like to stay in the state for college.  However I've seen a lot of talk about a BS in computer science but not as much as a BA in computer science.  I'm pretty sure the only school in this state that offers a BS in cs is Iowa State University.  All the other smaller and private schools only offer a BA in this field and are not widely known for this.  What is the main difference between the two and will the BS get me better jobs in the future or not?  I really liked ISU's campus but don't really know if I can handle the size.  I think a smaller private school would fit me better but don't know how their programs stack up.",6,2
37,2014-8-11,2014,8,11,4,2d63nw,Spike Deals Virus Deletion,https://www.reddit.com/r/computerscience/comments/2d63nw/spike_deals_virus_deletion/,gisrteam,1407699374,,0,0
38,2014-8-11,2014,8,11,21,2d8ag4,Computer Architecture,https://www.reddit.com/r/computerscience/comments/2d8ag4/computer_architecture/,jovykay,1407761142,,0,0
39,2014-8-11,2014,8,11,23,2d8grl,What to do for internships as CS major?,https://www.reddit.com/r/computerscience/comments/2d8grl/what_to_do_for_internships_as_cs_major/,ItDependsOnTheMetric,1407765813,"Hello reddit,

I'm currently a first year CS (=""Informatik"") student in Germany. First year, as in ""I just finished the first year/2 semesters"". I'm currently doing good (not the best, but good nevertheless) and it's quite fun.
Although I'm thinking I'm lacking quite a bit of practical knowledge. As everyone told me, and as I expected, CS was rather mathematical. Not that I don't like the math, I just think *only* doing induction proofs on graphs and amortized analysis on different algorithms won't get me very far in terms of jobs.

I didn't know much programming when starting CS, so I didn't have the opportunity to do internships until now. Now I know quite a bit of Java (and a little less C) from university (and some x86 assembly and VHDL if that counts), also Objective-C which I have taught myself to write an iOS app (which I even published, but it's not that popular, it only has 700 downloads yet).
But no ""practical applications"" of Java, e.g. I have no idea how to make a website/GUI/etc. with it.

So before the 3rd semester starts, I'm looking for ideas what to spend my free time on, so that I could maybe do an internship in winter (after the 3rd semester is finished).
All of the job offers I'm looking at require either sysadmin skills (either in a Linux environment or Windows (Exchange, Activedirectory and whatnot) environment) or programming skills (often Java/C#/PHP, combined with HTML/CSS/JavaScript which I know next to nothing about).

Can anyone tell me how ""much"" experience you need to do an internship? It doesn't need to be at giants like Microsoft or Apple or Google of course, just me getting to apply something of what I learned.

So: How do I get proficient in Linux/Windows server administration tasks, how do I get more ""applied"" knowledge of programming, and how much knowledge is enough to apply for internships?

Thank you in advance!

PS: I'm hoping, the third semester is not already too late for that... (B.Sc. in CS is 6 semesters here)
PPS: Sorry for my English, if it bothers you, as I said I'm German :)",1,3
40,2014-8-12,2014,8,12,3,2d96cm,Loop Control Statements,https://www.reddit.com/r/computerscience/comments/2d96cm/loop_control_statements/,[deleted],1407780180,,2,0
41,2014-8-12,2014,8,12,6,2d9tl7,Linear Search Algorithm in Array,https://www.reddit.com/r/computerscience/comments/2d9tl7/linear_search_algorithm_in_array/,dejavuprotech,1407792239,,0,0
42,2014-8-12,2014,8,12,6,2d9vkt,Binary Search Algorithm in Array,https://www.reddit.com/r/computerscience/comments/2d9vkt/binary_search_algorithm_in_array/,dejavuprotech,1407793264,,0,0
43,2014-8-12,2014,8,12,7,2d9z4i,Bubble Sort Algorithm,https://www.reddit.com/r/computerscience/comments/2d9z4i/bubble_sort_algorithm/,dejavuprotech,1407795217,,0,0
44,2014-8-12,2014,8,12,11,2daphl,Database books recommendation and comparison?,https://www.reddit.com/r/computerscience/comments/2daphl/database_books_recommendation_and_comparison/,[deleted],1407809785,"Although with application as my goal, I would like to learn about the theory of database (I am not afraid of some math and logic), which I guess will guide me through the mass of practical database references.  

Could you recommend some books?

Also comments on or compare (some of) the following books:

* Foundations of Databases (Abiteboul, Hull &amp; Vianu)

* Database Systems (Silberschatz, Korth and Sudarshan)

* A First Course in Database Systems, (Ullman, Widom, and Garcia-Molina)

* Database Systems The Complete Book 2002  (Ullman, Widom, and Garcia-Molina)

* Principles of database systems (Jeffrey D Ullman) 1982

* Database System Implementation, (Ullman, Widom, and Garcia-Molina)

* Database Management Systems (Ramakrishnan)

* An Introduction to Database Systems by C.J. Date

* Database Design and Relational Theory Normal Forms and All That Jazz By C.J. Date  2012

* Database in Depth: Relational Theory for Practitioners by Date

Thanks!",0,1
45,2014-8-13,2014,8,13,3,2dcx94,How To Make Your PC Core I7 Permanently ?,https://www.reddit.com/r/computerscience/comments/2dcx94/how_to_make_your_pc_core_i7_permanently/,etunescafe,1407868609,,0,1
46,2014-8-13,2014,8,13,6,2ddfy3,How long is a year in milliseconds (on average)?,https://www.reddit.com/r/computerscience/comments/2ddfy3/how_long_is_a_year_in_milliseconds_on_average/,[deleted],1407878069,1000 * 60 * 60 * 24 * 364.75 ?,0,1
47,2014-8-14,2014,8,14,23,2djj7e,Facebook Black Is Scam Article is in greek,https://www.reddit.com/r/computerscience/comments/2djj7e/facebook_black_is_scam_article_is_in_greek/,gisrteam,1408027449,,0,0
48,2014-8-15,2014,8,15,0,2djp3j,"Top 20 colleges for computer science majors, based on earning potential",https://www.reddit.com/r/computerscience/comments/2djp3j/top_20_colleges_for_computer_science_majors_based/,antdude,1408030669,,3,6
49,2014-8-15,2014,8,15,1,2djsph,Become a Good Programmer,https://www.reddit.com/r/computerscience/comments/2djsph/become_a_good_programmer/,[deleted],1408032498,,2,0
50,2014-8-15,2014,8,15,1,2djtr6,[Logic] I have a logic question that I'm stuck on!,https://www.reddit.com/r/computerscience/comments/2djtr6/logic_i_have_a_logic_question_that_im_stuck_on/,[deleted],1408033081,"Im studying some logic questions and I've run into this from a past paper.

[Here is the question.](http://i.imgur.com/7LCduPs.jpg)

Any explanations would be greatly appreciated! cheers.",6,1
51,2014-8-15,2014,8,15,11,2dlnxx,Advice much needed,https://www.reddit.com/r/computerscience/comments/2dlnxx/advice_much_needed/,[deleted],1408071273,"I just got my first job out of college. However, until today, I was told my development machine will be *nix based. Today I found out they are no longer doing this and that I'd have to work on Windows 7 machine. 


Through out my development career, I've either been on a Mac (please dont start arguing about how its over priced) and/or Linux.


I know I can search and find my favorites. But Im asking you since I start development on Monday

If you were to do Java, C/C++ development on a Windows enviorment, what tools would you use? Any and all advise welcome!

Tell me all your windows tricks to make development easier on windows!!!!

Thanks guys,
You are a life saver. 

PS: Not sure if this is fully fitting here!

**EDIT:** Typos
",4,2
52,2014-8-15,2014,8,15,15,2dm5qr,Need help on computer science.,https://www.reddit.com/r/computerscience/comments/2dm5qr/need_help_on_computer_science/,navismm,1408085788,"Hi, i just joined bachelor's of computer science.
can you please suggest me any sources from where i can learn the very basic fundamentals of computer science, i want to have the in-depth knowledge about computer programming.
Thanks.
",6,3
53,2014-8-15,2014,8,15,21,2dmmtn,"I will be studying Computer Science next year, What should I do to prepare?",https://www.reddit.com/r/computerscience/comments/2dmmtn/i_will_be_studying_computer_science_next_year/,AtomicRaine,1408105825,"A level results came in yesterday and I will be studying Computer Science in September 2015 (at University of Sheffield, UK). 

I have a year before I go and study, what should I do to prepare myself?

 I studied Physics, Mathematics and Western Philosophy for my A levels.
I have little to no experience writing code. I used Codecademy to learn JavaScript eight months ago but other than that, nothing.

Any help is appreciated",7,3
54,2014-8-16,2014,8,16,0,2dn5ph,Learn Programming,https://www.reddit.com/r/computerscience/comments/2dn5ph/learn_programming/,[deleted],1408118245,,0,4
55,2014-8-17,2014,8,17,1,2dqcag,Lets Enjoy Programming | LEARN CODING IN ANY LANGUAGE AND BECOME EXPERT PROGRAMMER!,https://www.reddit.com/r/computerscience/comments/2dqcag/lets_enjoy_programming_learn_coding_in_any/,james09212,1408207346,,0,1
