,date,year,month,day,hour,id,title,full_link,author,created,selftext,num_comments,score
56,2014-8-17,2014,8,17,17,2dscvv,How to Install an Operating System on a Computer?,https://www.reddit.com/r/computerscience/comments/2dscvv/how_to_install_an_operating_system_on_a_computer/,stackhow17,1408264287,,0,0
57,2014-8-17,2014,8,17,22,2dsrik,CoolSaleCoupon Virus Deletion Article is in greek,https://www.reddit.com/r/computerscience/comments/2dsrik/coolsalecoupon_virus_deletion_article_is_in_greek/,gisrteam,1408283103,,0,0
58,2014-8-18,2014,8,18,2,2dtb0o,Link List Source Code,https://www.reddit.com/r/computerscience/comments/2dtb0o/link_list_source_code/,linklist09,1408297522,,0,1
59,2014-8-18,2014,8,18,12,2duro7,Good Programmer,https://www.reddit.com/r/computerscience/comments/2duro7/good_programmer/,Prgo90,1408332458,,0,1
60,2014-8-18,2014,8,18,14,2duz83,Nervousness,https://www.reddit.com/r/computerscience/comments/2duz83/nervousness/,JoseVanguard,1408338066,So hey. I am currently having major anxiety about my computer science major. I have not visited stem program to talk even though I have been at this school for 2 years going on to 3 (because of bad English and still need to take all computer science courses) and I just feel like I am starting of bad. Is it true or is the anxiety just messing with me?,2,1
61,2014-8-18,2014,8,18,22,2dvql8,Handle Programming Error,https://www.reddit.com/r/computerscience/comments/2dvql8/handle_programming_error/,prog998,1408366917,,0,1
62,2014-8-19,2014,8,19,0,2dw5m0,Masters,https://www.reddit.com/r/computerscience/comments/2dw5m0/masters/,kag0,1408376679,"So I'm in my senior year of a CS degree and I'm thinking about a masters. I don't have a terribly good GPA (low 3) but I am quite good at actual development and projects. My main interests are high level software and security and I'll be leading a small research team this year (doing basically decentralized certificates so security, networking, algorithms). I just finished up an internship as a software engineer at a big company that starts with a Q and that makes up the majority of my work experience.

SOOoo, what do you guys think of CS masters in general and in my case, and are there any schools you think would be good for me, or should I just head straight to SV and make some money?",1,2
63,2014-8-19,2014,8,19,3,2dwpma,Computer Science specialty to put on Resume?,https://www.reddit.com/r/computerscience/comments/2dwpma/computer_science_specialty_to_put_on_resume/,Ghostmasks,1408387531,"Hello all. I have just received my Bachelor's Degree in Computer Science this last May.

Cue the job hunt...

I'm currently working on my resume and after spending a couple of hours, and having only a page worth of lines to show for it (a humorously familiar feeling in Computer Science), I've finally reached a point of near-completion. It's a great feeling but I am looking for help to make the final push. 

I'm doing my best to make my resume specific and unique to me so I stand out. Ideally, I'd put my special computer science interests and skills that show that I'm not just a code-monkey. But I'm coming up with a blank when I attempt to list my skills and specialties that aren't simply expected of any computer scientist. Why bother listing that I can apply my ""efficient coding"" skills? Or that I have ""knowledge of modularization""?

My only breakthrough is when I recently realized that I'm better at conceptualizing the problem solving and working with recursion. I was often the quicker one in my classes to wrap my head around the mental acrobatics that Computer Science algorithms can require. Is there better, less abstract way to articulate this in a resume that works for the Computer Science job market?

Can anybody shed some light on some words, concepts, skills or anything that might spark my memory of what I specialize in doing? I know there is something I'm missing but I'm drawing blanks now that I'm finally at this stage in my career.

Cheers

P.S. Any resume advice for a Computer Science major would be greatly appreciated.",2,5
64,2014-8-19,2014,8,19,10,2dxtcb,Windows 8.1 Microsoft error,https://www.reddit.com/r/computerscience/comments/2dxtcb/windows_81_microsoft_error/,big_hand_larry,1408410199,"Ok so I just got a new laptop and anyone who has also got one in the last few months can probably tell you they are preloaded with a bunch of useless almost malware like files and it has taken a lot of work.
So after three very long weeks I decided to open the windows store to buy some apps.  It gave me the 0x80072efd error and I have not been able to resolve it.  I eventually was told it may have to do with my LAN settings being set to proxy.  After many more hours I still have not found a way to keep these switched off.  Any help is appreciated and I will not download anything.  Thx. ",1,0
65,2014-8-19,2014,8,19,13,2dyd4i,Professional Computer Organizations,https://www.reddit.com/r/computerscience/comments/2dyd4i/professional_computer_organizations/,unlikelycomputerguy,1408423043,"Alright, so I have recently started my pursuit for a degree in Computer Science. I would like to join an organization like ACM, IEEE, or AITP, but am worried that the members of these organizations are not welcoming to those that are not as knowledgeable as they are. While I am not an idiot when it comes to computers, I am very good at problem solving and fixing hardware/ software issues experienced in most help desk jobs, I lack the knowledge possessed by those that have worked with computers from a very young age. Knowing that I am behind when it comes to understanding computer systems other than fixing computers, I would like to join a professional computing organization that would help in my pursuit for a computer science degree and not leave me feeling out of place around those that know a hell of a lot more than I do. I may not know as much as most who are pursuing a computer science degree, but my passion to learn and become as knowledgeable as humanly possible will drive me to one day be where they are. I guess my question, after all of my rambling, is there anyone that has been in a situation such as myself, and found an organization that was welcoming and helpful for you? Is there an organization that helped you in your pursuit for a computer science degree while also understanding that you are a ""beginner"", for lack of a better term?",2,1
66,2014-8-19,2014,8,19,22,2dzbzp,Could use some CS pursuit advice,https://www.reddit.com/r/computerscience/comments/2dzbzp/could_use_some_cs_pursuit_advice/,TheSeanis,1408455436,"Hello,

I'm not actually a CS major, I'm an Information Assurance major (which can be an area of concentration for CS majors at my school) a lot of the basic framework for the degree is similar; we follow a core set of classes for all programs within the college of information science &amp; technology..

I was recently inducted into a program specifically for Information Assurance majors, it covers all the tuition for up to two years, pays a salary to go to school, has internship requirements and places me in a job for up to 2 years to repay their investment into my education. 

This is all fine and dandy, but, I took two courses over the summer to kickstart my program (Calc 1 and Advanced Java programming) and they both kicked my ass. Granted, Calculus was an online course and the Java course was condensed from 16 weeks to 6. Anyways, I lost all my financial aid and have to pay for the next two semesters out of pocket until I officially sign onto the scholarship program (you must graduate within two years of signing on, so, I delayed my entry)

My fear is that if I'm struggling with Calc and Programming then I will struggle even more with the more advanced classes. I wouldn't say that I dislike programming, I just have a hard time finding the fun in the assignments. They frustrate me to no end.


Thanks for reading, just looking for any general advice/suggestions, can clarify anything if needed.",3,1
67,2014-8-19,2014,8,19,23,2dzf8p,"[Question] I'm looking for an application I can build in Java, that is complex, but also useful.",https://www.reddit.com/r/computerscience/comments/2dzf8p/question_im_looking_for_an_application_i_can/,Fredriksebek,1408457512,"I know beyond the basics, but it needs to serve some sort of utility. I want to challenge myself, but not to the point were I have to constantly look online.

An calculator for example is too easy, but a graphics integrated game is too difficult.

Thanks&lt;3

P",8,6
68,2014-8-20,2014,8,20,10,2e1ee0,Best time to submit job applications after graduating in Computer Science?,https://www.reddit.com/r/computerscience/comments/2e1ee0/best_time_to_submit_job_applications_after/,havocshack,1408496606,"I have two summers of interning, same company. When is the best time to start applying for jobs before graduating with a Computer Science bachelors degree? Is 1 year in advance too soon? 6 months??  ",5,5
69,2014-8-20,2014,8,20,22,2e2u4r,5 Tips to improve your Programming Logic,https://www.reddit.com/r/computerscience/comments/2e2u4r/5_tips_to_improve_your_programming_logic/,popp090,1408540609,,0,1
70,2014-8-21,2014,8,21,0,2e35xa,Good stuff,https://www.reddit.com/r/computerscience/comments/2e35xa/good_stuff/,majinmax72,1408547952,,0,1
71,2014-8-21,2014,8,21,9,2e4vwb,Too Much Benefits From Google+,https://www.reddit.com/r/computerscience/comments/2e4vwb/too_much_benefits_from_google/,naeem090,1408581935,,0,1
72,2014-8-21,2014,8,21,21,2e6bsh,Need to Know versus Principle of Least Privilege,https://www.reddit.com/r/computerscience/comments/2e6bsh/need_to_know_versus_principle_of_least_privilege/,[deleted],1408625425,"Hi, I'm having some issues understanding what the differences are between these concepts. Could anyone help by elaborating?",0,1
73,2014-8-21,2014,8,21,23,2e6hx6,Learning Visual Basic at school...what's the point?,https://www.reddit.com/r/computerscience/comments/2e6hx6/learning_visual_basic_at_schoolwhats_the_point/,blueredhead09,1408629631,"I just read [here](http://en.wikipedia.org/wiki/Visual_Basic) that Basic is an unsupported language as of 2008. Originally this class was going to teach C# instead, but was switched to Basic. What's the point of learning an unsupported language? One of my IT student friends even said that it's outdated. ",16,5
74,2014-8-22,2014,8,22,3,2e78jq,What does applying a laplacian transform on an image do?,https://www.reddit.com/r/computerscience/comments/2e78jq/what_does_applying_a_laplacian_transform_on_an/,fight_off_thy_demons,1408644306,"I just got hired to a computer vision lab this fall as a freshman, and I'm reading papers the professor has published. In his paper over undering the optics of a phase contrast microscopy image, he applies a laplacian transform onto the image. What would that do exactly?",3,1
75,2014-8-22,2014,8,22,3,2e7b1q,Taking a Software Engineering this semester. Can anyone tell me what it will be like?,https://www.reddit.com/r/computerscience/comments/2e7b1q/taking_a_software_engineering_this_semester_can/,battle_guy,1408645606,Give a detailed explanation of what it was like when you took it. Hard? Easy? Lots of coding? Less coding than you think?,2,1
76,2014-8-22,2014,8,22,10,2e8l7a,CS major or CS/Math major?,https://www.reddit.com/r/computerscience/comments/2e8l7a/cs_major_or_csmath_major/,[deleted],1408672149,"So I just realized that cs majors and cs/math majors require the same number of classes. 

Is there an advantage of going the CS/Math route?

thanks :)",0,1
77,2014-8-22,2014,8,22,12,2e8sff,Array Programming is fun of coding,https://www.reddit.com/r/computerscience/comments/2e8sff/array_programming_is_fun_of_coding/,codinu8,1408676790,,0,1
78,2014-8-22,2014,8,22,15,2e99xy,I know how to program C but I don't know what to do with it for fun,https://www.reddit.com/r/computerscience/comments/2e99xy/i_know_how_to_program_c_but_i_dont_know_what_to/,kikillorulez,1408690589,"I'm an electrical engineering student in University of Maryland who took a year of C and basically learned basic algorithms, structs, search trees, bit lever operations, programming with pointers, etc. I've programmed hardware stuff such as a hovercraft project and VEX robots in competitions but I believe those were simple to program cause they were basically simple commands and algorithms. My main issue is that I don't know what to do with it. I guess I rather be given a task and maybe some tools and work then think of something my own. I was thinking of making an app or something like that but its usually in java or C++. I know C++ is pretty much similar to C but I just don't know basic high level syntax. I tried to make an IRC bot using C but I got confused with all server stuff that I just stopped. I was one of the highest grades in my C programming course but I don't think that means anything after I started to try stuff on my own. 

Can anyone help me with this? I just don't know where or what to start with. ",4,3
79,2014-8-22,2014,8,22,22,2e9x1v,Improve your Logic in Programming,https://www.reddit.com/r/computerscience/comments/2e9x1v/improve_your_logic_in_programming/,lodo009,1408713890,,0,1
80,2014-8-23,2014,8,23,3,2eaukk,How can I be more logical,https://www.reddit.com/r/computerscience/comments/2eaukk/how_can_i_be_more_logical/,thorpeza,1408733131,How can I train my brain to think more logically or algorithmically. Are there certain puzzle games or things I can do?,5,1
81,2014-8-23,2014,8,23,5,2eb5rh,what is it?,https://www.reddit.com/r/computerscience/comments/2eb5rh/what_is_it/,SUsudo,1408739434,"what do you tell people when they ask you "" what's computer science?"" 

does our bother you when they assume you fix computers? 

also do you tell people your a computer scientist or a programmer?",5,9
82,2014-8-23,2014,8,23,19,2ectzg,String Programming in Java is not a difficult task,https://www.reddit.com/r/computerscience/comments/2ectzg/string_programming_in_java_is_not_a_difficult_task/,Strigni78,1408788556,,0,1
83,2014-8-24,2014,8,24,2,2edmjz,Software Systems Vs. Other Systems,https://www.reddit.com/r/computerscience/comments/2edmjz/software_systems_vs_other_systems/,educationfront,1408814564,,0,1
84,2014-8-24,2014,8,24,22,2efwb1,How to generate Dinero IV input trace files,https://www.reddit.com/r/computerscience/comments/2efwb1/how_to_generate_dinero_iv_input_trace_files/,delixd,1408885361,"I've been searching for a couple of hours and I can't find any info on how [Dinero IV](http://pages.cs.wisc.edu/~markhill/DineroIV/) creates it's input trace files. 
It's considered the best single cpu cache simulator (and I even think the most correct) it has been referenced in books like Patterson and Hennesy's Computer Architecture and yet I can only find three examples of input files (TeX, Gcc and Spice) and no info on how to generate them. 

I saw that the .din input file is just 
#command #address
where command is either data read, data write, instruction read or flush and #address is the address in main memory

But I was wondering if there is a way to generate this kind of files from existing executables or existing source code?",3,0
85,2014-8-25,2014,8,25,1,2egb99,If you are a Programmer then do this ..??,https://www.reddit.com/r/computerscience/comments/2egb99/if_you_are_a_programmer_then_do_this/,Ikuiiu99,1408897591,,0,1
86,2014-8-25,2014,8,25,13,2ei56t,I want to study CS but there are so many factors stopping me.,https://www.reddit.com/r/computerscience/comments/2ei56t/i_want_to_study_cs_but_there_are_so_many_factors/,CSunsurestudent,1408941543,"Hi r/computerscience, 

I've never been in such a low point in my life. 

Over the past few months, I have been searching through careers that I might find myself pursuing and CS has been near the top of that list every single time I work out a pros and cons list.

I fundamentally believe that CS is the degree of the future.

I've tried to study languages on my own,
HTML 
PHP 
Python 
C
Objective C 

but none of them I feel rather confident of.

It always boils down to two problems,

* 1) I lack experience. 
So many people that I know of who pursue CS all have prior experience doing projects. They know a multitude of languages, have excellent side projects and have some real world programming projects for companies. All this they accomplished without even starting their degree. 

But the thing is, every time I set my sights on starting a project. It gets derailed almost within the week either by 1) An immovable problem that I can't seem to solve or 2) I become too busy and the project gets shelved. By the time I get back to it , I'm back to square one because I've forgotten most of it.

* 2) I lack the mathematical foundation.
I've always been weak at math, and my constant avoidance and fear of it only exacerbated my weakness over time. I take the GCSE standard and although I managed an A* in it I have absolutely no experience beyond that. No calculus knowledge at all. 

This scares me the most because I know Computer Science is essentially a heavily modified mathematics major. I'm not sure whether I can cram all that math in the next year before I start a degree programme.

I was wondering if anyone could share any advice at all or whether anyone has been in a similar position as me?


",4,3
87,2014-8-25,2014,8,25,21,2eiuik,Trying for a computer science degree,https://www.reddit.com/r/computerscience/comments/2eiuik/trying_for_a_computer_science_degree/,Aceuniverse,1408968554,"So my summer has been quite exciting and I've made tons of changes that are for the better. One of those things that I have been thinking about changing is my direction in life (education-wise). Currently I'm a Geophysics and Math double major but I have always wanted to be a computer science major. But unfortunately, my school does not offer a computer science major (they dropped it a few years back). So I have been trying to plan out how I'd want to execute this. My best plan is to complete my Geophysics major and a minor in Math. Then attend my local community college for 1-1.5 yrs after and obtain an Associates in Computer Science. After which I would apply for graduate school for Computer Science or Software Engineering. Is this a good plan or would I have to get my bachelors in computer science which would take upwards of 3 years? Thanks so much!",5,1
88,2014-8-25,2014,8,25,23,2ej4w7,Need Job Advice,https://www.reddit.com/r/computerscience/comments/2ej4w7/need_job_advice/,Shannon518,1408976301,"Quick background info, graduated last spring with B.S. in Computer Science (3.3). Currently working in Health Information Management at a local hospital.


I'm having terrible time trying to find a tech job. I'm really open to anything in the computer field just to build up experience.


I've signed up for online job sites such as, monster and career builder. I constantly search Global foundries, IBM, and G.E. for openings. They are the biggest tech companies in my area. Yet the problem with those is entry level starts out with a bachelors and 5 years expierence, with some asking for a masters. These are entry level so idk how anyone gets in.


Any advice is much appreciated. Where did you start and how did you get into the position you are today? Do I need a masters, is a bachelor's no longer good enough?",1,3
89,2014-8-26,2014,8,26,2,2ejrl2,"Help me define, understand, performance-bind, and name this TSP variant (TTP?)",https://www.reddit.com/r/computerscience/comments/2ejrl2/help_me_define_understand_performancebind_and/,joshuaMachine,1408989292,"I would intuitively call this the traveling trader problem. In this (very loose) variation of the TSP, we aren't carrying all of our wares throughout our journey for free, and the goal is not even to visit all of the nodes. Rather, we want to find an *efficient* sub-route through a set of *market* nodes, each of which offers different rates for buying and selling. To help define what efficient means, we can consider that there is an additional cost (time) to traverse between nodes, and the ultimate problem statement has to do with discovering a path which produces the most wealth in a given duration, starting from a given node.

All together, our problem model includes the following components so far:

- The Trader, who starts in a given market node with a given amount of starter capital, and wants to optimize his earnings, ie. accrue as much wealth as possible, given a a fixed amount of time
- The market nodes, each of which have a list of goods for sale at a known cost, and a list of goods in demand with a known offer
- The edges between the markets have a cost associated with traversal, impacting the wealth of the traveling trader, but also have a time cost associated with them. These two distinct values could be considered linked unless there is use in modeling them uncoupled. Up for discussion.
- A path for our trader consists not only of a list of markets to visit in order, but also a list of goods to buy and sell at each market.

The problem is: find me the path for our trader that results in the most wealth accrued, given a fixed limit of x on time spent on travel.

I find this a very interesting human problem. Please help me better the model of it, formalize it, understand the performance constraints, generate an algorithm to get a solution or an approximation method, and have fun!",0,1
90,2014-8-26,2014,8,26,5,2ekbhh,I'm currently in undergrad and I kinda regret my choice in majors but I don't know how to market myself in tech.,https://www.reddit.com/r/computerscience/comments/2ekbhh/im_currently_in_undergrad_and_i_kinda_regret_my/,[deleted],1408999994,"I'm currently pursuing double majors in Econ and Math. I love both very much, but I realized that I might enjoy a career in compsci a little too late. I'm a junior now, and it's near impossible for me to switch without the heavy monetary cost. I already have tons of credits (technically I should be a second semester junior). I want to know how I can market my BA in Math if I want a job in software. Can someone in math expect a good starting salary? I plan on interning like crazy this year, summer, and next year. Should I apply for a CS masters? ",1,2
91,2014-8-26,2014,8,26,5,2ekc07,Questions About Internship Opportunities,https://www.reddit.com/r/computerscience/comments/2ekc07/questions_about_internship_opportunities/,[deleted],1409000282,"Hello,

I've recently changed my major to Computer Science from Business (I'm now minoring in business) as an incoming junior and I would really like to get some work experience this summer. The problem is, this is my first year as a computer science major so I've got very little working knowledge about programming right now. How should I be looking for internships like this? Or should I even be? I took classes this summer and I am trying my best to avoid taking more classes next summer by getting work experience instead. 

I go to Texas A&amp;M so I've been looking into/applying to companies in Austin and Houston (I'm very open to traveling to another state to work during the summer as well) but I can't help but feel terribly under-qualified. Please give me some advice. ",3,3
92,2014-8-26,2014,8,26,12,2elhyj,"What's a good book to learn C# if I already know C, C++, and Java?",https://www.reddit.com/r/computerscience/comments/2elhyj/whats_a_good_book_to_learn_c_if_i_already_know_c/,ryanstephendavis,1409025543,"I'm very well versed with the 3 aforementioned languages and would really like to dive into C#.  I don't want a book that's going to go over object oriented design concepts and the such, but one that will be a quick overall primer.  Any suggestions would be greatly appreciated!
",4,2
93,2014-8-26,2014,8,26,16,2elwd2,How the Global Variable is used in Programming,https://www.reddit.com/r/computerscience/comments/2elwd2/how_the_global_variable_is_used_in_programming/,Kiah21,1409037939,,0,1
94,2014-8-26,2014,8,26,17,2em01l,How to delete Linkey Virus,https://www.reddit.com/r/computerscience/comments/2em01l/how_to_delete_linkey_virus/,gisrteam,1409042160,,3,0
95,2014-8-26,2014,8,26,23,2emole,Windows 7(all versions 32 bit/64 bit) Permanent Genuine Activation (lifetime Activation).,https://www.reddit.com/r/computerscience/comments/2emole/windows_7all_versions_32_bit64_bit_permanent/,kirankatabattini,1409063808,,8,0
96,2014-8-27,2014,8,27,0,2emt5u,A new explanation for techs pathetic gender diversity: The personal computer,https://www.reddit.com/r/computerscience/comments/2emt5u/a_new_explanation_for_techs_pathetic_gender/,ACMlarry,1409066329,,0,1
97,2014-8-27,2014,8,27,23,2eq71a,The importance of CS and Programming education (Ideas needed),https://www.reddit.com/r/computerscience/comments/2eq71a/the_importance_of_cs_and_programming_education/,Balaam,1409149590,"Hi everyone!

There is a big probability that Ill have to present a talk about the importance of Computer Science and Programming education in the modern world to a big audience of people that could have some impact in the matter at an European level.

I have a template of it done already, but I think that my opinion is just one among many. 

Thus, I thought that it would be interesting to gather ideas from people around Reddit. 

Why, in your opinion, is education in these subjects so important? ",2,6
98,2014-8-28,2014,8,28,1,2eqjb8,Its time to move on and go a bit deeper discussion. In this article we will be talking about what a well-engineered software is and what is meant by balancing act?,https://www.reddit.com/r/computerscience/comments/2eqjb8/its_time_to_move_on_and_go_a_bit_deeper/,educationfront,1409156551,,0,1
99,2014-8-28,2014,8,28,2,2eqo9s,Why Java ..... ????,https://www.reddit.com/r/computerscience/comments/2eqo9s/why_java/,Java989,1409159266,,0,1
