,date,year,month,day,hour,id,title,full_link,author,created,selftext,num_comments,score
0,2014-10-1,2014,10,1,11,2hy9rt,I want to major in to computer science but I am not good at math.,https://www.reddit.com/r/computerscience/comments/2hy9rt/i_want_to_major_in_to_computer_science_but_i_am/,cjt11203,1412128872,I am in my first semester in community college and I have already changed my major twice. I have always been interested in computer science but I have been avoiding it since I am not good at math.I failed pre calculus in high school but that may have been because it was senior year and I gave up within the first semester.  I am currently taking an introductory math class but I plan on taking pre calculus next semester since most computer science programs require it as a pre requisite. Are there any suggestions or advice? Anything I can do to prepare myself?,7,4
1,2014-10-1,2014,10,1,14,2hyt81,Currently a computer science major and very nervous about it. Help? :),https://www.reddit.com/r/computerscience/comments/2hyt81/currently_a_computer_science_major_and_very/,ajsmit2,1412142153,"I'm in my sophomore year of college and I am currently on the path to graduating with a Computer Science degree, but quite honestly I feel like I have next to no experience with technology. I helped out at my old middle school working on the laptops and desktops there (mostly just doing diagnostic checks and installing laptop images), but as far as building my own computer, or creating my own website from scratch or anything like that I have no real idea what I'm doing. As far as building my own computer, I'm in the process of trying to scrounge up money to build one, but being in college, that isn't going so well. It just feels like everyone and their mother has so much in-depth experience with hardware and software, (everyone I talk to has opinions on the latest and greatest hardware and seems to be up to date on things), where as I feel like I don't know much.

Does anyone have any tips for how to get started growing a wider experience base? Currently I only know basic java from a series of 2 programming courses I have taken so far and very VERY introductory Visual Basic from a high school programming course that was offered.",3,2
2,2014-10-1,2014,10,1,19,2hz9k2,"Not strictly compSci, but a question for computer scientists! Help me find a gift please?",https://www.reddit.com/r/computerscience/comments/2hz9k2/not_strictly_compsci_but_a_question_for_computer/,aigirl,1412160144,"Hey all,

I did post on r/AskReddit, but thought you guys might be able to help better. 
My boyfriend is a computer scientist, loves programming and gaming and is absolutely impossible to buy gifts for because he either has what he needs, what he wants costs a fortune or he has no interest in frivolous shit.

Just wondering if any of you guys have any things you'd really love or recommend as presents, or something someone gave you that was really awesome?

Thanks y'all!

EDIT: Got some great advice, thanks to everyone who pitched in! :)",6,0
3,2014-10-1,2014,10,1,21,2hzh4e,Some Careers in Computer and Information Science You May Not Have Thought About,https://www.reddit.com/r/computerscience/comments/2hzh4e/some_careers_in_computer_and_information_science/,taylorsmith22,1412167048,,0,0
4,2014-10-2,2014,10,2,1,2i013q,Artificial Intelligence?,https://www.reddit.com/r/computerscience/comments/2i013q/artificial_intelligence/,[deleted],1412179204,"So I'm applying to do comp sci next year at uni and I want to get a better understanding of what AI really is before applying.

For example would Google's self-driving car come under AI or would it be under another branch of CompSci and Engineering?",0,1
5,2014-10-2,2014,10,2,2,2i0ezl,CCNP Route: Domain Wide OSPF Default Routes,https://www.reddit.com/r/computerscience/comments/2i0ezl/ccnp_route_domain_wide_ospf_default_routes/,abingabanger,1412186293,,0,1
6,2014-10-2,2014,10,2,7,2i1a6x,C-Programming question,https://www.reddit.com/r/computerscience/comments/2i1a6x/cprogramming_question/,rounder123,1412202430,"I am being asked to derive an algorithm to calculate the number of acres in the little triangular bit of land.

Farm A contains exactly 370 acres, B contains 116 acres, and C contains 74 acres.

How do i go about doing this?
any help would be appreciated.",4,0
7,2014-10-2,2014,10,2,9,2i1pbb,Some Eclipse Questions,https://www.reddit.com/r/computerscience/comments/2i1pbb/some_eclipse_questions/,[deleted],1412211193,"I am coding in Java using Eclipse. I am more familiar with Visual Studio, and found Eclipse to be the most similar IDE. However, there is one feature I have noticed is missing and I can't figure out if Eclipse has an option for it. In VS when I create an object and later reference it, VS brings up a list of all objects so that I don't have to type it out. Is there any way for Eclipse to do this, like a plugin or something? Thanks. ",2,0
8,2014-10-2,2014,10,2,11,2i1w21,"Quick Java question (Intro CS, Eclipse)",https://www.reddit.com/r/computerscience/comments/2i1w21/quick_java_question_intro_cs_eclipse/,[deleted],1412215236,"I'm doing an assignment in which the user enters three roots, and in return the code prints the polynomial. For example, with 5, -3, and 2, the output would be x^3 - 4x^2 + 11x + 30. I have the multiplication part solved, as in I could get the integers ( -4,11,and 30 ) for the above problem. I'm unsure as to how to print the output with the x's a part of it. Im assuming i need to do something with x, as i get errors whenever I try to put  x alongside an integer in the printing. Thanks in advance.

In case it's unclear: The answer should come out as x^3 + ax^2 + bx^1 + c, where a, b, and c are integers that have already been given a value.",3,1
9,2014-10-2,2014,10,2,14,2i2epf,Need help with java.,https://www.reddit.com/r/computerscience/comments/2i2epf/need_help_with_java/,theavailabletree,1412227834,"Our teacher recently introduced us to arrays, but I don't really know how it works. 

How would I change my current program into an array?


import java.util.Scanner;

public class project10{

    public static void main(String[] args){

        Scanner kbReader = new Scanner(System.in);

        System.out.print(""What is your weight on the Earth? "");

        int Earth=kbReader.nextInt();

        System.out.println(""1. Voltar"");

        System.out.println(""2. Krypton"");

        System.out.println(""3. Fertos"");

        System.out.println(""4. Servontos"");

        System.out.print(""Selection? "");

        int weight=kbReader.nextInt();        

        switch(weight){

            case 1:

            System.out.println(""Your weight on Voltar would be ""+.091*Earth);

            break;

            case 2:

            System.out.println(""Your weight on Krypton would be ""+.720*Earth);

            break;

            case 3:

            System.out.println(""Your weight on Fertos would be ""+.865*Earth);

            break;

            case 4:

            System.out.println(""Your weight on Servontos would be ""+4.612*Earth);

            break;

        }

    }

}
",1,0
10,2014-10-2,2014,10,2,21,2i33ir,Suggestions on How to Amplify Research Productivity,https://www.reddit.com/r/computerscience/comments/2i33ir/suggestions_on_how_to_amplify_research/,nzhiltsov,1412254317,,0,1
11,2014-10-2,2014,10,2,21,2i340z,Article arguing that we should redesign computer architecture from the ground up.,https://www.reddit.com/r/computerscience/comments/2i340z/article_arguing_that_we_should_redesign_computer/,zergl1ng,1412254739,,3,3
12,2014-10-4,2014,10,4,5,2i7wz0,CCNP Route: OSPF Area Types,https://www.reddit.com/r/computerscience/comments/2i7wz0/ccnp_route_ospf_area_types/,abingabanger,1412367644,,0,1
13,2014-10-4,2014,10,4,6,2i84xo,Currently an Electrical Engineer trying to convince my parents to financially help with the switch to Computer Science. I kind of need help convincing them.,https://www.reddit.com/r/computerscience/comments/2i84xo/currently_an_electrical_engineer_trying_to/,Artiriux,1412372191,They are CONVINCED there isn't a job market out there for computer science majors and that the pay is very bad. Also that getting a job will be extremely difficult. Are there any credited sources that combat this argument? Thank you for your time.,6,1
14,2014-10-4,2014,10,4,9,2i8jy4,Quick Java constructor question,https://www.reddit.com/r/computerscience/comments/2i8jy4/quick_java_constructor_question/,[deleted],1412381943,"I'm writing a Java class with a constructor which accepts an object type of an interface which is implemented by 3 different classes. If this object passed into the constructor is a null value then I should initially make the constructor class be empty.

How would I allow the constructor to accept a null object value? I cannot create a new blank object of the interface because it tells me it cannot be initialized. Currently my code for the constructor is simply:

Public RedPlate (Sushi contents){
This.contents = contents;
}

And whenever I run the testers on this it says that my constructor failed and that if a null object is passed into the constructor my class (RedPlate) should be made to initially be empty. 

Thanks. ",1,0
15,2014-10-4,2014,10,4,13,2i95bs,Comp. Sci. vs. Self-taught programming.,https://www.reddit.com/r/computerscience/comments/2i95bs/comp_sci_vs_selftaught_programming/,DataDragon1,1412398148,"If you are an employed 'computer scientist' tell us what your job entails, and if your degree was required. Or if you're a programmer who taught himself everything, tell us your perspective. ",3,2
16,2014-10-4,2014,10,4,19,2i9lyy,Is there a website I can use to compare programming languages side by side?,https://www.reddit.com/r/computerscience/comments/2i9lyy/is_there_a_website_i_can_use_to_compare/,[deleted],1412417658,"I am looking to learn a new language after having gotten to grips with Java now. The problem is, it is so difficult to come to a decision on what is worthwhile becuase of how different they all are.

Is there anywhere with good comparions for things like the pradigm, the usual purpose of the language, the age of the language, the emplyability etc...?",11,1
17,2014-10-4,2014,10,4,21,2i9t63,How important is the university you studied at? (UK),https://www.reddit.com/r/computerscience/comments/2i9t63/how_important_is_the_university_you_studied_at_uk/,[deleted],1412426472,"I'm 18 (UK) and have just started university studying BSc Computer Science, I went through clearing to end up at this university and I feel conflicted in my choice of coming here. I would like to ask how important is the university you studied at to employers?",4,3
18,2014-10-4,2014,10,4,23,2ia1eq,"A Computer Virus and its Precautions, also download free Antivirus",https://www.reddit.com/r/computerscience/comments/2ia1eq/a_computer_virus_and_its_precautions_also/,vitalsoft,1412433976,,0,0
19,2014-10-5,2014,10,5,7,2ib8gp,Advice on Computer Science Master's Scholarships in US,https://www.reddit.com/r/computerscience/comments/2ib8gp/advice_on_computer_science_masters_scholarships/,[deleted],1412461855,I am a dual citizen. I have both American and Irish citizenship. I'm going to graduate with a Bachelor's degree in Computer Science from Sweden. I have nothing but straight A's. Anyone have any idea if I have a shot getting a scholarship or something anywhere in the states?,0,2
20,2014-10-5,2014,10,5,16,2icb10,How to create and submit xml sitemap to Google Webmaster Tools Video Tutorial In Urdu &amp; Hindi,https://www.reddit.com/r/computerscience/comments/2icb10/how_to_create_and_submit_xml_sitemap_to_google/,vitalsoft,1412492669,,1,0
21,2014-10-5,2014,10,5,22,2icrbc,Scheduling Algorithms help? (simple),https://www.reddit.com/r/computerscience/comments/2icrbc/scheduling_algorithms_help_simple/,M-Weezy,1412514112,"My homework is to fill in a table of scheduling algorithm completion and waiting times. 

Here is the homework question: http://imgur.com/lUz19Sr

The skinnier numbers in the table are the values that I filled in. I understand how the scheduling algorithms work, but for some reason my average wait times are not checking out with the average wait times that are provided. Is it possible that the average wait times are a typo, or can someone help me find an error in the way I am doing this question?",1,0
22,2014-10-6,2014,10,6,23,2ig9nl,What exactly is a Product Owner and is it different than Product Manager?,https://www.reddit.com/r/computerscience/comments/2ig9nl/what_exactly_is_a_product_owner_and_is_it/,zvitez,1412607028,Every one I ask has a different opinion. If anyone here has any experience with these roles please do share your thoughts.,2,2
23,2014-10-7,2014,10,7,0,2igayl,"Help me find an alternative to the word ""techie""",https://www.reddit.com/r/computerscience/comments/2igayl/help_me_find_an_alternative_to_the_word_techie/,zvitez,1412607742,"I'm working with digital designers, marketers, developers and data scienists. It seems some people have a negative association with the word techie, which is what I use to designate the group. Based on how the word originated (and as a programmer myself) I see nothing wrong with it, but it would be nice to find something that doesn't offend anyone. 
Any suggestions?",6,1
24,2014-10-7,2014,10,7,4,2ih5k4,Would you hire someone that,https://www.reddit.com/r/computerscience/comments/2ih5k4/would_you_hire_someone_that/,ddanny1992,1412623122,"Took his own courses online in his own home with certificates and many of them,  or someone  that went to a technical school/university. and why?",13,0
25,2014-10-7,2014,10,7,6,2ihpnq,Help with the major,https://www.reddit.com/r/computerscience/comments/2ihpnq/help_with_the_major/,shadewake,1412632314,"I was originally planning on becomeing a nurse because it felt like the safer path, living in a small neighborhood and stuff the medical feild was interesting to me but today I hit a wall at an externship thinking about the medical field and working there, realizing this i started to freak out, all my life I have been decent at everything I did although math was never my strong point. I know this major has alot of it from what I hear. well I guess i am just in a rut and looking for some advice for someone interested in the major.",2,0
26,2014-10-7,2014,10,7,16,2ijbtr,Am taking CS and have realized I only like creating websites. What is your advice?,https://www.reddit.com/r/computerscience/comments/2ijbtr/am_taking_cs_and_have_realized_i_only_like/,parakeetsquakin,1412665682,"Should I just drop it and take a web design course at an tech institute? I was really determined at first but a lot of the stuff I'm learning doesn't suit me, just the web design and graphics. sigh",8,7
27,2014-10-7,2014,10,7,23,2ik7wa,Help with CS project,https://www.reddit.com/r/computerscience/comments/2ik7wa/help_with_cs_project/,xtrylanx,1412691503,"Hey there,
 I thereby ask for the help of the gods of Reddit. I have a project for a computer science subject writing a small text about any topic related to IT, Computer Science but I got no idea  what to write about. So I ask you for any kind of ideas ( cant be about AI unfortunately).
   Thanks in advance!",6,0
28,2014-10-8,2014,10,8,21,2injg9,How to get Facebook Training Video Tutorial in Urdu &amp; Hindi,https://www.reddit.com/r/computerscience/comments/2injg9/how_to_get_facebook_training_video_tutorial_in/,vitalsoft,1412770539,,2,0
29,2014-10-8,2014,10,8,22,2inqhk,"As a CS Minor in college, who realized that he wants to do this instead..",https://www.reddit.com/r/computerscience/comments/2inqhk/as_a_cs_minor_in_college_who_realized_that_he/,GermanApe,1412775588,"I am a senior in college who got into computer science pretty late. Not late enough that I couldn't still minor in it, but I realized I like this a lot better than my major. I want to get into this industry seeing the way it's going. Do you guys recommend I start with my CompTIA A+ certification? Or any other tips? 

Thank you.",4,4
30,2014-10-8,2014,10,8,23,2insv5,Freshman computer science major needs help,https://www.reddit.com/r/computerscience/comments/2insv5/freshman_computer_science_major_needs_help/,purplemiIk,1412777065,"OKay I am a freshman computer science major and i honestly don't know almost anything about coding or random things that i'm sure most of you know. like how to use code, little facts and hacks, interesting things you can make your computer do, etc.

I know very very basic things like using # to make a comment or print( ""whatever"" ) or myName = Katy

But I don't know what most of the other cs majors do. So please share literally ANYTHING on the subject. A N Y T H I N G!! Thank you!",8,3
31,2014-10-9,2014,10,9,7,2ipawq,Any computer scientists in North East England looking to get involved in a new startup?,https://www.reddit.com/r/computerscience/comments/2ipawq/any_computer_scientists_in_north_east_england/,Aspie_,1412805649,"I'm part of a new tech startup in North-East England. We're planning to sell Raspberry Pis to schools as a replacement for standard desktop PCs, with setup &amp; aftersale support and a more intuitive OS designed primarily for education.

I don't want to say too much in a public post but I will say that we've already received a grant for the development of a brand, website and a Kickstarter campaign. We'll be starting a Kickstarter fairly soon to fund development and manufacturing.

We have most of the idea sorted. The only thing we're missing is the operating system: while we both have experience with computer science and a bit of programming, software development is beyond us right now. We don't intend to create an OS from scratch, but we'll be modifying an existing GUI and distributing it with a selection of software already included, as well as a few small pieces of our own software.

I can't say for sure if we'll take another person on the team, but it's definitely something we've considered. If there's any entrepreneurs out there with a software engineering background who know a bit about operating systems and application development, and you'd like to discuss the idea, send me a PM. I can give you my Skype/email/Facebook or whatever if you like.",0,3
32,2014-10-9,2014,10,9,9,2iprp9,Recent grad  Are most CS jobs like this?,https://www.reddit.com/r/computerscience/comments/2iprp9/recent_grad_are_most_cs_jobs_like_this/,MB_Zeppin,1412815407,"I recently graduated from college last May with dual degrees in History and Computer Science and was hired by a large pharmaceutical firm, ostensibly as a software developer. I started working back in mid-July and haven't been terribly thrilled with the experience. I miss the sense of community, cooperation, and curiosity that came of constantly working in a CS lab pursuing common interests but I'm also routinely disinterested with my work and have trouble maintaining the discipline to complete my responsibilities. Thus far, very little of my time has been spent working with computer science related concepts and I have written perhaps a dozen lines of code.

Instead I largely use software that requires a CS background to understand and operate but which is not itself terribly interesting. For instance, we're doing some data processing work that's being done in Hadoop. In order to use Hadoop I have to be familiar with Python, Java, MapReduce, some SQL, etc. but the actual work that I do is attempting to get a scripting language to work, getting Hadoop to recognize all of our remote drives, pasting some code from an outside contractor in, and that sort of thing. All fairly menial tasks that simply require a large amount of background knowledge and persistence to do. When I go into work tomorrow I'll be loading some XML data into a Fedora repository for use as a back-end. After that I might help some interns wireframe a UI for a web front end. Based on conversations with my manager, this is what I can expect in future.

Speaking to my friends who have recently graduated and been hired by financial firms and similar, this seems to be a common experience for them as well, although one of them has done a little bit of development in COBOL.

I originally went to school to become a history teacher but after taking an introductory computer science course I enjoyed the discipline so much that I dropped my education major to pursue it. I remained strongly passionate about computer science throughout the 4 years, took extra classes, did research projects over the summer, and developed some software for local non-profits. After only a few months of working in the field my interest in remaining within the field is waning.

Is the experience of myself and my peers representative of typical positions within the Computer Science industry? If so, how do you guys keep yourselves productive, motivated, and interested?",4,3
33,2014-10-9,2014,10,9,9,2ipta7,Customize Windows 10 Start Menu,https://www.reddit.com/r/computerscience/comments/2ipta7/customize_windows_10_start_menu/,fisniku04,1412816357,,0,1
34,2014-10-9,2014,10,9,17,2iqs8f,CCNP Route: OSPF Virtual Links,https://www.reddit.com/r/computerscience/comments/2iqs8f/ccnp_route_ospf_virtual_links/,abingabanger,1412844332,,0,1
35,2014-10-10,2014,10,10,2,2irwyl,NAS through the cloud?,https://www.reddit.com/r/computerscience/comments/2irwyl/nas_through_the_cloud/,meatybacon,1412875029,"Hi, wasn't sure where to post this, hopefully this is the right place. So this weekend I'm helping a friend set up a NAS.  I thought it was just going to be at his office. However, upon talking to him a bit more, he wants the NAS physically at his house, but backing up information from his office. I normally use Dlink NAS.  Will this work?  My idea was to backup the information to google drive, then download the google drive app on his home computer then set the NAS to backup the google drive folder on his home pc.  Anyone ever do this? Anything I need to look out for? Thanks!",0,1
36,2014-10-10,2014,10,10,6,2ispn6,"Typical Comp Sci freshman story? Not cut out for this, or bad start?",https://www.reddit.com/r/computerscience/comments/2ispn6/typical_comp_sci_freshman_story_not_cut_out_for/,IrkLurkJerkSmirk,1412890274,"Sorry for the novel.

A little background info, I'm a high school drop out that in the last year taught myself math concepts form pre algebra through trigonometry with tutoring dvds. I realized I like math and school. I really dont know why I hated school so much in the past.

Im in my late twenties, and decided I wanted to major in computer science even though I have no experience programming. I've always loved structuring solutions to problems, and finding creative ways to use the tools i have to solve those problems. 

Anyways, Im in my second semester of community college, all A's and doing fine with every subject, in the honors program, and now I hit this Intro to Java class. I was fucking destroyed. Ill admit I got a late start on the class, but holy shit there was a lot of work. The first week we had to write 4 algorithms, and prior to this class I had no idea what an algorithm formally was or how to write one. Every week thereafter we had to write psuedocode and 3 programs that took about 3-8 hours each, 50 or so pages of reading, and 40-60 homework problems in ""my programming lab."" Not to mention he graded work like we were supposed to be experts. I started falling behind in other classes because I was spending twice as much time on this class and my other classes. When I spent enough time to catch up on my other classes, i fell behind in java. I never caught up with my java class again.

I researched the teacher on ""ratemyprofessors.com"" he has a bad review, but any other comp sci teacher i look at has a bad review. The reviews all say ""class moves too fast, dont tkae this class, teacher is too hard!"" etc.. So i got the idea that comp sci is just a difficult subject for most. I also read articles about how some people are meant to code, and some arent. This casts even more doubts.

I worry either that I am not cut out for this, even though I do OK, the class pace is just too fast for me even at a community college level. On top of that, I don't have a great sense for applying math yet, as in the past year ive learned all the mechanics of math concepts from high school. The application of math concepts seems entirely crucial in structuring problems in algorithms. This is slowly developing, but it doesn't feel like I will be ready to perform to expectations of these classes anytime soon.

I only got about 50% of the work done, and had a D with a lot of work invested already. All I could think was that I was going to fail. So, I dropped the course to avoid it from affecting my GPA. So I don't know if I should change majors, or take the java class again, only this time with 12 credit hours instead of 15.

**tl;dr** I had to drop my java class because I couldnt perform at the level my comp sci teacher expected. Fell behind in other classes, then fell behind in intro to java class. Dropped intro to java to fix other classes and avoid it from affecting my GPA. Are all teachers hard, and are there truly people not cut out for this major?",3,0
37,2014-10-10,2014,10,10,7,2isutb,What is something that a Computer Scientist can do that a Computer Engineer can't?,https://www.reddit.com/r/computerscience/comments/2isutb/what_is_something_that_a_computer_scientist_can/,[deleted],1412893237,"Or the other way around. I've asked around a lot, what's the difference between the two, and no one gives me a concise answer, so I've decided to change the question to something more objective. Any help is appreciated.",3,1
