,date,year,month,day,hour,id,title,full_link,author,created,selftext,num_comments,score
86,2014-10-22,2014,10,22,1,2jwhxr,How would someone else see what tabs you had open on the current browser ?,https://www.reddit.com/r/computerscience/comments/2jwhxr/how_would_someone_else_see_what_tabs_you_had_open/,NeutralReader,1413909968,"Inspired by this comment: https://www.reddit.com/r/AskReddit/comments/2jtxqb/what_glitch_in_the_system_are_you_exploiting/clf9bk2

Also, is there a way to prevent this from happening ?",1,0
87,2014-10-22,2014,10,22,2,2jwn91,[C] Need help writing a basic program which prints a square dependent on user input.,https://www.reddit.com/r/computerscience/comments/2jwn91/c_need_help_writing_a_basic_program_which_prints/,[deleted],1413912664,"I started learning C today at uni and I'm stumped on a question. If somebody could give me some advice and maybe tell me the function used to make this possible it would be appreciated. 

Our third and nal problem for today is to print out a square using text characters. Your program should take a side length (see the slide on scanf and variables) and print out an appropriately sized square. A side length of 3 and 5 would output...

http://gyazo.com/29dbe2bcf0704f892f94f253d9c732b7

The problem is in two parts:
(a) draw a square of a size entered by the user; and
(b) validate the user input (i.e. only allow the to enter a side length in the range 1 to 10, larger or smaller numbers should be rejected).",5,0
88,2014-10-22,2014,10,22,5,2jx6he,Is Computer Science a good major?,https://www.reddit.com/r/computerscience/comments/2jx6he/is_computer_science_a_good_major/,Jerry_Handspringer,1413922136,"I'm a Sophmore in high school and I'm pretty interested in computer science. My school doesn't provide a very extensive computer program, so i don't know how much prior knowledge I'll have when I graduate. Thanks in advance for any advice given.",13,3
89,2014-10-22,2014,10,22,10,2jy6sg,Acer Extensa 4630Z Wireless drivers for XP &amp; Vista,https://www.reddit.com/r/computerscience/comments/2jy6sg/acer_extensa_4630z_wireless_drivers_for_xp_vista/,alldriver39,1413941105,,0,1
90,2014-10-22,2014,10,22,10,2jy9k6,How to Recover Files from Unallocated External Hard Drive,https://www.reddit.com/r/computerscience/comments/2jy9k6/how_to_recover_files_from_unallocated_external/,BlakeClaire,1413942641,,0,1
91,2014-10-23,2014,10,23,3,2k0ktk,"If I want to get a career involving computers but not a programmer, is it worth it to get a bachelors degree?",https://www.reddit.com/r/computerscience/comments/2k0ktk/if_i_want_to_get_a_career_involving_computers_but/,TheDopplerIsDown,1414002022,I'd like to be a network administrator perhaps or something like that. Software development isn't really for me. Right now I am in college to get a certification to be a computer repair technician and a year after that I'll be receiving an associates degree in computer network engineering. Is it worth it to pursue beyond that?,4,0
92,2014-10-23,2014,10,23,3,2k0nni,Laker haray ki imandari,https://www.reddit.com/r/computerscience/comments/2k0nni/laker_haray_ki_imandari/,vitalsoft,1414003437,,0,0
93,2014-10-23,2014,10,23,5,2k0zk5,DNA Cryptography Alternate,https://www.reddit.com/r/computerscience/comments/2k0zk5/dna_cryptography_alternate/,kennbmondo,1414009364,,1,0
94,2014-10-24,2014,10,24,2,2k4283,Python Help?,https://www.reddit.com/r/computerscience/comments/2k4283/python_help/,[deleted],1414084820,"Would someone be willing to send me a calculator written in Python that you have created, and that can't be found anywhere else on the internet? Please send it to bigjimmyn@gmail.com. Thank you sooo much!

I should mention that this is for my computer science class (Yes, teachers use reddit, too) and I need a solution that can not be found anywhere on the internet so that my students cannot cheat.",2,0
95,2014-10-24,2014,10,24,5,2k4pgc,Python For Beginners: Types and Variables,https://www.reddit.com/r/computerscience/comments/2k4pgc/python_for_beginners_types_and_variables/,TheSnipingFoundation,1414096659,,0,1
96,2014-10-25,2014,10,25,3,2k7vvt,How to Download YouTube Video with High Speed forever without installing IDM,https://www.reddit.com/r/computerscience/comments/2k7vvt/how_to_download_youtube_video_with_high_speed/,vitalsoft,1414175259,,0,0
97,2014-10-25,2014,10,25,5,2k872b,"Reddit, halp!",https://www.reddit.com/r/computerscience/comments/2k872b/reddit_halp/,redditshy,1414181120,"EDIT:  This is the situation.  My friend's gf works for a great great company.  I met the gf, and she said to send me her resume, which I promptly did.  Then she let me know that the hiring manager received my resume, and the instruction was to go online, and get all of my information into their system, by applying through one of the available jobs listed.  Because a job that would match my experience and qualifications was not listed, I just picked a job that was at least in a similar department.  I never heard back, and let it go, figuring I was not a match for their company or needs.

&amp;nbsp;

Five months go by, and I receive an email from someone in the company's recruiting department!  This is in reference to the particular job that I ""applied"" to.  When, in reality, in only ""applied to"" that particular role as a means of getting into their system, as per the instructions of the hiring manager.  With this email came an attached list of screening questions.  I covered the finance/accounting portion I think with no problem.  It is this Turing Machine that is catching me up.

&amp;nbsp;

SO!  Do I email the recruiter back, explaining why I applied to that particular job, and with the answers to the accounting/finance questions attached, and explaining that the Turing Machine is outside of my realm, and that if I am not a fit for this particular role, I am still highly interested in the company as a whole, and open to other roles?

&amp;nbsp;

The best case would be to figure out on my own how to do the Turing Machine, and return the email with it attached...having some trouble understanding how to do that, though...

&amp;nbsp;

I kind of want to get back to her today, before the weekend.  Thinking I will send a nice email, attach what I have, and explain why I applied to that particular job that is outside of my realm of education/experience.

&amp;nbsp;

&amp;nbsp;






""Design a Turing machine that reads a binary string, and validates if it is a palindrome.""

I am completing a screening for a job.  I studied finance, not computer science, but this problem is part of the screening process.  If, by some wonderful chance, I get into this company, I don't think it will be for this particular position, but I would like to make a good initial impression, for tracking down how to do this.

I'm asking for your help in understanding how to go about this.  I downloaded JFLAP, and have read the tutorial, as well as more information about what a Turing Machine is and does.  

Not sure where to start.",7,1
98,2014-10-25,2014,10,25,18,2k9wof,Binary Operation - 2s Complement Method,https://www.reddit.com/r/computerscience/comments/2k9wof/binary_operation_2s_complement_method/,Psycho_Coder,1414229618,,0,0
99,2014-10-25,2014,10,25,21,2ka3pr,How a computer error helped Deep Blue beat humanity's best chess player,https://www.reddit.com/r/computerscience/comments/2ka3pr/how_a_computer_error_helped_deep_blue_beat/,bigbroz,1414238656,,1,0
100,2014-10-26,2014,10,26,2,2karhk,Fibonacci Programming - Computerphile - YouTube,https://www.reddit.com/r/computerscience/comments/2karhk/fibonacci_programming_computerphile_youtube/,VivaLaPandaReddit,1414257088,,0,1
101,2014-10-26,2014,10,26,18,2kcxp2,Choosing my platform choice for development. Help?,https://www.reddit.com/r/computerscience/comments/2kcxp2/choosing_my_platform_choice_for_development_help/,malsharekh94,1414316792,"First of all, is this the right subreddit for asking for such help? If not, please tell me which is or how to find out myself.

I don't have a lot of choices, because the requirements for my case are restricting.

I don't have extensive knowledge in a lot of CS concepts or deep knowledge in almost anything. So when starting development for the given platform, I'm gonna study and self-learn it.

It has to be an active, growing, and rewarding platform. If it doesn't require things like complex database algorithmic techniques like social networking for the web, that would be highly preferred.

I'm a Computer Science student, but still a level 2. My purpose for this is to build a solid portfolio early on and get a head start for when I need it, and to get experience (same thing basically), and also cuz I'm bored as fuck in college, learning slowly is really boring.

Revenue and money is very vital for this. Don't get me wrong, it's not the reason for this, but it is what drives my future projects. Cuz I do need money in the short term (hopefully *short*) for personal reasons.

I'm thinking of Android development, cuz it uses Java and xml, I already know a bit of Java from college and KCPC (local contest before the regional ACPC - I'm from Kuwait), and xml is easy to learn relatively. So the learning curve for Android development isn't that crazy, it's doable. And the market for it is quite decent in comparison to others.

I'm also considering the web, but I need someone to help me with this decision. It's a one time decision and I'm gonna stick to it for a long time.

OH, and another reason for this, is to make me available to professionally freelance much earlier. Which hopefully it turn brings me a much more solid portfolio and more money both much sooner than otherwise.

**EDIT:** My college courses that I took: Programming 1&amp;2 (JAVA), and Discrete Mathematics. And this course I'm taking Computer Systems (again, failed last semester), Data Structures &amp; Algorithms, and Programming in C &amp; UNIX.",12,0
102,2014-10-27,2014,10,27,2,2kdsnm,Your Computer has been locked virus deletion,https://www.reddit.com/r/computerscience/comments/2kdsnm/your_computer_has_been_locked_virus_deletion/,gisrteam,1414344122,,1,0
103,2014-10-27,2014,10,27,2,2kdst4,Question about internships,https://www.reddit.com/r/computerscience/comments/2kdst4/question_about_internships/,sempaiplznoticeme,1414344217,"If you don't have all the necessary skills for a internship, should you still apply? For a lot of internships, I don't have all the listed skills, usually just some subset of them.",3,2
104,2014-10-27,2014,10,27,2,2kdtb6,Python For Beginners: Functions,https://www.reddit.com/r/computerscience/comments/2kdtb6/python_for_beginners_functions/,TheSnipingFoundation,1414344547,,0,1
105,2014-10-27,2014,10,27,6,2kek6q,Collision detection in C#.Net example,https://www.reddit.com/r/computerscience/comments/2kek6q/collision_detection_in_cnet_example/,karimo94,1414359497,,0,1
106,2014-10-27,2014,10,27,7,2keo95,I am looking for someone with unique skills.,https://www.reddit.com/r/computerscience/comments/2keo95/i_am_looking_for_someone_with_unique_skills/,IcedAndPicked,1414361780,,1,0
107,2014-10-27,2014,10,27,15,2kfw6m,MACHINE LEARNING - automated personal psychiatrist,https://www.reddit.com/r/computerscience/comments/2kfw6m/machine_learning_automated_personal_psychiatrist/,monkeymanic,1414389794,,2,1
108,2014-10-28,2014,10,28,0,2kgza5,Useful links collection....,https://www.reddit.com/r/computerscience/comments/2kgza5/useful_links_collection/,nasir22,1414424096,,0,1
109,2014-10-28,2014,10,28,3,2khkux,"Thanks to the link provided by u/boggleogle, I accomplished my Turing Machine!! Thanks buddy!!!",https://www.reddit.com/r/computerscience/comments/2khkux/thanks_to_the_link_provided_by_uboggleogle_i/,[deleted],1414435346,,0,1
110,2014-10-28,2014,10,28,4,2khohb,"thanks to /u/boggleogle, i accomplished my Turing Machine!! Thanks buddy!",https://www.reddit.com/r/computerscience/comments/2khohb/thanks_to_uboggleogle_i_accomplished_my_turing/,redditshy,1414437205,"When submitting my .jpg of the Turing Machine diagram to the recruiter, do you think I should reference my source for the table?  I am thinking I should.  The question only asked that I submit either a table or a diagram.  It did not mention letting them know how I got there.  I built my own diagram, based on the table that /u/boggleogle linked me.",0,2
111,2014-10-28,2014,10,28,6,2ki1yk,High school senior looking to interview a Computer Science major for a class project.,https://www.reddit.com/r/computerscience/comments/2ki1yk/high_school_senior_looking_to_interview_a/,gajokai,1414443905,"I'm doing a research project on a career field I'm interested in doing. As you can tell, I chose Computer Science. If any of you have gotten your degree and have a career in the field, I would like to ask you some questions to complete my project. It would be great if you PM'd me , the questions aren't hard and you'll be doing me a huge favor :)",2,3
112,2014-10-28,2014,10,28,7,2ki9ph,Python For Beginners: Lists and Dictionaries,https://www.reddit.com/r/computerscience/comments/2ki9ph/python_for_beginners_lists_and_dictionaries/,TheSnipingFoundation,1414447742,,0,1
113,2014-10-28,2014,10,28,10,2kix1k,Amazing Free File Recovery Software for Windows 7,https://www.reddit.com/r/computerscience/comments/2kix1k/amazing_free_file_recovery_software_for_windows_7/,BlakeClaire,1414459827,,0,1
114,2014-10-28,2014,10,28,18,2kjwwc,Donald Knuth Ebooks 50% Off,https://www.reddit.com/r/computerscience/comments/2kjwwc/donald_knuth_ebooks_50_off/,blergmone,1414487421,"Use this coupon code: **KNUTHEBOOKS50**

[Volume 1](http://www.informit.com/store/art-of-computer-programming-volume-1-fundamental-algorithms-9780133489330?link=image&amp;WT.mc_id=2014_10_28_IT_PBM_KnuthEBooks)

[Volume 2](http://www.informit.com/store/art-of-computer-programming-volume-2-seminumerical-9780133488807?link=image&amp;WT.mc_id=2014_10_28_IT_PBM_KnuthEBooks)

[Volume 3](http://www.informit.com/store/art-of-computer-programming-volume-3-sorting-and-searching-9780133488845?link=image&amp;WT.mc_id=2014_10_28_IT_PBM_KnuthEBooks)

[Volume 4a](http://www.informit.com/store/art-of-computer-programming-volume-4a-combinatorial-9780133488883?link=image&amp;WT.mc_id=2014_10_28_IT_PBM_KnuthEBooks)",5,2
115,2014-10-28,2014,10,28,22,2kkfqc,What should I read to solve this graph problem?,https://www.reddit.com/r/computerscience/comments/2kkfqc/what_should_i_read_to_solve_this_graph_problem/,ElvishJerricco,1414503763,"In a three dimensional grid, each space represents either a connector or an end point. The connectors can all connect together to form a big graph, whose purpose is to share data among the entire network and to list the end points that touch the network. It needs to be capable of adding and removing connectors and end points. This can be tricky because multiple networks can become merged, or one network can become split.

What's the most efficient way to handle something like this? I don't know much about graph theory or how it applies here to any guidance on the problem would be greatly appreciated.",0,0
116,2014-10-29,2014,10,29,10,2kmsvc,Laptop for upcoming Computer Science major?,https://www.reddit.com/r/computerscience/comments/2kmsvc/laptop_for_upcoming_computer_science_major/,Battlepine,1414546985,"I have a budget of $600.00... What would be a ""good"" laptop for me?",8,1
117,2014-10-29,2014,10,29,12,2kn2yc,How difficult is it to get a computer science degree?,https://www.reddit.com/r/computerscience/comments/2kn2yc/how_difficult_is_it_to_get_a_computer_science/,[deleted],1414552679,"These past few years, I've settled with the idea to get a bachelors degree on criminal justice. But as of lately, I've seriously began to think about getting a degree in Computer Science instead. As of right now I'm in community college about to earn an AA in liberal arts (because its suggested for athletes since its the easiest and quickest way to get an AA and transfer). Apart from school, football takes up most of my time. Right now I have a couple of division 1 and 2 football scholarship lined up for next semester. But I'm really not certain with what degree I want to pursue.

In high school, I truly enjoyed my computer academy class. Even up to now, majority of the job opportunities seem to be in CS. Towards the beggining of my senior year, I started leaning more towards criminal justice because it seemed like it required easier classes and also offered about the same amount of jobs after college. I figured that with football taking up 75 percent of my time in college, I really won't be able to handle CS. But after reading all the post on reddit about how useful and valuable a CS degree is, I'm really starting to think about pursuing it, rather than criminal justice.

Since I'm going to be in college completely tuition free, I might as well do something I'm going to enjoy right? The thing I'm most worried about is that most of my knowledge from my computer academy class in high school are completely forgotten. So I'm basically clueless about anything related to computer science. So my question for someone who has their CS degree or someone working on it:

What type of classes were/are you required to take?

How difficult was the classes?

How time consuming was the work outside of class?

*Do you need to have tremendous prior knowledge about the classes?

How are you utilizing your degree after college?

What are the more specific fields of computer science (programming... etc) ?

Are there other alternatives or similar degree I can pursue on that field?",5,0
118,2014-10-29,2014,10,29,13,2kn7di,Anyone know any good computer science/software engineering books?,https://www.reddit.com/r/computerscience/comments/2kn7di/anyone_know_any_good_computer_sciencesoftware/,iEatAsss,1414555473,"I want some good computer science/software engineering books to read that are not necessarily textbooks but will provide insight into how to be a better software engineer. No real specific topic, just in general. Any ideas?
",1,0
119,2014-10-29,2014,10,29,18,2knsop,An article about gaining access to the system where all else fails: meet Apache vulnerability.,https://www.reddit.com/r/computerscience/comments/2knsop/an_article_about_gaining_access_to_the_system/,[deleted],1414575284,,0,1
120,2014-10-29,2014,10,29,21,2ko5ga,Internship Stipend 55000 bucks! And lots of amazing experiences! Barclays Global Technology Center,https://www.reddit.com/r/computerscience/comments/2ko5ga/internship_stipend_55000_bucks_and_lots_of/,intern_feel,1414587181,,1,1
121,2014-10-29,2014,10,29,22,2ko6gr,"Interview questions and coding tests on data structures, algorithms, etc. Good or bad?",https://www.reddit.com/r/computerscience/comments/2ko6gr/interview_questions_and_coding_tests_on_data/,[deleted],1414587911,"I have been employed for seven years at the same company since graduating college, and was recently approached by a head hunter.  I was initially interested, but then they wanted me to take a coding test with sorting, trees, the usual stuff.  However, I haven't used any of that even once in seven years.  I still remember the general concepts, but I would have to re-memorize all the details.  I responded with essentially, I currently have to adapt and learn new technologies all the time at my job, and have no desire/time/need to re-memorize for a ""book smart"" test.  I feel like a better approach is just to use a reference if I ever do need it.  Good or bad approach?  Am I missing some value in retaining all that CS 201 knowledge, other than for interviews of this type?  ",2,3
122,2014-10-29,2014,10,29,23,2kode9,Help with college app essay,https://www.reddit.com/r/computerscience/comments/2kode9/help_with_college_app_essay/,[deleted],1414592414,"So I'm applying for a private university and the prompt is

""To promote learning in the Jesuit Catholic tradition so that students acquire the knowledge, skills, values and sensitivities they need to succeed as persons, professionals and architects of a more humane and just world""

All I can think of so far is relating this prompt back to my major which is, you guessed it, computer science. The only idea I've had since starting my application is talking about how programming can ensure a safer future with [better] encryption of delicate information. I came up with this idea based off Apple's recent move on officially taking a stance  against decrypting personal information for intelligence agencies. ( I'm not sure which agency if there was a specific one) I'm not extremely religious so I'm trying to bank on the second half of the prompt.

What else should I look into? 
What can I do, as a programmer,  to benefit the welfare of the many? 
I'm open to criticism on my idea as well. 
Any help is appreciated. 


Edit: I'm in junior college applying for university",0,1
123,2014-10-30,2014,10,30,0,2kolzd,"I'm a middle school teacher, teaching our district's first ever computer programming class. I am looking for suggestions for projects or content using JavaScript, websites, or other ideas for a first year coding class.",https://www.reddit.com/r/computerscience/comments/2kolzd/im_a_middle_school_teacher_teaching_our_districts/,MrDATAVentura,1414597074,"I am also brand new to coding and am learning one step ahead of the students.  I have been using code.org, codecademy, and Khan Academy so far with my students. I'm looking for suggestions of projects or other sites that would be appropriate for middle school students beginning to write code. I also have a class set of Raspberry Pi's but am not quite sure how to implement them with beginning programmers. Any suggestions would be great. Thanks!",4,2
124,2014-10-30,2014,10,30,7,2kq49b,Help need for CS masters?,https://www.reddit.com/r/computerscience/comments/2kq49b/help_need_for_cs_masters/,computer8802,1414623047,"I have minimal experience with CS studies and programming. But, I finished masters (and unemployed) in Economics. I have pretty good background in Mathematics. I have two choices: either pursue phd in Economics (but dont want to) or seek masters in CS. Is it possible to enroll into masters with my background? I am targeting masters bc of availability of funding so I can sustain. Please suggest. 

I am ready work my ass off for couple of months so that I can do well in CS.",10,2
125,2014-10-31,2014,10,31,1,2ksocm,IEPY - An open source tool for Information Extraction in Python,https://www.reddit.com/r/computerscience/comments/2ksocm/iepy_an_open_source_tool_for_information/,copybin,1414687889,,0,2
126,2014-10-31,2014,10,31,8,2ktypo,"Almost graduating, is it worth delaying my graduation over an internship?",https://www.reddit.com/r/computerscience/comments/2ktypo/almost_graduating_is_it_worth_delaying_my/,thehappyyeti,1414711546,"Hey guys, I am currently pursuing my last year in BSc Comp. Sci. While I am pretty confident with my development skills, I still worry that people who have done an internship have the upper edge. Unfortunately, a lot of internship job postings require that I return to school to finish off my degree right after the internship. That being said, I have a couple of questions for you folks:

1. Is it worth delaying my graduation for an internship?
2. Has anyone done a new grad internship? If so, how was it? Any tips on interning as a new grad?
3. For people who didn't do an internship, how was it like finding a job?
4. Any tips on how to create a resume for an internship?

Looking forward to hearing back from you guys!
Thanks :D",2,2
127,2014-10-31,2014,10,31,9,2ku6qw,Near to the Metal - Computerphile - YouTube,https://www.reddit.com/r/computerscience/comments/2ku6qw/near_to_the_metal_computerphile_youtube/,VivaLaPandaReddit,1414716044,,0,2
