,date,year,month,day,hour,id,title,full_link,author,created,selftext,num_comments,score
38,2014-10-10,2014,10,10,8,2it4a0,What's a good computer for a computer science student?,https://www.reddit.com/r/computerscience/comments/2it4a0/whats_a_good_computer_for_a_computer_science/,Winrar_exe,1412898796,"On a college budget? Oh yeah and I would like a notebook. I work for the IT department at my university, and I see that my co-workers who are majoring in Comp Sci prefer Macs. ",8,0
39,2014-10-10,2014,10,10,8,2it4d1,can someone help me please,https://www.reddit.com/r/computerscience/comments/2it4d1/can_someone_help_me_please/,[deleted],1412898846,"PROCESSING IS WHAT IM USING.
Write a program that displays a circle.  Make it so the user can click and drag the circle to move it around the screen.  The circle should never move unless the mouse is being pressed, and the circle should always fully remain in the window .
**i drew the circle and i can drag it using the mouse but i can't seem to make it remain in the window using ""if statements""",0,0
40,2014-10-10,2014,10,10,9,2it9bq,Booth's Algorithm: Please help me.,https://www.reddit.com/r/computerscience/comments/2it9bq/booths_algorithm_please_help_me/,Sam095,1412901874,"I understand the very basic part of it. Like I understand it's how computer multiply numbers, and that it's supposed to be quicker than just multiplying binaries, but that is basically it. I have no idea how to set it up, or do any of it. I am completely lost and very discouraged. Can someone please help me figure this out and explain it.

Thanks so much.",0,1
41,2014-10-10,2014,10,10,10,2itd9z,What is an average day of work for someone in Computer Science?,https://www.reddit.com/r/computerscience/comments/2itd9z/what_is_an_average_day_of_work_for_someone_in/,pkhong,1412904223,"As someone who has never taken any computer science classes, knows nothing related to computer science except basic computer knowledge. What is the average day for you? Do you just sit from 9-5 and code all day long? What do you actually do all day?",3,0
42,2014-10-10,2014,10,10,13,2itst6,Not sure about computer science?,https://www.reddit.com/r/computerscience/comments/2itst6/not_sure_about_computer_science/,C17H21NO4_head,1412914384,"I really am interesting in computer science; but it seems that I like the logic behind the coding rather than the actual coding/programming. I understand the general logic/theory about computer science but I suck at actual programming. I'm attempting to learn Java on my own and I struggled to even get around using the compiler let alone type a simple hello world function.
 I'm wondering if this is a sign that I wouldn't be a good csc major, or I just need more practice with coding?
",2,1
43,2014-10-10,2014,10,10,14,2itwfy,Intel Underestimates Error Bounds by 1.3 quintillion,https://www.reddit.com/r/computerscience/comments/2itwfy/intel_underestimates_error_bounds_by_13/,Scientologist2a,1412917258,,0,6
44,2014-10-10,2014,10,10,15,2iu3ai,Computer Science major clubs?,https://www.reddit.com/r/computerscience/comments/2iu3ai/computer_science_major_clubs/,cuppaorangejuice,1412923438,"Hey reddit, I'm a sophomore attending Cal State Fullerton currently and I am looking for clubs to join that would be beneficiary towards my major. Are there any clubs out there that would allow me to maybe gather some experience, or network with other computer science majors?",1,1
45,2014-10-10,2014,10,10,20,2iuhq8,Kernel 101 - Let's Write a Kernel,https://www.reddit.com/r/computerscience/comments/2iuhq8/kernel_101_lets_write_a_kernel/,[deleted],1412939849,,0,2
46,2014-10-10,2014,10,10,23,2iuy7u,CCNP Route: OSPF Virtual Link Authentication,https://www.reddit.com/r/computerscience/comments/2iuy7u/ccnp_route_ospf_virtual_link_authentication/,abingabanger,1412952415,,0,1
47,2014-10-11,2014,10,11,0,2iv0zu,Singleton Pattern Example in Java | Fundamental of Programming for Begineers,https://www.reddit.com/r/computerscience/comments/2iv0zu/singleton_pattern_example_in_java_fundamental_of/,asdnihj88,1412954024,,0,1
48,2014-10-11,2014,10,11,2,2ivivs,Introduction to WordPress video tutorials in Urdu / Hindi Part-1,https://www.reddit.com/r/computerscience/comments/2ivivs/introduction_to_wordpress_video_tutorials_in_urdu/,vitalsoft,1412963853,,1,0
49,2014-10-12,2014,10,12,6,2iz3x8,"Where can I find public enterprise architecture? (x-post, /r/informationaltechnology)",https://www.reddit.com/r/computerscience/comments/2iz3x8/where_can_i_find_public_enterprise_architecture/,[deleted],1413061589,"Hello,

I know this is bit of an odd question but I have run of ideas as to where to look.

I am wondering if there is anywhere I can find any company or institution's system architecture that uses standard practices (i.e. software, procedures, hardware). Any help would be appreciated. 
I know twitter and Facebook EAP was available for a while, but I can't seem to find that now.
Thank you.
",0,0
50,2014-10-12,2014,10,12,7,2izam9,Mac Book Pro for Development(Security) and programming - will it be versatile? Prudent? Powerful? Effective? (Not Holy War - I love all OS' equally so far. And Hate other aspects),https://www.reddit.com/r/computerscience/comments/2izam9/mac_book_pro_for_developmentsecurity_and/,[deleted],1413065844,"As I said above I am looking to purchase a Mac. I utilize PC and Mac throughout my day - desktops, all in one, Mac Pros, and varying mobile technology. I also utilize Windows (All) and Android (All). I am currently working full time as well as a Full Time student. I love programming, databases and anything to do with information systems security (or breaking them). 
I personally love the Linux feel of a Mac prompt and folder structure. I enjoy the system. I love windows equally but as far as mobility I feel that it is lack luster when compared to the Air or Pro(Trade off power for battery or otherwise). I also get a substantial discount for Apple products due to me affiliations. I enjoy the UI and integration.
I know each has it's own specific draw backs. But I am more concerned with the following:
1) Are there any languages (Programming) That the Mac cannot program in?
2) If any of you tried Mac - have you ever felt limited or handicapped because of the machine?
3) Any and all issues with utilizing such a machine as a programming/development/professional device?
4) Other recommendations?
Thanks!
 
",17,0
51,2014-10-13,2014,10,13,1,2j1c0x,Question about stack permutations,https://www.reddit.com/r/computerscience/comments/2j1c0x/question_about_stack_permutations/,[deleted],1413131699,,0,1
52,2014-10-13,2014,10,13,1,2j1dam,Question on stack permutations,https://www.reddit.com/r/computerscience/comments/2j1dam/question_on_stack_permutations/,rdcode,1413132497,,0,0
53,2014-10-13,2014,10,13,8,2j2fhm,Starting Python 2.7.8 in classes -- need some help!,https://www.reddit.com/r/computerscience/comments/2j2fhm/starting_python_278_in_classes_need_some_help/,anieke56,1413155865,"We have an assignment that involves taking a pseudocode and turning it into a program on Python 2.7.8. The pseudocode is:  

1. Ask the user to enter the amount. Set Amount to the users input. 
2. Set OriginalAmount to Amount
3. Set Quarters to the maximum number of quarters in Amount (for example, if Amount is 87, set Quarters to 3).
4. Set Amount to the change left after giving out that many quarters
5. Set Dimes to the maximum number of dimes in Amount
6. Set Amount to the change left after giving out that many dimes
7. Set Nickels to maximum number of nickels in Amount
8. Set Amount to the change left after giving out that many nickels
9. Set Pennies to Amount
10. Output OriginalAmount and the values of Quarters, Dimes, Nickels and Pennies.  

Simple for ya'll, I know. I don't want it to be solved, I would just love some direction. So far I have:

""youramt = int(raw_input(""Enter whole number of cents: ""))

But from there, I don't know where to go. I've been watching and reading up on programming with Python, but it all gets jumbled. ",5,1
54,2014-10-13,2014,10,13,8,2j2jdi,Degree Help,https://www.reddit.com/r/computerscience/comments/2j2jdi/degree_help/,xian123,1413158349,"I graduated from college a long time ago with an undergraduate degree in anthropology/classics. I went on to get my master's degree in applications of Geographic Information Systems (GIS) to archaeology. I am currently finishing up a post graduate certificate in GIS and am also enrolled in at the local community college for a certificate in Java Programming. For the past 15 years I have worked as a GIS analyst.

My question is, if I wanted to get into programming and apply for those jobs, can I do so with just a certificate in Java, or do I need to look into either a BS in computer science. Can I bypass the undergrad degree and get try for a master's? 

Has anybody had any experience with the online master's programs, like the one offered by Georgia State? [Link](https://www.cs.gsu.edu/?q=graduate_programs)",2,2
55,2014-10-13,2014,10,13,15,2j3f1v,Question on what to study,https://www.reddit.com/r/computerscience/comments/2j3f1v/question_on_what_to_study/,VesperStorm,1413180998,"Ok so I'm a software Engineering major hoping to transfer to UCI soon. Thats my intro lol. I've taken all levels of Java and 1 level of C++. right now im in data structures(taught in java), and assembly language(which is so fun :D). I've been hearing all over the place that java isnt really used heavily in the field, its more like UNIX, python, c++ and JavaScript. Should I focus on those languages instead of Java? cause java is my best language.",4,2
56,2014-10-13,2014,10,13,20,2j3vj4,login4ites in delhi,https://www.reddit.com/r/computerscience/comments/2j3vj4/login4ites_in_delhi/,radhadesigngo,1413199826,,0,1
57,2014-10-13,2014,10,13,23,2j46dj,Does each programming language need its own compiler?,https://www.reddit.com/r/computerscience/comments/2j46dj/does_each_programming_language_need_its_own/,Huntermnator,1413208919,Will I need to download a compiler for each new language I learn or will some compilers support multiple languages?,5,2
58,2014-10-14,2014,10,14,0,2j4ckp,Phone Interview,https://www.reddit.com/r/computerscience/comments/2j4ckp/phone_interview/,[deleted],1413212773,I have a preliminary 30-min phone interview coming up for an internship and have no idea what to expect. What kinds of questions should I be expecting? I have never had an interview before. I'm in college btw. ,1,0
59,2014-10-14,2014,10,14,5,2j5gmu,Double Jeopardy for not following 'Spec' given in Lab naming programs?,https://www.reddit.com/r/computerscience/comments/2j5gmu/double_jeopardy_for_not_following_spec_given_in/,trustmeiminnocent,1413233760,"Hey, /r/computerscience !

I'm currently a sophomore, switching in Computer Science I was a Physics major last year and decided to switch. I love Computer Science so far. So, my professor took off points for naming a program ""Lab_Part1"" instead of ""Part1"" as he outlined in the spec. That's fine and I understood my mistake, but the following lab that was already submitted he deducted points for the same mistake as well! I lost 3 points- one for each lab- as the previous labs before the first he took off points of he didn't deduct any points for the naming of the programs I did. Is it okay if I bring this up with him about the following lab of the first error that I didn't know I'd lose points for naming programs that way in lab and it was already submitted- I couldn't edit it? 

Thanks!",4,2
60,2014-10-14,2014,10,14,10,2j6bzi,"Bae - ""can I help you with homework?"" Me - ""not unless you know how to create doubly linked abstract stacks"" Bae-",https://www.reddit.com/r/computerscience/comments/2j6bzi/bae_can_i_help_you_with_homework_me_not_unless/,spigs5,1413251207,,2,0
61,2014-10-14,2014,10,14,11,2j6dzr,Take Steps to Restore Deleted Partition in Windows 8,https://www.reddit.com/r/computerscience/comments/2j6dzr/take_steps_to_restore_deleted_partition_in/,BlakeClaire,1413252329,,0,1
62,2014-10-14,2014,10,14,11,2j6in1,Looking for someone to interview,https://www.reddit.com/r/computerscience/comments/2j6in1/looking_for_someone_to_interview/,LaxBroGotFlow,1413255210,"Hello,

My name is Josh and I attend a university, and for my comp class we are doing a paper on the major we intend on going into. I am looking for someone in the field that can answer a few questions of mine and can sign a form saying it's okay for me to use your answers in my paper. It should be a fairly short interview and it would be nice to do the interview over email or some other sort of text based communication since I have a very busy schedule and don't want to rush an interview.

I really would appreciate help with this and think it would be really cool to talk to someone else interested in what I am interested in.

Thank you.",0,4
63,2014-10-14,2014,10,14,23,2j7wzy,What's new in OpenStack Juno,https://www.reddit.com/r/computerscience/comments/2j7wzy/whats_new_in_openstack_juno/,fjaraya,1413297729,,1,2
64,2014-10-15,2014,10,15,1,2j8b0n,Mondolithic Studios | MondoWorks Publishing  Artificial Life,https://www.reddit.com/r/computerscience/comments/2j8b0n/mondolithic_studios_mondoworks_publishing/,kennbmondo,1413305437,,1,2
65,2014-10-15,2014,10,15,3,2j8kxv,Technical Writing Major looking to pick up CS minor,https://www.reddit.com/r/computerscience/comments/2j8kxv/technical_writing_major_looking_to_pick_up_cs/,sick_girl95,1413310614,"I'm an English major with a concentration in Technical Writing. I don't want to be an administrative assistant forever, and I've always wanted to work more in the tech industry / industrial sector.  I'm terrible at math, so I'm curious what level of math I need to get up to to begin in a computing 1 class. 

Stanford University has begun offering a dual major English + CS, so obviously this isn't an impossible goal. 

Thanks for your help and info!",4,3
66,2014-10-15,2014,10,15,3,2j8mfv,CCNP Route: OSPF over Frame Relay,https://www.reddit.com/r/computerscience/comments/2j8mfv/ccnp_route_ospf_over_frame_relay/,abingabanger,1413311352,,0,1
67,2014-10-15,2014,10,15,22,2jbdqi,Book recommendations for learning about type systems?,https://www.reddit.com/r/computerscience/comments/2jbdqi/book_recommendations_for_learning_about_type/,[deleted],1413380026,"So I'm about to graduate with a computer science degree but it's been pretty software development oriented. I have a pretty solid grasp of programming and most of the non-academic stuff.

I wanted to start branching out into more theoretical topics and type systems seemed a good place to start. They never really clicked with me and figured that would be a good place to start.",1,1
68,2014-10-16,2014,10,16,2,2jc1xk,CCNP Route: Redistribute OSPF into EIGRP,https://www.reddit.com/r/computerscience/comments/2jc1xk/ccnp_route_redistribute_ospf_into_eigrp/,abingabanger,1413393653,,0,1
69,2014-10-16,2014,10,16,3,2jcde3,Mac pro ssd backup problem,https://www.reddit.com/r/computerscience/comments/2jcde3/mac_pro_ssd_backup_problem/,mickelo13,1413399471,"I've a very tricky problem and will reward anyone who can solve it for me.

My macbook pro retina got stuck on the 'osx' utilities screen and would only let me boot from the recovery drive. From this drive you can normally inspect the ssd and repair it if necessary but that option is greyed out (it's not detecting an ssd).

So I can't boot up osx to do anything. I don't have a time machine backup (i know, I know)

Now my question...is it possible to backup the built in ssd of my laptop, even tho I can't actually boot up osx?",0,0
70,2014-10-18,2014,10,18,3,2jjbp3,"Any one on any ideas of CS courses; Oxford, Manchester or Warwick (or other)?",https://www.reddit.com/r/computerscience/comments/2jjbp3/any_one_on_any_ideas_of_cs_courses_oxford/,mojoegojoe,1413568893,I just want to know if any off you guys have studied or know much about the courses and student life at them.,0,1
71,2014-10-18,2014,10,18,16,2jlcay,Queues and Linked Lists in C#...a tutorial,https://www.reddit.com/r/computerscience/comments/2jlcay/queues_and_linked_lists_in_ca_tutorial/,karimo94,1413618866,,0,2
72,2014-10-19,2014,10,19,5,2jmyce,Computer Scientists concerned with Social Issues,https://www.reddit.com/r/computerscience/comments/2jmyce/computer_scientists_concerned_with_social_issues/,AaronDaBomb,1413665933,"Hi! 

I'm a computer scientist who is also very concerned with all sorts of other issues, such as the environment, human rights, and all sorts of other stuff. I've been trying to find a group of other computer scientists who also care about stuff like this, but I can't find one :( there was one (http://cpsr.org/) but it's defunct now (I spoke with one of the founders). Does anyone know of any groups, or is anyone else looking for something similar?

PS -- Check out [Norbert Weiner](http://en.wikipedia.org/wiki/Norbert_Wiener) and his book [The Human Use of Human Beings](http://en.wikipedia.org/wiki/The_Human_Use_of_Human_Beings). I found him when trying to find groups like this, and he is my new hero (warning: that book is dense af)",3,4
73,2014-10-19,2014,10,19,7,2jn9k7,CCNP Route: Redistribute EIGRP into OSPF,https://www.reddit.com/r/computerscience/comments/2jn9k7/ccnp_route_redistribute_eigrp_into_ospf/,abingabanger,1413673029,,0,1
74,2014-10-19,2014,10,19,9,2jnkdd,Studying For A Masters In Germany?,https://www.reddit.com/r/computerscience/comments/2jnkdd/studying_for_a_masters_in_germany/,con7con,1413680346,"Hello, I am currently a student in the UK in the 2nd year of a Computer Science BSc and wish to study in Germany for a masters degree, does anyone know if this would be possible etc and might be able to point me in the direction of any useful resources? Thanks in advance.",1,0
75,2014-10-19,2014,10,19,15,2jo9gb,"Wang B-machine: ""the first formulation of a Turing-machine theory in terms of computer-like models""",https://www.reddit.com/r/computerscience/comments/2jo9gb/wang_bmachine_the_first_formulation_of_a/,abathologist,1413700568,,0,0
76,2014-10-20,2014,10,20,7,2jqajd,Book recommendations for beginning machine learning?,https://www.reddit.com/r/computerscience/comments/2jqajd/book_recommendations_for_beginning_machine/,Carpetfizz,1413757672,"Hello,

I'm starting to get interested in machine learning and AI, and was wondering if there was a staple, go to book to read in order to learn it. I'm familiar with most major languages like Java, C++, Python, Js, etc. so the adaption is not really an issue. It would help if it was written in a modern style, with lots of code examples. One book I came across is [Machine Learning in Action by Peter Harrington](http://www.manning.com/pharrington/), but the Amazon reviews said that he does not go in depth into the code examples.

Thank you for any suggestions!

",4,2
77,2014-10-20,2014,10,20,9,2jqlks,What to include on an application for a placement year?,https://www.reddit.com/r/computerscience/comments/2jqlks/what_to_include_on_an_application_for_a_placement/,[deleted],1413764236,"I was wondering what things people thought were to be definitively included in cvs, covering letters etc, and what not to include (if anything?), when it comes to applying for jobs for a university placement year?",0,0
78,2014-10-20,2014,10,20,22,2js4ao,Best IT solutions,https://www.reddit.com/r/computerscience/comments/2js4ao/best_it_solutions/,[deleted],1413810157,,0,0
79,2014-10-21,2014,10,21,2,2jswh5,What are some of the more important languages?,https://www.reddit.com/r/computerscience/comments/2jswh5/what_are_some_of_the_more_important_languages/,blanketbread,1413826298,I'm in my second year of a computer science degree. I was curious to know what sorts of programming language are the most important once I am done.,14,0
80,2014-10-21,2014,10,21,7,2jtzgs,I really need help for my Micro Electronics class. We don't really ever seem to get the info we need to do these calculations:,https://www.reddit.com/r/computerscience/comments/2jtzgs/i_really_need_help_for_my_micro_electronics_class/,[deleted],1413845849,"This is going to be long, and the formatting will probably be terrible. But here goes. If anyone can solve this for me I'll be forever in your debt.


1. You have a PC with a 2 GHz processor, a system bus clocked at 400 MHz, and a 3 Mbps internal cable modem attached to the system buz. No parity or other error-checking mechanisms are used. The modem has a 64-byte buffer. After it receives 64 bytes, it stops accepting data from the network and sends a ""data ready"" interrupt to the CPU. When the interrupt is received, the CPU and OS perform the following actions:

a. The supervisor is called
b. The supervisor calls the modem's ""data ready"" interrupt handler.
c. The interrupt handler sends a command to the modem, instructing it to copy its buffer content to main memory,
d. The modem interrupt handler immediately returns control to the supervisor
e. The supervisor returns control to the process that was originally interrupted
Sending an interrupt requires one bus cycle. A push or pop operation consumes 30 CPU cycles. Incrementing the stack pointer and executing an unconditional BRANCH instruction require one CPU cycle each. The supervisor consumes eight CPU cycles searching the interrupt table before calling an interrupt handler. The ""data ready"" interrupt handler consumes 50 CPU cycles before returning to the supervisor.

Incoming packets are 64 bytes. The ""transfer complete"" interrupt consumes 30 CPU cycles before returning to the supervisor if it doesn't detect a complete packet in memory. If it does, it consumes 30 CPU cycles plus one cycle for each 8 bytes of the packet.

Use the following table to determine how long it takes to move a 64-byte packet from its arrival at the modem until its receipt in the memory area of the target application program or service? State your answer in elapsed time (nanoseconds).
Facts For Problem 1
Device
Clock rate (MHz)
Cycle time (ns)
Width (bytes)
Speed (bytes/sec)
Bus
400
2.5
8
 
CPU
2000
0.5
8
 
Modem buffer
 
 
64
 
Modem speed
 
 
 
375000
Operation
 
CPU Cycles
 
 
Push
 
30
 
 
Pop
 
30
 
 
Increment stack pointer
 
1
 
 
Branch
 
1
 
 
Supervisor lookup
 
8
 
 
Data ready interrupt handler
 
50
 
 
Transfer complete interrupt handler
30
 
 
Interrupt handler memory copy (8 bytes)
1
 
 
Now fill in CPU cycles and times
Processing steps
Cycles
Time (ns)
Send data ready interrupt to CPU
1
2.5
Call supervisor (PUSH+INCR+BRANCH)
 	 
Execute supervisor table lookup
 	 
Call interrupt handler (PUSH+INCR+BRANCH)
 	 
Execute data ready interrupt handler
 	 
Return to supervisor (POP)
 	 
Return to suspended program (POP)
 	 
Transfer buffer content (64 bytes) across bus Comment: This time is in parallel to the two returns to supervisor. In this case it is less and doesn't count.
(8)
(20)
Send transfer completed interrupt to CPU
1
2.5
Call supervisor (PUSH+INCR+BRANCH)
 	 
Execute supervisor lookup
 	 
Call interrupt handler (PUSH+INCR+BRANCH)
 	 
Execute transfer complete interrupt handler
 	 
Interrupt handler memory copy (64 bytes)
 	 
Return to supervisor (POP)
 	 
Return to suspended program (POP)
 	 
Sum
 (leave blank)
 
",1,0
81,2014-10-21,2014,10,21,14,2jv3w8,Need Help with a Simple CSE Intro Class Question,https://www.reddit.com/r/computerscience/comments/2jv3w8/need_help_with_a_simple_cse_intro_class_question/,TheAark,1413870278,"Hey CS community:

I am in an intro computer science class and I had to write some code for this homework project. Every thing is looking good as far as the functions but I can't find an easy way to indent every line 3 spaces except for some lines. Here is just an example of what it needs to look like:

&lt;output&gt;
   
___&lt;output&gt;
   
___&lt;output&gt;
   
___&lt;output&gt;


Is there an easy way to do this other than:

System.out.println(""___output"");

System.out.println(""___output2"");
???

Note: The _ underscores equal spaces.
",4,1
82,2014-10-21,2014,10,21,18,2jvgzp,SUPER IT SOLUTIONS,https://www.reddit.com/r/computerscience/comments/2jvgzp/super_it_solutions/,[deleted],1413883844,,0,0
83,2014-10-21,2014,10,21,20,2jvna3,"Hardware engineers, do you feel pressured by Moore's law?",https://www.reddit.com/r/computerscience/comments/2jvna3/hardware_engineers_do_you_feel_pressured_by/,minminminmin,1413890603,"Are you ever behind schedule on doubling the memory capacity every two years, so that you fear the repercussions of breaking the law?",2,6
84,2014-10-21,2014,10,21,21,2jvq0b,"How to Unblock YouTube in Pakistan Without any Software like Hotspot shield, Proxy or VPN",https://www.reddit.com/r/computerscience/comments/2jvq0b/how_to_unblock_youtube_in_pakistan_without_any/,vitalsoft,1413893115,,0,0
85,2014-10-22,2014,10,22,1,2jwdn5,Deciding between a Bachelors or Masters,https://www.reddit.com/r/computerscience/comments/2jwdn5/deciding_between_a_bachelors_or_masters/,last_try_why,1413907733,"As above I'm currently deciding between a Bachelors degree or Masters degree program.

Background: I already have a Bachelors degree in Business Management and I'm currently taking ""deficiency"" courses to be accepted to the Masters program. However, these are the same courses I need for the Bachelors minus a few of the end courses. 

The timeframe to complete either is roughly the same according to my advisor, but I'm going to check into that further. I was just curious to get the perspective of people in the actual field already on which route to take.

My grades are fairly average. Mostly B's except in my actual programming classes which are all A's. I'll be happy to respond with any other pertinent information.

Thanks Everyone",9,2
