,sbr,sbr_id,date,year,month,hour,day,id,domain,title,full_link,author,created,selftext,num_comments,score,over_18,thumbnail,media_provider,media_thumbnail,media_title,media_description,media_url
0,computerscience,t5_2qj8o,2015-9-1,2015,9,1,10,3j5qzu,self.computerscience,CS question on adders and adding binary numbers.,https://www.reddit.com/r/computerscience/comments/3j5qzu/cs_question_on_adders_and_adding_binary_numbers/,jbiz91,1441069675,"I just started taking my major classes and I'm having trouble understanding a binary problem. Our material is talking about adders and adding binary. 0 + 0 = 0, 1 + 0 = 1, and 1 + 1 = 0 with a carry-out bit, correct? My problem is the table given in the material. The formulas we're given are Sum = A + B + C-in. If line 5 is C-in(1) + A(0) + B(0), that would be 1 + 0 + 0 = 1 with no carry-out bit. So where does the carry-in bit on line 6 come from? Shouldn't that carry-in bit be 0 since the last line didn't have a carry-out bit? And if that's the case, it will change the rest of the table, right? The first table is what we were given. The second table is what I get when I go through and do the math. I've tried calling my professor but he doesn't have voicemail setup, so I'm kind of out of options. If I posted this in the wrong sub, I'm sorry. This is the only one I could find that I thought would be applicable. Thanks for your help!
 

C-in | A | B | SUM | C-out
---|---|----|----|----
0 | 0 | 0 | 0 | 0
0 | 0 | 1 | 1 | 0
0 | 1 | 0 | 1 | 0
0 | 1 | 1 | 0 | 1
1 | 0 | 0 | 1 | 0
1 | 0 | 1 | 0 | 1
1 | 1 | 0 | 0 | 1
1 | 1 | 1 | 1 | 1


C-in | A | B | SUM | C-out
---|---|----|----|----
0 | 0 | 0 | 0 | 0
0 | 0 | 1 | 1 | 0
0 | 1 | 0 | 1 | 0
0 | 1 | 1 | 0 | 1
1 | 0 | 0 | 1 | 0
0 | 0 | 1 | 1 | 0
0 | 1 | 0 | 1 | 0
0 | 1 | 1 | 0 | 1

Edit: I think I'm a dumbass. That table was just showing the possible variations, and I was trying to add the entire A column, B column, and C-in column in one word. Uhhhhh, yeah...",0,0,False,self,,,,,
1,computerscience,t5_2qj8o,2015-9-1,2015,9,1,10,3j5sk4,self.computerscience,PuTTY Equivalent on Mac?,https://www.reddit.com/r/computerscience/comments/3j5sk4/putty_equivalent_on_mac/,[deleted],1441070346,[deleted],7,1,False,default,,,,,
2,computerscience,t5_2qj8o,2015-9-1,2015,9,1,12,3j6crb,self.computerscience,Graduated with a degree in Environmental Science and wanting to go into CS,https://www.reddit.com/r/computerscience/comments/3j6crb/graduated_with_a_degree_in_environmental_science/,nguyen573,1441079620,"Hello,

I graduated with a degree in Environmental Science but the job market for Environmental science is rather hard to get into so I figured why not computer science since I come from a really technical background regarding computers and what not. I already know Python at an understandable level cause I was learning GIS which needs Python to exceed at a higher level. So my question is how realistic is it to get a career in CS without having a degree in CS per say. I already bought HTML, Java, and C++ books.",4,1,False,self,,,,,
3,computerscience,t5_2qj8o,2015-9-1,2015,9,1,17,3j72po,scirp.org,Two Pass Port Scan Detection Technique Based on Connection Pattern and Status on Sampled Data,https://www.reddit.com/r/computerscience/comments/3j72po/two_pass_port_scan_detection_technique_based_on/,Claire3652,1441096353,,0,1,False,default,,,,,
4,computerscience,t5_2qj8o,2015-9-2,2015,9,2,2,3j8tge,self.computerscience,Can you take the AP Computer Science A test if you're not in high school?,https://www.reddit.com/r/computerscience/comments/3j8tge/can_you_take_the_ap_computer_science_a_test_if/,doubletwo,1441129009,"This might be a really dumb question, but I had initially dropped out of University a while ago to pursue other interests, but when coming back for CSCI I noticed that for my University the AP Computer Science A test covers the Programming I course. 


This could fast track my process but from what I saw this is a high school AP test. Is there anyway a college student can take this test to get some easy credits and blow past the content I already know? It would be a huge help if at all possible. Sorry if it seems like I'm trying to cheat my way though, but I'm trying to prove myself in some way here.


Thanks.",8,0,False,self,,,,,
5,computerscience,t5_2qj8o,2015-9-2,2015,9,2,4,3j9dm1,imgur.com,Exactly 1.099.511.627.776 bytes used on a HDD,https://www.reddit.com/r/computerscience/comments/3j9dm1/exactly_1099511627776_bytes_used_on_a_hdd/,qualidad,1441136759,,3,0,False,http://a.thumbs.redditmedia.com/HY57sLZ03XT_Z0hStk1v9LrqwxwZXfDJC3eddEPt8l4.jpg,,,,,
6,computerscience,t5_2qj8o,2015-9-2,2015,9,2,6,3j9vs4,self.computerscience,"Well folks, I've run out of ideas. I need some CompSci degree help.",https://www.reddit.com/r/computerscience/comments/3j9vs4/well_folks_ive_run_out_of_ideas_i_need_some/,Chingy1510,1441143782,"First of all, I appreciate you taking the time to check out my post. Anyways, I don't know how common it is, but I found out today that the path my college had me on basically... Wasn't where I needed to be. To start off, my career plan is/was to get a BS in compsci after getting an associates. I'm 28 hours away from my associates, and I finally realized how stupid I've been. At my college, for an Associate's degree in compsci, two math courses are required, so I'm currently taking engineering algebra and will be taking trig next semester. If I pull off some movie-type shit, I'll be able to finish calculus I and II in a semester, which is required for transferring....

I guess my question is, has anyone else come across this problem? I feel like my community college has me taking random classes to fit their associate's degree program that is just leeching me of money, and has no transfer value to a university. What should I do? And does this mean I have to restart school? (Note: all of my core classes minus math and science are complete.)

TL:DR: I'm about to get an associates in computer science and haven't even started calculus/precal, though all of my core class (english, history etc) requirements are fulfilled. What should I do so that I can earn a bachelor's degree?",16,3,False,self,,,,,
7,computerscience,t5_2qj8o,2015-9-2,2015,9,2,9,3jak7d,readwrite.com,Googles Alphabet: Its All About Getting New Ideas Into Orbit,https://www.reddit.com/r/computerscience/comments/3jak7d/googles_alphabet_its_all_about_getting_new/,rcsoyer,1441154904,,0,2,False,default,,,,,
8,computerscience,t5_2qj8o,2015-9-2,2015,9,2,12,3jb379,self.computerscience,18 y/o senior(hs) looking to become a software developer. What can I do now to help?,https://www.reddit.com/r/computerscience/comments/3jb379/18_yo_seniorhs_looking_to_become_a_software/,TheIllusion_,1441163447,"New to this sorry about formatting.

I am an 18 year old highschool senior, looking to graduate early. I would like to pursue a career as a software developer after college. Anything I can/should to now to help prepare me for the future?",24,5,False,self,,,,,
9,computerscience,t5_2qj8o,2015-9-2,2015,9,2,12,3jb60h,self.computerscience,Need help with a c++ currency project!,https://www.reddit.com/r/computerscience/comments/3jb60h/need_help_with_a_c_currency_project/,hprado69,1441164741,"So as an honors student, we are required to do a project that is beyond of the scope of the class. My idea was to create a currency converter that pulls real currency rates from the interenet. Does anyone think I could add any other little tidbit's to the project or anything else which could make it more fun?

Thank you",4,0,False,self,,,,,
10,computerscience,t5_2qj8o,2015-9-2,2015,9,2,15,3jbopz,engineeringsalaryuk.wordpress.com,Computer engineering salary  Are You Interested in a Career As a computer Engineer?,https://www.reddit.com/r/computerscience/comments/3jbopz/computer_engineering_salary_are_you_interested_in/,engineersalary,1441175146,,0,1,False,default,,,,,
11,computerscience,t5_2qj8o,2015-9-2,2015,9,2,16,3jbrw4,self.computerscience,Problem in college,https://www.reddit.com/r/computerscience/comments/3jbrw4/problem_in_college/,olimpija5,1441177250,"Hi,  I am studying as a economics major in college. I completed all tasks for year 1 and I can go to year 2. But between year I was occasionally thinking about switching to cs. The problem is if I will switch to cs they don't recognize any of my credit (ECTS) and I will have to go in year 1, yes this is our European system. What to do,  stay or switch? 
Thanks for advices. ",5,0,False,self,,,,,
12,computerscience,t5_2qj8o,2015-9-2,2015,9,2,17,3jbyev,modeling-languages.com,Gitana: a SQL-based Git Repository Inspector,https://www.reddit.com/r/computerscience/comments/3jbyev/gitana_a_sqlbased_git_repository_inspector/,valerio_,1441182104,,0,3,False,http://b.thumbs.redditmedia.com/kc8zL9VtNZX5rBfXK1_5ufMh0yvGrYAdvMP_isffdpc.jpg,,,,,
13,computerscience,t5_2qj8o,2015-9-2,2015,9,2,20,3jchv6,xsolve.pl,iOS dilemma: Swift VS Objective-C?,https://www.reddit.com/r/computerscience/comments/3jchv6/ios_dilemma_swift_vs_objectivec/,leslao,1441194922,,0,1,False,default,,,,,
14,computerscience,t5_2qj8o,2015-9-2,2015,9,2,21,3jcp23,github.com,Soccer CLI - A command line interface for all soccer scores,https://www.reddit.com/r/computerscience/comments/3jcp23/soccer_cli_a_command_line_interface_for_all/,architv,1441198742,,1,1,False,http://b.thumbs.redditmedia.com/OzY3gr9RO39aB7iTrnmMeSIoWW92yW_1xaHBj4Bc1SM.jpg,,,,,
15,computerscience,t5_2qj8o,2015-9-3,2015,9,3,0,3jd99h,self.computerscience,What do companies actively look for in a recent CS Grad?,https://www.reddit.com/r/computerscience/comments/3jd99h/what_do_companies_actively_look_for_in_a_recent/,Kallaan12,1441207613,"I'm going to be graduating from UCF in Orlando, FL with a B.S. in Computer Science in about 2 semesters and I want to spend the last year or so studying and practicing a language that is most highly sought after in the marketplace. They teach mainly C in my courses and require OO which is taught in Java. Basically, those are the only two languages I am fully knowledgeable of. For the most part, the concepts and topics from one language are transferable to another with respect to syntax of said language. Which programming language, HTML/CSS/XHTML/SQL/JS/AngularJS/.NET/C#/C++, or any other is best worth my time to master before I graduate that will best aid me in landing a secure job in a timely manner. Side Note: I've been actively attemping to snag an Internship for about 10 months and have been unsuccessful so far, so please do not advise me that an Internship would be more helpful then mastering another language. Thanks again for taking the time to advise and review my question! =)",7,1,False,self,,,,,
16,computerscience,t5_2qj8o,2015-9-3,2015,9,3,10,3jfn4l,self.computerscience,Need help choosing best database system for homework assignment!,https://www.reddit.com/r/computerscience/comments/3jfn4l/need_help_choosing_best_database_system_for/,weeetart,1441243083,"Hello everyone of /r/computerscience !
I'm a little stuck on my assignment and am looking for the best method to store and retrieve data. My assignment is to create an airplane reservation system. The whole idea is that a person(s) can choose to reserve a seat in a cabin which looks like [this](http://i.imgur.com/FbFDUx9.png). They have the option to choose first class or economy, and between window, aisle, or center seat. What is the best way to go about adding or removing a single passenger or a group of passengers efficiently? I was thinking about a 2D array but feel as if there may be complications with it. Oh before I forget, this is also programmed in Java. ",2,0,False,self,,,,,
17,computerscience,t5_2qj8o,2015-9-3,2015,9,3,10,3jfqvd,readwrite.com,How Good Developers Deal With Bad Code,https://www.reddit.com/r/computerscience/comments/3jfqvd/how_good_developers_deal_with_bad_code/,rcsoyer,1441244920,,0,0,False,default,,,,,
18,computerscience,t5_2qj8o,2015-9-3,2015,9,3,13,3jg6fz,readwrite.com,"Today's Developer: Multilingual, Excited For The Future ... And Worried About Keeping Up",https://www.reddit.com/r/computerscience/comments/3jg6fz/todays_developer_multilingual_excited_for_the/,rcsoyer,1441252940,,0,1,False,default,,,,,
19,computerscience,t5_2qj8o,2015-9-3,2015,9,3,13,3jga9f,thebushra.com,What are desirable qualities of Operating System,https://www.reddit.com/r/computerscience/comments/3jga9f/what_are_desirable_qualities_of_operating_system/,xishan,1441255434,,0,1,False,default,,,,,
20,computerscience,t5_2qj8o,2015-9-3,2015,9,3,17,3jgpy4,levrish.com,Degree in Computer Sciences,https://www.reddit.com/r/computerscience/comments/3jgpy4/degree_in_computer_sciences/,vjfaizan,1441267375,,0,1,False,default,,,,,
21,computerscience,t5_2qj8o,2015-9-3,2015,9,3,17,3jgrhj,imgur.com,"How do you explain the appearance of ""waves"" of small dots of colours when you take a photo of a computer screen with your phone camera?",https://www.reddit.com/r/computerscience/comments/3jgrhj/how_do_you_explain_the_appearance_of_waves_of/,Dpgg94,1441268587,,3,20,False,http://b.thumbs.redditmedia.com/Kyf3BUB-7U5wiGBDn0je32-9vDM60nv9cSkdgdCB2NM.jpg,,,,,
22,computerscience,t5_2qj8o,2015-9-3,2015,9,3,18,3jgwl3,esdbsdqqbse.loveslife.biz,U need seex? i m Autumn I need seex! Please! Help! 6742,https://www.reddit.com/r/computerscience/comments/3jgwl3/u_need_seex_i_m_autumn_i_need_seex_please_help/,guenon2237,1441272725,,0,1,False,default,,,,,
23,computerscience,t5_2qj8o,2015-9-4,2015,9,4,3,3jimnr,self.computerscience,What are some good intermediary to advanced books / resources / tutorials on graph theory?,https://www.reddit.com/r/computerscience/comments/3jimnr/what_are_some_good_intermediary_to_advanced_books/,NoeticIntelligence,1441304018,,4,2,False,self,,,,,
24,computerscience,t5_2qj8o,2015-9-4,2015,9,4,4,3jitd9,palmtech.net,We are your West Palm Beach FL Computer Solutions provider | PalmTech.net,https://www.reddit.com/r/computerscience/comments/3jitd9/we_are_your_west_palm_beach_fl_computer_solutions/,palmtech1,1441306812,,1,0,False,default,,,,,
25,computerscience,t5_2qj8o,2015-9-4,2015,9,4,17,3jldq0,scirp.org,A Review of Telemetry Data Transmission in Unconventional Petroleum Environments Focused on Information Density and Reliability,https://www.reddit.com/r/computerscience/comments/3jldq0/a_review_of_telemetry_data_transmission_in/,kimberly1217,1441353610,,0,1,False,default,,,,,
26,computerscience,t5_2qj8o,2015-9-4,2015,9,4,20,3jlvhg,self.computerscience,Is it worth it taking freshman year in a community college?,https://www.reddit.com/r/computerscience/comments/3jlvhg/is_it_worth_it_taking_freshman_year_in_a/,[deleted],1441366853,[deleted],3,2,False,default,,,,,
27,computerscience,t5_2qj8o,2015-9-5,2015,9,5,2,3jn4om,self.computerscience,Analysis of Algorithms - Good books to study?,https://www.reddit.com/r/computerscience/comments/3jn4om/analysis_of_algorithms_good_books_to_study/,Esmeraude,1441386792,I'm taking an Analysis of Algorithms course. My professor is very vague when explaining things and also didn't recommend a textbook. I don't want to struggle in the class and want to make sure I understand everything clearly. Any general books anybody can suggest? ,3,2,False,self,,,,,
28,computerscience,t5_2qj8o,2015-9-5,2015,9,5,4,3jnpkz,csunplugged.org,CS Unplugged - Computer Science Without a Computer,https://www.reddit.com/r/computerscience/comments/3jnpkz/cs_unplugged_computer_science_without_a_computer/,RockDiesel,1441395602,,2,16,False,http://b.thumbs.redditmedia.com/vu6Z1uCbRKBdrI9U3kHIUdU8fup5hWXXhM_C4yYHpbg.jpg,,,,,
29,computerscience,t5_2qj8o,2015-9-5,2015,9,5,9,3joq6q,self.computerscience,A question about a computer science degree.,https://www.reddit.com/r/computerscience/comments/3joq6q/a_question_about_a_computer_science_degree/,jayman16,1441412102,"I love working with computers and I'm pretty well versed in them, I'm not sure what job exactly I want, would a computer science degree be a good start?",8,3,False,self,,,,,
30,computerscience,t5_2qj8o,2015-9-5,2015,9,5,12,3jp9gm,self.computerscience,Is it better to go for a Professional Master's of Science or just certifications in Cyber security?,https://www.reddit.com/r/computerscience/comments/3jp9gm/is_it_better_to_go_for_a_professional_masters_of/,ldiabl0530,1441422468,,1,8,False,self,,,,,
31,computerscience,t5_2qj8o,2015-9-5,2015,9,5,13,3jpl86,manageitservice247.com,manage it service,https://www.reddit.com/r/computerscience/comments/3jpl86/manage_it_service/,thanh3d,1441429133,,0,1,False,default,,,,,
32,computerscience,t5_2qj8o,2015-9-6,2015,9,6,8,3jsqo0,self.computerscience,I don't like computer science but it would be convenient if I did,https://www.reddit.com/r/computerscience/comments/3jsqo0/i_dont_like_computer_science_but_it_would_be/,pokethevertices,1441494194,"I'm about to start college. Right now I haven't even moved in, but my mom is already pushing for me to do CS. I really, really hate CS right now, even if only because my mom is pushing so hard. What is so good about CS?

When I try to bring up my interests in mechanical engineering or electrical engineering or applied physics, my mom just brings up statistics about my school, how some 30% of each graduating class got a degree in CS, or anecdotes about people switching from applied physics to CS. 

I'm not sure what's the big deal is about CS, and I'm starting to resent this path more and more every time my mom brings it up. I hate thinking about going to college, and I hate how my school is among those with the toughest workloads. I turned in 100% of my pre-registration forms late because college is the last thing I want on my mind. 

I'm really stressed and pissed, and this is not how I want to start college. I get that CS pays more and people with CS degrees tend to have posher workplace environments. I get that it's apparently the easiest major at my school. But can anyone here tell me more about it so that I don't automatically write it off before I even get to school? Maybe I can fall in love with it or something and have a great time at school.",10,1,False,self,,,,,
33,computerscience,t5_2qj8o,2015-9-6,2015,9,6,11,3jtbke,self.computerscience,How do you explain computer science to someone who's computer illiterate?,https://www.reddit.com/r/computerscience/comments/3jtbke/how_do_you_explain_computer_science_to_someone/,insufficientcharacte,1441505608,"I was recently visiting some of my older relatives and they were asking about what I study as a computer science major.  I was having a really hard time explaining to them what I do.  Obviously, it's pointless to explain the concepts I'm currently learning (that would require much more time in addition to a basic CS background) so I was trying to give them a really broad description.

After talking to them a bit, it appears as if they've concluded that i'm studying tech support...

Anyway, how can I go about explaining my major to others?",14,11,False,self,,,,,
34,computerscience,t5_2qj8o,2015-9-6,2015,9,6,13,3jtof7,self.computerscience,"Help with QR codes, barcodes, etc..",https://www.reddit.com/r/computerscience/comments/3jtof7/help_with_qr_codes_barcodes_etc/,EngineeringEnergy,1441513272,"First I apologize for 

A) this potentially being posted in the wrong sub
B) my complete lack of understanding of what I'm about to ask. 

I am hoping to be able to complete the following:

1) a contractor has performed a service, and would like to get paid $$$. 

2) the contractor puts all the items they want to charge for on an invoice. This can range up to 100 line items. Each line shows the following 
Name, code of billable item, cost 

3) once the invoice is complete, all the data is put into a code ( Qr, barcode). Forgive me for my arrogance on this, I'm not sure if this is possible or not. 

4) contractor brings invoice with printed code to the payee. The payee has an iPad or iPhone to scan the code. Now the code can be verified against the contract that the contractor and payee have to make sure that the contractor isn't over paying. Basically this automates the process of checking line by line every billable item. 

So my question is, is there a qr code or barcode type idea that I can use to transmit this much information? Or am I limited to a small amount of data? 

Again I'm sorry for knowing nothing, but thanks in advance for your help! ",6,2,False,self,,,,,
35,computerscience,t5_2qj8o,2015-9-7,2015,9,7,0,3jv44y,reddit.com,[URGENT] Need help on research topic for CS Master degree : AskComputerScience,https://www.reddit.com/r/computerscience/comments/3jv44y/urgent_need_help_on_research_topic_for_cs_master/,Hamasaki_Fanz,1441553066,,0,0,False,default,,,,,
36,computerscience,t5_2qj8o,2015-9-7,2015,9,7,0,3jv5sa,self.computerscience,I am wondering if it is possible to write my own type of internet packet?,https://www.reddit.com/r/computerscience/comments/3jv5sa/i_am_wondering_if_it_is_possible_to_write_my_own/,meowcoew,1441553953,I want to try to write my own internet packet and try it between two computers in my house. Is this possible and if so where do I start? Thanks.,4,1,False,self,,,,,
37,computerscience,t5_2qj8o,2015-9-7,2015,9,7,2,3jvgha,self.computerscience,"Database project for CS Major - ideas, thoughts, etc.",https://www.reddit.com/r/computerscience/comments/3jvgha/database_project_for_cs_major_ideas_thoughts_etc/,JohnTyler123,1441559127,"Hello, 

I'm a Computer Science major and am looking to do some good projects to expand my knowledge and experience in different fields. I was thinking about building a Database with a web front end. I had an idea of maybe a book store website? or something similar. 

Well my question is how do I get started on this? I don't know what softwares I would need. Could someone point me in the right direction on how this would work? Also, I'm open to new ideas as well. Thank you in advance. ",4,0,False,self,,,,,
38,computerscience,t5_2qj8o,2015-9-7,2015,9,7,3,3jvrzc,self.computerscience,How can I get my loop to break after 6 tries? [C++],https://www.reddit.com/r/computerscience/comments/3jvrzc/how_can_i_get_my_loop_to_break_after_6_tries_c/,eel314,1441564563,"Hey /r/computerscience I have a really quick problem that I need to solve. I am trying to get my integer ""tries"" to break after the amount of tries surpasses 6. I know that I am doing something wrong but am not sure what and what the remedy is.

I really appreciate any input. Thanks for you time and have a great labor day weekend!

Code:

    #include &lt;cstdlib&gt;
    #include &lt;iostream&gt;

    using namespace std;

    int main() {
        // assigning ""number"" as an integer
        int number;
        // forms a random number between 1 and 100
        number = rand() % 100 + 1;
        // assigning ""guess"" as an integer as well
        int guess;
        // keeps the number of guesses under 6
        int tries = 0;
        // calls for something to be done
        do {
            cout &lt;&lt; ""Guess a number between 1 and 100 "";
            cin &gt;&gt; guess;
            if (guess &lt; number)
                cout &lt;&lt; ""Too low!"" &lt;&lt; endl;
            else if (guess &gt; number)
                cout &lt;&lt; ""Too high!"" &lt;&lt; endl;
            else
                cout &lt;&lt; ""Your guess is right!"" &lt;&lt; endl;
        }while (tries &lt;= 6);
        return 0;
    }",10,0,False,self,,,,,
39,computerscience,t5_2qj8o,2015-9-7,2015,9,7,9,3jx096,self.computerscience,Calculus III and Linear Algebra,https://www.reddit.com/r/computerscience/comments/3jx096/calculus_iii_and_linear_algebra/,qwww456,1441586454,"Hey guys, I'm currently enrolled in a CS Program at my state university and I'm looking for advice for my course options next year.  The school doesn't require Calculus III or Linear Algebra, but they are offered as optional (with space allotted to electives). I'm wondering if the content of Calc III (Multi-Variable Calculus) and linear algebra is needed for CS.",12,3,False,self,,,,,
40,computerscience,t5_2qj8o,2015-9-7,2015,9,7,10,3jx75x,self.computerscience,Thinking like a programmer,https://www.reddit.com/r/computerscience/comments/3jx75x/thinking_like_a_programmer/,[deleted],1441590130,[deleted],8,6,False,default,,,,,
41,computerscience,t5_2qj8o,2015-9-7,2015,9,7,13,3jxni3,pctheatsremovalguide.wordpress.com,How to Remove 2080.hit.buy-targeted-traffic.com Pop-ups? | pctheatsremovalguide,https://www.reddit.com/r/computerscience/comments/3jxni3/how_to_remove_2080hitbuytargetedtrafficcom_popups/,Andy_Lee,1441599253,,0,0,False,default,,,,,
42,computerscience,t5_2qj8o,2015-9-7,2015,9,7,13,3jxo4k,self.computerscience,How important is it to learn x86 Assembly? Sophmore CS student currently enrolled in a program that is currently undergoing a curriculum overhaul.,https://www.reddit.com/r/computerscience/comments/3jxo4k/how_important_is_it_to_learn_x86_assembly/,[deleted],1441599641,[deleted],0,1,False,default,,,,,
43,computerscience,t5_2qj8o,2015-9-7,2015,9,7,13,3jxp79,self.computerscience,How important is it to learn x86 Assembly? I'm a sophmore CS student enrolled in a program that is currently undergoing a major curriculum overhaul.,https://www.reddit.com/r/computerscience/comments/3jxp79/how_important_is_it_to_learn_x86_assembly_im_a/,GordianKnott838,1441600303,"The long story short is that this last semester my school is offering an assembly focused System Fundamentals course. In the spring they are replacing it with a System Fundamentals course that is almost all theory, with a few c-based programming projects.

Should I try and get into this class before they eliminate it? ",3,5,False,self,,,,,
44,computerscience,t5_2qj8o,2015-9-7,2015,9,7,17,3jy9sh,scirp.org,Personalized Tag Recommendation Based on Transfer Matrix and Collaborative Filtering,https://www.reddit.com/r/computerscience/comments/3jy9sh/personalized_tag_recommendation_based_on_transfer/,scirpjenny,1441614641,,0,1,False,default,,,,,
