,sbr,sbr_id,date,year,month,hour,day,id,domain,title,full_link,author,created,selftext,num_comments,score,over_18,thumbnail,media_provider,media_thumbnail,media_title,media_description,media_url
45,computerscience,t5_2qj8o,2015-9-7,2015,9,7,17,3jyb2h,scirp.org,User Preferences-Based and Time-Sensitive Location Recommendation Using Check-In Data,https://www.reddit.com/r/computerscience/comments/3jyb2h/user_preferencesbased_and_timesensitive_location/,srp2014,1441615681,,0,1,False,default,,,,,
46,computerscience,t5_2qj8o,2015-9-7,2015,9,7,19,3jyjn8,self.computerscience,Year Project,https://www.reddit.com/r/computerscience/comments/3jyjn8/year_project/,pyxis_92,1441622579,"Heya, 

I'm going to start doing my final year project at uni but im currently out of ideas. I thought about doing something with the cloud and pi but all the ideas are repeated. 

Can anyone suggest something, or a new twist of doing something. I feel really frustrated. I'm willing to listen to new ideas as well.  

I'm studying computer science. ",6,1,False,self,,,,,
47,computerscience,t5_2qj8o,2015-9-7,2015,9,7,23,3jz2ne,self.computerscience,"When text is copied using Ctrl+C, where is it stored?",https://www.reddit.com/r/computerscience/comments/3jz2ne/when_text_is_copied_using_ctrlc_where_is_it_stored/,QuestionProgram,1441635130,"On the hard disk? In memory? CPU? Does it depend on the program?

Thanks!",13,9,False,self,,,,,
48,computerscience,t5_2qj8o,2015-9-8,2015,9,8,1,3jzlm2,self.computerscience,Is there a way to tell what application sent a given packet?,https://www.reddit.com/r/computerscience/comments/3jzlm2/is_there_a_way_to_tell_what_application_sent_a/,meowcoew,1441644151,"For example if I am using Google Chrome, can I take a random packet and tell based on something in the packet that it is from Google Chrome? Thanks.",2,1,False,self,,,,,
49,computerscience,t5_2qj8o,2015-9-8,2015,9,8,11,3k1nsy,self.computerscience,Java vs Node for server side architecture.,https://www.reddit.com/r/computerscience/comments/3k1nsy/java_vs_node_for_server_side_architecture/,Shikon_no_Ninja,1441680334,"Can someone give me good pros and cons list for why you would use one over the other? I've been told Java scales better and that when a lot of startups get large they need to switch. But a friend of mine tells me Node scales better horizontally (not sure what that means).

Feel free to give me as simple or as complicated pros and cons list as you'd like. Thanks reddit!",3,1,False,self,,,,,
50,computerscience,t5_2qj8o,2015-9-8,2015,9,8,13,3k1yog,self.computerscience,Buy or rent textbooks?,https://www.reddit.com/r/computerscience/comments/3k1yog/buy_or_rent_textbooks/,avatarKanye,1441685972,"Ignoring the financial portion of the argument, what are your reasons for buying/renting textbooks? Elaborating on that, do any of you actually end up using your books still after a course is over or find it helpful to keep the books? Thanks in advance!",6,1,False,self,,,,,
51,computerscience,t5_2qj8o,2015-9-8,2015,9,8,16,3k2fos,self.computerscience,Bachelor of Engineering or Bachelor of Science?,https://www.reddit.com/r/computerscience/comments/3k2fos/bachelor_of_engineering_or_bachelor_of_science/,coke21,1441697276,"Which one is better for employers and which do you think I should get?

Bachelor of Engineering (Software Engineering).

or

Bachelor of Science (Computer Science).

Academically they are both pretty much the same. Computer science has more flexibility (more free electives) and I'm leaning towards that. People have told me it doesn't matter, but I feel like it does. I will be awarded either a bachelor of engineering or bachelor of science in the end.

Honestly to a normal person the Bachelor of Engineering sounds better. And apparently to my mum, it sounds A LOT better... which is kind of why I'm asking this. My mum won't stop mentioning this and seems like it's a massive deal. I know it's not, but I still want to know which is better.

Want just brutally honest answers, don't really want 'doesn't matter' as an answer - but of course if it TRULY doesn't matter ONE bit, then I'm happy to hear it.

So which one is better in the eyes of employers, if we take out ability / experience / grades?

Thanks!!",17,1,False,self,,,,,
52,computerscience,t5_2qj8o,2015-9-9,2015,9,9,2,3k46tw,self.computerscience,Is computer science for me?,https://www.reddit.com/r/computerscience/comments/3k46tw/is_computer_science_for_me/,finalboss88,1441732376,"Currently I am about to earn an AA degree to transfer to a bigger college from my CC. But lately I have been pressured about what I will go into. Quite frankly, I did not ever once think in high school I would ever make it this far. So to me this is like taking a leap a faith when it comes time to select my major. Right now my math skills are weak but the class I am in will allow me to get into a credited higher level-MAT which is very attractive for transferring if I can get a B(80) so far I have almost a 100 in it currently. However, that's not what I fear. What I fear is I may not understand CS itself as well as comprehend the much much higher difficulties of MAT that are required. I really do like computers, Iv always liked them since I was a kid. Everyone turns to me when they need help with their computers and somehow I manage to solve simple issues. But even so, I know it means very little what I know about computers and am aware there is so much more to learn. Iv watched CS classes on youtube, and even took notes on the terms used by the professor. I want to do CS, but I am afraid no matter how strong my interest in it, it may not reflect my actual ability to make it possible to earn a B.S in it.

Has anyone ever felt like this before?

(Not sure if I selected the correct subreddit, this is my very first post on this site)
",14,5,False,self,,,,,
53,computerscience,t5_2qj8o,2015-9-9,2015,9,9,2,3k4blh,self.computerscience,What is a good way for a beginner to learn UNIX after the basic code academy course?,https://www.reddit.com/r/computerscience/comments/3k4blh/what_is_a_good_way_for_a_beginner_to_learn_unix/,dearalyyy,1441734272,,2,1,False,self,,,,,
54,computerscience,t5_2qj8o,2015-9-9,2015,9,9,4,3k4rcw,self.computerscience,a new test of Turing,https://www.reddit.com/r/computerscience/comments/3k4rcw/a_new_test_of_turing/,dShArpen,1441740620,[removed],2,0,False,default,,,,,
55,computerscience,t5_2qj8o,2015-9-9,2015,9,9,6,3k55ae,self.computerscience,Cormen Algorithms Additional Study Resources?,https://www.reddit.com/r/computerscience/comments/3k55ae/cormen_algorithms_additional_study_resources/,Allegiance_to_Mhysa,1441746429,"I was wondering if anyone has come across a good companion book for the Bible of all algorithm books. I'm taking an Advanced Data Structures and Algorithms class right now, and the first part is so heavy on math I haven't done in a while (proof by induction for example). I was curious about any good resources anyone has found for this book or when taking a similar class.",2,0,False,self,,,,,
56,computerscience,t5_2qj8o,2015-9-9,2015,9,9,9,3k5vqx,self.computerscience,Algorithm for Peanut Butter and Jelly Sandwich?,https://www.reddit.com/r/computerscience/comments/3k5vqx/algorithm_for_peanut_butter_and_jelly_sandwich/,dennis129,1441756969,My teacher is asking us this to demonstrate how specific we have to be when programming. ,5,0,False,self,,,,,
57,computerscience,t5_2qj8o,2015-9-9,2015,9,9,9,3k5zne,self.computerscience,BlueJ is awful.,https://www.reddit.com/r/computerscience/comments/3k5zne/bluej_is_awful/,PopRockRoll,1441758435,Or is it just me? I'm working through this textbook and it either oversimplifies things or complicates them. Am I just crazy?,12,0,False,self,,,,,
58,computerscience,t5_2qj8o,2015-9-9,2015,9,9,12,3k6qzw,self.computerscience,What are the similarities and differences between a workstation and a personal computer?,https://www.reddit.com/r/computerscience/comments/3k6qzw/what_are_the_similarities_and_differences_between/,[deleted],1441769327,,4,2,False,self,,,,,
59,computerscience,t5_2qj8o,2015-9-9,2015,9,9,14,3k77j5,cracksmaker.com,WinZip 19 Crack Activation Code Keygen Full Serial Key,https://www.reddit.com/r/computerscience/comments/3k77j5/winzip_19_crack_activation_code_keygen_full/,khizerhayat012,1441776862,,1,1,False,default,,,,,
60,computerscience,t5_2qj8o,2015-9-9,2015,9,9,15,3k7bjm,reddit.com,X-Post: How many concurrent users can YouTube or such other popular sites support?,https://www.reddit.com/r/computerscience/comments/3k7bjm/xpost_how_many_concurrent_users_can_youtube_or/,dusty321,1441779000,,1,0,False,http://a.thumbs.redditmedia.com/PDQadCzYX_x1bU3KrYuhTptu6eDdOVVagFG6q_Afyb4.jpg,,,,,
61,computerscience,t5_2qj8o,2015-9-9,2015,9,9,20,3k8735,self.computerscience,CS Graduates,https://www.reddit.com/r/computerscience/comments/3k8735/cs_graduates/,Connors344,1441797482,"To all you CS graduates out there I have a few questions that hopefully some of you guys could answer.

1. Did you go further than a bachelors degree or did you get higher degrees (Masters, PHD, etc.)?
2. How hard was it for you to find a job after you graduated? 
3. What do you normally do on a daily basis? (Such as software developer, cybersecurity, website developer, etc.)
4. What languages do you know best and which ones do you use the most in your line of work? 
5. Lastly, how happy are you guys with where you ended up after college?
Thanks!  ",13,13,False,self,,,,,
62,computerscience,t5_2qj8o,2015-9-10,2015,9,10,12,3kcdka,self.computerscience,Need help deciding what I should be doing as Comp. Sci major please!,https://www.reddit.com/r/computerscience/comments/3kcdka/need_help_deciding_what_i_should_be_doing_as_comp/,shutupanddancewithme,1441854755,"TL;DR I'm thinking of dropping Calc 2 and my desire to pursue a minor in math. Looking for some advice as to what cs courses might be helpful to me please!

So I'm a junior at Boston University and, as the title suggests, I'm a comp. sci major. I'm at best an average student with a GPA of 3.30.

So far, I've taken two intro courses to CS, a course on combinatoric structures, and one on computer systems. (Also, I've completed all my liberal arts requirements already.. which might have been a mistake).

Currently, I'm taking a course in Linear Algebra/Geometric Algorithms, Algebraic Algorithms, and Concepts of Programming Languages. I'm also taking Calculus 2.

Now here's my dilemma. At the end of last semester, I thought that I wanted to get a minor in Math. However, after talking about it with a friend and looking at a few stack exchange discussions, it seems that a minor in math might not be all that useful when pursuing a career (I definitely welcome anyone to refute that though because I'm extremely ignorant and will believe almost anything on the internet.. as long as they come from credible sources ofc...). I say it might not be useful because, at the moment, I just don't see how practical/beneficial the math courses I'll need to take will be in a future job.

Also, if I pursue the math minor, I'll have to take two of the course requirements (while maintaining four classes per semester - three cs classes and some other additional class) either by overloading on classes in two of my remaining four semesters or by taking them during the summer. I don't know if I'll be able to handle 5 classes (especially since people tell me taking 3 cs courses is already a handful), and taking the summer courses at my college is hella expensive. Obviously everything comes at some price, but again - I'm not certain at all if I want to commit myself to these things.

Anyways, it would be awesome if I could get some feedback and advice from more experienced individuals. I'm thinking about dropping Calc 2 and the math minor, but I don't know what classes to take that will keep me occupied with a 4-class semester until I graduated, not be too heavy in workload (though I can definitely try my best to keep up), and are guaranteed to be useful in the future. Is it practical/worthwhile to take classes that count for literally nothing and are taken just for fun?
Thanks so very much for reading! =)

Edit: I would discuss this with an advisor, but I wanted to get other opinions first because mine is the kind of guy who will tell me to do whatever I want to.",2,1,False,self,,,,,
63,computerscience,t5_2qj8o,2015-9-10,2015,9,10,21,3ke5dx,blog.exabeam.com,Thorough Analysis For Using Data Science To Detect Malicious Domains,https://www.reddit.com/r/computerscience/comments/3ke5dx/thorough_analysis_for_using_data_science_to/,aleahaa3,1441889259,,0,1,False,default,,,,,
64,computerscience,t5_2qj8o,2015-9-10,2015,9,10,22,3ked3h,self.computerscience,How can I tell whether I understand Java well enough to code professionally?,https://www.reddit.com/r/computerscience/comments/3ked3h/how_can_i_tell_whether_i_understand_java_well/,William_1,1441892538,"I am a CS student going into my third year of CS courses. I have taken four semesters of Java and my grades were decent, but how can I tell whether I actually know as much Java as I would need to to get a job?

The classes I have taken that involved the most programming were 

* CS101 - intro programming

* CS201 - more intro programming, designing data types, some basic algorithms for sorting and searching

* CS302 - Object Oriented Design and Patterns, covered principles for designing a program and some patterns programmers use

* CS303 - Algorithms and Data Structures, covered sorting and searching algorithms and data structures like hash tables and linked lists

I would appreciate any reliable advice anyone could give.",8,7,False,self,,,,,
65,computerscience,t5_2qj8o,2015-9-11,2015,9,11,5,3kgbgc,self.computerscience,What do you need to develop voice recognition?,https://www.reddit.com/r/computerscience/comments/3kgbgc/what_do_you_need_to_develop_voice_recognition/,noobeeee,1441917074,"Hi,

What kind of engineers or scientists do you need to develop voice recognition?

Thanks.",1,2,False,self,,,,,
66,computerscience,t5_2qj8o,2015-9-11,2015,9,11,11,3khpid,prog21.dadgum.com,"Computer Science Courses that Don't Exist, But Should",https://www.reddit.com/r/computerscience/comments/3khpid/computer_science_courses_that_dont_exist_but/,RockDiesel,1441938730,,8,25,False,default,,,,,
67,computerscience,t5_2qj8o,2015-9-11,2015,9,11,17,3kimvt,self.computerscience,What are the jobs that fall within the purview of a game engine?,https://www.reddit.com/r/computerscience/comments/3kimvt/what_are_the_jobs_that_fall_within_the_purview_of/,dusty321,1441958598,What does a game developer really develop if a game engine actually exists to do all the heavy lifting?,1,2,False,self,,,,,
68,computerscience,t5_2qj8o,2015-9-11,2015,9,11,18,3kirxn,scirp.org,Computer Simulation of Transition Regimes of Solitons in Stimulated Raman Scattering with Excitation of Polar Optical Phonons,https://www.reddit.com/r/computerscience/comments/3kirxn/computer_simulation_of_transition_regimes_of/,janice122,1441962699,,0,1,False,default,,,,,
69,computerscience,t5_2qj8o,2015-9-11,2015,9,11,21,3kj6f6,washingtonpost.com,Wearable technology empowers patients with COPD,https://www.reddit.com/r/computerscience/comments/3kj6f6/wearable_technology_empowers_patients_with_copd/,aleahaa3,1441972854,,0,0,False,http://b.thumbs.redditmedia.com/QC4ouIEgn_RqcxQF_uUZ0Wc770ITK9wNuCzhC2oXlxY.jpg,,,,,
70,computerscience,t5_2qj8o,2015-9-11,2015,9,11,23,3kjs0h,self.computerscience,"Sorry to be cliche, but I'm looking for some guidance. Is computer science the right course for me?",https://www.reddit.com/r/computerscience/comments/3kjs0h/sorry_to_be_cliche_but_im_looking_for_some/,Powelly1995,1441983521,"Currently in the second year of a journalism degree, and im realising that its not where I want to be. I've always loved IT and everything to do with it, and for years have been the go-to 'IT support dude', which I enjoyed because I really like fixing things. I ran linux for about 2 years (before it became impractical at uni) and the thing I enjoyed the most was nutting out why programs weren't running, digging for dependencies, running scripts and solving the problem.

Problem is that I'm not stellar at maths. I'm certainly competent, but I can't say I love it nor am I a whiz at it. The degree I'm looking at (which is [this](http://www.rmit.edu.au/study-with-us/levels-of-study/undergraduate-study/bachelor-degrees/bp094/#pageId=overview), and course structure [here](http://www.rmit.edu.au/study-with-us/levels-of-study/undergraduate-study/bachelor-degrees/bp094/#pageId=BP094GEN8)) seems to not be too heavy on maths, but I'm not entirely sure.

How do I know if this is really what I want to do?",9,0,False,self,,,,,
71,computerscience,t5_2qj8o,2015-9-12,2015,9,12,3,3kkjt5,udemy.com,Java Interview Guide,https://www.reddit.com/r/computerscience/comments/3kkjt5/java_interview_guide/,akhileshtt,1441994673,,0,1,False,default,,,,,
72,computerscience,t5_2qj8o,2015-9-12,2015,9,12,4,3kkw5n,self.computerscience,JS in HTML,https://www.reddit.com/r/computerscience/comments/3kkw5n/js_in_html/,RoyPhysics,1441999813,"Can I have the regular Javascript output to a GUI embedded in an HTML webpage, and if so how?",3,0,False,self,,,,,
73,computerscience,t5_2qj8o,2015-9-12,2015,9,12,4,3kkwuz,self.computerscience,Is a masters degree worth it for computer science?,https://www.reddit.com/r/computerscience/comments/3kkwuz/is_a_masters_degree_worth_it_for_computer_science/,Shade5000,1442000076,"I am currently a sophomore studying Information Assurance, and have been thinking about a masters in it for a while. I want to go into cyber security (mainly dealing with malware and the like) and was wondering if a masters in information assurance would help or not. Most of the job descriptions I've looked at just say a bachelors and proficiency in python, c/c++, and assembly, with no mention of a masters. It seems like skills are valued over a degree, do you think this will change in the future? thanks.",8,9,False,self,,,,,
74,computerscience,t5_2qj8o,2015-9-12,2015,9,12,7,3kljf6,self.computerscience,Algorithm to divide an array recursively,https://www.reddit.com/r/computerscience/comments/3kljf6/algorithm_to_divide_an_array_recursively/,AtomicAnto,1442009401,"Hi everyone. I have to do an exersice where I have to balance a binary tree and I have an N numbers in my array (all in order). What is the best way to reinsert that array in the tree? I thought about splitting the array in equal parts and one array that has the middle number to be the start of that tree.

I hope you can understand my problem!
Thank you in advance!",6,1,False,self,,,,,
75,computerscience,t5_2qj8o,2015-9-12,2015,9,12,8,3klrpl,self.computerscience,What is the best OS that I can use for CS schooling?,https://www.reddit.com/r/computerscience/comments/3klrpl/what_is_the_best_os_that_i_can_use_for_cs/,epictylerone808,1442013151,"Hello,
My hard drive crashed, so I basically have a nonbootable computer. I bought a hard drive, and since its new (and SSD) what are some of the best OSs that I can and should want to put on.

Here's what I'm thinking
Windows 7
Some form of Ubuntu. 

But I would love some input. Thank you.",8,1,False,self,,,,,
76,computerscience,t5_2qj8o,2015-9-12,2015,9,12,15,3kmy48,self.computerscience,"Raptor flowchart assignment help, need suggestions",https://www.reddit.com/r/computerscience/comments/3kmy48/raptor_flowchart_assignment_help_need_suggestions/,[deleted],1442038005,[deleted],0,1,False,default,,,,,
77,computerscience,t5_2qj8o,2015-9-12,2015,9,12,15,3kmy6k,self.computerscience,Declaration constant,https://www.reddit.com/r/computerscience/comments/3kmy6k/declaration_constant/,[deleted],1442038061,[deleted],1,0,False,default,,,,,
78,computerscience,t5_2qj8o,2015-9-12,2015,9,12,15,3kmyy7,self.computerscience,"Raptor flowchart assignment help, need suggestions",https://www.reddit.com/r/computerscience/comments/3kmyy7/raptor_flowchart_assignment_help_need_suggestions/,Bladelazoe,1442038650,"I'm not sure if this is the correct subreddit to put this in but I need some help on figuring out this IF statement block which seems confusing to me.

Write a program that accepts three numeric test scores as input. The program should first determine and display the average of the 3 scores. Then it should display the associated letter grade for the average. The letter grade should be determined using the scae: 90&lt;=ave&lt;=100, 80&lt;=ave&lt;90:B, 70&lt;=ave&lt;80:C, 60&lt;=ave&lt;70:D, &lt;60:F.

To get full credit, the program can only use at most 2 output statements.

Now I understand the general idea of the program, Input 3 scores, add them up then divide by 3 to get the average. it's the grading scale in which I'm having issues with and it's a little confusing to write out with only 2 output statements

Here's a picture of the flowchart: http://imgur.com/TkdiOsX
Make sure you zoom in on the picture otherwise it looks like Size 2 font in Word",4,1,False,self,,,,,
79,computerscience,t5_2qj8o,2015-9-12,2015,9,12,20,3knhrt,sciencesblog.org,Workshops &amp;#8211; A deeming future for students - Biology | Chemistry | Environmental | Management | Medical | Technology Blog - Science Blog,https://www.reddit.com/r/computerscience/comments/3knhrt/workshops_8211_a_deeming_future_for_students/,shanewatson5599,1442055626,,0,1,False,default,,,,,
80,computerscience,t5_2qj8o,2015-9-13,2015,9,13,1,3kogki,youtube.com,Information Technology (full computer course in Urdu) class 1,https://www.reddit.com/r/computerscience/comments/3kogki/information_technology_full_computer_course_in/,onlineinternetmaster,1442075938,,2,0,False,default,,,,,
81,computerscience,t5_2qj8o,2015-9-13,2015,9,13,6,3kpgzp,self.computerscience,Can someone please give me a good definition of reserved words and key words? I am confusing my self and surprisingly isn't being much help....,https://www.reddit.com/r/computerscience/comments/3kpgzp/can_someone_please_give_me_a_good_definition_of/,[deleted],1442091775,[deleted],3,0,False,default,,,,,
82,computerscience,t5_2qj8o,2015-9-13,2015,9,13,21,3krygg,self.computerscience,Brookshear: Machine Language help,https://www.reddit.com/r/computerscience/comments/3krygg/brookshear_machine_language_help/,ironwing12,1442147172,"I need a little help with understanding the writing of machine language. Im reading the book Computer Science and overview by brookshear and something is not clicking. 

Yes this is a homework question but ive changed so that i can learn and do the work myself. Im just starting to learn machine language.

Write a machine language program that starts at address 00, puts the hexadecimal value 4B into the memory location C5, puts the hexadecimal value 17 into the memory location 62, exchanges the values at locations C4 and 62, and then halts. NOTE: there is not a machine language instruction called exchange the values You will have to figure more than one machine language instruction to complete that part of the task. 


All the examples in the book a written in four bits. The first being the op-code, the second being the operand, and the last two being the data to be manipulated. 


So to store the value 4B i would use 2X4B, the X would be the register but how would i represent C5 location in that bit. I feel like there is something simple im missing, or maybe im way out in left field.

thanks for any help  ",1,1,False,self,,,,,
83,computerscience,t5_2qj8o,2015-9-14,2015,9,14,4,3ktea2,self.computerscience,Can you people please check if my C++ homework is right?,https://www.reddit.com/r/computerscience/comments/3ktea2/can_you_people_please_check_if_my_c_homework_is/,[deleted],1442171681,[deleted],17,0,False,default,,,,,
84,computerscience,t5_2qj8o,2015-9-14,2015,9,14,12,3kv6tp,self.computerscience,Jobs Without Programming?,https://www.reddit.com/r/computerscience/comments/3kv6tp/jobs_without_programming/,morthrow,1442201977,"I'm a junior CS major and MIS minor. I'm currently seeing a counselor because over the past year, I've slowly lost my patience with coding, to the point where my assignments are the worst thing ever: I have nightmares about them, and I foolishly attempted suicide (thankfully, a professor stopped me and didn't tell anyone).

At the same time, computers and technology are my passion. I love ""nerdy"" activities, and gadgets and /r/futurology are the greatest. I just can't stand coding. I do well in things like Discrete Math, Theory of Computation, etc...

My counselor suggested I ask this community about my options.

Any recommendations?",23,9,False,self,,,,,
85,computerscience,t5_2qj8o,2015-9-15,2015,9,15,5,3kyagv,self.computerscience,How should I teach people about computer science ?,https://www.reddit.com/r/computerscience/comments/3kyagv/how_should_i_teach_people_about_computer_science/,Diondre123,1442261073,"Im trying to teach a small class of students, what should  I teach them first ? PLZ help its due tomorrow .",7,3,False,self,,,,,
