,sbr,sbr_id,date,year,month,hour,day,id,domain,title,full_link,author,created,selftext,num_comments,score,over_18,thumbnail,media_provider,media_thumbnail,media_title,media_description,media_url
156,computerscience,t5_2qj8o,2017-10-16,2017,10,16,8,76mfwu,self.computerscience,Why can't people trouble shoot,https://www.reddit.com/r/computerscience/comments/76mfwu/why_cant_people_trouble_shoot/,rantyishprogrammer,1508108993,"As someone who is very into computer science, starting on 4th grade and been obsessed with it for now on to 5 years, people treat me as a trouble shooting dummy. Now I don't want advice on this but why isn't basic trouble shooting information common. I don't mind fixing more complex issues, but if the solution is to press f5, I just wasted part of my life on someone else's issue. I could sit and configure a list on the topic but often times these people have weak research skills. I mean it takes 5 seconds to look it up on google yet they claim they can not find it. Plus most of the technology community use Google for a lot of our issues, and suprise I find the solution to their problem on GOOGLE. 
Note: I am also very willing to help the elderly with technology
I think we can attribute this phenomenon too a couple things, yet of course I will miss omse, hints why I am opening up a discussion:
1. Lack of research and ""at the moment"" research
2. Parents buying kids $900 phones and can't justify a $300 dollar pc
3. Inability to problem solve with efficency
4. The closed mind causing many to not learn
Anything I missed?
I also find myself telling people to ""just look it up"" now days because in my 6th grade year my classmates took advantage of me and I spent the whole summer troubleshooting other people's computers. Although people do tend to doubt my ability to understand complexity theory and program as well as many other things. Although to be very honest, it feels nice not to spend 8 to 9 trouble shooting other people's problems for absolutely no pay and no referrals to people who can hire me in the future or open up possibilities.",2,1,False,self,,,,,
157,computerscience,t5_2qj8o,2017-10-16,2017,10,16,8,76mnjj,self.computerscience,Is there a set of bitwise operations to represent modular binary addition?,https://www.reddit.com/r/computerscience/comments/76mnjj/is_there_a_set_of_bitwise_operations_to_represent/,Ravenclaw968,1508111266,"Say I have two 32-bit base 2 numbers and I want to add them together modular 2 ^ 32. Would there be an intuitive bitwise operation using only AND, OR, XOR, et cetera to represent that operation?",4,8,False,self,,,,,
158,computerscience,t5_2qj8o,2017-10-16,2017,10,16,9,76mvo8,self.computerscience,Help with JavaScript,https://www.reddit.com/r/computerscience/comments/76mvo8/help_with_javascript/,Lostashoe,1508113651,[removed],5,3,False,default,,,,,
159,computerscience,t5_2qj8o,2017-10-16,2017,10,16,13,76o6vw,self.computerscience,The Pumping Lemma,https://www.reddit.com/r/computerscience/comments/76o6vw/the_pumping_lemma/,mathhelpimstupid,1508128483,"I'm reading Sipser's *Introduction to the Theory of Computation,* and I've come to the Pumping Lemma for regular languages. I get the basic idea, and I understand most of it. But there's one bit I want some clarification with. 

To begin with, we are trying to show that for any regular language *L,* any string *s* *L,* such that *s* is at least of length  *p,* must be such that *s = xyz* where the following conditions obtain:

1. *xy^n z**L*for all*n* 0.
2. |*y*| &gt; 0
3. |*xy*| *p*

Alright, we then proceed to prove that those conditions do indeed obtain for any string *s* *L,* such that *s* is at least of length  *p.*  What I don't quite understand is how condition (2) is shown. 

At one point, Sipser says that the reason that |*y*| &gt; 0 is that *y* ""was the part of *s* that occurred between the two different occurrences of [the repeating state *q*]."" Why is this? Why can't *y* be the empty string? 

My thoughts are that it is because this string *s* was assumed from the outset to be length at least *p,* where *p* is the number of states in the deterministic finite automaton (DFA) that accepts *L.* Now, this means that during the computation of *s,* some part of *s* must take us through the same state at least twice. Whatever this particular part of *s* is (I.e. that takes us through the same state twice), *that* part of *s* is called *y.* Now, this means that *y* is a substring that does in fact take us along a transition ""arrow"" exiting from some state *q,* a transition arrow that leads us into a loop that finally comes back around to *q* again. But *y* could *not* take us through such a sequence of transitions *if* |*y*| = 0, for then *y* would be the *empty string,* and empty strings cannot move us along *any* sequence of transitions in a DFA. Therefore, |*y*| &gt; 0.

Am I understanding this correctly, or am I lost?

Incidentally, I might have another question to ask about this, but it requires me to go into slightly more detail, and I haven't the time to do that just now.",4,13,False,self,,,,,
160,computerscience,t5_2qj8o,2017-10-16,2017,10,16,18,76pcao,notebookhyd.com,Laptop Service Centers in madhapur hyderabad,https://www.reddit.com/r/computerscience/comments/76pcao/laptop_service_centers_in_madhapur_hyderabad/,reddyvikram,1508145820,,0,1,False,default,,,,,
161,computerscience,t5_2qj8o,2017-10-16,2017,10,16,21,76qaex,medium.com,Learn the keyword `this` in js.,https://www.reddit.com/r/computerscience/comments/76qaex/learn_the_keyword_this_in_js/,danilosilvadev,1508158638,,1,1,False,default,,,,,
162,computerscience,t5_2qj8o,2017-10-16,2017,10,16,23,76qo2u,self.computerscience,Uses for an extra monitor,https://www.reddit.com/r/computerscience/comments/76qo2u/uses_for_an_extra_monitor/,edenkl8,1508162623,"Hi :)
I have recently bought a larger display for my pc and remained with a little smaller but unused monitor as a result.
What are some good uses for that monitor I can do to increase my productivity while programming?

Thank you :)",7,7,False,self,,,,,
163,computerscience,t5_2qj8o,2017-10-17,2017,10,17,1,76rlh2,self.computerscience,In which base is the following true: 9 + 7 + 6 = 20?,https://www.reddit.com/r/computerscience/comments/76rlh2/in_which_base_is_the_following_true_9_7_6_20/,JarusLetap,1508170920,[removed],5,1,False,default,,,,,
164,computerscience,t5_2qj8o,2017-10-17,2017,10,17,4,76t2v4,techhowtos.com,What is SEO?,https://www.reddit.com/r/computerscience/comments/76t2v4/what_is_seo/,artemakis,1508183355,,0,3,False,default,,,,,
165,computerscience,t5_2qj8o,2017-10-17,2017,10,17,4,76t2v5,self.computerscience,What specifically would a less intelligent person have trouble with if they were doing your job?,https://www.reddit.com/r/computerscience/comments/76t2v5/what_specifically_would_a_less_intelligent_person/,historyinthe,1508183355,,1,1,False,self,,,,,
166,computerscience,t5_2qj8o,2017-10-17,2017,10,17,5,76tkfl,theguardian.com,"WPA2 now cracked, according to Belgian researcher",https://www.reddit.com/r/computerscience/comments/76tkfl/wpa2_now_cracked_according_to_belgian_researcher/,waiting4aliens,1508187419,,3,8,False,https://b.thumbs.redditmedia.com/rF-o9dRrx4Ek3bAqVbKknqXpvflmfC4bdA_gJbHCxHg.jpg,,,,,
167,computerscience,t5_2qj8o,2017-10-17,2017,10,17,5,76tl3x,self.computerscience,Is computer science the degree for me?,https://www.reddit.com/r/computerscience/comments/76tl3x/is_computer_science_the_degree_for_me/,Sicariana,1508187579,"I am currently a freshman at Arizona State University. I declared major as Computer Science, but I'm not sure it's exactly what I want. Other degrees, like Software Engineering seem really similar.
I really like video games, and am especially interested in 3d modeling and animation. Making a game like yandere simulator would be cool. I currently use blender to model things for fun.
Any advice on a major? ",12,9,False,self,,,,,
168,computerscience,t5_2qj8o,2017-10-17,2017,10,17,9,76uuc2,i.imgur.com,Need help with computer science? Come join our discord server with over 950+ members for help!,https://www.reddit.com/r/computerscience/comments/76uuc2/need_help_with_computer_science_come_join_our/,Banqu,1508199507,,0,1,False,default,,,,,
169,computerscience,t5_2qj8o,2017-10-17,2017,10,17,9,76uuft,youtube.com,"Cyber Intelligence Briefing: Understanding the Impact of IT/OT Convergence (Bill Marion, USAF)",https://www.reddit.com/r/computerscience/comments/76uuft/cyber_intelligence_briefing_understanding_the/,bkacl_bunch,1508199541,,0,1,False,default,,,,,
170,computerscience,t5_2qj8o,2017-10-17,2017,10,17,11,76vg5i,self.computerscience,Online College/Uni questions,https://www.reddit.com/r/computerscience/comments/76vg5i/online_collegeuni_questions/,-TheCrazyYeti-,1508205780,"Before I start.. I'm sure this type of thing has been asked a billion times on this subreddit. I appologize if thats true ..

I'm a senior in HS, I've looking at my options for College/University, I live in Canada. I've been looking at Online CS colleges/Uni's. Its been hard for me to really decide what I wanna do at college/Uni, but I've been pretty good with computers my whole life, I've been pretty fascinated that you can make something starting from scratch on a computer. 

I've done some computer science courses at school, and a little bit at home. I'm not an expert or anything at all, infact I know very little on how to program.

What do you guys think about getting a Online CS degree at a University/College, is it worth it? Honestly I've checked a lot of them out and it seems that a lot of them are pricey? Also, do employers look down upon online cs degrees as opposed to a non online degree? Also any advice/recommendations are highly appreciated, thanks :)",2,2,False,self,,,,,
171,computerscience,t5_2qj8o,2017-10-17,2017,10,17,12,76vskd,self.computerscience,"[Comp Sci] Whats the relationship between Net Neutrality and tcp,ip address, and protocols?",https://www.reddit.com/r/computerscience/comments/76vskd/comp_sci_whats_the_relationship_between_net/,pandapooper9,1508209537,I watched several videos but Im still kind of lost. Please help,1,2,False,self,,,,,
172,computerscience,t5_2qj8o,2017-10-17,2017,10,17,14,76wi8b,self.computerscience,How do you think like a programmer?,https://www.reddit.com/r/computerscience/comments/76wi8b/how_do_you_think_like_a_programmer/,FrogsInMyPants,1508218237,"So Im a second year college student and I just finished taking my first midterm in Computer Science I (which is the equivalent of AP Computer Science A but more complicated). It didnt end up so well because I cant write programs to save my life. The exam was pretty straightforward until I got up to the coding questions and my mind went completely blank. The questions were really wordy and I can never seem to be able to apply what I learn to write code. I cant think of an algorithm or create proper logic to write a program under timed pressure. When I usually code without any time constraints, I usually take quite a while to understand the question and think of an algorithm. But this is a test and I cant just take my sweet time. 

So ultimately my question is, what do I need to do to figure out how to write programs when taking a test? Ive been practicing but I always seem to forget how to write the program/come up with an algorithm a day later. I cant think like a programmer because this is unrelated to any course Ive taken. Ive taken a myriad amount of courses in college and high school (math, science, humanities) but none of them are related to computer science in terms of thinking. Clearly, somethings just not clicking in my head because there are others whove never programmed before and they are able to learn and apply everything so efficiently. 

Btw, this is my second time taking this class (I didnt really try the first time). Can someone please explain to me what Im doing wrong and what I can do to be able to write programs when taking a paper-based exam? I understand the syntax and usages of Java but I cant seem to come up with an algorithm and apply my knowledge to write a program.

Edit: But some topics that I can never seem to get are loops/nested loops and arrays/multidimensional arrays. ",34,36,False,self,,,,,
173,computerscience,t5_2qj8o,2017-10-17,2017,10,17,16,76wz08,self.computerscience,Future after BSc in CS,https://www.reddit.com/r/computerscience/comments/76wz08/future_after_bsc_in_cs/,EnigmaticZee,1508225033,"I just graduated with a Bachelor's degree in CS but I still don't feel like I am fit for programming. I feel little comfortable with Web Development side but still not fully comfortable. Anyways, I want to know what Advanced Diploma or Masters stream should I chose that is still relevant to IT but not related to programming and also has high paying jobs within them. So, what should I pursue my career in which is still relevant to IT but not requiring me to write programs. An example would be Networking.

Note: When I say high paying job, I don't mean that I will get a high paying job on day 1. By high paying, I meant just like programming has high paying jobs.",2,2,False,self,,,,,
174,computerscience,t5_2qj8o,2017-10-17,2017,10,17,19,76xovk,i.redd.it,Best Web Designing Training Institute in Udaipur,https://www.reddit.com/r/computerscience/comments/76xovk/best_web_designing_training_institute_in_udaipur/,RAHULPURBIYA,1508236596,,0,0,False,default,,,,,
175,computerscience,t5_2qj8o,2017-10-17,2017,10,17,21,76y6vt,learning.maxtech4u.com,Learning &amp; Experience - Come with us to learn and share your experience,https://www.reddit.com/r/computerscience/comments/76y6vt/learning_experience_come_with_us_to_learn_and/,munishmaxtech,1508243210,,0,1,False,default,,,,,
176,computerscience,t5_2qj8o,2017-10-17,2017,10,17,22,76yk49,self.computerscience,Is the C language dying?,https://www.reddit.com/r/computerscience/comments/76yk49/is_the_c_language_dying/,nice_remark,1508247179,"This question has arisen when doing research for school. As some background info, my work (grad school research) is trying to prevent software attacks targeting vulnerabilities in the C language using hardware modifications. 

The more I read about the relevancy of C, the more I get concerned whether this topic is of particular interest going forward. At its inception, C was a ground-breaking language and has stood the test of time...so far. With more modern languages providing similar abilities, and are type-safe and flexible than C, does it still have a place in modern day computing?

Legacy code is a big deal, and a focal point of my research, but are new products coming out that mainly deal with C? I understand that operating systems and embedded systems both rely on C, but is that going to still be the case in 10-15 years? I understand that nobody can predict the future, but putting all my chips in the security of C programs might be a bad idea going forward.

Lastly, I was going to crosspost this to /r/ECE to get their take on it, but wanted to see what the CS community had for thoughts on this question, as it relates to both ECE and CS disciplines. 

Thank you.",9,6,False,self,,,,,
177,computerscience,t5_2qj8o,2017-10-17,2017,10,17,23,76yup0,boolr.me,BOOLR | A digital logic simulator,https://www.reddit.com/r/computerscience/comments/76yup0/boolr_a_digital_logic_simulator/,Icy207,1508250107,,2,26,False,https://b.thumbs.redditmedia.com/JU7zCRXiJo9Az-AOttOryHasdyvJwiGvdNrFy61rjsA.jpg,,,,,
178,computerscience,t5_2qj8o,2017-10-18,2017,10,18,0,76z3ce,learning.maxtech4u.com,Vehicular Ad-hoc Network (VANET),https://www.reddit.com/r/computerscience/comments/76z3ce/vehicular_adhoc_network_vanet/,munishmaxtech,1508252559,,1,1,False,default,,,,,
179,computerscience,t5_2qj8o,2017-10-18,2017,10,18,1,76zsy6,self.computerscience,What would you write if you were asked to write a paragraph on why computer science interests you.,https://www.reddit.com/r/computerscience/comments/76zsy6/what_would_you_write_if_you_were_asked_to_write_a/,5harkd0g,1508258638,"I'm applying for an undergraduate compsci course.

Excluding clich statements such as ""I have been programming since I was a child"".

Some ideas: maybe talking about any fields that seriously interest you, or whether some life changing event has sparked the interest. Or maybe you read something interesting on the news a few years back and wanted to learn more about it at a university level.

I would love to hear any replies.",3,0,False,self,,,,,
180,computerscience,t5_2qj8o,2017-10-18,2017,10,18,1,76zwmc,strawpoll.com,Do you believe that computer architecture education should be more hands on?,https://www.reddit.com/r/computerscience/comments/76zwmc/do_you_believe_that_computer_architecture/,Coolgum15,1508259521,,4,26,False,https://b.thumbs.redditmedia.com/Du3ttzHeN3idrV6aew9L-BS3d59UAHzoX88foI-42tk.jpg,,,,,
181,computerscience,t5_2qj8o,2017-10-18,2017,10,18,3,770pre,self.computerscience,Best web framework for an irrigation system maintenance website?,https://www.reddit.com/r/computerscience/comments/770pre/best_web_framework_for_an_irrigation_system/,RufflesTheMonkey,1508266335,"I am in a group in senior design in university and we are going to be developing a software system which will receive packets from a raspberry pi with sensor information regarding an irrigation system. We want to display information about the status of the sensors, as well as the ability to control the irrigation system through the web application. We will need to implement SSO authentication that will work with an existing system as well. We do not know the full requirements yet of the application as we will be having a meeting with our stakeholders in the next few days (though we do know the basic requirements as listed here), so we want to have as many realistic capabilities as possible. We are looking for a framework that can handle this sort of application, but one that is reasonably easy to learn and use. We do not have a lot of experience with frameworks, so we wanted to ask the experts (Some ideas we had were Meteor JS and Laravel). Thanks.",1,2,False,self,,,,,
182,computerscience,t5_2qj8o,2017-10-18,2017,10,18,4,770zr4,self.computerscience,Best CS Schools in the Philippines,https://www.reddit.com/r/computerscience/comments/770zr4/best_cs_schools_in_the_philippines/,csmathenthusiast,1508268711,What are the best CS schools in the Philippines that has more focus on theoretical CS than its practical side?,0,0,False,self,,,,,
183,computerscience,t5_2qj8o,2017-10-18,2017,10,18,5,771goz,self.computerscience,How do I learn computer science?,https://www.reddit.com/r/computerscience/comments/771goz/how_do_i_learn_computer_science/,spectredotjpg,1508272727,"https://teachyourselfcs.com

Did any of you learn from this? How did it go? What did you use if not this? I want to avoid the cost and lack of autonomy of college.",2,4,False,self,,,,,
184,computerscience,t5_2qj8o,2017-10-18,2017,10,18,5,771l1a,self.computerscience,College or Boot Camp,https://www.reddit.com/r/computerscience/comments/771l1a/college_or_boot_camp/,lowkeysam11,1508273785,"I'm currently in community college, but I'd transfer to a university to get my Bachelors in Computer Science. However, people have said that this route is long and expensive. I've heard that ""coding boot camps"" are expensive but effective. What do you guys recommend? Personal experience would help too. ",9,8,False,self,,,,,
185,computerscience,t5_2qj8o,2017-10-18,2017,10,18,7,77214t,self.computerscience,Most efficient algorithms used to calculate the stoppage times for the hailstone sequence/collatz conjecture?,https://www.reddit.com/r/computerscience/comments/77214t/most_efficient_algorithms_used_to_calculate_the/,Ada__Lovelace__,1508277748,"Well recently I was looking at this problem, and i'm creating an algorithm which can compute the stoppage time for the given input. I would like to take a look to other implementations. 

I'm looking at the original problem the 3n+1 conjecture and not the shortcut (3n + 1)/2. 

Thanks in advance :)

*Edit: Stoppage time = Total numbers in the sequence.",5,4,False,self,,,,,
186,computerscience,t5_2qj8o,2017-10-18,2017,10,18,7,77260d,self.computerscience,Fortran for Beginners,https://www.reddit.com/r/computerscience/comments/77260d/fortran_for_beginners/,nodog28,1508279023,"Does anyone know of a good online site to use to learn Fortran? I am doing research for a professor and need to learn from scratch, having only using Matlab prior to this. ",3,5,False,self,,,,,
187,computerscience,t5_2qj8o,2017-10-18,2017,10,18,9,772rrg,discord.gg,Need help with computer science? Come join our discord server with 980+ members!,https://www.reddit.com/r/computerscience/comments/772rrg/need_help_with_computer_science_come_join_our/,Banqu,1508284935,,0,1,False,default,,,,,
188,computerscience,t5_2qj8o,2017-10-18,2017,10,18,10,773a8i,self.computerscience,Looking for help online,https://www.reddit.com/r/computerscience/comments/773a8i/looking_for_help_online/,furhious,1508289929,I just started college this year and am taking an introduction to computer science. We learn java and have many projects/labs. The first 5 or so labs were pretty easy and didn't require me to look online for help. With the 6th lab we started using loops and I've been having a tough time with them and have started to look online for help with my labs. We also have a new project which requires us to create 4 programs based specific questions. I've started looking online for help and was wondering is it wrong for me to do this? The beginning topics came pretty naturally but I've been struggling with the loop section. Not sure if I should look online for help or not?,3,3,False,self,,,,,
189,computerscience,t5_2qj8o,2017-10-18,2017,10,18,18,775d4o,self.computerscience,Question has me stumped,https://www.reddit.com/r/computerscience/comments/775d4o/question_has_me_stumped/,shmaud23,1508317226,"Hi i was hoping someone can help me with a question my lecturer posted to me.

1.Consider a personal computer with a Pentium-class CPU (64-bit word size) running at 1Ghz clock speed. Assuming it ran continuously at peak performance, how long would it take this PC to read (and process) all of the data in a 1 petabyte Data Warehouse?


I was told the amswer is 2^17 seconds (131072 seconds/around 36.4 hours)

How do i work this out?

Thanks...",17,12,False,self,,,,,
190,computerscience,t5_2qj8o,2017-10-18,2017,10,18,20,775w6b,youtube.com,30 Minutes C++ Tutorial - Start Programming from scratch:,https://www.reddit.com/r/computerscience/comments/775w6b/30_minutes_c_tutorial_start_programming_from/,IloveProgramming23,1508325591,,0,17,False,default,,,,,
191,computerscience,t5_2qj8o,2017-10-18,2017,10,18,21,776969,ajehcomputercenter.com.ng,Learn Microsoft Word In 2 weeks Section 1 (Basic),https://www.reddit.com/r/computerscience/comments/776969/learn_microsoft_word_in_2_weeks_section_1_basic/,meshack_eres,1508330312,,0,1,False,default,,,,,
192,computerscience,t5_2qj8o,2017-10-19,2017,10,19,2,777zt2,self.computerscience,For a degree in computer science,https://www.reddit.com/r/computerscience/comments/777zt2/for_a_degree_in_computer_science/,Casey0923,1508346434,"Hi. So I'm a high school senior applying to colleges. For those that have gotten a degree in computer science, do you need to go into college with some prior experience or do they teach from the ground up (as in the very basics). I know every little and only recently have started teaching my self extremely simply stuff.

Thanks",11,10,False,self,,,,,
193,computerscience,t5_2qj8o,2017-10-19,2017,10,19,2,7789qz,imgur.com,My attempt on IGCSE (0478) Computer Science. Pass or Fail?,https://www.reddit.com/r/computerscience/comments/7789qz/my_attempt_on_igcse_0478_computer_science_pass_or/,suttiwit,1508348804,,4,16,False,https://b.thumbs.redditmedia.com/PW8h0ke0inQWoPh0cdaeEpmYSizPWH6q3haiPU-HI9c.jpg,,,,,
194,computerscience,t5_2qj8o,2017-10-19,2017,10,19,2,778bpq,self.computerscience,Interview a professional,https://www.reddit.com/r/computerscience/comments/778bpq/interview_a_professional/,BoundzHD,1508349289,"Currently a freshman studying CS. I have an assignment where I have to interview a professional in CS. It's essentially just a series of questions that need to be answered by someone in the field. Would any of you who are currently in the field be willing to allow me to ""interview"" you via PM? Thanks!",1,4,False,self,,,,,
195,computerscience,t5_2qj8o,2017-10-19,2017,10,19,4,77906r,self.computerscience,Computer science or engineering?,https://www.reddit.com/r/computerscience/comments/77906r/computer_science_or_engineering/,Asteroidforest,1508355096,Im considering going to major in computer science or engineering. Im not too great at math but I am super interested in computers so Im not sure what to do. I want to go to Colorado State and Im leaning towards computer science but whatever is less math heavy is better. ,9,9,False,self,,,,,
196,computerscience,t5_2qj8o,2017-10-19,2017,10,19,4,7794dp,self.computerscience,Need Web Development Textbook Suggestions,https://www.reddit.com/r/computerscience/comments/7794dp/need_web_development_textbook_suggestions/,Surely_not_Nate,1508356102,"Hello!

Next semester I am hoping to do an independent study for credit in Web Development as my school doesn't have any courses in the field. I'm hoping to learn the basics of HTML, CSS, Javascript, etc. I'd also take suggestions for other topics to study along with these. Does anyone have a suggestion for a textbook I could use for this? My school has a few but they are bit outdated (2010) 

 Thanks!",3,5,False,self,,,,,
