,sbr,sbr_id,date,year,month,hour,day,id,domain,title,full_link,author,created,selftext,num_comments,score,over_18,thumbnail,media_provider,media_thumbnail,media_title,media_description,media_url
0,computerscience,t5_2qj8o,2017-10-1,2017,10,1,9,73ihsu,self.computerscience,How Does The iPhone Compress Messages?,https://www.reddit.com/r/computerscience/comments/73ihsu/how_does_the_iphone_compress_messages/,entrasonics,1506816544,"Just as the title says, Im wondering how the iPhone compresses text messages when theyre being displayed as a notification banner with the ellipses following it. 

Some context:

https://youtu.be/hJLMSllzoLA",2,14,False,self,,,,,
1,computerscience,t5_2qj8o,2017-10-1,2017,10,1,11,73j4if,self.computerscience,Does anyone here develop geographical software? Would you be willing to give some advice to a final year CS student?,https://www.reddit.com/r/computerscience/comments/73j4if/does_anyone_here_develop_geographical_software/,Allegiance_to_Mhysa,1506824214,"I will be graduating with a CS degree this summer. I recently completed an internship with a focus on full stack web development. However, I have a very strong interest in geography and maps and feel I would love to focus my career in that direction. I have one free elective left, and when I spoke to my advisor about my interest, she recommended I take a GIS course to familiarize myself with all of the software and was extremely enthusiastic about just how many industries use geographic software and for so many purposes. I will be trying to get into that course if I can. Until then, I've started the Coursera UC-Davis Intro to GIS course, have downloaded ArcGIS, and am going through the interactive ArcGIS book. My favorite courses I've taken so far have been Numerical Methods, Database Design, and Adv. Data Structures and Algorithms. It seems like a lot of that stuff is used if I go this direction.

So, my question is, what sorts of jobs should I expect and in what industries? What can I be doing to focus on that path? What CS skills are needed in these sorts of jobs? Any other advice you can give me? Thank you so much for your time and your input.",0,1,False,self,,,,,
2,computerscience,t5_2qj8o,2017-10-1,2017,10,1,12,73jef6,self.computerscience,Is this a good book?,https://www.reddit.com/r/computerscience/comments/73jef6/is_this_a_good_book/,Benaxle,1506827760,"""The Algorithm Design Manual"" - it looks like a fun book, is there a better one out there? I'm following a course but I feel like it might not be a bad idea to read on the side.",5,8,False,self,,,,,
3,computerscience,t5_2qj8o,2017-10-1,2017,10,1,12,73jji4,self.computerscience,[Need Help] Emergency Info Hotspot idea.,https://www.reddit.com/r/computerscience/comments/73jji4/need_help_emergency_info_hotspot_idea/,satcomwilcox,1506829631,"I had an idea while looking at some pictures of people wandering around trying to use their phones during the recent damage in Puerto Rico. My idea was as follows:

In an emergency: Establish an opensource, battery and solar powered, wifi hotspot. Not to link to the internet as that is costly and difficult to maintain, but to display a website that disseminates useful information. 

It would utilize a redirect of some sort, similar to how the hotel's networks take whatever website you request and redirect it to their splash/registration page if you haven't already logged in. That page could host information that could be useful in an emergency. Like a local area map showing where the Red Cross is in your area, a schedule of when and where food and water deliveries are happening, where that fresh water spring that not everyone knows about is, who to see to get contacts out, what office is handling what etc... Kind of like an Emergency FAQ.

I am a fairly nerdy guy, but this is past my skill level. I am a wintel guy of limited skill and I don't want to invest much REAL money in it so ServerR8, etc are out. At first I was thinking of tinkering with a little linux box running a DHCP, DNS, and a simple webhost. but that became pretty daunting as I don't really know anything about it other than a couple of slackware boxes. Besides that the goal is simple, small footprint, small energy consumption.

Then I remembered re-flashing my wifi router at one point a few years ago with some software so I looked it up. Now I am at DD-WRT, but I'm not sure that is the cleanest and easiest thing to implement.

So far I have a hazy image of a Linksys or something running DD-WRT with some configuration of NOCAT or something. I would like it to host a simple HTML page with a couple of embedded maps etc. No outside link and no matter what you do it always ends up back at that page. I don't want someone to try to go to Yahoo and then not be able to find their way back. 

I think I have an old wrt54g in the basement someplace to play with, but if not ~60 at amazon is cool for a Proof of Concept. 

Goals:
A single box, implemented or supplemented with power (batt &amp; solar) supply considerations. Does not need to cover a huge area, I'll possibly do an external elevated antenna, but I'll worry about that later; RF isn't my problem. 

Ease of upkeep after initial installation. Some of the Linksys boxes have USB, could updating be as simple as keeping the same HTML file name and swapping out memory sticks that have been updated off site? 

Needs:
Some guidance on implementation. Ideally someone could point to a walkthrough or something and say stop at step 9, then put your HTML file on a memory stick and name it index.html, put x:/index.html in this field on this screen and you are done. ",3,5,False,self,,,,,
4,computerscience,t5_2qj8o,2017-10-1,2017,10,1,12,73jjm5,self.computerscience,My brain hurts from not knowing anything,https://www.reddit.com/r/computerscience/comments/73jjm5/my_brain_hurts_from_not_knowing_anything/,JaiX1234,1506829675,"Everything is always this dead end road and I'm pounding and pounding every possible solution in my head. I'm taking apart ideas and putting them back together in numerous different ways. I've taken that long break to get a fresh look at it at in the morning. I've read the 20th forum post, watched the 10th video and continue to sit here contemplating how I am not able to find a solution...

This Data Structure and Algorithm class I'm taking is slowly destroying what I thought I use to know as a CS major. Coming into it I knew how tough this class was, as I am doing undergrad research with the CS chair who also teaches this class, our school puts this course as one of our toughest classes with a 75% fail rate. It's only been one month into the semester but I continue to feel like I just code random jibberish I don't even understand, what I thought I mastered before feels like a fraction of what I never knew...  

My TA asked me today if I really wanted to do this for the rest of my life. I wonder what he meant...by that...  

I don't know whats going on with this class, I feel like I can't put anything I've learned from my previous Java: Object-oriented classes to use with ADT, collections, linked lists....I'm just looking at it and don't have a single clue how to implement any of these methods...I can't understand the logic and more advanced coding styles of the grad students who are making the test cases, I don't understand how to debug assertions, and this list goes on...  

Is this normal? is it this big of a jump for data/algor?

",4,1,False,self,,,,,
5,computerscience,t5_2qj8o,2017-10-1,2017,10,1,21,73lgww,youtube.com,5 key differences between Computer Science and Computer Engineering How to Choose the Right Major,https://www.reddit.com/r/computerscience/comments/73lgww/5_key_differences_between_computer_science_and/,Elintia64,1506862535,,0,5,False,default,,,,,
6,computerscience,t5_2qj8o,2017-10-2,2017,10,2,0,73maz4,self.computerscience,Discord for Information Systems majors in college,https://www.reddit.com/r/computerscience/comments/73maz4/discord_for_information_systems_majors_in_college/,Xilc,1506872348,"If youre an Information Systems major in college, feel free to join this discord chat. Doesnt matter where you go, and you can have just recently graduated. You are more than welcome to share this link with any of your peers as well. Literally just started it today. Great networking opportunity to meet others who will be in your career field but not necessarily in your own community. I have also created a datascience tab in the channel for specific questions and discussion of datasciencey stuff :) I hope to create a thriving community of IS majors and data enthusiasts alike. 


https://discord.gg/WUPDKA",3,13,False,self,,,,,
7,computerscience,t5_2qj8o,2017-10-2,2017,10,2,2,73n1ve,youtube.com,Future Trends of Computer Sciences In Next Five Years [2017],https://www.reddit.com/r/computerscience/comments/73n1ve/future_trends_of_computer_sciences_in_next_five/,mueen123,1506879686,,0,1,False,default,,,,,
8,computerscience,t5_2qj8o,2017-10-2,2017,10,2,4,73nlwh,self.computerscience,Help with understanding the half-space fill function,https://www.reddit.com/r/computerscience/comments/73nlwh/help_with_understanding_the_halfspace_fill/,Darkbinder,1506885039,"I'm trying to fill multiple triangles, so i found a link where they show and somewhat explain how the half-space function works but i dont really understand what it does. The link is [here](http://forum.devmaster.net/t/advanced-rasterization/6145#_blank). I get that it checks 3 lines in a triangle and checks if its positive or negative and so on, but i dont really know what the equations does, or where the function starts to fill the triangles. Im really want to understand how this function work instead of just copy pasting it.",1,2,False,self,,,,,
9,computerscience,t5_2qj8o,2017-10-2,2017,10,2,7,73oy8s,self.computerscience,Can't figure out why this won't run properly?,https://www.reddit.com/r/computerscience/comments/73oy8s/cant_figure_out_why_this_wont_run_properly/,Brutal_Boost,1506898382,"I am in my first semester as a CE student. We are currently using C++. I have been trying to figure this out but I just can't figure out why it won't execute properly. Here is the code: https://imgur.com/a/Hpz2M

The loop will run but than when I press -1 to exit the loop it skips the if else statement?",6,4,False,self,,,,,
10,computerscience,t5_2qj8o,2017-10-2,2017,10,2,8,73p4ei,gsa.gov,We apologize for the inconvenience...,https://www.reddit.com/r/computerscience/comments/73p4ei/we_apologize_for_the_inconvenience/,yabbaman1,1506900214,,3,0,False,default,,,,,
11,computerscience,t5_2qj8o,2017-10-2,2017,10,2,8,73pabw,self.computerscience,Showing an equation is equal to big theta,https://www.reddit.com/r/computerscience/comments/73pabw/showing_an_equation_is_equal_to_big_theta/,xMxTx,1506902043,"I've been working on this problem for hours.
I have to show that n^3 - 3n^2 - n +1 = theta(n^3)

I'm trying to prove it by using the definition
im using..
c1g(n) &lt;= f(n) &lt;= c2g(n)

i can prove big oh fine but when i try to solve for big omega, i keep on getting a negative value which throws the whole proof off.
can someone please tell me where im going wrong or point me towards the right direction?

thank you guys
",6,3,False,self,,,,,
12,computerscience,t5_2qj8o,2017-10-2,2017,10,2,15,73r2sl,self.computerscience,Survived my first week of programming,https://www.reddit.com/r/computerscience/comments/73r2sl/survived_my_first_week_of_programming/,zemorah,1506924333,"No question, just want to share happy news and maybe some encouragement for anyone who might be in my spot some day. 

I just started my second year as a CS major but so far have mainly focused on math, science, and intro CS classes. Im getting into the more serious classes now and finished my first week of C++ with almost no programming experience. I know its just one week, but small victories feel good too. 

I read every word of the assigned reading, viewed every slide, watched every lecture, and worked through almost every example from the book. (Recommendation to beginners: Read every word! Everything matters.) We started with 2 simple programs, which gave me some trouble, but I finally finished them earlier today. The experience was frustrating but very very satisfying. 

Im feeling pretty good about my classes. Thanks to everyone whos answered my previous CS questions. And special thanks to the user who helped me with discrete math. Have a good night everyone.

",13,57,False,self,,,,,
13,computerscience,t5_2qj8o,2017-10-3,2017,10,3,0,73tkyq,self.computerscience,C code issue? Any advice?,https://www.reddit.com/r/computerscience/comments/73tkyq/c_code_issue_any_advice/,AgentNoob542,1506959188,[removed],0,0,False,default,,,,,
14,computerscience,t5_2qj8o,2017-10-3,2017,10,3,2,73udb9,self.computerscience,Online Computer Science Courses for Transferable Credit?,https://www.reddit.com/r/computerscience/comments/73udb9/online_computer_science_courses_for_transferable/,Anglerte,1506966388,Due to unfortunate circumstances I now have a gap semester before transferring to University. Where can I take computer science classes online for transferable college credit? Other than community colleges,3,5,False,self,,,,,
15,computerscience,t5_2qj8o,2017-10-3,2017,10,3,3,73uitn,self.computerscience,Mac Specs for CS Program,https://www.reddit.com/r/computerscience/comments/73uitn/mac_specs_for_cs_program/,ericalyn9,1506967739,"I am about to head to school for Computer Science and I'm trying to figure out the best computer to do so. I am leaning more towards a MacBook Pro. Would 16GB of RAM, 256 GB of storage and an i5 processor be okay? Or should I upgrade any of them...I'm looking at the i7. ",5,1,False,self,,,,,
16,computerscience,t5_2qj8o,2017-10-3,2017,10,3,8,73wkd9,youtu.be,Amazing Techincal History from [1995] : Scsi Drive 500 MB,https://www.reddit.com/r/computerscience/comments/73wkd9/amazing_techincal_history_from_1995_scsi_drive/,MarkMax88,1506986448,,0,1,False,default,,,,,
17,computerscience,t5_2qj8o,2017-10-3,2017,10,3,9,73wurx,self.computerscience,Any ideas for a computer science related science fair project?,https://www.reddit.com/r/computerscience/comments/73wurx/any_ideas_for_a_computer_science_related_science/,Jack_Big_Rigglester,1506989517,"I am currently trying to find an idea for my science fair project and I was hoping that I could do something computer science related. It would be nice to base my research topic off of one of you guys suggestions. I own a laptop and phone of my own, but I do ask that the suggestions do not involve me taking apart these devices. I am familiar with the basics of a few different coding languages and I would be willing to learn more about these, but due to time and schedule constraints I ask that if there is coding involved it is not too extensive and complicated. That being said, any advice is useful to me. Thank you! ",9,5,False,self,,,,,
18,computerscience,t5_2qj8o,2017-10-3,2017,10,3,11,73xp5s,self.computerscience,Project help PLZ,https://www.reddit.com/r/computerscience/comments/73xp5s/project_help_plz/,Andyive,1506998936,[removed],0,1,False,default,,,,,
19,computerscience,t5_2qj8o,2017-10-3,2017,10,3,14,73yh90,self.computerscience,Which language should I start learning? Future software engineer looking to start a new career.,https://www.reddit.com/r/computerscience/comments/73yh90/which_language_should_i_start_learning_future/,HonestOpinion650,1507008900,"About me: 24 years old, Lives between san francisco and san jose. Wants my chances of getting hired to be super high, I would also like to program from home some day as I love to travel. But a long term job is what I'm after first... So, I have zero programming experience .  Now my questions are,

What would be a good programming language to start learning first?

Where would be my best bet at learning it? College?Certification prgm? Online prgm? Reading your book recommendation?

I have a lot of free time and a powerful laptop. I would love to start programming for pay in as a little as 3 months if that could be done.
",8,3,False,self,,,,,
20,computerscience,t5_2qj8o,2017-10-3,2017,10,3,18,73z80y,self.computerscience,"I want to learn new skills outside of university curriculum, what do you recommend?",https://www.reddit.com/r/computerscience/comments/73z80y/i_want_to_learn_new_skills_outside_of_university/,Hiromin,1507021436,"Greetings guys,

Im a first year in CS major, but I do have prior knowledge about the basics of Pascal, C++ and Python, so the load this semester have been rather easy, and thus I wish to study on my own to deepen my skills and knowledge, specially that I am aware that university doesnt teach you everything, and the work place is different than academia.

We are studying C at university right now.

What would you recommend me to do? Im thinking maybe I should be continuing with C++ and learning OOP? (which well do next year). Or maybe I try contributing to some open source projects on GitHub? But I am afraid I dont have the level to do that yet. Or maybe I learn another language? (java or JS or another suggestion?).

Im kinda at a loss at what would help me build a more solid education right now, so I wanted to ask people with prior experience in the industry.

As a note (in case it matters), I want to specialize in Software Engineering later on.

And thank you.",8,1,False,self,,,,,
21,computerscience,t5_2qj8o,2017-10-3,2017,10,3,20,73ztdy,self.computerscience,Trasfering my Computer as safe as possible through Bus,https://www.reddit.com/r/computerscience/comments/73ztdy/trasfering_my_computer_as_safe_as_possible/,Ereomiru,1507030682,"So I go to study away from my house and I'll take a bus to go to the place I'll stay while studying, I would like to take my computer with me plus the suitcase with the clothes and all the necessity that I will need as long as I am in the new place. My question is how can I transfer with all of this in the best way and as inappropriate as possible?(pc,monitor,clothes are my concern)
Thanks for reading and all the replies in advance :)",14,1,False,self,,,,,
22,computerscience,t5_2qj8o,2017-10-3,2017,10,3,23,740kuv,self.computerscience,Worried about starting my CS degree,https://www.reddit.com/r/computerscience/comments/740kuv/worried_about_starting_my_cs_degree/,DanNyan,1507039408,"Hi, I'll keep this short and sweet but pretty much I'm now in my first week of doing computer science and I'm a little bit worried that I'm going to fail miserably. I didn't take maths at an advanced level prior to my course and already we're being taught (and examined) on maths related content. I'm certainly willing to work towards improving on the maths side, but I'm worried about how much this will hinder me over the course of my degree.

 So my main question is: should I already be working on improving my maths to higher levels (I don't really know where to start though) or will I most likely be taught the advanced maths in such a way where no prior knowledge will have been required? 

To add on to this, if I'm really fucked because of my lack of mathematical knowledge, would software development or 'computing' on it's own be a better degree to try and switch to? I know that programming is what I want to do but I haven't decided on a career yet. 

TL;DR how much is my lack of maths going to hinder me throughout the course of my CS batchelors degree?

Thanks very much :) ",7,5,False,self,,,,,
23,computerscience,t5_2qj8o,2017-10-3,2017,10,3,23,740r49,self.computerscience,My understanding so far [x-post],https://www.reddit.com/r/computerscience/comments/740r49/my_understanding_so_far_xpost/,Steven_Hedberg,1507041018,"This is my theory, or more like a general outline, of how programming (or software engineering) knowledge can be broken down into three categories:

* languages and frameworks: you can imagine it as a tree where each language can have multiple frameworks (i.e java -&gt; struts, spring, hibernate, javascript -&gt; jquery, angular)

* concepts: these are language independent although some may be applicable to only 1 language or framework (i.e design patterns, software life cycles, readability, truthiness [afaik only applies to javascript])

* tools: this is software that helps you write, debug and deploy code such as IDEs, web-servers, debuggers etc.

You can understand concepts and how to use tools, but if you don't know a concrete language or framework you won't be able to implement anything. Similarly,
you can know a language but if you don't know the concepts or tools your software will probably be shit.


So am I missing something important here, or is that pretty much all there is to it? [Someone mentioned project management as a category as well; which is true, but I'm focusing on the technical aspects so far].",9,1,False,self,,,,,
24,computerscience,t5_2qj8o,2017-10-4,2017,10,4,0,741a1d,self.computerscience,Is this career worth taking a loan out for school?,https://www.reddit.com/r/computerscience/comments/741a1d/is_this_career_worth_taking_a_loan_out_for_school/,Brutal_Boost,1507045913,"I am currently in my 4th semester of school, first as a computer engineer major. My previous 3 where all business major stuff so essentially Im starting from scratch because I had no advisor help and wasted a lot of my time (I wouldnt say completely wasted because I still learned a lot of valuable things). 
    Basically right now Im working 30 hours a week and taking 15 credits. As of right now I have 0 free time, that on its own sucks. The worst thing is I still am not getting all my work done. I am someone who takes a lot of time to study it but once I get it its there for good. This on its own is bad being there is a lot of material I am missing and falling behind on. 
     Not only am I not learning everything I should but I am starting to get serious health issues. I am only 20 (almost 21) and I already have a bulging disk in my back causing it to pinch my sciatic nerve and cause extreme pain. The main reason for this is because I am constantly sitting. I am sitting at work, in class, and at home while studying. One of the best ways to fix my back without doing surgery is lots of exercising which I really dont have the time to do. 
      I never wanted to take our student loans but I am starting to think thats the best route. I am extremely good with money and know how to use it responsibly. My biggest fear is not being able to afford my bills and go late even just one month. So it scares the hell out of me to go take out a bunch of money in loans and not be able to find a job 6 months after graduating and not be able to pay my loans back. Schooling costs alone arent that bad but its the living expenses that add up. I would estimate it would cost me between $50,000-$70,000 to get my 4 year degree.
        My biggest fear is taking that $70k in loans (which I doubt it will be thats just the high side to be safe) would be around $777 a month in payments and if I dont get a CS or CE related job I dont think I would be able to afford this. I know this isnt a personal finance reddit or anything but I figured I would come here since CS and CE majors tend to earn more than most other 4year degrees. 
       Has anyone went this route and had it pay off? I dont want to take less of a coarse load because the extra money I could make in the 2 or 3 extra years it takes me to graduate far our weighs any interest I would be accruing. For example I make around $25,000 a year and according to my engineering book CE students make around $70,000 a year out of college thats a extra $45k a year. Thats $90k I lost out on if it takes 2 extra years and $135k if its a extra 3. There is no way interest will be that much not to mention I will pay the loan off before the 10 years.
         Sorry this has kind of turned into a rant Ive just been extremely stressed about this lately. Thanks for reading!",14,5,False,self,,,,,
25,computerscience,t5_2qj8o,2017-10-4,2017,10,4,0,741aeu,self.computerscience,How do you normalize data?,https://www.reddit.com/r/computerscience/comments/741aeu/how_do_you_normalize_data/,squid3piece,1507046011,"Im taking a computer organization course and Im stumped on a homework question. The question has a data table with a Reference machine,  an A machine, and a B machine.  The table shows 3 benchmarks for all of the machines. Then it ask that I present the results in a normalized form and provide benchmarks for machine A and B. I dont really know what steps to take to put them in normalized form. Any ideas? ",3,3,False,self,,,,,
26,computerscience,t5_2qj8o,2017-10-4,2017,10,4,1,741fgt,self.computerscience,Ideal jobs,https://www.reddit.com/r/computerscience/comments/741fgt/ideal_jobs/,twintowersrubble,1507047206,"What are some jobs for computer engineer majors who are not very proficient at programming so therefore cannot be a full fledged software developer, but are competent at it?",2,4,False,self,,,,,
27,computerscience,t5_2qj8o,2017-10-4,2017,10,4,2,741su1,news.mit.edu,Bug-repair system learns from example,https://www.reddit.com/r/computerscience/comments/741su1/bugrepair_system_learns_from_example/,Chipdoc,1507050453,,2,11,False,https://b.thumbs.redditmedia.com/dpG8TPi3AN4_uC6ZrZ4GOJoUjPo6qVRdqL9iV1Xocto.jpg,,,,,
28,computerscience,t5_2qj8o,2017-10-4,2017,10,4,2,741tsu,self.computerscience,What can I do to set myself apart from the rest?,https://www.reddit.com/r/computerscience/comments/741tsu/what_can_i_do_to_set_myself_apart_from_the_rest/,ID_Buyer,1507050678,"I'm applying to a couple internships and would like to have something that sets me apart. 

I'm thinking of starting a blog about some projects I want to do.

All help is greatly appreciated! ",19,26,False,self,,,,,
