,sbr,sbr_id,date,year,month,hour,day,id,domain,title,full_link,author,created,selftext,num_comments,score,over_18,thumbnail,media_provider,media_thumbnail,media_title,media_description,media_url
277,computerscience,t5_2qj8o,2017-10-25,2017,10,25,6,78j3t7,self.computerscience,What is the job market of Computer Science Majors in the next Ten Years?,https://www.reddit.com/r/computerscience/comments/78j3t7/what_is_the_job_market_of_computer_science_majors/,HexShadowZ,1508881569,"Is it growing? is it slowly declining? Where are the stats for this because I can't find it. I'm currently a high school junior and I'm just wondering what my chances are of landing a job in computer science in 5 to 6 years. I already know that computer science major is a good and growing market RIGHT NOW, but what about when I graduate uni in 2023? Is the market for Computer science jobs still going to be good during that period and will still be growing? Thank you. Goodbye.",3,2,False,self,,,,,
278,computerscience,t5_2qj8o,2017-10-25,2017,10,25,7,78jems,imgur.com,Sorting algorithms visualized.,https://www.reddit.com/r/computerscience/comments/78jems/sorting_algorithms_visualized/,Der_Ist,1508884359,,7,120,False,https://b.thumbs.redditmedia.com/WecT0hAC1Ef_PRJZ-2sYbo__MS9yeJcf159XZkGLORA.jpg,,,,,
279,computerscience,t5_2qj8o,2017-10-25,2017,10,25,7,78jjxm,flawlessrhetoric.com,Dynamic Programming: First Principles,https://www.reddit.com/r/computerscience/comments/78jjxm/dynamic_programming_first_principles/,oldm8Foxhound,1508885776,,0,2,False,https://b.thumbs.redditmedia.com/pGxvf3L4Y4I9fueowAwn9KCFSzZZHJaXvTKBADlCatw.jpg,,,,,
280,computerscience,t5_2qj8o,2017-10-25,2017,10,25,8,78jwgt,self.computerscience,What should I study/learn in order to be able to do this personal project? (Simulation stuff),https://www.reddit.com/r/computerscience/comments/78jwgt/what_should_i_studylearn_in_order_to_be_able_to/,KingBoy123,1508889201,"I'm doing a personal side project right now where I simulate an 82-game NBA season. There's 30 teams each comprised of players who's stats I want to import from an API, and each team's quality will be based off some combination of the players' stats, generating rating numbers for each category for a team (perimeter offense, perimeter defense, rebounding, ball movement, etc.). I will also need to create a schedule, so that I can account for fatigue, back-to-back games, team hot/cold streaks, and the like which would affect teams. I'll also need to create a way to simulate games and decide winners of games, although I'm thinking that would just likely involve some basic multipliers here and there, nothing complex. At the end of the season, standings will be created, a playoffs bracket will be made, and a champion will be determined. I also want to create a GUI for this.


So I've been reading about HTML, HTTP, and JavaScript in order to prepare for the web scraping part of this project, where I'd have to gather info from online API's. I'm wondering what else I should look into in order to create this project, besides learning about GUI's? This is being done in Java btw.",0,1,False,self,,,,,
281,computerscience,t5_2qj8o,2017-10-25,2017,10,25,9,78k2k7,self.computerscience,thinking about getting a computer science degree,https://www.reddit.com/r/computerscience/comments/78k2k7/thinking_about_getting_a_computer_science_degree/,camrin123,1508890861,"i live in california, would love to be part of the future and get a computer science degree. i would like to know the classes you took for your major. what was the standard outcome that most students are supposed to have once getting a degree? I'm probably being vague as hell but id like to program and create a drone operating system or create programs for other companys. thanks",2,1,False,self,,,,,
282,computerscience,t5_2qj8o,2017-10-25,2017,10,25,9,78k6x0,self.computerscience,Computer Science vs Applied Computer Science @ University's/Colleges,https://www.reddit.com/r/computerscience/comments/78k6x0/computer_science_vs_applied_computer_science/,razuhh,1508892109,"I am wondering what the difference between them is. I need a pre cal high school credit for Computer Science but I don't need a pre cal credit for Applied Computer Science. I'm also applying very soon and don't have a pre cal credit but wondering if I can still get in to Computer Science (Since I wanna Major in Computer Sciences) and take a pre cal credit at the University. 

I'm really sorry if this is the wrong sub reddit but thank you in advance.",1,2,False,self,,,,,
283,computerscience,t5_2qj8o,2017-10-25,2017,10,25,10,78kbz9,imgur.com,Help me,https://www.reddit.com/r/computerscience/comments/78kbz9/help_me/,KJGingie,1508893600,,1,1,False,default,,,,,
284,computerscience,t5_2qj8o,2017-10-25,2017,10,25,11,78kn42,self.computerscience,Need help with CS internship choice,https://www.reddit.com/r/computerscience/comments/78kn42/need_help_with_cs_internship_choice/,George9444,1508896922,"I am a computer science major at community college and will transfer next 2018 to university. I have the option of being a web development intern, but my professor told me that a web development internship will not be useful for a cs major. I ultimately want to be a software engineer but I want have atleast one internship so when I transfer out it will be easier for me to find internships at University since I would have completed one. What should I do, will a Web development intern be useful? Or should I turn it down and take an extra cs course? Help!!",1,1,False,self,,,,,
285,computerscience,t5_2qj8o,2017-10-25,2017,10,25,14,78loek,self.computerscience,netbeans Mastermind game coding,https://www.reddit.com/r/computerscience/comments/78loek/netbeans_mastermind_game_coding/,xxlolers,1508909457,"Hello, I am absolutely lost and I would love some help. The rules are:
green - A guess is exactly correct (it is the right number in the right position).   However, it does NOT indicate which of the three numbers are correct
yellow - A number is guessed correctly but it is in the wrong position.
	red - the number does not appear anywhere in the solution.
ex. green, green, green means that every digit is in the correct position  the player has guessed the number and won the game.
Greens always appear first in the evaluation.
Only one color is presented for each number
If no digits are in the number a single red is given.

-thanks",0,0,False,self,,,,,
286,computerscience,t5_2qj8o,2017-10-25,2017,10,25,14,78ls6o,instantassignmenthelp.com,Get Online Help From Expert writers in Computer Science Dissertation Assignment writing,https://www.reddit.com/r/computerscience/comments/78ls6o/get_online_help_from_expert_writers_in_computer/,Johnnoels,1508911011,,0,1,False,default,,,,,
287,computerscience,t5_2qj8o,2017-10-25,2017,10,25,15,78m0w8,self.computerscience,Need clarification on recursive binary search function,https://www.reddit.com/r/computerscience/comments/78m0w8/need_clarification_on_recursive_binary_search/,ButterMyMuffinn,1508914650," https://imgur.com/gallery/ofo0T

When returning RecBinarySearch (A, bottom, middle-1) why is target omitted if the parameters are the array, the target, bottom and top respectively? Is this a typo? ",2,2,False,self,,,,,
288,computerscience,t5_2qj8o,2017-10-25,2017,10,25,19,78mt2u,monades.roperzh.com,How Error Correcting Codes and Reed-Solomon works,https://www.reddit.com/r/computerscience/comments/78mt2u/how_error_correcting_codes_and_reedsolomon_works/,roperzh,1508927383,,0,1,False,default,,,,,
289,computerscience,t5_2qj8o,2017-10-25,2017,10,25,21,78nau5,self.computerscience,"I am making an aircraft air control system. There is an aircraft object and there is a vector called ""aircraftList_"" which holds all the aircraft objects. I am trying to write a method called ""ListAllAircraft"" which will print all the contents of aircraftList, could someone help?",https://www.reddit.com/r/computerscience/comments/78nau5/i_am_making_an_aircraft_air_control_system_there/,Murrack_Carn,1508934055,[removed],0,0,False,default,,,,,
290,computerscience,t5_2qj8o,2017-10-25,2017,10,25,23,78o5jq,i.redd.it,ill pay someone 20$ to do this assignment for my computer science class for me,https://www.reddit.com/r/computerscience/comments/78o5jq/ill_pay_someone_20_to_do_this_assignment_for_my/,jebbicher,1508942995,,5,0,False,default,,,,,
291,computerscience,t5_2qj8o,2017-10-26,2017,10,26,0,78o85y,self.computerscience,Transition from Front End Web Dev to Machine Learning Engineer,https://www.reddit.com/r/computerscience/comments/78o85y/transition_from_front_end_web_dev_to_machine/,dmrdc,1508943680,"I have recently thought about enrolling in Udacity's Machine Learning Engineer nanodegree program. However, I'm not sure if that will give me a better salary than my current Angular Dev job that pays $115k annual (Washington DC). What are some reasonable expectations in terms of salary and other things I might not know when doing this type of degree? Essentially, is it worth investigating the time and money doing this transition? What do you guys think? 

If you're not familiar with Udacity, here's a link udacity.com/nanodegree",1,3,False,self,,,,,
292,computerscience,t5_2qj8o,2017-10-26,2017,10,26,0,78obca,self.computerscience,computer programs vs. math functions - similar or different ideas?,https://www.reddit.com/r/computerscience/comments/78obca/computer_programs_vs_math_functions_similar_or/,jmdugan,1508944450,"in everyday computation, we have an idea of a program - either compiled or interpreted as a set of instructions a computer ""does""

we also have an idea in maths of a function, a thing that has inputs as variables, and it's value when evaluated, given those variable definitions, is the value of the function.

is there, in some general sense, an equivalence between programs and functions, taken with these meanings?  I'm not talking about a ""function"" as used in CS, but in math.

Can we think about a program as a really complex maths function - where the inputs of the program are the values of the variables, and the output of the program is the value of the function?


looking for pointers on where to read more about this, or what this area of study is called.

thank you",7,3,False,self,,,,,
293,computerscience,t5_2qj8o,2017-10-26,2017,10,26,0,78oi7z,self.computerscience,Confusion about grades,https://www.reddit.com/r/computerscience/comments/78oi7z/confusion_about_grades/,[deleted],1508946198,[deleted],2,7,False,default,,,,,
294,computerscience,t5_2qj8o,2017-10-26,2017,10,26,1,78oprt,facebook.com,When you can't find the error in your code,https://www.reddit.com/r/computerscience/comments/78oprt/when_you_cant_find_the_error_in_your_code/,secretmang123,1508948027,,1,5,False,default,,,,,
295,computerscience,t5_2qj8o,2017-10-26,2017,10,26,1,78ow4q,self.computerscience,"Odd background, want to go to grad school",https://www.reddit.com/r/computerscience/comments/78ow4q/odd_background_want_to_go_to_grad_school/,throwaway_nougrad,1508949587,"This is going to sound super weird but Im looking for advice. I am imminently graduating with a Masters degree (2 year, including thesis) in a CS sub-discipline.

I never completed a Bachelors degree - I dropped out after barely a semester to work in industry. The school I am due to graduate from is accreddited and respectable but not a top school. My grades are good, but my understanding is Masters GPAs arent worth as much as Bachelors GPAs. Before getting this degree I had five years of experience in various companies as a software engineer.

I really want to do original research and have access to research jobs in the industry. To that end I want to know if there is any way I can realistically apply to, and be accepted in, an excellent PhD program for core CS. I know I may have permanently closed some doors due to my background, but I am hoping that isnt the case.

EDIT: People are going to ask how I did this...basically, I had really good industry references and presented my case to the admissions committee. But that worked for an applied (Masters) degree, so I dont know any schools willing to (but not advertising) such exceptions for a PhD qualification. I dont know if professors can make exceptions over an admissions committee.",3,6,False,self,,,,,
296,computerscience,t5_2qj8o,2017-10-26,2017,10,26,1,78owo8,self.computerscience,I am looking for a BS in Computer Science program that offers evening &amp; weekend classes anywhere in the USA.,https://www.reddit.com/r/computerscience/comments/78owo8/i_am_looking_for_a_bs_in_computer_science_program/,sassyfras24,1508949713,"The title is basically it. I want to pursue a second bachelor's degree in the next year or so. Since I want to work and study simultaneously as a nontraditional student, evening and/or weekend courses are necessary. I'm open to moving anywhere!",10,4,False,self,,,,,
297,computerscience,t5_2qj8o,2017-10-26,2017,10,26,1,78oz8s,self.computerscience,Master degree question,https://www.reddit.com/r/computerscience/comments/78oz8s/master_degree_question/,structee,1508950309,"Hi guys, I'm looking at doing a masters in cs in the near future - the thing is that my undergrad is in civil (engineering). The school that I will be applying to will accept me given that I complete several pre-reqs - namely: discrete structures, algorithms and data, operating systems, and computer organization (along with a couple programming courses). So this brings me to the question - how much of important undergraduate material will I miss out on by taking only these courses? Should I take any other courses or study any other particular topic on my own? Thanks!",3,4,False,self,,,,,
298,computerscience,t5_2qj8o,2017-10-26,2017,10,26,2,78p2cc,i.redd.it,Someone Help!!!,https://www.reddit.com/r/computerscience/comments/78p2cc/someone_help/,[deleted],1508951039,[deleted],1,0,False,default,,,,,
299,computerscience,t5_2qj8o,2017-10-26,2017,10,26,2,78p3im,i.redd.it,Can someone please help?,https://www.reddit.com/r/computerscience/comments/78p3im/can_someone_please_help/,jkhvn,1508951313,,6,0,False,default,,,,,
300,computerscience,t5_2qj8o,2017-10-26,2017,10,26,3,78piqj,self.computerscience,Pay someone to write my program? (Java),https://www.reddit.com/r/computerscience/comments/78piqj/pay_someone_to_write_my_program_java/,bendaowl,1508954893,[removed],11,0,False,default,,,,,
301,computerscience,t5_2qj8o,2017-10-26,2017,10,26,5,78qh9i,self.computerscience,"Looking to get into ai, where should I start?",https://www.reddit.com/r/computerscience/comments/78qh9i/looking_to_get_into_ai_where_should_i_start/,abhisidhu,1508963094,,14,22,False,self,,,,,
302,computerscience,t5_2qj8o,2017-10-26,2017,10,26,7,78rflx,self.computerscience,Digital forensics,https://www.reddit.com/r/computerscience/comments/78rflx/digital_forensics/,[deleted],1508971915,[deleted],0,2,False,default,,,,,
303,computerscience,t5_2qj8o,2017-10-26,2017,10,26,8,78rjba,self.computerscience,"I don't attend a top school. I feel envious of those getting to attend ""product hunts"", career fairs by prestigious companies and whatnot -- things that come with the privilege of attending a highly ranked university. How do I cope with this?",https://www.reddit.com/r/computerscience/comments/78rjba/i_dont_attend_a_top_school_i_feel_envious_of/,starstruck_21,1508972930,,9,22,False,self,,,,,
304,computerscience,t5_2qj8o,2017-10-26,2017,10,26,9,78rxpz,self.computerscience,Pairing computer science with another major,https://www.reddit.com/r/computerscience/comments/78rxpz/pairing_computer_science_with_another_major/,mellinade,1508976997,"Hey everyone, 

Im currently pursuing a degree in CS, and the way the course is structured, its ideal to complete it along with a second major. Im having a really tough time narrowing down what I want to do. So, Ive narrowed it down to either Games Technology, Cyber Forensics and Information Security, or Internetworking and Network Security. 

Im trying to determine which one of those options would make me the most employable at the end of my degree. Are there any websites that would be good to check out to see what the job market is like? Anyone have any advice on narrowing down complimentary majors?
What kinds of jobs could the last two lead to? 

Here are the course outlines for the three if anybody is curious: 
[Games Technology](http://www.murdoch.edu.au/study/courses/course-structure/Games-Technology-(BSc))
[Cyber Forensics ](http://www.murdoch.edu.au/study/courses/course-structure/Cyber-Forensics-and-Information-Security-(BSc))
[Internetworking ](http://www.murdoch.edu.au/study/courses/course-structure/Internetworking-and-Network-Security-(BSc))

Thanks for any advice anyone have to offer :) 
",4,0,False,self,,,,,
305,computerscience,t5_2qj8o,2017-10-26,2017,10,26,10,78s7wq,bigdatanews.datasciencecentral.com,Graph Theory: Six Degrees of Separation Problem,https://www.reddit.com/r/computerscience/comments/78s7wq/graph_theory_six_degrees_of_separation_problem/,psangrene,1508980013,,1,5,False,https://b.thumbs.redditmedia.com/cJhApJwPdM86f3fuQvaZhRJoVxAtcLkjtwckR1eXtmo.jpg,,,,,
306,computerscience,t5_2qj8o,2017-10-26,2017,10,26,11,78ssll,self.computerscience,SICP Exercises,https://www.reddit.com/r/computerscience/comments/78ssll/sicp_exercises/,kinglyserf,1508986166,I have started SICP and when doing the exercises I have found I struggle with finding iterative solutions to problems the most. Anyone have any tips? ,0,1,False,self,,,,,
307,computerscience,t5_2qj8o,2017-10-26,2017,10,26,13,78t7x0,self.computerscience,"How to check how many ""7"" does a specific string contains?",https://www.reddit.com/r/computerscience/comments/78t7x0/how_to_check_how_many_7_does_a_specific_string/,[deleted],1508991321,[deleted],1,0,False,default,,,,,
308,computerscience,t5_2qj8o,2017-10-26,2017,10,26,13,78tbtq,self.computerscience,newbie to computer science looking for ways to dive in,https://www.reddit.com/r/computerscience/comments/78tbtq/newbie_to_computer_science_looking_for_ways_to/,overhimnow,1508992781,newbie to computer science I have experience coding in c++ and am currently working on python. Mainly looking for advice on what languages to learn and what info I should really work at. Thanks any advice is appreciated currently a sophomore at the university of Florida. ,1,1,False,self,,,,,
309,computerscience,t5_2qj8o,2017-10-26,2017,10,26,13,78tdhk,self.computerscience,laptop advice for college student in computer science,https://www.reddit.com/r/computerscience/comments/78tdhk/laptop_advice_for_college_student_in_computer/,overhimnow,1508993379,"planning on getting a new laptop this coming black Friday and was looking for advice. just a newbie in computer science so not really sure what to look for in a laptop any advice on features or models/brands would be awesome!!

thanks ",9,0,False,self,,,,,
310,computerscience,t5_2qj8o,2017-10-26,2017,10,26,16,78u02l,learning.maxtech4u.com,What is Mobile Computing,https://www.reddit.com/r/computerscience/comments/78u02l/what_is_mobile_computing/,munishmaxtech,1509002829,,0,1,False,default,,,,,
311,computerscience,t5_2qj8o,2017-10-26,2017,10,26,16,78u2sh,youtube.com,DJ       ? buttonbass edm cube2 application review on android ||  ,https://www.reddit.com/r/computerscience/comments/78u2sh/dj_______buttonbass_edm_cube2/,mukeshsokil,1509004164,,0,1,False,default,,,,,
312,computerscience,t5_2qj8o,2017-10-26,2017,10,26,17,78ubci,self.computerscience,Need help finding resources to study computer science AS levels,https://www.reddit.com/r/computerscience/comments/78ubci/need_help_finding_resources_to_study_computer/,A-H-Johndoe,1509008335,"Hi guys,
I am studying in AS levels and one of my subject is computer science. AS level CS text book is very vague and not helpful so I am trying to find any youtuber or website that can teach AS level CS effectively. If you know any please reply, thank you .",6,4,False,self,,,,,
313,computerscience,t5_2qj8o,2017-10-26,2017,10,26,22,78vmg7,self.computerscience,Sorting faster than O(n log n) with parallel clusters?,https://www.reddit.com/r/computerscience/comments/78vmg7/sorting_faster_than_on_log_n_with_parallel/,shortAAPL,1509025332,"If you run quicksort (or other sorting algorithms) in parallel, it seems like you could do them faster than O(n log n). I've searched around a bit but I can't find things other than academic papers which I don't want to read. Can anyone shed some insight?",16,2,False,self,,,,,
314,computerscience,t5_2qj8o,2017-10-26,2017,10,26,23,78w27a,self.computerscience,Search Engine Optimization Services UK,https://www.reddit.com/r/computerscience/comments/78w27a/search_engine_optimization_services_uk/,nadvertexuk,1509029556,[removed],0,1,False,default,,,,,
