,sbr,sbr_id,date,year,month,hour,day,id,domain,title,full_link,author,created,selftext,num_comments,score,over_18,thumbnail,media_provider,media_thumbnail,media_title,media_description,media_url
78,computerscience,t5_2qj8o,2017-10-9,2017,10,9,23,759fuu,i.redd.it,computer science work revision and help with a quality problem #6,https://www.reddit.com/r/computerscience/comments/759fuu/computer_science_work_revision_and_help_with_a/,pondarious,1507559691,,1,1,False,default,,,,,
79,computerscience,t5_2qj8o,2017-10-10,2017,10,10,6,75ca4b,self.computerscience,Huffman Encoding,https://www.reddit.com/r/computerscience/comments/75ca4b/huffman_encoding/,ashumallik,1507583904,[removed],0,1,False,default,,,,,
80,computerscience,t5_2qj8o,2017-10-10,2017,10,10,6,75ccap,youtu.be,Amazing Techincal History : Floppy Disk,https://www.reddit.com/r/computerscience/comments/75ccap/amazing_techincal_history_floppy_disk/,[deleted],1507584447,[deleted],0,1,False,default,,,,,
81,computerscience,t5_2qj8o,2017-10-10,2017,10,10,6,75cjs5,seekerswiki.com,Has anyone passed the crossover test for software engineer?,https://www.reddit.com/r/computerscience/comments/75cjs5/has_anyone_passed_the_crossover_test_for_software/,seekerswiki,1507586371,,0,1,False,default,,,,,
82,computerscience,t5_2qj8o,2017-10-10,2017,10,10,8,75d3b6,self.computerscience,Any Computer Scientists Here?,https://www.reddit.com/r/computerscience/comments/75d3b6/any_computer_scientists_here/,wovirs,1507591815,"Hello, I intend in majoring in computer science. As one of my assignments I have to ask someone in the field a couple of questions. Is there anyone here willing to answer a couple of questions about the field",12,3,False,self,,,,,
83,computerscience,t5_2qj8o,2017-10-10,2017,10,10,9,75da3i,self.computerscience,Looking for some good online resources on combinatorial circuit from a computer science point of view.,https://www.reddit.com/r/computerscience/comments/75da3i/looking_for_some_good_online_resources_on/,PerfectisSh1t,1507593729,"Im taking a class in computer science this semester which largely focus around combinatorial logic and circuitry and im having a really hard time with it.

My class is in french which makes translating terms im not very familiar with to english sometimes an issue, add to that that often the resources i find are more aimed at electrical engineering class.

My professor notes are of little help because they are often complicated for little reason i find and often have typo which just adds to my confusion. 

 My midterms is in 2 weeks and i have an homework to give back on the subject in 1 week so i really need to get down with it quick and dirty.

Usually i have good success with website like Khans academy but i cant seem to find much relevant info on there (hopefully im just dumb and looked in the wrong spots), but the way the information is structured in simple short video with a calm tutor really works well for me so if something like this exist on the subject i would be delighted but so far youtube has been more or less useful because i would really like to find one resource who suits me and use that one resource for everything without having to readjust myself to different tutor every other videos/website.

Video with examples would be best but i could work around with some good clear text based information.

I have absolutely no background in circuits in general so its really difficult for me. And i really want to get good grades in this class as it could really help me get officially in the program.

Here's a quick rundown of what was treated in the class.

- Truth Tables (how to build one)

- AND , OR, NOR, XOR gates

- Boolean Algebrea and Properties (de Morgan?)

- Karnaugh Diagram

- Multiplexer, Demultiplexer, Encoder, Decoder.

- Addition circuit (using complement of 2 for substraction and then checking for C and V to test answer), Circuit de Decalage (guessing that should translate to Bias circuit maybe, sorry)

we are also using a program called LogiSim to build Circuits.

Thanks to everyone for your time and help,

much love, 

TL;DR: Title basically :)
",1,2,False,self,,,,,
84,computerscience,t5_2qj8o,2017-10-10,2017,10,10,9,75dck5,self.computerscience,Computer Science Stereotypes in Movies and TV Shows,https://www.reddit.com/r/computerscience/comments/75dck5/computer_science_stereotypes_in_movies_and_tv/,xiguas,1507594428,What are some of your favorite scenes from movies and/or TV Shows that are obviously stereotyping the CS community?? (Not just NCIS  two people on one keyboard :P),12,12,False,self,,,,,
85,computerscience,t5_2qj8o,2017-10-10,2017,10,10,10,75dmmq,self.computerscience,Anyone dyslexic and a CS major?,https://www.reddit.com/r/computerscience/comments/75dmmq/anyone_dyslexic_and_a_cs_major/,JKeo15,1507597372,"Im a first year and, as the title suggests, a dyslexic CS major. Im having a really hard time with 50-60 lines of code when there is an error, Im wondering if this major is the best fit for me. Any ideas?
Thanks ",2,9,False,self,,,,,
86,computerscience,t5_2qj8o,2017-10-10,2017,10,10,10,75dnz9,self.computerscience,What are some good post-bac and second degree computer science programs in the US and Canada?,https://www.reddit.com/r/computerscience/comments/75dnz9/what_are_some_good_postbac_and_second_degree/,the_siloviki,1507597774,,0,17,False,self,,,,,
87,computerscience,t5_2qj8o,2017-10-11,2017,10,11,0,75hxz2,self.computerscience,Career Potential,https://www.reddit.com/r/computerscience/comments/75hxz2/career_potential/,TheRealRingpato,1507650730,"Good morning all, I've done some researching on my own regarding some options after I finish my current path, but I'd like to get some feedback from others.

I graduated in May with a BA in Political Science.  I was enrolled in graduate school to pursue a PhD in the field, but over the summer I felt very unmotivated and did not want to undertake something that would take 4+ years and still have the questions career-wise at the end.

During my undergraduate thesis, I did some Python programming to visualize data and I really liked it.  I started to read some books and stuff related to programming and figured it would be something that I liked.  I looked into programs like the OSU post-bacc BS in CompSci, UMUC's second degree option, but because I wasn't sure if it was something I'd truly like, I decided to enroll at my county's community college for an Associate's in CompSci.  

It's my first semester and I love the material and am doing very well.  After this semester ends I plan on putting my work together on github and building a portfolio website.  I have been comparing the courses I need to take to BS CompSci degrees and there is a lot of overlap.  

That being said, are entry-level programming/web development jobs accessible to people with AS degrees?  A lot of what I see are looking for BS degrees, but I'm curious as to if I should be applying to those anyway.

After I finish the AS, I one day would maybe like to go back for a Masters in Software Engineering or something similar after I can save up some money and not ttake out so much in loans.

TL;DR: Wasn't happy with my field after graduating, chose CS to study for an Associate's as my community college.  Should I plan on going back to get a Masters, finish another Bachelors or just focus on building my skillset(s)?

Cheers everyone!",0,1,False,self,,,,,
88,computerscience,t5_2qj8o,2017-10-11,2017,10,11,2,75im7j,self.computerscience,What can i do with a minor in CompSci?,https://www.reddit.com/r/computerscience/comments/75im7j/what_can_i_do_with_a_minor_in_compsci/,[deleted],1507656428,[deleted],2,12,False,default,,,,,
89,computerscience,t5_2qj8o,2017-10-11,2017,10,11,4,75joka,self.computerscience,Computer Science: Decision to continue learning.,https://www.reddit.com/r/computerscience/comments/75joka/computer_science_decision_to_continue_learning/,dragooner4788,1507665371,"Hello everyone, I originally posted earlier around August in this sub-reddit talking about Discrete Math and my difficulty with it. I thought I would do a follow-up post that may help other people deciding whether or no Computer Science is right for them. 

My decision, after attempting to complete Discrete Math, and Introduction to Java is that I would rather have my teeth pulled out of my head while having toothpicks driven into my fingernails and having someone scoop my eyes out with a melon baller. 

I am an older twenty-something student, and I think that has had a lot to do with my decision. I came back to finish up a bachelor's degree. At first, ANY DEGREE would suffice, I just thought I'd put all those general education credits I scooped up earlier in my twenties and put them to use and try to find a job not at a retail store. 

At first, I chose Communications. Then decided that I'd rather take on something more technical because I wanted more money. I chose Computer Science. 

My experience in this course so far at the university that I am at was not the best. I understand in programming, just like in any other topic, there is a good deal of 'googling' that one may have t do to get a solution to their problem. 

The issue is, is that the professor that teach both my discrete math course, and my introduction to java course is not that best at conveying information. He speed through the slides, and does not assign any homework for use to practice with. He then every few weeks posts assignments we must complete yet we have had no actual practice writing the code, we've only been watching him write code and run it. 

I'm wondering if anyone else has had a similar experience, but with the amount of googling I've done, and the endless nights of 3AM study sessions, I've found that Code Academy, and Team Treehouse do a better job at teaching coding than this professor does. So to  me, I'd rather put the money I'm spending towards something I can achieve, and just learn to program on my own. 

I'd say so any older CS hopefuls to maybe look at online alternatives. 

I've made the switch to Information Systems Management, and will move ahead with courses to complete that degree. I've learned sitting behind an IDE is extremely boring and unfulfilling. Hopefully this helps others out. 

The issue is that we are now pushed towards STEM degrees, because if you get a liberal arts degree you are going to be sucking cock behind a dumpster at a McDonalds to make ends meet. But we aren't preparing people for these STEM degrees thoroughly enough in high school, and we don't have professors that are with the times. ",2,2,False,self,,,,,
90,computerscience,t5_2qj8o,2017-10-11,2017,10,11,6,75kao9,self.computerscience,It is appropriate to get advice and guidance from an industry professional on your undergrad dissertation?,https://www.reddit.com/r/computerscience/comments/75kao9/it_is_appropriate_to_get_advice_and_guidance_from/,ohok123,1507670760,"I have an offer for help with my undergrad dissertation. All work carried out would be my own, but they'd advise on improvements, technology, and give feedback on my ideas. Is this still considered original work? ",1,4,False,self,,,,,
91,computerscience,t5_2qj8o,2017-10-11,2017,10,11,7,75kocd,self.computerscience,"I'm a noob to programming. My question is, once you are proficient in one language how long would it take you to learn a second language, as a fraction of the number of hours of the first? Thanks",https://www.reddit.com/r/computerscience/comments/75kocd/im_a_noob_to_programming_my_question_is_once_you/,natereddit2015,1507674369,,7,9,False,self,,,,,
92,computerscience,t5_2qj8o,2017-10-11,2017,10,11,8,75l10v,self.computerscience,Help on some CS questions,https://www.reddit.com/r/computerscience/comments/75l10v/help_on_some_cs_questions/,TheGreatMan_Greatest,1507677756,[removed],1,0,False,default,,,,,
93,computerscience,t5_2qj8o,2017-10-11,2017,10,11,8,75l56o,discord.gg,Need help with programming/hacking? Join our friendly discord server for help!,https://www.reddit.com/r/computerscience/comments/75l56o/need_help_with_programminghacking_join_our/,Banqu,1507678915,,1,44,False,default,,,,,
94,computerscience,t5_2qj8o,2017-10-11,2017,10,11,9,75lb0s,self.computerscience,"As a struggling freshmen attending RIT and majoring in Comp sci, what advice/tips would you give me to do well in my computer science classes?",https://www.reddit.com/r/computerscience/comments/75lb0s/as_a_struggling_freshmen_attending_rit_and/,zsweeney1,1507680573,,4,3,False,self,,,,,
95,computerscience,t5_2qj8o,2017-10-11,2017,10,11,12,75mas7,self.computerscience,"Graduating with a CS degree in December, yet I dont even know where to begin looking for a job",https://www.reddit.com/r/computerscience/comments/75mas7/graduating_with_a_cs_degree_in_december_yet_i/,[deleted],1507690833,[deleted],6,13,False,default,,,,,
96,computerscience,t5_2qj8o,2017-10-11,2017,10,11,12,75mbls,self.computerscience,Is there a book that talks about the development of computer from scratch?,https://www.reddit.com/r/computerscience/comments/75mbls/is_there_a_book_that_talks_about_the_development/,majiasheng,1507691086,"I would like to consolidate my knowledge in computer (system) by studying its development in both hardware and software aspects. 
I am interested particularly in the software aspect.
So I am wondering if there are any good books that talk about the development of a computer from the lowest level in detail?
(Pretending that computer never existed) I am trying to learn how computer came to be what it is by starting from the root. 

I am also looking for recommendations of books about Computer Networks

Thanks in advance.

- Ma
",5,3,False,self,,,,,
97,computerscience,t5_2qj8o,2017-10-11,2017,10,11,16,75nfco,self.computerscience,Should I attend an advanced technical conference?,https://www.reddit.com/r/computerscience/comments/75nfco/should_i_attend_an_advanced_technical_conference/,Foxtrotwhat,1507705738,"I'm confused about whether or not I should attend an in-depth training conference as an inexperienced student. The Microchip Masters conference is coming to my city. It's intended for embedded control design engineers, which is an area of great interest for me. However, I have no actual experience with embedded control systems. I can code in C and C++, and I have a basic conceptual idea of how embedded control systems work. 
When I called, they told me I could attend if I wanted to, but it might be an overload for me. Is there anyone here who has done something like this, who can advise? ",0,1,False,self,,,,,
98,computerscience,t5_2qj8o,2017-10-11,2017,10,11,19,75o934,caspervonb.github.io,Interactive and audible visualizations of sorting algorithms,https://www.reddit.com/r/computerscience/comments/75o934/interactive_and_audible_visualizations_of_sorting/,caspervonb,1507718768,,0,10,False,default,,,,,
99,computerscience,t5_2qj8o,2017-10-11,2017,10,11,21,75oviu,self.computerscience,When do I know if I need to switch majors?,https://www.reddit.com/r/computerscience/comments/75oviu/when_do_i_know_if_i_need_to_switch_majors/,ALoneLucario,1507726683,"I am majoring in Computer Science because it is broad, it seemed somewhat interesting and the degree might help me in trying to make video games (yes, my childish and lifelong dream). The problem is the fact I am a freshman and will only be in school for 3 years (due to things) but I will still get my degree. I take 5 classes this semester and will have to for the next few years. I just got a B on my first test but messed up on the programming part of the test. Our class is dedicated to learning Python.

The thing is, I don't know if I just need to practice more or actually change majors. I feel I'm behind but I got the median grade for my class. I can't afford to go longer than 3 years so I'm trying to solidify my major at least before the end of my first year. What are the signs that computer science would be for me?",21,2,False,self,,,,,
100,computerscience,t5_2qj8o,2017-10-12,2017,10,12,4,75rf9n,self.computerscience,What do LOAD and STORE instructions do?,https://www.reddit.com/r/computerscience/comments/75rf9n/what_do_load_and_store_instructions_do/,sahilkolwankar,1507749725,"Can anyone tell me what the following instructions do?

LOAD R1, R2, #3

STORE R4, R5, #8",2,1,False,self,,,,,
101,computerscience,t5_2qj8o,2017-10-12,2017,10,12,7,75slf6,self.computerscience,Where do the weird wavy lines in this (scaled) photograph of a LCD screen come from?,https://www.reddit.com/r/computerscience/comments/75slf6/where_do_the_weird_wavy_lines_in_this_scaled/,Deathcrow,1507760139,"Not sure where to ask this, but I think this subreddit relates and maybe someone has seen this effect before?

I was browsing Reddit on my phone and noticed these weird artefacts in a scaled down picture:

https://i.imgur.com/MHidg0M.png

This is the original full-screen image:

https://i.imgur.com/GSGmf51.jpg

I **think** this may have something to do with scaling and maybe the scaling-filter that is being applied (bilinear nearest-neighbor? ...?). But I don't really understand where the ""pattern"" comes from. Maybe because the phone was held at a slightly slanted angle to the screen when taking the picture so the pixels don't properly align?

It's a really interesting effect and can reproduce it in different intensities by selecting different zoom levels for the image in GIMP.",11,2,False,self,,,,,
102,computerscience,t5_2qj8o,2017-10-12,2017,10,12,7,75sodz,self.computerscience,Help with hw,https://www.reddit.com/r/computerscience/comments/75sodz/help_with_hw/,[deleted],1507760928,[deleted],0,1,False,default,,,,,
103,computerscience,t5_2qj8o,2017-10-12,2017,10,12,8,75t2o1,discord.gg,Need help with Computer Science/Programming? Come join our friendly discord server for help with over 250+ members!,https://www.reddit.com/r/computerscience/comments/75t2o1/need_help_with_computer_scienceprogramming_come/,Banqu,1507764861,,0,66,False,default,,,,,
104,computerscience,t5_2qj8o,2017-10-12,2017,10,12,9,75tcab,self.computerscience,Interview Prep Questions,https://www.reddit.com/r/computerscience/comments/75tcab/interview_prep_questions/,theoreticallyyy,1507767565,"I'm a CS major going for a part time job as a student in the IT department and my interview is tomorrow. One of my friends told me they ask basic questions and give you a computer to ""fix"". His laptop had the wifi turned off and he had to go into the network settings and turn it back on. I'm confident in my skills but extremely nervous. I'm also pretty tech savvy but have never been to an interview before so my questions are: 


What are some basic questions that I should be expecting?

How do I calm down and stop being so nervous?

What are some basic issues like the wifi being turned off that I should keep in mind?",0,1,False,self,,,,,
105,computerscience,t5_2qj8o,2017-10-12,2017,10,12,10,75tnch,self.computerscience,How was character encoding done the first time?,https://www.reddit.com/r/computerscience/comments/75tnch/how_was_character_encoding_done_the_first_time/,READERmii,1507770711,"How were programming languages used before character encoding? Is it even possible to use a programming language if you don't already have some sort of character encoding system running on your computer? What do you have to do when you have a computer with no encoding system to get one that does? How did the first character encoding system teach computers that whatever code point means ""k"" and that means displace a little picture of a lower case Latin letter Kay? How did they teach the computer what ""k"" looks like? How does one encode characters on a system with no prior character encoding system?",3,1,False,self,,,,,
106,computerscience,t5_2qj8o,2017-10-12,2017,10,12,10,75ttze,youtube.com,What is Diode and how it work in hindi? - Diode ko kaise check kare? (Hindi Video),https://www.reddit.com/r/computerscience/comments/75ttze/what_is_diode_and_how_it_work_in_hindi_diode_ko/,mukeshsokil,1507772721,,0,1,False,default,,,,,
107,computerscience,t5_2qj8o,2017-10-12,2017,10,12,11,75u1uf,self.computerscience,Has anyone graduated without an internship found a job?,https://www.reddit.com/r/computerscience/comments/75u1uf/has_anyone_graduated_without_an_internship_found/,Rongeegee,1507775101,"I am a junior in college worrying about my future. I find it so hard to look for an internship, Anyone has any suggestions?",1,3,False,self,,,,,
108,computerscience,t5_2qj8o,2017-10-12,2017,10,12,12,75ufah,self.computerscience,What kind of internships can give broad experience rather than doing just one thing?,https://www.reddit.com/r/computerscience/comments/75ufah/what_kind_of_internships_can_give_broad/,robendboua,1507779375,"Undergrad degrees like CS, IT or CIS aren't very specific. If I'm not sure what I wanna go into after, are there any internships that provide a broad overview to help me see what I like best? Anything that would involve networking, development, maybe some security like cryptology or penetration testing? ",2,2,False,self,,,,,
109,computerscience,t5_2qj8o,2017-10-12,2017,10,12,12,75ujo0,self.computerscience,Help did I fck up my chances of getting into uni/a good future? - Advice please,https://www.reddit.com/r/computerscience/comments/75ujo0/help_did_i_fck_up_my_chances_of_getting_into_unia/,[deleted],1507780775,[deleted],0,1,False,default,,,,,
110,computerscience,t5_2qj8o,2017-10-12,2017,10,12,13,75uqib,self.computerscience,What are some cool projects to do with the cloud. I know this is vague. Really anything cool. Just looking to practice...,https://www.reddit.com/r/computerscience/comments/75uqib/what_are_some_cool_projects_to_do_with_the_cloud/,ajparsa,1507783131,What are some cool projects to do with the cloud. I know this is vague. Really anything cool. Just looking to practice...,1,3,False,self,,,,,
111,computerscience,t5_2qj8o,2017-10-12,2017,10,12,19,75w316,self.computerscience,Computer science Highschool internships,https://www.reddit.com/r/computerscience/comments/75w316/computer_science_highschool_internships/,The_New_Eternet_Hero,1507803674,"Are there any around in New Jersey, and even if there are do colleges really care about that? Would it make me stand out on my application or am i wasting my time away from my studies ?",1,0,False,self,,,,,
112,computerscience,t5_2qj8o,2017-10-12,2017,10,12,19,75w6e1,mappingthejourney.com,"Learn about the creation of Database, RDBMS, and SQL from Don Chamberlin, designer of SQL database language",https://www.reddit.com/r/computerscience/comments/75w6e1/learn_about_the_creation_of_database_rdbms_and/,pramodhs,1507805094,,0,2,False,default,,,,,
113,computerscience,t5_2qj8o,2017-10-12,2017,10,12,22,75x4g4,self.computerscience,Implementing a Java program under Branch and Bound Algorithm,https://www.reddit.com/r/computerscience/comments/75x4g4/implementing_a_java_program_under_branch_and/,seventhmiachan,1507816385,"The researchers would be devising a solution using the listed algorithm below to address the issue. This solution would implement an application software portable and efficient for smartphones to be shared and to be used across the world. Instead of the current algorithm accessed by taxi drivers working under Uber which promotes unnecessary fuel and time consumption because of going through all the pickup points, users would see a display of various available waiting routes all across Metro Manila (limited per city  and its landmark) as well as the record of the vehicles price meter  the application would display the price drop or rise every five minutes of travelling time.

This is the beginning of our research proposal. And frankly, we have no idea how to continue and finish this. Could you give us some insight on how to code a program or even where to begin in coding a program using a branch and bound algorithm (we're rooting for doing this under the assignment problem approach) that would basically make the lives of ridesharers and drivers more efficient and easier?

Note: This is a high school paper being prepared by high school students with little background on C and Java and HTML.

HUGE THANKS IN ADVANCE.",0,3,False,self,,,,,
114,computerscience,t5_2qj8o,2017-10-13,2017,10,13,5,75zyhv,self.computerscience,Defragmentation,https://www.reddit.com/r/computerscience/comments/75zyhv/defragmentation/,furq6718,1507841812,[removed],4,0,False,default,,,,,
