,sbr,sbr_id,date,year,month,hour,day,id,domain,title,full_link,author,created,selftext,num_comments,score,over_18,thumbnail,media_provider,media_thumbnail,media_title,media_description,media_url
64,Got7,t5_2zrs4,2019-8-26,2019,8,26,15,cvkely,self.Got7,A GOT7 song that makes you emotional every time,https://www.reddit.com/r/Got7/comments/cvkely/a_got7_song_that_makes_you_emotional_every_time/,lobstermoon,1566801787,"Does anyone have that one or two GOT7 song that makes you emotional every single time you hear it? 

The song that will 200% make me cry whenever I hear it is 'I Am Me' (I am not even joking, the waterworks start almost immediately), mainly because it was released at a particular juncture in my life where I am was going through some exciting but scary life changes. I listen to it every time to remind myself to be brave and live the life I've always wanted to live. Special thanks to Jinyoung for those fantastic lyrics. 

Coming in a close second is 'Miracle', there is something about Yugyeom's high note that punches me in the gut every time! And also because it is generally a warm and fuzzy song. 

Do you have a song or two that holds deep personal meaning for you and gets you deep in the feels every time you listen to it? I would love to hear your stories!!",25,20,False,self,,,,,
65,Got7,t5_2zrs4,2019-8-26,2019,8,26,21,cvn3vy,youtu.be,NYC strangers picked the most handsome Got7 member,https://www.reddit.com/r/Got7/comments/cvn3vy/nyc_strangers_picked_the_most_handsome_got7_member/,daixxi,1566820831,,14,46,False,https://b.thumbs.redditmedia.com/fxKKZGcHwCfq6uvgF3MGQFy0ETXUEzgzQPy8QrsbZYA.jpg,,,,,
66,Got7,t5_2zrs4,2019-8-27,2019,8,27,19,cw29yg,reddit.com,Top 10 Got7 songs? Comment on the link below at r/kpop to vote for yours :),https://www.reddit.com/r/Got7/comments/cw29yg/top_10_got7_songs_comment_on_the_link_below_at/,RazorFernandez,1566900086,,0,26,False,default,,,,,
67,Got7,t5_2zrs4,2019-8-28,2019,8,28,4,cw9390,self.Got7,which sub-unit would you like to see debut?,https://www.reddit.com/r/Got7/comments/cw9390/which_subunit_would_you_like_to_see_debut/,jecg1,1566933385,"currently remembering how during eclipse promotions jackson and youngjae were teasing jjap jjap project, and realized that if they did debut it would be pretty interesting given they have different preferred musical styles and it would be a rapper + vocal (jus2 + jj project being all vocals) 

Who else would be an interesting sub-unit?",13,25,False,self,,,,,
68,Got7,t5_2zrs4,2019-8-29,2019,8,29,15,cwwzbs,reddit.com,"Schedule: August 26, 2019 - September 1, 2019",https://www.reddit.com/r/Got7/comments/cwwzbs/schedule_august_26_2019_september_1_2019/,Infinitize-It,1567059600,,0,12,False,default,,,,,
69,Got7,t5_2zrs4,2019-8-30,2019,8,30,7,cx7ube,vlive.tv,(ENG SUBS) Jackson &amp; BamBam - GOT2DAY 2019 EP 16,https://www.reddit.com/r/Got7/comments/cx7ube/eng_subs_jackson_bambam_got2day_2019_ep_16/,valvietd,1567116888,,1,6,False,https://a.thumbs.redditmedia.com/92YNKXjXRBrhcLGn2lg2Lys6I_tkGxKxaSrZQscNBq0.jpg,,,,,
70,Got7,t5_2zrs4,2019-8-30,2019,8,30,7,cx7upf,vlive.tv,(ENG SUBS) Mark &amp; BamBam - GOT2DAY 2019 EP 17,https://www.reddit.com/r/Got7/comments/cx7upf/eng_subs_mark_bambam_got2day_2019_ep_17/,valvietd,1567116947,,0,17,False,https://a.thumbs.redditmedia.com/LYZMuGDaWX0JMou-MJo8yC4TJUdJt9xcYL_UaqUh5M8.jpg,,,,,
71,Got7,t5_2zrs4,2019-8-30,2019,8,30,17,cxdz96,soompi.com,Mafia Game In Prison Announces Final Episode And End Of Show,https://www.reddit.com/r/Got7/comments/cxdz96/mafia_game_in_prison_announces_final_episode_and/,jecg1,1567153041,,5,31,False,https://b.thumbs.redditmedia.com/PH8PucnQyvCObH38U31o83t_bhkb8Az8DvNSEzgPqeY.jpg,,,,,
72,Got7,t5_2zrs4,2019-8-31,2019,8,31,12,cxr3t4,i.redd.it,How can such flawless human being exist?!?,https://www.reddit.com/r/Got7/comments/cxr3t4/how_can_such_flawless_human_being_exist/,Kpoplover2017,1567221893,,3,85,False,default,,,,,
