,sbr,sbr_id,date,year,month,hour,day,id,domain,title,full_link,author,created,selftext,num_comments,score,over_18,thumbnail,media_provider,media_thumbnail,media_title,media_description,media_url
0,Got7,t5_2zrs4,2019-8-1,2019,8,1,9,ckh1ap,vlive.tv,(ENG SUBS) JB &amp; Youngjae - GOT2DAY 2019 EP 09,https://www.reddit.com/r/Got7/comments/ckh1ap/eng_subs_jb_youngjae_got2day_2019_ep_09/,valvietd,1564619995,,0,20,False,default,,,,,
1,Got7,t5_2zrs4,2019-8-1,2019,8,1,20,ckmzuz,self.Got7,got7 London,https://www.reddit.com/r/Got7/comments/ckmzuz/got7_london/,possiblepsych0,1564658107,"If anyone has a presale code for Got7 in London, could I please have it? I am really desperate as I missed the campaign before it closed due to health issues. If anyone could gift it to me they would be my angel! I will do anything",2,5,False,self,,,,,
2,Got7,t5_2zrs4,2019-8-2,2019,8,2,1,ckqdwd,self.Got7,Love Loop Japan Pop-Up Store,https://www.reddit.com/r/Got7/comments/ckqdwd/love_loop_japan_popup_store/,icravenoodlez,1564675739,"Im curious whether this website was reliable because Im looking to purchase some merchandise for a friend and I. If there is another way, please tell me! Thank you so much! :) 
[Pop-Up Store](https://got7.japanhomemaker.tokyo/shop-got7-our-loop-japan-goods)",3,16,False,self,,,,,
3,Got7,t5_2zrs4,2019-8-2,2019,8,2,10,ckxmai,self.Got7,Favorite B-Side Track,https://www.reddit.com/r/Got7/comments/ckxmai/favorite_bside_track/,rose0509,1564710293,"I love so many B-side tracks of GOT7 that sometimes I wished it was the title track. Some of them include Page for the current era, Take Me To You and Save You. 

What's yours?",28,30,False,self,,,,,
4,Got7,t5_2zrs4,2019-8-2,2019,8,2,13,ckzluq,vlive.tv,(ENG SUBS) Mark &amp; Jinyoung - GOT2DAY 2019 EP 10,https://www.reddit.com/r/Got7/comments/ckzluq/eng_subs_mark_jinyoung_got2day_2019_ep_10/,valvietd,1564721996,,0,5,False,default,,,,,
5,Got7,t5_2zrs4,2019-8-2,2019,8,2,20,cl314a,i.redd.it,Jackson Wang (GOT7) becomes the newest face of Armani Beauty,https://www.reddit.com/r/Got7/comments/cl314a/jackson_wang_got7_becomes_the_newest_face_of/,kpopfangirl101,1564746357,,2,123,False,https://a.thumbs.redditmedia.com/pFAYJyC8Sol_zhctMDXWuk3MlXZ3SPXi94dJbh_lBr0.jpg,,,,,
6,Got7,t5_2zrs4,2019-8-2,2019,8,2,21,cl3qpt,self.Got7,Is anyone going to the concert in Kobe on the 4th??,https://www.reddit.com/r/Got7/comments/cl3qpt/is_anyone_going_to_the_concert_in_kobe_on_the_4th/,sailorscovt,1564750497,"I'm going alone, which is fine, but would be fun to meet other ahgases.",2,4,False,self,,,,,
7,Got7,t5_2zrs4,2019-8-3,2019,8,3,13,cleqa7,self.Got7,"Is anyone going to their HONG KONG shows, end of Aug?",https://www.reddit.com/r/Got7/comments/cleqa7/is_anyone_going_to_their_hong_kong_shows_end_of/,twocatsandakid,1564807070,,2,15,False,self,,,,,
8,Got7,t5_2zrs4,2019-8-3,2019,8,3,14,clf1xn,self.Got7,DOME TOUR,https://www.reddit.com/r/Got7/comments/clf1xn/dome_tour/,c00kie123,1564809357,I am a new GOT7 fan and i am really curious about got7 current japan popularity. Are they at a level where they could do dome tour?? i am really hoping they will be able to do it one day! :),1,3,False,self,,,,,
9,Got7,t5_2zrs4,2019-8-4,2019,8,4,15,clt2t9,self.Got7,HITC FESTIVAL - JACKSON WANG,https://www.reddit.com/r/Got7/comments/clt2t9/hitc_festival_jackson_wang/,sarcasticjackie,1564898572,"Hey! Im planning on going alone to the Head in the Clouds festival in LA (aug 17) and I was wondering if anyone else was going? I was thinking of taking the metro down there. 

Any advice on being in Chinatown on a Saturday? Any advice on going to a festival alone? Anyone planning anything to support him? Im so excited to support our guy!  

Thank you so much!!",5,14,False,self,,,,,
10,Got7,t5_2zrs4,2019-8-5,2019,8,5,4,cm04j6,soundcloud.com,Def. (JB) - 1/? vol.4 @ SoundCloud,https://www.reddit.com/r/Got7/comments/cm04j6/def_jb_1_vol4_soundcloud/,valvietd,1564945315,,4,53,False,https://b.thumbs.redditmedia.com/NPi2SJQdn6x5X-66GHNXrfishGPQoRMEY67uTfMpfBI.jpg,,,,,
11,Got7,t5_2zrs4,2019-8-6,2019,8,6,0,cmce2v,youtube.com,"GOT7 Sings BTS, Backstreet Boys, and More Boy Band Lyrics | Lyric Challenge",https://www.reddit.com/r/Got7/comments/cmce2v/got7_sings_bts_backstreet_boys_and_more_boy_band/,kpopfangirl101,1565018854,,2,47,False,https://b.thumbs.redditmedia.com/Esc4Ltjy-B9C7lh-i4yqLLoumcHbRvhxIIlYdFw62rY.jpg,,,,,
12,Got7,t5_2zrs4,2019-8-6,2019,8,6,1,cmcuaa,youtu.be,"Got7 singing BTS, backstreet Boys and more",https://www.reddit.com/r/Got7/comments/cmcuaa/got7_singing_bts_backstreet_boys_and_more/,daixxi,1565020922,,0,46,False,https://b.thumbs.redditmedia.com/FbNoMTuaXFxMQR5p-Tj3s6BpCn9uMz6w4Q3yTvbDELk.jpg,,,,,
13,Got7,t5_2zrs4,2019-8-6,2019,8,6,8,cmikls,vlive.tv,(ENG SUBS) BamBam &amp; Yugyeom - GOT2DAY 2019 EP 11,https://www.reddit.com/r/Got7/comments/cmikls/eng_subs_bambam_yugyeom_got2day_2019_ep_11/,valvietd,1565046727,,1,15,False,default,,,,,
14,Got7,t5_2zrs4,2019-8-6,2019,8,6,16,cmnjkc,self.Got7,Anyone going to the concert in Manila?,https://www.reddit.com/r/Got7/comments/cmnjkc/anyone_going_to_the_concert_in_manila/,tokwha,1565076901,"I'm from down under (Northern Mindanao), and I'm wondering: 1) when tickets going to be on sale, and 2) who's going to the concert?

Would love to have some company.",8,3,False,self,,,,,
15,Got7,t5_2zrs4,2019-8-6,2019,8,6,21,cmpvty,1iota.com,Jackson Wang to have a special performance on James Corden's The Late Late Show on the 13th August (PST),https://www.reddit.com/r/Got7/comments/cmpvty/jackson_wang_to_have_a_special_performance_on/,kpopfangirl101,1565094127,,3,82,False,https://b.thumbs.redditmedia.com/ogASOC6Q9fI3dLMG9fBIIsHL0QguNVZwdlYuOuSKerI.jpg,,,,,
16,Got7,t5_2zrs4,2019-8-7,2019,8,7,9,cmytuy,youtube.com,[GOT7 Golden key ep.16] Mark and Youngjae's never-ending song guessing time,https://www.reddit.com/r/Got7/comments/cmytuy/got7_golden_key_ep16_mark_and_youngjaes/,kpopfangirl101,1565138672,,0,1,False,default,,,,,
17,Got7,t5_2zrs4,2019-8-7,2019,8,7,9,cmyu2e,youtube.com,[GOT7 Golden key ep.17] 2nd day in Jeju Mark-navi being active [ENG SUBS],https://www.reddit.com/r/Got7/comments/cmyu2e/got7_golden_key_ep17_2nd_day_in_jeju_marknavi/,kpopfangirl101,1565138704,,0,8,False,https://b.thumbs.redditmedia.com/jSOdgy06BSk3_kSHgBGHMtgsrDq8SBLUn13kEl1IPqc.jpg,,,,,
18,Got7,t5_2zrs4,2019-8-7,2019,8,7,9,cmyufk,youtube.com,[GOT7 Golden key ep.18] Golden Key 4th hint revealed [ENG SUBS],https://www.reddit.com/r/Got7/comments/cmyufk/got7_golden_key_ep18_golden_key_4th_hint_revealed/,kpopfangirl101,1565138762,,0,7,False,https://b.thumbs.redditmedia.com/M92zL7zgztV5vt4LHbj12Nz3lPw7EeN2_9PdUeLRIaY.jpg,,,,,
19,Got7,t5_2zrs4,2019-8-7,2019,8,7,9,cmyulp,youtube.com,[GOT7 Golden key ep.19] Mark x Youngjae What happened on the fishing boat?,https://www.reddit.com/r/Got7/comments/cmyulp/got7_golden_key_ep19_mark_x_youngjae_what/,kpopfangirl101,1565138786,,0,24,False,default,,,,,
20,Got7,t5_2zrs4,2019-8-7,2019,8,7,9,cmyurp,youtube.com,[GOT7 Golden key ep.16] Mark and Youngjae's never-ending song guessing time [ENG SUBS],https://www.reddit.com/r/Got7/comments/cmyurp/got7_golden_key_ep16_mark_and_youngjaes/,kpopfangirl101,1565138813,,0,7,False,https://a.thumbs.redditmedia.com/2X6ZGOpcMwraTcKYuF8aZaDeB5LxVzJWOccahYLISo0.jpg,,,,,
21,Got7,t5_2zrs4,2019-8-7,2019,8,7,9,cmyv5u,youtube.com,[GOT7 Golden key ep.20] Mark and Youngjae Talented fisher [ENG SUBS],https://www.reddit.com/r/Got7/comments/cmyv5u/got7_golden_key_ep20_mark_and_youngjae_talented/,kpopfangirl101,1565138877,,0,7,False,https://b.thumbs.redditmedia.com/T28_hJD4VkAbvldUoZH4jlB9JSgSF-x51H2jhZZHI6I.jpg,,,,,
22,Got7,t5_2zrs4,2019-8-7,2019,8,7,13,cn19c5,self.Got7,Favourite youngjae moment?,https://www.reddit.com/r/Got7/comments/cn19c5/favourite_youngjae_moment/,dolcefermata,1565152810,"hello :)

what are your guys fave youngjae moment?

i just randomly thought back to the time (yes its about that time in exam season) where got7 were at a park in hk (?) for hard carry s2 and youngjae thought the park name was called [caution](https://mobile.twitter.com/yugbamssi/status/1081407654142959618) LOL

[also when](https://mobile.twitter.com/virgoars/status/1119318466606055425) he thought a fan typed say something nice but it was really just the default comment box

and in relation to that,^ lets not forget [this](https://mobile.twitter.com/bluejaeism/status/952997114723946496)",24,29,False,self,,,,,
23,Got7,t5_2zrs4,2019-8-8,2019,8,8,4,cnaq4p,i.redd.it,Got the cutest surprise when opening my email today,https://www.reddit.com/r/Got7/comments/cnaq4p/got_the_cutest_surprise_when_opening_my_email/,_6seven,1565207680,,7,154,False,https://b.thumbs.redditmedia.com/KHfaaL1OKjn1aTsUQHNfXaYUdCOx_ViWF8QycOPc8Zo.jpg,,,,,
24,Got7,t5_2zrs4,2019-8-8,2019,8,8,23,cnm9wd,self.Got7,Hi-touch or fansign tips,https://www.reddit.com/r/Got7/comments/cnm9wd/hitouch_or_fansign_tips/,prdsdefsoul_peach,1565273287,"Hi Im sorry this might be a very stupid question but this is really new to me so, whats the difference between a hi-touch and a fansign? I got a ticket to go to jinyoungs hi-touch event and I dont know what to expect. Any tips for a newbie?",2,11,False,self,,,,,
25,Got7,t5_2zrs4,2019-8-9,2019,8,9,12,cnwgta,/r/Got7/comments/cnwgta/i_dont_know_how_to_title_this_but_youre_welcome/,I dont know how to title this but youre welcome,https://www.reddit.com/r/Got7/comments/cnwgta/i_dont_know_how_to_title_this_but_youre_welcome/,boyplainn,1565320196,,7,72,False,https://b.thumbs.redditmedia.com/94t3lRGh7i9gRqKWb8SPGaA2TH5Age1haC9_S4bK_rI.jpg,,,,,
26,Got7,t5_2zrs4,2019-8-9,2019,8,9,22,co2ko9,self.Got7,Got7 Merch,https://www.reddit.com/r/Got7/comments/co2ko9/got7_merch/,jmcab819,1565358288,Atttn Filipino Ahgases. Does somebody know any legit seller of keep spinning official merch with reasonable prices? Please point out me in the right direction.,0,3,False,self,,,,,
27,Got7,t5_2zrs4,2019-8-10,2019,8,10,7,co9l12,vlive.tv,(ENG SUBS) JB &amp; Mark - GOT2DAY 2019 EP 12,https://www.reddit.com/r/Got7/comments/co9l12/eng_subs_jb_mark_got2day_2019_ep_12/,valvietd,1565389678,,0,24,False,default,,,,,
28,Got7,t5_2zrs4,2019-8-12,2019,8,12,14,cp7sxh,reddit.com,"Schedule: August 5, 2019 - August 11, 2019",https://www.reddit.com/r/Got7/comments/cp7sxh/schedule_august_5_2019_august_11_2019/,Infinitize-It,1565586344,,0,15,False,default,,,,,
29,Got7,t5_2zrs4,2019-8-12,2019,8,12,14,cp7wgf,reddit.com,"Schedule: August 12, 2019 - August 18, 2019",https://www.reddit.com/r/Got7/comments/cp7wgf/schedule_august_12_2019_august_18_2019/,Infinitize-It,1565586976,,0,11,False,default,,,,,
30,Got7,t5_2zrs4,2019-8-13,2019,8,13,4,cph9dh,self.Got7,Has it been confirmed why Jackson canceled his James Corden appearance?,https://www.reddit.com/r/Got7/comments/cph9dh/has_it_been_confirmed_why_jackson_canceled_his/,IkonicAhgase,1565638117,"Could it be possible that he had to cancel Corden to tape the finale of Masked Singer US? 

If this theory is too insane or implausible sorry. But Jackson loves to sing so I thought hmm...",4,30,False,self,,,,,
31,Got7,t5_2zrs4,2019-8-13,2019,8,13,6,cpj7l7,vlive.tv,(ENG SUBS) Jackson &amp; Jinyoung - GOT2DAY 2019 EP 13,https://www.reddit.com/r/Got7/comments/cpj7l7/eng_subs_jackson_jinyoung_got2day_2019_ep_13/,valvietd,1565646627,,0,25,False,default,,,,,
32,Got7,t5_2zrs4,2019-8-14,2019,8,14,2,cpwaj4,self.Got7,Polaroid Photocards,https://www.reddit.com/r/Got7/comments/cpwaj4/polaroid_photocards/,laetee,1565716973,"i've been looking everywhere for polaroid style or actual polaroid photocards like [these](https://twitter.com/nyeongsseuni/status/1158545466952314881)  or [these](https://www.ebay.com/itm/GOT7-ARRIVAL-FLY-GOT7-Ver-Special-Polaroid-Photocards-Select-Member-Super-Rare/323427081853?hash=item4b4dc19e7d:m:mBvuQEAE8jjGnnF1K7WAS_w) (which i already bought) or [this](https://twitter.com/gayeewang/status/1161228540727066624) but most on twitter are for trade and i can't find much on ebay (that arent $200+), mercari, and some other collectible websites. does anyone know where these are from and where people sell them? thank you so much",1,12,False,self,,,,,
33,Got7,t5_2zrs4,2019-8-14,2019,8,14,6,cq0085,youtube.com,[GOT7 Golden key ep.21] GOT7s first [ENG SUBS],https://www.reddit.com/r/Got7/comments/cq0085/got7_golden_key_ep21_got7s_first_eng_subs/,kpopfangirl101,1565732901,,0,29,False,https://a.thumbs.redditmedia.com/uja3nRPsgtxFcW_VdCBYFyEKx109LlqgVPQ5tQYom90.jpg,,,,,
34,Got7,t5_2zrs4,2019-8-14,2019,8,14,6,cq00m4,youtube.com,"[GOT7 Golden key ep.22] Mark, Member different from first impression? [ENG SUBS]",https://www.reddit.com/r/Got7/comments/cq00m4/got7_golden_key_ep22_mark_member_different_from/,kpopfangirl101,1565732947,,0,3,False,https://b.thumbs.redditmedia.com/zG7l2_Jo2ROx7p7snG7toaOQtrx68vqUeBTF0piVu_w.jpg,,,,,
35,Got7,t5_2zrs4,2019-8-14,2019,8,14,6,cq00sq,youtube.com,[GOT7 Golden key ep.23] Chef Marks cooking ability? [ENG SUBS],https://www.reddit.com/r/Got7/comments/cq00sq/got7_golden_key_ep23_chef_marks_cooking_ability/,kpopfangirl101,1565732968,,0,4,False,https://b.thumbs.redditmedia.com/UQcHsUD6LR4TglZVnjryTVlT6DAXhmrfEndqoj4BdKQ.jpg,,,,,
36,Got7,t5_2zrs4,2019-8-14,2019,8,14,6,cq010r,youtube.com,[GOT7 Golden key ep.24] Mark and Youngjaes Ahgase menu(Mark and Youngjaes Ahgase menu) [ENG SUBS],https://www.reddit.com/r/Got7/comments/cq010r/got7_golden_key_ep24_mark_and_youngjaes_ahgase/,kpopfangirl101,1565732992,,0,3,False,default,,,,,
37,Got7,t5_2zrs4,2019-8-14,2019,8,14,6,cq01fb,youtube.com,[GOT7 Golden key ep.25] Mark X Youngjae handmade photobook [ENG SUBS],https://www.reddit.com/r/Got7/comments/cq01fb/got7_golden_key_ep25_mark_x_youngjae_handmade/,kpopfangirl101,1565733041,,0,3,False,https://b.thumbs.redditmedia.com/6tmfzWzE3i_sR5WqfJ-CWNvNu6H1tmD85bxLHsMbMbw.jpg,,,,,
38,Got7,t5_2zrs4,2019-8-14,2019,8,14,10,cq2e4c,youtube.com,[GOT7 Golden key ep.26] MK X YJs Sudden karaoke time [ENG SUBS],https://www.reddit.com/r/Got7/comments/cq2e4c/got7_golden_key_ep26_mk_x_yjs_sudden_karaoke_time/,kpopfangirl101,1565744406,,0,3,False,https://b.thumbs.redditmedia.com/Ijfc9-ZFpftsV8LmbBtxPyO0DAMXWmI-Yd4nw9gbVok.jpg,,,,,
39,Got7,t5_2zrs4,2019-8-15,2019,8,15,0,cqbc43,self.Got7,"Got7's upcoming HK Concert, HK Protesting &amp; Jackson",https://www.reddit.com/r/Got7/comments/cqbc43/got7s_upcoming_hk_concert_hk_protesting_jackson/,JonghyunsShawol,1565796968,"This might be a bit heavy for our usual discussions, but thought I should bring it up here nonetheless. 

I've brought this up a [couple](https://www.reddit.com/r/Got7/comments/c97qrq/first_time_going_to_a_concert_questions_tips/) [times](https://www.reddit.com/r/Got7/comments/cdic9q/word_of_advice_for_anyone_trying_to_attend/) here, but I am planning to go to GOT7's Hong Kong concert coming up very shortly. With the protesting, there has been a call from Ahgases to cancel the concert. I've discussed it at length with u/balloonuhu and others on the r/kpop thread: [**EXO's Lay Ends Contract with Samsung**](https://www.reddit.com/r/kpop/comments/cpt2mh/exos_lay_ends_contract_with_samsung_electronics/ewrmg7c/) specifically re: Jackson and Got7. 

I didn't see anything about this in r/Got7 so I thought to do it first. 

What do you guys think of this whole situation? Looking forward to hearing responses!",50,43,False,self,,,,,
40,Got7,t5_2zrs4,2019-8-16,2019,8,16,7,cqwy56,youtube.com,[GOT7 Golden key ep.27] Mark X Youngjae Last story of the trip [ENG SUBS],https://www.reddit.com/r/Got7/comments/cqwy56/got7_golden_key_ep27_mark_x_youngjae_last_story/,kpopfangirl101,1565907328,,0,16,False,https://b.thumbs.redditmedia.com/7HtKYjCJbWO5jMDY4NDTZUPQzkDYHJseacekpzeZw2k.jpg,,,,,
41,Got7,t5_2zrs4,2019-8-16,2019,8,16,8,cqxvdo,vlive.tv,(ENG SUBS) Mark &amp; Youngjae - GOT2DAY 2019 EP 14,https://www.reddit.com/r/Got7/comments/cqxvdo/eng_subs_mark_youngjae_got2day_2019_ep_14/,valvietd,1565911590,,0,17,False,default,,,,,
42,Got7,t5_2zrs4,2019-8-16,2019,8,16,16,cr32bj,soompi.com,GOT7 Delays Upcoming Concert In Hong Kong Due To Safety Concerns,https://www.reddit.com/r/Got7/comments/cr32bj/got7_delays_upcoming_concert_in_hong_kong_due_to/,_fueledbycoffee,1565940880,,0,52,False,default,,,,,
43,Got7,t5_2zrs4,2019-8-17,2019,8,17,4,crbh6j,instagram.com,"88rising on Instagram: Due to unforeseen circumstances beyond our control, Jackson Wang will no longer be playing Head in the Clouds Festival.",https://www.reddit.com/r/Got7/comments/crbh6j/88rising_on_instagram_due_to_unforeseen/,_fueledbycoffee,1565984904,,12,30,False,default,,,,,
44,Got7,t5_2zrs4,2019-8-17,2019,8,17,6,crctnc,youtube.com,(ENG SUBS) 190816 JB - @prdsdef Insta Live,https://www.reddit.com/r/Got7/comments/crctnc/eng_subs_190816_jb_prdsdef_insta_live/,valvietd,1565991119,,3,40,False,https://b.thumbs.redditmedia.com/OcCAuY12m6N7d0JtD6m11AhxFGMQwKuuyw3QiCwZKNI.jpg,,,,,
45,Got7,t5_2zrs4,2019-8-18,2019,8,18,13,crwn8u,self.Got7,Is there a Got7 Golden Key giveaway?,https://www.reddit.com/r/Got7/comments/crwn8u/is_there_a_got7_golden_key_giveaway/,diamondKat31111,1566101506,Will they be giving out the stuff Mark and Youngjae got/made in the show?,0,11,False,self,,,,,
46,Got7,t5_2zrs4,2019-8-18,2019,8,18,21,cs0trt,reddit.com,GOT7s Yugyeom Shows Support For ASTROs Cha Eun Woo With Coffee Truck,https://www.reddit.com/r/Got7/comments/cs0trt/got7s_yugyeom_shows_support_for_astros_cha_eun/,kpopfangirl101,1566132799,,6,48,False,default,,,,,
47,Got7,t5_2zrs4,2019-8-19,2019,8,19,14,cscmnx,reddit.com,"Schedule: August 19, 2019 - August 25, 2019",https://www.reddit.com/r/Got7/comments/cscmnx/schedule_august_19_2019_august_25_2019/,Infinitize-It,1566192054,,0,18,False,default,,,,,
48,Got7,t5_2zrs4,2019-8-21,2019,8,21,9,ct8nub,self.Got7,GOT7 cheer guides,https://www.reddit.com/r/Got7/comments/ct8nub/got7_cheer_guides/,spotto_,1566345799,"Hey fellow ahgases, angels or shoebills. 

I'm going to go see GOT7 live, but I may need a little help on the cheer guides.

If you guys know any twitter accounts that post them all or if there's a master post or anything?

Please send them\~\~

Thank you so much and have an amazing week, (I mean we only got7 days in a week)",8,30,False,self,,,,,
49,Got7,t5_2zrs4,2019-8-21,2019,8,21,11,ctakea,vlive.tv,(ENG SUBS) JB &amp; Yugyeom - GOT2DAY 2019 EP 15,https://www.reddit.com/r/Got7/comments/ctakea/eng_subs_jb_yugyeom_got2day_2019_ep_15/,valvietd,1566355065,,0,8,False,default,,,,,
50,Got7,t5_2zrs4,2019-8-21,2019,8,21,13,ctbsta,self.Got7,keep spinning in melbourne!,https://www.reddit.com/r/Got7/comments/ctbsta/keep_spinning_in_melbourne/,pan_galactics,1566361894,anyone got GA tickets and want to come line up with me on Sunday? I have no friends to go with and I only bought one ticket rip.  would love to meet some melbourne aghase!!!,3,5,False,self,,,,,
51,Got7,t5_2zrs4,2019-8-21,2019,8,21,14,ctcl3c,self.Got7,Anyone going to the Melbourne tour stop this Sunday?,https://www.reddit.com/r/Got7/comments/ctcl3c/anyone_going_to_the_melbourne_tour_stop_this/,cheeseburgay,1566366874,"Hey guys! (I'm new to this subreddit so i'm sorry if i'm not posting correctly)

Keep Spinning in Melbourne will be my first Got7 and k-pop concert i've ever attended, and i will be going alone since none of my friends were able to come.

If there's anyone out there who want to travel with me (i'm coming to Rod Laver from the north side) or be friends in the queue or something please DM me!! I'd love to make some new friends because nothing hurts more than screaming the lullaby fanchant alone!!

For background info: I'm a friendly 19yo female and I go to uni in the city :) Jaebeom is my bias but ofc everyone else is a biaswrecker hahaha

Anyway please let me know if you wanna be friends :D

BONUS if you're sitting in Section 16 too!",7,4,False,self,,,,,
52,Got7,t5_2zrs4,2019-8-22,2019,8,22,13,ctsgi2,self.Got7,jinyoung photobook cost,https://www.reddit.com/r/Got7/comments/ctsgi2/jinyoung_photobook_cost/,iloveshu,1566448557,does anyone have any idea of an approximation of how much the photobook would possibly cost? I want to join a group order but i want to have an idea of how much id have to pay,2,6,False,self,,,,,
53,Got7,t5_2zrs4,2019-8-22,2019,8,22,20,ctvz63,imgur.com,"Jinyoung (GOT7) - 'HEY, GUYS' Photobook in Jeju (Teaser Images + Packaging)",https://www.reddit.com/r/Got7/comments/ctvz63/jinyoung_got7_hey_guys_photobook_in_jeju_teaser/,kpopfangirl101,1566472705,,1,14,False,https://a.thumbs.redditmedia.com/DtyYlnJuQozYZ_-15XR_tuAuTLMvRUDuon7inFdoMT0.jpg,,,,,
54,Got7,t5_2zrs4,2019-8-22,2019,8,22,20,ctw99c,i.redd.it,KCON Thailand 2019 Daily Line Up,https://www.reddit.com/r/Got7/comments/ctw99c/kcon_thailand_2019_daily_line_up/,kpopfangirl101,1566474342,,3,46,False,https://b.thumbs.redditmedia.com/dv8FloUwd-Y0loa0L800zhoqqmlSCy2XkpHudzGKDqU.jpg,,,,,
55,Got7,t5_2zrs4,2019-8-23,2019,8,23,10,cu6w18,self.Got7,In regards to GOT7 VLIVE+,https://www.reddit.com/r/Got7/comments/cu6w18/in_regards_to_got7_vlive/,spotto_,1566523414,"Hey Shoebills, Angels, baby birds, chickens, any bird on earth, ahagase, (tell me if forgot any) 

Do you guys have GOT7 VLIVE + ?

Is it worth it? 

Have a great life",3,5,False,self,,,,,
56,Got7,t5_2zrs4,2019-8-23,2019,8,23,11,cu7wtj,reddit.com,"GOT7 to hold GOT7 Fan Fest in Bangkok, 7 shows 7 members",https://www.reddit.com/r/Got7/comments/cu7wtj/got7_to_hold_got7_fan_fest_in_bangkok_7_shows_7/,kpopfangirl101,1566528964,,0,19,False,default,,,,,
57,Got7,t5_2zrs4,2019-8-23,2019,8,23,13,cu95hs,self.Got7,Did anyone go to the Sydney concert?,https://www.reddit.com/r/Got7/comments/cu95hs/did_anyone_go_to_the_sydney_concert/,PepperedPetunia,1566536158,"If so, how was it? Were there any memorable moments? And how was Jackson acting? I've been concerned about him with this whole HK thing that's been going on.",4,12,False,self,,,,,
58,Got7,t5_2zrs4,2019-8-23,2019,8,23,15,cu9tb0,goat.com.au,Not Even A Great K-pop Group Like GOT7 Can Make Double Denim Cool Again,https://www.reddit.com/r/Got7/comments/cu9tb0/not_even_a_great_kpop_group_like_got7_can_make/,anonamas,1566540511,,12,23,False,https://b.thumbs.redditmedia.com/hGHOhDnJkNbY1k7qimo5YAWDTfX8-IvMcUSypZ4xFwY.jpg,,,,,
59,Got7,t5_2zrs4,2019-8-24,2019,8,24,14,cup9fl,self.Got7,GOT7 Quiz 2019: How Well Do You Know GOT7?,https://www.reddit.com/r/Got7/comments/cup9fl/got7_quiz_2019_how_well_do_you_know_got7/,KpopStarsQuiz,1566623053,"## [GOT7 Quiz 2019: How Well Do You Know GOT7?](https://www.kpopstarsquiz.com/snax_quiz/got7-quiz-2019-how-well-do-you-know-got7/)

This quiz is for all IGOT7s. Play and Enjoy!!

[https://www.kpopstarsquiz.com/snax\_quiz/got7-quiz-2019-how-well-do-you-know-got7/](https://www.kpopstarsquiz.com/snax_quiz/got7-quiz-2019-how-well-do-you-know-got7/)",2,13,False,self,,,,,
60,Got7,t5_2zrs4,2019-8-24,2019,8,24,22,cut6oh,/r/Got7/comments/cut6oh/jb_liked_a_picture_of_skzs_chans_abs_im_crying/,JB LIKED A PICTURE OF SKZS CHANS ABS IM CRYING,https://www.reddit.com/r/Got7/comments/cut6oh/jb_liked_a_picture_of_skzs_chans_abs_im_crying/,violetlyviolent,1566652133,,6,119,False,https://b.thumbs.redditmedia.com/XZ4A2KxNCxXpufGOlE7nuE84cac0t5D8NoRQySFEiOA.jpg,,,,,
61,Got7,t5_2zrs4,2019-8-25,2019,8,25,13,cv3x4b,self.Got7,Heads up if youre going to the Melbourne concert tonight,https://www.reddit.com/r/Got7/comments/cv3x4b/heads_up_if_youre_going_to_the_melbourne_concert/,dimsimprincess,1566706077,"You should visit the Ticketek website and re-download your tickets if you bought in the upper section. It looks like they have closed the upper section and reallocated tickets to the lower section like what happened in Sydney. I opened the link in the text message Ticketek sent to me and it said the ticket was no longer available, but I was able to get the new ticket from my account on the Ticketek website.",0,28,False,self,,,,,
62,Got7,t5_2zrs4,2019-8-25,2019,8,25,14,cv4hmc,self.Got7,Recommendations for someone re-entering the fandom,https://www.reddit.com/r/Got7/comments/cv4hmc/recommendations_for_someone_reentering_the_fandom/,sabooyah,1566709802,"So in 2014 I was a multifan, but GOT7 was one of my favorite debuts and I latched on pretty quickly. Enjoyed all their content, watched all the videos, etc. Kept it up for a while but my interest in kpop started winding down and GOT7 ended up being one of the first groups I dropped, the last thing I remember kinda enjoying was 'Just Right' because by the time 'If you do' came out I was completely disinterested.

I never truly dropped kpop 100% but pretty much haven't been part of a fandom in 3 years. But about a month ago one of GOT7's recent American interviews came up on my youtube recommended, I watched it and felt nostalgic so I dug up a few more videos. THIS WAS A BAD IDEA because now im hardcore slipping back into being a fan again after essentially 4 years of ignorance...regrets

So I'm looking to see if anyone can help me with like, a GOT7 sparknotes version. They have so much content and I feel overwhelmed just looking at their vlive page, I've already watched both hard carry series and the jeju miniseries but have no idea what to watch next. Are there any core moments/varieties that I should watch? Anything I should know as a (sort-of) new fan? Memes? Lol

My bias is and has always been Jinyoung (weird to call him that now bc he's still Jr. to me in my head lmao) but now also Jackson, surprisingly, as I didn't like him much before. But I still like all other members too, any help is gratefully appreciated ;;",2,10,False,self,,,,,
63,Got7,t5_2zrs4,2019-8-25,2019,8,25,15,cv4x2k,self.Got7,How long is the average Spinning Top Tour concert?,https://www.reddit.com/r/Got7/comments/cv4x2k/how_long_is_the_average_spinning_top_tour_concert/,throwaway123180,1566712896,"Really random question, but I wanna know how long the concert goes on average because I was planning to go to a restaurant for dinner after the concert finished but they close at 10pm and the concert is supposed to start 7:30pm.",3,2,False,self,,,,,
