,date,year,month,day,hour,id,title,author,created,selftext,num_comments,score
0,2016-8-1,2016,8,1,9,4vjzhg,I'm confused,SARAHSARAHPEARL,1470012770,"So, I'm fairly new to bangtan, but the song Epilogue:Young Forever is very sad sounding, and sounds like it's the end, and the MV says 2015.04.29~forever. the lyrics are very sad and ending like. does this mean that bangtan will be over soon? does 'epilogue' pertain to the album or the group? that song makes me so sad, the thoughts going through their head. please help me out. ",8,6
1,2016-8-1,2016,8,1,11,4vkde4,160731 KCON LA 2016 Livestream &amp; Discussion,jsf1101,1470018590,"[Here's the link for the KCONLA Livestream!](http://KCON.TV/LIVE)

I watched the stream last night and it would randomly crash at times but you just have to reload the page and it should start back up! (hopefully..) Since BTS is headlining they should be going last so that will be within the last hour. Enjoy guys!! :)


Edit:  **STREAM IS BACK UP**

",70,31
2,2016-8-1,2016,8,1,12,4vknre,J-Hope's ass is on Fire,PotassiumAlum,1470023263,,5,27
3,2016-8-1,2016,8,1,15,4vl5mw,160801 SBS God's Work with Jimin and J-Hope airs today at 11PM (KST),min_turtle,1470032441,,6,24
4,2016-8-1,2016,8,1,15,4vl8rl,160801 The Jungkook-way to end Kcon.,min_turtle,1470034291,,8,37
5,2016-8-1,2016,8,1,15,4vl93a,BTS Kcon at LA entire performance.,EndyLovah,1470034470,,27,98
6,2016-8-1,2016,8,1,17,4vlgz4,BTS Reunite with Tony from AHL,girlsnotgray,1470039363,,11,101
7,2016-8-1,2016,8,1,23,4vmuok,BTS in suits KCON LA 2016 RED CARPET,motionless-min,1470062951,,17,53
8,2016-8-2,2016,8,2,3,4vnub1,My Impact,tempkpapaccount,1470074523,,5,0
9,2016-8-2,2016,8,2,3,4vo00k,"Finally a part 3 of Jimin Imagine ! I think it escalated that quickly. Don't worry though! The next one will be better, and I may put some surprise in it ;) *wink* *wink*",fraancxs,1470076347,,0,0
10,2016-8-2,2016,8,2,6,4vozk4,160801 God's Workplace (J-hope and Jimin cuts),dorkprincess,1470087941,,4,24
11,2016-8-2,2016,8,2,12,4vqfy1,Post your unpopular bts/bighit opinion,[deleted],1470107503,[deleted],164,16
12,2016-8-2,2016,8,2,17,4vrf48,160801 God's Workplace - J-Hope and Jimin cut,min_turtle,1470125139,,3,24
13,2016-8-2,2016,8,2,17,4vrj1h,[Throwback] No More Dream (bus scene long take ver.),screambledeggs,1470127928,,5,12
14,2016-8-2,2016,8,2,18,4vrkgp,"160802 Another photo in Tae's ""How is he even real?!"" twitter series",min_turtle,1470128830,,12,72
15,2016-8-2,2016,8,2,22,4vscnk,160802 V LIVE - BON VOYAGE EP5.    (Cheerful BTS's party in the cruise),mllelingling,1470143457,,60,38
16,2016-8-3,2016,8,3,0,4vt2g5,The fascinating phenomena of the Bangtan Boys,dorkprincess,1470152489,,23,24
17,2016-8-3,2016,8,3,0,4vt40y,"160730 Music Core Jimin, Jungkook Special MC",dorkprincess,1470152981,,0,18
18,2016-8-3,2016,8,3,2,4vtqfp,Flower Crew Ep. 1 (Full) + Duet Song Festival,screambledeggs,1470159872,,3,7
19,2016-8-3,2016,8,3,3,4vu1qc,BTS Crack #19 - V the perv,screambledeggs,1470163229,,4,10
20,2016-8-3,2016,8,3,3,4vu57q,I made a Hobi bleachshirt yesterday!,BrigidAndair,1470164311,,19,74
21,2016-8-3,2016,8,3,12,4vwhxc,A look at some of photos from the upcoming BTS Summer Package in Dubai,[deleted],1470194404,[deleted],0,1
22,2016-8-3,2016,8,3,12,4vwi8q,"Starcast: ""Join us on a summer vacation! #BTS in Dubai""",jsf1101,1470194545,,26,28
23,2016-8-3,2016,8,3,14,4vx0tb,160803: Hobi's tweet,chiisquare,1470203489,,15,54
24,2016-8-3,2016,8,3,15,4vx2r2,"[Personal] 6 weeks ago, BTS really did save me when I was locked in a psych ward (trigger warning)",lurburr,1470204556,"Ive held off on writing this because I knew I needed time to figure out what I wanted to say, and because truthfully its a difficult story for me to tell (which is why only my roommate knows).    
    
Im choosing to share it here because this is my BTS home and Im eternally grateful for the people here and the break this sub has given me from those days where things just felt too hard to keep going. Ive written about my health issues and my subsequent intro to kpop [here on the 4th comment down](https://www.reddit.com/r/bangtan/comments/4jv09r/bts_%EB%B6%88%ED%83%80%EC%98%A4%EB%A5%B4%EB%84%A4_fire_mv_reaction_massive_argentinian/) so Ill leave that for you to view if youd like the deets.    
    
So  just how did I end up in shackles in the back of an ambulance on my way to Nightmareville six weeks ago?    
    
Intense sleep deprivation plus the inability to manage pain levels from my surgeries (plus my doop doop MD lowering my pain meds during this time) and from my life coming to what felt like a dead end.  I hadnt slept more than 2-3 hours at a time for about 3 years due to my heart issues, then the pain/issues from the surgery and messed up blood just ended up being too much.    
    
Guys  I just wanted off the ride.  There was nothing that I could see that gave me any reason to stick around and I felt I was done.  My kids were grown and gone, Ive been single forever, I look like Gilbert Grapes mom (at least with better hair) and even the simplest tasks have become  impossible.    

*(cutting/suicide triggers ahead sweethearts, skip to the last 3 paragraphs if you need to)*
    
The less sleep I got, the more upset I got - the more gnarly panic attacks I had which made everything worse.  Finally, I slashed myself up on my stomach.  For me it seemed reasonable at the time because I was ready to be gone for good.  The cutting was my attempt to give it one last shot (after 10 years of not doing it).  Although it worked, I **way** overdid it and my skin was coming off in little ribbons.  The fact that I take blood-thinners meant it was a total mess and my sweet roommate had to help clean it up.  I was still so disconnected from myself I just saw her face turn grey but I didnt think much else of it.    
    
Because she is amazing, she got my cardiologist to pull strings and the next thing I knew I was at Kaiser a few days later answering questions about how I felt and if I had planned out my suicide.  Somewhere in my head, I knew this whole scene wasnt good (and Im not a liar by nature) so I told the whole ugly truth -- and about an hour later my fat ass was in the back of an ambulance on the way to my newest adventure.    
    
What can I say about the next 5 days of my life?  This is where it gets hard for me to explain.  Ive got some trauma there, I know.  Basically the staff at the place I was sent to decided to treat my psych needs only.  I got sleeping meds and Prozac (beautiful stuff) but they refused my pain medications and the anti inflammatory meds that unlock my joints so I can walk.  They denied all of it.    
    
This meant I couldnt walk anywhere and I couldnt do anything but cry.  In the morning I would drag myself down to the day room with the scary bullies who forced everyone to watch what they wanted (sports, sports and more sports).  Because I was stuck there, I pushed myself to run BTS songs through my head over and over and over.  It was the only thing I could do that was of any comfort.  There was no music allowed, the tv was blasting and people were screaming, throwing things, fighting with staff, etc ALL THE TIME and in virtually every room.    
    
(Note: Going into more detail has started making me upset.  Although I now have a deep wound on my leg from their neglect [nsfw but fine if you like gross stuff](http://imgur.com/a/z1gLi).  Most importantly to me, I can now appreciate how much strength I have AND I've made a lifelong friend who I call ""Single Serving Ben"" and we check up on each other constantly so I'll stop there.)    
    
Regular scary things aside, why was it so hard you ask? Although there was a schedule for me to get my pain meds, they messed around with it regularly.  If I complained (really I just cried) theyd drag it out longer.  So ultimately I decided to challenge my brain to be patient and my body to be quiet and restful.  This was all because I remembered [this clip](https://youtu.be/6HReEjtQuq4?t=11m40s) of Jungkook talking about how his thighs hurt but he kept going with that sweet way of his.  Suga and even Rap Monster talking about how exhausted they were on that video as well  but they all kept going, rehearsing and rehearsing and rehearsing to get it perfect.    
    
I knew I couldnt do anything about my physical issues, but I wanted to train my brain like they were.  After a long day of mayhem, it was hard to think straight with all of the noise but I grabbed a rubber pencil (yes, they were virtually impossible to write with) and [I started writing out all of the kpop bands I could think of](http://i.imgur.com/VT3GbuK.jpg?1).  My heart grew lighter as I remembered all bands that I had come to know and love because I fell in love with BTS.  It helped and before I knew it, it was bedtime.    
    
The next day was harder, they were supposed to let me go home that day but used a technicality to make me stay another day.  I was really, really angry and knew I was in danger of getting myself stuck there even longer (at this point they were threatening a 13 day hold).  So I went back to BTS.  I used the list Id made the day before and [I started writing out](http://imgur.com/vVW2Lc6) the bands, members and songs from the list I had written out the night before. While I did it, Id play the songs in my head like a record player.    
    
Im crying while I write this because it is difficult to explain how much this helped.  How much time it killed, how important it was for me to feel like I wasnt completely insane and mostly, how great it was to just sit and remind myself of all of the things Id watched and loved so much (and usually find out about in this sub).  How [silly Princess Jin is](https://youtu.be/eoz5_BP5mFs), how [kind Jimin is](https://youtu.be/VuZm-JNLcc0), [Grandpa Suga running](https://youtu.be/7_fe7ZYRkqc), [Taehyung teasing fans](https://youtu.be/hfdX6SqqHCg), [nervous smol bean Jungkook](https://youtu.be/C8LlUYM32RA), [J-Hope in the elevator prank](https://youtu.be/AEyanI5Z9Cc) and [Rap Monster missing his babies](https://youtu.be/d4bCr2EFXN0).  As I sat there, trying my best to not plug in to how loud it was, how much I hurt and how scared I felt... I would think about these different things and smile - really smile.  It helped so much.    
    
The last night there, they held my medication on purpose.  They told me to go to bed and theyd wake me up in an hour to give it to me.  I knew they wouldnt (learned experience) and I knew I wouldnt be able to walk out of the building the next day if I didnt have it before bed.    
    
So I sat down and [I wrote out](http://i.imgur.com/zoScQTi.jpg?1) every video I could think of and what the theme was or what was significant about it.  The entire time I did this, I was playing Save Me on repeat in my head and catching the tears as they dropped off my face.  Lights off was at 10pm so everyone else was gone and it was obvious the staff thought I would give up. I could tell they were shocked that I waited up until 11:15  that I sat quietly in the break room (they even closed up the day room so I couldnt sit in a comfortable chair).  I didnt care what they did and I reminded myself this was just their petty attempts at making more money off of my troubles.  I knew I was going to get out of there and I knew that my sweet boys from BTS would help.    So I made it to 11:15, naturally they dragged it out another 4 minutes but I took my meds and went to bed, knowing they had to let me go home because I made it through without flipping out.  Silly, they just didn't know I had [my secret weapon](https://youtu.be/GZjt_sA2eso).        
        
Things have since settled down in the last 6 weeks.  Im still sick from the heart and blood stuff, but I sleep through the night now and it makes a huge difference.  All the while, I have kpop running pretty much 24/7 in the background of my life.  It's what keeps me from feeling lonely, what makes me laugh, sing at the top of my lungs and even try harder to be better.    
    
So, this is quite a massive post - why did I write all of this out?  Well for you of course honey.  Maybe you are reading this and can relate because youre also having a hard time.  Perhaps you know someone who is hurting and you dont know what to do, I certainly understand.  Mostly I want my ARMY family to know my story and to know I adore you all and I'm here if you need someone to listen to you.    
    
Things can be so hard sometimes.  Life goes in weird directions, people leave, jobs suck  whatever it is, I know it can be miserable.  Maybe you could try some of the tricks Ive learned  or just send me a pm if you need someone to love on you.  Im right here.    
    
xoxo,    
Laura

*EDIT 8/4:  I am so overwhelmed by your beautiful responses. I'm at work now but I promise to respond to every single one of you as soon as I can.  Thank you so much for your encouragement, advice and love.  I actually went to bed last night promising myself I would leave this up even if it got zero attention or feedback just in case it helped one person.  It is obvious I owe you all an apology for so greatly underestimating the generosity of my ARMY family.*    
**EDIT 8/6:  I'm slowly responding to everyone.  Because I'm part computer, I printed out the list of everyones replies with oldest first and I'm writing a little letter in reply.  Basically I'm pretending I've pulled out the super sweet ""correspondence kit"" I had back in the 70's when I would write letters to my beloved Grandma Lee.  SO - if you haven't gotten a reply from me yet, I promise you will, it's just taking a little time because I want to make sure I give you the personal attention you gave me.  xoxoxo""**",37,66
25,2016-8-3,2016,8,3,18,4vxl22,When do you think the next comeback should be and what do you hope to see from it,CupcakeMaster97,1470215002,"I believe there was another post like this a while back, but I figured why not make another lol.  I was thinking about it and I think a number of people are still hoping for a comeback the end of this year. 

I doubt there will be one, and I say its a good thing. With the Japanese Album coming out and Yoongi's mixtape, I feel a comeback just wouldnt fit, it wouldnt be as hyped, and it would be so messy releasing so much stuff in a go

I think maybe next comeback would be next year perhaps around the same time when Fire was released

As for concept, I have no idea! Like we've been with HYYH for a while now, I have no idea what to expect from the next comeback, what do you guys think? 

I know a lot of people want romance concept but a lot of groups have done that one (so did BTS, boy in luv counts right?) I actually want to see something completely new! But I knida doubt it, making original concepts isnt exactly easy peasy.

I also wouldnt mind another concept like Dope or Fire I guess, I know they just did one but I love styling and stuff for MVs like that, the songs are energetic and the choreo is great so its really fun to watch

And kind of unrelated, but since we are talking about the future, what do you hope for them in terms of success, a lot of people say they are almost at their peak but I simply refuse to acknowledge that, cause I want to see them rise more and more!


So what do you guys expect and hope for?",31,26
26,2016-8-3,2016,8,3,22,4vyhee,Anyone know how to record scren on v live +?,bangtanismybae,1470231018,[removed],0,1
27,2016-8-3,2016,8,3,23,4vyotz,"[160803] """" (JungJiNam - Jungkook Jimin Namjoon)",jsf1101,1470233694,,14,64
28,2016-8-4,2016,8,4,5,4w0t7g,What songs should I listen to that are from BTS?,JellyNPeanut,1470257832,"Hey guys, I've recently really gotten into BTS after listening to some of their songs. I've only listened to all of their MV songs, the cyphers, rapmonsta singles, and 1verse. I love all these songs and wanted to ask what other songs should I listen to?
",25,18
29,2016-8-4,2016,8,4,7,4w157h,"Hit The Stage Reveals Plans To Cast EXO, BTS, And GOT7",EndyLovah,1470261670,,12,40
30,2016-8-4,2016,8,4,11,4w2ek7,ooc bangtan lyrics,yyuxin,1470278970,"What's the funniest/weirdest/out of context/most lost in translation lyric of bangtan you've heard?

Ex. ""I'm a whale"" - JK",38,21
31,2016-8-4,2016,8,4,21,4w4ai2,BTS Vocal Analysis: V | K-pop Vocalists' Vocal Analyses,klmnumbers,1470314173,,21,51
32,2016-8-4,2016,8,4,21,4w4ap6,BTS Vocal Analysis: Jungkook | K-pop Vocalists' Vocal Analyses,klmnumbers,1470314269,,11,36
33,2016-8-4,2016,8,4,22,4w4gly,160804 [V LIVE] [GIFT VOD] BON VOYAGE Behind cam EP5,mllelingling,1470316782,,18,30
34,2016-8-5,2016,8,5,3,4w5y6f,Suga's mixtape was supposed to be released as a surprise,smilingpanda13,1470334681,,29,66
35,2016-8-5,2016,8,5,3,4w63es,[160804] Interview with  app!,chiisquare,1470336330,,6,17
36,2016-8-5,2016,8,5,6,4w710n,Opportunity to get V-App Coins! The 4th Chemi beat challenge,wakeupnowsun,1470347475,"So, this is only slightly related to BTS, plz remove if necessary, but free coins on V-App is useful for watching their stuff, right?
The 4th Chemi beat challenge is on! This time it is for Twice (First was EXO, 2nd Bts, 3rd was B.A.P? I missed the 3rd one...)
So if you increase your Chemi beat score to level 2 by the 6th on Twice's V-App page you will receive free coins. You also need to comment on The V+ preview video on the Twice channel.

https://campaign.naver.com/vliveplus/en/event/chemibeat-twice.nhn#",0,12
37,2016-8-5,2016,8,5,9,4w7nfj,I Need U Remix,shydrummer,1470355468,,2,7
38,2016-8-5,2016,8,5,9,4w7rck,Where does this photoshoot come from?,chiisquare,1470356979,"[This](https://bangtannoonas.tumblr.com/post/148419916950/905-918endless-edits-of-bangtan) is what I'm referring to! Judging from their appearances and hair color, it looks like something from 2014.",2,8
39,2016-8-5,2016,8,5,10,4w809s,Here's a new video of Jimin Imagine Try not to cry or fangirl?  Maybe?,fraancxs,1470360610,,0,1
40,2016-8-5,2016,8,5,10,4w80kh,[Speculation] Jungkook to appear on masked singer this Sunday?,fluffymushroom757,1470360727,,4,27
41,2016-8-5,2016,8,5,11,4w8a8c,THE MUSHROOM HAIR IS GONE,hoseokked,1470364888,,23,78
42,2016-8-5,2016,8,5,13,4w8maf,[PANN] Let Me Tell You How Awesome Their HYYH Concept Is,fluffymushroom757,1470370227,,1,10
43,2016-8-5,2016,8,5,16,4w9c0c,VKookie art c:,Poppymix,1470383520,,2,11
44,2016-8-5,2016,8,5,22,4wacf7,[160805] Jin's selfie,jsf1101,1470403201,,7,55
45,2016-8-5,2016,8,5,22,4wafqy,What's your favourite piece of Bangtan trivia?,StaRapture,1470404479,,27,19
46,2016-8-5,2016,8,5,22,4wafx7,"BTS to receive V LIVE's 1st Anniversary gift event (w/ EXO, GOT7, iKON and SVT)",[deleted],1470404541,[deleted],0,1
47,2016-8-5,2016,8,5,22,4wahj2,"BTS to receive V LIVE's 1st Anniversary gift event (w/ EXO, GOT7, iKON and SVT)",[deleted],1470405146,[deleted],0,1
48,2016-8-5,2016,8,5,23,4waj8v,"BTS to receive V LIVE's 1st Anniversary gift event (w/ EXO, GOT7, iKON and SVT)",nuede,1470405765,,3,46
49,2016-8-5,2016,8,5,23,4wajkn,(Question) Lyrics in Let Me Know,madbsy,1470405886,"So in the opening lyrics, V sings:

   

   


mamuridweni seonyoor wiesseou

na horro beotigo isseo

(Sorry, I'm not very good at changing hangul to romanized).


Which I have seen always translated as:

On top of this ending melody

I am standing here alone


Roughly translated by my slight knowledge of Korean, it's more accurately:

At the finish of this melody, on top

I alone standing.


But wait. 

"""" sounds like the konglish word for ""vertigo."" In the recording, I've always noticed that V uses a slight ""v"" sound whenever he says that word, but I blew it off as my not listening correctly. But truth be told, if anyone can accurately pronounce the ""V"" sound, its... well V...


However, if the word really is ""vertigo,"" it adds a whole deeper meaning to the lyrics just by changing this one word! It would roughly now be:

I am standing here with vertigo (It sounds better and makes more sense in Korean obviously).


Oooh doesn't that just fit the dark undertones of this song?? And really the whole Dark and Wild concept?


Word by word:

 = I  = alone  = vertigo  = exists

I am alone with my vertigo.


Can anyone confirm me on this?

P.S. If we're gonna get extra technically, """" is another word for hall and """" can be roughly translated as ""the way/of the ___ /by the way of the____."" So it could mean that by the way of the hall is where he is standing. But that's a whole other bag of beans.",3,12
50,2016-8-6,2016,8,6,1,4wb3or,My arrangement of House of Cards (Full Length Version),dentedwing,1470412903,,8,12
51,2016-8-6,2016,8,6,2,4wbogj,What is your favorite harmonized moment between the members ?,taegjbear,1470419653,"[Mine is when Jungkook &amp; Taehyung harmonized in Move](https://twitter.com/taecypher/status/727358852493021184)

Edit: word",14,24
52,2016-8-6,2016,8,6,3,4wbvx5,[speculation] wonder girls's sunmi is gonna be in yoongi's mv,[deleted],1470422037,[deleted],3,3
53,2016-8-6,2016,8,6,5,4wcdxp,"Namjoon praising Yoongi, confirmation of 2nd mixtape, tears are shed everywhere",ABlackUnicorn,1470427921,,26,121
54,2016-8-6,2016,8,6,9,4wdgir,[ENG] BTS Interview @ Idol ,smilingpanda13,1470442177,,2,32
55,2016-8-6,2016,8,6,12,4we97t,What member would you get along best with?,etherealemilyy,1470455070,"Friend wise, mainly. But you could also tell us who you're most alike or who you think you could date and have a good relationship with :) Or if you want, you could tell us where you think each member could fit in to your life! 

I'll post my response in a little bit. ",34,16
56,2016-8-6,2016,8,6,14,4wenx6,Hoseok says hi,II_Shwin_II,1470462822,,5,27
57,2016-8-6,2016,8,6,16,4wexml,[ENGSUB] BTS at morning news in Thailand,EndyLovah,1470468600,,7,28
58,2016-8-6,2016,8,6,21,4wfmbj,BTS () - The Most Beautiful Moment in Life () Trilogy Piano Remix,Pikabouh,1470484810,,0,10
59,2016-8-6,2016,8,6,21,4wfmwk,Bangtan as the 7 Deadly Sins,ABlackUnicorn,1470485157,"Hey everyone!

I saw the question of which member would best fit a specific sin in a FB group I'm in, and I thought it'd be a cool discussion to bring to r/bangtan. For those who don't know, the [7 Deadly Sins](http://www.deadlysins.com/) are pride, envy, wrath, gluttony, lust, sloth, and greed. I felt like the other discussion was a bit uninspired, so I thought I'd ask you all, who analyze every single bit of the boys' personalities as I do which member you think shows each trait most. This isn't meant to denigrate them in any way- we all have our weaknesses, of course! This is simply meant to be a fun, interesting discussion :)

So, let me know!

Also, has anybody made this into a fic yet? Because this is prime fanfiction material!",9,12
60,2016-8-6,2016,8,6,23,4wg1ty,What happened to the subunit that was supposed to debut last month?,[deleted],1470493383,[deleted],2,1
61,2016-8-6,2016,8,6,23,4wg1v1,BTS - I NEED U (Remix by Me!!) Let me know if 'U' like it ^-^,556pm,1470493395,,2,6
62,2016-8-6,2016,8,6,23,4wg42l,"160806 BTS LIVE  on stage : epilogue in Bangkok -Run, Danger &amp; Intros",LovesBigWords,1470494462,,3,30
63,2016-8-7,2016,8,7,1,4wgfio,[160806] BTS' Post Epilogue in Bangkok twitter posts,jsf1101,1470499250,"* [Big Hit's post](https://twitter.com/bts_bighit/status/761938872041246720)

* [Hobi](https://twitter.com/BTS_twt/status/761935828914278401)

* [Yoongi](https://twitter.com/BTS_twt/status/761945246930395137)

* [Jimin](https://twitter.com/BTS_twt/status/761986320453410816)

will edit if other members post~

Edit: added Jimin",3,23
64,2016-8-7,2016,8,7,2,4wgu6p,Get Free Coins with the BTS Trans (as in translation) Project,keymanthan,1470504802,,1,21
65,2016-8-7,2016,8,7,9,4wijn9,Really excited for v's scene but don't really know how to react about the kiss...............hby,ZeyHyung,1470529065,,21,5
66,2016-8-7,2016,8,7,11,4wj1yd,[Fancam] 160806 Jimin Cries After Seeing Thai ARMY's Project (Epilogue in Bangkok),smilingpanda13,1470537190,,10,28
67,2016-8-7,2016,8,7,15,4wju2p,The Most Beautiful Moment In Life.,fluffymushroom757,1470552417,,4,81
68,2016-8-7,2016,8,7,16,4wjvh3,"This is a Korean reaction, but they then talk about BTS popularity in Korea and it turns into a really interesting look at how Korean fans see BTS and especially how they see Bighit and their popularity and how the company handles BTS.",shellycjd,1470553272,,14,54
69,2016-8-7,2016,8,7,18,4wk819,(Sounds like) Jungkook on King of Masked Singer!,girlsnotgray,1470561996,,21,48
70,2016-8-7,2016,8,7,21,4wkpy1,Full Cut of Jungkook on King of Masked Singer (Memelord Extraordinaire),Rubyrues,1470574192,,17,80
71,2016-8-8,2016,8,8,1,4wljea,Wonder girls sunmi supposedly to appear on suga new mv,Stark291,1470587895,,5,0
72,2016-8-8,2016,8,8,2,4wlogh,Do you see the @BTS_twt account?,motionless-min,1470589831,I wanted to check their tweets and twitter says that page doesn't exist?? Is this just happening to me ?,33,16
73,2016-8-8,2016,8,8,3,4wm0ty,BTS Makes Waves on Billboard + Twitter Top Tracks Chart,PotassiumAlum,1470594607,,4,32
74,2016-8-8,2016,8,8,4,4wm64g,When did Jungkook say he hates reading vulgar responses from International ARMYs?,CupcakeMaster97,1470596571,"I heard people say this before, I'd just like to know when he said (mostly cause I dont believe he made the distinction between international and korean cause that would piss so many people off lol)",12,7
75,2016-8-8,2016,8,8,5,4wmkiw,BANGTAN drama on Twitter,saraaacha,1470601842,Can someone explain to me what is going on? I see so many tweets about them blocking certain people or fans being perverted. Can someone explain? ,9,4
