,date,year,month,day,hour,id,title,full_link,author,created,selftext,num_comments,score
0,2013-3-15,2013,3,15,0,1aadyf,Hey r/datascience. Looking for help with a data problem help!,https://www.reddit.com/r/datascience/comments/1aadyf/hey_rdatascience_looking_for_help_with_a_data/,chehoebunj,1363274734,"I'm doing some data analysis on analytics for mobile games. The attributes include stuff like installs, daily active users, sessions, in app purchases, etc etc. The issue lies in that I'm using several data sources including analytics from flurry, distimo, app annie and Google Analytics.

Are there any great web tools for extraction, transformation, and loading of this data for reporting purposes. A way to visualize and come to conclusions on several assumptions?

Any help is welcome!",0,2
1,2013-3-16,2013,3,16,13,1ae7od,GOI HACKATOHN (Data Science Contest),https://www.reddit.com/r/datascience/comments/1ae7od/goi_hackatohn_data_science_contest/,[deleted],1363408302,,0,1
2,2013-3-17,2013,3,17,23,1agpcq,"""The gap left by Google will not take long to brim with hopeful upstarts.""",https://www.reddit.com/r/datascience/comments/1agpcq/the_gap_left_by_google_will_not_take_long_to_brim/,maxgreco,1363529156,,0,1
3,2013-3-20,2013,3,20,2,1alrxg,Researching With Twitter Data: Download Full Twitter Archives From Multiple Users,https://www.reddit.com/r/datascience/comments/1alrxg/researching_with_twitter_data_download_full/,Reiver,1363714773,,0,1
4,2013-3-20,2013,3,20,3,1alws7,Visualizing How Things Go Viral,https://www.reddit.com/r/datascience/comments/1alws7/visualizing_how_things_go_viral/,Reiver,1363718295,"What does it mean for online content to ""go viral""? An analysis of almost a billion information cascades on Twitter news, videos, and photos has produced the first quantitative notion of whether something has indeed gone viral, thereby enabling further research into topic experts, trending topics, and viral-incident metrics.",0,1
