,date,year,month,day,hour,id,title,full_link,author,created,selftext,num_comments,score
0,2014-7-1,2014,7,1,13,29jcz9,LACs with good CS degrees?,https://www.reddit.com/r/computerscience/comments/29jcz9/lacs_with_good_cs_degrees/,[deleted],1404189442,"Quick Question: I am currently on a quest to find 5-7 colleges for me to submit to this fall. I have a 3.5 GPA and I'm planning on going into school for Computer Science. 

Obviously, I have done my research and found some of the best schools for CS, even looking at ROI, but they all happen to be either A) Expensive B) Selective (too selective for my so-so 3.5 :/ ) or C) huge. While there are some attainable public schools in the top 20 like Purdue (in-state for me), UIUC, UT Austin, and University of Michigan, they all fall under that C point, they're huge. Does anyone know of a smaller school (that isn't impossibly selective) that has a fairly good CS department? Or does it look like I should get over the size and go to my in-state gem, Purdue? Thanks!",5,1
1,2014-7-2,2014,7,2,1,29kqye,Going to be away from computers for a year. What should I read to improve myself?,https://www.reddit.com/r/computerscience/comments/29kqye/going_to_be_away_from_computers_for_a_year_what/,Reisor,1404233984,"We've got mandatory military service and I'm going for a year. I've been told theres free time later on which can be used to read books etc. Are there any that can help me when I return to computers and go back to school? 

Like mentality etc. I cant imagine reading a book on say java being that helpful without a computer to try/learn/code on.",3,3
2,2014-7-2,2014,7,2,19,29n2g4,advance java course in delhi,https://www.reddit.com/r/computerscience/comments/29n2g4/advance_java_course_in_delhi/,croissantt,1404297415,,0,0
3,2014-7-3,2014,7,3,14,29pvcu,Server 2012 Partition Software  Good Assistant for Partition Management,https://www.reddit.com/r/computerscience/comments/29pvcu/server_2012_partition_software_good_assistant_for/,BlakeClaire,1404365485,,0,0
4,2014-7-4,2014,7,4,7,29s27a,What is the difference between Computer Science and Computer Engineering? (x-post /r/ComputerEngineering),https://www.reddit.com/r/computerscience/comments/29s27a/what_is_the_difference_between_computer_science/,FlavioWander,1404426168,,2,5
5,2014-7-4,2014,7,4,13,29svln,Is a BS in Computer Science really worth it?,https://www.reddit.com/r/computerscience/comments/29svln/is_a_bs_in_computer_science_really_worth_it/,lolwhatsausername,1404447722,Does a BS in Computer Science help when looking for a job to the point that it's worth paying the cost of college?,13,4
6,2014-7-5,2014,7,5,10,29vcjm,Summer projects to brush up?,https://www.reddit.com/r/computerscience/comments/29vcjm/summer_projects_to_brush_up/,PopRockRoll,1404525479,"So I am a senior in high school, and I wanted some Java/ python projects to brush up on my coding. I feel like I need the practice before I got into college, or is that not true? Do you start from the beginning anyway? Anyway, the only teaching I had was Codecademy and a shitty Virtual High School course. Is there anything I can do to keep busy?",4,7
7,2014-7-6,2014,7,6,8,29xigu,Beginner Program to download for someone interested in CS?,https://www.reddit.com/r/computerscience/comments/29xigu/beginner_program_to_download_for_someone/,lampeon,1404602794,"Im taking an intro class for computer science next fall and I was wondering if there is any programs I can download for free and mess around on. (programming and such) I've heard of C++ and Java but I dont really understand how to get them to work. I've looked at some free online courses but they're just lectures. I guess im looking for something more interactive.

Just a heads up I use a MacBook Pro 2013

Thank you!",10,1
8,2014-7-6,2014,7,6,15,29yap7,best service for computer repair,https://www.reddit.com/r/computerscience/comments/29yap7/best_service_for_computer_repair/,aryanittu1,1404627930,,1,1
9,2014-7-6,2014,7,6,18,29yhp7,Career Advice for a Computer Science Student,https://www.reddit.com/r/computerscience/comments/29yhp7/career_advice_for_a_computer_science_student/,sohaibhsyed,1404638159,"Hey Reddit, I just finished up my first year in community college en route to transferring to a 4-year university. I am majoring in Computer Science, and the last course I took was an introductory C++ class. From high school, I also know a little bit of HTML, CSS, and Javascript. I need ideas on what I can do in my time outside of class, including this summer. I have heard that you can create projects online, but I have no idea on how to begin with that. With the skills I have, what should I do next? I am open to any ideas and input is deeply appreciated.",4,1
10,2014-7-7,2014,7,7,5,29zpz0,How does one call C++ functions from within Python 2.x?,https://www.reddit.com/r/computerscience/comments/29zpz0/how_does_one_call_c_functions_from_within_python/,MightySquidWarrior,1404678766,"I've been struggling to follow Python's [documentation](https://docs.python.org/2/extending/extending.html#a-simple-example) on the subject, and I just don't understand what it is trying to tell me to do.  I'm much more familiar with C/C++ than with Python.  Could someone explain what the documentation is trying to say?

Sorry if this is the wrong subreddit for this question.",15,0
11,2014-7-7,2014,7,7,12,2a0qoe,Taking 2nd level CS classes and having trouble.,https://www.reddit.com/r/computerscience/comments/2a0qoe/taking_2nd_level_cs_classes_and_having_trouble/,poop-in-the-tub,1404704576,"I am trying to be a computer science major at CMU, I struggled through first semester CS courses, and now in second level freshmen ones, I am falling behind. I feel like I understand what is happening in lecture, and I am completing the homeworks, but come quizzes, I am doing much worse than my peers. What I am asking is, do any of you CS majors have any advice for someone new to college? What ways did you find most effective for succeeding in undergraduate courses? 

Any help is appreciated. ",4,2
12,2014-7-7,2014,7,7,18,2a1bbs,Where can I find a primer on elliptic curve cryptography that isn't either too basic or too much math oriented?,https://www.reddit.com/r/computerscience/comments/2a1bbs/where_can_i_find_a_primer_on_elliptic_curve/,[deleted],1404725245,,1,0
13,2014-7-8,2014,7,8,3,2a2jfv,Can Collective Behavior of AI Agents Create Consciousness?,https://www.reddit.com/r/computerscience/comments/2a2jfv/can_collective_behavior_of_ai_agents_create/,tharindra_,1404758016,,0,1
14,2014-7-9,2014,7,9,10,2a76gz,http://i.imgur.com/F6UMmt8.jpg,https://www.reddit.com/r/computerscience/comments/2a76gz/httpiimgurcomf6ummt8jpg/,[deleted],1404868899,,0,1
15,2014-7-9,2014,7,9,12,2a7gb6,Free Download Outstanding Partition Recovery Manager,https://www.reddit.com/r/computerscience/comments/2a7gb6/free_download_outstanding_partition_recovery/,BlakeClaire,1404875271,,0,0
16,2014-7-9,2014,7,9,13,2a7ny3,Found this lol,https://www.reddit.com/r/computerscience/comments/2a7ny3/found_this_lol/,sonataroger,1404880457,,0,1
17,2014-7-10,2014,7,10,3,2a9h9x,Trying to teach higher level concepts,https://www.reddit.com/r/computerscience/comments/2a9h9x/trying_to_teach_higher_level_concepts/,idmontie,1404932319,"I have a friend that wants to learn how to make websites.  Web App Development isn't that demanding when it comes to data structures and software architecture, but I still want to teach my friend some higher level concepts rather than just language syntax, creating single pages with minimal logic, etc.  

Are there any good resources where we can get some sort of spec as a prompt and we work through the spec to decide what data structures we should use and what the flow of the app should be?

For some background, my friend has completed some of the CodeAcademy courses and complained that they didn't really learn anything.  I was kind of surprised since I've only heard good things about CodeAcademy, I gave it a shot, and I had to agree that it doesn't really teach you anything useful other than syntax.

I've been teaching my friend some CS concepts, such as basic data structures, search and sort algorithms, etc, but some sort of prompt that I can guide her through and have her discover the answers herself would be nice.

Also, if this isn't the best sub for this, please let me know!",3,0
18,2014-7-10,2014,7,10,7,2aa5cy,Advice for studying CS?,https://www.reddit.com/r/computerscience/comments/2aa5cy/advice_for_studying_cs/,[deleted],1404946031,"I'm hoping to get some advice on studying CS. I already have a bachelor's degree in philosophy from a 4 year uni and have a substantial amount of debt. I've been researching going back to school (yes, my philosophy degree hasn't found me a job, what a shock), but I haven't had much luck finding a program that is going to be affordable and not a step backwards in education. 

Ideally I could find an affordable master's degree program, but so far all the ones I have found require applicants to have an undergrad degree in CS or something similar. 

I would be ok going back and getting a bachelor's degree in CS, but if I'm doing that I really need to find an affordable program that will accept the credits from my degree in philosophy so I wont have to do gen ed courses and so it wont take me 4 years again. 

Additional info: I'm primarily interested in programming and systems admin/analysis; a school online or in southern california would be great but not necessary. 

Thanks for any and all advice!",1,2
19,2014-7-10,2014,7,10,18,2abhvv,Learning C++ by myself - any advice?,https://www.reddit.com/r/computerscience/comments/2abhvv/learning_c_by_myself_any_advice/,[deleted],1404983320,"Hey!

So I am at home this summer for college and wanted to pick up something productive to learn.
I was wondering what are some good sites/books that would offer me a good start up in learning C++. I have no knowledge of anything computer related to this extent so I will need a good source of information. My college does offer computer science courses, but I won't have time to study for everything if I stay biochem and I am behind as it is if I switch to econ. 

Thanks! ",8,5
20,2014-7-11,2014,7,11,9,2aduh0,Possible college courses that go in depth regarding computer hardware?,https://www.reddit.com/r/computerscience/comments/2aduh0/possible_college_courses_that_go_in_depth/,Laky727,1405040063,"I want to take a college class that goes into detail about the components of computers, how they work, their purposes, etc. Most of the classes for my CS major seem to be more about programming and software rather than the physical aspects of computers. Any specific classes you can think of?",2,1
21,2014-7-11,2014,7,11,9,2adurs,AlgPedia - The free algorithm encyclopedia,https://www.reddit.com/r/computerscience/comments/2adurs/algpedia_the_free_algorithm_encyclopedia/,thaisviana,1405040261,"Hello,

This is my graduation  http://algpedia.dcc.ufrj.br/. It is a collaborative encyclopedia about algorithm. I'd like to know your opinion.",2,1
22,2014-7-11,2014,7,11,14,2aeitm,Is a minor in computer science enough?,https://www.reddit.com/r/computerscience/comments/2aeitm/is_a_minor_in_computer_science_enough/,[deleted],1405057091,"Is a minor in computer science enough to be considered for a position as a sys/server admin? I really want to be qualified enough to work IT in case my major fails me, but there is no way to double major. ",4,0
23,2014-7-11,2014,7,11,23,2afc4p,CS university rating based on student performance is it exist?,https://www.reddit.com/r/computerscience/comments/2afc4p/cs_university_rating_based_on_student_performance/,theSurgeonOfDeath,1405087286,"I am looking for university rating based only on programming competitons like ACM, Google Code JAM, Facebook Hacker Cup.

I knew how current ratings works and they are based only on Brand. I am only interested in competitve programming. When i see results from ACM, Code Jam etc.. I see real result of education like University of Warsaw destroying other Universities.",2,0
24,2014-7-13,2014,7,13,8,2ajome,How to Use your Usb Drive as Your Computer Ram and Speed Computer performance,https://www.reddit.com/r/computerscience/comments/2ajome/how_to_use_your_usb_drive_as_your_computer_ram/,plob55,1405208548,,0,1
25,2014-7-14,2014,7,14,7,2am9l5,What jobs am i missing out on with a BSc?,https://www.reddit.com/r/computerscience/comments/2am9l5/what_jobs_am_i_missing_out_on_with_a_bsc/,nepsel,1405291960,"Hey! I am studying Computer Science at a university in Norway, and i have two years left until i graduate with a BSc. It struck me that, i dont know if i want to continue and get a MSc within the field. So i was hoping some of you could answer me, what jobs am i missing out on by not continuing with my education?

I wish to work with operating systems, optimization, and develop systems.",5,2
26,2014-7-14,2014,7,14,13,2an2jz,Where do I learn programming and how do I take a programming class in college?,https://www.reddit.com/r/computerscience/comments/2an2jz/where_do_i_learn_programming_and_how_do_i_take_a/,TheChocolateBrownie,1405312144,"I'm a 13 year old kid , and I am very interested in programming , all sorts of programming , html5 , C++ , Unity and much more. I started learning programming from books, but so far no luck , and when I grow up I want to learn computer science and programming and pc's galore. So is there a site , or an organisation that specifies in teaching people programming and stuff? Also , I would like to be a computer programmer when I grow up , so what classes do I take in college? And what should I do from now that can help me succeed in the programming industry?

Thanks alot!",4,2
27,2014-7-15,2014,7,15,1,2aocud,Four Principles for Engineering Big Data Systems,https://www.reddit.com/r/computerscience/comments/2aocud/four_principles_for_engineering_big_data_systems/,hbrayer,1405354043,,0,0
28,2014-7-15,2014,7,15,5,2ap5sw,"If You Want to Teach Kids CS, First Teach the Adults",https://www.reddit.com/r/computerscience/comments/2ap5sw/if_you_want_to_teach_kids_cs_first_teach_the/,ACMlarry,1405369683,,0,1
29,2014-7-15,2014,7,15,8,2apoxf,PCI-DAS1000 Borland Access Violation Issues.,https://www.reddit.com/r/computerscience/comments/2apoxf/pcidas1000_borland_access_violation_issues/,[deleted],1405380358,"I recently received a desktop from my professor to work on a project for him using MMC PCI-DAS1000 and PCI-Dual-AC5. Whenever I try to call functions for either of these boards, I include CBW.h and link CBW32BC.lib, I keep getting access violation and same when I run the provided examples. Instacal is installed, the boards have been tested and calibrated with no issues; here are screenshots of what Instacal shows and the error:
http://imgur.com/a/536aj
I don't get this error when I run simple C++ code, like hello world. Forgot to add but my prof said he's been getting this error as well and has no idea how to fix it. Has anyone encountered this error before?
Thank you everyone for the help.",0,1
30,2014-7-15,2014,7,15,21,2ar7sb,Programming or computer science audiobooks?,https://www.reddit.com/r/computerscience/comments/2ar7sb/programming_or_computer_science_audiobooks/,largo_al_factotum,1405425793,"Obviously the type of computer science / programming content that can be done in the audiobook format is limited... but I listen to audiobooks on my commute and I feel like reading this type of material right now. Can anyone recommend any programming-related audiobooks?

Thanks!",2,0
31,2014-7-16,2014,7,16,2,2as2e6,Computer Science at fingertips!!!,https://www.reddit.com/r/computerscience/comments/2as2e6/computer_science_at_fingertips/,Cusp2207,1405445502,,1,3
32,2014-7-16,2014,7,16,3,2asbxe,ow to remove revelant knowledge virus,https://www.reddit.com/r/computerscience/comments/2asbxe/ow_to_remove_revelant_knowledge_virus/,gisrteam,1405450501,,0,0
33,2014-7-16,2014,7,16,17,2auctu,Introduction to computer science | Day 1,https://www.reddit.com/r/computerscience/comments/2auctu/introduction_to_computer_science_day_1/,ksvijay,1405499609,,0,0
34,2014-7-17,2014,7,17,6,2aw9hc,8 Of The Biggest Payoff Computer Science Courses In 2014,https://www.reddit.com/r/computerscience/comments/2aw9hc/8_of_the_biggest_payoff_computer_science_courses/,cost63,1405546245,,6,5
35,2014-7-17,2014,7,17,7,2awevk,The lesser of two evils (in laptop form),https://www.reddit.com/r/computerscience/comments/2awevk/the_lesser_of_two_evils_in_laptop_form/,[deleted],1405549286,"I am trying to choose a laptop that will work (somewhat okay) for gaming. I am aware that neither of these laptops are gaming laptops but a suggestion towards the lesser of these two evils would be greatly appreciated. So I am choosing between:

an Acer with an AMD Dual-core processor A6 (A6-5357M) and AMD Radeon Graphics (HD 8450G) with 6GB DDR3 RAM 500GB hard drive.

an HP with an AMD Quad-core processor A4 1.5GHZ (A4-5000) and AMD Radeon (HD 8330) 6GB DDR3 RAM and 500GB hard drive.",1,0
36,2014-7-17,2014,7,17,22,2ayb1n,Help needed with a CS problem,https://www.reddit.com/r/computerscience/comments/2ayb1n/help_needed_with_a_cs_problem/,PUSSY_RAVAGER,1405604284,"Let's say that I have *n* non-empty sets *S1*, *S2*, *S3*, ..., *Sn*. The elements in these sets are not mutually exclusive, so some sets have elements in common.

The problem is to calculate the smallest set of elements Sp such that every set *S1*, *S2*, ..., *Sn* contains at least one element from Sp. In other words, you need to pick the smallest bunch of elements which are sufficient to cover all the sets - where element *e* covers set *S* if *S* contains *e*.

The problem on the face of it appears to be NP hard. 

My questions are: 

1. Can this problem with modeled somehow in graph theory? Is there a common name for such a problem?

2. Are there any effective algorithms to solve particular cases of this problem? 

For the record, in the instance of the problem I faced, *n* was about 2200 and each *S* contained 22 elements. The number of sets an element was present in varies a lot, but I would say that the average is about 10-15.

Thanks in advance for any inputs!",1,1
37,2014-7-18,2014,7,18,0,2ayk97,World's First Photonic Router,https://www.reddit.com/r/computerscience/comments/2ayk97/worlds_first_photonic_router/,natron5150,1405610240,,0,1
38,2014-7-18,2014,7,18,0,2aylye,Adding Depth to Mobile Imaging: Google's Project Tango,https://www.reddit.com/r/computerscience/comments/2aylye/adding_depth_to_mobile_imaging_googles_project/,ACMlarry,1405611201,,0,1
39,2014-7-18,2014,7,18,2,2ayy7d,Where to get old(er) / used computer towers for free?,https://www.reddit.com/r/computerscience/comments/2ayy7d/where_to_get_older_used_computer_towers_for_free/,benzbullet,1405617922,"I'm getting to the beginning of ""basic information"" in my computer science course. I would like to have a computer tower to look into, disassemble and use to understand common procedure and function. 


Where can I get used/ old towers? I'd like any variation of towers, anyone know a direction to point me towards? 

Thanks reddit!",2,0
40,2014-7-18,2014,7,18,4,2azd9x,"New to computer science, where to begin?",https://www.reddit.com/r/computerscience/comments/2azd9x/new_to_computer_science_where_to_begin/,[deleted],1405626180,"I'm interested in learning about programming, linux, networks, how computer hardware interacts with other hardware and software etc. I've built my own computers and know a little python but that's about it. Looking on the programming multi is overwhelming because there is so much information out there. Is there a place to get a broad overview of topics like these so I can get an idea of what direction to head in?",1,1
41,2014-7-18,2014,7,18,20,2b1cxw,How much is maths in CS involved?,https://www.reddit.com/r/computerscience/comments/2b1cxw/how_much_is_maths_in_cs_involved/,SuperIngamer,1405681413,I am starting my CS classes after the holidays (German) and I was asking myself how much maths is involved in CS.,13,1
42,2014-7-18,2014,7,18,22,2b1lvj,What kind of jobs are there for comp sci majors?,https://www.reddit.com/r/computerscience/comments/2b1lvj/what_kind_of_jobs_are_there_for_comp_sci_majors/,davidjdavid,1405689937,"Different websites tell you what kind of jobs comp sci people get, but I want to hear from real people.",4,1
43,2014-7-19,2014,7,19,1,2b24bu,In need of good video tutorial for AJAX,https://www.reddit.com/r/computerscience/comments/2b24bu/in_need_of_good_video_tutorial_for_ajax/,INowHaveAUsername,1405701759,I was looking for a good video explanation/tutorial guide to AJAX and I was wondering if you guys have any recommendations. I have a limited experience with JavaScript and when looking at code for AJAX it is very foreign to me compared to other languages.  Thanks!,1,2
44,2014-7-19,2014,7,19,1,2b24ws,Language for a beginner? I think i know what I might want to do,https://www.reddit.com/r/computerscience/comments/2b24ws/language_for_a_beginner_i_think_i_know_what_i/,veterejf,1405702085,"I've been tasked with something pretty simple, and hopefully it will be a good place to start programming. I've taking some C++ and learned a little about web design, but other than that, I'm pretty fresh. 

My objective: To make a program that will run a flow chart. Statement &gt; then if no, click on no, bring it to next step. If yes, click yes and it will bring you to the next step, or a link to another page with info. In a specific case, If the answer to: ""Is this something we've made before?"" is Yes, then I want to bring up a page with info concerning all the different products we've made before and we can choose from them which one we are dealing with. An answer of No, could be a link to something like, fill out a new product form.

This definitely sounds like something MS Visio could do (which I don't have atm). But at the same time sounds like it could be simple enough to Learn some CS and programming (and an excuse to learn it at work).

My question to you guys is: is this something that a beginner could handle and what would be the best language to make something like this?",6,2
45,2014-7-19,2014,7,19,3,2b2hfx,Looking for a project?,https://www.reddit.com/r/computerscience/comments/2b2hfx/looking_for_a_project/,[deleted],1405709154,"I'm a college student (I think it's High school in the US... Either way) and I'm looking for a project to keep me busy over the summer holidays that'll also help improve my limited knowledge of C++ code. If anyone has an idea they think would fit that, please post it below? 

Also, I've been told that building a Linux OS is a good thing to do, but I need to learn command line. Has anyone got any tips for this?",2,2
46,2014-7-19,2014,7,19,6,2b2ysz,What language is the Khan Academy software made with?,https://www.reddit.com/r/computerscience/comments/2b2ysz/what_language_is_the_khan_academy_software_made/,punkprophetgenius,1405719119,,1,3
47,2014-7-22,2014,7,22,11,2bcyb3,Computer engineering,https://www.reddit.com/r/computerscience/comments/2bcyb3/computer_engineering/,saadiqbal00,1405997821,,2,0
48,2014-7-23,2014,7,23,20,2bhk82,  8 7vistaxp    dvd,https://www.reddit.com/r/computerscience/comments/2bhk82/__8_7vistaxp____dvd/,basuony,1406116289,,1,0
49,2014-7-24,2014,7,24,0,2bi1j9,Beauty through an Artificial Eye,https://www.reddit.com/r/computerscience/comments/2bi1j9/beauty_through_an_artificial_eye/,tharindra_,1406128301,,0,1
50,2014-7-24,2014,7,24,3,2bil32,Resources for CS degrees and jobs?,https://www.reddit.com/r/computerscience/comments/2bil32/resources_for_cs_degrees_and_jobs/,SanityNotFound,1406138639,"My parents have agreed to pay for a portion of my education *if* I can put together a presentation for them detailing the costs, courses required, salary projections for the field and my plan to complete it successfully. 

How much they pay will depend on how well I present this information to them. I'm posting to ask for any resources you all may know about that could help me put this together with more complete and accurate information. I've not decided which school I want to go either. I'm in Ohio and I've heard mixed reviews on IT Tech so I'm iffy on going there.

Thanks in advance for helping me out!",11,1
51,2014-7-24,2014,7,24,11,2bk2di,How to Get Back Deleted Partition,https://www.reddit.com/r/computerscience/comments/2bk2di/how_to_get_back_deleted_partition/,BlakeClaire,1406168107,,0,1
52,2014-7-24,2014,7,24,16,2bkqti,Computer Networking course provided by Udacity,https://www.reddit.com/r/computerscience/comments/2bkqti/computer_networking_course_provided_by_udacity/,backFromTheBed,1406186770,,0,2
53,2014-7-25,2014,7,25,2,2bm0zh,Artificial Intelligence Uncovers the Musical Progression of The Beatles,https://www.reddit.com/r/computerscience/comments/2bm0zh/artificial_intelligence_uncovers_the_musical/,33rdsquare,1406222755,,0,1
54,2014-7-25,2014,7,25,5,2bmjhk,Strings,https://www.reddit.com/r/computerscience/comments/2bmjhk/strings/,Cusp2207,1406232427,,0,1
55,2014-7-25,2014,7,25,16,2bo976,Good authors / books on formal languages?,https://www.reddit.com/r/computerscience/comments/2bo976/good_authors_books_on_formal_languages/,e-NFA,1406272711,"I recently completed a course in my undergrad where we got a taste of the theory behind construction of programming languages via implementing a compiler for a simplistic subset of the C programming language. I found the course fascinating and I am looking for some good reading material on formal languages in general.

So far I understand the Noam Chomsky is an excellent author to look into if I wish to explore the subject. For related material I find regular languages and automata theory to be fascinating, so these are excellent side subjects to reccomend reading material for as well.

Thanks in advance to anyone who can reccomend some must reads!",4,2
