,date,year,month,day,hour,id,title,full_link,author,created,selftext,num_comments,score
56,2014-7-25,2014,7,25,22,2bow1z,Quick Virus Deletion,https://www.reddit.com/r/computerscience/comments/2bow1z/quick_virus_deletion/,gisrteam,1406296088,,0,0
57,2014-7-26,2014,7,26,3,2bpn0i,Decision Making Statements,https://www.reddit.com/r/computerscience/comments/2bpn0i/decision_making_statements/,Cusp2207,1406311814,,0,1
58,2014-7-26,2014,7,26,7,2bqcbr,IPhone 5 hotspot security question,https://www.reddit.com/r/computerscience/comments/2bqcbr/iphone_5_hotspot_security_question/,gurdonbob,1406326219,"Hi,

I am going to a large trade show in which there will be about 500k people. I will have a booth with computers set up. I am considering using my iPhone 5's hotspot feature from Verizon to provide a wireless internet network to these computers for the show.

However, I have a serious concern about the potential security threats because I will be showcasing a website that is still in development and is not inherently secure itself. We have proprietary information on this site that, if it were stolen, could be very detrimental to us.

I have two options: spend a lot of time to make this website work locally (currently on Amazon), or just access it from the hotspot connection.

With this said, how secure is this connection? Is it more secure to use the WiFi than Bluetooth? If I use the WiFi I plan to use a very long custom passcode with a combination of capital letters, lower case, and numbers. I say very long because I think this comic convinced me that length is more important than complexity:

http://xkcd.com/936/

Also, my concern is not just with the WiFi network, it's with the phone talking to Verizon via LTE.  Is that encrypted?

Thanks!
",3,1
59,2014-7-26,2014,7,26,15,2brh4l,What kind of laptop should I get?,https://www.reddit.com/r/computerscience/comments/2brh4l/what_kind_of_laptop_should_i_get/,MongolianDynamite,1406356788,So I am entering as a computer science major this Fall at my University. During orientation one of the computer science professors were there to answer questions. He recommended a Macbook for computer science majors since it is a Linux based OS. I however am not a fan of Macbooks. Would it hurt me in class if I get a Windows laptop? Also is Linux easy to install on a windows laptop if I chose to work on base Linux?,14,0
60,2014-7-27,2014,7,27,23,2buwi3,        send mass messages on facebook,https://www.reddit.com/r/computerscience/comments/2buwi3/________send/,basuony,1406469930,,1,0
61,2014-7-28,2014,7,28,0,2bv3l3,Computer Science for Fun - cs4fn: Computing your cuppa,https://www.reddit.com/r/computerscience/comments/2bv3l3/computer_science_for_fun_cs4fn_computing_your/,vviikkrraanntt,1406475742,,0,2
62,2014-7-28,2014,7,28,14,2bx4n8,How can I get started with data analysis/data mining?,https://www.reddit.com/r/computerscience/comments/2bx4n8/how_can_i_get_started_with_data_analysisdata/,[deleted],1406524585,"There is so much data in this information age. There is dbpedia, quandl, freebase for crying out loud! All of this data and I don't know what to do with it. I've been coding for a couple years now and have mainly been doing web development, getting data from apis and displaying it for an end user, made pretty by some template. Got me a good job and everything. But this is really elementary stuff! I want to do data mining and analysis and do something with all that data. Find meaning. 

How do I start out? 

For the record I am behind in math (think precal). I'm attending a community college as a sophomore and working full-time as a web developer. I am looking for something to get me started in data mining and analysis while I can study calculus and stats and linear algebra alongside and, later on, get into the more complex things like machine learning and AI. 

What would you all recommend?",0,1
63,2014-7-28,2014,7,28,20,2bxqra,Amazon starts 3D printing store,https://www.reddit.com/r/computerscience/comments/2bxqra/amazon_starts_3d_printing_store/,pullipuli,1406548407,,1,2
64,2014-7-29,2014,7,29,2,2bypie,Informatica Powercenter Architecture,https://www.reddit.com/r/computerscience/comments/2bypie/informatica_powercenter_architecture/,tecktricks,1406569963,,0,1
65,2014-7-29,2014,7,29,2,2byq9c,Time and Space Complexity,https://www.reddit.com/r/computerscience/comments/2byq9c/time_and_space_complexity/,Cusp2207,1406570328,,0,1
66,2014-7-29,2014,7,29,8,2bzt4i,How Much Math in CS?,https://www.reddit.com/r/computerscience/comments/2bzt4i/how_much_math_in_cs/,b3dog1,1406591108,"My parents were both cs majors in college and say that the math is very heavy. I enjoy math and maybe am not the best at it, but it still isn't something I have major problem with. Can someone direct me in the type of math I should know in order for CS?",7,4
67,2014-7-29,2014,7,29,11,2c0772,What to Do after Partition Is Missing,https://www.reddit.com/r/computerscience/comments/2c0772/what_to_do_after_partition_is_missing/,BlakeClaire,1406599919,,0,1
68,2014-7-29,2014,7,29,16,2c0vts,"Sorry for noob question, but, can I use Visual Studio 2012 as a compiler for C++?",https://www.reddit.com/r/computerscience/comments/2c0vts/sorry_for_noob_question_but_can_i_use_visual/,RPCOM,1406618717,,3,2
69,2014-7-30,2014,7,30,1,2c20mf,CS vs Computer/Electricity engineering,https://www.reddit.com/r/computerscience/comments/2c20mf/cs_vs_computerelectricity_engineering/,TobiTako,1406652038,"So I always wanted to learn CS (and even did a year in uni,  though it was almost completely math per usual), but recently when thinking about what I want to go back and study I find myself more attracted to the physical and hardware side and less to the programming that I always thought I'll love to the end. 
The problem is I don't really know how to get a ""taste"" of electrical and computer engineering, and I don't know if it's something I'll actually like doing. 

Anyone that faced that dilemma and have any insights about making their decision?",2,1
70,2014-7-30,2014,7,30,3,2c2ch2,Info Session: Capital One Tech Team,https://www.reddit.com/r/computerscience/comments/2c2ch2/info_session_capital_one_tech_team/,flippityfloppers,1406658246,,0,1
71,2014-7-30,2014,7,30,3,2c2dvp,Free CS101 online course from Stanford University,https://www.reddit.com/r/computerscience/comments/2c2dvp/free_cs101_online_course_from_stanford_university/,ebeatyou,1406658971,,3,2
72,2014-7-30,2014,7,30,15,2c4cp3,CS electives. Which to choose?,https://www.reddit.com/r/computerscience/comments/2c4cp3/cs_electives_which_to_choose/,diabloallica,1406702901,"Hi! I'm new on this sub-reddit. I am currently an undergrad student of computer science. I've been offered a choice of 4 electives by my universiry out of which I am supposed to choose atleast 2. Here's the list:
1.Data Mining
2.Information Retrieval
3.Cryptography
4.ARTIFICIAL INTELLIGENCE
I have little or no idea regarding these courses. I'd be glad if somebody could suggest me what to choose considering that I'd be wanting to persue M.S in computer science after I'm done with undergraduation. I know this question sounds a bit random but I'd be happy if I would even get a little push from you guys.
Thanks.",4,7
73,2014-7-31,2014,7,31,1,2c5h8m,If computers only had a brain...,https://www.reddit.com/r/computerscience/comments/2c5h8m/if_computers_only_had_a_brain/,sailormoonandteam,1406737082,,0,0
74,2014-7-31,2014,7,31,3,2c5wrz,for compsci graduates that want to get better for industry programming,https://www.reddit.com/r/computerscience/comments/2c5wrz/for_compsci_graduates_that_want_to_get_better_for/,Lumin0uz,1406745073,"Hey guys,

I just graduated college with a computer science degree and I feel like I wasted 3 years. I was the typical student that sat in the back of the class listening to lectures and went home and do the assignments and did not have time to ""experiment"" with code and do all the crazy stuff that over achievers did.

So now I am job hunting and trying to find a list of books that are recommended for industry programmers. 

What would a Google Software Developer have in his/her library for programming reference and overall become a better programmer?

Books that I just bought because stack over flow people said its really good to have are Code Complete 2  and Pragmatic Programmer.

Any more suggestions for someone that would like to work at a software company?

And I do have have Corman Intro to algorithms book that I am working myself through at the moment.
",9,7
75,2014-7-31,2014,7,31,5,2c6atw,Can AI gain Consciousness by themselves?,https://www.reddit.com/r/computerscience/comments/2c6atw/can_ai_gain_consciousness_by_themselves/,tharindra_,1406752418,,0,1
76,2014-7-31,2014,7,31,5,2c6dbf,Graduate School while working full time,https://www.reddit.com/r/computerscience/comments/2c6dbf/graduate_school_while_working_full_time/,w34ksaUce,1406753734,"I got my BS at UCSB and I am working my first job. They offer to pay for graduate school as long as you do well so i thought i might as well take this opportunity. 

If someone has done this before, i would greatly appreciate if you could answer some questions.



Did you take classes online or did you have to commute to the campus?

what was your admissions process like? Do you go through the normal admissions application and let them know you're going to be a part time student?

I have a hard time finding the information on school's websites, is there a different name for graduate students who work full time?

is the application process the same? (gre, letters of rec, ect?)

To get more specific, I work in the Silicon Valley and would love to know if anyone has any experience getting their master's degree while working full time around the area if possible. ",1,2
77,2014-7-31,2014,7,31,15,2c7v2h,Where can I find relatively recent CS research articles that aren't paywalled?,https://www.reddit.com/r/computerscience/comments/2c7v2h/where_can_i_find_relatively_recent_cs_research/,dzack,1406788259,"I'm an undergrad in CS, and planning on applying to grad school in 2-3 years or so. I'd like to get an idea of what current research is like, and maybe coding up a few algorithms for practice. 

However, my school doesn't provide access to any journals in the field. Any pointers?",3,2
